Trial finished with value: 0.510999321937561 and parameters: {'lr': 0.009594146240058174, 'batch_size': 1024, 'epochs': 2, 'num_layers': 3, 'dropout_rate': 0.25960165401063595, 'reduction_factor': 0.6861380506646939, 'patience': 1, 'min_lr': 0.006873496618508872, 'units_layer_0': 310, 'activation_layer_0': 'sigmoid', 'units_layer_1': 948, 'activation_layer_1': 'tanh', 'units_layer_2': 66, 'activation_layer_2': 'tanh'}.
Trial finished with value: 0.510999321937561 and parameters: {'lr': 0.0048064676850960025, 'batch_size': 512, 'epochs': 194, 'num_layers': 5, 'dropout_rate': 0.4658267258828932, 'reduction_factor': 0.6254445376038688, 'patience': 3, 'min_lr': 6.27587961356995e-05, 'units_layer_0': 839, 'activation_layer_0': 'tanh', 'units_layer_1': 193, 'activation_layer_1': 'tanh', 'units_layer_2': 931, 'activation_layer_2': 'sigmoid', 'units_layer_3': 359, 'activation_layer_3': 'tanh', 'units_layer_4': 743, 'activation_layer_4': 'relu'}.
Trial finished with value: 0.510999321937561 and parameters: {'lr': 0.06417824416166949, 'batch_size': 128, 'epochs': 86, 'num_layers': 3, 'dropout_rate': 0.3253694881186787, 'reduction_factor': 0.6323636695062291, 'patience': 3, 'min_lr': 8.046117803310096e-05, 'units_layer_0': 505, 'activation_layer_0': 'relu', 'units_layer_1': 842, 'activation_layer_1': 'relu', 'units_layer_2': 472, 'activation_layer_2': 'sigmoid'}.
Trial finished with value: 0.5670929551124573 and parameters: {'lr': 0.00013602705168579772, 'batch_size': 128, 'epochs': 27, 'num_layers': 6, 'dropout_rate': 0.16668749763896998, 'reduction_factor': 0.43144054264091314, 'patience': 3, 'min_lr': 0.0010241809526389156, 'units_layer_0': 802, 'activation_layer_0': 'relu', 'units_layer_1': 250, 'activation_layer_1': 'sigmoid', 'units_layer_2': 743, 'activation_layer_2': 'tanh', 'units_layer_3': 964, 'activation_layer_3': 'tanh', 'units_layer_4': 204, 'activation_layer_4': 'relu', 'units_layer_5': 306, 'activation_layer_5': 'tanh'}.
Trial finished with value: 0.510999321937561 and parameters: {'lr': 0.00525260177631292, 'batch_size': 1024, 'epochs': 180, 'num_layers': 4, 'dropout_rate': 0.4806149686770794, 'reduction_factor': 0.5930747664380241, 'patience': 10, 'min_lr': 0.0006223091592366592, 'units_layer_0': 120, 'activation_layer_0': 'tanh', 'units_layer_1': 986, 'activation_layer_1': 'relu', 'units_layer_2': 787, 'activation_layer_2': 'relu', 'units_layer_3': 85, 'activation_layer_3': 'relu'}.
Trial finished with value: 0.5245384573936462 and parameters: {'lr': 0.001310913362444758, 'batch_size': 32, 'epochs': 28, 'num_layers': 3, 'dropout_rate': 0.47852940014029144, 'reduction_factor': 0.5402633294726029, 'patience': 1, 'min_lr': 1.1819918745644463e-05, 'units_layer_0': 178, 'activation_layer_0': 'sigmoid', 'units_layer_1': 812, 'activation_layer_1': 'relu', 'units_layer_2': 447, 'activation_layer_2': 'tanh'}.
Trial finished with value: 0.510999321937561 and parameters: {'lr': 0.0014398793142699668, 'batch_size': 32, 'epochs': 24, 'num_layers': 5, 'dropout_rate': 0.2827568432115326, 'reduction_factor': 0.7960529707177968, 'patience': 10, 'min_lr': 0.00158923548550021, 'units_layer_0': 974, 'activation_layer_0': 'sigmoid', 'units_layer_1': 895, 'activation_layer_1': 'sigmoid', 'units_layer_2': 331, 'activation_layer_2': 'relu', 'units_layer_3': 609, 'activation_layer_3': 'relu', 'units_layer_4': 321, 'activation_layer_4': 'relu'}.
Trial finished with value: 0.5625731945037842 and parameters: {'lr': 0.00023756118507709954, 'batch_size': 1024, 'epochs': 93, 'num_layers': 3, 'dropout_rate': 0.17260253029398553, 'reduction_factor': 0.8248218856045793, 'patience': 3, 'min_lr': 0.000506309647924176, 'units_layer_0': 236, 'activation_layer_0': 'sigmoid', 'units_layer_1': 308, 'activation_layer_1': 'tanh', 'units_layer_2': 229, 'activation_layer_2': 'sigmoid'}.
Trial finished with value: 0.5716126561164856 and parameters: {'lr': 0.00019536882675474907, 'batch_size': 32, 'epochs': 180, 'num_layers': 6, 'dropout_rate': 0.13757657778888285, 'reduction_factor': 0.850209393765786, 'patience': 4, 'min_lr': 4.342492447826245e-05, 'units_layer_0': 188, 'activation_layer_0': 'tanh', 'units_layer_1': 91, 'activation_layer_1': 'relu', 'units_layer_2': 677, 'activation_layer_2': 'relu', 'units_layer_3': 891, 'activation_layer_3': 'sigmoid', 'units_layer_4': 535, 'activation_layer_4': 'sigmoid', 'units_layer_5': 514, 'activation_layer_5': 'relu'}.
Trial finished with value: 0.5803035497665405 and parameters: {'lr': 0.0003769190925600526, 'batch_size': 128, 'epochs': 30, 'num_layers': 6, 'dropout_rate': 0.16536599966453175, 'reduction_factor': 0.5766500292247174, 'patience': 4, 'min_lr': 1.0309612289106678e-05, 'units_layer_0': 298, 'activation_layer_0': 'tanh', 'units_layer_1': 914, 'activation_layer_1': 'sigmoid', 'units_layer_2': 687, 'activation_layer_2': 'relu', 'units_layer_3': 330, 'activation_layer_3': 'tanh', 'units_layer_4': 832, 'activation_layer_4': 'tanh', 'units_layer_5': 412, 'activation_layer_5': 'relu'}.
Trial finished with value: 0.5883258581161499 and parameters: {'lr': 0.0002946631750015751, 'batch_size': 512, 'epochs': 76, 'num_layers': 5, 'dropout_rate': 0.2082681191266708, 'reduction_factor': 0.6000009227436272, 'patience': 9, 'min_lr': 9.01843980251706e-05, 'units_layer_0': 794, 'activation_layer_0': 'tanh', 'units_layer_1': 327, 'activation_layer_1': 'sigmoid', 'units_layer_2': 259, 'activation_layer_2': 'sigmoid', 'units_layer_3': 192, 'activation_layer_3': 'sigmoid', 'units_layer_4': 272, 'activation_layer_4': 'sigmoid'}.
Trial finished with value: 0.5104907751083374 and parameters: {'lr': 0.00018152049036285355, 'batch_size': 32, 'epochs': 181, 'num_layers': 5, 'dropout_rate': 0.18307250466669786, 'reduction_factor': 0.7053940965539782, 'patience': 10, 'min_lr': 3.2503172585218134e-05, 'units_layer_0': 330, 'activation_layer_0': 'sigmoid', 'units_layer_1': 458, 'activation_layer_1': 'tanh', 'units_layer_2': 1007, 'activation_layer_2': 'tanh', 'units_layer_3': 592, 'activation_layer_3': 'tanh', 'units_layer_4': 788, 'activation_layer_4': 'tanh'}.
Trial finished with value: 0.566807210445404 and parameters: {'lr': 0.0006927702468858795, 'batch_size': 128, 'epochs': 154, 'num_layers': 6, 'dropout_rate': 0.12111761967881828, 'reduction_factor': 0.6221609427919691, 'patience': 4, 'min_lr': 0.005048811278385069, 'units_layer_0': 179, 'activation_layer_0': 'tanh', 'units_layer_1': 98, 'activation_layer_1': 'sigmoid', 'units_layer_2': 604, 'activation_layer_2': 'relu', 'units_layer_3': 796, 'activation_layer_3': 'tanh', 'units_layer_4': 92, 'activation_layer_4': 'sigmoid', 'units_layer_5': 242, 'activation_layer_5': 'relu'}.
Trial finished with value: 0.510999321937561 and parameters: {'lr': 0.019012193194513933, 'batch_size': 512, 'epochs': 133, 'num_layers': 3, 'dropout_rate': 0.28688715342450266, 'reduction_factor': 0.6575767853366886, 'patience': 5, 'min_lr': 3.857445845572157e-05, 'units_layer_0': 210, 'activation_layer_0': 'tanh', 'units_layer_1': 948, 'activation_layer_1': 'sigmoid', 'units_layer_2': 875, 'activation_layer_2': 'sigmoid'}.
Trial finished with value: 0.5240870714187622 and parameters: {'lr': 0.00016789925933063734, 'batch_size': 512, 'epochs': 133, 'num_layers': 6, 'dropout_rate': 0.41161746943268784, 'reduction_factor': 0.6111384173533225, 'patience': 4, 'min_lr': 0.0036949135712144336, 'units_layer_0': 461, 'activation_layer_0': 'sigmoid', 'units_layer_1': 479, 'activation_layer_1': 'tanh', 'units_layer_2': 967, 'activation_layer_2': 'tanh', 'units_layer_3': 435, 'activation_layer_3': 'tanh', 'units_layer_4': 481, 'activation_layer_4': 'sigmoid', 'units_layer_5': 988, 'activation_layer_5': 'sigmoid'}.
Trial finished with value: 0.5674814581871033 and parameters: {'lr': 0.0001421538747590512, 'batch_size': 512, 'epochs': 109, 'num_layers': 4, 'dropout_rate': 0.2685107686941225, 'reduction_factor': 0.5569089442849628, 'patience': 4, 'min_lr': 6.659284592206105e-05, 'units_layer_0': 87, 'activation_layer_0': 'tanh', 'units_layer_1': 449, 'activation_layer_1': 'relu', 'units_layer_2': 553, 'activation_layer_2': 'tanh', 'units_layer_3': 418, 'activation_layer_3': 'tanh'}.
Trial finished with value: 0.48900067806243896 and parameters: {'lr': 0.0020027841514056004, 'batch_size': 128, 'epochs': 120, 'num_layers': 5, 'dropout_rate': 0.2807867768987281, 'reduction_factor': 0.25493207315682465, 'patience': 7, 'min_lr': 0.0029389201793814023, 'units_layer_0': 777, 'activation_layer_0': 'sigmoid', 'units_layer_1': 145, 'activation_layer_1': 'sigmoid', 'units_layer_2': 552, 'activation_layer_2': 'tanh', 'units_layer_3': 696, 'activation_layer_3': 'tanh', 'units_layer_4': 356, 'activation_layer_4': 'tanh'}.
Trial finished with value: 0.510999321937561 and parameters: {'lr': 0.009271678316678543, 'batch_size': 1024, 'epochs': 189, 'num_layers': 6, 'dropout_rate': 0.2930957677635187, 'reduction_factor': 0.5507800888773564, 'patience': 4, 'min_lr': 2.5531267742128175e-05, 'units_layer_0': 611, 'activation_layer_0': 'relu', 'units_layer_1': 466, 'activation_layer_1': 'tanh', 'units_layer_2': 303, 'activation_layer_2': 'relu', 'units_layer_3': 451, 'activation_layer_3': 'tanh', 'units_layer_4': 607, 'activation_layer_4': 'tanh', 'units_layer_5': 246, 'activation_layer_5': 'relu'}.
Trial finished with value: 0.5120363831520081 and parameters: {'lr': 0.002339630279728039, 'batch_size': 128, 'epochs': 116, 'num_layers': 3, 'dropout_rate': 0.40855321458765215, 'reduction_factor': 0.6843811805246529, 'patience': 7, 'min_lr': 0.00608779887587261, 'units_layer_0': 353, 'activation_layer_0': 'sigmoid', 'units_layer_1': 972, 'activation_layer_1': 'sigmoid', 'units_layer_2': 985, 'activation_layer_2': 'tanh'}.
Trial finished with value: 0.510999321937561 and parameters: {'lr': 0.025525884736609317, 'batch_size': 512, 'epochs': 108, 'num_layers': 3, 'dropout_rate': 0.3052095952566043, 'reduction_factor': 0.8750961761225338, 'patience': 3, 'min_lr': 0.00023701179456098862, 'units_layer_0': 603, 'activation_layer_0': 'relu', 'units_layer_1': 431, 'activation_layer_1': 'tanh', 'units_layer_2': 1007, 'activation_layer_2': 'sigmoid'}.
Trial finished with value: 0.5937512516975403 and parameters: {'lr': 0.0004978084739991331, 'batch_size': 1024, 'epochs': 59, 'num_layers': 4, 'dropout_rate': 0.18423481854175916, 'reduction_factor': 0.3899819899168142, 'patience': 10, 'min_lr': 0.00043429577406685024, 'units_layer_0': 1018, 'activation_layer_0': 'tanh', 'units_layer_1': 1021, 'activation_layer_1': 'sigmoid', 'units_layer_2': 66, 'activation_layer_2': 'sigmoid', 'units_layer_3': 84, 'activation_layer_3': 'sigmoid'}.
Trial finished with value: 0.510999321937561 and parameters: {'lr': 0.023748402183408533, 'batch_size': 32, 'epochs': 186, 'num_layers': 6, 'dropout_rate': 0.3925997382484395, 'reduction_factor': 0.6493834212946661, 'patience': 3, 'min_lr': 0.0007339881171634426, 'units_layer_0': 116, 'activation_layer_0': 'relu', 'units_layer_1': 217, 'activation_layer_1': 'relu', 'units_layer_2': 78, 'activation_layer_2': 'tanh', 'units_layer_3': 927, 'activation_layer_3': 'relu', 'units_layer_4': 833, 'activation_layer_4': 'relu', 'units_layer_5': 353, 'activation_layer_5': 'relu'}.
Trial finished with value: 0.48900067806243896 and parameters: {'lr': 0.07328873646265663, 'batch_size': 128, 'epochs': 69, 'num_layers': 6, 'dropout_rate': 0.10378728034582696, 'reduction_factor': 0.24750792983311504, 'patience': 1, 'min_lr': 1.8053869865632634e-05, 'units_layer_0': 549, 'activation_layer_0': 'tanh', 'units_layer_1': 716, 'activation_layer_1': 'sigmoid', 'units_layer_2': 556, 'activation_layer_2': 'relu', 'units_layer_3': 225, 'activation_layer_3': 'sigmoid', 'units_layer_4': 1010, 'activation_layer_4': 'tanh', 'units_layer_5': 959, 'activation_layer_5': 'sigmoid'}.
Trial finished with value: 0.5735068321228027 and parameters: {'lr': 0.00047887964936421754, 'batch_size': 512, 'epochs': 62, 'num_layers': 4, 'dropout_rate': 0.2504460970007061, 'reduction_factor': 0.4803424875468694, 'patience': 6, 'min_lr': 9.417952651792908e-05, 'units_layer_0': 478, 'activation_layer_0': 'tanh', 'units_layer_1': 607, 'activation_layer_1': 'relu', 'units_layer_2': 566, 'activation_layer_2': 'relu', 'units_layer_3': 364, 'activation_layer_3': 'tanh'}.
Trial finished with value: 0.5343064069747925 and parameters: {'lr': 0.000703269096634093, 'batch_size': 512, 'epochs': 52, 'num_layers': 5, 'dropout_rate': 0.2368667591771385, 'reduction_factor': 0.42582719654512974, 'patience': 7, 'min_lr': 1.155947730601046e-05, 'units_layer_0': 507, 'activation_layer_0': 'tanh', 'units_layer_1': 698, 'activation_layer_1': 'relu', 'units_layer_2': 665, 'activation_layer_2': 'relu', 'units_layer_3': 361, 'activation_layer_3': 'tanh', 'units_layer_4': 556, 'activation_layer_4': 'sigmoid'}.
Trial finished with value: 0.5904685854911804 and parameters: {'lr': 0.00047717495541172355, 'batch_size': 1024, 'epochs': 47, 'num_layers': 4, 'dropout_rate': 0.20197057056745193, 'reduction_factor': 0.3666590202138153, 'patience': 10, 'min_lr': 0.0005313890178946332, 'units_layer_0': 1023, 'activation_layer_0': 'tanh', 'units_layer_1': 1023, 'activation_layer_1': 'sigmoid', 'units_layer_2': 85, 'activation_layer_2': 'sigmoid', 'units_layer_3': 74, 'activation_layer_3': 'sigmoid'}.
Trial finished with value: 0.5667300820350647 and parameters: {'lr': 0.0004879533310845365, 'batch_size': 512, 'epochs': 48, 'num_layers': 4, 'dropout_rate': 0.22411870347400514, 'reduction_factor': 0.49546205575121594, 'patience': 7, 'min_lr': 0.0001644376587822546, 'units_layer_0': 541, 'activation_layer_0': 'tanh', 'units_layer_1': 727, 'activation_layer_1': 'relu', 'units_layer_2': 401, 'activation_layer_2': 'relu', 'units_layer_3': 374, 'activation_layer_3': 'tanh'}.
Trial finished with value: 0.5860089063644409 and parameters: {'lr': 0.0006116890465277421, 'batch_size': 1024, 'epochs': 31, 'num_layers': 4, 'dropout_rate': 0.19310038794781914, 'reduction_factor': 0.3314595547424991, 'patience': 10, 'min_lr': 0.0007375443740693484, 'units_layer_0': 972, 'activation_layer_0': 'tanh', 'units_layer_1': 1023, 'activation_layer_1': 'sigmoid', 'units_layer_2': 84, 'activation_layer_2': 'sigmoid', 'units_layer_3': 71, 'activation_layer_3': 'relu'}.
Trial finished with value: 0.5260097980499268 and parameters: {'lr': 0.0005475364251124649, 'batch_size': 128, 'epochs': 10, 'num_layers': 5, 'dropout_rate': 0.3270603115454733, 'reduction_factor': 0.45947266488822186, 'patience': 6, 'min_lr': 0.00016723207940390255, 'units_layer_0': 675, 'activation_layer_0': 'tanh', 'units_layer_1': 73, 'activation_layer_1': 'tanh', 'units_layer_2': 421, 'activation_layer_2': 'relu', 'units_layer_3': 726, 'activation_layer_3': 'sigmoid', 'units_layer_4': 552, 'activation_layer_4': 'tanh'}.
Trial finished with value: 0.576583743095398 and parameters: {'lr': 0.00011721252562279383, 'batch_size': 1024, 'epochs': 55, 'num_layers': 4, 'dropout_rate': 0.20236020200325167, 'reduction_factor': 0.3910872215368826, 'patience': 8, 'min_lr': 0.0006812496020167977, 'units_layer_0': 1024, 'activation_layer_0': 'tanh', 'units_layer_1': 1013, 'activation_layer_1': 'sigmoid', 'units_layer_2': 68, 'activation_layer_2': 'sigmoid', 'units_layer_3': 198, 'activation_layer_3': 'sigmoid'}.
Trial finished with value: 0.5815977454185486 and parameters: {'lr': 0.0010387206865975845, 'batch_size': 512, 'epochs': 75, 'num_layers': 4, 'dropout_rate': 0.10200467072667063, 'reduction_factor': 0.3518473287848943, 'patience': 1, 'min_lr': 7.326071689584279e-05, 'units_layer_0': 400, 'activation_layer_0': 'tanh', 'units_layer_1': 580, 'activation_layer_1': 'sigmoid', 'units_layer_2': 637, 'activation_layer_2': 'relu', 'units_layer_3': 179, 'activation_layer_3': 'tanh'}.
Trial finished with value: 0.5766009092330933 and parameters: {'lr': 0.0005286041408418583, 'batch_size': 1024, 'epochs': 12, 'num_layers': 4, 'dropout_rate': 0.11410153749505936, 'reduction_factor': 0.21320581480327944, 'patience': 10, 'min_lr': 0.00031466949272775693, 'units_layer_0': 921, 'activation_layer_0': 'tanh', 'units_layer_1': 711, 'activation_layer_1': 'sigmoid', 'units_layer_2': 220, 'activation_layer_2': 'sigmoid', 'units_layer_3': 83, 'activation_layer_3': 'sigmoid'}.
Trial 0 finished with value: 0.5225757360458374 and parameters: {'lr': 0.006451111300985256, 'batch_size': 1024, 'epochs': 167, 'num_layers': 4, 'dropout_rate': 0.15603773174000235, 'reduction_factor': 0.8455288294182065, 'patience': 4, 'min_lr': 0.0023335929538933786, 'units_layer_0': 260, 'activation_layer_0': 'sigmoid', 'units_layer_1': 813, 'activation_layer_1': 'tanh', 'units_layer_2': 728, 'activation_layer_2': 'sigmoid', 'units_layer_3': 1005, 'activation_layer_3': 'relu'}.
Trial 0 finished with value: 0.5830233693122864 and parameters: {'lr': 0.00026849925168702176, 'batch_size': 1024, 'epochs': 118, 'num_layers': 4, 'dropout_rate': 0.11944291306805946, 'reduction_factor': 0.8568025895281917, 'patience': 4, 'min_lr': 1.1770945053687654e-05, 'units_layer_0': 153, 'activation_layer_0': 'tanh', 'units_layer_1': 701, 'activation_layer_1': 'tanh', 'units_layer_2': 732, 'activation_layer_2': 'sigmoid', 'units_layer_3': 115, 'activation_layer_3': 'relu'}.
Trial 1 finished with value: 0.5743724703788757 and parameters: {'lr': 0.00019250436512669898, 'batch_size': 1024, 'epochs': 102, 'num_layers': 5, 'dropout_rate': 0.1576508857909139, 'reduction_factor': 0.8412441600475008, 'patience': 4, 'min_lr': 0.00025051015931172534, 'units_layer_0': 281, 'activation_layer_0': 'sigmoid', 'units_layer_1': 551, 'activation_layer_1': 'tanh', 'units_layer_2': 251, 'activation_layer_2': 'relu', 'units_layer_3': 943, 'activation_layer_3': 'sigmoid', 'units_layer_4': 846, 'activation_layer_4': 'tanh'}.
Trial 1 finished with value: 0.5689356923103333 and parameters: {'lr': 0.0025725745912519435, 'batch_size': 512, 'epochs': 110, 'num_layers': 4, 'dropout_rate': 0.19698053579039493, 'reduction_factor': 0.89631380358171, 'patience': 2, 'min_lr': 0.00016562653679697643, 'units_layer_0': 554, 'activation_layer_0': 'sigmoid', 'units_layer_1': 337, 'activation_layer_1': 'tanh', 'units_layer_2': 881, 'activation_layer_2': 'sigmoid', 'units_layer_3': 719, 'activation_layer_3': 'relu'}.
Trial 2 finished with value: 0.5751267075538635 and parameters: {'lr': 0.00019035182133987866, 'batch_size': 1024, 'epochs': 191, 'num_layers': 4, 'dropout_rate': 0.1183090065196048, 'reduction_factor': 0.8397133080106397, 'patience': 4, 'min_lr': 0.0002988364752711103, 'units_layer_0': 74, 'activation_layer_0': 'tanh', 'units_layer_1': 115, 'activation_layer_1': 'sigmoid', 'units_layer_2': 806, 'activation_layer_2': 'tanh', 'units_layer_3': 509, 'activation_layer_3': 'relu'}.
Trial 3 finished with value: 0.5888801217079163 and parameters: {'lr': 0.0004605741522850079, 'batch_size': 256, 'epochs': 122, 'num_layers': 4, 'dropout_rate': 0.15362122312885046, 'reduction_factor': 0.8682792080805501, 'patience': 4, 'min_lr': 0.0026025668477521846, 'units_layer_0': 500, 'activation_layer_0': 'relu', 'units_layer_1': 942, 'activation_layer_1': 'sigmoid', 'units_layer_2': 261, 'activation_layer_2': 'tanh', 'units_layer_3': 607, 'activation_layer_3': 'relu'}.
Trial 4 finished with value: 0.510999321937561 and parameters: {'lr': 0.008724630334992465, 'batch_size': 256, 'epochs': 135, 'num_layers': 4, 'dropout_rate': 0.16941126044939459, 'reduction_factor': 0.8763845657267582, 'patience': 4, 'min_lr': 1.854793993500583e-05, 'units_layer_0': 108, 'activation_layer_0': 'tanh', 'units_layer_1': 363, 'activation_layer_1': 'sigmoid', 'units_layer_2': 944, 'activation_layer_2': 'relu', 'units_layer_3': 498, 'activation_layer_3': 'relu'}.
Trial 5 finished with value: 0.5542937517166138 and parameters: {'lr': 0.0015815040594534232, 'batch_size': 512, 'epochs': 140, 'num_layers': 4, 'dropout_rate': 0.13186864333359238, 'reduction_factor': 0.8720914197009908, 'patience': 4, 'min_lr': 3.587240364913046e-05, 'units_layer_0': 300, 'activation_layer_0': 'tanh', 'units_layer_1': 86, 'activation_layer_1': 'tanh', 'units_layer_2': 294, 'activation_layer_2': 'sigmoid', 'units_layer_3': 190, 'activation_layer_3': 'tanh'}.
Trial 2 finished with value: 0.589011549949646 and parameters: {'lr': 0.0004912465090721029, 'batch_size': 256, 'epochs': 177, 'num_layers': 4, 'dropout_rate': 0.14221130161326137, 'reduction_factor': 0.830881578660711, 'patience': 3, 'min_lr': 0.0033802989970710177, 'units_layer_0': 953, 'activation_layer_0': 'sigmoid', 'units_layer_1': 1001, 'activation_layer_1': 'sigmoid', 'units_layer_2': 190, 'activation_layer_2': 'sigmoid', 'units_layer_3': 662, 'activation_layer_3': 'sigmoid'}.
Trial 3 finished with value: 0.5815005898475647 and parameters: {'lr': 0.00012531179630966702, 'batch_size': 1024, 'epochs': 107, 'num_layers': 6, 'dropout_rate': 0.1796131020523717, 'reduction_factor': 0.9038035326604912, 'patience': 3, 'min_lr': 0.003623254671882506, 'units_layer_0': 620, 'activation_layer_0': 'relu', 'units_layer_1': 274, 'activation_layer_1': 'relu', 'units_layer_2': 236, 'activation_layer_2': 'sigmoid', 'units_layer_3': 197, 'activation_layer_3': 'tanh', 'units_layer_4': 933, 'activation_layer_4': 'relu', 'units_layer_5': 860, 'activation_layer_5': 'sigmoid'}.
Trial 4 finished with value: 0.5864945650100708 and parameters: {'lr': 0.0009506882558287891, 'batch_size': 512, 'epochs': 194, 'num_layers': 4, 'dropout_rate': 0.16514561363992358, 'reduction_factor': 0.9194118613197035, 'patience': 3, 'min_lr': 0.00027955498600327247, 'units_layer_0': 309, 'activation_layer_0': 'sigmoid', 'units_layer_1': 901, 'activation_layer_1': 'sigmoid', 'units_layer_2': 609, 'activation_layer_2': 'tanh', 'units_layer_3': 657, 'activation_layer_3': 'sigmoid'}.
