Trial 6 finished with value: 0.5550879836082458 and parameters: {'lr': 0.0011507146083403969, 'batch_size': 512, 'epochs': 137, 'num_layers': 6, 'dropout_rate': 0.18689746774533322, 'reduction_factor': 0.8343580587853257, 'patience': 3, 'min_lr': 4.2015319486792446e-05, 'units_layer_0': 581, 'activation_layer_0': 'relu', 'units_layer_1': 594, 'activation_layer_1': 'sigmoid', 'units_layer_2': 652, 'activation_layer_2': 'tanh', 'units_layer_3': 313, 'activation_layer_3': 'relu', 'units_layer_4': 370, 'activation_layer_4': 'tanh', 'units_layer_5': 609, 'activation_layer_5': 'sigmoid'}.
Trial 5 finished with value: 0.5617075562477112 and parameters: {'lr': 0.00017395351448910615, 'batch_size': 256, 'epochs': 164, 'num_layers': 5, 'dropout_rate': 0.18599713007016297, 'reduction_factor': 0.921333528589861, 'patience': 4, 'min_lr': 0.0011758354521804117, 'units_layer_0': 727, 'activation_layer_0': 'sigmoid', 'units_layer_1': 133, 'activation_layer_1': 'tanh', 'units_layer_2': 403, 'activation_layer_2': 'relu', 'units_layer_3': 576, 'activation_layer_3': 'tanh', 'units_layer_4': 756, 'activation_layer_4': 'relu'}.
Trial 6 finished with value: 0.5256698131561279 and parameters: {'lr': 0.0008302753952291119, 'batch_size': 512, 'epochs': 145, 'num_layers': 6, 'dropout_rate': 0.12102485391768307, 'reduction_factor': 0.8323086060576695, 'patience': 3, 'min_lr': 0.0010440300854007258, 'units_layer_0': 238, 'activation_layer_0': 'sigmoid', 'units_layer_1': 173, 'activation_layer_1': 'tanh', 'units_layer_2': 678, 'activation_layer_2': 'relu', 'units_layer_3': 889, 'activation_layer_3': 'tanh', 'units_layer_4': 447, 'activation_layer_4': 'sigmoid', 'units_layer_5': 394, 'activation_layer_5': 'relu'}.
Trial 7 finished with value: 0.5310837626457214 and parameters: {'lr': 0.0014528708324286089, 'batch_size': 512, 'epochs': 168, 'num_layers': 4, 'dropout_rate': 0.1921902858905137, 'reduction_factor': 0.9416654180374939, 'patience': 3, 'min_lr': 7.270426171724117e-05, 'units_layer_0': 499, 'activation_layer_0': 'sigmoid', 'units_layer_1': 442, 'activation_layer_1': 'tanh', 'units_layer_2': 796, 'activation_layer_2': 'tanh', 'units_layer_3': 340, 'activation_layer_3': 'relu'}.
Trial 7 finished with value: 0.5388318300247192 and parameters: {'lr': 0.00042997838778391324, 'batch_size': 256, 'epochs': 178, 'num_layers': 6, 'dropout_rate': 0.19652536840898852, 'reduction_factor': 0.890223983625689, 'patience': 4, 'min_lr': 0.00016950682411858586, 'units_layer_0': 528, 'activation_layer_0': 'tanh', 'units_layer_1': 169, 'activation_layer_1': 'tanh', 'units_layer_2': 460, 'activation_layer_2': 'relu', 'units_layer_3': 631, 'activation_layer_3': 'tanh', 'units_layer_4': 853, 'activation_layer_4': 'tanh', 'units_layer_5': 721, 'activation_layer_5': 'tanh'}.
Trial 8 finished with value: 0.510999321937561 and parameters: {'lr': 0.005179256083148631, 'batch_size': 1024, 'epochs': 167, 'num_layers': 4, 'dropout_rate': 0.19293913952407687, 'reduction_factor': 0.9328603547641798, 'patience': 3, 'min_lr': 0.004622757989813424, 'units_layer_0': 195, 'activation_layer_0': 'tanh', 'units_layer_1': 680, 'activation_layer_1': 'tanh', 'units_layer_2': 194, 'activation_layer_2': 'relu', 'units_layer_3': 114, 'activation_layer_3': 'relu'}.
