Trial 10 finished with value: 0.6006250977516174 and parameters: {'lr': 0.00010872861301367315, 'batch_size': 256, 'epochs': 198, 'num_layers': 5, 'dropout_rate': 0.1420327506004687, 'reduction_factor': 0.9458849995771584, 'patience': 3, 'min_lr': 0.0014039581155981134, 'units_layer_0': 284, 'activation_layer_0': 'relu', 'units_layer_1': 511, 'activation_layer_1': 'tanh', 'units_layer_2': 508, 'activation_layer_2': 'relu', 'units_layer_3': 276, 'activation_layer_3': 'sigmoid', 'units_layer_4': 331, 'activation_layer_4': 'sigmoid'}.
Trial 11 finished with value: 0.5909942984580994 and parameters: {'lr': 0.00011549824362279896, 'batch_size': 256, 'epochs': 193, 'num_layers': 5, 'dropout_rate': 0.1432558991665307, 'reduction_factor': 0.9489599875304172, 'patience': 3, 'min_lr': 0.0014762686392657588, 'units_layer_0': 272, 'activation_layer_0': 'relu', 'units_layer_1': 511, 'activation_layer_1': 'tanh', 'units_layer_2': 506, 'activation_layer_2': 'relu', 'units_layer_3': 251, 'activation_layer_3': 'sigmoid', 'units_layer_4': 327, 'activation_layer_4': 'sigmoid'}.
Trial 0 finished with value: 0.570469856262207 and parameters: {'lr': 0.0006983355238453256, 'batch_size': 256, 'epochs': 154, 'num_layers': 4, 'dropout_rate': 0.11620427766499092, 'reduction_factor': 0.8148845440514232, 'patience': 2, 'min_lr': 0.004492472057322478, 'units_layer_0': 263, 'activation_layer_0': 'tanh', 'units_layer_1': 91, 'activation_layer_1': 'sigmoid', 'units_layer_2': 330, 'activation_layer_2': 'sigmoid', 'units_layer_3': 327, 'activation_layer_3': 'tanh'}.
Trial 1 finished with value: 0.5324665307998657 and parameters: {'lr': 0.0011864896497771845, 'batch_size': 512, 'epochs': 138, 'num_layers': 6, 'dropout_rate': 0.16250276422811177, 'reduction_factor': 0.8513819669383789, 'patience': 2, 'min_lr': 0.0013271245214675086, 'units_layer_0': 508, 'activation_layer_0': 'sigmoid', 'units_layer_1': 271, 'activation_layer_1': 'relu', 'units_layer_2': 410, 'activation_layer_2': 'sigmoid', 'units_layer_3': 344, 'activation_layer_3': 'tanh', 'units_layer_4': 155, 'activation_layer_4': 'tanh', 'units_layer_5': 180, 'activation_layer_5': 'sigmoid'}.
Trial 2 finished with value: 0.5774751305580139 and parameters: {'lr': 0.00021751094231713645, 'batch_size': 1024, 'epochs': 185, 'num_layers': 6, 'dropout_rate': 0.1080267140148255, 'reduction_factor': 0.8892709864318638, 'patience': 2, 'min_lr': 0.00588104949914846, 'units_layer_0': 189, 'activation_layer_0': 'sigmoid', 'units_layer_1': 167, 'activation_layer_1': 'tanh', 'units_layer_2': 220, 'activation_layer_2': 'relu', 'units_layer_3': 154, 'activation_layer_3': 'relu', 'units_layer_4': 368, 'activation_layer_4': 'tanh', 'units_layer_5': 330, 'activation_layer_5': 'relu'}.
Trial 3 finished with value: 0.5801235437393188 and parameters: {'lr': 0.0003976514390738059, 'batch_size': 512, 'epochs': 175, 'num_layers': 6, 'dropout_rate': 0.1256069113765947, 'reduction_factor': 0.8600466998929176, 'patience': 2, 'min_lr': 1.4214124367182512e-05, 'units_layer_0': 493, 'activation_layer_0': 'tanh', 'units_layer_1': 401, 'activation_layer_1': 'sigmoid', 'units_layer_2': 417, 'activation_layer_2': 'tanh', 'units_layer_3': 501, 'activation_layer_3': 'tanh', 'units_layer_4': 471, 'activation_layer_4': 'relu', 'units_layer_5': 366, 'activation_layer_5': 'sigmoid'}.
Trial 4 finished with value: 0.5262526273727417 and parameters: {'lr': 0.00019809215083647834, 'batch_size': 1024, 'epochs': 100, 'num_layers': 4, 'dropout_rate': 0.13831620159047125, 'reduction_factor': 0.8015153279577497, 'patience': 2, 'min_lr': 2.0147172217854634e-05, 'units_layer_0': 392, 'activation_layer_0': 'sigmoid', 'units_layer_1': 476, 'activation_layer_1': 'sigmoid', 'units_layer_2': 328, 'activation_layer_2': 'sigmoid', 'units_layer_3': 480, 'activation_layer_3': 'tanh'}.
Trial 5 finished with value: 0.5279382467269897 and parameters: {'lr': 0.00028904594258989804, 'batch_size': 1024, 'epochs': 135, 'num_layers': 5, 'dropout_rate': 0.19670415880205522, 'reduction_factor': 0.9133260150364092, 'patience': 4, 'min_lr': 4.080774624216448e-05, 'units_layer_0': 401, 'activation_layer_0': 'sigmoid', 'units_layer_1': 194, 'activation_layer_1': 'relu', 'units_layer_2': 79, 'activation_layer_2': 'tanh', 'units_layer_3': 133, 'activation_layer_3': 'relu', 'units_layer_4': 169, 'activation_layer_4': 'relu'}.
Trial 6 finished with value: 0.583640456199646 and parameters: {'lr': 0.000134493255894651, 'batch_size': 512, 'epochs': 195, 'num_layers': 6, 'dropout_rate': 0.1704854286956231, 'reduction_factor': 0.9223869773431164, 'patience': 4, 'min_lr': 0.002454435239239915, 'units_layer_0': 389, 'activation_layer_0': 'sigmoid', 'units_layer_1': 508, 'activation_layer_1': 'tanh', 'units_layer_2': 456, 'activation_layer_2': 'relu', 'units_layer_3': 283, 'activation_layer_3': 'sigmoid', 'units_layer_4': 213, 'activation_layer_4': 'relu', 'units_layer_5': 133, 'activation_layer_5': 'sigmoid'}.
Trial 7 finished with value: 0.5758095383644104 and parameters: {'lr': 0.0013285388228220058, 'batch_size': 1024, 'epochs': 161, 'num_layers': 6, 'dropout_rate': 0.17812129077893196, 'reduction_factor': 0.8470822171237932, 'patience': 2, 'min_lr': 9.416146007975748e-05, 'units_layer_0': 363, 'activation_layer_0': 'tanh', 'units_layer_1': 245, 'activation_layer_1': 'relu', 'units_layer_2': 240, 'activation_layer_2': 'sigmoid', 'units_layer_3': 122, 'activation_layer_3': 'relu', 'units_layer_4': 212, 'activation_layer_4': 'sigmoid', 'units_layer_5': 420, 'activation_layer_5': 'relu'}.
Trial 8 finished with value: 0.523301362991333 and parameters: {'lr': 0.0020434349933015753, 'batch_size': 1024, 'epochs': 113, 'num_layers': 5, 'dropout_rate': 0.17313218703581945, 'reduction_factor': 0.9249417905628872, 'patience': 4, 'min_lr': 0.00019005482854539323, 'units_layer_0': 83, 'activation_layer_0': 'sigmoid', 'units_layer_1': 347, 'activation_layer_1': 'tanh', 'units_layer_2': 356, 'activation_layer_2': 'relu', 'units_layer_3': 448, 'activation_layer_3': 'relu', 'units_layer_4': 83, 'activation_layer_4': 'relu'}.
Trial 9 finished with value: 0.5246555805206299 and parameters: {'lr': 0.0038998009680850177, 'batch_size': 512, 'epochs': 122, 'num_layers': 4, 'dropout_rate': 0.15872092354750028, 'reduction_factor': 0.8756496138846754, 'patience': 2, 'min_lr': 0.0005627257957844988, 'units_layer_0': 427, 'activation_layer_0': 'relu', 'units_layer_1': 118, 'activation_layer_1': 'tanh', 'units_layer_2': 104, 'activation_layer_2': 'relu', 'units_layer_3': 219, 'activation_layer_3': 'sigmoid'}.
Trial 10 finished with value: 0.6006250977516174 and parameters: {'lr': 0.00010872861301367315, 'batch_size': 256, 'epochs': 198, 'num_layers': 5, 'dropout_rate': 0.1420327506004687, 'reduction_factor': 0.9458849995771584, 'patience': 3, 'min_lr': 0.0014039581155981134, 'units_layer_0': 284, 'activation_layer_0': 'relu', 'units_layer_1': 511, 'activation_layer_1': 'tanh', 'units_layer_2': 508, 'activation_layer_2': 'relu', 'units_layer_3': 276, 'activation_layer_3': 'sigmoid', 'units_layer_4': 331, 'activation_layer_4': 'sigmoid'}.
Trial 11 finished with value: 0.5909942984580994 and parameters: {'lr': 0.00011549824362279896, 'batch_size': 256, 'epochs': 193, 'num_layers': 5, 'dropout_rate': 0.1432558991665307, 'reduction_factor': 0.9489599875304172, 'patience': 3, 'min_lr': 0.0014762686392657588, 'units_layer_0': 272, 'activation_layer_0': 'relu', 'units_layer_1': 511, 'activation_layer_1': 'tanh', 'units_layer_2': 506, 'activation_layer_2': 'relu', 'units_layer_3': 251, 'activation_layer_3': 'sigmoid', 'units_layer_4': 327, 'activation_layer_4': 'sigmoid'}.
