Trial 1778 finished with value: 0.6630434782608695 and parameters: {'n_estimators': 594, 'max_depth': 14, 'min_samples_split': 29, 'min_samples_leaf': 78, 'criterion': 'entropy'}.
Trial 1779 finished with value: 0.7065217391304348 and parameters: {'n_estimators': 622, 'max_depth': 8, 'min_samples_split': 22, 'min_samples_leaf': 63, 'criterion': 'entropy'}.
Trial 1780 finished with value: 0.6956521739130435 and parameters: {'n_estimators': 753, 'max_depth': 87, 'min_samples_split': 85, 'min_samples_leaf': 57, 'criterion': 'gini'}.
Trial 1781 finished with value: 0.717391304347826 and parameters: {'n_estimators': 693, 'max_depth': 10, 'min_samples_split': 28, 'min_samples_leaf': 55, 'criterion': 'entropy'}.
Trial 1782 finished with value: 0.6521739130434783 and parameters: {'n_estimators': 766, 'max_depth': 5, 'min_samples_split': 161, 'min_samples_leaf': 58, 'criterion': 'entropy'}.
Trial 1783 finished with value: 0.6521739130434783 and parameters: {'n_estimators': 527, 'max_depth': 55, 'min_samples_split': 18, 'min_samples_leaf': 55, 'criterion': 'entropy'}.
Trial 1784 finished with value: 0.7065217391304348 and parameters: {'n_estimators': 733, 'max_depth': 12, 'min_samples_split': 149, 'min_samples_leaf': 60, 'criterion': 'entropy'}.
Trial 1785 finished with value: 0.6956521739130435 and parameters: {'n_estimators': 565, 'max_depth': 8, 'min_samples_split': 25, 'min_samples_leaf': 54, 'criterion': 'entropy'}.
Trial 1786 finished with value: 0.6847826086956522 and parameters: {'n_estimators': 774, 'max_depth': 15, 'min_samples_split': 30, 'min_samples_leaf': 57, 'criterion': 'entropy'}.
Trial 1787 finished with value: 0.6630434782608695 and parameters: {'n_estimators': 779, 'max_depth': 36, 'min_samples_split': 22, 'min_samples_leaf': 54, 'criterion': 'entropy'}.
Trial 1788 finished with value: 0.717391304347826 and parameters: {'n_estimators': 757, 'max_depth': 10, 'min_samples_split': 26, 'min_samples_leaf': 57, 'criterion': 'entropy'}.
Trial 1789 finished with value: 0.6956521739130435 and parameters: {'n_estimators': 510, 'max_depth': 13, 'min_samples_split': 12, 'min_samples_leaf': 67, 'criterion': 'entropy'}.
Trial 1790 finished with value: 0.6847826086956522 and parameters: {'n_estimators': 739, 'max_depth': 31, 'min_samples_split': 29, 'min_samples_leaf': 56, 'criterion': 'entropy'}.
Trial 1791 finished with value: 0.7065217391304348 and parameters: {'n_estimators': 785, 'max_depth': 7, 'min_samples_split': 117, 'min_samples_leaf': 61, 'criterion': 'entropy'}.
Trial 1792 finished with value: 0.717391304347826 and parameters: {'n_estimators': 718, 'max_depth': 11, 'min_samples_split': 19, 'min_samples_leaf': 59, 'criterion': 'entropy'}.
Trial 1793 finished with value: 0.6956521739130435 and parameters: {'n_estimators': 784, 'max_depth': 9, 'min_samples_split': 77, 'min_samples_leaf': 54, 'criterion': 'entropy'}.
Trial 1794 finished with value: 0.6956521739130435 and parameters: {'n_estimators': 540, 'max_depth': 13, 'min_samples_split': 23, 'min_samples_leaf': 54, 'criterion': 'entropy'}.
Trial 1795 finished with value: 0.6847826086956522 and parameters: {'n_estimators': 752, 'max_depth': 16, 'min_samples_split': 30, 'min_samples_leaf': 62, 'criterion': 'entropy'}.
Trial 1796 finished with value: 0.6956521739130435 and parameters: {'n_estimators': 553, 'max_depth': 7, 'min_samples_split': 26, 'min_samples_leaf': 57, 'criterion': 'entropy'}.
Trial 1797 finished with value: 0.7282608695652174 and parameters: {'n_estimators': 577, 'max_depth': 11, 'min_samples_split': 194, 'min_samples_leaf': 59, 'criterion': 'entropy'}.
Trial 1798 finished with value: 0.717391304347826 and parameters: {'n_estimators': 733, 'max_depth': 9, 'min_samples_split': 16, 'min_samples_leaf': 55, 'criterion': 'entropy'}.
Trial 1799 finished with value: 0.6956521739130435 and parameters: {'n_estimators': 764, 'max_depth': 14, 'min_samples_split': 31, 'min_samples_leaf': 56, 'criterion': 'gini'}.
Trial 1800 finished with value: 0.6413043478260869 and parameters: {'n_estimators': 976, 'max_depth': 5, 'min_samples_split': 20, 'min_samples_leaf': 54, 'criterion': 'entropy'}.
Trial 1801 finished with value: 0.717391304347826 and parameters: {'n_estimators': 781, 'max_depth': 11, 'min_samples_split': 7, 'min_samples_leaf': 58, 'criterion': 'entropy'}.
Trial 1802 finished with value: 0.7282608695652174 and parameters: {'n_estimators': 493, 'max_depth': 8, 'min_samples_split': 26, 'min_samples_leaf': 54, 'criterion': 'entropy'}.
Trial 1803 finished with value: 0.6956521739130435 and parameters: {'n_estimators': 791, 'max_depth': 12, 'min_samples_split': 31, 'min_samples_leaf': 56, 'criterion': 'entropy'}.
Trial 1804 finished with value: 0.6630434782608695 and parameters: {'n_estimators': 751, 'max_depth': 18, 'min_samples_split': 23, 'min_samples_leaf': 60, 'criterion': 'entropy'}.
Trial 1805 finished with value: 0.7065217391304348 and parameters: {'n_estimators': 952, 'max_depth': 14, 'min_samples_split': 127, 'min_samples_leaf': 63, 'criterion': 'entropy'}.
Trial 1806 finished with value: 0.7065217391304348 and parameters: {'n_estimators': 780, 'max_depth': 10, 'min_samples_split': 28, 'min_samples_leaf': 53, 'criterion': 'entropy'}.
Trial 1807 finished with value: 0.6956521739130435 and parameters: {'n_estimators': 716, 'max_depth': 7, 'min_samples_split': 14, 'min_samples_leaf': 57, 'criterion': 'entropy'}.
Trial 1808 finished with value: 0.6956521739130435 and parameters: {'n_estimators': 359, 'max_depth': 12, 'min_samples_split': 32, 'min_samples_leaf': 70, 'criterion': 'entropy'}.
Trial 1809 finished with value: 0.6956521739130435 and parameters: {'n_estimators': 608, 'max_depth': 9, 'min_samples_split': 20, 'min_samples_leaf': 53, 'criterion': 'entropy'}.
Trial 1810 finished with value: 0.6739130434782609 and parameters: {'n_estimators': 763, 'max_depth': 15, 'min_samples_split': 24, 'min_samples_leaf': 59, 'criterion': 'entropy'}.
Trial 1811 finished with value: 0.717391304347826 and parameters: {'n_estimators': 740, 'max_depth': 10, 'min_samples_split': 29, 'min_samples_leaf': 55, 'criterion': 'entropy'}.
Trial 1812 finished with value: 0.6739130434782609 and parameters: {'n_estimators': 645, 'max_depth': 6, 'min_samples_split': 17, 'min_samples_leaf': 61, 'criterion': 'entropy'}.
Trial 1813 finished with value: 0.717391304347826 and parameters: {'n_estimators': 791, 'max_depth': 13, 'min_samples_split': 31, 'min_samples_leaf': 53, 'criterion': 'entropy'}.
Trial 1814 finished with value: 0.7282608695652174 and parameters: {'n_estimators': 518, 'max_depth': 8, 'min_samples_split': 26, 'min_samples_leaf': 56, 'criterion': 'entropy'}.
Trial 1815 finished with value: 0.717391304347826 and parameters: {'n_estimators': 708, 'max_depth': 11, 'min_samples_split': 22, 'min_samples_leaf': 58, 'criterion': 'entropy'}.
Trial 1816 finished with value: 0.6847826086956522 and parameters: {'n_estimators': 468, 'max_depth': 16, 'min_samples_split': 31, 'min_samples_leaf': 53, 'criterion': 'entropy'}.
Trial 1817 finished with value: 0.6956521739130435 and parameters: {'n_estimators': 784, 'max_depth': 9, 'min_samples_split': 28, 'min_samples_leaf': 65, 'criterion': 'entropy'}.
Trial 1818 finished with value: 0.6956521739130435 and parameters: {'n_estimators': 549, 'max_depth': 12, 'min_samples_split': 33, 'min_samples_leaf': 55, 'criterion': 'gini'}.
Trial 1819 finished with value: 0.6956521739130435 and parameters: {'n_estimators': 755, 'max_depth': 7, 'min_samples_split': 24, 'min_samples_leaf': 57, 'criterion': 'entropy'}.
Trial 1820 finished with value: 0.7065217391304348 and parameters: {'n_estimators': 771, 'max_depth': 10, 'min_samples_split': 19, 'min_samples_leaf': 53, 'criterion': 'entropy'}.
Trial 1821 finished with value: 0.6521739130434783 and parameters: {'n_estimators': 789, 'max_depth': 5, 'min_samples_split': 11, 'min_samples_leaf': 60, 'criterion': 'entropy'}.
Trial 1822 finished with value: 0.7282608695652174 and parameters: {'n_estimators': 737, 'max_depth': 13, 'min_samples_split': 33, 'min_samples_leaf': 58, 'criterion': 'entropy'}.
Trial 1823 finished with value: 0.717391304347826 and parameters: {'n_estimators': 766, 'max_depth': 10, 'min_samples_split': 27, 'min_samples_leaf': 53, 'criterion': 'entropy'}.
Trial 1824 finished with value: 0.6847826086956522 and parameters: {'n_estimators': 794, 'max_depth': 15, 'min_samples_split': 22, 'min_samples_leaf': 33, 'criterion': 'entropy'}.
Trial 1825 finished with value: 0.6956521739130435 and parameters: {'n_estimators': 531, 'max_depth': 12, 'min_samples_split': 15, 'min_samples_leaf': 55, 'criterion': 'entropy'}.
Trial 1826 finished with value: 0.717391304347826 and parameters: {'n_estimators': 694, 'max_depth': 8, 'min_samples_split': 56, 'min_samples_leaf': 63, 'criterion': 'entropy'}.
Trial 1827 finished with value: 0.6630434782608695 and parameters: {'n_estimators': 589, 'max_depth': 19, 'min_samples_split': 34, 'min_samples_leaf': 52, 'criterion': 'entropy'}.
Trial 1828 finished with value: 0.6630434782608695 and parameters: {'n_estimators': 752, 'max_depth': 73, 'min_samples_split': 27, 'min_samples_leaf': 60, 'criterion': 'entropy'}.
Trial 1829 finished with value: 0.7282608695652174 and parameters: {'n_estimators': 568, 'max_depth': 10, 'min_samples_split': 31, 'min_samples_leaf': 56, 'criterion': 'entropy'}.
Trial 1830 finished with value: 0.6847826086956522 and parameters: {'n_estimators': 776, 'max_depth': 13, 'min_samples_split': 119, 'min_samples_leaf': 54, 'criterion': 'entropy'}.
Trial 1831 finished with value: 0.7065217391304348 and parameters: {'n_estimators': 735, 'max_depth': 7, 'min_samples_split': 20, 'min_samples_leaf': 58, 'criterion': 'entropy'}.
Trial 1832 finished with value: 0.6956521739130435 and parameters: {'n_estimators': 794, 'max_depth': 11, 'min_samples_split': 142, 'min_samples_leaf': 52, 'criterion': 'entropy'}.
Trial 1833 finished with value: 0.6521739130434783 and parameters: {'n_estimators': 724, 'max_depth': 27, 'min_samples_split': 23, 'min_samples_leaf': 55, 'criterion': 'entropy'}.
Trial 1834 finished with value: 0.7065217391304348 and parameters: {'n_estimators': 770, 'max_depth': 14, 'min_samples_split': 27, 'min_samples_leaf': 62, 'criterion': 'entropy'}.
Trial 1835 finished with value: 0.6847826086956522 and parameters: {'n_estimators': 799, 'max_depth': 9, 'min_samples_split': 35, 'min_samples_leaf': 53, 'criterion': 'entropy'}.
Trial 1836 finished with value: 0.6739130434782609 and parameters: {'n_estimators': 750, 'max_depth': 16, 'min_samples_split': 30, 'min_samples_leaf': 59, 'criterion': 'entropy'}.
Trial 1837 finished with value: 0.717391304347826 and parameters: {'n_estimators': 782, 'max_depth': 12, 'min_samples_split': 18, 'min_samples_leaf': 52, 'criterion': 'gini'}.
Trial 1838 finished with value: 0.6956521739130435 and parameters: {'n_estimators': 550, 'max_depth': 7, 'min_samples_split': 24, 'min_samples_leaf': 57, 'criterion': 'entropy'}.
Trial 1839 finished with value: 0.717391304347826 and parameters: {'n_estimators': 681, 'max_depth': 9, 'min_samples_split': 63, 'min_samples_leaf': 55, 'criterion': 'entropy'}.
Trial 1840 finished with value: 0.6630434782608695 and parameters: {'n_estimators': 797, 'max_depth': 22, 'min_samples_split': 34, 'min_samples_leaf': 52, 'criterion': 'entropy'}.
Trial 1841 finished with value: 0.6521739130434783 and parameters: {'n_estimators': 763, 'max_depth': 5, 'min_samples_split': 181, 'min_samples_leaf': 57, 'criterion': 'entropy'}.
Trial 1842 finished with value: 0.717391304347826 and parameters: {'n_estimators': 800, 'max_depth': 11, 'min_samples_split': 30, 'min_samples_leaf': 54, 'criterion': 'entropy'}.
Trial 1843 finished with value: 0.7065217391304348 and parameters: {'n_estimators': 725, 'max_depth': 14, 'min_samples_split': 24, 'min_samples_leaf': 61, 'criterion': 'entropy'}.
Trial 1844 finished with value: 0.6739130434782609 and parameters: {'n_estimators': 667, 'max_depth': 17, 'min_samples_split': 5, 'min_samples_leaf': 51, 'criterion': 'entropy'}.
Trial 1845 finished with value: 0.7065217391304348 and parameters: {'n_estimators': 707, 'max_depth': 8, 'min_samples_split': 37, 'min_samples_leaf': 59, 'criterion': 'entropy'}.
Trial 1846 finished with value: 0.7065217391304348 and parameters: {'n_estimators': 777, 'max_depth': 11, 'min_samples_split': 14, 'min_samples_leaf': 56, 'criterion': 'entropy'}.
Trial 1847 finished with value: 0.7065217391304348 and parameters: {'n_estimators': 748, 'max_depth': 13, 'min_samples_split': 28, 'min_samples_leaf': 54, 'criterion': 'entropy'}.
Trial 1848 finished with value: 0.6739130434782609 and parameters: {'n_estimators': 806, 'max_depth': 9, 'min_samples_split': 19, 'min_samples_leaf': 52, 'criterion': 'entropy'}.
Trial 1849 finished with value: 0.6956521739130435 and parameters: {'n_estimators': 788, 'max_depth': 7, 'min_samples_split': 33, 'min_samples_leaf': 58, 'criterion': 'entropy'}.
Trial 1850 finished with value: 0.7065217391304348 and parameters: {'n_estimators': 533, 'max_depth': 10, 'min_samples_split': 26, 'min_samples_leaf': 51, 'criterion': 'entropy'}.
Trial 1851 finished with value: 0.7282608695652174 and parameters: {'n_estimators': 413, 'max_depth': 12, 'min_samples_split': 36, 'min_samples_leaf': 54, 'criterion': 'entropy'}.
Trial 1852 finished with value: 0.6739130434782609 and parameters: {'n_estimators': 498, 'max_depth': 6, 'min_samples_split': 115, 'min_samples_leaf': 61, 'criterion': 'entropy'}.
Trial 1853 finished with value: 0.6739130434782609 and parameters: {'n_estimators': 570, 'max_depth': 14, 'min_samples_split': 31, 'min_samples_leaf': 56, 'criterion': 'entropy'}.
Trial 1854 finished with value: 0.6847826086956522 and parameters: {'n_estimators': 776, 'max_depth': 9, 'min_samples_split': 72, 'min_samples_leaf': 51, 'criterion': 'entropy'}.
Trial 1855 finished with value: 0.7065217391304348 and parameters: {'n_estimators': 757, 'max_depth': 11, 'min_samples_split': 22, 'min_samples_leaf': 53, 'criterion': 'entropy'}.
Trial 1856 finished with value: 0.6739130434782609 and parameters: {'n_estimators': 936, 'max_depth': 16, 'min_samples_split': 28, 'min_samples_leaf': 59, 'criterion': 'entropy'}.
Trial 1857 finished with value: 0.7282608695652174 and parameters: {'n_estimators': 809, 'max_depth': 8, 'min_samples_split': 9, 'min_samples_leaf': 56, 'criterion': 'entropy'}.
Trial 1858 finished with value: 0.6739130434782609 and parameters: {'n_estimators': 739, 'max_depth': 78, 'min_samples_split': 34, 'min_samples_leaf': 54, 'criterion': 'gini'}.
Trial 1859 finished with value: 0.6630434782608695 and parameters: {'n_estimators': 441, 'max_depth': 65, 'min_samples_split': 17, 'min_samples_leaf': 52, 'criterion': 'entropy'}.
Trial 1860 finished with value: 0.7065217391304348 and parameters: {'n_estimators': 792, 'max_depth': 13, 'min_samples_split': 25, 'min_samples_leaf': 63, 'criterion': 'entropy'}.
Trial 1861 finished with value: 0.717391304347826 and parameters: {'n_estimators': 761, 'max_depth': 11, 'min_samples_split': 38, 'min_samples_leaf': 57, 'criterion': 'entropy'}.
Trial 1862 finished with value: 0.6739130434782609 and parameters: {'n_estimators': 779, 'max_depth': 15, 'min_samples_split': 31, 'min_samples_leaf': 50, 'criterion': 'entropy'}.
Trial 1863 finished with value: 0.7065217391304348 and parameters: {'n_estimators': 802, 'max_depth': 9, 'min_samples_split': 20, 'min_samples_leaf': 60, 'criterion': 'entropy'}.
Trial 1864 finished with value: 0.6304347826086957 and parameters: {'n_estimators': 518, 'max_depth': 5, 'min_samples_split': 28, 'min_samples_leaf': 55, 'criterion': 'entropy'}.
Trial 1865 finished with value: 0.7065217391304348 and parameters: {'n_estimators': 730, 'max_depth': 12, 'min_samples_split': 23, 'min_samples_leaf': 52, 'criterion': 'entropy'}.
Trial 1866 finished with value: 0.7065217391304348 and parameters: {'n_estimators': 598, 'max_depth': 7, 'min_samples_split': 82, 'min_samples_leaf': 58, 'criterion': 'entropy'}.
Trial 1867 finished with value: 0.6956521739130435 and parameters: {'n_estimators': 805, 'max_depth': 10, 'min_samples_split': 35, 'min_samples_leaf': 54, 'criterion': 'entropy'}.
Trial 1868 finished with value: 0.6739130434782609 and parameters: {'n_estimators': 770, 'max_depth': 18, 'min_samples_split': 31, 'min_samples_leaf': 51, 'criterion': 'entropy'}.
Trial 1869 finished with value: 0.717391304347826 and parameters: {'n_estimators': 819, 'max_depth': 13, 'min_samples_split': 124, 'min_samples_leaf': 56, 'criterion': 'entropy'}.
Trial 1870 finished with value: 0.717391304347826 and parameters: {'n_estimators': 634, 'max_depth': 10, 'min_samples_split': 14, 'min_samples_leaf': 51, 'criterion': 'entropy'}.
Trial 1871 finished with value: 0.7065217391304348 and parameters: {'n_estimators': 562, 'max_depth': 8, 'min_samples_split': 27, 'min_samples_leaf': 58, 'criterion': 'entropy'}.
Trial 1872 finished with value: 0.6956521739130435 and parameters: {'n_estimators': 705, 'max_depth': 15, 'min_samples_split': 38, 'min_samples_leaf': 53, 'criterion': 'entropy'}.
Trial 1873 finished with value: 0.7065217391304348 and parameters: {'n_estimators': 790, 'max_depth': 12, 'min_samples_split': 20, 'min_samples_leaf': 50, 'criterion': 'entropy'}.
Trial 1874 finished with value: 0.6739130434782609 and parameters: {'n_estimators': 743, 'max_depth': 7, 'min_samples_split': 33, 'min_samples_leaf': 54, 'criterion': 'entropy'}.
Trial 1875 finished with value: 0.6956521739130435 and parameters: {'n_estimators': 809, 'max_depth': 10, 'min_samples_split': 25, 'min_samples_leaf': 60, 'criterion': 'entropy'}.
Trial 1876 finished with value: 0.6956521739130435 and parameters: {'n_estimators': 763, 'max_depth': 14, 'min_samples_split': 39, 'min_samples_leaf': 56, 'criterion': 'entropy'}.
Trial 1877 finished with value: 0.7065217391304348 and parameters: {'n_estimators': 784, 'max_depth': 12, 'min_samples_split': 30, 'min_samples_leaf': 50, 'criterion': 'entropy'}.
Trial 1878 finished with value: 0.6956521739130435 and parameters: {'n_estimators': 814, 'max_depth': 9, 'min_samples_split': 35, 'min_samples_leaf': 53, 'criterion': 'gini'}.
Trial 1879 finished with value: 0.6630434782608695 and parameters: {'n_estimators': 983, 'max_depth': 6, 'min_samples_split': 17, 'min_samples_leaf': 62, 'criterion': 'entropy'}.
Trial 1880 finished with value: 0.717391304347826 and parameters: {'n_estimators': 721, 'max_depth': 11, 'min_samples_split': 23, 'min_samples_leaf': 58, 'criterion': 'entropy'}.
Trial 1881 finished with value: 0.6956521739130435 and parameters: {'n_estimators': 913, 'max_depth': 8, 'min_samples_split': 28, 'min_samples_leaf': 49, 'criterion': 'entropy'}.
Trial 1882 finished with value: 0.6739130434782609 and parameters: {'n_estimators': 546, 'max_depth': 14, 'min_samples_split': 32, 'min_samples_leaf': 55, 'criterion': 'entropy'}.
Trial 1883 finished with value: 0.6956521739130435 and parameters: {'n_estimators': 753, 'max_depth': 10, 'min_samples_split': 25, 'min_samples_leaf': 64, 'criterion': 'entropy'}.
Trial 1884 finished with value: 0.6630434782608695 and parameters: {'n_estimators': 785, 'max_depth': 17, 'min_samples_split': 41, 'min_samples_leaf': 52, 'criterion': 'entropy'}.
Trial 1885 finished with value: 0.7065217391304348 and parameters: {'n_estimators': 800, 'max_depth': 12, 'min_samples_split': 21, 'min_samples_leaf': 57, 'criterion': 'entropy'}.
Trial 1886 finished with value: 0.6521739130434783 and parameters: {'n_estimators': 766, 'max_depth': 5, 'min_samples_split': 113, 'min_samples_leaf': 51, 'criterion': 'entropy'}.
Trial 1887 finished with value: 0.6956521739130435 and parameters: {'n_estimators': 739, 'max_depth': 8, 'min_samples_split': 35, 'min_samples_leaf': 54, 'criterion': 'entropy'}.
Trial 1888 finished with value: 0.6956521739130435 and parameters: {'n_estimators': 819, 'max_depth': 10, 'min_samples_split': 29, 'min_samples_leaf': 60, 'criterion': 'entropy'}.
Trial 1889 finished with value: 0.6847826086956522 and parameters: {'n_estimators': 532, 'max_depth': 13, 'min_samples_split': 15, 'min_samples_leaf': 49, 'criterion': 'entropy'}.
Trial 1890 finished with value: 0.6847826086956522 and parameters: {'n_estimators': 1000, 'max_depth': 15, 'min_samples_split': 38, 'min_samples_leaf': 56, 'criterion': 'entropy'}.
Trial 1891 finished with value: 0.6739130434782609 and parameters: {'n_estimators': 575, 'max_depth': 7, 'min_samples_split': 25, 'min_samples_leaf': 52, 'criterion': 'entropy'}.
Trial 1892 finished with value: 0.7065217391304348 and parameters: {'n_estimators': 690, 'max_depth': 9, 'min_samples_split': 32, 'min_samples_leaf': 50, 'criterion': 'entropy'}.
Trial 1893 finished with value: 0.6630434782608695 and parameters: {'n_estimators': 775, 'max_depth': 11, 'min_samples_split': 19, 'min_samples_leaf': 31, 'criterion': 'gini'}.
Trial 1894 finished with value: 0.6956521739130435 and parameters: {'n_estimators': 798, 'max_depth': 12, 'min_samples_split': 11, 'min_samples_leaf': 59, 'criterion': 'entropy'}.
Trial 1895 finished with value: 0.6956521739130435 and parameters: {'n_estimators': 820, 'max_depth': 9, 'min_samples_split': 43, 'min_samples_leaf': 54, 'criterion': 'entropy'}.
Trial 1896 finished with value: 0.6956521739130435 and parameters: {'n_estimators': 748, 'max_depth': 14, 'min_samples_split': 29, 'min_samples_leaf': 48, 'criterion': 'entropy'}.
Trial 1897 finished with value: 0.6956521739130435 and parameters: {'n_estimators': 789, 'max_depth': 7, 'min_samples_split': 35, 'min_samples_leaf': 56, 'criterion': 'entropy'}.
Trial 1898 finished with value: 0.717391304347826 and parameters: {'n_estimators': 256, 'max_depth': 11, 'min_samples_split': 22, 'min_samples_leaf': 52, 'criterion': 'entropy'}.
Trial 1899 finished with value: 0.6739130434782609 and parameters: {'n_estimators': 713, 'max_depth': 20, 'min_samples_split': 27, 'min_samples_leaf': 62, 'criterion': 'entropy'}.
