Trial 2144 finished with value: 0.717391304347826 and parameters: {'n_estimators': 798, 'max_depth': 9, 'min_samples_split': 29, 'min_samples_leaf': 56, 'criterion': 'entropy'}.
Trial 2145 finished with value: 0.6739130434782609 and parameters: {'n_estimators': 747, 'max_depth': 15, 'min_samples_split': 19, 'min_samples_leaf': 54, 'criterion': 'entropy'}.
Trial 2146 finished with value: 0.7065217391304348 and parameters: {'n_estimators': 782, 'max_depth': 11, 'min_samples_split': 32, 'min_samples_leaf': 51, 'criterion': 'entropy'}.
Trial 2147 finished with value: 0.6847826086956522 and parameters: {'n_estimators': 509, 'max_depth': 7, 'min_samples_split': 24, 'min_samples_leaf': 48, 'criterion': 'entropy'}.
Trial 2148 finished with value: 0.6630434782608695 and parameters: {'n_estimators': 816, 'max_depth': 26, 'min_samples_split': 44, 'min_samples_leaf': 58, 'criterion': 'entropy'}.
Trial 2149 finished with value: 0.6956521739130435 and parameters: {'n_estimators': 872, 'max_depth': 13, 'min_samples_split': 28, 'min_samples_leaf': 55, 'criterion': 'entropy'}.
Trial 2150 finished with value: 0.717391304347826 and parameters: {'n_estimators': 799, 'max_depth': 10, 'min_samples_split': 38, 'min_samples_leaf': 51, 'criterion': 'entropy'}.
Trial 2151 finished with value: 0.6847826086956522 and parameters: {'n_estimators': 932, 'max_depth': 9, 'min_samples_split': 15, 'min_samples_leaf': 42, 'criterion': 'entropy'}.
Trial 2152 finished with value: 0.6956521739130435 and parameters: {'n_estimators': 843, 'max_depth': 12, 'min_samples_split': 86, 'min_samples_leaf': 53, 'criterion': 'entropy'}.
Trial 2153 finished with value: 0.7065217391304348 and parameters: {'n_estimators': 756, 'max_depth': 7, 'min_samples_split': 33, 'min_samples_leaf': 62, 'criterion': 'entropy'}.
Trial 2154 finished with value: 0.6413043478260869 and parameters: {'n_estimators': 554, 'max_depth': 5, 'min_samples_split': 108, 'min_samples_leaf': 46, 'criterion': 'entropy'}.
Trial 2155 finished with value: 0.7282608695652174 and parameters: {'n_estimators': 635, 'max_depth': 10, 'min_samples_split': 21, 'min_samples_leaf': 49, 'criterion': 'gini'}.
Trial 2156 finished with value: 0.7065217391304348 and parameters: {'n_estimators': 722, 'max_depth': 16, 'min_samples_split': 26, 'min_samples_leaf': 56, 'criterion': 'entropy'}.
Trial 2157 finished with value: 0.6956521739130435 and parameters: {'n_estimators': 780, 'max_depth': 13, 'min_samples_split': 30, 'min_samples_leaf': 60, 'criterion': 'entropy'}.
Trial 2158 finished with value: 0.6956521739130435 and parameters: {'n_estimators': 825, 'max_depth': 8, 'min_samples_split': 36, 'min_samples_leaf': 50, 'criterion': 'entropy'}.
Trial 2159 finished with value: 0.7282608695652174 and parameters: {'n_estimators': 118, 'max_depth': 11, 'min_samples_split': 25, 'min_samples_leaf': 53, 'criterion': 'entropy'}.
Trial 2160 finished with value: 0.7065217391304348 and parameters: {'n_estimators': 808, 'max_depth': 14, 'min_samples_split': 41, 'min_samples_leaf': 59, 'criterion': 'entropy'}.
Trial 2161 finished with value: 0.6521739130434783 and parameters: {'n_estimators': 537, 'max_depth': 35, 'min_samples_split': 18, 'min_samples_leaf': 55, 'criterion': 'entropy'}.
Trial 2162 finished with value: 0.717391304347826 and parameters: {'n_estimators': 853, 'max_depth': 9, 'min_samples_split': 118, 'min_samples_leaf': 47, 'criterion': 'entropy'}.
Trial 2163 finished with value: 0.7065217391304348 and parameters: {'n_estimators': 769, 'max_depth': 12, 'min_samples_split': 31, 'min_samples_leaf': 51, 'criterion': 'entropy'}.
Trial 2164 finished with value: 0.6739130434782609 and parameters: {'n_estimators': 698, 'max_depth': 56, 'min_samples_split': 11, 'min_samples_leaf': 57, 'criterion': 'entropy'}.
Trial 2165 finished with value: 0.7065217391304348 and parameters: {'n_estimators': 1000, 'max_depth': 7, 'min_samples_split': 22, 'min_samples_leaf': 67, 'criterion': 'entropy'}.
Trial 2166 finished with value: 0.6847826086956522 and parameters: {'n_estimators': 796, 'max_depth': 11, 'min_samples_split': 35, 'min_samples_leaf': 94, 'criterion': 'entropy'}.
Trial 2167 finished with value: 0.6847826086956522 and parameters: {'n_estimators': 742, 'max_depth': 9, 'min_samples_split': 28, 'min_samples_leaf': 52, 'criterion': 'entropy'}.
Trial 2168 finished with value: 0.6956521739130435 and parameters: {'n_estimators': 825, 'max_depth': 15, 'min_samples_split': 37, 'min_samples_leaf': 49, 'criterion': 'entropy'}.
Trial 2169 finished with value: 0.6847826086956522 and parameters: {'n_estimators': 656, 'max_depth': 18, 'min_samples_split': 32, 'min_samples_leaf': 45, 'criterion': 'entropy'}.
Trial 2170 finished with value: 0.6739130434782609 and parameters: {'n_estimators': 779, 'max_depth': 6, 'min_samples_split': 46, 'min_samples_leaf': 53, 'criterion': 'entropy'}.
Trial 2171 finished with value: 0.7065217391304348 and parameters: {'n_estimators': 585, 'max_depth': 13, 'min_samples_split': 25, 'min_samples_leaf': 58, 'criterion': 'entropy'}.
Trial 2172 finished with value: 0.6956521739130435 and parameters: {'n_estimators': 831, 'max_depth': 10, 'min_samples_split': 40, 'min_samples_leaf': 55, 'criterion': 'entropy'}.
Trial 2173 finished with value: 0.6739130434782609 and parameters: {'n_estimators': 762, 'max_depth': 8, 'min_samples_split': 101, 'min_samples_leaf': 48, 'criterion': 'entropy'}.
Trial 2174 finished with value: 0.6956521739130435 and parameters: {'n_estimators': 801, 'max_depth': 12, 'min_samples_split': 19, 'min_samples_leaf': 63, 'criterion': 'gini'}.
Trial 2175 finished with value: 0.6847826086956522 and parameters: {'n_estimators': 869, 'max_depth': 16, 'min_samples_split': 92, 'min_samples_leaf': 51, 'criterion': 'entropy'}.
Trial 2176 finished with value: 0.6956521739130435 and parameters: {'n_estimators': 812, 'max_depth': 10, 'min_samples_split': 29, 'min_samples_leaf': 60, 'criterion': 'entropy'}.
Trial 2177 finished with value: 0.7065217391304348 and parameters: {'n_estimators': 570, 'max_depth': 13, 'min_samples_split': 15, 'min_samples_leaf': 54, 'criterion': 'entropy'}.
Trial 2178 finished with value: 0.6413043478260869 and parameters: {'n_estimators': 274, 'max_depth': 5, 'min_samples_split': 34, 'min_samples_leaf': 56, 'criterion': 'entropy'}.
Trial 2179 finished with value: 0.7065217391304348 and parameters: {'n_estimators': 848, 'max_depth': 8, 'min_samples_split': 22, 'min_samples_leaf': 48, 'criterion': 'entropy'}.
Trial 2180 finished with value: 0.717391304347826 and parameters: {'n_estimators': 716, 'max_depth': 11, 'min_samples_split': 111, 'min_samples_leaf': 44, 'criterion': 'entropy'}.
Trial 2181 finished with value: 0.6739130434782609 and parameters: {'n_estimators': 786, 'max_depth': 15, 'min_samples_split': 27, 'min_samples_leaf': 50, 'criterion': 'entropy'}.
Trial 2182 finished with value: 0.6847826086956522 and parameters: {'n_estimators': 898, 'max_depth': 9, 'min_samples_split': 33, 'min_samples_leaf': 52, 'criterion': 'entropy'}.
Trial 2183 finished with value: 0.6956521739130435 and parameters: {'n_estimators': 739, 'max_depth': 12, 'min_samples_split': 39, 'min_samples_leaf': 54, 'criterion': 'entropy'}.
Trial 2184 finished with value: 0.6956521739130435 and parameters: {'n_estimators': 757, 'max_depth': 7, 'min_samples_split': 29, 'min_samples_leaf': 58, 'criterion': 'entropy'}.
Trial 2185 finished with value: 0.7282608695652174 and parameters: {'n_estimators': 834, 'max_depth': 14, 'min_samples_split': 20, 'min_samples_leaf': 47, 'criterion': 'entropy'}.
Trial 2186 finished with value: 0.7282608695652174 and parameters: {'n_estimators': 817, 'max_depth': 10, 'min_samples_split': 24, 'min_samples_leaf': 50, 'criterion': 'entropy'}.
Trial 2187 finished with value: 0.717391304347826 and parameters: {'n_estimators': 794, 'max_depth': 11, 'min_samples_split': 43, 'min_samples_leaf': 57, 'criterion': 'entropy'}.
Trial 2188 finished with value: 0.6956521739130435 and parameters: {'n_estimators': 475, 'max_depth': 7, 'min_samples_split': 36, 'min_samples_leaf': 61, 'criterion': 'entropy'}.
Trial 2189 finished with value: 0.6630434782608695 and parameters: {'n_estimators': 774, 'max_depth': 20, 'min_samples_split': 31, 'min_samples_leaf': 53, 'criterion': 'entropy'}.
Trial 2190 finished with value: 0.7282608695652174 and parameters: {'n_estimators': 550, 'max_depth': 9, 'min_samples_split': 8, 'min_samples_leaf': 55, 'criterion': 'entropy'}.
Trial 2191 finished with value: 0.6630434782608695 and parameters: {'n_estimators': 528, 'max_depth': 60, 'min_samples_split': 26, 'min_samples_leaf': 52, 'criterion': 'entropy'}.
Trial 2192 finished with value: 0.7065217391304348 and parameters: {'n_estimators': 811, 'max_depth': 13, 'min_samples_split': 17, 'min_samples_leaf': 59, 'criterion': 'entropy'}.
Trial 2193 finished with value: 0.717391304347826 and parameters: {'n_estimators': 842, 'max_depth': 11, 'min_samples_split': 35, 'min_samples_leaf': 50, 'criterion': 'entropy'}.
Trial 2194 finished with value: 0.6630434782608695 and parameters: {'n_estimators': 922, 'max_depth': 6, 'min_samples_split': 30, 'min_samples_leaf': 47, 'criterion': 'gini'}.
Trial 2195 finished with value: 0.6956521739130435 and parameters: {'n_estimators': 789, 'max_depth': 17, 'min_samples_split': 24, 'min_samples_leaf': 56, 'criterion': 'entropy'}.
Trial 2196 finished with value: 0.6739130434782609 and parameters: {'n_estimators': 730, 'max_depth': 23, 'min_samples_split': 122, 'min_samples_leaf': 52, 'criterion': 'entropy'}.
Trial 2197 finished with value: 0.717391304347826 and parameters: {'n_estimators': 762, 'max_depth': 14, 'min_samples_split': 40, 'min_samples_leaf': 45, 'criterion': 'entropy'}.
Trial 2198 finished with value: 0.7065217391304348 and parameters: {'n_estimators': 881, 'max_depth': 9, 'min_samples_split': 177, 'min_samples_leaf': 49, 'criterion': 'entropy'}.
Trial 2199 finished with value: 0.7065217391304348 and parameters: {'n_estimators': 860, 'max_depth': 11, 'min_samples_split': 21, 'min_samples_leaf': 54, 'criterion': 'entropy'}.
Trial 2200 finished with value: 0.7282608695652174 and parameters: {'n_estimators': 803, 'max_depth': 8, 'min_samples_split': 28, 'min_samples_leaf': 58, 'criterion': 'entropy'}.
Trial 2201 finished with value: 0.7065217391304348 and parameters: {'n_estimators': 825, 'max_depth': 13, 'min_samples_split': 33, 'min_samples_leaf': 62, 'criterion': 'entropy'}.
Trial 2202 finished with value: 0.6413043478260869 and parameters: {'n_estimators': 746, 'max_depth': 5, 'min_samples_split': 12, 'min_samples_leaf': 51, 'criterion': 'entropy'}.
Trial 2203 finished with value: 0.7065217391304348 and parameters: {'n_estimators': 774, 'max_depth': 10, 'min_samples_split': 36, 'min_samples_leaf': 55, 'criterion': 'entropy'}.
Trial 2204 finished with value: 0.6956521739130435 and parameters: {'n_estimators': 708, 'max_depth': 15, 'min_samples_split': 25, 'min_samples_leaf': 48, 'criterion': 'entropy'}.
Trial 2205 finished with value: 0.7065217391304348 and parameters: {'n_estimators': 681, 'max_depth': 12, 'min_samples_split': 30, 'min_samples_leaf': 57, 'criterion': 'entropy'}.
Trial 2206 finished with value: 0.7065217391304348 and parameters: {'n_estimators': 794, 'max_depth': 8, 'min_samples_split': 48, 'min_samples_leaf': 53, 'criterion': 'entropy'}.
Trial 2207 finished with value: 0.717391304347826 and parameters: {'n_estimators': 835, 'max_depth': 10, 'min_samples_split': 105, 'min_samples_leaf': 43, 'criterion': 'entropy'}.
Trial 2208 finished with value: 0.7065217391304348 and parameters: {'n_estimators': 808, 'max_depth': 12, 'min_samples_split': 19, 'min_samples_leaf': 50, 'criterion': 'entropy'}.
Trial 2209 finished with value: 0.5978260869565217 and parameters: {'n_estimators': 504, 'max_depth': 8, 'min_samples_split': 39, 'min_samples_leaf': 27, 'criterion': 'entropy'}.
Trial 2210 finished with value: 0.7065217391304348 and parameters: {'n_estimators': 595, 'max_depth': 14, 'min_samples_split': 114, 'min_samples_leaf': 65, 'criterion': 'entropy'}.
Trial 2211 finished with value: 0.6739130434782609 and parameters: {'n_estimators': 774, 'max_depth': 17, 'min_samples_split': 97, 'min_samples_leaf': 59, 'criterion': 'entropy'}.
Trial 2212 finished with value: 0.6847826086956522 and parameters: {'n_estimators': 751, 'max_depth': 86, 'min_samples_split': 33, 'min_samples_leaf': 55, 'criterion': 'gini'}.
Trial 2213 finished with value: 0.6630434782608695 and parameters: {'n_estimators': 821, 'max_depth': 7, 'min_samples_split': 27, 'min_samples_leaf': 46, 'criterion': 'entropy'}.
Trial 2214 finished with value: 0.717391304347826 and parameters: {'n_estimators': 960, 'max_depth': 10, 'min_samples_split': 16, 'min_samples_leaf': 52, 'criterion': 'entropy'}.
Trial 2215 finished with value: 0.7065217391304348 and parameters: {'n_estimators': 562, 'max_depth': 12, 'min_samples_split': 43, 'min_samples_leaf': 49, 'criterion': 'entropy'}.
Trial 2216 finished with value: 0.6847826086956522 and parameters: {'n_estimators': 733, 'max_depth': 9, 'min_samples_split': 23, 'min_samples_leaf': 60, 'criterion': 'entropy'}.
Trial 2217 finished with value: 0.6847826086956522 and parameters: {'n_estimators': 789, 'max_depth': 15, 'min_samples_split': 30, 'min_samples_leaf': 57, 'criterion': 'entropy'}.
Trial 2218 finished with value: 0.6739130434782609 and parameters: {'n_estimators': 839, 'max_depth': 6, 'min_samples_split': 37, 'min_samples_leaf': 54, 'criterion': 'entropy'}.
Trial 2219 finished with value: 0.717391304347826 and parameters: {'n_estimators': 858, 'max_depth': 11, 'min_samples_split': 26, 'min_samples_leaf': 51, 'criterion': 'entropy'}.
Trial 2220 finished with value: 0.717391304347826 and parameters: {'n_estimators': 762, 'max_depth': 13, 'min_samples_split': 33, 'min_samples_leaf': 48, 'criterion': 'entropy'}.
Trial 2221 finished with value: 0.6847826086956522 and parameters: {'n_estimators': 804, 'max_depth': 9, 'min_samples_split': 22, 'min_samples_leaf': 53, 'criterion': 'entropy'}.
Trial 2222 finished with value: 0.6956521739130435 and parameters: {'n_estimators': 783, 'max_depth': 7, 'min_samples_split': 63, 'min_samples_leaf': 56, 'criterion': 'entropy'}.
Trial 2223 finished with value: 0.717391304347826 and parameters: {'n_estimators': 820, 'max_depth': 11, 'min_samples_split': 29, 'min_samples_leaf': 62, 'criterion': 'entropy'}.
Trial 2224 finished with value: 0.6956521739130435 and parameters: {'n_estimators': 519, 'max_depth': 13, 'min_samples_split': 14, 'min_samples_leaf': 50, 'criterion': 'entropy'}.
Trial 2225 finished with value: 0.7065217391304348 and parameters: {'n_estimators': 749, 'max_depth': 9, 'min_samples_split': 37, 'min_samples_leaf': 47, 'criterion': 'entropy'}.
Trial 2226 finished with value: 0.6521739130434783 and parameters: {'n_estimators': 618, 'max_depth': 5, 'min_samples_split': 33, 'min_samples_leaf': 59, 'criterion': 'entropy'}.
Trial 2227 finished with value: 0.6847826086956522 and parameters: {'n_estimators': 541, 'max_depth': 15, 'min_samples_split': 21, 'min_samples_leaf': 52, 'criterion': 'entropy'}.
Trial 2228 finished with value: 0.6956521739130435 and parameters: {'n_estimators': 847, 'max_depth': 11, 'min_samples_split': 157, 'min_samples_leaf': 55, 'criterion': 'entropy'}.
Trial 2229 finished with value: 0.6630434782608695 and parameters: {'n_estimators': 768, 'max_depth': 18, 'min_samples_split': 42, 'min_samples_leaf': 49, 'criterion': 'entropy'}.
Trial 2230 finished with value: 0.6847826086956522 and parameters: {'n_estimators': 809, 'max_depth': 7, 'min_samples_split': 27, 'min_samples_leaf': 57, 'criterion': 'gini'}.
Trial 2231 finished with value: 0.717391304347826 and parameters: {'n_estimators': 789, 'max_depth': 13, 'min_samples_split': 25, 'min_samples_leaf': 53, 'criterion': 'entropy'}.
Trial 2232 finished with value: 0.7065217391304348 and parameters: {'n_estimators': 724, 'max_depth': 9, 'min_samples_split': 17, 'min_samples_leaf': 45, 'criterion': 'entropy'}.
Trial 2233 finished with value: 0.7065217391304348 and parameters: {'n_estimators': 882, 'max_depth': 11, 'min_samples_split': 31, 'min_samples_leaf': 51, 'criterion': 'entropy'}.
Trial 2234 finished with value: 0.6847826086956522 and parameters: {'n_estimators': 828, 'max_depth': 16, 'min_samples_split': 36, 'min_samples_leaf': 60, 'criterion': 'entropy'}.
Trial 2235 finished with value: 0.717391304347826 and parameters: {'n_estimators': 801, 'max_depth': 8, 'min_samples_split': 23, 'min_samples_leaf': 54, 'criterion': 'entropy'}.
Trial 2236 finished with value: 0.7065217391304348 and parameters: {'n_estimators': 708, 'max_depth': 10, 'min_samples_split': 52, 'min_samples_leaf': 48, 'criterion': 'entropy'}.
Trial 2237 finished with value: 0.6739130434782609 and parameters: {'n_estimators': 771, 'max_depth': 66, 'min_samples_split': 29, 'min_samples_leaf': 58, 'criterion': 'entropy'}.
Trial 2238 finished with value: 0.7065217391304348 and parameters: {'n_estimators': 851, 'max_depth': 14, 'min_samples_split': 39, 'min_samples_leaf': 51, 'criterion': 'entropy'}.
Trial 2239 finished with value: 0.7065217391304348 and parameters: {'n_estimators': 817, 'max_depth': 12, 'min_samples_split': 45, 'min_samples_leaf': 56, 'criterion': 'entropy'}.
Trial 2240 finished with value: 0.6739130434782609 and parameters: {'n_estimators': 788, 'max_depth': 7, 'min_samples_split': 149, 'min_samples_leaf': 49, 'criterion': 'entropy'}.
Trial 2241 finished with value: 0.7065217391304348 and parameters: {'n_estimators': 909, 'max_depth': 10, 'min_samples_split': 33, 'min_samples_leaf': 46, 'criterion': 'entropy'}.
Trial 2242 finished with value: 0.6413043478260869 and parameters: {'n_estimators': 755, 'max_depth': 5, 'min_samples_split': 20, 'min_samples_leaf': 53, 'criterion': 'entropy'}.
Trial 2243 finished with value: 0.6956521739130435 and parameters: {'n_estimators': 571, 'max_depth': 12, 'min_samples_split': 117, 'min_samples_leaf': 64, 'criterion': 'entropy'}.
Trial 2244 finished with value: 0.6956521739130435 and parameters: {'n_estimators': 868, 'max_depth': 9, 'min_samples_split': 108, 'min_samples_leaf': 61, 'criterion': 'entropy'}.
Trial 2245 finished with value: 0.6739130434782609 and parameters: {'n_estimators': 828, 'max_depth': 14, 'min_samples_split': 26, 'min_samples_leaf': 55, 'criterion': 'entropy'}.
Trial 2246 finished with value: 0.6956521739130435 and parameters: {'n_estimators': 806, 'max_depth': 11, 'min_samples_split': 34, 'min_samples_leaf': 41, 'criterion': 'entropy'}.
Trial 2247 finished with value: 0.6739130434782609 and parameters: {'n_estimators': 726, 'max_depth': 7, 'min_samples_split': 30, 'min_samples_leaf': 51, 'criterion': 'entropy'}.
Trial 2248 finished with value: 0.6630434782608695 and parameters: {'n_estimators': 488, 'max_depth': 74, 'min_samples_split': 12, 'min_samples_leaf': 97, 'criterion': 'entropy'}.
Trial 2249 finished with value: 0.6956521739130435 and parameters: {'n_estimators': 775, 'max_depth': 13, 'min_samples_split': 18, 'min_samples_leaf': 57, 'criterion': 'gini'}.
Trial 2250 finished with value: 0.6630434782608695 and parameters: {'n_estimators': 740, 'max_depth': 16, 'min_samples_split': 102, 'min_samples_leaf': 50, 'criterion': 'entropy'}.
Trial 2251 finished with value: 0.6847826086956522 and parameters: {'n_estimators': 836, 'max_depth': 9, 'min_samples_split': 37, 'min_samples_leaf': 53, 'criterion': 'entropy'}.
Trial 2252 finished with value: 0.7065217391304348 and parameters: {'n_estimators': 791, 'max_depth': 11, 'min_samples_split': 24, 'min_samples_leaf': 47, 'criterion': 'entropy'}.
Trial 2253 finished with value: 0.6413043478260869 and parameters: {'n_estimators': 941, 'max_depth': 8, 'min_samples_split': 41, 'min_samples_leaf': 20, 'criterion': 'entropy'}.
Trial 2254 finished with value: 0.6739130434782609 and parameters: {'n_estimators': 549, 'max_depth': 45, 'min_samples_split': 28, 'min_samples_leaf': 59, 'criterion': 'entropy'}.
Trial 2255 finished with value: 0.6956521739130435 and parameters: {'n_estimators': 754, 'max_depth': 13, 'min_samples_split': 32, 'min_samples_leaf': 43, 'criterion': 'entropy'}.
Trial 2256 finished with value: 0.7065217391304348 and parameters: {'n_estimators': 814, 'max_depth': 10, 'min_samples_split': 167, 'min_samples_leaf': 55, 'criterion': 'entropy'}.
Trial 2257 finished with value: 0.6739130434782609 and parameters: {'n_estimators': 850, 'max_depth': 19, 'min_samples_split': 22, 'min_samples_leaf': 52, 'criterion': 'entropy'}.
Trial 2258 finished with value: 0.6956521739130435 and parameters: {'n_estimators': 775, 'max_depth': 15, 'min_samples_split': 2, 'min_samples_leaf': 48, 'criterion': 'entropy'}.
Trial 2259 finished with value: 0.6956521739130435 and parameters: {'n_estimators': 795, 'max_depth': 7, 'min_samples_split': 36, 'min_samples_leaf': 57, 'criterion': 'entropy'}.
Trial 2260 finished with value: 0.7065217391304348 and parameters: {'n_estimators': 824, 'max_depth': 12, 'min_samples_split': 27, 'min_samples_leaf': 50, 'criterion': 'entropy'}.
Trial 2261 finished with value: 0.6739130434782609 and parameters: {'n_estimators': 739, 'max_depth': 9, 'min_samples_split': 16, 'min_samples_leaf': 86, 'criterion': 'entropy'}.
Trial 2262 finished with value: 0.6630434782608695 and parameters: {'n_estimators': 807, 'max_depth': 31, 'min_samples_split': 31, 'min_samples_leaf': 54, 'criterion': 'entropy'}.
Trial 2263 finished with value: 0.6413043478260869 and parameters: {'n_estimators': 531, 'max_depth': 5, 'min_samples_split': 40, 'min_samples_leaf': 52, 'criterion': 'entropy'}.
Trial 2264 finished with value: 0.7065217391304348 and parameters: {'n_estimators': 758, 'max_depth': 11, 'min_samples_split': 20, 'min_samples_leaf': 45, 'criterion': 'entropy'}.
Trial 2265 finished with value: 0.7065217391304348 and parameters: {'n_estimators': 838, 'max_depth': 14, 'min_samples_split': 112, 'min_samples_leaf': 62, 'criterion': 'entropy'}.
