Trial 2266 finished with value: 0.6630434782608695 and parameters: {'n_estimators': 686, 'max_depth': 93, 'min_samples_split': 25, 'min_samples_leaf': 59, 'criterion': 'entropy'}.
Trial 2267 finished with value: 0.6956521739130435 and parameters: {'n_estimators': 872, 'max_depth': 8, 'min_samples_split': 34, 'min_samples_leaf': 49, 'criterion': 'entropy'}.
Trial 2268 finished with value: 0.7065217391304348 and parameters: {'n_estimators': 777, 'max_depth': 10, 'min_samples_split': 29, 'min_samples_leaf': 56, 'criterion': 'gini'}.
Trial 2269 finished with value: 0.6630434782608695 and parameters: {'n_estimators': 709, 'max_depth': 16, 'min_samples_split': 48, 'min_samples_leaf': 54, 'criterion': 'entropy'}.
Trial 2270 finished with value: 0.7065217391304348 and parameters: {'n_estimators': 597, 'max_depth': 12, 'min_samples_split': 44, 'min_samples_leaf': 51, 'criterion': 'entropy'}.
Trial 2271 finished with value: 0.6739130434782609 and parameters: {'n_estimators': 791, 'max_depth': 7, 'min_samples_split': 23, 'min_samples_leaf': 47, 'criterion': 'entropy'}.
Trial 2272 finished with value: 0.6847826086956522 and parameters: {'n_estimators': 814, 'max_depth': 10, 'min_samples_split': 35, 'min_samples_leaf': 76, 'criterion': 'entropy'}.
Trial 2273 finished with value: 0.717391304347826 and parameters: {'n_estimators': 668, 'max_depth': 13, 'min_samples_split': 9, 'min_samples_leaf': 58, 'criterion': 'entropy'}.
Trial 2274 finished with value: 0.6195652173913043 and parameters: {'n_estimators': 765, 'max_depth': 9, 'min_samples_split': 27, 'min_samples_leaf': 3, 'criterion': 'entropy'}.
Trial 2275 finished with value: 0.6739130434782609 and parameters: {'n_estimators': 647, 'max_depth': 6, 'min_samples_split': 38, 'min_samples_leaf': 53, 'criterion': 'entropy'}.
Trial 2276 finished with value: 0.7065217391304348 and parameters: {'n_estimators': 834, 'max_depth': 12, 'min_samples_split': 31, 'min_samples_leaf': 49, 'criterion': 'entropy'}.
Trial 2277 finished with value: 0.5978260869565217 and parameters: {'n_estimators': 458, 'max_depth': 8, 'min_samples_split': 19, 'min_samples_leaf': 23, 'criterion': 'entropy'}.
Trial 2278 finished with value: 0.6739130434782609 and parameters: {'n_estimators': 566, 'max_depth': 14, 'min_samples_split': 14, 'min_samples_leaf': 61, 'criterion': 'entropy'}.
Trial 2279 finished with value: 0.6847826086956522 and parameters: {'n_estimators': 734, 'max_depth': 10, 'min_samples_split': 127, 'min_samples_leaf': 56, 'criterion': 'entropy'}.
Trial 2280 finished with value: 0.6630434782608695 and parameters: {'n_estimators': 795, 'max_depth': 17, 'min_samples_split': 25, 'min_samples_leaf': 51, 'criterion': 'entropy'}.
Trial 2281 finished with value: 0.6956521739130435 and parameters: {'n_estimators': 862, 'max_depth': 11, 'min_samples_split': 78, 'min_samples_leaf': 55, 'criterion': 'entropy'}.
Trial 2282 finished with value: 0.6956521739130435 and parameters: {'n_estimators': 518, 'max_depth': 15, 'min_samples_split': 31, 'min_samples_leaf': 46, 'criterion': 'entropy'}.
Trial 2283 finished with value: 0.6739130434782609 and parameters: {'n_estimators': 819, 'max_depth': 6, 'min_samples_split': 41, 'min_samples_leaf': 52, 'criterion': 'entropy'}.
Trial 2284 finished with value: 0.6956521739130435 and parameters: {'n_estimators': 780, 'max_depth': 9, 'min_samples_split': 23, 'min_samples_leaf': 58, 'criterion': 'entropy'}.
Trial 2285 finished with value: 0.7065217391304348 and parameters: {'n_estimators': 850, 'max_depth': 12, 'min_samples_split': 35, 'min_samples_leaf': 49, 'criterion': 'entropy'}.
Trial 2286 finished with value: 0.6956521739130435 and parameters: {'n_estimators': 754, 'max_depth': 8, 'min_samples_split': 30, 'min_samples_leaf': 54, 'criterion': 'entropy'}.
Trial 2287 finished with value: 0.7065217391304348 and parameters: {'n_estimators': 797, 'max_depth': 13, 'min_samples_split': 19, 'min_samples_leaf': 50, 'criterion': 'gini'}.
Trial 2288 finished with value: 0.6956521739130435 and parameters: {'n_estimators': 718, 'max_depth': 10, 'min_samples_split': 83, 'min_samples_leaf': 60, 'criterion': 'entropy'}.
Trial 2289 finished with value: 0.6956521739130435 and parameters: {'n_estimators': 828, 'max_depth': 7, 'min_samples_split': 38, 'min_samples_leaf': 57, 'criterion': 'entropy'}.
Trial 2290 finished with value: 0.6413043478260869 and parameters: {'n_estimators': 892, 'max_depth': 5, 'min_samples_split': 26, 'min_samples_leaf': 47, 'criterion': 'entropy'}.
Trial 2291 finished with value: 0.7065217391304348 and parameters: {'n_estimators': 768, 'max_depth': 12, 'min_samples_split': 32, 'min_samples_leaf': 53, 'criterion': 'entropy'}.
Trial 2292 finished with value: 0.6956521739130435 and parameters: {'n_estimators': 807, 'max_depth': 14, 'min_samples_split': 22, 'min_samples_leaf': 63, 'criterion': 'entropy'}.
Trial 2293 finished with value: 0.6956521739130435 and parameters: {'n_estimators': 741, 'max_depth': 10, 'min_samples_split': 28, 'min_samples_leaf': 44, 'criterion': 'entropy'}.
Trial 2294 finished with value: 0.6630434782608695 and parameters: {'n_estimators': 846, 'max_depth': 21, 'min_samples_split': 34, 'min_samples_leaf': 55, 'criterion': 'entropy'}.
Trial 2295 finished with value: 0.6413043478260869 and parameters: {'n_estimators': 582, 'max_depth': 17, 'min_samples_split': 15, 'min_samples_leaf': 51, 'criterion': 'entropy'}.
Trial 2296 finished with value: 0.6956521739130435 and parameters: {'n_estimators': 786, 'max_depth': 48, 'min_samples_split': 44, 'min_samples_leaf': 48, 'criterion': 'entropy'}.
Trial 2297 finished with value: 0.7065217391304348 and parameters: {'n_estimators': 695, 'max_depth': 8, 'min_samples_split': 39, 'min_samples_leaf': 59, 'criterion': 'entropy'}.
Trial 2298 finished with value: 0.6956521739130435 and parameters: {'n_estimators': 811, 'max_depth': 11, 'min_samples_split': 121, 'min_samples_leaf': 52, 'criterion': 'entropy'}.
Trial 2299 finished with value: 0.6956521739130435 and parameters: {'n_estimators': 985, 'max_depth': 14, 'min_samples_split': 27, 'min_samples_leaf': 56, 'criterion': 'entropy'}.
Trial 2300 finished with value: 0.6847826086956522 and parameters: {'n_estimators': 542, 'max_depth': 9, 'min_samples_split': 22, 'min_samples_leaf': 50, 'criterion': 'entropy'}.
Trial 2301 finished with value: 0.6956521739130435 and parameters: {'n_estimators': 765, 'max_depth': 12, 'min_samples_split': 33, 'min_samples_leaf': 54, 'criterion': 'entropy'}.
Trial 2302 finished with value: 0.6630434782608695 and parameters: {'n_estimators': 833, 'max_depth': 7, 'min_samples_split': 28, 'min_samples_leaf': 46, 'criterion': 'entropy'}.
Trial 2303 finished with value: 0.717391304347826 and parameters: {'n_estimators': 500, 'max_depth': 10, 'min_samples_split': 36, 'min_samples_leaf': 57, 'criterion': 'entropy'}.
Trial 2304 finished with value: 0.6956521739130435 and parameters: {'n_estimators': 747, 'max_depth': 15, 'min_samples_split': 59, 'min_samples_leaf': 52, 'criterion': 'entropy'}.
Trial 2305 finished with value: 0.7065217391304348 and parameters: {'n_estimators': 781, 'max_depth': 11, 'min_samples_split': 18, 'min_samples_leaf': 49, 'criterion': 'gini'}.
Trial 2306 finished with value: 0.6956521739130435 and parameters: {'n_estimators': 807, 'max_depth': 13, 'min_samples_split': 109, 'min_samples_leaf': 61, 'criterion': 'entropy'}.
Trial 2307 finished with value: 0.717391304347826 and parameters: {'n_estimators': 862, 'max_depth': 8, 'min_samples_split': 31, 'min_samples_leaf': 54, 'criterion': 'entropy'}.
Trial 2308 finished with value: 0.6521739130434783 and parameters: {'n_estimators': 823, 'max_depth': 5, 'min_samples_split': 104, 'min_samples_leaf': 58, 'criterion': 'entropy'}.
Trial 2309 finished with value: 0.717391304347826 and parameters: {'n_estimators': 953, 'max_depth': 9, 'min_samples_split': 142, 'min_samples_leaf': 48, 'criterion': 'entropy'}.
Trial 2310 finished with value: 0.6847826086956522 and parameters: {'n_estimators': 796, 'max_depth': 16, 'min_samples_split': 24, 'min_samples_leaf': 51, 'criterion': 'entropy'}.
Trial 2311 finished with value: 0.6847826086956522 and parameters: {'n_estimators': 717, 'max_depth': 12, 'min_samples_split': 40, 'min_samples_leaf': 55, 'criterion': 'entropy'}.
Trial 2312 finished with value: 0.6847826086956522 and parameters: {'n_estimators': 916, 'max_depth': 10, 'min_samples_split': 98, 'min_samples_leaf': 72, 'criterion': 'entropy'}.
Trial 2313 finished with value: 0.6086956521739131 and parameters: {'n_estimators': 552, 'max_depth': 19, 'min_samples_split': 28, 'min_samples_leaf': 10, 'criterion': 'entropy'}.
Trial 2314 finished with value: 0.6847826086956522 and parameters: {'n_estimators': 774, 'max_depth': 14, 'min_samples_split': 35, 'min_samples_leaf': 53, 'criterion': 'entropy'}.
Trial 2315 finished with value: 0.7065217391304348 and parameters: {'n_estimators': 752, 'max_depth': 7, 'min_samples_split': 25, 'min_samples_leaf': 60, 'criterion': 'entropy'}.
Trial 2316 finished with value: 0.7065217391304348 and parameters: {'n_estimators': 847, 'max_depth': 11, 'min_samples_split': 19, 'min_samples_leaf': 45, 'criterion': 'entropy'}.
Trial 2317 finished with value: 0.6956521739130435 and parameters: {'n_estimators': 824, 'max_depth': 9, 'min_samples_split': 93, 'min_samples_leaf': 50, 'criterion': 'entropy'}.
Trial 2318 finished with value: 0.6956521739130435 and parameters: {'n_estimators': 793, 'max_depth': 13, 'min_samples_split': 31, 'min_samples_leaf': 56, 'criterion': 'entropy'}.
Trial 2319 finished with value: 0.6630434782608695 and parameters: {'n_estimators': 878, 'max_depth': 7, 'min_samples_split': 10, 'min_samples_leaf': 52, 'criterion': 'entropy'}.
Trial 2320 finished with value: 0.6956521739130435 and parameters: {'n_estimators': 733, 'max_depth': 52, 'min_samples_split': 37, 'min_samples_leaf': 48, 'criterion': 'entropy'}.
Trial 2321 finished with value: 0.717391304347826 and parameters: {'n_estimators': 813, 'max_depth': 11, 'min_samples_split': 68, 'min_samples_leaf': 58, 'criterion': 'entropy'}.
Trial 2322 finished with value: 0.6739130434782609 and parameters: {'n_estimators': 763, 'max_depth': 15, 'min_samples_split': 22, 'min_samples_leaf': 54, 'criterion': 'entropy'}.
Trial 2323 finished with value: 0.6956521739130435 and parameters: {'n_estimators': 837, 'max_depth': 9, 'min_samples_split': 45, 'min_samples_leaf': 50, 'criterion': 'entropy'}.
Trial 2324 finished with value: 0.6847826086956522 and parameters: {'n_estimators': 781, 'max_depth': 12, 'min_samples_split': 116, 'min_samples_leaf': 43, 'criterion': 'gini'}.
Trial 2325 finished with value: 0.6304347826086957 and parameters: {'n_estimators': 524, 'max_depth': 5, 'min_samples_split': 29, 'min_samples_leaf': 56, 'criterion': 'entropy'}.
Trial 2326 finished with value: 0.6739130434782609 and parameters: {'n_estimators': 801, 'max_depth': 8, 'min_samples_split': 15, 'min_samples_leaf': 52, 'criterion': 'entropy'}.
Trial 2327 finished with value: 0.6630434782608695 and parameters: {'n_estimators': 818, 'max_depth': 83, 'min_samples_split': 33, 'min_samples_leaf': 63, 'criterion': 'entropy'}.
Trial 2328 finished with value: 0.717391304347826 and parameters: {'n_estimators': 577, 'max_depth': 10, 'min_samples_split': 133, 'min_samples_leaf': 48, 'criterion': 'entropy'}.
Trial 2329 finished with value: 0.7065217391304348 and parameters: {'n_estimators': 747, 'max_depth': 13, 'min_samples_split': 25, 'min_samples_leaf': 66, 'criterion': 'entropy'}.
Trial 2330 finished with value: 0.6956521739130435 and parameters: {'n_estimators': 862, 'max_depth': 16, 'min_samples_split': 42, 'min_samples_leaf': 46, 'criterion': 'entropy'}.
Trial 2331 finished with value: 0.717391304347826 and parameters: {'n_estimators': 783, 'max_depth': 11, 'min_samples_split': 37, 'min_samples_leaf': 60, 'criterion': 'entropy'}.
Trial 2332 finished with value: 0.6630434782608695 and parameters: {'n_estimators': 835, 'max_depth': 98, 'min_samples_split': 21, 'min_samples_leaf': 54, 'criterion': 'entropy'}.
Trial 2333 finished with value: 0.6739130434782609 and parameters: {'n_estimators': 767, 'max_depth': 70, 'min_samples_split': 29, 'min_samples_leaf': 50, 'criterion': 'entropy'}.
Trial 2334 finished with value: 0.717391304347826 and parameters: {'n_estimators': 895, 'max_depth': 8, 'min_samples_split': 34, 'min_samples_leaf': 57, 'criterion': 'entropy'}.
Trial 2335 finished with value: 0.6956521739130435 and parameters: {'n_estimators': 607, 'max_depth': 14, 'min_samples_split': 25, 'min_samples_leaf': 52, 'criterion': 'entropy'}.
Trial 2336 finished with value: 0.6847826086956522 and parameters: {'n_estimators': 808, 'max_depth': 6, 'min_samples_split': 17, 'min_samples_leaf': 59, 'criterion': 'entropy'}.
Trial 2337 finished with value: 0.6630434782608695 and parameters: {'n_estimators': 726, 'max_depth': 18, 'min_samples_split': 29, 'min_samples_leaf': 54, 'criterion': 'entropy'}.
Trial 2338 finished with value: 0.717391304347826 and parameters: {'n_estimators': 699, 'max_depth': 10, 'min_samples_split': 39, 'min_samples_leaf': 49, 'criterion': 'entropy'}.
Trial 2339 finished with value: 0.7065217391304348 and parameters: {'n_estimators': 792, 'max_depth': 12, 'min_samples_split': 34, 'min_samples_leaf': 56, 'criterion': 'entropy'}.
Trial 2340 finished with value: 0.6847826086956522 and parameters: {'n_estimators': 763, 'max_depth': 7, 'min_samples_split': 22, 'min_samples_leaf': 47, 'criterion': 'entropy'}.
Trial 2341 finished with value: 0.717391304347826 and parameters: {'n_estimators': 559, 'max_depth': 10, 'min_samples_split': 50, 'min_samples_leaf': 51, 'criterion': 'entropy'}.
Trial 2342 finished with value: 0.717391304347826 and parameters: {'n_estimators': 826, 'max_depth': 13, 'min_samples_split': 26, 'min_samples_leaf': 53, 'criterion': 'entropy'}.
Trial 2343 finished with value: 0.7065217391304348 and parameters: {'n_estimators': 804, 'max_depth': 9, 'min_samples_split': 32, 'min_samples_leaf': 58, 'criterion': 'gini'}.
Trial 2344 finished with value: 0.6739130434782609 and parameters: {'n_estimators': 842, 'max_depth': 15, 'min_samples_split': 89, 'min_samples_leaf': 61, 'criterion': 'entropy'}.
Trial 2345 finished with value: 0.7065217391304348 and parameters: {'n_estimators': 539, 'max_depth': 11, 'min_samples_split': 12, 'min_samples_leaf': 50, 'criterion': 'entropy'}.
Trial 2346 finished with value: 0.6847826086956522 and parameters: {'n_estimators': 778, 'max_depth': 54, 'min_samples_split': 19, 'min_samples_leaf': 56, 'criterion': 'entropy'}.
Trial 2347 finished with value: 0.6739130434782609 and parameters: {'n_estimators': 742, 'max_depth': 7, 'min_samples_split': 42, 'min_samples_leaf': 53, 'criterion': 'entropy'}.
Trial 2348 finished with value: 0.7065217391304348 and parameters: {'n_estimators': 814, 'max_depth': 12, 'min_samples_split': 30, 'min_samples_leaf': 45, 'criterion': 'entropy'}.
Trial 2349 finished with value: 0.6956521739130435 and parameters: {'n_estimators': 856, 'max_depth': 10, 'min_samples_split': 36, 'min_samples_leaf': 48, 'criterion': 'entropy'}.
Trial 2350 finished with value: 0.7065217391304348 and parameters: {'n_estimators': 789, 'max_depth': 8, 'min_samples_split': 27, 'min_samples_leaf': 55, 'criterion': 'entropy'}.
Trial 2351 finished with value: 0.6521739130434783 and parameters: {'n_estimators': 759, 'max_depth': 5, 'min_samples_split': 22, 'min_samples_leaf': 51, 'criterion': 'entropy'}.
Trial 2352 finished with value: 0.6956521739130435 and parameters: {'n_estimators': 723, 'max_depth': 14, 'min_samples_split': 112, 'min_samples_leaf': 59, 'criterion': 'entropy'}.
Trial 2353 finished with value: 0.6956521739130435 and parameters: {'n_estimators': 634, 'max_depth': 17, 'min_samples_split': 39, 'min_samples_leaf': 49, 'criterion': 'entropy'}.
Trial 2354 finished with value: 0.717391304347826 and parameters: {'n_estimators': 828, 'max_depth': 12, 'min_samples_split': 7, 'min_samples_leaf': 52, 'criterion': 'entropy'}.
Trial 2355 finished with value: 0.717391304347826 and parameters: {'n_estimators': 514, 'max_depth': 8, 'min_samples_split': 32, 'min_samples_leaf': 62, 'criterion': 'entropy'}.
Trial 2356 finished with value: 0.717391304347826 and parameters: {'n_estimators': 877, 'max_depth': 10, 'min_samples_split': 73, 'min_samples_leaf': 57, 'criterion': 'entropy'}.
Trial 2357 finished with value: 0.7065217391304348 and parameters: {'n_estimators': 801, 'max_depth': 13, 'min_samples_split': 26, 'min_samples_leaf': 54, 'criterion': 'entropy'}.
Trial 2358 finished with value: 0.717391304347826 and parameters: {'n_estimators': 776, 'max_depth': 11, 'min_samples_split': 17, 'min_samples_leaf': 47, 'criterion': 'entropy'}.
Trial 2359 finished with value: 0.7065217391304348 and parameters: {'n_estimators': 847, 'max_depth': 9, 'min_samples_split': 47, 'min_samples_leaf': 50, 'criterion': 'entropy'}.
Trial 2360 finished with value: 0.6956521739130435 and parameters: {'n_estimators': 733, 'max_depth': 15, 'min_samples_split': 34, 'min_samples_leaf': 52, 'criterion': 'entropy'}.
Trial 2361 finished with value: 0.6956521739130435 and parameters: {'n_estimators': 154, 'max_depth': 6, 'min_samples_split': 30, 'min_samples_leaf': 56, 'criterion': 'entropy'}.
Trial 2362 finished with value: 0.7065217391304348 and parameters: {'n_estimators': 819, 'max_depth': 9, 'min_samples_split': 23, 'min_samples_leaf': 58, 'criterion': 'entropy'}.
Trial 2363 finished with value: 0.717391304347826 and parameters: {'n_estimators': 752, 'max_depth': 13, 'min_samples_split': 38, 'min_samples_leaf': 54, 'criterion': 'gini'}.
Trial 2364 finished with value: 0.7065217391304348 and parameters: {'n_estimators': 791, 'max_depth': 11, 'min_samples_split': 27, 'min_samples_leaf': 46, 'criterion': 'entropy'}.
Trial 2365 finished with value: 0.6739130434782609 and parameters: {'n_estimators': 566, 'max_depth': 7, 'min_samples_split': 20, 'min_samples_leaf': 43, 'criterion': 'entropy'}.
Trial 2366 finished with value: 0.6739130434782609 and parameters: {'n_estimators': 772, 'max_depth': 16, 'min_samples_split': 32, 'min_samples_leaf': 60, 'criterion': 'entropy'}.
Trial 2367 finished with value: 0.6956521739130435 and parameters: {'n_estimators': 838, 'max_depth': 12, 'min_samples_split': 124, 'min_samples_leaf': 49, 'criterion': 'entropy'}.
Trial 2368 finished with value: 0.6956521739130435 and parameters: {'n_estimators': 806, 'max_depth': 9, 'min_samples_split': 36, 'min_samples_leaf': 64, 'criterion': 'entropy'}.
Trial 2369 finished with value: 0.717391304347826 and parameters: {'n_estimators': 787, 'max_depth': 14, 'min_samples_split': 104, 'min_samples_leaf': 51, 'criterion': 'entropy'}.
Trial 2370 finished with value: 0.7065217391304348 and parameters: {'n_estimators': 823, 'max_depth': 11, 'min_samples_split': 192, 'min_samples_leaf': 55, 'criterion': 'entropy'}.
Trial 2371 finished with value: 0.6847826086956522 and parameters: {'n_estimators': 863, 'max_depth': 7, 'min_samples_split': 15, 'min_samples_leaf': 53, 'criterion': 'entropy'}.
Trial 2372 finished with value: 0.6413043478260869 and parameters: {'n_estimators': 750, 'max_depth': 5, 'min_samples_split': 41, 'min_samples_leaf': 47, 'criterion': 'entropy'}.
Trial 2373 finished with value: 0.7282608695652174 and parameters: {'n_estimators': 590, 'max_depth': 9, 'min_samples_split': 24, 'min_samples_leaf': 57, 'criterion': 'entropy'}.
Trial 2374 finished with value: 0.717391304347826 and parameters: {'n_estimators': 712, 'max_depth': 13, 'min_samples_split': 30, 'min_samples_leaf': 51, 'criterion': 'entropy'}.
Trial 2375 finished with value: 0.717391304347826 and parameters: {'n_estimators': 668, 'max_depth': 11, 'min_samples_split': 28, 'min_samples_leaf': 49, 'criterion': 'entropy'}.
Trial 2376 finished with value: 0.7065217391304348 and parameters: {'n_estimators': 802, 'max_depth': 8, 'min_samples_split': 34, 'min_samples_leaf': 53, 'criterion': 'entropy'}.
Trial 2377 finished with value: 0.6847826086956522 and parameters: {'n_estimators': 528, 'max_depth': 15, 'min_samples_split': 19, 'min_samples_leaf': 60, 'criterion': 'entropy'}.
Trial 2378 finished with value: 0.7065217391304348 and parameters: {'n_estimators': 768, 'max_depth': 10, 'min_samples_split': 24, 'min_samples_leaf': 40, 'criterion': 'entropy'}.
Trial 2379 finished with value: 0.7065217391304348 and parameters: {'n_estimators': 833, 'max_depth': 12, 'min_samples_split': 44, 'min_samples_leaf': 56, 'criterion': 'entropy'}.
Trial 2380 finished with value: 0.6847826086956522 and parameters: {'n_estimators': 734, 'max_depth': 18, 'min_samples_split': 37, 'min_samples_leaf': 45, 'criterion': 'gini'}.
Trial 2381 finished with value: 0.7282608695652174 and parameters: {'n_estimators': 483, 'max_depth': 8, 'min_samples_split': 31, 'min_samples_leaf': 58, 'criterion': 'entropy'}.
Trial 2382 finished with value: 0.7065217391304348 and parameters: {'n_estimators': 808, 'max_depth': 14, 'min_samples_split': 12, 'min_samples_leaf': 50, 'criterion': 'entropy'}.
Trial 2383 finished with value: 0.6630434782608695 and parameters: {'n_estimators': 851, 'max_depth': 42, 'min_samples_split': 27, 'min_samples_leaf': 55, 'criterion': 'entropy'}.
Trial 2384 finished with value: 0.6739130434782609 and parameters: {'n_estimators': 782, 'max_depth': 6, 'min_samples_split': 21, 'min_samples_leaf': 48, 'criterion': 'entropy'}.
Trial 2385 finished with value: 0.7282608695652174 and parameters: {'n_estimators': 554, 'max_depth': 10, 'min_samples_split': 107, 'min_samples_leaf': 52, 'criterion': 'entropy'}.
Trial 2386 finished with value: 0.6847826086956522 and parameters: {'n_estimators': 761, 'max_depth': 12, 'min_samples_split': 34, 'min_samples_leaf': 62, 'criterion': 'entropy'}.
Trial 2387 finished with value: 0.6956521739130435 and parameters: {'n_estimators': 813, 'max_depth': 9, 'min_samples_split': 40, 'min_samples_leaf': 54, 'criterion': 'entropy'}.
