Trial 5586 finished with value: 0.7065217391304348 and parameters: {'n_estimators': 287, 'max_depth': 12, 'min_samples_split': 15, 'min_samples_leaf': 66, 'criterion': 'gini'}.
Trial 5587 finished with value: 0.6956521739130435 and parameters: {'n_estimators': 271, 'max_depth': 15, 'min_samples_split': 38, 'min_samples_leaf': 60, 'criterion': 'entropy'}.
Trial 5588 finished with value: 0.6847826086956522 and parameters: {'n_estimators': 731, 'max_depth': 6, 'min_samples_split': 156, 'min_samples_leaf': 58, 'criterion': 'gini'}.
Trial 5589 finished with value: 0.6739130434782609 and parameters: {'n_estimators': 703, 'max_depth': 87, 'min_samples_split': 139, 'min_samples_leaf': 55, 'criterion': 'entropy'}.
Trial 5590 finished with value: 0.6847826086956522 and parameters: {'n_estimators': 291, 'max_depth': 31, 'min_samples_split': 24, 'min_samples_leaf': 62, 'criterion': 'gini'}.
Trial 5591 finished with value: 0.6630434782608695 and parameters: {'n_estimators': 923, 'max_depth': 19, 'min_samples_split': 21, 'min_samples_leaf': 60, 'criterion': 'entropy'}.
Trial 5592 finished with value: 0.7065217391304348 and parameters: {'n_estimators': 252, 'max_depth': 10, 'min_samples_split': 30, 'min_samples_leaf': 73, 'criterion': 'entropy'}.
Trial 5593 finished with value: 0.6956521739130435 and parameters: {'n_estimators': 310, 'max_depth': 13, 'min_samples_split': 36, 'min_samples_leaf': 56, 'criterion': 'gini'}.
Trial 5594 finished with value: 0.6847826086956522 and parameters: {'n_estimators': 342, 'max_depth': 67, 'min_samples_split': 127, 'min_samples_leaf': 65, 'criterion': 'entropy'}.
Trial 5595 finished with value: 0.6739130434782609 and parameters: {'n_estimators': 753, 'max_depth': 8, 'min_samples_split': 118, 'min_samples_leaf': 24, 'criterion': 'gini'}.
Trial 5596 finished with value: 0.7282608695652174 and parameters: {'n_estimators': 275, 'max_depth': 11, 'min_samples_split': 60, 'min_samples_leaf': 58, 'criterion': 'entropy'}.
Trial 5597 finished with value: 0.7065217391304348 and parameters: {'n_estimators': 231, 'max_depth': 9, 'min_samples_split': 148, 'min_samples_leaf': 53, 'criterion': 'gini'}.
Trial 5598 finished with value: 0.6739130434782609 and parameters: {'n_estimators': 300, 'max_depth': 5, 'min_samples_split': 26, 'min_samples_leaf': 70, 'criterion': 'entropy'}.
Trial 5599 finished with value: 0.6739130434782609 and parameters: {'n_estimators': 256, 'max_depth': 14, 'min_samples_split': 42, 'min_samples_leaf': 63, 'criterion': 'gini'}.
Trial 5600 finished with value: 0.6739130434782609 and parameters: {'n_estimators': 770, 'max_depth': 17, 'min_samples_split': 98, 'min_samples_leaf': 75, 'criterion': 'entropy'}.
Trial 5601 finished with value: 0.6956521739130435 and parameters: {'n_estimators': 285, 'max_depth': 12, 'min_samples_split': 48, 'min_samples_leaf': 59, 'criterion': 'gini'}.
Trial 5602 finished with value: 0.717391304347826 and parameters: {'n_estimators': 718, 'max_depth': 10, 'min_samples_split': 30, 'min_samples_leaf': 56, 'criterion': 'entropy'}.
Trial 5603 finished with value: 0.6956521739130435 and parameters: {'n_estimators': 325, 'max_depth': 7, 'min_samples_split': 142, 'min_samples_leaf': 61, 'criterion': 'gini'}.
Trial 5604 finished with value: 0.7065217391304348 and parameters: {'n_estimators': 363, 'max_depth': 9, 'min_samples_split': 108, 'min_samples_leaf': 81, 'criterion': 'entropy'}.
Trial 5605 finished with value: 0.6847826086956522 and parameters: {'n_estimators': 269, 'max_depth': 12, 'min_samples_split': 34, 'min_samples_leaf': 77, 'criterion': 'gini'}.
Trial 5606 finished with value: 0.6847826086956522 and parameters: {'n_estimators': 401, 'max_depth': 16, 'min_samples_split': 136, 'min_samples_leaf': 57, 'criterion': 'entropy'}.
Trial 5607 finished with value: 0.7065217391304348 and parameters: {'n_estimators': 241, 'max_depth': 14, 'min_samples_split': 18, 'min_samples_leaf': 60, 'criterion': 'gini'}.
Trial 5608 finished with value: 0.7282608695652174 and parameters: {'n_estimators': 310, 'max_depth': 11, 'min_samples_split': 37, 'min_samples_leaf': 54, 'criterion': 'entropy'}.
Trial 5609 finished with value: 0.6739130434782609 and parameters: {'n_estimators': 263, 'max_depth': 7, 'min_samples_split': 27, 'min_samples_leaf': 68, 'criterion': 'gini'}.
Trial 5610 finished with value: 0.7065217391304348 and parameters: {'n_estimators': 783, 'max_depth': 9, 'min_samples_split': 87, 'min_samples_leaf': 72, 'criterion': 'entropy'}.
Trial 5611 finished with value: 0.6956521739130435 and parameters: {'n_estimators': 285, 'max_depth': 13, 'min_samples_split': 32, 'min_samples_leaf': 64, 'criterion': 'gini'}.
Trial 5612 finished with value: 0.6847826086956522 and parameters: {'n_estimators': 217, 'max_depth': 11, 'min_samples_split': 145, 'min_samples_leaf': 58, 'criterion': 'entropy'}.
Trial 5613 finished with value: 0.6413043478260869 and parameters: {'n_estimators': 188, 'max_depth': 5, 'min_samples_split': 121, 'min_samples_leaf': 62, 'criterion': 'gini'}.
Trial 5614 finished with value: 0.7282608695652174 and parameters: {'n_estimators': 256, 'max_depth': 8, 'min_samples_split': 22, 'min_samples_leaf': 56, 'criterion': 'entropy'}.
Trial 5615 finished with value: 0.6847826086956522 and parameters: {'n_estimators': 758, 'max_depth': 15, 'min_samples_split': 11, 'min_samples_leaf': 59, 'criterion': 'gini'}.
Trial 5616 finished with value: 0.717391304347826 and parameters: {'n_estimators': 986, 'max_depth': 10, 'min_samples_split': 131, 'min_samples_leaf': 53, 'criterion': 'entropy'}.
Trial 5617 finished with value: 0.6956521739130435 and parameters: {'n_estimators': 692, 'max_depth': 12, 'min_samples_split': 52, 'min_samples_leaf': 61, 'criterion': 'gini'}.
Trial 5618 finished with value: 0.6739130434782609 and parameters: {'n_estimators': 304, 'max_depth': 7, 'min_samples_split': 42, 'min_samples_leaf': 55, 'criterion': 'entropy'}.
Trial 5619 finished with value: 0.6956521739130435 and parameters: {'n_estimators': 740, 'max_depth': 9, 'min_samples_split': 140, 'min_samples_leaf': 65, 'criterion': 'gini'}.
Trial 5620 finished with value: 0.6956521739130435 and parameters: {'n_estimators': 672, 'max_depth': 13, 'min_samples_split': 150, 'min_samples_leaf': 58, 'criterion': 'entropy'}.
Trial 5621 finished with value: 0.717391304347826 and parameters: {'n_estimators': 280, 'max_depth': 10, 'min_samples_split': 34, 'min_samples_leaf': 70, 'criterion': 'entropy'}.
Trial 5622 finished with value: 0.6739130434782609 and parameters: {'n_estimators': 892, 'max_depth': 16, 'min_samples_split': 39, 'min_samples_leaf': 73, 'criterion': 'gini'}.
Trial 5623 finished with value: 0.6630434782608695 and parameters: {'n_estimators': 331, 'max_depth': 6, 'min_samples_split': 24, 'min_samples_leaf': 63, 'criterion': 'entropy'}.
Trial 5624 finished with value: 0.7065217391304348 and parameters: {'n_estimators': 292, 'max_depth': 11, 'min_samples_split': 29, 'min_samples_leaf': 60, 'criterion': 'gini'}.
Trial 5625 finished with value: 0.7065217391304348 and parameters: {'n_estimators': 245, 'max_depth': 8, 'min_samples_split': 134, 'min_samples_leaf': 57, 'criterion': 'entropy'}.
Trial 5626 finished with value: 0.7065217391304348 and parameters: {'n_estimators': 267, 'max_depth': 12, 'min_samples_split': 93, 'min_samples_leaf': 67, 'criterion': 'gini'}.
Trial 5627 finished with value: 0.6739130434782609 and parameters: {'n_estimators': 722, 'max_depth': 14, 'min_samples_split': 34, 'min_samples_leaf': 76, 'criterion': 'entropy'}.
Trial 5628 finished with value: 0.7065217391304348 and parameters: {'n_estimators': 228, 'max_depth': 9, 'min_samples_split': 114, 'min_samples_leaf': 59, 'criterion': 'gini'}.
Trial 5629 finished with value: 0.6521739130434783 and parameters: {'n_estimators': 317, 'max_depth': 18, 'min_samples_split': 28, 'min_samples_leaf': 56, 'criterion': 'entropy'}.
Trial 5630 finished with value: 0.7065217391304348 and parameters: {'n_estimators': 607, 'max_depth': 7, 'min_samples_split': 45, 'min_samples_leaf': 62, 'criterion': 'gini'}.
Trial 5631 finished with value: 0.717391304347826 and parameters: {'n_estimators': 278, 'max_depth': 10, 'min_samples_split': 20, 'min_samples_leaf': 55, 'criterion': 'entropy'}.
Trial 5632 finished with value: 0.6847826086956522 and parameters: {'n_estimators': 765, 'max_depth': 14, 'min_samples_split': 127, 'min_samples_leaf': 60, 'criterion': 'gini'}.
Trial 5633 finished with value: 0.6847826086956522 and parameters: {'n_estimators': 292, 'max_depth': 12, 'min_samples_split': 37, 'min_samples_leaf': 85, 'criterion': 'entropy'}.
Trial 5634 finished with value: 0.6956521739130435 and parameters: {'n_estimators': 784, 'max_depth': 8, 'min_samples_split': 145, 'min_samples_leaf': 72, 'criterion': 'gini'}.
Trial 5635 finished with value: 0.7065217391304348 and parameters: {'n_estimators': 258, 'max_depth': 10, 'min_samples_split': 16, 'min_samples_leaf': 57, 'criterion': 'entropy'}.
Trial 5636 finished with value: 0.6304347826086957 and parameters: {'n_estimators': 238, 'max_depth': 5, 'min_samples_split': 139, 'min_samples_leaf': 53, 'criterion': 'gini'}.
Trial 5637 finished with value: 0.6956521739130435 and parameters: {'n_estimators': 304, 'max_depth': 15, 'min_samples_split': 70, 'min_samples_leaf': 69, 'criterion': 'entropy'}.
Trial 5638 finished with value: 0.7065217391304348 and parameters: {'n_estimators': 341, 'max_depth': 11, 'min_samples_split': 31, 'min_samples_leaf': 64, 'criterion': 'gini'}.
Trial 5639 finished with value: 0.7065217391304348 and parameters: {'n_estimators': 742, 'max_depth': 13, 'min_samples_split': 26, 'min_samples_leaf': 62, 'criterion': 'entropy'}.
Trial 5640 finished with value: 0.717391304347826 and parameters: {'n_estimators': 481, 'max_depth': 9, 'min_samples_split': 40, 'min_samples_leaf': 74, 'criterion': 'gini'}.
Trial 5641 finished with value: 0.6847826086956522 and parameters: {'n_estimators': 271, 'max_depth': 7, 'min_samples_split': 153, 'min_samples_leaf': 59, 'criterion': 'entropy'}.
Trial 5642 finished with value: 0.6847826086956522 and parameters: {'n_estimators': 178, 'max_depth': 11, 'min_samples_split': 33, 'min_samples_leaf': 66, 'criterion': 'gini'}.
Trial 5643 finished with value: 0.6847826086956522 and parameters: {'n_estimators': 287, 'max_depth': 16, 'min_samples_split': 22, 'min_samples_leaf': 58, 'criterion': 'entropy'}.
Trial 5644 finished with value: 0.6956521739130435 and parameters: {'n_estimators': 253, 'max_depth': 13, 'min_samples_split': 143, 'min_samples_leaf': 61, 'criterion': 'gini'}.
Trial 5645 finished with value: 0.7065217391304348 and parameters: {'n_estimators': 316, 'max_depth': 9, 'min_samples_split': 118, 'min_samples_leaf': 54, 'criterion': 'entropy'}.
Trial 5646 finished with value: 0.6847826086956522 and parameters: {'n_estimators': 273, 'max_depth': 20, 'min_samples_split': 105, 'min_samples_leaf': 56, 'criterion': 'gini'}.
Trial 5647 finished with value: 0.6630434782608695 and parameters: {'n_estimators': 216, 'max_depth': 6, 'min_samples_split': 37, 'min_samples_leaf': 60, 'criterion': 'entropy'}.
Trial 5648 finished with value: 0.7282608695652174 and parameters: {'n_estimators': 302, 'max_depth': 11, 'min_samples_split': 137, 'min_samples_leaf': 57, 'criterion': 'entropy'}.
Trial 5649 finished with value: 0.717391304347826 and parameters: {'n_estimators': 431, 'max_depth': 8, 'min_samples_split': 29, 'min_samples_leaf': 63, 'criterion': 'gini'}.
Trial 5650 finished with value: 0.6847826086956522 and parameters: {'n_estimators': 935, 'max_depth': 58, 'min_samples_split': 43, 'min_samples_leaf': 68, 'criterion': 'entropy'}.
Trial 5651 finished with value: 0.6630434782608695 and parameters: {'n_estimators': 238, 'max_depth': 13, 'min_samples_split': 149, 'min_samples_leaf': 8, 'criterion': 'gini'}.
Trial 5652 finished with value: 0.717391304347826 and parameters: {'n_estimators': 961, 'max_depth': 10, 'min_samples_split': 32, 'min_samples_leaf': 59, 'criterion': 'entropy'}.
Trial 5653 finished with value: 0.6847826086956522 and parameters: {'n_estimators': 258, 'max_depth': 7, 'min_samples_split': 25, 'min_samples_leaf': 71, 'criterion': 'gini'}.
Trial 5654 finished with value: 0.6956521739130435 and parameters: {'n_estimators': 767, 'max_depth': 15, 'min_samples_split': 129, 'min_samples_leaf': 53, 'criterion': 'entropy'}.
Trial 5655 finished with value: 0.6739130434782609 and parameters: {'n_estimators': 728, 'max_depth': 5, 'min_samples_split': 122, 'min_samples_leaf': 75, 'criterion': 'gini'}.
Trial 5656 finished with value: 0.6956521739130435 and parameters: {'n_estimators': 282, 'max_depth': 12, 'min_samples_split': 133, 'min_samples_leaf': 55, 'criterion': 'entropy'}.
Trial 5657 finished with value: 0.6739130434782609 and parameters: {'n_estimators': 750, 'max_depth': 9, 'min_samples_split': 36, 'min_samples_leaf': 65, 'criterion': 'gini'}.
Trial 5658 finished with value: 0.717391304347826 and parameters: {'n_estimators': 785, 'max_depth': 11, 'min_samples_split': 30, 'min_samples_leaf': 58, 'criterion': 'entropy'}.
Trial 5659 finished with value: 0.6956521739130435 and parameters: {'n_estimators': 383, 'max_depth': 14, 'min_samples_split': 18, 'min_samples_leaf': 61, 'criterion': 'gini'}.
Trial 5660 finished with value: 0.717391304347826 and parameters: {'n_estimators': 356, 'max_depth': 8, 'min_samples_split': 79, 'min_samples_leaf': 57, 'criterion': 'entropy'}.
Trial 5661 finished with value: 0.6956521739130435 and parameters: {'n_estimators': 330, 'max_depth': 10, 'min_samples_split': 25, 'min_samples_leaf': 63, 'criterion': 'gini'}.
Trial 5662 finished with value: 0.6956521739130435 and parameters: {'n_estimators': 155, 'max_depth': 12, 'min_samples_split': 142, 'min_samples_leaf': 60, 'criterion': 'entropy'}.
Trial 5663 finished with value: 0.6739130434782609 and parameters: {'n_estimators': 708, 'max_depth': 91, 'min_samples_split': 41, 'min_samples_leaf': 72, 'criterion': 'gini'}.
Trial 5664 finished with value: 0.6630434782608695 and parameters: {'n_estimators': 300, 'max_depth': 17, 'min_samples_split': 14, 'min_samples_leaf': 55, 'criterion': 'entropy'}.
Trial 5665 finished with value: 0.7065217391304348 and parameters: {'n_estimators': 626, 'max_depth': 7, 'min_samples_split': 48, 'min_samples_leaf': 78, 'criterion': 'gini'}.
Trial 5666 finished with value: 0.7282608695652174 and parameters: {'n_estimators': 264, 'max_depth': 9, 'min_samples_split': 147, 'min_samples_leaf': 58, 'criterion': 'entropy'}.
Trial 5667 finished with value: 0.6847826086956522 and parameters: {'n_estimators': 288, 'max_depth': 14, 'min_samples_split': 2, 'min_samples_leaf': 62, 'criterion': 'gini'}.
Trial 5668 finished with value: 0.7282608695652174 and parameters: {'n_estimators': 242, 'max_depth': 11, 'min_samples_split': 34, 'min_samples_leaf': 53, 'criterion': 'entropy'}.
Trial 5669 finished with value: 0.6304347826086957 and parameters: {'n_estimators': 319, 'max_depth': 5, 'min_samples_split': 22, 'min_samples_leaf': 60, 'criterion': 'gini'}.
Trial 5670 finished with value: 0.6956521739130435 and parameters: {'n_estimators': 269, 'max_depth': 9, 'min_samples_split': 138, 'min_samples_leaf': 66, 'criterion': 'entropy'}.
Trial 5671 finished with value: 0.7065217391304348 and parameters: {'n_estimators': 251, 'max_depth': 13, 'min_samples_split': 28, 'min_samples_leaf': 70, 'criterion': 'gini'}.
Trial 5672 finished with value: 0.6739130434782609 and parameters: {'n_estimators': 118, 'max_depth': 7, 'min_samples_split': 39, 'min_samples_leaf': 56, 'criterion': 'entropy'}.
Trial 5673 finished with value: 0.7065217391304348 and parameters: {'n_estimators': 297, 'max_depth': 12, 'min_samples_split': 32, 'min_samples_leaf': 74, 'criterion': 'gini'}.
Trial 5674 finished with value: 0.6847826086956522 and parameters: {'n_estimators': 276, 'max_depth': 22, 'min_samples_split': 36, 'min_samples_leaf': 59, 'criterion': 'entropy'}.
Trial 5675 finished with value: 0.6847826086956522 and parameters: {'n_estimators': 212, 'max_depth': 16, 'min_samples_split': 112, 'min_samples_leaf': 61, 'criterion': 'gini'}.
Trial 5676 finished with value: 0.7065217391304348 and parameters: {'n_estimators': 235, 'max_depth': 10, 'min_samples_split': 125, 'min_samples_leaf': 57, 'criterion': 'entropy'}.
Trial 5677 finished with value: 0.717391304347826 and parameters: {'n_estimators': 749, 'max_depth': 8, 'min_samples_split': 45, 'min_samples_leaf': 68, 'criterion': 'entropy'}.
Trial 5678 finished with value: 0.6847826086956522 and parameters: {'n_estimators': 782, 'max_depth': 14, 'min_samples_split': 27, 'min_samples_leaf': 54, 'criterion': 'gini'}.
Trial 5679 finished with value: 0.6956521739130435 and parameters: {'n_estimators': 307, 'max_depth': 11, 'min_samples_split': 135, 'min_samples_leaf': 58, 'criterion': 'entropy'}.
Trial 5680 finished with value: 0.6739130434782609 and parameters: {'n_estimators': 262, 'max_depth': 18, 'min_samples_split': 145, 'min_samples_leaf': 62, 'criterion': 'gini'}.
Trial 5681 finished with value: 0.6956521739130435 and parameters: {'n_estimators': 284, 'max_depth': 6, 'min_samples_split': 21, 'min_samples_leaf': 94, 'criterion': 'entropy'}.
Trial 5682 finished with value: 0.6739130434782609 and parameters: {'n_estimators': 764, 'max_depth': 9, 'min_samples_split': 31, 'min_samples_leaf': 65, 'criterion': 'gini'}.
Trial 5683 finished with value: 0.6847826086956522 and parameters: {'n_estimators': 199, 'max_depth': 12, 'min_samples_split': 39, 'min_samples_leaf': 76, 'criterion': 'entropy'}.
Trial 5684 finished with value: 0.6739130434782609 and parameters: {'n_estimators': 320, 'max_depth': 74, 'min_samples_split': 139, 'min_samples_leaf': 55, 'criterion': 'gini'}.
Trial 5685 finished with value: 0.717391304347826 and parameters: {'n_estimators': 250, 'max_depth': 10, 'min_samples_split': 57, 'min_samples_leaf': 60, 'criterion': 'entropy'}.
Trial 5686 finished with value: 0.6956521739130435 and parameters: {'n_estimators': 726, 'max_depth': 15, 'min_samples_split': 116, 'min_samples_leaf': 72, 'criterion': 'gini'}.
Trial 5687 finished with value: 0.6847826086956522 and parameters: {'n_estimators': 287, 'max_depth': 7, 'min_samples_split': 130, 'min_samples_leaf': 63, 'criterion': 'entropy'}.
Trial 5688 finished with value: 0.6956521739130435 and parameters: {'n_estimators': 228, 'max_depth': 13, 'min_samples_split': 35, 'min_samples_leaf': 57, 'criterion': 'gini'}.
Trial 5689 finished with value: 0.7065217391304348 and parameters: {'n_estimators': 271, 'max_depth': 9, 'min_samples_split': 158, 'min_samples_leaf': 59, 'criterion': 'entropy'}.
Trial 5690 finished with value: 0.717391304347826 and parameters: {'n_estimators': 337, 'max_depth': 12, 'min_samples_split': 150, 'min_samples_leaf': 53, 'criterion': 'gini'}.
Trial 5691 finished with value: 0.7065217391304348 and parameters: {'n_estimators': 305, 'max_depth': 8, 'min_samples_split': 27, 'min_samples_leaf': 70, 'criterion': 'entropy'}.
Trial 5692 finished with value: 0.6956521739130435 and parameters: {'n_estimators': 698, 'max_depth': 71, 'min_samples_split': 141, 'min_samples_leaf': 64, 'criterion': 'gini'}.
Trial 5693 finished with value: 0.6521739130434783 and parameters: {'n_estimators': 132, 'max_depth': 80, 'min_samples_split': 18, 'min_samples_leaf': 56, 'criterion': 'entropy'}.
Trial 5694 finished with value: 0.7065217391304348 and parameters: {'n_estimators': 261, 'max_depth': 11, 'min_samples_split': 9, 'min_samples_leaf': 60, 'criterion': 'gini'}.
Trial 5695 finished with value: 0.6739130434782609 and parameters: {'n_estimators': 290, 'max_depth': 5, 'min_samples_split': 31, 'min_samples_leaf': 74, 'criterion': 'entropy'}.
Trial 5696 finished with value: 0.6739130434782609 and parameters: {'n_estimators': 242, 'max_depth': 15, 'min_samples_split': 23, 'min_samples_leaf': 58, 'criterion': 'gini'}.
Trial 5697 finished with value: 0.6956521739130435 and parameters: {'n_estimators': 747, 'max_depth': 10, 'min_samples_split': 42, 'min_samples_leaf': 67, 'criterion': 'entropy'}.
Trial 5698 finished with value: 0.6847826086956522 and parameters: {'n_estimators': 280, 'max_depth': 7, 'min_samples_split': 38, 'min_samples_leaf': 61, 'criterion': 'gini'}.
Trial 5699 finished with value: 0.6956521739130435 and parameters: {'n_estimators': 774, 'max_depth': 11, 'min_samples_split': 121, 'min_samples_leaf': 55, 'criterion': 'entropy'}.
Trial 5700 finished with value: 0.6739130434782609 and parameters: {'n_estimators': 257, 'max_depth': 13, 'min_samples_split': 34, 'min_samples_leaf': 57, 'criterion': 'gini'}.
Trial 5701 finished with value: 0.7065217391304348 and parameters: {'n_estimators': 318, 'max_depth': 9, 'min_samples_split': 144, 'min_samples_leaf': 63, 'criterion': 'entropy'}.
Trial 5702 finished with value: 0.6739130434782609 and parameters: {'n_estimators': 302, 'max_depth': 17, 'min_samples_split': 134, 'min_samples_leaf': 61, 'criterion': 'gini'}.
Trial 5703 finished with value: 0.6956521739130435 and parameters: {'n_estimators': 275, 'max_depth': 7, 'min_samples_split': 27, 'min_samples_leaf': 59, 'criterion': 'entropy'}.
Trial 5704 finished with value: 0.6847826086956522 and parameters: {'n_estimators': 722, 'max_depth': 14, 'min_samples_split': 31, 'min_samples_leaf': 53, 'criterion': 'entropy'}.
Trial 5705 finished with value: 0.6847826086956522 and parameters: {'n_estimators': 344, 'max_depth': 11, 'min_samples_split': 25, 'min_samples_leaf': 71, 'criterion': 'gini'}.
Trial 5706 finished with value: 0.6739130434782609 and parameters: {'n_estimators': 220, 'max_depth': 9, 'min_samples_split': 155, 'min_samples_leaf': 77, 'criterion': 'entropy'}.
Trial 5707 finished with value: 0.6956521739130435 and parameters: {'n_estimators': 295, 'max_depth': 13, 'min_samples_split': 170, 'min_samples_leaf': 69, 'criterion': 'gini'}.
Trial 5708 finished with value: 0.6304347826086957 and parameters: {'n_estimators': 244, 'max_depth': 5, 'min_samples_split': 125, 'min_samples_leaf': 57, 'criterion': 'entropy'}.
