Trial 8657 finished with value: 0.6956521739130435 and parameters: {'n_estimators': 267, 'max_depth': 14, 'min_samples_split': 22, 'min_samples_leaf': 56, 'criterion': 'entropy'}.
Trial 8658 finished with value: 0.7282608695652174 and parameters: {'n_estimators': 297, 'max_depth': 9, 'min_samples_split': 17, 'min_samples_leaf': 54, 'criterion': 'entropy'}.
Trial 8659 finished with value: 0.6847826086956522 and parameters: {'n_estimators': 284, 'max_depth': 18, 'min_samples_split': 112, 'min_samples_leaf': 58, 'criterion': 'entropy'}.
Trial 8660 finished with value: 0.7065217391304348 and parameters: {'n_estimators': 792, 'max_depth': 7, 'min_samples_split': 25, 'min_samples_leaf': 61, 'criterion': 'entropy'}.
Trial 8661 finished with value: 0.7282608695652174 and parameters: {'n_estimators': 262, 'max_depth': 11, 'min_samples_split': 88, 'min_samples_leaf': 56, 'criterion': 'entropy'}.
Trial 8662 finished with value: 0.6956521739130435 and parameters: {'n_estimators': 320, 'max_depth': 13, 'min_samples_split': 33, 'min_samples_leaf': 59, 'criterion': 'entropy'}.
Trial 8663 finished with value: 0.6956521739130435 and parameters: {'n_estimators': 703, 'max_depth': 9, 'min_samples_split': 41, 'min_samples_leaf': 63, 'criterion': 'entropy'}.
Trial 8664 finished with value: 0.6847826086956522 and parameters: {'n_estimators': 307, 'max_depth': 15, 'min_samples_split': 32, 'min_samples_leaf': 54, 'criterion': 'entropy'}.
Trial 8665 finished with value: 0.6521739130434783 and parameters: {'n_estimators': 205, 'max_depth': 5, 'min_samples_split': 49, 'min_samples_leaf': 57, 'criterion': 'entropy'}.
Trial 8666 finished with value: 0.717391304347826 and parameters: {'n_estimators': 909, 'max_depth': 11, 'min_samples_split': 11, 'min_samples_leaf': 61, 'criterion': 'entropy'}.
Trial 8667 finished with value: 0.6847826086956522 and parameters: {'n_estimators': 252, 'max_depth': 7, 'min_samples_split': 192, 'min_samples_leaf': 59, 'criterion': 'entropy'}.
Trial 8668 finished with value: 0.7282608695652174 and parameters: {'n_estimators': 340, 'max_depth': 9, 'min_samples_split': 27, 'min_samples_leaf': 57, 'criterion': 'entropy'}.
Trial 8669 finished with value: 0.6086956521739131 and parameters: {'n_estimators': 278, 'max_depth': 12, 'min_samples_split': 38, 'min_samples_leaf': 20, 'criterion': 'entropy'}.
Trial 8670 finished with value: 0.6739130434782609 and parameters: {'n_estimators': 399, 'max_depth': 17, 'min_samples_split': 28, 'min_samples_leaf': 50, 'criterion': 'entropy'}.
Trial 8671 finished with value: 0.6956521739130435 and parameters: {'n_estimators': 817, 'max_depth': 10, 'min_samples_split': 105, 'min_samples_leaf': 55, 'criterion': 'entropy'}.
Trial 8672 finished with value: 0.6847826086956522 and parameters: {'n_estimators': 859, 'max_depth': 73, 'min_samples_split': 36, 'min_samples_leaf': 62, 'criterion': 'entropy'}.
Trial 8673 finished with value: 0.6956521739130435 and parameters: {'n_estimators': 722, 'max_depth': 13, 'min_samples_split': 46, 'min_samples_leaf': 52, 'criterion': 'entropy'}.
Trial 8674 finished with value: 0.7065217391304348 and parameters: {'n_estimators': 745, 'max_depth': 7, 'min_samples_split': 23, 'min_samples_leaf': 60, 'criterion': 'entropy'}.
Trial 8675 finished with value: 0.6847826086956522 and parameters: {'n_estimators': 287, 'max_depth': 15, 'min_samples_split': 32, 'min_samples_leaf': 58, 'criterion': 'entropy'}.
Trial 8676 finished with value: 0.717391304347826 and parameters: {'n_estimators': 256, 'max_depth': 10, 'min_samples_split': 16, 'min_samples_leaf': 55, 'criterion': 'entropy'}.
Trial 8677 finished with value: 0.6630434782608695 and parameters: {'n_estimators': 766, 'max_depth': 22, 'min_samples_split': 43, 'min_samples_leaf': 63, 'criterion': 'entropy'}.
Trial 8678 finished with value: 0.717391304347826 and parameters: {'n_estimators': 307, 'max_depth': 8, 'min_samples_split': 29, 'min_samples_leaf': 57, 'criterion': 'entropy'}.
Trial 8679 finished with value: 0.7282608695652174 and parameters: {'n_estimators': 279, 'max_depth': 12, 'min_samples_split': 118, 'min_samples_leaf': 60, 'criterion': 'entropy'}.
Trial 8680 finished with value: 0.7282608695652174 and parameters: {'n_estimators': 327, 'max_depth': 10, 'min_samples_split': 38, 'min_samples_leaf': 52, 'criterion': 'entropy'}.
Trial 8681 finished with value: 0.6630434782608695 and parameters: {'n_estimators': 259, 'max_depth': 6, 'min_samples_split': 33, 'min_samples_leaf': 54, 'criterion': 'entropy'}.
Trial 8682 finished with value: 0.6739130434782609 and parameters: {'n_estimators': 112, 'max_depth': 14, 'min_samples_split': 20, 'min_samples_leaf': 59, 'criterion': 'entropy'}.
Trial 8683 finished with value: 0.6630434782608695 and parameters: {'n_estimators': 301, 'max_depth': 85, 'min_samples_split': 40, 'min_samples_leaf': 61, 'criterion': 'entropy'}.
Trial 8684 finished with value: 0.7282608695652174 and parameters: {'n_estimators': 777, 'max_depth': 8, 'min_samples_split': 26, 'min_samples_leaf': 57, 'criterion': 'entropy'}.
Trial 8685 finished with value: 0.6630434782608695 and parameters: {'n_estimators': 548, 'max_depth': 29, 'min_samples_split': 35, 'min_samples_leaf': 56, 'criterion': 'entropy'}.
Trial 8686 finished with value: 0.6956521739130435 and parameters: {'n_estimators': 358, 'max_depth': 12, 'min_samples_split': 52, 'min_samples_leaf': 62, 'criterion': 'entropy'}.
Trial 8687 finished with value: 0.6739130434782609 and parameters: {'n_estimators': 231, 'max_depth': 16, 'min_samples_split': 30, 'min_samples_leaf': 58, 'criterion': 'entropy'}.
Trial 8688 finished with value: 0.7282608695652174 and parameters: {'n_estimators': 271, 'max_depth': 10, 'min_samples_split': 24, 'min_samples_leaf': 53, 'criterion': 'entropy'}.
Trial 8689 finished with value: 0.6630434782608695 and parameters: {'n_estimators': 735, 'max_depth': 12, 'min_samples_split': 41, 'min_samples_leaf': 96, 'criterion': 'entropy'}.
Trial 8690 finished with value: 0.6195652173913043 and parameters: {'n_estimators': 137, 'max_depth': 5, 'min_samples_split': 36, 'min_samples_leaf': 60, 'criterion': 'entropy'}.
Trial 8691 finished with value: 0.717391304347826 and parameters: {'n_estimators': 289, 'max_depth': 9, 'min_samples_split': 114, 'min_samples_leaf': 55, 'criterion': 'entropy'}.
Trial 8692 finished with value: 0.6847826086956522 and parameters: {'n_estimators': 252, 'max_depth': 14, 'min_samples_split': 29, 'min_samples_leaf': 58, 'criterion': 'entropy'}.
Trial 8693 finished with value: 0.6739130434782609 and parameters: {'n_estimators': 757, 'max_depth': 64, 'min_samples_split': 21, 'min_samples_leaf': 62, 'criterion': 'entropy'}.
Trial 8694 finished with value: 0.7065217391304348 and parameters: {'n_estimators': 317, 'max_depth': 8, 'min_samples_split': 32, 'min_samples_leaf': 63, 'criterion': 'entropy'}.
Trial 8695 finished with value: 0.7065217391304348 and parameters: {'n_estimators': 937, 'max_depth': 11, 'min_samples_split': 26, 'min_samples_leaf': 56, 'criterion': 'entropy'}.
Trial 8696 finished with value: 0.6739130434782609 and parameters: {'n_estimators': 882, 'max_depth': 7, 'min_samples_split': 48, 'min_samples_leaf': 49, 'criterion': 'entropy'}.
Trial 8697 finished with value: 0.6956521739130435 and parameters: {'n_estimators': 452, 'max_depth': 13, 'min_samples_split': 37, 'min_samples_leaf': 60, 'criterion': 'entropy'}.
Trial 8698 finished with value: 0.6739130434782609 and parameters: {'n_estimators': 275, 'max_depth': 19, 'min_samples_split': 93, 'min_samples_leaf': 54, 'criterion': 'entropy'}.
Trial 8699 finished with value: 0.7065217391304348 and parameters: {'n_estimators': 796, 'max_depth': 10, 'min_samples_split': 42, 'min_samples_leaf': 58, 'criterion': 'entropy'}.
Trial 8700 finished with value: 0.6630434782608695 and parameters: {'n_estimators': 715, 'max_depth': 37, 'min_samples_split': 7, 'min_samples_leaf': 60, 'criterion': 'entropy'}.
Trial 8701 finished with value: 0.6521739130434783 and parameters: {'n_estimators': 184, 'max_depth': 16, 'min_samples_split': 15, 'min_samples_leaf': 56, 'criterion': 'entropy'}.
Trial 8702 finished with value: 0.717391304347826 and parameters: {'n_estimators': 301, 'max_depth': 11, 'min_samples_split': 71, 'min_samples_leaf': 58, 'criterion': 'entropy'}.
Trial 8703 finished with value: 0.7065217391304348 and parameters: {'n_estimators': 270, 'max_depth': 8, 'min_samples_split': 34, 'min_samples_leaf': 52, 'criterion': 'entropy'}.
Trial 8704 finished with value: 0.7065217391304348 and parameters: {'n_estimators': 238, 'max_depth': 13, 'min_samples_split': 29, 'min_samples_leaf': 63, 'criterion': 'entropy'}.
Trial 8705 finished with value: 0.6086956521739131 and parameters: {'n_estimators': 289, 'max_depth': 6, 'min_samples_split': 45, 'min_samples_leaf': 40, 'criterion': 'entropy'}.
Trial 8706 finished with value: 0.717391304347826 and parameters: {'n_estimators': 212, 'max_depth': 9, 'min_samples_split': 21, 'min_samples_leaf': 61, 'criterion': 'entropy'}.
Trial 8707 finished with value: 0.717391304347826 and parameters: {'n_estimators': 251, 'max_depth': 11, 'min_samples_split': 32, 'min_samples_leaf': 54, 'criterion': 'entropy'}.
Trial 8708 finished with value: 0.6847826086956522 and parameters: {'n_estimators': 325, 'max_depth': 40, 'min_samples_split': 100, 'min_samples_leaf': 59, 'criterion': 'entropy'}.
Trial 8709 finished with value: 0.6956521739130435 and parameters: {'n_estimators': 341, 'max_depth': 14, 'min_samples_split': 119, 'min_samples_leaf': 56, 'criterion': 'entropy'}.
Trial 8710 finished with value: 0.7282608695652174 and parameters: {'n_estimators': 303, 'max_depth': 9, 'min_samples_split': 38, 'min_samples_leaf': 57, 'criterion': 'entropy'}.
Trial 8711 finished with value: 0.6847826086956522 and parameters: {'n_estimators': 281, 'max_depth': 12, 'min_samples_split': 25, 'min_samples_leaf': 63, 'criterion': 'entropy'}.
Trial 8712 finished with value: 0.7065217391304348 and parameters: {'n_estimators': 751, 'max_depth': 7, 'min_samples_split': 29, 'min_samples_leaf': 59, 'criterion': 'entropy'}.
Trial 8713 finished with value: 0.717391304347826 and parameters: {'n_estimators': 782, 'max_depth': 10, 'min_samples_split': 25, 'min_samples_leaf': 51, 'criterion': 'entropy'}.
Trial 8714 finished with value: 0.6413043478260869 and parameters: {'n_estimators': 264, 'max_depth': 5, 'min_samples_split': 35, 'min_samples_leaf': 61, 'criterion': 'entropy'}.
Trial 8715 finished with value: 0.6739130434782609 and parameters: {'n_estimators': 616, 'max_depth': 15, 'min_samples_split': 40, 'min_samples_leaf': 54, 'criterion': 'entropy'}.
Trial 8716 finished with value: 0.7282608695652174 and parameters: {'n_estimators': 689, 'max_depth': 8, 'min_samples_split': 19, 'min_samples_leaf': 57, 'criterion': 'entropy'}.
Trial 8717 finished with value: 0.6956521739130435 and parameters: {'n_estimators': 819, 'max_depth': 12, 'min_samples_split': 32, 'min_samples_leaf': 59, 'criterion': 'entropy'}.
Trial 8718 finished with value: 0.717391304347826 and parameters: {'n_estimators': 313, 'max_depth': 10, 'min_samples_split': 43, 'min_samples_leaf': 64, 'criterion': 'entropy'}.
Trial 8719 finished with value: 0.6956521739130435 and parameters: {'n_estimators': 292, 'max_depth': 13, 'min_samples_split': 36, 'min_samples_leaf': 55, 'criterion': 'entropy'}.
Trial 8720 finished with value: 0.6739130434782609 and parameters: {'n_estimators': 224, 'max_depth': 7, 'min_samples_split': 28, 'min_samples_leaf': 57, 'criterion': 'entropy'}.
Trial 8721 finished with value: 0.6956521739130435 and parameters: {'n_estimators': 100, 'max_depth': 11, 'min_samples_split': 32, 'min_samples_leaf': 61, 'criterion': 'entropy'}.
Trial 8722 finished with value: 0.6739130434782609 and parameters: {'n_estimators': 769, 'max_depth': 16, 'min_samples_split': 38, 'min_samples_leaf': 53, 'criterion': 'entropy'}.
Trial 8723 finished with value: 0.7065217391304348 and parameters: {'n_estimators': 738, 'max_depth': 9, 'min_samples_split': 23, 'min_samples_leaf': 59, 'criterion': 'entropy'}.
Trial 8724 finished with value: 0.6956521739130435 and parameters: {'n_estimators': 249, 'max_depth': 14, 'min_samples_split': 58, 'min_samples_leaf': 56, 'criterion': 'entropy'}.
Trial 8725 finished with value: 0.717391304347826 and parameters: {'n_estimators': 370, 'max_depth': 11, 'min_samples_split': 14, 'min_samples_leaf': 61, 'criterion': 'entropy'}.
Trial 8726 finished with value: 0.6847826086956522 and parameters: {'n_estimators': 263, 'max_depth': 6, 'min_samples_split': 28, 'min_samples_leaf': 63, 'criterion': 'entropy'}.
Trial 8727 finished with value: 0.717391304347826 and parameters: {'n_estimators': 283, 'max_depth': 8, 'min_samples_split': 184, 'min_samples_leaf': 58, 'criterion': 'entropy'}.
Trial 8728 finished with value: 0.6956521739130435 and parameters: {'n_estimators': 308, 'max_depth': 13, 'min_samples_split': 34, 'min_samples_leaf': 50, 'criterion': 'entropy'}.
Trial 8729 finished with value: 0.6956521739130435 and parameters: {'n_estimators': 271, 'max_depth': 17, 'min_samples_split': 115, 'min_samples_leaf': 55, 'criterion': 'entropy'}.
Trial 8730 finished with value: 0.7282608695652174 and parameters: {'n_estimators': 332, 'max_depth': 9, 'min_samples_split': 109, 'min_samples_leaf': 60, 'criterion': 'entropy'}.
Trial 8731 finished with value: 0.717391304347826 and parameters: {'n_estimators': 586, 'max_depth': 11, 'min_samples_split': 18, 'min_samples_leaf': 58, 'criterion': 'entropy'}.
Trial 8732 finished with value: 0.6847826086956522 and parameters: {'n_estimators': 241, 'max_depth': 7, 'min_samples_split': 44, 'min_samples_leaf': 52, 'criterion': 'entropy'}.
Trial 8733 finished with value: 0.6304347826086957 and parameters: {'n_estimators': 298, 'max_depth': 5, 'min_samples_split': 47, 'min_samples_leaf': 56, 'criterion': 'entropy'}.
Trial 8734 finished with value: 0.7065217391304348 and parameters: {'n_estimators': 803, 'max_depth': 10, 'min_samples_split': 38, 'min_samples_leaf': 64, 'criterion': 'entropy'}.
Trial 8735 finished with value: 0.7065217391304348 and parameters: {'n_estimators': 350, 'max_depth': 14, 'min_samples_split': 30, 'min_samples_leaf': 61, 'criterion': 'entropy'}.
Trial 8736 finished with value: 0.6956521739130435 and parameters: {'n_estimators': 720, 'max_depth': 12, 'min_samples_split': 40, 'min_samples_leaf': 54, 'criterion': 'entropy'}.
Trial 8737 finished with value: 0.7065217391304348 and parameters: {'n_estimators': 282, 'max_depth': 9, 'min_samples_split': 23, 'min_samples_leaf': 59, 'criterion': 'entropy'}.
Trial 8738 finished with value: 0.6956521739130435 and parameters: {'n_estimators': 837, 'max_depth': 15, 'min_samples_split': 34, 'min_samples_leaf': 56, 'criterion': 'entropy'}.
Trial 8739 finished with value: 0.6956521739130435 and parameters: {'n_estimators': 260, 'max_depth': 12, 'min_samples_split': 120, 'min_samples_leaf': 62, 'criterion': 'entropy'}.
Trial 8740 finished with value: 0.717391304347826 and parameters: {'n_estimators': 766, 'max_depth': 8, 'min_samples_split': 29, 'min_samples_leaf': 58, 'criterion': 'entropy'}.
Trial 8741 finished with value: 0.6630434782608695 and parameters: {'n_estimators': 644, 'max_depth': 19, 'min_samples_split': 25, 'min_samples_leaf': 60, 'criterion': 'entropy'}.
Trial 8742 finished with value: 0.7282608695652174 and parameters: {'n_estimators': 317, 'max_depth': 10, 'min_samples_split': 9, 'min_samples_leaf': 53, 'criterion': 'entropy'}.
Trial 8743 finished with value: 0.6956521739130435 and parameters: {'n_estimators': 788, 'max_depth': 7, 'min_samples_split': 35, 'min_samples_leaf': 57, 'criterion': 'entropy'}.
Trial 8744 finished with value: 0.6847826086956522 and parameters: {'n_estimators': 287, 'max_depth': 12, 'min_samples_split': 40, 'min_samples_leaf': 63, 'criterion': 'entropy'}.
Trial 8745 finished with value: 0.717391304347826 and parameters: {'n_estimators': 735, 'max_depth': 9, 'min_samples_split': 53, 'min_samples_leaf': 55, 'criterion': 'entropy'}.
Trial 8746 finished with value: 0.6956521739130435 and parameters: {'n_estimators': 232, 'max_depth': 14, 'min_samples_split': 81, 'min_samples_leaf': 59, 'criterion': 'entropy'}.
Trial 8747 finished with value: 0.6413043478260869 and parameters: {'n_estimators': 750, 'max_depth': 5, 'min_samples_split': 65, 'min_samples_leaf': 57, 'criterion': 'entropy'}.
Trial 8748 finished with value: 0.717391304347826 and parameters: {'n_estimators': 267, 'max_depth': 11, 'min_samples_split': 31, 'min_samples_leaf': 61, 'criterion': 'entropy'}.
Trial 8749 finished with value: 0.7282608695652174 and parameters: {'n_estimators': 293, 'max_depth': 8, 'min_samples_split': 22, 'min_samples_leaf': 54, 'criterion': 'entropy'}.
Trial 8750 finished with value: 0.6739130434782609 and parameters: {'n_estimators': 253, 'max_depth': 16, 'min_samples_split': 18, 'min_samples_leaf': 60, 'criterion': 'entropy'}.
Trial 8751 finished with value: 0.7065217391304348 and parameters: {'n_estimators': 919, 'max_depth': 13, 'min_samples_split': 27, 'min_samples_leaf': 64, 'criterion': 'entropy'}.
Trial 8752 finished with value: 0.7391304347826086 and parameters: {'n_estimators': 330, 'max_depth': 10, 'min_samples_split': 43, 'min_samples_leaf': 58, 'criterion': 'entropy'}.
Trial 8753 finished with value: 0.7065217391304348 and parameters: {'n_estimators': 306, 'max_depth': 12, 'min_samples_split': 36, 'min_samples_leaf': 52, 'criterion': 'entropy'}.
Trial 8754 finished with value: 0.7282608695652174 and parameters: {'n_estimators': 279, 'max_depth': 8, 'min_samples_split': 32, 'min_samples_leaf': 56, 'criterion': 'entropy'}.
Trial 8755 finished with value: 0.717391304347826 and parameters: {'n_estimators': 203, 'max_depth': 10, 'min_samples_split': 102, 'min_samples_leaf': 62, 'criterion': 'entropy'}.
Trial 8756 finished with value: 0.6739130434782609 and parameters: {'n_estimators': 245, 'max_depth': 7, 'min_samples_split': 39, 'min_samples_leaf': 49, 'criterion': 'entropy'}.
Trial 8757 finished with value: 0.6739130434782609 and parameters: {'n_estimators': 699, 'max_depth': 14, 'min_samples_split': 121, 'min_samples_leaf': 58, 'criterion': 'entropy'}.
Trial 8758 finished with value: 0.7065217391304348 and parameters: {'n_estimators': 268, 'max_depth': 11, 'min_samples_split': 26, 'min_samples_leaf': 55, 'criterion': 'entropy'}.
Trial 8759 finished with value: 0.6630434782608695 and parameters: {'n_estimators': 418, 'max_depth': 6, 'min_samples_split': 48, 'min_samples_leaf': 59, 'criterion': 'entropy'}.
Trial 8760 finished with value: 0.7282608695652174 and parameters: {'n_estimators': 220, 'max_depth': 9, 'min_samples_split': 33, 'min_samples_leaf': 62, 'criterion': 'entropy'}.
Trial 8761 finished with value: 0.6847826086956522 and parameters: {'n_estimators': 298, 'max_depth': 18, 'min_samples_split': 112, 'min_samples_leaf': 64, 'criterion': 'entropy'}.
Trial 8762 finished with value: 0.6956521739130435 and parameters: {'n_estimators': 763, 'max_depth': 13, 'min_samples_split': 29, 'min_samples_leaf': 60, 'criterion': 'entropy'}.
Trial 8763 finished with value: 0.6847826086956522 and parameters: {'n_estimators': 779, 'max_depth': 88, 'min_samples_split': 36, 'min_samples_leaf': 56, 'criterion': 'entropy'}.
Trial 8764 finished with value: 0.7282608695652174 and parameters: {'n_estimators': 317, 'max_depth': 11, 'min_samples_split': 42, 'min_samples_leaf': 53, 'criterion': 'entropy'}.
Trial 8765 finished with value: 0.6739130434782609 and parameters: {'n_estimators': 479, 'max_depth': 16, 'min_samples_split': 21, 'min_samples_leaf': 57, 'criterion': 'entropy'}.
Trial 8766 finished with value: 0.6847826086956522 and parameters: {'n_estimators': 274, 'max_depth': 7, 'min_samples_split': 31, 'min_samples_leaf': 60, 'criterion': 'entropy'}.
Trial 8767 finished with value: 0.717391304347826 and parameters: {'n_estimators': 251, 'max_depth': 10, 'min_samples_split': 14, 'min_samples_leaf': 58, 'criterion': 'entropy'}.
Trial 8768 finished with value: 0.6956521739130435 and parameters: {'n_estimators': 292, 'max_depth': 13, 'min_samples_split': 25, 'min_samples_leaf': 55, 'criterion': 'entropy'}.
Trial 8769 finished with value: 0.6521739130434783 and parameters: {'n_estimators': 714, 'max_depth': 5, 'min_samples_split': 38, 'min_samples_leaf': 62, 'criterion': 'entropy'}.
Trial 8770 finished with value: 0.7065217391304348 and parameters: {'n_estimators': 347, 'max_depth': 9, 'min_samples_split': 45, 'min_samples_leaf': 59, 'criterion': 'entropy'}.
Trial 8771 finished with value: 0.7065217391304348 and parameters: {'n_estimators': 748, 'max_depth': 12, 'min_samples_split': 33, 'min_samples_leaf': 51, 'criterion': 'entropy'}.
Trial 8772 finished with value: 0.6847826086956522 and parameters: {'n_estimators': 971, 'max_depth': 15, 'min_samples_split': 28, 'min_samples_leaf': 64, 'criterion': 'entropy'}.
Trial 8773 finished with value: 0.7282608695652174 and parameters: {'n_estimators': 309, 'max_depth': 8, 'min_samples_split': 17, 'min_samples_leaf': 56, 'criterion': 'entropy'}.
Trial 8774 finished with value: 0.717391304347826 and parameters: {'n_estimators': 668, 'max_depth': 10, 'min_samples_split': 36, 'min_samples_leaf': 53, 'criterion': 'entropy'}.
Trial 8775 finished with value: 0.7065217391304348 and parameters: {'n_estimators': 160, 'max_depth': 7, 'min_samples_split': 116, 'min_samples_leaf': 60, 'criterion': 'entropy'}.
Trial 8776 finished with value: 0.6739130434782609 and parameters: {'n_estimators': 234, 'max_depth': 58, 'min_samples_split': 25, 'min_samples_leaf': 57, 'criterion': 'entropy'}.
Trial 8777 finished with value: 0.6847826086956522 and parameters: {'n_estimators': 563, 'max_depth': 12, 'min_samples_split': 41, 'min_samples_leaf': 61, 'criterion': 'entropy'}.
Trial 8778 finished with value: 0.6956521739130435 and parameters: {'n_estimators': 269, 'max_depth': 14, 'min_samples_split': 85, 'min_samples_leaf': 54, 'criterion': 'entropy'}.
