Trial 7552 finished with value: 0.6847826086956522 and parameters: {'n_estimators': 289, 'max_depth': 16, 'min_samples_split': 79, 'min_samples_leaf': 58, 'criterion': 'entropy'}.
Trial 7553 finished with value: 0.6847826086956522 and parameters: {'n_estimators': 255, 'max_depth': 22, 'min_samples_split': 45, 'min_samples_leaf': 52, 'criterion': 'gini'}.
Trial 7554 finished with value: 0.6847826086956522 and parameters: {'n_estimators': 194, 'max_depth': 12, 'min_samples_split': 30, 'min_samples_leaf': 73, 'criterion': 'entropy'}.
Trial 7555 finished with value: 0.6739130434782609 and parameters: {'n_estimators': 712, 'max_depth': 31, 'min_samples_split': 18, 'min_samples_leaf': 59, 'criterion': 'entropy'}.
Trial 7556 finished with value: 0.7282608695652174 and parameters: {'n_estimators': 300, 'max_depth': 9, 'min_samples_split': 24, 'min_samples_leaf': 62, 'criterion': 'gini'}.
Trial 7557 finished with value: 0.6413043478260869 and parameters: {'n_estimators': 119, 'max_depth': 7, 'min_samples_split': 38, 'min_samples_leaf': 56, 'criterion': 'entropy'}.
Trial 7558 finished with value: 0.6847826086956522 and parameters: {'n_estimators': 778, 'max_depth': 42, 'min_samples_split': 125, 'min_samples_leaf': 70, 'criterion': 'gini'}.
Trial 7559 finished with value: 0.6956521739130435 and parameters: {'n_estimators': 798, 'max_depth': 14, 'min_samples_split': 33, 'min_samples_leaf': 53, 'criterion': 'entropy'}.
Trial 7560 finished with value: 0.7282608695652174 and parameters: {'n_estimators': 278, 'max_depth': 10, 'min_samples_split': 27, 'min_samples_leaf': 67, 'criterion': 'gini'}.
Trial 7561 finished with value: 0.6847826086956522 and parameters: {'n_estimators': 688, 'max_depth': 12, 'min_samples_split': 42, 'min_samples_leaf': 61, 'criterion': 'entropy'}.
Trial 7562 finished with value: 0.6956521739130435 and parameters: {'n_estimators': 242, 'max_depth': 7, 'min_samples_split': 151, 'min_samples_leaf': 58, 'criterion': 'gini'}.
Trial 7563 finished with value: 0.6847826086956522 and parameters: {'n_estimators': 761, 'max_depth': 10, 'min_samples_split': 147, 'min_samples_leaf': 55, 'criterion': 'entropy'}.
Trial 7564 finished with value: 0.6956521739130435 and parameters: {'n_estimators': 261, 'max_depth': 15, 'min_samples_split': 139, 'min_samples_leaf': 64, 'criterion': 'entropy'}.
Trial 7565 finished with value: 0.7065217391304348 and parameters: {'n_estimators': 288, 'max_depth': 12, 'min_samples_split': 36, 'min_samples_leaf': 60, 'criterion': 'gini'}.
Trial 7566 finished with value: 0.6739130434782609 and parameters: {'n_estimators': 312, 'max_depth': 5, 'min_samples_split': 31, 'min_samples_leaf': 72, 'criterion': 'entropy'}.
Trial 7567 finished with value: 0.6956521739130435 and parameters: {'n_estimators': 818, 'max_depth': 9, 'min_samples_split': 23, 'min_samples_leaf': 75, 'criterion': 'gini'}.
Trial 7568 finished with value: 0.6847826086956522 and parameters: {'n_estimators': 493, 'max_depth': 13, 'min_samples_split': 39, 'min_samples_leaf': 57, 'criterion': 'entropy'}.
Trial 7569 finished with value: 0.6956521739130435 and parameters: {'n_estimators': 340, 'max_depth': 17, 'min_samples_split': 30, 'min_samples_leaf': 54, 'criterion': 'gini'}.
Trial 7570 finished with value: 0.6956521739130435 and parameters: {'n_estimators': 271, 'max_depth': 8, 'min_samples_split': 143, 'min_samples_leaf': 59, 'criterion': 'entropy'}.
Trial 7571 finished with value: 0.717391304347826 and parameters: {'n_estimators': 728, 'max_depth': 11, 'min_samples_split': 113, 'min_samples_leaf': 63, 'criterion': 'gini'}.
Trial 7572 finished with value: 0.7065217391304348 and parameters: {'n_estimators': 326, 'max_depth': 10, 'min_samples_split': 26, 'min_samples_leaf': 57, 'criterion': 'entropy'}.
Trial 7573 finished with value: 0.6847826086956522 and parameters: {'n_estimators': 250, 'max_depth': 7, 'min_samples_split': 119, 'min_samples_leaf': 62, 'criterion': 'gini'}.
Trial 7574 finished with value: 0.7065217391304348 and parameters: {'n_estimators': 228, 'max_depth': 14, 'min_samples_split': 35, 'min_samples_leaf': 60, 'criterion': 'entropy'}.
Trial 7575 finished with value: 0.6739130434782609 and parameters: {'n_estimators': 290, 'max_depth': 12, 'min_samples_split': 19, 'min_samples_leaf': 80, 'criterion': 'entropy'}.
Trial 7576 finished with value: 0.6739130434782609 and parameters: {'n_estimators': 746, 'max_depth': 9, 'min_samples_split': 133, 'min_samples_leaf': 89, 'criterion': 'gini'}.
Trial 7577 finished with value: 0.6739130434782609 and parameters: {'n_estimators': 268, 'max_depth': 19, 'min_samples_split': 47, 'min_samples_leaf': 71, 'criterion': 'entropy'}.
Trial 7578 finished with value: 0.6739130434782609 and parameters: {'n_estimators': 623, 'max_depth': 6, 'min_samples_split': 33, 'min_samples_leaf': 55, 'criterion': 'gini'}.
Trial 7579 finished with value: 0.717391304347826 and parameters: {'n_estimators': 300, 'max_depth': 11, 'min_samples_split': 28, 'min_samples_leaf': 66, 'criterion': 'entropy'}.
Trial 7580 finished with value: 0.6739130434782609 and parameters: {'n_estimators': 280, 'max_depth': 15, 'min_samples_split': 40, 'min_samples_leaf': 50, 'criterion': 'gini'}.
Trial 7581 finished with value: 0.6739130434782609 and parameters: {'n_estimators': 982, 'max_depth': 71, 'min_samples_split': 137, 'min_samples_leaf': 58, 'criterion': 'entropy'}.
Trial 7582 finished with value: 0.717391304347826 and parameters: {'n_estimators': 312, 'max_depth': 8, 'min_samples_split': 125, 'min_samples_leaf': 61, 'criterion': 'gini'}.
Trial 7583 finished with value: 0.6956521739130435 and parameters: {'n_estimators': 248, 'max_depth': 13, 'min_samples_split': 110, 'min_samples_leaf': 56, 'criterion': 'entropy'}.
Trial 7584 finished with value: 0.7391304347826086 and parameters: {'n_estimators': 152, 'max_depth': 10, 'min_samples_split': 25, 'min_samples_leaf': 52, 'criterion': 'entropy'}.
Trial 7585 finished with value: 0.6956521739130435 and parameters: {'n_estimators': 263, 'max_depth': 8, 'min_samples_split': 16, 'min_samples_leaf': 64, 'criterion': 'gini'}.
Trial 7586 finished with value: 0.6739130434782609 and parameters: {'n_estimators': 772, 'max_depth': 53, 'min_samples_split': 11, 'min_samples_leaf': 59, 'criterion': 'entropy'}.
Trial 7587 finished with value: 0.6630434782608695 and parameters: {'n_estimators': 794, 'max_depth': 5, 'min_samples_split': 43, 'min_samples_leaf': 68, 'criterion': 'gini'}.
Trial 7588 finished with value: 0.6956521739130435 and parameters: {'n_estimators': 290, 'max_depth': 11, 'min_samples_split': 141, 'min_samples_leaf': 74, 'criterion': 'entropy'}.
Trial 7589 finished with value: 0.6956521739130435 and parameters: {'n_estimators': 230, 'max_depth': 13, 'min_samples_split': 34, 'min_samples_leaf': 54, 'criterion': 'gini'}.
Trial 7590 finished with value: 0.6956521739130435 and parameters: {'n_estimators': 739, 'max_depth': 16, 'min_samples_split': 61, 'min_samples_leaf': 57, 'criterion': 'entropy'}.
Trial 7591 finished with value: 0.7065217391304348 and parameters: {'n_estimators': 360, 'max_depth': 9, 'min_samples_split': 29, 'min_samples_leaf': 59, 'criterion': 'gini'}.
Trial 7592 finished with value: 0.6956521739130435 and parameters: {'n_estimators': 452, 'max_depth': 7, 'min_samples_split': 22, 'min_samples_leaf': 61, 'criterion': 'entropy'}.
Trial 7593 finished with value: 0.7065217391304348 and parameters: {'n_estimators': 915, 'max_depth': 11, 'min_samples_split': 38, 'min_samples_leaf': 71, 'criterion': 'entropy'}.
Trial 7594 finished with value: 0.6739130434782609 and parameters: {'n_estimators': 320, 'max_depth': 14, 'min_samples_split': 155, 'min_samples_leaf': 76, 'criterion': 'gini'}.
Trial 7595 finished with value: 0.717391304347826 and parameters: {'n_estimators': 207, 'max_depth': 9, 'min_samples_split': 130, 'min_samples_leaf': 56, 'criterion': 'entropy'}.
Trial 7596 finished with value: 0.6956521739130435 and parameters: {'n_estimators': 392, 'max_depth': 12, 'min_samples_split': 32, 'min_samples_leaf': 63, 'criterion': 'gini'}.
Trial 7597 finished with value: 0.6630434782608695 and parameters: {'n_estimators': 765, 'max_depth': 6, 'min_samples_split': 121, 'min_samples_leaf': 53, 'criterion': 'entropy'}.
Trial 7598 finished with value: 0.7065217391304348 and parameters: {'n_estimators': 263, 'max_depth': 10, 'min_samples_split': 36, 'min_samples_leaf': 58, 'criterion': 'gini'}.
Trial 7599 finished with value: 0.6956521739130435 and parameters: {'n_estimators': 282, 'max_depth': 15, 'min_samples_split': 6, 'min_samples_leaf': 61, 'criterion': 'entropy'}.
Trial 7600 finished with value: 0.7282608695652174 and parameters: {'n_estimators': 302, 'max_depth': 8, 'min_samples_split': 146, 'min_samples_leaf': 69, 'criterion': 'gini'}.
Trial 7601 finished with value: 0.6956521739130435 and parameters: {'n_estimators': 717, 'max_depth': 12, 'min_samples_split': 29, 'min_samples_leaf': 65, 'criterion': 'entropy'}.
Trial 7602 finished with value: 0.717391304347826 and parameters: {'n_estimators': 240, 'max_depth': 10, 'min_samples_split': 22, 'min_samples_leaf': 55, 'criterion': 'entropy'}.
Trial 7603 finished with value: 0.6956521739130435 and parameters: {'n_estimators': 277, 'max_depth': 17, 'min_samples_split': 40, 'min_samples_leaf': 60, 'criterion': 'gini'}.
Trial 7604 finished with value: 0.6956521739130435 and parameters: {'n_estimators': 342, 'max_depth': 7, 'min_samples_split': 136, 'min_samples_leaf': 58, 'criterion': 'entropy'}.
Trial 7605 finished with value: 0.6847826086956522 and parameters: {'n_estimators': 257, 'max_depth': 45, 'min_samples_split': 162, 'min_samples_leaf': 73, 'criterion': 'gini'}.
Trial 7606 finished with value: 0.6956521739130435 and parameters: {'n_estimators': 295, 'max_depth': 13, 'min_samples_split': 26, 'min_samples_leaf': 57, 'criterion': 'entropy'}.
Trial 7607 finished with value: 0.7065217391304348 and parameters: {'n_estimators': 324, 'max_depth': 10, 'min_samples_split': 33, 'min_samples_leaf': 62, 'criterion': 'gini'}.
Trial 7608 finished with value: 0.6413043478260869 and parameters: {'n_estimators': 756, 'max_depth': 5, 'min_samples_split': 91, 'min_samples_leaf': 55, 'criterion': 'entropy'}.
Trial 7609 finished with value: 0.7065217391304348 and parameters: {'n_estimators': 270, 'max_depth': 8, 'min_samples_split': 43, 'min_samples_leaf': 67, 'criterion': 'gini'}.
Trial 7610 finished with value: 0.7065217391304348 and parameters: {'n_estimators': 785, 'max_depth': 12, 'min_samples_split': 142, 'min_samples_leaf': 59, 'criterion': 'entropy'}.
Trial 7611 finished with value: 0.6847826086956522 and parameters: {'n_estimators': 303, 'max_depth': 14, 'min_samples_split': 18, 'min_samples_leaf': 51, 'criterion': 'entropy'}.
Trial 7612 finished with value: 0.717391304347826 and parameters: {'n_estimators': 243, 'max_depth': 9, 'min_samples_split': 38, 'min_samples_leaf': 71, 'criterion': 'gini'}.
Trial 7613 finished with value: 0.6847826086956522 and parameters: {'n_estimators': 283, 'max_depth': 11, 'min_samples_split': 26, 'min_samples_leaf': 77, 'criterion': 'entropy'}.
Trial 7614 finished with value: 0.6847826086956522 and parameters: {'n_estimators': 741, 'max_depth': 7, 'min_samples_split': 148, 'min_samples_leaf': 60, 'criterion': 'gini'}.
Trial 7615 finished with value: 0.6847826086956522 and parameters: {'n_estimators': 221, 'max_depth': 14, 'min_samples_split': 49, 'min_samples_leaf': 53, 'criterion': 'entropy'}.
Trial 7616 finished with value: 0.6630434782608695 and parameters: {'n_estimators': 257, 'max_depth': 20, 'min_samples_split': 116, 'min_samples_leaf': 64, 'criterion': 'gini'}.
Trial 7617 finished with value: 0.717391304347826 and parameters: {'n_estimators': 814, 'max_depth': 10, 'min_samples_split': 103, 'min_samples_leaf': 56, 'criterion': 'entropy'}.
Trial 7618 finished with value: 0.6739130434782609 and parameters: {'n_estimators': 424, 'max_depth': 49, 'min_samples_split': 32, 'min_samples_leaf': 58, 'criterion': 'gini'}.
Trial 7619 finished with value: 0.7065217391304348 and parameters: {'n_estimators': 309, 'max_depth': 12, 'min_samples_split': 139, 'min_samples_leaf': 62, 'criterion': 'entropy'}.
Trial 7620 finished with value: 0.6630434782608695 and parameters: {'n_estimators': 282, 'max_depth': 16, 'min_samples_split': 28, 'min_samples_leaf': 54, 'criterion': 'entropy'}.
Trial 7621 finished with value: 0.7065217391304348 and parameters: {'n_estimators': 895, 'max_depth': 9, 'min_samples_split': 126, 'min_samples_leaf': 73, 'criterion': 'gini'}.
Trial 7622 finished with value: 0.6739130434782609 and parameters: {'n_estimators': 329, 'max_depth': 7, 'min_samples_split': 37, 'min_samples_leaf': 57, 'criterion': 'entropy'}.
Trial 7623 finished with value: 0.6956521739130435 and parameters: {'n_estimators': 256, 'max_depth': 12, 'min_samples_split': 134, 'min_samples_leaf': 37, 'criterion': 'gini'}.
Trial 7624 finished with value: 0.6956521739130435 and parameters: {'n_estimators': 765, 'max_depth': 9, 'min_samples_split': 21, 'min_samples_leaf': 60, 'criterion': 'entropy'}.
Trial 7625 finished with value: 0.6413043478260869 and parameters: {'n_estimators': 288, 'max_depth': 5, 'min_samples_split': 34, 'min_samples_leaf': 63, 'criterion': 'gini'}.
Trial 7626 finished with value: 0.6847826086956522 and parameters: {'n_estimators': 271, 'max_depth': 11, 'min_samples_split': 44, 'min_samples_leaf': 70, 'criterion': 'entropy'}.
Trial 7627 finished with value: 0.6847826086956522 and parameters: {'n_estimators': 238, 'max_depth': 14, 'min_samples_split': 31, 'min_samples_leaf': 75, 'criterion': 'gini'}.
Trial 7628 finished with value: 0.6956521739130435 and parameters: {'n_estimators': 798, 'max_depth': 7, 'min_samples_split': 15, 'min_samples_leaf': 65, 'criterion': 'entropy'}.
Trial 7629 finished with value: 0.717391304347826 and parameters: {'n_estimators': 602, 'max_depth': 10, 'min_samples_split': 145, 'min_samples_leaf': 59, 'criterion': 'gini'}.
Trial 7630 finished with value: 0.6739130434782609 and parameters: {'n_estimators': 694, 'max_depth': 18, 'min_samples_split': 25, 'min_samples_leaf': 56, 'criterion': 'entropy'}.
Trial 7631 finished with value: 0.7065217391304348 and parameters: {'n_estimators': 727, 'max_depth': 13, 'min_samples_split': 37, 'min_samples_leaf': 68, 'criterion': 'entropy'}.
Trial 7632 finished with value: 0.7065217391304348 and parameters: {'n_estimators': 868, 'max_depth': 8, 'min_samples_split': 130, 'min_samples_leaf': 61, 'criterion': 'gini'}.
Trial 7633 finished with value: 0.717391304347826 and parameters: {'n_estimators': 655, 'max_depth': 11, 'min_samples_split': 29, 'min_samples_leaf': 58, 'criterion': 'entropy'}.
Trial 7634 finished with value: 0.6847826086956522 and parameters: {'n_estimators': 306, 'max_depth': 15, 'min_samples_split': 121, 'min_samples_leaf': 86, 'criterion': 'gini'}.
Trial 7635 finished with value: 0.7282608695652174 and parameters: {'n_estimators': 270, 'max_depth': 9, 'min_samples_split': 41, 'min_samples_leaf': 52, 'criterion': 'entropy'}.
Trial 7636 finished with value: 0.6847826086956522 and parameters: {'n_estimators': 188, 'max_depth': 13, 'min_samples_split': 151, 'min_samples_leaf': 55, 'criterion': 'gini'}.
Trial 7637 finished with value: 0.6630434782608695 and parameters: {'n_estimators': 290, 'max_depth': 6, 'min_samples_split': 140, 'min_samples_leaf': 78, 'criterion': 'entropy'}.
Trial 7638 finished with value: 0.717391304347826 and parameters: {'n_estimators': 213, 'max_depth': 11, 'min_samples_split': 23, 'min_samples_leaf': 61, 'criterion': 'gini'}.
Trial 7639 finished with value: 0.6630434782608695 and parameters: {'n_estimators': 247, 'max_depth': 16, 'min_samples_split': 33, 'min_samples_leaf': 57, 'criterion': 'entropy'}.
Trial 7640 finished with value: 0.7065217391304348 and parameters: {'n_estimators': 751, 'max_depth': 8, 'min_samples_split': 36, 'min_samples_leaf': 72, 'criterion': 'entropy'}.
Trial 7641 finished with value: 0.6956521739130435 and parameters: {'n_estimators': 948, 'max_depth': 10, 'min_samples_split': 29, 'min_samples_leaf': 66, 'criterion': 'gini'}.
Trial 7642 finished with value: 0.6956521739130435 and parameters: {'n_estimators': 349, 'max_depth': 13, 'min_samples_split': 72, 'min_samples_leaf': 59, 'criterion': 'entropy'}.
Trial 7643 finished with value: 0.6739130434782609 and parameters: {'n_estimators': 776, 'max_depth': 7, 'min_samples_split': 19, 'min_samples_leaf': 50, 'criterion': 'gini'}.
Trial 7644 finished with value: 0.7065217391304348 and parameters: {'n_estimators': 324, 'max_depth': 11, 'min_samples_split': 134, 'min_samples_leaf': 54, 'criterion': 'entropy'}.
Trial 7645 finished with value: 0.6956521739130435 and parameters: {'n_estimators': 709, 'max_depth': 9, 'min_samples_split': 45, 'min_samples_leaf': 63, 'criterion': 'gini'}.
Trial 7646 finished with value: 0.6847826086956522 and parameters: {'n_estimators': 298, 'max_depth': 15, 'min_samples_split': 55, 'min_samples_leaf': 56, 'criterion': 'entropy'}.
Trial 7647 finished with value: 0.7065217391304348 and parameters: {'n_estimators': 267, 'max_depth': 12, 'min_samples_split': 40, 'min_samples_leaf': 60, 'criterion': 'gini'}.
Trial 7648 finished with value: 0.6847826086956522 and parameters: {'n_estimators': 283, 'max_depth': 56, 'min_samples_split': 143, 'min_samples_leaf': 58, 'criterion': 'entropy'}.
Trial 7649 finished with value: 0.6630434782608695 and parameters: {'n_estimators': 308, 'max_depth': 5, 'min_samples_split': 32, 'min_samples_leaf': 75, 'criterion': 'entropy'}.
Trial 7650 finished with value: 0.717391304347826 and parameters: {'n_estimators': 247, 'max_depth': 9, 'min_samples_split': 85, 'min_samples_leaf': 62, 'criterion': 'gini'}.
Trial 7651 finished with value: 0.6956521739130435 and parameters: {'n_estimators': 228, 'max_depth': 13, 'min_samples_split': 25, 'min_samples_leaf': 53, 'criterion': 'entropy'}.
Trial 7652 finished with value: 0.6739130434782609 and parameters: {'n_estimators': 263, 'max_depth': 7, 'min_samples_split': 35, 'min_samples_leaf': 68, 'criterion': 'gini'}.
Trial 7653 finished with value: 0.6956521739130435 and parameters: {'n_estimators': 784, 'max_depth': 17, 'min_samples_split': 12, 'min_samples_leaf': 56, 'criterion': 'entropy'}.
Trial 7654 finished with value: 0.6956521739130435 and parameters: {'n_estimators': 372, 'max_depth': 11, 'min_samples_split': 128, 'min_samples_leaf': 70, 'criterion': 'gini'}.
Trial 7655 finished with value: 0.6739130434782609 and parameters: {'n_estimators': 730, 'max_depth': 67, 'min_samples_split': 29, 'min_samples_leaf': 59, 'criterion': 'entropy'}.
Trial 7656 finished with value: 0.717391304347826 and parameters: {'n_estimators': 314, 'max_depth': 9, 'min_samples_split': 139, 'min_samples_leaf': 65, 'criterion': 'gini'}.
Trial 7657 finished with value: 0.6956521739130435 and parameters: {'n_estimators': 284, 'max_depth': 13, 'min_samples_split': 20, 'min_samples_leaf': 61, 'criterion': 'entropy'}.
Trial 7658 finished with value: 0.6956521739130435 and parameters: {'n_estimators': 173, 'max_depth': 11, 'min_samples_split': 40, 'min_samples_leaf': 57, 'criterion': 'entropy'}.
Trial 7659 finished with value: 0.6956521739130435 and parameters: {'n_estimators': 405, 'max_depth': 7, 'min_samples_split': 148, 'min_samples_leaf': 73, 'criterion': 'gini'}.
Trial 7660 finished with value: 0.6847826086956522 and parameters: {'n_estimators': 257, 'max_depth': 14, 'min_samples_split': 26, 'min_samples_leaf': 54, 'criterion': 'entropy'}.
Trial 7661 finished with value: 0.7065217391304348 and parameters: {'n_estimators': 339, 'max_depth': 9, 'min_samples_split': 34, 'min_samples_leaf': 59, 'criterion': 'gini'}.
Trial 7662 finished with value: 0.6630434782608695 and parameters: {'n_estimators': 544, 'max_depth': 5, 'min_samples_split': 115, 'min_samples_leaf': 63, 'criterion': 'entropy'}.
Trial 7663 finished with value: 0.7065217391304348 and parameters: {'n_estimators': 759, 'max_depth': 11, 'min_samples_split': 107, 'min_samples_leaf': 55, 'criterion': 'gini'}.
Trial 7664 finished with value: 0.717391304347826 and parameters: {'n_estimators': 302, 'max_depth': 8, 'min_samples_split': 123, 'min_samples_leaf': 58, 'criterion': 'entropy'}.
Trial 7665 finished with value: 0.6847826086956522 and parameters: {'n_estimators': 819, 'max_depth': 15, 'min_samples_split': 30, 'min_samples_leaf': 60, 'criterion': 'gini'}.
Trial 7666 finished with value: 0.7065217391304348 and parameters: {'n_estimators': 274, 'max_depth': 12, 'min_samples_split': 132, 'min_samples_leaf': 52, 'criterion': 'entropy'}.
Trial 7667 finished with value: 0.6630434782608695 and parameters: {'n_estimators': 120, 'max_depth': 10, 'min_samples_split': 46, 'min_samples_leaf': 71, 'criterion': 'entropy'}.
Trial 7668 finished with value: 0.6847826086956522 and parameters: {'n_estimators': 745, 'max_depth': 7, 'min_samples_split': 37, 'min_samples_leaf': 57, 'criterion': 'gini'}.
Trial 7669 finished with value: 0.7065217391304348 and parameters: {'n_estimators': 137, 'max_depth': 10, 'min_samples_split': 137, 'min_samples_leaf': 62, 'criterion': 'entropy'}.
Trial 7670 finished with value: 0.6630434782608695 and parameters: {'n_estimators': 233, 'max_depth': 18, 'min_samples_split': 23, 'min_samples_leaf': 67, 'criterion': 'gini'}.
Trial 7671 finished with value: 0.6739130434782609 and parameters: {'n_estimators': 293, 'max_depth': 15, 'min_samples_split': 143, 'min_samples_leaf': 74, 'criterion': 'entropy'}.
Trial 7672 finished with value: 0.6847826086956522 and parameters: {'n_estimators': 326, 'max_depth': 13, 'min_samples_split': 32, 'min_samples_leaf': 55, 'criterion': 'gini'}.
Trial 7673 finished with value: 0.6956521739130435 and parameters: {'n_estimators': 252, 'max_depth': 8, 'min_samples_split': 27, 'min_samples_leaf': 64, 'criterion': 'entropy'}.
Trial 7674 finished with value: 0.7065217391304348 and parameters: {'n_estimators': 274, 'max_depth': 11, 'min_samples_split': 41, 'min_samples_leaf': 60, 'criterion': 'gini'}.
