Trial 618 finished with value: 0.5217391304347826 and parameters: {'n_estimators': 496, 'max_depth': 51, 'min_samples_split': 189, 'min_samples_leaf': 28, 'criterion': 'entropy'}.
Trial 619 finished with value: 0.5760869565217391 and parameters: {'n_estimators': 462, 'max_depth': 54, 'min_samples_split': 200, 'min_samples_leaf': 96, 'criterion': 'entropy'}.
Trial 620 finished with value: 0.5434782608695652 and parameters: {'n_estimators': 408, 'max_depth': 45, 'min_samples_split': 105, 'min_samples_leaf': 99, 'criterion': 'entropy'}.
Trial 621 finished with value: 0.5543478260869565 and parameters: {'n_estimators': 546, 'max_depth': 43, 'min_samples_split': 194, 'min_samples_leaf': 91, 'criterion': 'entropy'}.
Trial 622 finished with value: 0.5543478260869565 and parameters: {'n_estimators': 436, 'max_depth': 48, 'min_samples_split': 184, 'min_samples_leaf': 94, 'criterion': 'entropy'}.
Trial 623 finished with value: 0.5543478260869565 and parameters: {'n_estimators': 479, 'max_depth': 87, 'min_samples_split': 179, 'min_samples_leaf': 51, 'criterion': 'entropy'}.
Trial 624 finished with value: 0.532608695652174 and parameters: {'n_estimators': 454, 'max_depth': 39, 'min_samples_split': 197, 'min_samples_leaf': 58, 'criterion': 'entropy'}.
Trial 625 finished with value: 0.5434782608695652 and parameters: {'n_estimators': 429, 'max_depth': 52, 'min_samples_split': 188, 'min_samples_leaf': 98, 'criterion': 'entropy'}.
Trial 626 finished with value: 0.5434782608695652 and parameters: {'n_estimators': 484, 'max_depth': 44, 'min_samples_split': 192, 'min_samples_leaf': 80, 'criterion': 'entropy'}.
Trial 627 finished with value: 0.5760869565217391 and parameters: {'n_estimators': 467, 'max_depth': 46, 'min_samples_split': 182, 'min_samples_leaf': 96, 'criterion': 'entropy'}.
Trial 628 finished with value: 0.5543478260869565 and parameters: {'n_estimators': 505, 'max_depth': 55, 'min_samples_split': 186, 'min_samples_leaf': 100, 'criterion': 'entropy'}.
Trial 629 finished with value: 0.5543478260869565 and parameters: {'n_estimators': 448, 'max_depth': 50, 'min_samples_split': 196, 'min_samples_leaf': 94, 'criterion': 'entropy'}.
Trial 630 finished with value: 0.5108695652173914 and parameters: {'n_estimators': 419, 'max_depth': 42, 'min_samples_split': 192, 'min_samples_leaf': 1, 'criterion': 'entropy'}.
Trial 631 finished with value: 0.5217391304347826 and parameters: {'n_estimators': 436, 'max_depth': 11, 'min_samples_split': 189, 'min_samples_leaf': 53, 'criterion': 'entropy'}.
Trial 632 finished with value: 0.5760869565217391 and parameters: {'n_estimators': 472, 'max_depth': 94, 'min_samples_split': 200, 'min_samples_leaf': 97, 'criterion': 'entropy'}.
Trial 633 finished with value: 0.532608695652174 and parameters: {'n_estimators': 453, 'max_depth': 34, 'min_samples_split': 180, 'min_samples_leaf': 91, 'criterion': 'entropy'}.
Trial 634 finished with value: 0.5543478260869565 and parameters: {'n_estimators': 487, 'max_depth': 84, 'min_samples_split': 184, 'min_samples_leaf': 94, 'criterion': 'entropy'}.
Trial 635 finished with value: 0.5434782608695652 and parameters: {'n_estimators': 526, 'max_depth': 47, 'min_samples_split': 193, 'min_samples_leaf': 50, 'criterion': 'entropy'}.
Trial 636 finished with value: 0.5543478260869565 and parameters: {'n_estimators': 463, 'max_depth': 40, 'min_samples_split': 196, 'min_samples_leaf': 98, 'criterion': 'entropy'}.
Trial 637 finished with value: 0.5543478260869565 and parameters: {'n_estimators': 946, 'max_depth': 44, 'min_samples_split': 178, 'min_samples_leaf': 96, 'criterion': 'entropy'}.
Trial 638 finished with value: 0.5543478260869565 and parameters: {'n_estimators': 424, 'max_depth': 30, 'min_samples_split': 188, 'min_samples_leaf': 93, 'criterion': 'entropy'}.
Trial 639 finished with value: 0.5434782608695652 and parameters: {'n_estimators': 444, 'max_depth': 49, 'min_samples_split': 184, 'min_samples_leaf': 100, 'criterion': 'entropy'}.
Trial 640 finished with value: 0.5760869565217391 and parameters: {'n_estimators': 468, 'max_depth': 37, 'min_samples_split': 192, 'min_samples_leaf': 95, 'criterion': 'entropy'}.
Trial 641 finished with value: 0.5434782608695652 and parameters: {'n_estimators': 502, 'max_depth': 53, 'min_samples_split': 200, 'min_samples_leaf': 92, 'criterion': 'entropy'}.
Trial 642 finished with value: 0.5434782608695652 and parameters: {'n_estimators': 406, 'max_depth': 25, 'min_samples_split': 132, 'min_samples_leaf': 98, 'criterion': 'entropy'}.
Trial 643 finished with value: 0.532608695652174 and parameters: {'n_estimators': 487, 'max_depth': 19, 'min_samples_split': 188, 'min_samples_leaf': 49, 'criterion': 'entropy'}.
Trial 644 finished with value: 0.5760869565217391 and parameters: {'n_estimators': 454, 'max_depth': 42, 'min_samples_split': 196, 'min_samples_leaf': 96, 'criterion': 'entropy'}.
Trial 645 finished with value: 0.532608695652174 and parameters: {'n_estimators': 472, 'max_depth': 47, 'min_samples_split': 181, 'min_samples_leaf': 63, 'criterion': 'entropy'}.
Trial 646 finished with value: 0.5434782608695652 and parameters: {'n_estimators': 436, 'max_depth': 86, 'min_samples_split': 192, 'min_samples_leaf': 53, 'criterion': 'entropy'}.
Trial 647 finished with value: 0.532608695652174 and parameters: {'n_estimators': 457, 'max_depth': 45, 'min_samples_split': 178, 'min_samples_leaf': 86, 'criterion': 'entropy'}.
Trial 648 finished with value: 0.532608695652174 and parameters: {'n_estimators': 428, 'max_depth': 50, 'min_samples_split': 186, 'min_samples_leaf': 77, 'criterion': 'entropy'}.
Trial 649 finished with value: 0.5434782608695652 and parameters: {'n_estimators': 473, 'max_depth': 38, 'min_samples_split': 196, 'min_samples_leaf': 94, 'criterion': 'entropy'}.
Trial 650 finished with value: 0.5434782608695652 and parameters: {'n_estimators': 444, 'max_depth': 41, 'min_samples_split': 190, 'min_samples_leaf': 98, 'criterion': 'entropy'}.
Trial 651 finished with value: 0.5434782608695652 and parameters: {'n_estimators': 492, 'max_depth': 43, 'min_samples_split': 183, 'min_samples_leaf': 89, 'criterion': 'entropy'}.
Trial 652 finished with value: 0.532608695652174 and parameters: {'n_estimators': 405, 'max_depth': 52, 'min_samples_split': 145, 'min_samples_leaf': 51, 'criterion': 'entropy'}.
Trial 653 finished with value: 0.532608695652174 and parameters: {'n_estimators': 512, 'max_depth': 48, 'min_samples_split': 194, 'min_samples_leaf': 60, 'criterion': 'entropy'}.
Trial 654 finished with value: 0.5217391304347826 and parameters: {'n_estimators': 478, 'max_depth': 55, 'min_samples_split': 188, 'min_samples_leaf': 56, 'criterion': 'entropy'}.
Trial 655 finished with value: 0.5543478260869565 and parameters: {'n_estimators': 454, 'max_depth': 45, 'min_samples_split': 200, 'min_samples_leaf': 73, 'criterion': 'entropy'}.
Trial 656 finished with value: 0.5652173913043478 and parameters: {'n_estimators': 424, 'max_depth': 40, 'min_samples_split': 179, 'min_samples_leaf': 96, 'criterion': 'entropy'}.
Trial 657 finished with value: 0.4891304347826087 and parameters: {'n_estimators': 447, 'max_depth': 51, 'min_samples_split': 15, 'min_samples_leaf': 48, 'criterion': 'entropy'}.
Trial 658 finished with value: 0.5434782608695652 and parameters: {'n_estimators': 475, 'max_depth': 47, 'min_samples_split': 185, 'min_samples_leaf': 92, 'criterion': 'entropy'}.
Trial 659 finished with value: 0.5543478260869565 and parameters: {'n_estimators': 461, 'max_depth': 44, 'min_samples_split': 191, 'min_samples_leaf': 99, 'criterion': 'entropy'}.
Trial 660 finished with value: 0.5543478260869565 and parameters: {'n_estimators': 438, 'max_depth': 85, 'min_samples_split': 196, 'min_samples_leaf': 96, 'criterion': 'entropy'}.
Trial 661 finished with value: 0.5543478260869565 and parameters: {'n_estimators': 489, 'max_depth': 49, 'min_samples_split': 177, 'min_samples_leaf': 94, 'criterion': 'entropy'}.
Trial 662 finished with value: 0.5543478260869565 and parameters: {'n_estimators': 462, 'max_depth': 36, 'min_samples_split': 77, 'min_samples_leaf': 100, 'criterion': 'entropy'}.
Trial 663 finished with value: 0.5760869565217391 and parameters: {'n_estimators': 420, 'max_depth': 42, 'min_samples_split': 89, 'min_samples_leaf': 97, 'criterion': 'entropy'}.
Trial 664 finished with value: 0.5543478260869565 and parameters: {'n_estimators': 439, 'max_depth': 53, 'min_samples_split': 193, 'min_samples_leaf': 93, 'criterion': 'entropy'}.
Trial 665 finished with value: 0.5543478260869565 and parameters: {'n_estimators': 509, 'max_depth': 89, 'min_samples_split': 183, 'min_samples_leaf': 50, 'criterion': 'entropy'}.
Trial 666 finished with value: 0.5543478260869565 and parameters: {'n_estimators': 493, 'max_depth': 46, 'min_samples_split': 122, 'min_samples_leaf': 95, 'criterion': 'entropy'}.
Trial 667 finished with value: 0.532608695652174 and parameters: {'n_estimators': 476, 'max_depth': 40, 'min_samples_split': 188, 'min_samples_leaf': 54, 'criterion': 'entropy'}.
Trial 668 finished with value: 0.532608695652174 and parameters: {'n_estimators': 457, 'max_depth': 43, 'min_samples_split': 197, 'min_samples_leaf': 91, 'criterion': 'entropy'}.
Trial 669 finished with value: 0.5434782608695652 and parameters: {'n_estimators': 407, 'max_depth': 38, 'min_samples_split': 190, 'min_samples_leaf': 98, 'criterion': 'entropy'}.
Trial 670 finished with value: 0.5652173913043478 and parameters: {'n_estimators': 435, 'max_depth': 49, 'min_samples_split': 185, 'min_samples_leaf': 96, 'criterion': 'entropy'}.
Trial 671 finished with value: 0.5434782608695652 and parameters: {'n_estimators': 451, 'max_depth': 51, 'min_samples_split': 193, 'min_samples_leaf': 52, 'criterion': 'entropy'}.
Trial 672 finished with value: 0.5434782608695652 and parameters: {'n_estimators': 460, 'max_depth': 56, 'min_samples_split': 181, 'min_samples_leaf': 48, 'criterion': 'entropy'}.
Trial 673 finished with value: 0.5434782608695652 and parameters: {'n_estimators': 471, 'max_depth': 45, 'min_samples_split': 200, 'min_samples_leaf': 94, 'criterion': 'entropy'}.
Trial 674 finished with value: 0.5434782608695652 and parameters: {'n_estimators': 416, 'max_depth': 83, 'min_samples_split': 178, 'min_samples_leaf': 98, 'criterion': 'entropy'}.
Trial 675 finished with value: 0.5760869565217391 and parameters: {'n_estimators': 498, 'max_depth': 48, 'min_samples_split': 189, 'min_samples_leaf': 96, 'criterion': 'entropy'}.
Trial 676 finished with value: 0.5543478260869565 and parameters: {'n_estimators': 486, 'max_depth': 43, 'min_samples_split': 196, 'min_samples_leaf': 100, 'criterion': 'entropy'}.
Trial 677 finished with value: 0.5434782608695652 and parameters: {'n_estimators': 523, 'max_depth': 41, 'min_samples_split': 186, 'min_samples_leaf': 92, 'criterion': 'entropy'}.
Trial 678 finished with value: 0.5543478260869565 and parameters: {'n_estimators': 448, 'max_depth': 54, 'min_samples_split': 176, 'min_samples_leaf': 94, 'criterion': 'entropy'}.
Trial 679 finished with value: 0.532608695652174 and parameters: {'n_estimators': 435, 'max_depth': 39, 'min_samples_split': 193, 'min_samples_leaf': 97, 'criterion': 'gini'}.
Trial 680 finished with value: 0.5543478260869565 and parameters: {'n_estimators': 472, 'max_depth': 46, 'min_samples_split': 182, 'min_samples_leaf': 50, 'criterion': 'entropy'}.
Trial 681 finished with value: 0.5434782608695652 and parameters: {'n_estimators': 427, 'max_depth': 51, 'min_samples_split': 197, 'min_samples_leaf': 98, 'criterion': 'entropy'}.
Trial 682 finished with value: 0.532608695652174 and parameters: {'n_estimators': 456, 'max_depth': 33, 'min_samples_split': 190, 'min_samples_leaf': 90, 'criterion': 'entropy'}.
Trial 683 finished with value: 0.5434782608695652 and parameters: {'n_estimators': 483, 'max_depth': 47, 'min_samples_split': 184, 'min_samples_leaf': 47, 'criterion': 'entropy'}.
Trial 684 finished with value: 0.5760869565217391 and parameters: {'n_estimators': 442, 'max_depth': 44, 'min_samples_split': 200, 'min_samples_leaf': 95, 'criterion': 'entropy'}.
Trial 685 finished with value: 0.532608695652174 and parameters: {'n_estimators': 468, 'max_depth': 28, 'min_samples_split': 71, 'min_samples_leaf': 55, 'criterion': 'entropy'}.
Trial 686 finished with value: 0.5543478260869565 and parameters: {'n_estimators': 455, 'max_depth': 21, 'min_samples_split': 194, 'min_samples_leaf': 52, 'criterion': 'entropy'}.
Trial 687 finished with value: 0.5543478260869565 and parameters: {'n_estimators': 405, 'max_depth': 41, 'min_samples_split': 187, 'min_samples_leaf': 93, 'criterion': 'entropy'}.
Trial 688 finished with value: 0.5543478260869565 and parameters: {'n_estimators': 502, 'max_depth': 87, 'min_samples_split': 176, 'min_samples_leaf': 100, 'criterion': 'entropy'}.
Trial 689 finished with value: 0.5760869565217391 and parameters: {'n_estimators': 480, 'max_depth': 45, 'min_samples_split': 192, 'min_samples_leaf': 96, 'criterion': 'entropy'}.
Trial 690 finished with value: 0.5434782608695652 and parameters: {'n_estimators': 423, 'max_depth': 49, 'min_samples_split': 181, 'min_samples_leaf': 88, 'criterion': 'gini'}.
Trial 691 finished with value: 0.5543478260869565 and parameters: {'n_estimators': 442, 'max_depth': 14, 'min_samples_split': 188, 'min_samples_leaf': 98, 'criterion': 'entropy'}.
Trial 692 finished with value: 0.532608695652174 and parameters: {'n_estimators': 466, 'max_depth': 37, 'min_samples_split': 197, 'min_samples_leaf': 92, 'criterion': 'entropy'}.
Trial 693 finished with value: 0.5543478260869565 and parameters: {'n_estimators': 491, 'max_depth': 43, 'min_samples_split': 191, 'min_samples_leaf': 95, 'criterion': 'entropy'}.
Trial 694 finished with value: 0.532608695652174 and parameters: {'n_estimators': 458, 'max_depth': 55, 'min_samples_split': 2, 'min_samples_leaf': 49, 'criterion': 'entropy'}.
Trial 695 finished with value: 0.5434782608695652 and parameters: {'n_estimators': 434, 'max_depth': 83, 'min_samples_split': 185, 'min_samples_leaf': 65, 'criterion': 'entropy'}.
Trial 696 finished with value: 0.5760869565217391 and parameters: {'n_estimators': 475, 'max_depth': 47, 'min_samples_split': 195, 'min_samples_leaf': 97, 'criterion': 'entropy'}.
Trial 697 finished with value: 0.5543478260869565 and parameters: {'n_estimators': 448, 'max_depth': 53, 'min_samples_split': 109, 'min_samples_leaf': 94, 'criterion': 'entropy'}.
Trial 698 finished with value: 0.5543478260869565 and parameters: {'n_estimators': 415, 'max_depth': 51, 'min_samples_split': 180, 'min_samples_leaf': 47, 'criterion': 'entropy'}.
Trial 699 finished with value: 0.5543478260869565 and parameters: {'n_estimators': 540, 'max_depth': 41, 'min_samples_split': 200, 'min_samples_leaf': 98, 'criterion': 'entropy'}.
Trial 700 finished with value: 0.532608695652174 and parameters: {'n_estimators': 499, 'max_depth': 46, 'min_samples_split': 189, 'min_samples_leaf': 51, 'criterion': 'entropy'}.
Trial 701 finished with value: 0.5543478260869565 and parameters: {'n_estimators': 467, 'max_depth': 43, 'min_samples_split': 176, 'min_samples_leaf': 100, 'criterion': 'entropy'}.
Trial 702 finished with value: 0.5434782608695652 and parameters: {'n_estimators': 444, 'max_depth': 49, 'min_samples_split': 193, 'min_samples_leaf': 90, 'criterion': 'gini'}.
Trial 703 finished with value: 0.5543478260869565 and parameters: {'n_estimators': 515, 'max_depth': 45, 'min_samples_split': 185, 'min_samples_leaf': 95, 'criterion': 'entropy'}.
Trial 704 finished with value: 0.5108695652173914 and parameters: {'n_estimators': 402, 'max_depth': 38, 'min_samples_split': 197, 'min_samples_leaf': 54, 'criterion': 'entropy'}.
Trial 705 finished with value: 0.5108695652173914 and parameters: {'n_estimators': 483, 'max_depth': 39, 'min_samples_split': 181, 'min_samples_leaf': 57, 'criterion': 'entropy'}.
Trial 706 finished with value: 0.5434782608695652 and parameters: {'n_estimators': 424, 'max_depth': 48, 'min_samples_split': 189, 'min_samples_leaf': 92, 'criterion': 'entropy'}.
Trial 707 finished with value: 0.5760869565217391 and parameters: {'n_estimators': 456, 'max_depth': 53, 'min_samples_split': 81, 'min_samples_leaf': 97, 'criterion': 'entropy'}.
Trial 708 finished with value: 0.5434782608695652 and parameters: {'n_estimators': 467, 'max_depth': 57, 'min_samples_split': 194, 'min_samples_leaf': 94, 'criterion': 'entropy'}.
Trial 709 finished with value: 0.5434782608695652 and parameters: {'n_estimators': 441, 'max_depth': 85, 'min_samples_split': 184, 'min_samples_leaf': 46, 'criterion': 'entropy'}.
Trial 710 finished with value: 0.5760869565217391 and parameters: {'n_estimators': 484, 'max_depth': 42, 'min_samples_split': 175, 'min_samples_leaf': 96, 'criterion': 'entropy'}.
Trial 711 finished with value: 0.5434782608695652 and parameters: {'n_estimators': 430, 'max_depth': 34, 'min_samples_split': 191, 'min_samples_leaf': 98, 'criterion': 'entropy'}.
Trial 712 finished with value: 0.532608695652174 and parameters: {'n_estimators': 458, 'max_depth': 50, 'min_samples_split': 197, 'min_samples_leaf': 49, 'criterion': 'entropy'}.
Trial 713 finished with value: 0.532608695652174 and parameters: {'n_estimators': 267, 'max_depth': 31, 'min_samples_split': 186, 'min_samples_leaf': 93, 'criterion': 'gini'}.
Trial 714 finished with value: 0.5217391304347826 and parameters: {'n_estimators': 472, 'max_depth': 8, 'min_samples_split': 178, 'min_samples_leaf': 100, 'criterion': 'entropy'}.
Trial 715 finished with value: 0.5434782608695652 and parameters: {'n_estimators': 447, 'max_depth': 82, 'min_samples_split': 193, 'min_samples_leaf': 53, 'criterion': 'entropy'}.
Trial 716 finished with value: 0.5543478260869565 and parameters: {'n_estimators': 506, 'max_depth': 44, 'min_samples_split': 188, 'min_samples_leaf': 97, 'criterion': 'entropy'}.
Trial 717 finished with value: 0.5217391304347826 and parameters: {'n_estimators': 397, 'max_depth': 40, 'min_samples_split': 197, 'min_samples_leaf': 84, 'criterion': 'entropy'}.
Trial 718 finished with value: 0.532608695652174 and parameters: {'n_estimators': 416, 'max_depth': 47, 'min_samples_split': 200, 'min_samples_leaf': 68, 'criterion': 'entropy'}.
Trial 719 finished with value: 0.5760869565217391 and parameters: {'n_estimators': 484, 'max_depth': 16, 'min_samples_split': 182, 'min_samples_leaf': 96, 'criterion': 'entropy'}.
Trial 720 finished with value: 0.5543478260869565 and parameters: {'n_estimators': 699, 'max_depth': 23, 'min_samples_split': 173, 'min_samples_leaf': 94, 'criterion': 'entropy'}.
Trial 721 finished with value: 0.5434782608695652 and parameters: {'n_estimators': 219, 'max_depth': 45, 'min_samples_split': 192, 'min_samples_leaf': 91, 'criterion': 'entropy'}.
Trial 722 finished with value: 0.5543478260869565 and parameters: {'n_estimators': 466, 'max_depth': 52, 'min_samples_split': 180, 'min_samples_leaf': 51, 'criterion': 'entropy'}.
Trial 723 finished with value: 0.5543478260869565 and parameters: {'n_estimators': 654, 'max_depth': 42, 'min_samples_split': 187, 'min_samples_leaf': 99, 'criterion': 'entropy'}.
Trial 724 finished with value: 0.5543478260869565 and parameters: {'n_estimators': 438, 'max_depth': 56, 'min_samples_split': 190, 'min_samples_leaf': 95, 'criterion': 'gini'}.
Trial 725 finished with value: 0.5543478260869565 and parameters: {'n_estimators': 454, 'max_depth': 50, 'min_samples_split': 195, 'min_samples_leaf': 48, 'criterion': 'entropy'}.
Trial 726 finished with value: 0.5652173913043478 and parameters: {'n_estimators': 284, 'max_depth': 47, 'min_samples_split': 184, 'min_samples_leaf': 98, 'criterion': 'entropy'}.
Trial 727 finished with value: 0.5543478260869565 and parameters: {'n_estimators': 487, 'max_depth': 44, 'min_samples_split': 53, 'min_samples_leaf': 93, 'criterion': 'entropy'}.
Trial 728 finished with value: 0.5652173913043478 and parameters: {'n_estimators': 297, 'max_depth': 59, 'min_samples_split': 31, 'min_samples_leaf': 96, 'criterion': 'entropy'}.
Trial 729 finished with value: 0.532608695652174 and parameters: {'n_estimators': 431, 'max_depth': 89, 'min_samples_split': 177, 'min_samples_leaf': 51, 'criterion': 'entropy'}.
Trial 730 finished with value: 0.5434782608695652 and parameters: {'n_estimators': 469, 'max_depth': 54, 'min_samples_split': 200, 'min_samples_leaf': 45, 'criterion': 'entropy'}.
Trial 731 finished with value: 0.5543478260869565 and parameters: {'n_estimators': 450, 'max_depth': 40, 'min_samples_split': 190, 'min_samples_leaf': 89, 'criterion': 'entropy'}.
Trial 732 finished with value: 0.5543478260869565 and parameters: {'n_estimators': 251, 'max_depth': 48, 'min_samples_split': 195, 'min_samples_leaf': 95, 'criterion': 'entropy'}.
Trial 733 finished with value: 0.532608695652174 and parameters: {'n_estimators': 500, 'max_depth': 35, 'min_samples_split': 183, 'min_samples_leaf': 61, 'criterion': 'entropy'}.
Trial 734 finished with value: 0.5434782608695652 and parameters: {'n_estimators': 413, 'max_depth': 37, 'min_samples_split': 188, 'min_samples_leaf': 98, 'criterion': 'entropy'}.
Trial 735 finished with value: 0.5217391304347826 and parameters: {'n_estimators': 470, 'max_depth': 43, 'min_samples_split': 173, 'min_samples_leaf': 7, 'criterion': 'entropy'}.
Trial 736 finished with value: 0.5543478260869565 and parameters: {'n_estimators': 451, 'max_depth': 51, 'min_samples_split': 193, 'min_samples_leaf': 92, 'criterion': 'gini'}.
Trial 737 finished with value: 0.5217391304347826 and parameters: {'n_estimators': 520, 'max_depth': 10, 'min_samples_split': 179, 'min_samples_leaf': 49, 'criterion': 'entropy'}.
Trial 738 finished with value: 0.5543478260869565 and parameters: {'n_estimators': 602, 'max_depth': 46, 'min_samples_split': 185, 'min_samples_leaf': 100, 'criterion': 'entropy'}.
Trial 739 finished with value: 0.5108695652173914 and parameters: {'n_estimators': 431, 'max_depth': 42, 'min_samples_split': 197, 'min_samples_leaf': 55, 'criterion': 'entropy'}.
