Trial 254 finished with value: 0.532608695652174 and parameters: {'n_estimators': 223, 'max_depth': 13, 'min_samples_split': 51, 'min_samples_leaf': 55, 'criterion': 'gini'}.
Trial 255 finished with value: 0.5652173913043478 and parameters: {'n_estimators': 227, 'max_depth': 12, 'min_samples_split': 53, 'min_samples_leaf': 54, 'criterion': 'gini'}.
Trial 256 finished with value: 0.5543478260869565 and parameters: {'n_estimators': 221, 'max_depth': 12, 'min_samples_split': 52, 'min_samples_leaf': 56, 'criterion': 'gini'}.
Trial 257 finished with value: 0.4891304347826087 and parameters: {'n_estimators': 224, 'max_depth': 11, 'min_samples_split': 51, 'min_samples_leaf': 55, 'criterion': 'gini'}.
Trial 258 finished with value: 0.5652173913043478 and parameters: {'n_estimators': 229, 'max_depth': 12, 'min_samples_split': 50, 'min_samples_leaf': 54, 'criterion': 'gini'}.
Trial 259 finished with value: 0.5760869565217391 and parameters: {'n_estimators': 226, 'max_depth': 12, 'min_samples_split': 52, 'min_samples_leaf': 55, 'criterion': 'gini'}.
Trial 260 finished with value: 0.532608695652174 and parameters: {'n_estimators': 222, 'max_depth': 13, 'min_samples_split': 54, 'min_samples_leaf': 55, 'criterion': 'gini'}.
Trial 261 finished with value: 0.5543478260869565 and parameters: {'n_estimators': 219, 'max_depth': 12, 'min_samples_split': 51, 'min_samples_leaf': 56, 'criterion': 'gini'}.
Trial 262 finished with value: 0.5652173913043478 and parameters: {'n_estimators': 231, 'max_depth': 12, 'min_samples_split': 52, 'min_samples_leaf': 55, 'criterion': 'gini'}.
Trial 263 finished with value: 0.5543478260869565 and parameters: {'n_estimators': 216, 'max_depth': 12, 'min_samples_split': 53, 'min_samples_leaf': 54, 'criterion': 'gini'}.
Trial 264 finished with value: 0.5543478260869565 and parameters: {'n_estimators': 224, 'max_depth': 12, 'min_samples_split': 52, 'min_samples_leaf': 56, 'criterion': 'gini'}.
Trial 265 finished with value: 0.5652173913043478 and parameters: {'n_estimators': 228, 'max_depth': 12, 'min_samples_split': 51, 'min_samples_leaf': 55, 'criterion': 'gini'}.
Trial 266 finished with value: 0.5652173913043478 and parameters: {'n_estimators': 220, 'max_depth': 12, 'min_samples_split': 51, 'min_samples_leaf': 54, 'criterion': 'gini'}.
Trial 267 finished with value: 0.5434782608695652 and parameters: {'n_estimators': 226, 'max_depth': 13, 'min_samples_split': 52, 'min_samples_leaf': 55, 'criterion': 'gini'}.
Trial 268 finished with value: 0.5108695652173914 and parameters: {'n_estimators': 223, 'max_depth': 11, 'min_samples_split': 53, 'min_samples_leaf': 56, 'criterion': 'entropy'}.
Trial 269 finished with value: 0.5760869565217391 and parameters: {'n_estimators': 222, 'max_depth': 12, 'min_samples_split': 50, 'min_samples_leaf': 55, 'criterion': 'gini'}.
Trial 270 finished with value: 0.5760869565217391 and parameters: {'n_estimators': 225, 'max_depth': 12, 'min_samples_split': 52, 'min_samples_leaf': 55, 'criterion': 'gini'}.
Trial 271 finished with value: 0.5652173913043478 and parameters: {'n_estimators': 218, 'max_depth': 12, 'min_samples_split': 51, 'min_samples_leaf': 54, 'criterion': 'gini'}.
Trial 272 finished with value: 0.5760869565217391 and parameters: {'n_estimators': 227, 'max_depth': 12, 'min_samples_split': 53, 'min_samples_leaf': 55, 'criterion': 'gini'}.
Trial 273 finished with value: 0.5543478260869565 and parameters: {'n_estimators': 221, 'max_depth': 12, 'min_samples_split': 52, 'min_samples_leaf': 56, 'criterion': 'gini'}.
Trial 274 finished with value: 0.4891304347826087 and parameters: {'n_estimators': 224, 'max_depth': 11, 'min_samples_split': 54, 'min_samples_leaf': 55, 'criterion': 'gini'}.
Trial 275 finished with value: 0.5652173913043478 and parameters: {'n_estimators': 220, 'max_depth': 12, 'min_samples_split': 51, 'min_samples_leaf': 54, 'criterion': 'gini'}.
Trial 276 finished with value: 0.5652173913043478 and parameters: {'n_estimators': 230, 'max_depth': 12, 'min_samples_split': 53, 'min_samples_leaf': 55, 'criterion': 'gini'}.
Trial 277 finished with value: 0.5543478260869565 and parameters: {'n_estimators': 226, 'max_depth': 12, 'min_samples_split': 42, 'min_samples_leaf': 56, 'criterion': 'gini'}.
Trial 278 finished with value: 0.5434782608695652 and parameters: {'n_estimators': 223, 'max_depth': 13, 'min_samples_split': 50, 'min_samples_leaf': 54, 'criterion': 'gini'}.
Trial 279 finished with value: 0.5652173913043478 and parameters: {'n_estimators': 218, 'max_depth': 12, 'min_samples_split': 52, 'min_samples_leaf': 55, 'criterion': 'gini'}.
