Trial 2998 finished with value: 0.6739130434782609 and parameters: {'n_estimators': 844, 'max_depth': 79, 'min_samples_split': 21, 'min_samples_leaf': 57, 'criterion': 'entropy'}.
Trial 2999 finished with value: 0.7282608695652174 and parameters: {'n_estimators': 194, 'max_depth': 11, 'min_samples_split': 32, 'min_samples_leaf': 53, 'criterion': 'entropy'}.
Trial 3000 finished with value: 0.6847826086956522 and parameters: {'n_estimators': 334, 'max_depth': 13, 'min_samples_split': 27, 'min_samples_leaf': 54, 'criterion': 'entropy'}.
Trial 3001 finished with value: 0.7065217391304348 and parameters: {'n_estimators': 296, 'max_depth': 9, 'min_samples_split': 36, 'min_samples_leaf': 59, 'criterion': 'entropy'}.
Trial 3002 finished with value: 0.6739130434782609 and parameters: {'n_estimators': 823, 'max_depth': 17, 'min_samples_split': 122, 'min_samples_leaf': 56, 'criterion': 'entropy'}.
Trial 3003 finished with value: 0.717391304347826 and parameters: {'n_estimators': 703, 'max_depth': 11, 'min_samples_split': 43, 'min_samples_leaf': 61, 'criterion': 'entropy'}.
Trial 3004 finished with value: 0.6739130434782609 and parameters: {'n_estimators': 790, 'max_depth': 7, 'min_samples_split': 25, 'min_samples_leaf': 52, 'criterion': 'entropy'}.
Trial 3005 finished with value: 0.7065217391304348 and parameters: {'n_estimators': 761, 'max_depth': 13, 'min_samples_split': 18, 'min_samples_leaf': 57, 'criterion': 'entropy'}.
Trial 3006 finished with value: 0.6956521739130435 and parameters: {'n_estimators': 777, 'max_depth': 9, 'min_samples_split': 31, 'min_samples_leaf': 54, 'criterion': 'gini'}.
Trial 3007 finished with value: 0.6521739130434783 and parameters: {'n_estimators': 816, 'max_depth': 5, 'min_samples_split': 145, 'min_samples_leaf': 59, 'criterion': 'entropy'}.
Trial 3008 finished with value: 0.6630434782608695 and parameters: {'n_estimators': 887, 'max_depth': 47, 'min_samples_split': 24, 'min_samples_leaf': 52, 'criterion': 'entropy'}.
Trial 3009 finished with value: 0.6847826086956522 and parameters: {'n_estimators': 366, 'max_depth': 15, 'min_samples_split': 39, 'min_samples_leaf': 55, 'criterion': 'entropy'}.
Trial 3010 finished with value: 0.7065217391304348 and parameters: {'n_estimators': 744, 'max_depth': 10, 'min_samples_split': 34, 'min_samples_leaf': 65, 'criterion': 'entropy'}.
Trial 3011 finished with value: 0.7065217391304348 and parameters: {'n_estimators': 800, 'max_depth': 12, 'min_samples_split': 46, 'min_samples_leaf': 57, 'criterion': 'entropy'}.
Trial 3012 finished with value: 0.7065217391304348 and parameters: {'n_estimators': 260, 'max_depth': 8, 'min_samples_split': 29, 'min_samples_leaf': 75, 'criterion': 'entropy'}.
Trial 3013 finished with value: 0.7282608695652174 and parameters: {'n_estimators': 312, 'max_depth': 11, 'min_samples_split': 14, 'min_samples_leaf': 60, 'criterion': 'entropy'}.
Trial 3014 finished with value: 0.6630434782608695 and parameters: {'n_estimators': 860, 'max_depth': 31, 'min_samples_split': 20, 'min_samples_leaf': 55, 'criterion': 'entropy'}.
Trial 3015 finished with value: 0.6956521739130435 and parameters: {'n_estimators': 139, 'max_depth': 14, 'min_samples_split': 35, 'min_samples_leaf': 63, 'criterion': 'entropy'}.
Trial 3016 finished with value: 0.7282608695652174 and parameters: {'n_estimators': 724, 'max_depth': 10, 'min_samples_split': 26, 'min_samples_leaf': 52, 'criterion': 'entropy'}.
Trial 3017 finished with value: 0.7065217391304348 and parameters: {'n_estimators': 756, 'max_depth': 13, 'min_samples_split': 179, 'min_samples_leaf': 58, 'criterion': 'entropy'}.
Trial 3018 finished with value: 0.7065217391304348 and parameters: {'n_estimators': 829, 'max_depth': 7, 'min_samples_split': 39, 'min_samples_leaf': 61, 'criterion': 'entropy'}.
Trial 3019 finished with value: 0.717391304347826 and parameters: {'n_estimators': 775, 'max_depth': 16, 'min_samples_split': 31, 'min_samples_leaf': 56, 'criterion': 'entropy'}.
Trial 3020 finished with value: 0.6847826086956522 and parameters: {'n_estimators': 800, 'max_depth': 9, 'min_samples_split': 23, 'min_samples_leaf': 53, 'criterion': 'entropy'}.
Trial 3021 finished with value: 0.7065217391304348 and parameters: {'n_estimators': 845, 'max_depth': 12, 'min_samples_split': 28, 'min_samples_leaf': 59, 'criterion': 'entropy'}.
Trial 3022 finished with value: 0.6956521739130435 and parameters: {'n_estimators': 741, 'max_depth': 11, 'min_samples_split': 33, 'min_samples_leaf': 55, 'criterion': 'entropy'}.
Trial 3023 finished with value: 0.6956521739130435 and parameters: {'n_estimators': 812, 'max_depth': 14, 'min_samples_split': 36, 'min_samples_leaf': 52, 'criterion': 'entropy'}.
Trial 3024 finished with value: 0.6847826086956522 and parameters: {'n_estimators': 783, 'max_depth': 18, 'min_samples_split': 41, 'min_samples_leaf': 57, 'criterion': 'gini'}.
Trial 3025 finished with value: 0.6739130434782609 and parameters: {'n_estimators': 761, 'max_depth': 7, 'min_samples_split': 19, 'min_samples_leaf': 54, 'criterion': 'entropy'}.
Trial 3026 finished with value: 0.7065217391304348 and parameters: {'n_estimators': 982, 'max_depth': 9, 'min_samples_split': 82, 'min_samples_leaf': 61, 'criterion': 'entropy'}.
Trial 3027 finished with value: 0.7065217391304348 and parameters: {'n_estimators': 387, 'max_depth': 12, 'min_samples_split': 24, 'min_samples_leaf': 58, 'criterion': 'entropy'}.
Trial 3028 finished with value: 0.717391304347826 and parameters: {'n_estimators': 875, 'max_depth': 10, 'min_samples_split': 29, 'min_samples_leaf': 52, 'criterion': 'entropy'}.
Trial 3029 finished with value: 0.6413043478260869 and parameters: {'n_estimators': 837, 'max_depth': 5, 'min_samples_split': 9, 'min_samples_leaf': 56, 'criterion': 'entropy'}.
Trial 3030 finished with value: 0.6630434782608695 and parameters: {'n_estimators': 714, 'max_depth': 15, 'min_samples_split': 32, 'min_samples_leaf': 59, 'criterion': 'entropy'}.
Trial 3031 finished with value: 0.717391304347826 and parameters: {'n_estimators': 819, 'max_depth': 8, 'min_samples_split': 37, 'min_samples_leaf': 54, 'criterion': 'entropy'}.
Trial 3032 finished with value: 0.6956521739130435 and parameters: {'n_estimators': 794, 'max_depth': 13, 'min_samples_split': 22, 'min_samples_leaf': 57, 'criterion': 'entropy'}.
Trial 3033 finished with value: 0.717391304347826 and parameters: {'n_estimators': 770, 'max_depth': 11, 'min_samples_split': 13, 'min_samples_leaf': 62, 'criterion': 'entropy'}.
Trial 3034 finished with value: 0.6847826086956522 and parameters: {'n_estimators': 739, 'max_depth': 9, 'min_samples_split': 26, 'min_samples_leaf': 52, 'criterion': 'entropy'}.
Trial 3035 finished with value: 0.6847826086956522 and parameters: {'n_estimators': 278, 'max_depth': 16, 'min_samples_split': 45, 'min_samples_leaf': 55, 'criterion': 'entropy'}.
Trial 3036 finished with value: 0.7065217391304348 and parameters: {'n_estimators': 853, 'max_depth': 7, 'min_samples_split': 31, 'min_samples_leaf': 60, 'criterion': 'entropy'}.
Trial 3037 finished with value: 0.7065217391304348 and parameters: {'n_estimators': 348, 'max_depth': 13, 'min_samples_split': 35, 'min_samples_leaf': 57, 'criterion': 'entropy'}.
Trial 3038 finished with value: 0.6847826086956522 and parameters: {'n_estimators': 807, 'max_depth': 11, 'min_samples_split': 17, 'min_samples_leaf': 52, 'criterion': 'entropy'}.
Trial 3039 finished with value: 0.717391304347826 and parameters: {'n_estimators': 695, 'max_depth': 9, 'min_samples_split': 28, 'min_samples_leaf': 55, 'criterion': 'entropy'}.
Trial 3040 finished with value: 0.6956521739130435 and parameters: {'n_estimators': 785, 'max_depth': 14, 'min_samples_split': 40, 'min_samples_leaf': 59, 'criterion': 'entropy'}.
Trial 3041 finished with value: 0.6739130434782609 and parameters: {'n_estimators': 753, 'max_depth': 19, 'min_samples_split': 23, 'min_samples_leaf': 54, 'criterion': 'entropy'}.
Trial 3042 finished with value: 0.7065217391304348 and parameters: {'n_estimators': 933, 'max_depth': 11, 'min_samples_split': 30, 'min_samples_leaf': 63, 'criterion': 'entropy'}.
Trial 3043 finished with value: 0.6847826086956522 and parameters: {'n_estimators': 825, 'max_depth': 6, 'min_samples_split': 34, 'min_samples_leaf': 58, 'criterion': 'gini'}.
Trial 3044 finished with value: 0.6847826086956522 and parameters: {'n_estimators': 725, 'max_depth': 12, 'min_samples_split': 21, 'min_samples_leaf': 61, 'criterion': 'entropy'}.
Trial 3045 finished with value: 0.6956521739130435 and parameters: {'n_estimators': 244, 'max_depth': 9, 'min_samples_split': 26, 'min_samples_leaf': 52, 'criterion': 'entropy'}.
Trial 3046 finished with value: 0.6847826086956522 and parameters: {'n_estimators': 467, 'max_depth': 15, 'min_samples_split': 37, 'min_samples_leaf': 56, 'criterion': 'entropy'}.
Trial 3047 finished with value: 0.6847826086956522 and parameters: {'n_estimators': 764, 'max_depth': 10, 'min_samples_split': 49, 'min_samples_leaf': 67, 'criterion': 'entropy'}.
Trial 3048 finished with value: 0.717391304347826 and parameters: {'n_estimators': 798, 'max_depth': 13, 'min_samples_split': 137, 'min_samples_leaf': 57, 'criterion': 'entropy'}.
Trial 3049 finished with value: 0.6739130434782609 and parameters: {'n_estimators': 905, 'max_depth': 6, 'min_samples_split': 42, 'min_samples_leaf': 54, 'criterion': 'entropy'}.
Trial 3050 finished with value: 0.6847826086956522 and parameters: {'n_estimators': 316, 'max_depth': 17, 'min_samples_split': 32, 'min_samples_leaf': 59, 'criterion': 'entropy'}.
Trial 3051 finished with value: 0.7065217391304348 and parameters: {'n_estimators': 842, 'max_depth': 11, 'min_samples_split': 28, 'min_samples_leaf': 53, 'criterion': 'entropy'}.
Trial 3052 finished with value: 0.7282608695652174 and parameters: {'n_estimators': 864, 'max_depth': 8, 'min_samples_split': 19, 'min_samples_leaf': 56, 'criterion': 'entropy'}.
Trial 3053 finished with value: 0.6956521739130435 and parameters: {'n_estimators': 778, 'max_depth': 14, 'min_samples_split': 38, 'min_samples_leaf': 52, 'criterion': 'entropy'}.
Trial 3054 finished with value: 0.717391304347826 and parameters: {'n_estimators': 813, 'max_depth': 10, 'min_samples_split': 24, 'min_samples_leaf': 58, 'criterion': 'entropy'}.
Trial 3055 finished with value: 0.6847826086956522 and parameters: {'n_estimators': 750, 'max_depth': 12, 'min_samples_split': 33, 'min_samples_leaf': 63, 'criterion': 'entropy'}.
Trial 3056 finished with value: 0.717391304347826 and parameters: {'n_estimators': 790, 'max_depth': 8, 'min_samples_split': 28, 'min_samples_leaf': 60, 'criterion': 'entropy'}.
Trial 3057 finished with value: 0.6630434782608695 and parameters: {'n_estimators': 293, 'max_depth': 67, 'min_samples_split': 72, 'min_samples_leaf': 55, 'criterion': 'entropy'}.
Trial 3058 finished with value: 0.6956521739130435 and parameters: {'n_estimators': 826, 'max_depth': 16, 'min_samples_split': 16, 'min_samples_leaf': 57, 'criterion': 'entropy'}.
Trial 3059 finished with value: 0.717391304347826 and parameters: {'n_estimators': 731, 'max_depth': 13, 'min_samples_split': 34, 'min_samples_leaf': 51, 'criterion': 'entropy'}.
Trial 3060 finished with value: 0.6956521739130435 and parameters: {'n_estimators': 768, 'max_depth': 7, 'min_samples_split': 25, 'min_samples_leaf': 65, 'criterion': 'entropy'}.
Trial 3061 finished with value: 0.717391304347826 and parameters: {'n_estimators': 336, 'max_depth': 10, 'min_samples_split': 39, 'min_samples_leaf': 60, 'criterion': 'entropy'}.
Trial 3062 finished with value: 0.7065217391304348 and parameters: {'n_estimators': 802, 'max_depth': 12, 'min_samples_split': 197, 'min_samples_leaf': 54, 'criterion': 'gini'}.
Trial 3063 finished with value: 0.6413043478260869 and parameters: {'n_estimators': 709, 'max_depth': 5, 'min_samples_split': 30, 'min_samples_leaf': 58, 'criterion': 'entropy'}.
Trial 3064 finished with value: 0.7065217391304348 and parameters: {'n_estimators': 115, 'max_depth': 9, 'min_samples_split': 57, 'min_samples_leaf': 61, 'criterion': 'entropy'}.
Trial 3065 finished with value: 0.7065217391304348 and parameters: {'n_estimators': 776, 'max_depth': 14, 'min_samples_split': 20, 'min_samples_leaf': 51, 'criterion': 'entropy'}.
Trial 3066 finished with value: 0.6956521739130435 and parameters: {'n_estimators': 834, 'max_depth': 11, 'min_samples_split': 35, 'min_samples_leaf': 34, 'criterion': 'entropy'}.
Trial 3067 finished with value: 0.6956521739130435 and parameters: {'n_estimators': 180, 'max_depth': 8, 'min_samples_split': 128, 'min_samples_leaf': 55, 'criterion': 'entropy'}.
Trial 3068 finished with value: 0.6956521739130435 and parameters: {'n_estimators': 752, 'max_depth': 15, 'min_samples_split': 44, 'min_samples_leaf': 53, 'criterion': 'entropy'}.
Trial 3069 finished with value: 0.7065217391304348 and parameters: {'n_estimators': 849, 'max_depth': 12, 'min_samples_split': 27, 'min_samples_leaf': 56, 'criterion': 'entropy'}.
Trial 3070 finished with value: 0.717391304347826 and parameters: {'n_estimators': 812, 'max_depth': 10, 'min_samples_split': 5, 'min_samples_leaf': 58, 'criterion': 'entropy'}.
Trial 3071 finished with value: 0.6739130434782609 and parameters: {'n_estimators': 891, 'max_depth': 7, 'min_samples_split': 32, 'min_samples_leaf': 51, 'criterion': 'entropy'}.
Trial 3072 finished with value: 0.6847826086956522 and parameters: {'n_estimators': 736, 'max_depth': 17, 'min_samples_split': 22, 'min_samples_leaf': 62, 'criterion': 'entropy'}.
Trial 3073 finished with value: 0.7065217391304348 and parameters: {'n_estimators': 774, 'max_depth': 13, 'min_samples_split': 14, 'min_samples_leaf': 54, 'criterion': 'entropy'}.
Trial 3074 finished with value: 0.7065217391304348 and parameters: {'n_estimators': 792, 'max_depth': 10, 'min_samples_split': 38, 'min_samples_leaf': 59, 'criterion': 'entropy'}.
Trial 3075 finished with value: 0.7282608695652174 and parameters: {'n_estimators': 868, 'max_depth': 8, 'min_samples_split': 30, 'min_samples_leaf': 56, 'criterion': 'entropy'}.
Trial 3076 finished with value: 0.717391304347826 and parameters: {'n_estimators': 822, 'max_depth': 12, 'min_samples_split': 25, 'min_samples_leaf': 52, 'criterion': 'entropy'}.
Trial 3077 finished with value: 0.6847826086956522 and parameters: {'n_estimators': 101, 'max_depth': 15, 'min_samples_split': 35, 'min_samples_leaf': 57, 'criterion': 'entropy'}.
Trial 3078 finished with value: 0.717391304347826 and parameters: {'n_estimators': 423, 'max_depth': 10, 'min_samples_split': 29, 'min_samples_leaf': 60, 'criterion': 'entropy'}.
Trial 3079 finished with value: 0.6739130434782609 and parameters: {'n_estimators': 760, 'max_depth': 7, 'min_samples_split': 18, 'min_samples_leaf': 54, 'criterion': 'entropy'}.
Trial 3080 finished with value: 0.6956521739130435 and parameters: {'n_estimators': 803, 'max_depth': 13, 'min_samples_split': 23, 'min_samples_leaf': 56, 'criterion': 'entropy'}.
Trial 3081 finished with value: 0.6304347826086957 and parameters: {'n_estimators': 686, 'max_depth': 5, 'min_samples_split': 39, 'min_samples_leaf': 51, 'criterion': 'entropy'}.
Trial 3082 finished with value: 0.6956521739130435 and parameters: {'n_estimators': 721, 'max_depth': 9, 'min_samples_split': 33, 'min_samples_leaf': 58, 'criterion': 'gini'}.
Trial 3083 finished with value: 0.717391304347826 and parameters: {'n_estimators': 741, 'max_depth': 11, 'min_samples_split': 27, 'min_samples_leaf': 62, 'criterion': 'entropy'}.
Trial 3084 finished with value: 0.717391304347826 and parameters: {'n_estimators': 311, 'max_depth': 14, 'min_samples_split': 189, 'min_samples_leaf': 53, 'criterion': 'entropy'}.
Trial 3085 finished with value: 0.6630434782608695 and parameters: {'n_estimators': 834, 'max_depth': 69, 'min_samples_split': 32, 'min_samples_leaf': 60, 'criterion': 'entropy'}.
Trial 3086 finished with value: 0.6521739130434783 and parameters: {'n_estimators': 790, 'max_depth': 19, 'min_samples_split': 42, 'min_samples_leaf': 55, 'criterion': 'entropy'}.
Trial 3087 finished with value: 0.6956521739130435 and parameters: {'n_estimators': 152, 'max_depth': 11, 'min_samples_split': 21, 'min_samples_leaf': 51, 'criterion': 'entropy'}.
Trial 3088 finished with value: 0.6956521739130435 and parameters: {'n_estimators': 760, 'max_depth': 16, 'min_samples_split': 36, 'min_samples_leaf': 57, 'criterion': 'entropy'}.
Trial 3089 finished with value: 0.7065217391304348 and parameters: {'n_estimators': 814, 'max_depth': 9, 'min_samples_split': 12, 'min_samples_leaf': 59, 'criterion': 'entropy'}.
Trial 3090 finished with value: 0.717391304347826 and parameters: {'n_estimators': 856, 'max_depth': 13, 'min_samples_split': 52, 'min_samples_leaf': 53, 'criterion': 'entropy'}.
Trial 3091 finished with value: 0.6630434782608695 and parameters: {'n_estimators': 777, 'max_depth': 22, 'min_samples_split': 28, 'min_samples_leaf': 55, 'criterion': 'entropy'}.
Trial 3092 finished with value: 0.6956521739130435 and parameters: {'n_estimators': 748, 'max_depth': 7, 'min_samples_split': 44, 'min_samples_leaf': 64, 'criterion': 'entropy'}.
Trial 3093 finished with value: 0.717391304347826 and parameters: {'n_estimators': 354, 'max_depth': 11, 'min_samples_split': 24, 'min_samples_leaf': 57, 'criterion': 'entropy'}.
Trial 3094 finished with value: 0.7065217391304348 and parameters: {'n_estimators': 284, 'max_depth': 8, 'min_samples_split': 31, 'min_samples_leaf': 51, 'criterion': 'entropy'}.
Trial 3095 finished with value: 0.7065217391304348 and parameters: {'n_estimators': 793, 'max_depth': 14, 'min_samples_split': 36, 'min_samples_leaf': 61, 'criterion': 'entropy'}.
Trial 3096 finished with value: 0.7282608695652174 and parameters: {'n_estimators': 327, 'max_depth': 10, 'min_samples_split': 17, 'min_samples_leaf': 53, 'criterion': 'entropy'}.
Trial 3097 finished with value: 0.717391304347826 and parameters: {'n_estimators': 834, 'max_depth': 12, 'min_samples_split': 26, 'min_samples_leaf': 58, 'criterion': 'entropy'}.
Trial 3098 finished with value: 0.6304347826086957 and parameters: {'n_estimators': 715, 'max_depth': 5, 'min_samples_split': 31, 'min_samples_leaf': 55, 'criterion': 'entropy'}.
Trial 3099 finished with value: 0.6847826086956522 and parameters: {'n_estimators': 223, 'max_depth': 17, 'min_samples_split': 89, 'min_samples_leaf': 50, 'criterion': 'gini'}.
Trial 3100 finished with value: 0.717391304347826 and parameters: {'n_estimators': 265, 'max_depth': 8, 'min_samples_split': 39, 'min_samples_leaf': 59, 'criterion': 'entropy'}.
Trial 3101 finished with value: 0.6956521739130435 and parameters: {'n_estimators': 809, 'max_depth': 15, 'min_samples_split': 22, 'min_samples_leaf': 56, 'criterion': 'entropy'}.
Trial 3102 finished with value: 0.7065217391304348 and parameters: {'n_estimators': 763, 'max_depth': 10, 'min_samples_split': 27, 'min_samples_leaf': 53, 'criterion': 'entropy'}.
Trial 3103 finished with value: 0.6956521739130435 and parameters: {'n_estimators': 782, 'max_depth': 13, 'min_samples_split': 158, 'min_samples_leaf': 61, 'criterion': 'entropy'}.
Trial 3104 finished with value: 0.6956521739130435 and parameters: {'n_estimators': 875, 'max_depth': 12, 'min_samples_split': 35, 'min_samples_leaf': 57, 'criterion': 'entropy'}.
Trial 3105 finished with value: 0.6847826086956522 and parameters: {'n_estimators': 733, 'max_depth': 9, 'min_samples_split': 19, 'min_samples_leaf': 51, 'criterion': 'entropy'}.
Trial 3106 finished with value: 0.6847826086956522 and parameters: {'n_estimators': 846, 'max_depth': 7, 'min_samples_split': 41, 'min_samples_leaf': 54, 'criterion': 'entropy'}.
Trial 3107 finished with value: 0.7065217391304348 and parameters: {'n_estimators': 820, 'max_depth': 10, 'min_samples_split': 30, 'min_samples_leaf': 63, 'criterion': 'entropy'}.
Trial 3108 finished with value: 0.7065217391304348 and parameters: {'n_estimators': 923, 'max_depth': 14, 'min_samples_split': 46, 'min_samples_leaf': 59, 'criterion': 'entropy'}.
Trial 3109 finished with value: 0.7065217391304348 and parameters: {'n_estimators': 800, 'max_depth': 12, 'min_samples_split': 33, 'min_samples_leaf': 55, 'criterion': 'entropy'}.
Trial 3110 finished with value: 0.717391304347826 and parameters: {'n_estimators': 774, 'max_depth': 11, 'min_samples_split': 25, 'min_samples_leaf': 50, 'criterion': 'entropy'}.
Trial 3111 finished with value: 0.6956521739130435 and parameters: {'n_estimators': 750, 'max_depth': 9, 'min_samples_split': 37, 'min_samples_leaf': 57, 'criterion': 'entropy'}.
Trial 3112 finished with value: 0.6630434782608695 and parameters: {'n_estimators': 788, 'max_depth': 16, 'min_samples_split': 15, 'min_samples_leaf': 52, 'criterion': 'entropy'}.
Trial 3113 finished with value: 0.6847826086956522 and parameters: {'n_estimators': 821, 'max_depth': 6, 'min_samples_split': 30, 'min_samples_leaf': 61, 'criterion': 'entropy'}.
Trial 3114 finished with value: 0.6956521739130435 and parameters: {'n_estimators': 703, 'max_depth': 14, 'min_samples_split': 67, 'min_samples_leaf': 59, 'criterion': 'entropy'}.
Trial 3115 finished with value: 0.6630434782608695 and parameters: {'n_estimators': 303, 'max_depth': 25, 'min_samples_split': 9, 'min_samples_leaf': 55, 'criterion': 'entropy'}.
Trial 3116 finished with value: 0.7065217391304348 and parameters: {'n_estimators': 838, 'max_depth': 11, 'min_samples_split': 22, 'min_samples_leaf': 53, 'criterion': 'entropy'}.
Trial 3117 finished with value: 0.7065217391304348 and parameters: {'n_estimators': 737, 'max_depth': 8, 'min_samples_split': 27, 'min_samples_leaf': 58, 'criterion': 'entropy'}.
Trial 3118 finished with value: 0.7065217391304348 and parameters: {'n_estimators': 764, 'max_depth': 12, 'min_samples_split': 33, 'min_samples_leaf': 50, 'criterion': 'gini'}.
Trial 3119 finished with value: 0.7282608695652174 and parameters: {'n_estimators': 954, 'max_depth': 9, 'min_samples_split': 41, 'min_samples_leaf': 56, 'criterion': 'entropy'}.
