Trial 2754 finished with value: 0.6956521739130435 and parameters: {'n_estimators': 113, 'max_depth': 9, 'min_samples_split': 16, 'min_samples_leaf': 65, 'criterion': 'entropy'}.
Trial 2755 finished with value: 0.6521739130434783 and parameters: {'n_estimators': 301, 'max_depth': 11, 'min_samples_split': 12, 'min_samples_leaf': 3, 'criterion': 'entropy'}.
Trial 2756 finished with value: 0.7065217391304348 and parameters: {'n_estimators': 188, 'max_depth': 8, 'min_samples_split': 22, 'min_samples_leaf': 59, 'criterion': 'entropy'}.
Trial 2757 finished with value: 0.7282608695652174 and parameters: {'n_estimators': 178, 'max_depth': 14, 'min_samples_split': 22, 'min_samples_leaf': 61, 'criterion': 'entropy'}.
Trial 2758 finished with value: 0.717391304347826 and parameters: {'n_estimators': 407, 'max_depth': 10, 'min_samples_split': 19, 'min_samples_leaf': 57, 'criterion': 'entropy'}.
Trial 2759 finished with value: 0.6956521739130435 and parameters: {'n_estimators': 341, 'max_depth': 12, 'min_samples_split': 24, 'min_samples_leaf': 62, 'criterion': 'entropy'}.
Trial 2760 finished with value: 0.6521739130434783 and parameters: {'n_estimators': 358, 'max_depth': 5, 'min_samples_split': 24, 'min_samples_leaf': 59, 'criterion': 'gini'}.
Trial 2761 finished with value: 0.6847826086956522 and parameters: {'n_estimators': 315, 'max_depth': 15, 'min_samples_split': 15, 'min_samples_leaf': 57, 'criterion': 'entropy'}.
Trial 2762 finished with value: 0.6956521739130435 and parameters: {'n_estimators': 712, 'max_depth': 17, 'min_samples_split': 9, 'min_samples_leaf': 57, 'criterion': 'entropy'}.
Trial 2763 finished with value: 0.717391304347826 and parameters: {'n_estimators': 271, 'max_depth': 8, 'min_samples_split': 195, 'min_samples_leaf': 59, 'criterion': 'entropy'}.
Trial 2764 finished with value: 0.7282608695652174 and parameters: {'n_estimators': 277, 'max_depth': 11, 'min_samples_split': 17, 'min_samples_leaf': 62, 'criterion': 'entropy'}.
Trial 2765 finished with value: 0.6521739130434783 and parameters: {'n_estimators': 261, 'max_depth': 39, 'min_samples_split': 23, 'min_samples_leaf': 56, 'criterion': 'entropy'}.
Trial 2766 finished with value: 0.6847826086956522 and parameters: {'n_estimators': 308, 'max_depth': 25, 'min_samples_split': 22, 'min_samples_leaf': 59, 'criterion': 'entropy'}.
Trial 2767 finished with value: 0.7065217391304348 and parameters: {'n_estimators': 136, 'max_depth': 13, 'min_samples_split': 26, 'min_samples_leaf': 57, 'criterion': 'entropy'}.
Trial 2768 finished with value: 0.717391304347826 and parameters: {'n_estimators': 125, 'max_depth': 10, 'min_samples_split': 18, 'min_samples_leaf': 60, 'criterion': 'entropy'}.
Trial 2769 finished with value: 0.6739130434782609 and parameters: {'n_estimators': 401, 'max_depth': 7, 'min_samples_split': 13, 'min_samples_leaf': 56, 'criterion': 'entropy'}.
Trial 2770 finished with value: 0.7065217391304348 and parameters: {'n_estimators': 334, 'max_depth': 13, 'min_samples_split': 20, 'min_samples_leaf': 64, 'criterion': 'entropy'}.
Trial 2771 finished with value: 0.6956521739130435 and parameters: {'n_estimators': 194, 'max_depth': 9, 'min_samples_split': 25, 'min_samples_leaf': 58, 'criterion': 'entropy'}.
Trial 2772 finished with value: 0.7282608695652174 and parameters: {'n_estimators': 361, 'max_depth': 11, 'min_samples_split': 24, 'min_samples_leaf': 56, 'criterion': 'entropy'}.
Trial 2773 finished with value: 0.6739130434782609 and parameters: {'n_estimators': 252, 'max_depth': 15, 'min_samples_split': 20, 'min_samples_leaf': 61, 'criterion': 'entropy'}.
Trial 2774 finished with value: 0.6739130434782609 and parameters: {'n_estimators': 281, 'max_depth': 7, 'min_samples_split': 27, 'min_samples_leaf': 56, 'criterion': 'entropy'}.
Trial 2775 finished with value: 0.7065217391304348 and parameters: {'n_estimators': 454, 'max_depth': 9, 'min_samples_split': 25, 'min_samples_leaf': 60, 'criterion': 'entropy'}.
Trial 2776 finished with value: 0.6847826086956522 and parameters: {'n_estimators': 221, 'max_depth': 18, 'min_samples_split': 16, 'min_samples_leaf': 58, 'criterion': 'entropy'}.
Trial 2777 finished with value: 0.6956521739130435 and parameters: {'n_estimators': 461, 'max_depth': 13, 'min_samples_split': 22, 'min_samples_leaf': 55, 'criterion': 'entropy'}.
Trial 2778 finished with value: 0.717391304347826 and parameters: {'n_estimators': 153, 'max_depth': 11, 'min_samples_split': 27, 'min_samples_leaf': 58, 'criterion': 'entropy'}.
Trial 2779 finished with value: 0.6956521739130435 and parameters: {'n_estimators': 377, 'max_depth': 15, 'min_samples_split': 19, 'min_samples_leaf': 62, 'criterion': 'entropy'}.
Trial 2780 finished with value: 0.7065217391304348 and parameters: {'n_estimators': 228, 'max_depth': 9, 'min_samples_split': 164, 'min_samples_leaf': 55, 'criterion': 'entropy'}.
Trial 2781 finished with value: 0.6956521739130435 and parameters: {'n_estimators': 118, 'max_depth': 12, 'min_samples_split': 13, 'min_samples_leaf': 68, 'criterion': 'gini'}.
Trial 2782 finished with value: 0.6956521739130435 and parameters: {'n_estimators': 210, 'max_depth': 10, 'min_samples_split': 27, 'min_samples_leaf': 57, 'criterion': 'entropy'}.
Trial 2783 finished with value: 0.6739130434782609 and parameters: {'n_estimators': 234, 'max_depth': 6, 'min_samples_split': 24, 'min_samples_leaf': 59, 'criterion': 'entropy'}.
Trial 2784 finished with value: 0.6956521739130435 and parameters: {'n_estimators': 891, 'max_depth': 13, 'min_samples_split': 28, 'min_samples_leaf': 55, 'criterion': 'entropy'}.
Trial 2785 finished with value: 0.7282608695652174 and parameters: {'n_estimators': 444, 'max_depth': 8, 'min_samples_split': 21, 'min_samples_leaf': 61, 'criterion': 'entropy'}.
Trial 2786 finished with value: 0.6739130434782609 and parameters: {'n_estimators': 100, 'max_depth': 17, 'min_samples_split': 7, 'min_samples_leaf': 54, 'criterion': 'entropy'}.
Trial 2787 finished with value: 0.7065217391304348 and parameters: {'n_estimators': 711, 'max_depth': 11, 'min_samples_split': 30, 'min_samples_leaf': 64, 'criterion': 'entropy'}.
Trial 2788 finished with value: 0.6847826086956522 and parameters: {'n_estimators': 373, 'max_depth': 14, 'min_samples_split': 17, 'min_samples_leaf': 57, 'criterion': 'entropy'}.
Trial 2789 finished with value: 0.6956521739130435 and parameters: {'n_estimators': 728, 'max_depth': 7, 'min_samples_split': 24, 'min_samples_leaf': 60, 'criterion': 'entropy'}.
Trial 2790 finished with value: 0.6413043478260869 and parameters: {'n_estimators': 414, 'max_depth': 5, 'min_samples_split': 132, 'min_samples_leaf': 54, 'criterion': 'entropy'}.
Trial 2791 finished with value: 0.6521739130434783 and parameters: {'n_estimators': 299, 'max_depth': 21, 'min_samples_split': 28, 'min_samples_leaf': 56, 'criterion': 'entropy'}.
Trial 2792 finished with value: 0.717391304347826 and parameters: {'n_estimators': 170, 'max_depth': 10, 'min_samples_split': 21, 'min_samples_leaf': 58, 'criterion': 'entropy'}.
Trial 2793 finished with value: 0.7065217391304348 and parameters: {'n_estimators': 322, 'max_depth': 12, 'min_samples_split': 28, 'min_samples_leaf': 55, 'criterion': 'entropy'}.
Trial 2794 finished with value: 0.7065217391304348 and parameters: {'n_estimators': 394, 'max_depth': 16, 'min_samples_split': 25, 'min_samples_leaf': 62, 'criterion': 'entropy'}.
Trial 2795 finished with value: 0.717391304347826 and parameters: {'n_estimators': 270, 'max_depth': 9, 'min_samples_split': 31, 'min_samples_leaf': 59, 'criterion': 'entropy'}.
Trial 2796 finished with value: 0.7065217391304348 and parameters: {'n_estimators': 679, 'max_depth': 14, 'min_samples_split': 186, 'min_samples_leaf': 54, 'criterion': 'entropy'}.
Trial 2797 finished with value: 0.7065217391304348 and parameters: {'n_estimators': 239, 'max_depth': 11, 'min_samples_split': 18, 'min_samples_leaf': 57, 'criterion': 'entropy'}.
Trial 2798 finished with value: 0.7065217391304348 and parameters: {'n_estimators': 729, 'max_depth': 8, 'min_samples_split': 13, 'min_samples_leaf': 59, 'criterion': 'entropy'}.
Trial 2799 finished with value: 0.7065217391304348 and parameters: {'n_estimators': 869, 'max_depth': 13, 'min_samples_split': 145, 'min_samples_leaf': 56, 'criterion': 'gini'}.
Trial 2800 finished with value: 0.717391304347826 and parameters: {'n_estimators': 747, 'max_depth': 10, 'min_samples_split': 79, 'min_samples_leaf': 54, 'criterion': 'entropy'}.
Trial 2801 finished with value: 0.6956521739130435 and parameters: {'n_estimators': 387, 'max_depth': 12, 'min_samples_split': 22, 'min_samples_leaf': 60, 'criterion': 'entropy'}.
Trial 2802 finished with value: 0.6739130434782609 and parameters: {'n_estimators': 202, 'max_depth': 7, 'min_samples_split': 30, 'min_samples_leaf': 57, 'criterion': 'entropy'}.
Trial 2803 finished with value: 0.6847826086956522 and parameters: {'n_estimators': 442, 'max_depth': 30, 'min_samples_split': 56, 'min_samples_leaf': 62, 'criterion': 'entropy'}.
Trial 2804 finished with value: 0.6739130434782609 and parameters: {'n_estimators': 928, 'max_depth': 15, 'min_samples_split': 26, 'min_samples_leaf': 54, 'criterion': 'entropy'}.
Trial 2805 finished with value: 0.7391304347826086 and parameters: {'n_estimators': 305, 'max_depth': 9, 'min_samples_split': 33, 'min_samples_leaf': 56, 'criterion': 'entropy'}.
Trial 2806 finished with value: 0.6739130434782609 and parameters: {'n_estimators': 291, 'max_depth': 6, 'min_samples_split': 24, 'min_samples_leaf': 59, 'criterion': 'entropy'}.
Trial 2807 finished with value: 0.6413043478260869 and parameters: {'n_estimators': 301, 'max_depth': 5, 'min_samples_split': 28, 'min_samples_leaf': 60, 'criterion': 'entropy'}.
Trial 2808 finished with value: 0.717391304347826 and parameters: {'n_estimators': 344, 'max_depth': 8, 'min_samples_split': 72, 'min_samples_leaf': 57, 'criterion': 'entropy'}.
Trial 2809 finished with value: 0.6739130434782609 and parameters: {'n_estimators': 320, 'max_depth': 7, 'min_samples_split': 19, 'min_samples_leaf': 58, 'criterion': 'entropy'}.
Trial 2810 finished with value: 0.6739130434782609 and parameters: {'n_estimators': 363, 'max_depth': 64, 'min_samples_split': 32, 'min_samples_leaf': 58, 'criterion': 'entropy'}.
Trial 2811 finished with value: 0.6195652173913043 and parameters: {'n_estimators': 296, 'max_depth': 5, 'min_samples_split': 23, 'min_samples_leaf': 61, 'criterion': 'entropy'}.
Trial 2812 finished with value: 0.6956521739130435 and parameters: {'n_estimators': 298, 'max_depth': 9, 'min_samples_split': 29, 'min_samples_leaf': 63, 'criterion': 'entropy'}.
Trial 2813 finished with value: 0.717391304347826 and parameters: {'n_estimators': 341, 'max_depth': 8, 'min_samples_split': 16, 'min_samples_leaf': 57, 'criterion': 'entropy'}.
Trial 2814 finished with value: 0.717391304347826 and parameters: {'n_estimators': 315, 'max_depth': 10, 'min_samples_split': 31, 'min_samples_leaf': 59, 'criterion': 'entropy'}.
Trial 2815 finished with value: 0.6739130434782609 and parameters: {'n_estimators': 288, 'max_depth': 7, 'min_samples_split': 26, 'min_samples_leaf': 56, 'criterion': 'entropy'}.
Trial 2816 finished with value: 0.717391304347826 and parameters: {'n_estimators': 311, 'max_depth': 9, 'min_samples_split': 34, 'min_samples_leaf': 58, 'criterion': 'entropy'}.
Trial 2817 finished with value: 0.7065217391304348 and parameters: {'n_estimators': 264, 'max_depth': 11, 'min_samples_split': 21, 'min_samples_leaf': 61, 'criterion': 'gini'}.
Trial 2818 finished with value: 0.7065217391304348 and parameters: {'n_estimators': 426, 'max_depth': 12, 'min_samples_split': 2, 'min_samples_leaf': 56, 'criterion': 'entropy'}.
Trial 2819 finished with value: 0.6847826086956522 and parameters: {'n_estimators': 233, 'max_depth': 9, 'min_samples_split': 34, 'min_samples_leaf': 66, 'criterion': 'entropy'}.
Trial 2820 finished with value: 0.6195652173913043 and parameters: {'n_estimators': 326, 'max_depth': 6, 'min_samples_split': 28, 'min_samples_leaf': 29, 'criterion': 'entropy'}.
Trial 2821 finished with value: 0.717391304347826 and parameters: {'n_estimators': 304, 'max_depth': 11, 'min_samples_split': 138, 'min_samples_leaf': 59, 'criterion': 'entropy'}.
Trial 2822 finished with value: 0.6847826086956522 and parameters: {'n_estimators': 321, 'max_depth': 14, 'min_samples_split': 10, 'min_samples_leaf': 56, 'criterion': 'entropy'}.
Trial 2823 finished with value: 0.717391304347826 and parameters: {'n_estimators': 280, 'max_depth': 8, 'min_samples_split': 24, 'min_samples_leaf': 60, 'criterion': 'entropy'}.
Trial 2824 finished with value: 0.7391304347826086 and parameters: {'n_estimators': 332, 'max_depth': 10, 'min_samples_split': 32, 'min_samples_leaf': 58, 'criterion': 'entropy'}.
Trial 2825 finished with value: 0.6956521739130435 and parameters: {'n_estimators': 324, 'max_depth': 17, 'min_samples_split': 35, 'min_samples_leaf': 63, 'criterion': 'entropy'}.
Trial 2826 finished with value: 0.717391304347826 and parameters: {'n_estimators': 276, 'max_depth': 10, 'min_samples_split': 35, 'min_samples_leaf': 60, 'criterion': 'entropy'}.
Trial 2827 finished with value: 0.6956521739130435 and parameters: {'n_estimators': 323, 'max_depth': 13, 'min_samples_split': 36, 'min_samples_leaf': 62, 'criterion': 'entropy'}.
Trial 2828 finished with value: 0.6847826086956522 and parameters: {'n_estimators': 261, 'max_depth': 7, 'min_samples_split': 33, 'min_samples_leaf': 64, 'criterion': 'entropy'}.
Trial 2829 finished with value: 0.7282608695652174 and parameters: {'n_estimators': 303, 'max_depth': 11, 'min_samples_split': 33, 'min_samples_leaf': 60, 'criterion': 'entropy'}.
Trial 2830 finished with value: 0.6413043478260869 and parameters: {'n_estimators': 319, 'max_depth': 5, 'min_samples_split': 32, 'min_samples_leaf': 58, 'criterion': 'entropy'}.
Trial 2831 finished with value: 0.7065217391304348 and parameters: {'n_estimators': 256, 'max_depth': 9, 'min_samples_split': 37, 'min_samples_leaf': 61, 'criterion': 'entropy'}.
Trial 2832 finished with value: 0.6847826086956522 and parameters: {'n_estimators': 318, 'max_depth': 19, 'min_samples_split': 32, 'min_samples_leaf': 59, 'criterion': 'entropy'}.
Trial 2833 finished with value: 0.6739130434782609 and parameters: {'n_estimators': 332, 'max_depth': 15, 'min_samples_split': 36, 'min_samples_leaf': 58, 'criterion': 'entropy'}.
Trial 2834 finished with value: 0.6956521739130435 and parameters: {'n_estimators': 298, 'max_depth': 12, 'min_samples_split': 31, 'min_samples_leaf': 62, 'criterion': 'entropy'}.
Trial 2835 finished with value: 0.6956521739130435 and parameters: {'n_estimators': 338, 'max_depth': 13, 'min_samples_split': 39, 'min_samples_leaf': 59, 'criterion': 'entropy'}.
Trial 2836 finished with value: 0.7282608695652174 and parameters: {'n_estimators': 306, 'max_depth': 10, 'min_samples_split': 30, 'min_samples_leaf': 58, 'criterion': 'entropy'}.
Trial 2837 finished with value: 0.6956521739130435 and parameters: {'n_estimators': 355, 'max_depth': 8, 'min_samples_split': 67, 'min_samples_leaf': 61, 'criterion': 'gini'}.
Trial 2838 finished with value: 0.6630434782608695 and parameters: {'n_estimators': 275, 'max_depth': 16, 'min_samples_split': 34, 'min_samples_leaf': 57, 'criterion': 'entropy'}.
Trial 2839 finished with value: 0.717391304347826 and parameters: {'n_estimators': 327, 'max_depth': 11, 'min_samples_split': 34, 'min_samples_leaf': 63, 'criterion': 'entropy'}.
Trial 2840 finished with value: 0.7065217391304348 and parameters: {'n_estimators': 287, 'max_depth': 13, 'min_samples_split': 30, 'min_samples_leaf': 60, 'criterion': 'entropy'}.
Trial 2841 finished with value: 0.6739130434782609 and parameters: {'n_estimators': 339, 'max_depth': 7, 'min_samples_split': 38, 'min_samples_leaf': 57, 'criterion': 'entropy'}.
Trial 2842 finished with value: 0.6847826086956522 and parameters: {'n_estimators': 318, 'max_depth': 72, 'min_samples_split': 29, 'min_samples_leaf': 58, 'criterion': 'entropy'}.
Trial 2843 finished with value: 0.7065217391304348 and parameters: {'n_estimators': 269, 'max_depth': 9, 'min_samples_split': 34, 'min_samples_leaf': 60, 'criterion': 'entropy'}.
Trial 2844 finished with value: 0.6847826086956522 and parameters: {'n_estimators': 255, 'max_depth': 14, 'min_samples_split': 40, 'min_samples_leaf': 93, 'criterion': 'entropy'}.
Trial 2845 finished with value: 0.717391304347826 and parameters: {'n_estimators': 309, 'max_depth': 11, 'min_samples_split': 31, 'min_samples_leaf': 57, 'criterion': 'entropy'}.
Trial 2846 finished with value: 0.6521739130434783 and parameters: {'n_estimators': 343, 'max_depth': 85, 'min_samples_split': 36, 'min_samples_leaf': 56, 'criterion': 'entropy'}.
Trial 2847 finished with value: 0.717391304347826 and parameters: {'n_estimators': 318, 'max_depth': 10, 'min_samples_split': 28, 'min_samples_leaf': 64, 'criterion': 'entropy'}.
Trial 2848 finished with value: 0.6956521739130435 and parameters: {'n_estimators': 287, 'max_depth': 7, 'min_samples_split': 124, 'min_samples_leaf': 59, 'criterion': 'entropy'}.
Trial 2849 finished with value: 0.6956521739130435 and parameters: {'n_estimators': 341, 'max_depth': 12, 'min_samples_split': 33, 'min_samples_leaf': 61, 'criterion': 'entropy'}.
Trial 2850 finished with value: 0.6847826086956522 and parameters: {'n_estimators': 308, 'max_depth': 15, 'min_samples_split': 38, 'min_samples_leaf': 56, 'criterion': 'entropy'}.
Trial 2851 finished with value: 0.7065217391304348 and parameters: {'n_estimators': 339, 'max_depth': 9, 'min_samples_split': 29, 'min_samples_leaf': 58, 'criterion': 'entropy'}.
Trial 2852 finished with value: 0.6304347826086957 and parameters: {'n_estimators': 374, 'max_depth': 5, 'min_samples_split': 42, 'min_samples_leaf': 56, 'criterion': 'entropy'}.
Trial 2853 finished with value: 0.6956521739130435 and parameters: {'n_estimators': 301, 'max_depth': 13, 'min_samples_split': 33, 'min_samples_leaf': 62, 'criterion': 'entropy'}.
Trial 2854 finished with value: 0.6739130434782609 and parameters: {'n_estimators': 296, 'max_depth': 33, 'min_samples_split': 36, 'min_samples_leaf': 89, 'criterion': 'entropy'}.
Trial 2855 finished with value: 0.6847826086956522 and parameters: {'n_estimators': 359, 'max_depth': 51, 'min_samples_split': 29, 'min_samples_leaf': 59, 'criterion': 'entropy'}.
Trial 2856 finished with value: 0.6739130434782609 and parameters: {'n_estimators': 289, 'max_depth': 17, 'min_samples_split': 28, 'min_samples_leaf': 66, 'criterion': 'gini'}.
Trial 2857 finished with value: 0.717391304347826 and parameters: {'n_estimators': 264, 'max_depth': 11, 'min_samples_split': 40, 'min_samples_leaf': 56, 'criterion': 'entropy'}.
Trial 2858 finished with value: 0.7282608695652174 and parameters: {'n_estimators': 273, 'max_depth': 8, 'min_samples_split': 33, 'min_samples_leaf': 58, 'criterion': 'entropy'}.
Trial 2859 finished with value: 0.6956521739130435 and parameters: {'n_estimators': 305, 'max_depth': 14, 'min_samples_split': 36, 'min_samples_leaf': 61, 'criterion': 'entropy'}.
Trial 2860 finished with value: 0.7065217391304348 and parameters: {'n_estimators': 334, 'max_depth': 11, 'min_samples_split': 30, 'min_samples_leaf': 56, 'criterion': 'entropy'}.
Trial 2861 finished with value: 0.7065217391304348 and parameters: {'n_estimators': 288, 'max_depth': 9, 'min_samples_split': 27, 'min_samples_leaf': 60, 'criterion': 'entropy'}.
Trial 2862 finished with value: 0.717391304347826 and parameters: {'n_estimators': 342, 'max_depth': 12, 'min_samples_split': 33, 'min_samples_leaf': 58, 'criterion': 'entropy'}.
Trial 2863 finished with value: 0.6739130434782609 and parameters: {'n_estimators': 340, 'max_depth': 6, 'min_samples_split': 129, 'min_samples_leaf': 56, 'criterion': 'entropy'}.
Trial 2864 finished with value: 0.6847826086956522 and parameters: {'n_estimators': 304, 'max_depth': 15, 'min_samples_split': 42, 'min_samples_leaf': 59, 'criterion': 'entropy'}.
Trial 2865 finished with value: 0.717391304347826 and parameters: {'n_estimators': 324, 'max_depth': 10, 'min_samples_split': 38, 'min_samples_leaf': 63, 'criterion': 'entropy'}.
Trial 2866 finished with value: 0.6847826086956522 and parameters: {'n_estimators': 337, 'max_depth': 13, 'min_samples_split': 26, 'min_samples_leaf': 55, 'criterion': 'entropy'}.
Trial 2867 finished with value: 0.6739130434782609 and parameters: {'n_estimators': 330, 'max_depth': 7, 'min_samples_split': 32, 'min_samples_leaf': 57, 'criterion': 'entropy'}.
Trial 2868 finished with value: 0.6739130434782609 and parameters: {'n_estimators': 311, 'max_depth': 19, 'min_samples_split': 30, 'min_samples_leaf': 60, 'criterion': 'entropy'}.
Trial 2869 finished with value: 0.7282608695652174 and parameters: {'n_estimators': 311, 'max_depth': 9, 'min_samples_split': 36, 'min_samples_leaf': 55, 'criterion': 'entropy'}.
Trial 2870 finished with value: 0.717391304347826 and parameters: {'n_estimators': 351, 'max_depth': 12, 'min_samples_split': 45, 'min_samples_leaf': 58, 'criterion': 'entropy'}.
Trial 2871 finished with value: 0.6739130434782609 and parameters: {'n_estimators': 359, 'max_depth': 16, 'min_samples_split': 26, 'min_samples_leaf': 61, 'criterion': 'entropy'}.
Trial 2872 finished with value: 0.7065217391304348 and parameters: {'n_estimators': 251, 'max_depth': 10, 'min_samples_split': 51, 'min_samples_leaf': 57, 'criterion': 'entropy'}.
Trial 2873 finished with value: 0.6630434782608695 and parameters: {'n_estimators': 293, 'max_depth': 27, 'min_samples_split': 31, 'min_samples_leaf': 65, 'criterion': 'entropy'}.
Trial 2874 finished with value: 0.7065217391304348 and parameters: {'n_estimators': 269, 'max_depth': 8, 'min_samples_split': 39, 'min_samples_leaf': 55, 'criterion': 'gini'}.
Trial 2875 finished with value: 0.6847826086956522 and parameters: {'n_estimators': 276, 'max_depth': 14, 'min_samples_split': 26, 'min_samples_leaf': 58, 'criterion': 'entropy'}.
