Trial 2510 finished with value: 0.6847826086956522 and parameters: {'n_estimators': 670, 'max_depth': 16, 'min_samples_split': 35, 'min_samples_leaf': 55, 'criterion': 'entropy'}.
Trial 2511 finished with value: 0.6847826086956522 and parameters: {'n_estimators': 751, 'max_depth': 12, 'min_samples_split': 34, 'min_samples_leaf': 61, 'criterion': 'entropy'}.
Trial 2512 finished with value: 0.6739130434782609 and parameters: {'n_estimators': 728, 'max_depth': 15, 'min_samples_split': 39, 'min_samples_leaf': 58, 'criterion': 'entropy'}.
Trial 2513 finished with value: 0.7065217391304348 and parameters: {'n_estimators': 756, 'max_depth': 13, 'min_samples_split': 43, 'min_samples_leaf': 55, 'criterion': 'gini'}.
Trial 2514 finished with value: 0.7065217391304348 and parameters: {'n_estimators': 706, 'max_depth': 12, 'min_samples_split': 34, 'min_samples_leaf': 59, 'criterion': 'entropy'}.
Trial 2515 finished with value: 0.6847826086956522 and parameters: {'n_estimators': 761, 'max_depth': 17, 'min_samples_split': 38, 'min_samples_leaf': 56, 'criterion': 'entropy'}.
Trial 2516 finished with value: 0.6413043478260869 and parameters: {'n_estimators': 770, 'max_depth': 21, 'min_samples_split': 33, 'min_samples_leaf': 43, 'criterion': 'entropy'}.
Trial 2517 finished with value: 0.6847826086956522 and parameters: {'n_estimators': 722, 'max_depth': 12, 'min_samples_split': 88, 'min_samples_leaf': 61, 'criterion': 'entropy'}.
Trial 2518 finished with value: 0.6086956521739131 and parameters: {'n_estimators': 690, 'max_depth': 14, 'min_samples_split': 33, 'min_samples_leaf': 6, 'criterion': 'entropy'}.
Trial 2519 finished with value: 0.7065217391304348 and parameters: {'n_estimators': 737, 'max_depth': 12, 'min_samples_split': 42, 'min_samples_leaf': 55, 'criterion': 'entropy'}.
Trial 2520 finished with value: 0.6847826086956522 and parameters: {'n_estimators': 766, 'max_depth': 19, 'min_samples_split': 37, 'min_samples_leaf': 45, 'criterion': 'entropy'}.
Trial 2521 finished with value: 0.6847826086956522 and parameters: {'n_estimators': 749, 'max_depth': 15, 'min_samples_split': 32, 'min_samples_leaf': 57, 'criterion': 'entropy'}.
Trial 2522 finished with value: 0.6956521739130435 and parameters: {'n_estimators': 769, 'max_depth': 12, 'min_samples_split': 46, 'min_samples_leaf': 54, 'criterion': 'entropy'}.
Trial 2523 finished with value: 0.7065217391304348 and parameters: {'n_estimators': 712, 'max_depth': 14, 'min_samples_split': 37, 'min_samples_leaf': 64, 'criterion': 'entropy'}.
Trial 2524 finished with value: 0.7065217391304348 and parameters: {'n_estimators': 745, 'max_depth': 12, 'min_samples_split': 33, 'min_samples_leaf': 59, 'criterion': 'entropy'}.
Trial 2525 finished with value: 0.717391304347826 and parameters: {'n_estimators': 768, 'max_depth': 12, 'min_samples_split': 41, 'min_samples_leaf': 57, 'criterion': 'entropy'}.
Trial 2526 finished with value: 0.6739130434782609 and parameters: {'n_estimators': 778, 'max_depth': 16, 'min_samples_split': 106, 'min_samples_leaf': 54, 'criterion': 'entropy'}.
Trial 2527 finished with value: 0.7065217391304348 and parameters: {'n_estimators': 755, 'max_depth': 14, 'min_samples_split': 36, 'min_samples_leaf': 46, 'criterion': 'entropy'}.
Trial 2528 finished with value: 0.717391304347826 and parameters: {'n_estimators': 735, 'max_depth': 11, 'min_samples_split': 33, 'min_samples_leaf': 58, 'criterion': 'entropy'}.
Trial 2529 finished with value: 0.6630434782608695 and parameters: {'n_estimators': 780, 'max_depth': 90, 'min_samples_split': 41, 'min_samples_leaf': 60, 'criterion': 'entropy'}.
Trial 2530 finished with value: 0.6739130434782609 and parameters: {'n_estimators': 721, 'max_depth': 17, 'min_samples_split': 63, 'min_samples_leaf': 54, 'criterion': 'entropy'}.
Trial 2531 finished with value: 0.717391304347826 and parameters: {'n_estimators': 755, 'max_depth': 11, 'min_samples_split': 99, 'min_samples_leaf': 56, 'criterion': 'entropy'}.
Trial 2532 finished with value: 0.6739130434782609 and parameters: {'n_estimators': 384, 'max_depth': 14, 'min_samples_split': 32, 'min_samples_leaf': 53, 'criterion': 'gini'}.
Trial 2533 finished with value: 0.6847826086956522 and parameters: {'n_estimators': 780, 'max_depth': 12, 'min_samples_split': 94, 'min_samples_leaf': 62, 'criterion': 'entropy'}.
Trial 2534 finished with value: 0.6847826086956522 and parameters: {'n_estimators': 684, 'max_depth': 11, 'min_samples_split': 53, 'min_samples_leaf': 48, 'criterion': 'entropy'}.
Trial 2535 finished with value: 0.6956521739130435 and parameters: {'n_estimators': 736, 'max_depth': 15, 'min_samples_split': 136, 'min_samples_leaf': 44, 'criterion': 'entropy'}.
Trial 2536 finished with value: 0.6956521739130435 and parameters: {'n_estimators': 789, 'max_depth': 13, 'min_samples_split': 116, 'min_samples_leaf': 56, 'criterion': 'entropy'}.
Trial 2537 finished with value: 0.6956521739130435 and parameters: {'n_estimators': 768, 'max_depth': 11, 'min_samples_split': 38, 'min_samples_leaf': 52, 'criterion': 'entropy'}.
Trial 2538 finished with value: 0.7391304347826086 and parameters: {'n_estimators': 796, 'max_depth': 13, 'min_samples_split': 31, 'min_samples_leaf': 58, 'criterion': 'entropy'}.
Trial 2539 finished with value: 0.6630434782608695 and parameters: {'n_estimators': 759, 'max_depth': 20, 'min_samples_split': 31, 'min_samples_leaf': 60, 'criterion': 'entropy'}.
Trial 2540 finished with value: 0.6739130434782609 and parameters: {'n_estimators': 749, 'max_depth': 24, 'min_samples_split': 34, 'min_samples_leaf': 47, 'criterion': 'entropy'}.
Trial 2541 finished with value: 0.6847826086956522 and parameters: {'n_estimators': 775, 'max_depth': 18, 'min_samples_split': 132, 'min_samples_leaf': 54, 'criterion': 'entropy'}.
Trial 2542 finished with value: 0.6739130434782609 and parameters: {'n_estimators': 736, 'max_depth': 17, 'min_samples_split': 31, 'min_samples_leaf': 50, 'criterion': 'entropy'}.
Trial 2543 finished with value: 0.6847826086956522 and parameters: {'n_estimators': 789, 'max_depth': 16, 'min_samples_split': 31, 'min_samples_leaf': 41, 'criterion': 'entropy'}.
Trial 2544 finished with value: 0.6739130434782609 and parameters: {'n_estimators': 712, 'max_depth': 16, 'min_samples_split': 35, 'min_samples_leaf': 58, 'criterion': 'entropy'}.
Trial 2545 finished with value: 0.6739130434782609 and parameters: {'n_estimators': 762, 'max_depth': 16, 'min_samples_split': 38, 'min_samples_leaf': 52, 'criterion': 'entropy'}.
Trial 2546 finished with value: 0.6956521739130435 and parameters: {'n_estimators': 792, 'max_depth': 15, 'min_samples_split': 31, 'min_samples_leaf': 56, 'criterion': 'entropy'}.
Trial 2547 finished with value: 0.717391304347826 and parameters: {'n_estimators': 975, 'max_depth': 14, 'min_samples_split': 31, 'min_samples_leaf': 49, 'criterion': 'entropy'}.
Trial 2548 finished with value: 0.6847826086956522 and parameters: {'n_estimators': 768, 'max_depth': 14, 'min_samples_split': 36, 'min_samples_leaf': 54, 'criterion': 'entropy'}.
Trial 2549 finished with value: 0.6847826086956522 and parameters: {'n_estimators': 724, 'max_depth': 19, 'min_samples_split': 35, 'min_samples_leaf': 51, 'criterion': 'entropy'}.
Trial 2550 finished with value: 0.6847826086956522 and parameters: {'n_estimators': 800, 'max_depth': 18, 'min_samples_split': 30, 'min_samples_leaf': 58, 'criterion': 'entropy'}.
Trial 2551 finished with value: 0.717391304347826 and parameters: {'n_estimators': 749, 'max_depth': 15, 'min_samples_split': 44, 'min_samples_leaf': 46, 'criterion': 'entropy'}.
Trial 2552 finished with value: 0.6956521739130435 and parameters: {'n_estimators': 767, 'max_depth': 14, 'min_samples_split': 40, 'min_samples_leaf': 61, 'criterion': 'gini'}.
Trial 2553 finished with value: 0.7065217391304348 and parameters: {'n_estimators': 782, 'max_depth': 13, 'min_samples_split': 30, 'min_samples_leaf': 56, 'criterion': 'entropy'}.
Trial 2554 finished with value: 0.6739130434782609 and parameters: {'n_estimators': 699, 'max_depth': 16, 'min_samples_split': 36, 'min_samples_leaf': 53, 'criterion': 'entropy'}.
Trial 2555 finished with value: 0.717391304347826 and parameters: {'n_estimators': 744, 'max_depth': 13, 'min_samples_split': 31, 'min_samples_leaf': 49, 'criterion': 'entropy'}.
Trial 2556 finished with value: 0.7065217391304348 and parameters: {'n_estimators': 809, 'max_depth': 14, 'min_samples_split': 40, 'min_samples_leaf': 65, 'criterion': 'entropy'}.
Trial 2557 finished with value: 0.7065217391304348 and parameters: {'n_estimators': 798, 'max_depth': 13, 'min_samples_split': 142, 'min_samples_leaf': 59, 'criterion': 'entropy'}.
Trial 2558 finished with value: 0.6739130434782609 and parameters: {'n_estimators': 883, 'max_depth': 17, 'min_samples_split': 34, 'min_samples_leaf': 51, 'criterion': 'entropy'}.
Trial 2559 finished with value: 0.717391304347826 and parameters: {'n_estimators': 779, 'max_depth': 13, 'min_samples_split': 30, 'min_samples_leaf': 55, 'criterion': 'entropy'}.
Trial 2560 finished with value: 0.7065217391304348 and parameters: {'n_estimators': 728, 'max_depth': 12, 'min_samples_split': 49, 'min_samples_leaf': 48, 'criterion': 'entropy'}.
Trial 2561 finished with value: 0.6956521739130435 and parameters: {'n_estimators': 749, 'max_depth': 16, 'min_samples_split': 38, 'min_samples_leaf': 57, 'criterion': 'entropy'}.
Trial 2562 finished with value: 0.6956521739130435 and parameters: {'n_estimators': 801, 'max_depth': 15, 'min_samples_split': 29, 'min_samples_leaf': 52, 'criterion': 'entropy'}.
Trial 2563 finished with value: 0.7065217391304348 and parameters: {'n_estimators': 765, 'max_depth': 12, 'min_samples_split': 34, 'min_samples_leaf': 45, 'criterion': 'entropy'}.
Trial 2564 finished with value: 0.6739130434782609 and parameters: {'n_estimators': 782, 'max_depth': 19, 'min_samples_split': 43, 'min_samples_leaf': 54, 'criterion': 'entropy'}.
Trial 2565 finished with value: 0.7065217391304348 and parameters: {'n_estimators': 929, 'max_depth': 14, 'min_samples_split': 38, 'min_samples_leaf': 62, 'criterion': 'entropy'}.
Trial 2566 finished with value: 0.7065217391304348 and parameters: {'n_estimators': 817, 'max_depth': 12, 'min_samples_split': 28, 'min_samples_leaf': 47, 'criterion': 'entropy'}.
Trial 2567 finished with value: 0.6630434782608695 and parameters: {'n_estimators': 857, 'max_depth': 15, 'min_samples_split': 160, 'min_samples_leaf': 12, 'criterion': 'entropy'}.
Trial 2568 finished with value: 0.7065217391304348 and parameters: {'n_estimators': 999, 'max_depth': 12, 'min_samples_split': 148, 'min_samples_leaf': 51, 'criterion': 'entropy'}.
Trial 2569 finished with value: 0.7065217391304348 and parameters: {'n_estimators': 793, 'max_depth': 13, 'min_samples_split': 136, 'min_samples_leaf': 59, 'criterion': 'entropy'}.
Trial 2570 finished with value: 0.6739130434782609 and parameters: {'n_estimators': 738, 'max_depth': 17, 'min_samples_split': 31, 'min_samples_leaf': 55, 'criterion': 'entropy'}.
Trial 2571 finished with value: 0.6956521739130435 and parameters: {'n_estimators': 676, 'max_depth': 11, 'min_samples_split': 35, 'min_samples_leaf': 53, 'criterion': 'gini'}.
Trial 2572 finished with value: 0.6847826086956522 and parameters: {'n_estimators': 763, 'max_depth': 14, 'min_samples_split': 33, 'min_samples_leaf': 50, 'criterion': 'entropy'}.
Trial 2573 finished with value: 0.6956521739130435 and parameters: {'n_estimators': 712, 'max_depth': 11, 'min_samples_split': 38, 'min_samples_leaf': 48, 'criterion': 'entropy'}.
Trial 2574 finished with value: 0.6847826086956522 and parameters: {'n_estimators': 810, 'max_depth': 15, 'min_samples_split': 28, 'min_samples_leaf': 57, 'criterion': 'entropy'}.
Trial 2575 finished with value: 0.7065217391304348 and parameters: {'n_estimators': 781, 'max_depth': 13, 'min_samples_split': 43, 'min_samples_leaf': 53, 'criterion': 'entropy'}.
Trial 2576 finished with value: 0.7282608695652174 and parameters: {'n_estimators': 831, 'max_depth': 11, 'min_samples_split': 33, 'min_samples_leaf': 50, 'criterion': 'entropy'}.
Trial 2577 finished with value: 0.6630434782608695 and parameters: {'n_estimators': 750, 'max_depth': 29, 'min_samples_split': 46, 'min_samples_leaf': 61, 'criterion': 'entropy'}.
Trial 2578 finished with value: 0.6847826086956522 and parameters: {'n_estimators': 906, 'max_depth': 17, 'min_samples_split': 30, 'min_samples_leaf': 56, 'criterion': 'entropy'}.
Trial 2579 finished with value: 0.7065217391304348 and parameters: {'n_estimators': 854, 'max_depth': 11, 'min_samples_split': 36, 'min_samples_leaf': 43, 'criterion': 'entropy'}.
Trial 2580 finished with value: 0.717391304347826 and parameters: {'n_estimators': 876, 'max_depth': 13, 'min_samples_split': 28, 'min_samples_leaf': 58, 'criterion': 'entropy'}.
Trial 2581 finished with value: 0.6847826086956522 and parameters: {'n_estimators': 803, 'max_depth': 11, 'min_samples_split': 40, 'min_samples_leaf': 52, 'criterion': 'entropy'}.
Trial 2582 finished with value: 0.6739130434782609 and parameters: {'n_estimators': 773, 'max_depth': 15, 'min_samples_split': 33, 'min_samples_leaf': 63, 'criterion': 'entropy'}.
Trial 2583 finished with value: 0.7065217391304348 and parameters: {'n_estimators': 792, 'max_depth': 13, 'min_samples_split': 28, 'min_samples_leaf': 47, 'criterion': 'entropy'}.
Trial 2584 finished with value: 0.6847826086956522 and parameters: {'n_estimators': 722, 'max_depth': 11, 'min_samples_split': 36, 'min_samples_leaf': 55, 'criterion': 'entropy'}.
Trial 2585 finished with value: 0.6739130434782609 and parameters: {'n_estimators': 823, 'max_depth': 15, 'min_samples_split': 40, 'min_samples_leaf': 60, 'criterion': 'entropy'}.
Trial 2586 finished with value: 0.7065217391304348 and parameters: {'n_estimators': 754, 'max_depth': 11, 'min_samples_split': 28, 'min_samples_leaf': 51, 'criterion': 'entropy'}.
Trial 2587 finished with value: 0.6956521739130435 and parameters: {'n_estimators': 843, 'max_depth': 46, 'min_samples_split': 33, 'min_samples_leaf': 48, 'criterion': 'entropy'}.
Trial 2588 finished with value: 0.6739130434782609 and parameters: {'n_estimators': 775, 'max_depth': 18, 'min_samples_split': 75, 'min_samples_leaf': 54, 'criterion': 'entropy'}.
Trial 2589 finished with value: 0.717391304347826 and parameters: {'n_estimators': 803, 'max_depth': 13, 'min_samples_split': 31, 'min_samples_leaf': 45, 'criterion': 'gini'}.
Trial 2590 finished with value: 0.717391304347826 and parameters: {'n_estimators': 766, 'max_depth': 10, 'min_samples_split': 27, 'min_samples_leaf': 58, 'criterion': 'entropy'}.
Trial 2591 finished with value: 0.717391304347826 and parameters: {'n_estimators': 818, 'max_depth': 13, 'min_samples_split': 37, 'min_samples_leaf': 49, 'criterion': 'entropy'}.
Trial 2592 finished with value: 0.717391304347826 and parameters: {'n_estimators': 734, 'max_depth': 10, 'min_samples_split': 42, 'min_samples_leaf': 53, 'criterion': 'entropy'}.
Trial 2593 finished with value: 0.6956521739130435 and parameters: {'n_estimators': 790, 'max_depth': 15, 'min_samples_split': 32, 'min_samples_leaf': 56, 'criterion': 'entropy'}.
Trial 2594 finished with value: 0.7065217391304348 and parameters: {'n_estimators': 699, 'max_depth': 12, 'min_samples_split': 26, 'min_samples_leaf': 50, 'criterion': 'entropy'}.
Trial 2595 finished with value: 0.6956521739130435 and parameters: {'n_estimators': 843, 'max_depth': 10, 'min_samples_split': 81, 'min_samples_leaf': 59, 'criterion': 'entropy'}.
Trial 2596 finished with value: 0.6956521739130435 and parameters: {'n_estimators': 747, 'max_depth': 14, 'min_samples_split': 47, 'min_samples_leaf': 52, 'criterion': 'entropy'}.
Trial 2597 finished with value: 0.6956521739130435 and parameters: {'n_estimators': 828, 'max_depth': 11, 'min_samples_split': 36, 'min_samples_leaf': 55, 'criterion': 'entropy'}.
Trial 2598 finished with value: 0.6739130434782609 and parameters: {'n_estimators': 867, 'max_depth': 95, 'min_samples_split': 30, 'min_samples_leaf': 57, 'criterion': 'entropy'}.
Trial 2599 finished with value: 0.6847826086956522 and parameters: {'n_estimators': 658, 'max_depth': 17, 'min_samples_split': 40, 'min_samples_leaf': 50, 'criterion': 'entropy'}.
Trial 2600 finished with value: 0.6956521739130435 and parameters: {'n_estimators': 197, 'max_depth': 13, 'min_samples_split': 34, 'min_samples_leaf': 47, 'criterion': 'entropy'}.
Trial 2601 finished with value: 0.6739130434782609 and parameters: {'n_estimators': 782, 'max_depth': 21, 'min_samples_split': 27, 'min_samples_leaf': 60, 'criterion': 'entropy'}.
Trial 2602 finished with value: 0.7065217391304348 and parameters: {'n_estimators': 807, 'max_depth': 10, 'min_samples_split': 37, 'min_samples_leaf': 53, 'criterion': 'entropy'}.
Trial 2603 finished with value: 0.6739130434782609 and parameters: {'n_estimators': 728, 'max_depth': 16, 'min_samples_split': 128, 'min_samples_leaf': 49, 'criterion': 'entropy'}.
Trial 2604 finished with value: 0.6739130434782609 and parameters: {'n_estimators': 767, 'max_depth': 12, 'min_samples_split': 31, 'min_samples_leaf': 63, 'criterion': 'entropy'}.
Trial 2605 finished with value: 0.6521739130434783 and parameters: {'n_estimators': 799, 'max_depth': 40, 'min_samples_split': 27, 'min_samples_leaf': 55, 'criterion': 'entropy'}.
Trial 2606 finished with value: 0.7065217391304348 and parameters: {'n_estimators': 751, 'max_depth': 14, 'min_samples_split': 42, 'min_samples_leaf': 52, 'criterion': 'entropy'}.
Trial 2607 finished with value: 0.7065217391304348 and parameters: {'n_estimators': 821, 'max_depth': 11, 'min_samples_split': 34, 'min_samples_leaf': 45, 'criterion': 'entropy'}.
Trial 2608 finished with value: 0.7065217391304348 and parameters: {'n_estimators': 780, 'max_depth': 10, 'min_samples_split': 26, 'min_samples_leaf': 56, 'criterion': 'gini'}.
Trial 2609 finished with value: 0.7065217391304348 and parameters: {'n_estimators': 856, 'max_depth': 12, 'min_samples_split': 38, 'min_samples_leaf': 50, 'criterion': 'entropy'}.
Trial 2610 finished with value: 0.6739130434782609 and parameters: {'n_estimators': 836, 'max_depth': 15, 'min_samples_split': 32, 'min_samples_leaf': 59, 'criterion': 'entropy'}.
Trial 2611 finished with value: 0.717391304347826 and parameters: {'n_estimators': 715, 'max_depth': 10, 'min_samples_split': 45, 'min_samples_leaf': 54, 'criterion': 'entropy'}.
Trial 2612 finished with value: 0.6956521739130435 and parameters: {'n_estimators': 762, 'max_depth': 13, 'min_samples_split': 29, 'min_samples_leaf': 57, 'criterion': 'entropy'}.
Trial 2613 finished with value: 0.6956521739130435 and parameters: {'n_estimators': 797, 'max_depth': 10, 'min_samples_split': 35, 'min_samples_leaf': 48, 'criterion': 'entropy'}.
Trial 2614 finished with value: 0.717391304347826 and parameters: {'n_estimators': 813, 'max_depth': 12, 'min_samples_split': 31, 'min_samples_leaf': 52, 'criterion': 'entropy'}.
Trial 2615 finished with value: 0.6847826086956522 and parameters: {'n_estimators': 741, 'max_depth': 17, 'min_samples_split': 25, 'min_samples_leaf': 61, 'criterion': 'entropy'}.
Trial 2616 finished with value: 0.7282608695652174 and parameters: {'n_estimators': 790, 'max_depth': 14, 'min_samples_split': 39, 'min_samples_leaf': 47, 'criterion': 'entropy'}.
Trial 2617 finished with value: 0.6739130434782609 and parameters: {'n_estimators': 831, 'max_depth': 19, 'min_samples_split': 24, 'min_samples_leaf': 51, 'criterion': 'entropy'}.
Trial 2618 finished with value: 0.6956521739130435 and parameters: {'n_estimators': 880, 'max_depth': 10, 'min_samples_split': 35, 'min_samples_leaf': 54, 'criterion': 'entropy'}.
Trial 2619 finished with value: 0.6956521739130435 and parameters: {'n_estimators': 766, 'max_depth': 12, 'min_samples_split': 29, 'min_samples_leaf': 59, 'criterion': 'entropy'}.
Trial 2620 finished with value: 0.6739130434782609 and parameters: {'n_estimators': 631, 'max_depth': 15, 'min_samples_split': 39, 'min_samples_leaf': 57, 'criterion': 'entropy'}.
Trial 2621 finished with value: 0.717391304347826 and parameters: {'n_estimators': 808, 'max_depth': 10, 'min_samples_split': 25, 'min_samples_leaf': 49, 'criterion': 'entropy'}.
Trial 2622 finished with value: 0.7065217391304348 and parameters: {'n_estimators': 781, 'max_depth': 14, 'min_samples_split': 33, 'min_samples_leaf': 46, 'criterion': 'entropy'}.
Trial 2623 finished with value: 0.717391304347826 and parameters: {'n_estimators': 852, 'max_depth': 12, 'min_samples_split': 42, 'min_samples_leaf': 52, 'criterion': 'entropy'}.
Trial 2624 finished with value: 0.7282608695652174 and parameters: {'n_estimators': 745, 'max_depth': 10, 'min_samples_split': 29, 'min_samples_leaf': 55, 'criterion': 'entropy'}.
Trial 2625 finished with value: 0.6956521739130435 and parameters: {'n_estimators': 724, 'max_depth': 13, 'min_samples_split': 51, 'min_samples_leaf': 44, 'criterion': 'entropy'}.
Trial 2626 finished with value: 0.6847826086956522 and parameters: {'n_estimators': 699, 'max_depth': 16, 'min_samples_split': 36, 'min_samples_leaf': 50, 'criterion': 'gini'}.
Trial 2627 finished with value: 0.6847826086956522 and parameters: {'n_estimators': 822, 'max_depth': 9, 'min_samples_split': 24, 'min_samples_leaf': 57, 'criterion': 'entropy'}.
Trial 2628 finished with value: 0.7065217391304348 and parameters: {'n_estimators': 897, 'max_depth': 11, 'min_samples_split': 32, 'min_samples_leaf': 53, 'criterion': 'entropy'}.
Trial 2629 finished with value: 0.6956521739130435 and parameters: {'n_estimators': 765, 'max_depth': 13, 'min_samples_split': 46, 'min_samples_leaf': 61, 'criterion': 'entropy'}.
Trial 2630 finished with value: 0.717391304347826 and parameters: {'n_estimators': 797, 'max_depth': 9, 'min_samples_split': 29, 'min_samples_leaf': 55, 'criterion': 'entropy'}.
Trial 2631 finished with value: 0.7065217391304348 and parameters: {'n_estimators': 947, 'max_depth': 12, 'min_samples_split': 38, 'min_samples_leaf': 48, 'criterion': 'entropy'}.
