Trial 3985 finished with value: 0.7065217391304348 and parameters: {'n_estimators': 264, 'max_depth': 10, 'min_samples_split': 152, 'min_samples_leaf': 61, 'criterion': 'gini'}.
Trial 3986 finished with value: 0.6521739130434783 and parameters: {'n_estimators': 123, 'max_depth': 16, 'min_samples_split': 139, 'min_samples_leaf': 71, 'criterion': 'gini'}.
Trial 3987 finished with value: 0.6847826086956522 and parameters: {'n_estimators': 292, 'max_depth': 7, 'min_samples_split': 37, 'min_samples_leaf': 57, 'criterion': 'gini'}.
Trial 3988 finished with value: 0.7065217391304348 and parameters: {'n_estimators': 379, 'max_depth': 9, 'min_samples_split': 114, 'min_samples_leaf': 77, 'criterion': 'gini'}.
Trial 3989 finished with value: 0.717391304347826 and parameters: {'n_estimators': 345, 'max_depth': 12, 'min_samples_split': 143, 'min_samples_leaf': 65, 'criterion': 'gini'}.
Trial 3990 finished with value: 0.7065217391304348 and parameters: {'n_estimators': 253, 'max_depth': 8, 'min_samples_split': 130, 'min_samples_leaf': 59, 'criterion': 'gini'}.
Trial 3991 finished with value: 0.6739130434782609 and parameters: {'n_estimators': 216, 'max_depth': 14, 'min_samples_split': 40, 'min_samples_leaf': 63, 'criterion': 'gini'}.
Trial 3992 finished with value: 0.6739130434782609 and parameters: {'n_estimators': 272, 'max_depth': 10, 'min_samples_split': 70, 'min_samples_leaf': 75, 'criterion': 'gini'}.
Trial 3993 finished with value: 0.6739130434782609 and parameters: {'n_estimators': 311, 'max_depth': 6, 'min_samples_split': 122, 'min_samples_leaf': 58, 'criterion': 'gini'}.
Trial 3994 finished with value: 0.6630434782608695 and parameters: {'n_estimators': 241, 'max_depth': 100, 'min_samples_split': 51, 'min_samples_leaf': 62, 'criterion': 'gini'}.
Trial 3995 finished with value: 0.7065217391304348 and parameters: {'n_estimators': 669, 'max_depth': 12, 'min_samples_split': 145, 'min_samples_leaf': 57, 'criterion': 'gini'}.
Trial 3996 finished with value: 0.6739130434782609 and parameters: {'n_estimators': 286, 'max_depth': 5, 'min_samples_split': 138, 'min_samples_leaf': 67, 'criterion': 'gini'}.
Trial 3997 finished with value: 0.6956521739130435 and parameters: {'n_estimators': 331, 'max_depth': 11, 'min_samples_split': 37, 'min_samples_leaf': 73, 'criterion': 'gini'}.
Trial 3998 finished with value: 0.717391304347826 and parameters: {'n_estimators': 262, 'max_depth': 8, 'min_samples_split': 44, 'min_samples_leaf': 60, 'criterion': 'gini'}.
Trial 3999 finished with value: 0.6739130434782609 and parameters: {'n_estimators': 169, 'max_depth': 15, 'min_samples_split': 118, 'min_samples_leaf': 57, 'criterion': 'gini'}.
Trial 4000 finished with value: 0.7065217391304348 and parameters: {'n_estimators': 298, 'max_depth': 10, 'min_samples_split': 87, 'min_samples_leaf': 70, 'criterion': 'gini'}.
Trial 4001 finished with value: 0.6956521739130435 and parameters: {'n_estimators': 225, 'max_depth': 13, 'min_samples_split': 98, 'min_samples_leaf': 60, 'criterion': 'gini'}.
Trial 4002 finished with value: 0.7065217391304348 and parameters: {'n_estimators': 278, 'max_depth': 8, 'min_samples_split': 37, 'min_samples_leaf': 64, 'criterion': 'gini'}.
Trial 4003 finished with value: 0.6847826086956522 and parameters: {'n_estimators': 305, 'max_depth': 17, 'min_samples_split': 42, 'min_samples_leaf': 61, 'criterion': 'gini'}.
Trial 4004 finished with value: 0.7065217391304348 and parameters: {'n_estimators': 252, 'max_depth': 11, 'min_samples_split': 107, 'min_samples_leaf': 57, 'criterion': 'gini'}.
Trial 4005 finished with value: 0.7065217391304348 and parameters: {'n_estimators': 287, 'max_depth': 13, 'min_samples_split': 134, 'min_samples_leaf': 59, 'criterion': 'gini'}.
Trial 4006 finished with value: 0.6739130434782609 and parameters: {'n_estimators': 267, 'max_depth': 34, 'min_samples_split': 156, 'min_samples_leaf': 36, 'criterion': 'gini'}.
Trial 4007 finished with value: 0.6956521739130435 and parameters: {'n_estimators': 320, 'max_depth': 9, 'min_samples_split': 142, 'min_samples_leaf': 62, 'criterion': 'gini'}.
Trial 4008 finished with value: 0.6956521739130435 and parameters: {'n_estimators': 235, 'max_depth': 7, 'min_samples_split': 110, 'min_samples_leaf': 72, 'criterion': 'gini'}.
Trial 4009 finished with value: 0.6956521739130435 and parameters: {'n_estimators': 255, 'max_depth': 11, 'min_samples_split': 147, 'min_samples_leaf': 69, 'criterion': 'gini'}.
Trial 4010 finished with value: 0.6847826086956522 and parameters: {'n_estimators': 358, 'max_depth': 76, 'min_samples_split': 36, 'min_samples_leaf': 74, 'criterion': 'gini'}.
Trial 4011 finished with value: 0.6521739130434783 and parameters: {'n_estimators': 197, 'max_depth': 20, 'min_samples_split': 126, 'min_samples_leaf': 78, 'criterion': 'gini'}.
Trial 4012 finished with value: 0.6847826086956522 and parameters: {'n_estimators': 293, 'max_depth': 14, 'min_samples_split': 138, 'min_samples_leaf': 57, 'criterion': 'gini'}.
Trial 4013 finished with value: 0.6413043478260869 and parameters: {'n_estimators': 279, 'max_depth': 5, 'min_samples_split': 121, 'min_samples_leaf': 59, 'criterion': 'gini'}.
Trial 4014 finished with value: 0.717391304347826 and parameters: {'n_estimators': 312, 'max_depth': 9, 'min_samples_split': 150, 'min_samples_leaf': 64, 'criterion': 'gini'}.
Trial 4015 finished with value: 0.7065217391304348 and parameters: {'n_estimators': 269, 'max_depth': 12, 'min_samples_split': 36, 'min_samples_leaf': 61, 'criterion': 'gini'}.
Trial 4016 finished with value: 0.6847826086956522 and parameters: {'n_estimators': 252, 'max_depth': 10, 'min_samples_split': 2, 'min_samples_leaf': 66, 'criterion': 'gini'}.
Trial 4017 finished with value: 0.6956521739130435 and parameters: {'n_estimators': 298, 'max_depth': 16, 'min_samples_split': 131, 'min_samples_leaf': 59, 'criterion': 'gini'}.
Trial 4018 finished with value: 0.6630434782608695 and parameters: {'n_estimators': 334, 'max_depth': 7, 'min_samples_split': 49, 'min_samples_leaf': 57, 'criterion': 'gini'}.
Trial 4019 finished with value: 0.6630434782608695 and parameters: {'n_estimators': 223, 'max_depth': 14, 'min_samples_split': 35, 'min_samples_leaf': 63, 'criterion': 'gini'}.
Trial 4020 finished with value: 0.717391304347826 and parameters: {'n_estimators': 272, 'max_depth': 9, 'min_samples_split': 42, 'min_samples_leaf': 71, 'criterion': 'gini'}.
Trial 4021 finished with value: 0.7065217391304348 and parameters: {'n_estimators': 241, 'max_depth': 12, 'min_samples_split': 82, 'min_samples_leaf': 60, 'criterion': 'gini'}.
Trial 4022 finished with value: 0.717391304347826 and parameters: {'n_estimators': 290, 'max_depth': 10, 'min_samples_split': 57, 'min_samples_leaf': 57, 'criterion': 'gini'}.
Trial 4023 finished with value: 0.6956521739130435 and parameters: {'n_estimators': 977, 'max_depth': 8, 'min_samples_split': 143, 'min_samples_leaf': 75, 'criterion': 'gini'}.
Trial 4024 finished with value: 0.7065217391304348 and parameters: {'n_estimators': 315, 'max_depth': 12, 'min_samples_split': 39, 'min_samples_leaf': 67, 'criterion': 'gini'}.
Trial 4025 finished with value: 0.6413043478260869 and parameters: {'n_estimators': 264, 'max_depth': 5, 'min_samples_split': 116, 'min_samples_leaf': 62, 'criterion': 'gini'}.
Trial 4026 finished with value: 0.6956521739130435 and parameters: {'n_estimators': 285, 'max_depth': 14, 'min_samples_split': 139, 'min_samples_leaf': 59, 'criterion': 'gini'}.
Trial 4027 finished with value: 0.6956521739130435 and parameters: {'n_estimators': 303, 'max_depth': 7, 'min_samples_split': 146, 'min_samples_leaf': 57, 'criterion': 'gini'}.
Trial 4028 finished with value: 0.6630434782608695 and parameters: {'n_estimators': 250, 'max_depth': 18, 'min_samples_split': 134, 'min_samples_leaf': 61, 'criterion': 'gini'}.
Trial 4029 finished with value: 0.7065217391304348 and parameters: {'n_estimators': 270, 'max_depth': 10, 'min_samples_split': 74, 'min_samples_leaf': 69, 'criterion': 'gini'}.
Trial 4030 finished with value: 0.6956521739130435 and parameters: {'n_estimators': 958, 'max_depth': 11, 'min_samples_split': 34, 'min_samples_leaf': 72, 'criterion': 'gini'}.
Trial 4031 finished with value: 0.6956521739130435 and parameters: {'n_estimators': 327, 'max_depth': 15, 'min_samples_split': 45, 'min_samples_leaf': 64, 'criterion': 'gini'}.
Trial 4032 finished with value: 0.6956521739130435 and parameters: {'n_estimators': 233, 'max_depth': 8, 'min_samples_split': 127, 'min_samples_leaf': 80, 'criterion': 'gini'}.
Trial 4033 finished with value: 0.6847826086956522 and parameters: {'n_estimators': 286, 'max_depth': 22, 'min_samples_split': 152, 'min_samples_leaf': 59, 'criterion': 'gini'}.
Trial 4034 finished with value: 0.6847826086956522 and parameters: {'n_estimators': 260, 'max_depth': 13, 'min_samples_split': 41, 'min_samples_leaf': 57, 'criterion': 'gini'}.
Trial 4035 finished with value: 0.7282608695652174 and parameters: {'n_estimators': 149, 'max_depth': 10, 'min_samples_split': 39, 'min_samples_leaf': 62, 'criterion': 'gini'}.
Trial 4036 finished with value: 0.6630434782608695 and parameters: {'n_estimators': 214, 'max_depth': 6, 'min_samples_split': 141, 'min_samples_leaf': 74, 'criterion': 'gini'}.
Trial 4037 finished with value: 0.6847826086956522 and parameters: {'n_estimators': 303, 'max_depth': 12, 'min_samples_split': 33, 'min_samples_leaf': 59, 'criterion': 'gini'}.
Trial 4038 finished with value: 0.6956521739130435 and parameters: {'n_estimators': 657, 'max_depth': 9, 'min_samples_split': 130, 'min_samples_leaf': 65, 'criterion': 'gini'}.
Trial 4039 finished with value: 0.6739130434782609 and parameters: {'n_estimators': 346, 'max_depth': 16, 'min_samples_split': 35, 'min_samples_leaf': 56, 'criterion': 'gini'}.
Trial 4040 finished with value: 0.6956521739130435 and parameters: {'n_estimators': 280, 'max_depth': 73, 'min_samples_split': 121, 'min_samples_leaf': 61, 'criterion': 'gini'}.
Trial 4041 finished with value: 0.7065217391304348 and parameters: {'n_estimators': 249, 'max_depth': 8, 'min_samples_split': 38, 'min_samples_leaf': 77, 'criterion': 'gini'}.
Trial 4042 finished with value: 0.7065217391304348 and parameters: {'n_estimators': 271, 'max_depth': 11, 'min_samples_split': 195, 'min_samples_leaf': 68, 'criterion': 'gini'}.
Trial 4043 finished with value: 0.7065217391304348 and parameters: {'n_estimators': 318, 'max_depth': 13, 'min_samples_split': 136, 'min_samples_leaf': 57, 'criterion': 'gini'}.
Trial 4044 finished with value: 0.6847826086956522 and parameters: {'n_estimators': 243, 'max_depth': 7, 'min_samples_split': 147, 'min_samples_leaf': 59, 'criterion': 'gini'}.
Trial 4045 finished with value: 0.717391304347826 and parameters: {'n_estimators': 292, 'max_depth': 10, 'min_samples_split': 142, 'min_samples_leaf': 71, 'criterion': 'gini'}.
Trial 4046 finished with value: 0.6739130434782609 and parameters: {'n_estimators': 270, 'max_depth': 14, 'min_samples_split': 35, 'min_samples_leaf': 63, 'criterion': 'gini'}.
Trial 4047 finished with value: 0.717391304347826 and parameters: {'n_estimators': 302, 'max_depth': 9, 'min_samples_split': 34, 'min_samples_leaf': 56, 'criterion': 'gini'}.
Trial 4048 finished with value: 0.6630434782608695 and parameters: {'n_estimators': 624, 'max_depth': 44, 'min_samples_split': 42, 'min_samples_leaf': 60, 'criterion': 'gini'}.
Trial 4049 finished with value: 0.6630434782608695 and parameters: {'n_estimators': 259, 'max_depth': 5, 'min_samples_split': 136, 'min_samples_leaf': 58, 'criterion': 'gini'}.
Trial 4050 finished with value: 0.6956521739130435 and parameters: {'n_estimators': 281, 'max_depth': 12, 'min_samples_split': 112, 'min_samples_leaf': 66, 'criterion': 'gini'}.
Trial 4051 finished with value: 0.7065217391304348 and parameters: {'n_estimators': 199, 'max_depth': 11, 'min_samples_split': 150, 'min_samples_leaf': 61, 'criterion': 'gini'}.
Trial 4052 finished with value: 0.6195652173913043 and parameters: {'n_estimators': 326, 'max_depth': 7, 'min_samples_split': 33, 'min_samples_leaf': 8, 'criterion': 'gini'}.
Trial 4053 finished with value: 0.6739130434782609 and parameters: {'n_estimators': 295, 'max_depth': 15, 'min_samples_split': 48, 'min_samples_leaf': 73, 'criterion': 'gini'}.
Trial 4054 finished with value: 0.6847826086956522 and parameters: {'n_estimators': 232, 'max_depth': 9, 'min_samples_split': 126, 'min_samples_leaf': 56, 'criterion': 'gini'}.
Trial 4055 finished with value: 0.717391304347826 and parameters: {'n_estimators': 254, 'max_depth': 13, 'min_samples_split': 145, 'min_samples_leaf': 63, 'criterion': 'gini'}.
Trial 4056 finished with value: 0.6739130434782609 and parameters: {'n_estimators': 478, 'max_depth': 50, 'min_samples_split': 132, 'min_samples_leaf': 59, 'criterion': 'gini'}.
Trial 4057 finished with value: 0.7065217391304348 and parameters: {'n_estimators': 312, 'max_depth': 18, 'min_samples_split': 53, 'min_samples_leaf': 57, 'criterion': 'gini'}.
Trial 4058 finished with value: 0.6847826086956522 and parameters: {'n_estimators': 167, 'max_depth': 11, 'min_samples_split': 140, 'min_samples_leaf': 69, 'criterion': 'gini'}.
Trial 4059 finished with value: 0.7065217391304348 and parameters: {'n_estimators': 278, 'max_depth': 8, 'min_samples_split': 37, 'min_samples_leaf': 61, 'criterion': 'gini'}.
Trial 4060 finished with value: 0.6739130434782609 and parameters: {'n_estimators': 370, 'max_depth': 6, 'min_samples_split': 32, 'min_samples_leaf': 84, 'criterion': 'gini'}.
Trial 4061 finished with value: 0.7065217391304348 and parameters: {'n_estimators': 393, 'max_depth': 10, 'min_samples_split': 116, 'min_samples_leaf': 65, 'criterion': 'gini'}.
Trial 4062 finished with value: 0.6739130434782609 and parameters: {'n_estimators': 639, 'max_depth': 16, 'min_samples_split': 44, 'min_samples_leaf': 59, 'criterion': 'gini'}.
Trial 4063 finished with value: 0.6630434782608695 and parameters: {'n_estimators': 118, 'max_depth': 13, 'min_samples_split': 102, 'min_samples_leaf': 74, 'criterion': 'gini'}.
Trial 4064 finished with value: 0.6847826086956522 and parameters: {'n_estimators': 225, 'max_depth': 9, 'min_samples_split': 157, 'min_samples_leaf': 56, 'criterion': 'gini'}.
Trial 4065 finished with value: 0.6739130434782609 and parameters: {'n_estimators': 268, 'max_depth': 47, 'min_samples_split': 93, 'min_samples_leaf': 76, 'criterion': 'gini'}.
Trial 4066 finished with value: 0.6956521739130435 and parameters: {'n_estimators': 341, 'max_depth': 11, 'min_samples_split': 166, 'min_samples_leaf': 62, 'criterion': 'gini'}.
Trial 4067 finished with value: 0.717391304347826 and parameters: {'n_estimators': 243, 'max_depth': 7, 'min_samples_split': 37, 'min_samples_leaf': 58, 'criterion': 'gini'}.
Trial 4068 finished with value: 0.6847826086956522 and parameters: {'n_estimators': 298, 'max_depth': 14, 'min_samples_split': 173, 'min_samples_leaf': 70, 'criterion': 'gini'}.
Trial 4069 finished with value: 0.7065217391304348 and parameters: {'n_estimators': 281, 'max_depth': 12, 'min_samples_split': 33, 'min_samples_leaf': 60, 'criterion': 'gini'}.
Trial 4070 finished with value: 0.7065217391304348 and parameters: {'n_estimators': 263, 'max_depth': 9, 'min_samples_split': 137, 'min_samples_leaf': 72, 'criterion': 'gini'}.
Trial 4071 finished with value: 0.6521739130434783 and parameters: {'n_estimators': 314, 'max_depth': 5, 'min_samples_split': 40, 'min_samples_leaf': 63, 'criterion': 'gini'}.
Trial 4072 finished with value: 0.6956521739130435 and parameters: {'n_estimators': 289, 'max_depth': 11, 'min_samples_split': 149, 'min_samples_leaf': 56, 'criterion': 'gini'}.
Trial 4073 finished with value: 0.7065217391304348 and parameters: {'n_estimators': 251, 'max_depth': 8, 'min_samples_split': 144, 'min_samples_leaf': 67, 'criterion': 'gini'}.
Trial 4074 finished with value: 0.7065217391304348 and parameters: {'n_estimators': 210, 'max_depth': 14, 'min_samples_split': 120, 'min_samples_leaf': 59, 'criterion': 'gini'}.
Trial 4075 finished with value: 0.717391304347826 and parameters: {'n_estimators': 300, 'max_depth': 10, 'min_samples_split': 38, 'min_samples_leaf': 61, 'criterion': 'gini'}.
Trial 4076 finished with value: 0.7065217391304348 and parameters: {'n_estimators': 329, 'max_depth': 7, 'min_samples_split': 188, 'min_samples_leaf': 57, 'criterion': 'gini'}.
Trial 4077 finished with value: 0.6739130434782609 and parameters: {'n_estimators': 276, 'max_depth': 16, 'min_samples_split': 31, 'min_samples_leaf': 58, 'criterion': 'gini'}.
Trial 4078 finished with value: 0.6956521739130435 and parameters: {'n_estimators': 231, 'max_depth': 12, 'min_samples_split': 46, 'min_samples_leaf': 63, 'criterion': 'gini'}.
Trial 4079 finished with value: 0.6956521739130435 and parameters: {'n_estimators': 262, 'max_depth': 9, 'min_samples_split': 130, 'min_samples_leaf': 61, 'criterion': 'gini'}.
Trial 4080 finished with value: 0.6847826086956522 and parameters: {'n_estimators': 243, 'max_depth': 13, 'min_samples_split': 141, 'min_samples_leaf': 65, 'criterion': 'gini'}.
Trial 4081 finished with value: 0.6956521739130435 and parameters: {'n_estimators': 285, 'max_depth': 11, 'min_samples_split': 123, 'min_samples_leaf': 75, 'criterion': 'gini'}.
Trial 4082 finished with value: 0.6739130434782609 and parameters: {'n_estimators': 184, 'max_depth': 7, 'min_samples_split': 33, 'min_samples_leaf': 71, 'criterion': 'gini'}.
Trial 4083 finished with value: 0.6847826086956522 and parameters: {'n_estimators': 265, 'max_depth': 9, 'min_samples_split': 136, 'min_samples_leaf': 56, 'criterion': 'gini'}.
Trial 4084 finished with value: 0.6521739130434783 and parameters: {'n_estimators': 419, 'max_depth': 15, 'min_samples_split': 64, 'min_samples_leaf': 59, 'criterion': 'gini'}.
Trial 4085 finished with value: 0.6956521739130435 and parameters: {'n_estimators': 309, 'max_depth': 91, 'min_samples_split': 154, 'min_samples_leaf': 60, 'criterion': 'gini'}.
Trial 4086 finished with value: 0.6739130434782609 and parameters: {'n_estimators': 673, 'max_depth': 55, 'min_samples_split': 145, 'min_samples_leaf': 98, 'criterion': 'gini'}.
Trial 4087 finished with value: 0.717391304347826 and parameters: {'n_estimators': 293, 'max_depth': 11, 'min_samples_split': 39, 'min_samples_leaf': 56, 'criterion': 'gini'}.
Trial 4088 finished with value: 0.6630434782608695 and parameters: {'n_estimators': 253, 'max_depth': 19, 'min_samples_split': 31, 'min_samples_leaf': 68, 'criterion': 'gini'}.
Trial 4089 finished with value: 0.6630434782608695 and parameters: {'n_estimators': 450, 'max_depth': 5, 'min_samples_split': 41, 'min_samples_leaf': 64, 'criterion': 'gini'}.
Trial 4090 finished with value: 0.7065217391304348 and parameters: {'n_estimators': 273, 'max_depth': 13, 'min_samples_split': 35, 'min_samples_leaf': 58, 'criterion': 'gini'}.
Trial 4091 finished with value: 0.6739130434782609 and parameters: {'n_estimators': 135, 'max_depth': 8, 'min_samples_split': 133, 'min_samples_leaf': 73, 'criterion': 'gini'}.
Trial 4092 finished with value: 0.6956521739130435 and parameters: {'n_estimators': 331, 'max_depth': 10, 'min_samples_split': 139, 'min_samples_leaf': 78, 'criterion': 'gini'}.
Trial 4093 finished with value: 0.717391304347826 and parameters: {'n_estimators': 353, 'max_depth': 12, 'min_samples_split': 32, 'min_samples_leaf': 62, 'criterion': 'gini'}.
Trial 4094 finished with value: 0.6956521739130435 and parameters: {'n_estimators': 310, 'max_depth': 7, 'min_samples_split': 149, 'min_samples_leaf': 56, 'criterion': 'gini'}.
Trial 4095 finished with value: 0.6739130434782609 and parameters: {'n_estimators': 944, 'max_depth': 16, 'min_samples_split': 36, 'min_samples_leaf': 60, 'criterion': 'gini'}.
Trial 4096 finished with value: 0.7065217391304348 and parameters: {'n_estimators': 275, 'max_depth': 10, 'min_samples_split': 125, 'min_samples_leaf': 58, 'criterion': 'gini'}.
Trial 4097 finished with value: 0.6739130434782609 and parameters: {'n_estimators': 244, 'max_depth': 14, 'min_samples_split': 43, 'min_samples_leaf': 66, 'criterion': 'gini'}.
Trial 4098 finished with value: 0.7391304347826086 and parameters: {'n_estimators': 268, 'max_depth': 9, 'min_samples_split': 109, 'min_samples_leaf': 61, 'criterion': 'gini'}.
Trial 4099 finished with value: 0.6847826086956522 and parameters: {'n_estimators': 222, 'max_depth': 12, 'min_samples_split': 144, 'min_samples_leaf': 56, 'criterion': 'gini'}.
Trial 4100 finished with value: 0.717391304347826 and parameters: {'n_estimators': 287, 'max_depth': 8, 'min_samples_split': 30, 'min_samples_leaf': 70, 'criterion': 'gini'}.
Trial 4101 finished with value: 0.6847826086956522 and parameters: {'n_estimators': 294, 'max_depth': 6, 'min_samples_split': 128, 'min_samples_leaf': 63, 'criterion': 'gini'}.
Trial 4102 finished with value: 0.717391304347826 and parameters: {'n_estimators': 306, 'max_depth': 11, 'min_samples_split': 39, 'min_samples_leaf': 58, 'criterion': 'gini'}.
Trial 4103 finished with value: 0.6847826086956522 and parameters: {'n_estimators': 252, 'max_depth': 14, 'min_samples_split': 139, 'min_samples_leaf': 72, 'criterion': 'gini'}.
Trial 4104 finished with value: 0.7282608695652174 and parameters: {'n_estimators': 324, 'max_depth': 10, 'min_samples_split': 114, 'min_samples_leaf': 60, 'criterion': 'gini'}.
Trial 4105 finished with value: 0.6956521739130435 and parameters: {'n_estimators': 231, 'max_depth': 17, 'min_samples_split': 162, 'min_samples_leaf': 75, 'criterion': 'gini'}.
Trial 4106 finished with value: 0.7065217391304348 and parameters: {'n_estimators': 284, 'max_depth': 8, 'min_samples_split': 35, 'min_samples_leaf': 68, 'criterion': 'gini'}.
Trial 4107 finished with value: 0.6847826086956522 and parameters: {'n_estimators': 261, 'max_depth': 12, 'min_samples_split': 134, 'min_samples_leaf': 57, 'criterion': 'gini'}.
Trial 4108 finished with value: 0.6847826086956522 and parameters: {'n_estimators': 297, 'max_depth': 6, 'min_samples_split': 118, 'min_samples_leaf': 62, 'criterion': 'gini'}.
