Trial 9270 finished with value: 0.6847826086956522 and parameters: {'n_estimators': 804, 'max_depth': 17, 'min_samples_split': 35, 'min_samples_leaf': 56, 'criterion': 'entropy'}.
Trial 9271 finished with value: 0.6304347826086957 and parameters: {'n_estimators': 312, 'max_depth': 5, 'min_samples_split': 20, 'min_samples_leaf': 62, 'criterion': 'gini'}.
Trial 9272 finished with value: 0.6956521739130435 and parameters: {'n_estimators': 761, 'max_depth': 11, 'min_samples_split': 148, 'min_samples_leaf': 65, 'criterion': 'entropy'}.
Trial 9273 finished with value: 0.6847826086956522 and parameters: {'n_estimators': 450, 'max_depth': 13, 'min_samples_split': 6, 'min_samples_leaf': 58, 'criterion': 'entropy'}.
Trial 9274 finished with value: 0.717391304347826 and parameters: {'n_estimators': 270, 'max_depth': 8, 'min_samples_split': 32, 'min_samples_leaf': 60, 'criterion': 'gini'}.
Trial 9275 finished with value: 0.7282608695652174 and parameters: {'n_estimators': 703, 'max_depth': 10, 'min_samples_split': 27, 'min_samples_leaf': 55, 'criterion': 'entropy'}.
Trial 9276 finished with value: 0.6956521739130435 and parameters: {'n_estimators': 290, 'max_depth': 12, 'min_samples_split': 45, 'min_samples_leaf': 75, 'criterion': 'gini'}.
Trial 9277 finished with value: 0.6630434782608695 and parameters: {'n_estimators': 220, 'max_depth': 7, 'min_samples_split': 103, 'min_samples_leaf': 53, 'criterion': 'entropy'}.
Trial 9278 finished with value: 0.6847826086956522 and parameters: {'n_estimators': 835, 'max_depth': 14, 'min_samples_split': 38, 'min_samples_leaf': 58, 'criterion': 'entropy'}.
Trial 9279 finished with value: 0.717391304347826 and parameters: {'n_estimators': 255, 'max_depth': 9, 'min_samples_split': 31, 'min_samples_leaf': 62, 'criterion': 'gini'}.
Trial 9280 finished with value: 0.7282608695652174 and parameters: {'n_estimators': 304, 'max_depth': 11, 'min_samples_split': 15, 'min_samples_leaf': 56, 'criterion': 'entropy'}.
Trial 9281 finished with value: 0.6847826086956522 and parameters: {'n_estimators': 743, 'max_depth': 6, 'min_samples_split': 116, 'min_samples_leaf': 60, 'criterion': 'gini'}.
Trial 9282 finished with value: 0.6956521739130435 and parameters: {'n_estimators': 673, 'max_depth': 15, 'min_samples_split': 25, 'min_samples_leaf': 49, 'criterion': 'entropy'}.
Trial 9283 finished with value: 0.7065217391304348 and parameters: {'n_estimators': 938, 'max_depth': 9, 'min_samples_split': 42, 'min_samples_leaf': 64, 'criterion': 'entropy'}.
Trial 9284 finished with value: 0.6847826086956522 and parameters: {'n_estimators': 354, 'max_depth': 13, 'min_samples_split': 130, 'min_samples_leaf': 58, 'criterion': 'gini'}.
Trial 9285 finished with value: 0.6956521739130435 and parameters: {'n_estimators': 408, 'max_depth': 7, 'min_samples_split': 36, 'min_samples_leaf': 61, 'criterion': 'entropy'}.
Trial 9286 finished with value: 0.7065217391304348 and parameters: {'n_estimators': 283, 'max_depth': 11, 'min_samples_split': 22, 'min_samples_leaf': 67, 'criterion': 'gini'}.
Trial 9287 finished with value: 0.6739130434782609 and parameters: {'n_estimators': 241, 'max_depth': 17, 'min_samples_split': 50, 'min_samples_leaf': 56, 'criterion': 'entropy'}.
Trial 9288 finished with value: 0.7065217391304348 and parameters: {'n_estimators': 772, 'max_depth': 9, 'min_samples_split': 40, 'min_samples_leaf': 53, 'criterion': 'gini'}.
Trial 9289 finished with value: 0.6956521739130435 and parameters: {'n_estimators': 268, 'max_depth': 12, 'min_samples_split': 96, 'min_samples_leaf': 59, 'criterion': 'entropy'}.
Trial 9290 finished with value: 0.6195652173913043 and parameters: {'n_estimators': 322, 'max_depth': 5, 'min_samples_split': 33, 'min_samples_leaf': 57, 'criterion': 'entropy'}.
Trial 9291 finished with value: 0.6847826086956522 and parameters: {'n_estimators': 288, 'max_depth': 19, 'min_samples_split': 28, 'min_samples_leaf': 51, 'criterion': 'gini'}.
Trial 9292 finished with value: 0.7065217391304348 and parameters: {'n_estimators': 256, 'max_depth': 8, 'min_samples_split': 147, 'min_samples_leaf': 78, 'criterion': 'entropy'}.
Trial 9293 finished with value: 0.7065217391304348 and parameters: {'n_estimators': 127, 'max_depth': 10, 'min_samples_split': 37, 'min_samples_leaf': 63, 'criterion': 'gini'}.
Trial 9294 finished with value: 0.6847826086956522 and parameters: {'n_estimators': 304, 'max_depth': 14, 'min_samples_split': 30, 'min_samples_leaf': 55, 'criterion': 'entropy'}.
Trial 9295 finished with value: 0.6847826086956522 and parameters: {'n_estimators': 900, 'max_depth': 11, 'min_samples_split': 18, 'min_samples_leaf': 74, 'criterion': 'entropy'}.
Trial 9296 finished with value: 0.7065217391304348 and parameters: {'n_estimators': 782, 'max_depth': 7, 'min_samples_split': 120, 'min_samples_leaf': 60, 'criterion': 'gini'}.
Trial 9297 finished with value: 0.6739130434782609 and parameters: {'n_estimators': 329, 'max_depth': 90, 'min_samples_split': 25, 'min_samples_leaf': 61, 'criterion': 'entropy'}.
Trial 9298 finished with value: 0.6739130434782609 and parameters: {'n_estimators': 194, 'max_depth': 16, 'min_samples_split': 34, 'min_samples_leaf': 58, 'criterion': 'gini'}.
Trial 9299 finished with value: 0.7065217391304348 and parameters: {'n_estimators': 750, 'max_depth': 12, 'min_samples_split': 45, 'min_samples_leaf': 55, 'criterion': 'entropy'}.
Trial 9300 finished with value: 0.7065217391304348 and parameters: {'n_estimators': 238, 'max_depth': 9, 'min_samples_split': 110, 'min_samples_leaf': 65, 'criterion': 'entropy'}.
Trial 9301 finished with value: 0.6739130434782609 and parameters: {'n_estimators': 165, 'max_depth': 13, 'min_samples_split': 10, 'min_samples_leaf': 57, 'criterion': 'gini'}.
Trial 9302 finished with value: 0.7065217391304348 and parameters: {'n_estimators': 272, 'max_depth': 9, 'min_samples_split': 40, 'min_samples_leaf': 53, 'criterion': 'entropy'}.
Trial 9303 finished with value: 0.6956521739130435 and parameters: {'n_estimators': 292, 'max_depth': 7, 'min_samples_split': 124, 'min_samples_leaf': 59, 'criterion': 'gini'}.
Trial 9304 finished with value: 0.717391304347826 and parameters: {'n_estimators': 719, 'max_depth': 11, 'min_samples_split': 31, 'min_samples_leaf': 61, 'criterion': 'entropy'}.
Trial 9305 finished with value: 0.6739130434782609 and parameters: {'n_estimators': 797, 'max_depth': 14, 'min_samples_split': 28, 'min_samples_leaf': 56, 'criterion': 'gini'}.
Trial 9306 finished with value: 0.6521739130434783 and parameters: {'n_estimators': 824, 'max_depth': 5, 'min_samples_split': 68, 'min_samples_leaf': 68, 'criterion': 'entropy'}.
Trial 9307 finished with value: 0.6739130434782609 and parameters: {'n_estimators': 258, 'max_depth': 10, 'min_samples_split': 35, 'min_samples_leaf': 76, 'criterion': 'entropy'}.
Trial 9308 finished with value: 0.7065217391304348 and parameters: {'n_estimators': 306, 'max_depth': 8, 'min_samples_split': 40, 'min_samples_leaf': 63, 'criterion': 'gini'}.
Trial 9309 finished with value: 0.6847826086956522 and parameters: {'n_estimators': 281, 'max_depth': 12, 'min_samples_split': 21, 'min_samples_leaf': 59, 'criterion': 'entropy'}.
Trial 9310 finished with value: 0.6956521739130435 and parameters: {'n_estimators': 338, 'max_depth': 16, 'min_samples_split': 156, 'min_samples_leaf': 54, 'criterion': 'gini'}.
Trial 9311 finished with value: 0.7065217391304348 and parameters: {'n_estimators': 224, 'max_depth': 10, 'min_samples_split': 33, 'min_samples_leaf': 57, 'criterion': 'entropy'}.
Trial 9312 finished with value: 0.7065217391304348 and parameters: {'n_estimators': 377, 'max_depth': 14, 'min_samples_split': 25, 'min_samples_leaf': 62, 'criterion': 'entropy'}.
Trial 9313 finished with value: 0.6847826086956522 and parameters: {'n_estimators': 269, 'max_depth': 8, 'min_samples_split': 44, 'min_samples_leaf': 51, 'criterion': 'gini'}.
Trial 9314 finished with value: 0.6521739130434783 and parameters: {'n_estimators': 315, 'max_depth': 12, 'min_samples_split': 129, 'min_samples_leaf': 26, 'criterion': 'entropy'}.
Trial 9315 finished with value: 0.6630434782608695 and parameters: {'n_estimators': 759, 'max_depth': 6, 'min_samples_split': 91, 'min_samples_leaf': 73, 'criterion': 'gini'}.
Trial 9316 finished with value: 0.6956521739130435 and parameters: {'n_estimators': 245, 'max_depth': 11, 'min_samples_split': 146, 'min_samples_leaf': 59, 'criterion': 'entropy'}.
Trial 9317 finished with value: 0.6847826086956522 and parameters: {'n_estimators': 728, 'max_depth': 9, 'min_samples_split': 38, 'min_samples_leaf': 65, 'criterion': 'entropy'}.
Trial 9318 finished with value: 0.6847826086956522 and parameters: {'n_estimators': 284, 'max_depth': 39, 'min_samples_split': 28, 'min_samples_leaf': 55, 'criterion': 'gini'}.
Trial 9319 finished with value: 0.7065217391304348 and parameters: {'n_estimators': 298, 'max_depth': 14, 'min_samples_split': 106, 'min_samples_leaf': 61, 'criterion': 'entropy'}.
Trial 9320 finished with value: 0.6847826086956522 and parameters: {'n_estimators': 272, 'max_depth': 7, 'min_samples_split': 15, 'min_samples_leaf': 57, 'criterion': 'gini'}.
Trial 9321 finished with value: 0.717391304347826 and parameters: {'n_estimators': 249, 'max_depth': 10, 'min_samples_split': 22, 'min_samples_leaf': 58, 'criterion': 'entropy'}.
Trial 9322 finished with value: 0.6739130434782609 and parameters: {'n_estimators': 209, 'max_depth': 13, 'min_samples_split': 35, 'min_samples_leaf': 67, 'criterion': 'gini'}.
Trial 9323 finished with value: 0.6739130434782609 and parameters: {'n_estimators': 772, 'max_depth': 16, 'min_samples_split': 31, 'min_samples_leaf': 53, 'criterion': 'entropy'}.
Trial 9324 finished with value: 0.7065217391304348 and parameters: {'n_estimators': 320, 'max_depth': 8, 'min_samples_split': 115, 'min_samples_leaf': 48, 'criterion': 'entropy'}.
Trial 9325 finished with value: 0.717391304347826 and parameters: {'n_estimators': 300, 'max_depth': 11, 'min_samples_split': 48, 'min_samples_leaf': 60, 'criterion': 'gini'}.
Trial 9326 finished with value: 0.7065217391304348 and parameters: {'n_estimators': 741, 'max_depth': 10, 'min_samples_split': 27, 'min_samples_leaf': 63, 'criterion': 'entropy'}.
Trial 9327 finished with value: 0.6739130434782609 and parameters: {'n_estimators': 261, 'max_depth': 18, 'min_samples_split': 39, 'min_samples_leaf': 56, 'criterion': 'gini'}.
Trial 9328 finished with value: 0.6413043478260869 and parameters: {'n_estimators': 282, 'max_depth': 5, 'min_samples_split': 18, 'min_samples_leaf': 59, 'criterion': 'entropy'}.
Trial 9329 finished with value: 0.6847826086956522 and parameters: {'n_estimators': 226, 'max_depth': 13, 'min_samples_split': 36, 'min_samples_leaf': 73, 'criterion': 'entropy'}.
Trial 9330 finished with value: 0.6956521739130435 and parameters: {'n_estimators': 846, 'max_depth': 7, 'min_samples_split': 131, 'min_samples_leaf': 54, 'criterion': 'gini'}.
Trial 9331 finished with value: 0.6956521739130435 and parameters: {'n_estimators': 653, 'max_depth': 9, 'min_samples_split': 42, 'min_samples_leaf': 61, 'criterion': 'entropy'}.
Trial 9332 finished with value: 0.6847826086956522 and parameters: {'n_estimators': 973, 'max_depth': 15, 'min_samples_split': 56, 'min_samples_leaf': 57, 'criterion': 'gini'}.
Trial 9333 finished with value: 0.7065217391304348 and parameters: {'n_estimators': 708, 'max_depth': 12, 'min_samples_split': 24, 'min_samples_leaf': 64, 'criterion': 'entropy'}.
Trial 9334 finished with value: 0.6847826086956522 and parameters: {'n_estimators': 349, 'max_depth': 53, 'min_samples_split': 32, 'min_samples_leaf': 59, 'criterion': 'entropy'}.
Trial 9335 finished with value: 0.7065217391304348 and parameters: {'n_estimators': 800, 'max_depth': 11, 'min_samples_split': 145, 'min_samples_leaf': 55, 'criterion': 'gini'}.
Trial 9336 finished with value: 0.717391304347826 and parameters: {'n_estimators': 265, 'max_depth': 8, 'min_samples_split': 122, 'min_samples_leaf': 52, 'criterion': 'entropy'}.
Trial 9337 finished with value: 0.6739130434782609 and parameters: {'n_estimators': 328, 'max_depth': 13, 'min_samples_split': 84, 'min_samples_leaf': 77, 'criterion': 'gini'}.
Trial 9338 finished with value: 0.717391304347826 and parameters: {'n_estimators': 304, 'max_depth': 10, 'min_samples_split': 29, 'min_samples_leaf': 62, 'criterion': 'entropy'}.
Trial 9339 finished with value: 0.6847826086956522 and parameters: {'n_estimators': 762, 'max_depth': 7, 'min_samples_split': 152, 'min_samples_leaf': 57, 'criterion': 'entropy'}.
Trial 9340 finished with value: 0.6630434782608695 and parameters: {'n_estimators': 239, 'max_depth': 15, 'min_samples_split': 36, 'min_samples_leaf': 60, 'criterion': 'gini'}.
Trial 9341 finished with value: 0.7065217391304348 and parameters: {'n_estimators': 284, 'max_depth': 9, 'min_samples_split': 31, 'min_samples_leaf': 68, 'criterion': 'entropy'}.
Trial 9342 finished with value: 0.6739130434782609 and parameters: {'n_estimators': 783, 'max_depth': 20, 'min_samples_split': 21, 'min_samples_leaf': 58, 'criterion': 'gini'}.
Trial 9343 finished with value: 0.6739130434782609 and parameters: {'n_estimators': 257, 'max_depth': 12, 'min_samples_split': 163, 'min_samples_leaf': 80, 'criterion': 'entropy'}.
Trial 9344 finished with value: 0.6304347826086957 and parameters: {'n_estimators': 294, 'max_depth': 5, 'min_samples_split': 46, 'min_samples_leaf': 55, 'criterion': 'gini'}.
Trial 9345 finished with value: 0.6847826086956522 and parameters: {'n_estimators': 314, 'max_depth': 10, 'min_samples_split': 27, 'min_samples_leaf': 75, 'criterion': 'entropy'}.
Trial 9346 finished with value: 0.6630434782608695 and parameters: {'n_estimators': 272, 'max_depth': 35, 'min_samples_split': 39, 'min_samples_leaf': 64, 'criterion': 'entropy'}.
Trial 9347 finished with value: 0.6956521739130435 and parameters: {'n_estimators': 734, 'max_depth': 7, 'min_samples_split': 34, 'min_samples_leaf': 61, 'criterion': 'gini'}.
Trial 9348 finished with value: 0.6521739130434783 and parameters: {'n_estimators': 583, 'max_depth': 12, 'min_samples_split': 25, 'min_samples_leaf': 30, 'criterion': 'entropy'}.
Trial 9349 finished with value: 0.6956521739130435 and parameters: {'n_estimators': 367, 'max_depth': 14, 'min_samples_split': 42, 'min_samples_leaf': 58, 'criterion': 'gini'}.
Trial 9350 finished with value: 0.7065217391304348 and parameters: {'n_estimators': 876, 'max_depth': 9, 'min_samples_split': 32, 'min_samples_leaf': 73, 'criterion': 'entropy'}.
Trial 9351 finished with value: 0.7065217391304348 and parameters: {'n_estimators': 752, 'max_depth': 11, 'min_samples_split': 113, 'min_samples_leaf': 51, 'criterion': 'entropy'}.
Trial 9352 finished with value: 0.6956521739130435 and parameters: {'n_estimators': 434, 'max_depth': 17, 'min_samples_split': 120, 'min_samples_leaf': 56, 'criterion': 'gini'}.
Trial 9353 finished with value: 0.6630434782608695 and parameters: {'n_estimators': 241, 'max_depth': 7, 'min_samples_split': 20, 'min_samples_leaf': 53, 'criterion': 'entropy'}.
Trial 9354 finished with value: 0.6739130434782609 and parameters: {'n_estimators': 813, 'max_depth': 9, 'min_samples_split': 36, 'min_samples_leaf': 66, 'criterion': 'gini'}.
Trial 9355 finished with value: 0.7065217391304348 and parameters: {'n_estimators': 289, 'max_depth': 13, 'min_samples_split': 145, 'min_samples_leaf': 60, 'criterion': 'entropy'}.
Trial 9356 finished with value: 0.717391304347826 and parameters: {'n_estimators': 920, 'max_depth': 11, 'min_samples_split': 30, 'min_samples_leaf': 62, 'criterion': 'entropy'}.
Trial 9357 finished with value: 0.6630434782608695 and parameters: {'n_estimators': 557, 'max_depth': 15, 'min_samples_split': 126, 'min_samples_leaf': 58, 'criterion': 'gini'}.
Trial 9358 finished with value: 0.6630434782608695 and parameters: {'n_estimators': 259, 'max_depth': 6, 'min_samples_split': 14, 'min_samples_leaf': 54, 'criterion': 'entropy'}.
Trial 9359 finished with value: 0.717391304347826 and parameters: {'n_estimators': 335, 'max_depth': 9, 'min_samples_split': 50, 'min_samples_leaf': 56, 'criterion': 'gini'}.
Trial 9360 finished with value: 0.717391304347826 and parameters: {'n_estimators': 307, 'max_depth': 13, 'min_samples_split': 131, 'min_samples_leaf': 59, 'criterion': 'entropy'}.
Trial 9361 finished with value: 0.717391304347826 and parameters: {'n_estimators': 682, 'max_depth': 11, 'min_samples_split': 24, 'min_samples_leaf': 63, 'criterion': 'gini'}.
Trial 9362 finished with value: 0.7065217391304348 and parameters: {'n_estimators': 277, 'max_depth': 8, 'min_samples_split': 150, 'min_samples_leaf': 57, 'criterion': 'entropy'}.
Trial 9363 finished with value: 0.6413043478260869 and parameters: {'n_estimators': 776, 'max_depth': 5, 'min_samples_split': 38, 'min_samples_leaf': 54, 'criterion': 'entropy'}.
Trial 9364 finished with value: 0.717391304347826 and parameters: {'n_estimators': 260, 'max_depth': 10, 'min_samples_split': 28, 'min_samples_leaf': 61, 'criterion': 'gini'}.
Trial 9365 finished with value: 0.7065217391304348 and parameters: {'n_estimators': 295, 'max_depth': 13, 'min_samples_split': 43, 'min_samples_leaf': 68, 'criterion': 'entropy'}.
Trial 9366 finished with value: 0.6413043478260869 and parameters: {'n_estimators': 219, 'max_depth': 16, 'min_samples_split': 101, 'min_samples_leaf': 59, 'criterion': 'gini'}.
Trial 9367 finished with value: 0.7065217391304348 and parameters: {'n_estimators': 100, 'max_depth': 8, 'min_samples_split': 33, 'min_samples_leaf': 56, 'criterion': 'entropy'}.
Trial 9368 finished with value: 0.7282608695652174 and parameters: {'n_estimators': 720, 'max_depth': 11, 'min_samples_split': 37, 'min_samples_leaf': 49, 'criterion': 'entropy'}.
Trial 9369 finished with value: 0.6739130434782609 and parameters: {'n_estimators': 321, 'max_depth': 7, 'min_samples_split': 27, 'min_samples_leaf': 65, 'criterion': 'gini'}.
Trial 9370 finished with value: 0.6956521739130435 and parameters: {'n_estimators': 278, 'max_depth': 10, 'min_samples_split': 18, 'min_samples_leaf': 74, 'criterion': 'entropy'}.
Trial 9371 finished with value: 0.717391304347826 and parameters: {'n_estimators': 238, 'max_depth': 14, 'min_samples_split': 118, 'min_samples_leaf': 60, 'criterion': 'gini'}.
Trial 9372 finished with value: 0.6739130434782609 and parameters: {'n_estimators': 756, 'max_depth': 18, 'min_samples_split': 42, 'min_samples_leaf': 58, 'criterion': 'entropy'}.
Trial 9373 finished with value: 0.6956521739130435 and parameters: {'n_estimators': 300, 'max_depth': 12, 'min_samples_split': 33, 'min_samples_leaf': 62, 'criterion': 'entropy'}.
Trial 9374 finished with value: 0.717391304347826 and parameters: {'n_estimators': 797, 'max_depth': 9, 'min_samples_split': 23, 'min_samples_leaf': 55, 'criterion': 'gini'}.
Trial 9375 finished with value: 0.6630434782608695 and parameters: {'n_estimators': 272, 'max_depth': 86, 'min_samples_split': 143, 'min_samples_leaf': 52, 'criterion': 'entropy'}.
Trial 9376 finished with value: 0.7282608695652174 and parameters: {'n_estimators': 194, 'max_depth': 7, 'min_samples_split': 30, 'min_samples_leaf': 58, 'criterion': 'gini'}.
Trial 9377 finished with value: 0.6847826086956522 and parameters: {'n_estimators': 311, 'max_depth': 12, 'min_samples_split': 183, 'min_samples_leaf': 76, 'criterion': 'entropy'}.
Trial 9378 finished with value: 0.6956521739130435 and parameters: {'n_estimators': 257, 'max_depth': 15, 'min_samples_split': 10, 'min_samples_leaf': 63, 'criterion': 'gini'}.
Trial 9379 finished with value: 0.717391304347826 and parameters: {'n_estimators': 339, 'max_depth': 10, 'min_samples_split': 39, 'min_samples_leaf': 60, 'criterion': 'entropy'}.
Trial 9380 finished with value: 0.717391304347826 and parameters: {'n_estimators': 494, 'max_depth': 8, 'min_samples_split': 47, 'min_samples_leaf': 57, 'criterion': 'entropy'}.
Trial 9381 finished with value: 0.6630434782608695 and parameters: {'n_estimators': 286, 'max_depth': 5, 'min_samples_split': 34, 'min_samples_leaf': 72, 'criterion': 'gini'}.
Trial 9382 finished with value: 0.7065217391304348 and parameters: {'n_estimators': 733, 'max_depth': 13, 'min_samples_split': 126, 'min_samples_leaf': 54, 'criterion': 'entropy'}.
Trial 9383 finished with value: 0.717391304347826 and parameters: {'n_estimators': 772, 'max_depth': 11, 'min_samples_split': 80, 'min_samples_leaf': 61, 'criterion': 'gini'}.
Trial 9384 finished with value: 0.7282608695652174 and parameters: {'n_estimators': 239, 'max_depth': 8, 'min_samples_split': 27, 'min_samples_leaf': 56, 'criterion': 'entropy'}.
Trial 9385 finished with value: 0.6956521739130435 and parameters: {'n_estimators': 178, 'max_depth': 15, 'min_samples_split': 36, 'min_samples_leaf': 66, 'criterion': 'entropy'}.
Trial 9386 finished with value: 0.7065217391304348 and parameters: {'n_estimators': 273, 'max_depth': 10, 'min_samples_split': 23, 'min_samples_leaf': 59, 'criterion': 'gini'}.
Trial 9387 finished with value: 0.7065217391304348 and parameters: {'n_estimators': 252, 'max_depth': 13, 'min_samples_split': 32, 'min_samples_leaf': 69, 'criterion': 'entropy'}.
Trial 9388 finished with value: 0.6956521739130435 and parameters: {'n_estimators': 293, 'max_depth': 9, 'min_samples_split': 93, 'min_samples_leaf': 51, 'criterion': 'gini'}.
Trial 9389 finished with value: 0.7065217391304348 and parameters: {'n_estimators': 470, 'max_depth': 7, 'min_samples_split': 42, 'min_samples_leaf': 63, 'criterion': 'entropy'}.
Trial 9390 finished with value: 0.7391304347826086 and parameters: {'n_estimators': 148, 'max_depth': 11, 'min_samples_split': 19, 'min_samples_leaf': 56, 'criterion': 'entropy'}.
Trial 9391 finished with value: 0.6956521739130435 and parameters: {'n_estimators': 706, 'max_depth': 17, 'min_samples_split': 109, 'min_samples_leaf': 59, 'criterion': 'gini'}.
Trial 9392 finished with value: 0.6739130434782609 and parameters: {'n_estimators': 350, 'max_depth': 6, 'min_samples_split': 29, 'min_samples_leaf': 72, 'criterion': 'entropy'}.
