Trial 3737 finished with value: 0.6847826086956522 and parameters: {'n_estimators': 287, 'max_depth': 13, 'min_samples_split': 141, 'min_samples_leaf': 61, 'criterion': 'gini'}.
Trial 3738 finished with value: 0.7065217391304348 and parameters: {'n_estimators': 305, 'max_depth': 10, 'min_samples_split': 164, 'min_samples_leaf': 58, 'criterion': 'gini'}.
Trial 3739 finished with value: 0.6847826086956522 and parameters: {'n_estimators': 332, 'max_depth': 15, 'min_samples_split': 147, 'min_samples_leaf': 70, 'criterion': 'gini'}.
Trial 3740 finished with value: 0.6956521739130435 and parameters: {'n_estimators': 204, 'max_depth': 12, 'min_samples_split': 138, 'min_samples_leaf': 64, 'criterion': 'gini'}.
Trial 3741 finished with value: 0.6413043478260869 and parameters: {'n_estimators': 263, 'max_depth': 5, 'min_samples_split': 125, 'min_samples_leaf': 59, 'criterion': 'gini'}.
Trial 3742 finished with value: 0.7065217391304348 and parameters: {'n_estimators': 246, 'max_depth': 8, 'min_samples_split': 100, 'min_samples_leaf': 71, 'criterion': 'gini'}.
Trial 3743 finished with value: 0.6956521739130435 and parameters: {'n_estimators': 271, 'max_depth': 48, 'min_samples_split': 119, 'min_samples_leaf': 61, 'criterion': 'gini'}.
Trial 3744 finished with value: 0.6630434782608695 and parameters: {'n_estimators': 162, 'max_depth': 11, 'min_samples_split': 75, 'min_samples_leaf': 21, 'criterion': 'gini'}.
Trial 3745 finished with value: 0.6521739130434783 and parameters: {'n_estimators': 304, 'max_depth': 14, 'min_samples_split': 122, 'min_samples_leaf': 5, 'criterion': 'gini'}.
Trial 3746 finished with value: 0.7065217391304348 and parameters: {'n_estimators': 229, 'max_depth': 9, 'min_samples_split': 144, 'min_samples_leaf': 68, 'criterion': 'gini'}.
Trial 3747 finished with value: 0.6847826086956522 and parameters: {'n_estimators': 275, 'max_depth': 17, 'min_samples_split': 135, 'min_samples_leaf': 59, 'criterion': 'gini'}.
Trial 3748 finished with value: 0.6956521739130435 and parameters: {'n_estimators': 349, 'max_depth': 7, 'min_samples_split': 112, 'min_samples_leaf': 63, 'criterion': 'gini'}.
Trial 3749 finished with value: 0.7065217391304348 and parameters: {'n_estimators': 254, 'max_depth': 11, 'min_samples_split': 130, 'min_samples_leaf': 58, 'criterion': 'gini'}.
Trial 3750 finished with value: 0.7065217391304348 and parameters: {'n_estimators': 287, 'max_depth': 13, 'min_samples_split': 104, 'min_samples_leaf': 75, 'criterion': 'gini'}.
Trial 3751 finished with value: 0.717391304347826 and parameters: {'n_estimators': 309, 'max_depth': 9, 'min_samples_split': 116, 'min_samples_leaf': 61, 'criterion': 'gini'}.
Trial 3752 finished with value: 0.6847826086956522 and parameters: {'n_estimators': 262, 'max_depth': 7, 'min_samples_split': 136, 'min_samples_leaf': 58, 'criterion': 'gini'}.
Trial 3753 finished with value: 0.6956521739130435 and parameters: {'n_estimators': 325, 'max_depth': 11, 'min_samples_split': 141, 'min_samples_leaf': 73, 'criterion': 'gini'}.
Trial 3754 finished with value: 0.7282608695652174 and parameters: {'n_estimators': 290, 'max_depth': 15, 'min_samples_split': 150, 'min_samples_leaf': 67, 'criterion': 'gini'}.
Trial 3755 finished with value: 0.717391304347826 and parameters: {'n_estimators': 239, 'max_depth': 13, 'min_samples_split': 145, 'min_samples_leaf': 65, 'criterion': 'gini'}.
Trial 3756 finished with value: 0.6847826086956522 and parameters: {'n_estimators': 272, 'max_depth': 9, 'min_samples_split': 131, 'min_samples_leaf': 60, 'criterion': 'gini'}.
Trial 3757 finished with value: 0.6630434782608695 and parameters: {'n_estimators': 295, 'max_depth': 6, 'min_samples_split': 191, 'min_samples_leaf': 58, 'criterion': 'gini'}.
Trial 3758 finished with value: 0.7065217391304348 and parameters: {'n_estimators': 253, 'max_depth': 10, 'min_samples_split': 80, 'min_samples_leaf': 71, 'criterion': 'gini'}.
Trial 3759 finished with value: 0.6847826086956522 and parameters: {'n_estimators': 141, 'max_depth': 12, 'min_samples_split': 121, 'min_samples_leaf': 62, 'criterion': 'gini'}.
Trial 3760 finished with value: 0.7282608695652174 and parameters: {'n_estimators': 315, 'max_depth': 8, 'min_samples_split': 133, 'min_samples_leaf': 73, 'criterion': 'gini'}.
Trial 3761 finished with value: 0.6739130434782609 and parameters: {'n_estimators': 209, 'max_depth': 16, 'min_samples_split': 52, 'min_samples_leaf': 60, 'criterion': 'gini'}.
Trial 3762 finished with value: 0.6630434782608695 and parameters: {'n_estimators': 382, 'max_depth': 5, 'min_samples_split': 142, 'min_samples_leaf': 76, 'criterion': 'gini'}.
Trial 3763 finished with value: 0.7065217391304348 and parameters: {'n_estimators': 282, 'max_depth': 10, 'min_samples_split': 138, 'min_samples_leaf': 63, 'criterion': 'gini'}.
Trial 3764 finished with value: 0.6630434782608695 and parameters: {'n_estimators': 225, 'max_depth': 13, 'min_samples_split': 148, 'min_samples_leaf': 58, 'criterion': 'gini'}.
Trial 3765 finished with value: 0.6956521739130435 and parameters: {'n_estimators': 333, 'max_depth': 11, 'min_samples_split': 92, 'min_samples_leaf': 61, 'criterion': 'gini'}.
Trial 3766 finished with value: 0.6956521739130435 and parameters: {'n_estimators': 260, 'max_depth': 8, 'min_samples_split': 127, 'min_samples_leaf': 78, 'criterion': 'gini'}.
Trial 3767 finished with value: 0.6956521739130435 and parameters: {'n_estimators': 295, 'max_depth': 14, 'min_samples_split': 110, 'min_samples_leaf': 69, 'criterion': 'gini'}.
Trial 3768 finished with value: 0.7065217391304348 and parameters: {'n_estimators': 277, 'max_depth': 10, 'min_samples_split': 116, 'min_samples_leaf': 65, 'criterion': 'gini'}.
Trial 3769 finished with value: 0.6956521739130435 and parameters: {'n_estimators': 987, 'max_depth': 7, 'min_samples_split': 140, 'min_samples_leaf': 59, 'criterion': 'gini'}.
Trial 3770 finished with value: 0.6956521739130435 and parameters: {'n_estimators': 271, 'max_depth': 13, 'min_samples_split': 124, 'min_samples_leaf': 58, 'criterion': 'gini'}.
Trial 3771 finished with value: 0.6739130434782609 and parameters: {'n_estimators': 249, 'max_depth': 11, 'min_samples_split': 143, 'min_samples_leaf': 63, 'criterion': 'gini'}.
Trial 3772 finished with value: 0.6847826086956522 and parameters: {'n_estimators': 310, 'max_depth': 16, 'min_samples_split': 154, 'min_samples_leaf': 74, 'criterion': 'gini'}.
Trial 3773 finished with value: 0.7065217391304348 and parameters: {'n_estimators': 232, 'max_depth': 9, 'min_samples_split': 137, 'min_samples_leaf': 60, 'criterion': 'gini'}.
Trial 3774 finished with value: 0.6739130434782609 and parameters: {'n_estimators': 294, 'max_depth': 6, 'min_samples_split': 130, 'min_samples_leaf': 71, 'criterion': 'gini'}.
Trial 3775 finished with value: 0.7065217391304348 and parameters: {'n_estimators': 257, 'max_depth': 12, 'min_samples_split': 171, 'min_samples_leaf': 67, 'criterion': 'gini'}.
Trial 3776 finished with value: 0.6956521739130435 and parameters: {'n_estimators': 317, 'max_depth': 9, 'min_samples_split': 145, 'min_samples_leaf': 61, 'criterion': 'gini'}.
Trial 3777 finished with value: 0.6739130434782609 and parameters: {'n_estimators': 348, 'max_depth': 14, 'min_samples_split': 137, 'min_samples_leaf': 58, 'criterion': 'gini'}.
Trial 3778 finished with value: 0.6956521739130435 and parameters: {'n_estimators': 281, 'max_depth': 7, 'min_samples_split': 122, 'min_samples_leaf': 58, 'criterion': 'gini'}.
Trial 3779 finished with value: 0.7065217391304348 and parameters: {'n_estimators': 304, 'max_depth': 11, 'min_samples_split': 135, 'min_samples_leaf': 64, 'criterion': 'gini'}.
Trial 3780 finished with value: 0.6739130434782609 and parameters: {'n_estimators': 243, 'max_depth': 18, 'min_samples_split': 143, 'min_samples_leaf': 61, 'criterion': 'gini'}.
Trial 3781 finished with value: 0.6956521739130435 and parameters: {'n_estimators': 191, 'max_depth': 9, 'min_samples_split': 113, 'min_samples_leaf': 72, 'criterion': 'gini'}.
Trial 3782 finished with value: 0.6956521739130435 and parameters: {'n_estimators': 266, 'max_depth': 71, 'min_samples_split': 127, 'min_samples_leaf': 69, 'criterion': 'gini'}.
Trial 3783 finished with value: 0.6630434782608695 and parameters: {'n_estimators': 285, 'max_depth': 12, 'min_samples_split': 140, 'min_samples_leaf': 10, 'criterion': 'gini'}.
Trial 3784 finished with value: 0.6304347826086957 and parameters: {'n_estimators': 215, 'max_depth': 5, 'min_samples_split': 57, 'min_samples_leaf': 58, 'criterion': 'gini'}.
Trial 3785 finished with value: 0.7065217391304348 and parameters: {'n_estimators': 366, 'max_depth': 8, 'min_samples_split': 151, 'min_samples_leaf': 63, 'criterion': 'gini'}.
Trial 3786 finished with value: 0.6630434782608695 and parameters: {'n_estimators': 270, 'max_depth': 14, 'min_samples_split': 132, 'min_samples_leaf': 66, 'criterion': 'gini'}.
Trial 3787 finished with value: 0.7065217391304348 and parameters: {'n_estimators': 334, 'max_depth': 10, 'min_samples_split': 148, 'min_samples_leaf': 60, 'criterion': 'gini'}.
Trial 3788 finished with value: 0.6521739130434783 and parameters: {'n_estimators': 249, 'max_depth': 16, 'min_samples_split': 133, 'min_samples_leaf': 74, 'criterion': 'gini'}.
Trial 3789 finished with value: 0.6956521739130435 and parameters: {'n_estimators': 294, 'max_depth': 12, 'min_samples_split': 119, 'min_samples_leaf': 58, 'criterion': 'gini'}.
Trial 3790 finished with value: 0.6847826086956522 and parameters: {'n_estimators': 229, 'max_depth': 7, 'min_samples_split': 137, 'min_samples_leaf': 61, 'criterion': 'gini'}.
Trial 3791 finished with value: 0.6739130434782609 and parameters: {'n_estimators': 273, 'max_depth': 20, 'min_samples_split': 145, 'min_samples_leaf': 58, 'criterion': 'gini'}.
Trial 3792 finished with value: 0.6847826086956522 and parameters: {'n_estimators': 308, 'max_depth': 10, 'min_samples_split': 159, 'min_samples_leaf': 77, 'criterion': 'gini'}.
Trial 3793 finished with value: 0.7065217391304348 and parameters: {'n_estimators': 321, 'max_depth': 13, 'min_samples_split': 107, 'min_samples_leaf': 63, 'criterion': 'gini'}.
Trial 3794 finished with value: 0.7065217391304348 and parameters: {'n_estimators': 288, 'max_depth': 8, 'min_samples_split': 144, 'min_samples_leaf': 60, 'criterion': 'gini'}.
Trial 3795 finished with value: 0.6847826086956522 and parameters: {'n_estimators': 261, 'max_depth': 15, 'min_samples_split': 116, 'min_samples_leaf': 80, 'criterion': 'gini'}.
Trial 3796 finished with value: 0.7065217391304348 and parameters: {'n_estimators': 237, 'max_depth': 11, 'min_samples_split': 127, 'min_samples_leaf': 71, 'criterion': 'gini'}.
Trial 3797 finished with value: 0.717391304347826 and parameters: {'n_estimators': 299, 'max_depth': 9, 'min_samples_split': 123, 'min_samples_leaf': 65, 'criterion': 'gini'}.
Trial 3798 finished with value: 0.6739130434782609 and parameters: {'n_estimators': 254, 'max_depth': 6, 'min_samples_split': 151, 'min_samples_leaf': 58, 'criterion': 'gini'}.
Trial 3799 finished with value: 0.6956521739130435 and parameters: {'n_estimators': 283, 'max_depth': 12, 'min_samples_split': 63, 'min_samples_leaf': 68, 'criterion': 'gini'}.
Trial 3800 finished with value: 0.6956521739130435 and parameters: {'n_estimators': 121, 'max_depth': 10, 'min_samples_split': 51, 'min_samples_leaf': 62, 'criterion': 'gini'}.
Trial 3801 finished with value: 0.6739130434782609 and parameters: {'n_estimators': 268, 'max_depth': 27, 'min_samples_split': 140, 'min_samples_leaf': 75, 'criterion': 'gini'}.
Trial 3802 finished with value: 0.7065217391304348 and parameters: {'n_estimators': 324, 'max_depth': 14, 'min_samples_split': 178, 'min_samples_leaf': 60, 'criterion': 'gini'}.
Trial 3803 finished with value: 0.717391304347826 and parameters: {'n_estimators': 240, 'max_depth': 8, 'min_samples_split': 102, 'min_samples_leaf': 58, 'criterion': 'gini'}.
Trial 3804 finished with value: 0.6956521739130435 and parameters: {'n_estimators': 305, 'max_depth': 11, 'min_samples_split': 136, 'min_samples_leaf': 70, 'criterion': 'gini'}.
Trial 3805 finished with value: 0.6739130434782609 and parameters: {'n_estimators': 281, 'max_depth': 5, 'min_samples_split': 96, 'min_samples_leaf': 73, 'criterion': 'gini'}.
Trial 3806 finished with value: 0.6847826086956522 and parameters: {'n_estimators': 257, 'max_depth': 17, 'min_samples_split': 72, 'min_samples_leaf': 62, 'criterion': 'gini'}.
Trial 3807 finished with value: 0.6847826086956522 and parameters: {'n_estimators': 293, 'max_depth': 13, 'min_samples_split': 128, 'min_samples_leaf': 58, 'criterion': 'gini'}.
Trial 3808 finished with value: 0.7391304347826086 and parameters: {'n_estimators': 272, 'max_depth': 9, 'min_samples_split': 147, 'min_samples_leaf': 60, 'criterion': 'gini'}.
Trial 3809 finished with value: 0.6956521739130435 and parameters: {'n_estimators': 268, 'max_depth': 7, 'min_samples_split': 154, 'min_samples_leaf': 62, 'criterion': 'gini'}.
Trial 3810 finished with value: 0.7065217391304348 and parameters: {'n_estimators': 253, 'max_depth': 8, 'min_samples_split': 150, 'min_samples_leaf': 64, 'criterion': 'gini'}.
Trial 3811 finished with value: 0.6847826086956522 and parameters: {'n_estimators': 275, 'max_depth': 6, 'min_samples_split': 147, 'min_samples_leaf': 61, 'criterion': 'gini'}.
Trial 3812 finished with value: 0.6956521739130435 and parameters: {'n_estimators': 222, 'max_depth': 7, 'min_samples_split': 154, 'min_samples_leaf': 60, 'criterion': 'gini'}.
Trial 3813 finished with value: 0.6630434782608695 and parameters: {'n_estimators': 249, 'max_depth': 5, 'min_samples_split': 158, 'min_samples_leaf': 64, 'criterion': 'gini'}.
Trial 3814 finished with value: 0.717391304347826 and parameters: {'n_estimators': 277, 'max_depth': 9, 'min_samples_split': 158, 'min_samples_leaf': 62, 'criterion': 'gini'}.
Trial 3815 finished with value: 0.6630434782608695 and parameters: {'n_estimators': 243, 'max_depth': 5, 'min_samples_split': 156, 'min_samples_leaf': 60, 'criterion': 'gini'}.
Trial 3816 finished with value: 0.6847826086956522 and parameters: {'n_estimators': 264, 'max_depth': 7, 'min_samples_split': 150, 'min_samples_leaf': 63, 'criterion': 'gini'}.
Trial 3817 finished with value: 0.7065217391304348 and parameters: {'n_estimators': 290, 'max_depth': 9, 'min_samples_split': 154, 'min_samples_leaf': 60, 'criterion': 'gini'}.
Trial 3818 finished with value: 0.7065217391304348 and parameters: {'n_estimators': 304, 'max_depth': 7, 'min_samples_split': 154, 'min_samples_leaf': 61, 'criterion': 'gini'}.
Trial 3819 finished with value: 0.6956521739130435 and parameters: {'n_estimators': 220, 'max_depth': 9, 'min_samples_split': 150, 'min_samples_leaf': 59, 'criterion': 'gini'}.
Trial 3820 finished with value: 0.7065217391304348 and parameters: {'n_estimators': 282, 'max_depth': 10, 'min_samples_split': 148, 'min_samples_leaf': 66, 'criterion': 'gini'}.
Trial 3821 finished with value: 0.6956521739130435 and parameters: {'n_estimators': 259, 'max_depth': 7, 'min_samples_split': 163, 'min_samples_leaf': 60, 'criterion': 'gini'}.
Trial 3822 finished with value: 0.717391304347826 and parameters: {'n_estimators': 268, 'max_depth': 11, 'min_samples_split': 151, 'min_samples_leaf': 63, 'criterion': 'gini'}.
Trial 3823 finished with value: 0.7065217391304348 and parameters: {'n_estimators': 234, 'max_depth': 9, 'min_samples_split': 148, 'min_samples_leaf': 62, 'criterion': 'gini'}.
Trial 3824 finished with value: 0.6521739130434783 and parameters: {'n_estimators': 300, 'max_depth': 5, 'min_samples_split': 151, 'min_samples_leaf': 58, 'criterion': 'gini'}.
Trial 3825 finished with value: 0.6956521739130435 and parameters: {'n_estimators': 284, 'max_depth': 11, 'min_samples_split': 144, 'min_samples_leaf': 58, 'criterion': 'gini'}.
Trial 3826 finished with value: 0.6847826086956522 and parameters: {'n_estimators': 244, 'max_depth': 7, 'min_samples_split': 140, 'min_samples_leaf': 64, 'criterion': 'gini'}.
Trial 3827 finished with value: 0.7065217391304348 and parameters: {'n_estimators': 316, 'max_depth': 9, 'min_samples_split': 148, 'min_samples_leaf': 60, 'criterion': 'gini'}.
Trial 3828 finished with value: 0.6956521739130435 and parameters: {'n_estimators': 263, 'max_depth': 12, 'min_samples_split': 147, 'min_samples_leaf': 62, 'criterion': 'gini'}.
Trial 3829 finished with value: 0.7065217391304348 and parameters: {'n_estimators': 279, 'max_depth': 10, 'min_samples_split': 143, 'min_samples_leaf': 65, 'criterion': 'gini'}.
Trial 3830 finished with value: 0.6739130434782609 and parameters: {'n_estimators': 202, 'max_depth': 8, 'min_samples_split': 149, 'min_samples_leaf': 58, 'criterion': 'gini'}.
Trial 3831 finished with value: 0.7065217391304348 and parameters: {'n_estimators': 296, 'max_depth': 14, 'min_samples_split': 155, 'min_samples_leaf': 61, 'criterion': 'gini'}.
Trial 3832 finished with value: 0.6956521739130435 and parameters: {'n_estimators': 239, 'max_depth': 12, 'min_samples_split': 145, 'min_samples_leaf': 59, 'criterion': 'gini'}.
Trial 3833 finished with value: 0.7065217391304348 and parameters: {'n_estimators': 259, 'max_depth': 10, 'min_samples_split': 146, 'min_samples_leaf': 58, 'criterion': 'gini'}.
Trial 3834 finished with value: 0.6521739130434783 and parameters: {'n_estimators': 340, 'max_depth': 5, 'min_samples_split': 145, 'min_samples_leaf': 60, 'criterion': 'gini'}.
Trial 3835 finished with value: 0.717391304347826 and parameters: {'n_estimators': 314, 'max_depth': 8, 'min_samples_split': 152, 'min_samples_leaf': 63, 'criterion': 'gini'}.
Trial 3836 finished with value: 0.7065217391304348 and parameters: {'n_estimators': 281, 'max_depth': 15, 'min_samples_split': 146, 'min_samples_leaf': 66, 'criterion': 'gini'}.
Trial 3837 finished with value: 0.6956521739130435 and parameters: {'n_estimators': 297, 'max_depth': 11, 'min_samples_split': 142, 'min_samples_leaf': 58, 'criterion': 'gini'}.
Trial 3838 finished with value: 0.6956521739130435 and parameters: {'n_estimators': 253, 'max_depth': 7, 'min_samples_split': 152, 'min_samples_leaf': 61, 'criterion': 'gini'}.
Trial 3839 finished with value: 0.7065217391304348 and parameters: {'n_estimators': 273, 'max_depth': 13, 'min_samples_split': 142, 'min_samples_leaf': 60, 'criterion': 'gini'}.
Trial 3840 finished with value: 0.6739130434782609 and parameters: {'n_estimators': 222, 'max_depth': 9, 'min_samples_split': 156, 'min_samples_leaf': 63, 'criterion': 'gini'}.
Trial 3841 finished with value: 0.6847826086956522 and parameters: {'n_estimators': 329, 'max_depth': 11, 'min_samples_split': 146, 'min_samples_leaf': 58, 'criterion': 'gini'}.
Trial 3842 finished with value: 0.7065217391304348 and parameters: {'n_estimators': 308, 'max_depth': 17, 'min_samples_split': 149, 'min_samples_leaf': 65, 'criterion': 'gini'}.
Trial 3843 finished with value: 0.6847826086956522 and parameters: {'n_estimators': 268, 'max_depth': 8, 'min_samples_split': 142, 'min_samples_leaf': 58, 'criterion': 'gini'}.
Trial 3844 finished with value: 0.7065217391304348 and parameters: {'n_estimators': 285, 'max_depth': 13, 'min_samples_split': 152, 'min_samples_leaf': 61, 'criterion': 'gini'}.
Trial 3845 finished with value: 0.6630434782608695 and parameters: {'n_estimators': 238, 'max_depth': 6, 'min_samples_split': 159, 'min_samples_leaf': 68, 'criterion': 'gini'}.
Trial 3846 finished with value: 0.7282608695652174 and parameters: {'n_estimators': 260, 'max_depth': 10, 'min_samples_split': 146, 'min_samples_leaf': 60, 'criterion': 'gini'}.
Trial 3847 finished with value: 0.6847826086956522 and parameters: {'n_estimators': 295, 'max_depth': 15, 'min_samples_split': 148, 'min_samples_leaf': 58, 'criterion': 'gini'}.
Trial 3848 finished with value: 0.6739130434782609 and parameters: {'n_estimators': 247, 'max_depth': 52, 'min_samples_split': 142, 'min_samples_leaf': 62, 'criterion': 'gini'}.
Trial 3849 finished with value: 0.7065217391304348 and parameters: {'n_estimators': 278, 'max_depth': 12, 'min_samples_split': 139, 'min_samples_leaf': 58, 'criterion': 'gini'}.
Trial 3850 finished with value: 0.717391304347826 and parameters: {'n_estimators': 321, 'max_depth': 9, 'min_samples_split': 141, 'min_samples_leaf': 64, 'criterion': 'gini'}.
Trial 3851 finished with value: 0.6739130434782609 and parameters: {'n_estimators': 209, 'max_depth': 7, 'min_samples_split': 138, 'min_samples_leaf': 61, 'criterion': 'gini'}.
Trial 3852 finished with value: 0.7065217391304348 and parameters: {'n_estimators': 352, 'max_depth': 11, 'min_samples_split': 145, 'min_samples_leaf': 67, 'criterion': 'gini'}.
Trial 3853 finished with value: 0.6739130434782609 and parameters: {'n_estimators': 299, 'max_depth': 19, 'min_samples_split': 142, 'min_samples_leaf': 60, 'criterion': 'gini'}.
Trial 3854 finished with value: 0.7065217391304348 and parameters: {'n_estimators': 268, 'max_depth': 13, 'min_samples_split': 152, 'min_samples_leaf': 58, 'criterion': 'gini'}.
Trial 3855 finished with value: 0.717391304347826 and parameters: {'n_estimators': 254, 'max_depth': 9, 'min_samples_split': 145, 'min_samples_leaf': 63, 'criterion': 'gini'}.
Trial 3856 finished with value: 0.6739130434782609 and parameters: {'n_estimators': 289, 'max_depth': 15, 'min_samples_split': 135, 'min_samples_leaf': 58, 'criterion': 'gini'}.
Trial 3857 finished with value: 0.6521739130434783 and parameters: {'n_estimators': 232, 'max_depth': 5, 'min_samples_split': 139, 'min_samples_leaf': 60, 'criterion': 'gini'}.
Trial 3858 finished with value: 0.7065217391304348 and parameters: {'n_estimators': 313, 'max_depth': 10, 'min_samples_split': 146, 'min_samples_leaf': 62, 'criterion': 'gini'}.
Trial 3859 finished with value: 0.7065217391304348 and parameters: {'n_estimators': 275, 'max_depth': 7, 'min_samples_split': 133, 'min_samples_leaf': 72, 'criterion': 'gini'}.
Trial 3860 finished with value: 0.6956521739130435 and parameters: {'n_estimators': 250, 'max_depth': 12, 'min_samples_split': 150, 'min_samples_leaf': 58, 'criterion': 'gini'}.
