Trial 5832 finished with value: 0.6521739130434783 and parameters: {'n_estimators': 136, 'max_depth': 5, 'min_samples_split': 11, 'min_samples_leaf': 65, 'criterion': 'entropy'}.
Trial 5833 finished with value: 0.6956521739130435 and parameters: {'n_estimators': 773, 'max_depth': 13, 'min_samples_split': 44, 'min_samples_leaf': 57, 'criterion': 'gini'}.
Trial 5834 finished with value: 0.7282608695652174 and parameters: {'n_estimators': 305, 'max_depth': 8, 'min_samples_split': 38, 'min_samples_leaf': 73, 'criterion': 'entropy'}.
Trial 5835 finished with value: 0.6847826086956522 and parameters: {'n_estimators': 757, 'max_depth': 15, 'min_samples_split': 140, 'min_samples_leaf': 62, 'criterion': 'gini'}.
Trial 5836 finished with value: 0.6847826086956522 and parameters: {'n_estimators': 350, 'max_depth': 11, 'min_samples_split': 33, 'min_samples_leaf': 79, 'criterion': 'entropy'}.
Trial 5837 finished with value: 0.6630434782608695 and parameters: {'n_estimators': 265, 'max_depth': 7, 'min_samples_split': 131, 'min_samples_leaf': 53, 'criterion': 'gini'}.
Trial 5838 finished with value: 0.5869565217391305 and parameters: {'n_estimators': 718, 'max_depth': 54, 'min_samples_split': 15, 'min_samples_leaf': 11, 'criterion': 'entropy'}.
Trial 5839 finished with value: 0.717391304347826 and parameters: {'n_estimators': 632, 'max_depth': 10, 'min_samples_split': 121, 'min_samples_leaf': 59, 'criterion': 'gini'}.
Trial 5840 finished with value: 0.6413043478260869 and parameters: {'n_estimators': 232, 'max_depth': 12, 'min_samples_split': 29, 'min_samples_leaf': 31, 'criterion': 'entropy'}.
Trial 5841 finished with value: 0.6956521739130435 and parameters: {'n_estimators': 293, 'max_depth': 14, 'min_samples_split': 134, 'min_samples_leaf': 55, 'criterion': 'gini'}.
Trial 5842 finished with value: 0.6847826086956522 and parameters: {'n_estimators': 278, 'max_depth': 19, 'min_samples_split': 148, 'min_samples_leaf': 61, 'criterion': 'entropy'}.
Trial 5843 finished with value: 0.6739130434782609 and parameters: {'n_estimators': 318, 'max_depth': 40, 'min_samples_split': 36, 'min_samples_leaf': 64, 'criterion': 'gini'}.
Trial 5844 finished with value: 0.6630434782608695 and parameters: {'n_estimators': 255, 'max_depth': 9, 'min_samples_split': 138, 'min_samples_leaf': 5, 'criterion': 'entropy'}.
Trial 5845 finished with value: 0.6847826086956522 and parameters: {'n_estimators': 286, 'max_depth': 7, 'min_samples_split': 6, 'min_samples_leaf': 57, 'criterion': 'entropy'}.
Trial 5846 finished with value: 0.6956521739130435 and parameters: {'n_estimators': 740, 'max_depth': 17, 'min_samples_split': 20, 'min_samples_leaf': 68, 'criterion': 'gini'}.
Trial 5847 finished with value: 0.6847826086956522 and parameters: {'n_estimators': 206, 'max_depth': 12, 'min_samples_split': 144, 'min_samples_leaf': 59, 'criterion': 'entropy'}.
Trial 5848 finished with value: 0.6630434782608695 and parameters: {'n_estimators': 239, 'max_depth': 10, 'min_samples_split': 42, 'min_samples_leaf': 75, 'criterion': 'gini'}.
Trial 5849 finished with value: 0.6739130434782609 and parameters: {'n_estimators': 308, 'max_depth': 6, 'min_samples_split': 34, 'min_samples_leaf': 63, 'criterion': 'entropy'}.
Trial 5850 finished with value: 0.6739130434782609 and parameters: {'n_estimators': 400, 'max_depth': 14, 'min_samples_split': 109, 'min_samples_leaf': 56, 'criterion': 'gini'}.
Trial 5851 finished with value: 0.6739130434782609 and parameters: {'n_estimators': 786, 'max_depth': 9, 'min_samples_split': 26, 'min_samples_leaf': 52, 'criterion': 'entropy'}.
Trial 5852 finished with value: 0.6956521739130435 and parameters: {'n_estimators': 269, 'max_depth': 62, 'min_samples_split': 30, 'min_samples_leaf': 72, 'criterion': 'gini'}.
Trial 5853 finished with value: 0.717391304347826 and parameters: {'n_estimators': 293, 'max_depth': 12, 'min_samples_split': 39, 'min_samples_leaf': 60, 'criterion': 'entropy'}.
Trial 5854 finished with value: 0.6847826086956522 and parameters: {'n_estimators': 251, 'max_depth': 16, 'min_samples_split': 24, 'min_samples_leaf': 54, 'criterion': 'gini'}.
Trial 5855 finished with value: 0.717391304347826 and parameters: {'n_estimators': 329, 'max_depth': 8, 'min_samples_split': 46, 'min_samples_leaf': 58, 'criterion': 'entropy'}.
Trial 5856 finished with value: 0.6413043478260869 and parameters: {'n_estimators': 693, 'max_depth': 5, 'min_samples_split': 50, 'min_samples_leaf': 61, 'criterion': 'gini'}.
Trial 5857 finished with value: 0.6956521739130435 and parameters: {'n_estimators': 770, 'max_depth': 11, 'min_samples_split': 153, 'min_samples_leaf': 65, 'criterion': 'entropy'}.
Trial 5858 finished with value: 0.717391304347826 and parameters: {'n_estimators': 272, 'max_depth': 10, 'min_samples_split': 31, 'min_samples_leaf': 57, 'criterion': 'gini'}.
Trial 5859 finished with value: 0.6956521739130435 and parameters: {'n_estimators': 751, 'max_depth': 13, 'min_samples_split': 141, 'min_samples_leaf': 70, 'criterion': 'entropy'}.
Trial 5860 finished with value: 0.6956521739130435 and parameters: {'n_estimators': 226, 'max_depth': 7, 'min_samples_split': 37, 'min_samples_leaf': 62, 'criterion': 'gini'}.
Trial 5861 finished with value: 0.7065217391304348 and parameters: {'n_estimators': 303, 'max_depth': 9, 'min_samples_split': 17, 'min_samples_leaf': 59, 'criterion': 'entropy'}.
Trial 5862 finished with value: 0.7065217391304348 and parameters: {'n_estimators': 712, 'max_depth': 11, 'min_samples_split': 128, 'min_samples_leaf': 55, 'criterion': 'gini'}.
Trial 5863 finished with value: 0.6630434782608695 and parameters: {'n_estimators': 283, 'max_depth': 14, 'min_samples_split': 114, 'min_samples_leaf': 67, 'criterion': 'entropy'}.
Trial 5864 finished with value: 0.7065217391304348 and parameters: {'n_estimators': 257, 'max_depth': 8, 'min_samples_split': 119, 'min_samples_leaf': 77, 'criterion': 'gini'}.
Trial 5865 finished with value: 0.6956521739130435 and parameters: {'n_estimators': 484, 'max_depth': 12, 'min_samples_split': 24, 'min_samples_leaf': 58, 'criterion': 'entropy'}.
Trial 5866 finished with value: 0.717391304347826 and parameters: {'n_estimators': 243, 'max_depth': 15, 'min_samples_split': 159, 'min_samples_leaf': 63, 'criterion': 'gini'}.
Trial 5867 finished with value: 0.6847826086956522 and parameters: {'n_estimators': 309, 'max_depth': 21, 'min_samples_split': 134, 'min_samples_leaf': 56, 'criterion': 'entropy'}.
Trial 5868 finished with value: 0.7065217391304348 and parameters: {'n_estimators': 100, 'max_depth': 10, 'min_samples_split': 31, 'min_samples_leaf': 60, 'criterion': 'gini'}.
Trial 5869 finished with value: 0.6956521739130435 and parameters: {'n_estimators': 736, 'max_depth': 7, 'min_samples_split': 146, 'min_samples_leaf': 54, 'criterion': 'entropy'}.
Trial 5870 finished with value: 0.6956521739130435 and parameters: {'n_estimators': 344, 'max_depth': 12, 'min_samples_split': 35, 'min_samples_leaf': 75, 'criterion': 'gini'}.
Trial 5871 finished with value: 0.717391304347826 and parameters: {'n_estimators': 269, 'max_depth': 9, 'min_samples_split': 28, 'min_samples_leaf': 73, 'criterion': 'entropy'}.
Trial 5872 finished with value: 0.6413043478260869 and parameters: {'n_estimators': 287, 'max_depth': 5, 'min_samples_split': 20, 'min_samples_leaf': 60, 'criterion': 'entropy'}.
Trial 5873 finished with value: 0.6956521739130435 and parameters: {'n_estimators': 332, 'max_depth': 13, 'min_samples_split': 138, 'min_samples_leaf': 69, 'criterion': 'gini'}.
Trial 5874 finished with value: 0.6847826086956522 and parameters: {'n_estimators': 259, 'max_depth': 17, 'min_samples_split': 92, 'min_samples_leaf': 57, 'criterion': 'entropy'}.
Trial 5875 finished with value: 0.717391304347826 and parameters: {'n_estimators': 899, 'max_depth': 10, 'min_samples_split': 125, 'min_samples_leaf': 62, 'criterion': 'gini'}.
Trial 5876 finished with value: 0.6739130434782609 and parameters: {'n_estimators': 218, 'max_depth': 7, 'min_samples_split': 41, 'min_samples_leaf': 65, 'criterion': 'entropy'}.
Trial 5877 finished with value: 0.7065217391304348 and parameters: {'n_estimators': 764, 'max_depth': 11, 'min_samples_split': 34, 'min_samples_leaf': 71, 'criterion': 'gini'}.
Trial 5878 finished with value: 0.6847826086956522 and parameters: {'n_estimators': 613, 'max_depth': 94, 'min_samples_split': 150, 'min_samples_leaf': 52, 'criterion': 'entropy'}.
Trial 5879 finished with value: 0.6956521739130435 and parameters: {'n_estimators': 791, 'max_depth': 15, 'min_samples_split': 142, 'min_samples_leaf': 58, 'criterion': 'gini'}.
Trial 5880 finished with value: 0.7391304347826086 and parameters: {'n_estimators': 282, 'max_depth': 9, 'min_samples_split': 27, 'min_samples_leaf': 55, 'criterion': 'entropy'}.
Trial 5881 finished with value: 0.7065217391304348 and parameters: {'n_estimators': 300, 'max_depth': 13, 'min_samples_split': 44, 'min_samples_leaf': 60, 'criterion': 'gini'}.
Trial 5882 finished with value: 0.6956521739130435 and parameters: {'n_estimators': 239, 'max_depth': 8, 'min_samples_split': 38, 'min_samples_leaf': 63, 'criterion': 'entropy'}.
Trial 5883 finished with value: 0.717391304347826 and parameters: {'n_estimators': 271, 'max_depth': 11, 'min_samples_split': 32, 'min_samples_leaf': 57, 'criterion': 'gini'}.
Trial 5884 finished with value: 0.6630434782608695 and parameters: {'n_estimators': 308, 'max_depth': 6, 'min_samples_split': 21, 'min_samples_leaf': 59, 'criterion': 'entropy'}.
Trial 5885 finished with value: 0.7065217391304348 and parameters: {'n_estimators': 249, 'max_depth': 14, 'min_samples_split': 27, 'min_samples_leaf': 61, 'criterion': 'gini'}.
Trial 5886 finished with value: 0.6956521739130435 and parameters: {'n_estimators': 946, 'max_depth': 10, 'min_samples_split': 144, 'min_samples_leaf': 54, 'criterion': 'entropy'}.
Trial 5887 finished with value: 0.6847826086956522 and parameters: {'n_estimators': 164, 'max_depth': 8, 'min_samples_split': 133, 'min_samples_leaf': 66, 'criterion': 'gini'}.
Trial 5888 finished with value: 0.7065217391304348 and parameters: {'n_estimators': 289, 'max_depth': 12, 'min_samples_split': 24, 'min_samples_leaf': 57, 'criterion': 'entropy'}.
Trial 5889 finished with value: 0.6847826086956522 and parameters: {'n_estimators': 736, 'max_depth': 18, 'min_samples_split': 137, 'min_samples_leaf': 35, 'criterion': 'gini'}.
Trial 5890 finished with value: 0.6847826086956522 and parameters: {'n_estimators': 648, 'max_depth': 29, 'min_samples_split': 123, 'min_samples_leaf': 21, 'criterion': 'entropy'}.
Trial 5891 finished with value: 0.7282608695652174 and parameters: {'n_estimators': 323, 'max_depth': 10, 'min_samples_split': 70, 'min_samples_leaf': 73, 'criterion': 'gini'}.
Trial 5892 finished with value: 0.6521739130434783 and parameters: {'n_estimators': 366, 'max_depth': 5, 'min_samples_split': 34, 'min_samples_leaf': 59, 'criterion': 'entropy'}.
Trial 5893 finished with value: 0.6956521739130435 and parameters: {'n_estimators': 755, 'max_depth': 16, 'min_samples_split': 39, 'min_samples_leaf': 64, 'criterion': 'gini'}.
Trial 5894 finished with value: 0.6956521739130435 and parameters: {'n_estimators': 264, 'max_depth': 8, 'min_samples_split': 13, 'min_samples_leaf': 69, 'criterion': 'entropy'}.
Trial 5895 finished with value: 0.6739130434782609 and parameters: {'n_estimators': 190, 'max_depth': 13, 'min_samples_split': 30, 'min_samples_leaf': 52, 'criterion': 'gini'}.
Trial 5896 finished with value: 0.7065217391304348 and parameters: {'n_estimators': 225, 'max_depth': 11, 'min_samples_split': 129, 'min_samples_leaf': 56, 'criterion': 'entropy'}.
Trial 5897 finished with value: 0.7065217391304348 and parameters: {'n_estimators': 123, 'max_depth': 14, 'min_samples_split': 148, 'min_samples_leaf': 62, 'criterion': 'gini'}.
Trial 5898 finished with value: 0.7065217391304348 and parameters: {'n_estimators': 277, 'max_depth': 7, 'min_samples_split': 98, 'min_samples_leaf': 75, 'criterion': 'entropy'}.
Trial 5899 finished with value: 0.7065217391304348 and parameters: {'n_estimators': 721, 'max_depth': 9, 'min_samples_split': 155, 'min_samples_leaf': 60, 'criterion': 'gini'}.
Trial 5900 finished with value: 0.6847826086956522 and parameters: {'n_estimators': 682, 'max_depth': 12, 'min_samples_split': 17, 'min_samples_leaf': 71, 'criterion': 'entropy'}.
Trial 5901 finished with value: 0.6956521739130435 and parameters: {'n_estimators': 784, 'max_depth': 9, 'min_samples_split': 36, 'min_samples_leaf': 58, 'criterion': 'entropy'}.
Trial 5902 finished with value: 0.7282608695652174 and parameters: {'n_estimators': 295, 'max_depth': 11, 'min_samples_split': 29, 'min_samples_leaf': 54, 'criterion': 'gini'}.
Trial 5903 finished with value: 0.6195652173913043 and parameters: {'n_estimators': 252, 'max_depth': 7, 'min_samples_split': 141, 'min_samples_leaf': 15, 'criterion': 'entropy'}.
Trial 5904 finished with value: 0.6630434782608695 and parameters: {'n_estimators': 315, 'max_depth': 23, 'min_samples_split': 23, 'min_samples_leaf': 56, 'criterion': 'gini'}.
Trial 5905 finished with value: 0.6847826086956522 and parameters: {'n_estimators': 271, 'max_depth': 15, 'min_samples_split': 117, 'min_samples_leaf': 61, 'criterion': 'entropy'}.
Trial 5906 finished with value: 0.6956521739130435 and parameters: {'n_estimators': 293, 'max_depth': 12, 'min_samples_split': 42, 'min_samples_leaf': 59, 'criterion': 'gini'}.
Trial 5907 finished with value: 0.6630434782608695 and parameters: {'n_estimators': 240, 'max_depth': 10, 'min_samples_split': 33, 'min_samples_leaf': 78, 'criterion': 'entropy'}.
Trial 5908 finished with value: 0.6630434782608695 and parameters: {'n_estimators': 773, 'max_depth': 5, 'min_samples_split': 27, 'min_samples_leaf': 66, 'criterion': 'gini'}.
Trial 5909 finished with value: 0.6956521739130435 and parameters: {'n_estimators': 258, 'max_depth': 8, 'min_samples_split': 38, 'min_samples_leaf': 63, 'criterion': 'entropy'}.
Trial 5910 finished with value: 0.6956521739130435 and parameters: {'n_estimators': 333, 'max_depth': 14, 'min_samples_split': 46, 'min_samples_leaf': 68, 'criterion': 'gini'}.
Trial 5911 finished with value: 0.7065217391304348 and parameters: {'n_estimators': 204, 'max_depth': 10, 'min_samples_split': 31, 'min_samples_leaf': 56, 'criterion': 'entropy'}.
Trial 5912 finished with value: 0.7065217391304348 and parameters: {'n_estimators': 751, 'max_depth': 12, 'min_samples_split': 106, 'min_samples_leaf': 58, 'criterion': 'gini'}.
Trial 5913 finished with value: 0.6847826086956522 and parameters: {'n_estimators': 281, 'max_depth': 16, 'min_samples_split': 138, 'min_samples_leaf': 61, 'criterion': 'entropy'}.
Trial 5914 finished with value: 0.7065217391304348 and parameters: {'n_estimators': 308, 'max_depth': 7, 'min_samples_split': 20, 'min_samples_leaf': 72, 'criterion': 'gini'}.
Trial 5915 finished with value: 0.7282608695652174 and parameters: {'n_estimators': 264, 'max_depth': 9, 'min_samples_split': 112, 'min_samples_leaf': 52, 'criterion': 'entropy'}.
Trial 5916 finished with value: 0.6956521739130435 and parameters: {'n_estimators': 228, 'max_depth': 13, 'min_samples_split': 177, 'min_samples_leaf': 55, 'criterion': 'gini'}.
Trial 5917 finished with value: 0.6956521739130435 and parameters: {'n_estimators': 286, 'max_depth': 11, 'min_samples_split': 145, 'min_samples_leaf': 80, 'criterion': 'entropy'}.
Trial 5918 finished with value: 0.6956521739130435 and parameters: {'n_estimators': 730, 'max_depth': 7, 'min_samples_split': 131, 'min_samples_leaf': 64, 'criterion': 'gini'}.
Trial 5919 finished with value: 0.7065217391304348 and parameters: {'n_estimators': 346, 'max_depth': 9, 'min_samples_split': 24, 'min_samples_leaf': 58, 'criterion': 'entropy'}.
Trial 5920 finished with value: 0.6956521739130435 and parameters: {'n_estimators': 305, 'max_depth': 19, 'min_samples_split': 36, 'min_samples_leaf': 61, 'criterion': 'gini'}.
Trial 5921 finished with value: 0.6956521739130435 and parameters: {'n_estimators': 245, 'max_depth': 14, 'min_samples_split': 51, 'min_samples_leaf': 59, 'criterion': 'entropy'}.
Trial 5922 finished with value: 0.6956521739130435 and parameters: {'n_estimators': 276, 'max_depth': 11, 'min_samples_split': 30, 'min_samples_leaf': 74, 'criterion': 'gini'}.
Trial 5923 finished with value: 0.6739130434782609 and parameters: {'n_estimators': 761, 'max_depth': 6, 'min_samples_split': 151, 'min_samples_leaf': 54, 'criterion': 'entropy'}.
Trial 5924 finished with value: 0.6956521739130435 and parameters: {'n_estimators': 710, 'max_depth': 17, 'min_samples_split': 41, 'min_samples_leaf': 57, 'criterion': 'gini'}.
Trial 5925 finished with value: 0.6739130434782609 and parameters: {'n_estimators': 264, 'max_depth': 9, 'min_samples_split': 135, 'min_samples_leaf': 70, 'criterion': 'entropy'}.
Trial 5926 finished with value: 0.6956521739130435 and parameters: {'n_estimators': 787, 'max_depth': 13, 'min_samples_split': 34, 'min_samples_leaf': 76, 'criterion': 'gini'}.
Trial 5927 finished with value: 0.717391304347826 and parameters: {'n_estimators': 297, 'max_depth': 11, 'min_samples_split': 142, 'min_samples_leaf': 62, 'criterion': 'entropy'}.
Trial 5928 finished with value: 0.7065217391304348 and parameters: {'n_estimators': 321, 'max_depth': 8, 'min_samples_split': 122, 'min_samples_leaf': 56, 'criterion': 'entropy'}.
Trial 5929 finished with value: 0.6413043478260869 and parameters: {'n_estimators': 250, 'max_depth': 5, 'min_samples_split': 26, 'min_samples_leaf': 60, 'criterion': 'gini'}.
Trial 5930 finished with value: 0.717391304347826 and parameters: {'n_estimators': 280, 'max_depth': 10, 'min_samples_split': 32, 'min_samples_leaf': 66, 'criterion': 'entropy'}.
Trial 5931 finished with value: 0.6847826086956522 and parameters: {'n_estimators': 230, 'max_depth': 15, 'min_samples_split': 40, 'min_samples_leaf': 53, 'criterion': 'gini'}.
Trial 5932 finished with value: 0.7065217391304348 and parameters: {'n_estimators': 742, 'max_depth': 12, 'min_samples_split': 16, 'min_samples_leaf': 64, 'criterion': 'entropy'}.
Trial 5933 finished with value: 0.6956521739130435 and parameters: {'n_estimators': 770, 'max_depth': 7, 'min_samples_split': 21, 'min_samples_leaf': 58, 'criterion': 'gini'}.
Trial 5934 finished with value: 0.6956521739130435 and parameters: {'n_estimators': 263, 'max_depth': 13, 'min_samples_split': 126, 'min_samples_leaf': 60, 'criterion': 'entropy'}.
Trial 5935 finished with value: 0.6956521739130435 and parameters: {'n_estimators': 588, 'max_depth': 9, 'min_samples_split': 28, 'min_samples_leaf': 62, 'criterion': 'gini'}.
Trial 5936 finished with value: 0.6956521739130435 and parameters: {'n_estimators': 887, 'max_depth': 11, 'min_samples_split': 146, 'min_samples_leaf': 73, 'criterion': 'entropy'}.
Trial 5937 finished with value: 0.6739130434782609 and parameters: {'n_estimators': 297, 'max_depth': 16, 'min_samples_split': 167, 'min_samples_leaf': 56, 'criterion': 'gini'}.
Trial 5938 finished with value: 0.6956521739130435 and parameters: {'n_estimators': 215, 'max_depth': 7, 'min_samples_split': 140, 'min_samples_leaf': 68, 'criterion': 'entropy'}.
Trial 5939 finished with value: 0.7065217391304348 and parameters: {'n_estimators': 280, 'max_depth': 10, 'min_samples_split': 38, 'min_samples_leaf': 58, 'criterion': 'gini'}.
Trial 5940 finished with value: 0.717391304347826 and parameters: {'n_estimators': 316, 'max_depth': 14, 'min_samples_split': 45, 'min_samples_leaf': 60, 'criterion': 'entropy'}.
Trial 5941 finished with value: 0.6956521739130435 and parameters: {'n_estimators': 258, 'max_depth': 12, 'min_samples_split': 34, 'min_samples_leaf': 71, 'criterion': 'gini'}.
Trial 5942 finished with value: 0.7282608695652174 and parameters: {'n_estimators': 295, 'max_depth': 9, 'min_samples_split': 11, 'min_samples_leaf': 54, 'criterion': 'entropy'}.
Trial 5943 finished with value: 0.6956521739130435 and parameters: {'n_estimators': 237, 'max_depth': 8, 'min_samples_split': 65, 'min_samples_leaf': 62, 'criterion': 'gini'}.
Trial 5944 finished with value: 0.6413043478260869 and parameters: {'n_estimators': 335, 'max_depth': 5, 'min_samples_split': 25, 'min_samples_leaf': 56, 'criterion': 'entropy'}.
Trial 5945 finished with value: 0.6956521739130435 and parameters: {'n_estimators': 789, 'max_depth': 11, 'min_samples_split': 137, 'min_samples_leaf': 59, 'criterion': 'gini'}.
Trial 5946 finished with value: 0.6956521739130435 and parameters: {'n_estimators': 277, 'max_depth': 14, 'min_samples_split': 118, 'min_samples_leaf': 64, 'criterion': 'entropy'}.
Trial 5947 finished with value: 0.7065217391304348 and parameters: {'n_estimators': 728, 'max_depth': 10, 'min_samples_split': 29, 'min_samples_leaf': 57, 'criterion': 'gini'}.
Trial 5948 finished with value: 0.6739130434782609 and parameters: {'n_estimators': 936, 'max_depth': 7, 'min_samples_split': 35, 'min_samples_leaf': 54, 'criterion': 'entropy'}.
Trial 5949 finished with value: 0.7065217391304348 and parameters: {'n_estimators': 661, 'max_depth': 12, 'min_samples_split': 101, 'min_samples_leaf': 67, 'criterion': 'gini'}.
Trial 5950 finished with value: 0.6956521739130435 and parameters: {'n_estimators': 356, 'max_depth': 9, 'min_samples_split': 132, 'min_samples_leaf': 61, 'criterion': 'entropy'}.
Trial 5951 finished with value: 0.6847826086956522 and parameters: {'n_estimators': 246, 'max_depth': 89, 'min_samples_split': 189, 'min_samples_leaf': 58, 'criterion': 'gini'}.
Trial 5952 finished with value: 0.6956521739130435 and parameters: {'n_estimators': 749, 'max_depth': 13, 'min_samples_split': 57, 'min_samples_leaf': 52, 'criterion': 'entropy'}.
Trial 5953 finished with value: 0.6847826086956522 and parameters: {'n_estimators': 697, 'max_depth': 16, 'min_samples_split': 23, 'min_samples_leaf': 75, 'criterion': 'gini'}.
Trial 5954 finished with value: 0.7282608695652174 and parameters: {'n_estimators': 420, 'max_depth': 8, 'min_samples_split': 147, 'min_samples_leaf': 70, 'criterion': 'entropy'}.
