Trial 4356 finished with value: 0.6847826086956522 and parameters: {'n_estimators': 268, 'max_depth': 14, 'min_samples_split': 39, 'min_samples_leaf': 75, 'criterion': 'gini'}.
Trial 4357 finished with value: 0.7282608695652174 and parameters: {'n_estimators': 287, 'max_depth': 11, 'min_samples_split': 27, 'min_samples_leaf': 59, 'criterion': 'entropy'}.
Trial 4358 finished with value: 0.6847826086956522 and parameters: {'n_estimators': 303, 'max_depth': 6, 'min_samples_split': 151, 'min_samples_leaf': 62, 'criterion': 'gini'}.
Trial 4359 finished with value: 0.6956521739130435 and parameters: {'n_estimators': 378, 'max_depth': 8, 'min_samples_split': 131, 'min_samples_leaf': 56, 'criterion': 'entropy'}.
Trial 4360 finished with value: 0.6847826086956522 and parameters: {'n_estimators': 351, 'max_depth': 17, 'min_samples_split': 31, 'min_samples_leaf': 65, 'criterion': 'entropy'}.
Trial 4361 finished with value: 0.6956521739130435 and parameters: {'n_estimators': 686, 'max_depth': 10, 'min_samples_split': 143, 'min_samples_leaf': 72, 'criterion': 'gini'}.
Trial 4362 finished with value: 0.6956521739130435 and parameters: {'n_estimators': 243, 'max_depth': 13, 'min_samples_split': 98, 'min_samples_leaf': 57, 'criterion': 'entropy'}.
Trial 4363 finished with value: 0.7065217391304348 and parameters: {'n_estimators': 267, 'max_depth': 11, 'min_samples_split': 116, 'min_samples_leaf': 60, 'criterion': 'gini'}.
Trial 4364 finished with value: 0.6304347826086957 and parameters: {'n_estimators': 710, 'max_depth': 5, 'min_samples_split': 24, 'min_samples_leaf': 55, 'criterion': 'entropy'}.
Trial 4365 finished with value: 0.6847826086956522 and parameters: {'n_estimators': 184, 'max_depth': 15, 'min_samples_split': 41, 'min_samples_leaf': 70, 'criterion': 'gini'}.
Trial 4366 finished with value: 0.717391304347826 and parameters: {'n_estimators': 330, 'max_depth': 8, 'min_samples_split': 34, 'min_samples_leaf': 59, 'criterion': 'entropy'}.
Trial 4367 finished with value: 0.7282608695652174 and parameters: {'n_estimators': 280, 'max_depth': 9, 'min_samples_split': 13, 'min_samples_leaf': 62, 'criterion': 'gini'}.
Trial 4368 finished with value: 0.6847826086956522 and parameters: {'n_estimators': 227, 'max_depth': 13, 'min_samples_split': 146, 'min_samples_leaf': 67, 'criterion': 'entropy'}.
Trial 4369 finished with value: 0.717391304347826 and parameters: {'n_estimators': 299, 'max_depth': 11, 'min_samples_split': 28, 'min_samples_leaf': 58, 'criterion': 'gini'}.
Trial 4370 finished with value: 0.6739130434782609 and parameters: {'n_estimators': 259, 'max_depth': 7, 'min_samples_split': 91, 'min_samples_leaf': 55, 'criterion': 'entropy'}.
Trial 4371 finished with value: 0.7065217391304348 and parameters: {'n_estimators': 201, 'max_depth': 10, 'min_samples_split': 139, 'min_samples_leaf': 61, 'criterion': 'gini'}.
Trial 4372 finished with value: 0.7065217391304348 and parameters: {'n_estimators': 314, 'max_depth': 12, 'min_samples_split': 37, 'min_samples_leaf': 57, 'criterion': 'entropy'}.
Trial 4373 finished with value: 0.6847826086956522 and parameters: {'n_estimators': 266, 'max_depth': 15, 'min_samples_split': 21, 'min_samples_leaf': 64, 'criterion': 'gini'}.
Trial 4374 finished with value: 0.7282608695652174 and parameters: {'n_estimators': 289, 'max_depth': 9, 'min_samples_split': 30, 'min_samples_leaf': 74, 'criterion': 'entropy'}.
Trial 4375 finished with value: 0.6847826086956522 and parameters: {'n_estimators': 110, 'max_depth': 7, 'min_samples_split': 33, 'min_samples_leaf': 60, 'criterion': 'gini'}.
Trial 4376 finished with value: 0.6956521739130435 and parameters: {'n_estimators': 247, 'max_depth': 12, 'min_samples_split': 128, 'min_samples_leaf': 63, 'criterion': 'entropy'}.
Trial 4377 finished with value: 0.6847826086956522 and parameters: {'n_estimators': 280, 'max_depth': 18, 'min_samples_split': 43, 'min_samples_leaf': 71, 'criterion': 'gini'}.
Trial 4378 finished with value: 0.6630434782608695 and parameters: {'n_estimators': 235, 'max_depth': 58, 'min_samples_split': 72, 'min_samples_leaf': 78, 'criterion': 'entropy'}.
Trial 4379 finished with value: 0.6847826086956522 and parameters: {'n_estimators': 302, 'max_depth': 14, 'min_samples_split': 121, 'min_samples_leaf': 55, 'criterion': 'gini'}.
Trial 4380 finished with value: 0.6413043478260869 and parameters: {'n_estimators': 264, 'max_depth': 5, 'min_samples_split': 108, 'min_samples_leaf': 59, 'criterion': 'entropy'}.
Trial 4381 finished with value: 0.7065217391304348 and parameters: {'n_estimators': 324, 'max_depth': 9, 'min_samples_split': 16, 'min_samples_leaf': 66, 'criterion': 'gini'}.
Trial 4382 finished with value: 0.717391304347826 and parameters: {'n_estimators': 726, 'max_depth': 11, 'min_samples_split': 26, 'min_samples_leaf': 57, 'criterion': 'entropy'}.
Trial 4383 finished with value: 0.7282608695652174 and parameters: {'n_estimators': 288, 'max_depth': 8, 'min_samples_split': 149, 'min_samples_leaf': 61, 'criterion': 'gini'}.
Trial 4384 finished with value: 0.7065217391304348 and parameters: {'n_estimators': 247, 'max_depth': 13, 'min_samples_split': 134, 'min_samples_leaf': 69, 'criterion': 'entropy'}.
Trial 4385 finished with value: 0.6847826086956522 and parameters: {'n_estimators': 216, 'max_depth': 21, 'min_samples_split': 157, 'min_samples_leaf': 58, 'criterion': 'gini'}.
Trial 4386 finished with value: 0.717391304347826 and parameters: {'n_estimators': 275, 'max_depth': 10, 'min_samples_split': 37, 'min_samples_leaf': 55, 'criterion': 'entropy'}.
Trial 4387 finished with value: 0.6956521739130435 and parameters: {'n_estimators': 307, 'max_depth': 7, 'min_samples_split': 143, 'min_samples_leaf': 60, 'criterion': 'gini'}.
Trial 4388 finished with value: 0.6956521739130435 and parameters: {'n_estimators': 169, 'max_depth': 12, 'min_samples_split': 21, 'min_samples_leaf': 74, 'criterion': 'entropy'}.
Trial 4389 finished with value: 0.6956521739130435 and parameters: {'n_estimators': 257, 'max_depth': 16, 'min_samples_split': 31, 'min_samples_leaf': 63, 'criterion': 'entropy'}.
Trial 4390 finished with value: 0.6956521739130435 and parameters: {'n_estimators': 337, 'max_depth': 10, 'min_samples_split': 139, 'min_samples_leaf': 57, 'criterion': 'gini'}.
Trial 4391 finished with value: 0.7065217391304348 and parameters: {'n_estimators': 285, 'max_depth': 14, 'min_samples_split': 124, 'min_samples_leaf': 72, 'criterion': 'entropy'}.
Trial 4392 finished with value: 0.717391304347826 and parameters: {'n_estimators': 638, 'max_depth': 9, 'min_samples_split': 26, 'min_samples_leaf': 61, 'criterion': 'gini'}.
Trial 4393 finished with value: 0.6847826086956522 and parameters: {'n_estimators': 232, 'max_depth': 6, 'min_samples_split': 39, 'min_samples_leaf': 65, 'criterion': 'entropy'}.
Trial 4394 finished with value: 0.7065217391304348 and parameters: {'n_estimators': 296, 'max_depth': 11, 'min_samples_split': 34, 'min_samples_leaf': 59, 'criterion': 'gini'}.
Trial 4395 finished with value: 0.7282608695652174 and parameters: {'n_estimators': 100, 'max_depth': 9, 'min_samples_split': 115, 'min_samples_leaf': 55, 'criterion': 'entropy'}.
Trial 4396 finished with value: 0.7065217391304348 and parameters: {'n_estimators': 940, 'max_depth': 13, 'min_samples_split': 135, 'min_samples_leaf': 57, 'criterion': 'gini'}.
Trial 4397 finished with value: 0.717391304347826 and parameters: {'n_estimators': 726, 'max_depth': 7, 'min_samples_split': 43, 'min_samples_leaf': 76, 'criterion': 'entropy'}.
Trial 4398 finished with value: 0.7065217391304348 and parameters: {'n_estimators': 272, 'max_depth': 11, 'min_samples_split': 23, 'min_samples_leaf': 68, 'criterion': 'gini'}.
Trial 4399 finished with value: 0.7065217391304348 and parameters: {'n_estimators': 315, 'max_depth': 16, 'min_samples_split': 30, 'min_samples_leaf': 62, 'criterion': 'entropy'}.
Trial 4400 finished with value: 0.717391304347826 and parameters: {'n_estimators': 253, 'max_depth': 8, 'min_samples_split': 18, 'min_samples_leaf': 81, 'criterion': 'gini'}.
Trial 4401 finished with value: 0.6304347826086957 and parameters: {'n_estimators': 360, 'max_depth': 5, 'min_samples_split': 36, 'min_samples_leaf': 55, 'criterion': 'entropy'}.
Trial 4402 finished with value: 0.6739130434782609 and parameters: {'n_estimators': 267, 'max_depth': 14, 'min_samples_split': 142, 'min_samples_leaf': 60, 'criterion': 'gini'}.
Trial 4403 finished with value: 0.6956521739130435 and parameters: {'n_estimators': 289, 'max_depth': 12, 'min_samples_split': 146, 'min_samples_leaf': 59, 'criterion': 'entropy'}.
Trial 4404 finished with value: 0.7065217391304348 and parameters: {'n_estimators': 243, 'max_depth': 10, 'min_samples_split': 46, 'min_samples_leaf': 71, 'criterion': 'gini'}.
Trial 4405 finished with value: 0.7065217391304348 and parameters: {'n_estimators': 691, 'max_depth': 8, 'min_samples_split': 29, 'min_samples_leaf': 57, 'criterion': 'entropy'}.
Trial 4406 finished with value: 0.6956521739130435 and parameters: {'n_estimators': 302, 'max_depth': 12, 'min_samples_split': 83, 'min_samples_leaf': 63, 'criterion': 'gini'}.
Trial 4407 finished with value: 0.717391304347826 and parameters: {'n_estimators': 215, 'max_depth': 10, 'min_samples_split': 39, 'min_samples_leaf': 58, 'criterion': 'entropy'}.
Trial 4408 finished with value: 0.7065217391304348 and parameters: {'n_estimators': 964, 'max_depth': 15, 'min_samples_split': 154, 'min_samples_leaf': 66, 'criterion': 'gini'}.
Trial 4409 finished with value: 0.6956521739130435 and parameters: {'n_estimators': 325, 'max_depth': 18, 'min_samples_split': 26, 'min_samples_leaf': 61, 'criterion': 'entropy'}.
Trial 4410 finished with value: 0.7065217391304348 and parameters: {'n_estimators': 269, 'max_depth': 8, 'min_samples_split': 33, 'min_samples_leaf': 55, 'criterion': 'gini'}.
Trial 4411 finished with value: 0.7065217391304348 and parameters: {'n_estimators': 710, 'max_depth': 13, 'min_samples_split': 129, 'min_samples_leaf': 64, 'criterion': 'entropy'}.
Trial 4412 finished with value: 0.6847826086956522 and parameters: {'n_estimators': 282, 'max_depth': 6, 'min_samples_split': 139, 'min_samples_leaf': 58, 'criterion': 'gini'}.
Trial 4413 finished with value: 0.6739130434782609 and parameters: {'n_estimators': 475, 'max_depth': 10, 'min_samples_split': 21, 'min_samples_leaf': 74, 'criterion': 'entropy'}.
Trial 4414 finished with value: 0.6956521739130435 and parameters: {'n_estimators': 255, 'max_depth': 11, 'min_samples_split': 150, 'min_samples_leaf': 60, 'criterion': 'gini'}.
Trial 4415 finished with value: 0.7065217391304348 and parameters: {'n_estimators': 310, 'max_depth': 8, 'min_samples_split': 50, 'min_samples_leaf': 70, 'criterion': 'entropy'}.
Trial 4416 finished with value: 0.6956521739130435 and parameters: {'n_estimators': 295, 'max_depth': 14, 'min_samples_split': 6, 'min_samples_leaf': 56, 'criterion': 'entropy'}.
Trial 4417 finished with value: 0.6521739130434783 and parameters: {'n_estimators': 238, 'max_depth': 12, 'min_samples_split': 36, 'min_samples_leaf': 100, 'criterion': 'gini'}.
Trial 4418 finished with value: 0.6956521739130435 and parameters: {'n_estimators': 343, 'max_depth': 9, 'min_samples_split': 10, 'min_samples_leaf': 62, 'criterion': 'entropy'}.
Trial 4419 finished with value: 0.7065217391304348 and parameters: {'n_estimators': 272, 'max_depth': 7, 'min_samples_split': 28, 'min_samples_leaf': 73, 'criterion': 'gini'}.
Trial 4420 finished with value: 0.6630434782608695 and parameters: {'n_estimators': 256, 'max_depth': 5, 'min_samples_split': 32, 'min_samples_leaf': 68, 'criterion': 'entropy'}.
Trial 4421 finished with value: 0.6630434782608695 and parameters: {'n_estimators': 283, 'max_depth': 16, 'min_samples_split': 111, 'min_samples_leaf': 59, 'criterion': 'gini'}.
Trial 4422 finished with value: 0.717391304347826 and parameters: {'n_estimators': 198, 'max_depth': 11, 'min_samples_split': 134, 'min_samples_leaf': 57, 'criterion': 'entropy'}.
Trial 4423 finished with value: 0.7065217391304348 and parameters: {'n_estimators': 326, 'max_depth': 9, 'min_samples_split': 42, 'min_samples_leaf': 61, 'criterion': 'gini'}.
Trial 4424 finished with value: 0.6956521739130435 and parameters: {'n_estimators': 227, 'max_depth': 13, 'min_samples_split': 119, 'min_samples_leaf': 64, 'criterion': 'entropy'}.
Trial 4425 finished with value: 0.6630434782608695 and parameters: {'n_estimators': 724, 'max_depth': 7, 'min_samples_split': 24, 'min_samples_leaf': 55, 'criterion': 'gini'}.
Trial 4426 finished with value: 0.7282608695652174 and parameters: {'n_estimators': 305, 'max_depth': 10, 'min_samples_split': 17, 'min_samples_leaf': 58, 'criterion': 'entropy'}.
Trial 4427 finished with value: 0.6739130434782609 and parameters: {'n_estimators': 670, 'max_depth': 12, 'min_samples_split': 145, 'min_samples_leaf': 78, 'criterion': 'gini'}.
Trial 4428 finished with value: 0.6956521739130435 and parameters: {'n_estimators': 272, 'max_depth': 15, 'min_samples_split': 126, 'min_samples_leaf': 60, 'criterion': 'entropy'}.
Trial 4429 finished with value: 0.6956521739130435 and parameters: {'n_estimators': 149, 'max_depth': 9, 'min_samples_split': 37, 'min_samples_leaf': 57, 'criterion': 'gini'}.
Trial 4430 finished with value: 0.6847826086956522 and parameters: {'n_estimators': 292, 'max_depth': 11, 'min_samples_split': 32, 'min_samples_leaf': 75, 'criterion': 'entropy'}.
Trial 4431 finished with value: 0.6956521739130435 and parameters: {'n_estimators': 244, 'max_depth': 14, 'min_samples_split': 56, 'min_samples_leaf': 71, 'criterion': 'gini'}.
Trial 4432 finished with value: 0.6847826086956522 and parameters: {'n_estimators': 438, 'max_depth': 7, 'min_samples_split': 140, 'min_samples_leaf': 66, 'criterion': 'entropy'}.
Trial 4433 finished with value: 0.6630434782608695 and parameters: {'n_estimators': 260, 'max_depth': 17, 'min_samples_split': 131, 'min_samples_leaf': 62, 'criterion': 'gini'}.
Trial 4434 finished with value: 0.6847826086956522 and parameters: {'n_estimators': 286, 'max_depth': 42, 'min_samples_split': 29, 'min_samples_leaf': 59, 'criterion': 'entropy'}.
Trial 4435 finished with value: 0.6956521739130435 and parameters: {'n_estimators': 314, 'max_depth': 49, 'min_samples_split': 23, 'min_samples_leaf': 55, 'criterion': 'gini'}.
Trial 4436 finished with value: 0.7065217391304348 and parameters: {'n_estimators': 728, 'max_depth': 10, 'min_samples_split': 40, 'min_samples_leaf': 63, 'criterion': 'entropy'}.
Trial 4437 finished with value: 0.7065217391304348 and parameters: {'n_estimators': 273, 'max_depth': 13, 'min_samples_split': 35, 'min_samples_leaf': 69, 'criterion': 'gini'}.
Trial 4438 finished with value: 0.6739130434782609 and parameters: {'n_estimators': 298, 'max_depth': 70, 'min_samples_split': 138, 'min_samples_leaf': 57, 'criterion': 'entropy'}.
Trial 4439 finished with value: 0.6304347826086957 and parameters: {'n_estimators': 249, 'max_depth': 5, 'min_samples_split': 27, 'min_samples_leaf': 60, 'criterion': 'gini'}.
Trial 4440 finished with value: 0.7282608695652174 and parameters: {'n_estimators': 335, 'max_depth': 8, 'min_samples_split': 101, 'min_samples_leaf': 73, 'criterion': 'entropy'}.
Trial 4441 finished with value: 0.7282608695652174 and parameters: {'n_estimators': 363, 'max_depth': 11, 'min_samples_split': 15, 'min_samples_leaf': 59, 'criterion': 'gini'}.
Trial 4442 finished with value: 0.7282608695652174 and parameters: {'n_estimators': 999, 'max_depth': 9, 'min_samples_split': 147, 'min_samples_leaf': 56, 'criterion': 'entropy'}.
Trial 4443 finished with value: 0.6847826086956522 and parameters: {'n_estimators': 232, 'max_depth': 12, 'min_samples_split': 32, 'min_samples_leaf': 65, 'criterion': 'gini'}.
Trial 4444 finished with value: 0.6739130434782609 and parameters: {'n_estimators': 267, 'max_depth': 7, 'min_samples_split': 184, 'min_samples_leaf': 62, 'criterion': 'entropy'}.
Trial 4445 finished with value: 0.6847826086956522 and parameters: {'n_estimators': 313, 'max_depth': 14, 'min_samples_split': 123, 'min_samples_leaf': 55, 'criterion': 'entropy'}.
Trial 4446 finished with value: 0.7065217391304348 and parameters: {'n_estimators': 413, 'max_depth': 10, 'min_samples_split': 46, 'min_samples_leaf': 58, 'criterion': 'gini'}.
Trial 4447 finished with value: 0.6739130434782609 and parameters: {'n_estimators': 707, 'max_depth': 20, 'min_samples_split': 39, 'min_samples_leaf': 61, 'criterion': 'entropy'}.
Trial 4448 finished with value: 0.6847826086956522 and parameters: {'n_estimators': 212, 'max_depth': 12, 'min_samples_split': 21, 'min_samples_leaf': 76, 'criterion': 'gini'}.
Trial 4449 finished with value: 0.7065217391304348 and parameters: {'n_estimators': 281, 'max_depth': 16, 'min_samples_split': 143, 'min_samples_leaf': 71, 'criterion': 'entropy'}.
Trial 4450 finished with value: 0.7065217391304348 and parameters: {'n_estimators': 259, 'max_depth': 8, 'min_samples_split': 26, 'min_samples_leaf': 67, 'criterion': 'gini'}.
Trial 4451 finished with value: 0.6739130434782609 and parameters: {'n_estimators': 294, 'max_depth': 6, 'min_samples_split': 34, 'min_samples_leaf': 59, 'criterion': 'entropy'}.
Trial 4452 finished with value: 0.7282608695652174 and parameters: {'n_estimators': 731, 'max_depth': 10, 'min_samples_split': 152, 'min_samples_leaf': 55, 'criterion': 'gini'}.
Trial 4453 finished with value: 0.6847826086956522 and parameters: {'n_estimators': 243, 'max_depth': 14, 'min_samples_split': 42, 'min_samples_leaf': 63, 'criterion': 'entropy'}.
Trial 4454 finished with value: 0.6739130434782609 and parameters: {'n_estimators': 920, 'max_depth': 31, 'min_samples_split': 132, 'min_samples_leaf': 60, 'criterion': 'gini'}.
Trial 4455 finished with value: 0.6739130434782609 and parameters: {'n_estimators': 615, 'max_depth': 12, 'min_samples_split': 29, 'min_samples_leaf': 90, 'criterion': 'entropy'}.
Trial 4456 finished with value: 0.717391304347826 and parameters: {'n_estimators': 134, 'max_depth': 9, 'min_samples_split': 135, 'min_samples_leaf': 57, 'criterion': 'gini'}.
Trial 4457 finished with value: 0.6739130434782609 and parameters: {'n_estimators': 276, 'max_depth': 5, 'min_samples_split': 114, 'min_samples_leaf': 73, 'criterion': 'entropy'}.
Trial 4458 finished with value: 0.6956521739130435 and parameters: {'n_estimators': 318, 'max_depth': 11, 'min_samples_split': 34, 'min_samples_leaf': 64, 'criterion': 'gini'}.
Trial 4459 finished with value: 0.6956521739130435 and parameters: {'n_estimators': 261, 'max_depth': 7, 'min_samples_split': 24, 'min_samples_leaf': 69, 'criterion': 'entropy'}.
Trial 4460 finished with value: 0.6739130434782609 and parameters: {'n_estimators': 223, 'max_depth': 15, 'min_samples_split': 37, 'min_samples_leaf': 61, 'criterion': 'gini'}.
Trial 4461 finished with value: 0.6739130434782609 and parameters: {'n_estimators': 298, 'max_depth': 18, 'min_samples_split': 30, 'min_samples_leaf': 57, 'criterion': 'entropy'}.
Trial 4462 finished with value: 0.7391304347826086 and parameters: {'n_estimators': 281, 'max_depth': 9, 'min_samples_split': 147, 'min_samples_leaf': 60, 'criterion': 'gini'}.
Trial 4463 finished with value: 0.6739130434782609 and parameters: {'n_estimators': 244, 'max_depth': 13, 'min_samples_split': 77, 'min_samples_leaf': 55, 'criterion': 'entropy'}.
Trial 4464 finished with value: 0.717391304347826 and parameters: {'n_estimators': 736, 'max_depth': 11, 'min_samples_split': 119, 'min_samples_leaf': 58, 'criterion': 'gini'}.
Trial 4465 finished with value: 0.6956521739130435 and parameters: {'n_estimators': 298, 'max_depth': 8, 'min_samples_split': 18, 'min_samples_leaf': 62, 'criterion': 'entropy'}.
Trial 4466 finished with value: 0.7065217391304348 and parameters: {'n_estimators': 341, 'max_depth': 80, 'min_samples_split': 142, 'min_samples_leaf': 67, 'criterion': 'gini'}.
Trial 4467 finished with value: 0.6956521739130435 and parameters: {'n_estimators': 260, 'max_depth': 13, 'min_samples_split': 127, 'min_samples_leaf': 72, 'criterion': 'entropy'}.
Trial 4468 finished with value: 0.7065217391304348 and parameters: {'n_estimators': 278, 'max_depth': 10, 'min_samples_split': 27, 'min_samples_leaf': 59, 'criterion': 'gini'}.
Trial 4469 finished with value: 0.6739130434782609 and parameters: {'n_estimators': 378, 'max_depth': 7, 'min_samples_split': 136, 'min_samples_leaf': 55, 'criterion': 'entropy'}.
Trial 4470 finished with value: 0.717391304347826 and parameters: {'n_estimators': 312, 'max_depth': 11, 'min_samples_split': 40, 'min_samples_leaf': 65, 'criterion': 'gini'}.
Trial 4471 finished with value: 0.6956521739130435 and parameters: {'n_estimators': 256, 'max_depth': 16, 'min_samples_split': 32, 'min_samples_leaf': 75, 'criterion': 'entropy'}.
Trial 4472 finished with value: 0.7391304347826086 and parameters: {'n_estimators': 282, 'max_depth': 9, 'min_samples_split': 23, 'min_samples_leaf': 57, 'criterion': 'entropy'}.
Trial 4473 finished with value: 0.6956521739130435 and parameters: {'n_estimators': 228, 'max_depth': 13, 'min_samples_split': 44, 'min_samples_leaf': 61, 'criterion': 'gini'}.
Trial 4474 finished with value: 0.6413043478260869 and parameters: {'n_estimators': 326, 'max_depth': 5, 'min_samples_split': 139, 'min_samples_leaf': 59, 'criterion': 'entropy'}.
Trial 4475 finished with value: 0.6956521739130435 and parameters: {'n_estimators': 296, 'max_depth': 8, 'min_samples_split': 36, 'min_samples_leaf': 80, 'criterion': 'gini'}.
Trial 4476 finished with value: 0.7065217391304348 and parameters: {'n_estimators': 243, 'max_depth': 11, 'min_samples_split': 150, 'min_samples_leaf': 63, 'criterion': 'entropy'}.
Trial 4477 finished with value: 0.6847826086956522 and parameters: {'n_estimators': 189, 'max_depth': 15, 'min_samples_split': 31, 'min_samples_leaf': 70, 'criterion': 'gini'}.
Trial 4478 finished with value: 0.6739130434782609 and parameters: {'n_estimators': 266, 'max_depth': 7, 'min_samples_split': 26, 'min_samples_leaf': 55, 'criterion': 'entropy'}.
