Trial 5217 finished with value: 0.7065217391304348 and parameters: {'n_estimators': 265, 'max_depth': 8, 'min_samples_split': 30, 'min_samples_leaf': 61, 'criterion': 'gini'}.
Trial 5218 finished with value: 0.6739130434782609 and parameters: {'n_estimators': 113, 'max_depth': 12, 'min_samples_split': 36, 'min_samples_leaf': 79, 'criterion': 'entropy'}.
Trial 5219 finished with value: 0.7282608695652174 and parameters: {'n_estimators': 306, 'max_depth': 10, 'min_samples_split': 157, 'min_samples_leaf': 66, 'criterion': 'gini'}.
Trial 5220 finished with value: 0.6847826086956522 and parameters: {'n_estimators': 388, 'max_depth': 15, 'min_samples_split': 137, 'min_samples_leaf': 54, 'criterion': 'entropy'}.
Trial 5221 finished with value: 0.6739130434782609 and parameters: {'n_estimators': 978, 'max_depth': 17, 'min_samples_split': 41, 'min_samples_leaf': 58, 'criterion': 'gini'}.
Trial 5222 finished with value: 0.6956521739130435 and parameters: {'n_estimators': 275, 'max_depth': 8, 'min_samples_split': 19, 'min_samples_leaf': 62, 'criterion': 'entropy'}.
Trial 5223 finished with value: 0.6956521739130435 and parameters: {'n_estimators': 718, 'max_depth': 12, 'min_samples_split': 26, 'min_samples_leaf': 60, 'criterion': 'gini'}.
Trial 5224 finished with value: 0.6413043478260869 and parameters: {'n_estimators': 101, 'max_depth': 5, 'min_samples_split': 33, 'min_samples_leaf': 74, 'criterion': 'entropy'}.
Trial 5225 finished with value: 0.7391304347826086 and parameters: {'n_estimators': 254, 'max_depth': 10, 'min_samples_split': 28, 'min_samples_leaf': 56, 'criterion': 'gini'}.
Trial 5226 finished with value: 0.6847826086956522 and parameters: {'n_estimators': 228, 'max_depth': 7, 'min_samples_split': 149, 'min_samples_leaf': 63, 'criterion': 'entropy'}.
Trial 5227 finished with value: 0.6956521739130435 and parameters: {'n_estimators': 351, 'max_depth': 13, 'min_samples_split': 36, 'min_samples_leaf': 71, 'criterion': 'gini'}.
Trial 5228 finished with value: 0.7282608695652174 and parameters: {'n_estimators': 291, 'max_depth': 11, 'min_samples_split': 23, 'min_samples_leaf': 59, 'criterion': 'entropy'}.
Trial 5229 finished with value: 0.717391304347826 and parameters: {'n_estimators': 735, 'max_depth': 9, 'min_samples_split': 93, 'min_samples_leaf': 55, 'criterion': 'entropy'}.
Trial 5230 finished with value: 0.6847826086956522 and parameters: {'n_estimators': 305, 'max_depth': 14, 'min_samples_split': 140, 'min_samples_leaf': 57, 'criterion': 'gini'}.
Trial 5231 finished with value: 0.6739130434782609 and parameters: {'n_estimators': 271, 'max_depth': 7, 'min_samples_split': 145, 'min_samples_leaf': 53, 'criterion': 'entropy'}.
Trial 5232 finished with value: 0.6956521739130435 and parameters: {'n_estimators': 773, 'max_depth': 16, 'min_samples_split': 40, 'min_samples_leaf': 65, 'criterion': 'gini'}.
Trial 5233 finished with value: 0.7391304347826086 and parameters: {'n_estimators': 250, 'max_depth': 11, 'min_samples_split': 13, 'min_samples_leaf': 60, 'criterion': 'entropy'}.
Trial 5234 finished with value: 0.6304347826086957 and parameters: {'n_estimators': 284, 'max_depth': 9, 'min_samples_split': 33, 'min_samples_leaf': 13, 'criterion': 'gini'}.
Trial 5235 finished with value: 0.6956521739130435 and parameters: {'n_estimators': 334, 'max_depth': 13, 'min_samples_split': 45, 'min_samples_leaf': 68, 'criterion': 'entropy'}.
Trial 5236 finished with value: 0.6847826086956522 and parameters: {'n_estimators': 313, 'max_depth': 25, 'min_samples_split': 135, 'min_samples_leaf': 58, 'criterion': 'gini'}.
Trial 5237 finished with value: 0.7391304347826086 and parameters: {'n_estimators': 220, 'max_depth': 11, 'min_samples_split': 130, 'min_samples_leaf': 61, 'criterion': 'entropy'}.
Trial 5238 finished with value: 0.6739130434782609 and parameters: {'n_estimators': 752, 'max_depth': 6, 'min_samples_split': 29, 'min_samples_leaf': 73, 'criterion': 'gini'}.
Trial 5239 finished with value: 0.6956521739130435 and parameters: {'n_estimators': 187, 'max_depth': 8, 'min_samples_split': 21, 'min_samples_leaf': 77, 'criterion': 'entropy'}.
Trial 5240 finished with value: 0.7282608695652174 and parameters: {'n_estimators': 277, 'max_depth': 10, 'min_samples_split': 37, 'min_samples_leaf': 56, 'criterion': 'gini'}.
Trial 5241 finished with value: 0.6956521739130435 and parameters: {'n_estimators': 899, 'max_depth': 12, 'min_samples_split': 49, 'min_samples_leaf': 63, 'criterion': 'entropy'}.
Trial 5242 finished with value: 0.6739130434782609 and parameters: {'n_estimators': 264, 'max_depth': 15, 'min_samples_split': 31, 'min_samples_leaf': 59, 'criterion': 'gini'}.
Trial 5243 finished with value: 0.7282608695652174 and parameters: {'n_estimators': 241, 'max_depth': 8, 'min_samples_split': 25, 'min_samples_leaf': 54, 'criterion': 'entropy'}.
Trial 5244 finished with value: 0.6847826086956522 and parameters: {'n_estimators': 776, 'max_depth': 6, 'min_samples_split': 79, 'min_samples_leaf': 57, 'criterion': 'gini'}.
Trial 5245 finished with value: 0.6956521739130435 and parameters: {'n_estimators': 298, 'max_depth': 17, 'min_samples_split': 124, 'min_samples_leaf': 61, 'criterion': 'entropy'}.
Trial 5246 finished with value: 0.6956521739130435 and parameters: {'n_estimators': 942, 'max_depth': 13, 'min_samples_split': 44, 'min_samples_leaf': 70, 'criterion': 'gini'}.
Trial 5247 finished with value: 0.7065217391304348 and parameters: {'n_estimators': 259, 'max_depth': 10, 'min_samples_split': 153, 'min_samples_leaf': 64, 'criterion': 'entropy'}.
Trial 5248 finished with value: 0.717391304347826 and parameters: {'n_estimators': 324, 'max_depth': 9, 'min_samples_split': 141, 'min_samples_leaf': 66, 'criterion': 'gini'}.
Trial 5249 finished with value: 0.717391304347826 and parameters: {'n_estimators': 646, 'max_depth': 11, 'min_samples_split': 34, 'min_samples_leaf': 59, 'criterion': 'entropy'}.
Trial 5250 finished with value: 0.6956521739130435 and parameters: {'n_estimators': 285, 'max_depth': 14, 'min_samples_split': 19, 'min_samples_leaf': 55, 'criterion': 'gini'}.
Trial 5251 finished with value: 0.6956521739130435 and parameters: {'n_estimators': 733, 'max_depth': 8, 'min_samples_split': 109, 'min_samples_leaf': 62, 'criterion': 'entropy'}.
Trial 5252 finished with value: 0.6739130434782609 and parameters: {'n_estimators': 707, 'max_depth': 19, 'min_samples_split': 133, 'min_samples_leaf': 57, 'criterion': 'gini'}.
Trial 5253 finished with value: 0.6521739130434783 and parameters: {'n_estimators': 240, 'max_depth': 5, 'min_samples_split': 116, 'min_samples_leaf': 75, 'criterion': 'entropy'}.
Trial 5254 finished with value: 0.717391304347826 and parameters: {'n_estimators': 756, 'max_depth': 12, 'min_samples_split': 28, 'min_samples_leaf': 53, 'criterion': 'gini'}.
Trial 5255 finished with value: 0.717391304347826 and parameters: {'n_estimators': 305, 'max_depth': 10, 'min_samples_split': 38, 'min_samples_leaf': 60, 'criterion': 'entropy'}.
Trial 5256 finished with value: 0.6956521739130435 and parameters: {'n_estimators': 270, 'max_depth': 8, 'min_samples_split': 144, 'min_samples_leaf': 72, 'criterion': 'entropy'}.
Trial 5257 finished with value: 0.7065217391304348 and parameters: {'n_estimators': 287, 'max_depth': 12, 'min_samples_split': 32, 'min_samples_leaf': 58, 'criterion': 'gini'}.
Trial 5258 finished with value: 0.6739130434782609 and parameters: {'n_estimators': 213, 'max_depth': 14, 'min_samples_split': 24, 'min_samples_leaf': 56, 'criterion': 'entropy'}.
Trial 5259 finished with value: 0.6956521739130435 and parameters: {'n_estimators': 417, 'max_depth': 7, 'min_samples_split': 148, 'min_samples_leaf': 69, 'criterion': 'gini'}.
Trial 5260 finished with value: 0.6847826086956522 and parameters: {'n_estimators': 248, 'max_depth': 16, 'min_samples_split': 191, 'min_samples_leaf': 62, 'criterion': 'entropy'}.
Trial 5261 finished with value: 0.717391304347826 and parameters: {'n_estimators': 276, 'max_depth': 10, 'min_samples_split': 16, 'min_samples_leaf': 60, 'criterion': 'gini'}.
Trial 5262 finished with value: 0.7065217391304348 and parameters: {'n_estimators': 305, 'max_depth': 12, 'min_samples_split': 42, 'min_samples_leaf': 55, 'criterion': 'entropy'}.
Trial 5263 finished with value: 0.6739130434782609 and parameters: {'n_estimators': 260, 'max_depth': 39, 'min_samples_split': 138, 'min_samples_leaf': 64, 'criterion': 'gini'}.
Trial 5264 finished with value: 0.6956521739130435 and parameters: {'n_estimators': 778, 'max_depth': 9, 'min_samples_split': 28, 'min_samples_leaf': 67, 'criterion': 'entropy'}.
Trial 5265 finished with value: 0.6847826086956522 and parameters: {'n_estimators': 334, 'max_depth': 7, 'min_samples_split': 6, 'min_samples_leaf': 58, 'criterion': 'gini'}.
Trial 5266 finished with value: 0.6630434782608695 and parameters: {'n_estimators': 229, 'max_depth': 5, 'min_samples_split': 37, 'min_samples_leaf': 73, 'criterion': 'entropy'}.
Trial 5267 finished with value: 0.7065217391304348 and parameters: {'n_estimators': 294, 'max_depth': 11, 'min_samples_split': 33, 'min_samples_leaf': 61, 'criterion': 'gini'}.
Trial 5268 finished with value: 0.6847826086956522 and parameters: {'n_estimators': 316, 'max_depth': 14, 'min_samples_split': 126, 'min_samples_leaf': 81, 'criterion': 'entropy'}.
Trial 5269 finished with value: 0.6956521739130435 and parameters: {'n_estimators': 744, 'max_depth': 9, 'min_samples_split': 24, 'min_samples_leaf': 53, 'criterion': 'gini'}.
Trial 5270 finished with value: 0.7065217391304348 and parameters: {'n_estimators': 261, 'max_depth': 12, 'min_samples_split': 143, 'min_samples_leaf': 57, 'criterion': 'entropy'}.
Trial 5271 finished with value: 0.717391304347826 and parameters: {'n_estimators': 694, 'max_depth': 7, 'min_samples_split': 120, 'min_samples_leaf': 76, 'criterion': 'gini'}.
Trial 5272 finished with value: 0.6847826086956522 and parameters: {'n_estimators': 281, 'max_depth': 15, 'min_samples_split': 62, 'min_samples_leaf': 71, 'criterion': 'entropy'}.
Trial 5273 finished with value: 0.7065217391304348 and parameters: {'n_estimators': 722, 'max_depth': 10, 'min_samples_split': 10, 'min_samples_leaf': 59, 'criterion': 'gini'}.
Trial 5274 finished with value: 0.6956521739130435 and parameters: {'n_estimators': 757, 'max_depth': 13, 'min_samples_split': 40, 'min_samples_leaf': 62, 'criterion': 'entropy'}.
Trial 5275 finished with value: 0.6739130434782609 and parameters: {'n_estimators': 250, 'max_depth': 18, 'min_samples_split': 136, 'min_samples_leaf': 56, 'criterion': 'gini'}.
Trial 5276 finished with value: 0.7065217391304348 and parameters: {'n_estimators': 298, 'max_depth': 11, 'min_samples_split': 30, 'min_samples_leaf': 65, 'criterion': 'entropy'}.
Trial 5277 finished with value: 0.717391304347826 and parameters: {'n_estimators': 439, 'max_depth': 8, 'min_samples_split': 131, 'min_samples_leaf': 59, 'criterion': 'gini'}.
Trial 5278 finished with value: 0.717391304347826 and parameters: {'n_estimators': 346, 'max_depth': 9, 'min_samples_split': 20, 'min_samples_leaf': 55, 'criterion': 'entropy'}.
Trial 5279 finished with value: 0.6847826086956522 and parameters: {'n_estimators': 278, 'max_depth': 6, 'min_samples_split': 27, 'min_samples_leaf': 63, 'criterion': 'gini'}.
Trial 5280 finished with value: 0.6956521739130435 and parameters: {'n_estimators': 776, 'max_depth': 13, 'min_samples_split': 96, 'min_samples_leaf': 60, 'criterion': 'entropy'}.
Trial 5281 finished with value: 0.717391304347826 and parameters: {'n_estimators': 260, 'max_depth': 11, 'min_samples_split': 36, 'min_samples_leaf': 53, 'criterion': 'gini'}.
Trial 5282 finished with value: 0.6847826086956522 and parameters: {'n_estimators': 236, 'max_depth': 15, 'min_samples_split': 32, 'min_samples_leaf': 58, 'criterion': 'entropy'}.
Trial 5283 finished with value: 0.7391304347826086 and parameters: {'n_estimators': 274, 'max_depth': 9, 'min_samples_split': 149, 'min_samples_leaf': 68, 'criterion': 'gini'}.
Trial 5284 finished with value: 0.6847826086956522 and parameters: {'n_estimators': 195, 'max_depth': 7, 'min_samples_split': 35, 'min_samples_leaf': 57, 'criterion': 'entropy'}.
Trial 5285 finished with value: 0.6956521739130435 and parameters: {'n_estimators': 322, 'max_depth': 11, 'min_samples_split': 45, 'min_samples_leaf': 74, 'criterion': 'entropy'}.
Trial 5286 finished with value: 0.7065217391304348 and parameters: {'n_estimators': 293, 'max_depth': 13, 'min_samples_split': 113, 'min_samples_leaf': 55, 'criterion': 'gini'}.
Trial 5287 finished with value: 0.6847826086956522 and parameters: {'n_estimators': 305, 'max_depth': 16, 'min_samples_split': 139, 'min_samples_leaf': 61, 'criterion': 'entropy'}.
Trial 5288 finished with value: 0.6630434782608695 and parameters: {'n_estimators': 253, 'max_depth': 5, 'min_samples_split': 146, 'min_samples_leaf': 71, 'criterion': 'gini'}.
Trial 5289 finished with value: 0.6956521739130435 and parameters: {'n_estimators': 742, 'max_depth': 9, 'min_samples_split': 40, 'min_samples_leaf': 64, 'criterion': 'entropy'}.
Trial 5290 finished with value: 0.717391304347826 and parameters: {'n_estimators': 217, 'max_depth': 11, 'min_samples_split': 24, 'min_samples_leaf': 58, 'criterion': 'gini'}.
Trial 5291 finished with value: 0.6739130434782609 and parameters: {'n_estimators': 273, 'max_depth': 21, 'min_samples_split': 29, 'min_samples_leaf': 78, 'criterion': 'entropy'}.
Trial 5292 finished with value: 0.6956521739130435 and parameters: {'n_estimators': 294, 'max_depth': 7, 'min_samples_split': 19, 'min_samples_leaf': 60, 'criterion': 'gini'}.
Trial 5293 finished with value: 0.6956521739130435 and parameters: {'n_estimators': 162, 'max_depth': 14, 'min_samples_split': 128, 'min_samples_leaf': 53, 'criterion': 'entropy'}.
Trial 5294 finished with value: 0.717391304347826 and parameters: {'n_estimators': 325, 'max_depth': 9, 'min_samples_split': 32, 'min_samples_leaf': 62, 'criterion': 'gini'}.
Trial 5295 finished with value: 0.7065217391304348 and parameters: {'n_estimators': 237, 'max_depth': 12, 'min_samples_split': 134, 'min_samples_leaf': 56, 'criterion': 'entropy'}.
Trial 5296 finished with value: 0.7065217391304348 and parameters: {'n_estimators': 773, 'max_depth': 10, 'min_samples_split': 141, 'min_samples_leaf': 59, 'criterion': 'gini'}.
Trial 5297 finished with value: 0.6630434782608695 and parameters: {'n_estimators': 264, 'max_depth': 17, 'min_samples_split': 15, 'min_samples_leaf': 70, 'criterion': 'entropy'}.
Trial 5298 finished with value: 0.6956521739130435 and parameters: {'n_estimators': 721, 'max_depth': 72, 'min_samples_split': 152, 'min_samples_leaf': 67, 'criterion': 'gini'}.
Trial 5299 finished with value: 0.717391304347826 and parameters: {'n_estimators': 357, 'max_depth': 8, 'min_samples_split': 26, 'min_samples_leaf': 57, 'criterion': 'entropy'}.
Trial 5300 finished with value: 0.6956521739130435 and parameters: {'n_estimators': 286, 'max_depth': 13, 'min_samples_split': 38, 'min_samples_leaf': 61, 'criterion': 'gini'}.
Trial 5301 finished with value: 0.7065217391304348 and parameters: {'n_estimators': 757, 'max_depth': 10, 'min_samples_split': 67, 'min_samples_leaf': 65, 'criterion': 'entropy'}.
Trial 5302 finished with value: 0.6956521739130435 and parameters: {'n_estimators': 310, 'max_depth': 7, 'min_samples_split': 49, 'min_samples_leaf': 76, 'criterion': 'gini'}.
Trial 5303 finished with value: 0.7065217391304348 and parameters: {'n_estimators': 251, 'max_depth': 12, 'min_samples_split': 43, 'min_samples_leaf': 72, 'criterion': 'entropy'}.
Trial 5304 finished with value: 0.6413043478260869 and parameters: {'n_estimators': 282, 'max_depth': 5, 'min_samples_split': 34, 'min_samples_leaf': 55, 'criterion': 'gini'}.
Trial 5305 finished with value: 0.6847826086956522 and parameters: {'n_estimators': 272, 'max_depth': 15, 'min_samples_split': 104, 'min_samples_leaf': 59, 'criterion': 'entropy'}.
Trial 5306 finished with value: 0.6956521739130435 and parameters: {'n_estimators': 243, 'max_depth': 10, 'min_samples_split': 23, 'min_samples_leaf': 63, 'criterion': 'gini'}.
Trial 5307 finished with value: 0.6956521739130435 and parameters: {'n_estimators': 927, 'max_depth': 8, 'min_samples_split': 55, 'min_samples_leaf': 74, 'criterion': 'entropy'}.
Trial 5308 finished with value: 0.6630434782608695 and parameters: {'n_estimators': 676, 'max_depth': 65, 'min_samples_split': 121, 'min_samples_leaf': 57, 'criterion': 'gini'}.
Trial 5309 finished with value: 0.7065217391304348 and parameters: {'n_estimators': 309, 'max_depth': 13, 'min_samples_split': 29, 'min_samples_leaf': 61, 'criterion': 'entropy'}.
Trial 5310 finished with value: 0.7065217391304348 and parameters: {'n_estimators': 373, 'max_depth': 10, 'min_samples_split': 143, 'min_samples_leaf': 69, 'criterion': 'gini'}.
Trial 5311 finished with value: 0.6739130434782609 and parameters: {'n_estimators': 739, 'max_depth': 56, 'min_samples_split': 138, 'min_samples_leaf': 53, 'criterion': 'entropy'}.
Trial 5312 finished with value: 0.6956521739130435 and parameters: {'n_estimators': 335, 'max_depth': 12, 'min_samples_split': 35, 'min_samples_leaf': 59, 'criterion': 'entropy'}.
Trial 5313 finished with value: 0.7065217391304348 and parameters: {'n_estimators': 227, 'max_depth': 8, 'min_samples_split': 40, 'min_samples_leaf': 56, 'criterion': 'gini'}.
Trial 5314 finished with value: 0.6956521739130435 and parameters: {'n_estimators': 969, 'max_depth': 14, 'min_samples_split': 28, 'min_samples_leaf': 63, 'criterion': 'entropy'}.
Trial 5315 finished with value: 0.6847826086956522 and parameters: {'n_estimators': 261, 'max_depth': 6, 'min_samples_split': 22, 'min_samples_leaf': 58, 'criterion': 'gini'}.
Trial 5316 finished with value: 0.717391304347826 and parameters: {'n_estimators': 293, 'max_depth': 10, 'min_samples_split': 32, 'min_samples_leaf': 60, 'criterion': 'entropy'}.
Trial 5317 finished with value: 0.7065217391304348 and parameters: {'n_estimators': 272, 'max_depth': 11, 'min_samples_split': 117, 'min_samples_leaf': 66, 'criterion': 'gini'}.
Trial 5318 finished with value: 0.6847826086956522 and parameters: {'n_estimators': 775, 'max_depth': 15, 'min_samples_split': 155, 'min_samples_leaf': 55, 'criterion': 'entropy'}.
Trial 5319 finished with value: 0.6956521739130435 and parameters: {'n_estimators': 203, 'max_depth': 8, 'min_samples_split': 144, 'min_samples_leaf': 62, 'criterion': 'gini'}.
Trial 5320 finished with value: 0.6739130434782609 and parameters: {'n_estimators': 288, 'max_depth': 17, 'min_samples_split': 133, 'min_samples_leaf': 73, 'criterion': 'entropy'}.
Trial 5321 finished with value: 0.6630434782608695 and parameters: {'n_estimators': 320, 'max_depth': 12, 'min_samples_split': 147, 'min_samples_leaf': 18, 'criterion': 'gini'}.
Trial 5322 finished with value: 0.7391304347826086 and parameters: {'n_estimators': 257, 'max_depth': 9, 'min_samples_split': 86, 'min_samples_leaf': 58, 'criterion': 'entropy'}.
Trial 5323 finished with value: 0.6847826086956522 and parameters: {'n_estimators': 238, 'max_depth': 7, 'min_samples_split': 166, 'min_samples_leaf': 53, 'criterion': 'gini'}.
Trial 5324 finished with value: 0.7065217391304348 and parameters: {'n_estimators': 732, 'max_depth': 11, 'min_samples_split': 123, 'min_samples_leaf': 60, 'criterion': 'entropy'}.
Trial 5325 finished with value: 0.7065217391304348 and parameters: {'n_estimators': 701, 'max_depth': 14, 'min_samples_split': 31, 'min_samples_leaf': 57, 'criterion': 'gini'}.
Trial 5326 finished with value: 0.6739130434782609 and parameters: {'n_estimators': 761, 'max_depth': 6, 'min_samples_split': 37, 'min_samples_leaf': 69, 'criterion': 'entropy'}.
Trial 5327 finished with value: 0.6956521739130435 and parameters: {'n_estimators': 293, 'max_depth': 9, 'min_samples_split': 129, 'min_samples_leaf': 64, 'criterion': 'gini'}.
Trial 5328 finished with value: 0.7282608695652174 and parameters: {'n_estimators': 269, 'max_depth': 12, 'min_samples_split': 25, 'min_samples_leaf': 54, 'criterion': 'entropy'}.
Trial 5329 finished with value: 0.717391304347826 and parameters: {'n_estimators': 307, 'max_depth': 10, 'min_samples_split': 18, 'min_samples_leaf': 61, 'criterion': 'gini'}.
Trial 5330 finished with value: 0.6739130434782609 and parameters: {'n_estimators': 282, 'max_depth': 5, 'min_samples_split': 137, 'min_samples_leaf': 71, 'criterion': 'entropy'}.
Trial 5331 finished with value: 0.6739130434782609 and parameters: {'n_estimators': 255, 'max_depth': 16, 'min_samples_split': 43, 'min_samples_leaf': 56, 'criterion': 'gini'}.
Trial 5332 finished with value: 0.717391304347826 and parameters: {'n_estimators': 232, 'max_depth': 8, 'min_samples_split': 34, 'min_samples_leaf': 59, 'criterion': 'entropy'}.
Trial 5333 finished with value: 0.6630434782608695 and parameters: {'n_estimators': 778, 'max_depth': 19, 'min_samples_split': 21, 'min_samples_leaf': 75, 'criterion': 'gini'}.
Trial 5334 finished with value: 0.6956521739130435 and parameters: {'n_estimators': 346, 'max_depth': 13, 'min_samples_split': 27, 'min_samples_leaf': 62, 'criterion': 'entropy'}.
Trial 5335 finished with value: 0.717391304347826 and parameters: {'n_estimators': 142, 'max_depth': 11, 'min_samples_split': 37, 'min_samples_leaf': 58, 'criterion': 'gini'}.
Trial 5336 finished with value: 0.7065217391304348 and parameters: {'n_estimators': 301, 'max_depth': 14, 'min_samples_split': 140, 'min_samples_leaf': 66, 'criterion': 'entropy'}.
Trial 5337 finished with value: 0.6630434782608695 and parameters: {'n_estimators': 753, 'max_depth': 7, 'min_samples_split': 111, 'min_samples_leaf': 55, 'criterion': 'gini'}.
Trial 5338 finished with value: 0.717391304347826 and parameters: {'n_estimators': 270, 'max_depth': 9, 'min_samples_split': 11, 'min_samples_leaf': 60, 'criterion': 'entropy'}.
Trial 5339 finished with value: 0.7065217391304348 and parameters: {'n_estimators': 320, 'max_depth': 11, 'min_samples_split': 150, 'min_samples_leaf': 57, 'criterion': 'gini'}.
