Trial 5709 finished with value: 0.7065217391304348 and parameters: {'n_estimators': 762, 'max_depth': 8, 'min_samples_split': 36, 'min_samples_leaf': 65, 'criterion': 'gini'}.
Trial 5710 finished with value: 0.717391304347826 and parameters: {'n_estimators': 273, 'max_depth': 10, 'min_samples_split': 45, 'min_samples_leaf': 55, 'criterion': 'entropy'}.
Trial 5711 finished with value: 0.7065217391304348 and parameters: {'n_estimators': 265, 'max_depth': 12, 'min_samples_split': 138, 'min_samples_leaf': 58, 'criterion': 'gini'}.
Trial 5712 finished with value: 0.6847826086956522 and parameters: {'n_estimators': 736, 'max_depth': 15, 'min_samples_split': 147, 'min_samples_leaf': 62, 'criterion': 'entropy'}.
Trial 5713 finished with value: 0.6847826086956522 and parameters: {'n_estimators': 787, 'max_depth': 50, 'min_samples_split': 101, 'min_samples_leaf': 74, 'criterion': 'gini'}.
Trial 5714 finished with value: 0.6847826086956522 and parameters: {'n_estimators': 369, 'max_depth': 47, 'min_samples_split': 14, 'min_samples_leaf': 61, 'criterion': 'entropy'}.
Trial 5715 finished with value: 0.7065217391304348 and parameters: {'n_estimators': 917, 'max_depth': 7, 'min_samples_split': 19, 'min_samples_leaf': 80, 'criterion': 'gini'}.
Trial 5716 finished with value: 0.717391304347826 and parameters: {'n_estimators': 322, 'max_depth': 10, 'min_samples_split': 52, 'min_samples_leaf': 59, 'criterion': 'entropy'}.
Trial 5717 finished with value: 0.7065217391304348 and parameters: {'n_estimators': 655, 'max_depth': 12, 'min_samples_split': 107, 'min_samples_leaf': 56, 'criterion': 'gini'}.
Trial 5718 finished with value: 0.7065217391304348 and parameters: {'n_estimators': 290, 'max_depth': 8, 'min_samples_split': 30, 'min_samples_leaf': 72, 'criterion': 'entropy'}.
Trial 5719 finished with value: 0.6739130434782609 and parameters: {'n_estimators': 251, 'max_depth': 16, 'min_samples_split': 63, 'min_samples_leaf': 63, 'criterion': 'gini'}.
Trial 5720 finished with value: 0.6739130434782609 and parameters: {'n_estimators': 306, 'max_depth': 19, 'min_samples_split': 41, 'min_samples_leaf': 53, 'criterion': 'entropy'}.
Trial 5721 finished with value: 0.6630434782608695 and parameters: {'n_estimators': 230, 'max_depth': 13, 'min_samples_split': 131, 'min_samples_leaf': 67, 'criterion': 'gini'}.
Trial 5722 finished with value: 0.7391304347826086 and parameters: {'n_estimators': 281, 'max_depth': 11, 'min_samples_split': 22, 'min_samples_leaf': 60, 'criterion': 'entropy'}.
Trial 5723 finished with value: 0.6847826086956522 and parameters: {'n_estimators': 264, 'max_depth': 6, 'min_samples_split': 142, 'min_samples_leaf': 58, 'criterion': 'gini'}.
Trial 5724 finished with value: 0.6956521739130435 and parameters: {'n_estimators': 171, 'max_depth': 9, 'min_samples_split': 34, 'min_samples_leaf': 55, 'criterion': 'entropy'}.
Trial 5725 finished with value: 0.6847826086956522 and parameters: {'n_estimators': 743, 'max_depth': 10, 'min_samples_split': 151, 'min_samples_leaf': 64, 'criterion': 'gini'}.
Trial 5726 finished with value: 0.6847826086956522 and parameters: {'n_estimators': 292, 'max_depth': 14, 'min_samples_split': 30, 'min_samples_leaf': 59, 'criterion': 'entropy'}.
Trial 5727 finished with value: 0.6956521739130435 and parameters: {'n_estimators': 767, 'max_depth': 8, 'min_samples_split': 26, 'min_samples_leaf': 56, 'criterion': 'gini'}.
Trial 5728 finished with value: 0.7065217391304348 and parameters: {'n_estimators': 327, 'max_depth': 12, 'min_samples_split': 38, 'min_samples_leaf': 61, 'criterion': 'entropy'}.
Trial 5729 finished with value: 0.6847826086956522 and parameters: {'n_estimators': 246, 'max_depth': 6, 'min_samples_split': 34, 'min_samples_leaf': 57, 'criterion': 'gini'}.
Trial 5730 finished with value: 0.7282608695652174 and parameters: {'n_estimators': 273, 'max_depth': 10, 'min_samples_split': 182, 'min_samples_leaf': 73, 'criterion': 'entropy'}.
Trial 5731 finished with value: 0.6847826086956522 and parameters: {'n_estimators': 257, 'max_depth': 16, 'min_samples_split': 136, 'min_samples_leaf': 59, 'criterion': 'gini'}.
Trial 5732 finished with value: 0.7065217391304348 and parameters: {'n_estimators': 349, 'max_depth': 13, 'min_samples_split': 142, 'min_samples_leaf': 70, 'criterion': 'entropy'}.
Trial 5733 finished with value: 0.6739130434782609 and parameters: {'n_estimators': 307, 'max_depth': 26, 'min_samples_split': 200, 'min_samples_leaf': 52, 'criterion': 'entropy'}.
Trial 5734 finished with value: 0.6739130434782609 and parameters: {'n_estimators': 786, 'max_depth': 9, 'min_samples_split': 115, 'min_samples_leaf': 66, 'criterion': 'gini'}.
Trial 5735 finished with value: 0.6086956521739131 and parameters: {'n_estimators': 203, 'max_depth': 11, 'min_samples_split': 23, 'min_samples_leaf': 1, 'criterion': 'entropy'}.
Trial 5736 finished with value: 0.7065217391304348 and parameters: {'n_estimators': 229, 'max_depth': 8, 'min_samples_split': 48, 'min_samples_leaf': 75, 'criterion': 'gini'}.
Trial 5737 finished with value: 0.6521739130434783 and parameters: {'n_estimators': 894, 'max_depth': 5, 'min_samples_split': 40, 'min_samples_leaf': 62, 'criterion': 'entropy'}.
Trial 5738 finished with value: 0.717391304347826 and parameters: {'n_estimators': 286, 'max_depth': 14, 'min_samples_split': 28, 'min_samples_leaf': 54, 'criterion': 'gini'}.
Trial 5739 finished with value: 0.7065217391304348 and parameters: {'n_estimators': 713, 'max_depth': 11, 'min_samples_split': 127, 'min_samples_leaf': 57, 'criterion': 'entropy'}.
Trial 5740 finished with value: 0.6847826086956522 and parameters: {'n_estimators': 269, 'max_depth': 7, 'min_samples_split': 147, 'min_samples_leaf': 68, 'criterion': 'gini'}.
Trial 5741 finished with value: 0.6630434782608695 and parameters: {'n_estimators': 754, 'max_depth': 38, 'min_samples_split': 32, 'min_samples_leaf': 60, 'criterion': 'entropy'}.
Trial 5742 finished with value: 0.6956521739130435 and parameters: {'n_estimators': 684, 'max_depth': 9, 'min_samples_split': 121, 'min_samples_leaf': 64, 'criterion': 'gini'}.
Trial 5743 finished with value: 0.7065217391304348 and parameters: {'n_estimators': 944, 'max_depth': 12, 'min_samples_split': 18, 'min_samples_leaf': 55, 'criterion': 'entropy'}.
Trial 5744 finished with value: 0.6739130434782609 and parameters: {'n_estimators': 308, 'max_depth': 15, 'min_samples_split': 110, 'min_samples_leaf': 59, 'criterion': 'gini'}.
Trial 5745 finished with value: 0.7282608695652174 and parameters: {'n_estimators': 981, 'max_depth': 10, 'min_samples_split': 83, 'min_samples_leaf': 62, 'criterion': 'entropy'}.
Trial 5746 finished with value: 0.6956521739130435 and parameters: {'n_estimators': 243, 'max_depth': 7, 'min_samples_split': 35, 'min_samples_leaf': 57, 'criterion': 'gini'}.
Trial 5747 finished with value: 0.6739130434782609 and parameters: {'n_estimators': 101, 'max_depth': 13, 'min_samples_split': 25, 'min_samples_leaf': 77, 'criterion': 'entropy'}.
Trial 5748 finished with value: 0.6739130434782609 and parameters: {'n_estimators': 284, 'max_depth': 17, 'min_samples_split': 132, 'min_samples_leaf': 61, 'criterion': 'gini'}.
Trial 5749 finished with value: 0.717391304347826 and parameters: {'n_estimators': 329, 'max_depth': 11, 'min_samples_split': 43, 'min_samples_leaf': 72, 'criterion': 'entropy'}.
Trial 5750 finished with value: 0.717391304347826 and parameters: {'n_estimators': 258, 'max_depth': 9, 'min_samples_split': 38, 'min_samples_leaf': 58, 'criterion': 'gini'}.
Trial 5751 finished with value: 0.6739130434782609 and parameters: {'n_estimators': 299, 'max_depth': 7, 'min_samples_split': 140, 'min_samples_leaf': 52, 'criterion': 'entropy'}.
Trial 5752 finished with value: 0.6956521739130435 and parameters: {'n_estimators': 739, 'max_depth': 14, 'min_samples_split': 29, 'min_samples_leaf': 70, 'criterion': 'gini'}.
Trial 5753 finished with value: 0.7065217391304348 and parameters: {'n_estimators': 1000, 'max_depth': 12, 'min_samples_split': 14, 'min_samples_leaf': 55, 'criterion': 'entropy'}.
Trial 5754 finished with value: 0.6521739130434783 and parameters: {'n_estimators': 273, 'max_depth': 5, 'min_samples_split': 32, 'min_samples_leaf': 64, 'criterion': 'gini'}.
Trial 5755 finished with value: 0.6956521739130435 and parameters: {'n_estimators': 218, 'max_depth': 9, 'min_samples_split': 145, 'min_samples_leaf': 60, 'criterion': 'entropy'}.
Trial 5756 finished with value: 0.6956521739130435 and parameters: {'n_estimators': 766, 'max_depth': 11, 'min_samples_split': 21, 'min_samples_leaf': 57, 'criterion': 'gini'}.
Trial 5757 finished with value: 0.7065217391304348 and parameters: {'n_estimators': 462, 'max_depth': 8, 'min_samples_split': 135, 'min_samples_leaf': 59, 'criterion': 'entropy'}.
Trial 5758 finished with value: 0.7065217391304348 and parameters: {'n_estimators': 786, 'max_depth': 13, 'min_samples_split': 37, 'min_samples_leaf': 62, 'criterion': 'gini'}.
Trial 5759 finished with value: 0.7065217391304348 and parameters: {'n_estimators': 286, 'max_depth': 15, 'min_samples_split': 151, 'min_samples_leaf': 68, 'criterion': 'entropy'}.
Trial 5760 finished with value: 0.7391304347826086 and parameters: {'n_estimators': 245, 'max_depth': 10, 'min_samples_split': 27, 'min_samples_leaf': 53, 'criterion': 'entropy'}.
Trial 5761 finished with value: 0.6847826086956522 and parameters: {'n_estimators': 311, 'max_depth': 18, 'min_samples_split': 32, 'min_samples_leaf': 74, 'criterion': 'gini'}.
Trial 5762 finished with value: 0.6630434782608695 and parameters: {'n_estimators': 260, 'max_depth': 7, 'min_samples_split': 24, 'min_samples_leaf': 56, 'criterion': 'entropy'}.
Trial 5763 finished with value: 0.717391304347826 and parameters: {'n_estimators': 293, 'max_depth': 11, 'min_samples_split': 42, 'min_samples_leaf': 59, 'criterion': 'gini'}.
Trial 5764 finished with value: 0.6630434782608695 and parameters: {'n_estimators': 708, 'max_depth': 9, 'min_samples_split': 117, 'min_samples_leaf': 100, 'criterion': 'entropy'}.
Trial 5765 finished with value: 0.6847826086956522 and parameters: {'n_estimators': 277, 'max_depth': 35, 'min_samples_split': 137, 'min_samples_leaf': 66, 'criterion': 'gini'}.
Trial 5766 finished with value: 0.6956521739130435 and parameters: {'n_estimators': 730, 'max_depth': 13, 'min_samples_split': 124, 'min_samples_leaf': 61, 'criterion': 'entropy'}.
Trial 5767 finished with value: 0.6304347826086957 and parameters: {'n_estimators': 322, 'max_depth': 5, 'min_samples_split': 35, 'min_samples_leaf': 55, 'criterion': 'gini'}.
Trial 5768 finished with value: 0.717391304347826 and parameters: {'n_estimators': 416, 'max_depth': 11, 'min_samples_split': 29, 'min_samples_leaf': 63, 'criterion': 'entropy'}.
Trial 5769 finished with value: 0.6847826086956522 and parameters: {'n_estimators': 444, 'max_depth': 16, 'min_samples_split': 142, 'min_samples_leaf': 72, 'criterion': 'gini'}.
Trial 5770 finished with value: 0.6956521739130435 and parameters: {'n_estimators': 503, 'max_depth': 8, 'min_samples_split': 162, 'min_samples_leaf': 58, 'criterion': 'entropy'}.
Trial 5771 finished with value: 0.6847826086956522 and parameters: {'n_estimators': 262, 'max_depth': 13, 'min_samples_split': 19, 'min_samples_leaf': 76, 'criterion': 'gini'}.
Trial 5772 finished with value: 0.717391304347826 and parameters: {'n_estimators': 234, 'max_depth': 10, 'min_samples_split': 130, 'min_samples_leaf': 57, 'criterion': 'entropy'}.
Trial 5773 finished with value: 0.7065217391304348 and parameters: {'n_estimators': 750, 'max_depth': 7, 'min_samples_split': 38, 'min_samples_leaf': 60, 'criterion': 'gini'}.
Trial 5774 finished with value: 0.6956521739130435 and parameters: {'n_estimators': 295, 'max_depth': 12, 'min_samples_split': 46, 'min_samples_leaf': 53, 'criterion': 'entropy'}.
Trial 5775 finished with value: 0.717391304347826 and parameters: {'n_estimators': 192, 'max_depth': 9, 'min_samples_split': 24, 'min_samples_leaf': 64, 'criterion': 'gini'}.
Trial 5776 finished with value: 0.6847826086956522 and parameters: {'n_estimators': 276, 'max_depth': 15, 'min_samples_split': 33, 'min_samples_leaf': 69, 'criterion': 'entropy'}.
Trial 5777 finished with value: 0.6956521739130435 and parameters: {'n_estimators': 336, 'max_depth': 10, 'min_samples_split': 155, 'min_samples_leaf': 55, 'criterion': 'gini'}.
Trial 5778 finished with value: 0.7065217391304348 and parameters: {'n_estimators': 595, 'max_depth': 7, 'min_samples_split': 145, 'min_samples_leaf': 61, 'criterion': 'entropy'}.
Trial 5779 finished with value: 0.6956521739130435 and parameters: {'n_estimators': 150, 'max_depth': 14, 'min_samples_split': 27, 'min_samples_leaf': 58, 'criterion': 'gini'}.
Trial 5780 finished with value: 0.6847826086956522 and parameters: {'n_estimators': 307, 'max_depth': 20, 'min_samples_split': 12, 'min_samples_leaf': 62, 'criterion': 'entropy'}.
Trial 5781 finished with value: 0.6956521739130435 and parameters: {'n_estimators': 245, 'max_depth': 43, 'min_samples_split': 149, 'min_samples_leaf': 65, 'criterion': 'gini'}.
Trial 5782 finished with value: 0.717391304347826 and parameters: {'n_estimators': 770, 'max_depth': 12, 'min_samples_split': 39, 'min_samples_leaf': 57, 'criterion': 'entropy'}.
Trial 5783 finished with value: 0.6847826086956522 and parameters: {'n_estimators': 355, 'max_depth': 9, 'min_samples_split': 140, 'min_samples_leaf': 59, 'criterion': 'gini'}.
Trial 5784 finished with value: 0.6739130434782609 and parameters: {'n_estimators': 268, 'max_depth': 6, 'min_samples_split': 31, 'min_samples_leaf': 71, 'criterion': 'entropy'}.
Trial 5785 finished with value: 0.6739130434782609 and parameters: {'n_estimators': 218, 'max_depth': 11, 'min_samples_split': 127, 'min_samples_leaf': 78, 'criterion': 'gini'}.
Trial 5786 finished with value: 0.7065217391304348 and parameters: {'n_estimators': 257, 'max_depth': 9, 'min_samples_split': 35, 'min_samples_leaf': 73, 'criterion': 'entropy'}.
Trial 5787 finished with value: 0.6956521739130435 and parameters: {'n_estimators': 291, 'max_depth': 17, 'min_samples_split': 44, 'min_samples_leaf': 55, 'criterion': 'gini'}.
Trial 5788 finished with value: 0.7065217391304348 and parameters: {'n_estimators': 315, 'max_depth': 14, 'min_samples_split': 21, 'min_samples_leaf': 61, 'criterion': 'entropy'}.
Trial 5789 finished with value: 0.6956521739130435 and parameters: {'n_estimators': 276, 'max_depth': 12, 'min_samples_split': 134, 'min_samples_leaf': 75, 'criterion': 'entropy'}.
Trial 5790 finished with value: 0.7282608695652174 and parameters: {'n_estimators': 781, 'max_depth': 8, 'min_samples_split': 28, 'min_samples_leaf': 66, 'criterion': 'gini'}.
Trial 5791 finished with value: 0.6521739130434783 and parameters: {'n_estimators': 386, 'max_depth': 5, 'min_samples_split': 17, 'min_samples_leaf': 59, 'criterion': 'entropy'}.
Trial 5792 finished with value: 0.6956521739130435 and parameters: {'n_estimators': 722, 'max_depth': 11, 'min_samples_split': 112, 'min_samples_leaf': 53, 'criterion': 'gini'}.
Trial 5793 finished with value: 0.6847826086956522 and parameters: {'n_estimators': 241, 'max_depth': 7, 'min_samples_split': 89, 'min_samples_leaf': 57, 'criterion': 'entropy'}.
Trial 5794 finished with value: 0.7065217391304348 and parameters: {'n_estimators': 297, 'max_depth': 10, 'min_samples_split': 119, 'min_samples_leaf': 63, 'criterion': 'gini'}.
Trial 5795 finished with value: 0.7065217391304348 and parameters: {'n_estimators': 259, 'max_depth': 13, 'min_samples_split': 41, 'min_samples_leaf': 60, 'criterion': 'entropy'}.
Trial 5796 finished with value: 0.6956521739130435 and parameters: {'n_estimators': 756, 'max_depth': 15, 'min_samples_split': 31, 'min_samples_leaf': 68, 'criterion': 'gini'}.
Trial 5797 finished with value: 0.7282608695652174 and parameters: {'n_estimators': 281, 'max_depth': 8, 'min_samples_split': 36, 'min_samples_leaf': 56, 'criterion': 'entropy'}.
Trial 5798 finished with value: 0.717391304347826 and parameters: {'n_estimators': 697, 'max_depth': 10, 'min_samples_split': 137, 'min_samples_leaf': 71, 'criterion': 'gini'}.
Trial 5799 finished with value: 0.7065217391304348 and parameters: {'n_estimators': 967, 'max_depth': 12, 'min_samples_split': 23, 'min_samples_leaf': 58, 'criterion': 'entropy'}.
Trial 5800 finished with value: 0.6847826086956522 and parameters: {'n_estimators': 322, 'max_depth': 8, 'min_samples_split': 142, 'min_samples_leaf': 55, 'criterion': 'gini'}.
Trial 5801 finished with value: 0.6956521739130435 and parameters: {'n_estimators': 230, 'max_depth': 14, 'min_samples_split': 28, 'min_samples_leaf': 63, 'criterion': 'entropy'}.
Trial 5802 finished with value: 0.7065217391304348 and parameters: {'n_estimators': 790, 'max_depth': 10, 'min_samples_split': 36, 'min_samples_leaf': 60, 'criterion': 'gini'}.
Trial 5803 finished with value: 0.6739130434782609 and parameters: {'n_estimators': 256, 'max_depth': 6, 'min_samples_split': 96, 'min_samples_leaf': 52, 'criterion': 'entropy'}.
Trial 5804 finished with value: 0.7065217391304348 and parameters: {'n_estimators': 740, 'max_depth': 12, 'min_samples_split': 145, 'min_samples_leaf': 57, 'criterion': 'gini'}.
Trial 5805 finished with value: 0.6847826086956522 and parameters: {'n_estimators': 291, 'max_depth': 16, 'min_samples_split': 25, 'min_samples_leaf': 61, 'criterion': 'entropy'}.
Trial 5806 finished with value: 0.6956521739130435 and parameters: {'n_estimators': 270, 'max_depth': 9, 'min_samples_split': 48, 'min_samples_leaf': 54, 'criterion': 'gini'}.
Trial 5807 finished with value: 0.6956521739130435 and parameters: {'n_estimators': 671, 'max_depth': 11, 'min_samples_split': 123, 'min_samples_leaf': 74, 'criterion': 'entropy'}.
Trial 5808 finished with value: 0.7065217391304348 and parameters: {'n_estimators': 314, 'max_depth': 7, 'min_samples_split': 31, 'min_samples_leaf': 59, 'criterion': 'gini'}.
Trial 5809 finished with value: 0.6847826086956522 and parameters: {'n_estimators': 205, 'max_depth': 13, 'min_samples_split': 40, 'min_samples_leaf': 66, 'criterion': 'entropy'}.
Trial 5810 finished with value: 0.7065217391304348 and parameters: {'n_estimators': 766, 'max_depth': 9, 'min_samples_split': 131, 'min_samples_leaf': 63, 'criterion': 'gini'}.
Trial 5811 finished with value: 0.6739130434782609 and parameters: {'n_estimators': 299, 'max_depth': 18, 'min_samples_split': 140, 'min_samples_leaf': 56, 'criterion': 'entropy'}.
Trial 5812 finished with value: 0.7065217391304348 and parameters: {'n_estimators': 338, 'max_depth': 11, 'min_samples_split': 152, 'min_samples_leaf': 58, 'criterion': 'gini'}.
Trial 5813 finished with value: 0.6304347826086957 and parameters: {'n_estimators': 241, 'max_depth': 5, 'min_samples_split': 17, 'min_samples_leaf': 61, 'criterion': 'entropy'}.
Trial 5814 finished with value: 0.7065217391304348 and parameters: {'n_estimators': 277, 'max_depth': 15, 'min_samples_split': 34, 'min_samples_leaf': 71, 'criterion': 'gini'}.
Trial 5815 finished with value: 0.6847826086956522 and parameters: {'n_estimators': 258, 'max_depth': 13, 'min_samples_split': 76, 'min_samples_leaf': 54, 'criterion': 'entropy'}.
Trial 5816 finished with value: 0.717391304347826 and parameters: {'n_estimators': 287, 'max_depth': 8, 'min_samples_split': 22, 'min_samples_leaf': 59, 'criterion': 'entropy'}.
Trial 5817 finished with value: 0.6956521739130435 and parameters: {'n_estimators': 749, 'max_depth': 10, 'min_samples_split': 148, 'min_samples_leaf': 64, 'criterion': 'gini'}.
Trial 5818 finished with value: 0.6956521739130435 and parameters: {'n_estimators': 224, 'max_depth': 7, 'min_samples_split': 31, 'min_samples_leaf': 76, 'criterion': 'entropy'}.
Trial 5819 finished with value: 0.6956521739130435 and parameters: {'n_estimators': 276, 'max_depth': 97, 'min_samples_split': 27, 'min_samples_leaf': 69, 'criterion': 'gini'}.
Trial 5820 finished with value: 0.7065217391304348 and parameters: {'n_estimators': 370, 'max_depth': 12, 'min_samples_split': 37, 'min_samples_leaf': 56, 'criterion': 'entropy'}.
Trial 5821 finished with value: 0.6956521739130435 and parameters: {'n_estimators': 728, 'max_depth': 10, 'min_samples_split': 136, 'min_samples_leaf': 73, 'criterion': 'gini'}.
Trial 5822 finished with value: 0.6956521739130435 and parameters: {'n_estimators': 307, 'max_depth': 14, 'min_samples_split': 41, 'min_samples_leaf': 61, 'criterion': 'entropy'}.
Trial 5823 finished with value: 0.717391304347826 and parameters: {'n_estimators': 789, 'max_depth': 8, 'min_samples_split': 116, 'min_samples_leaf': 52, 'criterion': 'gini'}.
Trial 5824 finished with value: 0.717391304347826 and parameters: {'n_estimators': 245, 'max_depth': 11, 'min_samples_split': 104, 'min_samples_leaf': 58, 'criterion': 'entropy'}.
Trial 5825 finished with value: 0.6956521739130435 and parameters: {'n_estimators': 263, 'max_depth': 16, 'min_samples_split': 33, 'min_samples_leaf': 62, 'criterion': 'gini'}.
Trial 5826 finished with value: 0.6630434782608695 and parameters: {'n_estimators': 293, 'max_depth': 6, 'min_samples_split': 54, 'min_samples_leaf': 67, 'criterion': 'entropy'}.
Trial 5827 finished with value: 0.7282608695652174 and parameters: {'n_estimators': 325, 'max_depth': 9, 'min_samples_split': 25, 'min_samples_leaf': 57, 'criterion': 'gini'}.
Trial 5828 finished with value: 0.7065217391304348 and parameters: {'n_estimators': 915, 'max_depth': 13, 'min_samples_split': 145, 'min_samples_leaf': 60, 'criterion': 'entropy'}.
Trial 5829 finished with value: 0.7065217391304348 and parameters: {'n_estimators': 176, 'max_depth': 11, 'min_samples_split': 21, 'min_samples_leaf': 55, 'criterion': 'gini'}.
Trial 5830 finished with value: 0.6739130434782609 and parameters: {'n_estimators': 275, 'max_depth': 33, 'min_samples_split': 127, 'min_samples_leaf': 70, 'criterion': 'entropy'}.
Trial 5831 finished with value: 0.6956521739130435 and parameters: {'n_estimators': 252, 'max_depth': 9, 'min_samples_split': 28, 'min_samples_leaf': 59, 'criterion': 'gini'}.
