Trial 185 finished with value: 0.7065217391304348 and parameters: {'n_estimators': 830, 'max_depth': 11, 'min_samples_split': 122, 'min_samples_leaf': 46, 'criterion': 'entropy'}.
Trial 186 finished with value: 0.6956521739130435 and parameters: {'n_estimators': 766, 'max_depth': 8, 'min_samples_split': 31, 'min_samples_leaf': 49, 'criterion': 'entropy'}.
Trial 187 finished with value: 0.717391304347826 and parameters: {'n_estimators': 801, 'max_depth': 13, 'min_samples_split': 39, 'min_samples_leaf': 51, 'criterion': 'entropy'}.
Trial 188 finished with value: 0.6847826086956522 and parameters: {'n_estimators': 697, 'max_depth': 9, 'min_samples_split': 27, 'min_samples_leaf': 53, 'criterion': 'entropy'}.
Trial 189 finished with value: 0.6739130434782609 and parameters: {'n_estimators': 821, 'max_depth': 18, 'min_samples_split': 44, 'min_samples_leaf': 56, 'criterion': 'entropy'}.
Trial 190 finished with value: 0.6847826086956522 and parameters: {'n_estimators': 843, 'max_depth': 12, 'min_samples_split': 21, 'min_samples_leaf': 42, 'criterion': 'entropy'}.
Trial 191 finished with value: 0.7282608695652174 and parameters: {'n_estimators': 741, 'max_depth': 10, 'min_samples_split': 35, 'min_samples_leaf': 58, 'criterion': 'entropy'}.
Trial 192 finished with value: 0.7065217391304348 and parameters: {'n_estimators': 747, 'max_depth': 10, 'min_samples_split': 33, 'min_samples_leaf': 59, 'criterion': 'entropy'}.
Trial 193 finished with value: 0.6739130434782609 and parameters: {'n_estimators': 728, 'max_depth': 6, 'min_samples_split': 35, 'min_samples_leaf': 57, 'criterion': 'entropy'}.
Trial 194 finished with value: 0.6847826086956522 and parameters: {'n_estimators': 784, 'max_depth': 12, 'min_samples_split': 29, 'min_samples_leaf': 62, 'criterion': 'entropy'}.
Trial 195 finished with value: 0.6956521739130435 and parameters: {'n_estimators': 768, 'max_depth': 15, 'min_samples_split': 23, 'min_samples_leaf': 49, 'criterion': 'entropy'}.
Trial 196 finished with value: 0.6956521739130435 and parameters: {'n_estimators': 714, 'max_depth': 8, 'min_samples_split': 36, 'min_samples_leaf': 51, 'criterion': 'entropy'}.
Trial 197 finished with value: 0.6956521739130435 and parameters: {'n_estimators': 807, 'max_depth': 10, 'min_samples_split': 16, 'min_samples_leaf': 55, 'criterion': 'entropy'}.
Trial 198 finished with value: 0.717391304347826 and parameters: {'n_estimators': 749, 'max_depth': 13, 'min_samples_split': 39, 'min_samples_leaf': 53, 'criterion': 'gini'}.
Trial 199 finished with value: 0.6847826086956522 and parameters: {'n_estimators': 784, 'max_depth': 16, 'min_samples_split': 25, 'min_samples_leaf': 46, 'criterion': 'entropy'}.
Trial 200 finished with value: 0.6413043478260869 and parameters: {'n_estimators': 864, 'max_depth': 5, 'min_samples_split': 31, 'min_samples_leaf': 58, 'criterion': 'entropy'}.
Trial 201 finished with value: 0.717391304347826 and parameters: {'n_estimators': 728, 'max_depth': 10, 'min_samples_split': 98, 'min_samples_leaf': 57, 'criterion': 'entropy'}.
Trial 202 finished with value: 0.7065217391304348 and parameters: {'n_estimators': 736, 'max_depth': 11, 'min_samples_split': 31, 'min_samples_leaf': 55, 'criterion': 'entropy'}.
Trial 203 finished with value: 0.717391304347826 and parameters: {'n_estimators': 761, 'max_depth': 8, 'min_samples_split': 41, 'min_samples_leaf': 61, 'criterion': 'entropy'}.
Trial 204 finished with value: 0.6195652173913043 and parameters: {'n_estimators': 818, 'max_depth': 14, 'min_samples_split': 27, 'min_samples_leaf': 9, 'criterion': 'entropy'}.
Trial 205 finished with value: 0.6847826086956522 and parameters: {'n_estimators': 797, 'max_depth': 31, 'min_samples_split': 36, 'min_samples_leaf': 51, 'criterion': 'entropy'}.
Trial 206 finished with value: 0.717391304347826 and parameters: {'n_estimators': 702, 'max_depth': 10, 'min_samples_split': 20, 'min_samples_leaf': 54, 'criterion': 'entropy'}.
Trial 207 finished with value: 0.6956521739130435 and parameters: {'n_estimators': 665, 'max_depth': 7, 'min_samples_split': 46, 'min_samples_leaf': 48, 'criterion': 'entropy'}.
Trial 208 finished with value: 0.7065217391304348 and parameters: {'n_estimators': 742, 'max_depth': 12, 'min_samples_split': 33, 'min_samples_leaf': 59, 'criterion': 'entropy'}.
Trial 209 finished with value: 0.717391304347826 and parameters: {'n_estimators': 777, 'max_depth': 9, 'min_samples_split': 156, 'min_samples_leaf': 52, 'criterion': 'entropy'}.
Trial 210 finished with value: 0.7065217391304348 and parameters: {'n_estimators': 834, 'max_depth': 13, 'min_samples_split': 23, 'min_samples_leaf': 65, 'criterion': 'entropy'}.
Trial 211 finished with value: 0.717391304347826 and parameters: {'n_estimators': 718, 'max_depth': 10, 'min_samples_split': 36, 'min_samples_leaf': 57, 'criterion': 'entropy'}.
Trial 212 finished with value: 0.717391304347826 and parameters: {'n_estimators': 757, 'max_depth': 11, 'min_samples_split': 29, 'min_samples_leaf': 56, 'criterion': 'entropy'}.
Trial 213 finished with value: 0.6847826086956522 and parameters: {'n_estimators': 688, 'max_depth': 12, 'min_samples_split': 40, 'min_samples_leaf': 60, 'criterion': 'entropy'}.
Trial 214 finished with value: 0.6847826086956522 and parameters: {'n_estimators': 727, 'max_depth': 8, 'min_samples_split': 13, 'min_samples_leaf': 50, 'criterion': 'entropy'}.
Trial 215 finished with value: 0.6739130434782609 and parameters: {'n_estimators': 802, 'max_depth': 73, 'min_samples_split': 27, 'min_samples_leaf': 53, 'criterion': 'entropy'}.
Trial 216 finished with value: 0.6847826086956522 and parameters: {'n_estimators': 773, 'max_depth': 15, 'min_samples_split': 175, 'min_samples_leaf': 57, 'criterion': 'entropy'}.
Trial 217 finished with value: 0.6956521739130435 and parameters: {'n_estimators': 743, 'max_depth': 11, 'min_samples_split': 33, 'min_samples_leaf': 48, 'criterion': 'entropy'}.
Trial 218 finished with value: 0.7065217391304348 and parameters: {'n_estimators': 708, 'max_depth': 7, 'min_samples_split': 18, 'min_samples_leaf': 63, 'criterion': 'entropy'}.
Trial 219 finished with value: 0.6847826086956522 and parameters: {'n_estimators': 820, 'max_depth': 14, 'min_samples_split': 82, 'min_samples_leaf': 54, 'criterion': 'entropy'}.
Trial 220 finished with value: 0.6847826086956522 and parameters: {'n_estimators': 790, 'max_depth': 94, 'min_samples_split': 23, 'min_samples_leaf': 51, 'criterion': 'entropy'}.
Trial 221 finished with value: 0.7282608695652174 and parameters: {'n_estimators': 796, 'max_depth': 13, 'min_samples_split': 36, 'min_samples_leaf': 48, 'criterion': 'entropy'}.
Trial 222 finished with value: 0.6739130434782609 and parameters: {'n_estimators': 847, 'max_depth': 49, 'min_samples_split': 141, 'min_samples_leaf': 49, 'criterion': 'entropy'}.
Trial 223 finished with value: 0.7065217391304348 and parameters: {'n_estimators': 760, 'max_depth': 12, 'min_samples_split': 31, 'min_samples_leaf': 45, 'criterion': 'entropy'}.
Trial 224 finished with value: 0.717391304347826 and parameters: {'n_estimators': 811, 'max_depth': 9, 'min_samples_split': 37, 'min_samples_leaf': 47, 'criterion': 'entropy'}.
Trial 225 finished with value: 0.7065217391304348 and parameters: {'n_estimators': 791, 'max_depth': 13, 'min_samples_split': 43, 'min_samples_leaf': 52, 'criterion': 'entropy'}.
Trial 226 finished with value: 0.7282608695652174 and parameters: {'n_estimators': 833, 'max_depth': 10, 'min_samples_split': 35, 'min_samples_leaf': 50, 'criterion': 'entropy'}.
Trial 227 finished with value: 0.7282608695652174 and parameters: {'n_estimators': 846, 'max_depth': 10, 'min_samples_split': 29, 'min_samples_leaf': 49, 'criterion': 'entropy'}.
Trial 228 finished with value: 0.6630434782608695 and parameters: {'n_estimators': 860, 'max_depth': 16, 'min_samples_split': 27, 'min_samples_leaf': 50, 'criterion': 'entropy'}.
Trial 229 finished with value: 0.6847826086956522 and parameters: {'n_estimators': 836, 'max_depth': 9, 'min_samples_split': 25, 'min_samples_leaf': 44, 'criterion': 'entropy'}.
Trial 230 finished with value: 0.6739130434782609 and parameters: {'n_estimators': 881, 'max_depth': 6, 'min_samples_split': 30, 'min_samples_leaf': 47, 'criterion': 'gini'}.
Trial 231 finished with value: 0.717391304347826 and parameters: {'n_estimators': 827, 'max_depth': 11, 'min_samples_split': 34, 'min_samples_leaf': 49, 'criterion': 'entropy'}.
Trial 232 finished with value: 0.6739130434782609 and parameters: {'n_estimators': 850, 'max_depth': 9, 'min_samples_split': 38, 'min_samples_leaf': 51, 'criterion': 'entropy'}.
Trial 233 finished with value: 0.717391304347826 and parameters: {'n_estimators': 812, 'max_depth': 13, 'min_samples_split': 30, 'min_samples_leaf': 53, 'criterion': 'entropy'}.
Trial 234 finished with value: 0.7282608695652174 and parameters: {'n_estimators': 597, 'max_depth': 10, 'min_samples_split': 21, 'min_samples_leaf': 50, 'criterion': 'entropy'}.
Trial 235 finished with value: 0.6847826086956522 and parameters: {'n_estimators': 512, 'max_depth': 11, 'min_samples_split': 21, 'min_samples_leaf': 48, 'criterion': 'entropy'}.
Trial 236 finished with value: 0.7065217391304348 and parameters: {'n_estimators': 632, 'max_depth': 14, 'min_samples_split': 16, 'min_samples_leaf': 46, 'criterion': 'entropy'}.
Trial 237 finished with value: 0.6847826086956522 and parameters: {'n_estimators': 594, 'max_depth': 8, 'min_samples_split': 20, 'min_samples_leaf': 49, 'criterion': 'entropy'}.
Trial 238 finished with value: 0.717391304347826 and parameters: {'n_estimators': 622, 'max_depth': 10, 'min_samples_split': 27, 'min_samples_leaf': 51, 'criterion': 'entropy'}.
Trial 239 finished with value: 0.7065217391304348 and parameters: {'n_estimators': 837, 'max_depth': 12, 'min_samples_split': 23, 'min_samples_leaf': 50, 'criterion': 'entropy'}.
Trial 240 finished with value: 0.6956521739130435 and parameters: {'n_estimators': 605, 'max_depth': 7, 'min_samples_split': 13, 'min_samples_leaf': 54, 'criterion': 'entropy'}.
Trial 241 finished with value: 0.7282608695652174 and parameters: {'n_estimators': 807, 'max_depth': 10, 'min_samples_split': 34, 'min_samples_leaf': 52, 'criterion': 'entropy'}.
Trial 242 finished with value: 0.7282608695652174 and parameters: {'n_estimators': 539, 'max_depth': 10, 'min_samples_split': 33, 'min_samples_leaf': 52, 'criterion': 'entropy'}.
Trial 243 finished with value: 0.7282608695652174 and parameters: {'n_estimators': 558, 'max_depth': 10, 'min_samples_split': 36, 'min_samples_leaf': 52, 'criterion': 'entropy'}.
Trial 244 finished with value: 0.7065217391304348 and parameters: {'n_estimators': 541, 'max_depth': 9, 'min_samples_split': 38, 'min_samples_leaf': 52, 'criterion': 'entropy'}.
Trial 245 finished with value: 0.6847826086956522 and parameters: {'n_estimators': 814, 'max_depth': 11, 'min_samples_split': 34, 'min_samples_leaf': 52, 'criterion': 'entropy'}.
Trial 246 finished with value: 0.717391304347826 and parameters: {'n_estimators': 531, 'max_depth': 8, 'min_samples_split': 42, 'min_samples_leaf': 54, 'criterion': 'entropy'}.
Trial 247 finished with value: 0.717391304347826 and parameters: {'n_estimators': 541, 'max_depth': 10, 'min_samples_split': 27, 'min_samples_leaf': 50, 'criterion': 'entropy'}.
Trial 248 finished with value: 0.6630434782608695 and parameters: {'n_estimators': 556, 'max_depth': 6, 'min_samples_split': 18, 'min_samples_leaf': 48, 'criterion': 'entropy'}.
Trial 249 finished with value: 0.7065217391304348 and parameters: {'n_estimators': 478, 'max_depth': 13, 'min_samples_split': 24, 'min_samples_leaf': 52, 'criterion': 'entropy'}.
Trial 250 finished with value: 0.717391304347826 and parameters: {'n_estimators': 827, 'max_depth': 11, 'min_samples_split': 188, 'min_samples_leaf': 55, 'criterion': 'entropy'}.
Trial 251 finished with value: 0.6847826086956522 and parameters: {'n_estimators': 499, 'max_depth': 8, 'min_samples_split': 31, 'min_samples_leaf': 50, 'criterion': 'entropy'}.
Trial 252 finished with value: 0.717391304347826 and parameters: {'n_estimators': 806, 'max_depth': 15, 'min_samples_split': 36, 'min_samples_leaf': 46, 'criterion': 'entropy'}.
Trial 253 finished with value: 0.7065217391304348 and parameters: {'n_estimators': 564, 'max_depth': 12, 'min_samples_split': 28, 'min_samples_leaf': 53, 'criterion': 'entropy'}.
Trial 254 finished with value: 0.7065217391304348 and parameters: {'n_estimators': 588, 'max_depth': 10, 'min_samples_split': 40, 'min_samples_leaf': 49, 'criterion': 'entropy'}.
Trial 255 finished with value: 0.7065217391304348 and parameters: {'n_estimators': 584, 'max_depth': 14, 'min_samples_split': 23, 'min_samples_leaf': 51, 'criterion': 'entropy'}.
Trial 256 finished with value: 0.6413043478260869 and parameters: {'n_estimators': 871, 'max_depth': 5, 'min_samples_split': 48, 'min_samples_leaf': 55, 'criterion': 'entropy'}.
Trial 257 finished with value: 0.6956521739130435 and parameters: {'n_estimators': 558, 'max_depth': 8, 'min_samples_split': 15, 'min_samples_leaf': 47, 'criterion': 'entropy'}.
Trial 258 finished with value: 0.7065217391304348 and parameters: {'n_estimators': 524, 'max_depth': 12, 'min_samples_split': 32, 'min_samples_leaf': 53, 'criterion': 'entropy'}.
Trial 259 finished with value: 0.717391304347826 and parameters: {'n_estimators': 850, 'max_depth': 10, 'min_samples_split': 20, 'min_samples_leaf': 51, 'criterion': 'entropy'}.
Trial 260 finished with value: 0.6739130434782609 and parameters: {'n_estimators': 571, 'max_depth': 7, 'min_samples_split': 8, 'min_samples_leaf': 44, 'criterion': 'gini'}.
Trial 261 finished with value: 0.7282608695652174 and parameters: {'n_estimators': 802, 'max_depth': 13, 'min_samples_split': 34, 'min_samples_leaf': 48, 'criterion': 'entropy'}.
Trial 262 finished with value: 0.717391304347826 and parameters: {'n_estimators': 787, 'max_depth': 9, 'min_samples_split': 36, 'min_samples_leaf': 48, 'criterion': 'entropy'}.
Trial 263 finished with value: 0.6956521739130435 and parameters: {'n_estimators': 827, 'max_depth': 17, 'min_samples_split': 42, 'min_samples_leaf': 46, 'criterion': 'entropy'}.
Trial 264 finished with value: 0.717391304347826 and parameters: {'n_estimators': 792, 'max_depth': 14, 'min_samples_split': 34, 'min_samples_leaf': 49, 'criterion': 'entropy'}.
Trial 265 finished with value: 0.7065217391304348 and parameters: {'n_estimators': 811, 'max_depth': 11, 'min_samples_split': 29, 'min_samples_leaf': 45, 'criterion': 'entropy'}.
Trial 266 finished with value: 0.7065217391304348 and parameters: {'n_estimators': 940, 'max_depth': 12, 'min_samples_split': 40, 'min_samples_leaf': 48, 'criterion': 'entropy'}.
Trial 267 finished with value: 0.6847826086956522 and parameters: {'n_estimators': 771, 'max_depth': 60, 'min_samples_split': 32, 'min_samples_leaf': 51, 'criterion': 'entropy'}.
Trial 268 finished with value: 0.717391304347826 and parameters: {'n_estimators': 841, 'max_depth': 9, 'min_samples_split': 26, 'min_samples_leaf': 55, 'criterion': 'entropy'}.
Trial 269 finished with value: 0.6630434782608695 and parameters: {'n_estimators': 798, 'max_depth': 16, 'min_samples_split': 36, 'min_samples_leaf': 50, 'criterion': 'entropy'}.
Trial 270 finished with value: 0.6630434782608695 and parameters: {'n_estimators': 899, 'max_depth': 7, 'min_samples_split': 29, 'min_samples_leaf': 42, 'criterion': 'entropy'}.
Trial 271 finished with value: 0.7065217391304348 and parameters: {'n_estimators': 826, 'max_depth': 10, 'min_samples_split': 38, 'min_samples_leaf': 53, 'criterion': 'entropy'}.
Trial 272 finished with value: 0.7065217391304348 and parameters: {'n_estimators': 779, 'max_depth': 13, 'min_samples_split': 32, 'min_samples_leaf': 47, 'criterion': 'entropy'}.
Trial 273 finished with value: 0.7065217391304348 and parameters: {'n_estimators': 802, 'max_depth': 12, 'min_samples_split': 46, 'min_samples_leaf': 56, 'criterion': 'entropy'}.
Trial 274 finished with value: 0.6630434782608695 and parameters: {'n_estimators': 649, 'max_depth': 15, 'min_samples_split': 25, 'min_samples_leaf': 50, 'criterion': 'entropy'}.
Trial 275 finished with value: 0.6739130434782609 and parameters: {'n_estimators': 862, 'max_depth': 9, 'min_samples_split': 18, 'min_samples_leaf': 52, 'criterion': 'entropy'}.
Trial 276 finished with value: 0.6739130434782609 and parameters: {'n_estimators': 238, 'max_depth': 6, 'min_samples_split': 166, 'min_samples_leaf': 48, 'criterion': 'entropy'}.
Trial 277 finished with value: 0.7065217391304348 and parameters: {'n_estimators': 852, 'max_depth': 10, 'min_samples_split': 10, 'min_samples_leaf': 54, 'criterion': 'entropy'}.
Trial 278 finished with value: 0.7065217391304348 and parameters: {'n_estimators': 819, 'max_depth': 14, 'min_samples_split': 53, 'min_samples_leaf': 45, 'criterion': 'entropy'}.
Trial 279 finished with value: 0.717391304347826 and parameters: {'n_estimators': 606, 'max_depth': 11, 'min_samples_split': 34, 'min_samples_leaf': 52, 'criterion': 'gini'}.
Trial 280 finished with value: 0.7282608695652174 and parameters: {'n_estimators': 804, 'max_depth': 8, 'min_samples_split': 105, 'min_samples_leaf': 58, 'criterion': 'entropy'}.
Trial 281 finished with value: 0.6521739130434783 and parameters: {'n_estimators': 760, 'max_depth': 5, 'min_samples_split': 43, 'min_samples_leaf': 59, 'criterion': 'entropy'}.
Trial 282 finished with value: 0.7065217391304348 and parameters: {'n_estimators': 782, 'max_depth': 7, 'min_samples_split': 38, 'min_samples_leaf': 86, 'criterion': 'entropy'}.
Trial 283 finished with value: 0.7282608695652174 and parameters: {'n_estimators': 797, 'max_depth': 8, 'min_samples_split': 28, 'min_samples_leaf': 58, 'criterion': 'entropy'}.
Trial 284 finished with value: 0.717391304347826 and parameters: {'n_estimators': 509, 'max_depth': 8, 'min_samples_split': 125, 'min_samples_leaf': 61, 'criterion': 'entropy'}.
Trial 285 finished with value: 0.6847826086956522 and parameters: {'n_estimators': 399, 'max_depth': 7, 'min_samples_split': 28, 'min_samples_leaf': 58, 'criterion': 'entropy'}.
Trial 286 finished with value: 0.717391304347826 and parameters: {'n_estimators': 801, 'max_depth': 9, 'min_samples_split': 111, 'min_samples_leaf': 56, 'criterion': 'entropy'}.
Trial 287 finished with value: 0.6739130434782609 and parameters: {'n_estimators': 837, 'max_depth': 5, 'min_samples_split': 23, 'min_samples_leaf': 95, 'criterion': 'entropy'}.
Trial 288 finished with value: 0.717391304347826 and parameters: {'n_estimators': 802, 'max_depth': 8, 'min_samples_split': 68, 'min_samples_leaf': 60, 'criterion': 'entropy'}.
Trial 289 finished with value: 0.6847826086956522 and parameters: {'n_estimators': 780, 'max_depth': 10, 'min_samples_split': 149, 'min_samples_leaf': 58, 'criterion': 'entropy'}.
Trial 290 finished with value: 0.6847826086956522 and parameters: {'n_estimators': 816, 'max_depth': 43, 'min_samples_split': 78, 'min_samples_leaf': 56, 'criterion': 'entropy'}.
Trial 291 finished with value: 0.717391304347826 and parameters: {'n_estimators': 831, 'max_depth': 11, 'min_samples_split': 30, 'min_samples_leaf': 62, 'criterion': 'entropy'}.
Trial 292 finished with value: 0.6956521739130435 and parameters: {'n_estimators': 794, 'max_depth': 7, 'min_samples_split': 133, 'min_samples_leaf': 58, 'criterion': 'entropy'}.
Trial 293 finished with value: 0.717391304347826 and parameters: {'n_estimators': 885, 'max_depth': 9, 'min_samples_split': 26, 'min_samples_leaf': 55, 'criterion': 'entropy'}.
Trial 294 finished with value: 0.6847826086956522 and parameters: {'n_estimators': 769, 'max_depth': 11, 'min_samples_split': 89, 'min_samples_leaf': 48, 'criterion': 'entropy'}.
Trial 295 finished with value: 0.7065217391304348 and parameters: {'n_estimators': 851, 'max_depth': 8, 'min_samples_split': 142, 'min_samples_leaf': 54, 'criterion': 'entropy'}.
Trial 296 finished with value: 0.7065217391304348 and parameters: {'n_estimators': 819, 'max_depth': 12, 'min_samples_split': 59, 'min_samples_leaf': 50, 'criterion': 'entropy'}.
Trial 297 finished with value: 0.6413043478260869 and parameters: {'n_estimators': 797, 'max_depth': 5, 'min_samples_split': 32, 'min_samples_leaf': 43, 'criterion': 'entropy'}.
Trial 298 finished with value: 0.7282608695652174 and parameters: {'n_estimators': 547, 'max_depth': 10, 'min_samples_split': 23, 'min_samples_leaf': 52, 'criterion': 'entropy'}.
Trial 299 finished with value: 0.6956521739130435 and parameters: {'n_estimators': 552, 'max_depth': 9, 'min_samples_split': 106, 'min_samples_leaf': 46, 'criterion': 'entropy'}.
Trial 300 finished with value: 0.6521739130434783 and parameters: {'n_estimators': 526, 'max_depth': 7, 'min_samples_split': 20, 'min_samples_leaf': 52, 'criterion': 'gini'}.
Trial 301 finished with value: 0.717391304347826 and parameters: {'n_estimators': 543, 'max_depth': 10, 'min_samples_split': 105, 'min_samples_leaf': 50, 'criterion': 'entropy'}.
Trial 302 finished with value: 0.6847826086956522 and parameters: {'n_estimators': 566, 'max_depth': 11, 'min_samples_split': 94, 'min_samples_leaf': 48, 'criterion': 'entropy'}.
Trial 303 finished with value: 0.6847826086956522 and parameters: {'n_estimators': 867, 'max_depth': 7, 'min_samples_split': 24, 'min_samples_leaf': 53, 'criterion': 'entropy'}.
Trial 304 finished with value: 0.6956521739130435 and parameters: {'n_estimators': 830, 'max_depth': 9, 'min_samples_split': 113, 'min_samples_leaf': 40, 'criterion': 'entropy'}.
Trial 305 finished with value: 0.6956521739130435 and parameters: {'n_estimators': 809, 'max_depth': 13, 'min_samples_split': 98, 'min_samples_leaf': 46, 'criterion': 'entropy'}.
Trial 306 finished with value: 0.717391304347826 and parameters: {'n_estimators': 782, 'max_depth': 11, 'min_samples_split': 15, 'min_samples_leaf': 50, 'criterion': 'entropy'}.
Trial 307 finished with value: 0.6413043478260869 and parameters: {'n_estimators': 842, 'max_depth': 5, 'min_samples_split': 28, 'min_samples_leaf': 51, 'criterion': 'entropy'}.
