Trial 130 finished with value: 0.5543478260869565 and parameters: {'n_estimators': 792, 'max_depth': 64, 'min_samples_split': 166, 'min_samples_leaf': 100, 'criterion': 'entropy'}.
Trial 131 finished with value: 0.5652173913043478 and parameters: {'n_estimators': 304, 'max_depth': 70, 'min_samples_split': 161, 'min_samples_leaf': 97, 'criterion': 'entropy'}.
Trial 132 finished with value: 0.532608695652174 and parameters: {'n_estimators': 352, 'max_depth': 68, 'min_samples_split': 169, 'min_samples_leaf': 93, 'criterion': 'entropy'}.
Trial 133 finished with value: 0.5434782608695652 and parameters: {'n_estimators': 312, 'max_depth': 73, 'min_samples_split': 186, 'min_samples_leaf': 88, 'criterion': 'entropy'}.
Trial 134 finished with value: 0.5652173913043478 and parameters: {'n_estimators': 330, 'max_depth': 61, 'min_samples_split': 179, 'min_samples_leaf': 97, 'criterion': 'entropy'}.
Trial 135 finished with value: 0.5543478260869565 and parameters: {'n_estimators': 281, 'max_depth': 76, 'min_samples_split': 167, 'min_samples_leaf': 91, 'criterion': 'entropy'}.
Trial 136 finished with value: 0.5543478260869565 and parameters: {'n_estimators': 397, 'max_depth': 67, 'min_samples_split': 175, 'min_samples_leaf': 95, 'criterion': 'entropy'}.
Trial 137 finished with value: 0.5543478260869565 and parameters: {'n_estimators': 369, 'max_depth': 73, 'min_samples_split': 156, 'min_samples_leaf': 94, 'criterion': 'gini'}.
Trial 138 finished with value: 0.5217391304347826 and parameters: {'n_estimators': 347, 'max_depth': 64, 'min_samples_split': 63, 'min_samples_leaf': 90, 'criterion': 'entropy'}.
Trial 139 finished with value: 0.5543478260869565 and parameters: {'n_estimators': 315, 'max_depth': 79, 'min_samples_split': 184, 'min_samples_leaf': 98, 'criterion': 'entropy'}.
Trial 140 finished with value: 0.5652173913043478 and parameters: {'n_estimators': 298, 'max_depth': 71, 'min_samples_split': 191, 'min_samples_leaf': 96, 'criterion': 'entropy'}.
Trial 141 finished with value: 0.532608695652174 and parameters: {'n_estimators': 325, 'max_depth': 68, 'min_samples_split': 175, 'min_samples_leaf': 100, 'criterion': 'entropy'}.
Trial 142 finished with value: 0.5434782608695652 and parameters: {'n_estimators': 337, 'max_depth': 65, 'min_samples_split': 172, 'min_samples_leaf': 93, 'criterion': 'entropy'}.
Trial 143 finished with value: 0.5652173913043478 and parameters: {'n_estimators': 272, 'max_depth': 69, 'min_samples_split': 161, 'min_samples_leaf': 96, 'criterion': 'entropy'}.
Trial 144 finished with value: 0.5652173913043478 and parameters: {'n_estimators': 414, 'max_depth': 74, 'min_samples_split': 197, 'min_samples_leaf': 97, 'criterion': 'entropy'}.
Trial 145 finished with value: 0.532608695652174 and parameters: {'n_estimators': 357, 'max_depth': 67, 'min_samples_split': 172, 'min_samples_leaf': 93, 'criterion': 'entropy'}.
Trial 146 finished with value: 0.5543478260869565 and parameters: {'n_estimators': 294, 'max_depth': 83, 'min_samples_split': 180, 'min_samples_leaf': 95, 'criterion': 'entropy'}.
Trial 147 finished with value: 0.5434782608695652 and parameters: {'n_estimators': 321, 'max_depth': 72, 'min_samples_split': 187, 'min_samples_leaf': 99, 'criterion': 'gini'}.
Trial 148 finished with value: 0.532608695652174 and parameters: {'n_estimators': 390, 'max_depth': 70, 'min_samples_split': 176, 'min_samples_leaf': 85, 'criterion': 'entropy'}.
Trial 149 finished with value: 0.532608695652174 and parameters: {'n_estimators': 343, 'max_depth': 62, 'min_samples_split': 165, 'min_samples_leaf': 91, 'criterion': 'entropy'}.
Trial 150 finished with value: 0.532608695652174 and parameters: {'n_estimators': 381, 'max_depth': 58, 'min_samples_split': 196, 'min_samples_leaf': 100, 'criterion': 'entropy'}.
Trial 151 finished with value: 0.5652173913043478 and parameters: {'n_estimators': 308, 'max_depth': 77, 'min_samples_split': 177, 'min_samples_leaf': 97, 'criterion': 'entropy'}.
Trial 152 finished with value: 0.5652173913043478 and parameters: {'n_estimators': 290, 'max_depth': 78, 'min_samples_split': 169, 'min_samples_leaf': 96, 'criterion': 'entropy'}.
Trial 153 finished with value: 0.5543478260869565 and parameters: {'n_estimators': 313, 'max_depth': 84, 'min_samples_split': 174, 'min_samples_leaf': 95, 'criterion': 'entropy'}.
Trial 154 finished with value: 0.5434782608695652 and parameters: {'n_estimators': 333, 'max_depth': 76, 'min_samples_split': 191, 'min_samples_leaf': 92, 'criterion': 'entropy'}.
Trial 155 finished with value: 0.532608695652174 and parameters: {'n_estimators': 358, 'max_depth': 75, 'min_samples_split': 182, 'min_samples_leaf': 88, 'criterion': 'entropy'}.
Trial 156 finished with value: 0.5652173913043478 and parameters: {'n_estimators': 256, 'max_depth': 65, 'min_samples_split': 185, 'min_samples_leaf': 98, 'criterion': 'entropy'}.
Trial 157 finished with value: 0.532608695652174 and parameters: {'n_estimators': 277, 'max_depth': 49, 'min_samples_split': 193, 'min_samples_leaf': 96, 'criterion': 'gini'}.
Trial 158 finished with value: 0.5543478260869565 and parameters: {'n_estimators': 329, 'max_depth': 73, 'min_samples_split': 168, 'min_samples_leaf': 94, 'criterion': 'entropy'}.
Trial 159 finished with value: 0.532608695652174 and parameters: {'n_estimators': 302, 'max_depth': 70, 'min_samples_split': 177, 'min_samples_leaf': 46, 'criterion': 'entropy'}.
Trial 160 finished with value: 0.5434782608695652 and parameters: {'n_estimators': 370, 'max_depth': 68, 'min_samples_split': 188, 'min_samples_leaf': 100, 'criterion': 'entropy'}.
Trial 161 finished with value: 0.5652173913043478 and parameters: {'n_estimators': 303, 'max_depth': 70, 'min_samples_split': 160, 'min_samples_leaf': 97, 'criterion': 'entropy'}.
Trial 162 finished with value: 0.5543478260869565 and parameters: {'n_estimators': 347, 'max_depth': 72, 'min_samples_split': 171, 'min_samples_leaf': 98, 'criterion': 'entropy'}.
Trial 163 finished with value: 0.5434782608695652 and parameters: {'n_estimators': 311, 'max_depth': 66, 'min_samples_split': 162, 'min_samples_leaf': 93, 'criterion': 'entropy'}.
Trial 164 finished with value: 0.5652173913043478 and parameters: {'n_estimators': 289, 'max_depth': 69, 'min_samples_split': 174, 'min_samples_leaf': 96, 'criterion': 'entropy'}.
Trial 165 finished with value: 0.5108695652173914 and parameters: {'n_estimators': 332, 'max_depth': 56, 'min_samples_split': 181, 'min_samples_leaf': 90, 'criterion': 'entropy'}.
Trial 166 finished with value: 0.5434782608695652 and parameters: {'n_estimators': 358, 'max_depth': 63, 'min_samples_split': 165, 'min_samples_leaf': 49, 'criterion': 'entropy'}.
Trial 167 finished with value: 0.5434782608695652 and parameters: {'n_estimators': 318, 'max_depth': 75, 'min_samples_split': 183, 'min_samples_leaf': 94, 'criterion': 'gini'}.
Trial 168 finished with value: 0.5652173913043478 and parameters: {'n_estimators': 409, 'max_depth': 78, 'min_samples_split': 112, 'min_samples_leaf': 97, 'criterion': 'entropy'}.
Trial 169 finished with value: 0.5434782608695652 and parameters: {'n_estimators': 341, 'max_depth': 71, 'min_samples_split': 178, 'min_samples_leaf': 100, 'criterion': 'entropy'}.
Trial 170 finished with value: 0.5543478260869565 and parameters: {'n_estimators': 265, 'max_depth': 60, 'min_samples_split': 199, 'min_samples_leaf': 98, 'criterion': 'entropy'}.
Trial 171 finished with value: 0.5652173913043478 and parameters: {'n_estimators': 328, 'max_depth': 62, 'min_samples_split': 170, 'min_samples_leaf': 96, 'criterion': 'entropy'}.
Trial 172 finished with value: 0.532608695652174 and parameters: {'n_estimators': 936, 'max_depth': 53, 'min_samples_split': 179, 'min_samples_leaf': 92, 'criterion': 'entropy'}.
Trial 173 finished with value: 0.5543478260869565 and parameters: {'n_estimators': 373, 'max_depth': 67, 'min_samples_split': 174, 'min_samples_leaf': 95, 'criterion': 'entropy'}.
Trial 174 finished with value: 0.5652173913043478 and parameters: {'n_estimators': 299, 'max_depth': 61, 'min_samples_split': 41, 'min_samples_leaf': 98, 'criterion': 'entropy'}.
Trial 175 finished with value: 0.5652173913043478 and parameters: {'n_estimators': 330, 'max_depth': 69, 'min_samples_split': 189, 'min_samples_leaf': 97, 'criterion': 'entropy'}.
Trial 176 finished with value: 0.5217391304347826 and parameters: {'n_estimators': 355, 'max_depth': 65, 'min_samples_split': 163, 'min_samples_leaf': 92, 'criterion': 'entropy'}.
Trial 177 finished with value: 0.532608695652174 and parameters: {'n_estimators': 396, 'max_depth': 74, 'min_samples_split': 185, 'min_samples_leaf': 100, 'criterion': 'gini'}.
Trial 178 finished with value: 0.5543478260869565 and parameters: {'n_estimators': 314, 'max_depth': 72, 'min_samples_split': 157, 'min_samples_leaf': 94, 'criterion': 'entropy'}.
Trial 179 finished with value: 0.5543478260869565 and parameters: {'n_estimators': 732, 'max_depth': 57, 'min_samples_split': 179, 'min_samples_leaf': 98, 'criterion': 'entropy'}.
Trial 180 finished with value: 0.532608695652174 and parameters: {'n_estimators': 289, 'max_depth': 67, 'min_samples_split': 194, 'min_samples_leaf': 90, 'criterion': 'entropy'}.
Trial 181 finished with value: 0.532608695652174 and parameters: {'n_estimators': 302, 'max_depth': 71, 'min_samples_split': 191, 'min_samples_leaf': 43, 'criterion': 'entropy'}.
Trial 182 finished with value: 0.5652173913043478 and parameters: {'n_estimators': 343, 'max_depth': 69, 'min_samples_split': 192, 'min_samples_leaf': 96, 'criterion': 'entropy'}.
Trial 183 finished with value: 0.5543478260869565 and parameters: {'n_estimators': 316, 'max_depth': 73, 'min_samples_split': 168, 'min_samples_leaf': 95, 'criterion': 'entropy'}.
Trial 184 finished with value: 0.5652173913043478 and parameters: {'n_estimators': 279, 'max_depth': 76, 'min_samples_split': 185, 'min_samples_leaf': 97, 'criterion': 'entropy'}.
Trial 185 finished with value: 0.5434782608695652 and parameters: {'n_estimators': 299, 'max_depth': 64, 'min_samples_split': 200, 'min_samples_leaf': 93, 'criterion': 'entropy'}.
Trial 186 finished with value: 0.5434782608695652 and parameters: {'n_estimators': 332, 'max_depth': 81, 'min_samples_split': 173, 'min_samples_leaf': 100, 'criterion': 'entropy'}.
Trial 187 finished with value: 0.5652173913043478 and parameters: {'n_estimators': 380, 'max_depth': 54, 'min_samples_split': 181, 'min_samples_leaf': 95, 'criterion': 'entropy'}.
Trial 188 finished with value: 0.5434782608695652 and parameters: {'n_estimators': 354, 'max_depth': 71, 'min_samples_split': 195, 'min_samples_leaf': 98, 'criterion': 'gini'}.
Trial 189 finished with value: 0.5652173913043478 and parameters: {'n_estimators': 322, 'max_depth': 68, 'min_samples_split': 187, 'min_samples_leaf': 96, 'criterion': 'entropy'}.
Trial 190 finished with value: 0.5434782608695652 and parameters: {'n_estimators': 276, 'max_depth': 86, 'min_samples_split': 177, 'min_samples_leaf': 92, 'criterion': 'entropy'}.
Trial 191 finished with value: 0.5217391304347826 and parameters: {'n_estimators': 244, 'max_depth': 69, 'min_samples_split': 162, 'min_samples_leaf': 47, 'criterion': 'entropy'}.
Trial 192 finished with value: 0.5652173913043478 and parameters: {'n_estimators': 268, 'max_depth': 71, 'min_samples_split': 169, 'min_samples_leaf': 96, 'criterion': 'entropy'}.
Trial 193 finished with value: 0.5543478260869565 and parameters: {'n_estimators': 290, 'max_depth': 66, 'min_samples_split': 152, 'min_samples_leaf': 94, 'criterion': 'entropy'}.
Trial 194 finished with value: 0.5217391304347826 and parameters: {'n_estimators': 304, 'max_depth': 74, 'min_samples_split': 159, 'min_samples_leaf': 50, 'criterion': 'entropy'}.
Trial 195 finished with value: 0.5652173913043478 and parameters: {'n_estimators': 339, 'max_depth': 70, 'min_samples_split': 166, 'min_samples_leaf': 97, 'criterion': 'entropy'}.
Trial 196 finished with value: 0.5434782608695652 and parameters: {'n_estimators': 364, 'max_depth': 67, 'min_samples_split': 175, 'min_samples_leaf': 99, 'criterion': 'entropy'}.
Trial 197 finished with value: 0.5652173913043478 and parameters: {'n_estimators': 317, 'max_depth': 73, 'min_samples_split': 191, 'min_samples_leaf': 95, 'criterion': 'entropy'}.
Trial 198 finished with value: 0.5543478260869565 and parameters: {'n_estimators': 266, 'max_depth': 78, 'min_samples_split': 172, 'min_samples_leaf': 100, 'criterion': 'entropy'}.
Trial 199 finished with value: 0.5543478260869565 and parameters: {'n_estimators': 341, 'max_depth': 60, 'min_samples_split': 182, 'min_samples_leaf': 98, 'criterion': 'entropy'}.
Trial 200 finished with value: 0.532608695652174 and parameters: {'n_estimators': 293, 'max_depth': 64, 'min_samples_split': 164, 'min_samples_leaf': 93, 'criterion': 'gini'}.
Trial 201 finished with value: 0.5652173913043478 and parameters: {'n_estimators': 425, 'max_depth': 75, 'min_samples_split': 198, 'min_samples_leaf': 96, 'criterion': 'entropy'}.
Trial 202 finished with value: 0.5434782608695652 and parameters: {'n_estimators': 398, 'max_depth': 72, 'min_samples_split': 196, 'min_samples_leaf': 98, 'criterion': 'entropy'}.
Trial 203 finished with value: 0.5652173913043478 and parameters: {'n_estimators': 327, 'max_depth': 69, 'min_samples_split': 189, 'min_samples_leaf': 96, 'criterion': 'entropy'}.
Trial 204 finished with value: 0.5434782608695652 and parameters: {'n_estimators': 666, 'max_depth': 51, 'min_samples_split': 197, 'min_samples_leaf': 45, 'criterion': 'entropy'}.
Trial 205 finished with value: 0.5652173913043478 and parameters: {'n_estimators': 407, 'max_depth': 76, 'min_samples_split': 194, 'min_samples_leaf': 97, 'criterion': 'entropy'}.
Trial 206 finished with value: 0.5543478260869565 and parameters: {'n_estimators': 419, 'max_depth': 74, 'min_samples_split': 200, 'min_samples_leaf': 94, 'criterion': 'entropy'}.
Trial 207 finished with value: 0.5434782608695652 and parameters: {'n_estimators': 370, 'max_depth': 66, 'min_samples_split': 178, 'min_samples_leaf': 100, 'criterion': 'entropy'}.
Trial 208 finished with value: 0.5434782608695652 and parameters: {'n_estimators': 446, 'max_depth': 70, 'min_samples_split': 187, 'min_samples_leaf': 91, 'criterion': 'entropy'}.
Trial 209 finished with value: 0.5543478260869565 and parameters: {'n_estimators': 310, 'max_depth': 79, 'min_samples_split': 170, 'min_samples_leaf': 98, 'criterion': 'entropy'}.
Trial 210 finished with value: 0.5543478260869565 and parameters: {'n_estimators': 348, 'max_depth': 68, 'min_samples_split': 182, 'min_samples_leaf': 94, 'criterion': 'entropy'}.
Trial 211 finished with value: 0.5652173913043478 and parameters: {'n_estimators': 308, 'max_depth': 77, 'min_samples_split': 176, 'min_samples_leaf': 97, 'criterion': 'entropy'}.
Trial 212 finished with value: 0.5652173913043478 and parameters: {'n_estimators': 320, 'max_depth': 73, 'min_samples_split': 174, 'min_samples_leaf': 96, 'criterion': 'entropy'}.
Trial 213 finished with value: 0.5543478260869565 and parameters: {'n_estimators': 282, 'max_depth': 77, 'min_samples_split': 167, 'min_samples_leaf': 98, 'criterion': 'entropy'}.
Trial 214 finished with value: 0.5652173913043478 and parameters: {'n_estimators': 306, 'max_depth': 71, 'min_samples_split': 190, 'min_samples_leaf': 96, 'criterion': 'entropy'}.
Trial 215 finished with value: 0.5434782608695652 and parameters: {'n_estimators': 331, 'max_depth': 74, 'min_samples_split': 179, 'min_samples_leaf': 93, 'criterion': 'entropy'}.
Trial 216 finished with value: 0.532608695652174 and parameters: {'n_estimators': 385, 'max_depth': 76, 'min_samples_split': 185, 'min_samples_leaf': 100, 'criterion': 'gini'}.
Trial 217 finished with value: 0.5543478260869565 and parameters: {'n_estimators': 768, 'max_depth': 80, 'min_samples_split': 173, 'min_samples_leaf': 95, 'criterion': 'entropy'}.
Trial 218 finished with value: 0.5217391304347826 and parameters: {'n_estimators': 354, 'max_depth': 69, 'min_samples_split': 194, 'min_samples_leaf': 42, 'criterion': 'entropy'}.
Trial 219 finished with value: 0.5652173913043478 and parameters: {'n_estimators': 291, 'max_depth': 72, 'min_samples_split': 161, 'min_samples_leaf': 98, 'criterion': 'entropy'}.
Trial 220 finished with value: 0.532608695652174 and parameters: {'n_estimators': 333, 'max_depth': 65, 'min_samples_split': 178, 'min_samples_leaf': 91, 'criterion': 'entropy'}.
Trial 221 finished with value: 0.5652173913043478 and parameters: {'n_estimators': 292, 'max_depth': 79, 'min_samples_split': 169, 'min_samples_leaf': 97, 'criterion': 'entropy'}.
Trial 222 finished with value: 0.5652173913043478 and parameters: {'n_estimators': 255, 'max_depth': 78, 'min_samples_split': 166, 'min_samples_leaf': 95, 'criterion': 'entropy'}.
Trial 223 finished with value: 0.5652173913043478 and parameters: {'n_estimators': 278, 'max_depth': 75, 'min_samples_split': 171, 'min_samples_leaf': 96, 'criterion': 'entropy'}.
Trial 224 finished with value: 0.5434782608695652 and parameters: {'n_estimators': 610, 'max_depth': 68, 'min_samples_split': 175, 'min_samples_leaf': 93, 'criterion': 'entropy'}.
Trial 225 finished with value: 0.5434782608695652 and parameters: {'n_estimators': 310, 'max_depth': 82, 'min_samples_split': 168, 'min_samples_leaf': 99, 'criterion': 'entropy'}.
Trial 226 finished with value: 0.5652173913043478 and parameters: {'n_estimators': 299, 'max_depth': 77, 'min_samples_split': 184, 'min_samples_leaf': 97, 'criterion': 'entropy'}.
Trial 227 finished with value: 0.5652173913043478 and parameters: {'n_estimators': 324, 'max_depth': 71, 'min_samples_split': 191, 'min_samples_leaf': 95, 'criterion': 'entropy'}.
Trial 228 finished with value: 0.5434782608695652 and parameters: {'n_estimators': 346, 'max_depth': 63, 'min_samples_split': 179, 'min_samples_leaf': 100, 'criterion': 'gini'}.
Trial 229 finished with value: 0.5543478260869565 and parameters: {'n_estimators': 314, 'max_depth': 74, 'min_samples_split': 171, 'min_samples_leaf': 94, 'criterion': 'entropy'}.
Trial 230 finished with value: 0.5108695652173914 and parameters: {'n_estimators': 367, 'max_depth': 67, 'min_samples_split': 160, 'min_samples_leaf': 52, 'criterion': 'entropy'}.
Trial 231 finished with value: 0.5652173913043478 and parameters: {'n_estimators': 255, 'max_depth': 65, 'min_samples_split': 187, 'min_samples_leaf': 98, 'criterion': 'entropy'}.
Trial 232 finished with value: 0.5652173913043478 and parameters: {'n_estimators': 275, 'max_depth': 48, 'min_samples_split': 183, 'min_samples_leaf': 97, 'criterion': 'entropy'}.
Trial 233 finished with value: 0.5543478260869565 and parameters: {'n_estimators': 225, 'max_depth': 62, 'min_samples_split': 176, 'min_samples_leaf': 98, 'criterion': 'entropy'}.
Trial 234 finished with value: 0.5652173913043478 and parameters: {'n_estimators': 253, 'max_depth': 70, 'min_samples_split': 196, 'min_samples_leaf': 96, 'criterion': 'entropy'}.
Trial 235 finished with value: 0.5652173913043478 and parameters: {'n_estimators': 288, 'max_depth': 65, 'min_samples_split': 192, 'min_samples_leaf': 48, 'criterion': 'entropy'}.
Trial 236 finished with value: 0.5434782608695652 and parameters: {'n_estimators': 332, 'max_depth': 67, 'min_samples_split': 181, 'min_samples_leaf': 99, 'criterion': 'entropy'}.
Trial 237 finished with value: 0.5543478260869565 and parameters: {'n_estimators': 831, 'max_depth': 69, 'min_samples_split': 186, 'min_samples_leaf': 94, 'criterion': 'entropy'}.
Trial 238 finished with value: 0.5652173913043478 and parameters: {'n_estimators': 267, 'max_depth': 73, 'min_samples_split': 164, 'min_samples_leaf': 96, 'criterion': 'entropy'}.
Trial 239 finished with value: 0.5217391304347826 and parameters: {'n_estimators': 301, 'max_depth': 57, 'min_samples_split': 173, 'min_samples_leaf': 92, 'criterion': 'entropy'}.
Trial 240 finished with value: 0.5434782608695652 and parameters: {'n_estimators': 322, 'max_depth': 60, 'min_samples_split': 190, 'min_samples_leaf': 100, 'criterion': 'entropy'}.
Trial 241 finished with value: 0.5108695652173914 and parameters: {'n_estimators': 303, 'max_depth': 70, 'min_samples_split': 158, 'min_samples_leaf': 77, 'criterion': 'entropy'}.
Trial 242 finished with value: 0.5652173913043478 and parameters: {'n_estimators': 305, 'max_depth': 71, 'min_samples_split': 119, 'min_samples_leaf': 97, 'criterion': 'entropy'}.
Trial 243 finished with value: 0.5543478260869565 and parameters: {'n_estimators': 337, 'max_depth': 67, 'min_samples_split': 162, 'min_samples_leaf': 98, 'criterion': 'entropy'}.
Trial 244 finished with value: 0.5652173913043478 and parameters: {'n_estimators': 285, 'max_depth': 69, 'min_samples_split': 169, 'min_samples_leaf': 96, 'criterion': 'entropy'}.
Trial 245 finished with value: 0.5543478260869565 and parameters: {'n_estimators': 315, 'max_depth': 75, 'min_samples_split': 153, 'min_samples_leaf': 94, 'criterion': 'entropy'}.
Trial 246 finished with value: 0.5543478260869565 and parameters: {'n_estimators': 352, 'max_depth': 72, 'min_samples_split': 147, 'min_samples_leaf': 96, 'criterion': 'gini'}.
Trial 247 finished with value: 0.5543478260869565 and parameters: {'n_estimators': 295, 'max_depth': 66, 'min_samples_split': 166, 'min_samples_leaf': 98, 'criterion': 'entropy'}.
Trial 248 finished with value: 0.5543478260869565 and parameters: {'n_estimators': 317, 'max_depth': 68, 'min_samples_split': 175, 'min_samples_leaf': 98, 'criterion': 'entropy'}.
Trial 249 finished with value: 0.5652173913043478 and parameters: {'n_estimators': 339, 'max_depth': 78, 'min_samples_split': 196, 'min_samples_leaf': 44, 'criterion': 'entropy'}.
Trial 250 finished with value: 0.5543478260869565 and parameters: {'n_estimators': 269, 'max_depth': 70, 'min_samples_split': 104, 'min_samples_leaf': 100, 'criterion': 'entropy'}.
Trial 251 finished with value: 0.5543478260869565 and parameters: {'n_estimators': 381, 'max_depth': 53, 'min_samples_split': 179, 'min_samples_leaf': 95, 'criterion': 'entropy'}.
