Trial 6200 finished with value: 0.6739130434782609 and parameters: {'n_estimators': 268, 'max_depth': 12, 'min_samples_split': 38, 'min_samples_leaf': 76, 'criterion': 'entropy'}.
Trial 6201 finished with value: 0.7282608695652174 and parameters: {'n_estimators': 327, 'max_depth': 9, 'min_samples_split': 33, 'min_samples_leaf': 57, 'criterion': 'entropy'}.
Trial 6202 finished with value: 0.6956521739130435 and parameters: {'n_estimators': 516, 'max_depth': 11, 'min_samples_split': 21, 'min_samples_leaf': 69, 'criterion': 'entropy'}.
Trial 6203 finished with value: 0.6630434782608695 and parameters: {'n_estimators': 425, 'max_depth': 15, 'min_samples_split': 50, 'min_samples_leaf': 59, 'criterion': 'entropy'}.
Trial 6204 finished with value: 0.6739130434782609 and parameters: {'n_estimators': 755, 'max_depth': 7, 'min_samples_split': 28, 'min_samples_leaf': 55, 'criterion': 'entropy'}.
Trial 6205 finished with value: 0.6956521739130435 and parameters: {'n_estimators': 718, 'max_depth': 9, 'min_samples_split': 41, 'min_samples_leaf': 60, 'criterion': 'entropy'}.
Trial 6206 finished with value: 0.6956521739130435 and parameters: {'n_estimators': 298, 'max_depth': 12, 'min_samples_split': 36, 'min_samples_leaf': 53, 'criterion': 'entropy'}.
Trial 6207 finished with value: 0.6847826086956522 and parameters: {'n_estimators': 261, 'max_depth': 17, 'min_samples_split': 10, 'min_samples_leaf': 57, 'criterion': 'entropy'}.
Trial 6208 finished with value: 0.6956521739130435 and parameters: {'n_estimators': 280, 'max_depth': 10, 'min_samples_split': 31, 'min_samples_leaf': 74, 'criterion': 'entropy'}.
Trial 6209 finished with value: 0.717391304347826 and parameters: {'n_estimators': 792, 'max_depth': 8, 'min_samples_split': 120, 'min_samples_leaf': 58, 'criterion': 'entropy'}.
Trial 6210 finished with value: 0.6956521739130435 and parameters: {'n_estimators': 262, 'max_depth': 20, 'min_samples_split': 110, 'min_samples_leaf': 56, 'criterion': 'entropy'}.
Trial 6211 finished with value: 0.717391304347826 and parameters: {'n_estimators': 314, 'max_depth': 14, 'min_samples_split': 25, 'min_samples_leaf': 60, 'criterion': 'entropy'}.
Trial 6212 finished with value: 0.6847826086956522 and parameters: {'n_estimators': 294, 'max_depth': 6, 'min_samples_split': 18, 'min_samples_leaf': 52, 'criterion': 'entropy'}.
Trial 6213 finished with value: 0.7065217391304348 and parameters: {'n_estimators': 730, 'max_depth': 11, 'min_samples_split': 33, 'min_samples_leaf': 71, 'criterion': 'entropy'}.
Trial 6214 finished with value: 0.6956521739130435 and parameters: {'n_estimators': 165, 'max_depth': 9, 'min_samples_split': 41, 'min_samples_leaf': 68, 'criterion': 'entropy'}.
Trial 6215 finished with value: 0.6630434782608695 and parameters: {'n_estimators': 691, 'max_depth': 39, 'min_samples_split': 45, 'min_samples_leaf': 54, 'criterion': 'entropy'}.
Trial 6216 finished with value: 0.6739130434782609 and parameters: {'n_estimators': 281, 'max_depth': 13, 'min_samples_split': 27, 'min_samples_leaf': 77, 'criterion': 'entropy'}.
Trial 6217 finished with value: 0.6413043478260869 and parameters: {'n_estimators': 256, 'max_depth': 5, 'min_samples_split': 36, 'min_samples_leaf': 59, 'criterion': 'entropy'}.
Trial 6218 finished with value: 0.7065217391304348 and parameters: {'n_estimators': 976, 'max_depth': 11, 'min_samples_split': 22, 'min_samples_leaf': 56, 'criterion': 'entropy'}.
Trial 6219 finished with value: 0.7282608695652174 and parameters: {'n_estimators': 338, 'max_depth': 8, 'min_samples_split': 30, 'min_samples_leaf': 58, 'criterion': 'entropy'}.
Trial 6220 finished with value: 0.6739130434782609 and parameters: {'n_estimators': 754, 'max_depth': 16, 'min_samples_split': 115, 'min_samples_leaf': 60, 'criterion': 'entropy'}.
Trial 6221 finished with value: 0.6956521739130435 and parameters: {'n_estimators': 776, 'max_depth': 12, 'min_samples_split': 39, 'min_samples_leaf': 74, 'criterion': 'entropy'}.
Trial 6222 finished with value: 0.717391304347826 and parameters: {'n_estimators': 308, 'max_depth': 9, 'min_samples_split': 32, 'min_samples_leaf': 71, 'criterion': 'entropy'}.
Trial 6223 finished with value: 0.6630434782608695 and parameters: {'n_estimators': 276, 'max_depth': 14, 'min_samples_split': 26, 'min_samples_leaf': 67, 'criterion': 'entropy'}.
Trial 6224 finished with value: 0.6956521739130435 and parameters: {'n_estimators': 301, 'max_depth': 7, 'min_samples_split': 127, 'min_samples_leaf': 54, 'criterion': 'entropy'}.
Trial 6225 finished with value: 0.7065217391304348 and parameters: {'n_estimators': 262, 'max_depth': 10, 'min_samples_split': 36, 'min_samples_leaf': 57, 'criterion': 'entropy'}.
Trial 6226 finished with value: 0.7282608695652174 and parameters: {'n_estimators': 323, 'max_depth': 12, 'min_samples_split': 122, 'min_samples_leaf': 60, 'criterion': 'entropy'}.
Trial 6227 finished with value: 0.6739130434782609 and parameters: {'n_estimators': 739, 'max_depth': 7, 'min_samples_split': 22, 'min_samples_leaf': 55, 'criterion': 'entropy'}.
Trial 6228 finished with value: 0.717391304347826 and parameters: {'n_estimators': 288, 'max_depth': 10, 'min_samples_split': 16, 'min_samples_leaf': 58, 'criterion': 'entropy'}.
Trial 6229 finished with value: 0.6739130434782609 and parameters: {'n_estimators': 252, 'max_depth': 15, 'min_samples_split': 30, 'min_samples_leaf': 61, 'criterion': 'entropy'}.
Trial 6230 finished with value: 0.6739130434782609 and parameters: {'n_estimators': 205, 'max_depth': 13, 'min_samples_split': 34, 'min_samples_leaf': 52, 'criterion': 'entropy'}.
Trial 6231 finished with value: 0.6521739130434783 and parameters: {'n_estimators': 272, 'max_depth': 18, 'min_samples_split': 42, 'min_samples_leaf': 56, 'criterion': 'entropy'}.
Trial 6232 finished with value: 0.7065217391304348 and parameters: {'n_estimators': 797, 'max_depth': 8, 'min_samples_split': 26, 'min_samples_leaf': 73, 'criterion': 'entropy'}.
Trial 6233 finished with value: 0.6847826086956522 and parameters: {'n_estimators': 352, 'max_depth': 11, 'min_samples_split': 45, 'min_samples_leaf': 79, 'criterion': 'entropy'}.
Trial 6234 finished with value: 0.6304347826086957 and parameters: {'n_estimators': 145, 'max_depth': 5, 'min_samples_split': 38, 'min_samples_leaf': 69, 'criterion': 'entropy'}.
Trial 6235 finished with value: 0.6956521739130435 and parameters: {'n_estimators': 765, 'max_depth': 9, 'min_samples_split': 32, 'min_samples_leaf': 58, 'criterion': 'entropy'}.
Trial 6236 finished with value: 0.6739130434782609 and parameters: {'n_estimators': 704, 'max_depth': 12, 'min_samples_split': 68, 'min_samples_leaf': 60, 'criterion': 'entropy'}.
Trial 6237 finished with value: 0.6956521739130435 and parameters: {'n_estimators': 293, 'max_depth': 14, 'min_samples_split': 29, 'min_samples_leaf': 75, 'criterion': 'entropy'}.
Trial 6238 finished with value: 0.6630434782608695 and parameters: {'n_estimators': 316, 'max_depth': 7, 'min_samples_split': 21, 'min_samples_leaf': 54, 'criterion': 'entropy'}.
Trial 6239 finished with value: 0.7065217391304348 and parameters: {'n_estimators': 248, 'max_depth': 10, 'min_samples_split': 37, 'min_samples_leaf': 57, 'criterion': 'entropy'}.
Trial 6240 finished with value: 0.6739130434782609 and parameters: {'n_estimators': 272, 'max_depth': 16, 'min_samples_split': 24, 'min_samples_leaf': 59, 'criterion': 'entropy'}.
Trial 6241 finished with value: 0.717391304347826 and parameters: {'n_estimators': 379, 'max_depth': 10, 'min_samples_split': 33, 'min_samples_leaf': 52, 'criterion': 'entropy'}.
Trial 6242 finished with value: 0.6956521739130435 and parameters: {'n_estimators': 918, 'max_depth': 13, 'min_samples_split': 50, 'min_samples_leaf': 67, 'criterion': 'entropy'}.
Trial 6243 finished with value: 0.717391304347826 and parameters: {'n_estimators': 301, 'max_depth': 8, 'min_samples_split': 19, 'min_samples_leaf': 71, 'criterion': 'entropy'}.
Trial 6244 finished with value: 0.6847826086956522 and parameters: {'n_estimators': 286, 'max_depth': 6, 'min_samples_split': 40, 'min_samples_leaf': 56, 'criterion': 'entropy'}.
Trial 6245 finished with value: 0.717391304347826 and parameters: {'n_estimators': 578, 'max_depth': 11, 'min_samples_split': 26, 'min_samples_leaf': 61, 'criterion': 'entropy'}.
Trial 6246 finished with value: 0.6956521739130435 and parameters: {'n_estimators': 730, 'max_depth': 9, 'min_samples_split': 124, 'min_samples_leaf': 58, 'criterion': 'entropy'}.
Trial 6247 finished with value: 0.7065217391304348 and parameters: {'n_estimators': 634, 'max_depth': 12, 'min_samples_split': 14, 'min_samples_leaf': 55, 'criterion': 'entropy'}.
Trial 6248 finished with value: 0.7065217391304348 and parameters: {'n_estimators': 333, 'max_depth': 14, 'min_samples_split': 36, 'min_samples_leaf': 61, 'criterion': 'entropy'}.
Trial 6249 finished with value: 0.717391304347826 and parameters: {'n_estimators': 261, 'max_depth': 8, 'min_samples_split': 30, 'min_samples_leaf': 59, 'criterion': 'entropy'}.
Trial 6250 finished with value: 0.7065217391304348 and parameters: {'n_estimators': 669, 'max_depth': 11, 'min_samples_split': 115, 'min_samples_leaf': 72, 'criterion': 'entropy'}.
Trial 6251 finished with value: 0.6847826086956522 and parameters: {'n_estimators': 751, 'max_depth': 6, 'min_samples_split': 33, 'min_samples_leaf': 57, 'criterion': 'entropy'}.
Trial 6252 finished with value: 0.6956521739130435 and parameters: {'n_estimators': 239, 'max_depth': 15, 'min_samples_split': 43, 'min_samples_leaf': 54, 'criterion': 'entropy'}.
Trial 6253 finished with value: 0.6847826086956522 and parameters: {'n_estimators': 774, 'max_depth': 10, 'min_samples_split': 30, 'min_samples_leaf': 76, 'criterion': 'entropy'}.
Trial 6254 finished with value: 0.6956521739130435 and parameters: {'n_estimators': 314, 'max_depth': 13, 'min_samples_split': 127, 'min_samples_leaf': 62, 'criterion': 'entropy'}.
Trial 6255 finished with value: 0.6739130434782609 and parameters: {'n_estimators': 282, 'max_depth': 17, 'min_samples_split': 119, 'min_samples_leaf': 69, 'criterion': 'entropy'}.
Trial 6256 finished with value: 0.717391304347826 and parameters: {'n_estimators': 263, 'max_depth': 9, 'min_samples_split': 26, 'min_samples_leaf': 65, 'criterion': 'entropy'}.
Trial 6257 finished with value: 0.6521739130434783 and parameters: {'n_estimators': 214, 'max_depth': 7, 'min_samples_split': 38, 'min_samples_leaf': 51, 'criterion': 'entropy'}.
Trial 6258 finished with value: 0.6847826086956522 and parameters: {'n_estimators': 183, 'max_depth': 11, 'min_samples_split': 19, 'min_samples_leaf': 84, 'criterion': 'entropy'}.
Trial 6259 finished with value: 0.6304347826086957 and parameters: {'n_estimators': 296, 'max_depth': 5, 'min_samples_split': 34, 'min_samples_leaf': 60, 'criterion': 'entropy'}.
Trial 6260 finished with value: 0.6847826086956522 and parameters: {'n_estimators': 245, 'max_depth': 13, 'min_samples_split': 28, 'min_samples_leaf': 56, 'criterion': 'entropy'}.
Trial 6261 finished with value: 0.7065217391304348 and parameters: {'n_estimators': 273, 'max_depth': 9, 'min_samples_split': 48, 'min_samples_leaf': 58, 'criterion': 'entropy'}.
Trial 6262 finished with value: 0.6956521739130435 and parameters: {'n_estimators': 717, 'max_depth': 12, 'min_samples_split': 111, 'min_samples_leaf': 73, 'criterion': 'entropy'}.
Trial 6263 finished with value: 0.6413043478260869 and parameters: {'n_estimators': 886, 'max_depth': 58, 'min_samples_split': 97, 'min_samples_leaf': 19, 'criterion': 'entropy'}.
Trial 6264 finished with value: 0.6847826086956522 and parameters: {'n_estimators': 296, 'max_depth': 15, 'min_samples_split': 41, 'min_samples_leaf': 63, 'criterion': 'entropy'}.
Trial 6265 finished with value: 0.6739130434782609 and parameters: {'n_estimators': 792, 'max_depth': 19, 'min_samples_split': 9, 'min_samples_leaf': 59, 'criterion': 'entropy'}.
Trial 6266 finished with value: 0.6630434782608695 and parameters: {'n_estimators': 318, 'max_depth': 7, 'min_samples_split': 23, 'min_samples_leaf': 55, 'criterion': 'entropy'}.
Trial 6267 finished with value: 0.717391304347826 and parameters: {'n_estimators': 341, 'max_depth': 10, 'min_samples_split': 35, 'min_samples_leaf': 61, 'criterion': 'entropy'}.
Trial 6268 finished with value: 0.7065217391304348 and parameters: {'n_estimators': 764, 'max_depth': 8, 'min_samples_split': 59, 'min_samples_leaf': 53, 'criterion': 'entropy'}.
Trial 6269 finished with value: 0.7065217391304348 and parameters: {'n_estimators': 254, 'max_depth': 12, 'min_samples_split': 130, 'min_samples_leaf': 57, 'criterion': 'entropy'}.
Trial 6270 finished with value: 0.6956521739130435 and parameters: {'n_estimators': 741, 'max_depth': 10, 'min_samples_split': 28, 'min_samples_leaf': 67, 'criterion': 'entropy'}.
Trial 6271 finished with value: 0.717391304347826 and parameters: {'n_estimators': 280, 'max_depth': 14, 'min_samples_split': 32, 'min_samples_leaf': 60, 'criterion': 'entropy'}.
Trial 6272 finished with value: 0.6956521739130435 and parameters: {'n_estimators': 228, 'max_depth': 8, 'min_samples_split': 45, 'min_samples_leaf': 70, 'criterion': 'entropy'}.
Trial 6273 finished with value: 0.6630434782608695 and parameters: {'n_estimators': 300, 'max_depth': 5, 'min_samples_split': 37, 'min_samples_leaf': 64, 'criterion': 'entropy'}.
Trial 6274 finished with value: 0.7282608695652174 and parameters: {'n_estimators': 272, 'max_depth': 11, 'min_samples_split': 103, 'min_samples_leaf': 58, 'criterion': 'entropy'}.
Trial 6275 finished with value: 0.6739130434782609 and parameters: {'n_estimators': 250, 'max_depth': 16, 'min_samples_split': 23, 'min_samples_leaf': 75, 'criterion': 'entropy'}.
Trial 6276 finished with value: 0.6739130434782609 and parameters: {'n_estimators': 313, 'max_depth': 13, 'min_samples_split': 40, 'min_samples_leaf': 56, 'criterion': 'entropy'}.
Trial 6277 finished with value: 0.717391304347826 and parameters: {'n_estimators': 288, 'max_depth': 9, 'min_samples_split': 30, 'min_samples_leaf': 62, 'criterion': 'entropy'}.
Trial 6278 finished with value: 0.6521739130434783 and parameters: {'n_estimators': 262, 'max_depth': 7, 'min_samples_split': 19, 'min_samples_leaf': 54, 'criterion': 'entropy'}.
Trial 6279 finished with value: 0.717391304347826 and parameters: {'n_estimators': 780, 'max_depth': 11, 'min_samples_split': 89, 'min_samples_leaf': 58, 'criterion': 'entropy'}.
Trial 6280 finished with value: 0.6956521739130435 and parameters: {'n_estimators': 360, 'max_depth': 9, 'min_samples_split': 35, 'min_samples_leaf': 60, 'criterion': 'entropy'}.
Trial 6281 finished with value: 0.7065217391304348 and parameters: {'n_estimators': 238, 'max_depth': 12, 'min_samples_split': 14, 'min_samples_leaf': 51, 'criterion': 'entropy'}.
Trial 6282 finished with value: 0.6847826086956522 and parameters: {'n_estimators': 753, 'max_depth': 15, 'min_samples_split': 26, 'min_samples_leaf': 72, 'criterion': 'entropy'}.
Trial 6283 finished with value: 0.6956521739130435 and parameters: {'n_estimators': 328, 'max_depth': 7, 'min_samples_split': 120, 'min_samples_leaf': 78, 'criterion': 'entropy'}.
Trial 6284 finished with value: 0.7282608695652174 and parameters: {'n_estimators': 284, 'max_depth': 10, 'min_samples_split': 2, 'min_samples_leaf': 56, 'criterion': 'entropy'}.
Trial 6285 finished with value: 0.7065217391304348 and parameters: {'n_estimators': 796, 'max_depth': 13, 'min_samples_split': 32, 'min_samples_leaf': 66, 'criterion': 'entropy'}.
Trial 6286 finished with value: 0.717391304347826 and parameters: {'n_estimators': 699, 'max_depth': 11, 'min_samples_split': 125, 'min_samples_leaf': 62, 'criterion': 'entropy'}.
Trial 6287 finished with value: 0.6739130434782609 and parameters: {'n_estimators': 728, 'max_depth': 17, 'min_samples_split': 85, 'min_samples_leaf': 81, 'criterion': 'entropy'}.
Trial 6288 finished with value: 0.717391304347826 and parameters: {'n_estimators': 310, 'max_depth': 8, 'min_samples_split': 41, 'min_samples_leaf': 59, 'criterion': 'entropy'}.
Trial 6289 finished with value: 0.6630434782608695 and parameters: {'n_estimators': 263, 'max_depth': 6, 'min_samples_split': 24, 'min_samples_leaf': 54, 'criterion': 'entropy'}.
Trial 6290 finished with value: 0.6739130434782609 and parameters: {'n_estimators': 221, 'max_depth': 14, 'min_samples_split': 37, 'min_samples_leaf': 69, 'criterion': 'entropy'}.
Trial 6291 finished with value: 0.6086956521739131 and parameters: {'n_estimators': 398, 'max_depth': 9, 'min_samples_split': 28, 'min_samples_leaf': 7, 'criterion': 'entropy'}.
Trial 6292 finished with value: 0.7065217391304348 and parameters: {'n_estimators': 279, 'max_depth': 12, 'min_samples_split': 33, 'min_samples_leaf': 57, 'criterion': 'entropy'}.
Trial 6293 finished with value: 0.6521739130434783 and parameters: {'n_estimators': 125, 'max_depth': 10, 'min_samples_split': 45, 'min_samples_leaf': 74, 'criterion': 'entropy'}.
Trial 6294 finished with value: 0.6739130434782609 and parameters: {'n_estimators': 304, 'max_depth': 5, 'min_samples_split': 129, 'min_samples_leaf': 64, 'criterion': 'entropy'}.
Trial 6295 finished with value: 0.7282608695652174 and parameters: {'n_estimators': 252, 'max_depth': 8, 'min_samples_split': 18, 'min_samples_leaf': 60, 'criterion': 'entropy'}.
Trial 6296 finished with value: 0.6630434782608695 and parameters: {'n_estimators': 772, 'max_depth': 21, 'min_samples_split': 22, 'min_samples_leaf': 52, 'criterion': 'entropy'}.
Trial 6297 finished with value: 0.6956521739130435 and parameters: {'n_estimators': 271, 'max_depth': 13, 'min_samples_split': 38, 'min_samples_leaf': 56, 'criterion': 'entropy'}.
Trial 6298 finished with value: 0.7282608695652174 and parameters: {'n_estimators': 297, 'max_depth': 11, 'min_samples_split': 27, 'min_samples_leaf': 61, 'criterion': 'entropy'}.
Trial 6299 finished with value: 0.6956521739130435 and parameters: {'n_estimators': 244, 'max_depth': 7, 'min_samples_split': 31, 'min_samples_leaf': 58, 'criterion': 'entropy'}.
Trial 6300 finished with value: 0.6956521739130435 and parameters: {'n_estimators': 336, 'max_depth': 15, 'min_samples_split': 35, 'min_samples_leaf': 55, 'criterion': 'entropy'}.
Trial 6301 finished with value: 0.7065217391304348 and parameters: {'n_estimators': 202, 'max_depth': 10, 'min_samples_split': 29, 'min_samples_leaf': 67, 'criterion': 'entropy'}.
Trial 6302 finished with value: 0.6956521739130435 and parameters: {'n_estimators': 744, 'max_depth': 12, 'min_samples_split': 116, 'min_samples_leaf': 63, 'criterion': 'entropy'}.
Trial 6303 finished with value: 0.717391304347826 and parameters: {'n_estimators': 280, 'max_depth': 8, 'min_samples_split': 40, 'min_samples_leaf': 71, 'criterion': 'entropy'}.
Trial 6304 finished with value: 0.6847826086956522 and parameters: {'n_estimators': 322, 'max_depth': 67, 'min_samples_split': 24, 'min_samples_leaf': 59, 'criterion': 'entropy'}.
Trial 6305 finished with value: 0.6956521739130435 and parameters: {'n_estimators': 262, 'max_depth': 14, 'min_samples_split': 107, 'min_samples_leaf': 57, 'criterion': 'entropy'}.
Trial 6306 finished with value: 0.6739130434782609 and parameters: {'n_estimators': 293, 'max_depth': 17, 'min_samples_split': 33, 'min_samples_leaf': 53, 'criterion': 'entropy'}.
Trial 6307 finished with value: 0.7065217391304348 and parameters: {'n_estimators': 761, 'max_depth': 10, 'min_samples_split': 131, 'min_samples_leaf': 61, 'criterion': 'entropy'}.
Trial 6308 finished with value: 0.6847826086956522 and parameters: {'n_estimators': 270, 'max_depth': 6, 'min_samples_split': 37, 'min_samples_leaf': 76, 'criterion': 'entropy'}.
Trial 6309 finished with value: 0.7065217391304348 and parameters: {'n_estimators': 718, 'max_depth': 9, 'min_samples_split': 43, 'min_samples_leaf': 73, 'criterion': 'entropy'}.
Trial 6310 finished with value: 0.6521739130434783 and parameters: {'n_estimators': 230, 'max_depth': 73, 'min_samples_split': 31, 'min_samples_leaf': 65, 'criterion': 'entropy'}.
Trial 6311 finished with value: 0.6956521739130435 and parameters: {'n_estimators': 466, 'max_depth': 12, 'min_samples_split': 21, 'min_samples_leaf': 58, 'criterion': 'entropy'}.
Trial 6312 finished with value: 0.6956521739130435 and parameters: {'n_estimators': 950, 'max_depth': 11, 'min_samples_split': 124, 'min_samples_leaf': 55, 'criterion': 'entropy'}.
Trial 6313 finished with value: 0.6956521739130435 and parameters: {'n_estimators': 308, 'max_depth': 15, 'min_samples_split': 14, 'min_samples_leaf': 60, 'criterion': 'entropy'}.
Trial 6314 finished with value: 0.7065217391304348 and parameters: {'n_estimators': 783, 'max_depth': 8, 'min_samples_split': 27, 'min_samples_leaf': 70, 'criterion': 'entropy'}.
Trial 6315 finished with value: 0.7065217391304348 and parameters: {'n_estimators': 926, 'max_depth': 13, 'min_samples_split': 113, 'min_samples_leaf': 62, 'criterion': 'entropy'}.
Trial 6316 finished with value: 0.7065217391304348 and parameters: {'n_estimators': 444, 'max_depth': 10, 'min_samples_split': 48, 'min_samples_leaf': 58, 'criterion': 'entropy'}.
Trial 6317 finished with value: 0.6521739130434783 and parameters: {'n_estimators': 253, 'max_depth': 5, 'min_samples_split': 36, 'min_samples_leaf': 54, 'criterion': 'entropy'}.
Trial 6318 finished with value: 0.6739130434782609 and parameters: {'n_estimators': 289, 'max_depth': 7, 'min_samples_split': 54, 'min_samples_leaf': 56, 'criterion': 'entropy'}.
Trial 6319 finished with value: 0.6630434782608695 and parameters: {'n_estimators': 738, 'max_depth': 18, 'min_samples_split': 31, 'min_samples_leaf': 60, 'criterion': 'entropy'}.
Trial 6320 finished with value: 0.6847826086956522 and parameters: {'n_estimators': 178, 'max_depth': 9, 'min_samples_split': 120, 'min_samples_leaf': 64, 'criterion': 'entropy'}.
Trial 6321 finished with value: 0.6630434782608695 and parameters: {'n_estimators': 348, 'max_depth': 24, 'min_samples_split': 26, 'min_samples_leaf': 52, 'criterion': 'entropy'}.
