Trial 4602 finished with value: 0.717391304347826 and parameters: {'n_estimators': 327, 'max_depth': 10, 'min_samples_split': 32, 'min_samples_leaf': 65, 'criterion': 'entropy'}.
Trial 4603 finished with value: 0.6956521739130435 and parameters: {'n_estimators': 292, 'max_depth': 12, 'min_samples_split': 133, 'min_samples_leaf': 75, 'criterion': 'gini'}.
Trial 4604 finished with value: 0.6847826086956522 and parameters: {'n_estimators': 276, 'max_depth': 7, 'min_samples_split': 29, 'min_samples_leaf': 55, 'criterion': 'entropy'}.
Trial 4605 finished with value: 0.6739130434782609 and parameters: {'n_estimators': 246, 'max_depth': 15, 'min_samples_split': 43, 'min_samples_leaf': 60, 'criterion': 'gini'}.
Trial 4606 finished with value: 0.6847826086956522 and parameters: {'n_estimators': 689, 'max_depth': 9, 'min_samples_split': 142, 'min_samples_leaf': 85, 'criterion': 'entropy'}.
Trial 4607 finished with value: 0.717391304347826 and parameters: {'n_estimators': 750, 'max_depth': 11, 'min_samples_split': 23, 'min_samples_leaf': 63, 'criterion': 'gini'}.
Trial 4608 finished with value: 0.6304347826086957 and parameters: {'n_estimators': 730, 'max_depth': 5, 'min_samples_split': 121, 'min_samples_leaf': 57, 'criterion': 'entropy'}.
Trial 4609 finished with value: 0.717391304347826 and parameters: {'n_estimators': 257, 'max_depth': 13, 'min_samples_split': 39, 'min_samples_leaf': 59, 'criterion': 'gini'}.
Trial 4610 finished with value: 0.6956521739130435 and parameters: {'n_estimators': 302, 'max_depth': 9, 'min_samples_split': 14, 'min_samples_leaf': 69, 'criterion': 'entropy'}.
Trial 4611 finished with value: 0.6847826086956522 and parameters: {'n_estimators': 981, 'max_depth': 7, 'min_samples_split': 149, 'min_samples_leaf': 61, 'criterion': 'gini'}.
Trial 4612 finished with value: 0.7282608695652174 and parameters: {'n_estimators': 356, 'max_depth': 11, 'min_samples_split': 130, 'min_samples_leaf': 57, 'criterion': 'entropy'}.
Trial 4613 finished with value: 0.6630434782608695 and parameters: {'n_estimators': 234, 'max_depth': 14, 'min_samples_split': 137, 'min_samples_leaf': 66, 'criterion': 'entropy'}.
Trial 4614 finished with value: 0.7065217391304348 and parameters: {'n_estimators': 330, 'max_depth': 8, 'min_samples_split': 100, 'min_samples_leaf': 59, 'criterion': 'gini'}.
Trial 4615 finished with value: 0.6739130434782609 and parameters: {'n_estimators': 290, 'max_depth': 25, 'min_samples_split': 34, 'min_samples_leaf': 73, 'criterion': 'entropy'}.
Trial 4616 finished with value: 0.7065217391304348 and parameters: {'n_estimators': 202, 'max_depth': 10, 'min_samples_split': 27, 'min_samples_leaf': 55, 'criterion': 'gini'}.
Trial 4617 finished with value: 0.6847826086956522 and parameters: {'n_estimators': 274, 'max_depth': 12, 'min_samples_split': 51, 'min_samples_leaf': 63, 'criterion': 'entropy'}.
Trial 4618 finished with value: 0.6847826086956522 and parameters: {'n_estimators': 313, 'max_depth': 15, 'min_samples_split': 46, 'min_samples_leaf': 57, 'criterion': 'gini'}.
Trial 4619 finished with value: 0.6739130434782609 and parameters: {'n_estimators': 251, 'max_depth': 18, 'min_samples_split': 20, 'min_samples_leaf': 71, 'criterion': 'entropy'}.
Trial 4620 finished with value: 0.6847826086956522 and parameters: {'n_estimators': 264, 'max_depth': 6, 'min_samples_split': 37, 'min_samples_leaf': 61, 'criterion': 'gini'}.
Trial 4621 finished with value: 0.717391304347826 and parameters: {'n_estimators': 281, 'max_depth': 10, 'min_samples_split': 144, 'min_samples_leaf': 59, 'criterion': 'entropy'}.
Trial 4622 finished with value: 0.7065217391304348 and parameters: {'n_estimators': 297, 'max_depth': 13, 'min_samples_split': 29, 'min_samples_leaf': 67, 'criterion': 'gini'}.
Trial 4623 finished with value: 0.7065217391304348 and parameters: {'n_estimators': 643, 'max_depth': 8, 'min_samples_split': 25, 'min_samples_leaf': 55, 'criterion': 'entropy'}.
Trial 4624 finished with value: 0.6847826086956522 and parameters: {'n_estimators': 228, 'max_depth': 11, 'min_samples_split': 71, 'min_samples_leaf': 77, 'criterion': 'gini'}.
Trial 4625 finished with value: 0.7065217391304348 and parameters: {'n_estimators': 317, 'max_depth': 9, 'min_samples_split': 154, 'min_samples_leaf': 62, 'criterion': 'entropy'}.
Trial 4626 finished with value: 0.6739130434782609 and parameters: {'n_estimators': 725, 'max_depth': 47, 'min_samples_split': 117, 'min_samples_leaf': 58, 'criterion': 'gini'}.
Trial 4627 finished with value: 0.7065217391304348 and parameters: {'n_estimators': 753, 'max_depth': 13, 'min_samples_split': 32, 'min_samples_leaf': 64, 'criterion': 'entropy'}.
Trial 4628 finished with value: 0.6739130434782609 and parameters: {'n_estimators': 395, 'max_depth': 5, 'min_samples_split': 140, 'min_samples_leaf': 70, 'criterion': 'gini'}.
Trial 4629 finished with value: 0.6847826086956522 and parameters: {'n_estimators': 258, 'max_depth': 55, 'min_samples_split': 125, 'min_samples_leaf': 54, 'criterion': 'entropy'}.
Trial 4630 finished with value: 0.6847826086956522 and parameters: {'n_estimators': 289, 'max_depth': 64, 'min_samples_split': 39, 'min_samples_leaf': 60, 'criterion': 'gini'}.
Trial 4631 finished with value: 0.6956521739130435 and parameters: {'n_estimators': 271, 'max_depth': 7, 'min_samples_split': 34, 'min_samples_leaf': 74, 'criterion': 'entropy'}.
Trial 4632 finished with value: 0.6847826086956522 and parameters: {'n_estimators': 245, 'max_depth': 16, 'min_samples_split': 42, 'min_samples_leaf': 57, 'criterion': 'gini'}.
Trial 4633 finished with value: 0.6630434782608695 and parameters: {'n_estimators': 134, 'max_depth': 20, 'min_samples_split': 19, 'min_samples_leaf': 62, 'criterion': 'entropy'}.
Trial 4634 finished with value: 0.7282608695652174 and parameters: {'n_estimators': 301, 'max_depth': 11, 'min_samples_split': 110, 'min_samples_leaf': 56, 'criterion': 'gini'}.
Trial 4635 finished with value: 0.7065217391304348 and parameters: {'n_estimators': 345, 'max_depth': 9, 'min_samples_split': 30, 'min_samples_leaf': 59, 'criterion': 'entropy'}.
Trial 4636 finished with value: 0.7065217391304348 and parameters: {'n_estimators': 607, 'max_depth': 12, 'min_samples_split': 146, 'min_samples_leaf': 66, 'criterion': 'gini'}.
Trial 4637 finished with value: 0.6956521739130435 and parameters: {'n_estimators': 748, 'max_depth': 14, 'min_samples_split': 136, 'min_samples_leaf': 61, 'criterion': 'entropy'}.
Trial 4638 finished with value: 0.6956521739130435 and parameters: {'n_estimators': 278, 'max_depth': 8, 'min_samples_split': 130, 'min_samples_leaf': 54, 'criterion': 'gini'}.
Trial 4639 finished with value: 0.717391304347826 and parameters: {'n_estimators': 244, 'max_depth': 10, 'min_samples_split': 27, 'min_samples_leaf': 58, 'criterion': 'entropy'}.
Trial 4640 finished with value: 0.7065217391304348 and parameters: {'n_estimators': 704, 'max_depth': 12, 'min_samples_split': 36, 'min_samples_leaf': 64, 'criterion': 'entropy'}.
Trial 4641 finished with value: 0.6739130434782609 and parameters: {'n_estimators': 221, 'max_depth': 7, 'min_samples_split': 22, 'min_samples_leaf': 56, 'criterion': 'gini'}.
Trial 4642 finished with value: 0.6956521739130435 and parameters: {'n_estimators': 309, 'max_depth': 10, 'min_samples_split': 33, 'min_samples_leaf': 72, 'criterion': 'entropy'}.
Trial 4643 finished with value: 0.6847826086956522 and parameters: {'n_estimators': 263, 'max_depth': 15, 'min_samples_split': 26, 'min_samples_leaf': 69, 'criterion': 'gini'}.
Trial 4644 finished with value: 0.6847826086956522 and parameters: {'n_estimators': 286, 'max_depth': 33, 'min_samples_split': 140, 'min_samples_leaf': 59, 'criterion': 'entropy'}.
Trial 4645 finished with value: 0.6847826086956522 and parameters: {'n_estimators': 913, 'max_depth': 13, 'min_samples_split': 151, 'min_samples_leaf': 75, 'criterion': 'gini'}.
Trial 4646 finished with value: 0.6956521739130435 and parameters: {'n_estimators': 950, 'max_depth': 6, 'min_samples_split': 39, 'min_samples_leaf': 62, 'criterion': 'entropy'}.
Trial 4647 finished with value: 0.6739130434782609 and parameters: {'n_estimators': 334, 'max_depth': 17, 'min_samples_split': 16, 'min_samples_leaf': 60, 'criterion': 'gini'}.
Trial 4648 finished with value: 0.6956521739130435 and parameters: {'n_estimators': 731, 'max_depth': 9, 'min_samples_split': 11, 'min_samples_leaf': 57, 'criterion': 'entropy'}.
Trial 4649 finished with value: 0.717391304347826 and parameters: {'n_estimators': 185, 'max_depth': 11, 'min_samples_split': 31, 'min_samples_leaf': 56, 'criterion': 'gini'}.
Trial 4650 finished with value: 0.717391304347826 and parameters: {'n_estimators': 267, 'max_depth': 8, 'min_samples_split': 145, 'min_samples_leaf': 65, 'criterion': 'entropy'}.
Trial 4651 finished with value: 0.717391304347826 and parameters: {'n_estimators': 294, 'max_depth': 13, 'min_samples_split': 134, 'min_samples_leaf': 54, 'criterion': 'gini'}.
Trial 4652 finished with value: 0.7065217391304348 and parameters: {'n_estimators': 236, 'max_depth': 10, 'min_samples_split': 44, 'min_samples_leaf': 61, 'criterion': 'entropy'}.
Trial 4653 finished with value: 0.6630434782608695 and parameters: {'n_estimators': 320, 'max_depth': 5, 'min_samples_split': 23, 'min_samples_leaf': 78, 'criterion': 'gini'}.
Trial 4654 finished with value: 0.7065217391304348 and parameters: {'n_estimators': 255, 'max_depth': 12, 'min_samples_split': 114, 'min_samples_leaf': 68, 'criterion': 'entropy'}.
Trial 4655 finished with value: 0.6956521739130435 and parameters: {'n_estimators': 273, 'max_depth': 15, 'min_samples_split': 123, 'min_samples_leaf': 58, 'criterion': 'gini'}.
Trial 4656 finished with value: 0.6956521739130435 and parameters: {'n_estimators': 214, 'max_depth': 8, 'min_samples_split': 37, 'min_samples_leaf': 72, 'criterion': 'entropy'}.
Trial 4657 finished with value: 0.717391304347826 and parameters: {'n_estimators': 306, 'max_depth': 11, 'min_samples_split': 29, 'min_samples_leaf': 60, 'criterion': 'gini'}.
Trial 4658 finished with value: 0.7065217391304348 and parameters: {'n_estimators': 750, 'max_depth': 7, 'min_samples_split': 34, 'min_samples_leaf': 63, 'criterion': 'entropy'}.
Trial 4659 finished with value: 0.7065217391304348 and parameters: {'n_estimators': 288, 'max_depth': 9, 'min_samples_split': 138, 'min_samples_leaf': 55, 'criterion': 'gini'}.
Trial 4660 finished with value: 0.7065217391304348 and parameters: {'n_estimators': 367, 'max_depth': 14, 'min_samples_split': 127, 'min_samples_leaf': 57, 'criterion': 'entropy'}.
Trial 4661 finished with value: 0.7065217391304348 and parameters: {'n_estimators': 260, 'max_depth': 11, 'min_samples_split': 41, 'min_samples_leaf': 70, 'criterion': 'gini'}.
Trial 4662 finished with value: 0.7065217391304348 and parameters: {'n_estimators': 281, 'max_depth': 9, 'min_samples_split': 24, 'min_samples_leaf': 80, 'criterion': 'entropy'}.
Trial 4663 finished with value: 0.6630434782608695 and parameters: {'n_estimators': 251, 'max_depth': 17, 'min_samples_split': 31, 'min_samples_leaf': 74, 'criterion': 'gini'}.
Trial 4664 finished with value: 0.6956521739130435 and parameters: {'n_estimators': 719, 'max_depth': 13, 'min_samples_split': 143, 'min_samples_leaf': 37, 'criterion': 'entropy'}.
Trial 4665 finished with value: 0.6739130434782609 and parameters: {'n_estimators': 327, 'max_depth': 6, 'min_samples_split': 47, 'min_samples_leaf': 59, 'criterion': 'gini'}.
Trial 4666 finished with value: 0.7282608695652174 and parameters: {'n_estimators': 235, 'max_depth': 10, 'min_samples_split': 36, 'min_samples_leaf': 62, 'criterion': 'entropy'}.
Trial 4667 finished with value: 0.7065217391304348 and parameters: {'n_estimators': 676, 'max_depth': 12, 'min_samples_split': 150, 'min_samples_leaf': 55, 'criterion': 'gini'}.
Trial 4668 finished with value: 0.6847826086956522 and parameters: {'n_estimators': 302, 'max_depth': 7, 'min_samples_split': 28, 'min_samples_leaf': 58, 'criterion': 'entropy'}.
Trial 4669 finished with value: 0.6847826086956522 and parameters: {'n_estimators': 276, 'max_depth': 15, 'min_samples_split': 20, 'min_samples_leaf': 66, 'criterion': 'entropy'}.
Trial 4670 finished with value: 0.6956521739130435 and parameters: {'n_estimators': 754, 'max_depth': 9, 'min_samples_split': 133, 'min_samples_leaf': 60, 'criterion': 'gini'}.
Trial 4671 finished with value: 0.7065217391304348 and parameters: {'n_estimators': 100, 'max_depth': 11, 'min_samples_split': 141, 'min_samples_leaf': 63, 'criterion': 'entropy'}.
Trial 4672 finished with value: 0.7065217391304348 and parameters: {'n_estimators': 288, 'max_depth': 13, 'min_samples_split': 33, 'min_samples_leaf': 54, 'criterion': 'gini'}.
Trial 4673 finished with value: 0.7065217391304348 and parameters: {'n_estimators': 313, 'max_depth': 8, 'min_samples_split': 147, 'min_samples_leaf': 76, 'criterion': 'entropy'}.
Trial 4674 finished with value: 0.6956521739130435 and parameters: {'n_estimators': 162, 'max_depth': 10, 'min_samples_split': 119, 'min_samples_leaf': 57, 'criterion': 'gini'}.
Trial 4675 finished with value: 0.6847826086956522 and parameters: {'n_estimators': 263, 'max_depth': 7, 'min_samples_split': 40, 'min_samples_leaf': 61, 'criterion': 'entropy'}.
Trial 4676 finished with value: 0.6739130434782609 and parameters: {'n_estimators': 245, 'max_depth': 15, 'min_samples_split': 7, 'min_samples_leaf': 59, 'criterion': 'gini'}.
Trial 4677 finished with value: 0.6630434782608695 and parameters: {'n_estimators': 347, 'max_depth': 5, 'min_samples_split': 23, 'min_samples_leaf': 68, 'criterion': 'entropy'}.
Trial 4678 finished with value: 0.6956521739130435 and parameters: {'n_estimators': 733, 'max_depth': 12, 'min_samples_split': 93, 'min_samples_leaf': 71, 'criterion': 'gini'}.
Trial 4679 finished with value: 0.7065217391304348 and parameters: {'n_estimators': 221, 'max_depth': 10, 'min_samples_split': 28, 'min_samples_leaf': 64, 'criterion': 'entropy'}.
Trial 4680 finished with value: 0.6739130434782609 and parameters: {'n_estimators': 293, 'max_depth': 98, 'min_samples_split': 37, 'min_samples_leaf': 57, 'criterion': 'gini'}.
Trial 4681 finished with value: 0.6739130434782609 and parameters: {'n_estimators': 278, 'max_depth': 18, 'min_samples_split': 15, 'min_samples_leaf': 73, 'criterion': 'entropy'}.
Trial 4682 finished with value: 0.7065217391304348 and parameters: {'n_estimators': 253, 'max_depth': 8, 'min_samples_split': 32, 'min_samples_leaf': 54, 'criterion': 'gini'}.
Trial 4683 finished with value: 0.717391304347826 and parameters: {'n_estimators': 198, 'max_depth': 14, 'min_samples_split': 137, 'min_samples_leaf': 61, 'criterion': 'entropy'}.
Trial 4684 finished with value: 0.717391304347826 and parameters: {'n_estimators': 315, 'max_depth': 11, 'min_samples_split': 130, 'min_samples_leaf': 58, 'criterion': 'gini'}.
Trial 4685 finished with value: 0.717391304347826 and parameters: {'n_estimators': 263, 'max_depth': 9, 'min_samples_split': 25, 'min_samples_leaf': 59, 'criterion': 'entropy'}.
Trial 4686 finished with value: 0.7065217391304348 and parameters: {'n_estimators': 752, 'max_depth': 12, 'min_samples_split': 104, 'min_samples_leaf': 56, 'criterion': 'gini'}.
Trial 4687 finished with value: 0.6956521739130435 and parameters: {'n_estimators': 277, 'max_depth': 7, 'min_samples_split': 36, 'min_samples_leaf': 64, 'criterion': 'entropy'}.
Trial 4688 finished with value: 0.6413043478260869 and parameters: {'n_estimators': 237, 'max_depth': 5, 'min_samples_split': 54, 'min_samples_leaf': 62, 'criterion': 'gini'}.
Trial 4689 finished with value: 0.6956521739130435 and parameters: {'n_estimators': 702, 'max_depth': 13, 'min_samples_split': 45, 'min_samples_leaf': 66, 'criterion': 'entropy'}.
Trial 4690 finished with value: 0.6630434782608695 and parameters: {'n_estimators': 299, 'max_depth': 16, 'min_samples_split': 19, 'min_samples_leaf': 60, 'criterion': 'gini'}.
Trial 4691 finished with value: 0.717391304347826 and parameters: {'n_estimators': 331, 'max_depth': 10, 'min_samples_split': 29, 'min_samples_leaf': 55, 'criterion': 'entropy'}.
Trial 4692 finished with value: 0.6739130434782609 and parameters: {'n_estimators': 270, 'max_depth': 8, 'min_samples_split': 142, 'min_samples_leaf': 57, 'criterion': 'gini'}.
Trial 4693 finished with value: 0.6847826086956522 and parameters: {'n_estimators': 293, 'max_depth': 11, 'min_samples_split': 115, 'min_samples_leaf': 70, 'criterion': 'entropy'}.
Trial 4694 finished with value: 0.717391304347826 and parameters: {'n_estimators': 737, 'max_depth': 13, 'min_samples_split': 41, 'min_samples_leaf': 59, 'criterion': 'gini'}.
Trial 4695 finished with value: 0.717391304347826 and parameters: {'n_estimators': 242, 'max_depth': 9, 'min_samples_split': 31, 'min_samples_leaf': 61, 'criterion': 'entropy'}.
Trial 4696 finished with value: 0.6739130434782609 and parameters: {'n_estimators': 305, 'max_depth': 14, 'min_samples_split': 123, 'min_samples_leaf': 76, 'criterion': 'entropy'}.
Trial 4697 finished with value: 0.6956521739130435 and parameters: {'n_estimators': 260, 'max_depth': 7, 'min_samples_split': 152, 'min_samples_leaf': 73, 'criterion': 'gini'}.
Trial 4698 finished with value: 0.7282608695652174 and parameters: {'n_estimators': 149, 'max_depth': 11, 'min_samples_split': 181, 'min_samples_leaf': 54, 'criterion': 'entropy'}.
Trial 4699 finished with value: 0.7065217391304348 and parameters: {'n_estimators': 279, 'max_depth': 16, 'min_samples_split': 145, 'min_samples_leaf': 63, 'criterion': 'gini'}.
Trial 4700 finished with value: 0.7065217391304348 and parameters: {'n_estimators': 221, 'max_depth': 9, 'min_samples_split': 26, 'min_samples_leaf': 56, 'criterion': 'entropy'}.
Trial 4701 finished with value: 0.6739130434782609 and parameters: {'n_estimators': 318, 'max_depth': 6, 'min_samples_split': 34, 'min_samples_leaf': 59, 'criterion': 'gini'}.
Trial 4702 finished with value: 0.7065217391304348 and parameters: {'n_estimators': 287, 'max_depth': 12, 'min_samples_split': 135, 'min_samples_leaf': 57, 'criterion': 'entropy'}.
Trial 4703 finished with value: 0.717391304347826 and parameters: {'n_estimators': 252, 'max_depth': 10, 'min_samples_split': 22, 'min_samples_leaf': 68, 'criterion': 'gini'}.
Trial 4704 finished with value: 0.6847826086956522 and parameters: {'n_estimators': 440, 'max_depth': 20, 'min_samples_split': 40, 'min_samples_leaf': 61, 'criterion': 'entropy'}.
Trial 4705 finished with value: 0.7065217391304348 and parameters: {'n_estimators': 752, 'max_depth': 14, 'min_samples_split': 36, 'min_samples_leaf': 65, 'criterion': 'gini'}.
Trial 4706 finished with value: 0.6956521739130435 and parameters: {'n_estimators': 341, 'max_depth': 8, 'min_samples_split': 139, 'min_samples_leaf': 58, 'criterion': 'entropy'}.
Trial 4707 finished with value: 0.6956521739130435 and parameters: {'n_estimators': 1000, 'max_depth': 12, 'min_samples_split': 128, 'min_samples_leaf': 72, 'criterion': 'gini'}.
Trial 4708 finished with value: 0.6413043478260869 and parameters: {'n_estimators': 721, 'max_depth': 5, 'min_samples_split': 29, 'min_samples_leaf': 54, 'criterion': 'entropy'}.
Trial 4709 finished with value: 0.6956521739130435 and parameters: {'n_estimators': 268, 'max_depth': 10, 'min_samples_split': 50, 'min_samples_leaf': 75, 'criterion': 'gini'}.
Trial 4710 finished with value: 0.6956521739130435 and parameters: {'n_estimators': 383, 'max_depth': 7, 'min_samples_split': 147, 'min_samples_leaf': 63, 'criterion': 'entropy'}.
Trial 4711 finished with value: 0.6847826086956522 and parameters: {'n_estimators': 295, 'max_depth': 17, 'min_samples_split': 17, 'min_samples_leaf': 60, 'criterion': 'gini'}.
Trial 4712 finished with value: 0.7065217391304348 and parameters: {'n_estimators': 237, 'max_depth': 12, 'min_samples_split': 33, 'min_samples_leaf': 56, 'criterion': 'entropy'}.
Trial 4713 finished with value: 0.717391304347826 and parameters: {'n_estimators': 316, 'max_depth': 9, 'min_samples_split': 25, 'min_samples_leaf': 58, 'criterion': 'gini'}.
Trial 4714 finished with value: 0.6847826086956522 and parameters: {'n_estimators': 267, 'max_depth': 14, 'min_samples_split': 119, 'min_samples_leaf': 70, 'criterion': 'entropy'}.
Trial 4715 finished with value: 0.6956521739130435 and parameters: {'n_estimators': 285, 'max_depth': 11, 'min_samples_split': 159, 'min_samples_leaf': 61, 'criterion': 'gini'}.
Trial 4716 finished with value: 0.717391304347826 and parameters: {'n_estimators': 689, 'max_depth': 8, 'min_samples_split': 43, 'min_samples_leaf': 66, 'criterion': 'entropy'}.
Trial 4717 finished with value: 0.6739130434782609 and parameters: {'n_estimators': 487, 'max_depth': 15, 'min_samples_split': 108, 'min_samples_leaf': 55, 'criterion': 'gini'}.
Trial 4718 finished with value: 0.717391304347826 and parameters: {'n_estimators': 246, 'max_depth': 11, 'min_samples_split': 132, 'min_samples_leaf': 59, 'criterion': 'entropy'}.
Trial 4719 finished with value: 0.6956521739130435 and parameters: {'n_estimators': 756, 'max_depth': 9, 'min_samples_split': 38, 'min_samples_leaf': 63, 'criterion': 'gini'}.
Trial 4720 finished with value: 0.6956521739130435 and parameters: {'n_estimators': 276, 'max_depth': 13, 'min_samples_split': 142, 'min_samples_leaf': 56, 'criterion': 'entropy'}.
Trial 4721 finished with value: 0.6847826086956522 and parameters: {'n_estimators': 303, 'max_depth': 43, 'min_samples_split': 98, 'min_samples_leaf': 74, 'criterion': 'gini'}.
Trial 4722 finished with value: 0.6304347826086957 and parameters: {'n_estimators': 201, 'max_depth': 6, 'min_samples_split': 30, 'min_samples_leaf': 6, 'criterion': 'entropy'}.
Trial 4723 finished with value: 0.7065217391304348 and parameters: {'n_estimators': 261, 'max_depth': 10, 'min_samples_split': 155, 'min_samples_leaf': 60, 'criterion': 'gini'}.
Trial 4724 finished with value: 0.717391304347826 and parameters: {'n_estimators': 738, 'max_depth': 7, 'min_samples_split': 22, 'min_samples_leaf': 78, 'criterion': 'entropy'}.
