Trial 129 finished with value: 0.532608695652174 and parameters: {'n_estimators': 221, 'max_depth': 12, 'min_samples_split': 49, 'min_samples_leaf': 52, 'criterion': 'gini'}.
Trial 130 finished with value: 0.5 and parameters: {'n_estimators': 226, 'max_depth': 11, 'min_samples_split': 48, 'min_samples_leaf': 53, 'criterion': 'gini'}.
Trial 131 finished with value: 0.5652173913043478 and parameters: {'n_estimators': 217, 'max_depth': 12, 'min_samples_split': 49, 'min_samples_leaf': 54, 'criterion': 'gini'}.
Trial 132 finished with value: 0.5652173913043478 and parameters: {'n_estimators': 217, 'max_depth': 12, 'min_samples_split': 49, 'min_samples_leaf': 53, 'criterion': 'gini'}.
Trial 133 finished with value: 0.5652173913043478 and parameters: {'n_estimators': 220, 'max_depth': 12, 'min_samples_split': 51, 'min_samples_leaf': 54, 'criterion': 'gini'}.
Trial 134 finished with value: 0.5543478260869565 and parameters: {'n_estimators': 214, 'max_depth': 12, 'min_samples_split': 50, 'min_samples_leaf': 53, 'criterion': 'gini'}.
Trial 135 finished with value: 0.5434782608695652 and parameters: {'n_estimators': 209, 'max_depth': 12, 'min_samples_split': 46, 'min_samples_leaf': 51, 'criterion': 'gini'}.
Trial 136 finished with value: 0.5652173913043478 and parameters: {'n_estimators': 218, 'max_depth': 12, 'min_samples_split': 49, 'min_samples_leaf': 55, 'criterion': 'gini'}.
Trial 137 finished with value: 0.5108695652173914 and parameters: {'n_estimators': 224, 'max_depth': 11, 'min_samples_split': 50, 'min_samples_leaf': 52, 'criterion': 'gini'}.
Trial 138 finished with value: 0.5652173913043478 and parameters: {'n_estimators': 216, 'max_depth': 12, 'min_samples_split': 48, 'min_samples_leaf': 53, 'criterion': 'gini'}.
Trial 139 finished with value: 0.5652173913043478 and parameters: {'n_estimators': 230, 'max_depth': 12, 'min_samples_split': 47, 'min_samples_leaf': 54, 'criterion': 'gini'}.
Trial 140 finished with value: 0.5652173913043478 and parameters: {'n_estimators': 212, 'max_depth': 12, 'min_samples_split': 51, 'min_samples_leaf': 55, 'criterion': 'gini'}.
Trial 141 finished with value: 0.5652173913043478 and parameters: {'n_estimators': 217, 'max_depth': 12, 'min_samples_split': 49, 'min_samples_leaf': 53, 'criterion': 'gini'}.
Trial 142 finished with value: 0.5652173913043478 and parameters: {'n_estimators': 222, 'max_depth': 12, 'min_samples_split': 49, 'min_samples_leaf': 54, 'criterion': 'gini'}.
Trial 143 finished with value: 0.532608695652174 and parameters: {'n_estimators': 227, 'max_depth': 12, 'min_samples_split': 49, 'min_samples_leaf': 52, 'criterion': 'gini'}.
Trial 144 finished with value: 0.5652173913043478 and parameters: {'n_estimators': 217, 'max_depth': 12, 'min_samples_split': 48, 'min_samples_leaf': 53, 'criterion': 'gini'}.
Trial 145 finished with value: 0.5217391304347826 and parameters: {'n_estimators': 220, 'max_depth': 11, 'min_samples_split': 50, 'min_samples_leaf': 42, 'criterion': 'gini'}.
Trial 146 finished with value: 0.5652173913043478 and parameters: {'n_estimators': 224, 'max_depth': 12, 'min_samples_split': 49, 'min_samples_leaf': 53, 'criterion': 'gini'}.
Trial 147 finished with value: 0.5434782608695652 and parameters: {'n_estimators': 215, 'max_depth': 18, 'min_samples_split': 48, 'min_samples_leaf': 56, 'criterion': 'gini'}.
Trial 148 finished with value: 0.5434782608695652 and parameters: {'n_estimators': 229, 'max_depth': 13, 'min_samples_split': 48, 'min_samples_leaf': 54, 'criterion': 'gini'}.
Trial 149 finished with value: 0.532608695652174 and parameters: {'n_estimators': 223, 'max_depth': 12, 'min_samples_split': 50, 'min_samples_leaf': 54, 'criterion': 'entropy'}.
Trial 150 finished with value: 0.5543478260869565 and parameters: {'n_estimators': 218, 'max_depth': 12, 'min_samples_split': 50, 'min_samples_leaf': 52, 'criterion': 'gini'}.
Trial 151 finished with value: 0.5760869565217391 and parameters: {'n_estimators': 220, 'max_depth': 12, 'min_samples_split': 51, 'min_samples_leaf': 55, 'criterion': 'gini'}.
Trial 152 finished with value: 0.4891304347826087 and parameters: {'n_estimators': 220, 'max_depth': 11, 'min_samples_split': 51, 'min_samples_leaf': 55, 'criterion': 'gini'}.
Trial 153 finished with value: 0.5760869565217391 and parameters: {'n_estimators': 226, 'max_depth': 12, 'min_samples_split': 52, 'min_samples_leaf': 55, 'criterion': 'gini'}.
Trial 154 finished with value: 0.5543478260869565 and parameters: {'n_estimators': 233, 'max_depth': 12, 'min_samples_split': 52, 'min_samples_leaf': 56, 'criterion': 'gini'}.
Trial 155 finished with value: 0.532608695652174 and parameters: {'n_estimators': 225, 'max_depth': 16, 'min_samples_split': 52, 'min_samples_leaf': 55, 'criterion': 'gini'}.
Trial 156 finished with value: 0.5760869565217391 and parameters: {'n_estimators': 227, 'max_depth': 12, 'min_samples_split': 51, 'min_samples_leaf': 55, 'criterion': 'gini'}.
Trial 157 finished with value: 0.532608695652174 and parameters: {'n_estimators': 227, 'max_depth': 11, 'min_samples_split': 52, 'min_samples_leaf': 56, 'criterion': 'gini'}.
Trial 158 finished with value: 0.5652173913043478 and parameters: {'n_estimators': 231, 'max_depth': 12, 'min_samples_split': 51, 'min_samples_leaf': 55, 'criterion': 'gini'}.
Trial 159 finished with value: 0.532608695652174 and parameters: {'n_estimators': 223, 'max_depth': 13, 'min_samples_split': 52, 'min_samples_leaf': 55, 'criterion': 'gini'}.
Trial 160 finished with value: 0.5543478260869565 and parameters: {'n_estimators': 229, 'max_depth': 12, 'min_samples_split': 51, 'min_samples_leaf': 56, 'criterion': 'gini'}.
Trial 161 finished with value: 0.5543478260869565 and parameters: {'n_estimators': 226, 'max_depth': 12, 'min_samples_split': 53, 'min_samples_leaf': 54, 'criterion': 'gini'}.
Trial 162 finished with value: 0.5652173913043478 and parameters: {'n_estimators': 221, 'max_depth': 12, 'min_samples_split': 50, 'min_samples_leaf': 54, 'criterion': 'gini'}.
Trial 163 finished with value: 0.4891304347826087 and parameters: {'n_estimators': 207, 'max_depth': 12, 'min_samples_split': 49, 'min_samples_leaf': 47, 'criterion': 'gini'}.
Trial 164 finished with value: 0.5760869565217391 and parameters: {'n_estimators': 222, 'max_depth': 12, 'min_samples_split': 51, 'min_samples_leaf': 55, 'criterion': 'gini'}.
Trial 165 finished with value: 0.5543478260869565 and parameters: {'n_estimators': 222, 'max_depth': 15, 'min_samples_split': 51, 'min_samples_leaf': 55, 'criterion': 'gini'}.
Trial 166 finished with value: 0.5760869565217391 and parameters: {'n_estimators': 225, 'max_depth': 12, 'min_samples_split': 52, 'min_samples_leaf': 55, 'criterion': 'gini'}.
Trial 167 finished with value: 0.532608695652174 and parameters: {'n_estimators': 227, 'max_depth': 13, 'min_samples_split': 52, 'min_samples_leaf': 56, 'criterion': 'gini'}.
Trial 168 finished with value: 0.5652173913043478 and parameters: {'n_estimators': 232, 'max_depth': 12, 'min_samples_split': 53, 'min_samples_leaf': 55, 'criterion': 'gini'}.
Trial 169 finished with value: 0.5 and parameters: {'n_estimators': 219, 'max_depth': 11, 'min_samples_split': 52, 'min_samples_leaf': 55, 'criterion': 'gini'}.
Trial 170 finished with value: 0.5543478260869565 and parameters: {'n_estimators': 226, 'max_depth': 18, 'min_samples_split': 51, 'min_samples_leaf': 56, 'criterion': 'gini'}.
Trial 171 finished with value: 0.5760869565217391 and parameters: {'n_estimators': 225, 'max_depth': 12, 'min_samples_split': 51, 'min_samples_leaf': 55, 'criterion': 'gini'}.
Trial 172 finished with value: 0.5760869565217391 and parameters: {'n_estimators': 224, 'max_depth': 12, 'min_samples_split': 51, 'min_samples_leaf': 55, 'criterion': 'gini'}.
Trial 173 finished with value: 0.5543478260869565 and parameters: {'n_estimators': 222, 'max_depth': 12, 'min_samples_split': 51, 'min_samples_leaf': 56, 'criterion': 'gini'}.
Trial 174 finished with value: 0.5760869565217391 and parameters: {'n_estimators': 224, 'max_depth': 12, 'min_samples_split': 51, 'min_samples_leaf': 55, 'criterion': 'gini'}.
Trial 175 finished with value: 0.5760869565217391 and parameters: {'n_estimators': 224, 'max_depth': 12, 'min_samples_split': 52, 'min_samples_leaf': 55, 'criterion': 'gini'}.
Trial 176 finished with value: 0.5652173913043478 and parameters: {'n_estimators': 229, 'max_depth': 12, 'min_samples_split': 52, 'min_samples_leaf': 55, 'criterion': 'gini'}.
Trial 177 finished with value: 0.5434782608695652 and parameters: {'n_estimators': 224, 'max_depth': 15, 'min_samples_split': 51, 'min_samples_leaf': 55, 'criterion': 'gini'}.
Trial 178 finished with value: 0.5108695652173914 and parameters: {'n_estimators': 224, 'max_depth': 20, 'min_samples_split': 53, 'min_samples_leaf': 57, 'criterion': 'entropy'}.
Trial 179 finished with value: 0.532608695652174 and parameters: {'n_estimators': 221, 'max_depth': 13, 'min_samples_split': 51, 'min_samples_leaf': 55, 'criterion': 'gini'}.
Trial 180 finished with value: 0.5434782608695652 and parameters: {'n_estimators': 234, 'max_depth': 12, 'min_samples_split': 52, 'min_samples_leaf': 56, 'criterion': 'gini'}.
Trial 181 finished with value: 0.5760869565217391 and parameters: {'n_estimators': 220, 'max_depth': 12, 'min_samples_split': 51, 'min_samples_leaf': 55, 'criterion': 'gini'}.
Trial 182 finished with value: 0.5652173913043478 and parameters: {'n_estimators': 228, 'max_depth': 12, 'min_samples_split': 51, 'min_samples_leaf': 55, 'criterion': 'gini'}.
Trial 183 finished with value: 0.5760869565217391 and parameters: {'n_estimators': 220, 'max_depth': 12, 'min_samples_split': 52, 'min_samples_leaf': 55, 'criterion': 'gini'}.
Trial 184 finished with value: 0.5543478260869565 and parameters: {'n_estimators': 220, 'max_depth': 12, 'min_samples_split': 52, 'min_samples_leaf': 56, 'criterion': 'gini'}.
Trial 185 finished with value: 0.5760869565217391 and parameters: {'n_estimators': 225, 'max_depth': 12, 'min_samples_split': 52, 'min_samples_leaf': 55, 'criterion': 'gini'}.
Trial 186 finished with value: 0.5434782608695652 and parameters: {'n_estimators': 225, 'max_depth': 15, 'min_samples_split': 53, 'min_samples_leaf': 55, 'criterion': 'gini'}.
Trial 187 finished with value: 0.5543478260869565 and parameters: {'n_estimators': 231, 'max_depth': 12, 'min_samples_split': 52, 'min_samples_leaf': 56, 'criterion': 'gini'}.
Trial 188 finished with value: 0.5760869565217391 and parameters: {'n_estimators': 223, 'max_depth': 12, 'min_samples_split': 52, 'min_samples_leaf': 55, 'criterion': 'gini'}.
Trial 189 finished with value: 0.5760869565217391 and parameters: {'n_estimators': 223, 'max_depth': 12, 'min_samples_split': 52, 'min_samples_leaf': 55, 'criterion': 'gini'}.
Trial 190 finished with value: 0.5760869565217391 and parameters: {'n_estimators': 223, 'max_depth': 12, 'min_samples_split': 52, 'min_samples_leaf': 55, 'criterion': 'gini'}.
Trial 191 finished with value: 0.5760869565217391 and parameters: {'n_estimators': 223, 'max_depth': 12, 'min_samples_split': 52, 'min_samples_leaf': 55, 'criterion': 'gini'}.
Trial 192 finished with value: 0.5760869565217391 and parameters: {'n_estimators': 223, 'max_depth': 12, 'min_samples_split': 52, 'min_samples_leaf': 55, 'criterion': 'gini'}.
Trial 193 finished with value: 0.5760869565217391 and parameters: {'n_estimators': 225, 'max_depth': 12, 'min_samples_split': 53, 'min_samples_leaf': 55, 'criterion': 'gini'}.
Trial 194 finished with value: 0.5760869565217391 and parameters: {'n_estimators': 227, 'max_depth': 12, 'min_samples_split': 52, 'min_samples_leaf': 55, 'criterion': 'gini'}.
Trial 195 finished with value: 0.5760869565217391 and parameters: {'n_estimators': 222, 'max_depth': 12, 'min_samples_split': 51, 'min_samples_leaf': 55, 'criterion': 'gini'}.
Trial 196 finished with value: 0.5760869565217391 and parameters: {'n_estimators': 223, 'max_depth': 12, 'min_samples_split': 53, 'min_samples_leaf': 55, 'criterion': 'gini'}.
Trial 197 finished with value: 0.5760869565217391 and parameters: {'n_estimators': 225, 'max_depth': 12, 'min_samples_split': 52, 'min_samples_leaf': 55, 'criterion': 'gini'}.
Trial 198 finished with value: 0.532608695652174 and parameters: {'n_estimators': 229, 'max_depth': 11, 'min_samples_split': 51, 'min_samples_leaf': 56, 'criterion': 'gini'}.
Trial 199 finished with value: 0.532608695652174 and parameters: {'n_estimators': 221, 'max_depth': 13, 'min_samples_split': 52, 'min_samples_leaf': 55, 'criterion': 'gini'}.
Trial 200 finished with value: 0.5543478260869565 and parameters: {'n_estimators': 227, 'max_depth': 12, 'min_samples_split': 53, 'min_samples_leaf': 56, 'criterion': 'gini'}.
Trial 201 finished with value: 0.5760869565217391 and parameters: {'n_estimators': 223, 'max_depth': 12, 'min_samples_split': 52, 'min_samples_leaf': 55, 'criterion': 'gini'}.
Trial 202 finished with value: 0.5760869565217391 and parameters: {'n_estimators': 223, 'max_depth': 12, 'min_samples_split': 52, 'min_samples_leaf': 55, 'criterion': 'gini'}.
Trial 203 finished with value: 0.5652173913043478 and parameters: {'n_estimators': 219, 'max_depth': 12, 'min_samples_split': 51, 'min_samples_leaf': 54, 'criterion': 'gini'}.
Trial 204 finished with value: 0.5760869565217391 and parameters: {'n_estimators': 225, 'max_depth': 12, 'min_samples_split': 52, 'min_samples_leaf': 55, 'criterion': 'gini'}.
Trial 205 finished with value: 0.5760869565217391 and parameters: {'n_estimators': 222, 'max_depth': 12, 'min_samples_split': 51, 'min_samples_leaf': 55, 'criterion': 'gini'}.
Trial 206 finished with value: 0.5543478260869565 and parameters: {'n_estimators': 220, 'max_depth': 12, 'min_samples_split': 53, 'min_samples_leaf': 56, 'criterion': 'gini'}.
Trial 207 finished with value: 0.5652173913043478 and parameters: {'n_estimators': 227, 'max_depth': 12, 'min_samples_split': 52, 'min_samples_leaf': 54, 'criterion': 'gini'}.
Trial 208 finished with value: 0.5652173913043478 and parameters: {'n_estimators': 225, 'max_depth': 12, 'min_samples_split': 51, 'min_samples_leaf': 54, 'criterion': 'gini'}.
Trial 209 finished with value: 0.5760869565217391 and parameters: {'n_estimators': 223, 'max_depth': 12, 'min_samples_split': 52, 'min_samples_leaf': 55, 'criterion': 'gini'}.
Trial 210 finished with value: 0.5434782608695652 and parameters: {'n_estimators': 228, 'max_depth': 13, 'min_samples_split': 51, 'min_samples_leaf': 55, 'criterion': 'gini'}.
Trial 211 finished with value: 0.5760869565217391 and parameters: {'n_estimators': 225, 'max_depth': 12, 'min_samples_split': 53, 'min_samples_leaf': 55, 'criterion': 'gini'}.
Trial 212 finished with value: 0.5760869565217391 and parameters: {'n_estimators': 224, 'max_depth': 12, 'min_samples_split': 53, 'min_samples_leaf': 55, 'criterion': 'gini'}.
Trial 213 finished with value: 0.5543478260869565 and parameters: {'n_estimators': 221, 'max_depth': 12, 'min_samples_split': 53, 'min_samples_leaf': 56, 'criterion': 'gini'}.
Trial 214 finished with value: 0.5760869565217391 and parameters: {'n_estimators': 226, 'max_depth': 12, 'min_samples_split': 54, 'min_samples_leaf': 55, 'criterion': 'gini'}.
Trial 215 finished with value: 0.5652173913043478 and parameters: {'n_estimators': 230, 'max_depth': 12, 'min_samples_split': 52, 'min_samples_leaf': 55, 'criterion': 'gini'}.
Trial 216 finished with value: 0.5543478260869565 and parameters: {'n_estimators': 219, 'max_depth': 12, 'min_samples_split': 53, 'min_samples_leaf': 56, 'criterion': 'gini'}.
Trial 217 finished with value: 0.5108695652173914 and parameters: {'n_estimators': 222, 'max_depth': 11, 'min_samples_split': 52, 'min_samples_leaf': 54, 'criterion': 'entropy'}.
Trial 218 finished with value: 0.5652173913043478 and parameters: {'n_estimators': 224, 'max_depth': 12, 'min_samples_split': 51, 'min_samples_leaf': 54, 'criterion': 'gini'}.
Trial 219 finished with value: 0.5760869565217391 and parameters: {'n_estimators': 226, 'max_depth': 12, 'min_samples_split': 52, 'min_samples_leaf': 55, 'criterion': 'gini'}.
Trial 220 finished with value: 0.5543478260869565 and parameters: {'n_estimators': 228, 'max_depth': 12, 'min_samples_split': 51, 'min_samples_leaf': 56, 'criterion': 'gini'}.
Trial 221 finished with value: 0.5760869565217391 and parameters: {'n_estimators': 227, 'max_depth': 12, 'min_samples_split': 52, 'min_samples_leaf': 55, 'criterion': 'gini'}.
Trial 222 finished with value: 0.5760869565217391 and parameters: {'n_estimators': 223, 'max_depth': 12, 'min_samples_split': 52, 'min_samples_leaf': 55, 'criterion': 'gini'}.
Trial 223 finished with value: 0.5760869565217391 and parameters: {'n_estimators': 221, 'max_depth': 12, 'min_samples_split': 53, 'min_samples_leaf': 55, 'criterion': 'gini'}.
Trial 224 finished with value: 0.5760869565217391 and parameters: {'n_estimators': 225, 'max_depth': 12, 'min_samples_split': 52, 'min_samples_leaf': 55, 'criterion': 'gini'}.
Trial 225 finished with value: 0.5652173913043478 and parameters: {'n_estimators': 227, 'max_depth': 12, 'min_samples_split': 54, 'min_samples_leaf': 54, 'criterion': 'gini'}.
Trial 226 finished with value: 0.5543478260869565 and parameters: {'n_estimators': 219, 'max_depth': 12, 'min_samples_split': 51, 'min_samples_leaf': 56, 'criterion': 'gini'}.
Trial 227 finished with value: 0.5652173913043478 and parameters: {'n_estimators': 230, 'max_depth': 12, 'min_samples_split': 50, 'min_samples_leaf': 55, 'criterion': 'gini'}.
Trial 228 finished with value: 0.5652173913043478 and parameters: {'n_estimators': 223, 'max_depth': 12, 'min_samples_split': 51, 'min_samples_leaf': 54, 'criterion': 'gini'}.
Trial 229 finished with value: 0.5760869565217391 and parameters: {'n_estimators': 225, 'max_depth': 12, 'min_samples_split': 52, 'min_samples_leaf': 55, 'criterion': 'gini'}.
Trial 230 finished with value: 0.5108695652173914 and parameters: {'n_estimators': 221, 'max_depth': 11, 'min_samples_split': 53, 'min_samples_leaf': 56, 'criterion': 'gini'}.
Trial 231 finished with value: 0.5760869565217391 and parameters: {'n_estimators': 222, 'max_depth': 12, 'min_samples_split': 51, 'min_samples_leaf': 55, 'criterion': 'gini'}.
Trial 232 finished with value: 0.5760869565217391 and parameters: {'n_estimators': 224, 'max_depth': 12, 'min_samples_split': 51, 'min_samples_leaf': 55, 'criterion': 'gini'}.
Trial 233 finished with value: 0.5760869565217391 and parameters: {'n_estimators': 222, 'max_depth': 12, 'min_samples_split': 52, 'min_samples_leaf': 55, 'criterion': 'gini'}.
Trial 234 finished with value: 0.5760869565217391 and parameters: {'n_estimators': 226, 'max_depth': 12, 'min_samples_split': 50, 'min_samples_leaf': 55, 'criterion': 'gini'}.
Trial 235 finished with value: 0.5760869565217391 and parameters: {'n_estimators': 219, 'max_depth': 12, 'min_samples_split': 51, 'min_samples_leaf': 55, 'criterion': 'gini'}.
Trial 236 finished with value: 0.5217391304347826 and parameters: {'n_estimators': 289, 'max_depth': 12, 'min_samples_split': 52, 'min_samples_leaf': 54, 'criterion': 'gini'}.
Trial 237 finished with value: 0.5543478260869565 and parameters: {'n_estimators': 228, 'max_depth': 12, 'min_samples_split': 52, 'min_samples_leaf': 56, 'criterion': 'gini'}.
Trial 238 finished with value: 0.5652173913043478 and parameters: {'n_estimators': 223, 'max_depth': 12, 'min_samples_split': 51, 'min_samples_leaf': 54, 'criterion': 'gini'}.
Trial 239 finished with value: 0.532608695652174 and parameters: {'n_estimators': 220, 'max_depth': 13, 'min_samples_split': 53, 'min_samples_leaf': 56, 'criterion': 'gini'}.
Trial 240 finished with value: 0.5760869565217391 and parameters: {'n_estimators': 225, 'max_depth': 12, 'min_samples_split': 51, 'min_samples_leaf': 55, 'criterion': 'gini'}.
Trial 241 finished with value: 0.5760869565217391 and parameters: {'n_estimators': 222, 'max_depth': 12, 'min_samples_split': 53, 'min_samples_leaf': 55, 'criterion': 'gini'}.
Trial 242 finished with value: 0.5760869565217391 and parameters: {'n_estimators': 224, 'max_depth': 12, 'min_samples_split': 52, 'min_samples_leaf': 55, 'criterion': 'gini'}.
Trial 243 finished with value: 0.5760869565217391 and parameters: {'n_estimators': 223, 'max_depth': 12, 'min_samples_split': 53, 'min_samples_leaf': 55, 'criterion': 'gini'}.
Trial 244 finished with value: 0.5652173913043478 and parameters: {'n_estimators': 217, 'max_depth': 12, 'min_samples_split': 52, 'min_samples_leaf': 55, 'criterion': 'gini'}.
Trial 245 finished with value: 0.5760869565217391 and parameters: {'n_estimators': 227, 'max_depth': 12, 'min_samples_split': 52, 'min_samples_leaf': 55, 'criterion': 'gini'}.
Trial 246 finished with value: 0.5652173913043478 and parameters: {'n_estimators': 220, 'max_depth': 12, 'min_samples_split': 51, 'min_samples_leaf': 54, 'criterion': 'gini'}.
Trial 247 finished with value: 0.5 and parameters: {'n_estimators': 222, 'max_depth': 12, 'min_samples_split': 53, 'min_samples_leaf': 50, 'criterion': 'gini'}.
Trial 248 finished with value: 0.5543478260869565 and parameters: {'n_estimators': 226, 'max_depth': 12, 'min_samples_split': 54, 'min_samples_leaf': 56, 'criterion': 'gini'}.
Trial 249 finished with value: 0.5652173913043478 and parameters: {'n_estimators': 224, 'max_depth': 12, 'min_samples_split': 50, 'min_samples_leaf': 54, 'criterion': 'gini'}.
Trial 250 finished with value: 0.5434782608695652 and parameters: {'n_estimators': 221, 'max_depth': 12, 'min_samples_split': 51, 'min_samples_leaf': 55, 'criterion': 'entropy'}.
Trial 251 finished with value: 0.5543478260869565 and parameters: {'n_estimators': 229, 'max_depth': 12, 'min_samples_split': 52, 'min_samples_leaf': 56, 'criterion': 'gini'}.
Trial 252 finished with value: 0.4891304347826087 and parameters: {'n_estimators': 218, 'max_depth': 12, 'min_samples_split': 53, 'min_samples_leaf': 49, 'criterion': 'gini'}.
Trial 253 finished with value: 0.4891304347826087 and parameters: {'n_estimators': 225, 'max_depth': 11, 'min_samples_split': 52, 'min_samples_leaf': 55, 'criterion': 'gini'}.
