Trial 740 finished with value: 0.5652173913043478 and parameters: {'n_estimators': 394, 'max_depth': 39, 'min_samples_split': 191, 'min_samples_leaf': 96, 'criterion': 'entropy'}.
Trial 741 finished with value: 0.5543478260869565 and parameters: {'n_estimators': 277, 'max_depth': 49, 'min_samples_split': 186, 'min_samples_leaf': 94, 'criterion': 'entropy'}.
Trial 742 finished with value: 0.532608695652174 and parameters: {'n_estimators': 568, 'max_depth': 86, 'min_samples_split': 180, 'min_samples_leaf': 36, 'criterion': 'entropy'}.
Trial 743 finished with value: 0.5652173913043478 and parameters: {'n_estimators': 303, 'max_depth': 45, 'min_samples_split': 175, 'min_samples_leaf': 97, 'criterion': 'entropy'}.
Trial 744 finished with value: 0.5652173913043478 and parameters: {'n_estimators': 489, 'max_depth': 82, 'min_samples_split': 194, 'min_samples_leaf': 52, 'criterion': 'entropy'}.
Trial 745 finished with value: 0.532608695652174 and parameters: {'n_estimators': 465, 'max_depth': 41, 'min_samples_split': 189, 'min_samples_leaf': 47, 'criterion': 'entropy'}.
Trial 746 finished with value: 0.5434782608695652 and parameters: {'n_estimators': 440, 'max_depth': 52, 'min_samples_split': 196, 'min_samples_leaf': 70, 'criterion': 'gini'}.
Trial 747 finished with value: 0.532608695652174 and parameters: {'n_estimators': 478, 'max_depth': 55, 'min_samples_split': 200, 'min_samples_leaf': 91, 'criterion': 'entropy'}.
Trial 748 finished with value: 0.5543478260869565 and parameters: {'n_estimators': 311, 'max_depth': 44, 'min_samples_split': 184, 'min_samples_leaf': 98, 'criterion': 'entropy'}.
Trial 749 finished with value: 0.5543478260869565 and parameters: {'n_estimators': 422, 'max_depth': 84, 'min_samples_split': 191, 'min_samples_leaf': 93, 'criterion': 'entropy'}.
Trial 750 finished with value: 0.532608695652174 and parameters: {'n_estimators': 845, 'max_depth': 48, 'min_samples_split': 181, 'min_samples_leaf': 24, 'criterion': 'entropy'}.
Trial 751 finished with value: 0.5760869565217391 and parameters: {'n_estimators': 453, 'max_depth': 46, 'min_samples_split': 188, 'min_samples_leaf': 95, 'criterion': 'entropy'}.
Trial 752 finished with value: 0.5543478260869565 and parameters: {'n_estimators': 501, 'max_depth': 42, 'min_samples_split': 172, 'min_samples_leaf': 100, 'criterion': 'entropy'}.
Trial 753 finished with value: 0.5108695652173914 and parameters: {'n_estimators': 328, 'max_depth': 51, 'min_samples_split': 96, 'min_samples_leaf': 75, 'criterion': 'entropy'}.
Trial 754 finished with value: 0.5543478260869565 and parameters: {'n_estimators': 293, 'max_depth': 36, 'min_samples_split': 177, 'min_samples_leaf': 50, 'criterion': 'entropy'}.
Trial 755 finished with value: 0.5760869565217391 and parameters: {'n_estimators': 464, 'max_depth': 40, 'min_samples_split': 193, 'min_samples_leaf': 97, 'criterion': 'entropy'}.
Trial 756 finished with value: 0.5543478260869565 and parameters: {'n_estimators': 480, 'max_depth': 49, 'min_samples_split': 197, 'min_samples_leaf': 95, 'criterion': 'entropy'}.
Trial 757 finished with value: 0.5217391304347826 and parameters: {'n_estimators': 443, 'max_depth': 44, 'min_samples_split': 183, 'min_samples_leaf': 54, 'criterion': 'entropy'}.
Trial 758 finished with value: 0.5543478260869565 and parameters: {'n_estimators': 314, 'max_depth': 53, 'min_samples_split': 188, 'min_samples_leaf': 43, 'criterion': 'gini'}.
Trial 759 finished with value: 0.5543478260869565 and parameters: {'n_estimators': 457, 'max_depth': 58, 'min_samples_split': 193, 'min_samples_leaf': 93, 'criterion': 'entropy'}.
Trial 760 finished with value: 0.5108695652173914 and parameters: {'n_estimators': 425, 'max_depth': 19, 'min_samples_split': 200, 'min_samples_leaf': 12, 'criterion': 'entropy'}.
Trial 761 finished with value: 0.5543478260869565 and parameters: {'n_estimators': 579, 'max_depth': 46, 'min_samples_split': 178, 'min_samples_leaf': 97, 'criterion': 'entropy'}.
Trial 762 finished with value: 0.5217391304347826 and parameters: {'n_estimators': 493, 'max_depth': 38, 'min_samples_split': 185, 'min_samples_leaf': 58, 'criterion': 'entropy'}.
Trial 763 finished with value: 0.5652173913043478 and parameters: {'n_estimators': 332, 'max_depth': 88, 'min_samples_split': 196, 'min_samples_leaf': 46, 'criterion': 'entropy'}.
Trial 764 finished with value: 0.5543478260869565 and parameters: {'n_estimators': 279, 'max_depth': 43, 'min_samples_split': 191, 'min_samples_leaf': 87, 'criterion': 'entropy'}.
Trial 765 finished with value: 0.5434782608695652 and parameters: {'n_estimators': 407, 'max_depth': 47, 'min_samples_split': 181, 'min_samples_leaf': 99, 'criterion': 'entropy'}.
Trial 766 finished with value: 0.5434782608695652 and parameters: {'n_estimators': 474, 'max_depth': 41, 'min_samples_split': 187, 'min_samples_leaf': 90, 'criterion': 'entropy'}.
Trial 767 finished with value: 0.5760869565217391 and parameters: {'n_estimators': 441, 'max_depth': 54, 'min_samples_split': 175, 'min_samples_leaf': 95, 'criterion': 'entropy'}.
Trial 768 finished with value: 0.5543478260869565 and parameters: {'n_estimators': 301, 'max_depth': 51, 'min_samples_split': 196, 'min_samples_leaf': 49, 'criterion': 'entropy'}.
Trial 769 finished with value: 0.5543478260869565 and parameters: {'n_estimators': 534, 'max_depth': 81, 'min_samples_split': 125, 'min_samples_leaf': 78, 'criterion': 'gini'}.
Trial 770 finished with value: 0.5434782608695652 and parameters: {'n_estimators': 388, 'max_depth': 45, 'min_samples_split': 191, 'min_samples_leaf': 98, 'criterion': 'entropy'}.
Trial 771 finished with value: 0.532608695652174 and parameters: {'n_estimators': 459, 'max_depth': 49, 'min_samples_split': 183, 'min_samples_leaf': 52, 'criterion': 'entropy'}.
Trial 772 finished with value: 0.5434782608695652 and parameters: {'n_estimators': 322, 'max_depth': 39, 'min_samples_split': 187, 'min_samples_leaf': 92, 'criterion': 'entropy'}.
Trial 773 finished with value: 0.5543478260869565 and parameters: {'n_estimators': 264, 'max_depth': 26, 'min_samples_split': 194, 'min_samples_leaf': 96, 'criterion': 'entropy'}.
Trial 774 finished with value: 0.5543478260869565 and parameters: {'n_estimators': 481, 'max_depth': 43, 'min_samples_split': 190, 'min_samples_leaf': 94, 'criterion': 'entropy'}.
Trial 775 finished with value: 0.5543478260869565 and parameters: {'n_estimators': 512, 'max_depth': 47, 'min_samples_split': 200, 'min_samples_leaf': 100, 'criterion': 'entropy'}.
Trial 776 finished with value: 0.532608695652174 and parameters: {'n_estimators': 432, 'max_depth': 86, 'min_samples_split': 173, 'min_samples_leaf': 48, 'criterion': 'entropy'}.
Trial 777 finished with value: 0.5652173913043478 and parameters: {'n_estimators': 341, 'max_depth': 93, 'min_samples_split': 179, 'min_samples_leaf': 96, 'criterion': 'entropy'}.
Trial 778 finished with value: 0.5543478260869565 and parameters: {'n_estimators': 453, 'max_depth': 56, 'min_samples_split': 196, 'min_samples_leaf': 93, 'criterion': 'entropy'}.
Trial 779 finished with value: 0.5434782608695652 and parameters: {'n_estimators': 362, 'max_depth': 12, 'min_samples_split': 183, 'min_samples_leaf': 97, 'criterion': 'entropy'}.
Trial 780 finished with value: 0.5434782608695652 and parameters: {'n_estimators': 472, 'max_depth': 96, 'min_samples_split': 187, 'min_samples_leaf': 98, 'criterion': 'gini'}.
Trial 781 finished with value: 0.5652173913043478 and parameters: {'n_estimators': 308, 'max_depth': 50, 'min_samples_split': 191, 'min_samples_leaf': 50, 'criterion': 'entropy'}.
Trial 782 finished with value: 0.532608695652174 and parameters: {'n_estimators': 420, 'max_depth': 84, 'min_samples_split': 142, 'min_samples_leaf': 91, 'criterion': 'entropy'}.
Trial 783 finished with value: 0.5217391304347826 and parameters: {'n_estimators': 495, 'max_depth': 41, 'min_samples_split': 193, 'min_samples_leaf': 45, 'criterion': 'entropy'}.
Trial 784 finished with value: 0.5434782608695652 and parameters: {'n_estimators': 445, 'max_depth': 44, 'min_samples_split': 171, 'min_samples_leaf': 53, 'criterion': 'entropy'}.
Trial 785 finished with value: 0.5652173913043478 and parameters: {'n_estimators': 339, 'max_depth': 48, 'min_samples_split': 180, 'min_samples_leaf': 95, 'criterion': 'entropy'}.
Trial 786 finished with value: 0.5543478260869565 and parameters: {'n_estimators': 294, 'max_depth': 45, 'min_samples_split': 197, 'min_samples_leaf': 99, 'criterion': 'entropy'}.
Trial 787 finished with value: 0.5760869565217391 and parameters: {'n_estimators': 462, 'max_depth': 36, 'min_samples_split': 176, 'min_samples_leaf': 95, 'criterion': 'entropy'}.
Trial 788 finished with value: 0.532608695652174 and parameters: {'n_estimators': 319, 'max_depth': 53, 'min_samples_split': 185, 'min_samples_leaf': 56, 'criterion': 'entropy'}.
Trial 789 finished with value: 0.5543478260869565 and parameters: {'n_estimators': 788, 'max_depth': 42, 'min_samples_split': 190, 'min_samples_leaf': 93, 'criterion': 'entropy'}.
Trial 790 finished with value: 0.5217391304347826 and parameters: {'n_estimators': 435, 'max_depth': 6, 'min_samples_split': 200, 'min_samples_leaf': 97, 'criterion': 'entropy'}.
Trial 791 finished with value: 0.5760869565217391 and parameters: {'n_estimators': 482, 'max_depth': 39, 'min_samples_split': 195, 'min_samples_leaf': 47, 'criterion': 'entropy'}.
Trial 792 finished with value: 0.5543478260869565 and parameters: {'n_estimators': 407, 'max_depth': 32, 'min_samples_split': 187, 'min_samples_leaf': 51, 'criterion': 'gini'}.
Trial 793 finished with value: 0.5434782608695652 and parameters: {'n_estimators': 374, 'max_depth': 24, 'min_samples_split': 182, 'min_samples_leaf': 94, 'criterion': 'entropy'}.
Trial 794 finished with value: 0.5543478260869565 and parameters: {'n_estimators': 462, 'max_depth': 60, 'min_samples_split': 194, 'min_samples_leaf': 100, 'criterion': 'entropy'}.
Trial 795 finished with value: 0.5543478260869565 and parameters: {'n_estimators': 241, 'max_depth': 17, 'min_samples_split': 177, 'min_samples_leaf': 89, 'criterion': 'entropy'}.
Trial 796 finished with value: 0.5760869565217391 and parameters: {'n_estimators': 448, 'max_depth': 46, 'min_samples_split': 190, 'min_samples_leaf': 97, 'criterion': 'entropy'}.
Trial 797 finished with value: 0.5652173913043478 and parameters: {'n_estimators': 288, 'max_depth': 50, 'min_samples_split': 185, 'min_samples_leaf': 96, 'criterion': 'entropy'}.
Trial 798 finished with value: 0.532608695652174 and parameters: {'n_estimators': 352, 'max_depth': 48, 'min_samples_split': 193, 'min_samples_leaf': 53, 'criterion': 'entropy'}.
Trial 799 finished with value: 0.5543478260869565 and parameters: {'n_estimators': 500, 'max_depth': 52, 'min_samples_split': 197, 'min_samples_leaf': 72, 'criterion': 'entropy'}.
Trial 800 finished with value: 0.532608695652174 and parameters: {'n_estimators': 321, 'max_depth': 43, 'min_samples_split': 173, 'min_samples_leaf': 80, 'criterion': 'entropy'}.
Trial 801 finished with value: 0.5434782608695652 and parameters: {'n_estimators': 470, 'max_depth': 90, 'min_samples_split': 200, 'min_samples_leaf': 92, 'criterion': 'entropy'}.
Trial 802 finished with value: 0.5543478260869565 and parameters: {'n_estimators': 445, 'max_depth': 57, 'min_samples_split': 179, 'min_samples_leaf': 98, 'criterion': 'entropy'}.
Trial 803 finished with value: 0.5543478260869565 and parameters: {'n_estimators': 427, 'max_depth': 40, 'min_samples_split': 188, 'min_samples_leaf': 48, 'criterion': 'gini'}.
Trial 804 finished with value: 0.5543478260869565 and parameters: {'n_estimators': 335, 'max_depth': 81, 'min_samples_split': 61, 'min_samples_leaf': 94, 'criterion': 'entropy'}.
Trial 805 finished with value: 0.5760869565217391 and parameters: {'n_estimators': 487, 'max_depth': 29, 'min_samples_split': 182, 'min_samples_leaf': 96, 'criterion': 'entropy'}.
Trial 806 finished with value: 0.5543478260869565 and parameters: {'n_estimators': 552, 'max_depth': 54, 'min_samples_split': 192, 'min_samples_leaf': 100, 'criterion': 'entropy'}.
Trial 807 finished with value: 0.5 and parameters: {'n_estimators': 389, 'max_depth': 45, 'min_samples_split': 186, 'min_samples_leaf': 16, 'criterion': 'entropy'}.
Trial 808 finished with value: 0.5543478260869565 and parameters: {'n_estimators': 302, 'max_depth': 47, 'min_samples_split': 169, 'min_samples_leaf': 50, 'criterion': 'entropy'}.
Trial 809 finished with value: 0.5434782608695652 and parameters: {'n_estimators': 463, 'max_depth': 37, 'min_samples_split': 196, 'min_samples_leaf': 43, 'criterion': 'entropy'}.
Trial 810 finished with value: 0.5543478260869565 and parameters: {'n_estimators': 480, 'max_depth': 42, 'min_samples_split': 118, 'min_samples_leaf': 94, 'criterion': 'entropy'}.
Trial 811 finished with value: 0.532608695652174 and parameters: {'n_estimators': 629, 'max_depth': 50, 'min_samples_split': 191, 'min_samples_leaf': 91, 'criterion': 'entropy'}.
Trial 812 finished with value: 0.5543478260869565 and parameters: {'n_estimators': 523, 'max_depth': 45, 'min_samples_split': 176, 'min_samples_leaf': 97, 'criterion': 'entropy'}.
Trial 813 finished with value: 0.5543478260869565 and parameters: {'n_estimators': 280, 'max_depth': 83, 'min_samples_split': 184, 'min_samples_leaf': 98, 'criterion': 'entropy'}.
Trial 814 finished with value: 0.5217391304347826 and parameters: {'n_estimators': 433, 'max_depth': 43, 'min_samples_split': 200, 'min_samples_leaf': 83, 'criterion': 'gini'}.
Trial 815 finished with value: 0.5760869565217391 and parameters: {'n_estimators': 413, 'max_depth': 40, 'min_samples_split': 188, 'min_samples_leaf': 95, 'criterion': 'entropy'}.
Trial 816 finished with value: 0.532608695652174 and parameters: {'n_estimators': 453, 'max_depth': 49, 'min_samples_split': 180, 'min_samples_leaf': 55, 'criterion': 'entropy'}.
Trial 817 finished with value: 0.5652173913043478 and parameters: {'n_estimators': 327, 'max_depth': 52, 'min_samples_split': 194, 'min_samples_leaf': 46, 'criterion': 'entropy'}.
Trial 818 finished with value: 0.532608695652174 and parameters: {'n_estimators': 362, 'max_depth': 56, 'min_samples_split': 189, 'min_samples_leaf': 93, 'criterion': 'entropy'}.
Trial 819 finished with value: 0.5543478260869565 and parameters: {'n_estimators': 313, 'max_depth': 35, 'min_samples_split': 197, 'min_samples_leaf': 52, 'criterion': 'entropy'}.
Trial 820 finished with value: 0.5543478260869565 and parameters: {'n_estimators': 464, 'max_depth': 47, 'min_samples_split': 183, 'min_samples_leaf': 86, 'criterion': 'entropy'}.
Trial 821 finished with value: 0.5434782608695652 and parameters: {'n_estimators': 344, 'max_depth': 38, 'min_samples_split': 173, 'min_samples_leaf': 33, 'criterion': 'entropy'}.
Trial 822 finished with value: 0.5543478260869565 and parameters: {'n_estimators': 502, 'max_depth': 41, 'min_samples_split': 193, 'min_samples_leaf': 98, 'criterion': 'entropy'}.
Trial 823 finished with value: 0.5760869565217391 and parameters: {'n_estimators': 443, 'max_depth': 46, 'min_samples_split': 186, 'min_samples_leaf': 95, 'criterion': 'entropy'}.
Trial 824 finished with value: 0.5543478260869565 and parameters: {'n_estimators': 477, 'max_depth': 43, 'min_samples_split': 179, 'min_samples_leaf': 100, 'criterion': 'entropy'}.
Trial 825 finished with value: 0.5652173913043478 and parameters: {'n_estimators': 260, 'max_depth': 51, 'min_samples_split': 190, 'min_samples_leaf': 49, 'criterion': 'gini'}.
Trial 826 finished with value: 0.5434782608695652 and parameters: {'n_estimators': 300, 'max_depth': 55, 'min_samples_split': 195, 'min_samples_leaf': 92, 'criterion': 'entropy'}.
Trial 827 finished with value: 0.5760869565217391 and parameters: {'n_estimators': 454, 'max_depth': 21, 'min_samples_split': 200, 'min_samples_leaf': 96, 'criterion': 'entropy'}.
Trial 828 finished with value: 0.5434782608695652 and parameters: {'n_estimators': 422, 'max_depth': 14, 'min_samples_split': 169, 'min_samples_leaf': 89, 'criterion': 'entropy'}.
Trial 829 finished with value: 0.5543478260869565 and parameters: {'n_estimators': 475, 'max_depth': 44, 'min_samples_split': 183, 'min_samples_leaf': 98, 'criterion': 'entropy'}.
Trial 830 finished with value: 0.5652173913043478 and parameters: {'n_estimators': 314, 'max_depth': 48, 'min_samples_split': 191, 'min_samples_leaf': 51, 'criterion': 'entropy'}.
Trial 831 finished with value: 0.5543478260869565 and parameters: {'n_estimators': 440, 'max_depth': 41, 'min_samples_split': 176, 'min_samples_leaf': 94, 'criterion': 'entropy'}.
Trial 832 finished with value: 0.5760869565217391 and parameters: {'n_estimators': 494, 'max_depth': 59, 'min_samples_split': 187, 'min_samples_leaf': 96, 'criterion': 'entropy'}.
Trial 833 finished with value: 0.5108695652173914 and parameters: {'n_estimators': 401, 'max_depth': 85, 'min_samples_split': 196, 'min_samples_leaf': 28, 'criterion': 'entropy'}.
Trial 834 finished with value: 0.5434782608695652 and parameters: {'n_estimators': 337, 'max_depth': 87, 'min_samples_split': 181, 'min_samples_leaf': 48, 'criterion': 'entropy'}.
Trial 835 finished with value: 0.5434782608695652 and parameters: {'n_estimators': 288, 'max_depth': 45, 'min_samples_split': 191, 'min_samples_leaf': 91, 'criterion': 'entropy'}.
Trial 836 finished with value: 0.5543478260869565 and parameters: {'n_estimators': 461, 'max_depth': 49, 'min_samples_split': 197, 'min_samples_leaf': 98, 'criterion': 'entropy'}.
Trial 837 finished with value: 0.5108695652173914 and parameters: {'n_estimators': 373, 'max_depth': 53, 'min_samples_split': 149, 'min_samples_leaf': 53, 'criterion': 'gini'}.
Trial 838 finished with value: 0.5434782608695652 and parameters: {'n_estimators': 514, 'max_depth': 47, 'min_samples_split': 186, 'min_samples_leaf': 93, 'criterion': 'entropy'}.
Trial 839 finished with value: 0.5543478260869565 and parameters: {'n_estimators': 350, 'max_depth': 43, 'min_samples_split': 193, 'min_samples_leaf': 45, 'criterion': 'entropy'}.
Trial 840 finished with value: 0.5652173913043478 and parameters: {'n_estimators': 438, 'max_depth': 40, 'min_samples_split': 172, 'min_samples_leaf': 96, 'criterion': 'entropy'}.
Trial 841 finished with value: 0.5217391304347826 and parameters: {'n_estimators': 325, 'max_depth': 80, 'min_samples_split': 178, 'min_samples_leaf': 40, 'criterion': 'entropy'}.
Trial 842 finished with value: 0.5543478260869565 and parameters: {'n_estimators': 470, 'max_depth': 38, 'min_samples_split': 188, 'min_samples_leaf': 99, 'criterion': 'entropy'}.
Trial 843 finished with value: 0.5543478260869565 and parameters: {'n_estimators': 453, 'max_depth': 51, 'min_samples_split': 200, 'min_samples_leaf': 50, 'criterion': 'entropy'}.
Trial 844 finished with value: 0.5543478260869565 and parameters: {'n_estimators': 485, 'max_depth': 45, 'min_samples_split': 183, 'min_samples_leaf': 95, 'criterion': 'entropy'}.
Trial 845 finished with value: 0.5434782608695652 and parameters: {'n_estimators': 305, 'max_depth': 34, 'min_samples_split': 194, 'min_samples_leaf': 100, 'criterion': 'entropy'}.
Trial 846 finished with value: 0.5760869565217391 and parameters: {'n_estimators': 424, 'max_depth': 49, 'min_samples_split': 189, 'min_samples_leaf': 97, 'criterion': 'entropy'}.
Trial 847 finished with value: 0.5543478260869565 and parameters: {'n_estimators': 459, 'max_depth': 41, 'min_samples_split': 90, 'min_samples_leaf': 93, 'criterion': 'entropy'}.
Trial 848 finished with value: 0.5434782608695652 and parameters: {'n_estimators': 277, 'max_depth': 54, 'min_samples_split': 176, 'min_samples_leaf': 46, 'criterion': 'gini'}.
Trial 849 finished with value: 0.532608695652174 and parameters: {'n_estimators': 359, 'max_depth': 83, 'min_samples_split': 185, 'min_samples_leaf': 66, 'criterion': 'entropy'}.
Trial 850 finished with value: 0.5652173913043478 and parameters: {'n_estimators': 330, 'max_depth': 47, 'min_samples_split': 196, 'min_samples_leaf': 96, 'criterion': 'entropy'}.
Trial 851 finished with value: 0.5217391304347826 and parameters: {'n_estimators': 437, 'max_depth': 43, 'min_samples_split': 181, 'min_samples_leaf': 55, 'criterion': 'entropy'}.
Trial 852 finished with value: 0.5217391304347826 and parameters: {'n_estimators': 476, 'max_depth': 58, 'min_samples_split': 190, 'min_samples_leaf': 58, 'criterion': 'entropy'}.
Trial 853 finished with value: 0.5434782608695652 and parameters: {'n_estimators': 384, 'max_depth': 51, 'min_samples_split': 194, 'min_samples_leaf': 91, 'criterion': 'entropy'}.
Trial 854 finished with value: 0.5543478260869565 and parameters: {'n_estimators': 415, 'max_depth': 45, 'min_samples_split': 186, 'min_samples_leaf': 94, 'criterion': 'entropy'}.
Trial 855 finished with value: 0.5543478260869565 and parameters: {'n_estimators': 492, 'max_depth': 42, 'min_samples_split': 200, 'min_samples_leaf': 98, 'criterion': 'entropy'}.
Trial 856 finished with value: 0.5434782608695652 and parameters: {'n_estimators': 317, 'max_depth': 47, 'min_samples_split': 170, 'min_samples_leaf': 48, 'criterion': 'entropy'}.
Trial 857 finished with value: 0.5652173913043478 and parameters: {'n_estimators': 295, 'max_depth': 39, 'min_samples_split': 178, 'min_samples_leaf': 52, 'criterion': 'entropy'}.
Trial 858 finished with value: 0.5760869565217391 and parameters: {'n_estimators': 466, 'max_depth': 53, 'min_samples_split': 192, 'min_samples_leaf': 95, 'criterion': 'entropy'}.
Trial 0 finished with value: 0.5108695652173914 and parameters: {'n_estimators': 227, 'max_depth': 13, 'min_samples_split': 60, 'min_samples_leaf': 56, 'criterion': 'entropy'}.
Trial 1 finished with value: 0.4782608695652174 and parameters: {'n_estimators': 248, 'max_depth': 19, 'min_samples_split': 55, 'min_samples_leaf': 40, 'criterion': 'entropy'}.
Trial 2 finished with value: 0.532608695652174 and parameters: {'n_estimators': 205, 'max_depth': 10, 'min_samples_split': 55, 'min_samples_leaf': 60, 'criterion': 'gini'}.
