Trial 7060 finished with value: 0.6739130434782609 and parameters: {'n_estimators': 175, 'max_depth': 11, 'min_samples_split': 46, 'min_samples_leaf': 35, 'criterion': 'gini'}.
Trial 7061 finished with value: 0.7065217391304348 and parameters: {'n_estimators': 730, 'max_depth': 7, 'min_samples_split': 106, 'min_samples_leaf': 69, 'criterion': 'entropy'}.
Trial 7062 finished with value: 0.6847826086956522 and parameters: {'n_estimators': 274, 'max_depth': 15, 'min_samples_split': 34, 'min_samples_leaf': 57, 'criterion': 'entropy'}.
Trial 7063 finished with value: 0.6956521739130435 and parameters: {'n_estimators': 248, 'max_depth': 9, 'min_samples_split': 116, 'min_samples_leaf': 59, 'criterion': 'gini'}.
Trial 7064 finished with value: 0.7065217391304348 and parameters: {'n_estimators': 754, 'max_depth': 12, 'min_samples_split': 127, 'min_samples_leaf': 64, 'criterion': 'entropy'}.
Trial 7065 finished with value: 0.6956521739130435 and parameters: {'n_estimators': 267, 'max_depth': 38, 'min_samples_split': 121, 'min_samples_leaf': 55, 'criterion': 'gini'}.
Trial 7066 finished with value: 0.6521739130434783 and parameters: {'n_estimators': 792, 'max_depth': 5, 'min_samples_split': 20, 'min_samples_leaf': 61, 'criterion': 'entropy'}.
Trial 7067 finished with value: 0.6630434782608695 and parameters: {'n_estimators': 287, 'max_depth': 10, 'min_samples_split': 31, 'min_samples_leaf': 76, 'criterion': 'gini'}.
Trial 7068 finished with value: 0.6956521739130435 and parameters: {'n_estimators': 325, 'max_depth': 17, 'min_samples_split': 41, 'min_samples_leaf': 58, 'criterion': 'entropy'}.
Trial 7069 finished with value: 0.6630434782608695 and parameters: {'n_estimators': 220, 'max_depth': 56, 'min_samples_split': 93, 'min_samples_leaf': 52, 'criterion': 'gini'}.
Trial 7070 finished with value: 0.6956521739130435 and parameters: {'n_estimators': 305, 'max_depth': 13, 'min_samples_split': 28, 'min_samples_leaf': 66, 'criterion': 'entropy'}.
Trial 7071 finished with value: 0.6739130434782609 and parameters: {'n_estimators': 145, 'max_depth': 8, 'min_samples_split': 142, 'min_samples_leaf': 56, 'criterion': 'entropy'}.
Trial 7072 finished with value: 0.6956521739130435 and parameters: {'n_estimators': 358, 'max_depth': 11, 'min_samples_split': 37, 'min_samples_leaf': 71, 'criterion': 'gini'}.
Trial 7073 finished with value: 0.6630434782608695 and parameters: {'n_estimators': 238, 'max_depth': 88, 'min_samples_split': 137, 'min_samples_leaf': 63, 'criterion': 'entropy'}.
Trial 7074 finished with value: 0.6739130434782609 and parameters: {'n_estimators': 270, 'max_depth': 14, 'min_samples_split': 23, 'min_samples_leaf': 74, 'criterion': 'gini'}.
Trial 7075 finished with value: 0.6847826086956522 and parameters: {'n_estimators': 287, 'max_depth': 7, 'min_samples_split': 33, 'min_samples_leaf': 60, 'criterion': 'entropy'}.
Trial 7076 finished with value: 0.7065217391304348 and parameters: {'n_estimators': 763, 'max_depth': 9, 'min_samples_split': 146, 'min_samples_leaf': 58, 'criterion': 'gini'}.
Trial 7077 finished with value: 0.6956521739130435 and parameters: {'n_estimators': 704, 'max_depth': 11, 'min_samples_split': 131, 'min_samples_leaf': 54, 'criterion': 'entropy'}.
Trial 7078 finished with value: 0.717391304347826 and parameters: {'n_estimators': 256, 'max_depth': 12, 'min_samples_split': 60, 'min_samples_leaf': 56, 'criterion': 'gini'}.
Trial 7079 finished with value: 0.6739130434782609 and parameters: {'n_estimators': 313, 'max_depth': 6, 'min_samples_split': 27, 'min_samples_leaf': 68, 'criterion': 'entropy'}.
Trial 7080 finished with value: 0.6956521739130435 and parameters: {'n_estimators': 285, 'max_depth': 15, 'min_samples_split': 36, 'min_samples_leaf': 62, 'criterion': 'entropy'}.
Trial 7081 finished with value: 0.6847826086956522 and parameters: {'n_estimators': 244, 'max_depth': 92, 'min_samples_split': 41, 'min_samples_leaf': 60, 'criterion': 'gini'}.
Trial 7082 finished with value: 0.6847826086956522 and parameters: {'n_estimators': 874, 'max_depth': 9, 'min_samples_split': 31, 'min_samples_leaf': 58, 'criterion': 'entropy'}.
Trial 7083 finished with value: 0.6739130434782609 and parameters: {'n_estimators': 727, 'max_depth': 10, 'min_samples_split': 18, 'min_samples_leaf': 92, 'criterion': 'gini'}.
Trial 7084 finished with value: 0.717391304347826 and parameters: {'n_estimators': 810, 'max_depth': 13, 'min_samples_split': 25, 'min_samples_leaf': 53, 'criterion': 'entropy'}.
Trial 7085 finished with value: 0.7065217391304348 and parameters: {'n_estimators': 776, 'max_depth': 8, 'min_samples_split': 141, 'min_samples_leaf': 70, 'criterion': 'gini'}.
Trial 7086 finished with value: 0.6739130434782609 and parameters: {'n_estimators': 299, 'max_depth': 5, 'min_samples_split': 50, 'min_samples_leaf': 65, 'criterion': 'entropy'}.
Trial 7087 finished with value: 0.6956521739130435 and parameters: {'n_estimators': 266, 'max_depth': 11, 'min_samples_split': 31, 'min_samples_leaf': 73, 'criterion': 'gini'}.
Trial 7088 finished with value: 0.6847826086956522 and parameters: {'n_estimators': 323, 'max_depth': 19, 'min_samples_split': 123, 'min_samples_leaf': 56, 'criterion': 'entropy'}.
Trial 7089 finished with value: 0.6847826086956522 and parameters: {'n_estimators': 743, 'max_depth': 14, 'min_samples_split': 134, 'min_samples_leaf': 60, 'criterion': 'entropy'}.
Trial 7090 finished with value: 0.6847826086956522 and parameters: {'n_estimators': 383, 'max_depth': 73, 'min_samples_split': 44, 'min_samples_leaf': 63, 'criterion': 'gini'}.
Trial 7091 finished with value: 0.6956521739130435 and parameters: {'n_estimators': 197, 'max_depth': 8, 'min_samples_split': 39, 'min_samples_leaf': 77, 'criterion': 'entropy'}.
Trial 7092 finished with value: 0.6739130434782609 and parameters: {'n_estimators': 340, 'max_depth': 17, 'min_samples_split': 22, 'min_samples_leaf': 85, 'criterion': 'gini'}.
Trial 7093 finished with value: 0.7282608695652174 and parameters: {'n_estimators': 270, 'max_depth': 10, 'min_samples_split': 28, 'min_samples_leaf': 58, 'criterion': 'entropy'}.
Trial 7094 finished with value: 0.7065217391304348 and parameters: {'n_estimators': 220, 'max_depth': 12, 'min_samples_split': 34, 'min_samples_leaf': 55, 'criterion': 'gini'}.
Trial 7095 finished with value: 0.6956521739130435 and parameters: {'n_estimators': 294, 'max_depth': 7, 'min_samples_split': 138, 'min_samples_leaf': 61, 'criterion': 'entropy'}.
Trial 7096 finished with value: 0.7282608695652174 and parameters: {'n_estimators': 254, 'max_depth': 10, 'min_samples_split': 114, 'min_samples_leaf': 51, 'criterion': 'gini'}.
Trial 7097 finished with value: 0.6956521739130435 and parameters: {'n_estimators': 125, 'max_depth': 13, 'min_samples_split': 16, 'min_samples_leaf': 57, 'criterion': 'entropy'}.
Trial 7098 finished with value: 0.7065217391304348 and parameters: {'n_estimators': 986, 'max_depth': 9, 'min_samples_split': 79, 'min_samples_leaf': 59, 'criterion': 'entropy'}.
Trial 7099 finished with value: 0.6956521739130435 and parameters: {'n_estimators': 277, 'max_depth': 15, 'min_samples_split': 38, 'min_samples_leaf': 72, 'criterion': 'gini'}.
Trial 7100 finished with value: 0.6847826086956522 and parameters: {'n_estimators': 234, 'max_depth': 83, 'min_samples_split': 127, 'min_samples_leaf': 53, 'criterion': 'entropy'}.
Trial 7101 finished with value: 0.6956521739130435 and parameters: {'n_estimators': 308, 'max_depth': 7, 'min_samples_split': 34, 'min_samples_leaf': 64, 'criterion': 'gini'}.
Trial 7102 finished with value: 0.6956521739130435 and parameters: {'n_estimators': 790, 'max_depth': 12, 'min_samples_split': 147, 'min_samples_leaf': 67, 'criterion': 'entropy'}.
Trial 7103 finished with value: 0.717391304347826 and parameters: {'n_estimators': 765, 'max_depth': 11, 'min_samples_split': 27, 'min_samples_leaf': 62, 'criterion': 'gini'}.
Trial 7104 finished with value: 0.6413043478260869 and parameters: {'n_estimators': 281, 'max_depth': 5, 'min_samples_split': 119, 'min_samples_leaf': 57, 'criterion': 'entropy'}.
Trial 7105 finished with value: 0.7282608695652174 and parameters: {'n_estimators': 258, 'max_depth': 9, 'min_samples_split': 21, 'min_samples_leaf': 60, 'criterion': 'gini'}.
Trial 7106 finished with value: 0.6847826086956522 and parameters: {'n_estimators': 330, 'max_depth': 15, 'min_samples_split': 109, 'min_samples_leaf': 15, 'criterion': 'entropy'}.
Trial 7107 finished with value: 0.7065217391304348 and parameters: {'n_estimators': 698, 'max_depth': 13, 'min_samples_split': 42, 'min_samples_leaf': 55, 'criterion': 'entropy'}.
Trial 7108 finished with value: 0.7065217391304348 and parameters: {'n_estimators': 290, 'max_depth': 7, 'min_samples_split': 32, 'min_samples_leaf': 74, 'criterion': 'gini'}.
Trial 7109 finished with value: 0.7065217391304348 and parameters: {'n_estimators': 753, 'max_depth': 10, 'min_samples_split': 24, 'min_samples_leaf': 59, 'criterion': 'entropy'}.
Trial 7110 finished with value: 0.7065217391304348 and parameters: {'n_estimators': 307, 'max_depth': 11, 'min_samples_split': 143, 'min_samples_leaf': 71, 'criterion': 'gini'}.
Trial 7111 finished with value: 0.6739130434782609 and parameters: {'n_estimators': 245, 'max_depth': 26, 'min_samples_split': 47, 'min_samples_leaf': 57, 'criterion': 'entropy'}.
Trial 7112 finished with value: 0.6847826086956522 and parameters: {'n_estimators': 267, 'max_depth': 8, 'min_samples_split': 29, 'min_samples_leaf': 39, 'criterion': 'gini'}.
Trial 7113 finished with value: 0.6630434782608695 and parameters: {'n_estimators': 719, 'max_depth': 16, 'min_samples_split': 131, 'min_samples_leaf': 62, 'criterion': 'entropy'}.
Trial 7114 finished with value: 0.717391304347826 and parameters: {'n_estimators': 280, 'max_depth': 13, 'min_samples_split': 37, 'min_samples_leaf': 69, 'criterion': 'gini'}.
Trial 7115 finished with value: 0.717391304347826 and parameters: {'n_estimators': 256, 'max_depth': 10, 'min_samples_split': 35, 'min_samples_leaf': 54, 'criterion': 'entropy'}.
Trial 7116 finished with value: 0.717391304347826 and parameters: {'n_estimators': 653, 'max_depth': 7, 'min_samples_split': 11, 'min_samples_leaf': 76, 'criterion': 'gini'}.
Trial 7117 finished with value: 0.6956521739130435 and parameters: {'n_estimators': 807, 'max_depth': 12, 'min_samples_split': 30, 'min_samples_leaf': 59, 'criterion': 'entropy'}.
Trial 7118 finished with value: 0.6956521739130435 and parameters: {'n_estimators': 630, 'max_depth': 9, 'min_samples_split': 139, 'min_samples_leaf': 65, 'criterion': 'entropy'}.
Trial 7119 finished with value: 0.6630434782608695 and parameters: {'n_estimators': 228, 'max_depth': 6, 'min_samples_split': 41, 'min_samples_leaf': 56, 'criterion': 'gini'}.
Trial 7120 finished with value: 0.6956521739130435 and parameters: {'n_estimators': 737, 'max_depth': 14, 'min_samples_split': 25, 'min_samples_leaf': 61, 'criterion': 'entropy'}.
Trial 7121 finished with value: 0.6630434782608695 and parameters: {'n_estimators': 301, 'max_depth': 17, 'min_samples_split': 135, 'min_samples_leaf': 58, 'criterion': 'gini'}.
Trial 7122 finished with value: 0.717391304347826 and parameters: {'n_estimators': 321, 'max_depth': 11, 'min_samples_split': 20, 'min_samples_leaf': 51, 'criterion': 'entropy'}.
Trial 7123 finished with value: 0.6956521739130435 and parameters: {'n_estimators': 773, 'max_depth': 9, 'min_samples_split': 32, 'min_samples_leaf': 63, 'criterion': 'gini'}.
Trial 7124 finished with value: 0.6739130434782609 and parameters: {'n_estimators': 282, 'max_depth': 12, 'min_samples_split': 147, 'min_samples_leaf': 79, 'criterion': 'entropy'}.
Trial 7125 finished with value: 0.7065217391304348 and parameters: {'n_estimators': 967, 'max_depth': 8, 'min_samples_split': 36, 'min_samples_leaf': 55, 'criterion': 'gini'}.
Trial 7126 finished with value: 0.717391304347826 and parameters: {'n_estimators': 342, 'max_depth': 14, 'min_samples_split': 27, 'min_samples_leaf': 60, 'criterion': 'entropy'}.
Trial 7127 finished with value: 0.6304347826086957 and parameters: {'n_estimators': 362, 'max_depth': 5, 'min_samples_split': 126, 'min_samples_leaf': 53, 'criterion': 'entropy'}.
Trial 7128 finished with value: 0.717391304347826 and parameters: {'n_estimators': 163, 'max_depth': 10, 'min_samples_split': 16, 'min_samples_leaf': 57, 'criterion': 'gini'}.
Trial 7129 finished with value: 0.6956521739130435 and parameters: {'n_estimators': 261, 'max_depth': 8, 'min_samples_split': 39, 'min_samples_leaf': 67, 'criterion': 'entropy'}.
Trial 7130 finished with value: 0.6739130434782609 and parameters: {'n_estimators': 297, 'max_depth': 81, 'min_samples_split': 44, 'min_samples_leaf': 74, 'criterion': 'gini'}.
Trial 7131 finished with value: 0.6956521739130435 and parameters: {'n_estimators': 234, 'max_depth': 12, 'min_samples_split': 142, 'min_samples_leaf': 59, 'criterion': 'entropy'}.
Trial 7132 finished with value: 0.7282608695652174 and parameters: {'n_estimators': 316, 'max_depth': 10, 'min_samples_split': 30, 'min_samples_leaf': 61, 'criterion': 'gini'}.
Trial 7133 finished with value: 0.6956521739130435 and parameters: {'n_estimators': 753, 'max_depth': 14, 'min_samples_split': 24, 'min_samples_leaf': 71, 'criterion': 'entropy'}.
Trial 7134 finished with value: 0.6847826086956522 and parameters: {'n_estimators': 890, 'max_depth': 6, 'min_samples_split': 33, 'min_samples_leaf': 56, 'criterion': 'gini'}.
Trial 7135 finished with value: 0.6956521739130435 and parameters: {'n_estimators': 274, 'max_depth': 11, 'min_samples_split': 36, 'min_samples_leaf': 69, 'criterion': 'entropy'}.
Trial 7136 finished with value: 0.7065217391304348 and parameters: {'n_estimators': 212, 'max_depth': 8, 'min_samples_split': 137, 'min_samples_leaf': 63, 'criterion': 'entropy'}.
Trial 7137 finished with value: 0.6739130434782609 and parameters: {'n_estimators': 786, 'max_depth': 30, 'min_samples_split': 55, 'min_samples_leaf': 58, 'criterion': 'gini'}.
Trial 7138 finished with value: 0.6739130434782609 and parameters: {'n_estimators': 291, 'max_depth': 16, 'min_samples_split': 130, 'min_samples_leaf': 65, 'criterion': 'entropy'}.
Trial 7139 finished with value: 0.717391304347826 and parameters: {'n_estimators': 248, 'max_depth': 12, 'min_samples_split': 117, 'min_samples_leaf': 54, 'criterion': 'gini'}.
Trial 7140 finished with value: 0.7065217391304348 and parameters: {'n_estimators': 190, 'max_depth': 9, 'min_samples_split': 29, 'min_samples_leaf': 61, 'criterion': 'entropy'}.
Trial 7141 finished with value: 0.7065217391304348 and parameters: {'n_estimators': 256, 'max_depth': 14, 'min_samples_split': 123, 'min_samples_leaf': 57, 'criterion': 'gini'}.
Trial 7142 finished with value: 0.6739130434782609 and parameters: {'n_estimators': 273, 'max_depth': 19, 'min_samples_split': 40, 'min_samples_leaf': 52, 'criterion': 'entropy'}.
Trial 7143 finished with value: 0.7065217391304348 and parameters: {'n_estimators': 306, 'max_depth': 7, 'min_samples_split': 20, 'min_samples_leaf': 59, 'criterion': 'gini'}.
Trial 7144 finished with value: 0.7065217391304348 and parameters: {'n_estimators': 1000, 'max_depth': 10, 'min_samples_split': 47, 'min_samples_leaf': 73, 'criterion': 'entropy'}.
Trial 7145 finished with value: 0.6847826086956522 and parameters: {'n_estimators': 461, 'max_depth': 13, 'min_samples_split': 26, 'min_samples_leaf': 56, 'criterion': 'entropy'}.
Trial 7146 finished with value: 0.717391304347826 and parameters: {'n_estimators': 730, 'max_depth': 11, 'min_samples_split': 33, 'min_samples_leaf': 62, 'criterion': 'gini'}.
Trial 7147 finished with value: 0.6521739130434783 and parameters: {'n_estimators': 284, 'max_depth': 61, 'min_samples_split': 144, 'min_samples_leaf': 59, 'criterion': 'entropy'}.
Trial 7148 finished with value: 0.6630434782608695 and parameters: {'n_estimators': 772, 'max_depth': 5, 'min_samples_split': 7, 'min_samples_leaf': 64, 'criterion': 'gini'}.
Trial 7149 finished with value: 0.7065217391304348 and parameters: {'n_estimators': 245, 'max_depth': 8, 'min_samples_split': 149, 'min_samples_leaf': 75, 'criterion': 'entropy'}.
Trial 7150 finished with value: 0.6630434782608695 and parameters: {'n_estimators': 801, 'max_depth': 16, 'min_samples_split': 134, 'min_samples_leaf': 4, 'criterion': 'gini'}.
Trial 7151 finished with value: 0.717391304347826 and parameters: {'n_estimators': 333, 'max_depth': 9, 'min_samples_split': 35, 'min_samples_leaf': 54, 'criterion': 'entropy'}.
Trial 7152 finished with value: 0.6956521739130435 and parameters: {'n_estimators': 264, 'max_depth': 12, 'min_samples_split': 23, 'min_samples_leaf': 70, 'criterion': 'gini'}.
Trial 7153 finished with value: 0.6847826086956522 and parameters: {'n_estimators': 299, 'max_depth': 7, 'min_samples_split': 29, 'min_samples_leaf': 60, 'criterion': 'entropy'}.
Trial 7154 finished with value: 0.7282608695652174 and parameters: {'n_estimators': 686, 'max_depth': 10, 'min_samples_split': 89, 'min_samples_leaf': 56, 'criterion': 'entropy'}.
Trial 7155 finished with value: 0.7065217391304348 and parameters: {'n_estimators': 746, 'max_depth': 13, 'min_samples_split': 113, 'min_samples_leaf': 58, 'criterion': 'gini'}.
Trial 7156 finished with value: 0.6847826086956522 and parameters: {'n_estimators': 318, 'max_depth': 15, 'min_samples_split': 38, 'min_samples_leaf': 67, 'criterion': 'entropy'}.
Trial 7157 finished with value: 0.7065217391304348 and parameters: {'n_estimators': 607, 'max_depth': 11, 'min_samples_split': 31, 'min_samples_leaf': 72, 'criterion': 'gini'}.
Trial 7158 finished with value: 0.6956521739130435 and parameters: {'n_estimators': 505, 'max_depth': 7, 'min_samples_split': 138, 'min_samples_leaf': 61, 'criterion': 'entropy'}.
Trial 7159 finished with value: 0.7282608695652174 and parameters: {'n_estimators': 277, 'max_depth': 9, 'min_samples_split': 13, 'min_samples_leaf': 57, 'criterion': 'gini'}.
Trial 7160 finished with value: 0.7065217391304348 and parameters: {'n_estimators': 711, 'max_depth': 12, 'min_samples_split': 120, 'min_samples_leaf': 55, 'criterion': 'entropy'}.
Trial 7161 finished with value: 0.6739130434782609 and parameters: {'n_estimators': 760, 'max_depth': 14, 'min_samples_split': 41, 'min_samples_leaf': 53, 'criterion': 'gini'}.
Trial 7162 finished with value: 0.6521739130434783 and parameters: {'n_estimators': 227, 'max_depth': 5, 'min_samples_split': 141, 'min_samples_leaf': 63, 'criterion': 'entropy'}.
Trial 7163 finished with value: 0.6847826086956522 and parameters: {'n_estimators': 291, 'max_depth': 21, 'min_samples_split': 26, 'min_samples_leaf': 59, 'criterion': 'entropy'}.
Trial 7164 finished with value: 0.6521739130434783 and parameters: {'n_estimators': 255, 'max_depth': 18, 'min_samples_split': 18, 'min_samples_leaf': 76, 'criterion': 'gini'}.
Trial 7165 finished with value: 0.717391304347826 and parameters: {'n_estimators': 275, 'max_depth': 10, 'min_samples_split': 35, 'min_samples_leaf': 66, 'criterion': 'entropy'}.
Trial 7166 finished with value: 0.717391304347826 and parameters: {'n_estimators': 309, 'max_depth': 8, 'min_samples_split': 132, 'min_samples_leaf': 61, 'criterion': 'gini'}.
Trial 7167 finished with value: 0.7065217391304348 and parameters: {'n_estimators': 238, 'max_depth': 11, 'min_samples_split': 44, 'min_samples_leaf': 58, 'criterion': 'entropy'}.
Trial 7168 finished with value: 0.6847826086956522 and parameters: {'n_estimators': 264, 'max_depth': 13, 'min_samples_split': 22, 'min_samples_leaf': 50, 'criterion': 'gini'}.
Trial 7169 finished with value: 0.7065217391304348 and parameters: {'n_estimators': 779, 'max_depth': 7, 'min_samples_split': 30, 'min_samples_leaf': 69, 'criterion': 'entropy'}.
Trial 7170 finished with value: 0.7282608695652174 and parameters: {'n_estimators': 294, 'max_depth': 9, 'min_samples_split': 33, 'min_samples_leaf': 55, 'criterion': 'gini'}.
Trial 7171 finished with value: 0.6739130434782609 and parameters: {'n_estimators': 347, 'max_depth': 15, 'min_samples_split': 38, 'min_samples_leaf': 60, 'criterion': 'entropy'}.
Trial 7172 finished with value: 0.6739130434782609 and parameters: {'n_estimators': 322, 'max_depth': 11, 'min_samples_split': 147, 'min_samples_leaf': 57, 'criterion': 'gini'}.
Trial 7173 finished with value: 0.6739130434782609 and parameters: {'n_estimators': 721, 'max_depth': 54, 'min_samples_split': 27, 'min_samples_leaf': 64, 'criterion': 'entropy'}.
Trial 7174 finished with value: 0.7065217391304348 and parameters: {'n_estimators': 743, 'max_depth': 9, 'min_samples_split': 102, 'min_samples_leaf': 72, 'criterion': 'entropy'}.
Trial 7175 finished with value: 0.6847826086956522 and parameters: {'n_estimators': 278, 'max_depth': 12, 'min_samples_split': 197, 'min_samples_leaf': 62, 'criterion': 'gini'}.
Trial 7176 finished with value: 0.6847826086956522 and parameters: {'n_estimators': 207, 'max_depth': 6, 'min_samples_split': 43, 'min_samples_leaf': 52, 'criterion': 'entropy'}.
Trial 7177 finished with value: 0.6956521739130435 and parameters: {'n_estimators': 905, 'max_depth': 16, 'min_samples_split': 36, 'min_samples_leaf': 55, 'criterion': 'gini'}.
Trial 7178 finished with value: 0.717391304347826 and parameters: {'n_estimators': 248, 'max_depth': 10, 'min_samples_split': 127, 'min_samples_leaf': 58, 'criterion': 'entropy'}.
Trial 7179 finished with value: 0.6956521739130435 and parameters: {'n_estimators': 299, 'max_depth': 13, 'min_samples_split': 143, 'min_samples_leaf': 60, 'criterion': 'gini'}.
Trial 7180 finished with value: 0.717391304347826 and parameters: {'n_estimators': 393, 'max_depth': 8, 'min_samples_split': 23, 'min_samples_leaf': 74, 'criterion': 'entropy'}.
Trial 7181 finished with value: 0.717391304347826 and parameters: {'n_estimators': 269, 'max_depth': 11, 'min_samples_split': 65, 'min_samples_leaf': 56, 'criterion': 'gini'}.
Trial 7182 finished with value: 0.6956521739130435 and parameters: {'n_estimators': 437, 'max_depth': 7, 'min_samples_split': 49, 'min_samples_leaf': 62, 'criterion': 'entropy'}.
