Trial 8167 finished with value: 0.6956521739130435 and parameters: {'n_estimators': 241, 'max_depth': 11, 'min_samples_split': 146, 'min_samples_leaf': 54, 'criterion': 'gini'}.
Trial 8168 finished with value: 0.6847826086956522 and parameters: {'n_estimators': 789, 'max_depth': 21, 'min_samples_split': 19, 'min_samples_leaf': 57, 'criterion': 'entropy'}.
Trial 8169 finished with value: 0.6413043478260869 and parameters: {'n_estimators': 707, 'max_depth': 5, 'min_samples_split': 108, 'min_samples_leaf': 61, 'criterion': 'gini'}.
Trial 8170 finished with value: 0.7065217391304348 and parameters: {'n_estimators': 282, 'max_depth': 8, 'min_samples_split': 14, 'min_samples_leaf': 73, 'criterion': 'entropy'}.
Trial 8171 finished with value: 0.7282608695652174 and parameters: {'n_estimators': 757, 'max_depth': 10, 'min_samples_split': 28, 'min_samples_leaf': 56, 'criterion': 'entropy'}.
Trial 8172 finished with value: 0.7065217391304348 and parameters: {'n_estimators': 291, 'max_depth': 12, 'min_samples_split': 39, 'min_samples_leaf': 58, 'criterion': 'gini'}.
Trial 8173 finished with value: 0.6630434782608695 and parameters: {'n_estimators': 118, 'max_depth': 15, 'min_samples_split': 26, 'min_samples_leaf': 50, 'criterion': 'entropy'}.
Trial 8174 finished with value: 0.6956521739130435 and parameters: {'n_estimators': 225, 'max_depth': 7, 'min_samples_split': 31, 'min_samples_leaf': 63, 'criterion': 'gini'}.
Trial 8175 finished with value: 0.717391304347826 and parameters: {'n_estimators': 313, 'max_depth': 9, 'min_samples_split': 113, 'min_samples_leaf': 71, 'criterion': 'entropy'}.
Trial 8176 finished with value: 0.717391304347826 and parameters: {'n_estimators': 261, 'max_depth': 13, 'min_samples_split': 5, 'min_samples_leaf': 59, 'criterion': 'gini'}.
Trial 8177 finished with value: 0.717391304347826 and parameters: {'n_estimators': 328, 'max_depth': 10, 'min_samples_split': 35, 'min_samples_leaf': 54, 'criterion': 'entropy'}.
Trial 8178 finished with value: 0.7065217391304348 and parameters: {'n_estimators': 667, 'max_depth': 12, 'min_samples_split': 120, 'min_samples_leaf': 61, 'criterion': 'gini'}.
Trial 8179 finished with value: 0.6739130434782609 and parameters: {'n_estimators': 292, 'max_depth': 7, 'min_samples_split': 140, 'min_samples_leaf': 56, 'criterion': 'entropy'}.
Trial 8180 finished with value: 0.6630434782608695 and parameters: {'n_estimators': 249, 'max_depth': 18, 'min_samples_split': 135, 'min_samples_leaf': 59, 'criterion': 'entropy'}.
Trial 8181 finished with value: 0.717391304347826 and parameters: {'n_estimators': 726, 'max_depth': 9, 'min_samples_split': 37, 'min_samples_leaf': 76, 'criterion': 'gini'}.
Trial 8182 finished with value: 0.6847826086956522 and parameters: {'n_estimators': 801, 'max_depth': 16, 'min_samples_split': 43, 'min_samples_leaf': 66, 'criterion': 'entropy'}.
Trial 8183 finished with value: 0.7065217391304348 and parameters: {'n_estimators': 277, 'max_depth': 11, 'min_samples_split': 125, 'min_samples_leaf': 69, 'criterion': 'gini'}.
Trial 8184 finished with value: 0.6630434782608695 and parameters: {'n_estimators': 304, 'max_depth': 5, 'min_samples_split': 21, 'min_samples_leaf': 64, 'criterion': 'entropy'}.
Trial 8185 finished with value: 0.6956521739130435 and parameters: {'n_estimators': 771, 'max_depth': 13, 'min_samples_split': 31, 'min_samples_leaf': 57, 'criterion': 'gini'}.
Trial 8186 finished with value: 0.6847826086956522 and parameters: {'n_estimators': 746, 'max_depth': 9, 'min_samples_split': 26, 'min_samples_leaf': 52, 'criterion': 'entropy'}.
Trial 8187 finished with value: 0.7065217391304348 and parameters: {'n_estimators': 238, 'max_depth': 14, 'min_samples_split': 98, 'min_samples_leaf': 61, 'criterion': 'gini'}.
Trial 8188 finished with value: 0.7065217391304348 and parameters: {'n_estimators': 270, 'max_depth': 11, 'min_samples_split': 41, 'min_samples_leaf': 55, 'criterion': 'entropy'}.
Trial 8189 finished with value: 0.7282608695652174 and parameters: {'n_estimators': 881, 'max_depth': 8, 'min_samples_split': 131, 'min_samples_leaf': 59, 'criterion': 'gini'}.
Trial 8190 finished with value: 0.6195652173913043 and parameters: {'n_estimators': 348, 'max_depth': 7, 'min_samples_split': 34, 'min_samples_leaf': 18, 'criterion': 'entropy'}.
Trial 8191 finished with value: 0.6739130434782609 and parameters: {'n_estimators': 290, 'max_depth': 34, 'min_samples_split': 143, 'min_samples_leaf': 72, 'criterion': 'entropy'}.
Trial 8192 finished with value: 0.717391304347826 and parameters: {'n_estimators': 951, 'max_depth': 10, 'min_samples_split': 29, 'min_samples_leaf': 57, 'criterion': 'gini'}.
Trial 8193 finished with value: 0.6847826086956522 and parameters: {'n_estimators': 253, 'max_depth': 15, 'min_samples_split': 152, 'min_samples_leaf': 74, 'criterion': 'entropy'}.
Trial 8194 finished with value: 0.6956521739130435 and parameters: {'n_estimators': 450, 'max_depth': 12, 'min_samples_split': 24, 'min_samples_leaf': 63, 'criterion': 'gini'}.
Trial 8195 finished with value: 0.6630434782608695 and parameters: {'n_estimators': 323, 'max_depth': 6, 'min_samples_split': 37, 'min_samples_leaf': 54, 'criterion': 'entropy'}.
Trial 8196 finished with value: 0.717391304347826 and parameters: {'n_estimators': 275, 'max_depth': 10, 'min_samples_split': 46, 'min_samples_leaf': 60, 'criterion': 'gini'}.
Trial 8197 finished with value: 0.6956521739130435 and parameters: {'n_estimators': 302, 'max_depth': 13, 'min_samples_split': 137, 'min_samples_leaf': 58, 'criterion': 'entropy'}.
Trial 8198 finished with value: 0.717391304347826 and parameters: {'n_estimators': 219, 'max_depth': 9, 'min_samples_split': 17, 'min_samples_leaf': 62, 'criterion': 'gini'}.
Trial 8199 finished with value: 0.6956521739130435 and parameters: {'n_estimators': 779, 'max_depth': 7, 'min_samples_split': 32, 'min_samples_leaf': 56, 'criterion': 'entropy'}.
Trial 8200 finished with value: 0.7065217391304348 and parameters: {'n_estimators': 267, 'max_depth': 11, 'min_samples_split': 146, 'min_samples_leaf': 70, 'criterion': 'entropy'}.
Trial 8201 finished with value: 0.6630434782608695 and parameters: {'n_estimators': 290, 'max_depth': 15, 'min_samples_split': 28, 'min_samples_leaf': 67, 'criterion': 'gini'}.
Trial 8202 finished with value: 0.6630434782608695 and parameters: {'n_estimators': 723, 'max_depth': 19, 'min_samples_split': 116, 'min_samples_leaf': 60, 'criterion': 'entropy'}.
Trial 8203 finished with value: 0.7065217391304348 and parameters: {'n_estimators': 247, 'max_depth': 8, 'min_samples_split': 41, 'min_samples_leaf': 52, 'criterion': 'gini'}.
Trial 8204 finished with value: 0.7065217391304348 and parameters: {'n_estimators': 806, 'max_depth': 12, 'min_samples_split': 128, 'min_samples_leaf': 58, 'criterion': 'entropy'}.
Trial 8205 finished with value: 0.6304347826086957 and parameters: {'n_estimators': 378, 'max_depth': 5, 'min_samples_split': 21, 'min_samples_leaf': 55, 'criterion': 'gini'}.
Trial 8206 finished with value: 0.6739130434782609 and parameters: {'n_estimators': 314, 'max_depth': 10, 'min_samples_split': 156, 'min_samples_leaf': 78, 'criterion': 'entropy'}.
Trial 8207 finished with value: 0.6739130434782609 and parameters: {'n_estimators': 204, 'max_depth': 17, 'min_samples_split': 35, 'min_samples_leaf': 64, 'criterion': 'gini'}.
Trial 8208 finished with value: 0.6739130434782609 and parameters: {'n_estimators': 173, 'max_depth': 29, 'min_samples_split': 122, 'min_samples_leaf': 74, 'criterion': 'entropy'}.
Trial 8209 finished with value: 0.6956521739130435 and parameters: {'n_estimators': 757, 'max_depth': 14, 'min_samples_split': 72, 'min_samples_leaf': 61, 'criterion': 'entropy'}.
Trial 8210 finished with value: 0.717391304347826 and parameters: {'n_estimators': 402, 'max_depth': 8, 'min_samples_split': 11, 'min_samples_leaf': 58, 'criterion': 'gini'}.
Trial 8211 finished with value: 0.717391304347826 and parameters: {'n_estimators': 285, 'max_depth': 12, 'min_samples_split': 26, 'min_samples_leaf': 56, 'criterion': 'entropy'}.
Trial 8212 finished with value: 0.6956521739130435 and parameters: {'n_estimators': 855, 'max_depth': 10, 'min_samples_split': 38, 'min_samples_leaf': 72, 'criterion': 'gini'}.
Trial 8213 finished with value: 0.6630434782608695 and parameters: {'n_estimators': 336, 'max_depth': 7, 'min_samples_split': 33, 'min_samples_leaf': 53, 'criterion': 'entropy'}.
Trial 8214 finished with value: 0.7065217391304348 and parameters: {'n_estimators': 257, 'max_depth': 13, 'min_samples_split': 139, 'min_samples_leaf': 65, 'criterion': 'gini'}.
Trial 8215 finished with value: 0.7065217391304348 and parameters: {'n_estimators': 301, 'max_depth': 9, 'min_samples_split': 30, 'min_samples_leaf': 59, 'criterion': 'entropy'}.
Trial 8216 finished with value: 0.6956521739130435 and parameters: {'n_estimators': 233, 'max_depth': 11, 'min_samples_split': 132, 'min_samples_leaf': 62, 'criterion': 'gini'}.
Trial 8217 finished with value: 0.6739130434782609 and parameters: {'n_estimators': 268, 'max_depth': 75, 'min_samples_split': 23, 'min_samples_leaf': 76, 'criterion': 'entropy'}.
Trial 8218 finished with value: 0.6847826086956522 and parameters: {'n_estimators': 744, 'max_depth': 14, 'min_samples_split': 42, 'min_samples_leaf': 54, 'criterion': 'entropy'}.
Trial 8219 finished with value: 0.717391304347826 and parameters: {'n_estimators': 276, 'max_depth': 8, 'min_samples_split': 142, 'min_samples_leaf': 69, 'criterion': 'gini'}.
Trial 8220 finished with value: 0.6956521739130435 and parameters: {'n_estimators': 708, 'max_depth': 16, 'min_samples_split': 149, 'min_samples_leaf': 50, 'criterion': 'entropy'}.
Trial 8221 finished with value: 0.717391304347826 and parameters: {'n_estimators': 777, 'max_depth': 11, 'min_samples_split': 34, 'min_samples_leaf': 59, 'criterion': 'gini'}.
Trial 8222 finished with value: 0.6304347826086957 and parameters: {'n_estimators': 298, 'max_depth': 5, 'min_samples_split': 29, 'min_samples_leaf': 56, 'criterion': 'entropy'}.
Trial 8223 finished with value: 0.717391304347826 and parameters: {'n_estimators': 984, 'max_depth': 9, 'min_samples_split': 14, 'min_samples_leaf': 61, 'criterion': 'gini'}.
Trial 8224 finished with value: 0.7065217391304348 and parameters: {'n_estimators': 327, 'max_depth': 12, 'min_samples_split': 49, 'min_samples_leaf': 57, 'criterion': 'entropy'}.
Trial 8225 finished with value: 0.6956521739130435 and parameters: {'n_estimators': 252, 'max_depth': 7, 'min_samples_split': 38, 'min_samples_leaf': 63, 'criterion': 'gini'}.
Trial 8226 finished with value: 0.717391304347826 and parameters: {'n_estimators': 285, 'max_depth': 10, 'min_samples_split': 27, 'min_samples_leaf': 60, 'criterion': 'entropy'}.
Trial 8227 finished with value: 0.6521739130434783 and parameters: {'n_estimators': 234, 'max_depth': 14, 'min_samples_split': 45, 'min_samples_leaf': 67, 'criterion': 'entropy'}.
Trial 8228 finished with value: 0.717391304347826 and parameters: {'n_estimators': 835, 'max_depth': 13, 'min_samples_split': 19, 'min_samples_leaf': 54, 'criterion': 'gini'}.
Trial 8229 finished with value: 0.6847826086956522 and parameters: {'n_estimators': 313, 'max_depth': 9, 'min_samples_split': 136, 'min_samples_leaf': 58, 'criterion': 'entropy'}.
Trial 8230 finished with value: 0.7065217391304348 and parameters: {'n_estimators': 731, 'max_depth': 11, 'min_samples_split': 107, 'min_samples_leaf': 71, 'criterion': 'gini'}.
Trial 8231 finished with value: 0.6956521739130435 and parameters: {'n_estimators': 421, 'max_depth': 7, 'min_samples_split': 32, 'min_samples_leaf': 65, 'criterion': 'entropy'}.
Trial 8232 finished with value: 0.717391304347826 and parameters: {'n_estimators': 267, 'max_depth': 12, 'min_samples_split': 23, 'min_samples_leaf': 57, 'criterion': 'gini'}.
Trial 8233 finished with value: 0.6956521739130435 and parameters: {'n_estimators': 761, 'max_depth': 16, 'min_samples_split': 36, 'min_samples_leaf': 62, 'criterion': 'entropy'}.
Trial 8234 finished with value: 0.6739130434782609 and parameters: {'n_estimators': 548, 'max_depth': 6, 'min_samples_split': 144, 'min_samples_leaf': 74, 'criterion': 'gini'}.
Trial 8235 finished with value: 0.6956521739130435 and parameters: {'n_estimators': 786, 'max_depth': 9, 'min_samples_split': 125, 'min_samples_leaf': 60, 'criterion': 'entropy'}.
Trial 8236 finished with value: 0.717391304347826 and parameters: {'n_estimators': 283, 'max_depth': 10, 'min_samples_split': 39, 'min_samples_leaf': 55, 'criterion': 'entropy'}.
Trial 8237 finished with value: 0.7065217391304348 and parameters: {'n_estimators': 248, 'max_depth': 14, 'min_samples_split': 31, 'min_samples_leaf': 58, 'criterion': 'gini'}.
Trial 8238 finished with value: 0.6956521739130435 and parameters: {'n_estimators': 304, 'max_depth': 12, 'min_samples_split': 119, 'min_samples_leaf': 52, 'criterion': 'entropy'}.
Trial 8239 finished with value: 0.717391304347826 and parameters: {'n_estimators': 347, 'max_depth': 8, 'min_samples_split': 112, 'min_samples_leaf': 68, 'criterion': 'gini'}.
Trial 8240 finished with value: 0.6304347826086957 and parameters: {'n_estimators': 262, 'max_depth': 5, 'min_samples_split': 25, 'min_samples_leaf': 60, 'criterion': 'entropy'}.
Trial 8241 finished with value: 0.7065217391304348 and parameters: {'n_estimators': 510, 'max_depth': 11, 'min_samples_split': 129, 'min_samples_leaf': 55, 'criterion': 'gini'}.
Trial 8242 finished with value: 0.6739130434782609 and parameters: {'n_estimators': 898, 'max_depth': 15, 'min_samples_split': 35, 'min_samples_leaf': 63, 'criterion': 'entropy'}.
Trial 8243 finished with value: 0.6956521739130435 and parameters: {'n_estimators': 221, 'max_depth': 8, 'min_samples_split': 138, 'min_samples_leaf': 72, 'criterion': 'gini'}.
Trial 8244 finished with value: 0.7065217391304348 and parameters: {'n_estimators': 276, 'max_depth': 10, 'min_samples_split': 28, 'min_samples_leaf': 57, 'criterion': 'entropy'}.
Trial 8245 finished with value: 0.6847826086956522 and parameters: {'n_estimators': 145, 'max_depth': 13, 'min_samples_split': 21, 'min_samples_leaf': 76, 'criterion': 'gini'}.
Trial 8246 finished with value: 0.6847826086956522 and parameters: {'n_estimators': 318, 'max_depth': 7, 'min_samples_split': 43, 'min_samples_leaf': 61, 'criterion': 'entropy'}.
Trial 8247 finished with value: 0.6739130434782609 and parameters: {'n_estimators': 466, 'max_depth': 17, 'min_samples_split': 31, 'min_samples_leaf': 59, 'criterion': 'entropy'}.
Trial 8248 finished with value: 0.717391304347826 and parameters: {'n_estimators': 740, 'max_depth': 10, 'min_samples_split': 39, 'min_samples_leaf': 70, 'criterion': 'gini'}.
Trial 8249 finished with value: 0.6739130434782609 and parameters: {'n_estimators': 297, 'max_depth': 80, 'min_samples_split': 145, 'min_samples_leaf': 53, 'criterion': 'entropy'}.
Trial 8250 finished with value: 0.7065217391304348 and parameters: {'n_estimators': 817, 'max_depth': 12, 'min_samples_split': 34, 'min_samples_leaf': 56, 'criterion': 'gini'}.
Trial 8251 finished with value: 0.6847826086956522 and parameters: {'n_estimators': 195, 'max_depth': 9, 'min_samples_split': 134, 'min_samples_leaf': 64, 'criterion': 'entropy'}.
Trial 8252 finished with value: 0.6630434782608695 and parameters: {'n_estimators': 252, 'max_depth': 6, 'min_samples_split': 54, 'min_samples_leaf': 50, 'criterion': 'gini'}.
Trial 8253 finished with value: 0.6739130434782609 and parameters: {'n_estimators': 696, 'max_depth': 14, 'min_samples_split': 103, 'min_samples_leaf': 84, 'criterion': 'entropy'}.
Trial 8254 finished with value: 0.717391304347826 and parameters: {'n_estimators': 279, 'max_depth': 11, 'min_samples_split': 25, 'min_samples_leaf': 58, 'criterion': 'gini'}.
Trial 8255 finished with value: 0.6739130434782609 and parameters: {'n_estimators': 800, 'max_depth': 68, 'min_samples_split': 16, 'min_samples_leaf': 66, 'criterion': 'entropy'}.
Trial 8256 finished with value: 0.6739130434782609 and parameters: {'n_estimators': 235, 'max_depth': 7, 'min_samples_split': 149, 'min_samples_leaf': 62, 'criterion': 'entropy'}.
Trial 8257 finished with value: 0.6847826086956522 and parameters: {'n_estimators': 764, 'max_depth': 24, 'min_samples_split': 140, 'min_samples_leaf': 56, 'criterion': 'gini'}.
Trial 8258 finished with value: 0.7065217391304348 and parameters: {'n_estimators': 265, 'max_depth': 9, 'min_samples_split': 31, 'min_samples_leaf': 60, 'criterion': 'entropy'}.
Trial 8259 finished with value: 0.6739130434782609 and parameters: {'n_estimators': 914, 'max_depth': 16, 'min_samples_split': 37, 'min_samples_leaf': 73, 'criterion': 'gini'}.
Trial 8260 finished with value: 0.6521739130434783 and parameters: {'n_estimators': 637, 'max_depth': 19, 'min_samples_split': 28, 'min_samples_leaf': 58, 'criterion': 'entropy'}.
Trial 8261 finished with value: 0.7065217391304348 and parameters: {'n_estimators': 296, 'max_depth': 13, 'min_samples_split': 41, 'min_samples_leaf': 54, 'criterion': 'gini'}.
Trial 8262 finished with value: 0.7282608695652174 and parameters: {'n_estimators': 325, 'max_depth': 11, 'min_samples_split': 122, 'min_samples_leaf': 60, 'criterion': 'entropy'}.
Trial 8263 finished with value: 0.7065217391304348 and parameters: {'n_estimators': 285, 'max_depth': 8, 'min_samples_split': 19, 'min_samples_leaf': 69, 'criterion': 'gini'}.
Trial 8264 finished with value: 0.6956521739130435 and parameters: {'n_estimators': 751, 'max_depth': 12, 'min_samples_split': 46, 'min_samples_leaf': 56, 'criterion': 'entropy'}.
Trial 8265 finished with value: 0.6630434782608695 and parameters: {'n_estimators': 718, 'max_depth': 5, 'min_samples_split': 34, 'min_samples_leaf': 63, 'criterion': 'entropy'}.
Trial 8266 finished with value: 0.6956521739130435 and parameters: {'n_estimators': 673, 'max_depth': 10, 'min_samples_split': 116, 'min_samples_leaf': 75, 'criterion': 'gini'}.
Trial 8267 finished with value: 0.6847826086956522 and parameters: {'n_estimators': 355, 'max_depth': 15, 'min_samples_split': 24, 'min_samples_leaf': 51, 'criterion': 'entropy'}.
Trial 8268 finished with value: 0.717391304347826 and parameters: {'n_estimators': 784, 'max_depth': 8, 'min_samples_split': 27, 'min_samples_leaf': 58, 'criterion': 'gini'}.
Trial 8269 finished with value: 0.6956521739130435 and parameters: {'n_estimators': 307, 'max_depth': 13, 'min_samples_split': 132, 'min_samples_leaf': 61, 'criterion': 'entropy'}.
Trial 8270 finished with value: 0.7282608695652174 and parameters: {'n_estimators': 253, 'max_depth': 10, 'min_samples_split': 77, 'min_samples_leaf': 53, 'criterion': 'gini'}.
Trial 8271 finished with value: 0.6956521739130435 and parameters: {'n_estimators': 269, 'max_depth': 8, 'min_samples_split': 38, 'min_samples_leaf': 78, 'criterion': 'entropy'}.
Trial 8272 finished with value: 0.5978260869565217 and parameters: {'n_estimators': 232, 'max_depth': 57, 'min_samples_split': 30, 'min_samples_leaf': 7, 'criterion': 'gini'}.
Trial 8273 finished with value: 0.6956521739130435 and parameters: {'n_estimators': 283, 'max_depth': 12, 'min_samples_split': 141, 'min_samples_leaf': 71, 'criterion': 'entropy'}.
Trial 8274 finished with value: 0.6739130434782609 and parameters: {'n_estimators': 320, 'max_depth': 6, 'min_samples_split': 147, 'min_samples_leaf': 59, 'criterion': 'entropy'}.
Trial 8275 finished with value: 0.6956521739130435 and parameters: {'n_estimators': 299, 'max_depth': 14, 'min_samples_split': 34, 'min_samples_leaf': 65, 'criterion': 'gini'}.
Trial 8276 finished with value: 0.7065217391304348 and parameters: {'n_estimators': 100, 'max_depth': 10, 'min_samples_split': 21, 'min_samples_leaf': 56, 'criterion': 'entropy'}.
Trial 8277 finished with value: 0.7065217391304348 and parameters: {'n_estimators': 254, 'max_depth': 11, 'min_samples_split': 169, 'min_samples_leaf': 54, 'criterion': 'gini'}.
Trial 8278 finished with value: 0.7065217391304348 and parameters: {'n_estimators': 607, 'max_depth': 8, 'min_samples_split': 127, 'min_samples_leaf': 62, 'criterion': 'entropy'}.
Trial 8279 finished with value: 0.6847826086956522 and parameters: {'n_estimators': 273, 'max_depth': 16, 'min_samples_split': 86, 'min_samples_leaf': 68, 'criterion': 'gini'}.
Trial 8280 finished with value: 0.7065217391304348 and parameters: {'n_estimators': 336, 'max_depth': 13, 'min_samples_split': 43, 'min_samples_leaf': 57, 'criterion': 'entropy'}.
Trial 8281 finished with value: 0.7065217391304348 and parameters: {'n_estimators': 745, 'max_depth': 9, 'min_samples_split': 8, 'min_samples_leaf': 60, 'criterion': 'gini'}.
Trial 8282 finished with value: 0.6630434782608695 and parameters: {'n_estimators': 220, 'max_depth': 6, 'min_samples_split': 136, 'min_samples_leaf': 73, 'criterion': 'entropy'}.
Trial 8283 finished with value: 0.7282608695652174 and parameters: {'n_estimators': 289, 'max_depth': 11, 'min_samples_split': 27, 'min_samples_leaf': 58, 'criterion': 'entropy'}.
Trial 8284 finished with value: 0.6847826086956522 and parameters: {'n_estimators': 765, 'max_depth': 18, 'min_samples_split': 32, 'min_samples_leaf': 55, 'criterion': 'gini'}.
Trial 8285 finished with value: 0.6847826086956522 and parameters: {'n_estimators': 243, 'max_depth': 14, 'min_samples_split': 37, 'min_samples_leaf': 63, 'criterion': 'entropy'}.
Trial 8286 finished with value: 0.7065217391304348 and parameters: {'n_estimators': 307, 'max_depth': 9, 'min_samples_split': 16, 'min_samples_leaf': 66, 'criterion': 'gini'}.
Trial 8287 finished with value: 0.6956521739130435 and parameters: {'n_estimators': 268, 'max_depth': 7, 'min_samples_split': 142, 'min_samples_leaf': 60, 'criterion': 'entropy'}.
Trial 8288 finished with value: 0.6956521739130435 and parameters: {'n_estimators': 730, 'max_depth': 12, 'min_samples_split': 24, 'min_samples_leaf': 57, 'criterion': 'gini'}.
Trial 8289 finished with value: 0.6847826086956522 and parameters: {'n_estimators': 792, 'max_depth': 10, 'min_samples_split': 32, 'min_samples_leaf': 75, 'criterion': 'entropy'}.
