Trial 9393 finished with value: 0.7065217391304348 and parameters: {'n_estimators': 318, 'max_depth': 13, 'min_samples_split': 131, 'min_samples_leaf': 53, 'criterion': 'gini'}.
Trial 9394 finished with value: 0.6956521739130435 and parameters: {'n_estimators': 826, 'max_depth': 9, 'min_samples_split': 38, 'min_samples_leaf': 61, 'criterion': 'entropy'}.
Trial 9395 finished with value: 0.7065217391304348 and parameters: {'n_estimators': 283, 'max_depth': 11, 'min_samples_split': 143, 'min_samples_leaf': 57, 'criterion': 'entropy'}.
Trial 9396 finished with value: 0.6956521739130435 and parameters: {'n_estimators': 739, 'max_depth': 12, 'min_samples_split': 26, 'min_samples_leaf': 64, 'criterion': 'gini'}.
Trial 9397 finished with value: 0.7065217391304348 and parameters: {'n_estimators': 397, 'max_depth': 15, 'min_samples_split': 147, 'min_samples_leaf': 55, 'criterion': 'entropy'}.
Trial 9398 finished with value: 0.7065217391304348 and parameters: {'n_estimators': 221, 'max_depth': 8, 'min_samples_split': 64, 'min_samples_leaf': 58, 'criterion': 'gini'}.
Trial 9399 finished with value: 0.6630434782608695 and parameters: {'n_estimators': 790, 'max_depth': 27, 'min_samples_split': 34, 'min_samples_leaf': 61, 'criterion': 'entropy'}.
Trial 9400 finished with value: 0.6630434782608695 and parameters: {'n_estimators': 257, 'max_depth': 5, 'min_samples_split': 123, 'min_samples_leaf': 75, 'criterion': 'gini'}.
Trial 9401 finished with value: 0.6739130434782609 and parameters: {'n_estimators': 961, 'max_depth': 10, 'min_samples_split': 46, 'min_samples_leaf': 78, 'criterion': 'entropy'}.
Trial 9402 finished with value: 0.6630434782608695 and parameters: {'n_estimators': 302, 'max_depth': 14, 'min_samples_split': 30, 'min_samples_leaf': 67, 'criterion': 'entropy'}.
Trial 9403 finished with value: 0.7065217391304348 and parameters: {'n_estimators': 328, 'max_depth': 7, 'min_samples_split': 40, 'min_samples_leaf': 59, 'criterion': 'gini'}.
Trial 9404 finished with value: 0.717391304347826 and parameters: {'n_estimators': 755, 'max_depth': 10, 'min_samples_split': 14, 'min_samples_leaf': 55, 'criterion': 'entropy'}.
Trial 9405 finished with value: 0.7282608695652174 and parameters: {'n_estimators': 264, 'max_depth': 12, 'min_samples_split': 21, 'min_samples_leaf': 53, 'criterion': 'gini'}.
Trial 9406 finished with value: 0.717391304347826 and parameters: {'n_estimators': 284, 'max_depth': 9, 'min_samples_split': 172, 'min_samples_leaf': 57, 'criterion': 'entropy'}.
Trial 9407 finished with value: 0.6847826086956522 and parameters: {'n_estimators': 117, 'max_depth': 16, 'min_samples_split': 36, 'min_samples_leaf': 62, 'criterion': 'entropy'}.
Trial 9408 finished with value: 0.6956521739130435 and parameters: {'n_estimators': 863, 'max_depth': 12, 'min_samples_split': 25, 'min_samples_leaf': 65, 'criterion': 'gini'}.
Trial 9409 finished with value: 0.7065217391304348 and parameters: {'n_estimators': 237, 'max_depth': 7, 'min_samples_split': 31, 'min_samples_leaf': 59, 'criterion': 'entropy'}.
Trial 9410 finished with value: 0.6847826086956522 and parameters: {'n_estimators': 302, 'max_depth': 14, 'min_samples_split': 44, 'min_samples_leaf': 56, 'criterion': 'gini'}.
Trial 9411 finished with value: 0.6847826086956522 and parameters: {'n_estimators': 269, 'max_depth': 9, 'min_samples_split': 133, 'min_samples_leaf': 50, 'criterion': 'entropy'}.
Trial 9412 finished with value: 0.6413043478260869 and parameters: {'n_estimators': 319, 'max_depth': 21, 'min_samples_split': 115, 'min_samples_leaf': 7, 'criterion': 'entropy'}.
Trial 9413 finished with value: 0.6521739130434783 and parameters: {'n_estimators': 209, 'max_depth': 11, 'min_samples_split': 35, 'min_samples_leaf': 3, 'criterion': 'gini'}.
Trial 9414 finished with value: 0.6630434782608695 and parameters: {'n_estimators': 768, 'max_depth': 5, 'min_samples_split': 39, 'min_samples_leaf': 73, 'criterion': 'entropy'}.
Trial 9415 finished with value: 0.717391304347826 and parameters: {'n_estimators': 627, 'max_depth': 8, 'min_samples_split': 150, 'min_samples_leaf': 70, 'criterion': 'gini'}.
Trial 9416 finished with value: 0.6956521739130435 and parameters: {'n_estimators': 278, 'max_depth': 18, 'min_samples_split': 51, 'min_samples_leaf': 60, 'criterion': 'entropy'}.
Trial 9417 finished with value: 0.6739130434782609 and parameters: {'n_estimators': 249, 'max_depth': 13, 'min_samples_split': 17, 'min_samples_leaf': 63, 'criterion': 'gini'}.
Trial 9418 finished with value: 0.6847826086956522 and parameters: {'n_estimators': 303, 'max_depth': 63, 'min_samples_split': 156, 'min_samples_leaf': 54, 'criterion': 'entropy'}.
Trial 9419 finished with value: 0.717391304347826 and parameters: {'n_estimators': 721, 'max_depth': 10, 'min_samples_split': 27, 'min_samples_leaf': 57, 'criterion': 'entropy'}.
Trial 9420 finished with value: 0.7282608695652174 and parameters: {'n_estimators': 285, 'max_depth': 11, 'min_samples_split': 23, 'min_samples_leaf': 60, 'criterion': 'gini'}.
Trial 9421 finished with value: 0.6630434782608695 and parameters: {'n_estimators': 745, 'max_depth': 7, 'min_samples_split': 32, 'min_samples_leaf': 52, 'criterion': 'entropy'}.
Trial 9422 finished with value: 0.6956521739130435 and parameters: {'n_estimators': 694, 'max_depth': 14, 'min_samples_split': 41, 'min_samples_leaf': 58, 'criterion': 'gini'}.
Trial 9423 finished with value: 0.7065217391304348 and parameters: {'n_estimators': 787, 'max_depth': 10, 'min_samples_split': 142, 'min_samples_leaf': 61, 'criterion': 'entropy'}.
Trial 9424 finished with value: 0.6413043478260869 and parameters: {'n_estimators': 360, 'max_depth': 12, 'min_samples_split': 126, 'min_samples_leaf': 19, 'criterion': 'entropy'}.
Trial 9425 finished with value: 0.717391304347826 and parameters: {'n_estimators': 811, 'max_depth': 8, 'min_samples_split': 119, 'min_samples_leaf': 55, 'criterion': 'gini'}.
Trial 9426 finished with value: 0.6956521739130435 and parameters: {'n_estimators': 251, 'max_depth': 15, 'min_samples_split': 29, 'min_samples_leaf': 68, 'criterion': 'entropy'}.
Trial 9427 finished with value: 0.6847826086956522 and parameters: {'n_estimators': 229, 'max_depth': 6, 'min_samples_split': 34, 'min_samples_leaf': 57, 'criterion': 'gini'}.
Trial 9428 finished with value: 0.717391304347826 and parameters: {'n_estimators': 270, 'max_depth': 10, 'min_samples_split': 38, 'min_samples_leaf': 64, 'criterion': 'entropy'}.
Trial 9429 finished with value: 0.6956521739130435 and parameters: {'n_estimators': 295, 'max_depth': 12, 'min_samples_split': 22, 'min_samples_leaf': 59, 'criterion': 'entropy'}.
Trial 9430 finished with value: 0.7065217391304348 and parameters: {'n_estimators': 338, 'max_depth': 9, 'min_samples_split': 30, 'min_samples_leaf': 76, 'criterion': 'gini'}.
Trial 9431 finished with value: 0.6956521739130435 and parameters: {'n_estimators': 307, 'max_depth': 16, 'min_samples_split': 36, 'min_samples_leaf': 71, 'criterion': 'entropy'}.
Trial 9432 finished with value: 0.6739130434782609 and parameters: {'n_estimators': 266, 'max_depth': 13, 'min_samples_split': 44, 'min_samples_leaf': 62, 'criterion': 'gini'}.
Trial 9433 finished with value: 0.7282608695652174 and parameters: {'n_estimators': 316, 'max_depth': 8, 'min_samples_split': 59, 'min_samples_leaf': 54, 'criterion': 'entropy'}.
Trial 9434 finished with value: 0.6847826086956522 and parameters: {'n_estimators': 755, 'max_depth': 6, 'min_samples_split': 25, 'min_samples_leaf': 57, 'criterion': 'gini'}.
Trial 9435 finished with value: 0.7282608695652174 and parameters: {'n_estimators': 248, 'max_depth': 11, 'min_samples_split': 106, 'min_samples_leaf': 60, 'criterion': 'entropy'}.
Trial 9436 finished with value: 0.717391304347826 and parameters: {'n_estimators': 945, 'max_depth': 9, 'min_samples_split': 145, 'min_samples_leaf': 73, 'criterion': 'entropy'}.
Trial 9437 finished with value: 0.6847826086956522 and parameters: {'n_estimators': 288, 'max_depth': 14, 'min_samples_split': 134, 'min_samples_leaf': 66, 'criterion': 'gini'}.
Trial 9438 finished with value: 0.7065217391304348 and parameters: {'n_estimators': 276, 'max_depth': 12, 'min_samples_split': 112, 'min_samples_leaf': 55, 'criterion': 'entropy'}.
Trial 9439 finished with value: 0.717391304347826 and parameters: {'n_estimators': 903, 'max_depth': 8, 'min_samples_split': 32, 'min_samples_leaf': 58, 'criterion': 'gini'}.
Trial 9440 finished with value: 0.717391304347826 and parameters: {'n_estimators': 295, 'max_depth': 10, 'min_samples_split': 129, 'min_samples_leaf': 61, 'criterion': 'entropy'}.
Trial 9441 finished with value: 0.6413043478260869 and parameters: {'n_estimators': 774, 'max_depth': 5, 'min_samples_split': 40, 'min_samples_leaf': 53, 'criterion': 'entropy'}.
Trial 9442 finished with value: 0.6521739130434783 and parameters: {'n_estimators': 230, 'max_depth': 57, 'min_samples_split': 17, 'min_samples_leaf': 56, 'criterion': 'gini'}.
Trial 9443 finished with value: 0.6956521739130435 and parameters: {'n_estimators': 331, 'max_depth': 16, 'min_samples_split': 28, 'min_samples_leaf': 63, 'criterion': 'entropy'}.
Trial 9444 finished with value: 0.7065217391304348 and parameters: {'n_estimators': 263, 'max_depth': 11, 'min_samples_split': 35, 'min_samples_leaf': 59, 'criterion': 'gini'}.
Trial 9445 finished with value: 0.7065217391304348 and parameters: {'n_estimators': 727, 'max_depth': 7, 'min_samples_split': 71, 'min_samples_leaf': 58, 'criterion': 'entropy'}.
Trial 9446 finished with value: 0.6956521739130435 and parameters: {'n_estimators': 312, 'max_depth': 13, 'min_samples_split': 21, 'min_samples_leaf': 48, 'criterion': 'entropy'}.
Trial 9447 finished with value: 0.7282608695652174 and parameters: {'n_estimators': 280, 'max_depth': 9, 'min_samples_split': 49, 'min_samples_leaf': 75, 'criterion': 'gini'}.
Trial 9448 finished with value: 0.6956521739130435 and parameters: {'n_estimators': 248, 'max_depth': 11, 'min_samples_split': 2, 'min_samples_leaf': 69, 'criterion': 'entropy'}.
Trial 9449 finished with value: 0.6521739130434783 and parameters: {'n_estimators': 209, 'max_depth': 7, 'min_samples_split': 30, 'min_samples_leaf': 50, 'criterion': 'gini'}.
Trial 9450 finished with value: 0.6956521739130435 and parameters: {'n_estimators': 744, 'max_depth': 14, 'min_samples_split': 140, 'min_samples_leaf': 56, 'criterion': 'entropy'}.
Trial 9451 finished with value: 0.6630434782608695 and parameters: {'n_estimators': 843, 'max_depth': 19, 'min_samples_split': 26, 'min_samples_leaf': 61, 'criterion': 'entropy'}.
Trial 9452 finished with value: 0.717391304347826 and parameters: {'n_estimators': 290, 'max_depth': 9, 'min_samples_split': 43, 'min_samples_leaf': 54, 'criterion': 'gini'}.
Trial 9453 finished with value: 0.6630434782608695 and parameters: {'n_estimators': 261, 'max_depth': 12, 'min_samples_split': 37, 'min_samples_leaf': 95, 'criterion': 'entropy'}.
Trial 9454 finished with value: 0.7065217391304348 and parameters: {'n_estimators': 788, 'max_depth': 10, 'min_samples_split': 149, 'min_samples_leaf': 52, 'criterion': 'gini'}.
Trial 9455 finished with value: 0.6739130434782609 and parameters: {'n_estimators': 760, 'max_depth': 17, 'min_samples_split': 32, 'min_samples_leaf': 65, 'criterion': 'entropy'}.
Trial 9456 finished with value: 0.7065217391304348 and parameters: {'n_estimators': 674, 'max_depth': 7, 'min_samples_split': 34, 'min_samples_leaf': 59, 'criterion': 'gini'}.
Trial 9457 finished with value: 0.7065217391304348 and parameters: {'n_estimators': 314, 'max_depth': 14, 'min_samples_split': 25, 'min_samples_leaf': 62, 'criterion': 'entropy'}.
Trial 9458 finished with value: 0.6956521739130435 and parameters: {'n_estimators': 710, 'max_depth': 12, 'min_samples_split': 13, 'min_samples_leaf': 71, 'criterion': 'entropy'}.
Trial 9459 finished with value: 0.6413043478260869 and parameters: {'n_estimators': 271, 'max_depth': 5, 'min_samples_split': 40, 'min_samples_leaf': 57, 'criterion': 'gini'}.
Trial 9460 finished with value: 0.6956521739130435 and parameters: {'n_estimators': 159, 'max_depth': 9, 'min_samples_split': 122, 'min_samples_leaf': 56, 'criterion': 'entropy'}.
Trial 9461 finished with value: 0.6739130434782609 and parameters: {'n_estimators': 237, 'max_depth': 11, 'min_samples_split': 154, 'min_samples_leaf': 79, 'criterion': 'gini'}.
Trial 9462 finished with value: 0.6956521739130435 and parameters: {'n_estimators': 285, 'max_depth': 15, 'min_samples_split': 7, 'min_samples_leaf': 60, 'criterion': 'entropy'}.
Trial 9463 finished with value: 0.7065217391304348 and parameters: {'n_estimators': 330, 'max_depth': 8, 'min_samples_split': 136, 'min_samples_leaf': 63, 'criterion': 'entropy'}.
Trial 9464 finished with value: 0.6956521739130435 and parameters: {'n_estimators': 354, 'max_depth': 13, 'min_samples_split': 116, 'min_samples_leaf': 59, 'criterion': 'gini'}.
Trial 9465 finished with value: 0.6956521739130435 and parameters: {'n_estimators': 802, 'max_depth': 10, 'min_samples_split': 19, 'min_samples_leaf': 74, 'criterion': 'entropy'}.
Trial 9466 finished with value: 0.6630434782608695 and parameters: {'n_estimators': 382, 'max_depth': 7, 'min_samples_split': 28, 'min_samples_leaf': 54, 'criterion': 'gini'}.
Trial 9467 finished with value: 0.6956521739130435 and parameters: {'n_estimators': 302, 'max_depth': 9, 'min_samples_split': 36, 'min_samples_leaf': 67, 'criterion': 'entropy'}.
Trial 9468 finished with value: 0.6739130434782609 and parameters: {'n_estimators': 255, 'max_depth': 59, 'min_samples_split': 46, 'min_samples_leaf': 57, 'criterion': 'entropy'}.
Trial 9469 finished with value: 0.717391304347826 and parameters: {'n_estimators': 601, 'max_depth': 11, 'min_samples_split': 32, 'min_samples_leaf': 62, 'criterion': 'gini'}.
Trial 9470 finished with value: 0.6956521739130435 and parameters: {'n_estimators': 825, 'max_depth': 14, 'min_samples_split': 128, 'min_samples_leaf': 60, 'criterion': 'entropy'}.
Trial 9471 finished with value: 0.7065217391304348 and parameters: {'n_estimators': 765, 'max_depth': 12, 'min_samples_split': 144, 'min_samples_leaf': 55, 'criterion': 'gini'}.
Trial 9472 finished with value: 0.6847826086956522 and parameters: {'n_estimators': 295, 'max_depth': 6, 'min_samples_split': 23, 'min_samples_leaf': 65, 'criterion': 'entropy'}.
Trial 9473 finished with value: 0.6956521739130435 and parameters: {'n_estimators': 271, 'max_depth': 17, 'min_samples_split': 41, 'min_samples_leaf': 58, 'criterion': 'gini'}.
Trial 9474 finished with value: 0.6630434782608695 and parameters: {'n_estimators': 983, 'max_depth': 24, 'min_samples_split': 29, 'min_samples_leaf': 52, 'criterion': 'entropy'}.
Trial 9475 finished with value: 0.6847826086956522 and parameters: {'n_estimators': 131, 'max_depth': 8, 'min_samples_split': 54, 'min_samples_leaf': 61, 'criterion': 'entropy'}.
Trial 9476 finished with value: 0.7065217391304348 and parameters: {'n_estimators': 735, 'max_depth': 10, 'min_samples_split': 39, 'min_samples_leaf': 58, 'criterion': 'gini'}.
Trial 9477 finished with value: 0.5978260869565217 and parameters: {'n_estimators': 248, 'max_depth': 13, 'min_samples_split': 34, 'min_samples_leaf': 15, 'criterion': 'entropy'}.
Trial 9478 finished with value: 0.6847826086956522 and parameters: {'n_estimators': 569, 'max_depth': 31, 'min_samples_split': 26, 'min_samples_leaf': 72, 'criterion': 'gini'}.
Trial 9479 finished with value: 0.6739130434782609 and parameters: {'n_estimators': 318, 'max_depth': 95, 'min_samples_split': 133, 'min_samples_leaf': 56, 'criterion': 'entropy'}.
Trial 9480 finished with value: 0.6739130434782609 and parameters: {'n_estimators': 228, 'max_depth': 15, 'min_samples_split': 140, 'min_samples_leaf': 63, 'criterion': 'entropy'}.
Trial 9481 finished with value: 0.7065217391304348 and parameters: {'n_estimators': 781, 'max_depth': 9, 'min_samples_split': 37, 'min_samples_leaf': 60, 'criterion': 'gini'}.
Trial 9482 finished with value: 0.6739130434782609 and parameters: {'n_estimators': 279, 'max_depth': 5, 'min_samples_split': 31, 'min_samples_leaf': 69, 'criterion': 'entropy'}.
Trial 9483 finished with value: 0.7282608695652174 and parameters: {'n_estimators': 292, 'max_depth': 11, 'min_samples_split': 20, 'min_samples_leaf': 54, 'criterion': 'gini'}.
Trial 9484 finished with value: 0.6847826086956522 and parameters: {'n_estimators': 190, 'max_depth': 7, 'min_samples_split': 124, 'min_samples_leaf': 58, 'criterion': 'entropy'}.
Trial 9485 finished with value: 0.717391304347826 and parameters: {'n_estimators': 264, 'max_depth': 12, 'min_samples_split': 45, 'min_samples_leaf': 56, 'criterion': 'entropy'}.
Trial 9486 finished with value: 0.6956521739130435 and parameters: {'n_estimators': 329, 'max_depth': 9, 'min_samples_split': 99, 'min_samples_leaf': 52, 'criterion': 'gini'}.
Trial 9487 finished with value: 0.7065217391304348 and parameters: {'n_estimators': 304, 'max_depth': 13, 'min_samples_split': 118, 'min_samples_leaf': 64, 'criterion': 'entropy'}.
Trial 9488 finished with value: 0.7282608695652174 and parameters: {'n_estimators': 243, 'max_depth': 10, 'min_samples_split': 148, 'min_samples_leaf': 60, 'criterion': 'gini'}.
Trial 9489 finished with value: 0.717391304347826 and parameters: {'n_estimators': 747, 'max_depth': 7, 'min_samples_split': 34, 'min_samples_leaf': 76, 'criterion': 'entropy'}.
Trial 9490 finished with value: 0.6739130434782609 and parameters: {'n_estimators': 276, 'max_depth': 16, 'min_samples_split': 28, 'min_samples_leaf': 58, 'criterion': 'gini'}.
Trial 9491 finished with value: 0.6956521739130435 and parameters: {'n_estimators': 699, 'max_depth': 12, 'min_samples_split': 16, 'min_samples_leaf': 73, 'criterion': 'entropy'}.
Trial 9492 finished with value: 0.717391304347826 and parameters: {'n_estimators': 344, 'max_depth': 10, 'min_samples_split': 22, 'min_samples_leaf': 62, 'criterion': 'entropy'}.
Trial 9493 finished with value: 0.6739130434782609 and parameters: {'n_estimators': 260, 'max_depth': 8, 'min_samples_split': 38, 'min_samples_leaf': 50, 'criterion': 'gini'}.
Trial 9494 finished with value: 0.7065217391304348 and parameters: {'n_estimators': 721, 'max_depth': 14, 'min_samples_split': 178, 'min_samples_leaf': 55, 'criterion': 'entropy'}.
Trial 9495 finished with value: 0.7065217391304348 and parameters: {'n_estimators': 305, 'max_depth': 11, 'min_samples_split': 32, 'min_samples_leaf': 66, 'criterion': 'gini'}.
Trial 9496 finished with value: 0.6630434782608695 and parameters: {'n_estimators': 219, 'max_depth': 19, 'min_samples_split': 111, 'min_samples_leaf': 57, 'criterion': 'entropy'}.
Trial 9497 finished with value: 0.6739130434782609 and parameters: {'n_estimators': 291, 'max_depth': 6, 'min_samples_split': 143, 'min_samples_leaf': 70, 'criterion': 'entropy'}.
Trial 9498 finished with value: 0.7065217391304348 and parameters: {'n_estimators': 761, 'max_depth': 9, 'min_samples_split': 43, 'min_samples_leaf': 60, 'criterion': 'gini'}.
Trial 9499 finished with value: 0.7065217391304348 and parameters: {'n_estimators': 798, 'max_depth': 15, 'min_samples_split': 131, 'min_samples_leaf': 53, 'criterion': 'entropy'}.
Trial 9500 finished with value: 0.7065217391304348 and parameters: {'n_estimators': 271, 'max_depth': 12, 'min_samples_split': 137, 'min_samples_leaf': 58, 'criterion': 'gini'}.
Trial 9501 finished with value: 0.717391304347826 and parameters: {'n_estimators': 245, 'max_depth': 8, 'min_samples_split': 24, 'min_samples_leaf': 84, 'criterion': 'entropy'}.
Trial 9502 finished with value: 0.6304347826086957 and parameters: {'n_estimators': 319, 'max_depth': 5, 'min_samples_split': 87, 'min_samples_leaf': 62, 'criterion': 'entropy'}.
Trial 9503 finished with value: 0.7282608695652174 and parameters: {'n_estimators': 286, 'max_depth': 11, 'min_samples_split': 29, 'min_samples_leaf': 55, 'criterion': 'gini'}.
Trial 9504 finished with value: 0.7065217391304348 and parameters: {'n_estimators': 924, 'max_depth': 13, 'min_samples_split': 36, 'min_samples_leaf': 59, 'criterion': 'entropy'}.
Trial 9505 finished with value: 0.6739130434782609 and parameters: {'n_estimators': 778, 'max_depth': 9, 'min_samples_split': 41, 'min_samples_leaf': 64, 'criterion': 'gini'}.
Trial 9506 finished with value: 0.6847826086956522 and parameters: {'n_estimators': 651, 'max_depth': 17, 'min_samples_split': 32, 'min_samples_leaf': 68, 'criterion': 'entropy'}.
Trial 9507 finished with value: 0.7065217391304348 and parameters: {'n_estimators': 266, 'max_depth': 7, 'min_samples_split': 47, 'min_samples_leaf': 74, 'criterion': 'entropy'}.
Trial 9508 finished with value: 0.7065217391304348 and parameters: {'n_estimators': 815, 'max_depth': 10, 'min_samples_split': 26, 'min_samples_leaf': 56, 'criterion': 'gini'}.
Trial 9509 finished with value: 0.7065217391304348 and parameters: {'n_estimators': 297, 'max_depth': 14, 'min_samples_split': 37, 'min_samples_leaf': 61, 'criterion': 'entropy'}.
Trial 9510 finished with value: 0.6956521739130435 and parameters: {'n_estimators': 536, 'max_depth': 44, 'min_samples_split': 191, 'min_samples_leaf': 57, 'criterion': 'gini'}.
Trial 9511 finished with value: 0.6956521739130435 and parameters: {'n_estimators': 314, 'max_depth': 11, 'min_samples_split': 19, 'min_samples_leaf': 78, 'criterion': 'entropy'}.
Trial 9512 finished with value: 0.7065217391304348 and parameters: {'n_estimators': 737, 'max_depth': 8, 'min_samples_split': 29, 'min_samples_leaf': 54, 'criterion': 'gini'}.
Trial 9513 finished with value: 0.7065217391304348 and parameters: {'n_estimators': 234, 'max_depth': 13, 'min_samples_split': 76, 'min_samples_leaf': 71, 'criterion': 'entropy'}.
Trial 9514 finished with value: 0.7282608695652174 and parameters: {'n_estimators': 256, 'max_depth': 10, 'min_samples_split': 120, 'min_samples_leaf': 59, 'criterion': 'entropy'}.
Trial 9515 finished with value: 0.6739130434782609 and parameters: {'n_estimators': 278, 'max_depth': 15, 'min_samples_split': 147, 'min_samples_leaf': 61, 'criterion': 'gini'}.
