Trial 7429 finished with value: 0.7282608695652174 and parameters: {'n_estimators': 261, 'max_depth': 9, 'min_samples_split': 31, 'min_samples_leaf': 57, 'criterion': 'entropy'}.
Trial 7430 finished with value: 0.6739130434782609 and parameters: {'n_estimators': 281, 'max_depth': 7, 'min_samples_split': 120, 'min_samples_leaf': 53, 'criterion': 'gini'}.
Trial 7431 finished with value: 0.6847826086956522 and parameters: {'n_estimators': 345, 'max_depth': 25, 'min_samples_split': 17, 'min_samples_leaf': 71, 'criterion': 'entropy'}.
Trial 7432 finished with value: 0.7065217391304348 and parameters: {'n_estimators': 758, 'max_depth': 12, 'min_samples_split': 144, 'min_samples_leaf': 63, 'criterion': 'gini'}.
Trial 7433 finished with value: 0.6847826086956522 and parameters: {'n_estimators': 307, 'max_depth': 15, 'min_samples_split': 28, 'min_samples_leaf': 59, 'criterion': 'entropy'}.
Trial 7434 finished with value: 0.7282608695652174 and parameters: {'n_estimators': 249, 'max_depth': 10, 'min_samples_split': 200, 'min_samples_leaf': 55, 'criterion': 'entropy'}.
Trial 7435 finished with value: 0.6739130434782609 and parameters: {'n_estimators': 171, 'max_depth': 17, 'min_samples_split': 127, 'min_samples_leaf': 61, 'criterion': 'gini'}.
Trial 7436 finished with value: 0.6521739130434783 and parameters: {'n_estimators': 781, 'max_depth': 5, 'min_samples_split': 36, 'min_samples_leaf': 65, 'criterion': 'entropy'}.
Trial 7437 finished with value: 0.6521739130434783 and parameters: {'n_estimators': 272, 'max_depth': 13, 'min_samples_split': 132, 'min_samples_leaf': 9, 'criterion': 'gini'}.
Trial 7438 finished with value: 0.6413043478260869 and parameters: {'n_estimators': 717, 'max_depth': 8, 'min_samples_split': 43, 'min_samples_leaf': 20, 'criterion': 'entropy'}.
Trial 7439 finished with value: 0.7065217391304348 and parameters: {'n_estimators': 218, 'max_depth': 10, 'min_samples_split': 139, 'min_samples_leaf': 57, 'criterion': 'gini'}.
Trial 7440 finished with value: 0.6847826086956522 and parameters: {'n_estimators': 291, 'max_depth': 12, 'min_samples_split': 25, 'min_samples_leaf': 59, 'criterion': 'entropy'}.
Trial 7441 finished with value: 0.717391304347826 and parameters: {'n_estimators': 329, 'max_depth': 8, 'min_samples_split': 39, 'min_samples_leaf': 69, 'criterion': 'gini'}.
Trial 7442 finished with value: 0.7065217391304348 and parameters: {'n_estimators': 805, 'max_depth': 14, 'min_samples_split': 34, 'min_samples_leaf': 52, 'criterion': 'entropy'}.
Trial 7443 finished with value: 0.6956521739130435 and parameters: {'n_estimators': 366, 'max_depth': 10, 'min_samples_split': 19, 'min_samples_leaf': 67, 'criterion': 'entropy'}.
Trial 7444 finished with value: 0.6630434782608695 and parameters: {'n_estimators': 739, 'max_depth': 6, 'min_samples_split': 30, 'min_samples_leaf': 63, 'criterion': 'gini'}.
Trial 7445 finished with value: 0.7065217391304348 and parameters: {'n_estimators': 263, 'max_depth': 11, 'min_samples_split': 116, 'min_samples_leaf': 50, 'criterion': 'entropy'}.
Trial 7446 finished with value: 0.6739130434782609 and parameters: {'n_estimators': 307, 'max_depth': 15, 'min_samples_split': 33, 'min_samples_leaf': 56, 'criterion': 'gini'}.
Trial 7447 finished with value: 0.717391304347826 and parameters: {'n_estimators': 768, 'max_depth': 8, 'min_samples_split': 13, 'min_samples_leaf': 61, 'criterion': 'entropy'}.
Trial 7448 finished with value: 0.7065217391304348 and parameters: {'n_estimators': 282, 'max_depth': 13, 'min_samples_split': 148, 'min_samples_leaf': 73, 'criterion': 'gini'}.
Trial 7449 finished with value: 0.6630434782608695 and parameters: {'n_estimators': 234, 'max_depth': 10, 'min_samples_split': 45, 'min_samples_leaf': 78, 'criterion': 'entropy'}.
Trial 7450 finished with value: 0.6847826086956522 and parameters: {'n_estimators': 697, 'max_depth': 7, 'min_samples_split': 25, 'min_samples_leaf': 58, 'criterion': 'gini'}.
Trial 7451 finished with value: 0.717391304347826 and parameters: {'n_estimators': 252, 'max_depth': 12, 'min_samples_split': 135, 'min_samples_leaf': 54, 'criterion': 'entropy'}.
Trial 7452 finished with value: 0.6956521739130435 and parameters: {'n_estimators': 297, 'max_depth': 9, 'min_samples_split': 143, 'min_samples_leaf': 58, 'criterion': 'gini'}.
Trial 7453 finished with value: 0.6847826086956522 and parameters: {'n_estimators': 439, 'max_depth': 17, 'min_samples_split': 39, 'min_samples_leaf': 61, 'criterion': 'entropy'}.
Trial 7454 finished with value: 0.6739130434782609 and parameters: {'n_estimators': 272, 'max_depth': 11, 'min_samples_split': 30, 'min_samples_leaf': 76, 'criterion': 'entropy'}.
Trial 7455 finished with value: 0.6413043478260869 and parameters: {'n_estimators': 632, 'max_depth': 5, 'min_samples_split': 23, 'min_samples_leaf': 55, 'criterion': 'gini'}.
Trial 7456 finished with value: 0.6956521739130435 and parameters: {'n_estimators': 902, 'max_depth': 14, 'min_samples_split': 35, 'min_samples_leaf': 59, 'criterion': 'entropy'}.
Trial 7457 finished with value: 0.7065217391304348 and parameters: {'n_estimators': 201, 'max_depth': 9, 'min_samples_split': 28, 'min_samples_leaf': 72, 'criterion': 'gini'}.
Trial 7458 finished with value: 0.6739130434782609 and parameters: {'n_estimators': 333, 'max_depth': 19, 'min_samples_split': 125, 'min_samples_leaf': 64, 'criterion': 'entropy'}.
Trial 7459 finished with value: 0.7065217391304348 and parameters: {'n_estimators': 748, 'max_depth': 7, 'min_samples_split': 138, 'min_samples_leaf': 82, 'criterion': 'gini'}.
Trial 7460 finished with value: 0.717391304347826 and parameters: {'n_estimators': 288, 'max_depth': 12, 'min_samples_split': 19, 'min_samples_leaf': 56, 'criterion': 'entropy'}.
Trial 7461 finished with value: 0.6630434782608695 and parameters: {'n_estimators': 1000, 'max_depth': 10, 'min_samples_split': 33, 'min_samples_leaf': 25, 'criterion': 'gini'}.
Trial 7462 finished with value: 0.6956521739130435 and parameters: {'n_estimators': 315, 'max_depth': 15, 'min_samples_split': 74, 'min_samples_leaf': 60, 'criterion': 'entropy'}.
Trial 7463 finished with value: 0.717391304347826 and parameters: {'n_estimators': 527, 'max_depth': 8, 'min_samples_split': 37, 'min_samples_leaf': 53, 'criterion': 'entropy'}.
Trial 7464 finished with value: 0.717391304347826 and parameters: {'n_estimators': 256, 'max_depth': 13, 'min_samples_split': 152, 'min_samples_leaf': 68, 'criterion': 'gini'}.
Trial 7465 finished with value: 0.7065217391304348 and parameters: {'n_estimators': 274, 'max_depth': 10, 'min_samples_split': 27, 'min_samples_leaf': 57, 'criterion': 'entropy'}.
Trial 7466 finished with value: 0.7065217391304348 and parameters: {'n_estimators': 771, 'max_depth': 12, 'min_samples_split': 48, 'min_samples_leaf': 62, 'criterion': 'gini'}.
Trial 7467 finished with value: 0.7065217391304348 and parameters: {'n_estimators': 816, 'max_depth': 7, 'min_samples_split': 42, 'min_samples_leaf': 60, 'criterion': 'entropy'}.
Trial 7468 finished with value: 0.717391304347826 and parameters: {'n_estimators': 241, 'max_depth': 11, 'min_samples_split': 22, 'min_samples_leaf': 65, 'criterion': 'gini'}.
Trial 7469 finished with value: 0.6956521739130435 and parameters: {'n_estimators': 300, 'max_depth': 9, 'min_samples_split': 111, 'min_samples_leaf': 75, 'criterion': 'entropy'}.
Trial 7470 finished with value: 0.6739130434782609 and parameters: {'n_estimators': 728, 'max_depth': 16, 'min_samples_split': 121, 'min_samples_leaf': 58, 'criterion': 'gini'}.
Trial 7471 finished with value: 0.6630434782608695 and parameters: {'n_estimators': 796, 'max_depth': 5, 'min_samples_split': 142, 'min_samples_leaf': 71, 'criterion': 'entropy'}.
Trial 7472 finished with value: 0.6956521739130435 and parameters: {'n_estimators': 257, 'max_depth': 14, 'min_samples_split': 133, 'min_samples_leaf': 55, 'criterion': 'entropy'}.
Trial 7473 finished with value: 0.6956521739130435 and parameters: {'n_estimators': 286, 'max_depth': 8, 'min_samples_split': 32, 'min_samples_leaf': 62, 'criterion': 'gini'}.
Trial 7474 finished with value: 0.7065217391304348 and parameters: {'n_estimators': 586, 'max_depth': 11, 'min_samples_split': 39, 'min_samples_leaf': 57, 'criterion': 'entropy'}.
Trial 7475 finished with value: 0.6956521739130435 and parameters: {'n_estimators': 221, 'max_depth': 13, 'min_samples_split': 129, 'min_samples_leaf': 60, 'criterion': 'gini'}.
Trial 7476 finished with value: 0.7065217391304348 and parameters: {'n_estimators': 323, 'max_depth': 9, 'min_samples_split': 26, 'min_samples_leaf': 52, 'criterion': 'entropy'}.
Trial 7477 finished with value: 0.6956521739130435 and parameters: {'n_estimators': 277, 'max_depth': 7, 'min_samples_split': 35, 'min_samples_leaf': 63, 'criterion': 'gini'}.
Trial 7478 finished with value: 0.717391304347826 and parameters: {'n_estimators': 302, 'max_depth': 11, 'min_samples_split': 29, 'min_samples_leaf': 58, 'criterion': 'entropy'}.
Trial 7479 finished with value: 0.6630434782608695 and parameters: {'n_estimators': 239, 'max_depth': 16, 'min_samples_split': 147, 'min_samples_leaf': 69, 'criterion': 'gini'}.
Trial 7480 finished with value: 0.6847826086956522 and parameters: {'n_estimators': 754, 'max_depth': 6, 'min_samples_split': 43, 'min_samples_leaf': 66, 'criterion': 'entropy'}.
Trial 7481 finished with value: 0.7282608695652174 and parameters: {'n_estimators': 266, 'max_depth': 9, 'min_samples_split': 9, 'min_samples_leaf': 55, 'criterion': 'entropy'}.
Trial 7482 finished with value: 0.6847826086956522 and parameters: {'n_estimators': 349, 'max_depth': 13, 'min_samples_split': 137, 'min_samples_leaf': 60, 'criterion': 'gini'}.
Trial 7483 finished with value: 0.717391304347826 and parameters: {'n_estimators': 676, 'max_depth': 11, 'min_samples_split': 32, 'min_samples_leaf': 56, 'criterion': 'entropy'}.
Trial 7484 finished with value: 0.6304347826086957 and parameters: {'n_estimators': 134, 'max_depth': 14, 'min_samples_split': 21, 'min_samples_leaf': 73, 'criterion': 'gini'}.
Trial 7485 finished with value: 0.7065217391304348 and parameters: {'n_estimators': 310, 'max_depth': 9, 'min_samples_split': 37, 'min_samples_leaf': 50, 'criterion': 'entropy'}.
Trial 7486 finished with value: 0.6304347826086957 and parameters: {'n_estimators': 784, 'max_depth': 7, 'min_samples_split': 142, 'min_samples_leaf': 1, 'criterion': 'gini'}.
Trial 7487 finished with value: 0.7065217391304348 and parameters: {'n_estimators': 712, 'max_depth': 12, 'min_samples_split': 52, 'min_samples_leaf': 53, 'criterion': 'entropy'}.
Trial 7488 finished with value: 0.6847826086956522 and parameters: {'n_estimators': 292, 'max_depth': 20, 'min_samples_split': 94, 'min_samples_leaf': 58, 'criterion': 'gini'}.
Trial 7489 finished with value: 0.7282608695652174 and parameters: {'n_estimators': 950, 'max_depth': 10, 'min_samples_split': 114, 'min_samples_leaf': 62, 'criterion': 'entropy'}.
Trial 7490 finished with value: 0.6195652173913043 and parameters: {'n_estimators': 100, 'max_depth': 5, 'min_samples_split': 25, 'min_samples_leaf': 71, 'criterion': 'entropy'}.
Trial 7491 finished with value: 0.6739130434782609 and parameters: {'n_estimators': 257, 'max_depth': 15, 'min_samples_split': 16, 'min_samples_leaf': 59, 'criterion': 'gini'}.
Trial 7492 finished with value: 0.7282608695652174 and parameters: {'n_estimators': 275, 'max_depth': 8, 'min_samples_split': 104, 'min_samples_leaf': 56, 'criterion': 'entropy'}.
Trial 7493 finished with value: 0.6956521739130435 and parameters: {'n_estimators': 743, 'max_depth': 12, 'min_samples_split': 33, 'min_samples_leaf': 75, 'criterion': 'gini'}.
Trial 7494 finished with value: 0.6739130434782609 and parameters: {'n_estimators': 865, 'max_depth': 18, 'min_samples_split': 40, 'min_samples_leaf': 64, 'criterion': 'entropy'}.
Trial 7495 finished with value: 0.717391304347826 and parameters: {'n_estimators': 329, 'max_depth': 10, 'min_samples_split': 29, 'min_samples_leaf': 54, 'criterion': 'gini'}.
Trial 7496 finished with value: 0.6847826086956522 and parameters: {'n_estimators': 229, 'max_depth': 7, 'min_samples_split': 122, 'min_samples_leaf': 60, 'criterion': 'entropy'}.
Trial 7497 finished with value: 0.7065217391304348 and parameters: {'n_estimators': 770, 'max_depth': 13, 'min_samples_split': 46, 'min_samples_leaf': 67, 'criterion': 'gini'}.
Trial 7498 finished with value: 0.7282608695652174 and parameters: {'n_estimators': 290, 'max_depth': 11, 'min_samples_split': 83, 'min_samples_leaf': 57, 'criterion': 'entropy'}.
Trial 7499 finished with value: 0.5869565217391305 and parameters: {'n_estimators': 249, 'max_depth': 9, 'min_samples_split': 35, 'min_samples_leaf': 17, 'criterion': 'entropy'}.
Trial 7500 finished with value: 0.7065217391304348 and parameters: {'n_estimators': 970, 'max_depth': 15, 'min_samples_split': 146, 'min_samples_leaf': 61, 'criterion': 'gini'}.
Trial 7501 finished with value: 0.6847826086956522 and parameters: {'n_estimators': 318, 'max_depth': 7, 'min_samples_split': 139, 'min_samples_leaf': 58, 'criterion': 'entropy'}.
Trial 7502 finished with value: 0.7065217391304348 and parameters: {'n_estimators': 185, 'max_depth': 11, 'min_samples_split': 28, 'min_samples_leaf': 77, 'criterion': 'gini'}.
Trial 7503 finished with value: 0.6956521739130435 and parameters: {'n_estimators': 268, 'max_depth': 9, 'min_samples_split': 20, 'min_samples_leaf': 70, 'criterion': 'entropy'}.
Trial 7504 finished with value: 0.7065217391304348 and parameters: {'n_estimators': 295, 'max_depth': 13, 'min_samples_split': 128, 'min_samples_leaf': 73, 'criterion': 'gini'}.
Trial 7505 finished with value: 0.6739130434782609 and parameters: {'n_estimators': 263, 'max_depth': 59, 'min_samples_split': 134, 'min_samples_leaf': 64, 'criterion': 'entropy'}.
Trial 7506 finished with value: 0.6630434782608695 and parameters: {'n_estimators': 729, 'max_depth': 79, 'min_samples_split': 38, 'min_samples_leaf': 55, 'criterion': 'gini'}.
Trial 7507 finished with value: 0.6956521739130435 and parameters: {'n_estimators': 212, 'max_depth': 17, 'min_samples_split': 25, 'min_samples_leaf': 59, 'criterion': 'entropy'}.
Trial 7508 finished with value: 0.6304347826086957 and parameters: {'n_estimators': 306, 'max_depth': 5, 'min_samples_split': 29, 'min_samples_leaf': 62, 'criterion': 'gini'}.
Trial 7509 finished with value: 0.7282608695652174 and parameters: {'n_estimators': 278, 'max_depth': 10, 'min_samples_split': 33, 'min_samples_leaf': 52, 'criterion': 'entropy'}.
Trial 7510 finished with value: 0.6739130434782609 and parameters: {'n_estimators': 241, 'max_depth': 14, 'min_samples_split': 42, 'min_samples_leaf': 57, 'criterion': 'entropy'}.
Trial 7511 finished with value: 0.7282608695652174 and parameters: {'n_estimators': 282, 'max_depth': 8, 'min_samples_split': 66, 'min_samples_leaf': 60, 'criterion': 'gini'}.
Trial 7512 finished with value: 0.6956521739130435 and parameters: {'n_estimators': 785, 'max_depth': 12, 'min_samples_split': 152, 'min_samples_leaf': 56, 'criterion': 'entropy'}.
Trial 7513 finished with value: 0.7065217391304348 and parameters: {'n_estimators': 381, 'max_depth': 11, 'min_samples_split': 22, 'min_samples_leaf': 54, 'criterion': 'gini'}.
Trial 7514 finished with value: 0.7065217391304348 and parameters: {'n_estimators': 471, 'max_depth': 7, 'min_samples_split': 57, 'min_samples_leaf': 62, 'criterion': 'entropy'}.
Trial 7515 finished with value: 0.6739130434782609 and parameters: {'n_estimators': 764, 'max_depth': 9, 'min_samples_split': 37, 'min_samples_leaf': 66, 'criterion': 'gini'}.
Trial 7516 finished with value: 0.6847826086956522 and parameters: {'n_estimators': 257, 'max_depth': 14, 'min_samples_split': 32, 'min_samples_leaf': 58, 'criterion': 'entropy'}.
Trial 7517 finished with value: 0.6956521739130435 and parameters: {'n_estimators': 815, 'max_depth': 12, 'min_samples_split': 116, 'min_samples_leaf': 69, 'criterion': 'gini'}.
Trial 7518 finished with value: 0.6956521739130435 and parameters: {'n_estimators': 314, 'max_depth': 10, 'min_samples_split': 137, 'min_samples_leaf': 74, 'criterion': 'entropy'}.
Trial 7519 finished with value: 0.6847826086956522 and parameters: {'n_estimators': 344, 'max_depth': 16, 'min_samples_split': 132, 'min_samples_leaf': 59, 'criterion': 'entropy'}.
Trial 7520 finished with value: 0.6847826086956522 and parameters: {'n_estimators': 292, 'max_depth': 6, 'min_samples_split': 14, 'min_samples_leaf': 56, 'criterion': 'gini'}.
Trial 7521 finished with value: 0.717391304347826 and parameters: {'n_estimators': 746, 'max_depth': 8, 'min_samples_split': 26, 'min_samples_leaf': 61, 'criterion': 'entropy'}.
Trial 7522 finished with value: 0.6739130434782609 and parameters: {'n_estimators': 233, 'max_depth': 12, 'min_samples_split': 31, 'min_samples_leaf': 64, 'criterion': 'gini'}.
Trial 7523 finished with value: 0.7282608695652174 and parameters: {'n_estimators': 272, 'max_depth': 10, 'min_samples_split': 123, 'min_samples_leaf': 53, 'criterion': 'entropy'}.
Trial 7524 finished with value: 0.6956521739130435 and parameters: {'n_estimators': 798, 'max_depth': 13, 'min_samples_split': 143, 'min_samples_leaf': 72, 'criterion': 'gini'}.
Trial 7525 finished with value: 0.7282608695652174 and parameters: {'n_estimators': 301, 'max_depth': 8, 'min_samples_split': 40, 'min_samples_leaf': 58, 'criterion': 'entropy'}.
Trial 7526 finished with value: 0.6521739130434783 and parameters: {'n_estimators': 702, 'max_depth': 5, 'min_samples_split': 36, 'min_samples_leaf': 60, 'criterion': 'gini'}.
Trial 7527 finished with value: 0.717391304347826 and parameters: {'n_estimators': 270, 'max_depth': 10, 'min_samples_split': 45, 'min_samples_leaf': 55, 'criterion': 'entropy'}.
Trial 7528 finished with value: 0.6847826086956522 and parameters: {'n_estimators': 326, 'max_depth': 15, 'min_samples_split': 18, 'min_samples_leaf': 51, 'criterion': 'entropy'}.
Trial 7529 finished with value: 0.6739130434782609 and parameters: {'n_estimators': 249, 'max_depth': 11, 'min_samples_split': 148, 'min_samples_leaf': 57, 'criterion': 'gini'}.
Trial 7530 finished with value: 0.6956521739130435 and parameters: {'n_estimators': 287, 'max_depth': 7, 'min_samples_split': 25, 'min_samples_leaf': 68, 'criterion': 'entropy'}.
Trial 7531 finished with value: 0.6956521739130435 and parameters: {'n_estimators': 757, 'max_depth': 9, 'min_samples_split': 33, 'min_samples_leaf': 63, 'criterion': 'gini'}.
Trial 7532 finished with value: 0.6956521739130435 and parameters: {'n_estimators': 884, 'max_depth': 13, 'min_samples_split': 28, 'min_samples_leaf': 71, 'criterion': 'entropy'}.
Trial 7533 finished with value: 0.717391304347826 and parameters: {'n_estimators': 727, 'max_depth': 11, 'min_samples_split': 38, 'min_samples_leaf': 60, 'criterion': 'gini'}.
Trial 7534 finished with value: 0.6630434782608695 and parameters: {'n_estimators': 254, 'max_depth': 27, 'min_samples_split': 141, 'min_samples_leaf': 78, 'criterion': 'entropy'}.
Trial 7535 finished with value: 0.6739130434782609 and parameters: {'n_estimators': 309, 'max_depth': 16, 'min_samples_split': 107, 'min_samples_leaf': 58, 'criterion': 'gini'}.
Trial 7536 finished with value: 0.6847826086956522 and parameters: {'n_estimators': 213, 'max_depth': 7, 'min_samples_split': 128, 'min_samples_leaf': 54, 'criterion': 'entropy'}.
Trial 7537 finished with value: 0.6956521739130435 and parameters: {'n_estimators': 275, 'max_depth': 9, 'min_samples_split': 21, 'min_samples_leaf': 66, 'criterion': 'entropy'}.
Trial 7538 finished with value: 0.6956521739130435 and parameters: {'n_estimators': 567, 'max_depth': 13, 'min_samples_split': 118, 'min_samples_leaf': 63, 'criterion': 'gini'}.
Trial 7539 finished with value: 0.6956521739130435 and parameters: {'n_estimators': 362, 'max_depth': 11, 'min_samples_split': 31, 'min_samples_leaf': 74, 'criterion': 'entropy'}.
Trial 7540 finished with value: 0.7065217391304348 and parameters: {'n_estimators': 240, 'max_depth': 14, 'min_samples_split': 41, 'min_samples_leaf': 61, 'criterion': 'gini'}.
Trial 7541 finished with value: 0.6739130434782609 and parameters: {'n_estimators': 777, 'max_depth': 18, 'min_samples_split': 35, 'min_samples_leaf': 56, 'criterion': 'entropy'}.
Trial 7542 finished with value: 0.6847826086956522 and parameters: {'n_estimators': 298, 'max_depth': 6, 'min_samples_split': 23, 'min_samples_leaf': 60, 'criterion': 'gini'}.
Trial 7543 finished with value: 0.6956521739130435 and parameters: {'n_estimators': 930, 'max_depth': 9, 'min_samples_split': 138, 'min_samples_leaf': 57, 'criterion': 'entropy'}.
Trial 7544 finished with value: 0.717391304347826 and parameters: {'n_estimators': 664, 'max_depth': 12, 'min_samples_split': 50, 'min_samples_leaf': 54, 'criterion': 'gini'}.
Trial 7545 finished with value: 0.6847826086956522 and parameters: {'n_estimators': 335, 'max_depth': 8, 'min_samples_split': 29, 'min_samples_leaf': 50, 'criterion': 'entropy'}.
Trial 7546 finished with value: 0.6739130434782609 and parameters: {'n_estimators': 263, 'max_depth': 10, 'min_samples_split': 99, 'min_samples_leaf': 76, 'criterion': 'entropy'}.
Trial 7547 finished with value: 0.6956521739130435 and parameters: {'n_estimators': 277, 'max_depth': 62, 'min_samples_split': 35, 'min_samples_leaf': 59, 'criterion': 'gini'}.
Trial 7548 finished with value: 0.6847826086956522 and parameters: {'n_estimators': 227, 'max_depth': 14, 'min_samples_split': 135, 'min_samples_leaf': 62, 'criterion': 'entropy'}.
Trial 7549 finished with value: 0.6521739130434783 and parameters: {'n_estimators': 166, 'max_depth': 5, 'min_samples_split': 13, 'min_samples_leaf': 65, 'criterion': 'gini'}.
Trial 7550 finished with value: 0.717391304347826 and parameters: {'n_estimators': 746, 'max_depth': 11, 'min_samples_split': 144, 'min_samples_leaf': 69, 'criterion': 'entropy'}.
Trial 7551 finished with value: 0.7065217391304348 and parameters: {'n_estimators': 316, 'max_depth': 8, 'min_samples_split': 131, 'min_samples_leaf': 56, 'criterion': 'gini'}.
