Trial 1534 finished with value: 0.6413043478260869 and parameters: {'n_estimators': 545, 'max_depth': 5, 'min_samples_split': 96, 'min_samples_leaf': 50, 'criterion': 'gini'}.
Trial 1535 finished with value: 0.6956521739130435 and parameters: {'n_estimators': 761, 'max_depth': 8, 'min_samples_split': 32, 'min_samples_leaf': 47, 'criterion': 'entropy'}.
Trial 1536 finished with value: 0.7065217391304348 and parameters: {'n_estimators': 918, 'max_depth': 12, 'min_samples_split': 27, 'min_samples_leaf': 53, 'criterion': 'entropy'}.
Trial 1537 finished with value: 0.7282608695652174 and parameters: {'n_estimators': 834, 'max_depth': 10, 'min_samples_split': 50, 'min_samples_leaf': 49, 'criterion': 'entropy'}.
Trial 1538 finished with value: 0.6847826086956522 and parameters: {'n_estimators': 803, 'max_depth': 7, 'min_samples_split': 35, 'min_samples_leaf': 56, 'criterion': 'entropy'}.
Trial 1539 finished with value: 0.6956521739130435 and parameters: {'n_estimators': 820, 'max_depth': 14, 'min_samples_split': 17, 'min_samples_leaf': 52, 'criterion': 'entropy'}.
Trial 1540 finished with value: 0.717391304347826 and parameters: {'n_estimators': 773, 'max_depth': 11, 'min_samples_split': 41, 'min_samples_leaf': 59, 'criterion': 'entropy'}.
Trial 1541 finished with value: 0.6956521739130435 and parameters: {'n_estimators': 866, 'max_depth': 16, 'min_samples_split': 31, 'min_samples_leaf': 46, 'criterion': 'entropy'}.
Trial 1542 finished with value: 0.6847826086956522 and parameters: {'n_estimators': 605, 'max_depth': 9, 'min_samples_split': 23, 'min_samples_leaf': 51, 'criterion': 'entropy'}.
Trial 1543 finished with value: 0.7065217391304348 and parameters: {'n_estimators': 792, 'max_depth': 13, 'min_samples_split': 36, 'min_samples_leaf': 54, 'criterion': 'entropy'}.
Trial 1544 finished with value: 0.6739130434782609 and parameters: {'n_estimators': 840, 'max_depth': 6, 'min_samples_split': 21, 'min_samples_leaf': 48, 'criterion': 'entropy'}.
Trial 1545 finished with value: 0.717391304347826 and parameters: {'n_estimators': 820, 'max_depth': 11, 'min_samples_split': 28, 'min_samples_leaf': 57, 'criterion': 'entropy'}.
Trial 1546 finished with value: 0.6521739130434783 and parameters: {'n_estimators': 778, 'max_depth': 8, 'min_samples_split': 100, 'min_samples_leaf': 29, 'criterion': 'entropy'}.
Trial 1547 finished with value: 0.7065217391304348 and parameters: {'n_estimators': 747, 'max_depth': 10, 'min_samples_split': 116, 'min_samples_leaf': 50, 'criterion': 'entropy'}.
Trial 1548 finished with value: 0.7065217391304348 and parameters: {'n_estimators': 803, 'max_depth': 13, 'min_samples_split': 31, 'min_samples_leaf': 53, 'criterion': 'entropy'}.
Trial 1549 finished with value: 0.7065217391304348 and parameters: {'n_estimators': 525, 'max_depth': 9, 'min_samples_split': 106, 'min_samples_leaf': 55, 'criterion': 'entropy'}.
Trial 1550 finished with value: 0.6956521739130435 and parameters: {'n_estimators': 849, 'max_depth': 12, 'min_samples_split': 40, 'min_samples_leaf': 63, 'criterion': 'entropy'}.
Trial 1551 finished with value: 0.6630434782608695 and parameters: {'n_estimators': 820, 'max_depth': 7, 'min_samples_split': 34, 'min_samples_leaf': 44, 'criterion': 'entropy'}.
Trial 1552 finished with value: 0.6847826086956522 and parameters: {'n_estimators': 767, 'max_depth': 17, 'min_samples_split': 45, 'min_samples_leaf': 48, 'criterion': 'entropy'}.
Trial 1553 finished with value: 0.717391304347826 and parameters: {'n_estimators': 790, 'max_depth': 11, 'min_samples_split': 15, 'min_samples_leaf': 50, 'criterion': 'entropy'}.
Trial 1554 finished with value: 0.6847826086956522 and parameters: {'n_estimators': 834, 'max_depth': 15, 'min_samples_split': 26, 'min_samples_leaf': 60, 'criterion': 'gini'}.
Trial 1555 finished with value: 0.6413043478260869 and parameters: {'n_estimators': 725, 'max_depth': 5, 'min_samples_split': 36, 'min_samples_leaf': 52, 'criterion': 'entropy'}.
Trial 1556 finished with value: 0.6521739130434783 and parameters: {'n_estimators': 805, 'max_depth': 9, 'min_samples_split': 29, 'min_samples_leaf': 98, 'criterion': 'entropy'}.
Trial 1557 finished with value: 0.717391304347826 and parameters: {'n_estimators': 852, 'max_depth': 13, 'min_samples_split': 21, 'min_samples_leaf': 58, 'criterion': 'entropy'}.
Trial 1558 finished with value: 0.7065217391304348 and parameters: {'n_estimators': 564, 'max_depth': 8, 'min_samples_split': 39, 'min_samples_leaf': 46, 'criterion': 'entropy'}.
Trial 1559 finished with value: 0.7065217391304348 and parameters: {'n_estimators': 880, 'max_depth': 11, 'min_samples_split': 33, 'min_samples_leaf': 54, 'criterion': 'entropy'}.
Trial 1560 finished with value: 0.7065217391304348 and parameters: {'n_estimators': 825, 'max_depth': 10, 'min_samples_split': 9, 'min_samples_leaf': 51, 'criterion': 'entropy'}.
Trial 1561 finished with value: 0.6739130434782609 and parameters: {'n_estimators': 636, 'max_depth': 7, 'min_samples_split': 135, 'min_samples_leaf': 48, 'criterion': 'entropy'}.
Trial 1562 finished with value: 0.6739130434782609 and parameters: {'n_estimators': 784, 'max_depth': 14, 'min_samples_split': 59, 'min_samples_leaf': 56, 'criterion': 'entropy'}.
Trial 1563 finished with value: 0.6956521739130435 and parameters: {'n_estimators': 806, 'max_depth': 12, 'min_samples_split': 26, 'min_samples_leaf': 53, 'criterion': 'entropy'}.
Trial 1564 finished with value: 0.6304347826086957 and parameters: {'n_estimators': 900, 'max_depth': 10, 'min_samples_split': 32, 'min_samples_leaf': 22, 'criterion': 'entropy'}.
Trial 1565 finished with value: 0.6956521739130435 and parameters: {'n_estimators': 758, 'max_depth': 8, 'min_samples_split': 18, 'min_samples_leaf': 50, 'criterion': 'entropy'}.
Trial 1566 finished with value: 0.6956521739130435 and parameters: {'n_estimators': 867, 'max_depth': 67, 'min_samples_split': 24, 'min_samples_leaf': 45, 'criterion': 'entropy'}.
Trial 1567 finished with value: 0.6195652173913043 and parameters: {'n_estimators': 498, 'max_depth': 6, 'min_samples_split': 67, 'min_samples_leaf': 41, 'criterion': 'entropy'}.
Trial 1568 finished with value: 0.6956521739130435 and parameters: {'n_estimators': 464, 'max_depth': 15, 'min_samples_split': 46, 'min_samples_leaf': 48, 'criterion': 'entropy'}.
Trial 1569 finished with value: 0.717391304347826 and parameters: {'n_estimators': 832, 'max_depth': 12, 'min_samples_split': 37, 'min_samples_leaf': 52, 'criterion': 'entropy'}.
Trial 1570 finished with value: 0.717391304347826 and parameters: {'n_estimators': 793, 'max_depth': 9, 'min_samples_split': 30, 'min_samples_leaf': 55, 'criterion': 'entropy'}.
Trial 1571 finished with value: 0.717391304347826 and parameters: {'n_estimators': 549, 'max_depth': 11, 'min_samples_split': 103, 'min_samples_leaf': 58, 'criterion': 'entropy'}.
Trial 1572 finished with value: 0.7065217391304348 and parameters: {'n_estimators': 982, 'max_depth': 13, 'min_samples_split': 121, 'min_samples_leaf': 50, 'criterion': 'entropy'}.
Trial 1573 finished with value: 0.6956521739130435 and parameters: {'n_estimators': 814, 'max_depth': 8, 'min_samples_split': 43, 'min_samples_leaf': 47, 'criterion': 'gini'}.
Trial 1574 finished with value: 0.6413043478260869 and parameters: {'n_estimators': 945, 'max_depth': 5, 'min_samples_split': 28, 'min_samples_leaf': 53, 'criterion': 'entropy'}.
Trial 1575 finished with value: 0.717391304347826 and parameters: {'n_estimators': 777, 'max_depth': 10, 'min_samples_split': 35, 'min_samples_leaf': 49, 'criterion': 'entropy'}.
Trial 1576 finished with value: 0.6739130434782609 and parameters: {'n_estimators': 844, 'max_depth': 18, 'min_samples_split': 22, 'min_samples_leaf': 56, 'criterion': 'entropy'}.
Trial 1577 finished with value: 0.7065217391304348 and parameters: {'n_estimators': 742, 'max_depth': 14, 'min_samples_split': 39, 'min_samples_leaf': 51, 'criterion': 'entropy'}.
Trial 1578 finished with value: 0.7065217391304348 and parameters: {'n_estimators': 711, 'max_depth': 7, 'min_samples_split': 31, 'min_samples_leaf': 61, 'criterion': 'entropy'}.
Trial 1579 finished with value: 0.7065217391304348 and parameters: {'n_estimators': 582, 'max_depth': 12, 'min_samples_split': 163, 'min_samples_leaf': 54, 'criterion': 'entropy'}.
Trial 1580 finished with value: 0.6956521739130435 and parameters: {'n_estimators': 812, 'max_depth': 9, 'min_samples_split': 25, 'min_samples_leaf': 45, 'criterion': 'entropy'}.
Trial 1581 finished with value: 0.6847826086956522 and parameters: {'n_estimators': 760, 'max_depth': 16, 'min_samples_split': 33, 'min_samples_leaf': 51, 'criterion': 'entropy'}.
Trial 1582 finished with value: 0.717391304347826 and parameters: {'n_estimators': 860, 'max_depth': 11, 'min_samples_split': 14, 'min_samples_leaf': 58, 'criterion': 'entropy'}.
Trial 1583 finished with value: 0.7065217391304348 and parameters: {'n_estimators': 534, 'max_depth': 9, 'min_samples_split': 108, 'min_samples_leaf': 48, 'criterion': 'entropy'}.
Trial 1584 finished with value: 0.6847826086956522 and parameters: {'n_estimators': 836, 'max_depth': 7, 'min_samples_split': 83, 'min_samples_leaf': 53, 'criterion': 'entropy'}.
Trial 1585 finished with value: 0.6847826086956522 and parameters: {'n_estimators': 789, 'max_depth': 23, 'min_samples_split': 28, 'min_samples_leaf': 49, 'criterion': 'entropy'}.
Trial 1586 finished with value: 0.7065217391304348 and parameters: {'n_estimators': 819, 'max_depth': 13, 'min_samples_split': 19, 'min_samples_leaf': 55, 'criterion': 'entropy'}.
Trial 1587 finished with value: 0.717391304347826 and parameters: {'n_estimators': 511, 'max_depth': 10, 'min_samples_split': 41, 'min_samples_leaf': 60, 'criterion': 'entropy'}.
Trial 1588 finished with value: 0.6956521739130435 and parameters: {'n_estimators': 796, 'max_depth': 12, 'min_samples_split': 36, 'min_samples_leaf': 46, 'criterion': 'entropy'}.
Trial 1589 finished with value: 0.6956521739130435 and parameters: {'n_estimators': 771, 'max_depth': 15, 'min_samples_split': 24, 'min_samples_leaf': 51, 'criterion': 'entropy'}.
Trial 1590 finished with value: 0.6847826086956522 and parameters: {'n_estimators': 842, 'max_depth': 6, 'min_samples_split': 112, 'min_samples_leaf': 57, 'criterion': 'entropy'}.
Trial 1591 finished with value: 0.717391304347826 and parameters: {'n_estimators': 803, 'max_depth': 9, 'min_samples_split': 30, 'min_samples_leaf': 52, 'criterion': 'gini'}.
Trial 1592 finished with value: 0.6956521739130435 and parameters: {'n_estimators': 825, 'max_depth': 11, 'min_samples_split': 34, 'min_samples_leaf': 85, 'criterion': 'entropy'}.
Trial 1593 finished with value: 0.6847826086956522 and parameters: {'n_estimators': 860, 'max_depth': 21, 'min_samples_split': 90, 'min_samples_leaf': 47, 'criterion': 'entropy'}.
Trial 1594 finished with value: 0.6956521739130435 and parameters: {'n_estimators': 885, 'max_depth': 8, 'min_samples_split': 94, 'min_samples_leaf': 43, 'criterion': 'entropy'}.
Trial 1595 finished with value: 0.717391304347826 and parameters: {'n_estimators': 780, 'max_depth': 14, 'min_samples_split': 27, 'min_samples_leaf': 49, 'criterion': 'entropy'}.
Trial 1596 finished with value: 0.717391304347826 and parameters: {'n_estimators': 326, 'max_depth': 10, 'min_samples_split': 38, 'min_samples_leaf': 64, 'criterion': 'entropy'}.
Trial 1597 finished with value: 0.6630434782608695 and parameters: {'n_estimators': 811, 'max_depth': 100, 'min_samples_split': 19, 'min_samples_leaf': 54, 'criterion': 'entropy'}.
Trial 1598 finished with value: 0.6413043478260869 and parameters: {'n_estimators': 743, 'max_depth': 5, 'min_samples_split': 23, 'min_samples_leaf': 50, 'criterion': 'entropy'}.
Trial 1599 finished with value: 0.6739130434782609 and parameters: {'n_estimators': 834, 'max_depth': 12, 'min_samples_split': 31, 'min_samples_leaf': 94, 'criterion': 'entropy'}.
Trial 1600 finished with value: 0.6847826086956522 and parameters: {'n_estimators': 795, 'max_depth': 7, 'min_samples_split': 43, 'min_samples_leaf': 52, 'criterion': 'entropy'}.
Trial 1601 finished with value: 0.7282608695652174 and parameters: {'n_estimators': 668, 'max_depth': 10, 'min_samples_split': 35, 'min_samples_leaf': 56, 'criterion': 'entropy'}.
Trial 1602 finished with value: 0.6847826086956522 and parameters: {'n_estimators': 778, 'max_depth': 17, 'min_samples_split': 27, 'min_samples_leaf': 47, 'criterion': 'entropy'}.
Trial 1603 finished with value: 0.6847826086956522 and parameters: {'n_estimators': 762, 'max_depth': 14, 'min_samples_split': 47, 'min_samples_leaf': 54, 'criterion': 'entropy'}.
Trial 1604 finished with value: 0.6956521739130435 and parameters: {'n_estimators': 217, 'max_depth': 8, 'min_samples_split': 40, 'min_samples_leaf': 50, 'criterion': 'entropy'}.
Trial 1605 finished with value: 0.6630434782608695 and parameters: {'n_estimators': 926, 'max_depth': 34, 'min_samples_split': 125, 'min_samples_leaf': 59, 'criterion': 'entropy'}.
Trial 1606 finished with value: 0.7065217391304348 and parameters: {'n_estimators': 853, 'max_depth': 12, 'min_samples_split': 32, 'min_samples_leaf': 52, 'criterion': 'entropy'}.
Trial 1607 finished with value: 0.6956521739130435 and parameters: {'n_estimators': 556, 'max_depth': 9, 'min_samples_split': 12, 'min_samples_leaf': 44, 'criterion': 'entropy'}.
Trial 1608 finished with value: 0.717391304347826 and parameters: {'n_estimators': 818, 'max_depth': 11, 'min_samples_split': 22, 'min_samples_leaf': 57, 'criterion': 'entropy'}.
Trial 1609 finished with value: 0.717391304347826 and parameters: {'n_estimators': 730, 'max_depth': 13, 'min_samples_split': 37, 'min_samples_leaf': 49, 'criterion': 'entropy'}.
Trial 1610 finished with value: 0.6847826086956522 and parameters: {'n_estimators': 798, 'max_depth': 7, 'min_samples_split': 29, 'min_samples_leaf': 54, 'criterion': 'entropy'}.
Trial 1611 finished with value: 0.717391304347826 and parameters: {'n_estimators': 830, 'max_depth': 10, 'min_samples_split': 17, 'min_samples_leaf': 51, 'criterion': 'gini'}.
Trial 1612 finished with value: 0.6739130434782609 and parameters: {'n_estimators': 586, 'max_depth': 16, 'min_samples_split': 24, 'min_samples_leaf': 47, 'criterion': 'entropy'}.
Trial 1613 finished with value: 0.717391304347826 and parameters: {'n_estimators': 869, 'max_depth': 8, 'min_samples_split': 34, 'min_samples_leaf': 62, 'criterion': 'entropy'}.
Trial 1614 finished with value: 0.6739130434782609 and parameters: {'n_estimators': 146, 'max_depth': 29, 'min_samples_split': 115, 'min_samples_leaf': 55, 'criterion': 'entropy'}.
Trial 1615 finished with value: 0.6413043478260869 and parameters: {'n_estimators': 810, 'max_depth': 5, 'min_samples_split': 103, 'min_samples_leaf': 49, 'criterion': 'entropy'}.
Trial 1616 finished with value: 0.7065217391304348 and parameters: {'n_estimators': 759, 'max_depth': 11, 'min_samples_split': 28, 'min_samples_leaf': 53, 'criterion': 'entropy'}.
Trial 1617 finished with value: 0.6956521739130435 and parameters: {'n_estimators': 523, 'max_depth': 13, 'min_samples_split': 98, 'min_samples_leaf': 45, 'criterion': 'entropy'}.
Trial 1618 finished with value: 0.6739130434782609 and parameters: {'n_estimators': 844, 'max_depth': 9, 'min_samples_split': 2, 'min_samples_leaf': 51, 'criterion': 'entropy'}.
Trial 1619 finished with value: 0.7065217391304348 and parameters: {'n_estimators': 616, 'max_depth': 14, 'min_samples_split': 41, 'min_samples_leaf': 57, 'criterion': 'entropy'}.
Trial 1620 finished with value: 0.717391304347826 and parameters: {'n_estimators': 786, 'max_depth': 11, 'min_samples_split': 32, 'min_samples_leaf': 60, 'criterion': 'entropy'}.
Trial 1621 finished with value: 0.6847826086956522 and parameters: {'n_estimators': 826, 'max_depth': 7, 'min_samples_split': 21, 'min_samples_leaf': 48, 'criterion': 'entropy'}.
Trial 1622 finished with value: 0.6630434782608695 and parameters: {'n_estimators': 797, 'max_depth': 19, 'min_samples_split': 36, 'min_samples_leaf': 52, 'criterion': 'entropy'}.
Trial 1623 finished with value: 0.6630434782608695 and parameters: {'n_estimators': 700, 'max_depth': 25, 'min_samples_split': 27, 'min_samples_leaf': 50, 'criterion': 'entropy'}.
Trial 1624 finished with value: 0.717391304347826 and parameters: {'n_estimators': 774, 'max_depth': 9, 'min_samples_split': 39, 'min_samples_leaf': 55, 'criterion': 'entropy'}.
Trial 1625 finished with value: 0.6956521739130435 and parameters: {'n_estimators': 897, 'max_depth': 12, 'min_samples_split': 31, 'min_samples_leaf': 53, 'criterion': 'entropy'}.
Trial 1626 finished with value: 0.6956521739130435 and parameters: {'n_estimators': 815, 'max_depth': 16, 'min_samples_split': 16, 'min_samples_leaf': 47, 'criterion': 'entropy'}.
Trial 1627 finished with value: 0.6630434782608695 and parameters: {'n_estimators': 539, 'max_depth': 38, 'min_samples_split': 50, 'min_samples_leaf': 58, 'criterion': 'entropy'}.
Trial 1628 finished with value: 0.717391304347826 and parameters: {'n_estimators': 753, 'max_depth': 10, 'min_samples_split': 25, 'min_samples_leaf': 50, 'criterion': 'gini'}.
Trial 1629 finished with value: 0.6630434782608695 and parameters: {'n_estimators': 840, 'max_depth': 7, 'min_samples_split': 34, 'min_samples_leaf': 46, 'criterion': 'entropy'}.
Trial 1630 finished with value: 0.6847826086956522 and parameters: {'n_estimators': 868, 'max_depth': 14, 'min_samples_split': 43, 'min_samples_leaf': 56, 'criterion': 'entropy'}.
Trial 1631 finished with value: 0.7065217391304348 and parameters: {'n_estimators': 796, 'max_depth': 12, 'min_samples_split': 30, 'min_samples_leaf': 53, 'criterion': 'entropy'}.
Trial 1632 finished with value: 0.7282608695652174 and parameters: {'n_estimators': 570, 'max_depth': 9, 'min_samples_split': 21, 'min_samples_leaf': 49, 'criterion': 'entropy'}.
Trial 1633 finished with value: 0.6413043478260869 and parameters: {'n_estimators': 815, 'max_depth': 5, 'min_samples_split': 37, 'min_samples_leaf': 51, 'criterion': 'entropy'}.
Trial 1634 finished with value: 0.6956521739130435 and parameters: {'n_estimators': 850, 'max_depth': 11, 'min_samples_split': 25, 'min_samples_leaf': 55, 'criterion': 'entropy'}.
Trial 1635 finished with value: 0.6956521739130435 and parameters: {'n_estimators': 785, 'max_depth': 8, 'min_samples_split': 31, 'min_samples_leaf': 48, 'criterion': 'entropy'}.
Trial 1636 finished with value: 0.7065217391304348 and parameters: {'n_estimators': 830, 'max_depth': 13, 'min_samples_split': 27, 'min_samples_leaf': 44, 'criterion': 'entropy'}.
Trial 1637 finished with value: 0.7065217391304348 and parameters: {'n_estimators': 735, 'max_depth': 10, 'min_samples_split': 109, 'min_samples_leaf': 60, 'criterion': 'entropy'}.
Trial 1638 finished with value: 0.6739130434782609 and parameters: {'n_estimators': 107, 'max_depth': 15, 'min_samples_split': 35, 'min_samples_leaf': 52, 'criterion': 'entropy'}.
Trial 1639 finished with value: 0.6956521739130435 and parameters: {'n_estimators': 807, 'max_depth': 7, 'min_samples_split': 40, 'min_samples_leaf': 58, 'criterion': 'entropy'}.
Trial 1640 finished with value: 0.7065217391304348 and parameters: {'n_estimators': 767, 'max_depth': 11, 'min_samples_split': 20, 'min_samples_leaf': 41, 'criterion': 'entropy'}.
Trial 1641 finished with value: 0.6847826086956522 and parameters: {'n_estimators': 646, 'max_depth': 9, 'min_samples_split': 29, 'min_samples_leaf': 88, 'criterion': 'entropy'}.
Trial 1642 finished with value: 0.6956521739130435 and parameters: {'n_estimators': 876, 'max_depth': 13, 'min_samples_split': 46, 'min_samples_leaf': 54, 'criterion': 'entropy'}.
Trial 1643 finished with value: 0.6847826086956522 and parameters: {'n_estimators': 845, 'max_depth': 7, 'min_samples_split': 33, 'min_samples_leaf': 50, 'criterion': 'entropy'}.
Trial 1644 finished with value: 0.7065217391304348 and parameters: {'n_estimators': 827, 'max_depth': 11, 'min_samples_split': 25, 'min_samples_leaf': 47, 'criterion': 'entropy'}.
Trial 1645 finished with value: 0.6847826086956522 and parameters: {'n_estimators': 780, 'max_depth': 76, 'min_samples_split': 14, 'min_samples_leaf': 56, 'criterion': 'entropy'}.
Trial 1646 finished with value: 0.6847826086956522 and parameters: {'n_estimators': 802, 'max_depth': 9, 'min_samples_split': 37, 'min_samples_leaf': 52, 'criterion': 'entropy'}.
Trial 1647 finished with value: 0.6630434782608695 and parameters: {'n_estimators': 860, 'max_depth': 69, 'min_samples_split': 30, 'min_samples_leaf': 49, 'criterion': 'gini'}.
Trial 1648 finished with value: 0.6847826086956522 and parameters: {'n_estimators': 719, 'max_depth': 15, 'min_samples_split': 22, 'min_samples_leaf': 62, 'criterion': 'entropy'}.
Trial 1649 finished with value: 0.6847826086956522 and parameters: {'n_estimators': 597, 'max_depth': 42, 'min_samples_split': 34, 'min_samples_leaf': 46, 'criterion': 'entropy'}.
Trial 1650 finished with value: 0.6304347826086957 and parameters: {'n_estimators': 751, 'max_depth': 5, 'min_samples_split': 55, 'min_samples_leaf': 7, 'criterion': 'entropy'}.
Trial 1651 finished with value: 0.7065217391304348 and parameters: {'n_estimators': 556, 'max_depth': 12, 'min_samples_split': 9, 'min_samples_leaf': 54, 'criterion': 'entropy'}.
Trial 1652 finished with value: 0.6847826086956522 and parameters: {'n_estimators': 818, 'max_depth': 8, 'min_samples_split': 100, 'min_samples_leaf': 51, 'criterion': 'entropy'}.
Trial 1653 finished with value: 0.6956521739130435 and parameters: {'n_estimators': 788, 'max_depth': 10, 'min_samples_split': 17, 'min_samples_leaf': 48, 'criterion': 'entropy'}.
Trial 1654 finished with value: 0.717391304347826 and parameters: {'n_estimators': 774, 'max_depth': 13, 'min_samples_split': 72, 'min_samples_leaf': 53, 'criterion': 'entropy'}.
Trial 1655 finished with value: 0.6956521739130435 and parameters: {'n_estimators': 837, 'max_depth': 6, 'min_samples_split': 41, 'min_samples_leaf': 100, 'criterion': 'entropy'}.
