Trial 2388 finished with value: 0.6739130434782609 and parameters: {'n_estimators': 787, 'max_depth': 16, 'min_samples_split': 25, 'min_samples_leaf': 58, 'criterion': 'entropy'}.
Trial 2389 finished with value: 0.6630434782608695 and parameters: {'n_estimators': 936, 'max_depth': 7, 'min_samples_split': 30, 'min_samples_leaf': 52, 'criterion': 'entropy'}.
Trial 2390 finished with value: 0.7065217391304348 and parameters: {'n_estimators': 891, 'max_depth': 13, 'min_samples_split': 17, 'min_samples_leaf': 47, 'criterion': 'entropy'}.
Trial 2391 finished with value: 0.7282608695652174 and parameters: {'n_estimators': 501, 'max_depth': 10, 'min_samples_split': 117, 'min_samples_leaf': 50, 'criterion': 'entropy'}.
Trial 2392 finished with value: 0.6956521739130435 and parameters: {'n_estimators': 826, 'max_depth': 11, 'min_samples_split': 36, 'min_samples_leaf': 55, 'criterion': 'entropy'}.
Trial 2393 finished with value: 0.6521739130434783 and parameters: {'n_estimators': 797, 'max_depth': 5, 'min_samples_split': 22, 'min_samples_leaf': 59, 'criterion': 'entropy'}.
Trial 2394 finished with value: 0.6956521739130435 and parameters: {'n_estimators': 747, 'max_depth': 8, 'min_samples_split': 28, 'min_samples_leaf': 53, 'criterion': 'entropy'}.
Trial 2395 finished with value: 0.717391304347826 and parameters: {'n_estimators': 847, 'max_depth': 14, 'min_samples_split': 31, 'min_samples_leaf': 49, 'criterion': 'entropy'}.
Trial 2396 finished with value: 0.6956521739130435 and parameters: {'n_estimators': 698, 'max_depth': 12, 'min_samples_split': 54, 'min_samples_leaf': 56, 'criterion': 'entropy'}.
Trial 2397 finished with value: 0.6956521739130435 and parameters: {'n_estimators': 772, 'max_depth': 9, 'min_samples_split': 26, 'min_samples_leaf': 44, 'criterion': 'entropy'}.
Trial 2398 finished with value: 0.7065217391304348 and parameters: {'n_estimators': 616, 'max_depth': 11, 'min_samples_split': 96, 'min_samples_leaf': 51, 'criterion': 'entropy'}.
Trial 2399 finished with value: 0.6847826086956522 and parameters: {'n_estimators': 867, 'max_depth': 16, 'min_samples_split': 34, 'min_samples_leaf': 47, 'criterion': 'gini'}.
Trial 2400 finished with value: 0.7065217391304348 and parameters: {'n_estimators': 801, 'max_depth': 7, 'min_samples_split': 41, 'min_samples_leaf': 61, 'criterion': 'entropy'}.
Trial 2401 finished with value: 0.6956521739130435 and parameters: {'n_estimators': 970, 'max_depth': 13, 'min_samples_split': 20, 'min_samples_leaf': 54, 'criterion': 'entropy'}.
Trial 2402 finished with value: 0.717391304347826 and parameters: {'n_estimators': 537, 'max_depth': 10, 'min_samples_split': 15, 'min_samples_leaf': 57, 'criterion': 'entropy'}.
Trial 2403 finished with value: 0.6847826086956522 and parameters: {'n_estimators': 720, 'max_depth': 8, 'min_samples_split': 101, 'min_samples_leaf': 51, 'criterion': 'entropy'}.
Trial 2404 finished with value: 0.6739130434782609 and parameters: {'n_estimators': 443, 'max_depth': 27, 'min_samples_split': 38, 'min_samples_leaf': 49, 'criterion': 'entropy'}.
Trial 2405 finished with value: 0.6956521739130435 and parameters: {'n_estimators': 828, 'max_depth': 14, 'min_samples_split': 25, 'min_samples_leaf': 53, 'criterion': 'entropy'}.
Trial 2406 finished with value: 0.717391304347826 and parameters: {'n_estimators': 760, 'max_depth': 11, 'min_samples_split': 29, 'min_samples_leaf': 59, 'criterion': 'entropy'}.
Trial 2407 finished with value: 0.6739130434782609 and parameters: {'n_estimators': 813, 'max_depth': 50, 'min_samples_split': 6, 'min_samples_leaf': 64, 'criterion': 'entropy'}.
Trial 2408 finished with value: 0.6956521739130435 and parameters: {'n_estimators': 911, 'max_depth': 9, 'min_samples_split': 33, 'min_samples_leaf': 46, 'criterion': 'entropy'}.
Trial 2409 finished with value: 0.6739130434782609 and parameters: {'n_estimators': 736, 'max_depth': 6, 'min_samples_split': 21, 'min_samples_leaf': 52, 'criterion': 'entropy'}.
Trial 2410 finished with value: 0.6521739130434783 and parameters: {'n_estimators': 779, 'max_depth': 20, 'min_samples_split': 43, 'min_samples_leaf': 55, 'criterion': 'entropy'}.
Trial 2411 finished with value: 0.7065217391304348 and parameters: {'n_estimators': 791, 'max_depth': 12, 'min_samples_split': 111, 'min_samples_leaf': 57, 'criterion': 'entropy'}.
Trial 2412 finished with value: 0.6847826086956522 and parameters: {'n_estimators': 841, 'max_depth': 17, 'min_samples_split': 31, 'min_samples_leaf': 49, 'criterion': 'entropy'}.
Trial 2413 finished with value: 0.717391304347826 and parameters: {'n_estimators': 348, 'max_depth': 10, 'min_samples_split': 37, 'min_samples_leaf': 61, 'criterion': 'entropy'}.
Trial 2414 finished with value: 0.6739130434782609 and parameters: {'n_estimators': 411, 'max_depth': 77, 'min_samples_split': 24, 'min_samples_leaf': 51, 'criterion': 'entropy'}.
Trial 2415 finished with value: 0.6847826086956522 and parameters: {'n_estimators': 818, 'max_depth': 14, 'min_samples_split': 28, 'min_samples_leaf': 54, 'criterion': 'entropy'}.
Trial 2416 finished with value: 0.6956521739130435 and parameters: {'n_estimators': 751, 'max_depth': 7, 'min_samples_split': 13, 'min_samples_leaf': 48, 'criterion': 'entropy'}.
Trial 2417 finished with value: 0.6956521739130435 and parameters: {'n_estimators': 879, 'max_depth': 12, 'min_samples_split': 46, 'min_samples_leaf': 56, 'criterion': 'entropy'}.
Trial 2418 finished with value: 0.7065217391304348 and parameters: {'n_estimators': 796, 'max_depth': 9, 'min_samples_split': 18, 'min_samples_leaf': 59, 'criterion': 'gini'}.
Trial 2419 finished with value: 0.6739130434782609 and parameters: {'n_estimators': 573, 'max_depth': 5, 'min_samples_split': 33, 'min_samples_leaf': 69, 'criterion': 'entropy'}.
Trial 2420 finished with value: 0.6630434782608695 and parameters: {'n_estimators': 838, 'max_depth': 15, 'min_samples_split': 25, 'min_samples_leaf': 50, 'criterion': 'entropy'}.
Trial 2421 finished with value: 0.7065217391304348 and parameters: {'n_estimators': 767, 'max_depth': 11, 'min_samples_split': 37, 'min_samples_leaf': 53, 'criterion': 'entropy'}.
Trial 2422 finished with value: 0.6956521739130435 and parameters: {'n_estimators': 815, 'max_depth': 8, 'min_samples_split': 120, 'min_samples_leaf': 45, 'criterion': 'entropy'}.
Trial 2423 finished with value: 0.6956521739130435 and parameters: {'n_estimators': 685, 'max_depth': 10, 'min_samples_split': 30, 'min_samples_leaf': 42, 'criterion': 'entropy'}.
Trial 2424 finished with value: 0.6739130434782609 and parameters: {'n_estimators': 858, 'max_depth': 37, 'min_samples_split': 22, 'min_samples_leaf': 57, 'criterion': 'entropy'}.
Trial 2425 finished with value: 0.7065217391304348 and parameters: {'n_estimators': 549, 'max_depth': 13, 'min_samples_split': 34, 'min_samples_leaf': 52, 'criterion': 'entropy'}.
Trial 2426 finished with value: 0.7065217391304348 and parameters: {'n_estimators': 783, 'max_depth': 8, 'min_samples_split': 27, 'min_samples_leaf': 80, 'criterion': 'entropy'}.
Trial 2427 finished with value: 0.6847826086956522 and parameters: {'n_estimators': 717, 'max_depth': 12, 'min_samples_split': 41, 'min_samples_leaf': 55, 'criterion': 'entropy'}.
Trial 2428 finished with value: 0.6956521739130435 and parameters: {'n_estimators': 745, 'max_depth': 15, 'min_samples_split': 16, 'min_samples_leaf': 48, 'criterion': 'entropy'}.
Trial 2429 finished with value: 0.6847826086956522 and parameters: {'n_estimators': 797, 'max_depth': 7, 'min_samples_split': 31, 'min_samples_leaf': 50, 'criterion': 'entropy'}.
Trial 2430 finished with value: 0.6956521739130435 and parameters: {'n_estimators': 823, 'max_depth': 10, 'min_samples_split': 21, 'min_samples_leaf': 60, 'criterion': 'entropy'}.
Trial 2431 finished with value: 0.6739130434782609 and parameters: {'n_estimators': 843, 'max_depth': 18, 'min_samples_split': 36, 'min_samples_leaf': 53, 'criterion': 'entropy'}.
Trial 2432 finished with value: 0.7065217391304348 and parameters: {'n_estimators': 769, 'max_depth': 13, 'min_samples_split': 26, 'min_samples_leaf': 47, 'criterion': 'entropy'}.
Trial 2433 finished with value: 0.7065217391304348 and parameters: {'n_estimators': 511, 'max_depth': 9, 'min_samples_split': 40, 'min_samples_leaf': 58, 'criterion': 'entropy'}.
Trial 2434 finished with value: 0.6956521739130435 and parameters: {'n_estimators': 807, 'max_depth': 11, 'min_samples_split': 29, 'min_samples_leaf': 55, 'criterion': 'entropy'}.
Trial 2435 finished with value: 0.6739130434782609 and parameters: {'n_estimators': 729, 'max_depth': 6, 'min_samples_split': 181, 'min_samples_leaf': 62, 'criterion': 'entropy'}.
Trial 2436 finished with value: 0.7065217391304348 and parameters: {'n_estimators': 776, 'max_depth': 13, 'min_samples_split': 114, 'min_samples_leaf': 51, 'criterion': 'gini'}.
Trial 2437 finished with value: 0.717391304347826 and parameters: {'n_estimators': 833, 'max_depth': 9, 'min_samples_split': 48, 'min_samples_leaf': 49, 'criterion': 'entropy'}.
Trial 2438 finished with value: 0.6630434782608695 and parameters: {'n_estimators': 592, 'max_depth': 22, 'min_samples_split': 23, 'min_samples_leaf': 53, 'criterion': 'entropy'}.
Trial 2439 finished with value: 0.6956521739130435 and parameters: {'n_estimators': 757, 'max_depth': 16, 'min_samples_split': 33, 'min_samples_leaf': 57, 'criterion': 'entropy'}.
Trial 2440 finished with value: 0.6956521739130435 and parameters: {'n_estimators': 794, 'max_depth': 12, 'min_samples_split': 19, 'min_samples_leaf': 46, 'criterion': 'entropy'}.
Trial 2441 finished with value: 0.717391304347826 and parameters: {'n_estimators': 868, 'max_depth': 10, 'min_samples_split': 28, 'min_samples_leaf': 51, 'criterion': 'entropy'}.
Trial 2442 finished with value: 0.6847826086956522 and parameters: {'n_estimators': 820, 'max_depth': 7, 'min_samples_split': 37, 'min_samples_leaf': 55, 'criterion': 'entropy'}.
Trial 2443 finished with value: 0.717391304347826 and parameters: {'n_estimators': 782, 'max_depth': 14, 'min_samples_split': 33, 'min_samples_leaf': 48, 'criterion': 'entropy'}.
Trial 2444 finished with value: 0.717391304347826 and parameters: {'n_estimators': 809, 'max_depth': 11, 'min_samples_split': 11, 'min_samples_leaf': 59, 'criterion': 'entropy'}.
Trial 2445 finished with value: 0.6413043478260869 and parameters: {'n_estimators': 564, 'max_depth': 5, 'min_samples_split': 25, 'min_samples_leaf': 52, 'criterion': 'entropy'}.
Trial 2446 finished with value: 0.7282608695652174 and parameters: {'n_estimators': 535, 'max_depth': 8, 'min_samples_split': 108, 'min_samples_leaf': 54, 'criterion': 'entropy'}.
Trial 2447 finished with value: 0.7282608695652174 and parameters: {'n_estimators': 850, 'max_depth': 11, 'min_samples_split': 18, 'min_samples_leaf': 50, 'criterion': 'entropy'}.
Trial 2448 finished with value: 0.6739130434782609 and parameters: {'n_estimators': 307, 'max_depth': 9, 'min_samples_split': 31, 'min_samples_leaf': 44, 'criterion': 'entropy'}.
Trial 2449 finished with value: 0.6956521739130435 and parameters: {'n_estimators': 747, 'max_depth': 14, 'min_samples_split': 39, 'min_samples_leaf': 56, 'criterion': 'entropy'}.
Trial 2450 finished with value: 0.6739130434782609 and parameters: {'n_estimators': 766, 'max_depth': 12, 'min_samples_split': 43, 'min_samples_leaf': 63, 'criterion': 'entropy'}.
Trial 2451 finished with value: 0.6739130434782609 and parameters: {'n_estimators': 700, 'max_depth': 16, 'min_samples_split': 23, 'min_samples_leaf': 58, 'criterion': 'entropy'}.
Trial 2452 finished with value: 0.7065217391304348 and parameters: {'n_estimators': 798, 'max_depth': 8, 'min_samples_split': 35, 'min_samples_leaf': 53, 'criterion': 'entropy'}.
Trial 2453 finished with value: 0.7282608695652174 and parameters: {'n_estimators': 828, 'max_depth': 10, 'min_samples_split': 28, 'min_samples_leaf': 49, 'criterion': 'entropy'}.
Trial 2454 finished with value: 0.7065217391304348 and parameters: {'n_estimators': 734, 'max_depth': 7, 'min_samples_split': 31, 'min_samples_leaf': 61, 'criterion': 'entropy'}.
Trial 2455 finished with value: 0.7065217391304348 and parameters: {'n_estimators': 790, 'max_depth': 13, 'min_samples_split': 25, 'min_samples_leaf': 51, 'criterion': 'gini'}.
Trial 2456 finished with value: 0.7065217391304348 and parameters: {'n_estimators': 818, 'max_depth': 11, 'min_samples_split': 20, 'min_samples_leaf': 47, 'criterion': 'entropy'}.
Trial 2457 finished with value: 0.6956521739130435 and parameters: {'n_estimators': 767, 'max_depth': 9, 'min_samples_split': 36, 'min_samples_leaf': 66, 'criterion': 'entropy'}.
Trial 2458 finished with value: 0.6304347826086957 and parameters: {'n_estimators': 647, 'max_depth': 5, 'min_samples_split': 14, 'min_samples_leaf': 56, 'criterion': 'entropy'}.
Trial 2459 finished with value: 0.6739130434782609 and parameters: {'n_estimators': 896, 'max_depth': 15, 'min_samples_split': 27, 'min_samples_leaf': 54, 'criterion': 'entropy'}.
Trial 2460 finished with value: 0.7065217391304348 and parameters: {'n_estimators': 844, 'max_depth': 12, 'min_samples_split': 33, 'min_samples_leaf': 59, 'criterion': 'entropy'}.
Trial 2461 finished with value: 0.7282608695652174 and parameters: {'n_estimators': 801, 'max_depth': 10, 'min_samples_split': 22, 'min_samples_leaf': 52, 'criterion': 'entropy'}.
Trial 2462 finished with value: 0.6739130434782609 and parameters: {'n_estimators': 950, 'max_depth': 17, 'min_samples_split': 39, 'min_samples_leaf': 50, 'criterion': 'entropy'}.
Trial 2463 finished with value: 0.6739130434782609 and parameters: {'n_estimators': 712, 'max_depth': 7, 'min_samples_split': 45, 'min_samples_leaf': 46, 'criterion': 'entropy'}.
Trial 2464 finished with value: 0.717391304347826 and parameters: {'n_estimators': 780, 'max_depth': 13, 'min_samples_split': 29, 'min_samples_leaf': 55, 'criterion': 'entropy'}.
Trial 2465 finished with value: 0.717391304347826 and parameters: {'n_estimators': 754, 'max_depth': 9, 'min_samples_split': 33, 'min_samples_leaf': 48, 'criterion': 'entropy'}.
Trial 2466 finished with value: 0.7065217391304348 and parameters: {'n_estimators': 832, 'max_depth': 11, 'min_samples_split': 130, 'min_samples_leaf': 57, 'criterion': 'entropy'}.
Trial 2467 finished with value: 0.7065217391304348 and parameters: {'n_estimators': 921, 'max_depth': 14, 'min_samples_split': 102, 'min_samples_leaf': 37, 'criterion': 'entropy'}.
Trial 2468 finished with value: 0.6956521739130435 and parameters: {'n_estimators': 866, 'max_depth': 8, 'min_samples_split': 24, 'min_samples_leaf': 51, 'criterion': 'entropy'}.
Trial 2469 finished with value: 0.717391304347826 and parameters: {'n_estimators': 520, 'max_depth': 11, 'min_samples_split': 17, 'min_samples_leaf': 53, 'criterion': 'entropy'}.
Trial 2470 finished with value: 0.6847826086956522 and parameters: {'n_estimators': 810, 'max_depth': 6, 'min_samples_split': 28, 'min_samples_leaf': 61, 'criterion': 'entropy'}.
Trial 2471 finished with value: 0.717391304347826 and parameters: {'n_estimators': 739, 'max_depth': 9, 'min_samples_split': 37, 'min_samples_leaf': 49, 'criterion': 'entropy'}.
Trial 2472 finished with value: 0.7391304347826086 and parameters: {'n_estimators': 773, 'max_depth': 13, 'min_samples_split': 41, 'min_samples_leaf': 58, 'criterion': 'entropy'}.
Trial 2473 finished with value: 0.6739130434782609 and parameters: {'n_estimators': 761, 'max_depth': 18, 'min_samples_split': 42, 'min_samples_leaf': 64, 'criterion': 'entropy'}.
Trial 2474 finished with value: 0.6956521739130435 and parameters: {'n_estimators': 771, 'max_depth': 16, 'min_samples_split': 45, 'min_samples_leaf': 62, 'criterion': 'entropy'}.
Trial 2475 finished with value: 0.6630434782608695 and parameters: {'n_estimators': 754, 'max_depth': 19, 'min_samples_split': 51, 'min_samples_leaf': 60, 'criterion': 'gini'}.
Trial 2476 finished with value: 0.6630434782608695 and parameters: {'n_estimators': 773, 'max_depth': 18, 'min_samples_split': 50, 'min_samples_leaf': 60, 'criterion': 'entropy'}.
Trial 2477 finished with value: 0.6739130434782609 and parameters: {'n_estimators': 742, 'max_depth': 16, 'min_samples_split': 43, 'min_samples_leaf': 59, 'criterion': 'entropy'}.
Trial 2478 finished with value: 0.6739130434782609 and parameters: {'n_estimators': 779, 'max_depth': 15, 'min_samples_split': 40, 'min_samples_leaf': 60, 'criterion': 'entropy'}.
Trial 2479 finished with value: 0.6847826086956522 and parameters: {'n_estimators': 785, 'max_depth': 17, 'min_samples_split': 40, 'min_samples_leaf': 62, 'criterion': 'entropy'}.
Trial 2480 finished with value: 0.6739130434782609 and parameters: {'n_estimators': 767, 'max_depth': 15, 'min_samples_split': 39, 'min_samples_leaf': 63, 'criterion': 'entropy'}.
Trial 2481 finished with value: 0.6847826086956522 and parameters: {'n_estimators': 747, 'max_depth': 14, 'min_samples_split': 42, 'min_samples_leaf': 58, 'criterion': 'entropy'}.
Trial 2482 finished with value: 0.6956521739130435 and parameters: {'n_estimators': 784, 'max_depth': 14, 'min_samples_split': 47, 'min_samples_leaf': 59, 'criterion': 'entropy'}.
Trial 2483 finished with value: 0.6739130434782609 and parameters: {'n_estimators': 755, 'max_depth': 20, 'min_samples_split': 37, 'min_samples_leaf': 61, 'criterion': 'entropy'}.
Trial 2484 finished with value: 0.6739130434782609 and parameters: {'n_estimators': 789, 'max_depth': 16, 'min_samples_split': 37, 'min_samples_leaf': 60, 'criterion': 'entropy'}.
Trial 2485 finished with value: 0.717391304347826 and parameters: {'n_estimators': 720, 'max_depth': 13, 'min_samples_split': 43, 'min_samples_leaf': 58, 'criterion': 'entropy'}.
Trial 2486 finished with value: 0.6847826086956522 and parameters: {'n_estimators': 764, 'max_depth': 15, 'min_samples_split': 36, 'min_samples_leaf': 57, 'criterion': 'entropy'}.
Trial 2487 finished with value: 0.7391304347826086 and parameters: {'n_estimators': 745, 'max_depth': 13, 'min_samples_split': 35, 'min_samples_leaf': 58, 'criterion': 'entropy'}.
Trial 2488 finished with value: 0.6739130434782609 and parameters: {'n_estimators': 718, 'max_depth': 17, 'min_samples_split': 43, 'min_samples_leaf': 58, 'criterion': 'entropy'}.
Trial 2489 finished with value: 0.6739130434782609 and parameters: {'n_estimators': 732, 'max_depth': 18, 'min_samples_split': 40, 'min_samples_leaf': 64, 'criterion': 'entropy'}.
Trial 2490 finished with value: 0.6956521739130435 and parameters: {'n_estimators': 730, 'max_depth': 16, 'min_samples_split': 41, 'min_samples_leaf': 62, 'criterion': 'entropy'}.
Trial 2491 finished with value: 0.6630434782608695 and parameters: {'n_estimators': 721, 'max_depth': 15, 'min_samples_split': 39, 'min_samples_leaf': 59, 'criterion': 'entropy'}.
Trial 2492 finished with value: 0.6847826086956522 and parameters: {'n_estimators': 737, 'max_depth': 18, 'min_samples_split': 44, 'min_samples_leaf': 57, 'criterion': 'entropy'}.
Trial 2493 finished with value: 0.6739130434782609 and parameters: {'n_estimators': 698, 'max_depth': 17, 'min_samples_split': 45, 'min_samples_leaf': 58, 'criterion': 'entropy'}.
Trial 2494 finished with value: 0.6847826086956522 and parameters: {'n_estimators': 711, 'max_depth': 15, 'min_samples_split': 38, 'min_samples_leaf': 61, 'criterion': 'entropy'}.
Trial 2495 finished with value: 0.6739130434782609 and parameters: {'n_estimators': 722, 'max_depth': 20, 'min_samples_split': 37, 'min_samples_leaf': 57, 'criterion': 'entropy'}.
Trial 2496 finished with value: 0.7065217391304348 and parameters: {'n_estimators': 737, 'max_depth': 14, 'min_samples_split': 40, 'min_samples_leaf': 60, 'criterion': 'gini'}.
Trial 2497 finished with value: 0.6956521739130435 and parameters: {'n_estimators': 740, 'max_depth': 14, 'min_samples_split': 47, 'min_samples_leaf': 57, 'criterion': 'entropy'}.
Trial 2498 finished with value: 0.6739130434782609 and parameters: {'n_estimators': 690, 'max_depth': 16, 'min_samples_split': 35, 'min_samples_leaf': 59, 'criterion': 'entropy'}.
Trial 2499 finished with value: 0.6630434782608695 and parameters: {'n_estimators': 746, 'max_depth': 33, 'min_samples_split': 36, 'min_samples_leaf': 63, 'criterion': 'entropy'}.
Trial 2500 finished with value: 0.7065217391304348 and parameters: {'n_estimators': 709, 'max_depth': 14, 'min_samples_split': 40, 'min_samples_leaf': 57, 'criterion': 'entropy'}.
Trial 2501 finished with value: 0.6956521739130435 and parameters: {'n_estimators': 734, 'max_depth': 13, 'min_samples_split': 35, 'min_samples_leaf': 66, 'criterion': 'entropy'}.
Trial 2502 finished with value: 0.7065217391304348 and parameters: {'n_estimators': 751, 'max_depth': 16, 'min_samples_split': 56, 'min_samples_leaf': 56, 'criterion': 'entropy'}.
Trial 2503 finished with value: 0.6956521739130435 and parameters: {'n_estimators': 724, 'max_depth': 13, 'min_samples_split': 43, 'min_samples_leaf': 60, 'criterion': 'entropy'}.
Trial 2504 finished with value: 0.6847826086956522 and parameters: {'n_estimators': 750, 'max_depth': 14, 'min_samples_split': 46, 'min_samples_leaf': 56, 'criterion': 'entropy'}.
Trial 2505 finished with value: 0.7065217391304348 and parameters: {'n_estimators': 705, 'max_depth': 13, 'min_samples_split': 35, 'min_samples_leaf': 59, 'criterion': 'entropy'}.
Trial 2506 finished with value: 0.6739130434782609 and parameters: {'n_estimators': 750, 'max_depth': 18, 'min_samples_split': 49, 'min_samples_leaf': 56, 'criterion': 'entropy'}.
Trial 2507 finished with value: 0.6847826086956522 and parameters: {'n_estimators': 732, 'max_depth': 15, 'min_samples_split': 38, 'min_samples_leaf': 62, 'criterion': 'entropy'}.
Trial 2508 finished with value: 0.717391304347826 and parameters: {'n_estimators': 759, 'max_depth': 13, 'min_samples_split': 34, 'min_samples_leaf': 55, 'criterion': 'entropy'}.
Trial 2509 finished with value: 0.7282608695652174 and parameters: {'n_estimators': 737, 'max_depth': 13, 'min_samples_split': 40, 'min_samples_leaf': 58, 'criterion': 'entropy'}.
