Trial 4971 finished with value: 0.6847826086956522 and parameters: {'n_estimators': 730, 'max_depth': 12, 'min_samples_split': 24, 'min_samples_leaf': 63, 'criterion': 'entropy'}.
Trial 4972 finished with value: 0.6739130434782609 and parameters: {'n_estimators': 276, 'max_depth': 6, 'min_samples_split': 35, 'min_samples_leaf': 67, 'criterion': 'gini'}.
Trial 4973 finished with value: 0.717391304347826 and parameters: {'n_estimators': 303, 'max_depth': 10, 'min_samples_split': 28, 'min_samples_leaf': 60, 'criterion': 'entropy'}.
Trial 4974 finished with value: 0.6739130434782609 and parameters: {'n_estimators': 242, 'max_depth': 13, 'min_samples_split': 38, 'min_samples_leaf': 75, 'criterion': 'gini'}.
Trial 4975 finished with value: 0.717391304347826 and parameters: {'n_estimators': 745, 'max_depth': 8, 'min_samples_split': 19, 'min_samples_leaf': 56, 'criterion': 'entropy'}.
Trial 4976 finished with value: 0.6847826086956522 and parameters: {'n_estimators': 328, 'max_depth': 15, 'min_samples_split': 90, 'min_samples_leaf': 59, 'criterion': 'entropy'}.
Trial 4977 finished with value: 0.6956521739130435 and parameters: {'n_estimators': 268, 'max_depth': 12, 'min_samples_split': 32, 'min_samples_leaf': 73, 'criterion': 'gini'}.
Trial 4978 finished with value: 0.7065217391304348 and parameters: {'n_estimators': 254, 'max_depth': 10, 'min_samples_split': 138, 'min_samples_leaf': 64, 'criterion': 'entropy'}.
Trial 4979 finished with value: 0.6956521739130435 and parameters: {'n_estimators': 223, 'max_depth': 7, 'min_samples_split': 24, 'min_samples_leaf': 70, 'criterion': 'gini'}.
Trial 4980 finished with value: 0.6739130434782609 and parameters: {'n_estimators': 209, 'max_depth': 49, 'min_samples_split': 145, 'min_samples_leaf': 57, 'criterion': 'entropy'}.
Trial 4981 finished with value: 0.6413043478260869 and parameters: {'n_estimators': 617, 'max_depth': 5, 'min_samples_split': 13, 'min_samples_leaf': 62, 'criterion': 'gini'}.
Trial 4982 finished with value: 0.6956521739130435 and parameters: {'n_estimators': 292, 'max_depth': 62, 'min_samples_split': 149, 'min_samples_leaf': 54, 'criterion': 'entropy'}.
Trial 4983 finished with value: 0.7065217391304348 and parameters: {'n_estimators': 768, 'max_depth': 14, 'min_samples_split': 124, 'min_samples_leaf': 59, 'criterion': 'gini'}.
Trial 4984 finished with value: 0.6739130434782609 and parameters: {'n_estimators': 310, 'max_depth': 74, 'min_samples_split': 109, 'min_samples_leaf': 61, 'criterion': 'entropy'}.
Trial 4985 finished with value: 0.7282608695652174 and parameters: {'n_estimators': 275, 'max_depth': 11, 'min_samples_split': 28, 'min_samples_leaf': 56, 'criterion': 'gini'}.
Trial 4986 finished with value: 0.7065217391304348 and parameters: {'n_estimators': 245, 'max_depth': 9, 'min_samples_split': 41, 'min_samples_leaf': 58, 'criterion': 'entropy'}.
Trial 4987 finished with value: 0.6521739130434783 and parameters: {'n_estimators': 131, 'max_depth': 17, 'min_samples_split': 45, 'min_samples_leaf': 65, 'criterion': 'gini'}.
Trial 4988 finished with value: 0.7065217391304348 and parameters: {'n_estimators': 684, 'max_depth': 8, 'min_samples_split': 99, 'min_samples_leaf': 71, 'criterion': 'entropy'}.
Trial 4989 finished with value: 0.717391304347826 and parameters: {'n_estimators': 262, 'max_depth': 12, 'min_samples_split': 33, 'min_samples_leaf': 54, 'criterion': 'gini'}.
Trial 4990 finished with value: 0.6847826086956522 and parameters: {'n_estimators': 283, 'max_depth': 14, 'min_samples_split': 141, 'min_samples_leaf': 60, 'criterion': 'entropy'}.
Trial 4991 finished with value: 0.7065217391304348 and parameters: {'n_estimators': 300, 'max_depth': 11, 'min_samples_split': 129, 'min_samples_leaf': 57, 'criterion': 'gini'}.
Trial 4992 finished with value: 0.717391304347826 and parameters: {'n_estimators': 494, 'max_depth': 9, 'min_samples_split': 21, 'min_samples_leaf': 67, 'criterion': 'entropy'}.
Trial 4993 finished with value: 0.6630434782608695 and parameters: {'n_estimators': 232, 'max_depth': 79, 'min_samples_split': 38, 'min_samples_leaf': 62, 'criterion': 'gini'}.
Trial 4994 finished with value: 0.6956521739130435 and parameters: {'n_estimators': 321, 'max_depth': 7, 'min_samples_split': 30, 'min_samples_leaf': 75, 'criterion': 'entropy'}.
Trial 4995 finished with value: 0.6956521739130435 and parameters: {'n_estimators': 338, 'max_depth': 10, 'min_samples_split': 153, 'min_samples_leaf': 77, 'criterion': 'gini'}.
Trial 4996 finished with value: 0.6956521739130435 and parameters: {'n_estimators': 267, 'max_depth': 14, 'min_samples_split': 135, 'min_samples_leaf': 35, 'criterion': 'entropy'}.
Trial 4997 finished with value: 0.6847826086956522 and parameters: {'n_estimators': 666, 'max_depth': 6, 'min_samples_split': 26, 'min_samples_leaf': 59, 'criterion': 'gini'}.
Trial 4998 finished with value: 0.6086956521739131 and parameters: {'n_estimators': 722, 'max_depth': 12, 'min_samples_split': 58, 'min_samples_leaf': 9, 'criterion': 'entropy'}.
Trial 4999 finished with value: 0.7282608695652174 and parameters: {'n_estimators': 746, 'max_depth': 9, 'min_samples_split': 36, 'min_samples_leaf': 56, 'criterion': 'gini'}.
Trial 5000 finished with value: 0.6847826086956522 and parameters: {'n_estimators': 288, 'max_depth': 16, 'min_samples_split': 119, 'min_samples_leaf': 64, 'criterion': 'entropy'}.
Trial 5001 finished with value: 0.717391304347826 and parameters: {'n_estimators': 254, 'max_depth': 11, 'min_samples_split': 33, 'min_samples_leaf': 61, 'criterion': 'gini'}.
Trial 5002 finished with value: 0.7065217391304348 and parameters: {'n_estimators': 765, 'max_depth': 8, 'min_samples_split': 140, 'min_samples_leaf': 69, 'criterion': 'entropy'}.
Trial 5003 finished with value: 0.7065217391304348 and parameters: {'n_estimators': 302, 'max_depth': 13, 'min_samples_split': 67, 'min_samples_leaf': 54, 'criterion': 'gini'}.
Trial 5004 finished with value: 0.6739130434782609 and parameters: {'n_estimators': 408, 'max_depth': 5, 'min_samples_split': 16, 'min_samples_leaf': 73, 'criterion': 'entropy'}.
Trial 5005 finished with value: 0.7391304347826086 and parameters: {'n_estimators': 274, 'max_depth': 10, 'min_samples_split': 26, 'min_samples_leaf': 58, 'criterion': 'entropy'}.
Trial 5006 finished with value: 0.7065217391304348 and parameters: {'n_estimators': 254, 'max_depth': 8, 'min_samples_split': 143, 'min_samples_leaf': 60, 'criterion': 'gini'}.
Trial 5007 finished with value: 0.6847826086956522 and parameters: {'n_estimators': 205, 'max_depth': 13, 'min_samples_split': 133, 'min_samples_leaf': 56, 'criterion': 'entropy'}.
Trial 5008 finished with value: 0.6956521739130435 and parameters: {'n_estimators': 370, 'max_depth': 18, 'min_samples_split': 43, 'min_samples_leaf': 63, 'criterion': 'gini'}.
Trial 5009 finished with value: 0.7065217391304348 and parameters: {'n_estimators': 286, 'max_depth': 11, 'min_samples_split': 20, 'min_samples_leaf': 66, 'criterion': 'entropy'}.
Trial 5010 finished with value: 0.6956521739130435 and parameters: {'n_estimators': 313, 'max_depth': 7, 'min_samples_split': 126, 'min_samples_leaf': 58, 'criterion': 'gini'}.
Trial 5011 finished with value: 0.6739130434782609 and parameters: {'n_estimators': 745, 'max_depth': 15, 'min_samples_split': 32, 'min_samples_leaf': 54, 'criterion': 'entropy'}.
Trial 5012 finished with value: 0.6956521739130435 and parameters: {'n_estimators': 225, 'max_depth': 10, 'min_samples_split': 2, 'min_samples_leaf': 62, 'criterion': 'gini'}.
Trial 5013 finished with value: 0.6956521739130435 and parameters: {'n_estimators': 700, 'max_depth': 12, 'min_samples_split': 9, 'min_samples_leaf': 71, 'criterion': 'entropy'}.
Trial 5014 finished with value: 0.7065217391304348 and parameters: {'n_estimators': 770, 'max_depth': 7, 'min_samples_split': 114, 'min_samples_leaf': 60, 'criterion': 'gini'}.
Trial 5015 finished with value: 0.6847826086956522 and parameters: {'n_estimators': 984, 'max_depth': 33, 'min_samples_split': 103, 'min_samples_leaf': 56, 'criterion': 'entropy'}.
Trial 5016 finished with value: 0.6847826086956522 and parameters: {'n_estimators': 245, 'max_depth': 28, 'min_samples_split': 39, 'min_samples_leaf': 58, 'criterion': 'gini'}.
Trial 5017 finished with value: 0.717391304347826 and parameters: {'n_estimators': 265, 'max_depth': 9, 'min_samples_split': 149, 'min_samples_leaf': 74, 'criterion': 'entropy'}.
Trial 5018 finished with value: 0.7065217391304348 and parameters: {'n_estimators': 293, 'max_depth': 14, 'min_samples_split': 29, 'min_samples_leaf': 61, 'criterion': 'gini'}.
Trial 5019 finished with value: 0.6956521739130435 and parameters: {'n_estimators': 161, 'max_depth': 11, 'min_samples_split': 86, 'min_samples_leaf': 69, 'criterion': 'entropy'}.
Trial 5020 finished with value: 0.6847826086956522 and parameters: {'n_estimators': 337, 'max_depth': 6, 'min_samples_split': 35, 'min_samples_leaf': 64, 'criterion': 'gini'}.
Trial 5021 finished with value: 0.717391304347826 and parameters: {'n_estimators': 275, 'max_depth': 9, 'min_samples_split': 23, 'min_samples_leaf': 59, 'criterion': 'entropy'}.
Trial 5022 finished with value: 0.6956521739130435 and parameters: {'n_estimators': 319, 'max_depth': 12, 'min_samples_split': 145, 'min_samples_leaf': 56, 'criterion': 'gini'}.
Trial 5023 finished with value: 0.6956521739130435 and parameters: {'n_estimators': 243, 'max_depth': 16, 'min_samples_split': 138, 'min_samples_leaf': 72, 'criterion': 'entropy'}.
Trial 5024 finished with value: 0.717391304347826 and parameters: {'n_estimators': 295, 'max_depth': 8, 'min_samples_split': 47, 'min_samples_leaf': 58, 'criterion': 'gini'}.
Trial 5025 finished with value: 0.6630434782608695 and parameters: {'n_estimators': 732, 'max_depth': 59, 'min_samples_split': 121, 'min_samples_leaf': 61, 'criterion': 'entropy'}.
Trial 5026 finished with value: 0.717391304347826 and parameters: {'n_estimators': 281, 'max_depth': 13, 'min_samples_split': 30, 'min_samples_leaf': 54, 'criterion': 'gini'}.
Trial 5027 finished with value: 0.6847826086956522 and parameters: {'n_estimators': 263, 'max_depth': 10, 'min_samples_split': 37, 'min_samples_leaf': 78, 'criterion': 'entropy'}.
Trial 5028 finished with value: 0.6739130434782609 and parameters: {'n_estimators': 299, 'max_depth': 5, 'min_samples_split': 156, 'min_samples_leaf': 66, 'criterion': 'gini'}.
Trial 5029 finished with value: 0.6847826086956522 and parameters: {'n_estimators': 768, 'max_depth': 11, 'min_samples_split': 26, 'min_samples_leaf': 81, 'criterion': 'entropy'}.
Trial 5030 finished with value: 0.6847826086956522 and parameters: {'n_estimators': 912, 'max_depth': 15, 'min_samples_split': 42, 'min_samples_leaf': 63, 'criterion': 'gini'}.
Trial 5031 finished with value: 0.6956521739130435 and parameters: {'n_estimators': 234, 'max_depth': 8, 'min_samples_split': 131, 'min_samples_leaf': 57, 'criterion': 'entropy'}.
Trial 5032 finished with value: 0.6956521739130435 and parameters: {'n_estimators': 350, 'max_depth': 13, 'min_samples_split': 34, 'min_samples_leaf': 60, 'criterion': 'entropy'}.
Trial 5033 finished with value: 0.6956521739130435 and parameters: {'n_estimators': 716, 'max_depth': 10, 'min_samples_split': 22, 'min_samples_leaf': 68, 'criterion': 'gini'}.
Trial 5034 finished with value: 0.6630434782608695 and parameters: {'n_estimators': 269, 'max_depth': 54, 'min_samples_split': 18, 'min_samples_leaf': 55, 'criterion': 'entropy'}.
Trial 5035 finished with value: 0.7065217391304348 and parameters: {'n_estimators': 319, 'max_depth': 7, 'min_samples_split': 29, 'min_samples_leaf': 59, 'criterion': 'gini'}.
Trial 5036 finished with value: 0.6956521739130435 and parameters: {'n_estimators': 253, 'max_depth': 9, 'min_samples_split': 135, 'min_samples_leaf': 62, 'criterion': 'entropy'}.
Trial 5037 finished with value: 0.6956521739130435 and parameters: {'n_estimators': 748, 'max_depth': 12, 'min_samples_split': 145, 'min_samples_leaf': 74, 'criterion': 'gini'}.
Trial 5038 finished with value: 0.6847826086956522 and parameters: {'n_estimators': 282, 'max_depth': 18, 'min_samples_split': 39, 'min_samples_leaf': 57, 'criterion': 'entropy'}.
Trial 5039 finished with value: 0.6847826086956522 and parameters: {'n_estimators': 215, 'max_depth': 14, 'min_samples_split': 34, 'min_samples_leaf': 59, 'criterion': 'gini'}.
Trial 5040 finished with value: 0.7282608695652174 and parameters: {'n_estimators': 313, 'max_depth': 11, 'min_samples_split': 62, 'min_samples_leaf': 54, 'criterion': 'entropy'}.
Trial 5041 finished with value: 0.6521739130434783 and parameters: {'n_estimators': 188, 'max_depth': 5, 'min_samples_split': 140, 'min_samples_leaf': 71, 'criterion': 'gini'}.
Trial 5042 finished with value: 0.6956521739130435 and parameters: {'n_estimators': 264, 'max_depth': 9, 'min_samples_split': 27, 'min_samples_leaf': 64, 'criterion': 'entropy'}.
Trial 5043 finished with value: 0.6956521739130435 and parameters: {'n_estimators': 298, 'max_depth': 7, 'min_samples_split': 151, 'min_samples_leaf': 76, 'criterion': 'gini'}.
Trial 5044 finished with value: 0.717391304347826 and parameters: {'n_estimators': 235, 'max_depth': 11, 'min_samples_split': 32, 'min_samples_leaf': 56, 'criterion': 'entropy'}.
Trial 5045 finished with value: 0.6847826086956522 and parameters: {'n_estimators': 286, 'max_depth': 15, 'min_samples_split': 126, 'min_samples_leaf': 61, 'criterion': 'gini'}.
Trial 5046 finished with value: 0.7065217391304348 and parameters: {'n_estimators': 961, 'max_depth': 13, 'min_samples_split': 110, 'min_samples_leaf': 66, 'criterion': 'entropy'}.
Trial 5047 finished with value: 0.6956521739130435 and parameters: {'n_estimators': 247, 'max_depth': 9, 'min_samples_split': 24, 'min_samples_leaf': 59, 'criterion': 'gini'}.
Trial 5048 finished with value: 0.6630434782608695 and parameters: {'n_estimators': 274, 'max_depth': 7, 'min_samples_split': 14, 'min_samples_leaf': 57, 'criterion': 'entropy'}.
Trial 5049 finished with value: 0.717391304347826 and parameters: {'n_estimators': 752, 'max_depth': 11, 'min_samples_split': 37, 'min_samples_leaf': 54, 'criterion': 'gini'}.
Trial 5050 finished with value: 0.6956521739130435 and parameters: {'n_estimators': 337, 'max_depth': 17, 'min_samples_split': 116, 'min_samples_leaf': 62, 'criterion': 'entropy'}.
Trial 5051 finished with value: 0.6956521739130435 and parameters: {'n_estimators': 302, 'max_depth': 9, 'min_samples_split': 44, 'min_samples_leaf': 70, 'criterion': 'gini'}.
Trial 5052 finished with value: 0.6956521739130435 and parameters: {'n_estimators': 258, 'max_depth': 13, 'min_samples_split': 30, 'min_samples_leaf': 83, 'criterion': 'entropy'}.
Trial 5053 finished with value: 0.6956521739130435 and parameters: {'n_estimators': 769, 'max_depth': 11, 'min_samples_split': 144, 'min_samples_leaf': 73, 'criterion': 'gini'}.
Trial 5054 finished with value: 0.6956521739130435 and parameters: {'n_estimators': 390, 'max_depth': 7, 'min_samples_split': 52, 'min_samples_leaf': 60, 'criterion': 'entropy'}.
Trial 5055 finished with value: 0.6739130434782609 and parameters: {'n_estimators': 286, 'max_depth': 15, 'min_samples_split': 137, 'min_samples_leaf': 58, 'criterion': 'gini'}.
Trial 5056 finished with value: 0.7065217391304348 and parameters: {'n_estimators': 276, 'max_depth': 9, 'min_samples_split': 39, 'min_samples_leaf': 64, 'criterion': 'entropy'}.
Trial 5057 finished with value: 0.6413043478260869 and parameters: {'n_estimators': 311, 'max_depth': 5, 'min_samples_split': 22, 'min_samples_leaf': 56, 'criterion': 'gini'}.
Trial 5058 finished with value: 0.7065217391304348 and parameters: {'n_estimators': 725, 'max_depth': 12, 'min_samples_split': 27, 'min_samples_leaf': 68, 'criterion': 'entropy'}.
Trial 5059 finished with value: 0.7065217391304348 and parameters: {'n_estimators': 260, 'max_depth': 10, 'min_samples_split': 35, 'min_samples_leaf': 62, 'criterion': 'gini'}.
Trial 5060 finished with value: 0.6739130434782609 and parameters: {'n_estimators': 222, 'max_depth': 20, 'min_samples_split': 130, 'min_samples_leaf': 60, 'criterion': 'entropy'}.
Trial 5061 finished with value: 0.7065217391304348 and parameters: {'n_estimators': 247, 'max_depth': 14, 'min_samples_split': 148, 'min_samples_leaf': 54, 'criterion': 'entropy'}.
Trial 5062 finished with value: 0.717391304347826 and parameters: {'n_estimators': 326, 'max_depth': 8, 'min_samples_split': 18, 'min_samples_leaf': 58, 'criterion': 'gini'}.
Trial 5063 finished with value: 0.717391304347826 and parameters: {'n_estimators': 299, 'max_depth': 12, 'min_samples_split': 32, 'min_samples_leaf': 56, 'criterion': 'entropy'}.
Trial 5064 finished with value: 0.7065217391304348 and parameters: {'n_estimators': 734, 'max_depth': 10, 'min_samples_split': 97, 'min_samples_leaf': 65, 'criterion': 'gini'}.
Trial 5065 finished with value: 0.7065217391304348 and parameters: {'n_estimators': 769, 'max_depth': 7, 'min_samples_split': 121, 'min_samples_leaf': 60, 'criterion': 'entropy'}.
Trial 5066 finished with value: 0.6956521739130435 and parameters: {'n_estimators': 144, 'max_depth': 13, 'min_samples_split': 140, 'min_samples_leaf': 62, 'criterion': 'gini'}.
Trial 5067 finished with value: 0.6739130434782609 and parameters: {'n_estimators': 114, 'max_depth': 9, 'min_samples_split': 24, 'min_samples_leaf': 72, 'criterion': 'entropy'}.
Trial 5068 finished with value: 0.7065217391304348 and parameters: {'n_estimators': 705, 'max_depth': 11, 'min_samples_split': 40, 'min_samples_leaf': 58, 'criterion': 'gini'}.
Trial 5069 finished with value: 0.6739130434782609 and parameters: {'n_estimators': 931, 'max_depth': 15, 'min_samples_split': 30, 'min_samples_leaf': 54, 'criterion': 'entropy'}.
Trial 5070 finished with value: 0.6739130434782609 and parameters: {'n_estimators': 273, 'max_depth': 6, 'min_samples_split': 135, 'min_samples_leaf': 75, 'criterion': 'gini'}.
Trial 5071 finished with value: 0.6956521739130435 and parameters: {'n_estimators': 606, 'max_depth': 17, 'min_samples_split': 34, 'min_samples_leaf': 57, 'criterion': 'entropy'}.
Trial 5072 finished with value: 0.7065217391304348 and parameters: {'n_estimators': 236, 'max_depth': 8, 'min_samples_split': 142, 'min_samples_leaf': 69, 'criterion': 'gini'}.
Trial 5073 finished with value: 0.6956521739130435 and parameters: {'n_estimators': 203, 'max_depth': 12, 'min_samples_split': 43, 'min_samples_leaf': 63, 'criterion': 'entropy'}.
Trial 5074 finished with value: 0.7065217391304348 and parameters: {'n_estimators': 262, 'max_depth': 10, 'min_samples_split': 27, 'min_samples_leaf': 60, 'criterion': 'gini'}.
Trial 5075 finished with value: 0.6630434782608695 and parameters: {'n_estimators': 284, 'max_depth': 14, 'min_samples_split': 36, 'min_samples_leaf': 67, 'criterion': 'entropy'}.
Trial 5076 finished with value: 0.6956521739130435 and parameters: {'n_estimators': 358, 'max_depth': 7, 'min_samples_split': 75, 'min_samples_leaf': 78, 'criterion': 'gini'}.
Trial 5077 finished with value: 0.7065217391304348 and parameters: {'n_estimators': 430, 'max_depth': 11, 'min_samples_split': 21, 'min_samples_leaf': 55, 'criterion': 'entropy'}.
Trial 5078 finished with value: 0.7065217391304348 and parameters: {'n_estimators': 322, 'max_depth': 9, 'min_samples_split': 49, 'min_samples_leaf': 59, 'criterion': 'gini'}.
Trial 5079 finished with value: 0.6739130434782609 and parameters: {'n_estimators': 299, 'max_depth': 5, 'min_samples_split': 147, 'min_samples_leaf': 73, 'criterion': 'entropy'}.
Trial 5080 finished with value: 0.6739130434782609 and parameters: {'n_estimators': 249, 'max_depth': 16, 'min_samples_split': 92, 'min_samples_leaf': 57, 'criterion': 'gini'}.
Trial 5081 finished with value: 0.6956521739130435 and parameters: {'n_estimators': 279, 'max_depth': 13, 'min_samples_split': 30, 'min_samples_leaf': 62, 'criterion': 'entropy'}.
Trial 5082 finished with value: 0.7065217391304348 and parameters: {'n_estimators': 760, 'max_depth': 10, 'min_samples_split': 132, 'min_samples_leaf': 65, 'criterion': 'gini'}.
Trial 5083 finished with value: 0.717391304347826 and parameters: {'n_estimators': 309, 'max_depth': 8, 'min_samples_split': 38, 'min_samples_leaf': 59, 'criterion': 'entropy'}.
Trial 5084 finished with value: 0.6847826086956522 and parameters: {'n_estimators': 748, 'max_depth': 23, 'min_samples_split': 126, 'min_samples_leaf': 71, 'criterion': 'gini'}.
Trial 5085 finished with value: 0.717391304347826 and parameters: {'n_estimators': 288, 'max_depth': 12, 'min_samples_split': 14, 'min_samples_leaf': 56, 'criterion': 'entropy'}.
Trial 5086 finished with value: 0.6847826086956522 and parameters: {'n_estimators': 265, 'max_depth': 92, 'min_samples_split': 152, 'min_samples_leaf': 60, 'criterion': 'gini'}.
Trial 5087 finished with value: 0.7065217391304348 and parameters: {'n_estimators': 229, 'max_depth': 7, 'min_samples_split': 26, 'min_samples_leaf': 98, 'criterion': 'entropy'}.
Trial 5088 finished with value: 0.717391304347826 and parameters: {'n_estimators': 176, 'max_depth': 10, 'min_samples_split': 33, 'min_samples_leaf': 54, 'criterion': 'entropy'}.
Trial 5089 finished with value: 0.6521739130434783 and parameters: {'n_estimators': 250, 'max_depth': 14, 'min_samples_split': 140, 'min_samples_leaf': 76, 'criterion': 'gini'}.
Trial 5090 finished with value: 0.6956521739130435 and parameters: {'n_estimators': 272, 'max_depth': 12, 'min_samples_split': 105, 'min_samples_leaf': 61, 'criterion': 'entropy'}.
Trial 5091 finished with value: 0.7282608695652174 and parameters: {'n_estimators': 337, 'max_depth': 9, 'min_samples_split': 20, 'min_samples_leaf': 58, 'criterion': 'gini'}.
Trial 5092 finished with value: 0.6847826086956522 and parameters: {'n_estimators': 679, 'max_depth': 6, 'min_samples_split': 41, 'min_samples_leaf': 64, 'criterion': 'entropy'}.
Trial 5093 finished with value: 0.6847826086956522 and parameters: {'n_estimators': 646, 'max_depth': 16, 'min_samples_split': 144, 'min_samples_leaf': 56, 'criterion': 'gini'}.
