Trial 6937 finished with value: 0.7065217391304348 and parameters: {'n_estimators': 394, 'max_depth': 11, 'min_samples_split': 140, 'min_samples_leaf': 51, 'criterion': 'gini'}.
Trial 6938 finished with value: 0.717391304347826 and parameters: {'n_estimators': 773, 'max_depth': 8, 'min_samples_split': 53, 'min_samples_leaf': 60, 'criterion': 'entropy'}.
Trial 6939 finished with value: 0.6847826086956522 and parameters: {'n_estimators': 301, 'max_depth': 14, 'min_samples_split': 27, 'min_samples_leaf': 56, 'criterion': 'entropy'}.
Trial 6940 finished with value: 0.717391304347826 and parameters: {'n_estimators': 357, 'max_depth': 10, 'min_samples_split': 33, 'min_samples_leaf': 58, 'criterion': 'gini'}.
Trial 6941 finished with value: 0.6847826086956522 and parameters: {'n_estimators': 466, 'max_depth': 6, 'min_samples_split': 40, 'min_samples_leaf': 62, 'criterion': 'entropy'}.
Trial 6942 finished with value: 0.7065217391304348 and parameters: {'n_estimators': 265, 'max_depth': 12, 'min_samples_split': 57, 'min_samples_leaf': 55, 'criterion': 'gini'}.
Trial 6943 finished with value: 0.7065217391304348 and parameters: {'n_estimators': 339, 'max_depth': 8, 'min_samples_split': 126, 'min_samples_leaf': 64, 'criterion': 'entropy'}.
Trial 6944 finished with value: 0.6739130434782609 and parameters: {'n_estimators': 749, 'max_depth': 15, 'min_samples_split': 36, 'min_samples_leaf': 60, 'criterion': 'gini'}.
Trial 6945 finished with value: 0.717391304347826 and parameters: {'n_estimators': 702, 'max_depth': 10, 'min_samples_split': 23, 'min_samples_leaf': 53, 'criterion': 'entropy'}.
Trial 6946 finished with value: 0.6956521739130435 and parameters: {'n_estimators': 291, 'max_depth': 13, 'min_samples_split': 28, 'min_samples_leaf': 57, 'criterion': 'gini'}.
Trial 6947 finished with value: 0.7282608695652174 and parameters: {'n_estimators': 525, 'max_depth': 8, 'min_samples_split': 135, 'min_samples_leaf': 73, 'criterion': 'entropy'}.
Trial 6948 finished with value: 0.6630434782608695 and parameters: {'n_estimators': 195, 'max_depth': 5, 'min_samples_split': 142, 'min_samples_leaf': 66, 'criterion': 'gini'}.
Trial 6949 finished with value: 0.6956521739130435 and parameters: {'n_estimators': 235, 'max_depth': 11, 'min_samples_split': 17, 'min_samples_leaf': 70, 'criterion': 'entropy'}.
Trial 6950 finished with value: 0.6739130434782609 and parameters: {'n_estimators': 259, 'max_depth': 16, 'min_samples_split': 121, 'min_samples_leaf': 58, 'criterion': 'entropy'}.
Trial 6951 finished with value: 0.717391304347826 and parameters: {'n_estimators': 279, 'max_depth': 9, 'min_samples_split': 42, 'min_samples_leaf': 63, 'criterion': 'gini'}.
Trial 6952 finished with value: 0.6521739130434783 and parameters: {'n_estimators': 314, 'max_depth': 12, 'min_samples_split': 9, 'min_samples_leaf': 81, 'criterion': 'entropy'}.
Trial 6953 finished with value: 0.6956521739130435 and parameters: {'n_estimators': 731, 'max_depth': 7, 'min_samples_split': 110, 'min_samples_leaf': 60, 'criterion': 'gini'}.
Trial 6954 finished with value: 0.7065217391304348 and parameters: {'n_estimators': 767, 'max_depth': 10, 'min_samples_split': 34, 'min_samples_leaf': 54, 'criterion': 'entropy'}.
Trial 6955 finished with value: 0.6521739130434783 and parameters: {'n_estimators': 277, 'max_depth': 14, 'min_samples_split': 117, 'min_samples_leaf': 77, 'criterion': 'gini'}.
Trial 6956 finished with value: 0.7065217391304348 and parameters: {'n_estimators': 807, 'max_depth': 12, 'min_samples_split': 130, 'min_samples_leaf': 68, 'criterion': 'entropy'}.
Trial 6957 finished with value: 0.6956521739130435 and parameters: {'n_estimators': 221, 'max_depth': 9, 'min_samples_split': 31, 'min_samples_leaf': 56, 'criterion': 'gini'}.
Trial 6958 finished with value: 0.7065217391304348 and parameters: {'n_estimators': 308, 'max_depth': 7, 'min_samples_split': 26, 'min_samples_leaf': 59, 'criterion': 'entropy'}.
Trial 6959 finished with value: 0.717391304347826 and parameters: {'n_estimators': 256, 'max_depth': 11, 'min_samples_split': 36, 'min_samples_leaf': 61, 'criterion': 'entropy'}.
Trial 6960 finished with value: 0.6847826086956522 and parameters: {'n_estimators': 292, 'max_depth': 18, 'min_samples_split': 45, 'min_samples_leaf': 51, 'criterion': 'gini'}.
Trial 6961 finished with value: 0.6739130434782609 and parameters: {'n_estimators': 331, 'max_depth': 15, 'min_samples_split': 145, 'min_samples_leaf': 57, 'criterion': 'entropy'}.
Trial 6962 finished with value: 0.7065217391304348 and parameters: {'n_estimators': 742, 'max_depth': 9, 'min_samples_split': 22, 'min_samples_leaf': 73, 'criterion': 'gini'}.
Trial 6963 finished with value: 0.6956521739130435 and parameters: {'n_estimators': 615, 'max_depth': 13, 'min_samples_split': 29, 'min_samples_leaf': 63, 'criterion': 'entropy'}.
Trial 6964 finished with value: 0.6413043478260869 and parameters: {'n_estimators': 246, 'max_depth': 5, 'min_samples_split': 139, 'min_samples_leaf': 55, 'criterion': 'gini'}.
Trial 6965 finished with value: 0.6847826086956522 and parameters: {'n_estimators': 267, 'max_depth': 7, 'min_samples_split': 38, 'min_samples_leaf': 61, 'criterion': 'entropy'}.
Trial 6966 finished with value: 0.6956521739130435 and parameters: {'n_estimators': 878, 'max_depth': 10, 'min_samples_split': 134, 'min_samples_leaf': 58, 'criterion': 'gini'}.
Trial 6967 finished with value: 0.7065217391304348 and parameters: {'n_estimators': 788, 'max_depth': 12, 'min_samples_split': 33, 'min_samples_leaf': 66, 'criterion': 'entropy'}.
Trial 6968 finished with value: 0.717391304347826 and parameters: {'n_estimators': 292, 'max_depth': 8, 'min_samples_split': 18, 'min_samples_leaf': 59, 'criterion': 'entropy'}.
Trial 6969 finished with value: 0.6956521739130435 and parameters: {'n_estimators': 277, 'max_depth': 13, 'min_samples_split': 41, 'min_samples_leaf': 53, 'criterion': 'gini'}.
Trial 6970 finished with value: 0.6956521739130435 and parameters: {'n_estimators': 495, 'max_depth': 10, 'min_samples_split': 25, 'min_samples_leaf': 70, 'criterion': 'entropy'}.
Trial 6971 finished with value: 0.6847826086956522 and parameters: {'n_estimators': 316, 'max_depth': 16, 'min_samples_split': 31, 'min_samples_leaf': 75, 'criterion': 'gini'}.
Trial 6972 finished with value: 0.7065217391304348 and parameters: {'n_estimators': 764, 'max_depth': 11, 'min_samples_split': 125, 'min_samples_leaf': 56, 'criterion': 'entropy'}.
Trial 6973 finished with value: 0.6630434782608695 and parameters: {'n_estimators': 232, 'max_depth': 20, 'min_samples_split': 37, 'min_samples_leaf': 63, 'criterion': 'gini'}.
Trial 6974 finished with value: 0.7282608695652174 and parameters: {'n_estimators': 150, 'max_depth': 8, 'min_samples_split': 97, 'min_samples_leaf': 58, 'criterion': 'entropy'}.
Trial 6975 finished with value: 0.6956521739130435 and parameters: {'n_estimators': 716, 'max_depth': 14, 'min_samples_split': 13, 'min_samples_leaf': 72, 'criterion': 'gini'}.
Trial 6976 finished with value: 0.6739130434782609 and parameters: {'n_estimators': 306, 'max_depth': 6, 'min_samples_split': 28, 'min_samples_leaf': 61, 'criterion': 'entropy'}.
Trial 6977 finished with value: 0.717391304347826 and parameters: {'n_estimators': 251, 'max_depth': 10, 'min_samples_split': 34, 'min_samples_leaf': 54, 'criterion': 'entropy'}.
Trial 6978 finished with value: 0.717391304347826 and parameters: {'n_estimators': 270, 'max_depth': 12, 'min_samples_split': 49, 'min_samples_leaf': 57, 'criterion': 'gini'}.
Trial 6979 finished with value: 0.717391304347826 and parameters: {'n_estimators': 350, 'max_depth': 8, 'min_samples_split': 140, 'min_samples_leaf': 68, 'criterion': 'entropy'}.
Trial 6980 finished with value: 0.6847826086956522 and parameters: {'n_estimators': 292, 'max_depth': 15, 'min_samples_split': 21, 'min_samples_leaf': 60, 'criterion': 'gini'}.
Trial 6981 finished with value: 0.6956521739130435 and parameters: {'n_estimators': 741, 'max_depth': 10, 'min_samples_split': 145, 'min_samples_leaf': 65, 'criterion': 'entropy'}.
Trial 6982 finished with value: 0.6956521739130435 and parameters: {'n_estimators': 328, 'max_depth': 12, 'min_samples_split': 113, 'min_samples_leaf': 57, 'criterion': 'gini'}.
Trial 6983 finished with value: 0.6521739130434783 and parameters: {'n_estimators': 268, 'max_depth': 5, 'min_samples_split': 40, 'min_samples_leaf': 55, 'criterion': 'entropy'}.
Trial 6984 finished with value: 0.7065217391304348 and parameters: {'n_estimators': 286, 'max_depth': 8, 'min_samples_split': 28, 'min_samples_leaf': 52, 'criterion': 'gini'}.
Trial 6985 finished with value: 0.6847826086956522 and parameters: {'n_estimators': 247, 'max_depth': 17, 'min_samples_split': 129, 'min_samples_leaf': 59, 'criterion': 'entropy'}.
Trial 6986 finished with value: 0.7065217391304348 and parameters: {'n_estimators': 218, 'max_depth': 13, 'min_samples_split': 136, 'min_samples_leaf': 62, 'criterion': 'entropy'}.
Trial 6987 finished with value: 0.6956521739130435 and parameters: {'n_estimators': 918, 'max_depth': 10, 'min_samples_split': 44, 'min_samples_leaf': 78, 'criterion': 'gini'}.
Trial 6988 finished with value: 0.7065217391304348 and parameters: {'n_estimators': 774, 'max_depth': 7, 'min_samples_split': 33, 'min_samples_leaf': 59, 'criterion': 'entropy'}.
Trial 6989 finished with value: 0.7282608695652174 and parameters: {'n_estimators': 296, 'max_depth': 9, 'min_samples_split': 24, 'min_samples_leaf': 74, 'criterion': 'gini'}.
Trial 6990 finished with value: 0.6739130434782609 and parameters: {'n_estimators': 805, 'max_depth': 14, 'min_samples_split': 119, 'min_samples_leaf': 55, 'criterion': 'entropy'}.
Trial 6991 finished with value: 0.6956521739130435 and parameters: {'n_estimators': 264, 'max_depth': 11, 'min_samples_split': 37, 'min_samples_leaf': 63, 'criterion': 'gini'}.
Trial 6992 finished with value: 0.7065217391304348 and parameters: {'n_estimators': 310, 'max_depth': 12, 'min_samples_split': 30, 'min_samples_leaf': 70, 'criterion': 'entropy'}.
Trial 6993 finished with value: 0.6739130434782609 and parameters: {'n_estimators': 760, 'max_depth': 6, 'min_samples_split': 141, 'min_samples_leaf': 57, 'criterion': 'gini'}.
Trial 6994 finished with value: 0.7065217391304348 and parameters: {'n_estimators': 279, 'max_depth': 9, 'min_samples_split': 18, 'min_samples_leaf': 72, 'criterion': 'entropy'}.
Trial 6995 finished with value: 0.6847826086956522 and parameters: {'n_estimators': 182, 'max_depth': 15, 'min_samples_split': 84, 'min_samples_leaf': 61, 'criterion': 'entropy'}.
Trial 6996 finished with value: 0.7065217391304348 and parameters: {'n_estimators': 246, 'max_depth': 11, 'min_samples_split': 24, 'min_samples_leaf': 65, 'criterion': 'gini'}.
Trial 6997 finished with value: 0.7065217391304348 and parameters: {'n_estimators': 792, 'max_depth': 7, 'min_samples_split': 34, 'min_samples_leaf': 60, 'criterion': 'entropy'}.
Trial 6998 finished with value: 0.7065217391304348 and parameters: {'n_estimators': 730, 'max_depth': 13, 'min_samples_split': 133, 'min_samples_leaf': 53, 'criterion': 'gini'}.
Trial 6999 finished with value: 0.717391304347826 and parameters: {'n_estimators': 101, 'max_depth': 9, 'min_samples_split': 39, 'min_samples_leaf': 56, 'criterion': 'entropy'}.
Trial 7000 finished with value: 0.6956521739130435 and parameters: {'n_estimators': 330, 'max_depth': 11, 'min_samples_split': 30, 'min_samples_leaf': 51, 'criterion': 'gini'}.
Trial 7001 finished with value: 0.7065217391304348 and parameters: {'n_estimators': 264, 'max_depth': 8, 'min_samples_split': 189, 'min_samples_leaf': 58, 'criterion': 'entropy'}.
Trial 7002 finished with value: 0.6847826086956522 and parameters: {'n_estimators': 643, 'max_depth': 17, 'min_samples_split': 69, 'min_samples_leaf': 75, 'criterion': 'gini'}.
Trial 7003 finished with value: 0.7065217391304348 and parameters: {'n_estimators': 708, 'max_depth': 14, 'min_samples_split': 27, 'min_samples_leaf': 67, 'criterion': 'entropy'}.
Trial 7004 finished with value: 0.6413043478260869 and parameters: {'n_estimators': 302, 'max_depth': 5, 'min_samples_split': 34, 'min_samples_leaf': 59, 'criterion': 'gini'}.
Trial 7005 finished with value: 0.7282608695652174 and parameters: {'n_estimators': 956, 'max_depth': 10, 'min_samples_split': 124, 'min_samples_leaf': 63, 'criterion': 'entropy'}.
Trial 7006 finished with value: 0.7065217391304348 and parameters: {'n_estimators': 230, 'max_depth': 12, 'min_samples_split': 147, 'min_samples_leaf': 55, 'criterion': 'entropy'}.
Trial 7007 finished with value: 0.6847826086956522 and parameters: {'n_estimators': 282, 'max_depth': 7, 'min_samples_split': 43, 'min_samples_leaf': 61, 'criterion': 'gini'}.
Trial 7008 finished with value: 0.6956521739130435 and parameters: {'n_estimators': 755, 'max_depth': 9, 'min_samples_split': 37, 'min_samples_leaf': 57, 'criterion': 'entropy'}.
Trial 7009 finished with value: 0.7065217391304348 and parameters: {'n_estimators': 265, 'max_depth': 13, 'min_samples_split': 21, 'min_samples_leaf': 69, 'criterion': 'gini'}.
Trial 7010 finished with value: 0.6630434782608695 and parameters: {'n_estimators': 546, 'max_depth': 16, 'min_samples_split': 5, 'min_samples_leaf': 54, 'criterion': 'entropy'}.
Trial 7011 finished with value: 0.7065217391304348 and parameters: {'n_estimators': 316, 'max_depth': 11, 'min_samples_split': 136, 'min_samples_leaf': 60, 'criterion': 'gini'}.
Trial 7012 finished with value: 0.7065217391304348 and parameters: {'n_estimators': 208, 'max_depth': 9, 'min_samples_split': 32, 'min_samples_leaf': 72, 'criterion': 'entropy'}.
Trial 7013 finished with value: 0.6956521739130435 and parameters: {'n_estimators': 431, 'max_depth': 7, 'min_samples_split': 28, 'min_samples_leaf': 96, 'criterion': 'gini'}.
Trial 7014 finished with value: 0.6739130434782609 and parameters: {'n_estimators': 287, 'max_depth': 78, 'min_samples_split': 14, 'min_samples_leaf': 64, 'criterion': 'entropy'}.
Trial 7015 finished with value: 0.6847826086956522 and parameters: {'n_estimators': 241, 'max_depth': 14, 'min_samples_split': 41, 'min_samples_leaf': 58, 'criterion': 'entropy'}.
Trial 7016 finished with value: 0.6956521739130435 and parameters: {'n_estimators': 346, 'max_depth': 11, 'min_samples_split': 143, 'min_samples_leaf': 56, 'criterion': 'gini'}.
Trial 7017 finished with value: 0.6847826086956522 and parameters: {'n_estimators': 781, 'max_depth': 19, 'min_samples_split': 131, 'min_samples_leaf': 62, 'criterion': 'entropy'}.
Trial 7018 finished with value: 0.6739130434782609 and parameters: {'n_estimators': 299, 'max_depth': 22, 'min_samples_split': 73, 'min_samples_leaf': 59, 'criterion': 'gini'}.
Trial 7019 finished with value: 0.6956521739130435 and parameters: {'n_estimators': 254, 'max_depth': 9, 'min_samples_split': 46, 'min_samples_leaf': 53, 'criterion': 'entropy'}.
Trial 7020 finished with value: 0.6847826086956522 and parameters: {'n_estimators': 904, 'max_depth': 12, 'min_samples_split': 176, 'min_samples_leaf': 77, 'criterion': 'gini'}.
Trial 7021 finished with value: 0.6847826086956522 and parameters: {'n_estimators': 276, 'max_depth': 6, 'min_samples_split': 104, 'min_samples_leaf': 57, 'criterion': 'entropy'}.
Trial 7022 finished with value: 0.6956521739130435 and parameters: {'n_estimators': 734, 'max_depth': 15, 'min_samples_split': 24, 'min_samples_leaf': 66, 'criterion': 'gini'}.
Trial 7023 finished with value: 0.6956521739130435 and parameters: {'n_estimators': 670, 'max_depth': 10, 'min_samples_split': 35, 'min_samples_leaf': 74, 'criterion': 'entropy'}.
Trial 7024 finished with value: 0.7282608695652174 and parameters: {'n_estimators': 285, 'max_depth': 8, 'min_samples_split': 117, 'min_samples_leaf': 60, 'criterion': 'entropy'}.
Trial 7025 finished with value: 0.6956521739130435 and parameters: {'n_estimators': 320, 'max_depth': 13, 'min_samples_split': 139, 'min_samples_leaf': 70, 'criterion': 'gini'}.
Trial 7026 finished with value: 0.7065217391304348 and parameters: {'n_estimators': 242, 'max_depth': 11, 'min_samples_split': 30, 'min_samples_leaf': 55, 'criterion': 'entropy'}.
Trial 7027 finished with value: 0.6413043478260869 and parameters: {'n_estimators': 688, 'max_depth': 5, 'min_samples_split': 38, 'min_samples_leaf': 61, 'criterion': 'gini'}.
Trial 7028 finished with value: 0.7282608695652174 and parameters: {'n_estimators': 300, 'max_depth': 8, 'min_samples_split': 21, 'min_samples_leaf': 58, 'criterion': 'entropy'}.
Trial 7029 finished with value: 0.6956521739130435 and parameters: {'n_estimators': 271, 'max_depth': 98, 'min_samples_split': 26, 'min_samples_leaf': 68, 'criterion': 'gini'}.
Trial 7030 finished with value: 0.7065217391304348 and parameters: {'n_estimators': 372, 'max_depth': 13, 'min_samples_split': 32, 'min_samples_leaf': 51, 'criterion': 'entropy'}.
Trial 7031 finished with value: 0.6956521739130435 and parameters: {'n_estimators': 747, 'max_depth': 10, 'min_samples_split': 184, 'min_samples_leaf': 64, 'criterion': 'gini'}.
Trial 7032 finished with value: 0.6956521739130435 and parameters: {'n_estimators': 261, 'max_depth': 16, 'min_samples_split': 122, 'min_samples_leaf': 56, 'criterion': 'entropy'}.
Trial 7033 finished with value: 0.7065217391304348 and parameters: {'n_estimators': 597, 'max_depth': 7, 'min_samples_split': 18, 'min_samples_leaf': 59, 'criterion': 'entropy'}.
Trial 7034 finished with value: 0.7065217391304348 and parameters: {'n_estimators': 770, 'max_depth': 12, 'min_samples_split': 51, 'min_samples_leaf': 62, 'criterion': 'gini'}.
Trial 7035 finished with value: 0.6847826086956522 and parameters: {'n_estimators': 305, 'max_depth': 9, 'min_samples_split': 147, 'min_samples_leaf': 79, 'criterion': 'entropy'}.
Trial 7036 finished with value: 0.717391304347826 and parameters: {'n_estimators': 332, 'max_depth': 11, 'min_samples_split': 41, 'min_samples_leaf': 54, 'criterion': 'gini'}.
Trial 7037 finished with value: 0.6956521739130435 and parameters: {'n_estimators': 227, 'max_depth': 14, 'min_samples_split': 111, 'min_samples_leaf': 71, 'criterion': 'entropy'}.
Trial 7038 finished with value: 0.6847826086956522 and parameters: {'n_estimators': 286, 'max_depth': 7, 'min_samples_split': 128, 'min_samples_leaf': 57, 'criterion': 'gini'}.
Trial 7039 finished with value: 0.717391304347826 and parameters: {'n_estimators': 249, 'max_depth': 10, 'min_samples_split': 36, 'min_samples_leaf': 60, 'criterion': 'entropy'}.
Trial 7040 finished with value: 0.6739130434782609 and parameters: {'n_estimators': 811, 'max_depth': 49, 'min_samples_split': 29, 'min_samples_leaf': 75, 'criterion': 'gini'}.
Trial 7041 finished with value: 0.6847826086956522 and parameters: {'n_estimators': 717, 'max_depth': 12, 'min_samples_split': 25, 'min_samples_leaf': 63, 'criterion': 'entropy'}.
Trial 7042 finished with value: 0.6521739130434783 and parameters: {'n_estimators': 273, 'max_depth': 5, 'min_samples_split': 136, 'min_samples_leaf': 58, 'criterion': 'entropy'}.
Trial 7043 finished with value: 0.6847826086956522 and parameters: {'n_estimators': 406, 'max_depth': 18, 'min_samples_split': 142, 'min_samples_leaf': 53, 'criterion': 'gini'}.
Trial 7044 finished with value: 0.7282608695652174 and parameters: {'n_estimators': 258, 'max_depth': 9, 'min_samples_split': 35, 'min_samples_leaf': 56, 'criterion': 'entropy'}.
Trial 7045 finished with value: 0.6630434782608695 and parameters: {'n_estimators': 563, 'max_depth': 13, 'min_samples_split': 31, 'min_samples_leaf': 29, 'criterion': 'gini'}.
Trial 7046 finished with value: 0.6630434782608695 and parameters: {'n_estimators': 319, 'max_depth': 15, 'min_samples_split': 44, 'min_samples_leaf': 73, 'criterion': 'entropy'}.
Trial 7047 finished with value: 0.7065217391304348 and parameters: {'n_estimators': 294, 'max_depth': 8, 'min_samples_split': 27, 'min_samples_leaf': 61, 'criterion': 'gini'}.
Trial 7048 finished with value: 0.7065217391304348 and parameters: {'n_estimators': 789, 'max_depth': 10, 'min_samples_split': 39, 'min_samples_leaf': 65, 'criterion': 'entropy'}.
Trial 7049 finished with value: 0.717391304347826 and parameters: {'n_estimators': 207, 'max_depth': 7, 'min_samples_split': 22, 'min_samples_leaf': 59, 'criterion': 'gini'}.
Trial 7050 finished with value: 0.7065217391304348 and parameters: {'n_estimators': 747, 'max_depth': 11, 'min_samples_split': 34, 'min_samples_leaf': 55, 'criterion': 'entropy'}.
Trial 7051 finished with value: 0.7065217391304348 and parameters: {'n_estimators': 275, 'max_depth': 14, 'min_samples_split': 133, 'min_samples_leaf': 51, 'criterion': 'entropy'}.
Trial 7052 finished with value: 0.6956521739130435 and parameters: {'n_estimators': 234, 'max_depth': 9, 'min_samples_split': 139, 'min_samples_leaf': 67, 'criterion': 'gini'}.
Trial 7053 finished with value: 0.6956521739130435 and parameters: {'n_estimators': 301, 'max_depth': 12, 'min_samples_split': 30, 'min_samples_leaf': 62, 'criterion': 'entropy'}.
Trial 7054 finished with value: 0.6847826086956522 and parameters: {'n_estimators': 771, 'max_depth': 16, 'min_samples_split': 145, 'min_samples_leaf': 57, 'criterion': 'gini'}.
Trial 7055 finished with value: 0.6739130434782609 and parameters: {'n_estimators': 256, 'max_depth': 6, 'min_samples_split': 99, 'min_samples_leaf': 72, 'criterion': 'entropy'}.
Trial 7056 finished with value: 0.7065217391304348 and parameters: {'n_estimators': 344, 'max_depth': 10, 'min_samples_split': 16, 'min_samples_leaf': 59, 'criterion': 'gini'}.
Trial 7057 finished with value: 0.6304347826086957 and parameters: {'n_estimators': 289, 'max_depth': 8, 'min_samples_split': 11, 'min_samples_leaf': 6, 'criterion': 'entropy'}.
Trial 7058 finished with value: 0.6956521739130435 and parameters: {'n_estimators': 934, 'max_depth': 13, 'min_samples_split': 38, 'min_samples_leaf': 54, 'criterion': 'gini'}.
Trial 7059 finished with value: 0.6739130434782609 and parameters: {'n_estimators': 311, 'max_depth': 41, 'min_samples_split': 25, 'min_samples_leaf': 61, 'criterion': 'entropy'}.
