Trial 3 finished with value: 0.5108695652173914 and parameters: {'n_estimators': 211, 'max_depth': 20, 'min_samples_split': 50, 'min_samples_leaf': 56, 'criterion': 'entropy'}.
Trial 4 finished with value: 0.4782608695652174 and parameters: {'n_estimators': 286, 'max_depth': 13, 'min_samples_split': 59, 'min_samples_leaf': 48, 'criterion': 'entropy'}.
Trial 5 finished with value: 0.4891304347826087 and parameters: {'n_estimators': 274, 'max_depth': 18, 'min_samples_split': 52, 'min_samples_leaf': 45, 'criterion': 'entropy'}.
Trial 6 finished with value: 0.5217391304347826 and parameters: {'n_estimators': 285, 'max_depth': 19, 'min_samples_split': 40, 'min_samples_leaf': 50, 'criterion': 'gini'}.
Trial 7 finished with value: 0.5108695652173914 and parameters: {'n_estimators': 244, 'max_depth': 18, 'min_samples_split': 55, 'min_samples_leaf': 59, 'criterion': 'entropy'}.
Trial 8 finished with value: 0.4782608695652174 and parameters: {'n_estimators': 204, 'max_depth': 19, 'min_samples_split': 40, 'min_samples_leaf': 44, 'criterion': 'entropy'}.
Trial 9 finished with value: 0.4891304347826087 and parameters: {'n_estimators': 286, 'max_depth': 16, 'min_samples_split': 48, 'min_samples_leaf': 44, 'criterion': 'entropy'}.
Trial 10 finished with value: 0.5108695652173914 and parameters: {'n_estimators': 231, 'max_depth': 10, 'min_samples_split': 45, 'min_samples_leaf': 60, 'criterion': 'gini'}.
Trial 11 finished with value: 0.5 and parameters: {'n_estimators': 270, 'max_depth': 11, 'min_samples_split': 40, 'min_samples_leaf': 53, 'criterion': 'gini'}.
Trial 12 finished with value: 0.5217391304347826 and parameters: {'n_estimators': 300, 'max_depth': 16, 'min_samples_split': 45, 'min_samples_leaf': 51, 'criterion': 'gini'}.
Trial 13 finished with value: 0.5434782608695652 and parameters: {'n_estimators': 262, 'max_depth': 14, 'min_samples_split': 55, 'min_samples_leaf': 49, 'criterion': 'gini'}.
Trial 14 finished with value: 0.5543478260869565 and parameters: {'n_estimators': 261, 'max_depth': 13, 'min_samples_split': 56, 'min_samples_leaf': 54, 'criterion': 'gini'}.
Trial 15 finished with value: 0.4891304347826087 and parameters: {'n_estimators': 261, 'max_depth': 13, 'min_samples_split': 57, 'min_samples_leaf': 48, 'criterion': 'gini'}.
Trial 16 finished with value: 0.5543478260869565 and parameters: {'n_estimators': 257, 'max_depth': 14, 'min_samples_split': 53, 'min_samples_leaf': 54, 'criterion': 'gini'}.
Trial 17 finished with value: 0.5217391304347826 and parameters: {'n_estimators': 237, 'max_depth': 15, 'min_samples_split': 52, 'min_samples_leaf': 54, 'criterion': 'gini'}.
Trial 18 finished with value: 0.532608695652174 and parameters: {'n_estimators': 259, 'max_depth': 12, 'min_samples_split': 51, 'min_samples_leaf': 57, 'criterion': 'gini'}.
Trial 19 finished with value: 0.532608695652174 and parameters: {'n_estimators': 220, 'max_depth': 15, 'min_samples_split': 47, 'min_samples_leaf': 53, 'criterion': 'gini'}.
Trial 20 finished with value: 0.5543478260869565 and parameters: {'n_estimators': 253, 'max_depth': 12, 'min_samples_split': 58, 'min_samples_leaf': 54, 'criterion': 'gini'}.
Trial 21 finished with value: 0.5434782608695652 and parameters: {'n_estimators': 253, 'max_depth': 12, 'min_samples_split': 58, 'min_samples_leaf': 52, 'criterion': 'gini'}.
Trial 22 finished with value: 0.532608695652174 and parameters: {'n_estimators': 242, 'max_depth': 14, 'min_samples_split': 57, 'min_samples_leaf': 55, 'criterion': 'gini'}.
Trial 23 finished with value: 0.5108695652173914 and parameters: {'n_estimators': 272, 'max_depth': 12, 'min_samples_split': 53, 'min_samples_leaf': 58, 'criterion': 'gini'}.
Trial 24 finished with value: 0.5108695652173914 and parameters: {'n_estimators': 255, 'max_depth': 11, 'min_samples_split': 57, 'min_samples_leaf': 54, 'criterion': 'gini'}.
Trial 25 finished with value: 0.5434782608695652 and parameters: {'n_estimators': 266, 'max_depth': 14, 'min_samples_split': 54, 'min_samples_leaf': 51, 'criterion': 'gini'}.
Trial 26 finished with value: 0.5217391304347826 and parameters: {'n_estimators': 276, 'max_depth': 11, 'min_samples_split': 60, 'min_samples_leaf': 56, 'criterion': 'gini'}.
Trial 27 finished with value: 0.5108695652173914 and parameters: {'n_estimators': 250, 'max_depth': 15, 'min_samples_split': 58, 'min_samples_leaf': 54, 'criterion': 'gini'}.
Trial 28 finished with value: 0.5543478260869565 and parameters: {'n_estimators': 238, 'max_depth': 13, 'min_samples_split': 56, 'min_samples_leaf': 58, 'criterion': 'gini'}.
Trial 29 finished with value: 0.532608695652174 and parameters: {'n_estimators': 280, 'max_depth': 16, 'min_samples_split': 60, 'min_samples_leaf': 52, 'criterion': 'gini'}.
Trial 30 finished with value: 0.5760869565217391 and parameters: {'n_estimators': 225, 'max_depth': 12, 'min_samples_split': 53, 'min_samples_leaf': 55, 'criterion': 'gini'}.
Trial 31 finished with value: 0.5760869565217391 and parameters: {'n_estimators': 227, 'max_depth': 12, 'min_samples_split': 53, 'min_samples_leaf': 55, 'criterion': 'gini'}.
Trial 32 finished with value: 0.5434782608695652 and parameters: {'n_estimators': 222, 'max_depth': 14, 'min_samples_split': 53, 'min_samples_leaf': 56, 'criterion': 'gini'}.
Trial 33 finished with value: 0.5217391304347826 and parameters: {'n_estimators': 230, 'max_depth': 13, 'min_samples_split': 49, 'min_samples_leaf': 57, 'criterion': 'gini'}.
Trial 34 finished with value: 0.5 and parameters: {'n_estimators': 216, 'max_depth': 11, 'min_samples_split': 51, 'min_samples_leaf': 55, 'criterion': 'gini'}.
Trial 35 finished with value: 0.5434782608695652 and parameters: {'n_estimators': 211, 'max_depth': 12, 'min_samples_split': 54, 'min_samples_leaf': 57, 'criterion': 'gini'}.
Trial 36 finished with value: 0.5108695652173914 and parameters: {'n_estimators': 223, 'max_depth': 10, 'min_samples_split': 50, 'min_samples_leaf': 52, 'criterion': 'entropy'}.
Trial 37 finished with value: 0.532608695652174 and parameters: {'n_estimators': 235, 'max_depth': 13, 'min_samples_split': 53, 'min_samples_leaf': 55, 'criterion': 'gini'}.
Trial 38 finished with value: 0.4782608695652174 and parameters: {'n_estimators': 242, 'max_depth': 14, 'min_samples_split': 54, 'min_samples_leaf': 41, 'criterion': 'gini'}.
Trial 39 finished with value: 0.5108695652173914 and parameters: {'n_estimators': 228, 'max_depth': 13, 'min_samples_split': 56, 'min_samples_leaf': 50, 'criterion': 'entropy'}.
Trial 40 finished with value: 0.4782608695652174 and parameters: {'n_estimators': 247, 'max_depth': 15, 'min_samples_split': 52, 'min_samples_leaf': 47, 'criterion': 'gini'}.
Trial 41 finished with value: 0.5543478260869565 and parameters: {'n_estimators': 253, 'max_depth': 12, 'min_samples_split': 56, 'min_samples_leaf': 53, 'criterion': 'gini'}.
Trial 42 finished with value: 0.5217391304347826 and parameters: {'n_estimators': 257, 'max_depth': 12, 'min_samples_split': 59, 'min_samples_leaf': 55, 'criterion': 'gini'}.
Trial 43 finished with value: 0.5 and parameters: {'n_estimators': 266, 'max_depth': 11, 'min_samples_split': 55, 'min_samples_leaf': 59, 'criterion': 'gini'}.
Trial 44 finished with value: 0.5 and parameters: {'n_estimators': 210, 'max_depth': 10, 'min_samples_split': 51, 'min_samples_leaf': 54, 'criterion': 'entropy'}.
Trial 45 finished with value: 0.5434782608695652 and parameters: {'n_estimators': 201, 'max_depth': 13, 'min_samples_split': 58, 'min_samples_leaf': 53, 'criterion': 'gini'}.
Trial 46 finished with value: 0.532608695652174 and parameters: {'n_estimators': 265, 'max_depth': 12, 'min_samples_split': 54, 'min_samples_leaf': 51, 'criterion': 'gini'}.
Trial 47 finished with value: 0.5108695652173914 and parameters: {'n_estimators': 247, 'max_depth': 11, 'min_samples_split': 42, 'min_samples_leaf': 56, 'criterion': 'entropy'}.
Trial 48 finished with value: 0.5217391304347826 and parameters: {'n_estimators': 233, 'max_depth': 14, 'min_samples_split': 52, 'min_samples_leaf': 58, 'criterion': 'gini'}.
Trial 49 finished with value: 0.532608695652174 and parameters: {'n_estimators': 226, 'max_depth': 20, 'min_samples_split': 56, 'min_samples_leaf': 55, 'criterion': 'gini'}.
Trial 50 finished with value: 0.5434782608695652 and parameters: {'n_estimators': 294, 'max_depth': 17, 'min_samples_split': 50, 'min_samples_leaf': 60, 'criterion': 'gini'}.
Trial 51 finished with value: 0.5543478260869565 and parameters: {'n_estimators': 239, 'max_depth': 13, 'min_samples_split': 56, 'min_samples_leaf': 58, 'criterion': 'gini'}.
Trial 52 finished with value: 0.5434782608695652 and parameters: {'n_estimators': 238, 'max_depth': 13, 'min_samples_split': 55, 'min_samples_leaf': 59, 'criterion': 'gini'}.
Trial 53 finished with value: 0.5434782608695652 and parameters: {'n_estimators': 217, 'max_depth': 12, 'min_samples_split': 59, 'min_samples_leaf': 57, 'criterion': 'gini'}.
Trial 54 finished with value: 0.5217391304347826 and parameters: {'n_estimators': 243, 'max_depth': 13, 'min_samples_split': 57, 'min_samples_leaf': 56, 'criterion': 'gini'}.
Trial 55 finished with value: 0.5543478260869565 and parameters: {'n_estimators': 260, 'max_depth': 14, 'min_samples_split': 53, 'min_samples_leaf': 54, 'criterion': 'gini'}.
Trial 56 finished with value: 0.532608695652174 and parameters: {'n_estimators': 250, 'max_depth': 12, 'min_samples_split': 55, 'min_samples_leaf': 52, 'criterion': 'gini'}.
Trial 57 finished with value: 0.5 and parameters: {'n_estimators': 269, 'max_depth': 13, 'min_samples_split': 58, 'min_samples_leaf': 49, 'criterion': 'gini'}.
Trial 58 finished with value: 0.5 and parameters: {'n_estimators': 232, 'max_depth': 11, 'min_samples_split': 49, 'min_samples_leaf': 53, 'criterion': 'entropy'}.
Trial 59 finished with value: 0.5652173913043478 and parameters: {'n_estimators': 255, 'max_depth': 15, 'min_samples_split': 57, 'min_samples_leaf': 56, 'criterion': 'gini'}.
Trial 60 finished with value: 0.5434782608695652 and parameters: {'n_estimators': 263, 'max_depth': 17, 'min_samples_split': 59, 'min_samples_leaf': 56, 'criterion': 'gini'}.
Trial 61 finished with value: 0.532608695652174 and parameters: {'n_estimators': 256, 'max_depth': 15, 'min_samples_split': 57, 'min_samples_leaf': 57, 'criterion': 'gini'}.
Trial 62 finished with value: 0.532608695652174 and parameters: {'n_estimators': 253, 'max_depth': 14, 'min_samples_split': 56, 'min_samples_leaf': 58, 'criterion': 'gini'}.
Trial 63 finished with value: 0.5217391304347826 and parameters: {'n_estimators': 245, 'max_depth': 14, 'min_samples_split': 55, 'min_samples_leaf': 55, 'criterion': 'gini'}.
Trial 64 finished with value: 0.532608695652174 and parameters: {'n_estimators': 259, 'max_depth': 16, 'min_samples_split': 54, 'min_samples_leaf': 54, 'criterion': 'gini'}.
Trial 65 finished with value: 0.5543478260869565 and parameters: {'n_estimators': 226, 'max_depth': 15, 'min_samples_split': 57, 'min_samples_leaf': 56, 'criterion': 'gini'}.
Trial 66 finished with value: 0.532608695652174 and parameters: {'n_estimators': 240, 'max_depth': 12, 'min_samples_split': 53, 'min_samples_leaf': 60, 'criterion': 'gini'}.
Trial 67 finished with value: 0.5543478260869565 and parameters: {'n_estimators': 235, 'max_depth': 13, 'min_samples_split': 52, 'min_samples_leaf': 58, 'criterion': 'gini'}.
Trial 68 finished with value: 0.5217391304347826 and parameters: {'n_estimators': 274, 'max_depth': 12, 'min_samples_split': 58, 'min_samples_leaf': 55, 'criterion': 'gini'}.
Trial 69 finished with value: 0.5108695652173914 and parameters: {'n_estimators': 250, 'max_depth': 11, 'min_samples_split': 46, 'min_samples_leaf': 53, 'criterion': 'gini'}.
Trial 70 finished with value: 0.5217391304347826 and parameters: {'n_estimators': 269, 'max_depth': 13, 'min_samples_split': 60, 'min_samples_leaf': 57, 'criterion': 'gini'}.
Trial 71 finished with value: 0.5543478260869565 and parameters: {'n_estimators': 252, 'max_depth': 12, 'min_samples_split': 56, 'min_samples_leaf': 53, 'criterion': 'gini'}.
Trial 72 finished with value: 0.5434782608695652 and parameters: {'n_estimators': 254, 'max_depth': 12, 'min_samples_split': 54, 'min_samples_leaf': 54, 'criterion': 'gini'}.
Trial 73 finished with value: 0.532608695652174 and parameters: {'n_estimators': 263, 'max_depth': 13, 'min_samples_split': 51, 'min_samples_leaf': 52, 'criterion': 'gini'}.
Trial 74 finished with value: 0.5108695652173914 and parameters: {'n_estimators': 256, 'max_depth': 11, 'min_samples_split': 56, 'min_samples_leaf': 54, 'criterion': 'gini'}.
Trial 75 finished with value: 0.5217391304347826 and parameters: {'n_estimators': 258, 'max_depth': 12, 'min_samples_split': 55, 'min_samples_leaf': 53, 'criterion': 'entropy'}.
Trial 76 finished with value: 0.5434782608695652 and parameters: {'n_estimators': 223, 'max_depth': 14, 'min_samples_split': 58, 'min_samples_leaf': 55, 'criterion': 'gini'}.
Trial 77 finished with value: 0.5652173913043478 and parameters: {'n_estimators': 246, 'max_depth': 15, 'min_samples_split': 57, 'min_samples_leaf': 56, 'criterion': 'gini'}.
Trial 78 finished with value: 0.5652173913043478 and parameters: {'n_estimators': 247, 'max_depth': 15, 'min_samples_split': 59, 'min_samples_leaf': 59, 'criterion': 'gini'}.
Trial 79 finished with value: 0.532608695652174 and parameters: {'n_estimators': 250, 'max_depth': 16, 'min_samples_split': 59, 'min_samples_leaf': 56, 'criterion': 'gini'}.
Trial 80 finished with value: 0.5543478260869565 and parameters: {'n_estimators': 208, 'max_depth': 15, 'min_samples_split': 57, 'min_samples_leaf': 59, 'criterion': 'gini'}.
Trial 81 finished with value: 0.532608695652174 and parameters: {'n_estimators': 241, 'max_depth': 15, 'min_samples_split': 58, 'min_samples_leaf': 57, 'criterion': 'gini'}.
Trial 82 finished with value: 0.5434782608695652 and parameters: {'n_estimators': 246, 'max_depth': 16, 'min_samples_split': 60, 'min_samples_leaf': 59, 'criterion': 'gini'}.
Trial 83 finished with value: 0.5434782608695652 and parameters: {'n_estimators': 236, 'max_depth': 14, 'min_samples_split': 59, 'min_samples_leaf': 56, 'criterion': 'gini'}.
Trial 84 finished with value: 0.5217391304347826 and parameters: {'n_estimators': 245, 'max_depth': 15, 'min_samples_split': 56, 'min_samples_leaf': 58, 'criterion': 'gini'}.
Trial 85 finished with value: 0.4891304347826087 and parameters: {'n_estimators': 219, 'max_depth': 14, 'min_samples_split': 57, 'min_samples_leaf': 40, 'criterion': 'gini'}.
Trial 86 finished with value: 0.5543478260869565 and parameters: {'n_estimators': 228, 'max_depth': 17, 'min_samples_split': 58, 'min_samples_leaf': 55, 'criterion': 'gini'}.
Trial 87 finished with value: 0.5434782608695652 and parameters: {'n_estimators': 248, 'max_depth': 15, 'min_samples_split': 60, 'min_samples_leaf': 57, 'criterion': 'entropy'}.
Trial 88 finished with value: 0.5434782608695652 and parameters: {'n_estimators': 215, 'max_depth': 16, 'min_samples_split': 57, 'min_samples_leaf': 58, 'criterion': 'gini'}.
Trial 89 finished with value: 0.5543478260869565 and parameters: {'n_estimators': 243, 'max_depth': 13, 'min_samples_split': 55, 'min_samples_leaf': 60, 'criterion': 'gini'}.
Trial 90 finished with value: 0.5108695652173914 and parameters: {'n_estimators': 233, 'max_depth': 15, 'min_samples_split': 53, 'min_samples_leaf': 45, 'criterion': 'gini'}.
Trial 91 finished with value: 0.5543478260869565 and parameters: {'n_estimators': 251, 'max_depth': 12, 'min_samples_split': 59, 'min_samples_leaf': 54, 'criterion': 'gini'}.
Trial 92 finished with value: 0.5217391304347826 and parameters: {'n_estimators': 261, 'max_depth': 13, 'min_samples_split': 56, 'min_samples_leaf': 51, 'criterion': 'gini'}.
Trial 93 finished with value: 0.5217391304347826 and parameters: {'n_estimators': 253, 'max_depth': 14, 'min_samples_split': 49, 'min_samples_leaf': 55, 'criterion': 'gini'}.
Trial 94 finished with value: 0.5108695652173914 and parameters: {'n_estimators': 255, 'max_depth': 11, 'min_samples_split': 57, 'min_samples_leaf': 54, 'criterion': 'gini'}.
Trial 95 finished with value: 0.5434782608695652 and parameters: {'n_estimators': 258, 'max_depth': 12, 'min_samples_split': 54, 'min_samples_leaf': 56, 'criterion': 'gini'}.
Trial 96 finished with value: 0.5434782608695652 and parameters: {'n_estimators': 248, 'max_depth': 13, 'min_samples_split': 55, 'min_samples_leaf': 55, 'criterion': 'gini'}.
Trial 97 finished with value: 0.5217391304347826 and parameters: {'n_estimators': 266, 'max_depth': 15, 'min_samples_split': 52, 'min_samples_leaf': 53, 'criterion': 'gini'}.
Trial 98 finished with value: 0.532608695652174 and parameters: {'n_estimators': 264, 'max_depth': 14, 'min_samples_split': 43, 'min_samples_leaf': 56, 'criterion': 'gini'}.
Trial 99 finished with value: 0.5 and parameters: {'n_estimators': 248, 'max_depth': 19, 'min_samples_split': 58, 'min_samples_leaf': 54, 'criterion': 'entropy'}.
Trial 100 finished with value: 0.532608695652174 and parameters: {'n_estimators': 230, 'max_depth': 12, 'min_samples_split': 53, 'min_samples_leaf': 52, 'criterion': 'gini'}.
Trial 101 finished with value: 0.5434782608695652 and parameters: {'n_estimators': 238, 'max_depth': 13, 'min_samples_split': 56, 'min_samples_leaf': 59, 'criterion': 'gini'}.
Trial 102 finished with value: 0.5543478260869565 and parameters: {'n_estimators': 240, 'max_depth': 13, 'min_samples_split': 56, 'min_samples_leaf': 58, 'criterion': 'gini'}.
Trial 103 finished with value: 0.5434782608695652 and parameters: {'n_estimators': 244, 'max_depth': 12, 'min_samples_split': 54, 'min_samples_leaf': 57, 'criterion': 'gini'}.
Trial 104 finished with value: 0.5 and parameters: {'n_estimators': 260, 'max_depth': 12, 'min_samples_split': 57, 'min_samples_leaf': 59, 'criterion': 'gini'}.
Trial 105 finished with value: 0.532608695652174 and parameters: {'n_estimators': 224, 'max_depth': 13, 'min_samples_split': 59, 'min_samples_leaf': 55, 'criterion': 'gini'}.
Trial 106 finished with value: 0.5217391304347826 and parameters: {'n_estimators': 239, 'max_depth': 11, 'min_samples_split': 56, 'min_samples_leaf': 57, 'criterion': 'gini'}.
Trial 107 finished with value: 0.532608695652174 and parameters: {'n_estimators': 255, 'max_depth': 13, 'min_samples_split': 55, 'min_samples_leaf': 56, 'criterion': 'gini'}.
Trial 108 finished with value: 0.532608695652174 and parameters: {'n_estimators': 252, 'max_depth': 14, 'min_samples_split': 50, 'min_samples_leaf': 53, 'criterion': 'gini'}.
Trial 109 finished with value: 0.5652173913043478 and parameters: {'n_estimators': 220, 'max_depth': 12, 'min_samples_split': 48, 'min_samples_leaf': 54, 'criterion': 'gini'}.
Trial 110 finished with value: 0.5652173913043478 and parameters: {'n_estimators': 215, 'max_depth': 12, 'min_samples_split': 49, 'min_samples_leaf': 53, 'criterion': 'gini'}.
Trial 111 finished with value: 0.5652173913043478 and parameters: {'n_estimators': 218, 'max_depth': 12, 'min_samples_split': 49, 'min_samples_leaf': 54, 'criterion': 'gini'}.
Trial 112 finished with value: 0.5652173913043478 and parameters: {'n_estimators': 214, 'max_depth': 12, 'min_samples_split': 48, 'min_samples_leaf': 54, 'criterion': 'gini'}.
Trial 113 finished with value: 0.5543478260869565 and parameters: {'n_estimators': 215, 'max_depth': 12, 'min_samples_split': 48, 'min_samples_leaf': 54, 'criterion': 'gini'}.
Trial 114 finished with value: 0.5108695652173914 and parameters: {'n_estimators': 219, 'max_depth': 11, 'min_samples_split': 49, 'min_samples_leaf': 53, 'criterion': 'gini'}.
Trial 115 finished with value: 0.5543478260869565 and parameters: {'n_estimators': 211, 'max_depth': 12, 'min_samples_split': 48, 'min_samples_leaf': 54, 'criterion': 'gini'}.
Trial 116 finished with value: 0.5543478260869565 and parameters: {'n_estimators': 213, 'max_depth': 12, 'min_samples_split': 47, 'min_samples_leaf': 52, 'criterion': 'gini'}.
Trial 117 finished with value: 0.4782608695652174 and parameters: {'n_estimators': 221, 'max_depth': 11, 'min_samples_split': 47, 'min_samples_leaf': 55, 'criterion': 'gini'}.
Trial 118 finished with value: 0.5434782608695652 and parameters: {'n_estimators': 206, 'max_depth': 12, 'min_samples_split': 48, 'min_samples_leaf': 51, 'criterion': 'gini'}.
Trial 119 finished with value: 0.5108695652173914 and parameters: {'n_estimators': 203, 'max_depth': 11, 'min_samples_split': 48, 'min_samples_leaf': 54, 'criterion': 'gini'}.
Trial 120 finished with value: 0.5543478260869565 and parameters: {'n_estimators': 218, 'max_depth': 12, 'min_samples_split': 49, 'min_samples_leaf': 55, 'criterion': 'entropy'}.
Trial 121 finished with value: 0.532608695652174 and parameters: {'n_estimators': 213, 'max_depth': 15, 'min_samples_split': 47, 'min_samples_leaf': 54, 'criterion': 'gini'}.
Trial 122 finished with value: 0.5760869565217391 and parameters: {'n_estimators': 225, 'max_depth': 12, 'min_samples_split': 51, 'min_samples_leaf': 53, 'criterion': 'gini'}.
Trial 123 finished with value: 0.5652173913043478 and parameters: {'n_estimators': 226, 'max_depth': 12, 'min_samples_split': 49, 'min_samples_leaf': 53, 'criterion': 'gini'}.
Trial 124 finished with value: 0.5652173913043478 and parameters: {'n_estimators': 224, 'max_depth': 12, 'min_samples_split': 50, 'min_samples_leaf': 53, 'criterion': 'gini'}.
Trial 125 finished with value: 0.5434782608695652 and parameters: {'n_estimators': 225, 'max_depth': 12, 'min_samples_split': 50, 'min_samples_leaf': 52, 'criterion': 'gini'}.
Trial 126 finished with value: 0.5 and parameters: {'n_estimators': 222, 'max_depth': 11, 'min_samples_split': 51, 'min_samples_leaf': 53, 'criterion': 'gini'}.
Trial 127 finished with value: 0.4673913043478261 and parameters: {'n_estimators': 228, 'max_depth': 10, 'min_samples_split': 50, 'min_samples_leaf': 50, 'criterion': 'gini'}.
Trial 128 finished with value: 0.5760869565217391 and parameters: {'n_estimators': 221, 'max_depth': 12, 'min_samples_split': 49, 'min_samples_leaf': 53, 'criterion': 'gini'}.
