Trial 6078 finished with value: 0.717391304347826 and parameters: {'n_estimators': 663, 'max_depth': 10, 'min_samples_split': 106, 'min_samples_leaf': 52, 'criterion': 'gini'}.
Trial 6079 finished with value: 0.7065217391304348 and parameters: {'n_estimators': 243, 'max_depth': 13, 'min_samples_split': 27, 'min_samples_leaf': 63, 'criterion': 'entropy'}.
Trial 6080 finished with value: 0.7065217391304348 and parameters: {'n_estimators': 352, 'max_depth': 8, 'min_samples_split': 38, 'min_samples_leaf': 61, 'criterion': 'gini'}.
Trial 6081 finished with value: 0.6956521739130435 and parameters: {'n_estimators': 717, 'max_depth': 16, 'min_samples_split': 32, 'min_samples_leaf': 72, 'criterion': 'entropy'}.
Trial 6082 finished with value: 0.7065217391304348 and parameters: {'n_estimators': 304, 'max_depth': 11, 'min_samples_split': 137, 'min_samples_leaf': 67, 'criterion': 'gini'}.
Trial 6083 finished with value: 0.7282608695652174 and parameters: {'n_estimators': 259, 'max_depth': 9, 'min_samples_split': 147, 'min_samples_leaf': 54, 'criterion': 'entropy'}.
Trial 6084 finished with value: 0.6413043478260869 and parameters: {'n_estimators': 280, 'max_depth': 5, 'min_samples_split': 19, 'min_samples_leaf': 57, 'criterion': 'gini'}.
Trial 6085 finished with value: 0.6739130434782609 and parameters: {'n_estimators': 776, 'max_depth': 78, 'min_samples_split': 28, 'min_samples_leaf': 59, 'criterion': 'entropy'}.
Trial 6086 finished with value: 0.6847826086956522 and parameters: {'n_estimators': 229, 'max_depth': 14, 'min_samples_split': 15, 'min_samples_leaf': 65, 'criterion': 'gini'}.
Trial 6087 finished with value: 0.6847826086956522 and parameters: {'n_estimators': 793, 'max_depth': 7, 'min_samples_split': 160, 'min_samples_leaf': 62, 'criterion': 'entropy'}.
Trial 6088 finished with value: 0.6956521739130435 and parameters: {'n_estimators': 586, 'max_depth': 11, 'min_samples_split': 43, 'min_samples_leaf': 75, 'criterion': 'gini'}.
Trial 6089 finished with value: 0.75 and parameters: {'n_estimators': 296, 'max_depth': 9, 'min_samples_split': 35, 'min_samples_leaf': 56, 'criterion': 'entropy'}.
Trial 6090 finished with value: 0.7065217391304348 and parameters: {'n_estimators': 342, 'max_depth': 12, 'min_samples_split': 38, 'min_samples_leaf': 53, 'criterion': 'entropy'}.
Trial 6091 finished with value: 0.7282608695652174 and parameters: {'n_estimators': 335, 'max_depth': 10, 'min_samples_split': 41, 'min_samples_leaf': 52, 'criterion': 'entropy'}.
Trial 6092 finished with value: 0.6630434782608695 and parameters: {'n_estimators': 322, 'max_depth': 48, 'min_samples_split': 37, 'min_samples_leaf': 55, 'criterion': 'entropy'}.
Trial 6093 finished with value: 0.6630434782608695 and parameters: {'n_estimators': 336, 'max_depth': 32, 'min_samples_split': 40, 'min_samples_leaf': 52, 'criterion': 'entropy'}.
Trial 6094 finished with value: 0.6630434782608695 and parameters: {'n_estimators': 325, 'max_depth': 7, 'min_samples_split': 44, 'min_samples_leaf': 53, 'criterion': 'entropy'}.
Trial 6095 finished with value: 0.6630434782608695 and parameters: {'n_estimators': 324, 'max_depth': 25, 'min_samples_split': 36, 'min_samples_leaf': 54, 'criterion': 'entropy'}.
Trial 6096 finished with value: 0.6739130434782609 and parameters: {'n_estimators': 342, 'max_depth': 15, 'min_samples_split': 35, 'min_samples_leaf': 53, 'criterion': 'entropy'}.
Trial 6097 finished with value: 0.6847826086956522 and parameters: {'n_estimators': 330, 'max_depth': 13, 'min_samples_split': 42, 'min_samples_leaf': 54, 'criterion': 'entropy'}.
Trial 6098 finished with value: 0.6956521739130435 and parameters: {'n_estimators': 352, 'max_depth': 9, 'min_samples_split': 39, 'min_samples_leaf': 52, 'criterion': 'entropy'}.
Trial 6099 finished with value: 0.7065217391304348 and parameters: {'n_estimators': 352, 'max_depth': 11, 'min_samples_split': 36, 'min_samples_leaf': 52, 'criterion': 'entropy'}.
Trial 6100 finished with value: 0.6739130434782609 and parameters: {'n_estimators': 316, 'max_depth': 18, 'min_samples_split': 34, 'min_samples_leaf': 54, 'criterion': 'entropy'}.
Trial 6101 finished with value: 0.6304347826086957 and parameters: {'n_estimators': 320, 'max_depth': 5, 'min_samples_split': 41, 'min_samples_leaf': 53, 'criterion': 'entropy'}.
Trial 6102 finished with value: 0.717391304347826 and parameters: {'n_estimators': 330, 'max_depth': 8, 'min_samples_split': 34, 'min_samples_leaf': 54, 'criterion': 'entropy'}.
Trial 6103 finished with value: 0.6847826086956522 and parameters: {'n_estimators': 313, 'max_depth': 13, 'min_samples_split': 45, 'min_samples_leaf': 53, 'criterion': 'entropy'}.
Trial 6104 finished with value: 0.7282608695652174 and parameters: {'n_estimators': 312, 'max_depth': 10, 'min_samples_split': 37, 'min_samples_leaf': 52, 'criterion': 'entropy'}.
Trial 6105 finished with value: 0.6630434782608695 and parameters: {'n_estimators': 305, 'max_depth': 16, 'min_samples_split': 40, 'min_samples_leaf': 55, 'criterion': 'entropy'}.
Trial 6106 finished with value: 0.7282608695652174 and parameters: {'n_estimators': 365, 'max_depth': 8, 'min_samples_split': 32, 'min_samples_leaf': 55, 'criterion': 'entropy'}.
Trial 6107 finished with value: 0.6956521739130435 and parameters: {'n_estimators': 316, 'max_depth': 12, 'min_samples_split': 34, 'min_samples_leaf': 52, 'criterion': 'entropy'}.
Trial 6108 finished with value: 0.6739130434782609 and parameters: {'n_estimators': 340, 'max_depth': 7, 'min_samples_split': 39, 'min_samples_leaf': 54, 'criterion': 'entropy'}.
Trial 6109 finished with value: 0.6847826086956522 and parameters: {'n_estimators': 307, 'max_depth': 14, 'min_samples_split': 48, 'min_samples_leaf': 56, 'criterion': 'entropy'}.
Trial 6110 finished with value: 0.717391304347826 and parameters: {'n_estimators': 304, 'max_depth': 10, 'min_samples_split': 35, 'min_samples_leaf': 54, 'criterion': 'entropy'}.
Trial 6111 finished with value: 0.7065217391304348 and parameters: {'n_estimators': 304, 'max_depth': 12, 'min_samples_split': 32, 'min_samples_leaf': 55, 'criterion': 'entropy'}.
Trial 6112 finished with value: 0.717391304347826 and parameters: {'n_estimators': 316, 'max_depth': 9, 'min_samples_split': 42, 'min_samples_leaf': 55, 'criterion': 'entropy'}.
Trial 6113 finished with value: 0.6739130434782609 and parameters: {'n_estimators': 306, 'max_depth': 6, 'min_samples_split': 37, 'min_samples_leaf': 52, 'criterion': 'entropy'}.
Trial 6114 finished with value: 0.6847826086956522 and parameters: {'n_estimators': 323, 'max_depth': 15, 'min_samples_split': 32, 'min_samples_leaf': 56, 'criterion': 'entropy'}.
Trial 6115 finished with value: 0.717391304347826 and parameters: {'n_estimators': 329, 'max_depth': 11, 'min_samples_split': 46, 'min_samples_leaf': 56, 'criterion': 'entropy'}.
Trial 6116 finished with value: 0.717391304347826 and parameters: {'n_estimators': 346, 'max_depth': 9, 'min_samples_split': 36, 'min_samples_leaf': 55, 'criterion': 'entropy'}.
Trial 6117 finished with value: 0.6739130434782609 and parameters: {'n_estimators': 303, 'max_depth': 13, 'min_samples_split': 31, 'min_samples_leaf': 52, 'criterion': 'entropy'}.
Trial 6118 finished with value: 0.6630434782608695 and parameters: {'n_estimators': 294, 'max_depth': 22, 'min_samples_split': 39, 'min_samples_leaf': 56, 'criterion': 'entropy'}.
Trial 6119 finished with value: 0.6739130434782609 and parameters: {'n_estimators': 371, 'max_depth': 7, 'min_samples_split': 34, 'min_samples_leaf': 56, 'criterion': 'entropy'}.
Trial 6120 finished with value: 0.7282608695652174 and parameters: {'n_estimators': 298, 'max_depth': 11, 'min_samples_split': 42, 'min_samples_leaf': 54, 'criterion': 'entropy'}.
Trial 6121 finished with value: 0.6413043478260869 and parameters: {'n_estimators': 292, 'max_depth': 5, 'min_samples_split': 30, 'min_samples_leaf': 52, 'criterion': 'entropy'}.
Trial 6122 finished with value: 0.7282608695652174 and parameters: {'n_estimators': 883, 'max_depth': 8, 'min_samples_split': 39, 'min_samples_leaf': 56, 'criterion': 'entropy'}.
Trial 6123 finished with value: 0.6956521739130435 and parameters: {'n_estimators': 322, 'max_depth': 14, 'min_samples_split': 31, 'min_samples_leaf': 56, 'criterion': 'entropy'}.
Trial 6124 finished with value: 0.717391304347826 and parameters: {'n_estimators': 969, 'max_depth': 10, 'min_samples_split': 44, 'min_samples_leaf': 54, 'criterion': 'entropy'}.
Trial 6125 finished with value: 0.7065217391304348 and parameters: {'n_estimators': 757, 'max_depth': 12, 'min_samples_split': 35, 'min_samples_leaf': 56, 'criterion': 'entropy'}.
Trial 6126 finished with value: 0.6739130434782609 and parameters: {'n_estimators': 737, 'max_depth': 8, 'min_samples_split': 29, 'min_samples_leaf': 52, 'criterion': 'entropy'}.
Trial 6127 finished with value: 0.6847826086956522 and parameters: {'n_estimators': 300, 'max_depth': 17, 'min_samples_split': 35, 'min_samples_leaf': 57, 'criterion': 'entropy'}.
Trial 6128 finished with value: 0.717391304347826 and parameters: {'n_estimators': 335, 'max_depth': 10, 'min_samples_split': 37, 'min_samples_leaf': 54, 'criterion': 'entropy'}.
Trial 6129 finished with value: 0.717391304347826 and parameters: {'n_estimators': 295, 'max_depth': 12, 'min_samples_split': 31, 'min_samples_leaf': 57, 'criterion': 'entropy'}.
Trial 6130 finished with value: 0.6847826086956522 and parameters: {'n_estimators': 314, 'max_depth': 15, 'min_samples_split': 39, 'min_samples_leaf': 55, 'criterion': 'entropy'}.
Trial 6131 finished with value: 0.6956521739130435 and parameters: {'n_estimators': 708, 'max_depth': 7, 'min_samples_split': 49, 'min_samples_leaf': 57, 'criterion': 'entropy'}.
Trial 6132 finished with value: 0.717391304347826 and parameters: {'n_estimators': 775, 'max_depth': 10, 'min_samples_split': 29, 'min_samples_leaf': 57, 'criterion': 'entropy'}.
Trial 6133 finished with value: 0.6956521739130435 and parameters: {'n_estimators': 292, 'max_depth': 13, 'min_samples_split': 44, 'min_samples_leaf': 52, 'criterion': 'entropy'}.
Trial 6134 finished with value: 0.7391304347826086 and parameters: {'n_estimators': 293, 'max_depth': 9, 'min_samples_split': 32, 'min_samples_leaf': 56, 'criterion': 'entropy'}.
Trial 6135 finished with value: 0.6956521739130435 and parameters: {'n_estimators': 732, 'max_depth': 61, 'min_samples_split': 34, 'min_samples_leaf': 72, 'criterion': 'entropy'}.
Trial 6136 finished with value: 0.6413043478260869 and parameters: {'n_estimators': 692, 'max_depth': 5, 'min_samples_split': 39, 'min_samples_leaf': 54, 'criterion': 'entropy'}.
Trial 6137 finished with value: 0.6847826086956522 and parameters: {'n_estimators': 747, 'max_depth': 11, 'min_samples_split': 27, 'min_samples_leaf': 76, 'criterion': 'entropy'}.
Trial 6138 finished with value: 0.7065217391304348 and parameters: {'n_estimators': 642, 'max_depth': 14, 'min_samples_split': 33, 'min_samples_leaf': 57, 'criterion': 'entropy'}.
Trial 6139 finished with value: 0.6739130434782609 and parameters: {'n_estimators': 161, 'max_depth': 19, 'min_samples_split': 37, 'min_samples_leaf': 73, 'criterion': 'entropy'}.
Trial 6140 finished with value: 0.717391304347826 and parameters: {'n_estimators': 476, 'max_depth': 8, 'min_samples_split': 31, 'min_samples_leaf': 54, 'criterion': 'entropy'}.
Trial 6141 finished with value: 0.6847826086956522 and parameters: {'n_estimators': 318, 'max_depth': 16, 'min_samples_split': 27, 'min_samples_leaf': 70, 'criterion': 'entropy'}.
Trial 6142 finished with value: 0.6956521739130435 and parameters: {'n_estimators': 355, 'max_depth': 12, 'min_samples_split': 41, 'min_samples_leaf': 55, 'criterion': 'entropy'}.
Trial 6143 finished with value: 0.6847826086956522 and parameters: {'n_estimators': 291, 'max_depth': 7, 'min_samples_split': 35, 'min_samples_leaf': 57, 'criterion': 'entropy'}.
Trial 6144 finished with value: 0.6739130434782609 and parameters: {'n_estimators': 793, 'max_depth': 9, 'min_samples_split': 27, 'min_samples_leaf': 52, 'criterion': 'entropy'}.
Trial 6145 finished with value: 0.7282608695652174 and parameters: {'n_estimators': 339, 'max_depth': 11, 'min_samples_split': 38, 'min_samples_leaf': 58, 'criterion': 'entropy'}.
Trial 6146 finished with value: 0.6521739130434783 and parameters: {'n_estimators': 140, 'max_depth': 13, 'min_samples_split': 46, 'min_samples_leaf': 39, 'criterion': 'entropy'}.
Trial 6147 finished with value: 0.717391304347826 and parameters: {'n_estimators': 310, 'max_depth': 10, 'min_samples_split': 32, 'min_samples_leaf': 55, 'criterion': 'entropy'}.
Trial 6148 finished with value: 0.6956521739130435 and parameters: {'n_estimators': 912, 'max_depth': 6, 'min_samples_split': 42, 'min_samples_leaf': 71, 'criterion': 'entropy'}.
Trial 6149 finished with value: 0.717391304347826 and parameters: {'n_estimators': 770, 'max_depth': 8, 'min_samples_split': 28, 'min_samples_leaf': 58, 'criterion': 'entropy'}.
Trial 6150 finished with value: 0.6847826086956522 and parameters: {'n_estimators': 287, 'max_depth': 15, 'min_samples_split': 24, 'min_samples_leaf': 57, 'criterion': 'entropy'}.
Trial 6151 finished with value: 0.6847826086956522 and parameters: {'n_estimators': 760, 'max_depth': 12, 'min_samples_split': 36, 'min_samples_leaf': 77, 'criterion': 'entropy'}.
Trial 6152 finished with value: 0.7282608695652174 and parameters: {'n_estimators': 283, 'max_depth': 9, 'min_samples_split': 34, 'min_samples_leaf': 73, 'criterion': 'entropy'}.
Trial 6153 finished with value: 0.7282608695652174 and parameters: {'n_estimators': 304, 'max_depth': 11, 'min_samples_split': 30, 'min_samples_leaf': 54, 'criterion': 'entropy'}.
Trial 6154 finished with value: 0.6739130434782609 and parameters: {'n_estimators': 450, 'max_depth': 82, 'min_samples_split': 43, 'min_samples_leaf': 58, 'criterion': 'entropy'}.
Trial 6155 finished with value: 0.6739130434782609 and parameters: {'n_estimators': 329, 'max_depth': 17, 'min_samples_split': 25, 'min_samples_leaf': 74, 'criterion': 'entropy'}.
Trial 6156 finished with value: 0.6630434782608695 and parameters: {'n_estimators': 288, 'max_depth': 14, 'min_samples_split': 38, 'min_samples_leaf': 80, 'criterion': 'entropy'}.
Trial 6157 finished with value: 0.6739130434782609 and parameters: {'n_estimators': 724, 'max_depth': 6, 'min_samples_split': 30, 'min_samples_leaf': 56, 'criterion': 'entropy'}.
Trial 6158 finished with value: 0.717391304347826 and parameters: {'n_estimators': 748, 'max_depth': 10, 'min_samples_split': 52, 'min_samples_leaf': 52, 'criterion': 'entropy'}.
Trial 6159 finished with value: 0.7282608695652174 and parameters: {'n_estimators': 791, 'max_depth': 8, 'min_samples_split': 33, 'min_samples_leaf': 58, 'criterion': 'entropy'}.
Trial 6160 finished with value: 0.6956521739130435 and parameters: {'n_estimators': 939, 'max_depth': 13, 'min_samples_split': 26, 'min_samples_leaf': 70, 'criterion': 'entropy'}.
Trial 6161 finished with value: 0.717391304347826 and parameters: {'n_estimators': 311, 'max_depth': 11, 'min_samples_split': 41, 'min_samples_leaf': 55, 'criterion': 'entropy'}.
Trial 6162 finished with value: 0.6847826086956522 and parameters: {'n_estimators': 284, 'max_depth': 7, 'min_samples_split': 36, 'min_samples_leaf': 58, 'criterion': 'entropy'}.
Trial 6163 finished with value: 0.717391304347826 and parameters: {'n_estimators': 679, 'max_depth': 9, 'min_samples_split': 30, 'min_samples_leaf': 75, 'criterion': 'entropy'}.
Trial 6164 finished with value: 0.7065217391304348 and parameters: {'n_estimators': 277, 'max_depth': 13, 'min_samples_split': 24, 'min_samples_leaf': 54, 'criterion': 'entropy'}.
Trial 6165 finished with value: 0.6304347826086957 and parameters: {'n_estimators': 306, 'max_depth': 5, 'min_samples_split': 38, 'min_samples_leaf': 56, 'criterion': 'entropy'}.
Trial 6166 finished with value: 0.717391304347826 and parameters: {'n_estimators': 390, 'max_depth': 10, 'min_samples_split': 47, 'min_samples_leaf': 58, 'criterion': 'entropy'}.
Trial 6167 finished with value: 0.6847826086956522 and parameters: {'n_estimators': 354, 'max_depth': 30, 'min_samples_split': 34, 'min_samples_leaf': 71, 'criterion': 'entropy'}.
Trial 6168 finished with value: 0.7065217391304348 and parameters: {'n_estimators': 766, 'max_depth': 15, 'min_samples_split': 29, 'min_samples_leaf': 56, 'criterion': 'entropy'}.
Trial 6169 finished with value: 0.6739130434782609 and parameters: {'n_estimators': 330, 'max_depth': 52, 'min_samples_split': 43, 'min_samples_leaf': 57, 'criterion': 'entropy'}.
Trial 6170 finished with value: 0.6956521739130435 and parameters: {'n_estimators': 277, 'max_depth': 12, 'min_samples_split': 33, 'min_samples_leaf': 68, 'criterion': 'entropy'}.
Trial 6171 finished with value: 0.6956521739130435 and parameters: {'n_estimators': 741, 'max_depth': 8, 'min_samples_split': 24, 'min_samples_leaf': 53, 'criterion': 'entropy'}.
Trial 6172 finished with value: 0.6847826086956522 and parameters: {'n_estimators': 308, 'max_depth': 11, 'min_samples_split': 28, 'min_samples_leaf': 78, 'criterion': 'entropy'}.
Trial 6173 finished with value: 0.717391304347826 and parameters: {'n_estimators': 296, 'max_depth': 7, 'min_samples_split': 38, 'min_samples_leaf': 73, 'criterion': 'entropy'}.
Trial 6174 finished with value: 0.6847826086956522 and parameters: {'n_estimators': 707, 'max_depth': 16, 'min_samples_split': 31, 'min_samples_leaf': 69, 'criterion': 'entropy'}.
Trial 6175 finished with value: 0.717391304347826 and parameters: {'n_estimators': 780, 'max_depth': 10, 'min_samples_split': 23, 'min_samples_leaf': 58, 'criterion': 'entropy'}.
Trial 6176 finished with value: 0.717391304347826 and parameters: {'n_estimators': 277, 'max_depth': 13, 'min_samples_split': 40, 'min_samples_leaf': 59, 'criterion': 'entropy'}.
Trial 6177 finished with value: 0.7391304347826086 and parameters: {'n_estimators': 321, 'max_depth': 9, 'min_samples_split': 33, 'min_samples_leaf': 56, 'criterion': 'entropy'}.
Trial 6178 finished with value: 0.6630434782608695 and parameters: {'n_estimators': 725, 'max_depth': 18, 'min_samples_split': 26, 'min_samples_leaf': 54, 'criterion': 'entropy'}.
Trial 6179 finished with value: 0.6304347826086957 and parameters: {'n_estimators': 120, 'max_depth': 5, 'min_samples_split': 35, 'min_samples_leaf': 26, 'criterion': 'entropy'}.
Trial 6180 finished with value: 0.6847826086956522 and parameters: {'n_estimators': 292, 'max_depth': 14, 'min_samples_split': 30, 'min_samples_leaf': 52, 'criterion': 'entropy'}.
Trial 6181 finished with value: 0.7065217391304348 and parameters: {'n_estimators': 758, 'max_depth': 11, 'min_samples_split': 21, 'min_samples_leaf': 75, 'criterion': 'entropy'}.
Trial 6182 finished with value: 0.6739130434782609 and parameters: {'n_estimators': 271, 'max_depth': 7, 'min_samples_split': 39, 'min_samples_leaf': 58, 'criterion': 'entropy'}.
Trial 6183 finished with value: 0.6956521739130435 and parameters: {'n_estimators': 892, 'max_depth': 9, 'min_samples_split': 55, 'min_samples_leaf': 71, 'criterion': 'entropy'}.
Trial 6184 finished with value: 0.6847826086956522 and parameters: {'n_estimators': 492, 'max_depth': 12, 'min_samples_split': 26, 'min_samples_leaf': 55, 'criterion': 'entropy'}.
Trial 6185 finished with value: 0.7065217391304348 and parameters: {'n_estimators': 792, 'max_depth': 10, 'min_samples_split': 47, 'min_samples_leaf': 59, 'criterion': 'entropy'}.
Trial 6186 finished with value: 0.6847826086956522 and parameters: {'n_estimators': 283, 'max_depth': 14, 'min_samples_split': 35, 'min_samples_leaf': 57, 'criterion': 'entropy'}.
Trial 6187 finished with value: 0.6956521739130435 and parameters: {'n_estimators': 369, 'max_depth': 7, 'min_samples_split': 31, 'min_samples_leaf': 59, 'criterion': 'entropy'}.
Trial 6188 finished with value: 0.6847826086956522 and parameters: {'n_estimators': 189, 'max_depth': 12, 'min_samples_split': 44, 'min_samples_leaf': 69, 'criterion': 'entropy'}.
Trial 6189 finished with value: 0.7065217391304348 and parameters: {'n_estimators': 319, 'max_depth': 9, 'min_samples_split': 28, 'min_samples_leaf': 52, 'criterion': 'entropy'}.
Trial 6190 finished with value: 0.6739130434782609 and parameters: {'n_estimators': 297, 'max_depth': 27, 'min_samples_split': 40, 'min_samples_leaf': 73, 'criterion': 'entropy'}.
Trial 6191 finished with value: 0.6847826086956522 and parameters: {'n_estimators': 744, 'max_depth': 16, 'min_samples_split': 35, 'min_samples_leaf': 55, 'criterion': 'entropy'}.
Trial 6192 finished with value: 0.717391304347826 and parameters: {'n_estimators': 267, 'max_depth': 8, 'min_samples_split': 29, 'min_samples_leaf': 59, 'criterion': 'entropy'}.
Trial 6193 finished with value: 0.6739130434782609 and parameters: {'n_estimators': 601, 'max_depth': 11, 'min_samples_split': 22, 'min_samples_leaf': 97, 'criterion': 'entropy'}.
Trial 6194 finished with value: 0.6195652173913043 and parameters: {'n_estimators': 278, 'max_depth': 13, 'min_samples_split': 17, 'min_samples_leaf': 3, 'criterion': 'entropy'}.
Trial 6195 finished with value: 0.6304347826086957 and parameters: {'n_estimators': 306, 'max_depth': 5, 'min_samples_split': 37, 'min_samples_leaf': 57, 'criterion': 'entropy'}.
Trial 6196 finished with value: 0.7065217391304348 and parameters: {'n_estimators': 953, 'max_depth': 10, 'min_samples_split': 43, 'min_samples_leaf': 54, 'criterion': 'entropy'}.
Trial 6197 finished with value: 0.6521739130434783 and parameters: {'n_estimators': 344, 'max_depth': 42, 'min_samples_split': 33, 'min_samples_leaf': 56, 'criterion': 'entropy'}.
Trial 6198 finished with value: 0.7065217391304348 and parameters: {'n_estimators': 772, 'max_depth': 7, 'min_samples_split': 24, 'min_samples_leaf': 59, 'criterion': 'entropy'}.
Trial 6199 finished with value: 0.717391304347826 and parameters: {'n_estimators': 289, 'max_depth': 14, 'min_samples_split': 28, 'min_samples_leaf': 72, 'criterion': 'entropy'}.
