Trial 8044 finished with value: 0.6956521739130435 and parameters: {'n_estimators': 500, 'max_depth': 12, 'min_samples_split': 33, 'min_samples_leaf': 58, 'criterion': 'gini'}.
Trial 8045 finished with value: 0.6739130434782609 and parameters: {'n_estimators': 315, 'max_depth': 20, 'min_samples_split': 153, 'min_samples_leaf': 60, 'criterion': 'entropy'}.
Trial 8046 finished with value: 0.717391304347826 and parameters: {'n_estimators': 289, 'max_depth': 10, 'min_samples_split': 121, 'min_samples_leaf': 67, 'criterion': 'gini'}.
Trial 8047 finished with value: 0.6739130434782609 and parameters: {'n_estimators': 769, 'max_depth': 72, 'min_samples_split': 117, 'min_samples_leaf': 50, 'criterion': 'entropy'}.
Trial 8048 finished with value: 0.6630434782608695 and parameters: {'n_estimators': 266, 'max_depth': 15, 'min_samples_split': 133, 'min_samples_leaf': 26, 'criterion': 'gini'}.
Trial 8049 finished with value: 0.7282608695652174 and parameters: {'n_estimators': 249, 'max_depth': 8, 'min_samples_split': 27, 'min_samples_leaf': 56, 'criterion': 'entropy'}.
Trial 8050 finished with value: 0.6413043478260869 and parameters: {'n_estimators': 283, 'max_depth': 5, 'min_samples_split': 37, 'min_samples_leaf': 62, 'criterion': 'entropy'}.
Trial 8051 finished with value: 0.7065217391304348 and parameters: {'n_estimators': 303, 'max_depth': 12, 'min_samples_split': 32, 'min_samples_leaf': 58, 'criterion': 'gini'}.
Trial 8052 finished with value: 0.717391304347826 and parameters: {'n_estimators': 220, 'max_depth': 9, 'min_samples_split': 25, 'min_samples_leaf': 55, 'criterion': 'entropy'}.
Trial 8053 finished with value: 0.7065217391304348 and parameters: {'n_estimators': 753, 'max_depth': 14, 'min_samples_split': 42, 'min_samples_leaf': 71, 'criterion': 'gini'}.
Trial 8054 finished with value: 0.7065217391304348 and parameters: {'n_estimators': 915, 'max_depth': 7, 'min_samples_split': 50, 'min_samples_leaf': 60, 'criterion': 'entropy'}.
Trial 8055 finished with value: 0.6847826086956522 and parameters: {'n_estimators': 263, 'max_depth': 18, 'min_samples_split': 29, 'min_samples_leaf': 53, 'criterion': 'gini'}.
Trial 8056 finished with value: 0.7065217391304348 and parameters: {'n_estimators': 721, 'max_depth': 11, 'min_samples_split': 110, 'min_samples_leaf': 65, 'criterion': 'entropy'}.
Trial 8057 finished with value: 0.6739130434782609 and parameters: {'n_estimators': 326, 'max_depth': 23, 'min_samples_split': 105, 'min_samples_leaf': 57, 'criterion': 'gini'}.
Trial 8058 finished with value: 0.717391304347826 and parameters: {'n_estimators': 278, 'max_depth': 9, 'min_samples_split': 63, 'min_samples_leaf': 63, 'criterion': 'entropy'}.
Trial 8059 finished with value: 0.6739130434782609 and parameters: {'n_estimators': 244, 'max_depth': 12, 'min_samples_split': 141, 'min_samples_leaf': 76, 'criterion': 'entropy'}.
Trial 8060 finished with value: 0.6956521739130435 and parameters: {'n_estimators': 301, 'max_depth': 41, 'min_samples_split': 157, 'min_samples_leaf': 69, 'criterion': 'gini'}.
Trial 8061 finished with value: 0.6956521739130435 and parameters: {'n_estimators': 121, 'max_depth': 7, 'min_samples_split': 18, 'min_samples_leaf': 59, 'criterion': 'entropy'}.
Trial 8062 finished with value: 0.6847826086956522 and parameters: {'n_estimators': 794, 'max_depth': 16, 'min_samples_split': 36, 'min_samples_leaf': 73, 'criterion': 'gini'}.
Trial 8063 finished with value: 0.6739130434782609 and parameters: {'n_estimators': 180, 'max_depth': 61, 'min_samples_split': 136, 'min_samples_leaf': 57, 'criterion': 'entropy'}.
Trial 8064 finished with value: 0.6739130434782609 and parameters: {'n_estimators': 874, 'max_depth': 50, 'min_samples_split': 22, 'min_samples_leaf': 61, 'criterion': 'gini'}.
Trial 8065 finished with value: 0.7282608695652174 and parameters: {'n_estimators': 567, 'max_depth': 10, 'min_samples_split': 31, 'min_samples_leaf': 54, 'criterion': 'entropy'}.
Trial 8066 finished with value: 0.717391304347826 and parameters: {'n_estimators': 268, 'max_depth': 13, 'min_samples_split': 39, 'min_samples_leaf': 59, 'criterion': 'gini'}.
Trial 8067 finished with value: 0.7065217391304348 and parameters: {'n_estimators': 348, 'max_depth': 9, 'min_samples_split': 146, 'min_samples_leaf': 56, 'criterion': 'entropy'}.
Trial 8068 finished with value: 0.717391304347826 and parameters: {'n_estimators': 288, 'max_depth': 11, 'min_samples_split': 25, 'min_samples_leaf': 63, 'criterion': 'entropy'}.
Trial 8069 finished with value: 0.6304347826086957 and parameters: {'n_estimators': 777, 'max_depth': 6, 'min_samples_split': 34, 'min_samples_leaf': 14, 'criterion': 'gini'}.
Trial 8070 finished with value: 0.6956521739130435 and parameters: {'n_estimators': 741, 'max_depth': 14, 'min_samples_split': 30, 'min_samples_leaf': 61, 'criterion': 'entropy'}.
Trial 8071 finished with value: 0.6847826086956522 and parameters: {'n_estimators': 309, 'max_depth': 8, 'min_samples_split': 45, 'min_samples_leaf': 51, 'criterion': 'gini'}.
Trial 8072 finished with value: 0.717391304347826 and parameters: {'n_estimators': 234, 'max_depth': 11, 'min_samples_split': 139, 'min_samples_leaf': 54, 'criterion': 'entropy'}.
Trial 8073 finished with value: 0.6521739130434783 and parameters: {'n_estimators': 268, 'max_depth': 5, 'min_samples_split': 178, 'min_samples_leaf': 58, 'criterion': 'gini'}.
Trial 8074 finished with value: 0.7065217391304348 and parameters: {'n_estimators': 292, 'max_depth': 13, 'min_samples_split': 36, 'min_samples_leaf': 68, 'criterion': 'entropy'}.
Trial 8075 finished with value: 0.717391304347826 and parameters: {'n_estimators': 320, 'max_depth': 9, 'min_samples_split': 128, 'min_samples_leaf': 65, 'criterion': 'gini'}.
Trial 8076 finished with value: 0.6847826086956522 and parameters: {'n_estimators': 433, 'max_depth': 15, 'min_samples_split': 27, 'min_samples_leaf': 74, 'criterion': 'entropy'}.
Trial 8077 finished with value: 0.717391304347826 and parameters: {'n_estimators': 762, 'max_depth': 11, 'min_samples_split': 13, 'min_samples_leaf': 60, 'criterion': 'gini'}.
Trial 8078 finished with value: 0.7065217391304348 and parameters: {'n_estimators': 810, 'max_depth': 7, 'min_samples_split': 133, 'min_samples_leaf': 70, 'criterion': 'entropy'}.
Trial 8079 finished with value: 0.717391304347826 and parameters: {'n_estimators': 251, 'max_depth': 10, 'min_samples_split': 123, 'min_samples_leaf': 56, 'criterion': 'entropy'}.
Trial 8080 finished with value: 0.6956521739130435 and parameters: {'n_estimators': 690, 'max_depth': 13, 'min_samples_split': 22, 'min_samples_leaf': 58, 'criterion': 'gini'}.
Trial 8081 finished with value: 0.6956521739130435 and parameters: {'n_estimators': 281, 'max_depth': 17, 'min_samples_split': 39, 'min_samples_leaf': 62, 'criterion': 'entropy'}.
Trial 8082 finished with value: 0.6956521739130435 and parameters: {'n_estimators': 261, 'max_depth': 8, 'min_samples_split': 143, 'min_samples_leaf': 72, 'criterion': 'gini'}.
Trial 8083 finished with value: 0.6956521739130435 and parameters: {'n_estimators': 158, 'max_depth': 12, 'min_samples_split': 150, 'min_samples_leaf': 54, 'criterion': 'entropy'}.
Trial 8084 finished with value: 0.6956521739130435 and parameters: {'n_estimators': 338, 'max_depth': 10, 'min_samples_split': 33, 'min_samples_leaf': 78, 'criterion': 'gini'}.
Trial 8085 finished with value: 0.6847826086956522 and parameters: {'n_estimators': 222, 'max_depth': 7, 'min_samples_split': 115, 'min_samples_leaf': 92, 'criterion': 'entropy'}.
Trial 8086 finished with value: 0.6956521739130435 and parameters: {'n_estimators': 363, 'max_depth': 15, 'min_samples_split': 18, 'min_samples_leaf': 52, 'criterion': 'gini'}.
Trial 8087 finished with value: 0.6956521739130435 and parameters: {'n_estimators': 300, 'max_depth': 9, 'min_samples_split': 29, 'min_samples_leaf': 60, 'criterion': 'entropy'}.
Trial 8088 finished with value: 0.7065217391304348 and parameters: {'n_estimators': 739, 'max_depth': 12, 'min_samples_split': 41, 'min_samples_leaf': 57, 'criterion': 'entropy'}.
Trial 8089 finished with value: 0.6739130434782609 and parameters: {'n_estimators': 278, 'max_depth': 5, 'min_samples_split': 33, 'min_samples_leaf': 66, 'criterion': 'gini'}.
Trial 8090 finished with value: 0.6956521739130435 and parameters: {'n_estimators': 719, 'max_depth': 14, 'min_samples_split': 26, 'min_samples_leaf': 63, 'criterion': 'entropy'}.
Trial 8091 finished with value: 0.6956521739130435 and parameters: {'n_estimators': 249, 'max_depth': 10, 'min_samples_split': 37, 'min_samples_leaf': 59, 'criterion': 'gini'}.
Trial 8092 finished with value: 0.7282608695652174 and parameters: {'n_estimators': 320, 'max_depth': 8, 'min_samples_split': 56, 'min_samples_leaf': 56, 'criterion': 'entropy'}.
Trial 8093 finished with value: 0.6847826086956522 and parameters: {'n_estimators': 833, 'max_depth': 12, 'min_samples_split': 137, 'min_samples_leaf': 75, 'criterion': 'gini'}.
Trial 8094 finished with value: 0.717391304347826 and parameters: {'n_estimators': 530, 'max_depth': 10, 'min_samples_split': 30, 'min_samples_leaf': 61, 'criterion': 'entropy'}.
Trial 8095 finished with value: 0.6956521739130435 and parameters: {'n_estimators': 776, 'max_depth': 7, 'min_samples_split': 146, 'min_samples_leaf': 55, 'criterion': 'gini'}.
Trial 8096 finished with value: 0.6630434782608695 and parameters: {'n_estimators': 199, 'max_depth': 13, 'min_samples_split': 165, 'min_samples_leaf': 58, 'criterion': 'entropy'}.
Trial 8097 finished with value: 0.6956521739130435 and parameters: {'n_estimators': 294, 'max_depth': 16, 'min_samples_split': 23, 'min_samples_leaf': 71, 'criterion': 'entropy'}.
Trial 8098 finished with value: 0.6304347826086957 and parameters: {'n_estimators': 267, 'max_depth': 9, 'min_samples_split': 189, 'min_samples_leaf': 3, 'criterion': 'gini'}.
Trial 8099 finished with value: 0.7065217391304348 and parameters: {'n_estimators': 238, 'max_depth': 11, 'min_samples_split': 48, 'min_samples_leaf': 64, 'criterion': 'entropy'}.
Trial 8100 finished with value: 0.6956521739130435 and parameters: {'n_estimators': 391, 'max_depth': 7, 'min_samples_split': 42, 'min_samples_leaf': 59, 'criterion': 'gini'}.
Trial 8101 finished with value: 0.6739130434782609 and parameters: {'n_estimators': 281, 'max_depth': 19, 'min_samples_split': 35, 'min_samples_leaf': 57, 'criterion': 'entropy'}.
Trial 8102 finished with value: 0.717391304347826 and parameters: {'n_estimators': 898, 'max_depth': 14, 'min_samples_split': 125, 'min_samples_leaf': 52, 'criterion': 'gini'}.
Trial 8103 finished with value: 0.6956521739130435 and parameters: {'n_estimators': 797, 'max_depth': 11, 'min_samples_split': 19, 'min_samples_leaf': 67, 'criterion': 'entropy'}.
Trial 8104 finished with value: 0.6956521739130435 and parameters: {'n_estimators': 621, 'max_depth': 36, 'min_samples_split': 95, 'min_samples_leaf': 62, 'criterion': 'gini'}.
Trial 8105 finished with value: 0.6956521739130435 and parameters: {'n_estimators': 309, 'max_depth': 9, 'min_samples_split': 140, 'min_samples_leaf': 54, 'criterion': 'entropy'}.
Trial 8106 finished with value: 0.6304347826086957 and parameters: {'n_estimators': 260, 'max_depth': 5, 'min_samples_split': 119, 'min_samples_leaf': 60, 'criterion': 'entropy'}.
Trial 8107 finished with value: 0.7065217391304348 and parameters: {'n_estimators': 759, 'max_depth': 12, 'min_samples_split': 28, 'min_samples_leaf': 56, 'criterion': 'gini'}.
Trial 8108 finished with value: 0.7065217391304348 and parameters: {'n_estimators': 291, 'max_depth': 8, 'min_samples_split': 133, 'min_samples_leaf': 76, 'criterion': 'entropy'}.
Trial 8109 finished with value: 0.6847826086956522 and parameters: {'n_estimators': 329, 'max_depth': 14, 'min_samples_split': 112, 'min_samples_leaf': 73, 'criterion': 'gini'}.
Trial 8110 finished with value: 0.7065217391304348 and parameters: {'n_estimators': 737, 'max_depth': 10, 'min_samples_split': 39, 'min_samples_leaf': 70, 'criterion': 'entropy'}.
Trial 8111 finished with value: 0.6847826086956522 and parameters: {'n_estimators': 238, 'max_depth': 16, 'min_samples_split': 89, 'min_samples_leaf': 58, 'criterion': 'gini'}.
Trial 8112 finished with value: 0.6739130434782609 and parameters: {'n_estimators': 278, 'max_depth': 7, 'min_samples_split': 33, 'min_samples_leaf': 50, 'criterion': 'entropy'}.
Trial 8113 finished with value: 0.6847826086956522 and parameters: {'n_estimators': 783, 'max_depth': 32, 'min_samples_split': 25, 'min_samples_leaf': 61, 'criterion': 'gini'}.
Trial 8114 finished with value: 0.6739130434782609 and parameters: {'n_estimators': 310, 'max_depth': 12, 'min_samples_split': 44, 'min_samples_leaf': 64, 'criterion': 'entropy'}.
Trial 8115 finished with value: 0.7282608695652174 and parameters: {'n_estimators': 257, 'max_depth': 9, 'min_samples_split': 32, 'min_samples_leaf': 55, 'criterion': 'entropy'}.
Trial 8116 finished with value: 0.6847826086956522 and parameters: {'n_estimators': 710, 'max_depth': 6, 'min_samples_split': 15, 'min_samples_leaf': 59, 'criterion': 'gini'}.
Trial 8117 finished with value: 0.7065217391304348 and parameters: {'n_estimators': 211, 'max_depth': 11, 'min_samples_split': 130, 'min_samples_leaf': 68, 'criterion': 'entropy'}.
Trial 8118 finished with value: 0.6847826086956522 and parameters: {'n_estimators': 274, 'max_depth': 14, 'min_samples_split': 142, 'min_samples_leaf': 57, 'criterion': 'gini'}.
Trial 8119 finished with value: 0.7065217391304348 and parameters: {'n_estimators': 297, 'max_depth': 9, 'min_samples_split': 38, 'min_samples_leaf': 62, 'criterion': 'entropy'}.
Trial 8120 finished with value: 0.717391304347826 and parameters: {'n_estimators': 761, 'max_depth': 13, 'min_samples_split': 28, 'min_samples_leaf': 54, 'criterion': 'gini'}.
Trial 8121 finished with value: 0.6956521739130435 and parameters: {'n_estimators': 251, 'max_depth': 17, 'min_samples_split': 22, 'min_samples_leaf': 58, 'criterion': 'entropy'}.
Trial 8122 finished with value: 0.717391304347826 and parameters: {'n_estimators': 349, 'max_depth': 11, 'min_samples_split': 34, 'min_samples_leaf': 60, 'criterion': 'gini'}.
Trial 8123 finished with value: 0.7065217391304348 and parameters: {'n_estimators': 314, 'max_depth': 7, 'min_samples_split': 102, 'min_samples_leaf': 72, 'criterion': 'entropy'}.
Trial 8124 finished with value: 0.6847826086956522 and parameters: {'n_estimators': 855, 'max_depth': 9, 'min_samples_split': 147, 'min_samples_leaf': 65, 'criterion': 'entropy'}.
Trial 8125 finished with value: 0.7065217391304348 and parameters: {'n_estimators': 287, 'max_depth': 12, 'min_samples_split': 136, 'min_samples_leaf': 56, 'criterion': 'gini'}.
Trial 8126 finished with value: 0.6413043478260869 and parameters: {'n_estimators': 266, 'max_depth': 5, 'min_samples_split': 29, 'min_samples_leaf': 53, 'criterion': 'entropy'}.
Trial 8127 finished with value: 0.6739130434782609 and parameters: {'n_estimators': 743, 'max_depth': 15, 'min_samples_split': 37, 'min_samples_leaf': 60, 'criterion': 'gini'}.
Trial 8128 finished with value: 0.6847826086956522 and parameters: {'n_estimators': 647, 'max_depth': 38, 'min_samples_split': 25, 'min_samples_leaf': 74, 'criterion': 'entropy'}.
Trial 8129 finished with value: 0.717391304347826 and parameters: {'n_estimators': 482, 'max_depth': 10, 'min_samples_split': 31, 'min_samples_leaf': 62, 'criterion': 'gini'}.
Trial 8130 finished with value: 0.7065217391304348 and parameters: {'n_estimators': 223, 'max_depth': 8, 'min_samples_split': 40, 'min_samples_leaf': 57, 'criterion': 'entropy'}.
Trial 8131 finished with value: 0.6956521739130435 and parameters: {'n_estimators': 812, 'max_depth': 13, 'min_samples_split': 122, 'min_samples_leaf': 69, 'criterion': 'gini'}.
Trial 8132 finished with value: 0.7391304347826086 and parameters: {'n_estimators': 145, 'max_depth': 11, 'min_samples_split': 19, 'min_samples_leaf': 59, 'criterion': 'entropy'}.
Trial 8133 finished with value: 0.6521739130434783 and parameters: {'n_estimators': 250, 'max_depth': 7, 'min_samples_split': 45, 'min_samples_leaf': 52, 'criterion': 'gini'}.
Trial 8134 finished with value: 0.717391304347826 and parameters: {'n_estimators': 336, 'max_depth': 10, 'min_samples_split': 152, 'min_samples_leaf': 55, 'criterion': 'entropy'}.
Trial 8135 finished with value: 0.6739130434782609 and parameters: {'n_estimators': 275, 'max_depth': 13, 'min_samples_split': 33, 'min_samples_leaf': 77, 'criterion': 'entropy'}.
Trial 8136 finished with value: 0.717391304347826 and parameters: {'n_estimators': 301, 'max_depth': 8, 'min_samples_split': 143, 'min_samples_leaf': 64, 'criterion': 'gini'}.
Trial 8137 finished with value: 0.6739130434782609 and parameters: {'n_estimators': 238, 'max_depth': 18, 'min_samples_split': 10, 'min_samples_leaf': 58, 'criterion': 'entropy'}.
Trial 8138 finished with value: 0.6739130434782609 and parameters: {'n_estimators': 292, 'max_depth': 15, 'min_samples_split': 35, 'min_samples_leaf': 67, 'criterion': 'gini'}.
Trial 8139 finished with value: 0.717391304347826 and parameters: {'n_estimators': 773, 'max_depth': 11, 'min_samples_split': 69, 'min_samples_leaf': 61, 'criterion': 'entropy'}.
Trial 8140 finished with value: 0.6956521739130435 and parameters: {'n_estimators': 598, 'max_depth': 6, 'min_samples_split': 139, 'min_samples_leaf': 71, 'criterion': 'gini'}.
Trial 8141 finished with value: 0.717391304347826 and parameters: {'n_estimators': 261, 'max_depth': 9, 'min_samples_split': 24, 'min_samples_leaf': 56, 'criterion': 'entropy'}.
Trial 8142 finished with value: 0.717391304347826 and parameters: {'n_estimators': 969, 'max_depth': 13, 'min_samples_split': 28, 'min_samples_leaf': 59, 'criterion': 'gini'}.
Trial 8143 finished with value: 0.7065217391304348 and parameters: {'n_estimators': 724, 'max_depth': 11, 'min_samples_split': 126, 'min_samples_leaf': 30, 'criterion': 'entropy'}.
Trial 8144 finished with value: 0.6956521739130435 and parameters: {'n_estimators': 320, 'max_depth': 9, 'min_samples_split': 117, 'min_samples_leaf': 63, 'criterion': 'entropy'}.
Trial 8145 finished with value: 0.6956521739130435 and parameters: {'n_estimators': 278, 'max_depth': 16, 'min_samples_split': 135, 'min_samples_leaf': 81, 'criterion': 'gini'}.
Trial 8146 finished with value: 0.6413043478260869 and parameters: {'n_estimators': 753, 'max_depth': 5, 'min_samples_split': 41, 'min_samples_leaf': 55, 'criterion': 'entropy'}.
Trial 8147 finished with value: 0.717391304347826 and parameters: {'n_estimators': 792, 'max_depth': 12, 'min_samples_split': 36, 'min_samples_leaf': 49, 'criterion': 'gini'}.
Trial 8148 finished with value: 0.717391304347826 and parameters: {'n_estimators': 310, 'max_depth': 8, 'min_samples_split': 80, 'min_samples_leaf': 61, 'criterion': 'entropy'}.
Trial 8149 finished with value: 0.6739130434782609 and parameters: {'n_estimators': 265, 'max_depth': 14, 'min_samples_split': 30, 'min_samples_leaf': 73, 'criterion': 'gini'}.
Trial 8150 finished with value: 0.717391304347826 and parameters: {'n_estimators': 928, 'max_depth': 10, 'min_samples_split': 52, 'min_samples_leaf': 57, 'criterion': 'entropy'}.
Trial 8151 finished with value: 0.6630434782608695 and parameters: {'n_estimators': 237, 'max_depth': 63, 'min_samples_split': 22, 'min_samples_leaf': 53, 'criterion': 'gini'}.
Trial 8152 finished with value: 0.717391304347826 and parameters: {'n_estimators': 300, 'max_depth': 11, 'min_samples_split': 129, 'min_samples_leaf': 66, 'criterion': 'entropy'}.
Trial 8153 finished with value: 0.6956521739130435 and parameters: {'n_estimators': 280, 'max_depth': 7, 'min_samples_split': 17, 'min_samples_leaf': 59, 'criterion': 'entropy'}.
Trial 8154 finished with value: 0.6956521739130435 and parameters: {'n_estimators': 253, 'max_depth': 13, 'min_samples_split': 149, 'min_samples_leaf': 57, 'criterion': 'gini'}.
Trial 8155 finished with value: 0.6956521739130435 and parameters: {'n_estimators': 689, 'max_depth': 9, 'min_samples_split': 26, 'min_samples_leaf': 62, 'criterion': 'entropy'}.
Trial 8156 finished with value: 0.7065217391304348 and parameters: {'n_estimators': 333, 'max_depth': 7, 'min_samples_split': 43, 'min_samples_leaf': 70, 'criterion': 'gini'}.
Trial 8157 finished with value: 0.6847826086956522 and parameters: {'n_estimators': 214, 'max_depth': 15, 'min_samples_split': 32, 'min_samples_leaf': 75, 'criterion': 'entropy'}.
Trial 8158 finished with value: 0.717391304347826 and parameters: {'n_estimators': 364, 'max_depth': 11, 'min_samples_split': 36, 'min_samples_leaf': 60, 'criterion': 'gini'}.
Trial 8159 finished with value: 0.7065217391304348 and parameters: {'n_estimators': 291, 'max_depth': 9, 'min_samples_split': 143, 'min_samples_leaf': 55, 'criterion': 'entropy'}.
Trial 8160 finished with value: 0.7065217391304348 and parameters: {'n_estimators': 737, 'max_depth': 13, 'min_samples_split': 30, 'min_samples_leaf': 58, 'criterion': 'gini'}.
Trial 8161 finished with value: 0.6739130434782609 and parameters: {'n_estimators': 187, 'max_depth': 6, 'min_samples_split': 48, 'min_samples_leaf': 63, 'criterion': 'entropy'}.
Trial 8162 finished with value: 0.7282608695652174 and parameters: {'n_estimators': 765, 'max_depth': 10, 'min_samples_split': 39, 'min_samples_leaf': 52, 'criterion': 'entropy'}.
Trial 8163 finished with value: 0.717391304347826 and parameters: {'n_estimators': 262, 'max_depth': 12, 'min_samples_split': 139, 'min_samples_leaf': 65, 'criterion': 'gini'}.
Trial 8164 finished with value: 0.6847826086956522 and parameters: {'n_estimators': 311, 'max_depth': 17, 'min_samples_split': 23, 'min_samples_leaf': 60, 'criterion': 'entropy'}.
Trial 8165 finished with value: 0.717391304347826 and parameters: {'n_estimators': 270, 'max_depth': 8, 'min_samples_split': 133, 'min_samples_leaf': 79, 'criterion': 'gini'}.
Trial 8166 finished with value: 0.6956521739130435 and parameters: {'n_estimators': 827, 'max_depth': 14, 'min_samples_split': 34, 'min_samples_leaf': 68, 'criterion': 'entropy'}.
