Trial 8779 finished with value: 0.7282608695652174 and parameters: {'n_estimators': 329, 'max_depth': 9, 'min_samples_split': 21, 'min_samples_leaf': 57, 'criterion': 'entropy'}.
Trial 8780 finished with value: 0.717391304347826 and parameters: {'n_estimators': 791, 'max_depth': 11, 'min_samples_split': 32, 'min_samples_leaf': 59, 'criterion': 'entropy'}.
Trial 8781 finished with value: 0.6521739130434783 and parameters: {'n_estimators': 379, 'max_depth': 17, 'min_samples_split': 36, 'min_samples_leaf': 24, 'criterion': 'entropy'}.
Trial 8782 finished with value: 0.6847826086956522 and parameters: {'n_estimators': 283, 'max_depth': 6, 'min_samples_split': 28, 'min_samples_leaf': 63, 'criterion': 'entropy'}.
Trial 8783 finished with value: 0.6630434782608695 and parameters: {'n_estimators': 253, 'max_depth': 21, 'min_samples_split': 42, 'min_samples_leaf': 55, 'criterion': 'entropy'}.
Trial 8784 finished with value: 0.6630434782608695 and parameters: {'n_estimators': 736, 'max_depth': 9, 'min_samples_split': 121, 'min_samples_leaf': 16, 'criterion': 'entropy'}.
Trial 8785 finished with value: 0.7065217391304348 and parameters: {'n_estimators': 298, 'max_depth': 14, 'min_samples_split': 32, 'min_samples_leaf': 61, 'criterion': 'entropy'}.
Trial 8786 finished with value: 0.7282608695652174 and parameters: {'n_estimators': 276, 'max_depth': 11, 'min_samples_split': 96, 'min_samples_leaf': 58, 'criterion': 'entropy'}.
Trial 8787 finished with value: 0.6739130434782609 and parameters: {'n_estimators': 820, 'max_depth': 7, 'min_samples_split': 46, 'min_samples_leaf': 51, 'criterion': 'entropy'}.
Trial 8788 finished with value: 0.7065217391304348 and parameters: {'n_estimators': 857, 'max_depth': 12, 'min_samples_split': 38, 'min_samples_leaf': 57, 'criterion': 'entropy'}.
Trial 8789 finished with value: 0.6956521739130435 and parameters: {'n_estimators': 190, 'max_depth': 9, 'min_samples_split': 26, 'min_samples_leaf': 64, 'criterion': 'entropy'}.
Trial 8790 finished with value: 0.6630434782608695 and parameters: {'n_estimators': 770, 'max_depth': 16, 'min_samples_split': 21, 'min_samples_leaf': 54, 'criterion': 'entropy'}.
Trial 8791 finished with value: 0.6630434782608695 and parameters: {'n_estimators': 900, 'max_depth': 46, 'min_samples_split': 31, 'min_samples_leaf': 60, 'criterion': 'entropy'}.
Trial 8792 finished with value: 0.6304347826086957 and parameters: {'n_estimators': 314, 'max_depth': 5, 'min_samples_split': 34, 'min_samples_leaf': 62, 'criterion': 'entropy'}.
Trial 8793 finished with value: 0.7065217391304348 and parameters: {'n_estimators': 258, 'max_depth': 13, 'min_samples_split': 38, 'min_samples_leaf': 58, 'criterion': 'entropy'}.
Trial 8794 finished with value: 0.7065217391304348 and parameters: {'n_estimators': 236, 'max_depth': 10, 'min_samples_split': 108, 'min_samples_leaf': 49, 'criterion': 'entropy'}.
Trial 8795 finished with value: 0.6521739130434783 and parameters: {'n_estimators': 291, 'max_depth': 32, 'min_samples_split': 28, 'min_samples_leaf': 56, 'criterion': 'entropy'}.
Trial 8796 finished with value: 0.717391304347826 and parameters: {'n_estimators': 951, 'max_depth': 8, 'min_samples_split': 49, 'min_samples_leaf': 59, 'criterion': 'entropy'}.
Trial 8797 finished with value: 0.7065217391304348 and parameters: {'n_estimators': 270, 'max_depth': 11, 'min_samples_split': 18, 'min_samples_leaf': 55, 'criterion': 'entropy'}.
Trial 8798 finished with value: 0.6847826086956522 and parameters: {'n_estimators': 216, 'max_depth': 15, 'min_samples_split': 35, 'min_samples_leaf': 52, 'criterion': 'entropy'}.
Trial 8799 finished with value: 0.7065217391304348 and parameters: {'n_estimators': 751, 'max_depth': 7, 'min_samples_split': 12, 'min_samples_leaf': 61, 'criterion': 'entropy'}.
Trial 8800 finished with value: 0.6956521739130435 and parameters: {'n_estimators': 504, 'max_depth': 13, 'min_samples_split': 41, 'min_samples_leaf': 64, 'criterion': 'entropy'}.
Trial 8801 finished with value: 0.717391304347826 and parameters: {'n_estimators': 725, 'max_depth': 10, 'min_samples_split': 30, 'min_samples_leaf': 58, 'criterion': 'entropy'}.
Trial 8802 finished with value: 0.717391304347826 and parameters: {'n_estimators': 334, 'max_depth': 8, 'min_samples_split': 54, 'min_samples_leaf': 54, 'criterion': 'entropy'}.
Trial 8803 finished with value: 0.6847826086956522 and parameters: {'n_estimators': 806, 'max_depth': 12, 'min_samples_split': 23, 'min_samples_leaf': 60, 'criterion': 'entropy'}.
Trial 8804 finished with value: 0.7391304347826086 and parameters: {'n_estimators': 301, 'max_depth': 9, 'min_samples_split': 24, 'min_samples_leaf': 56, 'criterion': 'entropy'}.
Trial 8805 finished with value: 0.6956521739130435 and parameters: {'n_estimators': 284, 'max_depth': 14, 'min_samples_split': 34, 'min_samples_leaf': 62, 'criterion': 'entropy'}.
Trial 8806 finished with value: 0.6413043478260869 and parameters: {'n_estimators': 266, 'max_depth': 5, 'min_samples_split': 39, 'min_samples_leaf': 58, 'criterion': 'entropy'}.
Trial 8807 finished with value: 0.7282608695652174 and parameters: {'n_estimators': 245, 'max_depth': 11, 'min_samples_split': 122, 'min_samples_leaf': 56, 'criterion': 'entropy'}.
Trial 8808 finished with value: 0.6739130434782609 and parameters: {'n_estimators': 320, 'max_depth': 18, 'min_samples_split': 44, 'min_samples_leaf': 60, 'criterion': 'entropy'}.
Trial 8809 finished with value: 0.6630434782608695 and parameters: {'n_estimators': 305, 'max_depth': 7, 'min_samples_split': 29, 'min_samples_leaf': 53, 'criterion': 'entropy'}.
Trial 8810 finished with value: 0.7282608695652174 and parameters: {'n_estimators': 136, 'max_depth': 10, 'min_samples_split': 36, 'min_samples_leaf': 58, 'criterion': 'entropy'}.
Trial 8811 finished with value: 0.6956521739130435 and parameters: {'n_estimators': 535, 'max_depth': 15, 'min_samples_split': 26, 'min_samples_leaf': 64, 'criterion': 'entropy'}.
Trial 8812 finished with value: 0.6847826086956522 and parameters: {'n_estimators': 773, 'max_depth': 12, 'min_samples_split': 19, 'min_samples_leaf': 61, 'criterion': 'entropy'}.
Trial 8813 finished with value: 0.7282608695652174 and parameters: {'n_estimators': 256, 'max_depth': 8, 'min_samples_split': 31, 'min_samples_leaf': 56, 'criterion': 'entropy'}.
Trial 8814 finished with value: 0.717391304347826 and parameters: {'n_estimators': 356, 'max_depth': 10, 'min_samples_split': 116, 'min_samples_leaf': 59, 'criterion': 'entropy'}.
Trial 8815 finished with value: 0.6956521739130435 and parameters: {'n_estimators': 284, 'max_depth': 12, 'min_samples_split': 40, 'min_samples_leaf': 62, 'criterion': 'entropy'}.
Trial 8816 finished with value: 0.7065217391304348 and parameters: {'n_estimators': 273, 'max_depth': 14, 'min_samples_split': 34, 'min_samples_leaf': 54, 'criterion': 'entropy'}.
Trial 8817 finished with value: 0.6956521739130435 and parameters: {'n_estimators': 706, 'max_depth': 7, 'min_samples_split': 29, 'min_samples_leaf': 57, 'criterion': 'entropy'}.
Trial 8818 finished with value: 0.7065217391304348 and parameters: {'n_estimators': 232, 'max_depth': 9, 'min_samples_split': 23, 'min_samples_leaf': 59, 'criterion': 'entropy'}.
Trial 8819 finished with value: 0.717391304347826 and parameters: {'n_estimators': 302, 'max_depth': 11, 'min_samples_split': 48, 'min_samples_leaf': 51, 'criterion': 'entropy'}.
Trial 8820 finished with value: 0.6739130434782609 and parameters: {'n_estimators': 753, 'max_depth': 16, 'min_samples_split': 37, 'min_samples_leaf': 64, 'criterion': 'entropy'}.
Trial 8821 finished with value: 0.7065217391304348 and parameters: {'n_estimators': 679, 'max_depth': 13, 'min_samples_split': 111, 'min_samples_leaf': 55, 'criterion': 'entropy'}.
Trial 8822 finished with value: 0.6521739130434783 and parameters: {'n_estimators': 790, 'max_depth': 5, 'min_samples_split': 43, 'min_samples_leaf': 61, 'criterion': 'entropy'}.
Trial 8823 finished with value: 0.7282608695652174 and parameters: {'n_estimators': 392, 'max_depth': 9, 'min_samples_split': 26, 'min_samples_leaf': 57, 'criterion': 'entropy'}.
Trial 8824 finished with value: 0.7065217391304348 and parameters: {'n_estimators': 323, 'max_depth': 7, 'min_samples_split': 32, 'min_samples_leaf': 59, 'criterion': 'entropy'}.
Trial 8825 finished with value: 0.7282608695652174 and parameters: {'n_estimators': 260, 'max_depth': 11, 'min_samples_split': 40, 'min_samples_leaf': 53, 'criterion': 'entropy'}.
Trial 8826 finished with value: 0.6956521739130435 and parameters: {'n_estimators': 287, 'max_depth': 54, 'min_samples_split': 78, 'min_samples_leaf': 62, 'criterion': 'entropy'}.
Trial 8827 finished with value: 0.7065217391304348 and parameters: {'n_estimators': 734, 'max_depth': 13, 'min_samples_split': 9, 'min_samples_leaf': 57, 'criterion': 'entropy'}.
Trial 8828 finished with value: 0.717391304347826 and parameters: {'n_estimators': 984, 'max_depth': 9, 'min_samples_split': 21, 'min_samples_leaf': 55, 'criterion': 'entropy'}.
Trial 8829 finished with value: 0.6847826086956522 and parameters: {'n_estimators': 220, 'max_depth': 17, 'min_samples_split': 34, 'min_samples_leaf': 60, 'criterion': 'entropy'}.
Trial 8830 finished with value: 0.6304347826086957 and parameters: {'n_estimators': 253, 'max_depth': 11, 'min_samples_split': 16, 'min_samples_leaf': 9, 'criterion': 'entropy'}.
Trial 8831 finished with value: 0.7065217391304348 and parameters: {'n_estimators': 279, 'max_depth': 7, 'min_samples_split': 118, 'min_samples_leaf': 58, 'criterion': 'entropy'}.
Trial 8832 finished with value: 0.6847826086956522 and parameters: {'n_estimators': 303, 'max_depth': 14, 'min_samples_split': 123, 'min_samples_leaf': 63, 'criterion': 'entropy'}.
Trial 8833 finished with value: 0.7282608695652174 and parameters: {'n_estimators': 242, 'max_depth': 9, 'min_samples_split': 28, 'min_samples_leaf': 56, 'criterion': 'entropy'}.
Trial 8834 finished with value: 0.6739130434782609 and parameters: {'n_estimators': 882, 'max_depth': 20, 'min_samples_split': 37, 'min_samples_leaf': 53, 'criterion': 'entropy'}.
Trial 8835 finished with value: 0.7065217391304348 and parameters: {'n_estimators': 337, 'max_depth': 12, 'min_samples_split': 45, 'min_samples_leaf': 60, 'criterion': 'entropy'}.
Trial 8836 finished with value: 0.717391304347826 and parameters: {'n_estimators': 771, 'max_depth': 10, 'min_samples_split': 106, 'min_samples_leaf': 50, 'criterion': 'gini'}.
Trial 8837 finished with value: 0.6847826086956522 and parameters: {'n_estimators': 291, 'max_depth': 6, 'min_samples_split': 33, 'min_samples_leaf': 65, 'criterion': 'entropy'}.
Trial 8838 finished with value: 0.6739130434782609 and parameters: {'n_estimators': 315, 'max_depth': 15, 'min_samples_split': 26, 'min_samples_leaf': 58, 'criterion': 'gini'}.
Trial 8839 finished with value: 0.717391304347826 and parameters: {'n_estimators': 832, 'max_depth': 8, 'min_samples_split': 31, 'min_samples_leaf': 62, 'criterion': 'entropy'}.
Trial 8840 finished with value: 0.7065217391304348 and parameters: {'n_estimators': 270, 'max_depth': 12, 'min_samples_split': 14, 'min_samples_leaf': 55, 'criterion': 'gini'}.
Trial 8841 finished with value: 0.6956521739130435 and parameters: {'n_estimators': 809, 'max_depth': 10, 'min_samples_split': 40, 'min_samples_leaf': 59, 'criterion': 'entropy'}.
Trial 8842 finished with value: 0.6413043478260869 and parameters: {'n_estimators': 263, 'max_depth': 5, 'min_samples_split': 30, 'min_samples_leaf': 57, 'criterion': 'entropy'}.
Trial 8843 finished with value: 0.6847826086956522 and parameters: {'n_estimators': 461, 'max_depth': 13, 'min_samples_split': 37, 'min_samples_leaf': 61, 'criterion': 'gini'}.
Trial 8844 finished with value: 0.7065217391304348 and parameters: {'n_estimators': 753, 'max_depth': 8, 'min_samples_split': 20, 'min_samples_leaf': 53, 'criterion': 'entropy'}.
Trial 8845 finished with value: 0.7065217391304348 and parameters: {'n_estimators': 280, 'max_depth': 11, 'min_samples_split': 26, 'min_samples_leaf': 64, 'criterion': 'gini'}.
Trial 8846 finished with value: 0.6413043478260869 and parameters: {'n_estimators': 207, 'max_depth': 51, 'min_samples_split': 35, 'min_samples_leaf': 56, 'criterion': 'entropy'}.
Trial 8847 finished with value: 0.6630434782608695 and parameters: {'n_estimators': 730, 'max_depth': 15, 'min_samples_split': 44, 'min_samples_leaf': 59, 'criterion': 'entropy'}.
Trial 8848 finished with value: 0.6847826086956522 and parameters: {'n_estimators': 303, 'max_depth': 69, 'min_samples_split': 170, 'min_samples_leaf': 61, 'criterion': 'gini'}.
Trial 8849 finished with value: 0.717391304347826 and parameters: {'n_estimators': 785, 'max_depth': 9, 'min_samples_split': 25, 'min_samples_leaf': 55, 'criterion': 'entropy'}.
Trial 8850 finished with value: 0.6847826086956522 and parameters: {'n_estimators': 246, 'max_depth': 13, 'min_samples_split': 40, 'min_samples_leaf': 52, 'criterion': 'gini'}.
Trial 8851 finished with value: 0.6847826086956522 and parameters: {'n_estimators': 291, 'max_depth': 7, 'min_samples_split': 52, 'min_samples_leaf': 57, 'criterion': 'entropy'}.
Trial 8852 finished with value: 0.6739130434782609 and parameters: {'n_estimators': 345, 'max_depth': 17, 'min_samples_split': 30, 'min_samples_leaf': 60, 'criterion': 'entropy'}.
Trial 8853 finished with value: 0.7065217391304348 and parameters: {'n_estimators': 316, 'max_depth': 10, 'min_samples_split': 36, 'min_samples_leaf': 63, 'criterion': 'gini'}.
Trial 8854 finished with value: 0.717391304347826 and parameters: {'n_estimators': 598, 'max_depth': 11, 'min_samples_split': 22, 'min_samples_leaf': 58, 'criterion': 'entropy'}.
Trial 8855 finished with value: 0.717391304347826 and parameters: {'n_estimators': 170, 'max_depth': 8, 'min_samples_split': 123, 'min_samples_leaf': 54, 'criterion': 'gini'}.
Trial 8856 finished with value: 0.6956521739130435 and parameters: {'n_estimators': 274, 'max_depth': 14, 'min_samples_split': 32, 'min_samples_leaf': 65, 'criterion': 'entropy'}.
Trial 8857 finished with value: 0.6847826086956522 and parameters: {'n_estimators': 238, 'max_depth': 6, 'min_samples_split': 28, 'min_samples_leaf': 59, 'criterion': 'gini'}.
Trial 8858 finished with value: 0.717391304347826 and parameters: {'n_estimators': 759, 'max_depth': 11, 'min_samples_split': 48, 'min_samples_leaf': 56, 'criterion': 'entropy'}.
Trial 8859 finished with value: 0.7065217391304348 and parameters: {'n_estimators': 258, 'max_depth': 9, 'min_samples_split': 18, 'min_samples_leaf': 49, 'criterion': 'entropy'}.
Trial 8860 finished with value: 0.6956521739130435 and parameters: {'n_estimators': 293, 'max_depth': 13, 'min_samples_split': 41, 'min_samples_leaf': 61, 'criterion': 'gini'}.
Trial 8861 finished with value: 0.6739130434782609 and parameters: {'n_estimators': 326, 'max_depth': 7, 'min_samples_split': 68, 'min_samples_leaf': 57, 'criterion': 'entropy'}.
Trial 8862 finished with value: 0.717391304347826 and parameters: {'n_estimators': 932, 'max_depth': 12, 'min_samples_split': 114, 'min_samples_leaf': 54, 'criterion': 'gini'}.
Trial 8863 finished with value: 0.6956521739130435 and parameters: {'n_estimators': 741, 'max_depth': 16, 'min_samples_split': 35, 'min_samples_leaf': 62, 'criterion': 'entropy'}.
Trial 8864 finished with value: 0.717391304347826 and parameters: {'n_estimators': 224, 'max_depth': 10, 'min_samples_split': 23, 'min_samples_leaf': 58, 'criterion': 'entropy'}.
Trial 8865 finished with value: 0.6521739130434783 and parameters: {'n_estimators': 270, 'max_depth': 5, 'min_samples_split': 32, 'min_samples_leaf': 52, 'criterion': 'gini'}.
Trial 8866 finished with value: 0.6956521739130435 and parameters: {'n_estimators': 713, 'max_depth': 9, 'min_samples_split': 38, 'min_samples_leaf': 80, 'criterion': 'entropy'}.
Trial 8867 finished with value: 0.6739130434782609 and parameters: {'n_estimators': 641, 'max_depth': 14, 'min_samples_split': 29, 'min_samples_leaf': 60, 'criterion': 'gini'}.
Trial 8868 finished with value: 0.7282608695652174 and parameters: {'n_estimators': 306, 'max_depth': 11, 'min_samples_split': 25, 'min_samples_leaf': 55, 'criterion': 'entropy'}.
Trial 8869 finished with value: 0.7065217391304348 and parameters: {'n_estimators': 799, 'max_depth': 8, 'min_samples_split': 90, 'min_samples_leaf': 63, 'criterion': 'entropy'}.
Trial 8870 finished with value: 0.7065217391304348 and parameters: {'n_estimators': 363, 'max_depth': 12, 'min_samples_split': 43, 'min_samples_leaf': 59, 'criterion': 'gini'}.
Trial 8871 finished with value: 0.6847826086956522 and parameters: {'n_estimators': 281, 'max_depth': 7, 'min_samples_split': 118, 'min_samples_leaf': 56, 'criterion': 'entropy'}.
Trial 8872 finished with value: 0.6739130434782609 and parameters: {'n_estimators': 253, 'max_depth': 62, 'min_samples_split': 34, 'min_samples_leaf': 57, 'criterion': 'gini'}.
Trial 8873 finished with value: 0.6956521739130435 and parameters: {'n_estimators': 296, 'max_depth': 15, 'min_samples_split': 17, 'min_samples_leaf': 60, 'criterion': 'entropy'}.
Trial 8874 finished with value: 0.6847826086956522 and parameters: {'n_estimators': 769, 'max_depth': 10, 'min_samples_split': 38, 'min_samples_leaf': 90, 'criterion': 'gini'}.
Trial 8875 finished with value: 0.6956521739130435 and parameters: {'n_estimators': 333, 'max_depth': 13, 'min_samples_split': 29, 'min_samples_leaf': 62, 'criterion': 'entropy'}.
Trial 8876 finished with value: 0.6630434782608695 and parameters: {'n_estimators': 264, 'max_depth': 19, 'min_samples_split': 12, 'min_samples_leaf': 65, 'criterion': 'entropy'}.
Trial 8877 finished with value: 0.6630434782608695 and parameters: {'n_estimators': 119, 'max_depth': 34, 'min_samples_split': 23, 'min_samples_leaf': 54, 'criterion': 'gini'}.
Trial 8878 finished with value: 0.7065217391304348 and parameters: {'n_estimators': 234, 'max_depth': 9, 'min_samples_split': 105, 'min_samples_leaf': 59, 'criterion': 'entropy'}.
Trial 8879 finished with value: 0.7065217391304348 and parameters: {'n_estimators': 288, 'max_depth': 11, 'min_samples_split': 33, 'min_samples_leaf': 57, 'criterion': 'gini'}.
Trial 8880 finished with value: 0.6630434782608695 and parameters: {'n_estimators': 312, 'max_depth': 7, 'min_samples_split': 46, 'min_samples_leaf': 52, 'criterion': 'entropy'}.
Trial 8881 finished with value: 0.6304347826086957 and parameters: {'n_estimators': 188, 'max_depth': 5, 'min_samples_split': 27, 'min_samples_leaf': 61, 'criterion': 'entropy'}.
Trial 8882 finished with value: 0.6956521739130435 and parameters: {'n_estimators': 248, 'max_depth': 13, 'min_samples_split': 41, 'min_samples_leaf': 58, 'criterion': 'gini'}.
Trial 8883 finished with value: 0.6413043478260869 and parameters: {'n_estimators': 737, 'max_depth': 9, 'min_samples_split': 164, 'min_samples_leaf': 5, 'criterion': 'entropy'}.
Trial 8884 finished with value: 0.6847826086956522 and parameters: {'n_estimators': 279, 'max_depth': 16, 'min_samples_split': 124, 'min_samples_leaf': 55, 'criterion': 'gini'}.
Trial 8885 finished with value: 0.717391304347826 and parameters: {'n_estimators': 868, 'max_depth': 10, 'min_samples_split': 36, 'min_samples_leaf': 64, 'criterion': 'entropy'}.
Trial 8886 finished with value: 0.6956521739130435 and parameters: {'n_estimators': 787, 'max_depth': 12, 'min_samples_split': 20, 'min_samples_leaf': 59, 'criterion': 'entropy'}.
Trial 8887 finished with value: 0.6630434782608695 and parameters: {'n_estimators': 316, 'max_depth': 8, 'min_samples_split': 29, 'min_samples_leaf': 50, 'criterion': 'gini'}.
Trial 8888 finished with value: 0.6847826086956522 and parameters: {'n_estimators': 266, 'max_depth': 14, 'min_samples_split': 56, 'min_samples_leaf': 56, 'criterion': 'entropy'}.
Trial 8889 finished with value: 0.6956521739130435 and parameters: {'n_estimators': 692, 'max_depth': 26, 'min_samples_split': 33, 'min_samples_leaf': 62, 'criterion': 'gini'}.
Trial 8890 finished with value: 0.717391304347826 and parameters: {'n_estimators': 756, 'max_depth': 11, 'min_samples_split': 39, 'min_samples_leaf': 60, 'criterion': 'entropy'}.
Trial 8891 finished with value: 0.6739130434782609 and parameters: {'n_estimators': 293, 'max_depth': 7, 'min_samples_split': 73, 'min_samples_leaf': 54, 'criterion': 'entropy'}.
Trial 8892 finished with value: 0.6195652173913043 and parameters: {'n_estimators': 215, 'max_depth': 9, 'min_samples_split': 24, 'min_samples_leaf': 1, 'criterion': 'gini'}.
Trial 8893 finished with value: 0.717391304347826 and parameters: {'n_estimators': 348, 'max_depth': 12, 'min_samples_split': 43, 'min_samples_leaf': 58, 'criterion': 'entropy'}.
Trial 8894 finished with value: 0.6847826086956522 and parameters: {'n_estimators': 259, 'max_depth': 17, 'min_samples_split': 62, 'min_samples_leaf': 57, 'criterion': 'gini'}.
Trial 8895 finished with value: 0.6956521739130435 and parameters: {'n_estimators': 846, 'max_depth': 15, 'min_samples_split': 33, 'min_samples_leaf': 52, 'criterion': 'entropy'}.
Trial 8896 finished with value: 0.6739130434782609 and parameters: {'n_estimators': 145, 'max_depth': 6, 'min_samples_split': 30, 'min_samples_leaf': 63, 'criterion': 'gini'}.
Trial 8897 finished with value: 0.6956521739130435 and parameters: {'n_estimators': 722, 'max_depth': 10, 'min_samples_split': 113, 'min_samples_leaf': 60, 'criterion': 'entropy'}.
Trial 8898 finished with value: 0.717391304347826 and parameters: {'n_estimators': 280, 'max_depth': 8, 'min_samples_split': 101, 'min_samples_leaf': 65, 'criterion': 'entropy'}.
Trial 8899 finished with value: 0.7282608695652174 and parameters: {'n_estimators': 308, 'max_depth': 12, 'min_samples_split': 119, 'min_samples_leaf': 56, 'criterion': 'gini'}.
Trial 8900 finished with value: 0.6956521739130435 and parameters: {'n_estimators': 776, 'max_depth': 14, 'min_samples_split': 39, 'min_samples_leaf': 61, 'criterion': 'entropy'}.
