Trial 1290 finished with value: 0.6956521739130435 and parameters: {'n_estimators': 552, 'max_depth': 11, 'min_samples_split': 29, 'min_samples_leaf': 53, 'criterion': 'gini'}.
Trial 1291 finished with value: 0.6956521739130435 and parameters: {'n_estimators': 820, 'max_depth': 9, 'min_samples_split': 34, 'min_samples_leaf': 51, 'criterion': 'entropy'}.
Trial 1292 finished with value: 0.717391304347826 and parameters: {'n_estimators': 862, 'max_depth': 12, 'min_samples_split': 13, 'min_samples_leaf': 47, 'criterion': 'entropy'}.
Trial 1293 finished with value: 0.6956521739130435 and parameters: {'n_estimators': 803, 'max_depth': 15, 'min_samples_split': 21, 'min_samples_leaf': 49, 'criterion': 'entropy'}.
Trial 1294 finished with value: 0.7065217391304348 and parameters: {'n_estimators': 900, 'max_depth': 8, 'min_samples_split': 56, 'min_samples_leaf': 55, 'criterion': 'entropy'}.
Trial 1295 finished with value: 0.717391304347826 and parameters: {'n_estimators': 830, 'max_depth': 11, 'min_samples_split': 44, 'min_samples_leaf': 58, 'criterion': 'entropy'}.
Trial 1296 finished with value: 0.6630434782608695 and parameters: {'n_estimators': 774, 'max_depth': 6, 'min_samples_split': 27, 'min_samples_leaf': 45, 'criterion': 'entropy'}.
Trial 1297 finished with value: 0.6739130434782609 and parameters: {'n_estimators': 847, 'max_depth': 9, 'min_samples_split': 38, 'min_samples_leaf': 52, 'criterion': 'entropy'}.
Trial 1298 finished with value: 0.6847826086956522 and parameters: {'n_estimators': 519, 'max_depth': 13, 'min_samples_split': 31, 'min_samples_leaf': 49, 'criterion': 'entropy'}.
Trial 1299 finished with value: 0.6521739130434783 and parameters: {'n_estimators': 731, 'max_depth': 39, 'min_samples_split': 110, 'min_samples_leaf': 54, 'criterion': 'entropy'}.
Trial 1300 finished with value: 0.6847826086956522 and parameters: {'n_estimators': 971, 'max_depth': 23, 'min_samples_split': 25, 'min_samples_leaf': 51, 'criterion': 'entropy'}.
Trial 1301 finished with value: 0.7282608695652174 and parameters: {'n_estimators': 455, 'max_depth': 10, 'min_samples_split': 36, 'min_samples_leaf': 61, 'criterion': 'entropy'}.
Trial 1302 finished with value: 0.6413043478260869 and parameters: {'n_estimators': 349, 'max_depth': 5, 'min_samples_split': 29, 'min_samples_leaf': 56, 'criterion': 'entropy'}.
Trial 1303 finished with value: 0.6739130434782609 and parameters: {'n_estimators': 796, 'max_depth': 7, 'min_samples_split': 17, 'min_samples_leaf': 47, 'criterion': 'entropy'}.
Trial 1304 finished with value: 0.717391304347826 and parameters: {'n_estimators': 817, 'max_depth': 13, 'min_samples_split': 41, 'min_samples_leaf': 53, 'criterion': 'entropy'}.
Trial 1305 finished with value: 0.7282608695652174 and parameters: {'n_estimators': 878, 'max_depth': 10, 'min_samples_split': 33, 'min_samples_leaf': 50, 'criterion': 'entropy'}.
Trial 1306 finished with value: 0.6956521739130435 and parameters: {'n_estimators': 758, 'max_depth': 15, 'min_samples_split': 21, 'min_samples_leaf': 58, 'criterion': 'entropy'}.
Trial 1307 finished with value: 0.6847826086956522 and parameters: {'n_estimators': 792, 'max_depth': 18, 'min_samples_split': 70, 'min_samples_leaf': 44, 'criterion': 'entropy'}.
Trial 1308 finished with value: 0.7065217391304348 and parameters: {'n_estimators': 662, 'max_depth': 8, 'min_samples_split': 48, 'min_samples_leaf': 73, 'criterion': 'entropy'}.
Trial 1309 finished with value: 0.6956521739130435 and parameters: {'n_estimators': 827, 'max_depth': 59, 'min_samples_split': 25, 'min_samples_leaf': 48, 'criterion': 'gini'}.
Trial 1310 finished with value: 0.717391304347826 and parameters: {'n_estimators': 780, 'max_depth': 12, 'min_samples_split': 30, 'min_samples_leaf': 52, 'criterion': 'entropy'}.
Trial 1311 finished with value: 0.7065217391304348 and parameters: {'n_estimators': 851, 'max_depth': 10, 'min_samples_split': 36, 'min_samples_leaf': 55, 'criterion': 'entropy'}.
Trial 1312 finished with value: 0.7065217391304348 and parameters: {'n_estimators': 814, 'max_depth': 12, 'min_samples_split': 97, 'min_samples_leaf': 50, 'criterion': 'entropy'}.
Trial 1313 finished with value: 0.6739130434782609 and parameters: {'n_estimators': 615, 'max_depth': 88, 'min_samples_split': 40, 'min_samples_leaf': 53, 'criterion': 'entropy'}.
Trial 1314 finished with value: 0.717391304347826 and parameters: {'n_estimators': 568, 'max_depth': 8, 'min_samples_split': 105, 'min_samples_leaf': 57, 'criterion': 'entropy'}.
Trial 1315 finished with value: 0.7065217391304348 and parameters: {'n_estimators': 751, 'max_depth': 14, 'min_samples_split': 33, 'min_samples_leaf': 48, 'criterion': 'entropy'}.
Trial 1316 finished with value: 0.6739130434782609 and parameters: {'n_estimators': 837, 'max_depth': 36, 'min_samples_split': 115, 'min_samples_leaf': 46, 'criterion': 'entropy'}.
Trial 1317 finished with value: 0.7065217391304348 and parameters: {'n_estimators': 711, 'max_depth': 10, 'min_samples_split': 28, 'min_samples_leaf': 60, 'criterion': 'entropy'}.
Trial 1318 finished with value: 0.6739130434782609 and parameters: {'n_estimators': 802, 'max_depth': 7, 'min_samples_split': 23, 'min_samples_leaf': 51, 'criterion': 'entropy'}.
Trial 1319 finished with value: 0.7065217391304348 and parameters: {'n_estimators': 537, 'max_depth': 11, 'min_samples_split': 14, 'min_samples_leaf': 54, 'criterion': 'entropy'}.
Trial 1320 finished with value: 0.6847826086956522 and parameters: {'n_estimators': 776, 'max_depth': 16, 'min_samples_split': 36, 'min_samples_leaf': 49, 'criterion': 'entropy'}.
Trial 1321 finished with value: 0.6304347826086957 and parameters: {'n_estimators': 485, 'max_depth': 5, 'min_samples_split': 44, 'min_samples_leaf': 56, 'criterion': 'entropy'}.
Trial 1322 finished with value: 0.6739130434782609 and parameters: {'n_estimators': 813, 'max_depth': 9, 'min_samples_split': 30, 'min_samples_leaf': 52, 'criterion': 'entropy'}.
Trial 1323 finished with value: 0.7065217391304348 and parameters: {'n_estimators': 870, 'max_depth': 13, 'min_samples_split': 19, 'min_samples_leaf': 63, 'criterion': 'entropy'}.
Trial 1324 finished with value: 0.7065217391304348 and parameters: {'n_estimators': 835, 'max_depth': 11, 'min_samples_split': 26, 'min_samples_leaf': 47, 'criterion': 'entropy'}.
Trial 1325 finished with value: 0.6847826086956522 and parameters: {'n_estimators': 788, 'max_depth': 8, 'min_samples_split': 39, 'min_samples_leaf': 51, 'criterion': 'entropy'}.
Trial 1326 finished with value: 0.6630434782608695 and parameters: {'n_estimators': 855, 'max_depth': 27, 'min_samples_split': 33, 'min_samples_leaf': 54, 'criterion': 'entropy'}.
Trial 1327 finished with value: 0.6739130434782609 and parameters: {'n_estimators': 911, 'max_depth': 9, 'min_samples_split': 9, 'min_samples_leaf': 66, 'criterion': 'gini'}.
Trial 1328 finished with value: 0.6956521739130435 and parameters: {'n_estimators': 804, 'max_depth': 12, 'min_samples_split': 27, 'min_samples_leaf': 59, 'criterion': 'entropy'}.
Trial 1329 finished with value: 0.6847826086956522 and parameters: {'n_estimators': 739, 'max_depth': 14, 'min_samples_split': 85, 'min_samples_leaf': 44, 'criterion': 'entropy'}.
Trial 1330 finished with value: 0.6847826086956522 and parameters: {'n_estimators': 770, 'max_depth': 21, 'min_samples_split': 34, 'min_samples_leaf': 49, 'criterion': 'entropy'}.
Trial 1331 finished with value: 0.6956521739130435 and parameters: {'n_estimators': 586, 'max_depth': 7, 'min_samples_split': 22, 'min_samples_leaf': 56, 'criterion': 'entropy'}.
Trial 1332 finished with value: 0.7282608695652174 and parameters: {'n_estimators': 825, 'max_depth': 10, 'min_samples_split': 31, 'min_samples_leaf': 52, 'criterion': 'entropy'}.
Trial 1333 finished with value: 0.7065217391304348 and parameters: {'n_estimators': 789, 'max_depth': 12, 'min_samples_split': 39, 'min_samples_leaf': 47, 'criterion': 'entropy'}.
Trial 1334 finished with value: 0.6739130434782609 and parameters: {'n_estimators': 514, 'max_depth': 7, 'min_samples_split': 102, 'min_samples_leaf': 54, 'criterion': 'entropy'}.
Trial 1335 finished with value: 0.6630434782608695 and parameters: {'n_estimators': 551, 'max_depth': 15, 'min_samples_split': 18, 'min_samples_leaf': 42, 'criterion': 'entropy'}.
Trial 1336 finished with value: 0.6956521739130435 and parameters: {'n_estimators': 764, 'max_depth': 9, 'min_samples_split': 27, 'min_samples_leaf': 50, 'criterion': 'entropy'}.
Trial 1337 finished with value: 0.6413043478260869 and parameters: {'n_estimators': 841, 'max_depth': 5, 'min_samples_split': 36, 'min_samples_leaf': 58, 'criterion': 'entropy'}.
Trial 1338 finished with value: 0.7065217391304348 and parameters: {'n_estimators': 890, 'max_depth': 11, 'min_samples_split': 44, 'min_samples_leaf': 45, 'criterion': 'entropy'}.
Trial 1339 finished with value: 0.717391304347826 and parameters: {'n_estimators': 806, 'max_depth': 13, 'min_samples_split': 22, 'min_samples_leaf': 49, 'criterion': 'entropy'}.
Trial 1340 finished with value: 0.6630434782608695 and parameters: {'n_estimators': 822, 'max_depth': 17, 'min_samples_split': 31, 'min_samples_leaf': 52, 'criterion': 'entropy'}.
Trial 1341 finished with value: 0.7065217391304348 and parameters: {'n_estimators': 860, 'max_depth': 9, 'min_samples_split': 123, 'min_samples_leaf': 55, 'criterion': 'entropy'}.
Trial 1342 finished with value: 0.6847826086956522 and parameters: {'n_estimators': 789, 'max_depth': 11, 'min_samples_split': 109, 'min_samples_leaf': 51, 'criterion': 'entropy'}.
Trial 1343 finished with value: 0.6739130434782609 and parameters: {'n_estimators': 805, 'max_depth': 7, 'min_samples_split': 24, 'min_samples_leaf': 47, 'criterion': 'entropy'}.
Trial 1344 finished with value: 0.6956521739130435 and parameters: {'n_estimators': 753, 'max_depth': 13, 'min_samples_split': 35, 'min_samples_leaf': 61, 'criterion': 'entropy'}.
Trial 1345 finished with value: 0.6847826086956522 and parameters: {'n_estimators': 841, 'max_depth': 9, 'min_samples_split': 28, 'min_samples_leaf': 53, 'criterion': 'entropy'}.
Trial 1346 finished with value: 0.6847826086956522 and parameters: {'n_estimators': 944, 'max_depth': 15, 'min_samples_split': 41, 'min_samples_leaf': 57, 'criterion': 'gini'}.
Trial 1347 finished with value: 0.717391304347826 and parameters: {'n_estimators': 827, 'max_depth': 11, 'min_samples_split': 31, 'min_samples_leaf': 49, 'criterion': 'entropy'}.
Trial 1348 finished with value: 0.6630434782608695 and parameters: {'n_estimators': 779, 'max_depth': 7, 'min_samples_split': 38, 'min_samples_leaf': 51, 'criterion': 'entropy'}.
Trial 1349 finished with value: 0.6630434782608695 and parameters: {'n_estimators': 721, 'max_depth': 94, 'min_samples_split': 18, 'min_samples_leaf': 54, 'criterion': 'entropy'}.
Trial 1350 finished with value: 0.6956521739130435 and parameters: {'n_estimators': 811, 'max_depth': 10, 'min_samples_split': 27, 'min_samples_leaf': 46, 'criterion': 'entropy'}.
Trial 1351 finished with value: 0.6847826086956522 and parameters: {'n_estimators': 570, 'max_depth': 13, 'min_samples_split': 48, 'min_samples_leaf': 49, 'criterion': 'entropy'}.
Trial 1352 finished with value: 0.717391304347826 and parameters: {'n_estimators': 763, 'max_depth': 8, 'min_samples_split': 33, 'min_samples_leaf': 56, 'criterion': 'entropy'}.
Trial 1353 finished with value: 0.6521739130434783 and parameters: {'n_estimators': 848, 'max_depth': 5, 'min_samples_split': 15, 'min_samples_leaf': 59, 'criterion': 'entropy'}.
Trial 1354 finished with value: 0.7065217391304348 and parameters: {'n_estimators': 869, 'max_depth': 10, 'min_samples_split': 22, 'min_samples_leaf': 53, 'criterion': 'entropy'}.
Trial 1355 finished with value: 0.7065217391304348 and parameters: {'n_estimators': 530, 'max_depth': 12, 'min_samples_split': 36, 'min_samples_leaf': 51, 'criterion': 'entropy'}.
Trial 1356 finished with value: 0.6847826086956522 and parameters: {'n_estimators': 797, 'max_depth': 68, 'min_samples_split': 30, 'min_samples_leaf': 49, 'criterion': 'entropy'}.
Trial 1357 finished with value: 0.7065217391304348 and parameters: {'n_estimators': 825, 'max_depth': 15, 'min_samples_split': 98, 'min_samples_leaf': 47, 'criterion': 'entropy'}.
Trial 1358 finished with value: 0.7065217391304348 and parameters: {'n_estimators': 781, 'max_depth': 8, 'min_samples_split': 41, 'min_samples_leaf': 53, 'criterion': 'entropy'}.
Trial 1359 finished with value: 0.6956521739130435 and parameters: {'n_estimators': 696, 'max_depth': 11, 'min_samples_split': 25, 'min_samples_leaf': 55, 'criterion': 'entropy'}.
Trial 1360 finished with value: 0.7065217391304348 and parameters: {'n_estimators': 634, 'max_depth': 9, 'min_samples_split': 32, 'min_samples_leaf': 45, 'criterion': 'entropy'}.
Trial 1361 finished with value: 0.717391304347826 and parameters: {'n_estimators': 813, 'max_depth': 13, 'min_samples_split': 37, 'min_samples_leaf': 51, 'criterion': 'entropy'}.
Trial 1362 finished with value: 0.6630434782608695 and parameters: {'n_estimators': 738, 'max_depth': 19, 'min_samples_split': 27, 'min_samples_leaf': 57, 'criterion': 'entropy'}.
Trial 1363 finished with value: 0.6956521739130435 and parameters: {'n_estimators': 884, 'max_depth': 98, 'min_samples_split': 20, 'min_samples_leaf': 48, 'criterion': 'entropy'}.
Trial 1364 finished with value: 0.6847826086956522 and parameters: {'n_estimators': 840, 'max_depth': 7, 'min_samples_split': 33, 'min_samples_leaf': 50, 'criterion': 'entropy'}.
Trial 1365 finished with value: 0.6630434782608695 and parameters: {'n_estimators': 796, 'max_depth': 72, 'min_samples_split': 24, 'min_samples_leaf': 60, 'criterion': 'gini'}.
Trial 1366 finished with value: 0.717391304347826 and parameters: {'n_estimators': 295, 'max_depth': 11, 'min_samples_split': 113, 'min_samples_leaf': 54, 'criterion': 'entropy'}.
Trial 1367 finished with value: 0.6739130434782609 and parameters: {'n_estimators': 766, 'max_depth': 16, 'min_samples_split': 29, 'min_samples_leaf': 52, 'criterion': 'entropy'}.
Trial 1368 finished with value: 0.6847826086956522 and parameters: {'n_estimators': 598, 'max_depth': 6, 'min_samples_split': 52, 'min_samples_leaf': 83, 'criterion': 'entropy'}.
Trial 1369 finished with value: 0.6847826086956522 and parameters: {'n_estimators': 825, 'max_depth': 9, 'min_samples_split': 43, 'min_samples_leaf': 43, 'criterion': 'entropy'}.
Trial 1370 finished with value: 0.6739130434782609 and parameters: {'n_estimators': 558, 'max_depth': 14, 'min_samples_split': 107, 'min_samples_leaf': 56, 'criterion': 'entropy'}.
Trial 1371 finished with value: 0.7065217391304348 and parameters: {'n_estimators': 858, 'max_depth': 12, 'min_samples_split': 37, 'min_samples_leaf': 48, 'criterion': 'entropy'}.
Trial 1372 finished with value: 0.7065217391304348 and parameters: {'n_estimators': 410, 'max_depth': 10, 'min_samples_split': 14, 'min_samples_leaf': 58, 'criterion': 'entropy'}.
Trial 1373 finished with value: 0.7065217391304348 and parameters: {'n_estimators': 804, 'max_depth': 7, 'min_samples_split': 33, 'min_samples_leaf': 63, 'criterion': 'entropy'}.
Trial 1374 finished with value: 0.6956521739130435 and parameters: {'n_estimators': 783, 'max_depth': 9, 'min_samples_split': 25, 'min_samples_leaf': 50, 'criterion': 'entropy'}.
Trial 1375 finished with value: 0.717391304347826 and parameters: {'n_estimators': 752, 'max_depth': 13, 'min_samples_split': 77, 'min_samples_leaf': 53, 'criterion': 'entropy'}.
Trial 1376 finished with value: 0.7065217391304348 and parameters: {'n_estimators': 826, 'max_depth': 11, 'min_samples_split': 40, 'min_samples_leaf': 47, 'criterion': 'entropy'}.
Trial 1377 finished with value: 0.6956521739130435 and parameters: {'n_estimators': 853, 'max_depth': 8, 'min_samples_split': 29, 'min_samples_leaf': 51, 'criterion': 'entropy'}.
Trial 1378 finished with value: 0.6521739130434783 and parameters: {'n_estimators': 812, 'max_depth': 5, 'min_samples_split': 195, 'min_samples_leaf': 55, 'criterion': 'entropy'}.
Trial 1379 finished with value: 0.6847826086956522 and parameters: {'n_estimators': 787, 'max_depth': 15, 'min_samples_split': 19, 'min_samples_leaf': 45, 'criterion': 'entropy'}.
Trial 1380 finished with value: 0.717391304347826 and parameters: {'n_estimators': 507, 'max_depth': 11, 'min_samples_split': 33, 'min_samples_leaf': 49, 'criterion': 'entropy'}.
Trial 1381 finished with value: 0.6739130434782609 and parameters: {'n_estimators': 838, 'max_depth': 9, 'min_samples_split': 36, 'min_samples_leaf': 52, 'criterion': 'entropy'}.
Trial 1382 finished with value: 0.6739130434782609 and parameters: {'n_estimators': 774, 'max_depth': 17, 'min_samples_split': 22, 'min_samples_leaf': 58, 'criterion': 'entropy'}.
Trial 1383 finished with value: 0.7065217391304348 and parameters: {'n_estimators': 743, 'max_depth': 13, 'min_samples_split': 141, 'min_samples_leaf': 40, 'criterion': 'entropy'}.
Trial 1384 finished with value: 0.717391304347826 and parameters: {'n_estimators': 537, 'max_depth': 10, 'min_samples_split': 7, 'min_samples_leaf': 54, 'criterion': 'gini'}.
Trial 1385 finished with value: 0.6847826086956522 and parameters: {'n_estimators': 804, 'max_depth': 7, 'min_samples_split': 29, 'min_samples_leaf': 50, 'criterion': 'entropy'}.
Trial 1386 finished with value: 0.6739130434782609 and parameters: {'n_estimators': 821, 'max_depth': 12, 'min_samples_split': 39, 'min_samples_leaf': 80, 'criterion': 'entropy'}.
Trial 1387 finished with value: 0.6956521739130435 and parameters: {'n_estimators': 981, 'max_depth': 9, 'min_samples_split': 45, 'min_samples_leaf': 46, 'criterion': 'entropy'}.
Trial 1388 finished with value: 0.6847826086956522 and parameters: {'n_estimators': 874, 'max_depth': 14, 'min_samples_split': 92, 'min_samples_leaf': 56, 'criterion': 'entropy'}.
Trial 1389 finished with value: 0.6739130434782609 and parameters: {'n_estimators': 922, 'max_depth': 6, 'min_samples_split': 27, 'min_samples_leaf': 52, 'criterion': 'entropy'}.
Trial 1390 finished with value: 0.717391304347826 and parameters: {'n_estimators': 840, 'max_depth': 11, 'min_samples_split': 118, 'min_samples_leaf': 60, 'criterion': 'entropy'}.
Trial 1391 finished with value: 0.6956521739130435 and parameters: {'n_estimators': 790, 'max_depth': 8, 'min_samples_split': 64, 'min_samples_leaf': 48, 'criterion': 'entropy'}.
Trial 1392 finished with value: 0.717391304347826 and parameters: {'n_estimators': 769, 'max_depth': 13, 'min_samples_split': 102, 'min_samples_leaf': 53, 'criterion': 'entropy'}.
Trial 1393 finished with value: 0.6847826086956522 and parameters: {'n_estimators': 815, 'max_depth': 65, 'min_samples_split': 34, 'min_samples_leaf': 50, 'criterion': 'entropy'}.
Trial 1394 finished with value: 0.6956521739130435 and parameters: {'n_estimators': 855, 'max_depth': 10, 'min_samples_split': 30, 'min_samples_leaf': 48, 'criterion': 'entropy'}.
Trial 1395 finished with value: 0.6847826086956522 and parameters: {'n_estimators': 804, 'max_depth': 15, 'min_samples_split': 24, 'min_samples_leaf': 55, 'criterion': 'entropy'}.
Trial 1396 finished with value: 0.7065217391304348 and parameters: {'n_estimators': 721, 'max_depth': 12, 'min_samples_split': 12, 'min_samples_leaf': 51, 'criterion': 'entropy'}.
Trial 1397 finished with value: 0.7282608695652174 and parameters: {'n_estimators': 830, 'max_depth': 8, 'min_samples_split': 17, 'min_samples_leaf': 57, 'criterion': 'entropy'}.
Trial 1398 finished with value: 0.6521739130434783 and parameters: {'n_estimators': 549, 'max_depth': 5, 'min_samples_split': 40, 'min_samples_leaf': 62, 'criterion': 'entropy'}.
Trial 1399 finished with value: 0.717391304347826 and parameters: {'n_estimators': 575, 'max_depth': 10, 'min_samples_split': 36, 'min_samples_leaf': 46, 'criterion': 'entropy'}.
Trial 1400 finished with value: 0.6847826086956522 and parameters: {'n_estimators': 793, 'max_depth': 17, 'min_samples_split': 31, 'min_samples_leaf': 53, 'criterion': 'entropy'}.
Trial 1401 finished with value: 0.6195652173913043 and parameters: {'n_estimators': 761, 'max_depth': 7, 'min_samples_split': 25, 'min_samples_leaf': 19, 'criterion': 'entropy'}.
Trial 1402 finished with value: 0.7065217391304348 and parameters: {'n_estimators': 835, 'max_depth': 12, 'min_samples_split': 33, 'min_samples_leaf': 49, 'criterion': 'entropy'}.
Trial 1403 finished with value: 0.717391304347826 and parameters: {'n_estimators': 893, 'max_depth': 10, 'min_samples_split': 22, 'min_samples_leaf': 55, 'criterion': 'gini'}.
Trial 1404 finished with value: 0.6956521739130435 and parameters: {'n_estimators': 786, 'max_depth': 14, 'min_samples_split': 27, 'min_samples_leaf': 52, 'criterion': 'entropy'}.
Trial 1405 finished with value: 0.6847826086956522 and parameters: {'n_estimators': 807, 'max_depth': 8, 'min_samples_split': 43, 'min_samples_leaf': 44, 'criterion': 'entropy'}.
Trial 1406 finished with value: 0.717391304347826 and parameters: {'n_estimators': 866, 'max_depth': 11, 'min_samples_split': 111, 'min_samples_leaf': 58, 'criterion': 'entropy'}.
Trial 1407 finished with value: 0.6847826086956522 and parameters: {'n_estimators': 474, 'max_depth': 9, 'min_samples_split': 38, 'min_samples_leaf': 50, 'criterion': 'entropy'}.
Trial 1408 finished with value: 0.7065217391304348 and parameters: {'n_estimators': 748, 'max_depth': 13, 'min_samples_split': 30, 'min_samples_leaf': 47, 'criterion': 'entropy'}.
Trial 1409 finished with value: 0.6847826086956522 and parameters: {'n_estimators': 821, 'max_depth': 7, 'min_samples_split': 20, 'min_samples_leaf': 54, 'criterion': 'entropy'}.
Trial 1410 finished with value: 0.6847826086956522 and parameters: {'n_estimators': 773, 'max_depth': 79, 'min_samples_split': 34, 'min_samples_leaf': 51, 'criterion': 'entropy'}.
Trial 1411 finished with value: 0.717391304347826 and parameters: {'n_estimators': 520, 'max_depth': 11, 'min_samples_split': 27, 'min_samples_leaf': 60, 'criterion': 'entropy'}.
