Trial 496 finished with value: 0.532608695652174 and parameters: {'n_estimators': 387, 'max_depth': 58, 'min_samples_split': 185, 'min_samples_leaf': 61, 'criterion': 'entropy'}.
Trial 497 finished with value: 0.532608695652174 and parameters: {'n_estimators': 287, 'max_depth': 76, 'min_samples_split': 168, 'min_samples_leaf': 51, 'criterion': 'entropy'}.
Trial 498 finished with value: 0.5760869565217391 and parameters: {'n_estimators': 459, 'max_depth': 47, 'min_samples_split': 175, 'min_samples_leaf': 96, 'criterion': 'entropy'}.
Trial 499 finished with value: 0.5760869565217391 and parameters: {'n_estimators': 464, 'max_depth': 44, 'min_samples_split': 176, 'min_samples_leaf': 95, 'criterion': 'entropy'}.
Trial 500 finished with value: 0.5434782608695652 and parameters: {'n_estimators': 448, 'max_depth': 44, 'min_samples_split': 180, 'min_samples_leaf': 93, 'criterion': 'gini'}.
Trial 501 finished with value: 0.5543478260869565 and parameters: {'n_estimators': 495, 'max_depth': 46, 'min_samples_split': 175, 'min_samples_leaf': 95, 'criterion': 'entropy'}.
Trial 502 finished with value: 0.532608695652174 and parameters: {'n_estimators': 439, 'max_depth': 50, 'min_samples_split': 182, 'min_samples_leaf': 90, 'criterion': 'entropy'}.
Trial 503 finished with value: 0.5652173913043478 and parameters: {'n_estimators': 464, 'max_depth': 49, 'min_samples_split': 197, 'min_samples_leaf': 46, 'criterion': 'entropy'}.
Trial 504 finished with value: 0.532608695652174 and parameters: {'n_estimators': 429, 'max_depth': 46, 'min_samples_split': 190, 'min_samples_leaf': 88, 'criterion': 'entropy'}.
Trial 505 finished with value: 0.5434782608695652 and parameters: {'n_estimators': 483, 'max_depth': 48, 'min_samples_split': 178, 'min_samples_leaf': 49, 'criterion': 'entropy'}.
Trial 506 finished with value: 0.5434782608695652 and parameters: {'n_estimators': 424, 'max_depth': 43, 'min_samples_split': 185, 'min_samples_leaf': 98, 'criterion': 'entropy'}.
Trial 507 finished with value: 0.5543478260869565 and parameters: {'n_estimators': 512, 'max_depth': 47, 'min_samples_split': 200, 'min_samples_leaf': 95, 'criterion': 'entropy'}.
Trial 508 finished with value: 0.5217391304347826 and parameters: {'n_estimators': 414, 'max_depth': 45, 'min_samples_split': 176, 'min_samples_leaf': 53, 'criterion': 'entropy'}.
Trial 509 finished with value: 0.5217391304347826 and parameters: {'n_estimators': 468, 'max_depth': 50, 'min_samples_split': 193, 'min_samples_leaf': 11, 'criterion': 'gini'}.
Trial 510 finished with value: 0.5543478260869565 and parameters: {'n_estimators': 458, 'max_depth': 47, 'min_samples_split': 188, 'min_samples_leaf': 92, 'criterion': 'entropy'}.
Trial 511 finished with value: 0.5760869565217391 and parameters: {'n_estimators': 456, 'max_depth': 51, 'min_samples_split': 172, 'min_samples_leaf': 97, 'criterion': 'entropy'}.
Trial 512 finished with value: 0.5543478260869565 and parameters: {'n_estimators': 464, 'max_depth': 50, 'min_samples_split': 47, 'min_samples_leaf': 100, 'criterion': 'entropy'}.
Trial 513 finished with value: 0.5760869565217391 and parameters: {'n_estimators': 471, 'max_depth': 48, 'min_samples_split': 171, 'min_samples_leaf': 97, 'criterion': 'entropy'}.
Trial 514 finished with value: 0.532608695652174 and parameters: {'n_estimators': 486, 'max_depth': 52, 'min_samples_split': 171, 'min_samples_leaf': 47, 'criterion': 'entropy'}.
Trial 515 finished with value: 0.5760869565217391 and parameters: {'n_estimators': 447, 'max_depth': 47, 'min_samples_split': 181, 'min_samples_leaf': 97, 'criterion': 'entropy'}.
Trial 516 finished with value: 0.5760869565217391 and parameters: {'n_estimators': 450, 'max_depth': 46, 'min_samples_split': 182, 'min_samples_leaf': 97, 'criterion': 'entropy'}.
Trial 517 finished with value: 0.5434782608695652 and parameters: {'n_estimators': 450, 'max_depth': 42, 'min_samples_split': 182, 'min_samples_leaf': 99, 'criterion': 'entropy'}.
Trial 518 finished with value: 0.5543478260869565 and parameters: {'n_estimators': 454, 'max_depth': 45, 'min_samples_split': 185, 'min_samples_leaf': 51, 'criterion': 'entropy'}.
Trial 519 finished with value: 0.5434782608695652 and parameters: {'n_estimators': 470, 'max_depth': 48, 'min_samples_split': 10, 'min_samples_leaf': 55, 'criterion': 'gini'}.
Trial 520 finished with value: 0.5543478260869565 and parameters: {'n_estimators': 441, 'max_depth': 46, 'min_samples_split': 182, 'min_samples_leaf': 38, 'criterion': 'entropy'}.
Trial 521 finished with value: 0.5760869565217391 and parameters: {'n_estimators': 473, 'max_depth': 44, 'min_samples_split': 188, 'min_samples_leaf': 96, 'criterion': 'entropy'}.
Trial 522 finished with value: 0.5543478260869565 and parameters: {'n_estimators': 470, 'max_depth': 44, 'min_samples_split': 186, 'min_samples_leaf': 94, 'criterion': 'entropy'}.
Trial 523 finished with value: 0.5543478260869565 and parameters: {'n_estimators': 483, 'max_depth': 40, 'min_samples_split': 190, 'min_samples_leaf': 44, 'criterion': 'entropy'}.
Trial 524 finished with value: 0.5543478260869565 and parameters: {'n_estimators': 500, 'max_depth': 44, 'min_samples_split': 188, 'min_samples_leaf': 97, 'criterion': 'entropy'}.
Trial 525 finished with value: 0.5760869565217391 and parameters: {'n_estimators': 456, 'max_depth': 42, 'min_samples_split': 193, 'min_samples_leaf': 96, 'criterion': 'entropy'}.
Trial 526 finished with value: 0.5543478260869565 and parameters: {'n_estimators': 441, 'max_depth': 47, 'min_samples_split': 193, 'min_samples_leaf': 92, 'criterion': 'entropy'}.
Trial 527 finished with value: 0.5543478260869565 and parameters: {'n_estimators': 482, 'max_depth': 42, 'min_samples_split': 196, 'min_samples_leaf': 49, 'criterion': 'entropy'}.
Trial 528 finished with value: 0.5760869565217391 and parameters: {'n_estimators': 450, 'max_depth': 42, 'min_samples_split': 191, 'min_samples_leaf': 95, 'criterion': 'entropy'}.
Trial 529 finished with value: 0.5434782608695652 and parameters: {'n_estimators': 452, 'max_depth': 44, 'min_samples_split': 192, 'min_samples_leaf': 94, 'criterion': 'gini'}.
Trial 530 finished with value: 0.5543478260869565 and parameters: {'n_estimators': 456, 'max_depth': 41, 'min_samples_split': 190, 'min_samples_leaf': 93, 'criterion': 'entropy'}.
Trial 531 finished with value: 0.5217391304347826 and parameters: {'n_estimators': 476, 'max_depth': 38, 'min_samples_split': 196, 'min_samples_leaf': 90, 'criterion': 'entropy'}.
Trial 532 finished with value: 0.5760869565217391 and parameters: {'n_estimators': 434, 'max_depth': 42, 'min_samples_split': 194, 'min_samples_leaf': 95, 'criterion': 'entropy'}.
Trial 533 finished with value: 0.5652173913043478 and parameters: {'n_estimators': 441, 'max_depth': 42, 'min_samples_split': 195, 'min_samples_leaf': 46, 'criterion': 'entropy'}.
Trial 534 finished with value: 0.5543478260869565 and parameters: {'n_estimators': 460, 'max_depth': 43, 'min_samples_split': 192, 'min_samples_leaf': 75, 'criterion': 'entropy'}.
Trial 535 finished with value: 0.5434782608695652 and parameters: {'n_estimators': 431, 'max_depth': 40, 'min_samples_split': 198, 'min_samples_leaf': 52, 'criterion': 'entropy'}.
Trial 536 finished with value: 0.532608695652174 and parameters: {'n_estimators': 454, 'max_depth': 46, 'min_samples_split': 189, 'min_samples_leaf': 59, 'criterion': 'entropy'}.
Trial 537 finished with value: 0.5108695652173914 and parameters: {'n_estimators': 501, 'max_depth': 43, 'min_samples_split': 200, 'min_samples_leaf': 26, 'criterion': 'entropy'}.
Trial 538 finished with value: 0.5434782608695652 and parameters: {'n_estimators': 435, 'max_depth': 48, 'min_samples_split': 193, 'min_samples_leaf': 95, 'criterion': 'gini'}.
Trial 539 finished with value: 0.5434782608695652 and parameters: {'n_estimators': 457, 'max_depth': 45, 'min_samples_split': 188, 'min_samples_leaf': 42, 'criterion': 'entropy'}.
Trial 540 finished with value: 0.5434782608695652 and parameters: {'n_estimators': 423, 'max_depth': 37, 'min_samples_split': 196, 'min_samples_leaf': 91, 'criterion': 'entropy'}.
Trial 541 finished with value: 0.5434782608695652 and parameters: {'n_estimators': 472, 'max_depth': 47, 'min_samples_split': 191, 'min_samples_leaf': 19, 'criterion': 'entropy'}.
Trial 542 finished with value: 0.5434782608695652 and parameters: {'n_estimators': 441, 'max_depth': 43, 'min_samples_split': 186, 'min_samples_leaf': 49, 'criterion': 'entropy'}.
Trial 543 finished with value: 0.5543478260869565 and parameters: {'n_estimators': 485, 'max_depth': 41, 'min_samples_split': 194, 'min_samples_leaf': 96, 'criterion': 'entropy'}.
Trial 544 finished with value: 0.532608695652174 and parameters: {'n_estimators': 533, 'max_depth': 48, 'min_samples_split': 188, 'min_samples_leaf': 88, 'criterion': 'entropy'}.
Trial 545 finished with value: 0.5543478260869565 and parameters: {'n_estimators': 464, 'max_depth': 45, 'min_samples_split': 197, 'min_samples_leaf': 47, 'criterion': 'entropy'}.
Trial 546 finished with value: 0.5434782608695652 and parameters: {'n_estimators': 446, 'max_depth': 50, 'min_samples_split': 185, 'min_samples_leaf': 93, 'criterion': 'gini'}.
Trial 547 finished with value: 0.5760869565217391 and parameters: {'n_estimators': 478, 'max_depth': 40, 'min_samples_split': 193, 'min_samples_leaf': 96, 'criterion': 'entropy'}.
Trial 548 finished with value: 0.5652173913043478 and parameters: {'n_estimators': 479, 'max_depth': 39, 'min_samples_split': 200, 'min_samples_leaf': 95, 'criterion': 'entropy'}.
Trial 549 finished with value: 0.5217391304347826 and parameters: {'n_estimators': 496, 'max_depth': 41, 'min_samples_split': 193, 'min_samples_leaf': 54, 'criterion': 'entropy'}.
Trial 550 finished with value: 0.532608695652174 and parameters: {'n_estimators': 475, 'max_depth': 39, 'min_samples_split': 191, 'min_samples_leaf': 84, 'criterion': 'entropy'}.
Trial 551 finished with value: 0.532608695652174 and parameters: {'n_estimators': 432, 'max_depth': 44, 'min_samples_split': 196, 'min_samples_leaf': 51, 'criterion': 'entropy'}.
Trial 552 finished with value: 0.5108695652173914 and parameters: {'n_estimators': 458, 'max_depth': 46, 'min_samples_split': 190, 'min_samples_leaf': 40, 'criterion': 'entropy'}.
Trial 553 finished with value: 0.532608695652174 and parameters: {'n_estimators': 510, 'max_depth': 35, 'min_samples_split': 36, 'min_samples_leaf': 92, 'criterion': 'entropy'}.
Trial 554 finished with value: 0.5543478260869565 and parameters: {'n_estimators': 448, 'max_depth': 42, 'min_samples_split': 197, 'min_samples_leaf': 44, 'criterion': 'entropy'}.
Trial 555 finished with value: 0.5543478260869565 and parameters: {'n_estimators': 469, 'max_depth': 48, 'min_samples_split': 194, 'min_samples_leaf': 96, 'criterion': 'gini'}.
Trial 556 finished with value: 0.5434782608695652 and parameters: {'n_estimators': 427, 'max_depth': 44, 'min_samples_split': 200, 'min_samples_leaf': 98, 'criterion': 'entropy'}.
Trial 557 finished with value: 0.5434782608695652 and parameters: {'n_estimators': 491, 'max_depth': 51, 'min_samples_split': 188, 'min_samples_leaf': 50, 'criterion': 'entropy'}.
Trial 558 finished with value: 0.5652173913043478 and parameters: {'n_estimators': 453, 'max_depth': 46, 'min_samples_split': 191, 'min_samples_leaf': 94, 'criterion': 'entropy'}.
Trial 559 finished with value: 0.5434782608695652 and parameters: {'n_estimators': 437, 'max_depth': 49, 'min_samples_split': 186, 'min_samples_leaf': 48, 'criterion': 'entropy'}.
Trial 560 finished with value: 0.5434782608695652 and parameters: {'n_estimators': 416, 'max_depth': 40, 'min_samples_split': 195, 'min_samples_leaf': 89, 'criterion': 'entropy'}.
Trial 561 finished with value: 0.5543478260869565 and parameters: {'n_estimators': 471, 'max_depth': 42, 'min_samples_split': 191, 'min_samples_leaf': 98, 'criterion': 'entropy'}.
Trial 562 finished with value: 0.5760869565217391 and parameters: {'n_estimators': 483, 'max_depth': 51, 'min_samples_split': 184, 'min_samples_leaf': 96, 'criterion': 'entropy'}.
Trial 563 finished with value: 0.5543478260869565 and parameters: {'n_estimators': 492, 'max_depth': 51, 'min_samples_split': 184, 'min_samples_leaf': 94, 'criterion': 'entropy'}.
Trial 564 finished with value: 0.532608695652174 and parameters: {'n_estimators': 490, 'max_depth': 37, 'min_samples_split': 194, 'min_samples_leaf': 91, 'criterion': 'gini'}.
Trial 565 finished with value: 0.5108695652173914 and parameters: {'n_estimators': 517, 'max_depth': 46, 'min_samples_split': 189, 'min_samples_leaf': 31, 'criterion': 'entropy'}.
Trial 566 finished with value: 0.532608695652174 and parameters: {'n_estimators': 475, 'max_depth': 53, 'min_samples_split': 185, 'min_samples_leaf': 53, 'criterion': 'entropy'}.
Trial 567 finished with value: 0.5760869565217391 and parameters: {'n_estimators': 459, 'max_depth': 44, 'min_samples_split': 200, 'min_samples_leaf': 96, 'criterion': 'entropy'}.
Trial 568 finished with value: 0.5434782608695652 and parameters: {'n_estimators': 457, 'max_depth': 43, 'min_samples_split': 200, 'min_samples_leaf': 56, 'criterion': 'entropy'}.
Trial 569 finished with value: 0.5434782608695652 and parameters: {'n_estimators': 505, 'max_depth': 44, 'min_samples_split': 197, 'min_samples_leaf': 45, 'criterion': 'entropy'}.
Trial 570 finished with value: 0.5543478260869565 and parameters: {'n_estimators': 477, 'max_depth': 48, 'min_samples_split': 198, 'min_samples_leaf': 93, 'criterion': 'entropy'}.
Trial 571 finished with value: 0.5760869565217391 and parameters: {'n_estimators': 460, 'max_depth': 39, 'min_samples_split': 200, 'min_samples_leaf': 96, 'criterion': 'entropy'}.
Trial 572 finished with value: 0.5760869565217391 and parameters: {'n_estimators': 450, 'max_depth': 39, 'min_samples_split': 197, 'min_samples_leaf': 96, 'criterion': 'entropy'}.
Trial 573 finished with value: 0.5760869565217391 and parameters: {'n_estimators': 463, 'max_depth': 38, 'min_samples_split': 195, 'min_samples_leaf': 96, 'criterion': 'entropy'}.
Trial 574 finished with value: 0.5760869565217391 and parameters: {'n_estimators': 451, 'max_depth': 38, 'min_samples_split': 200, 'min_samples_leaf': 95, 'criterion': 'entropy'}.
Trial 575 finished with value: 0.5434782608695652 and parameters: {'n_estimators': 486, 'max_depth': 41, 'min_samples_split': 194, 'min_samples_leaf': 94, 'criterion': 'entropy'}.
Trial 576 finished with value: 0.5543478260869565 and parameters: {'n_estimators': 465, 'max_depth': 36, 'min_samples_split': 200, 'min_samples_leaf': 91, 'criterion': 'entropy'}.
Trial 577 finished with value: 0.5760869565217391 and parameters: {'n_estimators': 445, 'max_depth': 32, 'min_samples_split': 190, 'min_samples_leaf': 97, 'criterion': 'entropy'}.
Trial 578 finished with value: 0.5434782608695652 and parameters: {'n_estimators': 478, 'max_depth': 40, 'min_samples_split': 196, 'min_samples_leaf': 93, 'criterion': 'entropy'}.
Trial 579 finished with value: 0.5434782608695652 and parameters: {'n_estimators': 446, 'max_depth': 41, 'min_samples_split': 183, 'min_samples_leaf': 99, 'criterion': 'entropy'}.
Trial 580 finished with value: 0.5760869565217391 and parameters: {'n_estimators': 500, 'max_depth': 39, 'min_samples_split': 188, 'min_samples_leaf': 96, 'criterion': 'entropy'}.
Trial 581 finished with value: 0.5760869565217391 and parameters: {'n_estimators': 466, 'max_depth': 43, 'min_samples_split': 193, 'min_samples_leaf': 95, 'criterion': 'entropy'}.
Trial 582 finished with value: 0.5543478260869565 and parameters: {'n_estimators': 430, 'max_depth': 39, 'min_samples_split': 200, 'min_samples_leaf': 92, 'criterion': 'entropy'}.
Trial 583 finished with value: 0.5543478260869565 and parameters: {'n_estimators': 480, 'max_depth': 45, 'min_samples_split': 183, 'min_samples_leaf': 98, 'criterion': 'entropy'}.
Trial 584 finished with value: 0.5434782608695652 and parameters: {'n_estimators': 457, 'max_depth': 33, 'min_samples_split': 192, 'min_samples_leaf': 100, 'criterion': 'entropy'}.
Trial 585 finished with value: 0.5652173913043478 and parameters: {'n_estimators': 444, 'max_depth': 35, 'min_samples_split': 187, 'min_samples_leaf': 96, 'criterion': 'entropy'}.
Trial 586 finished with value: 0.532608695652174 and parameters: {'n_estimators': 465, 'max_depth': 42, 'min_samples_split': 194, 'min_samples_leaf': 70, 'criterion': 'entropy'}.
Trial 587 finished with value: 0.5543478260869565 and parameters: {'n_estimators': 490, 'max_depth': 41, 'min_samples_split': 196, 'min_samples_leaf': 93, 'criterion': 'entropy'}.
Trial 588 finished with value: 0.532608695652174 and parameters: {'n_estimators': 443, 'max_depth': 44, 'min_samples_split': 190, 'min_samples_leaf': 90, 'criterion': 'entropy'}.
Trial 589 finished with value: 0.5760869565217391 and parameters: {'n_estimators': 426, 'max_depth': 46, 'min_samples_split': 114, 'min_samples_leaf': 97, 'criterion': 'entropy'}.
Trial 590 finished with value: 0.5652173913043478 and parameters: {'n_estimators': 475, 'max_depth': 37, 'min_samples_split': 182, 'min_samples_leaf': 95, 'criterion': 'entropy'}.
Trial 591 finished with value: 0.5543478260869565 and parameters: {'n_estimators': 503, 'max_depth': 43, 'min_samples_split': 100, 'min_samples_leaf': 98, 'criterion': 'entropy'}.
Trial 592 finished with value: 0.5543478260869565 and parameters: {'n_estimators': 464, 'max_depth': 39, 'min_samples_split': 187, 'min_samples_leaf': 94, 'criterion': 'entropy'}.
Trial 593 finished with value: 0.5434782608695652 and parameters: {'n_estimators': 451, 'max_depth': 46, 'min_samples_split': 197, 'min_samples_leaf': 100, 'criterion': 'entropy'}.
Trial 594 finished with value: 0.5652173913043478 and parameters: {'n_estimators': 428, 'max_depth': 42, 'min_samples_split': 191, 'min_samples_leaf': 96, 'criterion': 'entropy'}.
Trial 595 finished with value: 0.5543478260869565 and parameters: {'n_estimators': 530, 'max_depth': 48, 'min_samples_split': 200, 'min_samples_leaf': 92, 'criterion': 'entropy'}.
Trial 596 finished with value: 0.5543478260869565 and parameters: {'n_estimators': 477, 'max_depth': 44, 'min_samples_split': 184, 'min_samples_leaf': 98, 'criterion': 'entropy'}.
Trial 597 finished with value: 0.5652173913043478 and parameters: {'n_estimators': 447, 'max_depth': 40, 'min_samples_split': 180, 'min_samples_leaf': 95, 'criterion': 'entropy'}.
Trial 598 finished with value: 0.5217391304347826 and parameters: {'n_estimators': 462, 'max_depth': 47, 'min_samples_split': 187, 'min_samples_leaf': 87, 'criterion': 'entropy'}.
Trial 599 finished with value: 0.5434782608695652 and parameters: {'n_estimators': 486, 'max_depth': 50, 'min_samples_split': 193, 'min_samples_leaf': 67, 'criterion': 'entropy'}.
Trial 600 finished with value: 0.5652173913043478 and parameters: {'n_estimators': 415, 'max_depth': 88, 'min_samples_split': 196, 'min_samples_leaf': 97, 'criterion': 'entropy'}.
Trial 601 finished with value: 0.5543478260869565 and parameters: {'n_estimators': 460, 'max_depth': 45, 'min_samples_split': 190, 'min_samples_leaf': 93, 'criterion': 'entropy'}.
Trial 602 finished with value: 0.532608695652174 and parameters: {'n_estimators': 439, 'max_depth': 42, 'min_samples_split': 182, 'min_samples_leaf': 90, 'criterion': 'entropy'}.
Trial 603 finished with value: 0.5760869565217391 and parameters: {'n_estimators': 508, 'max_depth': 49, 'min_samples_split': 187, 'min_samples_leaf': 96, 'criterion': 'entropy'}.
Trial 604 finished with value: 0.5543478260869565 and parameters: {'n_estimators': 488, 'max_depth': 52, 'min_samples_split': 194, 'min_samples_leaf': 99, 'criterion': 'entropy'}.
Trial 605 finished with value: 0.5652173913043478 and parameters: {'n_estimators': 431, 'max_depth': 38, 'min_samples_split': 200, 'min_samples_leaf': 94, 'criterion': 'entropy'}.
Trial 606 finished with value: 0.5760869565217391 and parameters: {'n_estimators': 454, 'max_depth': 22, 'min_samples_split': 180, 'min_samples_leaf': 97, 'criterion': 'entropy'}.
Trial 607 finished with value: 0.5543478260869565 and parameters: {'n_estimators': 468, 'max_depth': 44, 'min_samples_split': 191, 'min_samples_leaf': 100, 'criterion': 'entropy'}.
Trial 608 finished with value: 0.5543478260869565 and parameters: {'n_estimators': 480, 'max_depth': 46, 'min_samples_split': 186, 'min_samples_leaf': 92, 'criterion': 'entropy'}.
Trial 609 finished with value: 0.5217391304347826 and parameters: {'n_estimators': 444, 'max_depth': 41, 'min_samples_split': 196, 'min_samples_leaf': 82, 'criterion': 'entropy'}.
Trial 610 finished with value: 0.5652173913043478 and parameters: {'n_estimators': 417, 'max_depth': 17, 'min_samples_split': 183, 'min_samples_leaf': 95, 'criterion': 'entropy'}.
Trial 611 finished with value: 0.5543478260869565 and parameters: {'n_estimators': 457, 'max_depth': 91, 'min_samples_split': 137, 'min_samples_leaf': 98, 'criterion': 'entropy'}.
Trial 612 finished with value: 0.532608695652174 and parameters: {'n_estimators': 495, 'max_depth': 36, 'min_samples_split': 190, 'min_samples_leaf': 52, 'criterion': 'entropy'}.
Trial 613 finished with value: 0.5543478260869565 and parameters: {'n_estimators': 436, 'max_depth': 49, 'min_samples_split': 196, 'min_samples_leaf': 95, 'criterion': 'entropy'}.
Trial 614 finished with value: 0.5543478260869565 and parameters: {'n_estimators': 475, 'max_depth': 47, 'min_samples_split': 186, 'min_samples_leaf': 93, 'criterion': 'entropy'}.
Trial 615 finished with value: 0.5760869565217391 and parameters: {'n_estimators': 467, 'max_depth': 40, 'min_samples_split': 192, 'min_samples_leaf': 97, 'criterion': 'entropy'}.
Trial 616 finished with value: 0.5434782608695652 and parameters: {'n_estimators': 517, 'max_depth': 42, 'min_samples_split': 68, 'min_samples_leaf': 89, 'criterion': 'entropy'}.
Trial 617 finished with value: 0.532608695652174 and parameters: {'n_estimators': 447, 'max_depth': 27, 'min_samples_split': 180, 'min_samples_leaf': 55, 'criterion': 'entropy'}.
