Trial 1168 finished with value: 0.6956521739130435 and parameters: {'n_estimators': 771, 'max_depth': 12, 'min_samples_split': 36, 'min_samples_leaf': 54, 'criterion': 'entropy'}.
Trial 1169 finished with value: 0.6847826086956522 and parameters: {'n_estimators': 893, 'max_depth': 25, 'min_samples_split': 32, 'min_samples_leaf': 51, 'criterion': 'entropy'}.
Trial 1170 finished with value: 0.717391304347826 and parameters: {'n_estimators': 554, 'max_depth': 10, 'min_samples_split': 103, 'min_samples_leaf': 47, 'criterion': 'entropy'}.
Trial 1171 finished with value: 0.6847826086956522 and parameters: {'n_estimators': 717, 'max_depth': 14, 'min_samples_split': 42, 'min_samples_leaf': 53, 'criterion': 'entropy'}.
Trial 1172 finished with value: 0.6956521739130435 and parameters: {'n_estimators': 795, 'max_depth': 8, 'min_samples_split': 25, 'min_samples_leaf': 50, 'criterion': 'entropy'}.
Trial 1173 finished with value: 0.717391304347826 and parameters: {'n_estimators': 822, 'max_depth': 11, 'min_samples_split': 109, 'min_samples_leaf': 58, 'criterion': 'entropy'}.
Trial 1174 finished with value: 0.6304347826086957 and parameters: {'n_estimators': 865, 'max_depth': 6, 'min_samples_split': 38, 'min_samples_leaf': 4, 'criterion': 'entropy'}.
Trial 1175 finished with value: 0.7065217391304348 and parameters: {'n_estimators': 851, 'max_depth': 12, 'min_samples_split': 29, 'min_samples_leaf': 55, 'criterion': 'entropy'}.
Trial 1176 finished with value: 0.6956521739130435 and parameters: {'n_estimators': 794, 'max_depth': 9, 'min_samples_split': 118, 'min_samples_leaf': 49, 'criterion': 'entropy'}.
Trial 1177 finished with value: 0.6847826086956522 and parameters: {'n_estimators': 530, 'max_depth': 18, 'min_samples_split': 14, 'min_samples_leaf': 46, 'criterion': 'gini'}.
Trial 1178 finished with value: 0.6956521739130435 and parameters: {'n_estimators': 758, 'max_depth': 10, 'min_samples_split': 20, 'min_samples_leaf': 60, 'criterion': 'entropy'}.
Trial 1179 finished with value: 0.6847826086956522 and parameters: {'n_estimators': 662, 'max_depth': 15, 'min_samples_split': 34, 'min_samples_leaf': 52, 'criterion': 'entropy'}.
Trial 1180 finished with value: 0.6847826086956522 and parameters: {'n_estimators': 832, 'max_depth': 7, 'min_samples_split': 45, 'min_samples_leaf': 50, 'criterion': 'entropy'}.
Trial 1181 finished with value: 0.7065217391304348 and parameters: {'n_estimators': 808, 'max_depth': 13, 'min_samples_split': 26, 'min_samples_leaf': 56, 'criterion': 'entropy'}.
Trial 1182 finished with value: 0.7065217391304348 and parameters: {'n_estimators': 774, 'max_depth': 11, 'min_samples_split': 178, 'min_samples_leaf': 48, 'criterion': 'entropy'}.
Trial 1183 finished with value: 0.7065217391304348 and parameters: {'n_estimators': 821, 'max_depth': 8, 'min_samples_split': 31, 'min_samples_leaf': 53, 'criterion': 'entropy'}.
Trial 1184 finished with value: 0.6304347826086957 and parameters: {'n_estimators': 497, 'max_depth': 5, 'min_samples_split': 38, 'min_samples_leaf': 51, 'criterion': 'entropy'}.
Trial 1185 finished with value: 0.6956521739130435 and parameters: {'n_estimators': 734, 'max_depth': 9, 'min_samples_split': 23, 'min_samples_leaf': 63, 'criterion': 'entropy'}.
Trial 1186 finished with value: 0.7065217391304348 and parameters: {'n_estimators': 586, 'max_depth': 12, 'min_samples_split': 33, 'min_samples_leaf': 54, 'criterion': 'entropy'}.
Trial 1187 finished with value: 0.7065217391304348 and parameters: {'n_estimators': 566, 'max_depth': 10, 'min_samples_split': 123, 'min_samples_leaf': 47, 'criterion': 'entropy'}.
Trial 1188 finished with value: 0.6956521739130435 and parameters: {'n_estimators': 845, 'max_depth': 14, 'min_samples_split': 19, 'min_samples_leaf': 59, 'criterion': 'entropy'}.
Trial 1189 finished with value: 0.7065217391304348 and parameters: {'n_estimators': 803, 'max_depth': 8, 'min_samples_split': 29, 'min_samples_leaf': 49, 'criterion': 'entropy'}.
Trial 1190 finished with value: 0.6956521739130435 and parameters: {'n_estimators': 876, 'max_depth': 12, 'min_samples_split': 36, 'min_samples_leaf': 43, 'criterion': 'entropy'}.
Trial 1191 finished with value: 0.6956521739130435 and parameters: {'n_estimators': 781, 'max_depth': 7, 'min_samples_split': 51, 'min_samples_leaf': 56, 'criterion': 'entropy'}.
Trial 1192 finished with value: 0.6630434782608695 and parameters: {'n_estimators': 824, 'max_depth': 16, 'min_samples_split': 99, 'min_samples_leaf': 52, 'criterion': 'entropy'}.
Trial 1193 finished with value: 0.6847826086956522 and parameters: {'n_estimators': 751, 'max_depth': 20, 'min_samples_split': 41, 'min_samples_leaf': 46, 'criterion': 'entropy'}.
Trial 1194 finished with value: 0.7065217391304348 and parameters: {'n_estimators': 922, 'max_depth': 10, 'min_samples_split': 27, 'min_samples_leaf': 53, 'criterion': 'entropy'}.
Trial 1195 finished with value: 0.717391304347826 and parameters: {'n_estimators': 792, 'max_depth': 13, 'min_samples_split': 23, 'min_samples_leaf': 50, 'criterion': 'entropy'}.
Trial 1196 finished with value: 0.7065217391304348 and parameters: {'n_estimators': 850, 'max_depth': 11, 'min_samples_split': 31, 'min_samples_leaf': 57, 'criterion': 'gini'}.
Trial 1197 finished with value: 0.6630434782608695 and parameters: {'n_estimators': 429, 'max_depth': 6, 'min_samples_split': 34, 'min_samples_leaf': 54, 'criterion': 'entropy'}.
Trial 1198 finished with value: 0.717391304347826 and parameters: {'n_estimators': 771, 'max_depth': 9, 'min_samples_split': 15, 'min_samples_leaf': 48, 'criterion': 'entropy'}.
Trial 1199 finished with value: 0.6739130434782609 and parameters: {'n_estimators': 813, 'max_depth': 14, 'min_samples_split': 27, 'min_samples_leaf': 88, 'criterion': 'entropy'}.
Trial 1200 finished with value: 0.7065217391304348 and parameters: {'n_estimators': 606, 'max_depth': 11, 'min_samples_split': 39, 'min_samples_leaf': 51, 'criterion': 'entropy'}.
Trial 1201 finished with value: 0.7065217391304348 and parameters: {'n_estimators': 838, 'max_depth': 8, 'min_samples_split': 20, 'min_samples_leaf': 50, 'criterion': 'entropy'}.
Trial 1202 finished with value: 0.7065217391304348 and parameters: {'n_estimators': 795, 'max_depth': 13, 'min_samples_split': 45, 'min_samples_leaf': 45, 'criterion': 'entropy'}.
Trial 1203 finished with value: 0.6413043478260869 and parameters: {'n_estimators': 829, 'max_depth': 5, 'min_samples_split': 35, 'min_samples_leaf': 55, 'criterion': 'entropy'}.
Trial 1204 finished with value: 0.7065217391304348 and parameters: {'n_estimators': 520, 'max_depth': 9, 'min_samples_split': 106, 'min_samples_leaf': 58, 'criterion': 'entropy'}.
Trial 1205 finished with value: 0.6847826086956522 and parameters: {'n_estimators': 806, 'max_depth': 11, 'min_samples_split': 32, 'min_samples_leaf': 52, 'criterion': 'entropy'}.
Trial 1206 finished with value: 0.6739130434782609 and parameters: {'n_estimators': 865, 'max_depth': 16, 'min_samples_split': 25, 'min_samples_leaf': 41, 'criterion': 'entropy'}.
Trial 1207 finished with value: 0.6739130434782609 and parameters: {'n_estimators': 784, 'max_depth': 7, 'min_samples_split': 30, 'min_samples_leaf': 48, 'criterion': 'entropy'}.
Trial 1208 finished with value: 0.717391304347826 and parameters: {'n_estimators': 551, 'max_depth': 10, 'min_samples_split': 38, 'min_samples_leaf': 55, 'criterion': 'entropy'}.
Trial 1209 finished with value: 0.7065217391304348 and parameters: {'n_estimators': 756, 'max_depth': 13, 'min_samples_split': 23, 'min_samples_leaf': 52, 'criterion': 'entropy'}.
Trial 1210 finished with value: 0.717391304347826 and parameters: {'n_estimators': 821, 'max_depth': 8, 'min_samples_split': 42, 'min_samples_leaf': 60, 'criterion': 'entropy'}.
Trial 1211 finished with value: 0.6956521739130435 and parameters: {'n_estimators': 642, 'max_depth': 15, 'min_samples_split': 184, 'min_samples_leaf': 49, 'criterion': 'entropy'}.
Trial 1212 finished with value: 0.6956521739130435 and parameters: {'n_estimators': 890, 'max_depth': 12, 'min_samples_split': 28, 'min_samples_leaf': 65, 'criterion': 'entropy'}.
Trial 1213 finished with value: 0.717391304347826 and parameters: {'n_estimators': 851, 'max_depth': 10, 'min_samples_split': 35, 'min_samples_leaf': 46, 'criterion': 'entropy'}.
Trial 1214 finished with value: 0.6847826086956522 and parameters: {'n_estimators': 803, 'max_depth': 7, 'min_samples_split': 19, 'min_samples_leaf': 53, 'criterion': 'entropy'}.
Trial 1215 finished with value: 0.7065217391304348 and parameters: {'n_estimators': 833, 'max_depth': 9, 'min_samples_split': 30, 'min_samples_leaf': 50, 'criterion': 'entropy'}.
Trial 1216 finished with value: 0.717391304347826 and parameters: {'n_estimators': 781, 'max_depth': 12, 'min_samples_split': 116, 'min_samples_leaf': 57, 'criterion': 'gini'}.
Trial 1217 finished with value: 0.6739130434782609 and parameters: {'n_estimators': 767, 'max_depth': 18, 'min_samples_split': 38, 'min_samples_leaf': 47, 'criterion': 'entropy'}.
Trial 1218 finished with value: 0.6521739130434783 and parameters: {'n_estimators': 816, 'max_depth': 5, 'min_samples_split': 10, 'min_samples_leaf': 61, 'criterion': 'entropy'}.
Trial 1219 finished with value: 0.6847826086956522 and parameters: {'n_estimators': 623, 'max_depth': 14, 'min_samples_split': 25, 'min_samples_leaf': 54, 'criterion': 'entropy'}.
Trial 1220 finished with value: 0.717391304347826 and parameters: {'n_estimators': 735, 'max_depth': 10, 'min_samples_split': 33, 'min_samples_leaf': 51, 'criterion': 'entropy'}.
Trial 1221 finished with value: 0.6956521739130435 and parameters: {'n_estimators': 572, 'max_depth': 7, 'min_samples_split': 110, 'min_samples_leaf': 44, 'criterion': 'entropy'}.
Trial 1222 finished with value: 0.717391304347826 and parameters: {'n_estimators': 849, 'max_depth': 11, 'min_samples_split': 27, 'min_samples_leaf': 49, 'criterion': 'entropy'}.
Trial 1223 finished with value: 0.717391304347826 and parameters: {'n_estimators': 703, 'max_depth': 9, 'min_samples_split': 101, 'min_samples_leaf': 55, 'criterion': 'entropy'}.
Trial 1224 finished with value: 0.717391304347826 and parameters: {'n_estimators': 802, 'max_depth': 13, 'min_samples_split': 15, 'min_samples_leaf': 52, 'criterion': 'entropy'}.
Trial 1225 finished with value: 0.6847826086956522 and parameters: {'n_estimators': 788, 'max_depth': 15, 'min_samples_split': 43, 'min_samples_leaf': 57, 'criterion': 'entropy'}.
Trial 1226 finished with value: 0.7065217391304348 and parameters: {'n_estimators': 835, 'max_depth': 11, 'min_samples_split': 22, 'min_samples_leaf': 47, 'criterion': 'entropy'}.
Trial 1227 finished with value: 0.6847826086956522 and parameters: {'n_estimators': 870, 'max_depth': 8, 'min_samples_split': 35, 'min_samples_leaf': 91, 'criterion': 'entropy'}.
Trial 1228 finished with value: 0.7065217391304348 and parameters: {'n_estimators': 535, 'max_depth': 12, 'min_samples_split': 30, 'min_samples_leaf': 50, 'criterion': 'entropy'}.
Trial 1229 finished with value: 0.6630434782608695 and parameters: {'n_estimators': 767, 'max_depth': 6, 'min_samples_split': 47, 'min_samples_leaf': 59, 'criterion': 'entropy'}.
Trial 1230 finished with value: 0.6847826086956522 and parameters: {'n_estimators': 815, 'max_depth': 9, 'min_samples_split': 96, 'min_samples_leaf': 53, 'criterion': 'entropy'}.
Trial 1231 finished with value: 0.7065217391304348 and parameters: {'n_estimators': 739, 'max_depth': 11, 'min_samples_split': 39, 'min_samples_leaf': 51, 'criterion': 'entropy'}.
Trial 1232 finished with value: 0.7065217391304348 and parameters: {'n_estimators': 906, 'max_depth': 16, 'min_samples_split': 33, 'min_samples_leaf': 56, 'criterion': 'entropy'}.
Trial 1233 finished with value: 0.6956521739130435 and parameters: {'n_estimators': 795, 'max_depth': 14, 'min_samples_split': 27, 'min_samples_leaf': 48, 'criterion': 'gini'}.
Trial 1234 finished with value: 0.717391304347826 and parameters: {'n_estimators': 506, 'max_depth': 8, 'min_samples_split': 22, 'min_samples_leaf': 54, 'criterion': 'entropy'}.
Trial 1235 finished with value: 0.6956521739130435 and parameters: {'n_estimators': 832, 'max_depth': 10, 'min_samples_split': 36, 'min_samples_leaf': 44, 'criterion': 'entropy'}.
Trial 1236 finished with value: 0.7065217391304348 and parameters: {'n_estimators': 960, 'max_depth': 12, 'min_samples_split': 29, 'min_samples_leaf': 49, 'criterion': 'entropy'}.
Trial 1237 finished with value: 0.7065217391304348 and parameters: {'n_estimators': 782, 'max_depth': 7, 'min_samples_split': 18, 'min_samples_leaf': 62, 'criterion': 'entropy'}.
Trial 1238 finished with value: 0.6739130434782609 and parameters: {'n_estimators': 812, 'max_depth': 9, 'min_samples_split': 41, 'min_samples_leaf': 52, 'criterion': 'entropy'}.
Trial 1239 finished with value: 0.717391304347826 and parameters: {'n_estimators': 849, 'max_depth': 13, 'min_samples_split': 32, 'min_samples_leaf': 46, 'criterion': 'entropy'}.
Trial 1240 finished with value: 0.6413043478260869 and parameters: {'n_estimators': 757, 'max_depth': 5, 'min_samples_split': 36, 'min_samples_leaf': 58, 'criterion': 'entropy'}.
Trial 1241 finished with value: 0.6847826086956522 and parameters: {'n_estimators': 875, 'max_depth': 17, 'min_samples_split': 24, 'min_samples_leaf': 50, 'criterion': 'entropy'}.
Trial 1242 finished with value: 0.6630434782608695 and parameters: {'n_estimators': 714, 'max_depth': 30, 'min_samples_split': 29, 'min_samples_leaf': 54, 'criterion': 'entropy'}.
Trial 1243 finished with value: 0.6956521739130435 and parameters: {'n_estimators': 826, 'max_depth': 10, 'min_samples_split': 25, 'min_samples_leaf': 48, 'criterion': 'entropy'}.
Trial 1244 finished with value: 0.6956521739130435 and parameters: {'n_estimators': 797, 'max_depth': 7, 'min_samples_split': 32, 'min_samples_leaf': 56, 'criterion': 'entropy'}.
Trial 1245 finished with value: 0.7065217391304348 and parameters: {'n_estimators': 774, 'max_depth': 12, 'min_samples_split': 38, 'min_samples_leaf': 52, 'criterion': 'entropy'}.
Trial 1246 finished with value: 0.717391304347826 and parameters: {'n_estimators': 999, 'max_depth': 14, 'min_samples_split': 19, 'min_samples_leaf': 50, 'criterion': 'entropy'}.
Trial 1247 finished with value: 0.717391304347826 and parameters: {'n_estimators': 856, 'max_depth': 9, 'min_samples_split': 34, 'min_samples_leaf': 46, 'criterion': 'entropy'}.
Trial 1248 finished with value: 0.7065217391304348 and parameters: {'n_estimators': 818, 'max_depth': 11, 'min_samples_split': 12, 'min_samples_leaf': 53, 'criterion': 'entropy'}.
Trial 1249 finished with value: 0.6739130434782609 and parameters: {'n_estimators': 747, 'max_depth': 7, 'min_samples_split': 43, 'min_samples_leaf': 55, 'criterion': 'entropy'}.
Trial 1250 finished with value: 0.717391304347826 and parameters: {'n_estimators': 560, 'max_depth': 10, 'min_samples_split': 104, 'min_samples_leaf': 59, 'criterion': 'entropy'}.
Trial 1251 finished with value: 0.717391304347826 and parameters: {'n_estimators': 836, 'max_depth': 14, 'min_samples_split': 26, 'min_samples_leaf': 48, 'criterion': 'entropy'}.
Trial 1252 finished with value: 0.7065217391304348 and parameters: {'n_estimators': 804, 'max_depth': 12, 'min_samples_split': 31, 'min_samples_leaf': 51, 'criterion': 'gini'}.
Trial 1253 finished with value: 0.717391304347826 and parameters: {'n_estimators': 777, 'max_depth': 9, 'min_samples_split': 90, 'min_samples_leaf': 49, 'criterion': 'entropy'}.
Trial 1254 finished with value: 0.6739130434782609 and parameters: {'n_estimators': 544, 'max_depth': 6, 'min_samples_split': 21, 'min_samples_leaf': 53, 'criterion': 'entropy'}.
Trial 1255 finished with value: 0.7065217391304348 and parameters: {'n_estimators': 800, 'max_depth': 11, 'min_samples_split': 5, 'min_samples_leaf': 56, 'criterion': 'entropy'}.
Trial 1256 finished with value: 0.6956521739130435 and parameters: {'n_estimators': 833, 'max_depth': 8, 'min_samples_split': 39, 'min_samples_leaf': 51, 'criterion': 'entropy'}.
Trial 1257 finished with value: 0.717391304347826 and parameters: {'n_estimators': 888, 'max_depth': 13, 'min_samples_split': 113, 'min_samples_leaf': 58, 'criterion': 'entropy'}.
Trial 1258 finished with value: 0.6847826086956522 and parameters: {'n_estimators': 787, 'max_depth': 15, 'min_samples_split': 50, 'min_samples_leaf': 45, 'criterion': 'entropy'}.
Trial 1259 finished with value: 0.7065217391304348 and parameters: {'n_estimators': 812, 'max_depth': 10, 'min_samples_split': 28, 'min_samples_leaf': 47, 'criterion': 'entropy'}.
Trial 1260 finished with value: 0.6630434782608695 and parameters: {'n_estimators': 864, 'max_depth': 19, 'min_samples_split': 16, 'min_samples_leaf': 61, 'criterion': 'entropy'}.
Trial 1261 finished with value: 0.6413043478260869 and parameters: {'n_estimators': 762, 'max_depth': 5, 'min_samples_split': 35, 'min_samples_leaf': 55, 'criterion': 'entropy'}.
Trial 1262 finished with value: 0.6739130434782609 and parameters: {'n_estimators': 579, 'max_depth': 8, 'min_samples_split': 23, 'min_samples_leaf': 51, 'criterion': 'entropy'}.
Trial 1263 finished with value: 0.6956521739130435 and parameters: {'n_estimators': 840, 'max_depth': 12, 'min_samples_split': 29, 'min_samples_leaf': 48, 'criterion': 'entropy'}.
Trial 1264 finished with value: 0.6847826086956522 and parameters: {'n_estimators': 821, 'max_depth': 16, 'min_samples_split': 41, 'min_samples_leaf': 43, 'criterion': 'entropy'}.
Trial 1265 finished with value: 0.6956521739130435 and parameters: {'n_estimators': 785, 'max_depth': 10, 'min_samples_split': 34, 'min_samples_leaf': 54, 'criterion': 'entropy'}.
Trial 1266 finished with value: 0.7065217391304348 and parameters: {'n_estimators': 854, 'max_depth': 8, 'min_samples_split': 25, 'min_samples_leaf': 50, 'criterion': 'entropy'}.
Trial 1267 finished with value: 0.7065217391304348 and parameters: {'n_estimators': 530, 'max_depth': 13, 'min_samples_split': 107, 'min_samples_leaf': 53, 'criterion': 'entropy'}.
Trial 1268 finished with value: 0.717391304347826 and parameters: {'n_estimators': 812, 'max_depth': 11, 'min_samples_split': 31, 'min_samples_leaf': 57, 'criterion': 'entropy'}.
Trial 1269 finished with value: 0.6630434782608695 and parameters: {'n_estimators': 772, 'max_depth': 7, 'min_samples_split': 39, 'min_samples_leaf': 49, 'criterion': 'entropy'}.
Trial 1270 finished with value: 0.7065217391304348 and parameters: {'n_estimators': 725, 'max_depth': 9, 'min_samples_split': 19, 'min_samples_leaf': 46, 'criterion': 'entropy'}.
Trial 1271 finished with value: 0.717391304347826 and parameters: {'n_estimators': 684, 'max_depth': 11, 'min_samples_split': 46, 'min_samples_leaf': 52, 'criterion': 'gini'}.
Trial 1272 finished with value: 0.6956521739130435 and parameters: {'n_estimators': 795, 'max_depth': 14, 'min_samples_split': 36, 'min_samples_leaf': 63, 'criterion': 'entropy'}.
Trial 1273 finished with value: 0.6956521739130435 and parameters: {'n_estimators': 932, 'max_depth': 9, 'min_samples_split': 80, 'min_samples_leaf': 59, 'criterion': 'entropy'}.
Trial 1274 finished with value: 0.6956521739130435 and parameters: {'n_estimators': 823, 'max_depth': 12, 'min_samples_split': 127, 'min_samples_leaf': 50, 'criterion': 'entropy'}.
Trial 1275 finished with value: 0.6739130434782609 and parameters: {'n_estimators': 756, 'max_depth': 6, 'min_samples_split': 27, 'min_samples_leaf': 55, 'criterion': 'entropy'}.
Trial 1276 finished with value: 0.6739130434782609 and parameters: {'n_estimators': 376, 'max_depth': 16, 'min_samples_split': 32, 'min_samples_leaf': 52, 'criterion': 'entropy'}.
Trial 1277 finished with value: 0.6956521739130435 and parameters: {'n_estimators': 803, 'max_depth': 10, 'min_samples_split': 22, 'min_samples_leaf': 48, 'criterion': 'entropy'}.
Trial 1278 finished with value: 0.6739130434782609 and parameters: {'n_estimators': 849, 'max_depth': 7, 'min_samples_split': 28, 'min_samples_leaf': 45, 'criterion': 'entropy'}.
Trial 1279 finished with value: 0.6956521739130435 and parameters: {'n_estimators': 833, 'max_depth': 14, 'min_samples_split': 101, 'min_samples_leaf': 53, 'criterion': 'entropy'}.
Trial 1280 finished with value: 0.6956521739130435 and parameters: {'n_estimators': 594, 'max_depth': 12, 'min_samples_split': 36, 'min_samples_leaf': 57, 'criterion': 'entropy'}.
Trial 1281 finished with value: 0.6956521739130435 and parameters: {'n_estimators': 745, 'max_depth': 9, 'min_samples_split': 94, 'min_samples_leaf': 50, 'criterion': 'entropy'}.
Trial 1282 finished with value: 0.6413043478260869 and parameters: {'n_estimators': 254, 'max_depth': 5, 'min_samples_split': 31, 'min_samples_leaf': 47, 'criterion': 'entropy'}.
Trial 1283 finished with value: 0.7282608695652174 and parameters: {'n_estimators': 498, 'max_depth': 10, 'min_samples_split': 42, 'min_samples_leaf': 54, 'criterion': 'entropy'}.
Trial 1284 finished with value: 0.6956521739130435 and parameters: {'n_estimators': 785, 'max_depth': 13, 'min_samples_split': 25, 'min_samples_leaf': 60, 'criterion': 'entropy'}.
Trial 1285 finished with value: 0.6956521739130435 and parameters: {'n_estimators': 871, 'max_depth': 8, 'min_samples_split': 17, 'min_samples_leaf': 51, 'criterion': 'entropy'}.
Trial 1286 finished with value: 0.6195652173913043 and parameters: {'n_estimators': 813, 'max_depth': 11, 'min_samples_split': 38, 'min_samples_leaf': 7, 'criterion': 'entropy'}.
Trial 1287 finished with value: 0.6739130434782609 and parameters: {'n_estimators': 840, 'max_depth': 17, 'min_samples_split': 119, 'min_samples_leaf': 56, 'criterion': 'entropy'}.
Trial 1288 finished with value: 0.6956521739130435 and parameters: {'n_estimators': 768, 'max_depth': 7, 'min_samples_split': 33, 'min_samples_leaf': 42, 'criterion': 'entropy'}.
Trial 1289 finished with value: 0.717391304347826 and parameters: {'n_estimators': 793, 'max_depth': 14, 'min_samples_split': 23, 'min_samples_leaf': 49, 'criterion': 'entropy'}.
