Trial 6445 finished with value: 0.6847826086956522 and parameters: {'n_estimators': 305, 'max_depth': 15, 'min_samples_split': 105, 'min_samples_leaf': 54, 'criterion': 'entropy'}.
Trial 6446 finished with value: 0.6956521739130435 and parameters: {'n_estimators': 244, 'max_depth': 10, 'min_samples_split': 132, 'min_samples_leaf': 69, 'criterion': 'entropy'}.
Trial 6447 finished with value: 0.7065217391304348 and parameters: {'n_estimators': 764, 'max_depth': 7, 'min_samples_split': 39, 'min_samples_leaf': 60, 'criterion': 'gini'}.
Trial 6448 finished with value: 0.6956521739130435 and parameters: {'n_estimators': 791, 'max_depth': 13, 'min_samples_split': 29, 'min_samples_leaf': 57, 'criterion': 'entropy'}.
Trial 6449 finished with value: 0.7065217391304348 and parameters: {'n_estimators': 354, 'max_depth': 9, 'min_samples_split': 21, 'min_samples_leaf': 63, 'criterion': 'gini'}.
Trial 6450 finished with value: 0.6739130434782609 and parameters: {'n_estimators': 286, 'max_depth': 5, 'min_samples_split': 26, 'min_samples_leaf': 67, 'criterion': 'entropy'}.
Trial 6451 finished with value: 0.7282608695652174 and parameters: {'n_estimators': 268, 'max_depth': 11, 'min_samples_split': 33, 'min_samples_leaf': 53, 'criterion': 'gini'}.
Trial 6452 finished with value: 0.6956521739130435 and parameters: {'n_estimators': 332, 'max_depth': 15, 'min_samples_split': 123, 'min_samples_leaf': 72, 'criterion': 'entropy'}.
Trial 6453 finished with value: 0.7065217391304348 and parameters: {'n_estimators': 517, 'max_depth': 9, 'min_samples_split': 57, 'min_samples_leaf': 76, 'criterion': 'gini'}.
Trial 6454 finished with value: 0.7065217391304348 and parameters: {'n_estimators': 681, 'max_depth': 13, 'min_samples_split': 136, 'min_samples_leaf': 55, 'criterion': 'entropy'}.
Trial 6455 finished with value: 0.7282608695652174 and parameters: {'n_estimators': 294, 'max_depth': 11, 'min_samples_split': 35, 'min_samples_leaf': 59, 'criterion': 'entropy'}.
Trial 6456 finished with value: 0.7065217391304348 and parameters: {'n_estimators': 726, 'max_depth': 7, 'min_samples_split': 29, 'min_samples_leaf': 62, 'criterion': 'gini'}.
Trial 6457 finished with value: 0.7065217391304348 and parameters: {'n_estimators': 259, 'max_depth': 9, 'min_samples_split': 38, 'min_samples_leaf': 74, 'criterion': 'entropy'}.
Trial 6458 finished with value: 0.7065217391304348 and parameters: {'n_estimators': 748, 'max_depth': 12, 'min_samples_split': 128, 'min_samples_leaf': 57, 'criterion': 'gini'}.
Trial 6459 finished with value: 0.717391304347826 and parameters: {'n_estimators': 386, 'max_depth': 14, 'min_samples_split': 20, 'min_samples_leaf': 60, 'criterion': 'entropy'}.
Trial 6460 finished with value: 0.6847826086956522 and parameters: {'n_estimators': 231, 'max_depth': 7, 'min_samples_split': 13, 'min_samples_leaf': 56, 'criterion': 'gini'}.
Trial 6461 finished with value: 0.7282608695652174 and parameters: {'n_estimators': 275, 'max_depth': 10, 'min_samples_split': 25, 'min_samples_leaf': 58, 'criterion': 'entropy'}.
Trial 6462 finished with value: 0.6739130434782609 and parameters: {'n_estimators': 307, 'max_depth': 37, 'min_samples_split': 45, 'min_samples_leaf': 65, 'criterion': 'gini'}.
Trial 6463 finished with value: 0.6956521739130435 and parameters: {'n_estimators': 246, 'max_depth': 17, 'min_samples_split': 32, 'min_samples_leaf': 68, 'criterion': 'entropy'}.
Trial 6464 finished with value: 0.717391304347826 and parameters: {'n_estimators': 776, 'max_depth': 11, 'min_samples_split': 38, 'min_samples_leaf': 61, 'criterion': 'entropy'}.
Trial 6465 finished with value: 0.6413043478260869 and parameters: {'n_estimators': 293, 'max_depth': 5, 'min_samples_split': 28, 'min_samples_leaf': 51, 'criterion': 'gini'}.
Trial 6466 finished with value: 0.7065217391304348 and parameters: {'n_estimators': 798, 'max_depth': 8, 'min_samples_split': 137, 'min_samples_leaf': 71, 'criterion': 'entropy'}.
Trial 6467 finished with value: 0.6847826086956522 and parameters: {'n_estimators': 206, 'max_depth': 13, 'min_samples_split': 33, 'min_samples_leaf': 53, 'criterion': 'gini'}.
Trial 6468 finished with value: 0.7065217391304348 and parameters: {'n_estimators': 264, 'max_depth': 10, 'min_samples_split': 118, 'min_samples_leaf': 55, 'criterion': 'entropy'}.
Trial 6469 finished with value: 0.6630434782608695 and parameters: {'n_estimators': 320, 'max_depth': 15, 'min_samples_split': 95, 'min_samples_leaf': 58, 'criterion': 'gini'}.
Trial 6470 finished with value: 0.6956521739130435 and parameters: {'n_estimators': 282, 'max_depth': 8, 'min_samples_split': 25, 'min_samples_leaf': 62, 'criterion': 'entropy'}.
Trial 6471 finished with value: 0.6956521739130435 and parameters: {'n_estimators': 647, 'max_depth': 12, 'min_samples_split': 41, 'min_samples_leaf': 60, 'criterion': 'gini'}.
Trial 6472 finished with value: 0.6739130434782609 and parameters: {'n_estimators': 749, 'max_depth': 44, 'min_samples_split': 16, 'min_samples_leaf': 56, 'criterion': 'entropy'}.
Trial 6473 finished with value: 0.7065217391304348 and parameters: {'n_estimators': 695, 'max_depth': 11, 'min_samples_split': 132, 'min_samples_leaf': 64, 'criterion': 'entropy'}.
Trial 6474 finished with value: 0.6847826086956522 and parameters: {'n_estimators': 247, 'max_depth': 6, 'min_samples_split': 36, 'min_samples_leaf': 58, 'criterion': 'gini'}.
Trial 6475 finished with value: 0.6847826086956522 and parameters: {'n_estimators': 720, 'max_depth': 19, 'min_samples_split': 30, 'min_samples_leaf': 74, 'criterion': 'entropy'}.
Trial 6476 finished with value: 0.6956521739130435 and parameters: {'n_estimators': 306, 'max_depth': 14, 'min_samples_split': 21, 'min_samples_leaf': 60, 'criterion': 'gini'}.
Trial 6477 finished with value: 0.6956521739130435 and parameters: {'n_estimators': 222, 'max_depth': 9, 'min_samples_split': 35, 'min_samples_leaf': 66, 'criterion': 'entropy'}.
Trial 6478 finished with value: 0.6956521739130435 and parameters: {'n_estimators': 279, 'max_depth': 7, 'min_samples_split': 112, 'min_samples_leaf': 70, 'criterion': 'gini'}.
Trial 6479 finished with value: 0.6956521739130435 and parameters: {'n_estimators': 764, 'max_depth': 11, 'min_samples_split': 137, 'min_samples_leaf': 54, 'criterion': 'entropy'}.
Trial 6480 finished with value: 0.7282608695652174 and parameters: {'n_estimators': 260, 'max_depth': 9, 'min_samples_split': 42, 'min_samples_leaf': 62, 'criterion': 'gini'}.
Trial 6481 finished with value: 0.6630434782608695 and parameters: {'n_estimators': 292, 'max_depth': 16, 'min_samples_split': 30, 'min_samples_leaf': 57, 'criterion': 'entropy'}.
Trial 6482 finished with value: 0.6847826086956522 and parameters: {'n_estimators': 340, 'max_depth': 71, 'min_samples_split': 50, 'min_samples_leaf': 72, 'criterion': 'entropy'}.
Trial 6483 finished with value: 0.6739130434782609 and parameters: {'n_estimators': 368, 'max_depth': 13, 'min_samples_split': 127, 'min_samples_leaf': 77, 'criterion': 'gini'}.
Trial 6484 finished with value: 0.717391304347826 and parameters: {'n_estimators': 267, 'max_depth': 10, 'min_samples_split': 24, 'min_samples_leaf': 59, 'criterion': 'entropy'}.
Trial 6485 finished with value: 0.6521739130434783 and parameters: {'n_estimators': 312, 'max_depth': 7, 'min_samples_split': 38, 'min_samples_leaf': 37, 'criterion': 'gini'}.
Trial 6486 finished with value: 0.717391304347826 and parameters: {'n_estimators': 235, 'max_depth': 12, 'min_samples_split': 33, 'min_samples_leaf': 52, 'criterion': 'entropy'}.
Trial 6487 finished with value: 0.6413043478260869 and parameters: {'n_estimators': 284, 'max_depth': 5, 'min_samples_split': 28, 'min_samples_leaf': 55, 'criterion': 'gini'}.
Trial 6488 finished with value: 0.6956521739130435 and parameters: {'n_estimators': 738, 'max_depth': 9, 'min_samples_split': 123, 'min_samples_leaf': 63, 'criterion': 'entropy'}.
Trial 6489 finished with value: 0.6739130434782609 and parameters: {'n_estimators': 256, 'max_depth': 14, 'min_samples_split': 17, 'min_samples_leaf': 57, 'criterion': 'gini'}.
Trial 6490 finished with value: 0.7065217391304348 and parameters: {'n_estimators': 130, 'max_depth': 11, 'min_samples_split': 44, 'min_samples_leaf': 60, 'criterion': 'entropy'}.
Trial 6491 finished with value: 0.7282608695652174 and parameters: {'n_estimators': 998, 'max_depth': 8, 'min_samples_split': 138, 'min_samples_leaf': 68, 'criterion': 'entropy'}.
Trial 6492 finished with value: 0.6847826086956522 and parameters: {'n_estimators': 300, 'max_depth': 13, 'min_samples_split': 36, 'min_samples_leaf': 58, 'criterion': 'gini'}.
Trial 6493 finished with value: 0.6847826086956522 and parameters: {'n_estimators': 785, 'max_depth': 17, 'min_samples_split': 9, 'min_samples_leaf': 61, 'criterion': 'entropy'}.
Trial 6494 finished with value: 0.7282608695652174 and parameters: {'n_estimators': 327, 'max_depth': 10, 'min_samples_split': 22, 'min_samples_leaf': 55, 'criterion': 'gini'}.
Trial 6495 finished with value: 0.7065217391304348 and parameters: {'n_estimators': 272, 'max_depth': 7, 'min_samples_split': 32, 'min_samples_leaf': 75, 'criterion': 'entropy'}.
Trial 6496 finished with value: 0.6956521739130435 and parameters: {'n_estimators': 408, 'max_depth': 15, 'min_samples_split': 120, 'min_samples_leaf': 65, 'criterion': 'gini'}.
Trial 6497 finished with value: 0.6847826086956522 and parameters: {'n_estimators': 759, 'max_depth': 12, 'min_samples_split': 132, 'min_samples_leaf': 59, 'criterion': 'entropy'}.
Trial 6498 finished with value: 0.6739130434782609 and parameters: {'n_estimators': 181, 'max_depth': 9, 'min_samples_split': 26, 'min_samples_leaf': 53, 'criterion': 'gini'}.
Trial 6499 finished with value: 0.717391304347826 and parameters: {'n_estimators': 248, 'max_depth': 11, 'min_samples_split': 41, 'min_samples_leaf': 56, 'criterion': 'entropy'}.
Trial 6500 finished with value: 0.6739130434782609 and parameters: {'n_estimators': 286, 'max_depth': 6, 'min_samples_split': 108, 'min_samples_leaf': 62, 'criterion': 'gini'}.
Trial 6501 finished with value: 0.6847826086956522 and parameters: {'n_estimators': 152, 'max_depth': 8, 'min_samples_split': 30, 'min_samples_leaf': 70, 'criterion': 'entropy'}.
Trial 6502 finished with value: 0.6847826086956522 and parameters: {'n_estimators': 312, 'max_depth': 14, 'min_samples_split': 37, 'min_samples_leaf': 58, 'criterion': 'entropy'}.
Trial 6503 finished with value: 0.5543478260869565 and parameters: {'n_estimators': 230, 'max_depth': 41, 'min_samples_split': 26, 'min_samples_leaf': 13, 'criterion': 'gini'}.
Trial 6504 finished with value: 0.7065217391304348 and parameters: {'n_estimators': 715, 'max_depth': 10, 'min_samples_split': 61, 'min_samples_leaf': 73, 'criterion': 'entropy'}.
Trial 6505 finished with value: 0.6956521739130435 and parameters: {'n_estimators': 270, 'max_depth': 11, 'min_samples_split': 46, 'min_samples_leaf': 63, 'criterion': 'gini'}.
Trial 6506 finished with value: 0.6956521739130435 and parameters: {'n_estimators': 779, 'max_depth': 13, 'min_samples_split': 20, 'min_samples_leaf': 60, 'criterion': 'entropy'}.
Trial 6507 finished with value: 0.6847826086956522 and parameters: {'n_estimators': 292, 'max_depth': 8, 'min_samples_split': 71, 'min_samples_leaf': 51, 'criterion': 'gini'}.
Trial 6508 finished with value: 0.6304347826086957 and parameters: {'n_estimators': 252, 'max_depth': 5, 'min_samples_split': 33, 'min_samples_leaf': 56, 'criterion': 'entropy'}.
Trial 6509 finished with value: 0.6847826086956522 and parameters: {'n_estimators': 211, 'max_depth': 16, 'min_samples_split': 139, 'min_samples_leaf': 54, 'criterion': 'gini'}.
Trial 6510 finished with value: 0.7065217391304348 and parameters: {'n_estimators': 325, 'max_depth': 12, 'min_samples_split': 39, 'min_samples_leaf': 67, 'criterion': 'entropy'}.
Trial 6511 finished with value: 0.6956521739130435 and parameters: {'n_estimators': 801, 'max_depth': 9, 'min_samples_split': 31, 'min_samples_leaf': 58, 'criterion': 'entropy'}.
Trial 6512 finished with value: 0.6847826086956522 and parameters: {'n_estimators': 271, 'max_depth': 7, 'min_samples_split': 28, 'min_samples_leaf': 61, 'criterion': 'gini'}.
Trial 6513 finished with value: 0.717391304347826 and parameters: {'n_estimators': 302, 'max_depth': 10, 'min_samples_split': 129, 'min_samples_leaf': 64, 'criterion': 'entropy'}.
Trial 6514 finished with value: 0.6956521739130435 and parameters: {'n_estimators': 353, 'max_depth': 14, 'min_samples_split': 36, 'min_samples_leaf': 72, 'criterion': 'gini'}.
Trial 6515 finished with value: 0.6956521739130435 and parameters: {'n_estimators': 753, 'max_depth': 12, 'min_samples_split': 15, 'min_samples_leaf': 56, 'criterion': 'entropy'}.
Trial 6516 finished with value: 0.6739130434782609 and parameters: {'n_estimators': 735, 'max_depth': 18, 'min_samples_split': 115, 'min_samples_leaf': 59, 'criterion': 'gini'}.
Trial 6517 finished with value: 0.6847826086956522 and parameters: {'n_estimators': 274, 'max_depth': 9, 'min_samples_split': 135, 'min_samples_leaf': 57, 'criterion': 'entropy'}.
Trial 6518 finished with value: 0.6847826086956522 and parameters: {'n_estimators': 241, 'max_depth': 7, 'min_samples_split': 26, 'min_samples_leaf': 78, 'criterion': 'gini'}.
Trial 6519 finished with value: 0.6956521739130435 and parameters: {'n_estimators': 290, 'max_depth': 11, 'min_samples_split': 22, 'min_samples_leaf': 69, 'criterion': 'entropy'}.
Trial 6520 finished with value: 0.6847826086956522 and parameters: {'n_estimators': 258, 'max_depth': 13, 'min_samples_split': 41, 'min_samples_leaf': 53, 'criterion': 'entropy'}.
Trial 6521 finished with value: 0.7065217391304348 and parameters: {'n_estimators': 315, 'max_depth': 9, 'min_samples_split': 33, 'min_samples_leaf': 61, 'criterion': 'gini'}.
Trial 6522 finished with value: 0.6739130434782609 and parameters: {'n_estimators': 283, 'max_depth': 15, 'min_samples_split': 36, 'min_samples_leaf': 74, 'criterion': 'entropy'}.
Trial 6523 finished with value: 0.6413043478260869 and parameters: {'n_estimators': 301, 'max_depth': 5, 'min_samples_split': 29, 'min_samples_leaf': 59, 'criterion': 'gini'}.
Trial 6524 finished with value: 0.6847826086956522 and parameters: {'n_estimators': 259, 'max_depth': 11, 'min_samples_split': 100, 'min_samples_leaf': 65, 'criterion': 'entropy'}.
Trial 6525 finished with value: 0.6739130434782609 and parameters: {'n_estimators': 665, 'max_depth': 7, 'min_samples_split': 24, 'min_samples_leaf': 55, 'criterion': 'gini'}.
Trial 6526 finished with value: 0.717391304347826 and parameters: {'n_estimators': 768, 'max_depth': 10, 'min_samples_split': 48, 'min_samples_leaf': 62, 'criterion': 'entropy'}.
Trial 6527 finished with value: 0.6956521739130435 and parameters: {'n_estimators': 472, 'max_depth': 13, 'min_samples_split': 122, 'min_samples_leaf': 57, 'criterion': 'gini'}.
Trial 6528 finished with value: 0.7065217391304348 and parameters: {'n_estimators': 225, 'max_depth': 8, 'min_samples_split': 133, 'min_samples_leaf': 60, 'criterion': 'entropy'}.
Trial 6529 finished with value: 0.6739130434782609 and parameters: {'n_estimators': 913, 'max_depth': 16, 'min_samples_split': 139, 'min_samples_leaf': 51, 'criterion': 'entropy'}.
Trial 6530 finished with value: 0.6847826086956522 and parameters: {'n_estimators': 329, 'max_depth': 22, 'min_samples_split': 39, 'min_samples_leaf': 72, 'criterion': 'gini'}.
Trial 6531 finished with value: 0.6956521739130435 and parameters: {'n_estimators': 959, 'max_depth': 12, 'min_samples_split': 33, 'min_samples_leaf': 76, 'criterion': 'entropy'}.
Trial 6532 finished with value: 0.6847826086956522 and parameters: {'n_estimators': 282, 'max_depth': 87, 'min_samples_split': 20, 'min_samples_leaf': 58, 'criterion': 'gini'}.
Trial 6533 finished with value: 0.7065217391304348 and parameters: {'n_estimators': 245, 'max_depth': 10, 'min_samples_split': 29, 'min_samples_leaf': 63, 'criterion': 'entropy'}.
Trial 6534 finished with value: 0.6956521739130435 and parameters: {'n_estimators': 800, 'max_depth': 14, 'min_samples_split': 34, 'min_samples_leaf': 54, 'criterion': 'gini'}.
Trial 6535 finished with value: 0.717391304347826 and parameters: {'n_estimators': 724, 'max_depth': 8, 'min_samples_split': 44, 'min_samples_leaf': 56, 'criterion': 'entropy'}.
Trial 6536 finished with value: 0.6847826086956522 and parameters: {'n_estimators': 304, 'max_depth': 11, 'min_samples_split': 186, 'min_samples_leaf': 60, 'criterion': 'gini'}.
Trial 6537 finished with value: 0.6739130434782609 and parameters: {'n_estimators': 266, 'max_depth': 5, 'min_samples_split': 126, 'min_samples_leaf': 67, 'criterion': 'entropy'}.
Trial 6538 finished with value: 0.6847826086956522 and parameters: {'n_estimators': 743, 'max_depth': 9, 'min_samples_split': 27, 'min_samples_leaf': 71, 'criterion': 'entropy'}.
Trial 6539 finished with value: 0.717391304347826 and parameters: {'n_estimators': 192, 'max_depth': 12, 'min_samples_split': 39, 'min_samples_leaf': 58, 'criterion': 'gini'}.
Trial 6540 finished with value: 0.6956521739130435 and parameters: {'n_estimators': 276, 'max_depth': 7, 'min_samples_split': 118, 'min_samples_leaf': 62, 'criterion': 'entropy'}.
Trial 6541 finished with value: 0.6739130434782609 and parameters: {'n_estimators': 765, 'max_depth': 19, 'min_samples_split': 24, 'min_samples_leaf': 53, 'criterion': 'gini'}.
Trial 6542 finished with value: 0.6847826086956522 and parameters: {'n_estimators': 340, 'max_depth': 15, 'min_samples_split': 32, 'min_samples_leaf': 55, 'criterion': 'entropy'}.
Trial 6543 finished with value: 0.6739130434782609 and parameters: {'n_estimators': 700, 'max_depth': 31, 'min_samples_split': 18, 'min_samples_leaf': 69, 'criterion': 'gini'}.
Trial 6544 finished with value: 0.7065217391304348 and parameters: {'n_estimators': 783, 'max_depth': 9, 'min_samples_split': 135, 'min_samples_leaf': 65, 'criterion': 'entropy'}.
Trial 6545 finished with value: 0.7065217391304348 and parameters: {'n_estimators': 291, 'max_depth': 13, 'min_samples_split': 88, 'min_samples_leaf': 59, 'criterion': 'gini'}.
Trial 6546 finished with value: 0.7065217391304348 and parameters: {'n_estimators': 235, 'max_depth': 11, 'min_samples_split': 36, 'min_samples_leaf': 57, 'criterion': 'entropy'}.
Trial 6547 finished with value: 0.6847826086956522 and parameters: {'n_estimators': 314, 'max_depth': 7, 'min_samples_split': 130, 'min_samples_leaf': 61, 'criterion': 'entropy'}.
Trial 6548 finished with value: 0.6739130434782609 and parameters: {'n_estimators': 881, 'max_depth': 17, 'min_samples_split': 42, 'min_samples_leaf': 75, 'criterion': 'gini'}.
Trial 6549 finished with value: 0.7065217391304348 and parameters: {'n_estimators': 257, 'max_depth': 10, 'min_samples_split': 30, 'min_samples_leaf': 59, 'criterion': 'entropy'}.
Trial 6550 finished with value: 0.7065217391304348 and parameters: {'n_estimators': 281, 'max_depth': 14, 'min_samples_split': 138, 'min_samples_leaf': 63, 'criterion': 'gini'}.
Trial 6551 finished with value: 0.6847826086956522 and parameters: {'n_estimators': 301, 'max_depth': 6, 'min_samples_split': 81, 'min_samples_leaf': 56, 'criterion': 'entropy'}.
Trial 6552 finished with value: 0.6739130434782609 and parameters: {'n_estimators': 213, 'max_depth': 12, 'min_samples_split': 112, 'min_samples_leaf': 79, 'criterion': 'gini'}.
Trial 6553 finished with value: 0.7065217391304348 and parameters: {'n_estimators': 598, 'max_depth': 9, 'min_samples_split': 10, 'min_samples_leaf': 53, 'criterion': 'entropy'}.
Trial 6554 finished with value: 0.7065217391304348 and parameters: {'n_estimators': 263, 'max_depth': 11, 'min_samples_split': 35, 'min_samples_leaf': 73, 'criterion': 'gini'}.
Trial 6555 finished with value: 0.7065217391304348 and parameters: {'n_estimators': 244, 'max_depth': 8, 'min_samples_split': 24, 'min_samples_leaf': 60, 'criterion': 'entropy'}.
Trial 6556 finished with value: 0.6956521739130435 and parameters: {'n_estimators': 752, 'max_depth': 15, 'min_samples_split': 29, 'min_samples_leaf': 70, 'criterion': 'gini'}.
Trial 6557 finished with value: 0.7391304347826086 and parameters: {'n_estimators': 314, 'max_depth': 10, 'min_samples_split': 55, 'min_samples_leaf': 58, 'criterion': 'entropy'}.
Trial 6558 finished with value: 0.6847826086956522 and parameters: {'n_estimators': 285, 'max_depth': 13, 'min_samples_split': 20, 'min_samples_leaf': 66, 'criterion': 'entropy'}.
Trial 6559 finished with value: 0.6739130434782609 and parameters: {'n_estimators': 977, 'max_depth': 6, 'min_samples_split': 40, 'min_samples_leaf': 55, 'criterion': 'gini'}.
Trial 6560 finished with value: 0.7065217391304348 and parameters: {'n_estimators': 328, 'max_depth': 8, 'min_samples_split': 15, 'min_samples_leaf': 61, 'criterion': 'entropy'}.
Trial 6561 finished with value: 0.7282608695652174 and parameters: {'n_estimators': 930, 'max_depth': 12, 'min_samples_split': 32, 'min_samples_leaf': 57, 'criterion': 'gini'}.
Trial 6562 finished with value: 0.6847826086956522 and parameters: {'n_estimators': 268, 'max_depth': 80, 'min_samples_split': 46, 'min_samples_leaf': 63, 'criterion': 'entropy'}.
Trial 6563 finished with value: 0.7065217391304348 and parameters: {'n_estimators': 735, 'max_depth': 10, 'min_samples_split': 139, 'min_samples_leaf': 59, 'criterion': 'gini'}.
Trial 6564 finished with value: 0.6847826086956522 and parameters: {'n_estimators': 120, 'max_depth': 16, 'min_samples_split': 197, 'min_samples_leaf': 51, 'criterion': 'entropy'}.
Trial 6565 finished with value: 0.6413043478260869 and parameters: {'n_estimators': 781, 'max_depth': 5, 'min_samples_split': 27, 'min_samples_leaf': 55, 'criterion': 'gini'}.
Trial 6566 finished with value: 0.6956521739130435 and parameters: {'n_estimators': 296, 'max_depth': 9, 'min_samples_split': 38, 'min_samples_leaf': 68, 'criterion': 'entropy'}.
Trial 6567 finished with value: 0.6956521739130435 and parameters: {'n_estimators': 715, 'max_depth': 13, 'min_samples_split': 124, 'min_samples_leaf': 61, 'criterion': 'entropy'}.
