Trial 8901 finished with value: 0.6847826086956522 and parameters: {'n_estimators': 247, 'max_depth': 98, 'min_samples_split': 15, 'min_samples_leaf': 58, 'criterion': 'gini'}.
Trial 8902 finished with value: 0.7065217391304348 and parameters: {'n_estimators': 292, 'max_depth': 10, 'min_samples_split': 200, 'min_samples_leaf': 54, 'criterion': 'entropy'}.
Trial 8903 finished with value: 0.6521739130434783 and parameters: {'n_estimators': 810, 'max_depth': 5, 'min_samples_split': 27, 'min_samples_leaf': 59, 'criterion': 'entropy'}.
Trial 8904 finished with value: 0.7391304347826086 and parameters: {'n_estimators': 272, 'max_depth': 9, 'min_samples_split': 37, 'min_samples_leaf': 56, 'criterion': 'gini'}.
Trial 8905 finished with value: 0.6956521739130435 and parameters: {'n_estimators': 756, 'max_depth': 13, 'min_samples_split': 23, 'min_samples_leaf': 62, 'criterion': 'entropy'}.
Trial 8906 finished with value: 0.6739130434782609 and parameters: {'n_estimators': 232, 'max_depth': 7, 'min_samples_split': 34, 'min_samples_leaf': 65, 'criterion': 'gini'}.
Trial 8907 finished with value: 0.7065217391304348 and parameters: {'n_estimators': 318, 'max_depth': 11, 'min_samples_split': 29, 'min_samples_leaf': 58, 'criterion': 'entropy'}.
Trial 8908 finished with value: 0.6956521739130435 and parameters: {'n_estimators': 706, 'max_depth': 8, 'min_samples_split': 19, 'min_samples_leaf': 54, 'criterion': 'entropy'}.
Trial 8909 finished with value: 0.6847826086956522 and parameters: {'n_estimators': 328, 'max_depth': 11, 'min_samples_split': 45, 'min_samples_leaf': 86, 'criterion': 'gini'}.
Trial 8910 finished with value: 0.6847826086956522 and parameters: {'n_estimators': 908, 'max_depth': 15, 'min_samples_split': 110, 'min_samples_leaf': 60, 'criterion': 'entropy'}.
Trial 8911 finished with value: 0.6739130434782609 and parameters: {'n_estimators': 298, 'max_depth': 81, 'min_samples_split': 49, 'min_samples_leaf': 51, 'criterion': 'gini'}.
Trial 8912 finished with value: 0.6521739130434783 and parameters: {'n_estimators': 260, 'max_depth': 18, 'min_samples_split': 32, 'min_samples_leaf': 56, 'criterion': 'entropy'}.
Trial 8913 finished with value: 0.7065217391304348 and parameters: {'n_estimators': 278, 'max_depth': 13, 'min_samples_split': 36, 'min_samples_leaf': 63, 'criterion': 'gini'}.
Trial 8914 finished with value: 0.7065217391304348 and parameters: {'n_estimators': 1000, 'max_depth': 9, 'min_samples_split': 41, 'min_samples_leaf': 58, 'criterion': 'entropy'}.
Trial 8915 finished with value: 0.6847826086956522 and parameters: {'n_estimators': 248, 'max_depth': 7, 'min_samples_split': 27, 'min_samples_leaf': 60, 'criterion': 'entropy'}.
Trial 8916 finished with value: 0.6956521739130435 and parameters: {'n_estimators': 300, 'max_depth': 76, 'min_samples_split': 31, 'min_samples_leaf': 55, 'criterion': 'gini'}.
Trial 8917 finished with value: 0.7065217391304348 and parameters: {'n_estimators': 733, 'max_depth': 11, 'min_samples_split': 124, 'min_samples_leaf': 53, 'criterion': 'entropy'}.
Trial 8918 finished with value: 0.6847826086956522 and parameters: {'n_estimators': 277, 'max_depth': 13, 'min_samples_split': 22, 'min_samples_leaf': 62, 'criterion': 'gini'}.
Trial 8919 finished with value: 0.717391304347826 and parameters: {'n_estimators': 788, 'max_depth': 10, 'min_samples_split': 36, 'min_samples_leaf': 57, 'criterion': 'entropy'}.
Trial 8920 finished with value: 0.6304347826086957 and parameters: {'n_estimators': 372, 'max_depth': 5, 'min_samples_split': 25, 'min_samples_leaf': 61, 'criterion': 'entropy'}.
Trial 8921 finished with value: 0.6847826086956522 and parameters: {'n_estimators': 200, 'max_depth': 8, 'min_samples_split': 42, 'min_samples_leaf': 59, 'criterion': 'gini'}.
Trial 8922 finished with value: 0.6956521739130435 and parameters: {'n_estimators': 828, 'max_depth': 15, 'min_samples_split': 7, 'min_samples_leaf': 56, 'criterion': 'entropy'}.
Trial 8923 finished with value: 0.7065217391304348 and parameters: {'n_estimators': 406, 'max_depth': 11, 'min_samples_split': 31, 'min_samples_leaf': 65, 'criterion': 'gini'}.
Trial 8924 finished with value: 0.6956521739130435 and parameters: {'n_estimators': 328, 'max_depth': 9, 'min_samples_split': 36, 'min_samples_leaf': 48, 'criterion': 'entropy'}.
Trial 8925 finished with value: 0.7282608695652174 and parameters: {'n_estimators': 241, 'max_depth': 12, 'min_samples_split': 27, 'min_samples_leaf': 58, 'criterion': 'entropy'}.
Trial 8926 finished with value: 0.6630434782608695 and parameters: {'n_estimators': 761, 'max_depth': 7, 'min_samples_split': 18, 'min_samples_leaf': 53, 'criterion': 'gini'}.
Trial 8927 finished with value: 0.7065217391304348 and parameters: {'n_estimators': 268, 'max_depth': 16, 'min_samples_split': 51, 'min_samples_leaf': 63, 'criterion': 'entropy'}.
Trial 8928 finished with value: 0.7282608695652174 and parameters: {'n_estimators': 299, 'max_depth': 10, 'min_samples_split': 38, 'min_samples_leaf': 55, 'criterion': 'gini'}.
Trial 8929 finished with value: 0.6521739130434783 and parameters: {'n_estimators': 225, 'max_depth': 43, 'min_samples_split': 33, 'min_samples_leaf': 60, 'criterion': 'entropy'}.
Trial 8930 finished with value: 0.6847826086956522 and parameters: {'n_estimators': 282, 'max_depth': 6, 'min_samples_split': 119, 'min_samples_leaf': 57, 'criterion': 'gini'}.
Trial 8931 finished with value: 0.7065217391304348 and parameters: {'n_estimators': 346, 'max_depth': 13, 'min_samples_split': 43, 'min_samples_leaf': 61, 'criterion': 'entropy'}.
Trial 8932 finished with value: 0.717391304347826 and parameters: {'n_estimators': 959, 'max_depth': 8, 'min_samples_split': 96, 'min_samples_leaf': 59, 'criterion': 'entropy'}.
Trial 8933 finished with value: 0.7282608695652174 and parameters: {'n_estimators': 258, 'max_depth': 10, 'min_samples_split': 21, 'min_samples_leaf': 51, 'criterion': 'gini'}.
Trial 8934 finished with value: 0.7065217391304348 and parameters: {'n_estimators': 744, 'max_depth': 14, 'min_samples_split': 125, 'min_samples_leaf': 56, 'criterion': 'entropy'}.
Trial 8935 finished with value: 0.7065217391304348 and parameters: {'n_estimators': 771, 'max_depth': 12, 'min_samples_split': 30, 'min_samples_leaf': 54, 'criterion': 'gini'}.
Trial 8936 finished with value: 0.6847826086956522 and parameters: {'n_estimators': 310, 'max_depth': 18, 'min_samples_split': 46, 'min_samples_leaf': 58, 'criterion': 'entropy'}.
Trial 8937 finished with value: 0.7065217391304348 and parameters: {'n_estimators': 289, 'max_depth': 9, 'min_samples_split': 39, 'min_samples_leaf': 64, 'criterion': 'entropy'}.
Trial 8938 finished with value: 0.6956521739130435 and parameters: {'n_estimators': 263, 'max_depth': 12, 'min_samples_split': 156, 'min_samples_leaf': 61, 'criterion': 'gini'}.
Trial 8939 finished with value: 0.6630434782608695 and parameters: {'n_estimators': 434, 'max_depth': 7, 'min_samples_split': 27, 'min_samples_leaf': 57, 'criterion': 'entropy'}.
Trial 8940 finished with value: 0.7282608695652174 and parameters: {'n_estimators': 719, 'max_depth': 10, 'min_samples_split': 15, 'min_samples_leaf': 55, 'criterion': 'gini'}.
Trial 8941 finished with value: 0.6739130434782609 and parameters: {'n_estimators': 803, 'max_depth': 15, 'min_samples_split': 24, 'min_samples_leaf': 59, 'criterion': 'entropy'}.
Trial 8942 finished with value: 0.6413043478260869 and parameters: {'n_estimators': 281, 'max_depth': 5, 'min_samples_split': 36, 'min_samples_leaf': 32, 'criterion': 'entropy'}.
Trial 8943 finished with value: 0.7065217391304348 and parameters: {'n_estimators': 311, 'max_depth': 11, 'min_samples_split': 33, 'min_samples_leaf': 52, 'criterion': 'gini'}.
Trial 8944 finished with value: 0.717391304347826 and parameters: {'n_estimators': 240, 'max_depth': 9, 'min_samples_split': 40, 'min_samples_leaf': 62, 'criterion': 'entropy'}.
Trial 8945 finished with value: 0.6956521739130435 and parameters: {'n_estimators': 330, 'max_depth': 13, 'min_samples_split': 30, 'min_samples_leaf': 65, 'criterion': 'gini'}.
Trial 8946 finished with value: 0.7282608695652174 and parameters: {'n_estimators': 261, 'max_depth': 8, 'min_samples_split': 34, 'min_samples_leaf': 57, 'criterion': 'entropy'}.
Trial 8947 finished with value: 0.6847826086956522 and parameters: {'n_estimators': 662, 'max_depth': 14, 'min_samples_split': 11, 'min_samples_leaf': 61, 'criterion': 'entropy'}.
Trial 8948 finished with value: 0.6956521739130435 and parameters: {'n_estimators': 297, 'max_depth': 11, 'min_samples_split': 115, 'min_samples_leaf': 54, 'criterion': 'gini'}.
Trial 8949 finished with value: 0.6956521739130435 and parameters: {'n_estimators': 283, 'max_depth': 7, 'min_samples_split': 27, 'min_samples_leaf': 59, 'criterion': 'entropy'}.
Trial 8950 finished with value: 0.6956521739130435 and parameters: {'n_estimators': 777, 'max_depth': 17, 'min_samples_split': 43, 'min_samples_leaf': 57, 'criterion': 'gini'}.
Trial 8951 finished with value: 0.6847826086956522 and parameters: {'n_estimators': 517, 'max_depth': 9, 'min_samples_split': 180, 'min_samples_leaf': 81, 'criterion': 'entropy'}.
Trial 8952 finished with value: 0.6739130434782609 and parameters: {'n_estimators': 238, 'max_depth': 12, 'min_samples_split': 21, 'min_samples_leaf': 50, 'criterion': 'gini'}.
Trial 8953 finished with value: 0.6739130434782609 and parameters: {'n_estimators': 741, 'max_depth': 6, 'min_samples_split': 38, 'min_samples_leaf': 60, 'criterion': 'entropy'}.
Trial 8954 finished with value: 0.717391304347826 and parameters: {'n_estimators': 266, 'max_depth': 10, 'min_samples_split': 35, 'min_samples_leaf': 55, 'criterion': 'entropy'}.
Trial 8955 finished with value: 0.6521739130434783 and parameters: {'n_estimators': 174, 'max_depth': 14, 'min_samples_split': 120, 'min_samples_leaf': 63, 'criterion': 'gini'}.
Trial 8956 finished with value: 0.7282608695652174 and parameters: {'n_estimators': 318, 'max_depth': 8, 'min_samples_split': 30, 'min_samples_leaf': 58, 'criterion': 'entropy'}.
Trial 8957 finished with value: 0.717391304347826 and parameters: {'n_estimators': 301, 'max_depth': 12, 'min_samples_split': 24, 'min_samples_leaf': 53, 'criterion': 'gini'}.
Trial 8958 finished with value: 0.7065217391304348 and parameters: {'n_estimators': 223, 'max_depth': 10, 'min_samples_split': 46, 'min_samples_leaf': 63, 'criterion': 'entropy'}.
Trial 8959 finished with value: 0.6739130434782609 and parameters: {'n_estimators': 252, 'max_depth': 16, 'min_samples_split': 18, 'min_samples_leaf': 60, 'criterion': 'entropy'}.
Trial 8960 finished with value: 0.6739130434782609 and parameters: {'n_estimators': 762, 'max_depth': 20, 'min_samples_split': 32, 'min_samples_leaf': 55, 'criterion': 'gini'}.
Trial 8961 finished with value: 0.6521739130434783 and parameters: {'n_estimators': 274, 'max_depth': 5, 'min_samples_split': 39, 'min_samples_leaf': 57, 'criterion': 'entropy'}.
Trial 8962 finished with value: 0.6739130434782609 and parameters: {'n_estimators': 291, 'max_depth': 12, 'min_samples_split': 28, 'min_samples_leaf': 65, 'criterion': 'gini'}.
Trial 8963 finished with value: 0.717391304347826 and parameters: {'n_estimators': 348, 'max_depth': 8, 'min_samples_split': 35, 'min_samples_leaf': 59, 'criterion': 'entropy'}.
Trial 8964 finished with value: 0.7065217391304348 and parameters: {'n_estimators': 791, 'max_depth': 14, 'min_samples_split': 24, 'min_samples_leaf': 62, 'criterion': 'entropy'}.
Trial 8965 finished with value: 0.6956521739130435 and parameters: {'n_estimators': 720, 'max_depth': 10, 'min_samples_split': 126, 'min_samples_leaf': 56, 'criterion': 'gini'}.
Trial 8966 finished with value: 0.7065217391304348 and parameters: {'n_estimators': 313, 'max_depth': 7, 'min_samples_split': 31, 'min_samples_leaf': 59, 'criterion': 'entropy'}.
Trial 8967 finished with value: 0.6956521739130435 and parameters: {'n_estimators': 688, 'max_depth': 11, 'min_samples_split': 85, 'min_samples_leaf': 53, 'criterion': 'gini'}.
Trial 8968 finished with value: 0.6847826086956522 and parameters: {'n_estimators': 272, 'max_depth': 13, 'min_samples_split': 39, 'min_samples_leaf': 61, 'criterion': 'entropy'}.
Trial 8969 finished with value: 0.717391304347826 and parameters: {'n_estimators': 741, 'max_depth': 9, 'min_samples_split': 43, 'min_samples_leaf': 57, 'criterion': 'gini'}.
Trial 8970 finished with value: 0.6630434782608695 and parameters: {'n_estimators': 891, 'max_depth': 16, 'min_samples_split': 20, 'min_samples_leaf': 79, 'criterion': 'entropy'}.
Trial 8971 finished with value: 0.6956521739130435 and parameters: {'n_estimators': 819, 'max_depth': 11, 'min_samples_split': 26, 'min_samples_leaf': 55, 'criterion': 'entropy'}.
Trial 8972 finished with value: 0.7065217391304348 and parameters: {'n_estimators': 622, 'max_depth': 7, 'min_samples_split': 35, 'min_samples_leaf': 59, 'criterion': 'gini'}.
Trial 8973 finished with value: 0.6956521739130435 and parameters: {'n_estimators': 253, 'max_depth': 9, 'min_samples_split': 30, 'min_samples_leaf': 51, 'criterion': 'entropy'}.
Trial 8974 finished with value: 0.6847826086956522 and parameters: {'n_estimators': 288, 'max_depth': 13, 'min_samples_split': 34, 'min_samples_leaf': 62, 'criterion': 'gini'}.
Trial 8975 finished with value: 0.6739130434782609 and parameters: {'n_estimators': 328, 'max_depth': 6, 'min_samples_split': 50, 'min_samples_leaf': 57, 'criterion': 'entropy'}.
Trial 8976 finished with value: 0.6847826086956522 and parameters: {'n_estimators': 128, 'max_depth': 11, 'min_samples_split': 110, 'min_samples_leaf': 65, 'criterion': 'entropy'}.
Trial 8977 finished with value: 0.6630434782608695 and parameters: {'n_estimators': 210, 'max_depth': 15, 'min_samples_split': 103, 'min_samples_leaf': 60, 'criterion': 'gini'}.
Trial 8978 finished with value: 0.7065217391304348 and parameters: {'n_estimators': 302, 'max_depth': 9, 'min_samples_split': 122, 'min_samples_leaf': 54, 'criterion': 'entropy'}.
Trial 8979 finished with value: 0.717391304347826 and parameters: {'n_estimators': 246, 'max_depth': 12, 'min_samples_split': 13, 'min_samples_leaf': 57, 'criterion': 'gini'}.
Trial 8980 finished with value: 0.6304347826086957 and parameters: {'n_estimators': 758, 'max_depth': 8, 'min_samples_split': 40, 'min_samples_leaf': 28, 'criterion': 'entropy'}.
Trial 8981 finished with value: 0.6956521739130435 and parameters: {'n_estimators': 278, 'max_depth': 14, 'min_samples_split': 23, 'min_samples_leaf': 63, 'criterion': 'entropy'}.
Trial 8982 finished with value: 0.717391304347826 and parameters: {'n_estimators': 779, 'max_depth': 10, 'min_samples_split': 28, 'min_samples_leaf': 59, 'criterion': 'gini'}.
Trial 8983 finished with value: 0.6413043478260869 and parameters: {'n_estimators': 263, 'max_depth': 5, 'min_samples_split': 47, 'min_samples_leaf': 61, 'criterion': 'entropy'}.
Trial 8984 finished with value: 0.6847826086956522 and parameters: {'n_estimators': 573, 'max_depth': 7, 'min_samples_split': 37, 'min_samples_leaf': 56, 'criterion': 'gini'}.
Trial 8985 finished with value: 0.6521739130434783 and parameters: {'n_estimators': 229, 'max_depth': 17, 'min_samples_split': 32, 'min_samples_leaf': 49, 'criterion': 'entropy'}.
Trial 8986 finished with value: 0.717391304347826 and parameters: {'n_estimators': 487, 'max_depth': 12, 'min_samples_split': 26, 'min_samples_leaf': 52, 'criterion': 'gini'}.
Trial 8987 finished with value: 0.6630434782608695 and parameters: {'n_estimators': 306, 'max_depth': 10, 'min_samples_split': 43, 'min_samples_leaf': 100, 'criterion': 'entropy'}.
Trial 8988 finished with value: 0.717391304347826 and parameters: {'n_estimators': 152, 'max_depth': 13, 'min_samples_split': 115, 'min_samples_leaf': 58, 'criterion': 'entropy'}.
Trial 8989 finished with value: 0.7065217391304348 and parameters: {'n_estimators': 286, 'max_depth': 8, 'min_samples_split': 19, 'min_samples_leaf': 54, 'criterion': 'gini'}.
Trial 8990 finished with value: 0.6847826086956522 and parameters: {'n_estimators': 358, 'max_depth': 15, 'min_samples_split': 56, 'min_samples_leaf': 61, 'criterion': 'entropy'}.
Trial 8991 finished with value: 0.7065217391304348 and parameters: {'n_estimators': 701, 'max_depth': 11, 'min_samples_split': 32, 'min_samples_leaf': 65, 'criterion': 'gini'}.
Trial 8992 finished with value: 0.7065217391304348 and parameters: {'n_estimators': 263, 'max_depth': 9, 'min_samples_split': 38, 'min_samples_leaf': 58, 'criterion': 'entropy'}.
Trial 8993 finished with value: 0.6630434782608695 and parameters: {'n_estimators': 334, 'max_depth': 6, 'min_samples_split': 28, 'min_samples_leaf': 55, 'criterion': 'entropy'}.
Trial 8994 finished with value: 0.7065217391304348 and parameters: {'n_estimators': 749, 'max_depth': 13, 'min_samples_split': 15, 'min_samples_leaf': 60, 'criterion': 'gini'}.
Trial 8995 finished with value: 0.6956521739130435 and parameters: {'n_estimators': 846, 'max_depth': 10, 'min_samples_split': 33, 'min_samples_leaf': 63, 'criterion': 'entropy'}.
Trial 8996 finished with value: 0.6847826086956522 and parameters: {'n_estimators': 386, 'max_depth': 7, 'min_samples_split': 42, 'min_samples_leaf': 56, 'criterion': 'gini'}.
Trial 8997 finished with value: 0.717391304347826 and parameters: {'n_estimators': 796, 'max_depth': 11, 'min_samples_split': 126, 'min_samples_leaf': 58, 'criterion': 'entropy'}.
Trial 8998 finished with value: 0.7065217391304348 and parameters: {'n_estimators': 313, 'max_depth': 8, 'min_samples_split': 23, 'min_samples_leaf': 52, 'criterion': 'entropy'}.
Trial 8999 finished with value: 0.6739130434782609 and parameters: {'n_estimators': 249, 'max_depth': 13, 'min_samples_split': 35, 'min_samples_leaf': 78, 'criterion': 'gini'}.
Trial 9000 finished with value: 0.6956521739130435 and parameters: {'n_estimators': 927, 'max_depth': 15, 'min_samples_split': 29, 'min_samples_leaf': 60, 'criterion': 'entropy'}.
Trial 9001 finished with value: 0.7282608695652174 and parameters: {'n_estimators': 286, 'max_depth': 10, 'min_samples_split': 37, 'min_samples_leaf': 56, 'criterion': 'gini'}.
Trial 9002 finished with value: 0.6413043478260869 and parameters: {'n_estimators': 272, 'max_depth': 5, 'min_samples_split': 25, 'min_samples_leaf': 62, 'criterion': 'entropy'}.
Trial 9003 finished with value: 0.6847826086956522 and parameters: {'n_estimators': 200, 'max_depth': 12, 'min_samples_split': 41, 'min_samples_leaf': 66, 'criterion': 'entropy'}.
Trial 9004 finished with value: 0.6956521739130435 and parameters: {'n_estimators': 295, 'max_depth': 18, 'min_samples_split': 21, 'min_samples_leaf': 58, 'criterion': 'gini'}.
Trial 9005 finished with value: 0.7065217391304348 and parameters: {'n_estimators': 235, 'max_depth': 8, 'min_samples_split': 121, 'min_samples_leaf': 53, 'criterion': 'entropy'}.
Trial 9006 finished with value: 0.6956521739130435 and parameters: {'n_estimators': 720, 'max_depth': 9, 'min_samples_split': 47, 'min_samples_leaf': 60, 'criterion': 'gini'}.
Trial 9007 finished with value: 0.717391304347826 and parameters: {'n_estimators': 314, 'max_depth': 11, 'min_samples_split': 32, 'min_samples_leaf': 56, 'criterion': 'entropy'}.
Trial 9008 finished with value: 0.6847826086956522 and parameters: {'n_estimators': 269, 'max_depth': 14, 'min_samples_split': 117, 'min_samples_leaf': 63, 'criterion': 'gini'}.
Trial 9009 finished with value: 0.6739130434782609 and parameters: {'n_estimators': 775, 'max_depth': 23, 'min_samples_split': 37, 'min_samples_leaf': 58, 'criterion': 'entropy'}.
Trial 9010 finished with value: 0.6847826086956522 and parameters: {'n_estimators': 866, 'max_depth': 7, 'min_samples_split': 29, 'min_samples_leaf': 54, 'criterion': 'entropy'}.
Trial 9011 finished with value: 0.6956521739130435 and parameters: {'n_estimators': 330, 'max_depth': 11, 'min_samples_split': 34, 'min_samples_leaf': 61, 'criterion': 'gini'}.
Trial 9012 finished with value: 0.7065217391304348 and parameters: {'n_estimators': 252, 'max_depth': 9, 'min_samples_split': 155, 'min_samples_leaf': 59, 'criterion': 'entropy'}.
Trial 9013 finished with value: 0.6956521739130435 and parameters: {'n_estimators': 294, 'max_depth': 13, 'min_samples_split': 26, 'min_samples_leaf': 55, 'criterion': 'gini'}.
Trial 9014 finished with value: 0.6739130434782609 and parameters: {'n_estimators': 732, 'max_depth': 16, 'min_samples_split': 40, 'min_samples_leaf': 64, 'criterion': 'entropy'}.
Trial 9015 finished with value: 0.6521739130434783 and parameters: {'n_estimators': 760, 'max_depth': 5, 'min_samples_split': 2, 'min_samples_leaf': 57, 'criterion': 'entropy'}.
Trial 9016 finished with value: 0.717391304347826 and parameters: {'n_estimators': 280, 'max_depth': 9, 'min_samples_split': 20, 'min_samples_leaf': 49, 'criterion': 'gini'}.
Trial 9017 finished with value: 0.717391304347826 and parameters: {'n_estimators': 979, 'max_depth': 11, 'min_samples_split': 45, 'min_samples_leaf': 61, 'criterion': 'entropy'}.
Trial 9018 finished with value: 0.6956521739130435 and parameters: {'n_estimators': 804, 'max_depth': 7, 'min_samples_split': 90, 'min_samples_leaf': 59, 'criterion': 'gini'}.
Trial 9019 finished with value: 0.6847826086956522 and parameters: {'n_estimators': 263, 'max_depth': 13, 'min_samples_split': 17, 'min_samples_leaf': 51, 'criterion': 'entropy'}.
Trial 9020 finished with value: 0.717391304347826 and parameters: {'n_estimators': 302, 'max_depth': 10, 'min_samples_split': 31, 'min_samples_leaf': 55, 'criterion': 'entropy'}.
Trial 9021 finished with value: 0.6847826086956522 and parameters: {'n_estimators': 247, 'max_depth': 15, 'min_samples_split': 36, 'min_samples_leaf': 57, 'criterion': 'gini'}.
Trial 9022 finished with value: 0.7065217391304348 and parameters: {'n_estimators': 342, 'max_depth': 12, 'min_samples_split': 26, 'min_samples_leaf': 66, 'criterion': 'entropy'}.
Trial 9023 finished with value: 0.6630434782608695 and parameters: {'n_estimators': 225, 'max_depth': 8, 'min_samples_split': 30, 'min_samples_leaf': 38, 'criterion': 'gini'}.
