Trial 7306 finished with value: 0.6956521739130435 and parameters: {'n_estimators': 794, 'max_depth': 9, 'min_samples_split': 145, 'min_samples_leaf': 70, 'criterion': 'entropy'}.
Trial 7307 finished with value: 0.717391304347826 and parameters: {'n_estimators': 766, 'max_depth': 11, 'min_samples_split': 35, 'min_samples_leaf': 62, 'criterion': 'gini'}.
Trial 7308 finished with value: 0.6956521739130435 and parameters: {'n_estimators': 180, 'max_depth': 51, 'min_samples_split': 25, 'min_samples_leaf': 57, 'criterion': 'entropy'}.
Trial 7309 finished with value: 0.7065217391304348 and parameters: {'n_estimators': 310, 'max_depth': 7, 'min_samples_split': 150, 'min_samples_leaf': 75, 'criterion': 'gini'}.
Trial 7310 finished with value: 0.6956521739130435 and parameters: {'n_estimators': 273, 'max_depth': 13, 'min_samples_split': 18, 'min_samples_leaf': 60, 'criterion': 'entropy'}.
Trial 7311 finished with value: 0.6739130434782609 and parameters: {'n_estimators': 677, 'max_depth': 16, 'min_samples_split': 137, 'min_samples_leaf': 72, 'criterion': 'gini'}.
Trial 7312 finished with value: 0.6956521739130435 and parameters: {'n_estimators': 724, 'max_depth': 9, 'min_samples_split': 29, 'min_samples_leaf': 58, 'criterion': 'entropy'}.
Trial 7313 finished with value: 0.6630434782608695 and parameters: {'n_estimators': 329, 'max_depth': 85, 'min_samples_split': 44, 'min_samples_leaf': 55, 'criterion': 'entropy'}.
Trial 7314 finished with value: 0.6847826086956522 and parameters: {'n_estimators': 248, 'max_depth': 11, 'min_samples_split': 141, 'min_samples_leaf': 68, 'criterion': 'gini'}.
Trial 7315 finished with value: 0.6956521739130435 and parameters: {'n_estimators': 290, 'max_depth': 14, 'min_samples_split': 129, 'min_samples_leaf': 52, 'criterion': 'entropy'}.
Trial 7316 finished with value: 0.6847826086956522 and parameters: {'n_estimators': 354, 'max_depth': 6, 'min_samples_split': 119, 'min_samples_leaf': 64, 'criterion': 'gini'}.
Trial 7317 finished with value: 0.717391304347826 and parameters: {'n_estimators': 218, 'max_depth': 9, 'min_samples_split': 37, 'min_samples_leaf': 61, 'criterion': 'entropy'}.
Trial 7318 finished with value: 0.6956521739130435 and parameters: {'n_estimators': 454, 'max_depth': 11, 'min_samples_split': 114, 'min_samples_leaf': 56, 'criterion': 'gini'}.
Trial 7319 finished with value: 0.7065217391304348 and parameters: {'n_estimators': 780, 'max_depth': 13, 'min_samples_split': 32, 'min_samples_leaf': 59, 'criterion': 'entropy'}.
Trial 7320 finished with value: 0.7065217391304348 and parameters: {'n_estimators': 134, 'max_depth': 8, 'min_samples_split': 21, 'min_samples_leaf': 54, 'criterion': 'gini'}.
Trial 7321 finished with value: 0.6847826086956522 and parameters: {'n_estimators': 196, 'max_depth': 10, 'min_samples_split': 25, 'min_samples_leaf': 98, 'criterion': 'entropy'}.
Trial 7322 finished with value: 0.6413043478260869 and parameters: {'n_estimators': 275, 'max_depth': 5, 'min_samples_split': 124, 'min_samples_leaf': 62, 'criterion': 'entropy'}.
Trial 7323 finished with value: 0.7065217391304348 and parameters: {'n_estimators': 811, 'max_depth': 15, 'min_samples_split': 192, 'min_samples_leaf': 58, 'criterion': 'gini'}.
Trial 7324 finished with value: 0.6847826086956522 and parameters: {'n_estimators': 744, 'max_depth': 12, 'min_samples_split': 40, 'min_samples_leaf': 77, 'criterion': 'entropy'}.
Trial 7325 finished with value: 0.7065217391304348 and parameters: {'n_estimators': 304, 'max_depth': 7, 'min_samples_split': 30, 'min_samples_leaf': 73, 'criterion': 'gini'}.
Trial 7326 finished with value: 0.6847826086956522 and parameters: {'n_estimators': 243, 'max_depth': 9, 'min_samples_split': 35, 'min_samples_leaf': 50, 'criterion': 'entropy'}.
Trial 7327 finished with value: 0.6630434782608695 and parameters: {'n_estimators': 259, 'max_depth': 76, 'min_samples_split': 27, 'min_samples_leaf': 66, 'criterion': 'gini'}.
Trial 7328 finished with value: 0.6739130434782609 and parameters: {'n_estimators': 282, 'max_depth': 17, 'min_samples_split': 10, 'min_samples_leaf': 56, 'criterion': 'entropy'}.
Trial 7329 finished with value: 0.717391304347826 and parameters: {'n_estimators': 758, 'max_depth': 11, 'min_samples_split': 131, 'min_samples_leaf': 60, 'criterion': 'gini'}.
Trial 7330 finished with value: 0.7065217391304348 and parameters: {'n_estimators': 318, 'max_depth': 14, 'min_samples_split': 139, 'min_samples_leaf': 70, 'criterion': 'entropy'}.
Trial 7331 finished with value: 0.6956521739130435 and parameters: {'n_estimators': 289, 'max_depth': 7, 'min_samples_split': 145, 'min_samples_leaf': 63, 'criterion': 'entropy'}.
Trial 7332 finished with value: 0.7065217391304348 and parameters: {'n_estimators': 264, 'max_depth': 10, 'min_samples_split': 48, 'min_samples_leaf': 58, 'criterion': 'gini'}.
Trial 7333 finished with value: 0.6956521739130435 and parameters: {'n_estimators': 345, 'max_depth': 12, 'min_samples_split': 35, 'min_samples_leaf': 55, 'criterion': 'entropy'}.
Trial 7334 finished with value: 0.6956521739130435 and parameters: {'n_estimators': 232, 'max_depth': 8, 'min_samples_split': 43, 'min_samples_leaf': 60, 'criterion': 'gini'}.
Trial 7335 finished with value: 0.6847826086956522 and parameters: {'n_estimators': 293, 'max_depth': 13, 'min_samples_split': 16, 'min_samples_leaf': 53, 'criterion': 'entropy'}.
Trial 7336 finished with value: 0.6847826086956522 and parameters: {'n_estimators': 273, 'max_depth': 10, 'min_samples_split': 30, 'min_samples_leaf': 74, 'criterion': 'gini'}.
Trial 7337 finished with value: 0.6304347826086957 and parameters: {'n_estimators': 310, 'max_depth': 5, 'min_samples_split': 39, 'min_samples_leaf': 57, 'criterion': 'entropy'}.
Trial 7338 finished with value: 0.6847826086956522 and parameters: {'n_estimators': 703, 'max_depth': 15, 'min_samples_split': 134, 'min_samples_leaf': 62, 'criterion': 'gini'}.
Trial 7339 finished with value: 0.7065217391304348 and parameters: {'n_estimators': 736, 'max_depth': 8, 'min_samples_split': 23, 'min_samples_leaf': 71, 'criterion': 'entropy'}.
Trial 7340 finished with value: 0.7065217391304348 and parameters: {'n_estimators': 792, 'max_depth': 12, 'min_samples_split': 31, 'min_samples_leaf': 68, 'criterion': 'gini'}.
Trial 7341 finished with value: 0.7065217391304348 and parameters: {'n_estimators': 163, 'max_depth': 10, 'min_samples_split': 34, 'min_samples_leaf': 64, 'criterion': 'entropy'}.
Trial 7342 finished with value: 0.717391304347826 and parameters: {'n_estimators': 253, 'max_depth': 8, 'min_samples_split': 56, 'min_samples_leaf': 59, 'criterion': 'entropy'}.
Trial 7343 finished with value: 0.6956521739130435 and parameters: {'n_estimators': 330, 'max_depth': 13, 'min_samples_split': 26, 'min_samples_leaf': 57, 'criterion': 'gini'}.
Trial 7344 finished with value: 0.717391304347826 and parameters: {'n_estimators': 389, 'max_depth': 10, 'min_samples_split': 150, 'min_samples_leaf': 54, 'criterion': 'entropy'}.
Trial 7345 finished with value: 0.6847826086956522 and parameters: {'n_estimators': 776, 'max_depth': 18, 'min_samples_split': 19, 'min_samples_leaf': 61, 'criterion': 'gini'}.
Trial 7346 finished with value: 0.6630434782608695 and parameters: {'n_estimators': 302, 'max_depth': 6, 'min_samples_split': 37, 'min_samples_leaf': 59, 'criterion': 'entropy'}.
Trial 7347 finished with value: 0.6956521739130435 and parameters: {'n_estimators': 274, 'max_depth': 16, 'min_samples_split': 140, 'min_samples_leaf': 52, 'criterion': 'gini'}.
Trial 7348 finished with value: 0.7282608695652174 and parameters: {'n_estimators': 252, 'max_depth': 11, 'min_samples_split': 28, 'min_samples_leaf': 56, 'criterion': 'entropy'}.
Trial 7349 finished with value: 0.6739130434782609 and parameters: {'n_estimators': 878, 'max_depth': 9, 'min_samples_split': 42, 'min_samples_leaf': 65, 'criterion': 'gini'}.
Trial 7350 finished with value: 0.6847826086956522 and parameters: {'n_estimators': 282, 'max_depth': 14, 'min_samples_split': 103, 'min_samples_leaf': 58, 'criterion': 'entropy'}.
Trial 7351 finished with value: 0.6956521739130435 and parameters: {'n_estimators': 420, 'max_depth': 7, 'min_samples_split': 126, 'min_samples_leaf': 60, 'criterion': 'entropy'}.
Trial 7352 finished with value: 0.6956521739130435 and parameters: {'n_estimators': 723, 'max_depth': 11, 'min_samples_split': 23, 'min_samples_leaf': 55, 'criterion': 'gini'}.
Trial 7353 finished with value: 0.6847826086956522 and parameters: {'n_estimators': 229, 'max_depth': 12, 'min_samples_split': 32, 'min_samples_leaf': 75, 'criterion': 'entropy'}.
Trial 7354 finished with value: 0.717391304347826 and parameters: {'n_estimators': 319, 'max_depth': 9, 'min_samples_split': 111, 'min_samples_leaf': 62, 'criterion': 'gini'}.
Trial 7355 finished with value: 0.6847826086956522 and parameters: {'n_estimators': 940, 'max_depth': 14, 'min_samples_split': 118, 'min_samples_leaf': 67, 'criterion': 'entropy'}.
Trial 7356 finished with value: 0.7065217391304348 and parameters: {'n_estimators': 806, 'max_depth': 7, 'min_samples_split': 144, 'min_samples_leaf': 57, 'criterion': 'gini'}.
Trial 7357 finished with value: 0.6739130434782609 and parameters: {'n_estimators': 296, 'max_depth': 21, 'min_samples_split': 37, 'min_samples_leaf': 69, 'criterion': 'entropy'}.
Trial 7358 finished with value: 0.6630434782608695 and parameters: {'n_estimators': 761, 'max_depth': 5, 'min_samples_split': 33, 'min_samples_leaf': 73, 'criterion': 'gini'}.
Trial 7359 finished with value: 0.717391304347826 and parameters: {'n_estimators': 248, 'max_depth': 12, 'min_samples_split': 47, 'min_samples_leaf': 54, 'criterion': 'entropy'}.
Trial 7360 finished with value: 0.7065217391304348 and parameters: {'n_estimators': 262, 'max_depth': 9, 'min_samples_split': 134, 'min_samples_leaf': 60, 'criterion': 'entropy'}.
Trial 7361 finished with value: 0.6956521739130435 and parameters: {'n_estimators': 374, 'max_depth': 15, 'min_samples_split': 27, 'min_samples_leaf': 63, 'criterion': 'gini'}.
Trial 7362 finished with value: 0.6956521739130435 and parameters: {'n_estimators': 283, 'max_depth': 11, 'min_samples_split': 20, 'min_samples_leaf': 80, 'criterion': 'entropy'}.
Trial 7363 finished with value: 0.6847826086956522 and parameters: {'n_estimators': 305, 'max_depth': 8, 'min_samples_split': 137, 'min_samples_leaf': 58, 'criterion': 'gini'}.
Trial 7364 finished with value: 0.6739130434782609 and parameters: {'n_estimators': 209, 'max_depth': 13, 'min_samples_split': 38, 'min_samples_leaf': 51, 'criterion': 'entropy'}.
Trial 7365 finished with value: 0.7065217391304348 and parameters: {'n_estimators': 340, 'max_depth': 10, 'min_samples_split': 31, 'min_samples_leaf': 71, 'criterion': 'gini'}.
Trial 7366 finished with value: 0.6956521739130435 and parameters: {'n_estimators': 747, 'max_depth': 7, 'min_samples_split': 41, 'min_samples_leaf': 56, 'criterion': 'entropy'}.
Trial 7367 finished with value: 0.717391304347826 and parameters: {'n_estimators': 272, 'max_depth': 9, 'min_samples_split': 147, 'min_samples_leaf': 61, 'criterion': 'gini'}.
Trial 7368 finished with value: 0.6521739130434783 and parameters: {'n_estimators': 247, 'max_depth': 40, 'min_samples_split': 25, 'min_samples_leaf': 76, 'criterion': 'entropy'}.
Trial 7369 finished with value: 0.6956521739130435 and parameters: {'n_estimators': 613, 'max_depth': 33, 'min_samples_split': 180, 'min_samples_leaf': 64, 'criterion': 'entropy'}.
Trial 7370 finished with value: 0.6956521739130435 and parameters: {'n_estimators': 291, 'max_depth': 12, 'min_samples_split': 34, 'min_samples_leaf': 59, 'criterion': 'gini'}.
Trial 7371 finished with value: 0.6956521739130435 and parameters: {'n_estimators': 231, 'max_depth': 17, 'min_samples_split': 123, 'min_samples_leaf': 56, 'criterion': 'entropy'}.
Trial 7372 finished with value: 0.7065217391304348 and parameters: {'n_estimators': 778, 'max_depth': 14, 'min_samples_split': 141, 'min_samples_leaf': 54, 'criterion': 'gini'}.
Trial 7373 finished with value: 0.7065217391304348 and parameters: {'n_estimators': 266, 'max_depth': 10, 'min_samples_split': 12, 'min_samples_leaf': 66, 'criterion': 'entropy'}.
Trial 7374 finished with value: 0.6630434782608695 and parameters: {'n_estimators': 960, 'max_depth': 5, 'min_samples_split': 129, 'min_samples_leaf': 72, 'criterion': 'gini'}.
Trial 7375 finished with value: 0.6739130434782609 and parameters: {'n_estimators': 317, 'max_depth': 7, 'min_samples_split': 44, 'min_samples_leaf': 58, 'criterion': 'entropy'}.
Trial 7376 finished with value: 0.7065217391304348 and parameters: {'n_estimators': 300, 'max_depth': 12, 'min_samples_split': 29, 'min_samples_leaf': 61, 'criterion': 'gini'}.
Trial 7377 finished with value: 0.717391304347826 and parameters: {'n_estimators': 274, 'max_depth': 9, 'min_samples_split': 22, 'min_samples_leaf': 52, 'criterion': 'entropy'}.
Trial 7378 finished with value: 0.6521739130434783 and parameters: {'n_estimators': 478, 'max_depth': 95, 'min_samples_split': 37, 'min_samples_leaf': 57, 'criterion': 'entropy'}.
Trial 7379 finished with value: 0.6739130434782609 and parameters: {'n_estimators': 736, 'max_depth': 15, 'min_samples_split': 29, 'min_samples_leaf': 60, 'criterion': 'gini'}.
Trial 7380 finished with value: 0.717391304347826 and parameters: {'n_estimators': 684, 'max_depth': 11, 'min_samples_split': 34, 'min_samples_leaf': 63, 'criterion': 'entropy'}.
Trial 7381 finished with value: 0.717391304347826 and parameters: {'n_estimators': 755, 'max_depth': 13, 'min_samples_split': 90, 'min_samples_leaf': 59, 'criterion': 'gini'}.
Trial 7382 finished with value: 0.7282608695652174 and parameters: {'n_estimators': 325, 'max_depth': 8, 'min_samples_split': 16, 'min_samples_leaf': 55, 'criterion': 'entropy'}.
Trial 7383 finished with value: 0.6739130434782609 and parameters: {'n_estimators': 796, 'max_depth': 64, 'min_samples_split': 137, 'min_samples_leaf': 70, 'criterion': 'gini'}.
Trial 7384 finished with value: 0.7282608695652174 and parameters: {'n_estimators': 255, 'max_depth': 10, 'min_samples_split': 116, 'min_samples_leaf': 50, 'criterion': 'entropy'}.
Trial 7385 finished with value: 0.6521739130434783 and parameters: {'n_estimators': 286, 'max_depth': 16, 'min_samples_split': 39, 'min_samples_leaf': 77, 'criterion': 'gini'}.
Trial 7386 finished with value: 0.6847826086956522 and parameters: {'n_estimators': 555, 'max_depth': 6, 'min_samples_split': 174, 'min_samples_leaf': 53, 'criterion': 'entropy'}.
Trial 7387 finished with value: 0.6847826086956522 and parameters: {'n_estimators': 238, 'max_depth': 19, 'min_samples_split': 25, 'min_samples_leaf': 62, 'criterion': 'entropy'}.
Trial 7388 finished with value: 0.6630434782608695 and parameters: {'n_estimators': 113, 'max_depth': 47, 'min_samples_split': 132, 'min_samples_leaf': 57, 'criterion': 'gini'}.
Trial 7389 finished with value: 0.717391304347826 and parameters: {'n_estimators': 656, 'max_depth': 11, 'min_samples_split': 32, 'min_samples_leaf': 58, 'criterion': 'entropy'}.
Trial 7390 finished with value: 0.6956521739130435 and parameters: {'n_estimators': 704, 'max_depth': 13, 'min_samples_split': 19, 'min_samples_leaf': 74, 'criterion': 'gini'}.
Trial 7391 finished with value: 0.717391304347826 and parameters: {'n_estimators': 303, 'max_depth': 8, 'min_samples_split': 146, 'min_samples_leaf': 67, 'criterion': 'entropy'}.
Trial 7392 finished with value: 0.7065217391304348 and parameters: {'n_estimators': 916, 'max_depth': 10, 'min_samples_split': 141, 'min_samples_leaf': 60, 'criterion': 'gini'}.
Trial 7393 finished with value: 0.6847826086956522 and parameters: {'n_estimators': 265, 'max_depth': 7, 'min_samples_split': 6, 'min_samples_leaf': 64, 'criterion': 'entropy'}.
Trial 7394 finished with value: 0.717391304347826 and parameters: {'n_estimators': 764, 'max_depth': 14, 'min_samples_split': 120, 'min_samples_leaf': 54, 'criterion': 'gini'}.
Trial 7395 finished with value: 0.7065217391304348 and parameters: {'n_estimators': 357, 'max_depth': 12, 'min_samples_split': 28, 'min_samples_leaf': 56, 'criterion': 'entropy'}.
Trial 7396 finished with value: 0.717391304347826 and parameters: {'n_estimators': 287, 'max_depth': 9, 'min_samples_split': 51, 'min_samples_leaf': 72, 'criterion': 'gini'}.
Trial 7397 finished with value: 0.6521739130434783 and parameters: {'n_estimators': 869, 'max_depth': 5, 'min_samples_split': 35, 'min_samples_leaf': 61, 'criterion': 'entropy'}.
Trial 7398 finished with value: 0.7065217391304348 and parameters: {'n_estimators': 219, 'max_depth': 11, 'min_samples_split': 152, 'min_samples_leaf': 68, 'criterion': 'entropy'}.
Trial 7399 finished with value: 0.6739130434782609 and parameters: {'n_estimators': 719, 'max_depth': 16, 'min_samples_split': 40, 'min_samples_leaf': 58, 'criterion': 'gini'}.
Trial 7400 finished with value: 0.717391304347826 and parameters: {'n_estimators': 269, 'max_depth': 9, 'min_samples_split': 25, 'min_samples_leaf': 56, 'criterion': 'entropy'}.
Trial 7401 finished with value: 0.7065217391304348 and parameters: {'n_estimators': 325, 'max_depth': 13, 'min_samples_split': 44, 'min_samples_leaf': 62, 'criterion': 'gini'}.
Trial 7402 finished with value: 0.717391304347826 and parameters: {'n_estimators': 252, 'max_depth': 8, 'min_samples_split': 31, 'min_samples_leaf': 65, 'criterion': 'entropy'}.
Trial 7403 finished with value: 0.7065217391304348 and parameters: {'n_estimators': 296, 'max_depth': 10, 'min_samples_split': 22, 'min_samples_leaf': 59, 'criterion': 'gini'}.
Trial 7404 finished with value: 0.6956521739130435 and parameters: {'n_estimators': 197, 'max_depth': 12, 'min_samples_split': 37, 'min_samples_leaf': 55, 'criterion': 'entropy'}.
Trial 7405 finished with value: 0.6956521739130435 and parameters: {'n_estimators': 812, 'max_depth': 7, 'min_samples_split': 125, 'min_samples_leaf': 60, 'criterion': 'gini'}.
Trial 7406 finished with value: 0.6847826086956522 and parameters: {'n_estimators': 777, 'max_depth': 14, 'min_samples_split': 135, 'min_samples_leaf': 53, 'criterion': 'entropy'}.
Trial 7407 finished with value: 0.6630434782608695 and parameters: {'n_estimators': 309, 'max_depth': 37, 'min_samples_split': 30, 'min_samples_leaf': 79, 'criterion': 'entropy'}.
Trial 7408 finished with value: 0.6956521739130435 and parameters: {'n_estimators': 280, 'max_depth': 11, 'min_samples_split': 112, 'min_samples_leaf': 74, 'criterion': 'gini'}.
Trial 7409 finished with value: 0.6847826086956522 and parameters: {'n_estimators': 239, 'max_depth': 9, 'min_samples_split': 47, 'min_samples_leaf': 70, 'criterion': 'entropy'}.
Trial 7410 finished with value: 0.6847826086956522 and parameters: {'n_estimators': 739, 'max_depth': 6, 'min_samples_split': 35, 'min_samples_leaf': 57, 'criterion': 'gini'}.
Trial 7411 finished with value: 0.7065217391304348 and parameters: {'n_estimators': 262, 'max_depth': 16, 'min_samples_split': 41, 'min_samples_leaf': 62, 'criterion': 'entropy'}.
Trial 7412 finished with value: 0.7065217391304348 and parameters: {'n_estimators': 339, 'max_depth': 11, 'min_samples_split': 141, 'min_samples_leaf': 59, 'criterion': 'gini'}.
Trial 7413 finished with value: 0.6847826086956522 and parameters: {'n_estimators': 282, 'max_depth': 69, 'min_samples_split': 15, 'min_samples_leaf': 57, 'criterion': 'entropy'}.
Trial 7414 finished with value: 0.6956521739130435 and parameters: {'n_estimators': 311, 'max_depth': 13, 'min_samples_split': 27, 'min_samples_leaf': 64, 'criterion': 'gini'}.
Trial 7415 finished with value: 0.6956521739130435 and parameters: {'n_estimators': 223, 'max_depth': 8, 'min_samples_split': 107, 'min_samples_leaf': 72, 'criterion': 'entropy'}.
Trial 7416 finished with value: 0.6739130434782609 and parameters: {'n_estimators': 248, 'max_depth': 18, 'min_samples_split': 33, 'min_samples_leaf': 54, 'criterion': 'entropy'}.
Trial 7417 finished with value: 0.7065217391304348 and parameters: {'n_estimators': 790, 'max_depth': 10, 'min_samples_split': 97, 'min_samples_leaf': 61, 'criterion': 'gini'}.
Trial 7418 finished with value: 0.7065217391304348 and parameters: {'n_estimators': 148, 'max_depth': 7, 'min_samples_split': 144, 'min_samples_leaf': 76, 'criterion': 'entropy'}.
Trial 7419 finished with value: 0.6847826086956522 and parameters: {'n_estimators': 291, 'max_depth': 14, 'min_samples_split': 130, 'min_samples_leaf': 59, 'criterion': 'gini'}.
Trial 7420 finished with value: 0.6521739130434783 and parameters: {'n_estimators': 756, 'max_depth': 5, 'min_samples_split': 21, 'min_samples_leaf': 69, 'criterion': 'entropy'}.
Trial 7421 finished with value: 0.7065217391304348 and parameters: {'n_estimators': 265, 'max_depth': 12, 'min_samples_split': 26, 'min_samples_leaf': 51, 'criterion': 'gini'}.
Trial 7422 finished with value: 0.717391304347826 and parameters: {'n_estimators': 277, 'max_depth': 9, 'min_samples_split': 38, 'min_samples_leaf': 56, 'criterion': 'entropy'}.
Trial 7423 finished with value: 0.6847826086956522 and parameters: {'n_estimators': 318, 'max_depth': 15, 'min_samples_split': 149, 'min_samples_leaf': 62, 'criterion': 'gini'}.
Trial 7424 finished with value: 0.6956521739130435 and parameters: {'n_estimators': 506, 'max_depth': 11, 'min_samples_split': 137, 'min_samples_leaf': 58, 'criterion': 'entropy'}.
Trial 7425 finished with value: 0.6956521739130435 and parameters: {'n_estimators': 730, 'max_depth': 7, 'min_samples_split': 30, 'min_samples_leaf': 66, 'criterion': 'entropy'}.
Trial 7426 finished with value: 0.7282608695652174 and parameters: {'n_estimators': 406, 'max_depth': 9, 'min_samples_split': 35, 'min_samples_leaf': 55, 'criterion': 'gini'}.
Trial 7427 finished with value: 0.7065217391304348 and parameters: {'n_estimators': 298, 'max_depth': 13, 'min_samples_split': 41, 'min_samples_leaf': 60, 'criterion': 'entropy'}.
Trial 7428 finished with value: 0.7065217391304348 and parameters: {'n_estimators': 239, 'max_depth': 11, 'min_samples_split': 23, 'min_samples_leaf': 74, 'criterion': 'gini'}.
