Trial 3861 finished with value: 0.717391304347826 and parameters: {'n_estimators': 332, 'max_depth': 8, 'min_samples_split': 138, 'min_samples_leaf': 65, 'criterion': 'gini'}.
Trial 3862 finished with value: 0.6956521739130435 and parameters: {'n_estimators': 290, 'max_depth': 10, 'min_samples_split': 148, 'min_samples_leaf': 60, 'criterion': 'gini'}.
Trial 3863 finished with value: 0.7065217391304348 and parameters: {'n_estimators': 264, 'max_depth': 16, 'min_samples_split': 155, 'min_samples_leaf': 68, 'criterion': 'gini'}.
Trial 3864 finished with value: 0.7065217391304348 and parameters: {'n_estimators': 301, 'max_depth': 13, 'min_samples_split': 137, 'min_samples_leaf': 76, 'criterion': 'gini'}.
Trial 3865 finished with value: 0.6847826086956522 and parameters: {'n_estimators': 228, 'max_depth': 11, 'min_samples_split': 150, 'min_samples_leaf': 62, 'criterion': 'gini'}.
Trial 3866 finished with value: 0.6956521739130435 and parameters: {'n_estimators': 280, 'max_depth': 8, 'min_samples_split': 141, 'min_samples_leaf': 58, 'criterion': 'gini'}.
Trial 3867 finished with value: 0.6956521739130435 and parameters: {'n_estimators': 315, 'max_depth': 10, 'min_samples_split': 162, 'min_samples_leaf': 70, 'criterion': 'gini'}.
Trial 3868 finished with value: 0.6739130434782609 and parameters: {'n_estimators': 173, 'max_depth': 6, 'min_samples_split': 134, 'min_samples_leaf': 64, 'criterion': 'gini'}.
Trial 3869 finished with value: 0.6739130434782609 and parameters: {'n_estimators': 254, 'max_depth': 14, 'min_samples_split': 143, 'min_samples_leaf': 60, 'criterion': 'gini'}.
Trial 3870 finished with value: 0.6956521739130435 and parameters: {'n_estimators': 272, 'max_depth': 11, 'min_samples_split': 143, 'min_samples_leaf': 57, 'criterion': 'gini'}.
Trial 3871 finished with value: 0.7065217391304348 and parameters: {'n_estimators': 303, 'max_depth': 8, 'min_samples_split': 144, 'min_samples_leaf': 66, 'criterion': 'gini'}.
Trial 3872 finished with value: 0.6739130434782609 and parameters: {'n_estimators': 240, 'max_depth': 40, 'min_samples_split': 136, 'min_samples_leaf': 74, 'criterion': 'gini'}.
Trial 3873 finished with value: 0.6739130434782609 and parameters: {'n_estimators': 286, 'max_depth': 57, 'min_samples_split': 141, 'min_samples_leaf': 62, 'criterion': 'gini'}.
Trial 3874 finished with value: 0.717391304347826 and parameters: {'n_estimators': 266, 'max_depth': 13, 'min_samples_split': 131, 'min_samples_leaf': 59, 'criterion': 'gini'}.
Trial 3875 finished with value: 0.6956521739130435 and parameters: {'n_estimators': 213, 'max_depth': 9, 'min_samples_split': 145, 'min_samples_leaf': 57, 'criterion': 'gini'}.
Trial 3876 finished with value: 0.6413043478260869 and parameters: {'n_estimators': 329, 'max_depth': 5, 'min_samples_split': 167, 'min_samples_leaf': 60, 'criterion': 'gini'}.
Trial 3877 finished with value: 0.6413043478260869 and parameters: {'n_estimators': 157, 'max_depth': 16, 'min_samples_split': 146, 'min_samples_leaf': 73, 'criterion': 'gini'}.
Trial 3878 finished with value: 0.717391304347826 and parameters: {'n_estimators': 247, 'max_depth': 12, 'min_samples_split': 151, 'min_samples_leaf': 71, 'criterion': 'gini'}.
Trial 3879 finished with value: 0.7065217391304348 and parameters: {'n_estimators': 282, 'max_depth': 10, 'min_samples_split': 141, 'min_samples_leaf': 58, 'criterion': 'gini'}.
Trial 3880 finished with value: 0.6956521739130435 and parameters: {'n_estimators': 305, 'max_depth': 7, 'min_samples_split': 117, 'min_samples_leaf': 64, 'criterion': 'gini'}.
Trial 3881 finished with value: 0.6956521739130435 and parameters: {'n_estimators': 193, 'max_depth': 14, 'min_samples_split': 124, 'min_samples_leaf': 62, 'criterion': 'gini'}.
Trial 3882 finished with value: 0.7065217391304348 and parameters: {'n_estimators': 265, 'max_depth': 12, 'min_samples_split': 136, 'min_samples_leaf': 69, 'criterion': 'gini'}.
Trial 3883 finished with value: 0.6956521739130435 and parameters: {'n_estimators': 362, 'max_depth': 21, 'min_samples_split': 157, 'min_samples_leaf': 57, 'criterion': 'gini'}.
Trial 3884 finished with value: 0.6847826086956522 and parameters: {'n_estimators': 288, 'max_depth': 9, 'min_samples_split': 138, 'min_samples_leaf': 60, 'criterion': 'gini'}.
Trial 3885 finished with value: 0.6847826086956522 and parameters: {'n_estimators': 411, 'max_depth': 11, 'min_samples_split': 113, 'min_samples_leaf': 78, 'criterion': 'gini'}.
Trial 3886 finished with value: 0.6521739130434783 and parameters: {'n_estimators': 230, 'max_depth': 78, 'min_samples_split': 119, 'min_samples_leaf': 67, 'criterion': 'gini'}.
Trial 3887 finished with value: 0.6956521739130435 and parameters: {'n_estimators': 312, 'max_depth': 7, 'min_samples_split': 85, 'min_samples_leaf': 75, 'criterion': 'gini'}.
Trial 3888 finished with value: 0.6739130434782609 and parameters: {'n_estimators': 252, 'max_depth': 18, 'min_samples_split': 109, 'min_samples_leaf': 59, 'criterion': 'gini'}.
Trial 3889 finished with value: 0.6847826086956522 and parameters: {'n_estimators': 267, 'max_depth': 15, 'min_samples_split': 133, 'min_samples_leaf': 57, 'criterion': 'gini'}.
Trial 3890 finished with value: 0.7065217391304348 and parameters: {'n_estimators': 298, 'max_depth': 9, 'min_samples_split': 148, 'min_samples_leaf': 63, 'criterion': 'gini'}.
Trial 3891 finished with value: 0.6956521739130435 and parameters: {'n_estimators': 344, 'max_depth': 12, 'min_samples_split': 48, 'min_samples_leaf': 61, 'criterion': 'gini'}.
Trial 3892 finished with value: 0.6847826086956522 and parameters: {'n_estimators': 663, 'max_depth': 30, 'min_samples_split': 128, 'min_samples_leaf': 65, 'criterion': 'gini'}.
Trial 3893 finished with value: 0.7065217391304348 and parameters: {'n_estimators': 276, 'max_depth': 7, 'min_samples_split': 140, 'min_samples_leaf': 72, 'criterion': 'gini'}.
Trial 3894 finished with value: 0.6847826086956522 and parameters: {'n_estimators': 248, 'max_depth': 14, 'min_samples_split': 140, 'min_samples_leaf': 57, 'criterion': 'gini'}.
Trial 3895 finished with value: 0.6847826086956522 and parameters: {'n_estimators': 319, 'max_depth': 10, 'min_samples_split': 154, 'min_samples_leaf': 59, 'criterion': 'gini'}.
Trial 3896 finished with value: 0.6630434782608695 and parameters: {'n_estimators': 286, 'max_depth': 5, 'min_samples_split': 147, 'min_samples_leaf': 62, 'criterion': 'gini'}.
Trial 3897 finished with value: 0.6956521739130435 and parameters: {'n_estimators': 226, 'max_depth': 12, 'min_samples_split': 131, 'min_samples_leaf': 60, 'criterion': 'gini'}.
Trial 3898 finished with value: 0.7065217391304348 and parameters: {'n_estimators': 259, 'max_depth': 9, 'min_samples_split': 120, 'min_samples_leaf': 69, 'criterion': 'gini'}.
Trial 3899 finished with value: 0.6847826086956522 and parameters: {'n_estimators': 299, 'max_depth': 11, 'min_samples_split': 136, 'min_samples_leaf': 30, 'criterion': 'gini'}.
Trial 3900 finished with value: 0.7065217391304348 and parameters: {'n_estimators': 280, 'max_depth': 8, 'min_samples_split': 124, 'min_samples_leaf': 57, 'criterion': 'gini'}.
Trial 3901 finished with value: 0.7065217391304348 and parameters: {'n_estimators': 322, 'max_depth': 14, 'min_samples_split': 143, 'min_samples_leaf': 17, 'criterion': 'gini'}.
Trial 3902 finished with value: 0.6847826086956522 and parameters: {'n_estimators': 266, 'max_depth': 17, 'min_samples_split': 54, 'min_samples_leaf': 60, 'criterion': 'gini'}.
Trial 3903 finished with value: 0.6956521739130435 and parameters: {'n_estimators': 240, 'max_depth': 10, 'min_samples_split': 149, 'min_samples_leaf': 58, 'criterion': 'gini'}.
Trial 3904 finished with value: 0.6847826086956522 and parameters: {'n_estimators': 133, 'max_depth': 7, 'min_samples_split': 46, 'min_samples_leaf': 66, 'criterion': 'gini'}.
Trial 3905 finished with value: 0.6956521739130435 and parameters: {'n_estimators': 206, 'max_depth': 13, 'min_samples_split': 129, 'min_samples_leaf': 62, 'criterion': 'gini'}.
Trial 3906 finished with value: 0.7282608695652174 and parameters: {'n_estimators': 297, 'max_depth': 9, 'min_samples_split': 138, 'min_samples_leaf': 87, 'criterion': 'gini'}.
Trial 3907 finished with value: 0.6956521739130435 and parameters: {'n_estimators': 339, 'max_depth': 11, 'min_samples_split': 143, 'min_samples_leaf': 71, 'criterion': 'gini'}.
Trial 3908 finished with value: 0.6847826086956522 and parameters: {'n_estimators': 280, 'max_depth': 37, 'min_samples_split': 151, 'min_samples_leaf': 64, 'criterion': 'gini'}.
Trial 3909 finished with value: 0.6630434782608695 and parameters: {'n_estimators': 255, 'max_depth': 5, 'min_samples_split': 134, 'min_samples_leaf': 75, 'criterion': 'gini'}.
Trial 3910 finished with value: 0.6847826086956522 and parameters: {'n_estimators': 303, 'max_depth': 15, 'min_samples_split': 99, 'min_samples_leaf': 57, 'criterion': 'gini'}.
Trial 3911 finished with value: 0.7065217391304348 and parameters: {'n_estimators': 375, 'max_depth': 12, 'min_samples_split': 138, 'min_samples_leaf': 59, 'criterion': 'gini'}.
Trial 3912 finished with value: 0.7065217391304348 and parameters: {'n_estimators': 241, 'max_depth': 8, 'min_samples_split': 115, 'min_samples_leaf': 73, 'criterion': 'gini'}.
Trial 3913 finished with value: 0.6847826086956522 and parameters: {'n_estimators': 100, 'max_depth': 10, 'min_samples_split': 146, 'min_samples_leaf': 61, 'criterion': 'gini'}.
Trial 3914 finished with value: 0.6521739130434783 and parameters: {'n_estimators': 275, 'max_depth': 13, 'min_samples_split': 107, 'min_samples_leaf': 1, 'criterion': 'gini'}.
Trial 3915 finished with value: 0.6956521739130435 and parameters: {'n_estimators': 220, 'max_depth': 7, 'min_samples_split': 124, 'min_samples_leaf': 77, 'criterion': 'gini'}.
Trial 3916 finished with value: 0.6739130434782609 and parameters: {'n_estimators': 263, 'max_depth': 16, 'min_samples_split': 48, 'min_samples_leaf': 57, 'criterion': 'gini'}.
Trial 3917 finished with value: 0.717391304347826 and parameters: {'n_estimators': 286, 'max_depth': 11, 'min_samples_split': 90, 'min_samples_leaf': 59, 'criterion': 'gini'}.
Trial 3918 finished with value: 0.717391304347826 and parameters: {'n_estimators': 466, 'max_depth': 9, 'min_samples_split': 132, 'min_samples_leaf': 63, 'criterion': 'gini'}.
Trial 3919 finished with value: 0.6847826086956522 and parameters: {'n_estimators': 310, 'max_depth': 6, 'min_samples_split': 142, 'min_samples_leaf': 61, 'criterion': 'gini'}.
Trial 3920 finished with value: 0.6739130434782609 and parameters: {'n_estimators': 183, 'max_depth': 13, 'min_samples_split': 145, 'min_samples_leaf': 57, 'criterion': 'gini'}.
Trial 3921 finished with value: 0.7065217391304348 and parameters: {'n_estimators': 243, 'max_depth': 10, 'min_samples_split': 153, 'min_samples_leaf': 67, 'criterion': 'gini'}.
Trial 3922 finished with value: 0.6956521739130435 and parameters: {'n_estimators': 265, 'max_depth': 8, 'min_samples_split': 137, 'min_samples_leaf': 71, 'criterion': 'gini'}.
Trial 3923 finished with value: 0.6847826086956522 and parameters: {'n_estimators': 319, 'max_depth': 12, 'min_samples_split': 119, 'min_samples_leaf': 59, 'criterion': 'gini'}.
Trial 3924 finished with value: 0.6956521739130435 and parameters: {'n_estimators': 641, 'max_depth': 15, 'min_samples_split': 112, 'min_samples_leaf': 64, 'criterion': 'gini'}.
Trial 3925 finished with value: 0.7282608695652174 and parameters: {'n_estimators': 1000, 'max_depth': 10, 'min_samples_split': 60, 'min_samples_leaf': 57, 'criterion': 'gini'}.
Trial 3926 finished with value: 0.6847826086956522 and parameters: {'n_estimators': 292, 'max_depth': 7, 'min_samples_split': 45, 'min_samples_leaf': 61, 'criterion': 'gini'}.
Trial 3927 finished with value: 0.6956521739130435 and parameters: {'n_estimators': 338, 'max_depth': 12, 'min_samples_split': 66, 'min_samples_leaf': 73, 'criterion': 'gini'}.
Trial 3928 finished with value: 0.6847826086956522 and parameters: {'n_estimators': 278, 'max_depth': 18, 'min_samples_split': 140, 'min_samples_leaf': 70, 'criterion': 'gini'}.
Trial 3929 finished with value: 0.6847826086956522 and parameters: {'n_estimators': 257, 'max_depth': 14, 'min_samples_split': 123, 'min_samples_leaf': 82, 'criterion': 'gini'}.
Trial 3930 finished with value: 0.7282608695652174 and parameters: {'n_estimators': 294, 'max_depth': 9, 'min_samples_split': 147, 'min_samples_leaf': 59, 'criterion': 'gini'}.
Trial 3931 finished with value: 0.6521739130434783 and parameters: {'n_estimators': 232, 'max_depth': 5, 'min_samples_split': 128, 'min_samples_leaf': 62, 'criterion': 'gini'}.
Trial 3932 finished with value: 0.717391304347826 and parameters: {'n_estimators': 265, 'max_depth': 11, 'min_samples_split': 132, 'min_samples_leaf': 57, 'criterion': 'gini'}.
Trial 3933 finished with value: 0.7282608695652174 and parameters: {'n_estimators': 313, 'max_depth': 8, 'min_samples_split': 140, 'min_samples_leaf': 68, 'criterion': 'gini'}.
Trial 3934 finished with value: 0.6847826086956522 and parameters: {'n_estimators': 288, 'max_depth': 60, 'min_samples_split': 157, 'min_samples_leaf': 65, 'criterion': 'gini'}.
Trial 3935 finished with value: 0.6630434782608695 and parameters: {'n_estimators': 248, 'max_depth': 13, 'min_samples_split': 149, 'min_samples_leaf': 76, 'criterion': 'gini'}.
Trial 3936 finished with value: 0.7065217391304348 and parameters: {'n_estimators': 273, 'max_depth': 10, 'min_samples_split': 134, 'min_samples_leaf': 60, 'criterion': 'gini'}.
Trial 3937 finished with value: 0.6847826086956522 and parameters: {'n_estimators': 327, 'max_depth': 15, 'min_samples_split': 144, 'min_samples_leaf': 57, 'criterion': 'gini'}.
Trial 3938 finished with value: 0.6630434782608695 and parameters: {'n_estimators': 442, 'max_depth': 6, 'min_samples_split': 78, 'min_samples_leaf': 62, 'criterion': 'gini'}.
Trial 3939 finished with value: 0.6956521739130435 and parameters: {'n_estimators': 307, 'max_depth': 8, 'min_samples_split': 137, 'min_samples_leaf': 59, 'criterion': 'gini'}.
Trial 3940 finished with value: 0.7065217391304348 and parameters: {'n_estimators': 218, 'max_depth': 11, 'min_samples_split': 51, 'min_samples_leaf': 57, 'criterion': 'gini'}.
Trial 3941 finished with value: 0.6739130434782609 and parameters: {'n_estimators': 248, 'max_depth': 13, 'min_samples_split': 104, 'min_samples_leaf': 63, 'criterion': 'gini'}.
Trial 3942 finished with value: 0.6847826086956522 and parameters: {'n_estimators': 281, 'max_depth': 17, 'min_samples_split': 3, 'min_samples_leaf': 69, 'criterion': 'gini'}.
Trial 3943 finished with value: 0.6956521739130435 and parameters: {'n_estimators': 296, 'max_depth': 10, 'min_samples_split': 94, 'min_samples_leaf': 74, 'criterion': 'gini'}.
Trial 3944 finished with value: 0.6739130434782609 and parameters: {'n_estimators': 267, 'max_depth': 7, 'min_samples_split': 44, 'min_samples_leaf': 66, 'criterion': 'gini'}.
Trial 3945 finished with value: 0.717391304347826 and parameters: {'n_estimators': 147, 'max_depth': 9, 'min_samples_split': 119, 'min_samples_leaf': 59, 'criterion': 'gini'}.
Trial 3946 finished with value: 0.7065217391304348 and parameters: {'n_estimators': 395, 'max_depth': 12, 'min_samples_split': 143, 'min_samples_leaf': 61, 'criterion': 'gini'}.
Trial 3947 finished with value: 0.6739130434782609 and parameters: {'n_estimators': 258, 'max_depth': 14, 'min_samples_split': 43, 'min_samples_leaf': 57, 'criterion': 'gini'}.
Trial 3948 finished with value: 0.717391304347826 and parameters: {'n_estimators': 360, 'max_depth': 11, 'min_samples_split': 110, 'min_samples_leaf': 60, 'criterion': 'gini'}.
Trial 3949 finished with value: 0.6956521739130435 and parameters: {'n_estimators': 232, 'max_depth': 8, 'min_samples_split': 151, 'min_samples_leaf': 72, 'criterion': 'gini'}.
Trial 3950 finished with value: 0.6956521739130435 and parameters: {'n_estimators': 291, 'max_depth': 9, 'min_samples_split': 128, 'min_samples_leaf': 64, 'criterion': 'gini'}.
Trial 3951 finished with value: 0.6521739130434783 and parameters: {'n_estimators': 315, 'max_depth': 5, 'min_samples_split': 140, 'min_samples_leaf': 59, 'criterion': 'gini'}.
Trial 3952 finished with value: 0.6847826086956522 and parameters: {'n_estimators': 276, 'max_depth': 16, 'min_samples_split': 131, 'min_samples_leaf': 62, 'criterion': 'gini'}.
Trial 3953 finished with value: 0.6630434782608695 and parameters: {'n_estimators': 255, 'max_depth': 12, 'min_samples_split': 122, 'min_samples_leaf': 79, 'criterion': 'gini'}.
Trial 3954 finished with value: 0.6956521739130435 and parameters: {'n_estimators': 275, 'max_depth': 7, 'min_samples_split': 40, 'min_samples_leaf': 57, 'criterion': 'gini'}.
Trial 3955 finished with value: 0.717391304347826 and parameters: {'n_estimators': 337, 'max_depth': 14, 'min_samples_split': 147, 'min_samples_leaf': 60, 'criterion': 'gini'}.
Trial 3956 finished with value: 0.6630434782608695 and parameters: {'n_estimators': 204, 'max_depth': 10, 'min_samples_split': 114, 'min_samples_leaf': 75, 'criterion': 'gini'}.
Trial 3957 finished with value: 0.6847826086956522 and parameters: {'n_estimators': 303, 'max_depth': 64, 'min_samples_split': 135, 'min_samples_leaf': 67, 'criterion': 'gini'}.
Trial 3958 finished with value: 0.7065217391304348 and parameters: {'n_estimators': 238, 'max_depth': 11, 'min_samples_split': 45, 'min_samples_leaf': 57, 'criterion': 'gini'}.
Trial 3959 finished with value: 0.7282608695652174 and parameters: {'n_estimators': 289, 'max_depth': 9, 'min_samples_split': 144, 'min_samples_leaf': 70, 'criterion': 'gini'}.
Trial 3960 finished with value: 0.717391304347826 and parameters: {'n_estimators': 327, 'max_depth': 13, 'min_samples_split': 154, 'min_samples_leaf': 63, 'criterion': 'gini'}.
Trial 3961 finished with value: 0.6739130434782609 and parameters: {'n_estimators': 257, 'max_depth': 7, 'min_samples_split': 137, 'min_samples_leaf': 59, 'criterion': 'gini'}.
Trial 3962 finished with value: 0.6956521739130435 and parameters: {'n_estimators': 276, 'max_depth': 15, 'min_samples_split': 149, 'min_samples_leaf': 73, 'criterion': 'gini'}.
Trial 3963 finished with value: 0.7065217391304348 and parameters: {'n_estimators': 304, 'max_depth': 11, 'min_samples_split': 42, 'min_samples_leaf': 61, 'criterion': 'gini'}.
Trial 3964 finished with value: 0.7065217391304348 and parameters: {'n_estimators': 229, 'max_depth': 9, 'min_samples_split': 142, 'min_samples_leaf': 57, 'criterion': 'gini'}.
Trial 3965 finished with value: 0.6630434782608695 and parameters: {'n_estimators': 252, 'max_depth': 5, 'min_samples_split': 131, 'min_samples_leaf': 66, 'criterion': 'gini'}.
Trial 3966 finished with value: 0.6739130434782609 and parameters: {'n_estimators': 290, 'max_depth': 24, 'min_samples_split': 126, 'min_samples_leaf': 59, 'criterion': 'gini'}.
Trial 3967 finished with value: 0.6956521739130435 and parameters: {'n_estimators': 351, 'max_depth': 19, 'min_samples_split': 48, 'min_samples_leaf': 64, 'criterion': 'gini'}.
Trial 3968 finished with value: 0.7065217391304348 and parameters: {'n_estimators': 271, 'max_depth': 12, 'min_samples_split': 117, 'min_samples_leaf': 61, 'criterion': 'gini'}.
Trial 3969 finished with value: 0.6847826086956522 and parameters: {'n_estimators': 311, 'max_depth': 7, 'min_samples_split': 139, 'min_samples_leaf': 57, 'criterion': 'gini'}.
Trial 3970 finished with value: 0.7065217391304348 and parameters: {'n_estimators': 266, 'max_depth': 10, 'min_samples_split': 40, 'min_samples_leaf': 69, 'criterion': 'gini'}.
Trial 3971 finished with value: 0.6847826086956522 and parameters: {'n_estimators': 237, 'max_depth': 68, 'min_samples_split': 145, 'min_samples_leaf': 71, 'criterion': 'gini'}.
Trial 3972 finished with value: 0.6521739130434783 and parameters: {'n_estimators': 189, 'max_depth': 14, 'min_samples_split': 38, 'min_samples_leaf': 76, 'criterion': 'gini'}.
Trial 3973 finished with value: 0.717391304347826 and parameters: {'n_estimators': 286, 'max_depth': 8, 'min_samples_split': 42, 'min_samples_leaf': 59, 'criterion': 'gini'}.
Trial 3974 finished with value: 0.6739130434782609 and parameters: {'n_estimators': 326, 'max_depth': 17, 'min_samples_split': 135, 'min_samples_leaf': 62, 'criterion': 'gini'}.
Trial 3975 finished with value: 0.6956521739130435 and parameters: {'n_estimators': 216, 'max_depth': 12, 'min_samples_split': 182, 'min_samples_leaf': 57, 'criterion': 'gini'}.
Trial 3976 finished with value: 0.7065217391304348 and parameters: {'n_estimators': 247, 'max_depth': 9, 'min_samples_split': 123, 'min_samples_leaf': 60, 'criterion': 'gini'}.
Trial 3977 finished with value: 0.717391304347826 and parameters: {'n_estimators': 296, 'max_depth': 13, 'min_samples_split': 160, 'min_samples_leaf': 65, 'criterion': 'gini'}.
Trial 3978 finished with value: 0.6739130434782609 and parameters: {'n_estimators': 425, 'max_depth': 6, 'min_samples_split': 104, 'min_samples_leaf': 73, 'criterion': 'gini'}.
Trial 3979 finished with value: 0.6956521739130435 and parameters: {'n_estimators': 263, 'max_depth': 11, 'min_samples_split': 127, 'min_samples_leaf': 57, 'criterion': 'gini'}.
Trial 3980 finished with value: 0.6956521739130435 and parameters: {'n_estimators': 279, 'max_depth': 15, 'min_samples_split': 141, 'min_samples_leaf': 63, 'criterion': 'gini'}.
Trial 3981 finished with value: 0.7282608695652174 and parameters: {'n_estimators': 303, 'max_depth': 9, 'min_samples_split': 39, 'min_samples_leaf': 58, 'criterion': 'gini'}.
Trial 3982 finished with value: 0.6956521739130435 and parameters: {'n_estimators': 316, 'max_depth': 11, 'min_samples_split': 148, 'min_samples_leaf': 68, 'criterion': 'gini'}.
Trial 3983 finished with value: 0.6847826086956522 and parameters: {'n_estimators': 242, 'max_depth': 7, 'min_samples_split': 46, 'min_samples_leaf': 61, 'criterion': 'gini'}.
Trial 3984 finished with value: 0.7065217391304348 and parameters: {'n_estimators': 279, 'max_depth': 13, 'min_samples_split': 134, 'min_samples_leaf': 59, 'criterion': 'gini'}.
