Trial 5463 finished with value: 0.7065217391304348 and parameters: {'n_estimators': 335, 'max_depth': 13, 'min_samples_split': 153, 'min_samples_leaf': 55, 'criterion': 'entropy'}.
Trial 5464 finished with value: 0.6956521739130435 and parameters: {'n_estimators': 731, 'max_depth': 9, 'min_samples_split': 138, 'min_samples_leaf': 79, 'criterion': 'gini'}.
Trial 5465 finished with value: 0.7282608695652174 and parameters: {'n_estimators': 295, 'max_depth': 11, 'min_samples_split': 39, 'min_samples_leaf': 61, 'criterion': 'entropy'}.
Trial 5466 finished with value: 0.6739130434782609 and parameters: {'n_estimators': 248, 'max_depth': 7, 'min_samples_split': 31, 'min_samples_leaf': 67, 'criterion': 'gini'}.
Trial 5467 finished with value: 0.6956521739130435 and parameters: {'n_estimators': 985, 'max_depth': 15, 'min_samples_split': 102, 'min_samples_leaf': 72, 'criterion': 'entropy'}.
Trial 5468 finished with value: 0.7065217391304348 and parameters: {'n_estimators': 653, 'max_depth': 9, 'min_samples_split': 35, 'min_samples_leaf': 59, 'criterion': 'gini'}.
Trial 5469 finished with value: 0.717391304347826 and parameters: {'n_estimators': 783, 'max_depth': 12, 'min_samples_split': 120, 'min_samples_leaf': 53, 'criterion': 'entropy'}.
Trial 5470 finished with value: 0.7065217391304348 and parameters: {'n_estimators': 278, 'max_depth': 10, 'min_samples_split': 27, 'min_samples_leaf': 64, 'criterion': 'gini'}.
Trial 5471 finished with value: 0.6413043478260869 and parameters: {'n_estimators': 932, 'max_depth': 5, 'min_samples_split': 136, 'min_samples_leaf': 57, 'criterion': 'entropy'}.
Trial 5472 finished with value: 0.6956521739130435 and parameters: {'n_estimators': 315, 'max_depth': 13, 'min_samples_split': 46, 'min_samples_leaf': 61, 'criterion': 'gini'}.
Trial 5473 finished with value: 0.7065217391304348 and parameters: {'n_estimators': 897, 'max_depth': 8, 'min_samples_split': 140, 'min_samples_leaf': 69, 'criterion': 'entropy'}.
Trial 5474 finished with value: 0.6956521739130435 and parameters: {'n_estimators': 205, 'max_depth': 16, 'min_samples_split': 24, 'min_samples_leaf': 55, 'criterion': 'gini'}.
Trial 5475 finished with value: 0.7065217391304348 and parameters: {'n_estimators': 262, 'max_depth': 10, 'min_samples_split': 19, 'min_samples_leaf': 58, 'criterion': 'entropy'}.
Trial 5476 finished with value: 0.6956521739130435 and parameters: {'n_estimators': 299, 'max_depth': 12, 'min_samples_split': 90, 'min_samples_leaf': 63, 'criterion': 'gini'}.
Trial 5477 finished with value: 0.6847826086956522 and parameters: {'n_estimators': 354, 'max_depth': 7, 'min_samples_split': 128, 'min_samples_leaf': 60, 'criterion': 'entropy'}.
Trial 5478 finished with value: 0.6847826086956522 and parameters: {'n_estimators': 281, 'max_depth': 14, 'min_samples_split': 31, 'min_samples_leaf': 75, 'criterion': 'gini'}.
Trial 5479 finished with value: 0.7065217391304348 and parameters: {'n_estimators': 720, 'max_depth': 10, 'min_samples_split': 38, 'min_samples_leaf': 66, 'criterion': 'entropy'}.
Trial 5480 finished with value: 0.7065217391304348 and parameters: {'n_estimators': 763, 'max_depth': 8, 'min_samples_split': 76, 'min_samples_leaf': 71, 'criterion': 'entropy'}.
Trial 5481 finished with value: 0.6413043478260869 and parameters: {'n_estimators': 236, 'max_depth': 5, 'min_samples_split': 148, 'min_samples_leaf': 56, 'criterion': 'gini'}.
Trial 5482 finished with value: 0.6956521739130435 and parameters: {'n_estimators': 259, 'max_depth': 12, 'min_samples_split': 42, 'min_samples_leaf': 53, 'criterion': 'entropy'}.
Trial 5483 finished with value: 0.7065217391304348 and parameters: {'n_estimators': 748, 'max_depth': 10, 'min_samples_split': 28, 'min_samples_leaf': 62, 'criterion': 'gini'}.
Trial 5484 finished with value: 0.6847826086956522 and parameters: {'n_estimators': 312, 'max_depth': 14, 'min_samples_split': 35, 'min_samples_leaf': 59, 'criterion': 'entropy'}.
Trial 5485 finished with value: 0.717391304347826 and parameters: {'n_estimators': 282, 'max_depth': 8, 'min_samples_split': 11, 'min_samples_leaf': 57, 'criterion': 'gini'}.
Trial 5486 finished with value: 0.6847826086956522 and parameters: {'n_estimators': 334, 'max_depth': 18, 'min_samples_split': 133, 'min_samples_leaf': 64, 'criterion': 'entropy'}.
Trial 5487 finished with value: 0.7065217391304348 and parameters: {'n_estimators': 267, 'max_depth': 11, 'min_samples_split': 110, 'min_samples_leaf': 59, 'criterion': 'gini'}.
Trial 5488 finished with value: 0.717391304347826 and parameters: {'n_estimators': 220, 'max_depth': 9, 'min_samples_split': 22, 'min_samples_leaf': 55, 'criterion': 'entropy'}.
Trial 5489 finished with value: 0.7065217391304348 and parameters: {'n_estimators': 299, 'max_depth': 7, 'min_samples_split': 142, 'min_samples_leaf': 73, 'criterion': 'gini'}.
Trial 5490 finished with value: 0.6847826086956522 and parameters: {'n_estimators': 778, 'max_depth': 12, 'min_samples_split': 32, 'min_samples_leaf': 61, 'criterion': 'entropy'}.
Trial 5491 finished with value: 0.6630434782608695 and parameters: {'n_estimators': 256, 'max_depth': 16, 'min_samples_split': 37, 'min_samples_leaf': 58, 'criterion': 'gini'}.
Trial 5492 finished with value: 0.6956521739130435 and parameters: {'n_estimators': 289, 'max_depth': 14, 'min_samples_split': 26, 'min_samples_leaf': 62, 'criterion': 'entropy'}.
Trial 5493 finished with value: 0.6847826086956522 and parameters: {'n_estimators': 238, 'max_depth': 10, 'min_samples_split': 144, 'min_samples_leaf': 70, 'criterion': 'gini'}.
Trial 5494 finished with value: 0.6739130434782609 and parameters: {'n_estimators': 319, 'max_depth': 5, 'min_samples_split': 30, 'min_samples_leaf': 67, 'criterion': 'entropy'}.
Trial 5495 finished with value: 0.6956521739130435 and parameters: {'n_estimators': 672, 'max_depth': 7, 'min_samples_split': 150, 'min_samples_leaf': 57, 'criterion': 'gini'}.
Trial 5496 finished with value: 0.7065217391304348 and parameters: {'n_estimators': 271, 'max_depth': 12, 'min_samples_split': 45, 'min_samples_leaf': 53, 'criterion': 'entropy'}.
Trial 5497 finished with value: 0.6739130434782609 and parameters: {'n_estimators': 708, 'max_depth': 42, 'min_samples_split': 17, 'min_samples_leaf': 83, 'criterion': 'gini'}.
Trial 5498 finished with value: 0.7065217391304348 and parameters: {'n_estimators': 297, 'max_depth': 9, 'min_samples_split': 156, 'min_samples_leaf': 60, 'criterion': 'entropy'}.
Trial 5499 finished with value: 0.6847826086956522 and parameters: {'n_estimators': 247, 'max_depth': 60, 'min_samples_split': 40, 'min_samples_leaf': 55, 'criterion': 'gini'}.
Trial 5500 finished with value: 0.6847826086956522 and parameters: {'n_estimators': 735, 'max_depth': 13, 'min_samples_split': 54, 'min_samples_leaf': 77, 'criterion': 'entropy'}.
Trial 5501 finished with value: 0.717391304347826 and parameters: {'n_estimators': 280, 'max_depth': 11, 'min_samples_split': 34, 'min_samples_leaf': 58, 'criterion': 'gini'}.
Trial 5502 finished with value: 0.6739130434782609 and parameters: {'n_estimators': 190, 'max_depth': 15, 'min_samples_split': 136, 'min_samples_leaf': 65, 'criterion': 'entropy'}.
Trial 5503 finished with value: 0.717391304347826 and parameters: {'n_estimators': 748, 'max_depth': 8, 'min_samples_split': 122, 'min_samples_leaf': 63, 'criterion': 'gini'}.
Trial 5504 finished with value: 0.717391304347826 and parameters: {'n_estimators': 265, 'max_depth': 10, 'min_samples_split': 115, 'min_samples_leaf': 61, 'criterion': 'entropy'}.
Trial 5505 finished with value: 0.6739130434782609 and parameters: {'n_estimators': 302, 'max_depth': 6, 'min_samples_split': 24, 'min_samples_leaf': 72, 'criterion': 'gini'}.
Trial 5506 finished with value: 0.7065217391304348 and parameters: {'n_estimators': 767, 'max_depth': 12, 'min_samples_split': 28, 'min_samples_leaf': 56, 'criterion': 'entropy'}.
Trial 5507 finished with value: 0.717391304347826 and parameters: {'n_estimators': 211, 'max_depth': 9, 'min_samples_split': 33, 'min_samples_leaf': 59, 'criterion': 'gini'}.
Trial 5508 finished with value: 0.6739130434782609 and parameters: {'n_estimators': 382, 'max_depth': 17, 'min_samples_split': 140, 'min_samples_leaf': 69, 'criterion': 'entropy'}.
Trial 5509 finished with value: 0.6739130434782609 and parameters: {'n_estimators': 234, 'max_depth': 14, 'min_samples_split': 19, 'min_samples_leaf': 74, 'criterion': 'entropy'}.
Trial 5510 finished with value: 0.7065217391304348 and parameters: {'n_estimators': 416, 'max_depth': 11, 'min_samples_split': 126, 'min_samples_leaf': 53, 'criterion': 'gini'}.
Trial 5511 finished with value: 0.6847826086956522 and parameters: {'n_estimators': 282, 'max_depth': 7, 'min_samples_split': 36, 'min_samples_leaf': 57, 'criterion': 'entropy'}.
Trial 5512 finished with value: 0.717391304347826 and parameters: {'n_estimators': 128, 'max_depth': 9, 'min_samples_split': 147, 'min_samples_leaf': 60, 'criterion': 'gini'}.
Trial 5513 finished with value: 0.6956521739130435 and parameters: {'n_estimators': 328, 'max_depth': 13, 'min_samples_split': 14, 'min_samples_leaf': 62, 'criterion': 'entropy'}.
Trial 5514 finished with value: 0.7282608695652174 and parameters: {'n_estimators': 265, 'max_depth': 10, 'min_samples_split': 133, 'min_samples_leaf': 55, 'criterion': 'gini'}.
Trial 5515 finished with value: 0.6521739130434783 and parameters: {'n_estimators': 250, 'max_depth': 24, 'min_samples_split': 42, 'min_samples_leaf': 65, 'criterion': 'entropy'}.
Trial 5516 finished with value: 0.6956521739130435 and parameters: {'n_estimators': 784, 'max_depth': 7, 'min_samples_split': 31, 'min_samples_leaf': 58, 'criterion': 'gini'}.
Trial 5517 finished with value: 0.6847826086956522 and parameters: {'n_estimators': 306, 'max_depth': 12, 'min_samples_split': 23, 'min_samples_leaf': 76, 'criterion': 'entropy'}.
Trial 5518 finished with value: 0.6739130434782609 and parameters: {'n_estimators': 721, 'max_depth': 15, 'min_samples_split': 50, 'min_samples_leaf': 60, 'criterion': 'gini'}.
Trial 5519 finished with value: 0.7282608695652174 and parameters: {'n_estimators': 351, 'max_depth': 8, 'min_samples_split': 38, 'min_samples_leaf': 56, 'criterion': 'entropy'}.
Trial 5520 finished with value: 0.7065217391304348 and parameters: {'n_estimators': 289, 'max_depth': 11, 'min_samples_split': 29, 'min_samples_leaf': 68, 'criterion': 'gini'}.
Trial 5521 finished with value: 0.6739130434782609 and parameters: {'n_estimators': 316, 'max_depth': 5, 'min_samples_split': 139, 'min_samples_leaf': 71, 'criterion': 'entropy'}.
Trial 5522 finished with value: 0.7282608695652174 and parameters: {'n_estimators': 277, 'max_depth': 9, 'min_samples_split': 118, 'min_samples_leaf': 63, 'criterion': 'gini'}.
Trial 5523 finished with value: 0.6847826086956522 and parameters: {'n_estimators': 251, 'max_depth': 13, 'min_samples_split': 129, 'min_samples_leaf': 60, 'criterion': 'entropy'}.
Trial 5524 finished with value: 0.6956521739130435 and parameters: {'n_estimators': 224, 'max_depth': 11, 'min_samples_split': 145, 'min_samples_leaf': 53, 'criterion': 'gini'}.
Trial 5525 finished with value: 0.6739130434782609 and parameters: {'n_estimators': 763, 'max_depth': 16, 'min_samples_split': 26, 'min_samples_leaf': 58, 'criterion': 'entropy'}.
Trial 5526 finished with value: 0.6739130434782609 and parameters: {'n_estimators': 267, 'max_depth': 77, 'min_samples_split': 33, 'min_samples_leaf': 62, 'criterion': 'gini'}.
Trial 5527 finished with value: 0.6847826086956522 and parameters: {'n_estimators': 295, 'max_depth': 7, 'min_samples_split': 152, 'min_samples_leaf': 55, 'criterion': 'entropy'}.
Trial 5528 finished with value: 0.717391304347826 and parameters: {'n_estimators': 589, 'max_depth': 9, 'min_samples_split': 66, 'min_samples_leaf': 58, 'criterion': 'gini'}.
Trial 5529 finished with value: 0.7065217391304348 and parameters: {'n_estimators': 690, 'max_depth': 14, 'min_samples_split': 39, 'min_samples_leaf': 66, 'criterion': 'entropy'}.
Trial 5530 finished with value: 0.6956521739130435 and parameters: {'n_estimators': 745, 'max_depth': 11, 'min_samples_split': 44, 'min_samples_leaf': 75, 'criterion': 'gini'}.
Trial 5531 finished with value: 0.6739130434782609 and parameters: {'n_estimators': 252, 'max_depth': 18, 'min_samples_split': 21, 'min_samples_leaf': 73, 'criterion': 'entropy'}.
Trial 5532 finished with value: 0.6847826086956522 and parameters: {'n_estimators': 336, 'max_depth': 6, 'min_samples_split': 29, 'min_samples_leaf': 60, 'criterion': 'gini'}.
Trial 5533 finished with value: 0.6847826086956522 and parameters: {'n_estimators': 286, 'max_depth': 13, 'min_samples_split': 142, 'min_samples_leaf': 57, 'criterion': 'entropy'}.
Trial 5534 finished with value: 0.717391304347826 and parameters: {'n_estimators': 149, 'max_depth': 9, 'min_samples_split': 35, 'min_samples_leaf': 64, 'criterion': 'gini'}.
Trial 5535 finished with value: 0.7282608695652174 and parameters: {'n_estimators': 367, 'max_depth': 11, 'min_samples_split': 104, 'min_samples_leaf': 54, 'criterion': 'entropy'}.
Trial 5536 finished with value: 0.717391304347826 and parameters: {'n_estimators': 781, 'max_depth': 8, 'min_samples_split': 136, 'min_samples_leaf': 78, 'criterion': 'entropy'}.
Trial 5537 finished with value: 0.6847826086956522 and parameters: {'n_estimators': 314, 'max_depth': 15, 'min_samples_split': 25, 'min_samples_leaf': 62, 'criterion': 'gini'}.
Trial 5538 finished with value: 0.7065217391304348 and parameters: {'n_estimators': 906, 'max_depth': 10, 'min_samples_split': 32, 'min_samples_leaf': 70, 'criterion': 'entropy'}.
Trial 5539 finished with value: 0.6739130434782609 and parameters: {'n_estimators': 951, 'max_depth': 20, 'min_samples_split': 124, 'min_samples_leaf': 59, 'criterion': 'gini'}.
Trial 5540 finished with value: 0.6847826086956522 and parameters: {'n_estimators': 235, 'max_depth': 13, 'min_samples_split': 40, 'min_samples_leaf': 56, 'criterion': 'entropy'}.
Trial 5541 finished with value: 0.6847826086956522 and parameters: {'n_estimators': 276, 'max_depth': 7, 'min_samples_split': 21, 'min_samples_leaf': 61, 'criterion': 'gini'}.
Trial 5542 finished with value: 0.6304347826086957 and parameters: {'n_estimators': 255, 'max_depth': 5, 'min_samples_split': 131, 'min_samples_leaf': 57, 'criterion': 'entropy'}.
Trial 5543 finished with value: 0.7065217391304348 and parameters: {'n_estimators': 302, 'max_depth': 12, 'min_samples_split': 13, 'min_samples_leaf': 67, 'criterion': 'gini'}.
Trial 5544 finished with value: 0.6956521739130435 and parameters: {'n_estimators': 736, 'max_depth': 10, 'min_samples_split': 36, 'min_samples_leaf': 72, 'criterion': 'entropy'}.
Trial 5545 finished with value: 0.717391304347826 and parameters: {'n_estimators': 277, 'max_depth': 8, 'min_samples_split': 29, 'min_samples_leaf': 59, 'criterion': 'gini'}.
Trial 5546 finished with value: 0.7391304347826086 and parameters: {'n_estimators': 765, 'max_depth': 12, 'min_samples_split': 111, 'min_samples_leaf': 53, 'criterion': 'entropy'}.
Trial 5547 finished with value: 0.6630434782608695 and parameters: {'n_estimators': 213, 'max_depth': 16, 'min_samples_split': 145, 'min_samples_leaf': 56, 'criterion': 'gini'}.
Trial 5548 finished with value: 0.717391304347826 and parameters: {'n_estimators': 322, 'max_depth': 10, 'min_samples_split': 47, 'min_samples_leaf': 64, 'criterion': 'entropy'}.
Trial 5549 finished with value: 0.7065217391304348 and parameters: {'n_estimators': 267, 'max_depth': 14, 'min_samples_split': 32, 'min_samples_leaf': 61, 'criterion': 'gini'}.
Trial 5550 finished with value: 0.717391304347826 and parameters: {'n_estimators': 298, 'max_depth': 8, 'min_samples_split': 25, 'min_samples_leaf': 59, 'criterion': 'entropy'}.
Trial 5551 finished with value: 0.6739130434782609 and parameters: {'n_estimators': 231, 'max_depth': 11, 'min_samples_split': 149, 'min_samples_leaf': 55, 'criterion': 'gini'}.
Trial 5552 finished with value: 0.6847826086956522 and parameters: {'n_estimators': 254, 'max_depth': 7, 'min_samples_split': 136, 'min_samples_leaf': 63, 'criterion': 'entropy'}.
Trial 5553 finished with value: 0.6956521739130435 and parameters: {'n_estimators': 280, 'max_depth': 9, 'min_samples_split': 120, 'min_samples_leaf': 58, 'criterion': 'gini'}.
Trial 5554 finished with value: 0.6847826086956522 and parameters: {'n_estimators': 754, 'max_depth': 53, 'min_samples_split': 19, 'min_samples_leaf': 74, 'criterion': 'entropy'}.
Trial 5555 finished with value: 0.6956521739130435 and parameters: {'n_estimators': 713, 'max_depth': 13, 'min_samples_split': 37, 'min_samples_leaf': 69, 'criterion': 'gini'}.
Trial 5556 finished with value: 0.6195652173913043 and parameters: {'n_estimators': 291, 'max_depth': 5, 'min_samples_split': 42, 'min_samples_leaf': 61, 'criterion': 'entropy'}.
Trial 5557 finished with value: 0.7282608695652174 and parameters: {'n_estimators': 263, 'max_depth': 10, 'min_samples_split': 140, 'min_samples_leaf': 57, 'criterion': 'gini'}.
Trial 5558 finished with value: 0.6739130434782609 and parameters: {'n_estimators': 784, 'max_depth': 17, 'min_samples_split': 27, 'min_samples_leaf': 53, 'criterion': 'entropy'}.
Trial 5559 finished with value: 0.6956521739130435 and parameters: {'n_estimators': 242, 'max_depth': 12, 'min_samples_split': 128, 'min_samples_leaf': 59, 'criterion': 'gini'}.
Trial 5560 finished with value: 0.6413043478260869 and parameters: {'n_estimators': 164, 'max_depth': 15, 'min_samples_split': 33, 'min_samples_leaf': 65, 'criterion': 'entropy'}.
Trial 5561 finished with value: 0.6956521739130435 and parameters: {'n_estimators': 317, 'max_depth': 7, 'min_samples_split': 143, 'min_samples_leaf': 55, 'criterion': 'gini'}.
Trial 5562 finished with value: 0.7065217391304348 and parameters: {'n_estimators': 733, 'max_depth': 9, 'min_samples_split': 29, 'min_samples_leaf': 72, 'criterion': 'entropy'}.
Trial 5563 finished with value: 0.717391304347826 and parameters: {'n_estimators': 343, 'max_depth': 11, 'min_samples_split': 114, 'min_samples_leaf': 62, 'criterion': 'gini'}.
Trial 5564 finished with value: 0.6847826086956522 and parameters: {'n_estimators': 293, 'max_depth': 14, 'min_samples_split': 23, 'min_samples_leaf': 58, 'criterion': 'entropy'}.
Trial 5565 finished with value: 0.717391304347826 and parameters: {'n_estimators': 276, 'max_depth': 9, 'min_samples_split': 39, 'min_samples_leaf': 60, 'criterion': 'entropy'}.
Trial 5566 finished with value: 0.6847826086956522 and parameters: {'n_estimators': 259, 'max_depth': 6, 'min_samples_split': 34, 'min_samples_leaf': 76, 'criterion': 'gini'}.
Trial 5567 finished with value: 0.6956521739130435 and parameters: {'n_estimators': 314, 'max_depth': 12, 'min_samples_split': 152, 'min_samples_leaf': 56, 'criterion': 'entropy'}.
Trial 5568 finished with value: 0.7065217391304348 and parameters: {'n_estimators': 454, 'max_depth': 10, 'min_samples_split': 18, 'min_samples_leaf': 67, 'criterion': 'gini'}.
Trial 5569 finished with value: 0.6739130434782609 and parameters: {'n_estimators': 232, 'max_depth': 13, 'min_samples_split': 163, 'min_samples_leaf': 70, 'criterion': 'entropy'}.
Trial 5570 finished with value: 0.7065217391304348 and parameters: {'n_estimators': 301, 'max_depth': 8, 'min_samples_split': 194, 'min_samples_leaf': 54, 'criterion': 'gini'}.
Trial 5571 finished with value: 0.7282608695652174 and parameters: {'n_estimators': 268, 'max_depth': 11, 'min_samples_split': 30, 'min_samples_leaf': 62, 'criterion': 'entropy'}.
Trial 5572 finished with value: 0.6630434782608695 and parameters: {'n_estimators': 197, 'max_depth': 7, 'min_samples_split': 132, 'min_samples_leaf': 60, 'criterion': 'gini'}.
Trial 5573 finished with value: 0.6956521739130435 and parameters: {'n_estimators': 505, 'max_depth': 15, 'min_samples_split': 138, 'min_samples_leaf': 57, 'criterion': 'entropy'}.
Trial 5574 finished with value: 0.6739130434782609 and parameters: {'n_estimators': 285, 'max_depth': 10, 'min_samples_split': 186, 'min_samples_leaf': 64, 'criterion': 'gini'}.
Trial 5575 finished with value: 0.7065217391304348 and parameters: {'n_estimators': 763, 'max_depth': 13, 'min_samples_split': 45, 'min_samples_leaf': 59, 'criterion': 'entropy'}.
Trial 5576 finished with value: 0.6304347826086957 and parameters: {'n_estimators': 246, 'max_depth': 5, 'min_samples_split': 36, 'min_samples_leaf': 57, 'criterion': 'gini'}.
Trial 5577 finished with value: 0.7065217391304348 and parameters: {'n_estimators': 745, 'max_depth': 8, 'min_samples_split': 147, 'min_samples_leaf': 74, 'criterion': 'entropy'}.
Trial 5578 finished with value: 0.6847826086956522 and parameters: {'n_estimators': 642, 'max_depth': 17, 'min_samples_split': 7, 'min_samples_leaf': 53, 'criterion': 'gini'}.
Trial 5579 finished with value: 0.717391304347826 and parameters: {'n_estimators': 329, 'max_depth': 11, 'min_samples_split': 25, 'min_samples_leaf': 61, 'criterion': 'entropy'}.
Trial 5580 finished with value: 0.717391304347826 and parameters: {'n_estimators': 782, 'max_depth': 9, 'min_samples_split': 41, 'min_samples_leaf': 55, 'criterion': 'gini'}.
Trial 5581 finished with value: 0.7065217391304348 and parameters: {'n_estimators': 269, 'max_depth': 14, 'min_samples_split': 28, 'min_samples_leaf': 71, 'criterion': 'entropy'}.
Trial 5582 finished with value: 0.6956521739130435 and parameters: {'n_estimators': 113, 'max_depth': 12, 'min_samples_split': 134, 'min_samples_leaf': 63, 'criterion': 'gini'}.
Trial 5583 finished with value: 0.7282608695652174 and parameters: {'n_estimators': 304, 'max_depth': 8, 'min_samples_split': 143, 'min_samples_leaf': 79, 'criterion': 'entropy'}.
Trial 5584 finished with value: 0.717391304347826 and parameters: {'n_estimators': 248, 'max_depth': 10, 'min_samples_split': 33, 'min_samples_leaf': 68, 'criterion': 'gini'}.
Trial 5585 finished with value: 0.6847826086956522 and parameters: {'n_estimators': 218, 'max_depth': 7, 'min_samples_split': 124, 'min_samples_leaf': 58, 'criterion': 'entropy'}.
