Trial 7183 finished with value: 0.6630434782608695 and parameters: {'n_estimators': 328, 'max_depth': 14, 'min_samples_split': 108, 'min_samples_leaf': 77, 'criterion': 'entropy'}.
Trial 7184 finished with value: 0.6847826086956522 and parameters: {'n_estimators': 758, 'max_depth': 9, 'min_samples_split': 31, 'min_samples_leaf': 68, 'criterion': 'gini'}.
Trial 7185 finished with value: 0.717391304347826 and parameters: {'n_estimators': 291, 'max_depth': 12, 'min_samples_split': 19, 'min_samples_leaf': 58, 'criterion': 'entropy'}.
Trial 7186 finished with value: 0.6413043478260869 and parameters: {'n_estimators': 232, 'max_depth': 5, 'min_samples_split': 39, 'min_samples_leaf': 54, 'criterion': 'gini'}.
Trial 7187 finished with value: 0.6956521739130435 and parameters: {'n_estimators': 795, 'max_depth': 17, 'min_samples_split': 136, 'min_samples_leaf': 71, 'criterion': 'entropy'}.
Trial 7188 finished with value: 0.7282608695652174 and parameters: {'n_estimators': 261, 'max_depth': 9, 'min_samples_split': 27, 'min_samples_leaf': 60, 'criterion': 'gini'}.
Trial 7189 finished with value: 0.6521739130434783 and parameters: {'n_estimators': 116, 'max_depth': 11, 'min_samples_split': 33, 'min_samples_leaf': 66, 'criterion': 'entropy'}.
Trial 7190 finished with value: 0.6847826086956522 and parameters: {'n_estimators': 309, 'max_depth': 7, 'min_samples_split': 141, 'min_samples_leaf': 81, 'criterion': 'gini'}.
Trial 7191 finished with value: 0.6847826086956522 and parameters: {'n_estimators': 281, 'max_depth': 14, 'min_samples_split': 14, 'min_samples_leaf': 57, 'criterion': 'entropy'}.
Trial 7192 finished with value: 0.6956521739130435 and parameters: {'n_estimators': 933, 'max_depth': 10, 'min_samples_split': 169, 'min_samples_leaf': 63, 'criterion': 'entropy'}.
Trial 7193 finished with value: 0.6521739130434783 and parameters: {'n_estimators': 255, 'max_depth': 13, 'min_samples_split': 29, 'min_samples_leaf': 51, 'criterion': 'gini'}.
Trial 7194 finished with value: 0.717391304347826 and parameters: {'n_estimators': 522, 'max_depth': 8, 'min_samples_split': 123, 'min_samples_leaf': 59, 'criterion': 'entropy'}.
Trial 7195 finished with value: 0.7282608695652174 and parameters: {'n_estimators': 283, 'max_depth': 11, 'min_samples_split': 37, 'min_samples_leaf': 53, 'criterion': 'gini'}.
Trial 7196 finished with value: 0.6521739130434783 and parameters: {'n_estimators': 137, 'max_depth': 15, 'min_samples_split': 25, 'min_samples_leaf': 56, 'criterion': 'entropy'}.
Trial 7197 finished with value: 0.6739130434782609 and parameters: {'n_estimators': 417, 'max_depth': 6, 'min_samples_split': 131, 'min_samples_leaf': 61, 'criterion': 'gini'}.
Trial 7198 finished with value: 0.6956521739130435 and parameters: {'n_estimators': 730, 'max_depth': 9, 'min_samples_split': 33, 'min_samples_leaf': 64, 'criterion': 'entropy'}.
Trial 7199 finished with value: 0.6956521739130435 and parameters: {'n_estimators': 780, 'max_depth': 12, 'min_samples_split': 114, 'min_samples_leaf': 73, 'criterion': 'gini'}.
Trial 7200 finished with value: 0.7282608695652174 and parameters: {'n_estimators': 361, 'max_depth': 10, 'min_samples_split': 43, 'min_samples_leaf': 58, 'criterion': 'entropy'}.
Trial 7201 finished with value: 0.7065217391304348 and parameters: {'n_estimators': 811, 'max_depth': 7, 'min_samples_split': 138, 'min_samples_leaf': 69, 'criterion': 'entropy'}.
Trial 7202 finished with value: 0.7065217391304348 and parameters: {'n_estimators': 309, 'max_depth': 13, 'min_samples_split': 149, 'min_samples_leaf': 54, 'criterion': 'gini'}.
Trial 7203 finished with value: 0.6413043478260869 and parameters: {'n_estimators': 215, 'max_depth': 16, 'min_samples_split': 40, 'min_samples_leaf': 100, 'criterion': 'entropy'}.
Trial 7204 finished with value: 0.717391304347826 and parameters: {'n_estimators': 248, 'max_depth': 9, 'min_samples_split': 21, 'min_samples_leaf': 60, 'criterion': 'gini'}.
Trial 7205 finished with value: 0.7065217391304348 and parameters: {'n_estimators': 485, 'max_depth': 11, 'min_samples_split': 30, 'min_samples_leaf': 56, 'criterion': 'entropy'}.
Trial 7206 finished with value: 0.6521739130434783 and parameters: {'n_estimators': 336, 'max_depth': 5, 'min_samples_split': 145, 'min_samples_leaf': 75, 'criterion': 'gini'}.
Trial 7207 finished with value: 0.6956521739130435 and parameters: {'n_estimators': 666, 'max_depth': 14, 'min_samples_split': 36, 'min_samples_leaf': 62, 'criterion': 'entropy'}.
Trial 7208 finished with value: 0.6847826086956522 and parameters: {'n_estimators': 100, 'max_depth': 18, 'min_samples_split': 25, 'min_samples_leaf': 58, 'criterion': 'gini'}.
Trial 7209 finished with value: 0.717391304347826 and parameters: {'n_estimators': 271, 'max_depth': 8, 'min_samples_split': 33, 'min_samples_leaf': 65, 'criterion': 'entropy'}.
Trial 7210 finished with value: 0.6956521739130435 and parameters: {'n_estimators': 292, 'max_depth': 12, 'min_samples_split': 28, 'min_samples_leaf': 71, 'criterion': 'entropy'}.
Trial 7211 finished with value: 0.6956521739130435 and parameters: {'n_estimators': 238, 'max_depth': 10, 'min_samples_split': 117, 'min_samples_leaf': 59, 'criterion': 'gini'}.
Trial 7212 finished with value: 0.6956521739130435 and parameters: {'n_estimators': 747, 'max_depth': 7, 'min_samples_split': 125, 'min_samples_leaf': 56, 'criterion': 'entropy'}.
Trial 7213 finished with value: 0.6956521739130435 and parameters: {'n_estimators': 701, 'max_depth': 13, 'min_samples_split': 17, 'min_samples_leaf': 61, 'criterion': 'gini'}.
Trial 7214 finished with value: 0.717391304347826 and parameters: {'n_estimators': 575, 'max_depth': 10, 'min_samples_split': 39, 'min_samples_leaf': 54, 'criterion': 'entropy'}.
Trial 7215 finished with value: 0.6847826086956522 and parameters: {'n_estimators': 318, 'max_depth': 15, 'min_samples_split': 134, 'min_samples_leaf': 57, 'criterion': 'gini'}.
Trial 7216 finished with value: 0.6630434782608695 and parameters: {'n_estimators': 263, 'max_depth': 7, 'min_samples_split': 33, 'min_samples_leaf': 52, 'criterion': 'entropy'}.
Trial 7217 finished with value: 0.6847826086956522 and parameters: {'n_estimators': 298, 'max_depth': 12, 'min_samples_split': 48, 'min_samples_leaf': 59, 'criterion': 'gini'}.
Trial 7218 finished with value: 0.6739130434782609 and parameters: {'n_estimators': 767, 'max_depth': 35, 'min_samples_split': 164, 'min_samples_leaf': 79, 'criterion': 'entropy'}.
Trial 7219 finished with value: 0.7065217391304348 and parameters: {'n_estimators': 279, 'max_depth': 9, 'min_samples_split': 140, 'min_samples_leaf': 67, 'criterion': 'entropy'}.
Trial 7220 finished with value: 0.6847826086956522 and parameters: {'n_estimators': 181, 'max_depth': 11, 'min_samples_split': 23, 'min_samples_leaf': 63, 'criterion': 'gini'}.
Trial 7221 finished with value: 0.6413043478260869 and parameters: {'n_estimators': 250, 'max_depth': 5, 'min_samples_split': 75, 'min_samples_leaf': 55, 'criterion': 'entropy'}.
Trial 7222 finished with value: 0.7065217391304348 and parameters: {'n_estimators': 310, 'max_depth': 8, 'min_samples_split': 28, 'min_samples_leaf': 60, 'criterion': 'gini'}.
Trial 7223 finished with value: 0.7391304347826086 and parameters: {'n_estimators': 792, 'max_depth': 13, 'min_samples_split': 44, 'min_samples_leaf': 58, 'criterion': 'entropy'}.
Trial 7224 finished with value: 0.6956521739130435 and parameters: {'n_estimators': 225, 'max_depth': 44, 'min_samples_split': 38, 'min_samples_leaf': 72, 'criterion': 'gini'}.
Trial 7225 finished with value: 0.7065217391304348 and parameters: {'n_estimators': 273, 'max_depth': 10, 'min_samples_split': 129, 'min_samples_leaf': 70, 'criterion': 'entropy'}.
Trial 7226 finished with value: 0.6739130434782609 and parameters: {'n_estimators': 298, 'max_depth': 16, 'min_samples_split': 120, 'min_samples_leaf': 75, 'criterion': 'gini'}.
Trial 7227 finished with value: 0.717391304347826 and parameters: {'n_estimators': 952, 'max_depth': 8, 'min_samples_split': 35, 'min_samples_leaf': 62, 'criterion': 'entropy'}.
Trial 7228 finished with value: 0.6739130434782609 and parameters: {'n_estimators': 735, 'max_depth': 100, 'min_samples_split': 53, 'min_samples_leaf': 57, 'criterion': 'gini'}.
Trial 7229 finished with value: 0.717391304347826 and parameters: {'n_estimators': 269, 'max_depth': 14, 'min_samples_split': 145, 'min_samples_leaf': 65, 'criterion': 'entropy'}.
Trial 7230 finished with value: 0.7065217391304348 and parameters: {'n_estimators': 758, 'max_depth': 11, 'min_samples_split': 24, 'min_samples_leaf': 55, 'criterion': 'entropy'}.
Trial 7231 finished with value: 0.717391304347826 and parameters: {'n_estimators': 324, 'max_depth': 9, 'min_samples_split': 30, 'min_samples_leaf': 60, 'criterion': 'gini'}.
Trial 7232 finished with value: 0.6739130434782609 and parameters: {'n_estimators': 286, 'max_depth': 12, 'min_samples_split': 16, 'min_samples_leaf': 73, 'criterion': 'entropy'}.
Trial 7233 finished with value: 0.6630434782608695 and parameters: {'n_estimators': 874, 'max_depth': 6, 'min_samples_split': 20, 'min_samples_leaf': 51, 'criterion': 'gini'}.
Trial 7234 finished with value: 0.7065217391304348 and parameters: {'n_estimators': 241, 'max_depth': 10, 'min_samples_split': 41, 'min_samples_leaf': 57, 'criterion': 'entropy'}.
Trial 7235 finished with value: 0.6630434782608695 and parameters: {'n_estimators': 262, 'max_depth': 15, 'min_samples_split': 32, 'min_samples_leaf': 77, 'criterion': 'gini'}.
Trial 7236 finished with value: 0.6956521739130435 and parameters: {'n_estimators': 343, 'max_depth': 28, 'min_samples_split': 138, 'min_samples_leaf': 53, 'criterion': 'entropy'}.
Trial 7237 finished with value: 0.6956521739130435 and parameters: {'n_estimators': 814, 'max_depth': 18, 'min_samples_split': 37, 'min_samples_leaf': 62, 'criterion': 'gini'}.
Trial 7238 finished with value: 0.6956521739130435 and parameters: {'n_estimators': 289, 'max_depth': 7, 'min_samples_split': 95, 'min_samples_leaf': 68, 'criterion': 'entropy'}.
Trial 7239 finished with value: 0.7065217391304348 and parameters: {'n_estimators': 719, 'max_depth': 12, 'min_samples_split': 27, 'min_samples_leaf': 59, 'criterion': 'entropy'}.
Trial 7240 finished with value: 0.6739130434782609 and parameters: {'n_estimators': 772, 'max_depth': 9, 'min_samples_split': 34, 'min_samples_leaf': 64, 'criterion': 'gini'}.
Trial 7241 finished with value: 0.6739130434782609 and parameters: {'n_estimators': 200, 'max_depth': 13, 'min_samples_split': 143, 'min_samples_leaf': 55, 'criterion': 'entropy'}.
Trial 7242 finished with value: 0.717391304347826 and parameters: {'n_estimators': 252, 'max_depth': 11, 'min_samples_split': 28, 'min_samples_leaf': 61, 'criterion': 'gini'}.
Trial 7243 finished with value: 0.6847826086956522 and parameters: {'n_estimators': 306, 'max_depth': 7, 'min_samples_split': 134, 'min_samples_leaf': 57, 'criterion': 'entropy'}.
Trial 7244 finished with value: 0.6413043478260869 and parameters: {'n_estimators': 376, 'max_depth': 5, 'min_samples_split': 42, 'min_samples_leaf': 58, 'criterion': 'gini'}.
Trial 7245 finished with value: 0.6847826086956522 and parameters: {'n_estimators': 280, 'max_depth': 14, 'min_samples_split': 21, 'min_samples_leaf': 59, 'criterion': 'entropy'}.
Trial 7246 finished with value: 0.6847826086956522 and parameters: {'n_estimators': 156, 'max_depth': 10, 'min_samples_split': 9, 'min_samples_leaf': 66, 'criterion': 'gini'}.
Trial 7247 finished with value: 0.717391304347826 and parameters: {'n_estimators': 229, 'max_depth': 8, 'min_samples_split': 112, 'min_samples_leaf': 50, 'criterion': 'entropy'}.
Trial 7248 finished with value: 0.6847826086956522 and parameters: {'n_estimators': 268, 'max_depth': 16, 'min_samples_split': 32, 'min_samples_leaf': 70, 'criterion': 'entropy'}.
Trial 7249 finished with value: 0.6956521739130435 and parameters: {'n_estimators': 299, 'max_depth': 20, 'min_samples_split': 69, 'min_samples_leaf': 54, 'criterion': 'gini'}.
Trial 7250 finished with value: 0.6956521739130435 and parameters: {'n_estimators': 740, 'max_depth': 12, 'min_samples_split': 46, 'min_samples_leaf': 63, 'criterion': 'entropy'}.
Trial 7251 finished with value: 0.6956521739130435 and parameters: {'n_estimators': 328, 'max_depth': 9, 'min_samples_split': 128, 'min_samples_leaf': 60, 'criterion': 'gini'}.
Trial 7252 finished with value: 0.6956521739130435 and parameters: {'n_estimators': 791, 'max_depth': 11, 'min_samples_split': 148, 'min_samples_leaf': 74, 'criterion': 'entropy'}.
Trial 7253 finished with value: 0.6847826086956522 and parameters: {'n_estimators': 252, 'max_depth': 14, 'min_samples_split': 24, 'min_samples_leaf': 56, 'criterion': 'gini'}.
Trial 7254 finished with value: 0.6847826086956522 and parameters: {'n_estimators': 287, 'max_depth': 7, 'min_samples_split': 34, 'min_samples_leaf': 61, 'criterion': 'entropy'}.
Trial 7255 finished with value: 0.717391304347826 and parameters: {'n_estimators': 312, 'max_depth': 9, 'min_samples_split': 38, 'min_samples_leaf': 58, 'criterion': 'gini'}.
Trial 7256 finished with value: 0.7065217391304348 and parameters: {'n_estimators': 269, 'max_depth': 12, 'min_samples_split': 138, 'min_samples_leaf': 53, 'criterion': 'entropy'}.
Trial 7257 finished with value: 0.7282608695652174 and parameters: {'n_estimators': 756, 'max_depth': 10, 'min_samples_split': 2, 'min_samples_leaf': 56, 'criterion': 'entropy'}.
Trial 7258 finished with value: 0.6739130434782609 and parameters: {'n_estimators': 692, 'max_depth': 6, 'min_samples_split': 81, 'min_samples_leaf': 72, 'criterion': 'gini'}.
Trial 7259 finished with value: 0.6956521739130435 and parameters: {'n_estimators': 542, 'max_depth': 13, 'min_samples_split': 30, 'min_samples_leaf': 64, 'criterion': 'entropy'}.
Trial 7260 finished with value: 0.6847826086956522 and parameters: {'n_estimators': 220, 'max_depth': 17, 'min_samples_split': 106, 'min_samples_leaf': 61, 'criterion': 'gini'}.
Trial 7261 finished with value: 0.717391304347826 and parameters: {'n_estimators': 714, 'max_depth': 8, 'min_samples_split': 26, 'min_samples_leaf': 68, 'criterion': 'entropy'}.
Trial 7262 finished with value: 0.7282608695652174 and parameters: {'n_estimators': 243, 'max_depth': 10, 'min_samples_split': 123, 'min_samples_leaf': 59, 'criterion': 'gini'}.
Trial 7263 finished with value: 0.7065217391304348 and parameters: {'n_estimators': 774, 'max_depth': 15, 'min_samples_split': 36, 'min_samples_leaf': 56, 'criterion': 'entropy'}.
Trial 7264 finished with value: 0.6847826086956522 and parameters: {'n_estimators': 285, 'max_depth': 11, 'min_samples_split': 150, 'min_samples_leaf': 62, 'criterion': 'gini'}.
Trial 7265 finished with value: 0.6304347826086957 and parameters: {'n_estimators': 263, 'max_depth': 5, 'min_samples_split': 13, 'min_samples_leaf': 12, 'criterion': 'entropy'}.
Trial 7266 finished with value: 0.7065217391304348 and parameters: {'n_estimators': 313, 'max_depth': 8, 'min_samples_split': 133, 'min_samples_leaf': 76, 'criterion': 'entropy'}.
Trial 7267 finished with value: 0.6739130434782609 and parameters: {'n_estimators': 357, 'max_depth': 13, 'min_samples_split': 143, 'min_samples_leaf': 52, 'criterion': 'gini'}.
Trial 7268 finished with value: 0.717391304347826 and parameters: {'n_estimators': 298, 'max_depth': 11, 'min_samples_split': 41, 'min_samples_leaf': 58, 'criterion': 'entropy'}.
Trial 7269 finished with value: 0.6956521739130435 and parameters: {'n_estimators': 922, 'max_depth': 9, 'min_samples_split': 32, 'min_samples_leaf': 54, 'criterion': 'gini'}.
Trial 7270 finished with value: 0.6956521739130435 and parameters: {'n_estimators': 740, 'max_depth': 7, 'min_samples_split': 27, 'min_samples_leaf': 57, 'criterion': 'entropy'}.
Trial 7271 finished with value: 0.7065217391304348 and parameters: {'n_estimators': 338, 'max_depth': 15, 'min_samples_split': 20, 'min_samples_leaf': 70, 'criterion': 'gini'}.
Trial 7272 finished with value: 0.717391304347826 and parameters: {'n_estimators': 240, 'max_depth': 12, 'min_samples_split': 140, 'min_samples_leaf': 60, 'criterion': 'entropy'}.
Trial 7273 finished with value: 0.717391304347826 and parameters: {'n_estimators': 278, 'max_depth': 9, 'min_samples_split': 117, 'min_samples_leaf': 65, 'criterion': 'gini'}.
Trial 7274 finished with value: 0.6956521739130435 and parameters: {'n_estimators': 812, 'max_depth': 13, 'min_samples_split': 36, 'min_samples_leaf': 55, 'criterion': 'entropy'}.
Trial 7275 finished with value: 0.6847826086956522 and parameters: {'n_estimators': 260, 'max_depth': 23, 'min_samples_split': 29, 'min_samples_leaf': 59, 'criterion': 'entropy'}.
Trial 7276 finished with value: 0.7065217391304348 and parameters: {'n_estimators': 299, 'max_depth': 7, 'min_samples_split': 24, 'min_samples_leaf': 73, 'criterion': 'gini'}.
Trial 7277 finished with value: 0.7065217391304348 and parameters: {'n_estimators': 787, 'max_depth': 10, 'min_samples_split': 43, 'min_samples_leaf': 63, 'criterion': 'entropy'}.
Trial 7278 finished with value: 0.6847826086956522 and parameters: {'n_estimators': 320, 'max_depth': 17, 'min_samples_split': 18, 'min_samples_leaf': 67, 'criterion': 'gini'}.
Trial 7279 finished with value: 0.7282608695652174 and parameters: {'n_estimators': 281, 'max_depth': 11, 'min_samples_split': 39, 'min_samples_leaf': 61, 'criterion': 'entropy'}.
Trial 7280 finished with value: 0.6739130434782609 and parameters: {'n_estimators': 258, 'max_depth': 14, 'min_samples_split': 31, 'min_samples_leaf': 57, 'criterion': 'gini'}.
Trial 7281 finished with value: 0.6195652173913043 and parameters: {'n_estimators': 211, 'max_depth': 5, 'min_samples_split': 126, 'min_samples_leaf': 59, 'criterion': 'entropy'}.
Trial 7282 finished with value: 0.6956521739130435 and parameters: {'n_estimators': 756, 'max_depth': 8, 'min_samples_split': 130, 'min_samples_leaf': 54, 'criterion': 'gini'}.
Trial 7283 finished with value: 0.6956521739130435 and parameters: {'n_estimators': 294, 'max_depth': 11, 'min_samples_split': 86, 'min_samples_leaf': 71, 'criterion': 'entropy'}.
Trial 7284 finished with value: 0.717391304347826 and parameters: {'n_estimators': 264, 'max_depth': 9, 'min_samples_split': 136, 'min_samples_leaf': 50, 'criterion': 'gini'}.
Trial 7285 finished with value: 0.6739130434782609 and parameters: {'n_estimators': 237, 'max_depth': 13, 'min_samples_split': 100, 'min_samples_leaf': 75, 'criterion': 'entropy'}.
Trial 7286 finished with value: 0.6956521739130435 and parameters: {'n_estimators': 279, 'max_depth': 7, 'min_samples_split': 146, 'min_samples_leaf': 56, 'criterion': 'entropy'}.
Trial 7287 finished with value: 0.7065217391304348 and parameters: {'n_estimators': 772, 'max_depth': 10, 'min_samples_split': 36, 'min_samples_leaf': 61, 'criterion': 'gini'}.
Trial 7288 finished with value: 0.6739130434782609 and parameters: {'n_estimators': 732, 'max_depth': 15, 'min_samples_split': 51, 'min_samples_leaf': 63, 'criterion': 'entropy'}.
Trial 7289 finished with value: 0.7065217391304348 and parameters: {'n_estimators': 317, 'max_depth': 12, 'min_samples_split': 23, 'min_samples_leaf': 58, 'criterion': 'gini'}.
Trial 7290 finished with value: 0.6956521739130435 and parameters: {'n_estimators': 240, 'max_depth': 8, 'min_samples_split': 31, 'min_samples_leaf': 78, 'criterion': 'entropy'}.
Trial 7291 finished with value: 0.7065217391304348 and parameters: {'n_estimators': 333, 'max_depth': 11, 'min_samples_split': 27, 'min_samples_leaf': 69, 'criterion': 'gini'}.
Trial 7292 finished with value: 0.6847826086956522 and parameters: {'n_estimators': 306, 'max_depth': 14, 'min_samples_split': 46, 'min_samples_leaf': 52, 'criterion': 'entropy'}.
Trial 7293 finished with value: 0.6847826086956522 and parameters: {'n_estimators': 710, 'max_depth': 6, 'min_samples_split': 33, 'min_samples_leaf': 60, 'criterion': 'gini'}.
Trial 7294 finished with value: 0.7282608695652174 and parameters: {'n_estimators': 278, 'max_depth': 9, 'min_samples_split': 40, 'min_samples_leaf': 55, 'criterion': 'entropy'}.
Trial 7295 finished with value: 0.6630434782608695 and parameters: {'n_estimators': 252, 'max_depth': 17, 'min_samples_split': 141, 'min_samples_leaf': 73, 'criterion': 'entropy'}.
Trial 7296 finished with value: 0.6956521739130435 and parameters: {'n_estimators': 638, 'max_depth': 12, 'min_samples_split': 15, 'min_samples_leaf': 66, 'criterion': 'gini'}.
Trial 7297 finished with value: 0.717391304347826 and parameters: {'n_estimators': 290, 'max_depth': 10, 'min_samples_split': 121, 'min_samples_leaf': 57, 'criterion': 'entropy'}.
Trial 7298 finished with value: 0.6630434782608695 and parameters: {'n_estimators': 751, 'max_depth': 5, 'min_samples_split': 36, 'min_samples_leaf': 63, 'criterion': 'gini'}.
Trial 7299 finished with value: 0.717391304347826 and parameters: {'n_estimators': 261, 'max_depth': 8, 'min_samples_split': 22, 'min_samples_leaf': 59, 'criterion': 'entropy'}.
Trial 7300 finished with value: 0.6847826086956522 and parameters: {'n_estimators': 227, 'max_depth': 13, 'min_samples_split': 134, 'min_samples_leaf': 53, 'criterion': 'gini'}.
Trial 7301 finished with value: 0.6847826086956522 and parameters: {'n_estimators': 295, 'max_depth': 15, 'min_samples_split': 109, 'min_samples_leaf': 57, 'criterion': 'entropy'}.
Trial 7302 finished with value: 0.6739130434782609 and parameters: {'n_estimators': 897, 'max_depth': 19, 'min_samples_split': 28, 'min_samples_leaf': 61, 'criterion': 'gini'}.
Trial 7303 finished with value: 0.717391304347826 and parameters: {'n_estimators': 592, 'max_depth': 10, 'min_samples_split': 32, 'min_samples_leaf': 55, 'criterion': 'entropy'}.
Trial 7304 finished with value: 0.6956521739130435 and parameters: {'n_estimators': 977, 'max_depth': 7, 'min_samples_split': 40, 'min_samples_leaf': 65, 'criterion': 'entropy'}.
Trial 7305 finished with value: 0.6956521739130435 and parameters: {'n_estimators': 267, 'max_depth': 12, 'min_samples_split': 61, 'min_samples_leaf': 59, 'criterion': 'gini'}.
