Trial 7921 finished with value: 0.7065217391304348 and parameters: {'n_estimators': 209, 'max_depth': 13, 'min_samples_split': 23, 'min_samples_leaf': 65, 'criterion': 'gini'}.
Trial 7922 finished with value: 0.6847826086956522 and parameters: {'n_estimators': 306, 'max_depth': 15, 'min_samples_split': 27, 'min_samples_leaf': 61, 'criterion': 'entropy'}.
Trial 7923 finished with value: 0.6739130434782609 and parameters: {'n_estimators': 265, 'max_depth': 77, 'min_samples_split': 138, 'min_samples_leaf': 73, 'criterion': 'gini'}.
Trial 7924 finished with value: 0.717391304347826 and parameters: {'n_estimators': 295, 'max_depth': 10, 'min_samples_split': 132, 'min_samples_leaf': 57, 'criterion': 'entropy'}.
Trial 7925 finished with value: 0.717391304347826 and parameters: {'n_estimators': 279, 'max_depth': 12, 'min_samples_split': 39, 'min_samples_leaf': 54, 'criterion': 'gini'}.
Trial 7926 finished with value: 0.7065217391304348 and parameters: {'n_estimators': 959, 'max_depth': 7, 'min_samples_split': 30, 'min_samples_leaf': 60, 'criterion': 'entropy'}.
Trial 7927 finished with value: 0.6739130434782609 and parameters: {'n_estimators': 180, 'max_depth': 65, 'min_samples_split': 145, 'min_samples_leaf': 63, 'criterion': 'gini'}.
Trial 7928 finished with value: 0.6739130434782609 and parameters: {'n_estimators': 781, 'max_depth': 18, 'min_samples_split': 34, 'min_samples_leaf': 69, 'criterion': 'entropy'}.
Trial 7929 finished with value: 0.6847826086956522 and parameters: {'n_estimators': 638, 'max_depth': 9, 'min_samples_split': 25, 'min_samples_leaf': 52, 'criterion': 'entropy'}.
Trial 7930 finished with value: 0.6739130434782609 and parameters: {'n_estimators': 228, 'max_depth': 14, 'min_samples_split': 42, 'min_samples_leaf': 56, 'criterion': 'gini'}.
Trial 7931 finished with value: 0.717391304347826 and parameters: {'n_estimators': 258, 'max_depth': 11, 'min_samples_split': 37, 'min_samples_leaf': 58, 'criterion': 'entropy'}.
Trial 7932 finished with value: 0.6739130434782609 and parameters: {'n_estimators': 321, 'max_depth': 5, 'min_samples_split': 117, 'min_samples_leaf': 72, 'criterion': 'gini'}.
Trial 7933 finished with value: 0.6739130434782609 and parameters: {'n_estimators': 386, 'max_depth': 21, 'min_samples_split': 31, 'min_samples_leaf': 60, 'criterion': 'entropy'}.
Trial 7934 finished with value: 0.717391304347826 and parameters: {'n_estimators': 754, 'max_depth': 8, 'min_samples_split': 19, 'min_samples_leaf': 76, 'criterion': 'gini'}.
Trial 7935 finished with value: 0.7065217391304348 and parameters: {'n_estimators': 716, 'max_depth': 12, 'min_samples_split': 141, 'min_samples_leaf': 62, 'criterion': 'entropy'}.
Trial 7936 finished with value: 0.7282608695652174 and parameters: {'n_estimators': 676, 'max_depth': 10, 'min_samples_split': 148, 'min_samples_leaf': 55, 'criterion': 'gini'}.
Trial 7937 finished with value: 0.6956521739130435 and parameters: {'n_estimators': 346, 'max_depth': 7, 'min_samples_split': 123, 'min_samples_leaf': 67, 'criterion': 'entropy'}.
Trial 7938 finished with value: 0.6630434782608695 and parameters: {'n_estimators': 292, 'max_depth': 16, 'min_samples_split': 45, 'min_samples_leaf': 57, 'criterion': 'entropy'}.
Trial 7939 finished with value: 0.6956521739130435 and parameters: {'n_estimators': 244, 'max_depth': 13, 'min_samples_split': 182, 'min_samples_leaf': 64, 'criterion': 'gini'}.
Trial 7940 finished with value: 0.7065217391304348 and parameters: {'n_estimators': 306, 'max_depth': 9, 'min_samples_split': 27, 'min_samples_leaf': 59, 'criterion': 'entropy'}.
Trial 7941 finished with value: 0.7065217391304348 and parameters: {'n_estimators': 275, 'max_depth': 11, 'min_samples_split': 133, 'min_samples_leaf': 53, 'criterion': 'gini'}.
Trial 7942 finished with value: 0.6956521739130435 and parameters: {'n_estimators': 739, 'max_depth': 14, 'min_samples_split': 35, 'min_samples_leaf': 61, 'criterion': 'entropy'}.
Trial 7943 finished with value: 0.717391304347826 and parameters: {'n_estimators': 802, 'max_depth': 7, 'min_samples_split': 29, 'min_samples_leaf': 70, 'criterion': 'gini'}.
Trial 7944 finished with value: 0.7065217391304348 and parameters: {'n_estimators': 262, 'max_depth': 10, 'min_samples_split': 6, 'min_samples_leaf': 57, 'criterion': 'entropy'}.
Trial 7945 finished with value: 0.6847826086956522 and parameters: {'n_estimators': 285, 'max_depth': 93, 'min_samples_split': 23, 'min_samples_leaf': 55, 'criterion': 'gini'}.
Trial 7946 finished with value: 0.6956521739130435 and parameters: {'n_estimators': 240, 'max_depth': 12, 'min_samples_split': 104, 'min_samples_leaf': 73, 'criterion': 'entropy'}.
Trial 7947 finished with value: 0.717391304347826 and parameters: {'n_estimators': 358, 'max_depth': 8, 'min_samples_split': 33, 'min_samples_leaf': 59, 'criterion': 'entropy'}.
Trial 7948 finished with value: 0.6521739130434783 and parameters: {'n_estimators': 767, 'max_depth': 5, 'min_samples_split': 39, 'min_samples_leaf': 62, 'criterion': 'gini'}.
Trial 7949 finished with value: 0.6956521739130435 and parameters: {'n_estimators': 516, 'max_depth': 15, 'min_samples_split': 155, 'min_samples_leaf': 65, 'criterion': 'entropy'}.
Trial 7950 finished with value: 0.7065217391304348 and parameters: {'n_estimators': 823, 'max_depth': 10, 'min_samples_split': 48, 'min_samples_leaf': 58, 'criterion': 'gini'}.
Trial 7951 finished with value: 0.6956521739130435 and parameters: {'n_estimators': 320, 'max_depth': 12, 'min_samples_split': 126, 'min_samples_leaf': 52, 'criterion': 'entropy'}.
Trial 7952 finished with value: 0.717391304347826 and parameters: {'n_estimators': 270, 'max_depth': 8, 'min_samples_split': 12, 'min_samples_leaf': 60, 'criterion': 'gini'}.
Trial 7953 finished with value: 0.7065217391304348 and parameters: {'n_estimators': 293, 'max_depth': 13, 'min_samples_split': 136, 'min_samples_leaf': 55, 'criterion': 'entropy'}.
Trial 7954 finished with value: 0.6521739130434783 and parameters: {'n_estimators': 250, 'max_depth': 17, 'min_samples_split': 140, 'min_samples_leaf': 77, 'criterion': 'gini'}.
Trial 7955 finished with value: 0.7065217391304348 and parameters: {'n_estimators': 452, 'max_depth': 10, 'min_samples_split': 31, 'min_samples_leaf': 57, 'criterion': 'entropy'}.
Trial 7956 finished with value: 0.6739130434782609 and parameters: {'n_estimators': 700, 'max_depth': 6, 'min_samples_split': 39, 'min_samples_leaf': 68, 'criterion': 'entropy'}.
Trial 7957 finished with value: 0.7065217391304348 and parameters: {'n_estimators': 215, 'max_depth': 9, 'min_samples_split': 114, 'min_samples_leaf': 63, 'criterion': 'gini'}.
Trial 7958 finished with value: 0.6739130434782609 and parameters: {'n_estimators': 309, 'max_depth': 14, 'min_samples_split': 146, 'min_samples_leaf': 74, 'criterion': 'entropy'}.
Trial 7959 finished with value: 0.7065217391304348 and parameters: {'n_estimators': 275, 'max_depth': 11, 'min_samples_split': 18, 'min_samples_leaf': 61, 'criterion': 'gini'}.
Trial 7960 finished with value: 0.717391304347826 and parameters: {'n_estimators': 796, 'max_depth': 7, 'min_samples_split': 53, 'min_samples_leaf': 71, 'criterion': 'entropy'}.
Trial 7961 finished with value: 0.6956521739130435 and parameters: {'n_estimators': 729, 'max_depth': 12, 'min_samples_split': 24, 'min_samples_leaf': 54, 'criterion': 'gini'}.
Trial 7962 finished with value: 0.7282608695652174 and parameters: {'n_estimators': 336, 'max_depth': 8, 'min_samples_split': 37, 'min_samples_leaf': 58, 'criterion': 'entropy'}.
Trial 7963 finished with value: 0.6847826086956522 and parameters: {'n_estimators': 258, 'max_depth': 10, 'min_samples_split': 29, 'min_samples_leaf': 66, 'criterion': 'gini'}.
Trial 7964 finished with value: 0.6847826086956522 and parameters: {'n_estimators': 289, 'max_depth': 15, 'min_samples_split': 43, 'min_samples_leaf': 56, 'criterion': 'entropy'}.
Trial 7965 finished with value: 0.6956521739130435 and parameters: {'n_estimators': 229, 'max_depth': 13, 'min_samples_split': 35, 'min_samples_leaf': 60, 'criterion': 'gini'}.
Trial 7966 finished with value: 0.6956521739130435 and parameters: {'n_estimators': 775, 'max_depth': 9, 'min_samples_split': 130, 'min_samples_leaf': 62, 'criterion': 'entropy'}.
Trial 7967 finished with value: 0.717391304347826 and parameters: {'n_estimators': 756, 'max_depth': 11, 'min_samples_split': 26, 'min_samples_leaf': 50, 'criterion': 'entropy'}.
Trial 7968 finished with value: 0.6739130434782609 and parameters: {'n_estimators': 304, 'max_depth': 6, 'min_samples_split': 119, 'min_samples_leaf': 58, 'criterion': 'gini'}.
Trial 7969 finished with value: 0.6956521739130435 and parameters: {'n_estimators': 278, 'max_depth': 9, 'min_samples_split': 33, 'min_samples_leaf': 53, 'criterion': 'entropy'}.
Trial 7970 finished with value: 0.6739130434782609 and parameters: {'n_estimators': 252, 'max_depth': 12, 'min_samples_split': 21, 'min_samples_leaf': 64, 'criterion': 'gini'}.
Trial 7971 finished with value: 0.6956521739130435 and parameters: {'n_estimators': 268, 'max_depth': 17, 'min_samples_split': 75, 'min_samples_leaf': 60, 'criterion': 'entropy'}.
Trial 7972 finished with value: 0.6847826086956522 and parameters: {'n_estimators': 322, 'max_depth': 7, 'min_samples_split': 142, 'min_samples_leaf': 56, 'criterion': 'gini'}.
Trial 7973 finished with value: 0.6956521739130435 and parameters: {'n_estimators': 297, 'max_depth': 14, 'min_samples_split': 151, 'min_samples_leaf': 58, 'criterion': 'entropy'}.
Trial 7974 finished with value: 0.6847826086956522 and parameters: {'n_estimators': 789, 'max_depth': 11, 'min_samples_split': 28, 'min_samples_leaf': 75, 'criterion': 'gini'}.
Trial 7975 finished with value: 0.6739130434782609 and parameters: {'n_estimators': 890, 'max_depth': 19, 'min_samples_split': 136, 'min_samples_leaf': 55, 'criterion': 'entropy'}.
Trial 7976 finished with value: 0.6304347826086957 and parameters: {'n_estimators': 160, 'max_depth': 43, 'min_samples_split': 14, 'min_samples_leaf': 70, 'criterion': 'entropy'}.
Trial 7977 finished with value: 0.7282608695652174 and parameters: {'n_estimators': 240, 'max_depth': 9, 'min_samples_split': 32, 'min_samples_leaf': 61, 'criterion': 'gini'}.
Trial 7978 finished with value: 0.6739130434782609 and parameters: {'n_estimators': 283, 'max_depth': 6, 'min_samples_split': 41, 'min_samples_leaf': 72, 'criterion': 'entropy'}.
Trial 7979 finished with value: 0.6847826086956522 and parameters: {'n_estimators': 730, 'max_depth': 15, 'min_samples_split': 36, 'min_samples_leaf': 59, 'criterion': 'gini'}.
Trial 7980 finished with value: 0.6739130434782609 and parameters: {'n_estimators': 192, 'max_depth': 13, 'min_samples_split': 23, 'min_samples_leaf': 67, 'criterion': 'entropy'}.
Trial 7981 finished with value: 0.6847826086956522 and parameters: {'n_estimators': 132, 'max_depth': 11, 'min_samples_split': 28, 'min_samples_leaf': 57, 'criterion': 'gini'}.
Trial 7982 finished with value: 0.6521739130434783 and parameters: {'n_estimators': 268, 'max_depth': 5, 'min_samples_split': 99, 'min_samples_leaf': 63, 'criterion': 'entropy'}.
Trial 7983 finished with value: 0.6847826086956522 and parameters: {'n_estimators': 748, 'max_depth': 8, 'min_samples_split': 38, 'min_samples_leaf': 52, 'criterion': 'gini'}.
Trial 7984 finished with value: 0.6739130434782609 and parameters: {'n_estimators': 858, 'max_depth': 10, 'min_samples_split': 145, 'min_samples_leaf': 22, 'criterion': 'entropy'}.
Trial 7985 finished with value: 0.717391304347826 and parameters: {'n_estimators': 306, 'max_depth': 8, 'min_samples_split': 45, 'min_samples_leaf': 78, 'criterion': 'entropy'}.
Trial 7986 finished with value: 0.7065217391304348 and parameters: {'n_estimators': 330, 'max_depth': 13, 'min_samples_split': 32, 'min_samples_leaf': 54, 'criterion': 'gini'}.
Trial 7987 finished with value: 0.7065217391304348 and parameters: {'n_estimators': 687, 'max_depth': 11, 'min_samples_split': 127, 'min_samples_leaf': 60, 'criterion': 'entropy'}.
Trial 7988 finished with value: 0.6847826086956522 and parameters: {'n_estimators': 409, 'max_depth': 16, 'min_samples_split': 133, 'min_samples_leaf': 56, 'criterion': 'gini'}.
Trial 7989 finished with value: 0.717391304347826 and parameters: {'n_estimators': 256, 'max_depth': 9, 'min_samples_split': 18, 'min_samples_leaf': 62, 'criterion': 'entropy'}.
Trial 7990 finished with value: 0.7065217391304348 and parameters: {'n_estimators': 765, 'max_depth': 12, 'min_samples_split': 140, 'min_samples_leaf': 65, 'criterion': 'gini'}.
Trial 7991 finished with value: 0.6956521739130435 and parameters: {'n_estimators': 293, 'max_depth': 7, 'min_samples_split': 27, 'min_samples_leaf': 69, 'criterion': 'entropy'}.
Trial 7992 finished with value: 0.6739130434782609 and parameters: {'n_estimators': 225, 'max_depth': 82, 'min_samples_split': 109, 'min_samples_leaf': 58, 'criterion': 'gini'}.
Trial 7993 finished with value: 0.6847826086956522 and parameters: {'n_estimators': 278, 'max_depth': 10, 'min_samples_split': 35, 'min_samples_leaf': 75, 'criterion': 'entropy'}.
Trial 7994 finished with value: 0.6847826086956522 and parameters: {'n_estimators': 710, 'max_depth': 15, 'min_samples_split': 22, 'min_samples_leaf': 73, 'criterion': 'entropy'}.
Trial 7995 finished with value: 0.6956521739130435 and parameters: {'n_estimators': 315, 'max_depth': 13, 'min_samples_split': 161, 'min_samples_leaf': 59, 'criterion': 'gini'}.
Trial 7996 finished with value: 0.6521739130434783 and parameters: {'n_estimators': 259, 'max_depth': 26, 'min_samples_split': 30, 'min_samples_leaf': 56, 'criterion': 'entropy'}.
Trial 7997 finished with value: 0.6521739130434783 and parameters: {'n_estimators': 812, 'max_depth': 5, 'min_samples_split': 120, 'min_samples_leaf': 61, 'criterion': 'gini'}.
Trial 7998 finished with value: 0.6847826086956522 and parameters: {'n_estimators': 355, 'max_depth': 8, 'min_samples_split': 41, 'min_samples_leaf': 51, 'criterion': 'entropy'}.
Trial 7999 finished with value: 0.6956521739130435 and parameters: {'n_estimators': 100, 'max_depth': 11, 'min_samples_split': 137, 'min_samples_leaf': 54, 'criterion': 'gini'}.
Trial 8000 finished with value: 0.6739130434782609 and parameters: {'n_estimators': 238, 'max_depth': 54, 'min_samples_split': 34, 'min_samples_leaf': 57, 'criterion': 'entropy'}.
Trial 8001 finished with value: 0.7065217391304348 and parameters: {'n_estimators': 287, 'max_depth': 9, 'min_samples_split': 25, 'min_samples_leaf': 64, 'criterion': 'gini'}.
Trial 8002 finished with value: 0.717391304347826 and parameters: {'n_estimators': 747, 'max_depth': 14, 'min_samples_split': 148, 'min_samples_leaf': 59, 'criterion': 'entropy'}.
Trial 8003 finished with value: 0.717391304347826 and parameters: {'n_estimators': 786, 'max_depth': 7, 'min_samples_split': 123, 'min_samples_leaf': 71, 'criterion': 'entropy'}.
Trial 8004 finished with value: 0.717391304347826 and parameters: {'n_estimators': 301, 'max_depth': 11, 'min_samples_split': 49, 'min_samples_leaf': 62, 'criterion': 'gini'}.
Trial 8005 finished with value: 0.7391304347826086 and parameters: {'n_estimators': 271, 'max_depth': 9, 'min_samples_split': 39, 'min_samples_leaf': 57, 'criterion': 'entropy'}.
Trial 8006 finished with value: 0.6956521739130435 and parameters: {'n_estimators': 248, 'max_depth': 17, 'min_samples_split': 58, 'min_samples_leaf': 54, 'criterion': 'gini'}.
Trial 8007 finished with value: 0.6847826086956522 and parameters: {'n_estimators': 591, 'max_depth': 13, 'min_samples_split': 30, 'min_samples_leaf': 67, 'criterion': 'entropy'}.
Trial 8008 finished with value: 0.7065217391304348 and parameters: {'n_estimators': 212, 'max_depth': 10, 'min_samples_split': 92, 'min_samples_leaf': 60, 'criterion': 'gini'}.
Trial 8009 finished with value: 0.6739130434782609 and parameters: {'n_estimators': 998, 'max_depth': 7, 'min_samples_split': 142, 'min_samples_leaf': 56, 'criterion': 'entropy'}.
Trial 8010 finished with value: 0.7065217391304348 and parameters: {'n_estimators': 967, 'max_depth': 12, 'min_samples_split': 130, 'min_samples_leaf': 50, 'criterion': 'gini'}.
Trial 8011 finished with value: 0.6413043478260869 and parameters: {'n_estimators': 335, 'max_depth': 5, 'min_samples_split': 16, 'min_samples_leaf': 59, 'criterion': 'entropy'}.
Trial 8012 finished with value: 0.6847826086956522 and parameters: {'n_estimators': 286, 'max_depth': 48, 'min_samples_split': 36, 'min_samples_leaf': 62, 'criterion': 'entropy'}.
Trial 8013 finished with value: 0.6847826086956522 and parameters: {'n_estimators': 264, 'max_depth': 10, 'min_samples_split': 44, 'min_samples_leaf': 72, 'criterion': 'gini'}.
Trial 8014 finished with value: 0.6739130434782609 and parameters: {'n_estimators': 834, 'max_depth': 46, 'min_samples_split': 21, 'min_samples_leaf': 65, 'criterion': 'entropy'}.
Trial 8015 finished with value: 0.6847826086956522 and parameters: {'n_estimators': 313, 'max_depth': 15, 'min_samples_split': 32, 'min_samples_leaf': 53, 'criterion': 'gini'}.
Trial 8016 finished with value: 0.7065217391304348 and parameters: {'n_estimators': 734, 'max_depth': 12, 'min_samples_split': 114, 'min_samples_leaf': 59, 'criterion': 'entropy'}.
Trial 8017 finished with value: 0.7065217391304348 and parameters: {'n_estimators': 278, 'max_depth': 8, 'min_samples_split': 26, 'min_samples_leaf': 55, 'criterion': 'gini'}.
Trial 8018 finished with value: 0.6956521739130435 and parameters: {'n_estimators': 299, 'max_depth': 14, 'min_samples_split': 30, 'min_samples_leaf': 69, 'criterion': 'entropy'}.
Trial 8019 finished with value: 0.6739130434782609 and parameters: {'n_estimators': 253, 'max_depth': 10, 'min_samples_split': 38, 'min_samples_leaf': 74, 'criterion': 'gini'}.
Trial 8020 finished with value: 0.7065217391304348 and parameters: {'n_estimators': 774, 'max_depth': 7, 'min_samples_split': 134, 'min_samples_leaf': 80, 'criterion': 'entropy'}.
Trial 8021 finished with value: 0.6739130434782609 and parameters: {'n_estimators': 316, 'max_depth': 18, 'min_samples_split': 139, 'min_samples_leaf': 57, 'criterion': 'gini'}.
Trial 8022 finished with value: 0.6956521739130435 and parameters: {'n_estimators': 231, 'max_depth': 12, 'min_samples_split': 144, 'min_samples_leaf': 61, 'criterion': 'entropy'}.
Trial 8023 finished with value: 0.6956521739130435 and parameters: {'n_estimators': 762, 'max_depth': 9, 'min_samples_split': 34, 'min_samples_leaf': 57, 'criterion': 'entropy'}.
Trial 8024 finished with value: 0.6956521739130435 and parameters: {'n_estimators': 272, 'max_depth': 11, 'min_samples_split': 26, 'min_samples_leaf': 63, 'criterion': 'gini'}.
Trial 8025 finished with value: 0.717391304347826 and parameters: {'n_estimators': 345, 'max_depth': 14, 'min_samples_split': 42, 'min_samples_leaf': 60, 'criterion': 'entropy'}.
Trial 8026 finished with value: 0.717391304347826 and parameters: {'n_estimators': 296, 'max_depth': 8, 'min_samples_split': 21, 'min_samples_leaf': 77, 'criterion': 'gini'}.
Trial 8027 finished with value: 0.6739130434782609 and parameters: {'n_estimators': 254, 'max_depth': 16, 'min_samples_split': 36, 'min_samples_leaf': 58, 'criterion': 'entropy'}.
Trial 8028 finished with value: 0.6739130434782609 and parameters: {'n_estimators': 725, 'max_depth': 6, 'min_samples_split': 30, 'min_samples_leaf': 55, 'criterion': 'gini'}.
Trial 8029 finished with value: 0.7065217391304348 and parameters: {'n_estimators': 285, 'max_depth': 12, 'min_samples_split': 149, 'min_samples_leaf': 52, 'criterion': 'entropy'}.
Trial 8030 finished with value: 0.717391304347826 and parameters: {'n_estimators': 243, 'max_depth': 9, 'min_samples_split': 85, 'min_samples_leaf': 71, 'criterion': 'gini'}.
Trial 8031 finished with value: 0.7065217391304348 and parameters: {'n_estimators': 789, 'max_depth': 10, 'min_samples_split': 24, 'min_samples_leaf': 61, 'criterion': 'entropy'}.
Trial 8032 finished with value: 0.6956521739130435 and parameters: {'n_estimators': 747, 'max_depth': 7, 'min_samples_split': 126, 'min_samples_leaf': 66, 'criterion': 'entropy'}.
Trial 8033 finished with value: 0.7065217391304348 and parameters: {'n_estimators': 327, 'max_depth': 13, 'min_samples_split': 41, 'min_samples_leaf': 63, 'criterion': 'gini'}.
Trial 8034 finished with value: 0.717391304347826 and parameters: {'n_estimators': 659, 'max_depth': 11, 'min_samples_split': 15, 'min_samples_leaf': 58, 'criterion': 'entropy'}.
Trial 8035 finished with value: 0.7065217391304348 and parameters: {'n_estimators': 378, 'max_depth': 9, 'min_samples_split': 33, 'min_samples_leaf': 69, 'criterion': 'gini'}.
Trial 8036 finished with value: 0.6847826086956522 and parameters: {'n_estimators': 276, 'max_depth': 14, 'min_samples_split': 28, 'min_samples_leaf': 55, 'criterion': 'entropy'}.
Trial 8037 finished with value: 0.6739130434782609 and parameters: {'n_estimators': 301, 'max_depth': 5, 'min_samples_split': 138, 'min_samples_leaf': 75, 'criterion': 'gini'}.
Trial 8038 finished with value: 0.6521739130434783 and parameters: {'n_estimators': 203, 'max_depth': 16, 'min_samples_split': 9, 'min_samples_leaf': 59, 'criterion': 'entropy'}.
Trial 8039 finished with value: 0.717391304347826 and parameters: {'n_estimators': 261, 'max_depth': 11, 'min_samples_split': 38, 'min_samples_leaf': 56, 'criterion': 'gini'}.
Trial 8040 finished with value: 0.717391304347826 and parameters: {'n_estimators': 941, 'max_depth': 8, 'min_samples_split': 144, 'min_samples_leaf': 64, 'criterion': 'entropy'}.
Trial 8041 finished with value: 0.6739130434782609 and parameters: {'n_estimators': 231, 'max_depth': 13, 'min_samples_split': 46, 'min_samples_leaf': 61, 'criterion': 'entropy'}.
Trial 8042 finished with value: 0.6956521739130435 and parameters: {'n_estimators': 816, 'max_depth': 10, 'min_samples_split': 20, 'min_samples_leaf': 73, 'criterion': 'gini'}.
Trial 8043 finished with value: 0.6847826086956522 and parameters: {'n_estimators': 704, 'max_depth': 7, 'min_samples_split': 129, 'min_samples_leaf': 53, 'criterion': 'entropy'}.
