Trial 5094 finished with value: 0.7282608695652174 and parameters: {'n_estimators': 312, 'max_depth': 11, 'min_samples_split': 113, 'min_samples_leaf': 62, 'criterion': 'entropy'}.
Trial 5095 finished with value: 0.7065217391304348 and parameters: {'n_estimators': 730, 'max_depth': 8, 'min_samples_split': 46, 'min_samples_leaf': 70, 'criterion': 'gini'}.
Trial 5096 finished with value: 0.6956521739130435 and parameters: {'n_estimators': 287, 'max_depth': 13, 'min_samples_split': 30, 'min_samples_leaf': 58, 'criterion': 'entropy'}.
Trial 5097 finished with value: 0.7282608695652174 and parameters: {'n_estimators': 265, 'max_depth': 10, 'min_samples_split': 136, 'min_samples_leaf': 67, 'criterion': 'gini'}.
Trial 5098 finished with value: 0.6630434782608695 and parameters: {'n_estimators': 241, 'max_depth': 44, 'min_samples_split': 36, 'min_samples_leaf': 74, 'criterion': 'entropy'}.
Trial 5099 finished with value: 0.6413043478260869 and parameters: {'n_estimators': 302, 'max_depth': 5, 'min_samples_split': 25, 'min_samples_leaf': 54, 'criterion': 'gini'}.
Trial 5100 finished with value: 0.7065217391304348 and parameters: {'n_estimators': 769, 'max_depth': 14, 'min_samples_split': 32, 'min_samples_leaf': 60, 'criterion': 'entropy'}.
Trial 5101 finished with value: 0.6956521739130435 and parameters: {'n_estimators': 903, 'max_depth': 8, 'min_samples_split': 121, 'min_samples_leaf': 56, 'criterion': 'gini'}.
Trial 5102 finished with value: 0.6630434782608695 and parameters: {'n_estimators': 715, 'max_depth': 19, 'min_samples_split': 129, 'min_samples_leaf': 63, 'criterion': 'entropy'}.
Trial 5103 finished with value: 0.717391304347826 and parameters: {'n_estimators': 287, 'max_depth': 11, 'min_samples_split': 55, 'min_samples_leaf': 58, 'criterion': 'gini'}.
Trial 5104 finished with value: 0.717391304347826 and parameters: {'n_estimators': 262, 'max_depth': 9, 'min_samples_split': 16, 'min_samples_leaf': 61, 'criterion': 'entropy'}.
Trial 5105 finished with value: 0.7065217391304348 and parameters: {'n_estimators': 222, 'max_depth': 12, 'min_samples_split': 149, 'min_samples_leaf': 56, 'criterion': 'gini'}.
Trial 5106 finished with value: 0.6630434782608695 and parameters: {'n_estimators': 748, 'max_depth': 15, 'min_samples_split': 117, 'min_samples_leaf': 59, 'criterion': 'entropy'}.
Trial 5107 finished with value: 0.6956521739130435 and parameters: {'n_estimators': 322, 'max_depth': 7, 'min_samples_split': 11, 'min_samples_leaf': 72, 'criterion': 'gini'}.
Trial 5108 finished with value: 0.717391304347826 and parameters: {'n_estimators': 276, 'max_depth': 10, 'min_samples_split': 28, 'min_samples_leaf': 65, 'criterion': 'entropy'}.
Trial 5109 finished with value: 0.6847826086956522 and parameters: {'n_estimators': 245, 'max_depth': 13, 'min_samples_split': 156, 'min_samples_leaf': 53, 'criterion': 'gini'}.
Trial 5110 finished with value: 0.717391304347826 and parameters: {'n_estimators': 301, 'max_depth': 8, 'min_samples_split': 38, 'min_samples_leaf': 61, 'criterion': 'entropy'}.
Trial 5111 finished with value: 0.6739130434782609 and parameters: {'n_estimators': 257, 'max_depth': 35, 'min_samples_split': 21, 'min_samples_leaf': 57, 'criterion': 'gini'}.
Trial 5112 finished with value: 0.7065217391304348 and parameters: {'n_estimators': 770, 'max_depth': 11, 'min_samples_split': 43, 'min_samples_leaf': 69, 'criterion': 'entropy'}.
Trial 5113 finished with value: 0.6847826086956522 and parameters: {'n_estimators': 290, 'max_depth': 17, 'min_samples_split': 138, 'min_samples_leaf': 63, 'criterion': 'gini'}.
Trial 5114 finished with value: 0.6413043478260869 and parameters: {'n_estimators': 272, 'max_depth': 5, 'min_samples_split': 35, 'min_samples_leaf': 58, 'criterion': 'entropy'}.
Trial 5115 finished with value: 0.7065217391304348 and parameters: {'n_estimators': 213, 'max_depth': 9, 'min_samples_split': 143, 'min_samples_leaf': 76, 'criterion': 'gini'}.
Trial 5116 finished with value: 0.6956521739130435 and parameters: {'n_estimators': 372, 'max_depth': 12, 'min_samples_split': 24, 'min_samples_leaf': 55, 'criterion': 'entropy'}.
Trial 5117 finished with value: 0.6847826086956522 and parameters: {'n_estimators': 344, 'max_depth': 14, 'min_samples_split': 31, 'min_samples_leaf': 59, 'criterion': 'entropy'}.
Trial 5118 finished with value: 0.717391304347826 and parameters: {'n_estimators': 999, 'max_depth': 7, 'min_samples_split': 133, 'min_samples_leaf': 73, 'criterion': 'gini'}.
Trial 5119 finished with value: 0.717391304347826 and parameters: {'n_estimators': 695, 'max_depth': 10, 'min_samples_split': 27, 'min_samples_leaf': 61, 'criterion': 'entropy'}.
Trial 5120 finished with value: 0.6521739130434783 and parameters: {'n_estimators': 735, 'max_depth': 12, 'min_samples_split': 39, 'min_samples_leaf': 23, 'criterion': 'gini'}.
Trial 5121 finished with value: 0.6847826086956522 and parameters: {'n_estimators': 302, 'max_depth': 15, 'min_samples_split': 33, 'min_samples_leaf': 53, 'criterion': 'entropy'}.
Trial 5122 finished with value: 0.7065217391304348 and parameters: {'n_estimators': 235, 'max_depth': 9, 'min_samples_split': 18, 'min_samples_leaf': 66, 'criterion': 'gini'}.
Trial 5123 finished with value: 0.6847826086956522 and parameters: {'n_estimators': 322, 'max_depth': 7, 'min_samples_split': 125, 'min_samples_leaf': 57, 'criterion': 'entropy'}.
Trial 5124 finished with value: 0.7065217391304348 and parameters: {'n_estimators': 269, 'max_depth': 11, 'min_samples_split': 147, 'min_samples_leaf': 60, 'criterion': 'gini'}.
Trial 5125 finished with value: 0.7065217391304348 and parameters: {'n_estimators': 289, 'max_depth': 13, 'min_samples_split': 140, 'min_samples_leaf': 70, 'criterion': 'entropy'}.
Trial 5126 finished with value: 0.7065217391304348 and parameters: {'n_estimators': 250, 'max_depth': 9, 'min_samples_split': 29, 'min_samples_leaf': 63, 'criterion': 'gini'}.
Trial 5127 finished with value: 0.6739130434782609 and parameters: {'n_estimators': 772, 'max_depth': 6, 'min_samples_split': 41, 'min_samples_leaf': 55, 'criterion': 'entropy'}.
Trial 5128 finished with value: 0.6739130434782609 and parameters: {'n_estimators': 755, 'max_depth': 16, 'min_samples_split': 36, 'min_samples_leaf': 58, 'criterion': 'gini'}.
Trial 5129 finished with value: 0.7065217391304348 and parameters: {'n_estimators': 281, 'max_depth': 11, 'min_samples_split': 23, 'min_samples_leaf': 68, 'criterion': 'entropy'}.
Trial 5130 finished with value: 0.6956521739130435 and parameters: {'n_estimators': 308, 'max_depth': 8, 'min_samples_split': 34, 'min_samples_leaf': 61, 'criterion': 'gini'}.
Trial 5131 finished with value: 0.6956521739130435 and parameters: {'n_estimators': 261, 'max_depth': 13, 'min_samples_split': 170, 'min_samples_leaf': 75, 'criterion': 'entropy'}.
Trial 5132 finished with value: 0.717391304347826 and parameters: {'n_estimators': 329, 'max_depth': 10, 'min_samples_split': 46, 'min_samples_leaf': 56, 'criterion': 'gini'}.
Trial 5133 finished with value: 0.7065217391304348 and parameters: {'n_estimators': 232, 'max_depth': 7, 'min_samples_split': 25, 'min_samples_leaf': 59, 'criterion': 'entropy'}.
Trial 5134 finished with value: 0.6956521739130435 and parameters: {'n_estimators': 280, 'max_depth': 14, 'min_samples_split': 30, 'min_samples_leaf': 72, 'criterion': 'gini'}.
Trial 5135 finished with value: 0.7065217391304348 and parameters: {'n_estimators': 197, 'max_depth': 11, 'min_samples_split': 83, 'min_samples_leaf': 63, 'criterion': 'entropy'}.
Trial 5136 finished with value: 0.6304347826086957 and parameters: {'n_estimators': 254, 'max_depth': 5, 'min_samples_split': 145, 'min_samples_leaf': 54, 'criterion': 'gini'}.
Trial 5137 finished with value: 0.7065217391304348 and parameters: {'n_estimators': 743, 'max_depth': 9, 'min_samples_split': 134, 'min_samples_leaf': 57, 'criterion': 'entropy'}.
Trial 5138 finished with value: 0.6956521739130435 and parameters: {'n_estimators': 718, 'max_depth': 12, 'min_samples_split': 179, 'min_samples_leaf': 65, 'criterion': 'gini'}.
Trial 5139 finished with value: 0.6521739130434783 and parameters: {'n_estimators': 299, 'max_depth': 17, 'min_samples_split': 110, 'min_samples_leaf': 79, 'criterion': 'entropy'}.
Trial 5140 finished with value: 0.7065217391304348 and parameters: {'n_estimators': 356, 'max_depth': 8, 'min_samples_split': 161, 'min_samples_leaf': 60, 'criterion': 'gini'}.
Trial 5141 finished with value: 0.717391304347826 and parameters: {'n_estimators': 272, 'max_depth': 10, 'min_samples_split': 129, 'min_samples_leaf': 62, 'criterion': 'entropy'}.
Trial 5142 finished with value: 0.6956521739130435 and parameters: {'n_estimators': 313, 'max_depth': 14, 'min_samples_split': 138, 'min_samples_leaf': 89, 'criterion': 'gini'}.
Trial 5143 finished with value: 0.6847826086956522 and parameters: {'n_estimators': 245, 'max_depth': 12, 'min_samples_split': 151, 'min_samples_leaf': 59, 'criterion': 'entropy'}.
Trial 5144 finished with value: 0.6630434782608695 and parameters: {'n_estimators': 294, 'max_depth': 7, 'min_samples_split': 38, 'min_samples_leaf': 53, 'criterion': 'entropy'}.
Trial 5145 finished with value: 0.7065217391304348 and parameters: {'n_estimators': 453, 'max_depth': 10, 'min_samples_split': 20, 'min_samples_leaf': 56, 'criterion': 'gini'}.
Trial 5146 finished with value: 0.717391304347826 and parameters: {'n_estimators': 264, 'max_depth': 13, 'min_samples_split': 32, 'min_samples_leaf': 71, 'criterion': 'entropy'}.
Trial 5147 finished with value: 0.6630434782608695 and parameters: {'n_estimators': 227, 'max_depth': 16, 'min_samples_split': 27, 'min_samples_leaf': 67, 'criterion': 'gini'}.
Trial 5148 finished with value: 0.717391304347826 and parameters: {'n_estimators': 951, 'max_depth': 9, 'min_samples_split': 142, 'min_samples_leaf': 59, 'criterion': 'entropy'}.
Trial 5149 finished with value: 0.6413043478260869 and parameters: {'n_estimators': 282, 'max_depth': 5, 'min_samples_split': 119, 'min_samples_leaf': 57, 'criterion': 'gini'}.
Trial 5150 finished with value: 0.717391304347826 and parameters: {'n_estimators': 768, 'max_depth': 11, 'min_samples_split': 123, 'min_samples_leaf': 61, 'criterion': 'entropy'}.
Trial 5151 finished with value: 0.6956521739130435 and parameters: {'n_estimators': 403, 'max_depth': 7, 'min_samples_split': 43, 'min_samples_leaf': 73, 'criterion': 'gini'}.
Trial 5152 finished with value: 0.6847826086956522 and parameters: {'n_estimators': 626, 'max_depth': 19, 'min_samples_split': 8, 'min_samples_leaf': 77, 'criterion': 'entropy'}.
Trial 5153 finished with value: 0.6847826086956522 and parameters: {'n_estimators': 158, 'max_depth': 14, 'min_samples_split': 35, 'min_samples_leaf': 55, 'criterion': 'gini'}.
Trial 5154 finished with value: 0.6956521739130435 and parameters: {'n_estimators': 250, 'max_depth': 9, 'min_samples_split': 32, 'min_samples_leaf': 64, 'criterion': 'entropy'}.
Trial 5155 finished with value: 0.7065217391304348 and parameters: {'n_estimators': 315, 'max_depth': 12, 'min_samples_split': 24, 'min_samples_leaf': 58, 'criterion': 'gini'}.
Trial 5156 finished with value: 0.6956521739130435 and parameters: {'n_estimators': 748, 'max_depth': 10, 'min_samples_split': 28, 'min_samples_leaf': 61, 'criterion': 'entropy'}.
Trial 5157 finished with value: 0.6739130434782609 and parameters: {'n_estimators': 291, 'max_depth': 41, 'min_samples_split': 40, 'min_samples_leaf': 53, 'criterion': 'gini'}.
Trial 5158 finished with value: 0.7065217391304348 and parameters: {'n_estimators': 329, 'max_depth': 8, 'min_samples_split': 136, 'min_samples_leaf': 70, 'criterion': 'entropy'}.
Trial 5159 finished with value: 0.6847826086956522 and parameters: {'n_estimators': 666, 'max_depth': 69, 'min_samples_split': 17, 'min_samples_leaf': 74, 'criterion': 'gini'}.
Trial 5160 finished with value: 0.6847826086956522 and parameters: {'n_estimators': 268, 'max_depth': 15, 'min_samples_split': 147, 'min_samples_leaf': 58, 'criterion': 'entropy'}.
Trial 5161 finished with value: 0.6956521739130435 and parameters: {'n_estimators': 280, 'max_depth': 11, 'min_samples_split': 115, 'min_samples_leaf': 63, 'criterion': 'gini'}.
Trial 5162 finished with value: 0.6956521739130435 and parameters: {'n_estimators': 725, 'max_depth': 7, 'min_samples_split': 37, 'min_samples_leaf': 60, 'criterion': 'entropy'}.
Trial 5163 finished with value: 0.6956521739130435 and parameters: {'n_estimators': 243, 'max_depth': 13, 'min_samples_split': 143, 'min_samples_leaf': 55, 'criterion': 'gini'}.
Trial 5164 finished with value: 0.6956521739130435 and parameters: {'n_estimators': 308, 'max_depth': 9, 'min_samples_split': 22, 'min_samples_leaf': 68, 'criterion': 'entropy'}.
Trial 5165 finished with value: 0.7065217391304348 and parameters: {'n_estimators': 261, 'max_depth': 11, 'min_samples_split': 30, 'min_samples_leaf': 65, 'criterion': 'gini'}.
Trial 5166 finished with value: 0.6630434782608695 and parameters: {'n_estimators': 212, 'max_depth': 6, 'min_samples_split': 154, 'min_samples_leaf': 57, 'criterion': 'entropy'}.
Trial 5167 finished with value: 0.6739130434782609 and parameters: {'n_estimators': 291, 'max_depth': 15, 'min_samples_split': 131, 'min_samples_leaf': 62, 'criterion': 'gini'}.
Trial 5168 finished with value: 0.6847826086956522 and parameters: {'n_estimators': 345, 'max_depth': 13, 'min_samples_split': 47, 'min_samples_leaf': 59, 'criterion': 'entropy'}.
Trial 5169 finished with value: 0.7282608695652174 and parameters: {'n_estimators': 770, 'max_depth': 9, 'min_samples_split': 27, 'min_samples_leaf': 55, 'criterion': 'gini'}.
Trial 5170 finished with value: 0.7065217391304348 and parameters: {'n_estimators': 128, 'max_depth': 11, 'min_samples_split': 35, 'min_samples_leaf': 60, 'criterion': 'entropy'}.
Trial 5171 finished with value: 0.6847826086956522 and parameters: {'n_estimators': 274, 'max_depth': 31, 'min_samples_split': 139, 'min_samples_leaf': 57, 'criterion': 'gini'}.
Trial 5172 finished with value: 0.6739130434782609 and parameters: {'n_estimators': 701, 'max_depth': 18, 'min_samples_split': 42, 'min_samples_leaf': 66, 'criterion': 'entropy'}.
Trial 5173 finished with value: 0.6956521739130435 and parameters: {'n_estimators': 235, 'max_depth': 8, 'min_samples_split': 13, 'min_samples_leaf': 72, 'criterion': 'entropy'}.
Trial 5174 finished with value: 0.6956521739130435 and parameters: {'n_estimators': 252, 'max_depth': 12, 'min_samples_split': 34, 'min_samples_leaf': 75, 'criterion': 'gini'}.
Trial 5175 finished with value: 0.6847826086956522 and parameters: {'n_estimators': 302, 'max_depth': 7, 'min_samples_split': 125, 'min_samples_leaf': 53, 'criterion': 'entropy'}.
Trial 5176 finished with value: 0.6521739130434783 and parameters: {'n_estimators': 750, 'max_depth': 5, 'min_samples_split': 52, 'min_samples_leaf': 61, 'criterion': 'gini'}.
Trial 5177 finished with value: 0.6739130434782609 and parameters: {'n_estimators': 279, 'max_depth': 21, 'min_samples_split': 31, 'min_samples_leaf': 63, 'criterion': 'entropy'}.
Trial 5178 finished with value: 0.6956521739130435 and parameters: {'n_estimators': 495, 'max_depth': 10, 'min_samples_split': 22, 'min_samples_leaf': 58, 'criterion': 'gini'}.
Trial 5179 finished with value: 0.6956521739130435 and parameters: {'n_estimators': 328, 'max_depth': 15, 'min_samples_split': 39, 'min_samples_leaf': 55, 'criterion': 'entropy'}.
Trial 5180 finished with value: 0.7065217391304348 and parameters: {'n_estimators': 293, 'max_depth': 13, 'min_samples_split': 134, 'min_samples_leaf': 59, 'criterion': 'gini'}.
Trial 5181 finished with value: 0.717391304347826 and parameters: {'n_estimators': 922, 'max_depth': 10, 'min_samples_split': 149, 'min_samples_leaf': 70, 'criterion': 'entropy'}.
Trial 5182 finished with value: 0.6956521739130435 and parameters: {'n_estimators': 775, 'max_depth': 7, 'min_samples_split': 26, 'min_samples_leaf': 57, 'criterion': 'gini'}.
Trial 5183 finished with value: 0.6956521739130435 and parameters: {'n_estimators': 260, 'max_depth': 12, 'min_samples_split': 140, 'min_samples_leaf': 62, 'criterion': 'entropy'}.
Trial 5184 finished with value: 0.6956521739130435 and parameters: {'n_estimators': 316, 'max_depth': 9, 'min_samples_split': 18, 'min_samples_leaf': 64, 'criterion': 'gini'}.
Trial 5185 finished with value: 0.6956521739130435 and parameters: {'n_estimators': 736, 'max_depth': 14, 'min_samples_split': 30, 'min_samples_leaf': 56, 'criterion': 'entropy'}.
Trial 5186 finished with value: 0.6847826086956522 and parameters: {'n_estimators': 227, 'max_depth': 16, 'min_samples_split': 37, 'min_samples_leaf': 60, 'criterion': 'gini'}.
Trial 5187 finished with value: 0.6847826086956522 and parameters: {'n_estimators': 598, 'max_depth': 11, 'min_samples_split': 71, 'min_samples_leaf': 77, 'criterion': 'entropy'}.
Trial 5188 finished with value: 0.717391304347826 and parameters: {'n_estimators': 270, 'max_depth': 8, 'min_samples_split': 34, 'min_samples_leaf': 59, 'criterion': 'gini'}.
Trial 5189 finished with value: 0.6413043478260869 and parameters: {'n_estimators': 291, 'max_depth': 5, 'min_samples_split': 145, 'min_samples_leaf': 53, 'criterion': 'entropy'}.
Trial 5190 finished with value: 0.7065217391304348 and parameters: {'n_estimators': 201, 'max_depth': 10, 'min_samples_split': 106, 'min_samples_leaf': 68, 'criterion': 'gini'}.
Trial 5191 finished with value: 0.7065217391304348 and parameters: {'n_estimators': 248, 'max_depth': 13, 'min_samples_split': 27, 'min_samples_leaf': 72, 'criterion': 'entropy'}.
Trial 5192 finished with value: 0.6956521739130435 and parameters: {'n_estimators': 476, 'max_depth': 9, 'min_samples_split': 129, 'min_samples_leaf': 56, 'criterion': 'gini'}.
Trial 5193 finished with value: 0.7065217391304348 and parameters: {'n_estimators': 711, 'max_depth': 7, 'min_samples_split': 120, 'min_samples_leaf': 74, 'criterion': 'entropy'}.
Trial 5194 finished with value: 0.7065217391304348 and parameters: {'n_estimators': 304, 'max_depth': 12, 'min_samples_split': 101, 'min_samples_leaf': 62, 'criterion': 'gini'}.
Trial 5195 finished with value: 0.717391304347826 and parameters: {'n_estimators': 756, 'max_depth': 11, 'min_samples_split': 40, 'min_samples_leaf': 58, 'criterion': 'entropy'}.
Trial 5196 finished with value: 0.6956521739130435 and parameters: {'n_estimators': 262, 'max_depth': 16, 'min_samples_split': 137, 'min_samples_leaf': 65, 'criterion': 'gini'}.
Trial 5197 finished with value: 0.6847826086956522 and parameters: {'n_estimators': 174, 'max_depth': 8, 'min_samples_split': 24, 'min_samples_leaf': 54, 'criterion': 'entropy'}.
Trial 5198 finished with value: 0.7065217391304348 and parameters: {'n_estimators': 275, 'max_depth': 14, 'min_samples_split': 32, 'min_samples_leaf': 61, 'criterion': 'gini'}.
Trial 5199 finished with value: 0.7282608695652174 and parameters: {'n_estimators': 236, 'max_depth': 10, 'min_samples_split': 142, 'min_samples_leaf': 57, 'criterion': 'entropy'}.
Trial 5200 finished with value: 0.6739130434782609 and parameters: {'n_estimators': 734, 'max_depth': 84, 'min_samples_split': 43, 'min_samples_leaf': 59, 'criterion': 'entropy'}.
Trial 5201 finished with value: 0.7065217391304348 and parameters: {'n_estimators': 338, 'max_depth': 7, 'min_samples_split': 35, 'min_samples_leaf': 70, 'criterion': 'gini'}.
Trial 5202 finished with value: 0.6847826086956522 and parameters: {'n_estimators': 292, 'max_depth': 13, 'min_samples_split': 21, 'min_samples_leaf': 67, 'criterion': 'entropy'}.
Trial 5203 finished with value: 0.717391304347826 and parameters: {'n_estimators': 216, 'max_depth': 9, 'min_samples_split': 112, 'min_samples_leaf': 61, 'criterion': 'gini'}.
Trial 5204 finished with value: 0.7065217391304348 and parameters: {'n_estimators': 279, 'max_depth': 11, 'min_samples_split': 151, 'min_samples_leaf': 56, 'criterion': 'entropy'}.
Trial 5205 finished with value: 0.6521739130434783 and parameters: {'n_estimators': 314, 'max_depth': 5, 'min_samples_split': 28, 'min_samples_leaf': 63, 'criterion': 'gini'}.
Trial 5206 finished with value: 0.6956521739130435 and parameters: {'n_estimators': 772, 'max_depth': 12, 'min_samples_split': 16, 'min_samples_leaf': 59, 'criterion': 'entropy'}.
Trial 5207 finished with value: 0.6847826086956522 and parameters: {'n_estimators': 262, 'max_depth': 18, 'min_samples_split': 47, 'min_samples_leaf': 53, 'criterion': 'gini'}.
Trial 5208 finished with value: 0.717391304347826 and parameters: {'n_estimators': 250, 'max_depth': 9, 'min_samples_split': 31, 'min_samples_leaf': 55, 'criterion': 'entropy'}.
Trial 5209 finished with value: 0.6739130434782609 and parameters: {'n_estimators': 283, 'max_depth': 15, 'min_samples_split': 133, 'min_samples_leaf': 60, 'criterion': 'gini'}.
Trial 5210 finished with value: 0.6956521739130435 and parameters: {'n_estimators': 368, 'max_depth': 7, 'min_samples_split': 146, 'min_samples_leaf': 75, 'criterion': 'entropy'}.
Trial 5211 finished with value: 0.6739130434782609 and parameters: {'n_estimators': 296, 'max_depth': 11, 'min_samples_split': 38, 'min_samples_leaf': 28, 'criterion': 'gini'}.
Trial 5212 finished with value: 0.7065217391304348 and parameters: {'n_estimators': 323, 'max_depth': 9, 'min_samples_split': 117, 'min_samples_leaf': 72, 'criterion': 'entropy'}.
Trial 5213 finished with value: 0.7065217391304348 and parameters: {'n_estimators': 754, 'max_depth': 13, 'min_samples_split': 142, 'min_samples_leaf': 64, 'criterion': 'gini'}.
Trial 5214 finished with value: 0.6739130434782609 and parameters: {'n_estimators': 685, 'max_depth': 6, 'min_samples_split': 24, 'min_samples_leaf': 57, 'criterion': 'entropy'}.
Trial 5215 finished with value: 0.7065217391304348 and parameters: {'n_estimators': 141, 'max_depth': 10, 'min_samples_split': 122, 'min_samples_leaf': 58, 'criterion': 'gini'}.
Trial 5216 finished with value: 0.6847826086956522 and parameters: {'n_estimators': 241, 'max_depth': 14, 'min_samples_split': 127, 'min_samples_leaf': 69, 'criterion': 'entropy'}.
