Trial 4109 finished with value: 0.6956521739130435 and parameters: {'n_estimators': 206, 'max_depth': 10, 'min_samples_split': 31, 'min_samples_leaf': 59, 'criterion': 'gini'}.
Trial 4110 finished with value: 0.6739130434782609 and parameters: {'n_estimators': 242, 'max_depth': 13, 'min_samples_split': 46, 'min_samples_leaf': 64, 'criterion': 'gini'}.
Trial 4111 finished with value: 0.6739130434782609 and parameters: {'n_estimators': 278, 'max_depth': 15, 'min_samples_split': 144, 'min_samples_leaf': 56, 'criterion': 'gini'}.
Trial 4112 finished with value: 0.7065217391304348 and parameters: {'n_estimators': 316, 'max_depth': 8, 'min_samples_split': 153, 'min_samples_leaf': 60, 'criterion': 'gini'}.
Trial 4113 finished with value: 0.6521739130434783 and parameters: {'n_estimators': 342, 'max_depth': 5, 'min_samples_split': 148, 'min_samples_leaf': 58, 'criterion': 'gini'}.
Trial 4114 finished with value: 0.7282608695652174 and parameters: {'n_estimators': 257, 'max_depth': 10, 'min_samples_split': 35, 'min_samples_leaf': 56, 'criterion': 'gini'}.
Trial 4115 finished with value: 0.6847826086956522 and parameters: {'n_estimators': 275, 'max_depth': 12, 'min_samples_split': 40, 'min_samples_leaf': 66, 'criterion': 'gini'}.
Trial 4116 finished with value: 0.717391304347826 and parameters: {'n_estimators': 304, 'max_depth': 9, 'min_samples_split': 140, 'min_samples_leaf': 70, 'criterion': 'gini'}.
Trial 4117 finished with value: 0.6956521739130435 and parameters: {'n_estimators': 968, 'max_depth': 7, 'min_samples_split': 29, 'min_samples_leaf': 62, 'criterion': 'gini'}.
Trial 4118 finished with value: 0.6739130434782609 and parameters: {'n_estimators': 258, 'max_depth': 14, 'min_samples_split': 33, 'min_samples_leaf': 73, 'criterion': 'gini'}.
Trial 4119 finished with value: 0.717391304347826 and parameters: {'n_estimators': 283, 'max_depth': 11, 'min_samples_split': 130, 'min_samples_leaf': 59, 'criterion': 'gini'}.
Trial 4120 finished with value: 0.717391304347826 and parameters: {'n_estimators': 232, 'max_depth': 9, 'min_samples_split': 43, 'min_samples_leaf': 76, 'criterion': 'gini'}.
Trial 4121 finished with value: 0.6956521739130435 and parameters: {'n_estimators': 296, 'max_depth': 13, 'min_samples_split': 30, 'min_samples_leaf': 61, 'criterion': 'gini'}.
Trial 4122 finished with value: 0.6739130434782609 and parameters: {'n_estimators': 324, 'max_depth': 17, 'min_samples_split': 37, 'min_samples_leaf': 56, 'criterion': 'gini'}.
Trial 4123 finished with value: 0.6847826086956522 and parameters: {'n_estimators': 264, 'max_depth': 7, 'min_samples_split': 143, 'min_samples_leaf': 65, 'criterion': 'gini'}.
Trial 4124 finished with value: 0.7065217391304348 and parameters: {'n_estimators': 281, 'max_depth': 12, 'min_samples_split': 138, 'min_samples_leaf': 59, 'criterion': 'gini'}.
Trial 4125 finished with value: 0.7065217391304348 and parameters: {'n_estimators': 362, 'max_depth': 10, 'min_samples_split': 49, 'min_samples_leaf': 63, 'criterion': 'gini'}.
Trial 4126 finished with value: 0.6739130434782609 and parameters: {'n_estimators': 685, 'max_depth': 15, 'min_samples_split': 123, 'min_samples_leaf': 58, 'criterion': 'gini'}.
Trial 4127 finished with value: 0.6956521739130435 and parameters: {'n_estimators': 242, 'max_depth': 8, 'min_samples_split': 60, 'min_samples_leaf': 69, 'criterion': 'gini'}.
Trial 4128 finished with value: 0.6413043478260869 and parameters: {'n_estimators': 303, 'max_depth': 5, 'min_samples_split': 134, 'min_samples_leaf': 61, 'criterion': 'gini'}.
Trial 4129 finished with value: 0.717391304347826 and parameters: {'n_estimators': 220, 'max_depth': 12, 'min_samples_split': 35, 'min_samples_leaf': 56, 'criterion': 'gini'}.
Trial 4130 finished with value: 0.6739130434782609 and parameters: {'n_estimators': 255, 'max_depth': 10, 'min_samples_split': 29, 'min_samples_leaf': 74, 'criterion': 'gini'}.
Trial 4131 finished with value: 0.6956521739130435 and parameters: {'n_estimators': 268, 'max_depth': 41, 'min_samples_split': 147, 'min_samples_leaf': 71, 'criterion': 'gini'}.
Trial 4132 finished with value: 0.6956521739130435 and parameters: {'n_estimators': 289, 'max_depth': 7, 'min_samples_split': 40, 'min_samples_leaf': 60, 'criterion': 'gini'}.
Trial 4133 finished with value: 0.6956521739130435 and parameters: {'n_estimators': 325, 'max_depth': 14, 'min_samples_split': 54, 'min_samples_leaf': 58, 'criterion': 'gini'}.
Trial 4134 finished with value: 0.717391304347826 and parameters: {'n_estimators': 186, 'max_depth': 11, 'min_samples_split': 98, 'min_samples_leaf': 67, 'criterion': 'gini'}.
Trial 4135 finished with value: 0.7282608695652174 and parameters: {'n_estimators': 241, 'max_depth': 9, 'min_samples_split': 33, 'min_samples_leaf': 56, 'criterion': 'gini'}.
Trial 4136 finished with value: 0.6956521739130435 and parameters: {'n_estimators': 306, 'max_depth': 19, 'min_samples_split': 29, 'min_samples_leaf': 63, 'criterion': 'gini'}.
Trial 4137 finished with value: 0.6847826086956522 and parameters: {'n_estimators': 274, 'max_depth': 16, 'min_samples_split': 39, 'min_samples_leaf': 61, 'criterion': 'gini'}.
Trial 4138 finished with value: 0.6630434782608695 and parameters: {'n_estimators': 154, 'max_depth': 13, 'min_samples_split': 118, 'min_samples_leaf': 78, 'criterion': 'gini'}.
Trial 4139 finished with value: 0.717391304347826 and parameters: {'n_estimators': 263, 'max_depth': 8, 'min_samples_split': 106, 'min_samples_leaf': 58, 'criterion': 'gini'}.
Trial 4140 finished with value: 0.7065217391304348 and parameters: {'n_estimators': 294, 'max_depth': 11, 'min_samples_split': 136, 'min_samples_leaf': 72, 'criterion': 'gini'}.
Trial 4141 finished with value: 0.717391304347826 and parameters: {'n_estimators': 314, 'max_depth': 9, 'min_samples_split': 141, 'min_samples_leaf': 65, 'criterion': 'gini'}.
Trial 4142 finished with value: 0.6956521739130435 and parameters: {'n_estimators': 344, 'max_depth': 7, 'min_samples_split': 152, 'min_samples_leaf': 56, 'criterion': 'gini'}.
Trial 4143 finished with value: 0.7282608695652174 and parameters: {'n_estimators': 280, 'max_depth': 11, 'min_samples_split': 43, 'min_samples_leaf': 60, 'criterion': 'gini'}.
Trial 4144 finished with value: 0.6304347826086957 and parameters: {'n_estimators': 213, 'max_depth': 5, 'min_samples_split': 32, 'min_samples_leaf': 58, 'criterion': 'gini'}.
Trial 4145 finished with value: 0.6956521739130435 and parameters: {'n_estimators': 248, 'max_depth': 13, 'min_samples_split': 129, 'min_samples_leaf': 62, 'criterion': 'gini'}.
Trial 4146 finished with value: 0.6847826086956522 and parameters: {'n_estimators': 292, 'max_depth': 10, 'min_samples_split': 27, 'min_samples_leaf': 25, 'criterion': 'gini'}.
Trial 4147 finished with value: 0.6739130434782609 and parameters: {'n_estimators': 266, 'max_depth': 15, 'min_samples_split': 36, 'min_samples_leaf': 56, 'criterion': 'gini'}.
Trial 4148 finished with value: 0.7065217391304348 and parameters: {'n_estimators': 246, 'max_depth': 8, 'min_samples_split': 126, 'min_samples_leaf': 64, 'criterion': 'gini'}.
Trial 4149 finished with value: 0.7065217391304348 and parameters: {'n_estimators': 332, 'max_depth': 12, 'min_samples_split': 31, 'min_samples_leaf': 74, 'criterion': 'gini'}.
Trial 4150 finished with value: 0.6847826086956522 and parameters: {'n_estimators': 113, 'max_depth': 10, 'min_samples_split': 110, 'min_samples_leaf': 80, 'criterion': 'gini'}.
Trial 4151 finished with value: 0.6413043478260869 and parameters: {'n_estimators': 278, 'max_depth': 17, 'min_samples_split': 145, 'min_samples_leaf': 13, 'criterion': 'gini'}.
Trial 4152 finished with value: 0.6739130434782609 and parameters: {'n_estimators': 312, 'max_depth': 6, 'min_samples_split': 47, 'min_samples_leaf': 68, 'criterion': 'gini'}.
Trial 4153 finished with value: 0.7065217391304348 and parameters: {'n_estimators': 986, 'max_depth': 13, 'min_samples_split': 37, 'min_samples_leaf': 60, 'criterion': 'gini'}.
Trial 4154 finished with value: 0.717391304347826 and parameters: {'n_estimators': 261, 'max_depth': 9, 'min_samples_split': 27, 'min_samples_leaf': 58, 'criterion': 'gini'}.
Trial 4155 finished with value: 0.6956521739130435 and parameters: {'n_estimators': 294, 'max_depth': 11, 'min_samples_split': 140, 'min_samples_leaf': 62, 'criterion': 'gini'}.
Trial 4156 finished with value: 0.6521739130434783 and parameters: {'n_estimators': 223, 'max_depth': 15, 'min_samples_split': 121, 'min_samples_leaf': 76, 'criterion': 'gini'}.
Trial 4157 finished with value: 0.6956521739130435 and parameters: {'n_estimators': 234, 'max_depth': 7, 'min_samples_split': 7, 'min_samples_leaf': 70, 'criterion': 'gini'}.
Trial 4158 finished with value: 0.6956521739130435 and parameters: {'n_estimators': 280, 'max_depth': 13, 'min_samples_split': 133, 'min_samples_leaf': 56, 'criterion': 'gini'}.
Trial 4159 finished with value: 0.7065217391304348 and parameters: {'n_estimators': 649, 'max_depth': 9, 'min_samples_split': 149, 'min_samples_leaf': 59, 'criterion': 'gini'}.
Trial 4160 finished with value: 0.7065217391304348 and parameters: {'n_estimators': 374, 'max_depth': 11, 'min_samples_split': 32, 'min_samples_leaf': 61, 'criterion': 'gini'}.
Trial 4161 finished with value: 0.7065217391304348 and parameters: {'n_estimators': 255, 'max_depth': 7, 'min_samples_split': 90, 'min_samples_leaf': 72, 'criterion': 'gini'}.
Trial 4162 finished with value: 0.6956521739130435 and parameters: {'n_estimators': 317, 'max_depth': 14, 'min_samples_split': 42, 'min_samples_leaf': 58, 'criterion': 'gini'}.
Trial 4163 finished with value: 0.6956521739130435 and parameters: {'n_estimators': 294, 'max_depth': 9, 'min_samples_split': 36, 'min_samples_leaf': 64, 'criterion': 'gini'}.
Trial 4164 finished with value: 0.6304347826086957 and parameters: {'n_estimators': 264, 'max_depth': 5, 'min_samples_split': 28, 'min_samples_leaf': 56, 'criterion': 'gini'}.
Trial 4165 finished with value: 0.717391304347826 and parameters: {'n_estimators': 928, 'max_depth': 12, 'min_samples_split': 33, 'min_samples_leaf': 59, 'criterion': 'gini'}.
Trial 4166 finished with value: 0.6956521739130435 and parameters: {'n_estimators': 436, 'max_depth': 10, 'min_samples_split': 80, 'min_samples_leaf': 66, 'criterion': 'gini'}.
Trial 4167 finished with value: 0.6630434782608695 and parameters: {'n_estimators': 466, 'max_depth': 18, 'min_samples_split': 138, 'min_samples_leaf': 61, 'criterion': 'gini'}.
Trial 4168 finished with value: 0.6630434782608695 and parameters: {'n_estimators': 279, 'max_depth': 29, 'min_samples_split': 39, 'min_samples_leaf': 56, 'criterion': 'gini'}.
Trial 4169 finished with value: 0.7065217391304348 and parameters: {'n_estimators': 307, 'max_depth': 8, 'min_samples_split': 114, 'min_samples_leaf': 63, 'criterion': 'gini'}.
Trial 4170 finished with value: 0.6630434782608695 and parameters: {'n_estimators': 100, 'max_depth': 15, 'min_samples_split': 145, 'min_samples_leaf': 60, 'criterion': 'gini'}.
Trial 4171 finished with value: 0.6956521739130435 and parameters: {'n_estimators': 250, 'max_depth': 12, 'min_samples_split': 27, 'min_samples_leaf': 74, 'criterion': 'gini'}.
Trial 4172 finished with value: 0.6847826086956522 and parameters: {'n_estimators': 234, 'max_depth': 25, 'min_samples_split': 34, 'min_samples_leaf': 69, 'criterion': 'gini'}.
Trial 4173 finished with value: 0.6739130434782609 and parameters: {'n_estimators': 204, 'max_depth': 7, 'min_samples_split': 142, 'min_samples_leaf': 58, 'criterion': 'gini'}.
Trial 4174 finished with value: 0.6847826086956522 and parameters: {'n_estimators': 408, 'max_depth': 10, 'min_samples_split': 135, 'min_samples_leaf': 56, 'criterion': 'gini'}.
Trial 4175 finished with value: 0.6847826086956522 and parameters: {'n_estimators': 274, 'max_depth': 97, 'min_samples_split': 31, 'min_samples_leaf': 62, 'criterion': 'gini'}.
Trial 4176 finished with value: 0.7065217391304348 and parameters: {'n_estimators': 333, 'max_depth': 13, 'min_samples_split': 38, 'min_samples_leaf': 67, 'criterion': 'gini'}.
Trial 4177 finished with value: 0.717391304347826 and parameters: {'n_estimators': 298, 'max_depth': 11, 'min_samples_split': 44, 'min_samples_leaf': 58, 'criterion': 'gini'}.
Trial 4178 finished with value: 0.7065217391304348 and parameters: {'n_estimators': 348, 'max_depth': 9, 'min_samples_split': 156, 'min_samples_leaf': 77, 'criterion': 'gini'}.
Trial 4179 finished with value: 0.6739130434782609 and parameters: {'n_estimators': 262, 'max_depth': 6, 'min_samples_split': 28, 'min_samples_leaf': 71, 'criterion': 'gini'}.
Trial 4180 finished with value: 0.6739130434782609 and parameters: {'n_estimators': 285, 'max_depth': 16, 'min_samples_split': 124, 'min_samples_leaf': 60, 'criterion': 'gini'}.
Trial 4181 finished with value: 0.7065217391304348 and parameters: {'n_estimators': 240, 'max_depth': 8, 'min_samples_split': 36, 'min_samples_leaf': 64, 'criterion': 'gini'}.
Trial 4182 finished with value: 0.6847826086956522 and parameters: {'n_estimators': 306, 'max_depth': 14, 'min_samples_split': 147, 'min_samples_leaf': 56, 'criterion': 'gini'}.
Trial 4183 finished with value: 0.6739130434782609 and parameters: {'n_estimators': 167, 'max_depth': 11, 'min_samples_split': 129, 'min_samples_leaf': 58, 'criterion': 'gini'}.
Trial 4184 finished with value: 0.6956521739130435 and parameters: {'n_estimators': 274, 'max_depth': 89, 'min_samples_split': 30, 'min_samples_leaf': 60, 'criterion': 'gini'}.
Trial 4185 finished with value: 0.6847826086956522 and parameters: {'n_estimators': 321, 'max_depth': 21, 'min_samples_split': 41, 'min_samples_leaf': 62, 'criterion': 'gini'}.
Trial 4186 finished with value: 0.717391304347826 and parameters: {'n_estimators': 689, 'max_depth': 9, 'min_samples_split': 152, 'min_samples_leaf': 74, 'criterion': 'gini'}.
Trial 4187 finished with value: 0.717391304347826 and parameters: {'n_estimators': 252, 'max_depth': 12, 'min_samples_split': 119, 'min_samples_leaf': 56, 'criterion': 'gini'}.
Trial 4188 finished with value: 0.6739130434782609 and parameters: {'n_estimators': 285, 'max_depth': 5, 'min_samples_split': 142, 'min_samples_leaf': 65, 'criterion': 'gini'}.
Trial 4189 finished with value: 0.6847826086956522 and parameters: {'n_estimators': 230, 'max_depth': 14, 'min_samples_split': 136, 'min_samples_leaf': 58, 'criterion': 'gini'}.
Trial 4190 finished with value: 0.6956521739130435 and parameters: {'n_estimators': 267, 'max_depth': 7, 'min_samples_split': 25, 'min_samples_leaf': 60, 'criterion': 'gini'}.
Trial 4191 finished with value: 0.717391304347826 and parameters: {'n_estimators': 299, 'max_depth': 10, 'min_samples_split': 33, 'min_samples_leaf': 72, 'criterion': 'gini'}.
Trial 4192 finished with value: 0.6956521739130435 and parameters: {'n_estimators': 250, 'max_depth': 12, 'min_samples_split': 50, 'min_samples_leaf': 63, 'criterion': 'gini'}.
Trial 4193 finished with value: 0.7065217391304348 and parameters: {'n_estimators': 288, 'max_depth': 8, 'min_samples_split': 27, 'min_samples_leaf': 69, 'criterion': 'gini'}.
Trial 4194 finished with value: 0.6521739130434783 and parameters: {'n_estimators': 317, 'max_depth': 32, 'min_samples_split': 69, 'min_samples_leaf': 56, 'criterion': 'gini'}.
Trial 4195 finished with value: 0.6739130434782609 and parameters: {'n_estimators': 219, 'max_depth': 16, 'min_samples_split': 131, 'min_samples_leaf': 60, 'criterion': 'gini'}.
Trial 4196 finished with value: 0.7065217391304348 and parameters: {'n_estimators': 267, 'max_depth': 10, 'min_samples_split': 37, 'min_samples_leaf': 58, 'criterion': 'gini'}.
Trial 4197 finished with value: 0.6847826086956522 and parameters: {'n_estimators': 1000, 'max_depth': 13, 'min_samples_split': 31, 'min_samples_leaf': 67, 'criterion': 'gini'}.
Trial 4198 finished with value: 0.717391304347826 and parameters: {'n_estimators': 134, 'max_depth': 11, 'min_samples_split': 104, 'min_samples_leaf': 61, 'criterion': 'gini'}.
Trial 4199 finished with value: 0.6956521739130435 and parameters: {'n_estimators': 294, 'max_depth': 7, 'min_samples_split': 44, 'min_samples_leaf': 76, 'criterion': 'gini'}.
Trial 4200 finished with value: 0.7065217391304348 and parameters: {'n_estimators': 247, 'max_depth': 9, 'min_samples_split': 76, 'min_samples_leaf': 58, 'criterion': 'gini'}.
Trial 4201 finished with value: 0.6956521739130435 and parameters: {'n_estimators': 273, 'max_depth': 13, 'min_samples_split': 115, 'min_samples_leaf': 71, 'criterion': 'gini'}.
Trial 4202 finished with value: 0.7065217391304348 and parameters: {'n_estimators': 307, 'max_depth': 11, 'min_samples_split': 139, 'min_samples_leaf': 56, 'criterion': 'gini'}.
Trial 4203 finished with value: 0.6304347826086957 and parameters: {'n_estimators': 338, 'max_depth': 5, 'min_samples_split': 36, 'min_samples_leaf': 62, 'criterion': 'gini'}.
Trial 4204 finished with value: 0.7065217391304348 and parameters: {'n_estimators': 272, 'max_depth': 8, 'min_samples_split': 149, 'min_samples_leaf': 65, 'criterion': 'gini'}.
Trial 4205 finished with value: 0.6847826086956522 and parameters: {'n_estimators': 359, 'max_depth': 17, 'min_samples_split': 26, 'min_samples_leaf': 60, 'criterion': 'gini'}.
Trial 4206 finished with value: 0.6739130434782609 and parameters: {'n_estimators': 254, 'max_depth': 15, 'min_samples_split': 30, 'min_samples_leaf': 73, 'criterion': 'gini'}.
Trial 4207 finished with value: 0.7065217391304348 and parameters: {'n_estimators': 389, 'max_depth': 10, 'min_samples_split': 40, 'min_samples_leaf': 58, 'criterion': 'gini'}.
Trial 4208 finished with value: 0.6956521739130435 and parameters: {'n_estimators': 230, 'max_depth': 13, 'min_samples_split': 34, 'min_samples_leaf': 56, 'criterion': 'gini'}.
Trial 4209 finished with value: 0.6956521739130435 and parameters: {'n_estimators': 200, 'max_depth': 7, 'min_samples_split': 146, 'min_samples_leaf': 64, 'criterion': 'gini'}.
Trial 4210 finished with value: 0.717391304347826 and parameters: {'n_estimators': 285, 'max_depth': 9, 'min_samples_split': 126, 'min_samples_leaf': 69, 'criterion': 'gini'}.
Trial 4211 finished with value: 0.6956521739130435 and parameters: {'n_estimators': 318, 'max_depth': 11, 'min_samples_split': 142, 'min_samples_leaf': 62, 'criterion': 'gini'}.
Trial 4212 finished with value: 0.6739130434782609 and parameters: {'n_estimators': 294, 'max_depth': 14, 'min_samples_split': 132, 'min_samples_leaf': 59, 'criterion': 'gini'}.
Trial 4213 finished with value: 0.717391304347826 and parameters: {'n_estimators': 258, 'max_depth': 12, 'min_samples_split': 26, 'min_samples_leaf': 57, 'criterion': 'gini'}.
Trial 4214 finished with value: 0.7065217391304348 and parameters: {'n_estimators': 629, 'max_depth': 9, 'min_samples_split': 31, 'min_samples_leaf': 75, 'criterion': 'gini'}.
Trial 4215 finished with value: 0.6847826086956522 and parameters: {'n_estimators': 277, 'max_depth': 7, 'min_samples_split': 47, 'min_samples_leaf': 61, 'criterion': 'gini'}.
Trial 4216 finished with value: 0.7065217391304348 and parameters: {'n_estimators': 239, 'max_depth': 11, 'min_samples_split': 136, 'min_samples_leaf': 56, 'criterion': 'gini'}.
Trial 4217 finished with value: 0.6739130434782609 and parameters: {'n_estimators': 311, 'max_depth': 19, 'min_samples_split': 112, 'min_samples_leaf': 59, 'criterion': 'gini'}.
Trial 4218 finished with value: 0.6847826086956522 and parameters: {'n_estimators': 963, 'max_depth': 6, 'min_samples_split': 39, 'min_samples_leaf': 72, 'criterion': 'gini'}.
Trial 4219 finished with value: 0.6521739130434783 and parameters: {'n_estimators': 262, 'max_depth': 15, 'min_samples_split': 35, 'min_samples_leaf': 67, 'criterion': 'gini'}.
Trial 4220 finished with value: 0.6847826086956522 and parameters: {'n_estimators': 937, 'max_depth': 9, 'min_samples_split': 24, 'min_samples_leaf': 63, 'criterion': 'gini'}.
Trial 4221 finished with value: 0.7065217391304348 and parameters: {'n_estimators': 291, 'max_depth': 12, 'min_samples_split': 29, 'min_samples_leaf': 60, 'criterion': 'gini'}.
Trial 4222 finished with value: 0.717391304347826 and parameters: {'n_estimators': 217, 'max_depth': 10, 'min_samples_split': 158, 'min_samples_leaf': 58, 'criterion': 'gini'}.
Trial 4223 finished with value: 0.6956521739130435 and parameters: {'n_estimators': 677, 'max_depth': 8, 'min_samples_split': 145, 'min_samples_leaf': 95, 'criterion': 'gini'}.
Trial 4224 finished with value: 0.7065217391304348 and parameters: {'n_estimators': 277, 'max_depth': 13, 'min_samples_split': 42, 'min_samples_leaf': 70, 'criterion': 'gini'}.
Trial 4225 finished with value: 0.6304347826086957 and parameters: {'n_estimators': 336, 'max_depth': 5, 'min_samples_split': 34, 'min_samples_leaf': 62, 'criterion': 'gini'}.
Trial 4226 finished with value: 0.6739130434782609 and parameters: {'n_estimators': 307, 'max_depth': 17, 'min_samples_split': 101, 'min_samples_leaf': 56, 'criterion': 'gini'}.
Trial 4227 finished with value: 0.717391304347826 and parameters: {'n_estimators': 245, 'max_depth': 11, 'min_samples_split': 122, 'min_samples_leaf': 59, 'criterion': 'gini'}.
Trial 4228 finished with value: 0.6956521739130435 and parameters: {'n_estimators': 259, 'max_depth': 14, 'min_samples_split': 140, 'min_samples_leaf': 65, 'criterion': 'gini'}.
Trial 4229 finished with value: 0.6956521739130435 and parameters: {'n_estimators': 190, 'max_depth': 8, 'min_samples_split': 152, 'min_samples_leaf': 56, 'criterion': 'gini'}.
Trial 4230 finished with value: 0.717391304347826 and parameters: {'n_estimators': 297, 'max_depth': 10, 'min_samples_split': 38, 'min_samples_leaf': 61, 'criterion': 'gini'}.
Trial 4231 finished with value: 0.7065217391304348 and parameters: {'n_estimators': 327, 'max_depth': 7, 'min_samples_split': 28, 'min_samples_leaf': 79, 'criterion': 'gini'}.
Trial 4232 finished with value: 0.6956521739130435 and parameters: {'n_estimators': 281, 'max_depth': 12, 'min_samples_split': 32, 'min_samples_leaf': 59, 'criterion': 'gini'}.
