Trial 3120 finished with value: 0.6956521739130435 and parameters: {'n_estimators': 807, 'max_depth': 15, 'min_samples_split': 20, 'min_samples_leaf': 53, 'criterion': 'entropy'}.
Trial 3121 finished with value: 0.6086956521739131 and parameters: {'n_estimators': 861, 'max_depth': 7, 'min_samples_split': 35, 'min_samples_leaf': 14, 'criterion': 'entropy'}.
Trial 3122 finished with value: 0.6630434782608695 and parameters: {'n_estimators': 786, 'max_depth': 18, 'min_samples_split': 26, 'min_samples_leaf': 60, 'criterion': 'entropy'}.
Trial 3123 finished with value: 0.7065217391304348 and parameters: {'n_estimators': 753, 'max_depth': 12, 'min_samples_split': 30, 'min_samples_leaf': 66, 'criterion': 'entropy'}.
Trial 3124 finished with value: 0.717391304347826 and parameters: {'n_estimators': 720, 'max_depth': 10, 'min_samples_split': 23, 'min_samples_leaf': 56, 'criterion': 'entropy'}.
Trial 3125 finished with value: 0.6413043478260869 and parameters: {'n_estimators': 772, 'max_depth': 5, 'min_samples_split': 38, 'min_samples_leaf': 51, 'criterion': 'entropy'}.
Trial 3126 finished with value: 0.7065217391304348 and parameters: {'n_estimators': 836, 'max_depth': 13, 'min_samples_split': 32, 'min_samples_leaf': 62, 'criterion': 'entropy'}.
Trial 3127 finished with value: 0.7065217391304348 and parameters: {'n_estimators': 803, 'max_depth': 9, 'min_samples_split': 17, 'min_samples_leaf': 57, 'criterion': 'entropy'}.
Trial 3128 finished with value: 0.7065217391304348 and parameters: {'n_estimators': 206, 'max_depth': 11, 'min_samples_split': 28, 'min_samples_leaf': 54, 'criterion': 'entropy'}.
Trial 3129 finished with value: 0.717391304347826 and parameters: {'n_estimators': 824, 'max_depth': 14, 'min_samples_split': 42, 'min_samples_leaf': 49, 'criterion': 'entropy'}.
Trial 3130 finished with value: 0.7065217391304348 and parameters: {'n_estimators': 885, 'max_depth': 7, 'min_samples_split': 35, 'min_samples_leaf': 59, 'criterion': 'entropy'}.
Trial 3131 finished with value: 0.6739130434782609 and parameters: {'n_estimators': 732, 'max_depth': 16, 'min_samples_split': 48, 'min_samples_leaf': 52, 'criterion': 'entropy'}.
Trial 3132 finished with value: 0.6847826086956522 and parameters: {'n_estimators': 332, 'max_depth': 98, 'min_samples_split': 23, 'min_samples_leaf': 58, 'criterion': 'entropy'}.
Trial 3133 finished with value: 0.6739130434782609 and parameters: {'n_estimators': 782, 'max_depth': 10, 'min_samples_split': 121, 'min_samples_leaf': 23, 'criterion': 'entropy'}.
Trial 3134 finished with value: 0.7065217391304348 and parameters: {'n_estimators': 854, 'max_depth': 12, 'min_samples_split': 29, 'min_samples_leaf': 55, 'criterion': 'entropy'}.
Trial 3135 finished with value: 0.7282608695652174 and parameters: {'n_estimators': 396, 'max_depth': 8, 'min_samples_split': 39, 'min_samples_leaf': 60, 'criterion': 'entropy'}.
Trial 3136 finished with value: 0.7065217391304348 and parameters: {'n_estimators': 751, 'max_depth': 13, 'min_samples_split': 33, 'min_samples_leaf': 54, 'criterion': 'entropy'}.
Trial 3137 finished with value: 0.7065217391304348 and parameters: {'n_estimators': 796, 'max_depth': 10, 'min_samples_split': 168, 'min_samples_leaf': 50, 'criterion': 'gini'}.
Trial 3138 finished with value: 0.6956521739130435 and parameters: {'n_estimators': 820, 'max_depth': 7, 'min_samples_split': 12, 'min_samples_leaf': 57, 'criterion': 'entropy'}.
Trial 3139 finished with value: 0.6847826086956522 and parameters: {'n_estimators': 691, 'max_depth': 15, 'min_samples_split': 25, 'min_samples_leaf': 63, 'criterion': 'entropy'}.
Trial 3140 finished with value: 0.7065217391304348 and parameters: {'n_estimators': 910, 'max_depth': 11, 'min_samples_split': 19, 'min_samples_leaf': 44, 'criterion': 'entropy'}.
Trial 3141 finished with value: 0.6630434782608695 and parameters: {'n_estimators': 765, 'max_depth': 20, 'min_samples_split': 36, 'min_samples_leaf': 52, 'criterion': 'entropy'}.
Trial 3142 finished with value: 0.6739130434782609 and parameters: {'n_estimators': 299, 'max_depth': 13, 'min_samples_split': 29, 'min_samples_leaf': 56, 'criterion': 'entropy'}.
Trial 3143 finished with value: 0.7065217391304348 and parameters: {'n_estimators': 246, 'max_depth': 9, 'min_samples_split': 26, 'min_samples_leaf': 61, 'criterion': 'entropy'}.
Trial 3144 finished with value: 0.6847826086956522 and parameters: {'n_estimators': 813, 'max_depth': 18, 'min_samples_split': 32, 'min_samples_leaf': 48, 'criterion': 'entropy'}.
Trial 3145 finished with value: 0.6739130434782609 and parameters: {'n_estimators': 738, 'max_depth': 28, 'min_samples_split': 20, 'min_samples_leaf': 58, 'criterion': 'entropy'}.
Trial 3146 finished with value: 0.6630434782608695 and parameters: {'n_estimators': 792, 'max_depth': 92, 'min_samples_split': 42, 'min_samples_leaf': 54, 'criterion': 'entropy'}.
Trial 3147 finished with value: 0.6739130434782609 and parameters: {'n_estimators': 840, 'max_depth': 6, 'min_samples_split': 35, 'min_samples_leaf': 50, 'criterion': 'entropy'}.
Trial 3148 finished with value: 0.6956521739130435 and parameters: {'n_estimators': 767, 'max_depth': 11, 'min_samples_split': 24, 'min_samples_leaf': 52, 'criterion': 'entropy'}.
Trial 3149 finished with value: 0.6956521739130435 and parameters: {'n_estimators': 716, 'max_depth': 14, 'min_samples_split': 15, 'min_samples_leaf': 59, 'criterion': 'entropy'}.
Trial 3150 finished with value: 0.7282608695652174 and parameters: {'n_estimators': 372, 'max_depth': 8, 'min_samples_split': 38, 'min_samples_leaf': 57, 'criterion': 'entropy'}.
Trial 3151 finished with value: 0.6630434782608695 and parameters: {'n_estimators': 777, 'max_depth': 77, 'min_samples_split': 30, 'min_samples_leaf': 54, 'criterion': 'entropy'}.
Trial 3152 finished with value: 0.6630434782608695 and parameters: {'n_estimators': 318, 'max_depth': 16, 'min_samples_split': 28, 'min_samples_leaf': 47, 'criterion': 'entropy'}.
Trial 3153 finished with value: 0.6956521739130435 and parameters: {'n_estimators': 871, 'max_depth': 12, 'min_samples_split': 32, 'min_samples_leaf': 56, 'criterion': 'entropy'}.
Trial 3154 finished with value: 0.6847826086956522 and parameters: {'n_estimators': 744, 'max_depth': 42, 'min_samples_split': 22, 'min_samples_leaf': 49, 'criterion': 'entropy'}.
Trial 3155 finished with value: 0.7391304347826086 and parameters: {'n_estimators': 265, 'max_depth': 9, 'min_samples_split': 38, 'min_samples_leaf': 61, 'criterion': 'gini'}.
Trial 3156 finished with value: 0.6521739130434783 and parameters: {'n_estimators': 264, 'max_depth': 5, 'min_samples_split': 44, 'min_samples_leaf': 65, 'criterion': 'gini'}.
Trial 3157 finished with value: 0.6847826086956522 and parameters: {'n_estimators': 320, 'max_depth': 6, 'min_samples_split': 40, 'min_samples_leaf': 64, 'criterion': 'gini'}.
Trial 3158 finished with value: 0.7065217391304348 and parameters: {'n_estimators': 298, 'max_depth': 8, 'min_samples_split': 39, 'min_samples_leaf': 66, 'criterion': 'gini'}.
Trial 3159 finished with value: 0.6413043478260869 and parameters: {'n_estimators': 288, 'max_depth': 5, 'min_samples_split': 48, 'min_samples_leaf': 63, 'criterion': 'gini'}.
Trial 3160 finished with value: 0.6847826086956522 and parameters: {'n_estimators': 311, 'max_depth': 7, 'min_samples_split': 44, 'min_samples_leaf': 60, 'criterion': 'entropy'}.
Trial 3161 finished with value: 0.7065217391304348 and parameters: {'n_estimators': 266, 'max_depth': 8, 'min_samples_split': 44, 'min_samples_leaf': 64, 'criterion': 'gini'}.
Trial 3162 finished with value: 0.7065217391304348 and parameters: {'n_estimators': 292, 'max_depth': 9, 'min_samples_split': 45, 'min_samples_leaf': 64, 'criterion': 'gini'}.
Trial 3163 finished with value: 0.7282608695652174 and parameters: {'n_estimators': 266, 'max_depth': 9, 'min_samples_split': 40, 'min_samples_leaf': 63, 'criterion': 'gini'}.
Trial 3164 finished with value: 0.6847826086956522 and parameters: {'n_estimators': 261, 'max_depth': 10, 'min_samples_split': 42, 'min_samples_leaf': 66, 'criterion': 'gini'}.
Trial 3165 finished with value: 0.6956521739130435 and parameters: {'n_estimators': 281, 'max_depth': 7, 'min_samples_split': 48, 'min_samples_leaf': 62, 'criterion': 'gini'}.
Trial 3166 finished with value: 0.6413043478260869 and parameters: {'n_estimators': 241, 'max_depth': 5, 'min_samples_split': 43, 'min_samples_leaf': 65, 'criterion': 'gini'}.
Trial 3167 finished with value: 0.7065217391304348 and parameters: {'n_estimators': 281, 'max_depth': 10, 'min_samples_split': 45, 'min_samples_leaf': 62, 'criterion': 'gini'}.
Trial 3168 finished with value: 0.6956521739130435 and parameters: {'n_estimators': 280, 'max_depth': 7, 'min_samples_split': 51, 'min_samples_leaf': 62, 'criterion': 'gini'}.
Trial 3169 finished with value: 0.6956521739130435 and parameters: {'n_estimators': 259, 'max_depth': 12, 'min_samples_split': 56, 'min_samples_leaf': 62, 'criterion': 'gini'}.
Trial 3170 finished with value: 0.7391304347826086 and parameters: {'n_estimators': 273, 'max_depth': 9, 'min_samples_split': 40, 'min_samples_leaf': 61, 'criterion': 'gini'}.
Trial 3171 finished with value: 0.6739130434782609 and parameters: {'n_estimators': 237, 'max_depth': 6, 'min_samples_split': 54, 'min_samples_leaf': 63, 'criterion': 'gini'}.
Trial 3172 finished with value: 0.6521739130434783 and parameters: {'n_estimators': 310, 'max_depth': 5, 'min_samples_split': 49, 'min_samples_leaf': 64, 'criterion': 'gini'}.
Trial 3173 finished with value: 0.6739130434782609 and parameters: {'n_estimators': 247, 'max_depth': 7, 'min_samples_split': 51, 'min_samples_leaf': 64, 'criterion': 'gini'}.
Trial 3174 finished with value: 0.6956521739130435 and parameters: {'n_estimators': 267, 'max_depth': 8, 'min_samples_split': 48, 'min_samples_leaf': 66, 'criterion': 'gini'}.
Trial 3175 finished with value: 0.7065217391304348 and parameters: {'n_estimators': 259, 'max_depth': 9, 'min_samples_split': 48, 'min_samples_leaf': 66, 'criterion': 'gini'}.
Trial 3176 finished with value: 0.6630434782608695 and parameters: {'n_estimators': 250, 'max_depth': 5, 'min_samples_split': 48, 'min_samples_leaf': 65, 'criterion': 'gini'}.
Trial 3177 finished with value: 0.7065217391304348 and parameters: {'n_estimators': 273, 'max_depth': 8, 'min_samples_split': 44, 'min_samples_leaf': 63, 'criterion': 'gini'}.
Trial 3178 finished with value: 0.6956521739130435 and parameters: {'n_estimators': 281, 'max_depth': 10, 'min_samples_split': 52, 'min_samples_leaf': 66, 'criterion': 'gini'}.
Trial 3179 finished with value: 0.6956521739130435 and parameters: {'n_estimators': 244, 'max_depth': 7, 'min_samples_split': 46, 'min_samples_leaf': 62, 'criterion': 'gini'}.
Trial 3180 finished with value: 0.7065217391304348 and parameters: {'n_estimators': 270, 'max_depth': 9, 'min_samples_split': 46, 'min_samples_leaf': 68, 'criterion': 'entropy'}.
Trial 3181 finished with value: 0.6847826086956522 and parameters: {'n_estimators': 247, 'max_depth': 11, 'min_samples_split': 44, 'min_samples_leaf': 64, 'criterion': 'gini'}.
Trial 3182 finished with value: 0.6956521739130435 and parameters: {'n_estimators': 288, 'max_depth': 7, 'min_samples_split': 43, 'min_samples_leaf': 62, 'criterion': 'gini'}.
Trial 3183 finished with value: 0.717391304347826 and parameters: {'n_estimators': 280, 'max_depth': 9, 'min_samples_split': 41, 'min_samples_leaf': 63, 'criterion': 'gini'}.
Trial 3184 finished with value: 0.7065217391304348 and parameters: {'n_estimators': 264, 'max_depth': 11, 'min_samples_split': 42, 'min_samples_leaf': 65, 'criterion': 'gini'}.
Trial 3185 finished with value: 0.7282608695652174 and parameters: {'n_estimators': 278, 'max_depth': 9, 'min_samples_split': 40, 'min_samples_leaf': 62, 'criterion': 'gini'}.
Trial 3186 finished with value: 0.6847826086956522 and parameters: {'n_estimators': 238, 'max_depth': 13, 'min_samples_split': 41, 'min_samples_leaf': 61, 'criterion': 'gini'}.
Trial 3187 finished with value: 0.6195652173913043 and parameters: {'n_estimators': 228, 'max_depth': 5, 'min_samples_split': 45, 'min_samples_leaf': 61, 'criterion': 'gini'}.
Trial 3188 finished with value: 0.7065217391304348 and parameters: {'n_estimators': 287, 'max_depth': 11, 'min_samples_split': 41, 'min_samples_leaf': 64, 'criterion': 'gini'}.
Trial 3189 finished with value: 0.6847826086956522 and parameters: {'n_estimators': 254, 'max_depth': 7, 'min_samples_split': 49, 'min_samples_leaf': 61, 'criterion': 'gini'}.
Trial 3190 finished with value: 0.6847826086956522 and parameters: {'n_estimators': 285, 'max_depth': 14, 'min_samples_split': 38, 'min_samples_leaf': 68, 'criterion': 'gini'}.
Trial 3191 finished with value: 0.717391304347826 and parameters: {'n_estimators': 285, 'max_depth': 10, 'min_samples_split': 40, 'min_samples_leaf': 60, 'criterion': 'gini'}.
Trial 3192 finished with value: 0.6956521739130435 and parameters: {'n_estimators': 300, 'max_depth': 12, 'min_samples_split': 45, 'min_samples_leaf': 68, 'criterion': 'gini'}.
Trial 3193 finished with value: 0.7065217391304348 and parameters: {'n_estimators': 270, 'max_depth': 8, 'min_samples_split': 39, 'min_samples_leaf': 61, 'criterion': 'gini'}.
Trial 3194 finished with value: 0.6956521739130435 and parameters: {'n_estimators': 265, 'max_depth': 16, 'min_samples_split': 42, 'min_samples_leaf': 63, 'criterion': 'gini'}.
Trial 3195 finished with value: 0.7065217391304348 and parameters: {'n_estimators': 261, 'max_depth': 10, 'min_samples_split': 37, 'min_samples_leaf': 70, 'criterion': 'gini'}.
Trial 3196 finished with value: 0.6956521739130435 and parameters: {'n_estimators': 225, 'max_depth': 13, 'min_samples_split': 37, 'min_samples_leaf': 61, 'criterion': 'gini'}.
Trial 3197 finished with value: 0.6847826086956522 and parameters: {'n_estimators': 288, 'max_depth': 7, 'min_samples_split': 40, 'min_samples_leaf': 61, 'criterion': 'gini'}.
Trial 3198 finished with value: 0.6521739130434783 and parameters: {'n_estimators': 219, 'max_depth': 35, 'min_samples_split': 50, 'min_samples_leaf': 65, 'criterion': 'gini'}.
Trial 3199 finished with value: 0.717391304347826 and parameters: {'n_estimators': 298, 'max_depth': 11, 'min_samples_split': 54, 'min_samples_leaf': 60, 'criterion': 'gini'}.
Trial 3200 finished with value: 0.717391304347826 and parameters: {'n_estimators': 249, 'max_depth': 9, 'min_samples_split': 38, 'min_samples_leaf': 63, 'criterion': 'gini'}.
Trial 3201 finished with value: 0.6956521739130435 and parameters: {'n_estimators': 284, 'max_depth': 14, 'min_samples_split': 75, 'min_samples_leaf': 67, 'criterion': 'gini'}.
Trial 3202 finished with value: 0.6847826086956522 and parameters: {'n_estimators': 305, 'max_depth': 17, 'min_samples_split': 38, 'min_samples_leaf': 60, 'criterion': 'gini'}.
Trial 3203 finished with value: 0.6956521739130435 and parameters: {'n_estimators': 301, 'max_depth': 12, 'min_samples_split': 131, 'min_samples_leaf': 61, 'criterion': 'gini'}.
Trial 3204 finished with value: 0.6847826086956522 and parameters: {'n_estimators': 264, 'max_depth': 6, 'min_samples_split': 46, 'min_samples_leaf': 60, 'criterion': 'gini'}.
Trial 3205 finished with value: 0.6956521739130435 and parameters: {'n_estimators': 294, 'max_depth': 9, 'min_samples_split': 150, 'min_samples_leaf': 64, 'criterion': 'gini'}.
Trial 3206 finished with value: 0.6847826086956522 and parameters: {'n_estimators': 309, 'max_depth': 15, 'min_samples_split': 44, 'min_samples_leaf': 62, 'criterion': 'gini'}.
Trial 3207 finished with value: 0.717391304347826 and parameters: {'n_estimators': 233, 'max_depth': 11, 'min_samples_split': 37, 'min_samples_leaf': 60, 'criterion': 'gini'}.
Trial 3208 finished with value: 0.7065217391304348 and parameters: {'n_estimators': 252, 'max_depth': 8, 'min_samples_split': 36, 'min_samples_leaf': 60, 'criterion': 'gini'}.
Trial 3209 finished with value: 0.6956521739130435 and parameters: {'n_estimators': 310, 'max_depth': 13, 'min_samples_split': 41, 'min_samples_leaf': 62, 'criterion': 'gini'}.
Trial 3210 finished with value: 0.717391304347826 and parameters: {'n_estimators': 293, 'max_depth': 10, 'min_samples_split': 163, 'min_samples_leaf': 59, 'criterion': 'gini'}.
Trial 3211 finished with value: 0.7065217391304348 and parameters: {'n_estimators': 277, 'max_depth': 7, 'min_samples_split': 46, 'min_samples_leaf': 59, 'criterion': 'gini'}.
Trial 3212 finished with value: 0.6847826086956522 and parameters: {'n_estimators': 268, 'max_depth': 12, 'min_samples_split': 36, 'min_samples_leaf': 63, 'criterion': 'gini'}.
Trial 3213 finished with value: 0.6413043478260869 and parameters: {'n_estimators': 296, 'max_depth': 5, 'min_samples_split': 41, 'min_samples_leaf': 59, 'criterion': 'gini'}.
Trial 3214 finished with value: 0.7391304347826086 and parameters: {'n_estimators': 271, 'max_depth': 9, 'min_samples_split': 35, 'min_samples_leaf': 61, 'criterion': 'gini'}.
Trial 3215 finished with value: 0.6630434782608695 and parameters: {'n_estimators': 245, 'max_depth': 5, 'min_samples_split': 35, 'min_samples_leaf': 66, 'criterion': 'gini'}.
Trial 3216 finished with value: 0.6847826086956522 and parameters: {'n_estimators': 272, 'max_depth': 6, 'min_samples_split': 36, 'min_samples_leaf': 64, 'criterion': 'gini'}.
Trial 3217 finished with value: 0.6739130434782609 and parameters: {'n_estimators': 249, 'max_depth': 7, 'min_samples_split': 34, 'min_samples_leaf': 65, 'criterion': 'gini'}.
Trial 3218 finished with value: 0.6630434782608695 and parameters: {'n_estimators': 265, 'max_depth': 5, 'min_samples_split': 8, 'min_samples_leaf': 66, 'criterion': 'gini'}.
Trial 3219 finished with value: 0.6847826086956522 and parameters: {'n_estimators': 253, 'max_depth': 7, 'min_samples_split': 35, 'min_samples_leaf': 61, 'criterion': 'gini'}.
Trial 3220 finished with value: 0.6956521739130435 and parameters: {'n_estimators': 239, 'max_depth': 8, 'min_samples_split': 125, 'min_samples_leaf': 65, 'criterion': 'gini'}.
Trial 3221 finished with value: 0.6956521739130435 and parameters: {'n_estimators': 271, 'max_depth': 7, 'min_samples_split': 40, 'min_samples_leaf': 60, 'criterion': 'gini'}.
Trial 3222 finished with value: 0.717391304347826 and parameters: {'n_estimators': 269, 'max_depth': 8, 'min_samples_split': 93, 'min_samples_leaf': 67, 'criterion': 'gini'}.
Trial 3223 finished with value: 0.7065217391304348 and parameters: {'n_estimators': 283, 'max_depth': 8, 'min_samples_split': 34, 'min_samples_leaf': 63, 'criterion': 'gini'}.
Trial 3224 finished with value: 0.6739130434782609 and parameters: {'n_estimators': 249, 'max_depth': 6, 'min_samples_split': 15, 'min_samples_leaf': 63, 'criterion': 'gini'}.
Trial 3225 finished with value: 0.6956521739130435 and parameters: {'n_estimators': 225, 'max_depth': 9, 'min_samples_split': 135, 'min_samples_leaf': 64, 'criterion': 'gini'}.
Trial 3226 finished with value: 0.6413043478260869 and parameters: {'n_estimators': 257, 'max_depth': 5, 'min_samples_split': 60, 'min_samples_leaf': 62, 'criterion': 'gini'}.
Trial 3227 finished with value: 0.7065217391304348 and parameters: {'n_estimators': 278, 'max_depth': 9, 'min_samples_split': 38, 'min_samples_leaf': 64, 'criterion': 'gini'}.
Trial 3228 finished with value: 0.6847826086956522 and parameters: {'n_estimators': 228, 'max_depth': 39, 'min_samples_split': 33, 'min_samples_leaf': 61, 'criterion': 'gini'}.
Trial 3229 finished with value: 0.6956521739130435 and parameters: {'n_estimators': 277, 'max_depth': 7, 'min_samples_split': 38, 'min_samples_leaf': 62, 'criterion': 'gini'}.
Trial 3230 finished with value: 0.717391304347826 and parameters: {'n_estimators': 302, 'max_depth': 9, 'min_samples_split': 42, 'min_samples_leaf': 61, 'criterion': 'gini'}.
Trial 3231 finished with value: 0.7391304347826086 and parameters: {'n_estimators': 273, 'max_depth': 9, 'min_samples_split': 33, 'min_samples_leaf': 61, 'criterion': 'gini'}.
Trial 3232 finished with value: 0.6630434782608695 and parameters: {'n_estimators': 290, 'max_depth': 5, 'min_samples_split': 11, 'min_samples_leaf': 69, 'criterion': 'gini'}.
Trial 3233 finished with value: 0.6630434782608695 and parameters: {'n_estimators': 244, 'max_depth': 5, 'min_samples_split': 32, 'min_samples_leaf': 67, 'criterion': 'gini'}.
Trial 3234 finished with value: 0.6956521739130435 and parameters: {'n_estimators': 266, 'max_depth': 7, 'min_samples_split': 18, 'min_samples_leaf': 63, 'criterion': 'gini'}.
Trial 3235 finished with value: 0.6739130434782609 and parameters: {'n_estimators': 250, 'max_depth': 7, 'min_samples_split': 31, 'min_samples_leaf': 68, 'criterion': 'gini'}.
Trial 3236 finished with value: 0.717391304347826 and parameters: {'n_estimators': 275, 'max_depth': 8, 'min_samples_split': 141, 'min_samples_leaf': 66, 'criterion': 'gini'}.
Trial 3237 finished with value: 0.717391304347826 and parameters: {'n_estimators': 256, 'max_depth': 9, 'min_samples_split': 29, 'min_samples_leaf': 65, 'criterion': 'gini'}.
Trial 3238 finished with value: 0.6847826086956522 and parameters: {'n_estimators': 258, 'max_depth': 7, 'min_samples_split': 174, 'min_samples_leaf': 64, 'criterion': 'gini'}.
Trial 3239 finished with value: 0.7065217391304348 and parameters: {'n_estimators': 279, 'max_depth': 9, 'min_samples_split': 21, 'min_samples_leaf': 64, 'criterion': 'gini'}.
Trial 3240 finished with value: 0.6630434782608695 and parameters: {'n_estimators': 235, 'max_depth': 5, 'min_samples_split': 33, 'min_samples_leaf': 65, 'criterion': 'gini'}.
Trial 3241 finished with value: 0.7391304347826086 and parameters: {'n_estimators': 264, 'max_depth': 9, 'min_samples_split': 120, 'min_samples_leaf': 63, 'criterion': 'gini'}.
Trial 3242 finished with value: 0.6956521739130435 and parameters: {'n_estimators': 265, 'max_depth': 10, 'min_samples_split': 117, 'min_samples_leaf': 64, 'criterion': 'gini'}.
Trial 3243 finished with value: 0.6739130434782609 and parameters: {'n_estimators': 250, 'max_depth': 10, 'min_samples_split': 116, 'min_samples_leaf': 66, 'criterion': 'gini'}.
