Trial 431 finished with value: 0.6847826086956522 and parameters: {'n_estimators': 786, 'max_depth': 9, 'min_samples_split': 16, 'min_samples_leaf': 51, 'criterion': 'entropy'}.
Trial 432 finished with value: 0.6630434782608695 and parameters: {'n_estimators': 557, 'max_depth': 15, 'min_samples_split': 37, 'min_samples_leaf': 55, 'criterion': 'entropy'}.
Trial 433 finished with value: 0.6739130434782609 and parameters: {'n_estimators': 766, 'max_depth': 6, 'min_samples_split': 105, 'min_samples_leaf': 53, 'criterion': 'entropy'}.
Trial 434 finished with value: 0.717391304347826 and parameters: {'n_estimators': 427, 'max_depth': 10, 'min_samples_split': 43, 'min_samples_leaf': 49, 'criterion': 'entropy'}.
Trial 435 finished with value: 0.6739130434782609 and parameters: {'n_estimators': 275, 'max_depth': 7, 'min_samples_split': 27, 'min_samples_leaf': 43, 'criterion': 'entropy'}.
Trial 436 finished with value: 0.7065217391304348 and parameters: {'n_estimators': 866, 'max_depth': 12, 'min_samples_split': 34, 'min_samples_leaf': 59, 'criterion': 'entropy'}.
Trial 437 finished with value: 0.6630434782608695 and parameters: {'n_estimators': 821, 'max_depth': 30, 'min_samples_split': 21, 'min_samples_leaf': 55, 'criterion': 'entropy'}.
Trial 438 finished with value: 0.6956521739130435 and parameters: {'n_estimators': 798, 'max_depth': 9, 'min_samples_split': 30, 'min_samples_leaf': 62, 'criterion': 'entropy'}.
Trial 439 finished with value: 0.6847826086956522 and parameters: {'n_estimators': 825, 'max_depth': 13, 'min_samples_split': 11, 'min_samples_leaf': 75, 'criterion': 'gini'}.
Trial 440 finished with value: 0.6413043478260869 and parameters: {'n_estimators': 156, 'max_depth': 5, 'min_samples_split': 25, 'min_samples_leaf': 45, 'criterion': 'entropy'}.
Trial 441 finished with value: 0.6847826086956522 and parameters: {'n_estimators': 846, 'max_depth': 62, 'min_samples_split': 40, 'min_samples_leaf': 51, 'criterion': 'entropy'}.
Trial 442 finished with value: 0.717391304347826 and parameters: {'n_estimators': 808, 'max_depth': 11, 'min_samples_split': 34, 'min_samples_leaf': 57, 'criterion': 'entropy'}.
Trial 443 finished with value: 0.6956521739130435 and parameters: {'n_estimators': 778, 'max_depth': 8, 'min_samples_split': 16, 'min_samples_leaf': 47, 'criterion': 'entropy'}.
Trial 444 finished with value: 0.6739130434782609 and parameters: {'n_estimators': 872, 'max_depth': 16, 'min_samples_split': 29, 'min_samples_leaf': 53, 'criterion': 'entropy'}.
Trial 445 finished with value: 0.6847826086956522 and parameters: {'n_estimators': 834, 'max_depth': 55, 'min_samples_split': 20, 'min_samples_leaf': 49, 'criterion': 'entropy'}.
Trial 446 finished with value: 0.6739130434782609 and parameters: {'n_estimators': 753, 'max_depth': 89, 'min_samples_split': 93, 'min_samples_leaf': 50, 'criterion': 'entropy'}.
Trial 447 finished with value: 0.717391304347826 and parameters: {'n_estimators': 538, 'max_depth': 10, 'min_samples_split': 24, 'min_samples_leaf': 55, 'criterion': 'entropy'}.
Trial 448 finished with value: 0.7065217391304348 and parameters: {'n_estimators': 796, 'max_depth': 14, 'min_samples_split': 37, 'min_samples_leaf': 52, 'criterion': 'entropy'}.
Trial 449 finished with value: 0.6956521739130435 and parameters: {'n_estimators': 680, 'max_depth': 7, 'min_samples_split': 33, 'min_samples_leaf': 58, 'criterion': 'entropy'}.
Trial 450 finished with value: 0.7065217391304348 and parameters: {'n_estimators': 858, 'max_depth': 11, 'min_samples_split': 28, 'min_samples_leaf': 47, 'criterion': 'entropy'}.
Trial 451 finished with value: 0.6847826086956522 and parameters: {'n_estimators': 822, 'max_depth': 9, 'min_samples_split': 44, 'min_samples_leaf': 52, 'criterion': 'entropy'}.
Trial 452 finished with value: 0.717391304347826 and parameters: {'n_estimators': 727, 'max_depth': 13, 'min_samples_split': 31, 'min_samples_leaf': 49, 'criterion': 'entropy'}.
Trial 453 finished with value: 0.6956521739130435 and parameters: {'n_estimators': 810, 'max_depth': 7, 'min_samples_split': 62, 'min_samples_leaf': 56, 'criterion': 'entropy'}.
Trial 454 finished with value: 0.6956521739130435 and parameters: {'n_estimators': 515, 'max_depth': 11, 'min_samples_split': 39, 'min_samples_leaf': 44, 'criterion': 'entropy'}.
Trial 455 finished with value: 0.6847826086956522 and parameters: {'n_estimators': 769, 'max_depth': 9, 'min_samples_split': 22, 'min_samples_leaf': 53, 'criterion': 'entropy'}.
Trial 456 finished with value: 0.6847826086956522 and parameters: {'n_estimators': 578, 'max_depth': 5, 'min_samples_split': 26, 'min_samples_leaf': 82, 'criterion': 'entropy'}.
Trial 457 finished with value: 0.6956521739130435 and parameters: {'n_estimators': 786, 'max_depth': 12, 'min_samples_split': 19, 'min_samples_leaf': 60, 'criterion': 'entropy'}.
Trial 458 finished with value: 0.6847826086956522 and parameters: {'n_estimators': 850, 'max_depth': 9, 'min_samples_split': 72, 'min_samples_leaf': 50, 'criterion': 'entropy'}.
Trial 459 finished with value: 0.6739130434782609 and parameters: {'n_estimators': 838, 'max_depth': 7, 'min_samples_split': 34, 'min_samples_leaf': 46, 'criterion': 'gini'}.
Trial 460 finished with value: 0.6847826086956522 and parameters: {'n_estimators': 816, 'max_depth': 14, 'min_samples_split': 30, 'min_samples_leaf': 54, 'criterion': 'entropy'}.
Trial 461 finished with value: 0.717391304347826 and parameters: {'n_estimators': 790, 'max_depth': 10, 'min_samples_split': 109, 'min_samples_leaf': 51, 'criterion': 'entropy'}.
Trial 462 finished with value: 0.6739130434782609 and parameters: {'n_estimators': 831, 'max_depth': 18, 'min_samples_split': 14, 'min_samples_leaf': 56, 'criterion': 'entropy'}.
Trial 463 finished with value: 0.7065217391304348 and parameters: {'n_estimators': 797, 'max_depth': 12, 'min_samples_split': 36, 'min_samples_leaf': 49, 'criterion': 'entropy'}.
Trial 464 finished with value: 0.717391304347826 and parameters: {'n_estimators': 858, 'max_depth': 8, 'min_samples_split': 25, 'min_samples_leaf': 58, 'criterion': 'entropy'}.
Trial 465 finished with value: 0.6956521739130435 and parameters: {'n_estimators': 746, 'max_depth': 16, 'min_samples_split': 46, 'min_samples_leaf': 47, 'criterion': 'entropy'}.
Trial 466 finished with value: 0.717391304347826 and parameters: {'n_estimators': 812, 'max_depth': 10, 'min_samples_split': 39, 'min_samples_leaf': 52, 'criterion': 'entropy'}.
Trial 467 finished with value: 0.6739130434782609 and parameters: {'n_estimators': 878, 'max_depth': 6, 'min_samples_split': 32, 'min_samples_leaf': 54, 'criterion': 'entropy'}.
Trial 468 finished with value: 0.717391304347826 and parameters: {'n_estimators': 771, 'max_depth': 13, 'min_samples_split': 100, 'min_samples_leaf': 48, 'criterion': 'entropy'}.
Trial 469 finished with value: 0.6847826086956522 and parameters: {'n_estimators': 557, 'max_depth': 8, 'min_samples_split': 27, 'min_samples_leaf': 51, 'criterion': 'entropy'}.
Trial 470 finished with value: 0.717391304347826 and parameters: {'n_estimators': 837, 'max_depth': 11, 'min_samples_split': 18, 'min_samples_leaf': 63, 'criterion': 'entropy'}.
Trial 471 finished with value: 0.6956521739130435 and parameters: {'n_estimators': 709, 'max_depth': 15, 'min_samples_split': 22, 'min_samples_leaf': 56, 'criterion': 'entropy'}.
Trial 472 finished with value: 0.6956521739130435 and parameters: {'n_estimators': 806, 'max_depth': 9, 'min_samples_split': 36, 'min_samples_leaf': 45, 'criterion': 'entropy'}.
Trial 473 finished with value: 0.6847826086956522 and parameters: {'n_estimators': 824, 'max_depth': 12, 'min_samples_split': 41, 'min_samples_leaf': 41, 'criterion': 'entropy'}.
Trial 474 finished with value: 0.6630434782608695 and parameters: {'n_estimators': 898, 'max_depth': 7, 'min_samples_split': 30, 'min_samples_leaf': 53, 'criterion': 'entropy'}.
Trial 475 finished with value: 0.6413043478260869 and parameters: {'n_estimators': 787, 'max_depth': 5, 'min_samples_split': 24, 'min_samples_leaf': 50, 'criterion': 'entropy'}.
Trial 476 finished with value: 0.7065217391304348 and parameters: {'n_estimators': 851, 'max_depth': 10, 'min_samples_split': 34, 'min_samples_leaf': 61, 'criterion': 'entropy'}.
Trial 477 finished with value: 0.6956521739130435 and parameters: {'n_estimators': 764, 'max_depth': 14, 'min_samples_split': 114, 'min_samples_leaf': 48, 'criterion': 'entropy'}.
Trial 478 finished with value: 0.717391304347826 and parameters: {'n_estimators': 820, 'max_depth': 11, 'min_samples_split': 30, 'min_samples_leaf': 58, 'criterion': 'gini'}.
Trial 479 finished with value: 0.6630434782608695 and parameters: {'n_estimators': 798, 'max_depth': 68, 'min_samples_split': 27, 'min_samples_leaf': 54, 'criterion': 'entropy'}.
Trial 480 finished with value: 0.6739130434782609 and parameters: {'n_estimators': 537, 'max_depth': 8, 'min_samples_split': 2, 'min_samples_leaf': 51, 'criterion': 'entropy'}.
Trial 481 finished with value: 0.6956521739130435 and parameters: {'n_estimators': 839, 'max_depth': 13, 'min_samples_split': 12, 'min_samples_leaf': 56, 'criterion': 'entropy'}.
Trial 482 finished with value: 0.7065217391304348 and parameters: {'n_estimators': 866, 'max_depth': 9, 'min_samples_split': 17, 'min_samples_leaf': 48, 'criterion': 'entropy'}.
Trial 483 finished with value: 0.6847826086956522 and parameters: {'n_estimators': 614, 'max_depth': 11, 'min_samples_split': 43, 'min_samples_leaf': 52, 'criterion': 'entropy'}.
Trial 484 finished with value: 0.6630434782608695 and parameters: {'n_estimators': 491, 'max_depth': 7, 'min_samples_split': 38, 'min_samples_leaf': 54, 'criterion': 'entropy'}.
Trial 485 finished with value: 0.6956521739130435 and parameters: {'n_estimators': 780, 'max_depth': 10, 'min_samples_split': 22, 'min_samples_leaf': 46, 'criterion': 'entropy'}.
Trial 486 finished with value: 0.6739130434782609 and parameters: {'n_estimators': 734, 'max_depth': 49, 'min_samples_split': 104, 'min_samples_leaf': 59, 'criterion': 'entropy'}.
Trial 487 finished with value: 0.6739130434782609 and parameters: {'n_estimators': 811, 'max_depth': 6, 'min_samples_split': 33, 'min_samples_leaf': 50, 'criterion': 'entropy'}.
Trial 488 finished with value: 0.7065217391304348 and parameters: {'n_estimators': 827, 'max_depth': 13, 'min_samples_split': 27, 'min_samples_leaf': 44, 'criterion': 'entropy'}.
Trial 489 finished with value: 0.7282608695652174 and parameters: {'n_estimators': 635, 'max_depth': 9, 'min_samples_split': 37, 'min_samples_leaf': 49, 'criterion': 'entropy'}.
Trial 490 finished with value: 0.6847826086956522 and parameters: {'n_estimators': 749, 'max_depth': 15, 'min_samples_split': 49, 'min_samples_leaf': 55, 'criterion': 'entropy'}.
Trial 491 finished with value: 0.7065217391304348 and parameters: {'n_estimators': 578, 'max_depth': 12, 'min_samples_split': 20, 'min_samples_leaf': 51, 'criterion': 'entropy'}.
Trial 492 finished with value: 0.7282608695652174 and parameters: {'n_estimators': 805, 'max_depth': 8, 'min_samples_split': 32, 'min_samples_leaf': 57, 'criterion': 'entropy'}.
Trial 493 finished with value: 0.6630434782608695 and parameters: {'n_estimators': 848, 'max_depth': 28, 'min_samples_split': 25, 'min_samples_leaf': 52, 'criterion': 'entropy'}.
Trial 494 finished with value: 0.6521739130434783 and parameters: {'n_estimators': 781, 'max_depth': 5, 'min_samples_split': 29, 'min_samples_leaf': 65, 'criterion': 'entropy'}.
Trial 495 finished with value: 0.7065217391304348 and parameters: {'n_estimators': 823, 'max_depth': 10, 'min_samples_split': 41, 'min_samples_leaf': 47, 'criterion': 'entropy'}.
Trial 496 finished with value: 0.7065217391304348 and parameters: {'n_estimators': 869, 'max_depth': 11, 'min_samples_split': 15, 'min_samples_leaf': 53, 'criterion': 'entropy'}.
Trial 497 finished with value: 0.6956521739130435 and parameters: {'n_estimators': 518, 'max_depth': 17, 'min_samples_split': 34, 'min_samples_leaf': 49, 'criterion': 'gini'}.
Trial 498 finished with value: 0.7065217391304348 and parameters: {'n_estimators': 801, 'max_depth': 7, 'min_samples_split': 23, 'min_samples_leaf': 59, 'criterion': 'entropy'}.
Trial 499 finished with value: 0.6739130434782609 and parameters: {'n_estimators': 838, 'max_depth': 14, 'min_samples_split': 30, 'min_samples_leaf': 55, 'criterion': 'entropy'}.
Trial 500 finished with value: 0.6956521739130435 and parameters: {'n_estimators': 760, 'max_depth': 9, 'min_samples_split': 8, 'min_samples_leaf': 50, 'criterion': 'entropy'}.
Trial 501 finished with value: 0.6956521739130435 and parameters: {'n_estimators': 890, 'max_depth': 12, 'min_samples_split': 38, 'min_samples_leaf': 53, 'criterion': 'entropy'}.
Trial 502 finished with value: 0.6630434782608695 and parameters: {'n_estimators': 562, 'max_depth': 7, 'min_samples_split': 27, 'min_samples_leaf': 46, 'criterion': 'entropy'}.
Trial 503 finished with value: 0.7065217391304348 and parameters: {'n_estimators': 792, 'max_depth': 10, 'min_samples_split': 20, 'min_samples_leaf': 61, 'criterion': 'entropy'}.
Trial 504 finished with value: 0.6521739130434783 and parameters: {'n_estimators': 596, 'max_depth': 19, 'min_samples_split': 36, 'min_samples_leaf': 57, 'criterion': 'entropy'}.
Trial 505 finished with value: 0.6847826086956522 and parameters: {'n_estimators': 820, 'max_depth': 12, 'min_samples_split': 44, 'min_samples_leaf': 48, 'criterion': 'entropy'}.
Trial 506 finished with value: 0.6956521739130435 and parameters: {'n_estimators': 854, 'max_depth': 8, 'min_samples_split': 32, 'min_samples_leaf': 51, 'criterion': 'entropy'}.
Trial 507 finished with value: 0.6739130434782609 and parameters: {'n_estimators': 665, 'max_depth': 15, 'min_samples_split': 24, 'min_samples_leaf': 55, 'criterion': 'entropy'}.
Trial 508 finished with value: 0.6413043478260869 and parameters: {'n_estimators': 775, 'max_depth': 5, 'min_samples_split': 17, 'min_samples_leaf': 52, 'criterion': 'entropy'}.
Trial 509 finished with value: 0.6847826086956522 and parameters: {'n_estimators': 832, 'max_depth': 47, 'min_samples_split': 34, 'min_samples_leaf': 49, 'criterion': 'entropy'}.
Trial 510 finished with value: 0.6956521739130435 and parameters: {'n_estimators': 807, 'max_depth': 10, 'min_samples_split': 40, 'min_samples_leaf': 44, 'criterion': 'entropy'}.
Trial 511 finished with value: 0.7065217391304348 and parameters: {'n_estimators': 838, 'max_depth': 13, 'min_samples_split': 28, 'min_samples_leaf': 54, 'criterion': 'entropy'}.
Trial 512 finished with value: 0.6630434782608695 and parameters: {'n_estimators': 791, 'max_depth': 8, 'min_samples_split': 22, 'min_samples_leaf': 39, 'criterion': 'entropy'}.
Trial 513 finished with value: 0.717391304347826 and parameters: {'n_estimators': 541, 'max_depth': 11, 'min_samples_split': 108, 'min_samples_leaf': 57, 'criterion': 'entropy'}.
Trial 514 finished with value: 0.6847826086956522 and parameters: {'n_estimators': 876, 'max_depth': 78, 'min_samples_split': 31, 'min_samples_leaf': 47, 'criterion': 'entropy'}.
Trial 515 finished with value: 0.7282608695652174 and parameters: {'n_estimators': 815, 'max_depth': 9, 'min_samples_split': 37, 'min_samples_leaf': 50, 'criterion': 'gini'}.
Trial 516 finished with value: 0.6630434782608695 and parameters: {'n_estimators': 765, 'max_depth': 7, 'min_samples_split': 99, 'min_samples_leaf': 52, 'criterion': 'entropy'}.
Trial 517 finished with value: 0.7065217391304348 and parameters: {'n_estimators': 856, 'max_depth': 11, 'min_samples_split': 120, 'min_samples_leaf': 54, 'criterion': 'entropy'}.
Trial 518 finished with value: 0.717391304347826 and parameters: {'n_estimators': 731, 'max_depth': 13, 'min_samples_split': 26, 'min_samples_leaf': 46, 'criterion': 'entropy'}.
Trial 519 finished with value: 0.7065217391304348 and parameters: {'n_estimators': 801, 'max_depth': 9, 'min_samples_split': 11, 'min_samples_leaf': 59, 'criterion': 'entropy'}.
Trial 520 finished with value: 0.6847826086956522 and parameters: {'n_estimators': 832, 'max_depth': 6, 'min_samples_split': 18, 'min_samples_leaf': 70, 'criterion': 'entropy'}.
Trial 521 finished with value: 0.6847826086956522 and parameters: {'n_estimators': 776, 'max_depth': 16, 'min_samples_split': 34, 'min_samples_leaf': 42, 'criterion': 'entropy'}.
Trial 522 finished with value: 0.717391304347826 and parameters: {'n_estimators': 815, 'max_depth': 11, 'min_samples_split': 42, 'min_samples_leaf': 50, 'criterion': 'entropy'}.
Trial 523 finished with value: 0.717391304347826 and parameters: {'n_estimators': 847, 'max_depth': 14, 'min_samples_split': 28, 'min_samples_leaf': 48, 'criterion': 'entropy'}.
Trial 524 finished with value: 0.717391304347826 and parameters: {'n_estimators': 750, 'max_depth': 8, 'min_samples_split': 31, 'min_samples_leaf': 56, 'criterion': 'entropy'}.
Trial 525 finished with value: 0.7282608695652174 and parameters: {'n_estimators': 792, 'max_depth': 10, 'min_samples_split': 47, 'min_samples_leaf': 52, 'criterion': 'entropy'}.
Trial 526 finished with value: 0.6739130434782609 and parameters: {'n_estimators': 821, 'max_depth': 24, 'min_samples_split': 23, 'min_samples_leaf': 62, 'criterion': 'entropy'}.
Trial 527 finished with value: 0.6413043478260869 and parameters: {'n_estimators': 856, 'max_depth': 5, 'min_samples_split': 37, 'min_samples_leaf': 53, 'criterion': 'entropy'}.
Trial 528 finished with value: 0.7065217391304348 and parameters: {'n_estimators': 914, 'max_depth': 12, 'min_samples_split': 15, 'min_samples_leaf': 49, 'criterion': 'entropy'}.
Trial 529 finished with value: 0.6956521739130435 and parameters: {'n_estimators': 690, 'max_depth': 9, 'min_samples_split': 95, 'min_samples_leaf': 57, 'criterion': 'entropy'}.
Trial 530 finished with value: 0.6739130434782609 and parameters: {'n_estimators': 783, 'max_depth': 7, 'min_samples_split': 20, 'min_samples_leaf': 45, 'criterion': 'entropy'}.
Trial 531 finished with value: 0.6956521739130435 and parameters: {'n_estimators': 803, 'max_depth': 13, 'min_samples_split': 26, 'min_samples_leaf': 60, 'criterion': 'entropy'}.
Trial 532 finished with value: 0.6956521739130435 and parameters: {'n_estimators': 835, 'max_depth': 11, 'min_samples_split': 34, 'min_samples_leaf': 55, 'criterion': 'entropy'}.
Trial 533 finished with value: 0.6847826086956522 and parameters: {'n_estimators': 882, 'max_depth': 41, 'min_samples_split': 30, 'min_samples_leaf': 51, 'criterion': 'entropy'}.
Trial 534 finished with value: 0.6847826086956522 and parameters: {'n_estimators': 551, 'max_depth': 9, 'min_samples_split': 103, 'min_samples_leaf': 47, 'criterion': 'entropy'}.
Trial 535 finished with value: 0.6739130434782609 and parameters: {'n_estimators': 523, 'max_depth': 7, 'min_samples_split': 39, 'min_samples_leaf': 53, 'criterion': 'gini'}.
Trial 536 finished with value: 0.6847826086956522 and parameters: {'n_estimators': 767, 'max_depth': 14, 'min_samples_split': 55, 'min_samples_leaf': 50, 'criterion': 'entropy'}.
Trial 537 finished with value: 0.717391304347826 and parameters: {'n_estimators': 817, 'max_depth': 11, 'min_samples_split': 24, 'min_samples_leaf': 58, 'criterion': 'entropy'}.
Trial 538 finished with value: 0.6739130434782609 and parameters: {'n_estimators': 411, 'max_depth': 16, 'min_samples_split': 34, 'min_samples_leaf': 48, 'criterion': 'entropy'}.
Trial 539 finished with value: 0.717391304347826 and parameters: {'n_estimators': 719, 'max_depth': 9, 'min_samples_split': 28, 'min_samples_leaf': 55, 'criterion': 'entropy'}.
Trial 540 finished with value: 0.717391304347826 and parameters: {'n_estimators': 843, 'max_depth': 12, 'min_samples_split': 43, 'min_samples_leaf': 52, 'criterion': 'entropy'}.
Trial 541 finished with value: 0.6847826086956522 and parameters: {'n_estimators': 571, 'max_depth': 7, 'min_samples_split': 20, 'min_samples_leaf': 49, 'criterion': 'entropy'}.
Trial 542 finished with value: 0.6956521739130435 and parameters: {'n_estimators': 795, 'max_depth': 10, 'min_samples_split': 31, 'min_samples_leaf': 54, 'criterion': 'entropy'}.
Trial 543 finished with value: 0.6304347826086957 and parameters: {'n_estimators': 867, 'max_depth': 5, 'min_samples_split': 36, 'min_samples_leaf': 13, 'criterion': 'entropy'}.
Trial 544 finished with value: 0.717391304347826 and parameters: {'n_estimators': 825, 'max_depth': 13, 'min_samples_split': 15, 'min_samples_leaf': 51, 'criterion': 'entropy'}.
Trial 545 finished with value: 0.6956521739130435 and parameters: {'n_estimators': 977, 'max_depth': 33, 'min_samples_split': 40, 'min_samples_leaf': 45, 'criterion': 'entropy'}.
Trial 546 finished with value: 0.7282608695652174 and parameters: {'n_estimators': 808, 'max_depth': 8, 'min_samples_split': 25, 'min_samples_leaf': 57, 'criterion': 'entropy'}.
Trial 547 finished with value: 0.717391304347826 and parameters: {'n_estimators': 754, 'max_depth': 10, 'min_samples_split': 30, 'min_samples_leaf': 51, 'criterion': 'entropy'}.
Trial 548 finished with value: 0.6630434782608695 and parameters: {'n_estimators': 462, 'max_depth': 22, 'min_samples_split': 22, 'min_samples_leaf': 60, 'criterion': 'entropy'}.
Trial 549 finished with value: 0.6521739130434783 and parameters: {'n_estimators': 841, 'max_depth': 58, 'min_samples_split': 34, 'min_samples_leaf': 43, 'criterion': 'entropy'}.
Trial 550 finished with value: 0.6956521739130435 and parameters: {'n_estimators': 783, 'max_depth': 15, 'min_samples_split': 27, 'min_samples_leaf': 48, 'criterion': 'entropy'}.
Trial 551 finished with value: 0.6956521739130435 and parameters: {'n_estimators': 804, 'max_depth': 12, 'min_samples_split': 36, 'min_samples_leaf': 53, 'criterion': 'entropy'}.
Trial 552 finished with value: 0.6956521739130435 and parameters: {'n_estimators': 825, 'max_depth': 7, 'min_samples_split': 80, 'min_samples_leaf': 56, 'criterion': 'entropy'}.
Trial 553 finished with value: 0.7282608695652174 and parameters: {'n_estimators': 768, 'max_depth': 9, 'min_samples_split': 18, 'min_samples_leaf': 50, 'criterion': 'gini'}.
