Trial 2876 finished with value: 0.7065217391304348 and parameters: {'n_estimators': 734, 'max_depth': 12, 'min_samples_split': 35, 'min_samples_leaf': 55, 'criterion': 'entropy'}.
Trial 2877 finished with value: 0.717391304347826 and parameters: {'n_estimators': 305, 'max_depth': 10, 'min_samples_split': 29, 'min_samples_leaf': 60, 'criterion': 'entropy'}.
Trial 2878 finished with value: 0.6847826086956522 and parameters: {'n_estimators': 284, 'max_depth': 6, 'min_samples_split': 34, 'min_samples_leaf': 62, 'criterion': 'entropy'}.
Trial 2879 finished with value: 0.717391304347826 and parameters: {'n_estimators': 320, 'max_depth': 8, 'min_samples_split': 26, 'min_samples_leaf': 57, 'criterion': 'entropy'}.
Trial 2880 finished with value: 0.6847826086956522 and parameters: {'n_estimators': 312, 'max_depth': 13, 'min_samples_split': 39, 'min_samples_leaf': 55, 'criterion': 'entropy'}.
Trial 2881 finished with value: 0.717391304347826 and parameters: {'n_estimators': 349, 'max_depth': 10, 'min_samples_split': 44, 'min_samples_leaf': 59, 'criterion': 'entropy'}.
Trial 2882 finished with value: 0.6630434782608695 and parameters: {'n_estimators': 284, 'max_depth': 16, 'min_samples_split': 31, 'min_samples_leaf': 57, 'criterion': 'entropy'}.
Trial 2883 finished with value: 0.6956521739130435 and parameters: {'n_estimators': 382, 'max_depth': 12, 'min_samples_split': 26, 'min_samples_leaf': 55, 'criterion': 'entropy'}.
Trial 2884 finished with value: 0.6847826086956522 and parameters: {'n_estimators': 289, 'max_depth': 14, 'min_samples_split': 36, 'min_samples_leaf': 59, 'criterion': 'entropy'}.
Trial 2885 finished with value: 0.6521739130434783 and parameters: {'n_estimators': 327, 'max_depth': 5, 'min_samples_split': 30, 'min_samples_leaf': 63, 'criterion': 'entropy'}.
Trial 2886 finished with value: 0.717391304347826 and parameters: {'n_estimators': 361, 'max_depth': 8, 'min_samples_split': 41, 'min_samples_leaf': 71, 'criterion': 'entropy'}.
Trial 2887 finished with value: 0.7282608695652174 and parameters: {'n_estimators': 302, 'max_depth': 11, 'min_samples_split': 33, 'min_samples_leaf': 56, 'criterion': 'entropy'}.
Trial 2888 finished with value: 0.6956521739130435 and parameters: {'n_estimators': 317, 'max_depth': 18, 'min_samples_split': 25, 'min_samples_leaf': 61, 'criterion': 'entropy'}.
Trial 2889 finished with value: 0.7282608695652174 and parameters: {'n_estimators': 311, 'max_depth': 10, 'min_samples_split': 36, 'min_samples_leaf': 58, 'criterion': 'entropy'}.
Trial 2890 finished with value: 0.6847826086956522 and parameters: {'n_estimators': 333, 'max_depth': 15, 'min_samples_split': 29, 'min_samples_leaf': 55, 'criterion': 'entropy'}.
Trial 2891 finished with value: 0.6630434782608695 and parameters: {'n_estimators': 287, 'max_depth': 12, 'min_samples_split': 48, 'min_samples_leaf': 78, 'criterion': 'entropy'}.
Trial 2892 finished with value: 0.6956521739130435 and parameters: {'n_estimators': 283, 'max_depth': 7, 'min_samples_split': 155, 'min_samples_leaf': 54, 'criterion': 'entropy'}.
Trial 2893 finished with value: 0.717391304347826 and parameters: {'n_estimators': 330, 'max_depth': 9, 'min_samples_split': 24, 'min_samples_leaf': 60, 'criterion': 'gini'}.
Trial 2894 finished with value: 0.6956521739130435 and parameters: {'n_estimators': 900, 'max_depth': 13, 'min_samples_split': 32, 'min_samples_leaf': 57, 'criterion': 'entropy'}.
Trial 2895 finished with value: 0.7282608695652174 and parameters: {'n_estimators': 348, 'max_depth': 11, 'min_samples_split': 37, 'min_samples_leaf': 59, 'criterion': 'entropy'}.
Trial 2896 finished with value: 0.7282608695652174 and parameters: {'n_estimators': 275, 'max_depth': 8, 'min_samples_split': 28, 'min_samples_leaf': 54, 'criterion': 'entropy'}.
Trial 2897 finished with value: 0.6847826086956522 and parameters: {'n_estimators': 312, 'max_depth': 14, 'min_samples_split': 41, 'min_samples_leaf': 57, 'criterion': 'entropy'}.
Trial 2898 finished with value: 0.717391304347826 and parameters: {'n_estimators': 308, 'max_depth': 10, 'min_samples_split': 24, 'min_samples_leaf': 55, 'criterion': 'entropy'}.
Trial 2899 finished with value: 0.6956521739130435 and parameters: {'n_estimators': 289, 'max_depth': 16, 'min_samples_split': 33, 'min_samples_leaf': 62, 'criterion': 'entropy'}.
Trial 2900 finished with value: 0.6956521739130435 and parameters: {'n_estimators': 301, 'max_depth': 12, 'min_samples_split': 28, 'min_samples_leaf': 59, 'criterion': 'entropy'}.
Trial 2901 finished with value: 0.6739130434782609 and parameters: {'n_estimators': 331, 'max_depth': 7, 'min_samples_split': 35, 'min_samples_leaf': 57, 'criterion': 'entropy'}.
Trial 2902 finished with value: 0.6956521739130435 and parameters: {'n_estimators': 744, 'max_depth': 9, 'min_samples_split': 23, 'min_samples_leaf': 61, 'criterion': 'entropy'}.
Trial 2903 finished with value: 0.717391304347826 and parameters: {'n_estimators': 356, 'max_depth': 11, 'min_samples_split': 31, 'min_samples_leaf': 54, 'criterion': 'entropy'}.
Trial 2904 finished with value: 0.6739130434782609 and parameters: {'n_estimators': 276, 'max_depth': 22, 'min_samples_split': 39, 'min_samples_leaf': 64, 'criterion': 'entropy'}.
Trial 2905 finished with value: 0.6847826086956522 and parameters: {'n_estimators': 318, 'max_depth': 14, 'min_samples_split': 27, 'min_samples_leaf': 56, 'criterion': 'entropy'}.
Trial 2906 finished with value: 0.6413043478260869 and parameters: {'n_estimators': 332, 'max_depth': 5, 'min_samples_split': 44, 'min_samples_leaf': 58, 'criterion': 'entropy'}.
Trial 2907 finished with value: 0.717391304347826 and parameters: {'n_estimators': 257, 'max_depth': 9, 'min_samples_split': 32, 'min_samples_leaf': 54, 'criterion': 'entropy'}.
Trial 2908 finished with value: 0.6847826086956522 and parameters: {'n_estimators': 369, 'max_depth': 17, 'min_samples_split': 36, 'min_samples_leaf': 60, 'criterion': 'entropy'}.
Trial 2909 finished with value: 0.717391304347826 and parameters: {'n_estimators': 298, 'max_depth': 12, 'min_samples_split': 23, 'min_samples_leaf': 57, 'criterion': 'entropy'}.
Trial 2910 finished with value: 0.6739130434782609 and parameters: {'n_estimators': 353, 'max_depth': 7, 'min_samples_split': 28, 'min_samples_leaf': 54, 'criterion': 'entropy'}.
Trial 2911 finished with value: 0.7065217391304348 and parameters: {'n_estimators': 951, 'max_depth': 10, 'min_samples_split': 39, 'min_samples_leaf': 56, 'criterion': 'entropy'}.
Trial 2912 finished with value: 0.7065217391304348 and parameters: {'n_estimators': 1000, 'max_depth': 13, 'min_samples_split': 31, 'min_samples_leaf': 62, 'criterion': 'gini'}.
Trial 2913 finished with value: 0.717391304347826 and parameters: {'n_estimators': 929, 'max_depth': 11, 'min_samples_split': 86, 'min_samples_leaf': 59, 'criterion': 'entropy'}.
Trial 2914 finished with value: 0.7282608695652174 and parameters: {'n_estimators': 303, 'max_depth': 8, 'min_samples_split': 23, 'min_samples_leaf': 54, 'criterion': 'entropy'}.
Trial 2915 finished with value: 0.6630434782608695 and parameters: {'n_estimators': 164, 'max_depth': 15, 'min_samples_split': 34, 'min_samples_leaf': 58, 'criterion': 'entropy'}.
Trial 2916 finished with value: 0.6847826086956522 and parameters: {'n_estimators': 244, 'max_depth': 13, 'min_samples_split': 27, 'min_samples_leaf': 56, 'criterion': 'entropy'}.
Trial 2917 finished with value: 0.717391304347826 and parameters: {'n_estimators': 724, 'max_depth': 11, 'min_samples_split': 30, 'min_samples_leaf': 60, 'criterion': 'entropy'}.
Trial 2918 finished with value: 0.717391304347826 and parameters: {'n_estimators': 211, 'max_depth': 9, 'min_samples_split': 42, 'min_samples_leaf': 54, 'criterion': 'entropy'}.
Trial 2919 finished with value: 0.6956521739130435 and parameters: {'n_estimators': 743, 'max_depth': 7, 'min_samples_split': 21, 'min_samples_leaf': 56, 'criterion': 'entropy'}.
Trial 2920 finished with value: 0.6956521739130435 and parameters: {'n_estimators': 120, 'max_depth': 14, 'min_samples_split': 37, 'min_samples_leaf': 58, 'criterion': 'entropy'}.
Trial 2921 finished with value: 0.6847826086956522 and parameters: {'n_estimators': 754, 'max_depth': 17, 'min_samples_split': 34, 'min_samples_leaf': 61, 'criterion': 'entropy'}.
Trial 2922 finished with value: 0.7065217391304348 and parameters: {'n_estimators': 886, 'max_depth': 10, 'min_samples_split': 27, 'min_samples_leaf': 54, 'criterion': 'entropy'}.
Trial 2923 finished with value: 0.6956521739130435 and parameters: {'n_estimators': 187, 'max_depth': 57, 'min_samples_split': 25, 'min_samples_leaf': 58, 'criterion': 'entropy'}.
Trial 2924 finished with value: 0.7065217391304348 and parameters: {'n_estimators': 737, 'max_depth': 12, 'min_samples_split': 31, 'min_samples_leaf': 64, 'criterion': 'entropy'}.
Trial 2925 finished with value: 0.6413043478260869 and parameters: {'n_estimators': 762, 'max_depth': 5, 'min_samples_split': 77, 'min_samples_leaf': 56, 'criterion': 'entropy'}.
Trial 2926 finished with value: 0.6630434782608695 and parameters: {'n_estimators': 953, 'max_depth': 37, 'min_samples_split': 21, 'min_samples_leaf': 60, 'criterion': 'entropy'}.
Trial 2927 finished with value: 0.717391304347826 and parameters: {'n_estimators': 238, 'max_depth': 9, 'min_samples_split': 36, 'min_samples_leaf': 54, 'criterion': 'entropy'}.
Trial 2928 finished with value: 0.6739130434782609 and parameters: {'n_estimators': 345, 'max_depth': 15, 'min_samples_split': 41, 'min_samples_leaf': 56, 'criterion': 'entropy'}.
Trial 2929 finished with value: 0.6739130434782609 and parameters: {'n_estimators': 720, 'max_depth': 20, 'min_samples_split': 60, 'min_samples_leaf': 62, 'criterion': 'entropy'}.
Trial 2930 finished with value: 0.6847826086956522 and parameters: {'n_estimators': 326, 'max_depth': 12, 'min_samples_split': 29, 'min_samples_leaf': 59, 'criterion': 'entropy'}.
Trial 2931 finished with value: 0.6630434782608695 and parameters: {'n_estimators': 293, 'max_depth': 7, 'min_samples_split': 34, 'min_samples_leaf': 53, 'criterion': 'gini'}.
Trial 2932 finished with value: 0.7065217391304348 and parameters: {'n_estimators': 130, 'max_depth': 10, 'min_samples_split': 48, 'min_samples_leaf': 58, 'criterion': 'entropy'}.
Trial 2933 finished with value: 0.7065217391304348 and parameters: {'n_estimators': 744, 'max_depth': 13, 'min_samples_split': 24, 'min_samples_leaf': 56, 'criterion': 'entropy'}.
Trial 2934 finished with value: 0.717391304347826 and parameters: {'n_estimators': 749, 'max_depth': 11, 'min_samples_split': 38, 'min_samples_leaf': 54, 'criterion': 'entropy'}.
Trial 2935 finished with value: 0.717391304347826 and parameters: {'n_estimators': 757, 'max_depth': 8, 'min_samples_split': 30, 'min_samples_leaf': 60, 'criterion': 'entropy'}.
Trial 2936 finished with value: 0.6847826086956522 and parameters: {'n_estimators': 273, 'max_depth': 15, 'min_samples_split': 26, 'min_samples_leaf': 57, 'criterion': 'entropy'}.
Trial 2937 finished with value: 0.6847826086956522 and parameters: {'n_estimators': 365, 'max_depth': 9, 'min_samples_split': 21, 'min_samples_leaf': 53, 'criterion': 'entropy'}.
Trial 2938 finished with value: 0.6847826086956522 and parameters: {'n_estimators': 863, 'max_depth': 13, 'min_samples_split': 133, 'min_samples_leaf': 55, 'criterion': 'entropy'}.
Trial 2939 finished with value: 0.6956521739130435 and parameters: {'n_estimators': 395, 'max_depth': 11, 'min_samples_split': 43, 'min_samples_leaf': 84, 'criterion': 'entropy'}.
Trial 2940 finished with value: 0.6956521739130435 and parameters: {'n_estimators': 735, 'max_depth': 6, 'min_samples_split': 64, 'min_samples_leaf': 100, 'criterion': 'entropy'}.
Trial 2941 finished with value: 0.6739130434782609 and parameters: {'n_estimators': 761, 'max_depth': 18, 'min_samples_split': 33, 'min_samples_leaf': 58, 'criterion': 'entropy'}.
Trial 2942 finished with value: 0.6956521739130435 and parameters: {'n_estimators': 704, 'max_depth': 14, 'min_samples_split': 30, 'min_samples_leaf': 62, 'criterion': 'entropy'}.
Trial 2943 finished with value: 0.6847826086956522 and parameters: {'n_estimators': 864, 'max_depth': 9, 'min_samples_split': 39, 'min_samples_leaf': 32, 'criterion': 'entropy'}.
Trial 2944 finished with value: 0.6630434782608695 and parameters: {'n_estimators': 726, 'max_depth': 54, 'min_samples_split': 26, 'min_samples_leaf': 53, 'criterion': 'entropy'}.
Trial 2945 finished with value: 0.717391304347826 and parameters: {'n_estimators': 314, 'max_depth': 11, 'min_samples_split': 19, 'min_samples_leaf': 56, 'criterion': 'entropy'}.
Trial 2946 finished with value: 0.6956521739130435 and parameters: {'n_estimators': 974, 'max_depth': 7, 'min_samples_split': 34, 'min_samples_leaf': 65, 'criterion': 'entropy'}.
Trial 2947 finished with value: 0.6739130434782609 and parameters: {'n_estimators': 771, 'max_depth': 16, 'min_samples_split': 30, 'min_samples_leaf': 60, 'criterion': 'entropy'}.
Trial 2948 finished with value: 0.717391304347826 and parameters: {'n_estimators': 877, 'max_depth': 13, 'min_samples_split': 24, 'min_samples_leaf': 58, 'criterion': 'entropy'}.
Trial 2949 finished with value: 0.7065217391304348 and parameters: {'n_estimators': 157, 'max_depth': 10, 'min_samples_split': 36, 'min_samples_leaf': 55, 'criterion': 'gini'}.
Trial 2950 finished with value: 0.7065217391304348 and parameters: {'n_estimators': 761, 'max_depth': 12, 'min_samples_split': 45, 'min_samples_leaf': 53, 'criterion': 'entropy'}.
Trial 2951 finished with value: 0.717391304347826 and parameters: {'n_estimators': 245, 'max_depth': 8, 'min_samples_split': 53, 'min_samples_leaf': 59, 'criterion': 'entropy'}.
Trial 2952 finished with value: 0.6956521739130435 and parameters: {'n_estimators': 913, 'max_depth': 14, 'min_samples_split': 27, 'min_samples_leaf': 57, 'criterion': 'entropy'}.
Trial 2953 finished with value: 0.717391304347826 and parameters: {'n_estimators': 284, 'max_depth': 10, 'min_samples_split': 33, 'min_samples_leaf': 61, 'criterion': 'entropy'}.
Trial 2954 finished with value: 0.6739130434782609 and parameters: {'n_estimators': 724, 'max_depth': 6, 'min_samples_split': 19, 'min_samples_leaf': 54, 'criterion': 'entropy'}.
Trial 2955 finished with value: 0.6847826086956522 and parameters: {'n_estimators': 427, 'max_depth': 12, 'min_samples_split': 23, 'min_samples_leaf': 86, 'criterion': 'entropy'}.
Trial 2956 finished with value: 0.717391304347826 and parameters: {'n_estimators': 748, 'max_depth': 9, 'min_samples_split': 38, 'min_samples_leaf': 56, 'criterion': 'entropy'}.
Trial 2957 finished with value: 0.6739130434782609 and parameters: {'n_estimators': 771, 'max_depth': 16, 'min_samples_split': 31, 'min_samples_leaf': 53, 'criterion': 'entropy'}.
Trial 2958 finished with value: 0.717391304347826 and parameters: {'n_estimators': 852, 'max_depth': 11, 'min_samples_split': 27, 'min_samples_leaf': 58, 'criterion': 'entropy'}.
Trial 2959 finished with value: 0.6521739130434783 and parameters: {'n_estimators': 314, 'max_depth': 5, 'min_samples_split': 125, 'min_samples_leaf': 62, 'criterion': 'entropy'}.
Trial 2960 finished with value: 0.6847826086956522 and parameters: {'n_estimators': 708, 'max_depth': 14, 'min_samples_split': 41, 'min_samples_leaf': 55, 'criterion': 'entropy'}.
Trial 2961 finished with value: 0.7065217391304348 and parameters: {'n_estimators': 748, 'max_depth': 8, 'min_samples_split': 35, 'min_samples_leaf': 59, 'criterion': 'entropy'}.
Trial 2962 finished with value: 0.6956521739130435 and parameters: {'n_estimators': 779, 'max_depth': 12, 'min_samples_split': 22, 'min_samples_leaf': 57, 'criterion': 'entropy'}.
Trial 2963 finished with value: 0.7065217391304348 and parameters: {'n_estimators': 858, 'max_depth': 10, 'min_samples_split': 29, 'min_samples_leaf': 53, 'criterion': 'entropy'}.
Trial 2964 finished with value: 0.6956521739130435 and parameters: {'n_estimators': 728, 'max_depth': 8, 'min_samples_split': 18, 'min_samples_leaf': 63, 'criterion': 'entropy'}.
Trial 2965 finished with value: 0.6847826086956522 and parameters: {'n_estimators': 769, 'max_depth': 15, 'min_samples_split': 38, 'min_samples_leaf': 55, 'criterion': 'entropy'}.
Trial 2966 finished with value: 0.6630434782608695 and parameters: {'n_estimators': 758, 'max_depth': 18, 'min_samples_split': 32, 'min_samples_leaf': 60, 'criterion': 'entropy'}.
Trial 2967 finished with value: 0.7065217391304348 and parameters: {'n_estimators': 328, 'max_depth': 13, 'min_samples_split': 26, 'min_samples_leaf': 57, 'criterion': 'entropy'}.
Trial 2968 finished with value: 0.717391304347826 and parameters: {'n_estimators': 884, 'max_depth': 10, 'min_samples_split': 34, 'min_samples_leaf': 53, 'criterion': 'gini'}.
Trial 2969 finished with value: 0.7065217391304348 and parameters: {'n_estimators': 739, 'max_depth': 7, 'min_samples_split': 23, 'min_samples_leaf': 60, 'criterion': 'entropy'}.
Trial 2970 finished with value: 0.7065217391304348 and parameters: {'n_estimators': 779, 'max_depth': 12, 'min_samples_split': 29, 'min_samples_leaf': 56, 'criterion': 'entropy'}.
Trial 2971 finished with value: 0.6956521739130435 and parameters: {'n_estimators': 348, 'max_depth': 9, 'min_samples_split': 42, 'min_samples_leaf': 81, 'criterion': 'entropy'}.
Trial 2972 finished with value: 0.6630434782608695 and parameters: {'n_estimators': 841, 'max_depth': 61, 'min_samples_split': 37, 'min_samples_leaf': 58, 'criterion': 'entropy'}.
Trial 2973 finished with value: 0.7065217391304348 and parameters: {'n_estimators': 716, 'max_depth': 11, 'min_samples_split': 20, 'min_samples_leaf': 53, 'criterion': 'entropy'}.
Trial 2974 finished with value: 0.6847826086956522 and parameters: {'n_estimators': 754, 'max_depth': 14, 'min_samples_split': 32, 'min_samples_leaf': 55, 'criterion': 'entropy'}.
Trial 2975 finished with value: 0.6847826086956522 and parameters: {'n_estimators': 780, 'max_depth': 16, 'min_samples_split': 27, 'min_samples_leaf': 68, 'criterion': 'entropy'}.
Trial 2976 finished with value: 0.6847826086956522 and parameters: {'n_estimators': 302, 'max_depth': 7, 'min_samples_split': 25, 'min_samples_leaf': 61, 'criterion': 'entropy'}.
Trial 2977 finished with value: 0.717391304347826 and parameters: {'n_estimators': 854, 'max_depth': 11, 'min_samples_split': 48, 'min_samples_leaf': 59, 'criterion': 'entropy'}.
Trial 2978 finished with value: 0.6847826086956522 and parameters: {'n_estimators': 741, 'max_depth': 9, 'min_samples_split': 16, 'min_samples_leaf': 57, 'criterion': 'entropy'}.
Trial 2979 finished with value: 0.717391304347826 and parameters: {'n_estimators': 762, 'max_depth': 13, 'min_samples_split': 34, 'min_samples_leaf': 53, 'criterion': 'entropy'}.
Trial 2980 finished with value: 0.6521739130434783 and parameters: {'n_estimators': 787, 'max_depth': 44, 'min_samples_split': 30, 'min_samples_leaf': 55, 'criterion': 'entropy'}.
Trial 2981 finished with value: 0.7065217391304348 and parameters: {'n_estimators': 834, 'max_depth': 10, 'min_samples_split': 40, 'min_samples_leaf': 63, 'criterion': 'entropy'}.
Trial 2982 finished with value: 0.6521739130434783 and parameters: {'n_estimators': 904, 'max_depth': 5, 'min_samples_split': 22, 'min_samples_leaf': 59, 'criterion': 'entropy'}.
Trial 2983 finished with value: 0.6956521739130435 and parameters: {'n_estimators': 872, 'max_depth': 12, 'min_samples_split': 37, 'min_samples_leaf': 56, 'criterion': 'entropy'}.
Trial 2984 finished with value: 0.6847826086956522 and parameters: {'n_estimators': 277, 'max_depth': 15, 'min_samples_split': 44, 'min_samples_leaf': 53, 'criterion': 'entropy'}.
Trial 2985 finished with value: 0.717391304347826 and parameters: {'n_estimators': 733, 'max_depth': 8, 'min_samples_split': 29, 'min_samples_leaf': 58, 'criterion': 'entropy'}.
Trial 2986 finished with value: 0.717391304347826 and parameters: {'n_estimators': 777, 'max_depth': 13, 'min_samples_split': 33, 'min_samples_leaf': 55, 'criterion': 'entropy'}.
Trial 2987 finished with value: 0.6739130434782609 and parameters: {'n_estimators': 940, 'max_depth': 17, 'min_samples_split': 25, 'min_samples_leaf': 60, 'criterion': 'gini'}.
Trial 2988 finished with value: 0.7065217391304348 and parameters: {'n_estimators': 849, 'max_depth': 10, 'min_samples_split': 18, 'min_samples_leaf': 53, 'criterion': 'entropy'}.
Trial 2989 finished with value: 0.6956521739130435 and parameters: {'n_estimators': 756, 'max_depth': 7, 'min_samples_split': 29, 'min_samples_leaf': 57, 'criterion': 'entropy'}.
Trial 2990 finished with value: 0.717391304347826 and parameters: {'n_estimators': 717, 'max_depth': 11, 'min_samples_split': 37, 'min_samples_leaf': 62, 'criterion': 'entropy'}.
Trial 2991 finished with value: 0.6630434782608695 and parameters: {'n_estimators': 217, 'max_depth': 20, 'min_samples_split': 22, 'min_samples_leaf': 55, 'criterion': 'entropy'}.
Trial 2992 finished with value: 0.6847826086956522 and parameters: {'n_estimators': 828, 'max_depth': 14, 'min_samples_split': 32, 'min_samples_leaf': 58, 'criterion': 'entropy'}.
Trial 2993 finished with value: 0.7065217391304348 and parameters: {'n_estimators': 963, 'max_depth': 9, 'min_samples_split': 26, 'min_samples_leaf': 64, 'criterion': 'entropy'}.
Trial 2994 finished with value: 0.7065217391304348 and parameters: {'n_estimators': 785, 'max_depth': 12, 'min_samples_split': 15, 'min_samples_leaf': 53, 'criterion': 'entropy'}.
Trial 2995 finished with value: 0.717391304347826 and parameters: {'n_estimators': 800, 'max_depth': 8, 'min_samples_split': 35, 'min_samples_leaf': 61, 'criterion': 'entropy'}.
Trial 2996 finished with value: 0.6739130434782609 and parameters: {'n_estimators': 767, 'max_depth': 6, 'min_samples_split': 40, 'min_samples_leaf': 56, 'criterion': 'entropy'}.
Trial 2997 finished with value: 0.6630434782608695 and parameters: {'n_estimators': 738, 'max_depth': 15, 'min_samples_split': 29, 'min_samples_leaf': 59, 'criterion': 'entropy'}.
