Trial 8535 finished with value: 0.6956521739130435 and parameters: {'n_estimators': 357, 'max_depth': 9, 'min_samples_split': 56, 'min_samples_leaf': 59, 'criterion': 'entropy'}.
Trial 8536 finished with value: 0.6304347826086957 and parameters: {'n_estimators': 1000, 'max_depth': 5, 'min_samples_split': 39, 'min_samples_leaf': 56, 'criterion': 'entropy'}.
Trial 8537 finished with value: 0.717391304347826 and parameters: {'n_estimators': 738, 'max_depth': 11, 'min_samples_split': 44, 'min_samples_leaf': 58, 'criterion': 'entropy'}.
Trial 8538 finished with value: 0.6956521739130435 and parameters: {'n_estimators': 307, 'max_depth': 13, 'min_samples_split': 39, 'min_samples_leaf': 54, 'criterion': 'entropy'}.
Trial 8539 finished with value: 0.6956521739130435 and parameters: {'n_estimators': 881, 'max_depth': 9, 'min_samples_split': 38, 'min_samples_leaf': 59, 'criterion': 'entropy'}.
Trial 8540 finished with value: 0.6739130434782609 and parameters: {'n_estimators': 606, 'max_depth': 7, 'min_samples_split': 49, 'min_samples_leaf': 51, 'criterion': 'entropy'}.
Trial 8541 finished with value: 0.7065217391304348 and parameters: {'n_estimators': 789, 'max_depth': 11, 'min_samples_split': 43, 'min_samples_leaf': 56, 'criterion': 'entropy'}.
Trial 8542 finished with value: 0.6847826086956522 and parameters: {'n_estimators': 293, 'max_depth': 14, 'min_samples_split': 37, 'min_samples_leaf': 59, 'criterion': 'entropy'}.
Trial 8543 finished with value: 0.6956521739130435 and parameters: {'n_estimators': 750, 'max_depth': 9, 'min_samples_split': 46, 'min_samples_leaf': 57, 'criterion': 'entropy'}.
Trial 8544 finished with value: 0.717391304347826 and parameters: {'n_estimators': 334, 'max_depth': 12, 'min_samples_split': 37, 'min_samples_leaf': 54, 'criterion': 'entropy'}.
Trial 8545 finished with value: 0.6847826086956522 and parameters: {'n_estimators': 313, 'max_depth': 42, 'min_samples_split': 42, 'min_samples_leaf': 59, 'criterion': 'entropy'}.
Trial 8546 finished with value: 0.6847826086956522 and parameters: {'n_estimators': 922, 'max_depth': 7, 'min_samples_split': 39, 'min_samples_leaf': 56, 'criterion': 'entropy'}.
Trial 8547 finished with value: 0.6956521739130435 and parameters: {'n_estimators': 291, 'max_depth': 17, 'min_samples_split': 36, 'min_samples_leaf': 58, 'criterion': 'entropy'}.
Trial 8548 finished with value: 0.717391304347826 and parameters: {'n_estimators': 702, 'max_depth': 10, 'min_samples_split': 53, 'min_samples_leaf': 54, 'criterion': 'entropy'}.
Trial 8549 finished with value: 0.6739130434782609 and parameters: {'n_estimators': 164, 'max_depth': 15, 'min_samples_split': 37, 'min_samples_leaf': 59, 'criterion': 'entropy'}.
Trial 8550 finished with value: 0.7065217391304348 and parameters: {'n_estimators': 287, 'max_depth': 12, 'min_samples_split': 44, 'min_samples_leaf': 52, 'criterion': 'entropy'}.
Trial 8551 finished with value: 0.7282608695652174 and parameters: {'n_estimators': 804, 'max_depth': 8, 'min_samples_split': 41, 'min_samples_leaf': 56, 'criterion': 'entropy'}.
Trial 8552 finished with value: 0.6630434782608695 and parameters: {'n_estimators': 759, 'max_depth': 19, 'min_samples_split': 35, 'min_samples_leaf': 60, 'criterion': 'entropy'}.
Trial 8553 finished with value: 0.6304347826086957 and parameters: {'n_estimators': 313, 'max_depth': 5, 'min_samples_split': 37, 'min_samples_leaf': 57, 'criterion': 'entropy'}.
Trial 8554 finished with value: 0.7065217391304348 and parameters: {'n_estimators': 776, 'max_depth': 10, 'min_samples_split': 41, 'min_samples_leaf': 55, 'criterion': 'entropy'}.
Trial 8555 finished with value: 0.7065217391304348 and parameters: {'n_estimators': 284, 'max_depth': 13, 'min_samples_split': 48, 'min_samples_leaf': 58, 'criterion': 'entropy'}.
Trial 8556 finished with value: 0.6847826086956522 and parameters: {'n_estimators': 728, 'max_depth': 8, 'min_samples_split': 37, 'min_samples_leaf': 49, 'criterion': 'entropy'}.
Trial 8557 finished with value: 0.7282608695652174 and parameters: {'n_estimators': 366, 'max_depth': 11, 'min_samples_split': 45, 'min_samples_leaf': 60, 'criterion': 'entropy'}.
Trial 8558 finished with value: 0.6847826086956522 and parameters: {'n_estimators': 323, 'max_depth': 14, 'min_samples_split': 37, 'min_samples_leaf': 53, 'criterion': 'entropy'}.
Trial 8559 finished with value: 0.717391304347826 and parameters: {'n_estimators': 135, 'max_depth': 9, 'min_samples_split': 41, 'min_samples_leaf': 56, 'criterion': 'entropy'}.
Trial 8560 finished with value: 0.6847826086956522 and parameters: {'n_estimators': 303, 'max_depth': 6, 'min_samples_split': 36, 'min_samples_leaf': 60, 'criterion': 'entropy'}.
Trial 8561 finished with value: 0.6956521739130435 and parameters: {'n_estimators': 341, 'max_depth': 12, 'min_samples_split': 35, 'min_samples_leaf': 57, 'criterion': 'entropy'}.
Trial 8562 finished with value: 0.7282608695652174 and parameters: {'n_estimators': 284, 'max_depth': 10, 'min_samples_split': 41, 'min_samples_leaf': 58, 'criterion': 'entropy'}.
Trial 8563 finished with value: 0.6630434782608695 and parameters: {'n_estimators': 823, 'max_depth': 16, 'min_samples_split': 36, 'min_samples_leaf': 54, 'criterion': 'entropy'}.
Trial 8564 finished with value: 0.6739130434782609 and parameters: {'n_estimators': 302, 'max_depth': 7, 'min_samples_split': 44, 'min_samples_leaf': 51, 'criterion': 'entropy'}.
Trial 8565 finished with value: 0.717391304347826 and parameters: {'n_estimators': 775, 'max_depth': 11, 'min_samples_split': 51, 'min_samples_leaf': 60, 'criterion': 'entropy'}.
Trial 8566 finished with value: 0.6956521739130435 and parameters: {'n_estimators': 953, 'max_depth': 13, 'min_samples_split': 39, 'min_samples_leaf': 55, 'criterion': 'entropy'}.
Trial 8567 finished with value: 0.6956521739130435 and parameters: {'n_estimators': 745, 'max_depth': 9, 'min_samples_split': 34, 'min_samples_leaf': 58, 'criterion': 'entropy'}.
Trial 8568 finished with value: 0.7282608695652174 and parameters: {'n_estimators': 284, 'max_depth': 8, 'min_samples_split': 35, 'min_samples_leaf': 60, 'criterion': 'entropy'}.
Trial 8569 finished with value: 0.7065217391304348 and parameters: {'n_estimators': 653, 'max_depth': 14, 'min_samples_split': 43, 'min_samples_leaf': 57, 'criterion': 'entropy'}.
Trial 8570 finished with value: 0.6956521739130435 and parameters: {'n_estimators': 715, 'max_depth': 11, 'min_samples_split': 40, 'min_samples_leaf': 55, 'criterion': 'entropy'}.
Trial 8571 finished with value: 0.6630434782608695 and parameters: {'n_estimators': 427, 'max_depth': 6, 'min_samples_split': 47, 'min_samples_leaf': 53, 'criterion': 'entropy'}.
Trial 8572 finished with value: 0.6739130434782609 and parameters: {'n_estimators': 324, 'max_depth': 16, 'min_samples_split': 34, 'min_samples_leaf': 59, 'criterion': 'entropy'}.
Trial 8573 finished with value: 0.6956521739130435 and parameters: {'n_estimators': 842, 'max_depth': 9, 'min_samples_split': 39, 'min_samples_leaf': 61, 'criterion': 'entropy'}.
Trial 8574 finished with value: 0.6847826086956522 and parameters: {'n_estimators': 759, 'max_depth': 94, 'min_samples_split': 35, 'min_samples_leaf': 57, 'criterion': 'entropy'}.
Trial 8575 finished with value: 0.7065217391304348 and parameters: {'n_estimators': 288, 'max_depth': 12, 'min_samples_split': 32, 'min_samples_leaf': 52, 'criterion': 'entropy'}.
Trial 8576 finished with value: 0.717391304347826 and parameters: {'n_estimators': 299, 'max_depth': 10, 'min_samples_split': 37, 'min_samples_leaf': 56, 'criterion': 'entropy'}.
Trial 8577 finished with value: 0.7065217391304348 and parameters: {'n_estimators': 579, 'max_depth': 7, 'min_samples_split': 46, 'min_samples_leaf': 59, 'criterion': 'entropy'}.
Trial 8578 finished with value: 0.6956521739130435 and parameters: {'n_estimators': 938, 'max_depth': 14, 'min_samples_split': 41, 'min_samples_leaf': 61, 'criterion': 'entropy'}.
Trial 8579 finished with value: 0.717391304347826 and parameters: {'n_estimators': 788, 'max_depth': 11, 'min_samples_split': 35, 'min_samples_leaf': 58, 'criterion': 'entropy'}.
Trial 8580 finished with value: 0.6304347826086957 and parameters: {'n_estimators': 342, 'max_depth': 5, 'min_samples_split': 38, 'min_samples_leaf': 55, 'criterion': 'entropy'}.
Trial 8581 finished with value: 0.7065217391304348 and parameters: {'n_estimators': 317, 'max_depth': 8, 'min_samples_split': 59, 'min_samples_leaf': 60, 'criterion': 'entropy'}.
Trial 8582 finished with value: 0.7065217391304348 and parameters: {'n_estimators': 304, 'max_depth': 13, 'min_samples_split': 33, 'min_samples_leaf': 57, 'criterion': 'entropy'}.
Trial 8583 finished with value: 0.717391304347826 and parameters: {'n_estimators': 287, 'max_depth': 10, 'min_samples_split': 32, 'min_samples_leaf': 54, 'criterion': 'entropy'}.
Trial 8584 finished with value: 0.6847826086956522 and parameters: {'n_estimators': 742, 'max_depth': 18, 'min_samples_split': 43, 'min_samples_leaf': 51, 'criterion': 'entropy'}.
Trial 8585 finished with value: 0.6847826086956522 and parameters: {'n_estimators': 279, 'max_depth': 15, 'min_samples_split': 34, 'min_samples_leaf': 59, 'criterion': 'entropy'}.
Trial 8586 finished with value: 0.717391304347826 and parameters: {'n_estimators': 276, 'max_depth': 8, 'min_samples_split': 39, 'min_samples_leaf': 61, 'criterion': 'entropy'}.
Trial 8587 finished with value: 0.717391304347826 and parameters: {'n_estimators': 767, 'max_depth': 11, 'min_samples_split': 51, 'min_samples_leaf': 57, 'criterion': 'entropy'}.
Trial 8588 finished with value: 0.7065217391304348 and parameters: {'n_estimators': 728, 'max_depth': 13, 'min_samples_split': 33, 'min_samples_leaf': 55, 'criterion': 'entropy'}.
Trial 8589 finished with value: 0.6956521739130435 and parameters: {'n_estimators': 309, 'max_depth': 9, 'min_samples_split': 46, 'min_samples_leaf': 61, 'criterion': 'entropy'}.
Trial 8590 finished with value: 0.6956521739130435 and parameters: {'n_estimators': 804, 'max_depth': 7, 'min_samples_split': 38, 'min_samples_leaf': 58, 'criterion': 'entropy'}.
Trial 8591 finished with value: 0.7065217391304348 and parameters: {'n_estimators': 334, 'max_depth': 12, 'min_samples_split': 31, 'min_samples_leaf': 53, 'criterion': 'entropy'}.
Trial 8592 finished with value: 0.6956521739130435 and parameters: {'n_estimators': 682, 'max_depth': 16, 'min_samples_split': 41, 'min_samples_leaf': 56, 'criterion': 'entropy'}.
Trial 8593 finished with value: 0.6847826086956522 and parameters: {'n_estimators': 115, 'max_depth': 10, 'min_samples_split': 32, 'min_samples_leaf': 59, 'criterion': 'entropy'}.
Trial 8594 finished with value: 0.6413043478260869 and parameters: {'n_estimators': 279, 'max_depth': 5, 'min_samples_split': 36, 'min_samples_leaf': 61, 'criterion': 'entropy'}.
Trial 8595 finished with value: 0.7282608695652174 and parameters: {'n_estimators': 895, 'max_depth': 8, 'min_samples_split': 41, 'min_samples_leaf': 56, 'criterion': 'entropy'}.
Trial 8596 finished with value: 0.7065217391304348 and parameters: {'n_estimators': 295, 'max_depth': 12, 'min_samples_split': 31, 'min_samples_leaf': 49, 'criterion': 'entropy'}.
Trial 8597 finished with value: 0.6956521739130435 and parameters: {'n_estimators': 755, 'max_depth': 14, 'min_samples_split': 37, 'min_samples_leaf': 58, 'criterion': 'entropy'}.
Trial 8598 finished with value: 0.7282608695652174 and parameters: {'n_estimators': 318, 'max_depth': 10, 'min_samples_split': 44, 'min_samples_leaf': 53, 'criterion': 'entropy'}.
Trial 8599 finished with value: 0.7065217391304348 and parameters: {'n_estimators': 868, 'max_depth': 7, 'min_samples_split': 30, 'min_samples_leaf': 60, 'criterion': 'entropy'}.
Trial 8600 finished with value: 0.717391304347826 and parameters: {'n_estimators': 784, 'max_depth': 9, 'min_samples_split': 34, 'min_samples_leaf': 55, 'criterion': 'entropy'}.
Trial 8601 finished with value: 0.6956521739130435 and parameters: {'n_estimators': 275, 'max_depth': 12, 'min_samples_split': 55, 'min_samples_leaf': 62, 'criterion': 'entropy'}.
Trial 8602 finished with value: 0.6847826086956522 and parameters: {'n_estimators': 292, 'max_depth': 14, 'min_samples_split': 38, 'min_samples_leaf': 58, 'criterion': 'entropy'}.
Trial 8603 finished with value: 0.717391304347826 and parameters: {'n_estimators': 311, 'max_depth': 10, 'min_samples_split': 30, 'min_samples_leaf': 59, 'criterion': 'entropy'}.
Trial 8604 finished with value: 0.6521739130434783 and parameters: {'n_estimators': 349, 'max_depth': 78, 'min_samples_split': 42, 'min_samples_leaf': 56, 'criterion': 'entropy'}.
Trial 8605 finished with value: 0.6847826086956522 and parameters: {'n_estimators': 277, 'max_depth': 6, 'min_samples_split': 35, 'min_samples_leaf': 52, 'criterion': 'entropy'}.
Trial 8606 finished with value: 0.6956521739130435 and parameters: {'n_estimators': 181, 'max_depth': 11, 'min_samples_split': 33, 'min_samples_leaf': 62, 'criterion': 'entropy'}.
Trial 8607 finished with value: 0.6630434782608695 and parameters: {'n_estimators': 711, 'max_depth': 16, 'min_samples_split': 46, 'min_samples_leaf': 54, 'criterion': 'entropy'}.
Trial 8608 finished with value: 0.717391304347826 and parameters: {'n_estimators': 627, 'max_depth': 8, 'min_samples_split': 49, 'min_samples_leaf': 60, 'criterion': 'entropy'}.
Trial 8609 finished with value: 0.7282608695652174 and parameters: {'n_estimators': 737, 'max_depth': 13, 'min_samples_split': 28, 'min_samples_leaf': 58, 'criterion': 'entropy'}.
Trial 8610 finished with value: 0.7282608695652174 and parameters: {'n_estimators': 148, 'max_depth': 10, 'min_samples_split': 39, 'min_samples_leaf': 57, 'criterion': 'entropy'}.
Trial 8611 finished with value: 0.6739130434782609 and parameters: {'n_estimators': 330, 'max_depth': 7, 'min_samples_split': 32, 'min_samples_leaf': 55, 'criterion': 'entropy'}.
Trial 8612 finished with value: 0.6739130434782609 and parameters: {'n_estimators': 767, 'max_depth': 25, 'min_samples_split': 37, 'min_samples_leaf': 62, 'criterion': 'entropy'}.
Trial 8613 finished with value: 0.717391304347826 and parameters: {'n_estimators': 299, 'max_depth': 12, 'min_samples_split': 26, 'min_samples_leaf': 60, 'criterion': 'entropy'}.
Trial 8614 finished with value: 0.7282608695652174 and parameters: {'n_estimators': 275, 'max_depth': 9, 'min_samples_split': 42, 'min_samples_leaf': 57, 'criterion': 'entropy'}.
Trial 8615 finished with value: 0.6847826086956522 and parameters: {'n_estimators': 299, 'max_depth': 20, 'min_samples_split': 28, 'min_samples_leaf': 59, 'criterion': 'entropy'}.
Trial 8616 finished with value: 0.6521739130434783 and parameters: {'n_estimators': 803, 'max_depth': 5, 'min_samples_split': 34, 'min_samples_leaf': 51, 'criterion': 'entropy'}.
Trial 8617 finished with value: 0.6847826086956522 and parameters: {'n_estimators': 376, 'max_depth': 15, 'min_samples_split': 30, 'min_samples_leaf': 53, 'criterion': 'entropy'}.
Trial 8618 finished with value: 0.717391304347826 and parameters: {'n_estimators': 523, 'max_depth': 11, 'min_samples_split': 37, 'min_samples_leaf': 56, 'criterion': 'entropy'}.
Trial 8619 finished with value: 0.6956521739130435 and parameters: {'n_estimators': 281, 'max_depth': 8, 'min_samples_split': 40, 'min_samples_leaf': 62, 'criterion': 'entropy'}.
Trial 8620 finished with value: 0.7391304347826086 and parameters: {'n_estimators': 780, 'max_depth': 13, 'min_samples_split': 32, 'min_samples_leaf': 58, 'criterion': 'entropy'}.
Trial 8621 finished with value: 0.6847826086956522 and parameters: {'n_estimators': 823, 'max_depth': 17, 'min_samples_split': 25, 'min_samples_leaf': 60, 'criterion': 'entropy'}.
Trial 8622 finished with value: 0.717391304347826 and parameters: {'n_estimators': 315, 'max_depth': 10, 'min_samples_split': 44, 'min_samples_leaf': 55, 'criterion': 'entropy'}.
Trial 8623 finished with value: 0.6630434782608695 and parameters: {'n_estimators': 439, 'max_depth': 7, 'min_samples_split': 37, 'min_samples_leaf': 57, 'criterion': 'entropy'}.
Trial 8624 finished with value: 0.7065217391304348 and parameters: {'n_estimators': 276, 'max_depth': 14, 'min_samples_split': 30, 'min_samples_leaf': 61, 'criterion': 'entropy'}.
Trial 8625 finished with value: 0.717391304347826 and parameters: {'n_estimators': 727, 'max_depth': 11, 'min_samples_split': 23, 'min_samples_leaf': 59, 'criterion': 'entropy'}.
Trial 8626 finished with value: 0.6847826086956522 and parameters: {'n_estimators': 760, 'max_depth': 9, 'min_samples_split': 34, 'min_samples_leaf': 53, 'criterion': 'entropy'}.
Trial 8627 finished with value: 0.7065217391304348 and parameters: {'n_estimators': 696, 'max_depth': 12, 'min_samples_split': 50, 'min_samples_leaf': 49, 'criterion': 'entropy'}.
Trial 8628 finished with value: 0.7282608695652174 and parameters: {'n_estimators': 298, 'max_depth': 9, 'min_samples_split': 28, 'min_samples_leaf': 55, 'criterion': 'entropy'}.
Trial 8629 finished with value: 0.6630434782608695 and parameters: {'n_estimators': 492, 'max_depth': 6, 'min_samples_split': 39, 'min_samples_leaf': 62, 'criterion': 'entropy'}.
Trial 8630 finished with value: 0.6847826086956522 and parameters: {'n_estimators': 970, 'max_depth': 15, 'min_samples_split': 35, 'min_samples_leaf': 57, 'criterion': 'entropy'}.
Trial 8631 finished with value: 0.7282608695652174 and parameters: {'n_estimators': 270, 'max_depth': 12, 'min_samples_split': 46, 'min_samples_leaf': 60, 'criterion': 'entropy'}.
Trial 8632 finished with value: 0.6630434782608695 and parameters: {'n_estimators': 327, 'max_depth': 18, 'min_samples_split': 61, 'min_samples_leaf': 58, 'criterion': 'entropy'}.
Trial 8633 finished with value: 0.7282608695652174 and parameters: {'n_estimators': 308, 'max_depth': 8, 'min_samples_split': 75, 'min_samples_leaf': 54, 'criterion': 'entropy'}.
Trial 8634 finished with value: 0.7065217391304348 and parameters: {'n_estimators': 749, 'max_depth': 10, 'min_samples_split': 29, 'min_samples_leaf': 63, 'criterion': 'entropy'}.
Trial 8635 finished with value: 0.6304347826086957 and parameters: {'n_estimators': 270, 'max_depth': 5, 'min_samples_split': 20, 'min_samples_leaf': 56, 'criterion': 'entropy'}.
Trial 8636 finished with value: 0.717391304347826 and parameters: {'n_estimators': 291, 'max_depth': 13, 'min_samples_split': 14, 'min_samples_leaf': 60, 'criterion': 'entropy'}.
Trial 8637 finished with value: 0.7282608695652174 and parameters: {'n_estimators': 267, 'max_depth': 11, 'min_samples_split': 41, 'min_samples_leaf': 58, 'criterion': 'entropy'}.
Trial 8638 finished with value: 0.7065217391304348 and parameters: {'n_estimators': 783, 'max_depth': 7, 'min_samples_split': 98, 'min_samples_leaf': 62, 'criterion': 'entropy'}.
Trial 8639 finished with value: 0.7065217391304348 and parameters: {'n_estimators': 289, 'max_depth': 9, 'min_samples_split': 24, 'min_samples_leaf': 51, 'criterion': 'entropy'}.
Trial 8640 finished with value: 0.6847826086956522 and parameters: {'n_estimators': 340, 'max_depth': 15, 'min_samples_split': 34, 'min_samples_leaf': 55, 'criterion': 'entropy'}.
Trial 8641 finished with value: 0.6956521739130435 and parameters: {'n_estimators': 359, 'max_depth': 13, 'min_samples_split': 108, 'min_samples_leaf': 59, 'criterion': 'entropy'}.
Trial 8642 finished with value: 0.6739130434782609 and parameters: {'n_estimators': 724, 'max_depth': 49, 'min_samples_split': 31, 'min_samples_leaf': 57, 'criterion': 'entropy'}.
Trial 8643 finished with value: 0.7282608695652174 and parameters: {'n_estimators': 315, 'max_depth': 11, 'min_samples_split': 37, 'min_samples_leaf': 53, 'criterion': 'entropy'}.
Trial 8644 finished with value: 0.6956521739130435 and parameters: {'n_estimators': 259, 'max_depth': 8, 'min_samples_split': 27, 'min_samples_leaf': 61, 'criterion': 'entropy'}.
Trial 8645 finished with value: 0.7065217391304348 and parameters: {'n_estimators': 740, 'max_depth': 10, 'min_samples_split': 44, 'min_samples_leaf': 59, 'criterion': 'entropy'}.
Trial 8646 finished with value: 0.6847826086956522 and parameters: {'n_estimators': 842, 'max_depth': 7, 'min_samples_split': 31, 'min_samples_leaf': 56, 'criterion': 'entropy'}.
Trial 8647 finished with value: 0.6847826086956522 and parameters: {'n_estimators': 289, 'max_depth': 12, 'min_samples_split': 24, 'min_samples_leaf': 63, 'criterion': 'entropy'}.
Trial 8648 finished with value: 0.6956521739130435 and parameters: {'n_estimators': 771, 'max_depth': 14, 'min_samples_split': 40, 'min_samples_leaf': 57, 'criterion': 'entropy'}.
Trial 8649 finished with value: 0.6956521739130435 and parameters: {'n_estimators': 667, 'max_depth': 9, 'min_samples_split': 35, 'min_samples_leaf': 61, 'criterion': 'entropy'}.
Trial 8650 finished with value: 0.6739130434782609 and parameters: {'n_estimators': 268, 'max_depth': 16, 'min_samples_split': 20, 'min_samples_leaf': 55, 'criterion': 'entropy'}.
Trial 8651 finished with value: 0.7065217391304348 and parameters: {'n_estimators': 802, 'max_depth': 11, 'min_samples_split': 33, 'min_samples_leaf': 51, 'criterion': 'entropy'}.
Trial 8652 finished with value: 0.6304347826086957 and parameters: {'n_estimators': 306, 'max_depth': 5, 'min_samples_split': 27, 'min_samples_leaf': 59, 'criterion': 'entropy'}.
Trial 8653 finished with value: 0.717391304347826 and parameters: {'n_estimators': 326, 'max_depth': 9, 'min_samples_split': 38, 'min_samples_leaf': 53, 'criterion': 'entropy'}.
Trial 8654 finished with value: 0.6956521739130435 and parameters: {'n_estimators': 287, 'max_depth': 13, 'min_samples_split': 43, 'min_samples_leaf': 58, 'criterion': 'entropy'}.
Trial 8655 finished with value: 0.7065217391304348 and parameters: {'n_estimators': 754, 'max_depth': 7, 'min_samples_split': 30, 'min_samples_leaf': 63, 'criterion': 'entropy'}.
Trial 8656 finished with value: 0.7391304347826086 and parameters: {'n_estimators': 168, 'max_depth': 11, 'min_samples_split': 36, 'min_samples_leaf': 60, 'criterion': 'entropy'}.
