Trial 7798 finished with value: 0.7065217391304348 and parameters: {'n_estimators': 609, 'max_depth': 9, 'min_samples_split': 132, 'min_samples_leaf': 70, 'criterion': 'entropy'}.
Trial 7799 finished with value: 0.6521739130434783 and parameters: {'n_estimators': 197, 'max_depth': 5, 'min_samples_split': 12, 'min_samples_leaf': 58, 'criterion': 'entropy'}.
Trial 7800 finished with value: 0.6956521739130435 and parameters: {'n_estimators': 318, 'max_depth': 15, 'min_samples_split': 148, 'min_samples_leaf': 62, 'criterion': 'gini'}.
Trial 7801 finished with value: 0.6956521739130435 and parameters: {'n_estimators': 260, 'max_depth': 17, 'min_samples_split': 125, 'min_samples_leaf': 60, 'criterion': 'entropy'}.
Trial 7802 finished with value: 0.6956521739130435 and parameters: {'n_estimators': 398, 'max_depth': 11, 'min_samples_split': 38, 'min_samples_leaf': 74, 'criterion': 'gini'}.
Trial 7803 finished with value: 0.7282608695652174 and parameters: {'n_estimators': 231, 'max_depth': 8, 'min_samples_split': 19, 'min_samples_leaf': 56, 'criterion': 'entropy'}.
Trial 7804 finished with value: 0.6739130434782609 and parameters: {'n_estimators': 737, 'max_depth': 97, 'min_samples_split': 23, 'min_samples_leaf': 64, 'criterion': 'gini'}.
Trial 7805 finished with value: 0.6847826086956522 and parameters: {'n_estimators': 289, 'max_depth': 14, 'min_samples_split': 59, 'min_samples_leaf': 53, 'criterion': 'entropy'}.
Trial 7806 finished with value: 0.6956521739130435 and parameters: {'n_estimators': 535, 'max_depth': 12, 'min_samples_split': 43, 'min_samples_leaf': 59, 'criterion': 'gini'}.
Trial 7807 finished with value: 0.717391304347826 and parameters: {'n_estimators': 785, 'max_depth': 10, 'min_samples_split': 34, 'min_samples_leaf': 57, 'criterion': 'entropy'}.
Trial 7808 finished with value: 0.6847826086956522 and parameters: {'n_estimators': 273, 'max_depth': 7, 'min_samples_split': 144, 'min_samples_leaf': 61, 'criterion': 'entropy'}.
Trial 7809 finished with value: 0.6847826086956522 and parameters: {'n_estimators': 246, 'max_depth': 30, 'min_samples_split': 119, 'min_samples_leaf': 69, 'criterion': 'gini'}.
Trial 7810 finished with value: 0.7065217391304348 and parameters: {'n_estimators': 304, 'max_depth': 9, 'min_samples_split': 28, 'min_samples_leaf': 58, 'criterion': 'entropy'}.
Trial 7811 finished with value: 0.7065217391304348 and parameters: {'n_estimators': 329, 'max_depth': 13, 'min_samples_split': 134, 'min_samples_leaf': 72, 'criterion': 'gini'}.
Trial 7812 finished with value: 0.6956521739130435 and parameters: {'n_estimators': 770, 'max_depth': 11, 'min_samples_split': 36, 'min_samples_leaf': 55, 'criterion': 'entropy'}.
Trial 7813 finished with value: 0.6847826086956522 and parameters: {'n_estimators': 284, 'max_depth': 6, 'min_samples_split': 31, 'min_samples_leaf': 63, 'criterion': 'gini'}.
Trial 7814 finished with value: 0.717391304347826 and parameters: {'n_estimators': 262, 'max_depth': 9, 'min_samples_split': 139, 'min_samples_leaf': 50, 'criterion': 'entropy'}.
Trial 7815 finished with value: 0.6847826086956522 and parameters: {'n_estimators': 720, 'max_depth': 15, 'min_samples_split': 159, 'min_samples_leaf': 75, 'criterion': 'gini'}.
Trial 7816 finished with value: 0.6956521739130435 and parameters: {'n_estimators': 860, 'max_depth': 12, 'min_samples_split': 39, 'min_samples_leaf': 60, 'criterion': 'entropy'}.
Trial 7817 finished with value: 0.717391304347826 and parameters: {'n_estimators': 748, 'max_depth': 8, 'min_samples_split': 23, 'min_samples_leaf': 66, 'criterion': 'entropy'}.
Trial 7818 finished with value: 0.6630434782608695 and parameters: {'n_estimators': 825, 'max_depth': 17, 'min_samples_split': 153, 'min_samples_leaf': 79, 'criterion': 'gini'}.
Trial 7819 finished with value: 0.7065217391304348 and parameters: {'n_estimators': 298, 'max_depth': 10, 'min_samples_split': 16, 'min_samples_leaf': 57, 'criterion': 'entropy'}.
Trial 7820 finished with value: 0.6956521739130435 and parameters: {'n_estimators': 215, 'max_depth': 13, 'min_samples_split': 32, 'min_samples_leaf': 53, 'criterion': 'gini'}.
Trial 7821 finished with value: 0.6413043478260869 and parameters: {'n_estimators': 250, 'max_depth': 5, 'min_samples_split': 25, 'min_samples_leaf': 62, 'criterion': 'entropy'}.
Trial 7822 finished with value: 0.717391304347826 and parameters: {'n_estimators': 581, 'max_depth': 11, 'min_samples_split': 45, 'min_samples_leaf': 59, 'criterion': 'gini'}.
Trial 7823 finished with value: 0.6630434782608695 and parameters: {'n_estimators': 316, 'max_depth': 7, 'min_samples_split': 41, 'min_samples_leaf': 55, 'criterion': 'entropy'}.
Trial 7824 finished with value: 0.6956521739130435 and parameters: {'n_estimators': 275, 'max_depth': 88, 'min_samples_split': 104, 'min_samples_leaf': 58, 'criterion': 'gini'}.
Trial 7825 finished with value: 0.6956521739130435 and parameters: {'n_estimators': 798, 'max_depth': 14, 'min_samples_split': 53, 'min_samples_leaf': 71, 'criterion': 'entropy'}.
Trial 7826 finished with value: 0.6847826086956522 and parameters: {'n_estimators': 352, 'max_depth': 9, 'min_samples_split': 28, 'min_samples_leaf': 61, 'criterion': 'entropy'}.
Trial 7827 finished with value: 0.6956521739130435 and parameters: {'n_estimators': 291, 'max_depth': 11, 'min_samples_split': 99, 'min_samples_leaf': 77, 'criterion': 'gini'}.
Trial 7828 finished with value: 0.6739130434782609 and parameters: {'n_estimators': 232, 'max_depth': 7, 'min_samples_split': 36, 'min_samples_leaf': 56, 'criterion': 'entropy'}.
Trial 7829 finished with value: 0.7282608695652174 and parameters: {'n_estimators': 133, 'max_depth': 9, 'min_samples_split': 141, 'min_samples_leaf': 52, 'criterion': 'gini'}.
Trial 7830 finished with value: 0.6739130434782609 and parameters: {'n_estimators': 265, 'max_depth': 12, 'min_samples_split': 33, 'min_samples_leaf': 64, 'criterion': 'entropy'}.
Trial 7831 finished with value: 0.6956521739130435 and parameters: {'n_estimators': 749, 'max_depth': 15, 'min_samples_split': 29, 'min_samples_leaf': 73, 'criterion': 'gini'}.
Trial 7832 finished with value: 0.6956521739130435 and parameters: {'n_estimators': 772, 'max_depth': 10, 'min_samples_split': 130, 'min_samples_leaf': 69, 'criterion': 'entropy'}.
Trial 7833 finished with value: 0.7065217391304348 and parameters: {'n_estimators': 308, 'max_depth': 13, 'min_samples_split': 136, 'min_samples_leaf': 59, 'criterion': 'gini'}.
Trial 7834 finished with value: 0.6739130434782609 and parameters: {'n_estimators': 280, 'max_depth': 7, 'min_samples_split': 110, 'min_samples_leaf': 57, 'criterion': 'entropy'}.
Trial 7835 finished with value: 0.6956521739130435 and parameters: {'n_estimators': 253, 'max_depth': 10, 'min_samples_split': 146, 'min_samples_leaf': 67, 'criterion': 'entropy'}.
Trial 7836 finished with value: 0.6956521739130435 and parameters: {'n_estimators': 295, 'max_depth': 19, 'min_samples_split': 20, 'min_samples_leaf': 54, 'criterion': 'gini'}.
Trial 7837 finished with value: 0.6956521739130435 and parameters: {'n_estimators': 259, 'max_depth': 16, 'min_samples_split': 117, 'min_samples_leaf': 62, 'criterion': 'entropy'}.
Trial 7838 finished with value: 0.7065217391304348 and parameters: {'n_estimators': 337, 'max_depth': 8, 'min_samples_split': 93, 'min_samples_leaf': 60, 'criterion': 'gini'}.
Trial 7839 finished with value: 0.717391304347826 and parameters: {'n_estimators': 319, 'max_depth': 12, 'min_samples_split': 124, 'min_samples_leaf': 57, 'criterion': 'entropy'}.
Trial 7840 finished with value: 0.6304347826086957 and parameters: {'n_estimators': 372, 'max_depth': 5, 'min_samples_split': 39, 'min_samples_leaf': 55, 'criterion': 'gini'}.
Trial 7841 finished with value: 0.7065217391304348 and parameters: {'n_estimators': 925, 'max_depth': 14, 'min_samples_split': 35, 'min_samples_leaf': 64, 'criterion': 'entropy'}.
Trial 7842 finished with value: 0.7065217391304348 and parameters: {'n_estimators': 281, 'max_depth': 10, 'min_samples_split': 25, 'min_samples_leaf': 59, 'criterion': 'gini'}.
Trial 7843 finished with value: 0.7065217391304348 and parameters: {'n_estimators': 759, 'max_depth': 8, 'min_samples_split': 30, 'min_samples_leaf': 75, 'criterion': 'entropy'}.
Trial 7844 finished with value: 0.7065217391304348 and parameters: {'n_estimators': 707, 'max_depth': 12, 'min_samples_split': 141, 'min_samples_leaf': 62, 'criterion': 'entropy'}.
Trial 7845 finished with value: 0.7391304347826086 and parameters: {'n_estimators': 246, 'max_depth': 10, 'min_samples_split': 42, 'min_samples_leaf': 56, 'criterion': 'gini'}.
Trial 7846 finished with value: 0.6739130434782609 and parameters: {'n_estimators': 231, 'max_depth': 6, 'min_samples_split': 128, 'min_samples_leaf': 83, 'criterion': 'entropy'}.
Trial 7847 finished with value: 0.7065217391304348 and parameters: {'n_estimators': 734, 'max_depth': 14, 'min_samples_split': 34, 'min_samples_leaf': 60, 'criterion': 'gini'}.
Trial 7848 finished with value: 0.7065217391304348 and parameters: {'n_estimators': 661, 'max_depth': 8, 'min_samples_split': 27, 'min_samples_leaf': 72, 'criterion': 'entropy'}.
Trial 7849 finished with value: 0.717391304347826 and parameters: {'n_estimators': 269, 'max_depth': 11, 'min_samples_split': 22, 'min_samples_leaf': 58, 'criterion': 'gini'}.
Trial 7850 finished with value: 0.6847826086956522 and parameters: {'n_estimators': 297, 'max_depth': 16, 'min_samples_split': 135, 'min_samples_leaf': 52, 'criterion': 'entropy'}.
Trial 7851 finished with value: 0.6956521739130435 and parameters: {'n_estimators': 211, 'max_depth': 12, 'min_samples_split': 149, 'min_samples_leaf': 54, 'criterion': 'gini'}.
Trial 7852 finished with value: 0.6956521739130435 and parameters: {'n_estimators': 779, 'max_depth': 9, 'min_samples_split': 17, 'min_samples_leaf': 66, 'criterion': 'entropy'}.
Trial 7853 finished with value: 0.717391304347826 and parameters: {'n_estimators': 281, 'max_depth': 13, 'min_samples_split': 47, 'min_samples_leaf': 69, 'criterion': 'gini'}.
Trial 7854 finished with value: 0.6413043478260869 and parameters: {'n_estimators': 310, 'max_depth': 5, 'min_samples_split': 38, 'min_samples_leaf': 62, 'criterion': 'entropy'}.
Trial 7855 finished with value: 0.6739130434782609 and parameters: {'n_estimators': 265, 'max_depth': 7, 'min_samples_split': 32, 'min_samples_leaf': 57, 'criterion': 'entropy'}.
Trial 7856 finished with value: 0.717391304347826 and parameters: {'n_estimators': 329, 'max_depth': 10, 'min_samples_split': 9, 'min_samples_leaf': 60, 'criterion': 'gini'}.
Trial 7857 finished with value: 0.6847826086956522 and parameters: {'n_estimators': 175, 'max_depth': 17, 'min_samples_split': 144, 'min_samples_leaf': 56, 'criterion': 'entropy'}.
Trial 7858 finished with value: 0.7065217391304348 and parameters: {'n_estimators': 793, 'max_depth': 9, 'min_samples_split': 27, 'min_samples_leaf': 59, 'criterion': 'gini'}.
Trial 7859 finished with value: 0.6847826086956522 and parameters: {'n_estimators': 246, 'max_depth': 12, 'min_samples_split': 37, 'min_samples_leaf': 63, 'criterion': 'entropy'}.
Trial 7860 finished with value: 0.6739130434782609 and parameters: {'n_estimators': 727, 'max_depth': 52, 'min_samples_split': 31, 'min_samples_leaf': 65, 'criterion': 'gini'}.
Trial 7861 finished with value: 0.6956521739130435 and parameters: {'n_estimators': 285, 'max_depth': 14, 'min_samples_split': 138, 'min_samples_leaf': 54, 'criterion': 'entropy'}.
Trial 7862 finished with value: 0.7065217391304348 and parameters: {'n_estimators': 300, 'max_depth': 7, 'min_samples_split': 42, 'min_samples_leaf': 73, 'criterion': 'gini'}.
Trial 7863 finished with value: 0.6739130434782609 and parameters: {'n_estimators': 809, 'max_depth': 28, 'min_samples_split': 19, 'min_samples_leaf': 50, 'criterion': 'entropy'}.
Trial 7864 finished with value: 0.7282608695652174 and parameters: {'n_estimators': 268, 'max_depth': 11, 'min_samples_split': 24, 'min_samples_leaf': 58, 'criterion': 'entropy'}.
Trial 7865 finished with value: 0.6847826086956522 and parameters: {'n_estimators': 759, 'max_depth': 9, 'min_samples_split': 121, 'min_samples_leaf': 70, 'criterion': 'gini'}.
Trial 7866 finished with value: 0.6847826086956522 and parameters: {'n_estimators': 421, 'max_depth': 14, 'min_samples_split': 132, 'min_samples_leaf': 94, 'criterion': 'entropy'}.
Trial 7867 finished with value: 0.6956521739130435 and parameters: {'n_estimators': 230, 'max_depth': 11, 'min_samples_split': 33, 'min_samples_leaf': 60, 'criterion': 'gini'}.
Trial 7868 finished with value: 0.6739130434782609 and parameters: {'n_estimators': 315, 'max_depth': 7, 'min_samples_split': 29, 'min_samples_leaf': 56, 'criterion': 'entropy'}.
Trial 7869 finished with value: 0.7065217391304348 and parameters: {'n_estimators': 283, 'max_depth': 9, 'min_samples_split': 172, 'min_samples_leaf': 77, 'criterion': 'gini'}.
Trial 7870 finished with value: 0.7065217391304348 and parameters: {'n_estimators': 494, 'max_depth': 13, 'min_samples_split': 35, 'min_samples_leaf': 61, 'criterion': 'entropy'}.
Trial 7871 finished with value: 0.6413043478260869 and parameters: {'n_estimators': 741, 'max_depth': 5, 'min_samples_split': 12, 'min_samples_leaf': 58, 'criterion': 'gini'}.
Trial 7872 finished with value: 0.6847826086956522 and parameters: {'n_estimators': 259, 'max_depth': 11, 'min_samples_split': 115, 'min_samples_leaf': 52, 'criterion': 'entropy'}.
Trial 7873 finished with value: 0.6956521739130435 and parameters: {'n_estimators': 697, 'max_depth': 16, 'min_samples_split': 22, 'min_samples_leaf': 68, 'criterion': 'entropy'}.
Trial 7874 finished with value: 0.7065217391304348 and parameters: {'n_estimators': 244, 'max_depth': 8, 'min_samples_split': 126, 'min_samples_leaf': 54, 'criterion': 'gini'}.
Trial 7875 finished with value: 0.6739130434782609 and parameters: {'n_estimators': 293, 'max_depth': 20, 'min_samples_split': 39, 'min_samples_leaf': 74, 'criterion': 'entropy'}.
Trial 7876 finished with value: 0.7065217391304348 and parameters: {'n_estimators': 342, 'max_depth': 10, 'min_samples_split': 142, 'min_samples_leaf': 64, 'criterion': 'gini'}.
Trial 7877 finished with value: 0.6956521739130435 and parameters: {'n_estimators': 266, 'max_depth': 12, 'min_samples_split': 28, 'min_samples_leaf': 61, 'criterion': 'entropy'}.
Trial 7878 finished with value: 0.6630434782608695 and parameters: {'n_estimators': 117, 'max_depth': 15, 'min_samples_split': 45, 'min_samples_leaf': 57, 'criterion': 'gini'}.
Trial 7879 finished with value: 0.6847826086956522 and parameters: {'n_estimators': 987, 'max_depth': 7, 'min_samples_split': 147, 'min_samples_leaf': 55, 'criterion': 'entropy'}.
Trial 7880 finished with value: 0.717391304347826 and parameters: {'n_estimators': 198, 'max_depth': 9, 'min_samples_split': 195, 'min_samples_leaf': 59, 'criterion': 'gini'}.
Trial 7881 finished with value: 0.6956521739130435 and parameters: {'n_estimators': 776, 'max_depth': 13, 'min_samples_split': 36, 'min_samples_leaf': 63, 'criterion': 'entropy'}.
Trial 7882 finished with value: 0.6847826086956522 and parameters: {'n_estimators': 303, 'max_depth': 11, 'min_samples_split': 153, 'min_samples_leaf': 72, 'criterion': 'entropy'}.
Trial 7883 finished with value: 0.6956521739130435 and parameters: {'n_estimators': 623, 'max_depth': 18, 'min_samples_split': 50, 'min_samples_leaf': 58, 'criterion': 'gini'}.
Trial 7884 finished with value: 0.6847826086956522 and parameters: {'n_estimators': 150, 'max_depth': 58, 'min_samples_split': 136, 'min_samples_leaf': 61, 'criterion': 'entropy'}.
Trial 7885 finished with value: 0.6956521739130435 and parameters: {'n_estimators': 319, 'max_depth': 8, 'min_samples_split': 31, 'min_samples_leaf': 66, 'criterion': 'gini'}.
Trial 7886 finished with value: 0.6630434782608695 and parameters: {'n_estimators': 287, 'max_depth': 10, 'min_samples_split': 25, 'min_samples_leaf': 76, 'criterion': 'entropy'}.
Trial 7887 finished with value: 0.6847826086956522 and parameters: {'n_estimators': 829, 'max_depth': 6, 'min_samples_split': 39, 'min_samples_leaf': 71, 'criterion': 'gini'}.
Trial 7888 finished with value: 0.6956521739130435 and parameters: {'n_estimators': 251, 'max_depth': 14, 'min_samples_split': 15, 'min_samples_leaf': 56, 'criterion': 'entropy'}.
Trial 7889 finished with value: 0.6956521739130435 and parameters: {'n_estimators': 274, 'max_depth': 12, 'min_samples_split': 42, 'min_samples_leaf': 59, 'criterion': 'gini'}.
Trial 7890 finished with value: 0.7065217391304348 and parameters: {'n_estimators': 463, 'max_depth': 9, 'min_samples_split': 35, 'min_samples_leaf': 54, 'criterion': 'entropy'}.
Trial 7891 finished with value: 0.717391304347826 and parameters: {'n_estimators': 364, 'max_depth': 11, 'min_samples_split': 131, 'min_samples_leaf': 50, 'criterion': 'entropy'}.
Trial 7892 finished with value: 0.6956521739130435 and parameters: {'n_estimators': 716, 'max_depth': 15, 'min_samples_split': 30, 'min_samples_leaf': 57, 'criterion': 'gini'}.
Trial 7893 finished with value: 0.6956521739130435 and parameters: {'n_estimators': 762, 'max_depth': 7, 'min_samples_split': 139, 'min_samples_leaf': 62, 'criterion': 'entropy'}.
Trial 7894 finished with value: 0.7065217391304348 and parameters: {'n_estimators': 880, 'max_depth': 13, 'min_samples_split': 67, 'min_samples_leaf': 53, 'criterion': 'gini'}.
Trial 7895 finished with value: 0.6413043478260869 and parameters: {'n_estimators': 222, 'max_depth': 5, 'min_samples_split': 25, 'min_samples_leaf': 60, 'criterion': 'entropy'}.
Trial 7896 finished with value: 0.717391304347826 and parameters: {'n_estimators': 791, 'max_depth': 9, 'min_samples_split': 144, 'min_samples_leaf': 56, 'criterion': 'gini'}.
Trial 7897 finished with value: 0.6956521739130435 and parameters: {'n_estimators': 936, 'max_depth': 11, 'min_samples_split': 20, 'min_samples_leaf': 68, 'criterion': 'entropy'}.
Trial 7898 finished with value: 0.6956521739130435 and parameters: {'n_estimators': 303, 'max_depth': 8, 'min_samples_split': 33, 'min_samples_leaf': 74, 'criterion': 'gini'}.
Trial 7899 finished with value: 0.7065217391304348 and parameters: {'n_estimators': 332, 'max_depth': 13, 'min_samples_split': 28, 'min_samples_leaf': 63, 'criterion': 'entropy'}.
Trial 7900 finished with value: 0.6630434782608695 and parameters: {'n_estimators': 240, 'max_depth': 16, 'min_samples_split': 119, 'min_samples_leaf': 58, 'criterion': 'entropy'}.
Trial 7901 finished with value: 0.7065217391304348 and parameters: {'n_estimators': 270, 'max_depth': 10, 'min_samples_split': 37, 'min_samples_leaf': 70, 'criterion': 'gini'}.
Trial 7902 finished with value: 0.717391304347826 and parameters: {'n_estimators': 284, 'max_depth': 8, 'min_samples_split': 42, 'min_samples_leaf': 65, 'criterion': 'entropy'}.
Trial 7903 finished with value: 0.717391304347826 and parameters: {'n_estimators': 744, 'max_depth': 12, 'min_samples_split': 123, 'min_samples_leaf': 61, 'criterion': 'gini'}.
Trial 7904 finished with value: 0.6739130434782609 and parameters: {'n_estimators': 262, 'max_depth': 6, 'min_samples_split': 32, 'min_samples_leaf': 55, 'criterion': 'entropy'}.
Trial 7905 finished with value: 0.7065217391304348 and parameters: {'n_estimators': 909, 'max_depth': 10, 'min_samples_split': 112, 'min_samples_leaf': 59, 'criterion': 'gini'}.
Trial 7906 finished with value: 0.6739130434782609 and parameters: {'n_estimators': 851, 'max_depth': 14, 'min_samples_split': 23, 'min_samples_leaf': 56, 'criterion': 'entropy'}.
Trial 7907 finished with value: 0.717391304347826 and parameters: {'n_estimators': 303, 'max_depth': 11, 'min_samples_split': 136, 'min_samples_leaf': 51, 'criterion': 'gini'}.
Trial 7908 finished with value: 0.6739130434782609 and parameters: {'n_estimators': 282, 'max_depth': 7, 'min_samples_split': 150, 'min_samples_leaf': 61, 'criterion': 'entropy'}.
Trial 7909 finished with value: 0.7065217391304348 and parameters: {'n_estimators': 809, 'max_depth': 9, 'min_samples_split': 46, 'min_samples_leaf': 58, 'criterion': 'gini'}.
Trial 7910 finished with value: 0.6847826086956522 and parameters: {'n_estimators': 551, 'max_depth': 17, 'min_samples_split': 128, 'min_samples_leaf': 67, 'criterion': 'entropy'}.
Trial 7911 finished with value: 0.6739130434782609 and parameters: {'n_estimators': 254, 'max_depth': 13, 'min_samples_split': 36, 'min_samples_leaf': 79, 'criterion': 'entropy'}.
Trial 7912 finished with value: 0.6739130434782609 and parameters: {'n_estimators': 729, 'max_depth': 86, 'min_samples_split': 27, 'min_samples_leaf': 53, 'criterion': 'gini'}.
Trial 7913 finished with value: 0.717391304347826 and parameters: {'n_estimators': 317, 'max_depth': 11, 'min_samples_split': 81, 'min_samples_leaf': 63, 'criterion': 'entropy'}.
Trial 7914 finished with value: 0.6847826086956522 and parameters: {'n_estimators': 753, 'max_depth': 15, 'min_samples_split': 31, 'min_samples_leaf': 71, 'criterion': 'gini'}.
Trial 7915 finished with value: 0.6847826086956522 and parameters: {'n_estimators': 772, 'max_depth': 8, 'min_samples_split': 142, 'min_samples_leaf': 75, 'criterion': 'entropy'}.
Trial 7916 finished with value: 0.6304347826086957 and parameters: {'n_estimators': 234, 'max_depth': 5, 'min_samples_split': 108, 'min_samples_leaf': 57, 'criterion': 'gini'}.
Trial 7917 finished with value: 0.6304347826086957 and parameters: {'n_estimators': 272, 'max_depth': 10, 'min_samples_split': 20, 'min_samples_leaf': 34, 'criterion': 'entropy'}.
Trial 7918 finished with value: 0.6956521739130435 and parameters: {'n_estimators': 290, 'max_depth': 12, 'min_samples_split': 40, 'min_samples_leaf': 59, 'criterion': 'gini'}.
Trial 7919 finished with value: 0.6739130434782609 and parameters: {'n_estimators': 248, 'max_depth': 7, 'min_samples_split': 34, 'min_samples_leaf': 55, 'criterion': 'entropy'}.
Trial 7920 finished with value: 0.717391304347826 and parameters: {'n_estimators': 332, 'max_depth': 9, 'min_samples_split': 16, 'min_samples_leaf': 59, 'criterion': 'entropy'}.
