Trial 4479 finished with value: 0.7065217391304348 and parameters: {'n_estimators': 693, 'max_depth': 10, 'min_samples_split': 20, 'min_samples_leaf': 57, 'criterion': 'gini'}.
Trial 4480 finished with value: 0.6847826086956522 and parameters: {'n_estimators': 307, 'max_depth': 12, 'min_samples_split': 144, 'min_samples_leaf': 77, 'criterion': 'entropy'}.
Trial 4481 finished with value: 0.7065217391304348 and parameters: {'n_estimators': 349, 'max_depth': 14, 'min_samples_split': 37, 'min_samples_leaf': 61, 'criterion': 'gini'}.
Trial 4482 finished with value: 0.7065217391304348 and parameters: {'n_estimators': 736, 'max_depth': 9, 'min_samples_split': 30, 'min_samples_leaf': 59, 'criterion': 'entropy'}.
Trial 4483 finished with value: 0.7065217391304348 and parameters: {'n_estimators': 271, 'max_depth': 12, 'min_samples_split': 12, 'min_samples_leaf': 68, 'criterion': 'gini'}.
Trial 4484 finished with value: 0.6739130434782609 and parameters: {'n_estimators': 281, 'max_depth': 7, 'min_samples_split': 107, 'min_samples_leaf': 57, 'criterion': 'entropy'}.
Trial 4485 finished with value: 0.6847826086956522 and parameters: {'n_estimators': 246, 'max_depth': 17, 'min_samples_split': 137, 'min_samples_leaf': 64, 'criterion': 'gini'}.
Trial 4486 finished with value: 0.7282608695652174 and parameters: {'n_estimators': 290, 'max_depth': 9, 'min_samples_split': 129, 'min_samples_leaf': 73, 'criterion': 'entropy'}.
Trial 4487 finished with value: 0.6956521739130435 and parameters: {'n_estimators': 214, 'max_depth': 14, 'min_samples_split': 123, 'min_samples_leaf': 55, 'criterion': 'gini'}.
Trial 4488 finished with value: 0.7391304347826086 and parameters: {'n_estimators': 171, 'max_depth': 11, 'min_samples_split': 48, 'min_samples_leaf': 59, 'criterion': 'entropy'}.
Trial 4489 finished with value: 0.6630434782608695 and parameters: {'n_estimators': 653, 'max_depth': 6, 'min_samples_split': 34, 'min_samples_leaf': 62, 'criterion': 'gini'}.
Trial 4490 finished with value: 0.6956521739130435 and parameters: {'n_estimators': 329, 'max_depth': 9, 'min_samples_split': 40, 'min_samples_leaf': 66, 'criterion': 'entropy'}.
Trial 4491 finished with value: 0.7065217391304348 and parameters: {'n_estimators': 263, 'max_depth': 13, 'min_samples_split': 157, 'min_samples_leaf': 57, 'criterion': 'gini'}.
Trial 4492 finished with value: 0.6956521739130435 and parameters: {'n_estimators': 310, 'max_depth': 11, 'min_samples_split': 27, 'min_samples_leaf': 71, 'criterion': 'entropy'}.
Trial 4493 finished with value: 0.6739130434782609 and parameters: {'n_estimators': 294, 'max_depth': 9, 'min_samples_split': 142, 'min_samples_leaf': 61, 'criterion': 'gini'}.
Trial 4494 finished with value: 0.6413043478260869 and parameters: {'n_estimators': 237, 'max_depth': 5, 'min_samples_split': 22, 'min_samples_leaf': 55, 'criterion': 'entropy'}.
Trial 4495 finished with value: 0.6956521739130435 and parameters: {'n_estimators': 976, 'max_depth': 7, 'min_samples_split': 16, 'min_samples_leaf': 59, 'criterion': 'gini'}.
Trial 4496 finished with value: 0.7065217391304348 and parameters: {'n_estimators': 718, 'max_depth': 12, 'min_samples_split': 53, 'min_samples_leaf': 64, 'criterion': 'entropy'}.
Trial 4497 finished with value: 0.6847826086956522 and parameters: {'n_estimators': 273, 'max_depth': 45, 'min_samples_split': 147, 'min_samples_leaf': 57, 'criterion': 'gini'}.
Trial 4498 finished with value: 0.7065217391304348 and parameters: {'n_estimators': 120, 'max_depth': 15, 'min_samples_split': 34, 'min_samples_leaf': 60, 'criterion': 'entropy'}.
Trial 4499 finished with value: 0.6956521739130435 and parameters: {'n_estimators': 939, 'max_depth': 10, 'min_samples_split': 44, 'min_samples_leaf': 74, 'criterion': 'gini'}.
Trial 4500 finished with value: 0.6956521739130435 and parameters: {'n_estimators': 742, 'max_depth': 8, 'min_samples_split': 95, 'min_samples_leaf': 62, 'criterion': 'entropy'}.
Trial 4501 finished with value: 0.7065217391304348 and parameters: {'n_estimators': 256, 'max_depth': 12, 'min_samples_split': 119, 'min_samples_leaf': 58, 'criterion': 'entropy'}.
Trial 4502 finished with value: 0.6847826086956522 and parameters: {'n_estimators': 288, 'max_depth': 19, 'min_samples_split': 131, 'min_samples_leaf': 69, 'criterion': 'gini'}.
Trial 4503 finished with value: 0.717391304347826 and parameters: {'n_estimators': 319, 'max_depth': 10, 'min_samples_split': 29, 'min_samples_leaf': 55, 'criterion': 'entropy'}.
Trial 4504 finished with value: 0.7065217391304348 and parameters: {'n_estimators': 270, 'max_depth': 14, 'min_samples_split': 38, 'min_samples_leaf': 60, 'criterion': 'gini'}.
Trial 4505 finished with value: 0.6847826086956522 and parameters: {'n_estimators': 229, 'max_depth': 17, 'min_samples_split': 24, 'min_samples_leaf': 75, 'criterion': 'entropy'}.
Trial 4506 finished with value: 0.6739130434782609 and parameters: {'n_estimators': 257, 'max_depth': 7, 'min_samples_split': 103, 'min_samples_leaf': 66, 'criterion': 'gini'}.
Trial 4507 finished with value: 0.7282608695652174 and parameters: {'n_estimators': 290, 'max_depth': 11, 'min_samples_split': 2, 'min_samples_leaf': 57, 'criterion': 'entropy'}.
Trial 4508 finished with value: 0.717391304347826 and parameters: {'n_estimators': 304, 'max_depth': 9, 'min_samples_split': 33, 'min_samples_leaf': 63, 'criterion': 'gini'}.
Trial 4509 finished with value: 0.7065217391304348 and parameters: {'n_estimators': 702, 'max_depth': 12, 'min_samples_split': 141, 'min_samples_leaf': 59, 'criterion': 'entropy'}.
Trial 4510 finished with value: 0.6739130434782609 and parameters: {'n_estimators': 204, 'max_depth': 15, 'min_samples_split': 112, 'min_samples_leaf': 71, 'criterion': 'gini'}.
Trial 4511 finished with value: 0.6739130434782609 and parameters: {'n_estimators': 276, 'max_depth': 7, 'min_samples_split': 28, 'min_samples_leaf': 56, 'criterion': 'entropy'}.
Trial 4512 finished with value: 0.7065217391304348 and parameters: {'n_estimators': 246, 'max_depth': 13, 'min_samples_split': 135, 'min_samples_leaf': 55, 'criterion': 'gini'}.
Trial 4513 finished with value: 0.6847826086956522 and parameters: {'n_estimators': 679, 'max_depth': 5, 'min_samples_split': 153, 'min_samples_leaf': 78, 'criterion': 'entropy'}.
Trial 4514 finished with value: 0.717391304347826 and parameters: {'n_estimators': 463, 'max_depth': 10, 'min_samples_split': 42, 'min_samples_leaf': 61, 'criterion': 'gini'}.
Trial 4515 finished with value: 0.7065217391304348 and parameters: {'n_estimators': 742, 'max_depth': 8, 'min_samples_split': 35, 'min_samples_leaf': 72, 'criterion': 'entropy'}.
Trial 4516 finished with value: 0.7065217391304348 and parameters: {'n_estimators': 351, 'max_depth': 10, 'min_samples_split': 146, 'min_samples_leaf': 59, 'criterion': 'gini'}.
Trial 4517 finished with value: 0.6956521739130435 and parameters: {'n_estimators': 303, 'max_depth': 39, 'min_samples_split': 22, 'min_samples_leaf': 68, 'criterion': 'entropy'}.
Trial 4518 finished with value: 0.6956521739130435 and parameters: {'n_estimators': 329, 'max_depth': 14, 'min_samples_split': 32, 'min_samples_leaf': 64, 'criterion': 'gini'}.
Trial 4519 finished with value: 0.6956521739130435 and parameters: {'n_estimators': 487, 'max_depth': 12, 'min_samples_split': 39, 'min_samples_leaf': 57, 'criterion': 'entropy'}.
Trial 4520 finished with value: 0.717391304347826 and parameters: {'n_estimators': 259, 'max_depth': 8, 'min_samples_split': 17, 'min_samples_leaf': 58, 'criterion': 'gini'}.
Trial 4521 finished with value: 0.7065217391304348 and parameters: {'n_estimators': 279, 'max_depth': 16, 'min_samples_split': 27, 'min_samples_leaf': 62, 'criterion': 'entropy'}.
Trial 4522 finished with value: 0.6739130434782609 and parameters: {'n_estimators': 233, 'max_depth': 10, 'min_samples_split': 31, 'min_samples_leaf': 76, 'criterion': 'gini'}.
Trial 4523 finished with value: 0.7065217391304348 and parameters: {'n_estimators': 295, 'max_depth': 13, 'min_samples_split': 138, 'min_samples_leaf': 55, 'criterion': 'entropy'}.
Trial 4524 finished with value: 0.6847826086956522 and parameters: {'n_estimators': 267, 'max_depth': 6, 'min_samples_split': 37, 'min_samples_leaf': 61, 'criterion': 'gini'}.
Trial 4525 finished with value: 0.6956521739130435 and parameters: {'n_estimators': 718, 'max_depth': 9, 'min_samples_split': 124, 'min_samples_leaf': 59, 'criterion': 'entropy'}.
Trial 4526 finished with value: 0.6956521739130435 and parameters: {'n_estimators': 251, 'max_depth': 11, 'min_samples_split': 191, 'min_samples_leaf': 65, 'criterion': 'gini'}.
Trial 4527 finished with value: 0.717391304347826 and parameters: {'n_estimators': 402, 'max_depth': 8, 'min_samples_split': 47, 'min_samples_leaf': 57, 'criterion': 'entropy'}.
Trial 4528 finished with value: 0.6739130434782609 and parameters: {'n_estimators': 322, 'max_depth': 13, 'min_samples_split': 89, 'min_samples_leaf': 73, 'criterion': 'entropy'}.
Trial 4529 finished with value: 0.6956521739130435 and parameters: {'n_estimators': 275, 'max_depth': 11, 'min_samples_split': 133, 'min_samples_leaf': 70, 'criterion': 'gini'}.
Trial 4530 finished with value: 0.6739130434782609 and parameters: {'n_estimators': 306, 'max_depth': 6, 'min_samples_split': 21, 'min_samples_leaf': 61, 'criterion': 'entropy'}.
Trial 4531 finished with value: 0.6847826086956522 and parameters: {'n_estimators': 913, 'max_depth': 15, 'min_samples_split': 142, 'min_samples_leaf': 55, 'criterion': 'gini'}.
Trial 4532 finished with value: 0.7065217391304348 and parameters: {'n_estimators': 288, 'max_depth': 9, 'min_samples_split': 25, 'min_samples_leaf': 59, 'criterion': 'entropy'}.
Trial 4533 finished with value: 0.7065217391304348 and parameters: {'n_estimators': 241, 'max_depth': 11, 'min_samples_split': 115, 'min_samples_leaf': 63, 'criterion': 'gini'}.
Trial 4534 finished with value: 0.6956521739130435 and parameters: {'n_estimators': 743, 'max_depth': 7, 'min_samples_split': 13, 'min_samples_leaf': 67, 'criterion': 'entropy'}.
Trial 4535 finished with value: 0.7065217391304348 and parameters: {'n_estimators': 265, 'max_depth': 18, 'min_samples_split': 36, 'min_samples_leaf': 57, 'criterion': 'gini'}.
Trial 4536 finished with value: 0.5760869565217391 and parameters: {'n_estimators': 223, 'max_depth': 14, 'min_samples_split': 29, 'min_samples_leaf': 22, 'criterion': 'entropy'}.
Trial 4537 finished with value: 0.7065217391304348 and parameters: {'n_estimators': 314, 'max_depth': 9, 'min_samples_split': 40, 'min_samples_leaf': 60, 'criterion': 'gini'}.
Trial 4538 finished with value: 0.6304347826086957 and parameters: {'n_estimators': 338, 'max_depth': 5, 'min_samples_split': 19, 'min_samples_leaf': 55, 'criterion': 'entropy'}.
Trial 4539 finished with value: 0.6956521739130435 and parameters: {'n_estimators': 284, 'max_depth': 12, 'min_samples_split': 148, 'min_samples_leaf': 58, 'criterion': 'gini'}.
Trial 4540 finished with value: 0.7391304347826086 and parameters: {'n_estimators': 257, 'max_depth': 10, 'min_samples_split': 33, 'min_samples_leaf': 62, 'criterion': 'entropy'}.
Trial 4541 finished with value: 0.6956521739130435 and parameters: {'n_estimators': 960, 'max_depth': 8, 'min_samples_split': 127, 'min_samples_leaf': 72, 'criterion': 'gini'}.
Trial 4542 finished with value: 0.7065217391304348 and parameters: {'n_estimators': 300, 'max_depth': 13, 'min_samples_split': 139, 'min_samples_leaf': 60, 'criterion': 'entropy'}.
Trial 4543 finished with value: 0.6956521739130435 and parameters: {'n_estimators': 214, 'max_depth': 16, 'min_samples_split': 164, 'min_samples_leaf': 65, 'criterion': 'gini'}.
Trial 4544 finished with value: 0.6956521739130435 and parameters: {'n_estimators': 278, 'max_depth': 11, 'min_samples_split': 58, 'min_samples_leaf': 69, 'criterion': 'entropy'}.
Trial 4545 finished with value: 0.5978260869565217 and parameters: {'n_estimators': 154, 'max_depth': 8, 'min_samples_split': 26, 'min_samples_leaf': 11, 'criterion': 'gini'}.
Trial 4546 finished with value: 0.6739130434782609 and parameters: {'n_estimators': 236, 'max_depth': 13, 'min_samples_split': 43, 'min_samples_leaf': 75, 'criterion': 'entropy'}.
Trial 4547 finished with value: 0.6956521739130435 and parameters: {'n_estimators': 723, 'max_depth': 10, 'min_samples_split': 151, 'min_samples_leaf': 57, 'criterion': 'gini'}.
Trial 4548 finished with value: 0.6847826086956522 and parameters: {'n_estimators': 372, 'max_depth': 6, 'min_samples_split': 144, 'min_samples_leaf': 62, 'criterion': 'entropy'}.
Trial 4549 finished with value: 0.6739130434782609 and parameters: {'n_estimators': 256, 'max_depth': 15, 'min_samples_split': 31, 'min_samples_leaf': 58, 'criterion': 'gini'}.
Trial 4550 finished with value: 0.717391304347826 and parameters: {'n_estimators': 289, 'max_depth': 12, 'min_samples_split': 119, 'min_samples_leaf': 60, 'criterion': 'entropy'}.
Trial 4551 finished with value: 0.7065217391304348 and parameters: {'n_estimators': 739, 'max_depth': 8, 'min_samples_split': 36, 'min_samples_leaf': 55, 'criterion': 'gini'}.
Trial 4552 finished with value: 0.717391304347826 and parameters: {'n_estimators': 317, 'max_depth': 10, 'min_samples_split': 132, 'min_samples_leaf': 63, 'criterion': 'entropy'}.
Trial 4553 finished with value: 0.6739130434782609 and parameters: {'n_estimators': 267, 'max_depth': 7, 'min_samples_split': 25, 'min_samples_leaf': 55, 'criterion': 'gini'}.
Trial 4554 finished with value: 0.6739130434782609 and parameters: {'n_estimators': 301, 'max_depth': 12, 'min_samples_split': 29, 'min_samples_leaf': 74, 'criterion': 'entropy'}.
Trial 4555 finished with value: 0.6739130434782609 and parameters: {'n_estimators': 251, 'max_depth': 75, 'min_samples_split': 135, 'min_samples_leaf': 59, 'criterion': 'gini'}.
Trial 4556 finished with value: 0.6739130434782609 and parameters: {'n_estimators': 273, 'max_depth': 51, 'min_samples_split': 38, 'min_samples_leaf': 67, 'criterion': 'entropy'}.
Trial 4557 finished with value: 0.6739130434782609 and parameters: {'n_estimators': 336, 'max_depth': 17, 'min_samples_split': 9, 'min_samples_leaf': 70, 'criterion': 'entropy'}.
Trial 4558 finished with value: 0.717391304347826 and parameters: {'n_estimators': 706, 'max_depth': 10, 'min_samples_split': 19, 'min_samples_leaf': 57, 'criterion': 'gini'}.
Trial 4559 finished with value: 0.6413043478260869 and parameters: {'n_estimators': 285, 'max_depth': 5, 'min_samples_split': 34, 'min_samples_leaf': 61, 'criterion': 'entropy'}.
Trial 4560 finished with value: 0.7065217391304348 and parameters: {'n_estimators': 248, 'max_depth': 13, 'min_samples_split': 139, 'min_samples_leaf': 64, 'criterion': 'gini'}.
Trial 4561 finished with value: 0.6630434782608695 and parameters: {'n_estimators': 190, 'max_depth': 28, 'min_samples_split': 42, 'min_samples_leaf': 79, 'criterion': 'entropy'}.
Trial 4562 finished with value: 0.7282608695652174 and parameters: {'n_estimators': 301, 'max_depth': 9, 'min_samples_split': 110, 'min_samples_leaf': 57, 'criterion': 'gini'}.
Trial 4563 finished with value: 0.6739130434782609 and parameters: {'n_estimators': 227, 'max_depth': 15, 'min_samples_split': 23, 'min_samples_leaf': 59, 'criterion': 'entropy'}.
Trial 4564 finished with value: 0.6739130434782609 and parameters: {'n_estimators': 270, 'max_depth': 7, 'min_samples_split': 30, 'min_samples_leaf': 55, 'criterion': 'gini'}.
Trial 4565 finished with value: 0.7065217391304348 and parameters: {'n_estimators': 741, 'max_depth': 11, 'min_samples_split': 145, 'min_samples_leaf': 72, 'criterion': 'entropy'}.
Trial 4566 finished with value: 0.7065217391304348 and parameters: {'n_estimators': 360, 'max_depth': 9, 'min_samples_split': 32, 'min_samples_leaf': 77, 'criterion': 'gini'}.
Trial 4567 finished with value: 0.6630434782608695 and parameters: {'n_estimators': 321, 'max_depth': 82, 'min_samples_split': 27, 'min_samples_leaf': 61, 'criterion': 'entropy'}.
Trial 4568 finished with value: 0.6847826086956522 and parameters: {'n_estimators': 281, 'max_depth': 14, 'min_samples_split': 122, 'min_samples_leaf': 66, 'criterion': 'gini'}.
Trial 4569 finished with value: 0.7065217391304348 and parameters: {'n_estimators': 238, 'max_depth': 11, 'min_samples_split': 129, 'min_samples_leaf': 63, 'criterion': 'entropy'}.
Trial 4570 finished with value: 0.7065217391304348 and parameters: {'n_estimators': 298, 'max_depth': 7, 'min_samples_split': 49, 'min_samples_leaf': 59, 'criterion': 'gini'}.
Trial 4571 finished with value: 0.7065217391304348 and parameters: {'n_estimators': 268, 'max_depth': 12, 'min_samples_split': 149, 'min_samples_leaf': 57, 'criterion': 'entropy'}.
Trial 4572 finished with value: 0.7282608695652174 and parameters: {'n_estimators': 257, 'max_depth': 9, 'min_samples_split': 39, 'min_samples_leaf': 55, 'criterion': 'gini'}.
Trial 4573 finished with value: 0.6956521739130435 and parameters: {'n_estimators': 747, 'max_depth': 13, 'min_samples_split': 116, 'min_samples_leaf': 61, 'criterion': 'entropy'}.
Trial 4574 finished with value: 0.7065217391304348 and parameters: {'n_estimators': 316, 'max_depth': 8, 'min_samples_split': 35, 'min_samples_leaf': 74, 'criterion': 'gini'}.
Trial 4575 finished with value: 0.6739130434782609 and parameters: {'n_estimators': 207, 'max_depth': 19, 'min_samples_split': 65, 'min_samples_leaf': 58, 'criterion': 'entropy'}.
Trial 4576 finished with value: 0.6630434782608695 and parameters: {'n_estimators': 289, 'max_depth': 5, 'min_samples_split': 160, 'min_samples_leaf': 70, 'criterion': 'gini'}.
Trial 4577 finished with value: 0.7391304347826086 and parameters: {'n_estimators': 246, 'max_depth': 11, 'min_samples_split': 15, 'min_samples_leaf': 60, 'criterion': 'entropy'}.
Trial 4578 finished with value: 0.6847826086956522 and parameters: {'n_estimators': 424, 'max_depth': 16, 'min_samples_split': 45, 'min_samples_leaf': 64, 'criterion': 'gini'}.
Trial 4579 finished with value: 0.717391304347826 and parameters: {'n_estimators': 275, 'max_depth': 10, 'min_samples_split': 143, 'min_samples_leaf': 56, 'criterion': 'entropy'}.
Trial 4580 finished with value: 0.6956521739130435 and parameters: {'n_estimators': 340, 'max_depth': 36, 'min_samples_split': 23, 'min_samples_leaf': 62, 'criterion': 'gini'}.
Trial 4581 finished with value: 0.6739130434782609 and parameters: {'n_estimators': 625, 'max_depth': 22, 'min_samples_split': 30, 'min_samples_leaf': 68, 'criterion': 'entropy'}.
Trial 4582 finished with value: 0.7065217391304348 and parameters: {'n_estimators': 728, 'max_depth': 14, 'min_samples_split': 155, 'min_samples_leaf': 58, 'criterion': 'gini'}.
Trial 4583 finished with value: 0.6956521739130435 and parameters: {'n_estimators': 305, 'max_depth': 7, 'min_samples_split': 138, 'min_samples_leaf': 59, 'criterion': 'entropy'}.
Trial 4584 finished with value: 0.717391304347826 and parameters: {'n_estimators': 260, 'max_depth': 9, 'min_samples_split': 35, 'min_samples_leaf': 61, 'criterion': 'entropy'}.
Trial 4585 finished with value: 0.6956521739130435 and parameters: {'n_estimators': 289, 'max_depth': 12, 'min_samples_split': 41, 'min_samples_leaf': 72, 'criterion': 'gini'}.
Trial 4586 finished with value: 0.6521739130434783 and parameters: {'n_estimators': 170, 'max_depth': 10, 'min_samples_split': 26, 'min_samples_leaf': 76, 'criterion': 'entropy'}.
Trial 4587 finished with value: 0.6847826086956522 and parameters: {'n_estimators': 248, 'max_depth': 14, 'min_samples_split': 126, 'min_samples_leaf': 55, 'criterion': 'gini'}.
Trial 4588 finished with value: 0.6739130434782609 and parameters: {'n_estimators': 232, 'max_depth': 7, 'min_samples_split': 135, 'min_samples_leaf': 65, 'criterion': 'entropy'}.
Trial 4589 finished with value: 0.6956521739130435 and parameters: {'n_estimators': 751, 'max_depth': 11, 'min_samples_split': 18, 'min_samples_leaf': 57, 'criterion': 'gini'}.
Trial 4590 finished with value: 0.6956521739130435 and parameters: {'n_estimators': 120, 'max_depth': 8, 'min_samples_split': 147, 'min_samples_leaf': 60, 'criterion': 'entropy'}.
Trial 4591 finished with value: 0.6956521739130435 and parameters: {'n_estimators': 277, 'max_depth': 16, 'min_samples_split': 31, 'min_samples_leaf': 63, 'criterion': 'gini'}.
Trial 4592 finished with value: 0.6956521739130435 and parameters: {'n_estimators': 314, 'max_depth': 13, 'min_samples_split': 141, 'min_samples_leaf': 56, 'criterion': 'entropy'}.
Trial 4593 finished with value: 0.6413043478260869 and parameters: {'n_estimators': 286, 'max_depth': 5, 'min_samples_split': 21, 'min_samples_leaf': 58, 'criterion': 'gini'}.
Trial 4594 finished with value: 0.6847826086956522 and parameters: {'n_estimators': 451, 'max_depth': 60, 'min_samples_split': 38, 'min_samples_leaf': 68, 'criterion': 'entropy'}.
Trial 4595 finished with value: 0.6956521739130435 and parameters: {'n_estimators': 664, 'max_depth': 9, 'min_samples_split': 200, 'min_samples_leaf': 73, 'criterion': 'gini'}.
Trial 4596 finished with value: 0.6956521739130435 and parameters: {'n_estimators': 711, 'max_depth': 11, 'min_samples_split': 26, 'min_samples_leaf': 55, 'criterion': 'entropy'}.
Trial 4597 finished with value: 0.6956521739130435 and parameters: {'n_estimators': 263, 'max_depth': 12, 'min_samples_split': 86, 'min_samples_leaf': 60, 'criterion': 'gini'}.
Trial 4598 finished with value: 0.7065217391304348 and parameters: {'n_estimators': 304, 'max_depth': 7, 'min_samples_split': 35, 'min_samples_leaf': 71, 'criterion': 'entropy'}.
Trial 4599 finished with value: 0.6956521739130435 and parameters: {'n_estimators': 268, 'max_depth': 9, 'min_samples_split': 106, 'min_samples_leaf': 29, 'criterion': 'gini'}.
Trial 4600 finished with value: 0.6956521739130435 and parameters: {'n_estimators': 932, 'max_depth': 14, 'min_samples_split': 171, 'min_samples_leaf': 62, 'criterion': 'entropy'}.
Trial 4601 finished with value: 0.6956521739130435 and parameters: {'n_estimators': 221, 'max_depth': 17, 'min_samples_split': 80, 'min_samples_leaf': 58, 'criterion': 'gini'}.
