Trial 7 finished with value: 0.5108695652173914 and parameters: {'n_estimators': 833, 'max_depth': 98, 'min_samples_split': 98, 'min_samples_leaf': 6, 'criterion': 'gini'}.
Trial 8 finished with value: 0.5434782608695652 and parameters: {'n_estimators': 585, 'max_depth': 44, 'min_samples_split': 49, 'min_samples_leaf': 89, 'criterion': 'entropy'}.
Trial 9 finished with value: 0.532608695652174 and parameters: {'n_estimators': 711, 'max_depth': 60, 'min_samples_split': 101, 'min_samples_leaf': 4, 'criterion': 'entropy'}.
Trial 10 finished with value: 0.5108695652173914 and parameters: {'n_estimators': 224, 'max_depth': 5, 'min_samples_split': 188, 'min_samples_leaf': 39, 'criterion': 'entropy'}.
Trial 11 finished with value: 0.5434782608695652 and parameters: {'n_estimators': 455, 'max_depth': 25, 'min_samples_split': 200, 'min_samples_leaf': 55, 'criterion': 'gini'}.
Trial 12 finished with value: 0.5217391304347826 and parameters: {'n_estimators': 446, 'max_depth': 24, 'min_samples_split': 160, 'min_samples_leaf': 37, 'criterion': 'gini'}.
Trial 13 finished with value: 0.5543478260869565 and parameters: {'n_estimators': 482, 'max_depth': 33, 'min_samples_split': 162, 'min_samples_leaf': 67, 'criterion': 'entropy'}.
Trial 14 finished with value: 0.532608695652174 and parameters: {'n_estimators': 365, 'max_depth': 73, 'min_samples_split': 170, 'min_samples_leaf': 68, 'criterion': 'entropy'}.
Trial 15 finished with value: 0.5 and parameters: {'n_estimators': 972, 'max_depth': 32, 'min_samples_split': 134, 'min_samples_leaf': 37, 'criterion': 'entropy'}.
Trial 16 finished with value: 0.532608695652174 and parameters: {'n_estimators': 533, 'max_depth': 7, 'min_samples_split': 176, 'min_samples_leaf': 26, 'criterion': 'entropy'}.
Trial 17 finished with value: 0.532608695652174 and parameters: {'n_estimators': 351, 'max_depth': 80, 'min_samples_split': 200, 'min_samples_leaf': 68, 'criterion': 'entropy'}.
Trial 18 finished with value: 0.5217391304347826 and parameters: {'n_estimators': 596, 'max_depth': 38, 'min_samples_split': 154, 'min_samples_leaf': 48, 'criterion': 'entropy'}.
Trial 19 finished with value: 0.4891304347826087 and parameters: {'n_estimators': 384, 'max_depth': 54, 'min_samples_split': 123, 'min_samples_leaf': 46, 'criterion': 'entropy'}.
Trial 20 finished with value: 0.5434782608695652 and parameters: {'n_estimators': 527, 'max_depth': 16, 'min_samples_split': 177, 'min_samples_leaf': 61, 'criterion': 'entropy'}.
Trial 21 finished with value: 0.5217391304347826 and parameters: {'n_estimators': 470, 'max_depth': 33, 'min_samples_split': 149, 'min_samples_leaf': 71, 'criterion': 'gini'}.
Trial 22 finished with value: 0.532608695652174 and parameters: {'n_estimators': 519, 'max_depth': 23, 'min_samples_split': 165, 'min_samples_leaf': 77, 'criterion': 'gini'}.
Trial 23 finished with value: 0.5434782608695652 and parameters: {'n_estimators': 649, 'max_depth': 33, 'min_samples_split': 128, 'min_samples_leaf': 63, 'criterion': 'gini'}.
Trial 24 finished with value: 0.5543478260869565 and parameters: {'n_estimators': 299, 'max_depth': 18, 'min_samples_split': 187, 'min_samples_leaf': 75, 'criterion': 'entropy'}.
Trial 25 finished with value: 0.5543478260869565 and parameters: {'n_estimators': 263, 'max_depth': 17, 'min_samples_split': 186, 'min_samples_leaf': 96, 'criterion': 'entropy'}.
Trial 26 finished with value: 0.5760869565217391 and parameters: {'n_estimators': 314, 'max_depth': 16, 'min_samples_split': 187, 'min_samples_leaf': 50, 'criterion': 'entropy'}.
Trial 27 finished with value: 0.5543478260869565 and parameters: {'n_estimators': 209, 'max_depth': 11, 'min_samples_split': 160, 'min_samples_leaf': 27, 'criterion': 'entropy'}.
Trial 28 finished with value: 0.5652173913043478 and parameters: {'n_estimators': 405, 'max_depth': 49, 'min_samples_split': 199, 'min_samples_leaf': 44, 'criterion': 'entropy'}.
Trial 29 finished with value: 0.5434782608695652 and parameters: {'n_estimators': 429, 'max_depth': 51, 'min_samples_split': 198, 'min_samples_leaf': 44, 'criterion': 'entropy'}.
Trial 30 finished with value: 0.5108695652173914 and parameters: {'n_estimators': 332, 'max_depth': 53, 'min_samples_split': 22, 'min_samples_leaf': 27, 'criterion': 'entropy'}.
Trial 31 finished with value: 0.5434782608695652 and parameters: {'n_estimators': 408, 'max_depth': 37, 'min_samples_split': 178, 'min_samples_leaf': 52, 'criterion': 'entropy'}.
Trial 32 finished with value: 0.5217391304347826 and parameters: {'n_estimators': 496, 'max_depth': 39, 'min_samples_split': 185, 'min_samples_leaf': 58, 'criterion': 'entropy'}.
Trial 33 finished with value: 0.4673913043478261 and parameters: {'n_estimators': 284, 'max_depth': 27, 'min_samples_split': 147, 'min_samples_leaf': 42, 'criterion': 'entropy'}.
Trial 34 finished with value: 0.532608695652174 and parameters: {'n_estimators': 569, 'max_depth': 48, 'min_samples_split': 170, 'min_samples_leaf': 32, 'criterion': 'entropy'}.
Trial 35 finished with value: 0.5543478260869565 and parameters: {'n_estimators': 390, 'max_depth': 43, 'min_samples_split': 190, 'min_samples_leaf': 52, 'criterion': 'entropy'}.
Trial 36 finished with value: 0.5108695652173914 and parameters: {'n_estimators': 320, 'max_depth': 60, 'min_samples_split': 115, 'min_samples_leaf': 14, 'criterion': 'entropy'}.
Trial 37 finished with value: 0.5217391304347826 and parameters: {'n_estimators': 647, 'max_depth': 12, 'min_samples_split': 142, 'min_samples_leaf': 61, 'criterion': 'entropy'}.
Trial 38 finished with value: 0.5108695652173914 and parameters: {'n_estimators': 252, 'max_depth': 20, 'min_samples_split': 175, 'min_samples_leaf': 33, 'criterion': 'entropy'}.
Trial 39 finished with value: 0.532608695652174 and parameters: {'n_estimators': 419, 'max_depth': 29, 'min_samples_split': 97, 'min_samples_leaf': 21, 'criterion': 'entropy'}.
Trial 40 finished with value: 0.532608695652174 and parameters: {'n_estimators': 472, 'max_depth': 42, 'min_samples_split': 82, 'min_samples_leaf': 49, 'criterion': 'entropy'}.
Trial 41 finished with value: 0.5543478260869565 and parameters: {'n_estimators': 297, 'max_depth': 20, 'min_samples_split': 191, 'min_samples_leaf': 79, 'criterion': 'entropy'}.
Trial 42 finished with value: 0.5217391304347826 and parameters: {'n_estimators': 323, 'max_depth': 11, 'min_samples_split': 182, 'min_samples_leaf': 86, 'criterion': 'entropy'}.
Trial 43 finished with value: 0.5543478260869565 and parameters: {'n_estimators': 380, 'max_depth': 30, 'min_samples_split': 194, 'min_samples_leaf': 75, 'criterion': 'entropy'}.
Trial 44 finished with value: 0.5434782608695652 and parameters: {'n_estimators': 252, 'max_depth': 17, 'min_samples_split': 160, 'min_samples_leaf': 66, 'criterion': 'entropy'}.
Trial 45 finished with value: 0.532608695652174 and parameters: {'n_estimators': 555, 'max_depth': 21, 'min_samples_split': 184, 'min_samples_leaf': 57, 'criterion': 'entropy'}.
Trial 46 finished with value: 0.5434782608695652 and parameters: {'n_estimators': 499, 'max_depth': 95, 'min_samples_split': 168, 'min_samples_leaf': 91, 'criterion': 'entropy'}.
Trial 47 finished with value: 0.5760869565217391 and parameters: {'n_estimators': 348, 'max_depth': 26, 'min_samples_split': 193, 'min_samples_leaf': 73, 'criterion': 'gini'}.
Trial 48 finished with value: 0.5108695652173914 and parameters: {'n_estimators': 352, 'max_depth': 26, 'min_samples_split': 196, 'min_samples_leaf': 41, 'criterion': 'gini'}.
Trial 49 finished with value: 0.5434782608695652 and parameters: {'n_estimators': 439, 'max_depth': 36, 'min_samples_split': 152, 'min_samples_leaf': 55, 'criterion': 'gini'}.
Trial 50 finished with value: 0.532608695652174 and parameters: {'n_estimators': 745, 'max_depth': 7, 'min_samples_split': 172, 'min_samples_leaf': 71, 'criterion': 'gini'}.
Trial 51 finished with value: 0.5217391304347826 and parameters: {'n_estimators': 281, 'max_depth': 14, 'min_samples_split': 191, 'min_samples_leaf': 79, 'criterion': 'gini'}.
Trial 52 finished with value: 0.5434782608695652 and parameters: {'n_estimators': 311, 'max_depth': 25, 'min_samples_split': 200, 'min_samples_leaf': 84, 'criterion': 'gini'}.
Trial 53 finished with value: 0.5217391304347826 and parameters: {'n_estimators': 363, 'max_depth': 72, 'min_samples_split': 182, 'min_samples_leaf': 65, 'criterion': 'entropy'}.
Trial 54 finished with value: 0.5543478260869565 and parameters: {'n_estimators': 408, 'max_depth': 33, 'min_samples_split': 164, 'min_samples_leaf': 74, 'criterion': 'gini'}.
Trial 55 finished with value: 0.5108695652173914 and parameters: {'n_estimators': 225, 'max_depth': 47, 'min_samples_split': 54, 'min_samples_leaf': 35, 'criterion': 'entropy'}.
Trial 56 finished with value: 0.5434782608695652 and parameters: {'n_estimators': 453, 'max_depth': 21, 'min_samples_split': 179, 'min_samples_leaf': 46, 'criterion': 'entropy'}.
Trial 57 finished with value: 0.5543478260869565 and parameters: {'n_estimators': 995, 'max_depth': 28, 'min_samples_split': 191, 'min_samples_leaf': 51, 'criterion': 'gini'}.
Trial 58 finished with value: 0.5434782608695652 and parameters: {'n_estimators': 341, 'max_depth': 59, 'min_samples_split': 156, 'min_samples_leaf': 70, 'criterion': 'entropy'}.
Trial 59 finished with value: 0.532608695652174 and parameters: {'n_estimators': 390, 'max_depth': 40, 'min_samples_split': 172, 'min_samples_leaf': 60, 'criterion': 'entropy'}.
Trial 60 finished with value: 0.532608695652174 and parameters: {'n_estimators': 893, 'max_depth': 8, 'min_samples_split': 30, 'min_samples_leaf': 91, 'criterion': 'entropy'}.
Trial 61 finished with value: 0.5543478260869565 and parameters: {'n_estimators': 278, 'max_depth': 17, 'min_samples_split': 200, 'min_samples_leaf': 94, 'criterion': 'entropy'}.
Trial 62 finished with value: 0.5434782608695652 and parameters: {'n_estimators': 211, 'max_depth': 18, 'min_samples_split': 187, 'min_samples_leaf': 95, 'criterion': 'entropy'}.
Trial 63 finished with value: 0.532608695652174 and parameters: {'n_estimators': 251, 'max_depth': 13, 'min_samples_split': 185, 'min_samples_leaf': 99, 'criterion': 'entropy'}.
Trial 64 finished with value: 0.532608695652174 and parameters: {'n_estimators': 260, 'max_depth': 23, 'min_samples_split': 180, 'min_samples_leaf': 40, 'criterion': 'entropy'}.
Trial 65 finished with value: 0.5434782608695652 and parameters: {'n_estimators': 620, 'max_depth': 31, 'min_samples_split': 165, 'min_samples_leaf': 87, 'criterion': 'entropy'}.
Trial 66 finished with value: 0.5434782608695652 and parameters: {'n_estimators': 303, 'max_depth': 34, 'min_samples_split': 195, 'min_samples_leaf': 81, 'criterion': 'entropy'}.
Trial 67 finished with value: 0.532608695652174 and parameters: {'n_estimators': 375, 'max_depth': 24, 'min_samples_split': 175, 'min_samples_leaf': 46, 'criterion': 'gini'}.
Trial 68 finished with value: 0.5108695652173914 and parameters: {'n_estimators': 346, 'max_depth': 14, 'min_samples_split': 188, 'min_samples_leaf': 54, 'criterion': 'entropy'}.
Trial 69 finished with value: 0.5108695652173914 and parameters: {'n_estimators': 489, 'max_depth': 10, 'min_samples_split': 193, 'min_samples_leaf': 63, 'criterion': 'entropy'}.
Trial 70 finished with value: 0.4891304347826087 and parameters: {'n_estimators': 414, 'max_depth': 36, 'min_samples_split': 159, 'min_samples_leaf': 38, 'criterion': 'entropy'}.
Trial 71 finished with value: 0.5217391304347826 and parameters: {'n_estimators': 232, 'max_depth': 6, 'min_samples_split': 133, 'min_samples_leaf': 26, 'criterion': 'entropy'}.
Trial 72 finished with value: 0.5108695652173914 and parameters: {'n_estimators': 208, 'max_depth': 15, 'min_samples_split': 145, 'min_samples_leaf': 9, 'criterion': 'entropy'}.
Trial 73 finished with value: 0.4891304347826087 and parameters: {'n_estimators': 282, 'max_depth': 10, 'min_samples_split': 177, 'min_samples_leaf': 22, 'criterion': 'entropy'}.
Trial 74 finished with value: 0.5217391304347826 and parameters: {'n_estimators': 320, 'max_depth': 21, 'min_samples_split': 166, 'min_samples_leaf': 44, 'criterion': 'entropy'}.
Trial 75 finished with value: 0.4673913043478261 and parameters: {'n_estimators': 238, 'max_depth': 19, 'min_samples_split': 138, 'min_samples_leaf': 30, 'criterion': 'entropy'}.
Trial 76 finished with value: 0.4891304347826087 and parameters: {'n_estimators': 461, 'max_depth': 28, 'min_samples_split': 112, 'min_samples_leaf': 16, 'criterion': 'entropy'}.
Trial 77 finished with value: 0.5108695652173914 and parameters: {'n_estimators': 516, 'max_depth': 5, 'min_samples_split': 187, 'min_samples_leaf': 49, 'criterion': 'entropy'}.
Trial 78 finished with value: 0.5543478260869565 and parameters: {'n_estimators': 203, 'max_depth': 16, 'min_samples_split': 195, 'min_samples_leaf': 74, 'criterion': 'gini'}.
Trial 79 finished with value: 0.5434782608695652 and parameters: {'n_estimators': 269, 'max_depth': 55, 'min_samples_split': 181, 'min_samples_leaf': 55, 'criterion': 'entropy'}.
Trial 80 finished with value: 0.5 and parameters: {'n_estimators': 437, 'max_depth': 26, 'min_samples_split': 172, 'min_samples_leaf': 67, 'criterion': 'entropy'}.
Trial 81 finished with value: 0.5108695652173914 and parameters: {'n_estimators': 391, 'max_depth': 45, 'min_samples_split': 189, 'min_samples_leaf': 58, 'criterion': 'entropy'}.
Trial 82 finished with value: 0.5434782608695652 and parameters: {'n_estimators': 334, 'max_depth': 44, 'min_samples_split': 200, 'min_samples_leaf': 52, 'criterion': 'entropy'}.
Trial 83 finished with value: 0.5217391304347826 and parameters: {'n_estimators': 296, 'max_depth': 50, 'min_samples_split': 79, 'min_samples_leaf': 69, 'criterion': 'entropy'}.
Trial 84 finished with value: 0.5217391304347826 and parameters: {'n_estimators': 365, 'max_depth': 42, 'min_samples_split': 185, 'min_samples_leaf': 43, 'criterion': 'entropy'}.
Trial 85 finished with value: 0.5 and parameters: {'n_estimators': 422, 'max_depth': 31, 'min_samples_split': 193, 'min_samples_leaf': 36, 'criterion': 'entropy'}.
Trial 86 finished with value: 0.5543478260869565 and parameters: {'n_estimators': 476, 'max_depth': 23, 'min_samples_split': 162, 'min_samples_leaf': 64, 'criterion': 'gini'}.
Trial 87 finished with value: 0.532608695652174 and parameters: {'n_estimators': 307, 'max_depth': 39, 'min_samples_split': 153, 'min_samples_leaf': 77, 'criterion': 'entropy'}.
Trial 88 finished with value: 0.5434782608695652 and parameters: {'n_estimators': 398, 'max_depth': 48, 'min_samples_split': 176, 'min_samples_leaf': 60, 'criterion': 'entropy'}.
Trial 89 finished with value: 0.5434782608695652 and parameters: {'n_estimators': 358, 'max_depth': 35, 'min_samples_split': 182, 'min_samples_leaf': 83, 'criterion': 'entropy'}.
Trial 90 finished with value: 0.5652173913043478 and parameters: {'n_estimators': 565, 'max_depth': 57, 'min_samples_split': 196, 'min_samples_leaf': 47, 'criterion': 'gini'}.
Trial 91 finished with value: 0.5434782608695652 and parameters: {'n_estimators': 559, 'max_depth': 52, 'min_samples_split': 196, 'min_samples_leaf': 48, 'criterion': 'gini'}.
Trial 92 finished with value: 0.5434782608695652 and parameters: {'n_estimators': 530, 'max_depth': 57, 'min_samples_split': 189, 'min_samples_leaf': 51, 'criterion': 'gini'}.
Trial 93 finished with value: 0.5434782608695652 and parameters: {'n_estimators': 592, 'max_depth': 63, 'min_samples_split': 191, 'min_samples_leaf': 45, 'criterion': 'gini'}.
Trial 94 finished with value: 0.5 and parameters: {'n_estimators': 454, 'max_depth': 9, 'min_samples_split': 169, 'min_samples_leaf': 34, 'criterion': 'gini'}.
Trial 95 finished with value: 0.5108695652173914 and parameters: {'n_estimators': 688, 'max_depth': 71, 'min_samples_split': 197, 'min_samples_leaf': 30, 'criterion': 'gini'}.
Trial 96 finished with value: 0.532608695652174 and parameters: {'n_estimators': 504, 'max_depth': 62, 'min_samples_split': 184, 'min_samples_leaf': 39, 'criterion': 'entropy'}.
Trial 97 finished with value: 0.532608695652174 and parameters: {'n_estimators': 621, 'max_depth': 12, 'min_samples_split': 179, 'min_samples_leaf': 73, 'criterion': 'gini'}.
Trial 98 finished with value: 0.5217391304347826 and parameters: {'n_estimators': 264, 'max_depth': 42, 'min_samples_split': 172, 'min_samples_leaf': 41, 'criterion': 'entropy'}.
Trial 99 finished with value: 0.5543478260869565 and parameters: {'n_estimators': 543, 'max_depth': 55, 'min_samples_split': 193, 'min_samples_leaf': 48, 'criterion': 'entropy'}.
Trial 100 finished with value: 0.5543478260869565 and parameters: {'n_estimators': 337, 'max_depth': 22, 'min_samples_split': 200, 'min_samples_leaf': 53, 'criterion': 'entropy'}.
Trial 101 finished with value: 0.5434782608695652 and parameters: {'n_estimators': 288, 'max_depth': 18, 'min_samples_split': 189, 'min_samples_leaf': 72, 'criterion': 'entropy'}.
Trial 102 finished with value: 0.5434782608695652 and parameters: {'n_estimators': 240, 'max_depth': 20, 'min_samples_split': 125, 'min_samples_leaf': 81, 'criterion': 'entropy'}.
Trial 103 finished with value: 0.5434782608695652 and parameters: {'n_estimators': 375, 'max_depth': 29, 'min_samples_split': 184, 'min_samples_leaf': 80, 'criterion': 'entropy'}.
Trial 104 finished with value: 0.5652173913043478 and parameters: {'n_estimators': 316, 'max_depth': 67, 'min_samples_split': 192, 'min_samples_leaf': 97, 'criterion': 'entropy'}.
Trial 105 finished with value: 0.5543478260869565 and parameters: {'n_estimators': 322, 'max_depth': 71, 'min_samples_split': 197, 'min_samples_leaf': 94, 'criterion': 'entropy'}.
Trial 106 finished with value: 0.5543478260869565 and parameters: {'n_estimators': 224, 'max_depth': 77, 'min_samples_split': 93, 'min_samples_leaf': 98, 'criterion': 'entropy'}.
Trial 107 finished with value: 0.532608695652174 and parameters: {'n_estimators': 403, 'max_depth': 66, 'min_samples_split': 177, 'min_samples_leaf': 91, 'criterion': 'gini'}.
Trial 108 finished with value: 0.5217391304347826 and parameters: {'n_estimators': 578, 'max_depth': 88, 'min_samples_split': 5, 'min_samples_leaf': 1, 'criterion': 'entropy'}.
Trial 109 finished with value: 0.5652173913043478 and parameters: {'n_estimators': 435, 'max_depth': 50, 'min_samples_split': 186, 'min_samples_leaf': 97, 'criterion': 'entropy'}.
Trial 110 finished with value: 0.5108695652173914 and parameters: {'n_estimators': 440, 'max_depth': 59, 'min_samples_split': 157, 'min_samples_leaf': 86, 'criterion': 'entropy'}.
Trial 111 finished with value: 0.532608695652174 and parameters: {'n_estimators': 430, 'max_depth': 46, 'min_samples_split': 188, 'min_samples_leaf': 100, 'criterion': 'entropy'}.
Trial 112 finished with value: 0.5543478260869565 and parameters: {'n_estimators': 483, 'max_depth': 51, 'min_samples_split': 193, 'min_samples_leaf': 89, 'criterion': 'entropy'}.
Trial 113 finished with value: 0.5652173913043478 and parameters: {'n_estimators': 351, 'max_depth': 68, 'min_samples_split': 181, 'min_samples_leaf': 97, 'criterion': 'entropy'}.
Trial 114 finished with value: 0.532608695652174 and parameters: {'n_estimators': 360, 'max_depth': 66, 'min_samples_split': 179, 'min_samples_leaf': 93, 'criterion': 'entropy'}.
Trial 115 finished with value: 0.5652173913043478 and parameters: {'n_estimators': 320, 'max_depth': 74, 'min_samples_split': 174, 'min_samples_leaf': 95, 'criterion': 'entropy'}.
Trial 116 finished with value: 0.5652173913043478 and parameters: {'n_estimators': 314, 'max_depth': 69, 'min_samples_split': 174, 'min_samples_leaf': 97, 'criterion': 'entropy'}.
Trial 117 finished with value: 0.5652173913043478 and parameters: {'n_estimators': 378, 'max_depth': 68, 'min_samples_split': 173, 'min_samples_leaf': 97, 'criterion': 'entropy'}.
Trial 118 finished with value: 0.5652173913043478 and parameters: {'n_estimators': 346, 'max_depth': 75, 'min_samples_split': 168, 'min_samples_leaf': 97, 'criterion': 'entropy'}.
Trial 119 finished with value: 0.5652173913043478 and parameters: {'n_estimators': 345, 'max_depth': 68, 'min_samples_split': 174, 'min_samples_leaf': 97, 'criterion': 'entropy'}.
Trial 120 finished with value: 0.5652173913043478 and parameters: {'n_estimators': 332, 'max_depth': 75, 'min_samples_split': 168, 'min_samples_leaf': 97, 'criterion': 'entropy'}.
Trial 121 finished with value: 0.5543478260869565 and parameters: {'n_estimators': 342, 'max_depth': 75, 'min_samples_split': 172, 'min_samples_leaf': 98, 'criterion': 'entropy'}.
Trial 122 finished with value: 0.5652173913043478 and parameters: {'n_estimators': 313, 'max_depth': 69, 'min_samples_split': 168, 'min_samples_leaf': 97, 'criterion': 'entropy'}.
Trial 123 finished with value: 0.5217391304347826 and parameters: {'n_estimators': 380, 'max_depth': 80, 'min_samples_split': 164, 'min_samples_leaf': 92, 'criterion': 'entropy'}.
Trial 124 finished with value: 0.5652173913043478 and parameters: {'n_estimators': 327, 'max_depth': 68, 'min_samples_split': 174, 'min_samples_leaf': 96, 'criterion': 'entropy'}.
Trial 125 finished with value: 0.532608695652174 and parameters: {'n_estimators': 347, 'max_depth': 80, 'min_samples_split': 150, 'min_samples_leaf': 89, 'criterion': 'entropy'}.
Trial 126 finished with value: 0.5434782608695652 and parameters: {'n_estimators': 365, 'max_depth': 74, 'min_samples_split': 182, 'min_samples_leaf': 100, 'criterion': 'entropy'}.
Trial 127 finished with value: 0.5652173913043478 and parameters: {'n_estimators': 304, 'max_depth': 77, 'min_samples_split': 175, 'min_samples_leaf': 96, 'criterion': 'entropy'}.
Trial 128 finished with value: 0.532608695652174 and parameters: {'n_estimators': 326, 'max_depth': 82, 'min_samples_split': 169, 'min_samples_leaf': 95, 'criterion': 'gini'}.
Trial 129 finished with value: 0.5434782608695652 and parameters: {'n_estimators': 378, 'max_depth': 69, 'min_samples_split': 181, 'min_samples_leaf': 98, 'criterion': 'entropy'}.
