Trial 6568 finished with value: 0.6847826086956522 and parameters: {'n_estimators': 251, 'max_depth': 7, 'min_samples_split': 34, 'min_samples_leaf': 56, 'criterion': 'gini'}.
Trial 6569 finished with value: 0.6739130434782609 and parameters: {'n_estimators': 374, 'max_depth': 84, 'min_samples_split': 23, 'min_samples_leaf': 64, 'criterion': 'entropy'}.
Trial 6570 finished with value: 0.7065217391304348 and parameters: {'n_estimators': 228, 'max_depth': 11, 'min_samples_split': 29, 'min_samples_leaf': 57, 'criterion': 'gini'}.
Trial 6571 finished with value: 0.6956521739130435 and parameters: {'n_estimators': 346, 'max_depth': 14, 'min_samples_split': 36, 'min_samples_leaf': 71, 'criterion': 'entropy'}.
Trial 6572 finished with value: 0.7282608695652174 and parameters: {'n_estimators': 277, 'max_depth': 9, 'min_samples_split': 43, 'min_samples_leaf': 74, 'criterion': 'gini'}.
Trial 6573 finished with value: 0.7282608695652174 and parameters: {'n_estimators': 299, 'max_depth': 11, 'min_samples_split': 131, 'min_samples_leaf': 59, 'criterion': 'entropy'}.
Trial 6574 finished with value: 0.6739130434782609 and parameters: {'n_estimators': 624, 'max_depth': 7, 'min_samples_split': 31, 'min_samples_leaf': 53, 'criterion': 'gini'}.
Trial 6575 finished with value: 0.6847826086956522 and parameters: {'n_estimators': 449, 'max_depth': 12, 'min_samples_split': 26, 'min_samples_leaf': 61, 'criterion': 'entropy'}.
Trial 6576 finished with value: 0.7065217391304348 and parameters: {'n_estimators': 759, 'max_depth': 9, 'min_samples_split': 121, 'min_samples_leaf': 76, 'criterion': 'entropy'}.
Trial 6577 finished with value: 0.6630434782608695 and parameters: {'n_estimators': 262, 'max_depth': 16, 'min_samples_split': 52, 'min_samples_leaf': 58, 'criterion': 'gini'}.
Trial 6578 finished with value: 0.7065217391304348 and parameters: {'n_estimators': 803, 'max_depth': 14, 'min_samples_split': 115, 'min_samples_leaf': 66, 'criterion': 'entropy'}.
Trial 6579 finished with value: 0.7065217391304348 and parameters: {'n_estimators': 323, 'max_depth': 10, 'min_samples_split': 135, 'min_samples_leaf': 33, 'criterion': 'gini'}.
Trial 6580 finished with value: 0.6630434782608695 and parameters: {'n_estimators': 164, 'max_depth': 75, 'min_samples_split': 21, 'min_samples_leaf': 54, 'criterion': 'entropy'}.
Trial 6581 finished with value: 0.7065217391304348 and parameters: {'n_estimators': 243, 'max_depth': 8, 'min_samples_split': 40, 'min_samples_leaf': 63, 'criterion': 'gini'}.
Trial 6582 finished with value: 0.6956521739130435 and parameters: {'n_estimators': 288, 'max_depth': 18, 'min_samples_split': 5, 'min_samples_leaf': 82, 'criterion': 'entropy'}.
Trial 6583 finished with value: 0.717391304347826 and parameters: {'n_estimators': 682, 'max_depth': 12, 'min_samples_split': 140, 'min_samples_leaf': 57, 'criterion': 'gini'}.
Trial 6584 finished with value: 0.6304347826086957 and parameters: {'n_estimators': 270, 'max_depth': 5, 'min_samples_split': 105, 'min_samples_leaf': 60, 'criterion': 'entropy'}.
Trial 6585 finished with value: 0.6739130434782609 and parameters: {'n_estimators': 198, 'max_depth': 59, 'min_samples_split': 13, 'min_samples_leaf': 73, 'criterion': 'entropy'}.
Trial 6586 finished with value: 0.7282608695652174 and parameters: {'n_estimators': 308, 'max_depth': 10, 'min_samples_split': 35, 'min_samples_leaf': 55, 'criterion': 'gini'}.
Trial 6587 finished with value: 0.6956521739130435 and parameters: {'n_estimators': 745, 'max_depth': 7, 'min_samples_split': 127, 'min_samples_leaf': 59, 'criterion': 'entropy'}.
Trial 6588 finished with value: 0.7065217391304348 and parameters: {'n_estimators': 777, 'max_depth': 13, 'min_samples_split': 30, 'min_samples_leaf': 69, 'criterion': 'gini'}.
Trial 6589 finished with value: 0.6739130434782609 and parameters: {'n_estimators': 251, 'max_depth': 15, 'min_samples_split': 17, 'min_samples_leaf': 62, 'criterion': 'entropy'}.
Trial 6590 finished with value: 0.717391304347826 and parameters: {'n_estimators': 276, 'max_depth': 11, 'min_samples_split': 25, 'min_samples_leaf': 58, 'criterion': 'gini'}.
Trial 6591 finished with value: 0.6956521739130435 and parameters: {'n_estimators': 233, 'max_depth': 8, 'min_samples_split': 33, 'min_samples_leaf': 71, 'criterion': 'entropy'}.
Trial 6592 finished with value: 0.7282608695652174 and parameters: {'n_estimators': 289, 'max_depth': 10, 'min_samples_split': 38, 'min_samples_leaf': 52, 'criterion': 'gini'}.
Trial 6593 finished with value: 0.6739130434782609 and parameters: {'n_estimators': 315, 'max_depth': 13, 'min_samples_split': 44, 'min_samples_leaf': 56, 'criterion': 'entropy'}.
Trial 6594 finished with value: 0.6847826086956522 and parameters: {'n_estimators': 261, 'max_depth': 7, 'min_samples_split': 28, 'min_samples_leaf': 64, 'criterion': 'entropy'}.
Trial 6595 finished with value: 0.6739130434782609 and parameters: {'n_estimators': 728, 'max_depth': 96, 'min_samples_split': 22, 'min_samples_leaf': 61, 'criterion': 'gini'}.
Trial 6596 finished with value: 0.6847826086956522 and parameters: {'n_estimators': 354, 'max_depth': 12, 'min_samples_split': 109, 'min_samples_leaf': 77, 'criterion': 'entropy'}.
Trial 6597 finished with value: 0.6847826086956522 and parameters: {'n_estimators': 214, 'max_depth': 9, 'min_samples_split': 139, 'min_samples_leaf': 57, 'criterion': 'gini'}.
Trial 6598 finished with value: 0.6956521739130435 and parameters: {'n_estimators': 299, 'max_depth': 15, 'min_samples_split': 35, 'min_samples_leaf': 60, 'criterion': 'entropy'}.
Trial 6599 finished with value: 0.6413043478260869 and parameters: {'n_estimators': 506, 'max_depth': 5, 'min_samples_split': 134, 'min_samples_leaf': 54, 'criterion': 'gini'}.
Trial 6600 finished with value: 0.6956521739130435 and parameters: {'n_estimators': 284, 'max_depth': 11, 'min_samples_split': 31, 'min_samples_leaf': 67, 'criterion': 'entropy'}.
Trial 6601 finished with value: 0.717391304347826 and parameters: {'n_estimators': 336, 'max_depth': 8, 'min_samples_split': 41, 'min_samples_leaf': 58, 'criterion': 'gini'}.
Trial 6602 finished with value: 0.717391304347826 and parameters: {'n_estimators': 767, 'max_depth': 10, 'min_samples_split': 117, 'min_samples_leaf': 62, 'criterion': 'entropy'}.
Trial 6603 finished with value: 0.717391304347826 and parameters: {'n_estimators': 799, 'max_depth': 13, 'min_samples_split': 26, 'min_samples_leaf': 51, 'criterion': 'entropy'}.
Trial 6604 finished with value: 0.6847826086956522 and parameters: {'n_estimators': 254, 'max_depth': 20, 'min_samples_split': 36, 'min_samples_leaf': 55, 'criterion': 'gini'}.
Trial 6605 finished with value: 0.6847826086956522 and parameters: {'n_estimators': 271, 'max_depth': 17, 'min_samples_split': 32, 'min_samples_leaf': 65, 'criterion': 'entropy'}.
Trial 6606 finished with value: 0.7065217391304348 and parameters: {'n_estimators': 300, 'max_depth': 7, 'min_samples_split': 19, 'min_samples_leaf': 74, 'criterion': 'gini'}.
Trial 6607 finished with value: 0.717391304347826 and parameters: {'n_estimators': 697, 'max_depth': 11, 'min_samples_split': 49, 'min_samples_leaf': 57, 'criterion': 'entropy'}.
Trial 6608 finished with value: 0.6956521739130435 and parameters: {'n_estimators': 234, 'max_depth': 9, 'min_samples_split': 129, 'min_samples_leaf': 60, 'criterion': 'gini'}.
Trial 6609 finished with value: 0.6956521739130435 and parameters: {'n_estimators': 755, 'max_depth': 14, 'min_samples_split': 38, 'min_samples_leaf': 72, 'criterion': 'entropy'}.
Trial 6610 finished with value: 0.6847826086956522 and parameters: {'n_estimators': 278, 'max_depth': 6, 'min_samples_split': 24, 'min_samples_leaf': 59, 'criterion': 'gini'}.
Trial 6611 finished with value: 0.6956521739130435 and parameters: {'n_estimators': 317, 'max_depth': 12, 'min_samples_split': 32, 'min_samples_leaf': 53, 'criterion': 'entropy'}.
Trial 6612 finished with value: 0.7065217391304348 and parameters: {'n_estimators': 250, 'max_depth': 9, 'min_samples_split': 139, 'min_samples_leaf': 63, 'criterion': 'gini'}.
Trial 6613 finished with value: 0.6847826086956522 and parameters: {'n_estimators': 716, 'max_depth': 15, 'min_samples_split': 42, 'min_samples_leaf': 69, 'criterion': 'entropy'}.
Trial 6614 finished with value: 0.7065217391304348 and parameters: {'n_estimators': 783, 'max_depth': 11, 'min_samples_split': 27, 'min_samples_leaf': 56, 'criterion': 'entropy'}.
Trial 6615 finished with value: 0.6956521739130435 and parameters: {'n_estimators': 265, 'max_depth': 7, 'min_samples_split': 124, 'min_samples_leaf': 61, 'criterion': 'gini'}.
Trial 6616 finished with value: 0.717391304347826 and parameters: {'n_estimators': 289, 'max_depth': 13, 'min_samples_split': 38, 'min_samples_leaf': 59, 'criterion': 'entropy'}.
Trial 6617 finished with value: 0.7282608695652174 and parameters: {'n_estimators': 334, 'max_depth': 9, 'min_samples_split': 68, 'min_samples_leaf': 57, 'criterion': 'gini'}.
Trial 6618 finished with value: 0.6847826086956522 and parameters: {'n_estimators': 302, 'max_depth': 11, 'min_samples_split': 30, 'min_samples_leaf': 75, 'criterion': 'entropy'}.
Trial 6619 finished with value: 0.7065217391304348 and parameters: {'n_estimators': 904, 'max_depth': 8, 'min_samples_split': 92, 'min_samples_leaf': 54, 'criterion': 'gini'}.
Trial 6620 finished with value: 0.7065217391304348 and parameters: {'n_estimators': 745, 'max_depth': 14, 'min_samples_split': 46, 'min_samples_leaf': 64, 'criterion': 'entropy'}.
Trial 6621 finished with value: 0.6630434782608695 and parameters: {'n_estimators': 268, 'max_depth': 5, 'min_samples_split': 134, 'min_samples_leaf': 71, 'criterion': 'gini'}.
Trial 6622 finished with value: 0.6847826086956522 and parameters: {'n_estimators': 399, 'max_depth': 17, 'min_samples_split': 22, 'min_samples_leaf': 59, 'criterion': 'entropy'}.
Trial 6623 finished with value: 0.6847826086956522 and parameters: {'n_estimators': 235, 'max_depth': 10, 'min_samples_split': 34, 'min_samples_leaf': 67, 'criterion': 'entropy'}.
Trial 6624 finished with value: 0.7065217391304348 and parameters: {'n_estimators': 317, 'max_depth': 12, 'min_samples_split': 28, 'min_samples_leaf': 62, 'criterion': 'gini'}.
Trial 6625 finished with value: 0.7065217391304348 and parameters: {'n_estimators': 946, 'max_depth': 8, 'min_samples_split': 141, 'min_samples_leaf': 51, 'criterion': 'entropy'}.
Trial 6626 finished with value: 0.717391304347826 and parameters: {'n_estimators': 273, 'max_depth': 10, 'min_samples_split': 120, 'min_samples_leaf': 56, 'criterion': 'gini'}.
Trial 6627 finished with value: 0.7391304347826086 and parameters: {'n_estimators': 769, 'max_depth': 13, 'min_samples_split': 17, 'min_samples_leaf': 58, 'criterion': 'entropy'}.
Trial 6628 finished with value: 0.6956521739130435 and parameters: {'n_estimators': 174, 'max_depth': 7, 'min_samples_split': 38, 'min_samples_leaf': 61, 'criterion': 'gini'}.
Trial 6629 finished with value: 0.6847826086956522 and parameters: {'n_estimators': 291, 'max_depth': 16, 'min_samples_split': 12, 'min_samples_leaf': 55, 'criterion': 'entropy'}.
Trial 6630 finished with value: 0.7065217391304348 and parameters: {'n_estimators': 214, 'max_depth': 11, 'min_samples_split': 25, 'min_samples_leaf': 80, 'criterion': 'gini'}.
Trial 6631 finished with value: 0.7065217391304348 and parameters: {'n_estimators': 251, 'max_depth': 9, 'min_samples_split': 30, 'min_samples_leaf': 73, 'criterion': 'entropy'}.
Trial 6632 finished with value: 0.6956521739130435 and parameters: {'n_estimators': 485, 'max_depth': 14, 'min_samples_split': 34, 'min_samples_leaf': 60, 'criterion': 'entropy'}.
Trial 6633 finished with value: 0.6739130434782609 and parameters: {'n_estimators': 429, 'max_depth': 6, 'min_samples_split': 136, 'min_samples_leaf': 57, 'criterion': 'gini'}.
Trial 6634 finished with value: 0.6956521739130435 and parameters: {'n_estimators': 731, 'max_depth': 12, 'min_samples_split': 131, 'min_samples_leaf': 70, 'criterion': 'entropy'}.
Trial 6635 finished with value: 0.6739130434782609 and parameters: {'n_estimators': 798, 'max_depth': 9, 'min_samples_split': 42, 'min_samples_leaf': 65, 'criterion': 'gini'}.
Trial 6636 finished with value: 0.717391304347826 and parameters: {'n_estimators': 361, 'max_depth': 11, 'min_samples_split': 36, 'min_samples_leaf': 53, 'criterion': 'entropy'}.
Trial 6637 finished with value: 0.7065217391304348 and parameters: {'n_estimators': 283, 'max_depth': 7, 'min_samples_split': 22, 'min_samples_leaf': 59, 'criterion': 'gini'}.
Trial 6638 finished with value: 0.6739130434782609 and parameters: {'n_estimators': 311, 'max_depth': 15, 'min_samples_split': 28, 'min_samples_leaf': 77, 'criterion': 'entropy'}.
Trial 6639 finished with value: 0.7065217391304348 and parameters: {'n_estimators': 259, 'max_depth': 10, 'min_samples_split': 141, 'min_samples_leaf': 62, 'criterion': 'gini'}.
Trial 6640 finished with value: 0.6956521739130435 and parameters: {'n_estimators': 297, 'max_depth': 13, 'min_samples_split': 113, 'min_samples_leaf': 55, 'criterion': 'entropy'}.
Trial 6641 finished with value: 0.6630434782608695 and parameters: {'n_estimators': 240, 'max_depth': 5, 'min_samples_split': 126, 'min_samples_leaf': 68, 'criterion': 'entropy'}.
Trial 6642 finished with value: 0.7065217391304348 and parameters: {'n_estimators': 278, 'max_depth': 9, 'min_samples_split': 31, 'min_samples_leaf': 94, 'criterion': 'gini'}.
Trial 6643 finished with value: 0.7065217391304348 and parameters: {'n_estimators': 636, 'max_depth': 8, 'min_samples_split': 100, 'min_samples_leaf': 58, 'criterion': 'entropy'}.
Trial 6644 finished with value: 0.6956521739130435 and parameters: {'n_estimators': 761, 'max_depth': 18, 'min_samples_split': 19, 'min_samples_leaf': 63, 'criterion': 'gini'}.
Trial 6645 finished with value: 0.717391304347826 and parameters: {'n_estimators': 575, 'max_depth': 11, 'min_samples_split': 40, 'min_samples_leaf': 60, 'criterion': 'entropy'}.
Trial 6646 finished with value: 0.6847826086956522 and parameters: {'n_estimators': 339, 'max_depth': 13, 'min_samples_split': 35, 'min_samples_leaf': 56, 'criterion': 'gini'}.
Trial 6647 finished with value: 0.6630434782608695 and parameters: {'n_estimators': 263, 'max_depth': 7, 'min_samples_split': 26, 'min_samples_leaf': 53, 'criterion': 'entropy'}.
Trial 6648 finished with value: 0.6847826086956522 and parameters: {'n_estimators': 319, 'max_depth': 10, 'min_samples_split': 46, 'min_samples_leaf': 75, 'criterion': 'gini'}.
Trial 6649 finished with value: 0.6847826086956522 and parameters: {'n_estimators': 222, 'max_depth': 15, 'min_samples_split': 32, 'min_samples_leaf': 72, 'criterion': 'entropy'}.
Trial 6650 finished with value: 0.6956521739130435 and parameters: {'n_estimators': 294, 'max_depth': 12, 'min_samples_split': 23, 'min_samples_leaf': 66, 'criterion': 'entropy'}.
Trial 6651 finished with value: 0.717391304347826 and parameters: {'n_estimators': 784, 'max_depth': 8, 'min_samples_split': 77, 'min_samples_leaf': 57, 'criterion': 'gini'}.
Trial 6652 finished with value: 0.6956521739130435 and parameters: {'n_estimators': 740, 'max_depth': 10, 'min_samples_split': 39, 'min_samples_leaf': 61, 'criterion': 'entropy'}.
Trial 6653 finished with value: 0.717391304347826 and parameters: {'n_estimators': 708, 'max_depth': 12, 'min_samples_split': 118, 'min_samples_leaf': 59, 'criterion': 'gini'}.
Trial 6654 finished with value: 0.6413043478260869 and parameters: {'n_estimators': 147, 'max_depth': 5, 'min_samples_split': 140, 'min_samples_leaf': 64, 'criterion': 'entropy'}.
Trial 6655 finished with value: 0.6847826086956522 and parameters: {'n_estimators': 251, 'max_depth': 14, 'min_samples_split': 135, 'min_samples_leaf': 55, 'criterion': 'gini'}.
Trial 6656 finished with value: 0.7065217391304348 and parameters: {'n_estimators': 279, 'max_depth': 9, 'min_samples_split': 105, 'min_samples_leaf': 58, 'criterion': 'entropy'}.
Trial 6657 finished with value: 0.6739130434782609 and parameters: {'n_estimators': 114, 'max_depth': 12, 'min_samples_split': 28, 'min_samples_leaf': 61, 'criterion': 'gini'}.
Trial 6658 finished with value: 0.6739130434782609 and parameters: {'n_estimators': 306, 'max_depth': 16, 'min_samples_split': 16, 'min_samples_leaf': 51, 'criterion': 'entropy'}.
Trial 6659 finished with value: 0.6956521739130435 and parameters: {'n_estimators': 269, 'max_depth': 7, 'min_samples_split': 35, 'min_samples_leaf': 70, 'criterion': 'entropy'}.
Trial 6660 finished with value: 0.7065217391304348 and parameters: {'n_estimators': 332, 'max_depth': 10, 'min_samples_split': 33, 'min_samples_leaf': 57, 'criterion': 'gini'}.
Trial 6661 finished with value: 0.6956521739130435 and parameters: {'n_estimators': 657, 'max_depth': 8, 'min_samples_split': 43, 'min_samples_leaf': 54, 'criterion': 'entropy'}.
Trial 6662 finished with value: 0.6739130434782609 and parameters: {'n_estimators': 250, 'max_depth': 14, 'min_samples_split': 130, 'min_samples_leaf': 73, 'criterion': 'gini'}.
Trial 6663 finished with value: 0.6847826086956522 and parameters: {'n_estimators': 290, 'max_depth': 26, 'min_samples_split': 122, 'min_samples_leaf': 60, 'criterion': 'entropy'}.
Trial 6664 finished with value: 0.717391304347826 and parameters: {'n_estimators': 751, 'max_depth': 11, 'min_samples_split': 24, 'min_samples_leaf': 63, 'criterion': 'gini'}.
Trial 6665 finished with value: 0.6739130434782609 and parameters: {'n_estimators': 228, 'max_depth': 6, 'min_samples_split': 38, 'min_samples_leaf': 56, 'criterion': 'entropy'}.
Trial 6666 finished with value: 0.6956521739130435 and parameters: {'n_estimators': 278, 'max_depth': 9, 'min_samples_split': 30, 'min_samples_leaf': 58, 'criterion': 'gini'}.
Trial 6667 finished with value: 0.6956521739130435 and parameters: {'n_estimators': 306, 'max_depth': 12, 'min_samples_split': 137, 'min_samples_leaf': 68, 'criterion': 'entropy'}.
Trial 6668 finished with value: 0.6630434782608695 and parameters: {'n_estimators': 886, 'max_depth': 19, 'min_samples_split': 19, 'min_samples_leaf': 60, 'criterion': 'gini'}.
Trial 6669 finished with value: 0.6847826086956522 and parameters: {'n_estimators': 193, 'max_depth': 16, 'min_samples_split': 49, 'min_samples_leaf': 53, 'criterion': 'entropy'}.
Trial 6670 finished with value: 0.6739130434782609 and parameters: {'n_estimators': 783, 'max_depth': 53, 'min_samples_split': 27, 'min_samples_leaf': 62, 'criterion': 'entropy'}.
Trial 6671 finished with value: 0.7065217391304348 and parameters: {'n_estimators': 732, 'max_depth': 10, 'min_samples_split': 142, 'min_samples_leaf': 55, 'criterion': 'gini'}.
Trial 6672 finished with value: 0.6739130434782609 and parameters: {'n_estimators': 803, 'max_depth': 13, 'min_samples_split': 33, 'min_samples_leaf': 87, 'criterion': 'entropy'}.
Trial 6673 finished with value: 0.6956521739130435 and parameters: {'n_estimators': 256, 'max_depth': 8, 'min_samples_split': 40, 'min_samples_leaf': 65, 'criterion': 'gini'}.
Trial 6674 finished with value: 0.6847826086956522 and parameters: {'n_estimators': 292, 'max_depth': 11, 'min_samples_split': 110, 'min_samples_leaf': 75, 'criterion': 'entropy'}.
Trial 6675 finished with value: 0.6847826086956522 and parameters: {'n_estimators': 766, 'max_depth': 6, 'min_samples_split': 11, 'min_samples_leaf': 59, 'criterion': 'gini'}.
Trial 6676 finished with value: 0.6956521739130435 and parameters: {'n_estimators': 320, 'max_depth': 14, 'min_samples_split': 36, 'min_samples_leaf': 57, 'criterion': 'entropy'}.
Trial 6677 finished with value: 0.717391304347826 and parameters: {'n_estimators': 239, 'max_depth': 9, 'min_samples_split': 128, 'min_samples_leaf': 71, 'criterion': 'gini'}.
Trial 6678 finished with value: 0.7065217391304348 and parameters: {'n_estimators': 265, 'max_depth': 12, 'min_samples_split': 29, 'min_samples_leaf': 51, 'criterion': 'entropy'}.
Trial 6679 finished with value: 0.6956521739130435 and parameters: {'n_estimators': 304, 'max_depth': 7, 'min_samples_split': 23, 'min_samples_leaf': 62, 'criterion': 'entropy'}.
Trial 6680 finished with value: 0.6956521739130435 and parameters: {'n_estimators': 279, 'max_depth': 11, 'min_samples_split': 178, 'min_samples_leaf': 78, 'criterion': 'gini'}.
Trial 6681 finished with value: 0.7065217391304348 and parameters: {'n_estimators': 376, 'max_depth': 9, 'min_samples_split': 32, 'min_samples_leaf': 58, 'criterion': 'entropy'}.
Trial 6682 finished with value: 0.6739130434782609 and parameters: {'n_estimators': 715, 'max_depth': 15, 'min_samples_split': 45, 'min_samples_leaf': 55, 'criterion': 'gini'}.
Trial 6683 finished with value: 0.6521739130434783 and parameters: {'n_estimators': 981, 'max_depth': 5, 'min_samples_split': 133, 'min_samples_leaf': 66, 'criterion': 'entropy'}.
Trial 6684 finished with value: 0.717391304347826 and parameters: {'n_estimators': 266, 'max_depth': 13, 'min_samples_split': 26, 'min_samples_leaf': 59, 'criterion': 'gini'}.
Trial 6685 finished with value: 0.6630434782608695 and parameters: {'n_estimators': 350, 'max_depth': 23, 'min_samples_split': 37, 'min_samples_leaf': 56, 'criterion': 'entropy'}.
Trial 6686 finished with value: 0.6739130434782609 and parameters: {'n_estimators': 289, 'max_depth': 17, 'min_samples_split': 20, 'min_samples_leaf': 73, 'criterion': 'gini'}.
Trial 6687 finished with value: 0.717391304347826 and parameters: {'n_estimators': 330, 'max_depth': 10, 'min_samples_split': 142, 'min_samples_leaf': 61, 'criterion': 'entropy'}.
Trial 6688 finished with value: 0.6956521739130435 and parameters: {'n_estimators': 246, 'max_depth': 8, 'min_samples_split': 43, 'min_samples_leaf': 68, 'criterion': 'entropy'}.
Trial 6689 finished with value: 0.717391304347826 and parameters: {'n_estimators': 308, 'max_depth': 12, 'min_samples_split': 97, 'min_samples_leaf': 57, 'criterion': 'gini'}.
Trial 6690 finished with value: 0.6956521739130435 and parameters: {'n_estimators': 749, 'max_depth': 10, 'min_samples_split': 116, 'min_samples_leaf': 64, 'criterion': 'entropy'}.
