Trial 3244 finished with value: 0.7065217391304348 and parameters: {'n_estimators': 228, 'max_depth': 10, 'min_samples_split': 120, 'min_samples_leaf': 70, 'criterion': 'gini'}.
Trial 3245 finished with value: 0.717391304347826 and parameters: {'n_estimators': 248, 'max_depth': 10, 'min_samples_split': 114, 'min_samples_leaf': 68, 'criterion': 'gini'}.
Trial 3246 finished with value: 0.7282608695652174 and parameters: {'n_estimators': 261, 'max_depth': 9, 'min_samples_split': 120, 'min_samples_leaf': 61, 'criterion': 'gini'}.
Trial 3247 finished with value: 0.7065217391304348 and parameters: {'n_estimators': 237, 'max_depth': 9, 'min_samples_split': 121, 'min_samples_leaf': 64, 'criterion': 'gini'}.
Trial 3248 finished with value: 0.7065217391304348 and parameters: {'n_estimators': 264, 'max_depth': 11, 'min_samples_split': 127, 'min_samples_leaf': 65, 'criterion': 'gini'}.
Trial 3249 finished with value: 0.7065217391304348 and parameters: {'n_estimators': 277, 'max_depth': 8, 'min_samples_split': 125, 'min_samples_leaf': 66, 'criterion': 'gini'}.
Trial 3250 finished with value: 0.6956521739130435 and parameters: {'n_estimators': 210, 'max_depth': 11, 'min_samples_split': 118, 'min_samples_leaf': 65, 'criterion': 'gini'}.
Trial 3251 finished with value: 0.6956521739130435 and parameters: {'n_estimators': 233, 'max_depth': 8, 'min_samples_split': 125, 'min_samples_leaf': 66, 'criterion': 'gini'}.
Trial 3252 finished with value: 0.7065217391304348 and parameters: {'n_estimators': 288, 'max_depth': 10, 'min_samples_split': 35, 'min_samples_leaf': 63, 'criterion': 'gini'}.
Trial 3253 finished with value: 0.7065217391304348 and parameters: {'n_estimators': 276, 'max_depth': 11, 'min_samples_split': 124, 'min_samples_leaf': 66, 'criterion': 'gini'}.
Trial 3254 finished with value: 0.6739130434782609 and parameters: {'n_estimators': 267, 'max_depth': 7, 'min_samples_split': 120, 'min_samples_leaf': 66, 'criterion': 'gini'}.
Trial 3255 finished with value: 0.6956521739130435 and parameters: {'n_estimators': 252, 'max_depth': 9, 'min_samples_split': 112, 'min_samples_leaf': 68, 'criterion': 'gini'}.
Trial 3256 finished with value: 0.7065217391304348 and parameters: {'n_estimators': 294, 'max_depth': 11, 'min_samples_split': 123, 'min_samples_leaf': 69, 'criterion': 'gini'}.
Trial 3257 finished with value: 0.6847826086956522 and parameters: {'n_estimators': 287, 'max_depth': 7, 'min_samples_split': 132, 'min_samples_leaf': 63, 'criterion': 'gini'}.
Trial 3258 finished with value: 0.7065217391304348 and parameters: {'n_estimators': 219, 'max_depth': 9, 'min_samples_split': 118, 'min_samples_leaf': 63, 'criterion': 'gini'}.
Trial 3259 finished with value: 0.7065217391304348 and parameters: {'n_estimators': 242, 'max_depth': 11, 'min_samples_split': 122, 'min_samples_leaf': 63, 'criterion': 'gini'}.
Trial 3260 finished with value: 0.7065217391304348 and parameters: {'n_estimators': 272, 'max_depth': 9, 'min_samples_split': 116, 'min_samples_leaf': 64, 'criterion': 'gini'}.
Trial 3261 finished with value: 0.7065217391304348 and parameters: {'n_estimators': 293, 'max_depth': 7, 'min_samples_split': 122, 'min_samples_leaf': 73, 'criterion': 'gini'}.
Trial 3262 finished with value: 0.7065217391304348 and parameters: {'n_estimators': 237, 'max_depth': 11, 'min_samples_split': 116, 'min_samples_leaf': 62, 'criterion': 'gini'}.
Trial 3263 finished with value: 0.6739130434782609 and parameters: {'n_estimators': 259, 'max_depth': 73, 'min_samples_split': 122, 'min_samples_leaf': 65, 'criterion': 'gini'}.
Trial 3264 finished with value: 0.7065217391304348 and parameters: {'n_estimators': 287, 'max_depth': 12, 'min_samples_split': 125, 'min_samples_leaf': 63, 'criterion': 'gini'}.
Trial 3265 finished with value: 0.6956521739130435 and parameters: {'n_estimators': 270, 'max_depth': 9, 'min_samples_split': 130, 'min_samples_leaf': 67, 'criterion': 'gini'}.
Trial 3266 finished with value: 0.7065217391304348 and parameters: {'n_estimators': 260, 'max_depth': 11, 'min_samples_split': 120, 'min_samples_leaf': 62, 'criterion': 'gini'}.
Trial 3267 finished with value: 0.6956521739130435 and parameters: {'n_estimators': 299, 'max_depth': 7, 'min_samples_split': 85, 'min_samples_leaf': 62, 'criterion': 'gini'}.
Trial 3268 finished with value: 0.7391304347826086 and parameters: {'n_estimators': 282, 'max_depth': 10, 'min_samples_split': 127, 'min_samples_leaf': 68, 'criterion': 'gini'}.
Trial 3269 finished with value: 0.7065217391304348 and parameters: {'n_estimators': 282, 'max_depth': 10, 'min_samples_split': 38, 'min_samples_leaf': 70, 'criterion': 'gini'}.
Trial 3270 finished with value: 0.7065217391304348 and parameters: {'n_estimators': 299, 'max_depth': 12, 'min_samples_split': 131, 'min_samples_leaf': 74, 'criterion': 'gini'}.
Trial 3271 finished with value: 0.7282608695652174 and parameters: {'n_estimators': 276, 'max_depth': 8, 'min_samples_split': 130, 'min_samples_leaf': 79, 'criterion': 'gini'}.
Trial 3272 finished with value: 0.6847826086956522 and parameters: {'n_estimators': 259, 'max_depth': 10, 'min_samples_split': 132, 'min_samples_leaf': 72, 'criterion': 'gini'}.
Trial 3273 finished with value: 0.6739130434782609 and parameters: {'n_estimators': 306, 'max_depth': 6, 'min_samples_split': 129, 'min_samples_leaf': 67, 'criterion': 'gini'}.
Trial 3274 finished with value: 0.6956521739130435 and parameters: {'n_estimators': 283, 'max_depth': 12, 'min_samples_split': 126, 'min_samples_leaf': 68, 'criterion': 'gini'}.
Trial 3275 finished with value: 0.7391304347826086 and parameters: {'n_estimators': 275, 'max_depth': 9, 'min_samples_split': 137, 'min_samples_leaf': 71, 'criterion': 'gini'}.
Trial 3276 finished with value: 0.6956521739130435 and parameters: {'n_estimators': 247, 'max_depth': 7, 'min_samples_split': 112, 'min_samples_leaf': 72, 'criterion': 'gini'}.
Trial 3277 finished with value: 0.6739130434782609 and parameters: {'n_estimators': 269, 'max_depth': 6, 'min_samples_split': 133, 'min_samples_leaf': 70, 'criterion': 'gini'}.
Trial 3278 finished with value: 0.7065217391304348 and parameters: {'n_estimators': 284, 'max_depth': 8, 'min_samples_split': 140, 'min_samples_leaf': 71, 'criterion': 'gini'}.
Trial 3279 finished with value: 0.6630434782608695 and parameters: {'n_estimators': 254, 'max_depth': 5, 'min_samples_split': 129, 'min_samples_leaf': 66, 'criterion': 'gini'}.
Trial 3280 finished with value: 0.7065217391304348 and parameters: {'n_estimators': 237, 'max_depth': 8, 'min_samples_split': 149, 'min_samples_leaf': 71, 'criterion': 'gini'}.
Trial 3281 finished with value: 0.6739130434782609 and parameters: {'n_estimators': 265, 'max_depth': 6, 'min_samples_split': 128, 'min_samples_leaf': 67, 'criterion': 'gini'}.
Trial 3282 finished with value: 0.7065217391304348 and parameters: {'n_estimators': 278, 'max_depth': 9, 'min_samples_split': 42, 'min_samples_leaf': 77, 'criterion': 'gini'}.
Trial 3283 finished with value: 0.6847826086956522 and parameters: {'n_estimators': 296, 'max_depth': 64, 'min_samples_split': 140, 'min_samples_leaf': 71, 'criterion': 'gini'}.
Trial 3284 finished with value: 0.7282608695652174 and parameters: {'n_estimators': 256, 'max_depth': 9, 'min_samples_split': 141, 'min_samples_leaf': 70, 'criterion': 'gini'}.
Trial 3285 finished with value: 0.6739130434782609 and parameters: {'n_estimators': 297, 'max_depth': 5, 'min_samples_split': 134, 'min_samples_leaf': 72, 'criterion': 'gini'}.
Trial 3286 finished with value: 0.717391304347826 and parameters: {'n_estimators': 277, 'max_depth': 8, 'min_samples_split': 136, 'min_samples_leaf': 63, 'criterion': 'gini'}.
Trial 3287 finished with value: 0.6956521739130435 and parameters: {'n_estimators': 301, 'max_depth': 11, 'min_samples_split': 138, 'min_samples_leaf': 70, 'criterion': 'gini'}.
Trial 3288 finished with value: 0.6847826086956522 and parameters: {'n_estimators': 229, 'max_depth': 7, 'min_samples_split': 137, 'min_samples_leaf': 68, 'criterion': 'gini'}.
Trial 3289 finished with value: 0.7065217391304348 and parameters: {'n_estimators': 255, 'max_depth': 10, 'min_samples_split': 136, 'min_samples_leaf': 66, 'criterion': 'gini'}.
Trial 3290 finished with value: 0.7391304347826086 and parameters: {'n_estimators': 268, 'max_depth': 9, 'min_samples_split': 143, 'min_samples_leaf': 74, 'criterion': 'gini'}.
Trial 3291 finished with value: 0.7065217391304348 and parameters: {'n_estimators': 237, 'max_depth': 8, 'min_samples_split': 145, 'min_samples_leaf': 71, 'criterion': 'gini'}.
Trial 3292 finished with value: 0.6630434782608695 and parameters: {'n_estimators': 269, 'max_depth': 5, 'min_samples_split': 138, 'min_samples_leaf': 74, 'criterion': 'gini'}.
Trial 3293 finished with value: 0.6847826086956522 and parameters: {'n_estimators': 246, 'max_depth': 6, 'min_samples_split': 145, 'min_samples_leaf': 77, 'criterion': 'gini'}.
Trial 3294 finished with value: 0.7065217391304348 and parameters: {'n_estimators': 275, 'max_depth': 7, 'min_samples_split': 147, 'min_samples_leaf': 73, 'criterion': 'gini'}.
Trial 3295 finished with value: 0.6956521739130435 and parameters: {'n_estimators': 257, 'max_depth': 7, 'min_samples_split': 135, 'min_samples_leaf': 74, 'criterion': 'gini'}.
Trial 3296 finished with value: 0.6630434782608695 and parameters: {'n_estimators': 229, 'max_depth': 5, 'min_samples_split': 147, 'min_samples_leaf': 74, 'criterion': 'gini'}.
Trial 3297 finished with value: 0.717391304347826 and parameters: {'n_estimators': 271, 'max_depth': 9, 'min_samples_split': 144, 'min_samples_leaf': 76, 'criterion': 'gini'}.
Trial 3298 finished with value: 0.7282608695652174 and parameters: {'n_estimators': 283, 'max_depth': 9, 'min_samples_split': 143, 'min_samples_leaf': 73, 'criterion': 'gini'}.
Trial 3299 finished with value: 0.6847826086956522 and parameters: {'n_estimators': 248, 'max_depth': 8, 'min_samples_split': 140, 'min_samples_leaf': 74, 'criterion': 'gini'}.
Trial 3300 finished with value: 0.7065217391304348 and parameters: {'n_estimators': 313, 'max_depth': 10, 'min_samples_split': 132, 'min_samples_leaf': 80, 'criterion': 'gini'}.
Trial 3301 finished with value: 0.6956521739130435 and parameters: {'n_estimators': 293, 'max_depth': 7, 'min_samples_split': 138, 'min_samples_leaf': 75, 'criterion': 'gini'}.
Trial 3302 finished with value: 0.7065217391304348 and parameters: {'n_estimators': 216, 'max_depth': 10, 'min_samples_split': 146, 'min_samples_leaf': 70, 'criterion': 'gini'}.
Trial 3303 finished with value: 0.6630434782608695 and parameters: {'n_estimators': 264, 'max_depth': 5, 'min_samples_split': 143, 'min_samples_leaf': 75, 'criterion': 'gini'}.
Trial 3304 finished with value: 0.6739130434782609 and parameters: {'n_estimators': 291, 'max_depth': 32, 'min_samples_split': 148, 'min_samples_leaf': 76, 'criterion': 'gini'}.
Trial 3305 finished with value: 0.7065217391304348 and parameters: {'n_estimators': 273, 'max_depth': 12, 'min_samples_split': 144, 'min_samples_leaf': 74, 'criterion': 'gini'}.
Trial 3306 finished with value: 0.7065217391304348 and parameters: {'n_estimators': 250, 'max_depth': 8, 'min_samples_split': 149, 'min_samples_leaf': 77, 'criterion': 'gini'}.
Trial 3307 finished with value: 0.6739130434782609 and parameters: {'n_estimators': 240, 'max_depth': 10, 'min_samples_split': 143, 'min_samples_leaf': 74, 'criterion': 'gini'}.
Trial 3308 finished with value: 0.7065217391304348 and parameters: {'n_estimators': 298, 'max_depth': 12, 'min_samples_split': 141, 'min_samples_leaf': 72, 'criterion': 'gini'}.
Trial 3309 finished with value: 0.6847826086956522 and parameters: {'n_estimators': 215, 'max_depth': 83, 'min_samples_split': 135, 'min_samples_leaf': 71, 'criterion': 'gini'}.
Trial 3310 finished with value: 0.7065217391304348 and parameters: {'n_estimators': 275, 'max_depth': 7, 'min_samples_split': 137, 'min_samples_leaf': 72, 'criterion': 'gini'}.
Trial 3311 finished with value: 0.6956521739130435 and parameters: {'n_estimators': 317, 'max_depth': 10, 'min_samples_split': 152, 'min_samples_leaf': 64, 'criterion': 'gini'}.
Trial 3312 finished with value: 0.7065217391304348 and parameters: {'n_estimators': 262, 'max_depth': 12, 'min_samples_split': 130, 'min_samples_leaf': 67, 'criterion': 'gini'}.
Trial 3313 finished with value: 0.717391304347826 and parameters: {'n_estimators': 310, 'max_depth': 9, 'min_samples_split': 142, 'min_samples_leaf': 72, 'criterion': 'gini'}.
Trial 3314 finished with value: 0.7065217391304348 and parameters: {'n_estimators': 288, 'max_depth': 7, 'min_samples_split': 153, 'min_samples_leaf': 76, 'criterion': 'gini'}.
Trial 3315 finished with value: 0.6630434782608695 and parameters: {'n_estimators': 232, 'max_depth': 60, 'min_samples_split': 146, 'min_samples_leaf': 78, 'criterion': 'gini'}.
Trial 3316 finished with value: 0.6956521739130435 and parameters: {'n_estimators': 262, 'max_depth': 13, 'min_samples_split': 126, 'min_samples_leaf': 69, 'criterion': 'gini'}.
Trial 3317 finished with value: 0.6739130434782609 and parameters: {'n_estimators': 308, 'max_depth': 49, 'min_samples_split': 138, 'min_samples_leaf': 70, 'criterion': 'gini'}.
Trial 3318 finished with value: 0.7065217391304348 and parameters: {'n_estimators': 281, 'max_depth': 11, 'min_samples_split': 141, 'min_samples_leaf': 72, 'criterion': 'gini'}.
Trial 3319 finished with value: 0.7065217391304348 and parameters: {'n_estimators': 255, 'max_depth': 9, 'min_samples_split': 133, 'min_samples_leaf': 71, 'criterion': 'gini'}.
Trial 3320 finished with value: 0.6739130434782609 and parameters: {'n_estimators': 287, 'max_depth': 6, 'min_samples_split': 128, 'min_samples_leaf': 75, 'criterion': 'gini'}.
Trial 3321 finished with value: 0.7065217391304348 and parameters: {'n_estimators': 246, 'max_depth': 11, 'min_samples_split': 136, 'min_samples_leaf': 76, 'criterion': 'gini'}.
Trial 3322 finished with value: 0.7065217391304348 and parameters: {'n_estimators': 295, 'max_depth': 13, 'min_samples_split': 124, 'min_samples_leaf': 73, 'criterion': 'gini'}.
Trial 3323 finished with value: 0.717391304347826 and parameters: {'n_estimators': 274, 'max_depth': 8, 'min_samples_split': 132, 'min_samples_leaf': 77, 'criterion': 'gini'}.
Trial 3324 finished with value: 0.6847826086956522 and parameters: {'n_estimators': 224, 'max_depth': 10, 'min_samples_split': 141, 'min_samples_leaf': 72, 'criterion': 'gini'}.
Trial 3325 finished with value: 0.6956521739130435 and parameters: {'n_estimators': 306, 'max_depth': 13, 'min_samples_split': 146, 'min_samples_leaf': 73, 'criterion': 'gini'}.
Trial 3326 finished with value: 0.6847826086956522 and parameters: {'n_estimators': 267, 'max_depth': 94, 'min_samples_split': 141, 'min_samples_leaf': 71, 'criterion': 'gini'}.
Trial 3327 finished with value: 0.6630434782608695 and parameters: {'n_estimators': 324, 'max_depth': 5, 'min_samples_split': 129, 'min_samples_leaf': 79, 'criterion': 'gini'}.
Trial 3328 finished with value: 0.717391304347826 and parameters: {'n_estimators': 286, 'max_depth': 9, 'min_samples_split': 144, 'min_samples_leaf': 70, 'criterion': 'gini'}.
Trial 3329 finished with value: 0.6956521739130435 and parameters: {'n_estimators': 238, 'max_depth': 11, 'min_samples_split': 154, 'min_samples_leaf': 66, 'criterion': 'gini'}.
Trial 3330 finished with value: 0.7065217391304348 and parameters: {'n_estimators': 255, 'max_depth': 8, 'min_samples_split': 151, 'min_samples_leaf': 69, 'criterion': 'gini'}.
Trial 3331 finished with value: 0.6847826086956522 and parameters: {'n_estimators': 313, 'max_depth': 46, 'min_samples_split': 126, 'min_samples_leaf': 74, 'criterion': 'gini'}.
Trial 3332 finished with value: 0.6956521739130435 and parameters: {'n_estimators': 296, 'max_depth': 13, 'min_samples_split': 137, 'min_samples_leaf': 69, 'criterion': 'gini'}.
Trial 3333 finished with value: 0.7065217391304348 and parameters: {'n_estimators': 270, 'max_depth': 7, 'min_samples_split': 140, 'min_samples_leaf': 73, 'criterion': 'gini'}.
Trial 3334 finished with value: 0.717391304347826 and parameters: {'n_estimators': 287, 'max_depth': 11, 'min_samples_split': 134, 'min_samples_leaf': 69, 'criterion': 'gini'}.
Trial 3335 finished with value: 0.7065217391304348 and parameters: {'n_estimators': 252, 'max_depth': 9, 'min_samples_split': 129, 'min_samples_leaf': 75, 'criterion': 'gini'}.
Trial 3336 finished with value: 0.6847826086956522 and parameters: {'n_estimators': 278, 'max_depth': 14, 'min_samples_split': 122, 'min_samples_leaf': 69, 'criterion': 'gini'}.
Trial 3337 finished with value: 0.7065217391304348 and parameters: {'n_estimators': 315, 'max_depth': 11, 'min_samples_split': 148, 'min_samples_leaf': 76, 'criterion': 'gini'}.
Trial 3338 finished with value: 0.6956521739130435 and parameters: {'n_estimators': 263, 'max_depth': 7, 'min_samples_split': 134, 'min_samples_leaf': 76, 'criterion': 'gini'}.
Trial 3339 finished with value: 0.6956521739130435 and parameters: {'n_estimators': 221, 'max_depth': 10, 'min_samples_split': 141, 'min_samples_leaf': 63, 'criterion': 'gini'}.
Trial 3340 finished with value: 0.6847826086956522 and parameters: {'n_estimators': 304, 'max_depth': 13, 'min_samples_split': 153, 'min_samples_leaf': 74, 'criterion': 'gini'}.
Trial 3341 finished with value: 0.6630434782608695 and parameters: {'n_estimators': 294, 'max_depth': 5, 'min_samples_split': 126, 'min_samples_leaf': 70, 'criterion': 'gini'}.
Trial 3342 finished with value: 0.717391304347826 and parameters: {'n_estimators': 235, 'max_depth': 9, 'min_samples_split': 119, 'min_samples_leaf': 72, 'criterion': 'gini'}.
Trial 3343 finished with value: 0.717391304347826 and parameters: {'n_estimators': 277, 'max_depth': 13, 'min_samples_split': 137, 'min_samples_leaf': 72, 'criterion': 'gini'}.
Trial 3344 finished with value: 0.7282608695652174 and parameters: {'n_estimators': 321, 'max_depth': 8, 'min_samples_split': 132, 'min_samples_leaf': 73, 'criterion': 'gini'}.
Trial 3345 finished with value: 0.7065217391304348 and parameters: {'n_estimators': 203, 'max_depth': 11, 'min_samples_split': 118, 'min_samples_leaf': 70, 'criterion': 'gini'}.
Trial 3346 finished with value: 0.6847826086956522 and parameters: {'n_estimators': 274, 'max_depth': 12, 'min_samples_split': 147, 'min_samples_leaf': 78, 'criterion': 'gini'}.
Trial 3347 finished with value: 0.7065217391304348 and parameters: {'n_estimators': 252, 'max_depth': 10, 'min_samples_split': 148, 'min_samples_leaf': 70, 'criterion': 'gini'}.
Trial 3348 finished with value: 0.7065217391304348 and parameters: {'n_estimators': 301, 'max_depth': 7, 'min_samples_split': 125, 'min_samples_leaf': 71, 'criterion': 'gini'}.
Trial 3349 finished with value: 0.7065217391304348 and parameters: {'n_estimators': 262, 'max_depth': 9, 'min_samples_split': 138, 'min_samples_leaf': 70, 'criterion': 'gini'}.
Trial 3350 finished with value: 0.6739130434782609 and parameters: {'n_estimators': 236, 'max_depth': 14, 'min_samples_split': 134, 'min_samples_leaf': 68, 'criterion': 'gini'}.
Trial 3351 finished with value: 0.6956521739130435 and parameters: {'n_estimators': 325, 'max_depth': 11, 'min_samples_split': 143, 'min_samples_leaf': 74, 'criterion': 'gini'}.
Trial 3352 finished with value: 0.6739130434782609 and parameters: {'n_estimators': 281, 'max_depth': 7, 'min_samples_split': 129, 'min_samples_leaf': 67, 'criterion': 'gini'}.
Trial 3353 finished with value: 0.7065217391304348 and parameters: {'n_estimators': 256, 'max_depth': 12, 'min_samples_split': 123, 'min_samples_leaf': 69, 'criterion': 'gini'}.
Trial 3354 finished with value: 0.7065217391304348 and parameters: {'n_estimators': 291, 'max_depth': 15, 'min_samples_split': 130, 'min_samples_leaf': 69, 'criterion': 'gini'}.
Trial 3355 finished with value: 0.717391304347826 and parameters: {'n_estimators': 242, 'max_depth': 9, 'min_samples_split': 119, 'min_samples_leaf': 73, 'criterion': 'gini'}.
Trial 3356 finished with value: 0.717391304347826 and parameters: {'n_estimators': 274, 'max_depth': 13, 'min_samples_split': 140, 'min_samples_leaf': 68, 'criterion': 'gini'}.
Trial 3357 finished with value: 0.6739130434782609 and parameters: {'n_estimators': 307, 'max_depth': 5, 'min_samples_split': 121, 'min_samples_leaf': 73, 'criterion': 'gini'}.
Trial 3358 finished with value: 0.6630434782608695 and parameters: {'n_estimators': 205, 'max_depth': 10, 'min_samples_split': 128, 'min_samples_leaf': 76, 'criterion': 'gini'}.
Trial 3359 finished with value: 0.6847826086956522 and parameters: {'n_estimators': 319, 'max_depth': 7, 'min_samples_split': 144, 'min_samples_leaf': 71, 'criterion': 'gini'}.
Trial 3360 finished with value: 0.7065217391304348 and parameters: {'n_estimators': 282, 'max_depth': 11, 'min_samples_split': 125, 'min_samples_leaf': 76, 'criterion': 'gini'}.
Trial 3361 finished with value: 0.6956521739130435 and parameters: {'n_estimators': 295, 'max_depth': 14, 'min_samples_split': 155, 'min_samples_leaf': 69, 'criterion': 'gini'}.
Trial 3362 finished with value: 0.6956521739130435 and parameters: {'n_estimators': 259, 'max_depth': 9, 'min_samples_split': 152, 'min_samples_leaf': 79, 'criterion': 'gini'}.
Trial 3363 finished with value: 0.6956521739130435 and parameters: {'n_estimators': 227, 'max_depth': 12, 'min_samples_split': 150, 'min_samples_leaf': 75, 'criterion': 'gini'}.
Trial 3364 finished with value: 0.7065217391304348 and parameters: {'n_estimators': 307, 'max_depth': 8, 'min_samples_split': 135, 'min_samples_leaf': 68, 'criterion': 'gini'}.
Trial 3365 finished with value: 0.6739130434782609 and parameters: {'n_estimators': 274, 'max_depth': 15, 'min_samples_split': 134, 'min_samples_leaf': 73, 'criterion': 'gini'}.
Trial 3366 finished with value: 0.7065217391304348 and parameters: {'n_estimators': 254, 'max_depth': 10, 'min_samples_split': 138, 'min_samples_leaf': 71, 'criterion': 'gini'}.
Trial 3367 finished with value: 0.6956521739130435 and parameters: {'n_estimators': 291, 'max_depth': 12, 'min_samples_split': 145, 'min_samples_leaf': 72, 'criterion': 'gini'}.
