Trial 923 finished with value: 0.6630434782608695 and parameters: {'n_estimators': 419, 'max_depth': 7, 'min_samples_split': 44, 'min_samples_leaf': 57, 'criterion': 'entropy'}.
Trial 924 finished with value: 0.6956521739130435 and parameters: {'n_estimators': 742, 'max_depth': 15, 'min_samples_split': 82, 'min_samples_leaf': 53, 'criterion': 'entropy'}.
Trial 925 finished with value: 0.717391304347826 and parameters: {'n_estimators': 564, 'max_depth': 10, 'min_samples_split': 29, 'min_samples_leaf': 55, 'criterion': 'entropy'}.
Trial 926 finished with value: 0.717391304347826 and parameters: {'n_estimators': 780, 'max_depth': 13, 'min_samples_split': 78, 'min_samples_leaf': 50, 'criterion': 'entropy'}.
Trial 927 finished with value: 0.6847826086956522 and parameters: {'n_estimators': 826, 'max_depth': 17, 'min_samples_split': 34, 'min_samples_leaf': 60, 'criterion': 'entropy'}.
Trial 928 finished with value: 0.6956521739130435 and parameters: {'n_estimators': 800, 'max_depth': 11, 'min_samples_split': 90, 'min_samples_leaf': 47, 'criterion': 'entropy'}.
Trial 929 finished with value: 0.6847826086956522 and parameters: {'n_estimators': 545, 'max_depth': 8, 'min_samples_split': 100, 'min_samples_leaf': 52, 'criterion': 'entropy'}.
Trial 930 finished with value: 0.717391304347826 and parameters: {'n_estimators': 768, 'max_depth': 9, 'min_samples_split': 24, 'min_samples_leaf': 49, 'criterion': 'entropy'}.
Trial 931 finished with value: 0.717391304347826 and parameters: {'n_estimators': 843, 'max_depth': 12, 'min_samples_split': 39, 'min_samples_leaf': 44, 'criterion': 'entropy'}.
Trial 932 finished with value: 0.6739130434782609 and parameters: {'n_estimators': 601, 'max_depth': 6, 'min_samples_split': 31, 'min_samples_leaf': 58, 'criterion': 'entropy'}.
Trial 933 finished with value: 0.6847826086956522 and parameters: {'n_estimators': 508, 'max_depth': 14, 'min_samples_split': 115, 'min_samples_leaf': 55, 'criterion': 'entropy'}.
Trial 934 finished with value: 0.717391304347826 and parameters: {'n_estimators': 812, 'max_depth': 10, 'min_samples_split': 27, 'min_samples_leaf': 53, 'criterion': 'gini'}.
Trial 935 finished with value: 0.717391304347826 and parameters: {'n_estimators': 350, 'max_depth': 8, 'min_samples_split': 42, 'min_samples_leaf': 65, 'criterion': 'entropy'}.
Trial 936 finished with value: 0.7065217391304348 and parameters: {'n_estimators': 789, 'max_depth': 11, 'min_samples_split': 36, 'min_samples_leaf': 51, 'criterion': 'entropy'}.
Trial 937 finished with value: 0.6413043478260869 and parameters: {'n_estimators': 831, 'max_depth': 5, 'min_samples_split': 22, 'min_samples_leaf': 47, 'criterion': 'entropy'}.
Trial 938 finished with value: 0.6956521739130435 and parameters: {'n_estimators': 722, 'max_depth': 13, 'min_samples_split': 128, 'min_samples_leaf': 49, 'criterion': 'entropy'}.
Trial 939 finished with value: 0.7065217391304348 and parameters: {'n_estimators': 896, 'max_depth': 16, 'min_samples_split': 28, 'min_samples_leaf': 56, 'criterion': 'entropy'}.
Trial 940 finished with value: 0.717391304347826 and parameters: {'n_estimators': 758, 'max_depth': 10, 'min_samples_split': 32, 'min_samples_leaf': 53, 'criterion': 'entropy'}.
Trial 941 finished with value: 0.6847826086956522 and parameters: {'n_estimators': 860, 'max_depth': 7, 'min_samples_split': 38, 'min_samples_leaf': 50, 'criterion': 'entropy'}.
Trial 942 finished with value: 0.6956521739130435 and parameters: {'n_estimators': 811, 'max_depth': 9, 'min_samples_split': 24, 'min_samples_leaf': 45, 'criterion': 'entropy'}.
Trial 943 finished with value: 0.717391304347826 and parameters: {'n_estimators': 785, 'max_depth': 11, 'min_samples_split': 34, 'min_samples_leaf': 62, 'criterion': 'entropy'}.
Trial 944 finished with value: 0.6630434782608695 and parameters: {'n_estimators': 930, 'max_depth': 19, 'min_samples_split': 46, 'min_samples_leaf': 57, 'criterion': 'entropy'}.
Trial 945 finished with value: 0.7065217391304348 and parameters: {'n_estimators': 576, 'max_depth': 14, 'min_samples_split': 28, 'min_samples_leaf': 51, 'criterion': 'entropy'}.
Trial 946 finished with value: 0.7282608695652174 and parameters: {'n_estimators': 1000, 'max_depth': 12, 'min_samples_split': 107, 'min_samples_leaf': 48, 'criterion': 'entropy'}.
Trial 947 finished with value: 0.7282608695652174 and parameters: {'n_estimators': 533, 'max_depth': 8, 'min_samples_split': 41, 'min_samples_leaf': 60, 'criterion': 'entropy'}.
Trial 948 finished with value: 0.717391304347826 and parameters: {'n_estimators': 687, 'max_depth': 10, 'min_samples_split': 37, 'min_samples_leaf': 53, 'criterion': 'entropy'}.
Trial 949 finished with value: 0.6847826086956522 and parameters: {'n_estimators': 826, 'max_depth': 7, 'min_samples_split': 32, 'min_samples_leaf': 54, 'criterion': 'entropy'}.
Trial 950 finished with value: 0.717391304347826 and parameters: {'n_estimators': 871, 'max_depth': 15, 'min_samples_split': 23, 'min_samples_leaf': 47, 'criterion': 'entropy'}.
Trial 951 finished with value: 0.7065217391304348 and parameters: {'n_estimators': 623, 'max_depth': 12, 'min_samples_split': 28, 'min_samples_leaf': 50, 'criterion': 'gini'}.
Trial 952 finished with value: 0.6521739130434783 and parameters: {'n_estimators': 800, 'max_depth': 97, 'min_samples_split': 34, 'min_samples_leaf': 55, 'criterion': 'entropy'}.
Trial 953 finished with value: 0.6739130434782609 and parameters: {'n_estimators': 849, 'max_depth': 9, 'min_samples_split': 26, 'min_samples_leaf': 52, 'criterion': 'entropy'}.
Trial 954 finished with value: 0.6195652173913043 and parameters: {'n_estimators': 746, 'max_depth': 5, 'min_samples_split': 21, 'min_samples_leaf': 26, 'criterion': 'entropy'}.
Trial 955 finished with value: 0.717391304347826 and parameters: {'n_estimators': 770, 'max_depth': 12, 'min_samples_split': 31, 'min_samples_leaf': 58, 'criterion': 'entropy'}.
Trial 956 finished with value: 0.717391304347826 and parameters: {'n_estimators': 813, 'max_depth': 14, 'min_samples_split': 94, 'min_samples_leaf': 49, 'criterion': 'entropy'}.
Trial 957 finished with value: 0.6739130434782609 and parameters: {'n_estimators': 783, 'max_depth': 8, 'min_samples_split': 39, 'min_samples_leaf': 45, 'criterion': 'entropy'}.
Trial 958 finished with value: 0.717391304347826 and parameters: {'n_estimators': 835, 'max_depth': 10, 'min_samples_split': 34, 'min_samples_leaf': 51, 'criterion': 'entropy'}.
Trial 959 finished with value: 0.7065217391304348 and parameters: {'n_estimators': 798, 'max_depth': 11, 'min_samples_split': 29, 'min_samples_leaf': 56, 'criterion': 'entropy'}.
Trial 960 finished with value: 0.6739130434782609 and parameters: {'n_estimators': 815, 'max_depth': 7, 'min_samples_split': 42, 'min_samples_leaf': 47, 'criterion': 'entropy'}.
Trial 961 finished with value: 0.7065217391304348 and parameters: {'n_estimators': 770, 'max_depth': 13, 'min_samples_split': 23, 'min_samples_leaf': 54, 'criterion': 'entropy'}.
Trial 962 finished with value: 0.717391304347826 and parameters: {'n_estimators': 848, 'max_depth': 9, 'min_samples_split': 37, 'min_samples_leaf': 49, 'criterion': 'entropy'}.
Trial 963 finished with value: 0.6847826086956522 and parameters: {'n_estimators': 821, 'max_depth': 11, 'min_samples_split': 48, 'min_samples_leaf': 52, 'criterion': 'entropy'}.
Trial 964 finished with value: 0.6956521739130435 and parameters: {'n_estimators': 795, 'max_depth': 6, 'min_samples_split': 58, 'min_samples_leaf': 95, 'criterion': 'entropy'}.
Trial 965 finished with value: 0.6956521739130435 and parameters: {'n_estimators': 520, 'max_depth': 15, 'min_samples_split': 120, 'min_samples_leaf': 43, 'criterion': 'entropy'}.
Trial 966 finished with value: 0.6956521739130435 and parameters: {'n_estimators': 740, 'max_depth': 9, 'min_samples_split': 26, 'min_samples_leaf': 60, 'criterion': 'entropy'}.
Trial 967 finished with value: 0.7065217391304348 and parameters: {'n_estimators': 882, 'max_depth': 13, 'min_samples_split': 111, 'min_samples_leaf': 51, 'criterion': 'entropy'}.
Trial 968 finished with value: 0.6956521739130435 and parameters: {'n_estimators': 709, 'max_depth': 17, 'min_samples_split': 101, 'min_samples_leaf': 57, 'criterion': 'entropy'}.
Trial 969 finished with value: 0.7065217391304348 and parameters: {'n_estimators': 836, 'max_depth': 11, 'min_samples_split': 30, 'min_samples_leaf': 46, 'criterion': 'entropy'}.
Trial 970 finished with value: 0.6739130434782609 and parameters: {'n_estimators': 760, 'max_depth': 7, 'min_samples_split': 35, 'min_samples_leaf': 54, 'criterion': 'entropy'}.
Trial 971 finished with value: 0.717391304347826 and parameters: {'n_estimators': 784, 'max_depth': 9, 'min_samples_split': 20, 'min_samples_leaf': 49, 'criterion': 'entropy'}.
Trial 972 finished with value: 0.7282608695652174 and parameters: {'n_estimators': 852, 'max_depth': 13, 'min_samples_split': 32, 'min_samples_leaf': 52, 'criterion': 'gini'}.
Trial 973 finished with value: 0.6956521739130435 and parameters: {'n_estimators': 553, 'max_depth': 11, 'min_samples_split': 27, 'min_samples_leaf': 55, 'criterion': 'entropy'}.
Trial 974 finished with value: 0.7065217391304348 and parameters: {'n_estimators': 808, 'max_depth': 8, 'min_samples_split': 138, 'min_samples_leaf': 49, 'criterion': 'entropy'}.
Trial 975 finished with value: 0.6413043478260869 and parameters: {'n_estimators': 832, 'max_depth': 5, 'min_samples_split': 43, 'min_samples_leaf': 47, 'criterion': 'entropy'}.
Trial 976 finished with value: 0.6956521739130435 and parameters: {'n_estimators': 872, 'max_depth': 15, 'min_samples_split': 38, 'min_samples_leaf': 53, 'criterion': 'entropy'}.
Trial 977 finished with value: 0.6413043478260869 and parameters: {'n_estimators': 778, 'max_depth': 10, 'min_samples_split': 32, 'min_samples_leaf': 12, 'criterion': 'entropy'}.
Trial 978 finished with value: 0.7065217391304348 and parameters: {'n_estimators': 800, 'max_depth': 12, 'min_samples_split': 24, 'min_samples_leaf': 57, 'criterion': 'entropy'}.
Trial 979 finished with value: 0.6956521739130435 and parameters: {'n_estimators': 131, 'max_depth': 7, 'min_samples_split': 17, 'min_samples_leaf': 59, 'criterion': 'entropy'}.
Trial 980 finished with value: 0.6847826086956522 and parameters: {'n_estimators': 826, 'max_depth': 9, 'min_samples_split': 35, 'min_samples_leaf': 51, 'criterion': 'entropy'}.
Trial 981 finished with value: 0.6956521739130435 and parameters: {'n_estimators': 757, 'max_depth': 13, 'min_samples_split': 29, 'min_samples_leaf': 62, 'criterion': 'entropy'}.
Trial 982 finished with value: 0.717391304347826 and parameters: {'n_estimators': 727, 'max_depth': 11, 'min_samples_split': 21, 'min_samples_leaf': 50, 'criterion': 'entropy'}.
Trial 983 finished with value: 0.6847826086956522 and parameters: {'n_estimators': 817, 'max_depth': 17, 'min_samples_split': 116, 'min_samples_leaf': 48, 'criterion': 'entropy'}.
Trial 984 finished with value: 0.6521739130434783 and parameters: {'n_estimators': 792, 'max_depth': 70, 'min_samples_split': 105, 'min_samples_leaf': 55, 'criterion': 'entropy'}.
Trial 985 finished with value: 0.6521739130434783 and parameters: {'n_estimators': 387, 'max_depth': 8, 'min_samples_split': 39, 'min_samples_leaf': 45, 'criterion': 'entropy'}.
Trial 986 finished with value: 0.717391304347826 and parameters: {'n_estimators': 575, 'max_depth': 10, 'min_samples_split': 26, 'min_samples_leaf': 54, 'criterion': 'entropy'}.
Trial 987 finished with value: 0.6847826086956522 and parameters: {'n_estimators': 302, 'max_depth': 14, 'min_samples_split': 32, 'min_samples_leaf': 52, 'criterion': 'entropy'}.
Trial 988 finished with value: 0.6630434782608695 and parameters: {'n_estimators': 535, 'max_depth': 6, 'min_samples_split': 36, 'min_samples_leaf': 50, 'criterion': 'entropy'}.
Trial 989 finished with value: 0.7065217391304348 and parameters: {'n_estimators': 861, 'max_depth': 12, 'min_samples_split': 42, 'min_samples_leaf': 58, 'criterion': 'gini'}.
Trial 990 finished with value: 0.6847826086956522 and parameters: {'n_estimators': 845, 'max_depth': 32, 'min_samples_split': 67, 'min_samples_leaf': 47, 'criterion': 'entropy'}.
Trial 991 finished with value: 0.6739130434782609 and parameters: {'n_estimators': 804, 'max_depth': 44, 'min_samples_split': 29, 'min_samples_leaf': 53, 'criterion': 'entropy'}.
Trial 992 finished with value: 0.717391304347826 and parameters: {'n_estimators': 774, 'max_depth': 9, 'min_samples_split': 26, 'min_samples_leaf': 56, 'criterion': 'entropy'}.
Trial 993 finished with value: 0.7065217391304348 and parameters: {'n_estimators': 971, 'max_depth': 11, 'min_samples_split': 20, 'min_samples_leaf': 43, 'criterion': 'entropy'}.
Trial 994 finished with value: 0.6956521739130435 and parameters: {'n_estimators': 900, 'max_depth': 15, 'min_samples_split': 33, 'min_samples_leaf': 49, 'criterion': 'entropy'}.
Trial 995 finished with value: 0.6630434782608695 and parameters: {'n_estimators': 493, 'max_depth': 7, 'min_samples_split': 24, 'min_samples_leaf': 51, 'criterion': 'entropy'}.
Trial 996 finished with value: 0.717391304347826 and parameters: {'n_estimators': 819, 'max_depth': 13, 'min_samples_split': 37, 'min_samples_leaf': 46, 'criterion': 'entropy'}.
Trial 997 finished with value: 0.7065217391304348 and parameters: {'n_estimators': 843, 'max_depth': 9, 'min_samples_split': 31, 'min_samples_leaf': 59, 'criterion': 'entropy'}.
Trial 998 finished with value: 0.6413043478260869 and parameters: {'n_estimators': 787, 'max_depth': 5, 'min_samples_split': 46, 'min_samples_leaf': 53, 'criterion': 'entropy'}.
Trial 999 finished with value: 0.7282608695652174 and parameters: {'n_estimators': 754, 'max_depth': 10, 'min_samples_split': 51, 'min_samples_leaf': 49, 'criterion': 'entropy'}.
Trial 1000 finished with value: 0.7065217391304348 and parameters: {'n_estimators': 807, 'max_depth': 12, 'min_samples_split': 40, 'min_samples_leaf': 56, 'criterion': 'entropy'}.
Trial 1001 finished with value: 0.6847826086956522 and parameters: {'n_estimators': 830, 'max_depth': 40, 'min_samples_split': 96, 'min_samples_leaf': 51, 'criterion': 'entropy'}.
Trial 1002 finished with value: 0.6521739130434783 and parameters: {'n_estimators': 773, 'max_depth': 8, 'min_samples_split': 28, 'min_samples_leaf': 33, 'criterion': 'entropy'}.
Trial 1003 finished with value: 0.6847826086956522 and parameters: {'n_estimators': 864, 'max_depth': 16, 'min_samples_split': 23, 'min_samples_leaf': 48, 'criterion': 'entropy'}.
Trial 1004 finished with value: 0.6739130434782609 and parameters: {'n_estimators': 559, 'max_depth': 19, 'min_samples_split': 18, 'min_samples_leaf': 54, 'criterion': 'entropy'}.
Trial 1005 finished with value: 0.6956521739130435 and parameters: {'n_estimators': 593, 'max_depth': 11, 'min_samples_split': 35, 'min_samples_leaf': 41, 'criterion': 'entropy'}.
Trial 1006 finished with value: 0.6630434782608695 and parameters: {'n_estimators': 734, 'max_depth': 61, 'min_samples_split': 29, 'min_samples_leaf': 52, 'criterion': 'entropy'}.
Trial 1007 finished with value: 0.6739130434782609 and parameters: {'n_estimators': 796, 'max_depth': 37, 'min_samples_split': 110, 'min_samples_leaf': 45, 'criterion': 'entropy'}.
Trial 1008 finished with value: 0.6956521739130435 and parameters: {'n_estimators': 826, 'max_depth': 7, 'min_samples_split': 33, 'min_samples_leaf': 61, 'criterion': 'gini'}.
Trial 1009 finished with value: 0.7065217391304348 and parameters: {'n_estimators': 808, 'max_depth': 14, 'min_samples_split': 38, 'min_samples_leaf': 50, 'criterion': 'entropy'}.
Trial 1010 finished with value: 0.6956521739130435 and parameters: {'n_estimators': 848, 'max_depth': 10, 'min_samples_split': 24, 'min_samples_leaf': 64, 'criterion': 'entropy'}.
Trial 1011 finished with value: 0.7065217391304348 and parameters: {'n_estimators': 770, 'max_depth': 12, 'min_samples_split': 42, 'min_samples_leaf': 55, 'criterion': 'entropy'}.
Trial 1012 finished with value: 0.6956521739130435 and parameters: {'n_estimators': 790, 'max_depth': 89, 'min_samples_split': 30, 'min_samples_leaf': 48, 'criterion': 'entropy'}.
Trial 1013 finished with value: 0.7065217391304348 and parameters: {'n_estimators': 242, 'max_depth': 9, 'min_samples_split': 35, 'min_samples_leaf': 58, 'criterion': 'entropy'}.
Trial 1014 finished with value: 0.6847826086956522 and parameters: {'n_estimators': 818, 'max_depth': 7, 'min_samples_split': 101, 'min_samples_leaf': 52, 'criterion': 'entropy'}.
Trial 1015 finished with value: 0.7065217391304348 and parameters: {'n_estimators': 882, 'max_depth': 14, 'min_samples_split': 16, 'min_samples_leaf': 50, 'criterion': 'entropy'}.
Trial 1016 finished with value: 0.6847826086956522 and parameters: {'n_estimators': 834, 'max_depth': 65, 'min_samples_split': 21, 'min_samples_leaf': 47, 'criterion': 'entropy'}.
Trial 1017 finished with value: 0.6956521739130435 and parameters: {'n_estimators': 649, 'max_depth': 10, 'min_samples_split': 169, 'min_samples_leaf': 55, 'criterion': 'entropy'}.
Trial 1018 finished with value: 0.6413043478260869 and parameters: {'n_estimators': 615, 'max_depth': 5, 'min_samples_split': 27, 'min_samples_leaf': 53, 'criterion': 'entropy'}.
Trial 1019 finished with value: 0.7065217391304348 and parameters: {'n_estimators': 512, 'max_depth': 13, 'min_samples_split': 32, 'min_samples_leaf': 51, 'criterion': 'entropy'}.
Trial 1020 finished with value: 0.717391304347826 and parameters: {'n_estimators': 539, 'max_depth': 9, 'min_samples_split': 39, 'min_samples_leaf': 57, 'criterion': 'entropy'}.
Trial 1021 finished with value: 0.6847826086956522 and parameters: {'n_estimators': 801, 'max_depth': 48, 'min_samples_split': 25, 'min_samples_leaf': 46, 'criterion': 'entropy'}.
Trial 1022 finished with value: 0.717391304347826 and parameters: {'n_estimators': 744, 'max_depth': 11, 'min_samples_split': 106, 'min_samples_leaf': 49, 'criterion': 'entropy'}.
Trial 1023 finished with value: 0.6847826086956522 and parameters: {'n_estimators': 857, 'max_depth': 16, 'min_samples_split': 35, 'min_samples_leaf': 53, 'criterion': 'entropy'}.
Trial 1024 finished with value: 0.7065217391304348 and parameters: {'n_estimators': 778, 'max_depth': 7, 'min_samples_split': 30, 'min_samples_leaf': 60, 'criterion': 'entropy'}.
Trial 1025 finished with value: 0.717391304347826 and parameters: {'n_estimators': 707, 'max_depth': 12, 'min_samples_split': 45, 'min_samples_leaf': 44, 'criterion': 'entropy'}.
Trial 1026 finished with value: 0.7282608695652174 and parameters: {'n_estimators': 817, 'max_depth': 8, 'min_samples_split': 21, 'min_samples_leaf': 56, 'criterion': 'entropy'}.
Trial 1027 finished with value: 0.7065217391304348 and parameters: {'n_estimators': 757, 'max_depth': 10, 'min_samples_split': 27, 'min_samples_leaf': 48, 'criterion': 'entropy'}.
Trial 1028 finished with value: 0.7065217391304348 and parameters: {'n_estimators': 836, 'max_depth': 13, 'min_samples_split': 38, 'min_samples_leaf': 51, 'criterion': 'gini'}.
Trial 1029 finished with value: 0.6630434782608695 and parameters: {'n_estimators': 792, 'max_depth': 8, 'min_samples_split': 13, 'min_samples_leaf': 38, 'criterion': 'entropy'}.
Trial 1030 finished with value: 0.7065217391304348 and parameters: {'n_estimators': 941, 'max_depth': 11, 'min_samples_split': 31, 'min_samples_leaf': 53, 'criterion': 'entropy'}.
Trial 1031 finished with value: 0.6739130434782609 and parameters: {'n_estimators': 868, 'max_depth': 6, 'min_samples_split': 35, 'min_samples_leaf': 50, 'criterion': 'entropy'}.
Trial 1032 finished with value: 0.6847826086956522 and parameters: {'n_estimators': 917, 'max_depth': 15, 'min_samples_split': 18, 'min_samples_leaf': 55, 'criterion': 'entropy'}.
Trial 1033 finished with value: 0.7065217391304348 and parameters: {'n_estimators': 812, 'max_depth': 10, 'min_samples_split': 42, 'min_samples_leaf': 47, 'criterion': 'entropy'}.
Trial 1034 finished with value: 0.717391304347826 and parameters: {'n_estimators': 779, 'max_depth': 12, 'min_samples_split': 24, 'min_samples_leaf': 58, 'criterion': 'entropy'}.
Trial 1035 finished with value: 0.6739130434782609 and parameters: {'n_estimators': 846, 'max_depth': 8, 'min_samples_split': 33, 'min_samples_leaf': 52, 'criterion': 'entropy'}.
Trial 1036 finished with value: 0.7065217391304348 and parameters: {'n_estimators': 575, 'max_depth': 14, 'min_samples_split': 9, 'min_samples_leaf': 49, 'criterion': 'entropy'}.
Trial 1037 finished with value: 0.6956521739130435 and parameters: {'n_estimators': 826, 'max_depth': 10, 'min_samples_split': 152, 'min_samples_leaf': 54, 'criterion': 'entropy'}.
Trial 1038 finished with value: 0.6847826086956522 and parameters: {'n_estimators': 789, 'max_depth': 17, 'min_samples_split': 27, 'min_samples_leaf': 62, 'criterion': 'entropy'}.
Trial 1039 finished with value: 0.6521739130434783 and parameters: {'n_estimators': 762, 'max_depth': 5, 'min_samples_split': 115, 'min_samples_leaf': 46, 'criterion': 'entropy'}.
Trial 1040 finished with value: 0.7065217391304348 and parameters: {'n_estimators': 805, 'max_depth': 12, 'min_samples_split': 31, 'min_samples_leaf': 51, 'criterion': 'entropy'}.
Trial 1041 finished with value: 0.6956521739130435 and parameters: {'n_estimators': 728, 'max_depth': 9, 'min_samples_split': 36, 'min_samples_leaf': 57, 'criterion': 'entropy'}.
Trial 1042 finished with value: 0.6847826086956522 and parameters: {'n_estimators': 557, 'max_depth': 7, 'min_samples_split': 22, 'min_samples_leaf': 48, 'criterion': 'entropy'}.
Trial 1043 finished with value: 0.717391304347826 and parameters: {'n_estimators': 892, 'max_depth': 11, 'min_samples_split': 40, 'min_samples_leaf': 59, 'criterion': 'entropy'}.
Trial 1044 finished with value: 0.6847826086956522 and parameters: {'n_estimators': 522, 'max_depth': 14, 'min_samples_split': 28, 'min_samples_leaf': 54, 'criterion': 'entropy'}.
Trial 1045 finished with value: 0.717391304347826 and parameters: {'n_estimators': 845, 'max_depth': 9, 'min_samples_split': 46, 'min_samples_leaf': 50, 'criterion': 'gini'}.
