Trial 3614 finished with value: 0.7282608695652174 and parameters: {'n_estimators': 304, 'max_depth': 9, 'min_samples_split': 132, 'min_samples_leaf': 75, 'criterion': 'gini'}.
Trial 3615 finished with value: 0.717391304347826 and parameters: {'n_estimators': 281, 'max_depth': 12, 'min_samples_split': 143, 'min_samples_leaf': 69, 'criterion': 'gini'}.
Trial 3616 finished with value: 0.6739130434782609 and parameters: {'n_estimators': 244, 'max_depth': 10, 'min_samples_split': 115, 'min_samples_leaf': 83, 'criterion': 'gini'}.
Trial 3617 finished with value: 0.6630434782608695 and parameters: {'n_estimators': 321, 'max_depth': 6, 'min_samples_split': 127, 'min_samples_leaf': 62, 'criterion': 'gini'}.
Trial 3618 finished with value: 0.7065217391304348 and parameters: {'n_estimators': 260, 'max_depth': 13, 'min_samples_split': 139, 'min_samples_leaf': 65, 'criterion': 'gini'}.
Trial 3619 finished with value: 0.6847826086956522 and parameters: {'n_estimators': 277, 'max_depth': 16, 'min_samples_split': 119, 'min_samples_leaf': 67, 'criterion': 'gini'}.
Trial 3620 finished with value: 0.717391304347826 and parameters: {'n_estimators': 296, 'max_depth': 8, 'min_samples_split': 150, 'min_samples_leaf': 77, 'criterion': 'gini'}.
Trial 3621 finished with value: 0.6847826086956522 and parameters: {'n_estimators': 229, 'max_depth': 11, 'min_samples_split': 146, 'min_samples_leaf': 63, 'criterion': 'gini'}.
Trial 3622 finished with value: 0.6739130434782609 and parameters: {'n_estimators': 193, 'max_depth': 10, 'min_samples_split': 137, 'min_samples_leaf': 72, 'criterion': 'gini'}.
Trial 3623 finished with value: 0.6956521739130435 and parameters: {'n_estimators': 298, 'max_depth': 14, 'min_samples_split': 130, 'min_samples_leaf': 61, 'criterion': 'gini'}.
Trial 3624 finished with value: 0.6630434782608695 and parameters: {'n_estimators': 255, 'max_depth': 18, 'min_samples_split': 122, 'min_samples_leaf': 62, 'criterion': 'gini'}.
Trial 3625 finished with value: 0.6739130434782609 and parameters: {'n_estimators': 334, 'max_depth': 62, 'min_samples_split': 109, 'min_samples_leaf': 65, 'criterion': 'gini'}.
Trial 3626 finished with value: 0.6739130434782609 and parameters: {'n_estimators': 285, 'max_depth': 7, 'min_samples_split': 139, 'min_samples_leaf': 69, 'criterion': 'gini'}.
Trial 3627 finished with value: 0.6847826086956522 and parameters: {'n_estimators': 218, 'max_depth': 12, 'min_samples_split': 142, 'min_samples_leaf': 73, 'criterion': 'gini'}.
Trial 3628 finished with value: 0.6739130434782609 and parameters: {'n_estimators': 267, 'max_depth': 45, 'min_samples_split': 135, 'min_samples_leaf': 75, 'criterion': 'gini'}.
Trial 3629 finished with value: 0.6956521739130435 and parameters: {'n_estimators': 240, 'max_depth': 9, 'min_samples_split': 127, 'min_samples_leaf': 61, 'criterion': 'gini'}.
Trial 3630 finished with value: 0.6521739130434783 and parameters: {'n_estimators': 313, 'max_depth': 5, 'min_samples_split': 152, 'min_samples_leaf': 60, 'criterion': 'gini'}.
Trial 3631 finished with value: 0.6956521739130435 and parameters: {'n_estimators': 352, 'max_depth': 11, 'min_samples_split': 146, 'min_samples_leaf': 63, 'criterion': 'gini'}.
Trial 3632 finished with value: 0.6739130434782609 and parameters: {'n_estimators': 277, 'max_depth': 24, 'min_samples_split': 155, 'min_samples_leaf': 71, 'criterion': 'gini'}.
Trial 3633 finished with value: 0.6956521739130435 and parameters: {'n_estimators': 299, 'max_depth': 14, 'min_samples_split': 133, 'min_samples_leaf': 68, 'criterion': 'gini'}.
Trial 3634 finished with value: 0.7065217391304348 and parameters: {'n_estimators': 259, 'max_depth': 8, 'min_samples_split': 144, 'min_samples_leaf': 60, 'criterion': 'gini'}.
Trial 3635 finished with value: 0.717391304347826 and parameters: {'n_estimators': 279, 'max_depth': 10, 'min_samples_split': 114, 'min_samples_leaf': 60, 'criterion': 'gini'}.
Trial 3636 finished with value: 0.7065217391304348 and parameters: {'n_estimators': 243, 'max_depth': 13, 'min_samples_split': 138, 'min_samples_leaf': 63, 'criterion': 'gini'}.
Trial 3637 finished with value: 0.6956521739130435 and parameters: {'n_estimators': 317, 'max_depth': 7, 'min_samples_split': 129, 'min_samples_leaf': 71, 'criterion': 'gini'}.
Trial 3638 finished with value: 0.6739130434782609 and parameters: {'n_estimators': 295, 'max_depth': 16, 'min_samples_split': 149, 'min_samples_leaf': 75, 'criterion': 'gini'}.
Trial 3639 finished with value: 0.6847826086956522 and parameters: {'n_estimators': 170, 'max_depth': 12, 'min_samples_split': 118, 'min_samples_leaf': 66, 'criterion': 'gini'}.
Trial 3640 finished with value: 0.717391304347826 and parameters: {'n_estimators': 263, 'max_depth': 9, 'min_samples_split': 124, 'min_samples_leaf': 60, 'criterion': 'gini'}.
Trial 3641 finished with value: 0.6739130434782609 and parameters: {'n_estimators': 225, 'max_depth': 10, 'min_samples_split': 143, 'min_samples_leaf': 78, 'criterion': 'gini'}.
Trial 3642 finished with value: 0.6739130434782609 and parameters: {'n_estimators': 277, 'max_depth': 6, 'min_samples_split': 139, 'min_samples_leaf': 73, 'criterion': 'gini'}.
Trial 3643 finished with value: 0.6956521739130435 and parameters: {'n_estimators': 252, 'max_depth': 12, 'min_samples_split': 135, 'min_samples_leaf': 62, 'criterion': 'gini'}.
Trial 3644 finished with value: 0.6847826086956522 and parameters: {'n_estimators': 307, 'max_depth': 15, 'min_samples_split': 110, 'min_samples_leaf': 65, 'criterion': 'gini'}.
Trial 3645 finished with value: 0.7065217391304348 and parameters: {'n_estimators': 290, 'max_depth': 8, 'min_samples_split': 140, 'min_samples_leaf': 62, 'criterion': 'gini'}.
Trial 3646 finished with value: 0.7065217391304348 and parameters: {'n_estimators': 200, 'max_depth': 11, 'min_samples_split': 184, 'min_samples_leaf': 61, 'criterion': 'gini'}.
Trial 3647 finished with value: 0.717391304347826 and parameters: {'n_estimators': 340, 'max_depth': 13, 'min_samples_split': 130, 'min_samples_leaf': 60, 'criterion': 'gini'}.
Trial 3648 finished with value: 0.717391304347826 and parameters: {'n_estimators': 267, 'max_depth': 9, 'min_samples_split': 144, 'min_samples_leaf': 69, 'criterion': 'gini'}.
Trial 3649 finished with value: 0.6413043478260869 and parameters: {'n_estimators': 245, 'max_depth': 5, 'min_samples_split': 120, 'min_samples_leaf': 60, 'criterion': 'gini'}.
Trial 3650 finished with value: 0.6956521739130435 and parameters: {'n_estimators': 292, 'max_depth': 7, 'min_samples_split': 149, 'min_samples_leaf': 73, 'criterion': 'gini'}.
Trial 3651 finished with value: 0.6956521739130435 and parameters: {'n_estimators': 321, 'max_depth': 11, 'min_samples_split': 115, 'min_samples_leaf': 64, 'criterion': 'gini'}.
Trial 3652 finished with value: 0.6739130434782609 and parameters: {'n_estimators': 270, 'max_depth': 17, 'min_samples_split': 134, 'min_samples_leaf': 68, 'criterion': 'gini'}.
Trial 3653 finished with value: 0.6847826086956522 and parameters: {'n_estimators': 226, 'max_depth': 14, 'min_samples_split': 124, 'min_samples_leaf': 60, 'criterion': 'gini'}.
Trial 3654 finished with value: 0.717391304347826 and parameters: {'n_estimators': 306, 'max_depth': 9, 'min_samples_split': 138, 'min_samples_leaf': 71, 'criterion': 'gini'}.
Trial 3655 finished with value: 0.6956521739130435 and parameters: {'n_estimators': 279, 'max_depth': 10, 'min_samples_split': 146, 'min_samples_leaf': 77, 'criterion': 'gini'}.
Trial 3656 finished with value: 0.6739130434782609 and parameters: {'n_estimators': 333, 'max_depth': 20, 'min_samples_split': 141, 'min_samples_leaf': 63, 'criterion': 'gini'}.
Trial 3657 finished with value: 0.6847826086956522 and parameters: {'n_estimators': 254, 'max_depth': 12, 'min_samples_split': 133, 'min_samples_leaf': 62, 'criterion': 'gini'}.
Trial 3658 finished with value: 0.6847826086956522 and parameters: {'n_estimators': 288, 'max_depth': 7, 'min_samples_split': 128, 'min_samples_leaf': 67, 'criterion': 'gini'}.
Trial 3659 finished with value: 0.6630434782608695 and parameters: {'n_estimators': 238, 'max_depth': 15, 'min_samples_split': 140, 'min_samples_leaf': 75, 'criterion': 'gini'}.
Trial 3660 finished with value: 0.6847826086956522 and parameters: {'n_estimators': 133, 'max_depth': 9, 'min_samples_split': 120, 'min_samples_leaf': 59, 'criterion': 'gini'}.
Trial 3661 finished with value: 0.7065217391304348 and parameters: {'n_estimators': 270, 'max_depth': 13, 'min_samples_split': 147, 'min_samples_leaf': 60, 'criterion': 'gini'}.
Trial 3662 finished with value: 0.6956521739130435 and parameters: {'n_estimators': 354, 'max_depth': 11, 'min_samples_split': 63, 'min_samples_leaf': 70, 'criterion': 'gini'}.
Trial 3663 finished with value: 0.7065217391304348 and parameters: {'n_estimators': 313, 'max_depth': 8, 'min_samples_split': 124, 'min_samples_leaf': 65, 'criterion': 'gini'}.
Trial 3664 finished with value: 0.6521739130434783 and parameters: {'n_estimators': 254, 'max_depth': 5, 'min_samples_split': 200, 'min_samples_leaf': 59, 'criterion': 'gini'}.
Trial 3665 finished with value: 0.7065217391304348 and parameters: {'n_estimators': 302, 'max_depth': 10, 'min_samples_split': 113, 'min_samples_leaf': 80, 'criterion': 'gini'}.
Trial 3666 finished with value: 0.6847826086956522 and parameters: {'n_estimators': 287, 'max_depth': 13, 'min_samples_split': 151, 'min_samples_leaf': 74, 'criterion': 'gini'}.
Trial 3667 finished with value: 0.6847826086956522 and parameters: {'n_estimators': 262, 'max_depth': 7, 'min_samples_split': 155, 'min_samples_leaf': 62, 'criterion': 'gini'}.
Trial 3668 finished with value: 0.6956521739130435 and parameters: {'n_estimators': 212, 'max_depth': 16, 'min_samples_split': 136, 'min_samples_leaf': 59, 'criterion': 'gini'}.
Trial 3669 finished with value: 0.7065217391304348 and parameters: {'n_estimators': 330, 'max_depth': 11, 'min_samples_split': 143, 'min_samples_leaf': 64, 'criterion': 'gini'}.
Trial 3670 finished with value: 0.6630434782608695 and parameters: {'n_estimators': 235, 'max_depth': 14, 'min_samples_split': 90, 'min_samples_leaf': 67, 'criterion': 'gini'}.
Trial 3671 finished with value: 0.717391304347826 and parameters: {'n_estimators': 279, 'max_depth': 8, 'min_samples_split': 139, 'min_samples_leaf': 60, 'criterion': 'gini'}.
Trial 3672 finished with value: 0.7065217391304348 and parameters: {'n_estimators': 306, 'max_depth': 12, 'min_samples_split': 131, 'min_samples_leaf': 72, 'criterion': 'gini'}.
Trial 3673 finished with value: 0.7065217391304348 and parameters: {'n_estimators': 256, 'max_depth': 10, 'min_samples_split': 78, 'min_samples_leaf': 62, 'criterion': 'gini'}.
Trial 3674 finished with value: 0.6739130434782609 and parameters: {'n_estimators': 275, 'max_depth': 18, 'min_samples_split': 117, 'min_samples_leaf': 59, 'criterion': 'gini'}.
Trial 3675 finished with value: 0.7282608695652174 and parameters: {'n_estimators': 291, 'max_depth': 9, 'min_samples_split': 136, 'min_samples_leaf': 70, 'criterion': 'gini'}.
Trial 3676 finished with value: 0.6739130434782609 and parameters: {'n_estimators': 234, 'max_depth': 7, 'min_samples_split': 107, 'min_samples_leaf': 64, 'criterion': 'gini'}.
Trial 3677 finished with value: 0.717391304347826 and parameters: {'n_estimators': 321, 'max_depth': 12, 'min_samples_split': 127, 'min_samples_leaf': 59, 'criterion': 'gini'}.
Trial 3678 finished with value: 0.6521739130434783 and parameters: {'n_estimators': 267, 'max_depth': 11, 'min_samples_split': 142, 'min_samples_leaf': 27, 'criterion': 'gini'}.
Trial 3679 finished with value: 0.6847826086956522 and parameters: {'n_estimators': 295, 'max_depth': 15, 'min_samples_split': 146, 'min_samples_leaf': 62, 'criterion': 'gini'}.
Trial 3680 finished with value: 0.6630434782608695 and parameters: {'n_estimators': 264, 'max_depth': 5, 'min_samples_split': 133, 'min_samples_leaf': 72, 'criterion': 'gini'}.
Trial 3681 finished with value: 0.6847826086956522 and parameters: {'n_estimators': 244, 'max_depth': 8, 'min_samples_split': 120, 'min_samples_leaf': 74, 'criterion': 'gini'}.
Trial 3682 finished with value: 0.6956521739130435 and parameters: {'n_estimators': 280, 'max_depth': 13, 'min_samples_split': 129, 'min_samples_leaf': 68, 'criterion': 'gini'}.
Trial 3683 finished with value: 0.7065217391304348 and parameters: {'n_estimators': 313, 'max_depth': 9, 'min_samples_split': 123, 'min_samples_leaf': 60, 'criterion': 'gini'}.
Trial 3684 finished with value: 0.7065217391304348 and parameters: {'n_estimators': 363, 'max_depth': 10, 'min_samples_split': 142, 'min_samples_leaf': 66, 'criterion': 'gini'}.
Trial 3685 finished with value: 0.6956521739130435 and parameters: {'n_estimators': 153, 'max_depth': 14, 'min_samples_split': 160, 'min_samples_leaf': 59, 'criterion': 'gini'}.
Trial 3686 finished with value: 0.6847826086956522 and parameters: {'n_estimators': 246, 'max_depth': 7, 'min_samples_split': 149, 'min_samples_leaf': 77, 'criterion': 'gini'}.
Trial 3687 finished with value: 0.6847826086956522 and parameters: {'n_estimators': 203, 'max_depth': 11, 'min_samples_split': 145, 'min_samples_leaf': 63, 'criterion': 'gini'}.
Trial 3688 finished with value: 0.6739130434782609 and parameters: {'n_estimators': 295, 'max_depth': 16, 'min_samples_split': 110, 'min_samples_leaf': 61, 'criterion': 'gini'}.
Trial 3689 finished with value: 0.6630434782608695 and parameters: {'n_estimators': 100, 'max_depth': 12, 'min_samples_split': 134, 'min_samples_leaf': 59, 'criterion': 'gini'}.
Trial 3690 finished with value: 0.7065217391304348 and parameters: {'n_estimators': 341, 'max_depth': 9, 'min_samples_split': 136, 'min_samples_leaf': 70, 'criterion': 'gini'}.
Trial 3691 finished with value: 0.6739130434782609 and parameters: {'n_estimators': 222, 'max_depth': 6, 'min_samples_split': 138, 'min_samples_leaf': 61, 'criterion': 'gini'}.
Trial 3692 finished with value: 0.6739130434782609 and parameters: {'n_estimators': 278, 'max_depth': 22, 'min_samples_split': 114, 'min_samples_leaf': 59, 'criterion': 'gini'}.
Trial 3693 finished with value: 0.6847826086956522 and parameters: {'n_estimators': 256, 'max_depth': 13, 'min_samples_split': 130, 'min_samples_leaf': 64, 'criterion': 'gini'}.
Trial 3694 finished with value: 0.717391304347826 and parameters: {'n_estimators': 325, 'max_depth': 10, 'min_samples_split': 141, 'min_samples_leaf': 73, 'criterion': 'gini'}.
Trial 3695 finished with value: 0.717391304347826 and parameters: {'n_estimators': 303, 'max_depth': 8, 'min_samples_split': 153, 'min_samples_leaf': 62, 'criterion': 'gini'}.
Trial 3696 finished with value: 0.6847826086956522 and parameters: {'n_estimators': 270, 'max_depth': 14, 'min_samples_split': 125, 'min_samples_leaf': 76, 'criterion': 'gini'}.
Trial 3697 finished with value: 0.717391304347826 and parameters: {'n_estimators': 298, 'max_depth': 11, 'min_samples_split': 134, 'min_samples_leaf': 59, 'criterion': 'gini'}.
Trial 3698 finished with value: 0.6630434782608695 and parameters: {'n_estimators': 253, 'max_depth': 6, 'min_samples_split': 145, 'min_samples_leaf': 66, 'criterion': 'gini'}.
Trial 3699 finished with value: 0.7282608695652174 and parameters: {'n_estimators': 282, 'max_depth': 9, 'min_samples_split': 119, 'min_samples_leaf': 69, 'criterion': 'gini'}.
Trial 3700 finished with value: 0.6956521739130435 and parameters: {'n_estimators': 230, 'max_depth': 18, 'min_samples_split': 96, 'min_samples_leaf': 61, 'criterion': 'gini'}.
Trial 3701 finished with value: 0.6956521739130435 and parameters: {'n_estimators': 268, 'max_depth': 12, 'min_samples_split': 139, 'min_samples_leaf': 71, 'criterion': 'gini'}.
Trial 3702 finished with value: 0.6956521739130435 and parameters: {'n_estimators': 298, 'max_depth': 15, 'min_samples_split': 148, 'min_samples_leaf': 59, 'criterion': 'gini'}.
Trial 3703 finished with value: 0.6739130434782609 and parameters: {'n_estimators': 248, 'max_depth': 10, 'min_samples_split': 144, 'min_samples_leaf': 74, 'criterion': 'gini'}.
Trial 3704 finished with value: 0.6956521739130435 and parameters: {'n_estimators': 321, 'max_depth': 7, 'min_samples_split': 124, 'min_samples_leaf': 64, 'criterion': 'gini'}.
Trial 3705 finished with value: 0.7065217391304348 and parameters: {'n_estimators': 276, 'max_depth': 12, 'min_samples_split': 140, 'min_samples_leaf': 59, 'criterion': 'gini'}.
Trial 3706 finished with value: 0.6956521739130435 and parameters: {'n_estimators': 176, 'max_depth': 8, 'min_samples_split': 106, 'min_samples_leaf': 91, 'criterion': 'gini'}.
Trial 3707 finished with value: 0.6956521739130435 and parameters: {'n_estimators': 292, 'max_depth': 82, 'min_samples_split': 129, 'min_samples_leaf': 62, 'criterion': 'gini'}.
Trial 3708 finished with value: 0.7065217391304348 and parameters: {'n_estimators': 257, 'max_depth': 10, 'min_samples_split': 134, 'min_samples_leaf': 67, 'criterion': 'gini'}.
Trial 3709 finished with value: 0.6521739130434783 and parameters: {'n_estimators': 343, 'max_depth': 5, 'min_samples_split': 148, 'min_samples_leaf': 59, 'criterion': 'gini'}.
Trial 3710 finished with value: 0.6847826086956522 and parameters: {'n_estimators': 215, 'max_depth': 32, 'min_samples_split': 118, 'min_samples_leaf': 61, 'criterion': 'gini'}.
Trial 3711 finished with value: 0.6847826086956522 and parameters: {'n_estimators': 319, 'max_depth': 14, 'min_samples_split': 157, 'min_samples_leaf': 72, 'criterion': 'gini'}.
Trial 3712 finished with value: 0.6847826086956522 and parameters: {'n_estimators': 285, 'max_depth': 16, 'min_samples_split': 113, 'min_samples_leaf': 63, 'criterion': 'gini'}.
Trial 3713 finished with value: 0.6847826086956522 and parameters: {'n_estimators': 238, 'max_depth': 11, 'min_samples_split': 142, 'min_samples_leaf': 59, 'criterion': 'gini'}.
Trial 3714 finished with value: 0.717391304347826 and parameters: {'n_estimators': 310, 'max_depth': 8, 'min_samples_split': 126, 'min_samples_leaf': 70, 'criterion': 'gini'}.
Trial 3715 finished with value: 0.6956521739130435 and parameters: {'n_estimators': 268, 'max_depth': 13, 'min_samples_split': 140, 'min_samples_leaf': 65, 'criterion': 'gini'}.
Trial 3716 finished with value: 0.6847826086956522 and parameters: {'n_estimators': 258, 'max_depth': 10, 'min_samples_split': 70, 'min_samples_leaf': 75, 'criterion': 'gini'}.
Trial 3717 finished with value: 0.6847826086956522 and parameters: {'n_estimators': 288, 'max_depth': 7, 'min_samples_split': 57, 'min_samples_leaf': 61, 'criterion': 'gini'}.
Trial 3718 finished with value: 0.7065217391304348 and parameters: {'n_estimators': 304, 'max_depth': 13, 'min_samples_split': 136, 'min_samples_leaf': 59, 'criterion': 'gini'}.
Trial 3719 finished with value: 0.6847826086956522 and parameters: {'n_estimators': 279, 'max_depth': 85, 'min_samples_split': 83, 'min_samples_leaf': 63, 'criterion': 'gini'}.
Trial 3720 finished with value: 0.6956521739130435 and parameters: {'n_estimators': 186, 'max_depth': 9, 'min_samples_split': 131, 'min_samples_leaf': 68, 'criterion': 'gini'}.
Trial 3721 finished with value: 0.7065217391304348 and parameters: {'n_estimators': 334, 'max_depth': 11, 'min_samples_split': 145, 'min_samples_leaf': 61, 'criterion': 'gini'}.
Trial 3722 finished with value: 0.6847826086956522 and parameters: {'n_estimators': 246, 'max_depth': 17, 'min_samples_split': 121, 'min_samples_leaf': 59, 'criterion': 'gini'}.
Trial 3723 finished with value: 0.6739130434782609 and parameters: {'n_estimators': 363, 'max_depth': 5, 'min_samples_split': 109, 'min_samples_leaf': 72, 'criterion': 'gini'}.
Trial 3724 finished with value: 0.6847826086956522 and parameters: {'n_estimators': 221, 'max_depth': 12, 'min_samples_split': 132, 'min_samples_leaf': 59, 'criterion': 'gini'}.
Trial 3725 finished with value: 0.6956521739130435 and parameters: {'n_estimators': 268, 'max_depth': 9, 'min_samples_split': 153, 'min_samples_leaf': 77, 'criterion': 'gini'}.
Trial 3726 finished with value: 0.6956521739130435 and parameters: {'n_estimators': 308, 'max_depth': 15, 'min_samples_split': 138, 'min_samples_leaf': 65, 'criterion': 'gini'}.
Trial 3727 finished with value: 0.6630434782608695 and parameters: {'n_estimators': 121, 'max_depth': 43, 'min_samples_split': 126, 'min_samples_leaf': 79, 'criterion': 'gini'}.
Trial 3728 finished with value: 0.717391304347826 and parameters: {'n_estimators': 288, 'max_depth': 8, 'min_samples_split': 148, 'min_samples_leaf': 61, 'criterion': 'gini'}.
Trial 3729 finished with value: 0.6847826086956522 and parameters: {'n_estimators': 238, 'max_depth': 11, 'min_samples_split': 139, 'min_samples_leaf': 63, 'criterion': 'gini'}.
Trial 3730 finished with value: 0.6739130434782609 and parameters: {'n_estimators': 255, 'max_depth': 14, 'min_samples_split': 143, 'min_samples_leaf': 75, 'criterion': 'gini'}.
Trial 3731 finished with value: 0.6847826086956522 and parameters: {'n_estimators': 281, 'max_depth': 7, 'min_samples_split': 151, 'min_samples_leaf': 73, 'criterion': 'gini'}.
Trial 3732 finished with value: 0.717391304347826 and parameters: {'n_estimators': 272, 'max_depth': 10, 'min_samples_split': 116, 'min_samples_leaf': 69, 'criterion': 'gini'}.
Trial 3733 finished with value: 0.6847826086956522 and parameters: {'n_estimators': 319, 'max_depth': 12, 'min_samples_split': 88, 'min_samples_leaf': 59, 'criterion': 'gini'}.
Trial 3734 finished with value: 0.6956521739130435 and parameters: {'n_estimators': 295, 'max_depth': 9, 'min_samples_split': 67, 'min_samples_leaf': 66, 'criterion': 'gini'}.
Trial 3735 finished with value: 0.6739130434782609 and parameters: {'n_estimators': 262, 'max_depth': 19, 'min_samples_split': 129, 'min_samples_leaf': 59, 'criterion': 'gini'}.
Trial 3736 finished with value: 0.6739130434782609 and parameters: {'n_estimators': 237, 'max_depth': 7, 'min_samples_split': 134, 'min_samples_leaf': 62, 'criterion': 'gini'}.
