Trial 5340 finished with value: 0.6847826086956522 and parameters: {'n_estimators': 714, 'max_depth': 13, 'min_samples_split': 159, 'min_samples_leaf': 77, 'criterion': 'entropy'}.
Trial 5341 finished with value: 0.7065217391304348 and parameters: {'n_estimators': 1000, 'max_depth': 9, 'min_samples_split': 30, 'min_samples_leaf': 64, 'criterion': 'entropy'}.
Trial 5342 finished with value: 0.6847826086956522 and parameters: {'n_estimators': 895, 'max_depth': 7, 'min_samples_split': 39, 'min_samples_leaf': 38, 'criterion': 'gini'}.
Trial 5343 finished with value: 0.6956521739130435 and parameters: {'n_estimators': 243, 'max_depth': 16, 'min_samples_split': 26, 'min_samples_leaf': 72, 'criterion': 'entropy'}.
Trial 5344 finished with value: 0.7065217391304348 and parameters: {'n_estimators': 285, 'max_depth': 11, 'min_samples_split': 16, 'min_samples_leaf': 68, 'criterion': 'gini'}.
Trial 5345 finished with value: 0.6521739130434783 and parameters: {'n_estimators': 263, 'max_depth': 5, 'min_samples_split': 47, 'min_samples_leaf': 53, 'criterion': 'entropy'}.
Trial 5346 finished with value: 0.7065217391304348 and parameters: {'n_estimators': 222, 'max_depth': 12, 'min_samples_split': 34, 'min_samples_leaf': 62, 'criterion': 'gini'}.
Trial 5347 finished with value: 0.717391304347826 and parameters: {'n_estimators': 306, 'max_depth': 9, 'min_samples_split': 146, 'min_samples_leaf': 59, 'criterion': 'entropy'}.
Trial 5348 finished with value: 0.7065217391304348 and parameters: {'n_estimators': 280, 'max_depth': 14, 'min_samples_split': 125, 'min_samples_leaf': 56, 'criterion': 'gini'}.
Trial 5349 finished with value: 0.6630434782608695 and parameters: {'n_estimators': 618, 'max_depth': 48, 'min_samples_split': 42, 'min_samples_leaf': 61, 'criterion': 'entropy'}.
Trial 5350 finished with value: 0.7065217391304348 and parameters: {'n_estimators': 183, 'max_depth': 10, 'min_samples_split': 135, 'min_samples_leaf': 58, 'criterion': 'gini'}.
Trial 5351 finished with value: 0.6847826086956522 and parameters: {'n_estimators': 333, 'max_depth': 7, 'min_samples_split': 30, 'min_samples_leaf': 55, 'criterion': 'entropy'}.
Trial 5352 finished with value: 0.6956521739130435 and parameters: {'n_estimators': 736, 'max_depth': 12, 'min_samples_split': 22, 'min_samples_leaf': 74, 'criterion': 'gini'}.
Trial 5353 finished with value: 0.7282608695652174 and parameters: {'n_estimators': 457, 'max_depth': 9, 'min_samples_split': 142, 'min_samples_leaf': 59, 'criterion': 'entropy'}.
Trial 5354 finished with value: 0.6630434782608695 and parameters: {'n_estimators': 250, 'max_depth': 15, 'min_samples_split': 35, 'min_samples_leaf': 66, 'criterion': 'gini'}.
Trial 5355 finished with value: 0.6739130434782609 and parameters: {'n_estimators': 662, 'max_depth': 18, 'min_samples_split': 118, 'min_samples_leaf': 63, 'criterion': 'entropy'}.
Trial 5356 finished with value: 0.717391304347826 and parameters: {'n_estimators': 265, 'max_depth': 11, 'min_samples_split': 31, 'min_samples_leaf': 57, 'criterion': 'gini'}.
Trial 5357 finished with value: 0.7065217391304348 and parameters: {'n_estimators': 293, 'max_depth': 7, 'min_samples_split': 25, 'min_samples_leaf': 71, 'criterion': 'entropy'}.
Trial 5358 finished with value: 0.6847826086956522 and parameters: {'n_estimators': 762, 'max_depth': 13, 'min_samples_split': 108, 'min_samples_leaf': 61, 'criterion': 'gini'}.
Trial 5359 finished with value: 0.6956521739130435 and parameters: {'n_estimators': 313, 'max_depth': 10, 'min_samples_split': 132, 'min_samples_leaf': 53, 'criterion': 'entropy'}.
Trial 5360 finished with value: 0.6956521739130435 and parameters: {'n_estimators': 281, 'max_depth': 8, 'min_samples_split': 39, 'min_samples_leaf': 69, 'criterion': 'gini'}.
Trial 5361 finished with value: 0.6521739130434783 and parameters: {'n_estimators': 952, 'max_depth': 5, 'min_samples_split': 137, 'min_samples_leaf': 60, 'criterion': 'entropy'}.
Trial 5362 finished with value: 0.6847826086956522 and parameters: {'n_estimators': 214, 'max_depth': 13, 'min_samples_split': 27, 'min_samples_leaf': 57, 'criterion': 'gini'}.
Trial 5363 finished with value: 0.717391304347826 and parameters: {'n_estimators': 255, 'max_depth': 10, 'min_samples_split': 34, 'min_samples_leaf': 55, 'criterion': 'entropy'}.
Trial 5364 finished with value: 0.6630434782608695 and parameters: {'n_estimators': 779, 'max_depth': 29, 'min_samples_split': 128, 'min_samples_leaf': 80, 'criterion': 'gini'}.
Trial 5365 finished with value: 0.6739130434782609 and parameters: {'n_estimators': 239, 'max_depth': 15, 'min_samples_split': 114, 'min_samples_leaf': 63, 'criterion': 'entropy'}.
Trial 5366 finished with value: 0.7065217391304348 and parameters: {'n_estimators': 297, 'max_depth': 8, 'min_samples_split': 20, 'min_samples_leaf': 73, 'criterion': 'gini'}.
Trial 5367 finished with value: 0.6847826086956522 and parameters: {'n_estimators': 124, 'max_depth': 12, 'min_samples_split': 145, 'min_samples_leaf': 59, 'criterion': 'entropy'}.
Trial 5368 finished with value: 0.7065217391304348 and parameters: {'n_estimators': 279, 'max_depth': 10, 'min_samples_split': 45, 'min_samples_leaf': 57, 'criterion': 'entropy'}.
Trial 5369 finished with value: 0.6956521739130435 and parameters: {'n_estimators': 728, 'max_depth': 7, 'min_samples_split': 150, 'min_samples_leaf': 65, 'criterion': 'gini'}.
Trial 5370 finished with value: 0.6847826086956522 and parameters: {'n_estimators': 383, 'max_depth': 17, 'min_samples_split': 29, 'min_samples_leaf': 76, 'criterion': 'entropy'}.
Trial 5371 finished with value: 0.7065217391304348 and parameters: {'n_estimators': 266, 'max_depth': 12, 'min_samples_split': 37, 'min_samples_leaf': 60, 'criterion': 'gini'}.
Trial 5372 finished with value: 0.6956521739130435 and parameters: {'n_estimators': 750, 'max_depth': 14, 'min_samples_split': 142, 'min_samples_leaf': 54, 'criterion': 'entropy'}.
Trial 5373 finished with value: 0.717391304347826 and parameters: {'n_estimators': 321, 'max_depth': 9, 'min_samples_split': 14, 'min_samples_leaf': 62, 'criterion': 'gini'}.
Trial 5374 finished with value: 0.6630434782608695 and parameters: {'n_estimators': 915, 'max_depth': 95, 'min_samples_split': 32, 'min_samples_leaf': 58, 'criterion': 'entropy'}.
Trial 5375 finished with value: 0.6847826086956522 and parameters: {'n_estimators': 298, 'max_depth': 11, 'min_samples_split': 175, 'min_samples_leaf': 56, 'criterion': 'gini'}.
Trial 5376 finished with value: 0.6847826086956522 and parameters: {'n_estimators': 352, 'max_depth': 6, 'min_samples_split': 73, 'min_samples_leaf': 64, 'criterion': 'entropy'}.
Trial 5377 finished with value: 0.717391304347826 and parameters: {'n_estimators': 272, 'max_depth': 8, 'min_samples_split': 100, 'min_samples_leaf': 67, 'criterion': 'gini'}.
Trial 5378 finished with value: 0.7065217391304348 and parameters: {'n_estimators': 253, 'max_depth': 11, 'min_samples_split': 40, 'min_samples_leaf': 71, 'criterion': 'entropy'}.
Trial 5379 finished with value: 0.717391304347826 and parameters: {'n_estimators': 232, 'max_depth': 14, 'min_samples_split': 25, 'min_samples_leaf': 60, 'criterion': 'gini'}.
Trial 5380 finished with value: 0.7065217391304348 and parameters: {'n_estimators': 709, 'max_depth': 9, 'min_samples_split': 140, 'min_samples_leaf': 53, 'criterion': 'entropy'}.
Trial 5381 finished with value: 0.6739130434782609 and parameters: {'n_estimators': 332, 'max_depth': 63, 'min_samples_split': 22, 'min_samples_leaf': 58, 'criterion': 'gini'}.
Trial 5382 finished with value: 0.6413043478260869 and parameters: {'n_estimators': 284, 'max_depth': 5, 'min_samples_split': 35, 'min_samples_leaf': 62, 'criterion': 'entropy'}.
Trial 5383 finished with value: 0.6847826086956522 and parameters: {'n_estimators': 778, 'max_depth': 16, 'min_samples_split': 29, 'min_samples_leaf': 55, 'criterion': 'gini'}.
Trial 5384 finished with value: 0.6956521739130435 and parameters: {'n_estimators': 262, 'max_depth': 13, 'min_samples_split': 18, 'min_samples_leaf': 73, 'criterion': 'entropy'}.
Trial 5385 finished with value: 0.7282608695652174 and parameters: {'n_estimators': 307, 'max_depth': 10, 'min_samples_split': 121, 'min_samples_leaf': 69, 'criterion': 'gini'}.
Trial 5386 finished with value: 0.7065217391304348 and parameters: {'n_estimators': 742, 'max_depth': 8, 'min_samples_split': 50, 'min_samples_leaf': 60, 'criterion': 'entropy'}.
Trial 5387 finished with value: 0.717391304347826 and parameters: {'n_estimators': 245, 'max_depth': 11, 'min_samples_split': 133, 'min_samples_leaf': 57, 'criterion': 'gini'}.
Trial 5388 finished with value: 0.6956521739130435 and parameters: {'n_estimators': 290, 'max_depth': 12, 'min_samples_split': 31, 'min_samples_leaf': 75, 'criterion': 'entropy'}.
Trial 5389 finished with value: 0.6956521739130435 and parameters: {'n_estimators': 600, 'max_depth': 7, 'min_samples_split': 38, 'min_samples_leaf': 61, 'criterion': 'gini'}.
Trial 5390 finished with value: 0.6630434782608695 and parameters: {'n_estimators': 202, 'max_depth': 15, 'min_samples_split': 147, 'min_samples_leaf': 58, 'criterion': 'entropy'}.
Trial 5391 finished with value: 0.6739130434782609 and parameters: {'n_estimators': 756, 'max_depth': 9, 'min_samples_split': 43, 'min_samples_leaf': 64, 'criterion': 'gini'}.
Trial 5392 finished with value: 0.6847826086956522 and parameters: {'n_estimators': 278, 'max_depth': 13, 'min_samples_split': 26, 'min_samples_leaf': 78, 'criterion': 'entropy'}.
Trial 5393 finished with value: 0.717391304347826 and parameters: {'n_estimators': 688, 'max_depth': 10, 'min_samples_split': 136, 'min_samples_leaf': 55, 'criterion': 'gini'}.
Trial 5394 finished with value: 0.6956521739130435 and parameters: {'n_estimators': 307, 'max_depth': 7, 'min_samples_split': 152, 'min_samples_leaf': 59, 'criterion': 'entropy'}.
Trial 5395 finished with value: 0.7065217391304348 and parameters: {'n_estimators': 400, 'max_depth': 11, 'min_samples_split': 34, 'min_samples_leaf': 67, 'criterion': 'gini'}.
Trial 5396 finished with value: 0.6956521739130435 and parameters: {'n_estimators': 250, 'max_depth': 13, 'min_samples_split': 125, 'min_samples_leaf': 62, 'criterion': 'entropy'}.
Trial 5397 finished with value: 0.6521739130434783 and parameters: {'n_estimators': 220, 'max_depth': 5, 'min_samples_split': 41, 'min_samples_leaf': 53, 'criterion': 'entropy'}.
Trial 5398 finished with value: 0.6739130434782609 and parameters: {'n_estimators': 268, 'max_depth': 19, 'min_samples_split': 144, 'min_samples_leaf': 56, 'criterion': 'gini'}.
Trial 5399 finished with value: 0.6847826086956522 and parameters: {'n_estimators': 322, 'max_depth': 9, 'min_samples_split': 58, 'min_samples_leaf': 70, 'criterion': 'entropy'}.
Trial 5400 finished with value: 0.6521739130434783 and parameters: {'n_estimators': 288, 'max_depth': 16, 'min_samples_split': 22, 'min_samples_leaf': 59, 'criterion': 'gini'}.
Trial 5401 finished with value: 0.6847826086956522 and parameters: {'n_estimators': 165, 'max_depth': 7, 'min_samples_split': 139, 'min_samples_leaf': 57, 'criterion': 'entropy'}.
Trial 5402 finished with value: 0.7065217391304348 and parameters: {'n_estimators': 493, 'max_depth': 11, 'min_samples_split': 29, 'min_samples_leaf': 61, 'criterion': 'gini'}.
Trial 5403 finished with value: 0.7065217391304348 and parameters: {'n_estimators': 767, 'max_depth': 14, 'min_samples_split': 130, 'min_samples_leaf': 64, 'criterion': 'entropy'}.
Trial 5404 finished with value: 0.6847826086956522 and parameters: {'n_estimators': 722, 'max_depth': 9, 'min_samples_split': 36, 'min_samples_leaf': 33, 'criterion': 'gini'}.
Trial 5405 finished with value: 0.6739130434782609 and parameters: {'n_estimators': 263, 'max_depth': 51, 'min_samples_split': 31, 'min_samples_leaf': 72, 'criterion': 'entropy'}.
Trial 5406 finished with value: 0.6956521739130435 and parameters: {'n_estimators': 235, 'max_depth': 12, 'min_samples_split': 25, 'min_samples_leaf': 55, 'criterion': 'gini'}.
Trial 5407 finished with value: 0.7065217391304348 and parameters: {'n_estimators': 297, 'max_depth': 8, 'min_samples_split': 154, 'min_samples_leaf': 59, 'criterion': 'entropy'}.
Trial 5408 finished with value: 0.6956521739130435 and parameters: {'n_estimators': 272, 'max_depth': 10, 'min_samples_split': 33, 'min_samples_leaf': 66, 'criterion': 'gini'}.
Trial 5409 finished with value: 0.6739130434782609 and parameters: {'n_estimators': 252, 'max_depth': 82, 'min_samples_split': 17, 'min_samples_leaf': 62, 'criterion': 'entropy'}.
Trial 5410 finished with value: 0.6739130434782609 and parameters: {'n_estimators': 314, 'max_depth': 6, 'min_samples_split': 118, 'min_samples_leaf': 75, 'criterion': 'gini'}.
Trial 5411 finished with value: 0.717391304347826 and parameters: {'n_estimators': 363, 'max_depth': 12, 'min_samples_split': 5, 'min_samples_leaf': 57, 'criterion': 'entropy'}.
Trial 5412 finished with value: 0.6847826086956522 and parameters: {'n_estimators': 283, 'max_depth': 17, 'min_samples_split': 44, 'min_samples_leaf': 60, 'criterion': 'gini'}.
Trial 5413 finished with value: 0.6847826086956522 and parameters: {'n_estimators': 744, 'max_depth': 14, 'min_samples_split': 39, 'min_samples_leaf': 54, 'criterion': 'entropy'}.
Trial 5414 finished with value: 0.717391304347826 and parameters: {'n_estimators': 631, 'max_depth': 9, 'min_samples_split': 28, 'min_samples_leaf': 58, 'criterion': 'gini'}.
Trial 5415 finished with value: 0.6956521739130435 and parameters: {'n_estimators': 299, 'max_depth': 37, 'min_samples_split': 147, 'min_samples_leaf': 68, 'criterion': 'entropy'}.
Trial 5416 finished with value: 0.7065217391304348 and parameters: {'n_estimators': 776, 'max_depth': 11, 'min_samples_split': 139, 'min_samples_leaf': 63, 'criterion': 'gini'}.
Trial 5417 finished with value: 0.6630434782608695 and parameters: {'n_estimators': 241, 'max_depth': 7, 'min_samples_split': 20, 'min_samples_leaf': 53, 'criterion': 'entropy'}.
Trial 5418 finished with value: 0.6739130434782609 and parameters: {'n_estimators': 267, 'max_depth': 15, 'min_samples_split': 36, 'min_samples_leaf': 73, 'criterion': 'gini'}.
Trial 5419 finished with value: 0.7282608695652174 and parameters: {'n_estimators': 429, 'max_depth': 10, 'min_samples_split': 27, 'min_samples_leaf': 56, 'criterion': 'entropy'}.
Trial 5420 finished with value: 0.6956521739130435 and parameters: {'n_estimators': 325, 'max_depth': 12, 'min_samples_split': 113, 'min_samples_leaf': 60, 'criterion': 'gini'}.
Trial 5421 finished with value: 0.6956521739130435 and parameters: {'n_estimators': 101, 'max_depth': 8, 'min_samples_split': 32, 'min_samples_leaf': 65, 'criterion': 'entropy'}.
Trial 5422 finished with value: 0.6847826086956522 and parameters: {'n_estimators': 222, 'max_depth': 22, 'min_samples_split': 128, 'min_samples_leaf': 71, 'criterion': 'gini'}.
Trial 5423 finished with value: 0.6413043478260869 and parameters: {'n_estimators': 335, 'max_depth': 5, 'min_samples_split': 10, 'min_samples_leaf': 58, 'criterion': 'entropy'}.
Trial 5424 finished with value: 0.6956521739130435 and parameters: {'n_estimators': 285, 'max_depth': 13, 'min_samples_split': 123, 'min_samples_leaf': 62, 'criterion': 'entropy'}.
Trial 5425 finished with value: 0.717391304347826 and parameters: {'n_estimators': 254, 'max_depth': 10, 'min_samples_split': 135, 'min_samples_leaf': 55, 'criterion': 'gini'}.
Trial 5426 finished with value: 0.7065217391304348 and parameters: {'n_estimators': 778, 'max_depth': 8, 'min_samples_split': 144, 'min_samples_leaf': 60, 'criterion': 'entropy'}.
Trial 5427 finished with value: 0.6956521739130435 and parameters: {'n_estimators': 731, 'max_depth': 12, 'min_samples_split': 23, 'min_samples_leaf': 57, 'criterion': 'gini'}.
Trial 5428 finished with value: 0.6956521739130435 and parameters: {'n_estimators': 301, 'max_depth': 15, 'min_samples_split': 47, 'min_samples_leaf': 69, 'criterion': 'entropy'}.
Trial 5429 finished with value: 0.6847826086956522 and parameters: {'n_estimators': 278, 'max_depth': 10, 'min_samples_split': 40, 'min_samples_leaf': 77, 'criterion': 'gini'}.
Trial 5430 finished with value: 0.7065217391304348 and parameters: {'n_estimators': 758, 'max_depth': 7, 'min_samples_split': 15, 'min_samples_leaf': 61, 'criterion': 'entropy'}.
Trial 5431 finished with value: 0.7065217391304348 and parameters: {'n_estimators': 264, 'max_depth': 13, 'min_samples_split': 107, 'min_samples_leaf': 58, 'criterion': 'gini'}.
Trial 5432 finished with value: 0.6956521739130435 and parameters: {'n_estimators': 310, 'max_depth': 9, 'min_samples_split': 32, 'min_samples_leaf': 63, 'criterion': 'entropy'}.
Trial 5433 finished with value: 0.6847826086956522 and parameters: {'n_estimators': 711, 'max_depth': 34, 'min_samples_split': 141, 'min_samples_leaf': 53, 'criterion': 'gini'}.
Trial 5434 finished with value: 0.6847826086956522 and parameters: {'n_estimators': 238, 'max_depth': 99, 'min_samples_split': 36, 'min_samples_leaf': 59, 'criterion': 'entropy'}.
Trial 5435 finished with value: 0.6630434782608695 and parameters: {'n_estimators': 203, 'max_depth': 18, 'min_samples_split': 149, 'min_samples_leaf': 74, 'criterion': 'gini'}.
Trial 5436 finished with value: 0.717391304347826 and parameters: {'n_estimators': 346, 'max_depth': 11, 'min_samples_split': 51, 'min_samples_leaf': 56, 'criterion': 'entropy'}.
Trial 5437 finished with value: 0.6847826086956522 and parameters: {'n_estimators': 284, 'max_depth': 6, 'min_samples_split': 25, 'min_samples_leaf': 66, 'criterion': 'gini'}.
Trial 5438 finished with value: 0.7065217391304348 and parameters: {'n_estimators': 266, 'max_depth': 14, 'min_samples_split': 132, 'min_samples_leaf': 61, 'criterion': 'entropy'}.
Trial 5439 finished with value: 0.7065217391304348 and parameters: {'n_estimators': 247, 'max_depth': 8, 'min_samples_split': 31, 'min_samples_leaf': 56, 'criterion': 'gini'}.
Trial 5440 finished with value: 0.7282608695652174 and parameters: {'n_estimators': 292, 'max_depth': 11, 'min_samples_split': 28, 'min_samples_leaf': 59, 'criterion': 'entropy'}.
Trial 5441 finished with value: 0.6956521739130435 and parameters: {'n_estimators': 757, 'max_depth': 9, 'min_samples_split': 82, 'min_samples_leaf': 71, 'criterion': 'gini'}.
Trial 5442 finished with value: 0.6630434782608695 and parameters: {'n_estimators': 308, 'max_depth': 16, 'min_samples_split': 38, 'min_samples_leaf': 54, 'criterion': 'entropy'}.
Trial 5443 finished with value: 0.7065217391304348 and parameters: {'n_estimators': 272, 'max_depth': 13, 'min_samples_split': 137, 'min_samples_leaf': 63, 'criterion': 'gini'}.
Trial 5444 finished with value: 0.6739130434782609 and parameters: {'n_estimators': 473, 'max_depth': 6, 'min_samples_split': 142, 'min_samples_leaf': 58, 'criterion': 'entropy'}.
Trial 5445 finished with value: 0.717391304347826 and parameters: {'n_estimators': 226, 'max_depth': 11, 'min_samples_split': 20, 'min_samples_leaf': 61, 'criterion': 'gini'}.
Trial 5446 finished with value: 0.6847826086956522 and parameters: {'n_estimators': 143, 'max_depth': 9, 'min_samples_split': 43, 'min_samples_leaf': 64, 'criterion': 'entropy'}.
Trial 5447 finished with value: 0.6847826086956522 and parameters: {'n_estimators': 739, 'max_depth': 45, 'min_samples_split': 36, 'min_samples_leaf': 73, 'criterion': 'gini'}.
Trial 5448 finished with value: 0.7065217391304348 and parameters: {'n_estimators': 325, 'max_depth': 12, 'min_samples_split': 116, 'min_samples_leaf': 56, 'criterion': 'entropy'}.
Trial 5449 finished with value: 0.6956521739130435 and parameters: {'n_estimators': 252, 'max_depth': 7, 'min_samples_split': 24, 'min_samples_leaf': 76, 'criterion': 'gini'}.
Trial 5450 finished with value: 0.6847826086956522 and parameters: {'n_estimators': 294, 'max_depth': 20, 'min_samples_split': 33, 'min_samples_leaf': 68, 'criterion': 'entropy'}.
Trial 5451 finished with value: 0.7065217391304348 and parameters: {'n_estimators': 276, 'max_depth': 15, 'min_samples_split': 29, 'min_samples_leaf': 60, 'criterion': 'gini'}.
Trial 5452 finished with value: 0.6956521739130435 and parameters: {'n_estimators': 260, 'max_depth': 10, 'min_samples_split': 147, 'min_samples_leaf': 58, 'criterion': 'entropy'}.
Trial 5453 finished with value: 0.6413043478260869 and parameters: {'n_estimators': 179, 'max_depth': 5, 'min_samples_split': 96, 'min_samples_leaf': 53, 'criterion': 'entropy'}.
Trial 5454 finished with value: 0.6847826086956522 and parameters: {'n_estimators': 966, 'max_depth': 27, 'min_samples_split': 41, 'min_samples_leaf': 70, 'criterion': 'gini'}.
Trial 5455 finished with value: 0.7065217391304348 and parameters: {'n_estimators': 781, 'max_depth': 13, 'min_samples_split': 124, 'min_samples_leaf': 55, 'criterion': 'entropy'}.
Trial 5456 finished with value: 0.7065217391304348 and parameters: {'n_estimators': 311, 'max_depth': 9, 'min_samples_split': 34, 'min_samples_leaf': 65, 'criterion': 'gini'}.
Trial 5457 finished with value: 0.717391304347826 and parameters: {'n_estimators': 289, 'max_depth': 11, 'min_samples_split': 131, 'min_samples_leaf': 60, 'criterion': 'entropy'}.
Trial 5458 finished with value: 0.717391304347826 and parameters: {'n_estimators': 229, 'max_depth': 8, 'min_samples_split': 159, 'min_samples_leaf': 57, 'criterion': 'gini'}.
Trial 5459 finished with value: 0.6956521739130435 and parameters: {'n_estimators': 695, 'max_depth': 14, 'min_samples_split': 27, 'min_samples_leaf': 59, 'criterion': 'entropy'}.
Trial 5460 finished with value: 0.6847826086956522 and parameters: {'n_estimators': 247, 'max_depth': 7, 'min_samples_split': 16, 'min_samples_leaf': 62, 'criterion': 'gini'}.
Trial 5461 finished with value: 0.6847826086956522 and parameters: {'n_estimators': 759, 'max_depth': 17, 'min_samples_split': 144, 'min_samples_leaf': 74, 'criterion': 'entropy'}.
Trial 5462 finished with value: 0.717391304347826 and parameters: {'n_estimators': 272, 'max_depth': 11, 'min_samples_split': 22, 'min_samples_leaf': 57, 'criterion': 'gini'}.
