Trial 1046 finished with value: 0.717391304347826 and parameters: {'n_estimators': 480, 'max_depth': 13, 'min_samples_split': 98, 'min_samples_leaf': 44, 'criterion': 'entropy'}.
Trial 1047 finished with value: 0.6847826086956522 and parameters: {'n_estimators': 812, 'max_depth': 7, 'min_samples_split': 33, 'min_samples_leaf': 52, 'criterion': 'entropy'}.
Trial 1048 finished with value: 0.7065217391304348 and parameters: {'n_estimators': 832, 'max_depth': 11, 'min_samples_split': 25, 'min_samples_leaf': 56, 'criterion': 'entropy'}.
Trial 1049 finished with value: 0.717391304347826 and parameters: {'n_estimators': 797, 'max_depth': 9, 'min_samples_split': 19, 'min_samples_leaf': 48, 'criterion': 'entropy'}.
Trial 1050 finished with value: 0.6847826086956522 and parameters: {'n_estimators': 447, 'max_depth': 15, 'min_samples_split': 121, 'min_samples_leaf': 50, 'criterion': 'entropy'}.
Trial 1051 finished with value: 0.7065217391304348 and parameters: {'n_estimators': 775, 'max_depth': 12, 'min_samples_split': 37, 'min_samples_leaf': 53, 'criterion': 'entropy'}.
Trial 1052 finished with value: 0.6739130434782609 and parameters: {'n_estimators': 861, 'max_depth': 8, 'min_samples_split': 30, 'min_samples_leaf': 46, 'criterion': 'entropy'}.
Trial 1053 finished with value: 0.717391304347826 and parameters: {'n_estimators': 674, 'max_depth': 10, 'min_samples_split': 42, 'min_samples_leaf': 55, 'criterion': 'entropy'}.
Trial 1054 finished with value: 0.6630434782608695 and parameters: {'n_estimators': 743, 'max_depth': 6, 'min_samples_split': 27, 'min_samples_leaf': 51, 'criterion': 'entropy'}.
Trial 1055 finished with value: 0.6956521739130435 and parameters: {'n_estimators': 821, 'max_depth': 13, 'min_samples_split': 15, 'min_samples_leaf': 60, 'criterion': 'entropy'}.
Trial 1056 finished with value: 0.717391304347826 and parameters: {'n_estimators': 793, 'max_depth': 11, 'min_samples_split': 34, 'min_samples_leaf': 49, 'criterion': 'entropy'}.
Trial 1057 finished with value: 0.717391304347826 and parameters: {'n_estimators': 760, 'max_depth': 8, 'min_samples_split': 111, 'min_samples_leaf': 57, 'criterion': 'entropy'}.
Trial 1058 finished with value: 0.6739130434782609 and parameters: {'n_estimators': 840, 'max_depth': 20, 'min_samples_split': 22, 'min_samples_leaf': 53, 'criterion': 'entropy'}.
Trial 1059 finished with value: 0.6847826086956522 and parameters: {'n_estimators': 877, 'max_depth': 17, 'min_samples_split': 38, 'min_samples_leaf': 47, 'criterion': 'entropy'}.
Trial 1060 finished with value: 0.6304347826086957 and parameters: {'n_estimators': 812, 'max_depth': 10, 'min_samples_split': 30, 'min_samples_leaf': 16, 'criterion': 'entropy'}.
Trial 1061 finished with value: 0.717391304347826 and parameters: {'n_estimators': 545, 'max_depth': 13, 'min_samples_split': 25, 'min_samples_leaf': 51, 'criterion': 'entropy'}.
Trial 1062 finished with value: 0.6413043478260869 and parameters: {'n_estimators': 778, 'max_depth': 5, 'min_samples_split': 34, 'min_samples_leaf': 55, 'criterion': 'entropy'}.
Trial 1063 finished with value: 0.6956521739130435 and parameters: {'n_estimators': 827, 'max_depth': 15, 'min_samples_split': 30, 'min_samples_leaf': 49, 'criterion': 'entropy'}.
Trial 1064 finished with value: 0.6739130434782609 and parameters: {'n_estimators': 855, 'max_depth': 53, 'min_samples_split': 103, 'min_samples_leaf': 53, 'criterion': 'gini'}.
Trial 1065 finished with value: 0.6847826086956522 and parameters: {'n_estimators': 179, 'max_depth': 9, 'min_samples_split': 39, 'min_samples_leaf': 43, 'criterion': 'entropy'}.
Trial 1066 finished with value: 0.717391304347826 and parameters: {'n_estimators': 800, 'max_depth': 11, 'min_samples_split': 86, 'min_samples_leaf': 58, 'criterion': 'entropy'}.
Trial 1067 finished with value: 0.6956521739130435 and parameters: {'n_estimators': 720, 'max_depth': 8, 'min_samples_split': 93, 'min_samples_leaf': 45, 'criterion': 'entropy'}.
Trial 1068 finished with value: 0.7065217391304348 and parameters: {'n_estimators': 817, 'max_depth': 12, 'min_samples_split': 48, 'min_samples_leaf': 51, 'criterion': 'entropy'}.
Trial 1069 finished with value: 0.6847826086956522 and parameters: {'n_estimators': 766, 'max_depth': 7, 'min_samples_split': 21, 'min_samples_leaf': 48, 'criterion': 'entropy'}.
Trial 1070 finished with value: 0.6956521739130435 and parameters: {'n_estimators': 839, 'max_depth': 10, 'min_samples_split': 27, 'min_samples_leaf': 55, 'criterion': 'entropy'}.
Trial 1071 finished with value: 0.6956521739130435 and parameters: {'n_estimators': 696, 'max_depth': 14, 'min_samples_split': 34, 'min_samples_leaf': 61, 'criterion': 'entropy'}.
Trial 1072 finished with value: 0.7065217391304348 and parameters: {'n_estimators': 789, 'max_depth': 12, 'min_samples_split': 43, 'min_samples_leaf': 52, 'criterion': 'entropy'}.
Trial 1073 finished with value: 0.717391304347826 and parameters: {'n_estimators': 500, 'max_depth': 9, 'min_samples_split': 17, 'min_samples_leaf': 49, 'criterion': 'entropy'}.
Trial 1074 finished with value: 0.6739130434782609 and parameters: {'n_estimators': 586, 'max_depth': 6, 'min_samples_split': 31, 'min_samples_leaf': 54, 'criterion': 'entropy'}.
Trial 1075 finished with value: 0.7065217391304348 and parameters: {'n_estimators': 825, 'max_depth': 11, 'min_samples_split': 23, 'min_samples_leaf': 46, 'criterion': 'entropy'}.
Trial 1076 finished with value: 0.7065217391304348 and parameters: {'n_estimators': 751, 'max_depth': 8, 'min_samples_split': 37, 'min_samples_leaf': 63, 'criterion': 'entropy'}.
Trial 1077 finished with value: 0.7065217391304348 and parameters: {'n_estimators': 806, 'max_depth': 14, 'min_samples_split': 106, 'min_samples_leaf': 59, 'criterion': 'entropy'}.
Trial 1078 finished with value: 0.7282608695652174 and parameters: {'n_estimators': 864, 'max_depth': 10, 'min_samples_split': 26, 'min_samples_leaf': 50, 'criterion': 'entropy'}.
Trial 1079 finished with value: 0.7065217391304348 and parameters: {'n_estimators': 635, 'max_depth': 16, 'min_samples_split': 33, 'min_samples_leaf': 56, 'criterion': 'entropy'}.
Trial 1080 finished with value: 0.6739130434782609 and parameters: {'n_estimators': 781, 'max_depth': 7, 'min_samples_split': 2, 'min_samples_leaf': 52, 'criterion': 'entropy'}.
Trial 1081 finished with value: 0.7065217391304348 and parameters: {'n_estimators': 961, 'max_depth': 12, 'min_samples_split': 29, 'min_samples_leaf': 67, 'criterion': 'entropy'}.
Trial 1082 finished with value: 0.6847826086956522 and parameters: {'n_estimators': 845, 'max_depth': 18, 'min_samples_split': 41, 'min_samples_leaf': 48, 'criterion': 'entropy'}.
Trial 1083 finished with value: 0.6304347826086957 and parameters: {'n_estimators': 566, 'max_depth': 5, 'min_samples_split': 20, 'min_samples_leaf': 57, 'criterion': 'gini'}.
Trial 1084 finished with value: 0.6956521739130435 and parameters: {'n_estimators': 804, 'max_depth': 9, 'min_samples_split': 36, 'min_samples_leaf': 54, 'criterion': 'entropy'}.
Trial 1085 finished with value: 0.6847826086956522 and parameters: {'n_estimators': 528, 'max_depth': 28, 'min_samples_split': 200, 'min_samples_leaf': 50, 'criterion': 'entropy'}.
Trial 1086 finished with value: 0.7065217391304348 and parameters: {'n_estimators': 900, 'max_depth': 13, 'min_samples_split': 24, 'min_samples_leaf': 47, 'criterion': 'entropy'}.
Trial 1087 finished with value: 0.7282608695652174 and parameters: {'n_estimators': 824, 'max_depth': 10, 'min_samples_split': 12, 'min_samples_leaf': 52, 'criterion': 'entropy'}.
Trial 1088 finished with value: 0.6739130434782609 and parameters: {'n_estimators': 788, 'max_depth': 50, 'min_samples_split': 29, 'min_samples_leaf': 50, 'criterion': 'entropy'}.
Trial 1089 finished with value: 0.6956521739130435 and parameters: {'n_estimators': 772, 'max_depth': 7, 'min_samples_split': 34, 'min_samples_leaf': 56, 'criterion': 'entropy'}.
Trial 1090 finished with value: 0.717391304347826 and parameters: {'n_estimators': 748, 'max_depth': 11, 'min_samples_split': 40, 'min_samples_leaf': 42, 'criterion': 'entropy'}.
Trial 1091 finished with value: 0.6956521739130435 and parameters: {'n_estimators': 877, 'max_depth': 15, 'min_samples_split': 17, 'min_samples_leaf': 53, 'criterion': 'entropy'}.
Trial 1092 finished with value: 0.7065217391304348 and parameters: {'n_estimators': 837, 'max_depth': 13, 'min_samples_split': 118, 'min_samples_leaf': 48, 'criterion': 'entropy'}.
Trial 1093 finished with value: 0.6956521739130435 and parameters: {'n_estimators': 808, 'max_depth': 9, 'min_samples_split': 27, 'min_samples_leaf': 45, 'criterion': 'entropy'}.
Trial 1094 finished with value: 0.717391304347826 and parameters: {'n_estimators': 821, 'max_depth': 11, 'min_samples_split': 125, 'min_samples_leaf': 59, 'criterion': 'entropy'}.
Trial 1095 finished with value: 0.6847826086956522 and parameters: {'n_estimators': 607, 'max_depth': 7, 'min_samples_split': 32, 'min_samples_leaf': 98, 'criterion': 'entropy'}.
Trial 1096 finished with value: 0.6847826086956522 and parameters: {'n_estimators': 859, 'max_depth': 56, 'min_samples_split': 44, 'min_samples_leaf': 51, 'criterion': 'entropy'}.
Trial 1097 finished with value: 0.7065217391304348 and parameters: {'n_estimators': 546, 'max_depth': 13, 'min_samples_split': 37, 'min_samples_leaf': 53, 'criterion': 'entropy'}.
Trial 1098 finished with value: 0.6956521739130435 and parameters: {'n_estimators': 807, 'max_depth': 9, 'min_samples_split': 23, 'min_samples_leaf': 76, 'criterion': 'entropy'}.
Trial 1099 finished with value: 0.6521739130434783 and parameters: {'n_estimators': 764, 'max_depth': 75, 'min_samples_split': 54, 'min_samples_leaf': 55, 'criterion': 'entropy'}.
Trial 1100 finished with value: 0.7065217391304348 and parameters: {'n_estimators': 786, 'max_depth': 11, 'min_samples_split': 30, 'min_samples_leaf': 70, 'criterion': 'entropy'}.
Trial 1101 finished with value: 0.6847826086956522 and parameters: {'n_estimators': 847, 'max_depth': 16, 'min_samples_split': 38, 'min_samples_leaf': 49, 'criterion': 'entropy'}.
Trial 1102 finished with value: 0.6847826086956522 and parameters: {'n_estimators': 795, 'max_depth': 8, 'min_samples_split': 99, 'min_samples_leaf': 51, 'criterion': 'gini'}.
Trial 1103 finished with value: 0.6521739130434783 and parameters: {'n_estimators': 822, 'max_depth': 5, 'min_samples_split': 145, 'min_samples_leaf': 46, 'criterion': 'entropy'}.
Trial 1104 finished with value: 0.717391304347826 and parameters: {'n_estimators': 742, 'max_depth': 10, 'min_samples_split': 19, 'min_samples_leaf': 57, 'criterion': 'entropy'}.
Trial 1105 finished with value: 0.7065217391304348 and parameters: {'n_estimators': 836, 'max_depth': 13, 'min_samples_split': 26, 'min_samples_leaf': 54, 'criterion': 'entropy'}.
Trial 1106 finished with value: 0.6195652173913043 and parameters: {'n_estimators': 771, 'max_depth': 8, 'min_samples_split': 33, 'min_samples_leaf': 21, 'criterion': 'entropy'}.
Trial 1107 finished with value: 0.6847826086956522 and parameters: {'n_estimators': 798, 'max_depth': 12, 'min_samples_split': 49, 'min_samples_leaf': 61, 'criterion': 'entropy'}.
Trial 1108 finished with value: 0.6847826086956522 and parameters: {'n_estimators': 879, 'max_depth': 22, 'min_samples_split': 109, 'min_samples_leaf': 48, 'criterion': 'entropy'}.
Trial 1109 finished with value: 0.6630434782608695 and parameters: {'n_estimators': 723, 'max_depth': 85, 'min_samples_split': 29, 'min_samples_leaf': 52, 'criterion': 'entropy'}.
Trial 1110 finished with value: 0.6630434782608695 and parameters: {'n_estimators': 857, 'max_depth': 15, 'min_samples_split': 24, 'min_samples_leaf': 50, 'criterion': 'entropy'}.
Trial 1111 finished with value: 0.6956521739130435 and parameters: {'n_estimators': 824, 'max_depth': 10, 'min_samples_split': 113, 'min_samples_leaf': 44, 'criterion': 'entropy'}.
Trial 1112 finished with value: 0.6739130434782609 and parameters: {'n_estimators': 928, 'max_depth': 6, 'min_samples_split': 34, 'min_samples_leaf': 58, 'criterion': 'entropy'}.
Trial 1113 finished with value: 0.6956521739130435 and parameters: {'n_estimators': 784, 'max_depth': 12, 'min_samples_split': 39, 'min_samples_leaf': 54, 'criterion': 'entropy'}.
Trial 1114 finished with value: 0.6956521739130435 and parameters: {'n_estimators': 522, 'max_depth': 9, 'min_samples_split': 31, 'min_samples_leaf': 48, 'criterion': 'entropy'}.
Trial 1115 finished with value: 0.6847826086956522 and parameters: {'n_estimators': 808, 'max_depth': 7, 'min_samples_split': 14, 'min_samples_leaf': 52, 'criterion': 'entropy'}.
Trial 1116 finished with value: 0.6413043478260869 and parameters: {'n_estimators': 212, 'max_depth': 81, 'min_samples_split': 21, 'min_samples_leaf': 56, 'criterion': 'entropy'}.
Trial 1117 finished with value: 0.6956521739130435 and parameters: {'n_estimators': 759, 'max_depth': 14, 'min_samples_split': 27, 'min_samples_leaf': 50, 'criterion': 'entropy'}.
Trial 1118 finished with value: 0.717391304347826 and parameters: {'n_estimators': 563, 'max_depth': 11, 'min_samples_split': 44, 'min_samples_leaf': 46, 'criterion': 'entropy'}.
Trial 1119 finished with value: 0.6956521739130435 and parameters: {'n_estimators': 836, 'max_depth': 9, 'min_samples_split': 102, 'min_samples_leaf': 54, 'criterion': 'entropy'}.
Trial 1120 finished with value: 0.6739130434782609 and parameters: {'n_estimators': 815, 'max_depth': 18, 'min_samples_split': 35, 'min_samples_leaf': 64, 'criterion': 'entropy'}.
Trial 1121 finished with value: 0.717391304347826 and parameters: {'n_estimators': 780, 'max_depth': 11, 'min_samples_split': 31, 'min_samples_leaf': 60, 'criterion': 'entropy'}.
Trial 1122 finished with value: 0.6739130434782609 and parameters: {'n_estimators': 859, 'max_depth': 7, 'min_samples_split': 40, 'min_samples_leaf': 50, 'criterion': 'gini'}.
Trial 1123 finished with value: 0.6847826086956522 and parameters: {'n_estimators': 843, 'max_depth': 14, 'min_samples_split': 132, 'min_samples_leaf': 47, 'criterion': 'entropy'}.
Trial 1124 finished with value: 0.6739130434782609 and parameters: {'n_estimators': 793, 'max_depth': 9, 'min_samples_split': 8, 'min_samples_leaf': 52, 'criterion': 'entropy'}.
Trial 1125 finished with value: 0.6521739130434783 and parameters: {'n_estimators': 738, 'max_depth': 5, 'min_samples_split': 159, 'min_samples_leaf': 56, 'criterion': 'entropy'}.
Trial 1126 finished with value: 0.717391304347826 and parameters: {'n_estimators': 808, 'max_depth': 13, 'min_samples_split': 23, 'min_samples_leaf': 49, 'criterion': 'entropy'}.
Trial 1127 finished with value: 0.7065217391304348 and parameters: {'n_estimators': 831, 'max_depth': 11, 'min_samples_split': 27, 'min_samples_leaf': 53, 'criterion': 'entropy'}.
Trial 1128 finished with value: 0.717391304347826 and parameters: {'n_estimators': 766, 'max_depth': 8, 'min_samples_split': 35, 'min_samples_leaf': 58, 'criterion': 'entropy'}.
Trial 1129 finished with value: 0.717391304347826 and parameters: {'n_estimators': 545, 'max_depth': 10, 'min_samples_split': 18, 'min_samples_leaf': 51, 'criterion': 'entropy'}.
Trial 1130 finished with value: 0.6956521739130435 and parameters: {'n_estimators': 577, 'max_depth': 15, 'min_samples_split': 30, 'min_samples_leaf': 48, 'criterion': 'entropy'}.
Trial 1131 finished with value: 0.7065217391304348 and parameters: {'n_estimators': 793, 'max_depth': 12, 'min_samples_split': 37, 'min_samples_leaf': 55, 'criterion': 'entropy'}.
Trial 1132 finished with value: 0.6304347826086957 and parameters: {'n_estimators': 819, 'max_depth': 7, 'min_samples_split': 25, 'min_samples_leaf': 30, 'criterion': 'entropy'}.
Trial 1133 finished with value: 0.7065217391304348 and parameters: {'n_estimators': 703, 'max_depth': 9, 'min_samples_split': 33, 'min_samples_leaf': 45, 'criterion': 'entropy'}.
Trial 1134 finished with value: 0.6630434782608695 and parameters: {'n_estimators': 907, 'max_depth': 92, 'min_samples_split': 41, 'min_samples_leaf': 52, 'criterion': 'entropy'}.
Trial 1135 finished with value: 0.7065217391304348 and parameters: {'n_estimators': 885, 'max_depth': 12, 'min_samples_split': 21, 'min_samples_leaf': 50, 'criterion': 'entropy'}.
Trial 1136 finished with value: 0.6086956521739131 and parameters: {'n_estimators': 161, 'max_depth': 17, 'min_samples_split': 29, 'min_samples_leaf': 47, 'criterion': 'entropy'}.
Trial 1137 finished with value: 0.7065217391304348 and parameters: {'n_estimators': 857, 'max_depth': 10, 'min_samples_split': 36, 'min_samples_leaf': 54, 'criterion': 'entropy'}.
Trial 1138 finished with value: 0.6956521739130435 and parameters: {'n_estimators': 777, 'max_depth': 7, 'min_samples_split': 25, 'min_samples_leaf': 57, 'criterion': 'entropy'}.
Trial 1139 finished with value: 0.7065217391304348 and parameters: {'n_estimators': 801, 'max_depth': 14, 'min_samples_split': 17, 'min_samples_leaf': 59, 'criterion': 'entropy'}.
Trial 1140 finished with value: 0.6413043478260869 and parameters: {'n_estimators': 981, 'max_depth': 5, 'min_samples_split': 44, 'min_samples_leaf': 49, 'criterion': 'gini'}.
Trial 1141 finished with value: 0.6956521739130435 and parameters: {'n_estimators': 839, 'max_depth': 12, 'min_samples_split': 106, 'min_samples_leaf': 53, 'criterion': 'entropy'}.
Trial 1142 finished with value: 0.7065217391304348 and parameters: {'n_estimators': 753, 'max_depth': 9, 'min_samples_split': 96, 'min_samples_leaf': 40, 'criterion': 'entropy'}.
Trial 1143 finished with value: 0.717391304347826 and parameters: {'n_estimators': 594, 'max_depth': 11, 'min_samples_split': 74, 'min_samples_leaf': 62, 'criterion': 'entropy'}.
Trial 1144 finished with value: 0.6847826086956522 and parameters: {'n_estimators': 822, 'max_depth': 16, 'min_samples_split': 32, 'min_samples_leaf': 43, 'criterion': 'entropy'}.
Trial 1145 finished with value: 0.6956521739130435 and parameters: {'n_estimators': 872, 'max_depth': 8, 'min_samples_split': 38, 'min_samples_leaf': 51, 'criterion': 'entropy'}.
Trial 1146 finished with value: 0.7065217391304348 and parameters: {'n_estimators': 512, 'max_depth': 13, 'min_samples_split': 27, 'min_samples_leaf': 56, 'criterion': 'entropy'}.
Trial 1147 finished with value: 0.6956521739130435 and parameters: {'n_estimators': 793, 'max_depth': 10, 'min_samples_split': 32, 'min_samples_leaf': 47, 'criterion': 'entropy'}.
Trial 1148 finished with value: 0.6630434782608695 and parameters: {'n_estimators': 774, 'max_depth': 7, 'min_samples_split': 61, 'min_samples_leaf': 51, 'criterion': 'entropy'}.
Trial 1149 finished with value: 0.717391304347826 and parameters: {'n_estimators': 813, 'max_depth': 11, 'min_samples_split': 22, 'min_samples_leaf': 54, 'criterion': 'entropy'}.
Trial 1150 finished with value: 0.717391304347826 and parameters: {'n_estimators': 848, 'max_depth': 13, 'min_samples_split': 28, 'min_samples_leaf': 49, 'criterion': 'entropy'}.
Trial 1151 finished with value: 0.6847826086956522 and parameters: {'n_estimators': 730, 'max_depth': 9, 'min_samples_split': 11, 'min_samples_leaf': 52, 'criterion': 'entropy'}.
Trial 1152 finished with value: 0.6847826086956522 and parameters: {'n_estimators': 836, 'max_depth': 15, 'min_samples_split': 36, 'min_samples_leaf': 45, 'criterion': 'entropy'}.
Trial 1153 finished with value: 0.6739130434782609 and parameters: {'n_estimators': 804, 'max_depth': 6, 'min_samples_split': 41, 'min_samples_leaf': 55, 'criterion': 'entropy'}.
Trial 1154 finished with value: 0.7065217391304348 and parameters: {'n_estimators': 538, 'max_depth': 10, 'min_samples_split': 32, 'min_samples_leaf': 59, 'criterion': 'entropy'}.
Trial 1155 finished with value: 0.6956521739130435 and parameters: {'n_estimators': 762, 'max_depth': 34, 'min_samples_split': 91, 'min_samples_leaf': 48, 'criterion': 'entropy'}.
Trial 1156 finished with value: 0.6739130434782609 and parameters: {'n_estimators': 473, 'max_depth': 8, 'min_samples_split': 47, 'min_samples_leaf': 50, 'criterion': 'entropy'}.
Trial 1157 finished with value: 0.6956521739130435 and parameters: {'n_estimators': 823, 'max_depth': 13, 'min_samples_split': 24, 'min_samples_leaf': 57, 'criterion': 'entropy'}.
Trial 1158 finished with value: 0.7065217391304348 and parameters: {'n_estimators': 786, 'max_depth': 11, 'min_samples_split': 19, 'min_samples_leaf': 53, 'criterion': 'entropy'}.
Trial 1159 finished with value: 0.6956521739130435 and parameters: {'n_estimators': 809, 'max_depth': 8, 'min_samples_split': 29, 'min_samples_leaf': 46, 'criterion': 'gini'}.
Trial 1160 finished with value: 0.6413043478260869 and parameters: {'n_estimators': 947, 'max_depth': 5, 'min_samples_split': 36, 'min_samples_leaf': 51, 'criterion': 'entropy'}.
Trial 1161 finished with value: 0.7065217391304348 and parameters: {'n_estimators': 863, 'max_depth': 12, 'min_samples_split': 40, 'min_samples_leaf': 49, 'criterion': 'entropy'}.
Trial 1162 finished with value: 0.6630434782608695 and parameters: {'n_estimators': 749, 'max_depth': 42, 'min_samples_split': 16, 'min_samples_leaf': 61, 'criterion': 'entropy'}.
Trial 1163 finished with value: 0.6956521739130435 and parameters: {'n_estimators': 830, 'max_depth': 10, 'min_samples_split': 33, 'min_samples_leaf': 55, 'criterion': 'entropy'}.
Trial 1164 finished with value: 0.7065217391304348 and parameters: {'n_estimators': 785, 'max_depth': 14, 'min_samples_split': 113, 'min_samples_leaf': 52, 'criterion': 'entropy'}.
Trial 1165 finished with value: 0.7065217391304348 and parameters: {'n_estimators': 843, 'max_depth': 9, 'min_samples_split': 26, 'min_samples_leaf': 48, 'criterion': 'entropy'}.
Trial 1166 finished with value: 0.6847826086956522 and parameters: {'n_estimators': 685, 'max_depth': 16, 'min_samples_split': 22, 'min_samples_leaf': 44, 'criterion': 'entropy'}.
Trial 1167 finished with value: 0.6956521739130435 and parameters: {'n_estimators': 809, 'max_depth': 7, 'min_samples_split': 29, 'min_samples_leaf': 57, 'criterion': 'entropy'}.
