Trial 8413 finished with value: 0.6956521739130435 and parameters: {'n_estimators': 822, 'max_depth': 14, 'min_samples_split': 138, 'min_samples_leaf': 59, 'criterion': 'gini'}.
Trial 8414 finished with value: 0.6739130434782609 and parameters: {'n_estimators': 414, 'max_depth': 16, 'min_samples_split': 117, 'min_samples_leaf': 49, 'criterion': 'entropy'}.
Trial 8415 finished with value: 0.7282608695652174 and parameters: {'n_estimators': 319, 'max_depth': 8, 'min_samples_split': 33, 'min_samples_leaf': 56, 'criterion': 'entropy'}.
Trial 8416 finished with value: 0.6630434782608695 and parameters: {'n_estimators': 757, 'max_depth': 5, 'min_samples_split': 42, 'min_samples_leaf': 64, 'criterion': 'gini'}.
Trial 8417 finished with value: 0.7065217391304348 and parameters: {'n_estimators': 908, 'max_depth': 12, 'min_samples_split': 145, 'min_samples_leaf': 58, 'criterion': 'entropy'}.
Trial 8418 finished with value: 0.717391304347826 and parameters: {'n_estimators': 260, 'max_depth': 10, 'min_samples_split': 37, 'min_samples_leaf': 61, 'criterion': 'gini'}.
Trial 8419 finished with value: 0.717391304347826 and parameters: {'n_estimators': 283, 'max_depth': 8, 'min_samples_split': 31, 'min_samples_leaf': 73, 'criterion': 'entropy'}.
Trial 8420 finished with value: 0.717391304347826 and parameters: {'n_estimators': 245, 'max_depth': 13, 'min_samples_split': 131, 'min_samples_leaf': 54, 'criterion': 'gini'}.
Trial 8421 finished with value: 0.7065217391304348 and parameters: {'n_estimators': 351, 'max_depth': 10, 'min_samples_split': 157, 'min_samples_leaf': 57, 'criterion': 'entropy'}.
Trial 8422 finished with value: 0.6956521739130435 and parameters: {'n_estimators': 865, 'max_depth': 18, 'min_samples_split': 151, 'min_samples_leaf': 60, 'criterion': 'gini'}.
Trial 8423 finished with value: 0.6739130434782609 and parameters: {'n_estimators': 782, 'max_depth': 7, 'min_samples_split': 16, 'min_samples_leaf': 53, 'criterion': 'entropy'}.
Trial 8424 finished with value: 0.6956521739130435 and parameters: {'n_estimators': 628, 'max_depth': 15, 'min_samples_split': 48, 'min_samples_leaf': 70, 'criterion': 'entropy'}.
Trial 8425 finished with value: 0.7065217391304348 and parameters: {'n_estimators': 304, 'max_depth': 11, 'min_samples_split': 28, 'min_samples_leaf': 68, 'criterion': 'gini'}.
Trial 8426 finished with value: 0.717391304347826 and parameters: {'n_estimators': 271, 'max_depth': 13, 'min_samples_split': 20, 'min_samples_leaf': 59, 'criterion': 'entropy'}.
Trial 8427 finished with value: 0.7065217391304348 and parameters: {'n_estimators': 206, 'max_depth': 9, 'min_samples_split': 122, 'min_samples_leaf': 62, 'criterion': 'gini'}.
Trial 8428 finished with value: 0.6739130434782609 and parameters: {'n_estimators': 331, 'max_depth': 6, 'min_samples_split': 39, 'min_samples_leaf': 82, 'criterion': 'entropy'}.
Trial 8429 finished with value: 0.6847826086956522 and parameters: {'n_estimators': 702, 'max_depth': 47, 'min_samples_split': 110, 'min_samples_leaf': 36, 'criterion': 'gini'}.
Trial 8430 finished with value: 0.717391304347826 and parameters: {'n_estimators': 155, 'max_depth': 11, 'min_samples_split': 11, 'min_samples_leaf': 57, 'criterion': 'entropy'}.
Trial 8431 finished with value: 0.6956521739130435 and parameters: {'n_estimators': 226, 'max_depth': 8, 'min_samples_split': 35, 'min_samples_leaf': 66, 'criterion': 'gini'}.
Trial 8432 finished with value: 0.717391304347826 and parameters: {'n_estimators': 288, 'max_depth': 13, 'min_samples_split': 140, 'min_samples_leaf': 51, 'criterion': 'entropy'}.
Trial 8433 finished with value: 0.6847826086956522 and parameters: {'n_estimators': 768, 'max_depth': 15, 'min_samples_split': 25, 'min_samples_leaf': 55, 'criterion': 'entropy'}.
Trial 8434 finished with value: 0.6847826086956522 and parameters: {'n_estimators': 256, 'max_depth': 10, 'min_samples_split': 30, 'min_samples_leaf': 64, 'criterion': 'gini'}.
Trial 8435 finished with value: 0.6956521739130435 and parameters: {'n_estimators': 308, 'max_depth': 12, 'min_samples_split': 134, 'min_samples_leaf': 59, 'criterion': 'entropy'}.
Trial 8436 finished with value: 0.7065217391304348 and parameters: {'n_estimators': 274, 'max_depth': 7, 'min_samples_split': 34, 'min_samples_leaf': 75, 'criterion': 'gini'}.
Trial 8437 finished with value: 0.6956521739130435 and parameters: {'n_estimators': 728, 'max_depth': 9, 'min_samples_split': 43, 'min_samples_leaf': 61, 'criterion': 'entropy'}.
Trial 8438 finished with value: 0.6413043478260869 and parameters: {'n_estimators': 799, 'max_depth': 5, 'min_samples_split': 55, 'min_samples_leaf': 56, 'criterion': 'gini'}.
Trial 8439 finished with value: 0.717391304347826 and parameters: {'n_estimators': 240, 'max_depth': 11, 'min_samples_split': 22, 'min_samples_leaf': 71, 'criterion': 'entropy'}.
Trial 8440 finished with value: 0.6847826086956522 and parameters: {'n_estimators': 297, 'max_depth': 14, 'min_samples_split': 144, 'min_samples_leaf': 58, 'criterion': 'gini'}.
Trial 8441 finished with value: 0.6956521739130435 and parameters: {'n_estimators': 255, 'max_depth': 8, 'min_samples_split': 37, 'min_samples_leaf': 61, 'criterion': 'entropy'}.
Trial 8442 finished with value: 0.6847826086956522 and parameters: {'n_estimators': 569, 'max_depth': 17, 'min_samples_split': 27, 'min_samples_leaf': 53, 'criterion': 'entropy'}.
Trial 8443 finished with value: 0.7065217391304348 and parameters: {'n_estimators': 378, 'max_depth': 10, 'min_samples_split': 31, 'min_samples_leaf': 63, 'criterion': 'gini'}.
Trial 8444 finished with value: 0.7065217391304348 and parameters: {'n_estimators': 277, 'max_depth': 12, 'min_samples_split': 149, 'min_samples_leaf': 56, 'criterion': 'entropy'}.
Trial 8445 finished with value: 0.7065217391304348 and parameters: {'n_estimators': 742, 'max_depth': 9, 'min_samples_split': 138, 'min_samples_leaf': 73, 'criterion': 'gini'}.
Trial 8446 finished with value: 0.6847826086956522 and parameters: {'n_estimators': 326, 'max_depth': 15, 'min_samples_split': 41, 'min_samples_leaf': 59, 'criterion': 'entropy'}.
Trial 8447 finished with value: 0.7065217391304348 and parameters: {'n_estimators': 295, 'max_depth': 12, 'min_samples_split': 2, 'min_samples_leaf': 57, 'criterion': 'gini'}.
Trial 8448 finished with value: 0.6847826086956522 and parameters: {'n_estimators': 118, 'max_depth': 7, 'min_samples_split': 35, 'min_samples_leaf': 60, 'criterion': 'entropy'}.
Trial 8449 finished with value: 0.7065217391304348 and parameters: {'n_estimators': 264, 'max_depth': 10, 'min_samples_split': 129, 'min_samples_leaf': 69, 'criterion': 'gini'}.
Trial 8450 finished with value: 0.7065217391304348 and parameters: {'n_estimators': 756, 'max_depth': 13, 'min_samples_split': 23, 'min_samples_leaf': 55, 'criterion': 'entropy'}.
Trial 8451 finished with value: 0.6413043478260869 and parameters: {'n_estimators': 243, 'max_depth': 5, 'min_samples_split': 118, 'min_samples_leaf': 66, 'criterion': 'entropy'}.
Trial 8452 finished with value: 0.6956521739130435 and parameters: {'n_estimators': 313, 'max_depth': 27, 'min_samples_split': 31, 'min_samples_leaf': 62, 'criterion': 'gini'}.
Trial 8453 finished with value: 0.7065217391304348 and parameters: {'n_estimators': 774, 'max_depth': 8, 'min_samples_split': 26, 'min_samples_leaf': 72, 'criterion': 'entropy'}.
Trial 8454 finished with value: 0.717391304347826 and parameters: {'n_estimators': 282, 'max_depth': 11, 'min_samples_split': 17, 'min_samples_leaf': 58, 'criterion': 'gini'}.
Trial 8455 finished with value: 0.7065217391304348 and parameters: {'n_estimators': 339, 'max_depth': 15, 'min_samples_split': 142, 'min_samples_leaf': 64, 'criterion': 'entropy'}.
Trial 8456 finished with value: 0.6956521739130435 and parameters: {'n_estimators': 226, 'max_depth': 9, 'min_samples_split': 39, 'min_samples_leaf': 54, 'criterion': 'gini'}.
Trial 8457 finished with value: 0.6956521739130435 and parameters: {'n_estimators': 263, 'max_depth': 7, 'min_samples_split': 124, 'min_samples_leaf': 76, 'criterion': 'entropy'}.
Trial 8458 finished with value: 0.7065217391304348 and parameters: {'n_estimators': 794, 'max_depth': 13, 'min_samples_split': 32, 'min_samples_leaf': 60, 'criterion': 'gini'}.
Trial 8459 finished with value: 0.717391304347826 and parameters: {'n_estimators': 289, 'max_depth': 11, 'min_samples_split': 45, 'min_samples_leaf': 51, 'criterion': 'entropy'}.
Trial 8460 finished with value: 0.6739130434782609 and parameters: {'n_estimators': 308, 'max_depth': 60, 'min_samples_split': 162, 'min_samples_leaf': 58, 'criterion': 'entropy'}.
Trial 8461 finished with value: 0.6956521739130435 and parameters: {'n_estimators': 972, 'max_depth': 17, 'min_samples_split': 136, 'min_samples_leaf': 56, 'criterion': 'gini'}.
Trial 8462 finished with value: 0.6739130434782609 and parameters: {'n_estimators': 848, 'max_depth': 9, 'min_samples_split': 20, 'min_samples_leaf': 68, 'criterion': 'entropy'}.
Trial 8463 finished with value: 0.7065217391304348 and parameters: {'n_estimators': 716, 'max_depth': 14, 'min_samples_split': 29, 'min_samples_leaf': 62, 'criterion': 'gini'}.
Trial 8464 finished with value: 0.6956521739130435 and parameters: {'n_estimators': 194, 'max_depth': 7, 'min_samples_split': 34, 'min_samples_leaf': 59, 'criterion': 'entropy'}.
Trial 8465 finished with value: 0.7065217391304348 and parameters: {'n_estimators': 269, 'max_depth': 11, 'min_samples_split': 38, 'min_samples_leaf': 78, 'criterion': 'gini'}.
Trial 8466 finished with value: 0.6956521739130435 and parameters: {'n_estimators': 827, 'max_depth': 10, 'min_samples_split': 26, 'min_samples_leaf': 54, 'criterion': 'entropy'}.
Trial 8467 finished with value: 0.6630434782608695 and parameters: {'n_estimators': 255, 'max_depth': 5, 'min_samples_split': 131, 'min_samples_leaf': 71, 'criterion': 'gini'}.
Trial 8468 finished with value: 0.6956521739130435 and parameters: {'n_estimators': 290, 'max_depth': 13, 'min_samples_split': 49, 'min_samples_leaf': 74, 'criterion': 'entropy'}.
Trial 8469 finished with value: 0.7065217391304348 and parameters: {'n_estimators': 750, 'max_depth': 8, 'min_samples_split': 147, 'min_samples_leaf': 57, 'criterion': 'gini'}.
Trial 8470 finished with value: 0.6739130434782609 and parameters: {'n_estimators': 317, 'max_depth': 19, 'min_samples_split': 115, 'min_samples_leaf': 61, 'criterion': 'entropy'}.
Trial 8471 finished with value: 0.6847826086956522 and parameters: {'n_estimators': 243, 'max_depth': 12, 'min_samples_split': 36, 'min_samples_leaf': 65, 'criterion': 'entropy'}.
Trial 8472 finished with value: 0.6847826086956522 and parameters: {'n_estimators': 509, 'max_depth': 16, 'min_samples_split': 29, 'min_samples_leaf': 53, 'criterion': 'gini'}.
Trial 8473 finished with value: 0.75 and parameters: {'n_estimators': 297, 'max_depth': 9, 'min_samples_split': 42, 'min_samples_leaf': 56, 'criterion': 'entropy'}.
Trial 8474 finished with value: 0.717391304347826 and parameters: {'n_estimators': 350, 'max_depth': 10, 'min_samples_split': 51, 'min_samples_leaf': 52, 'criterion': 'entropy'}.
Trial 8475 finished with value: 0.6630434782608695 and parameters: {'n_estimators': 339, 'max_depth': 7, 'min_samples_split': 48, 'min_samples_leaf': 52, 'criterion': 'entropy'}.
Trial 8476 finished with value: 0.6956521739130435 and parameters: {'n_estimators': 338, 'max_depth': 12, 'min_samples_split': 49, 'min_samples_leaf': 52, 'criterion': 'entropy'}.
Trial 8477 finished with value: 0.7282608695652174 and parameters: {'n_estimators': 338, 'max_depth': 10, 'min_samples_split': 44, 'min_samples_leaf': 49, 'criterion': 'entropy'}.
Trial 8478 finished with value: 0.6847826086956522 and parameters: {'n_estimators': 356, 'max_depth': 14, 'min_samples_split': 48, 'min_samples_leaf': 53, 'criterion': 'entropy'}.
Trial 8479 finished with value: 0.717391304347826 and parameters: {'n_estimators': 329, 'max_depth': 8, 'min_samples_split': 52, 'min_samples_leaf': 53, 'criterion': 'entropy'}.
Trial 8480 finished with value: 0.6739130434782609 and parameters: {'n_estimators': 358, 'max_depth': 52, 'min_samples_split': 50, 'min_samples_leaf': 51, 'criterion': 'entropy'}.
Trial 8481 finished with value: 0.6630434782608695 and parameters: {'n_estimators': 322, 'max_depth': 6, 'min_samples_split': 43, 'min_samples_leaf': 55, 'criterion': 'entropy'}.
Trial 8482 finished with value: 0.7282608695652174 and parameters: {'n_estimators': 331, 'max_depth': 11, 'min_samples_split': 45, 'min_samples_leaf': 54, 'criterion': 'entropy'}.
Trial 8483 finished with value: 0.6956521739130435 and parameters: {'n_estimators': 326, 'max_depth': 14, 'min_samples_split': 47, 'min_samples_leaf': 54, 'criterion': 'entropy'}.
Trial 8484 finished with value: 0.7065217391304348 and parameters: {'n_estimators': 323, 'max_depth': 9, 'min_samples_split': 45, 'min_samples_leaf': 50, 'criterion': 'entropy'}.
Trial 8485 finished with value: 0.6630434782608695 and parameters: {'n_estimators': 344, 'max_depth': 39, 'min_samples_split': 46, 'min_samples_leaf': 55, 'criterion': 'entropy'}.
Trial 8486 finished with value: 0.717391304347826 and parameters: {'n_estimators': 321, 'max_depth': 12, 'min_samples_split': 48, 'min_samples_leaf': 54, 'criterion': 'entropy'}.
Trial 8487 finished with value: 0.6739130434782609 and parameters: {'n_estimators': 319, 'max_depth': 21, 'min_samples_split': 43, 'min_samples_leaf': 51, 'criterion': 'entropy'}.
Trial 8488 finished with value: 0.6956521739130435 and parameters: {'n_estimators': 348, 'max_depth': 16, 'min_samples_split': 47, 'min_samples_leaf': 55, 'criterion': 'entropy'}.
Trial 8489 finished with value: 0.7282608695652174 and parameters: {'n_estimators': 321, 'max_depth': 9, 'min_samples_split': 47, 'min_samples_leaf': 53, 'criterion': 'entropy'}.
Trial 8490 finished with value: 0.6630434782608695 and parameters: {'n_estimators': 321, 'max_depth': 31, 'min_samples_split': 45, 'min_samples_leaf': 55, 'criterion': 'entropy'}.
Trial 8491 finished with value: 0.6739130434782609 and parameters: {'n_estimators': 375, 'max_depth': 6, 'min_samples_split': 56, 'min_samples_leaf': 53, 'criterion': 'entropy'}.
Trial 8492 finished with value: 0.6630434782608695 and parameters: {'n_estimators': 309, 'max_depth': 100, 'min_samples_split': 42, 'min_samples_leaf': 55, 'criterion': 'entropy'}.
Trial 8493 finished with value: 0.7065217391304348 and parameters: {'n_estimators': 339, 'max_depth': 11, 'min_samples_split': 48, 'min_samples_leaf': 52, 'criterion': 'entropy'}.
Trial 8494 finished with value: 0.6739130434782609 and parameters: {'n_estimators': 315, 'max_depth': 13, 'min_samples_split': 45, 'min_samples_leaf': 56, 'criterion': 'entropy'}.
Trial 8495 finished with value: 0.7282608695652174 and parameters: {'n_estimators': 305, 'max_depth': 8, 'min_samples_split': 44, 'min_samples_leaf': 55, 'criterion': 'entropy'}.
Trial 8496 finished with value: 0.717391304347826 and parameters: {'n_estimators': 364, 'max_depth': 10, 'min_samples_split': 43, 'min_samples_leaf': 55, 'criterion': 'entropy'}.
Trial 8497 finished with value: 0.6847826086956522 and parameters: {'n_estimators': 310, 'max_depth': 15, 'min_samples_split': 52, 'min_samples_leaf': 49, 'criterion': 'entropy'}.
Trial 8498 finished with value: 0.6847826086956522 and parameters: {'n_estimators': 309, 'max_depth': 6, 'min_samples_split': 49, 'min_samples_leaf': 56, 'criterion': 'entropy'}.
Trial 8499 finished with value: 0.7065217391304348 and parameters: {'n_estimators': 351, 'max_depth': 12, 'min_samples_split': 45, 'min_samples_leaf': 51, 'criterion': 'entropy'}.
Trial 8500 finished with value: 0.717391304347826 and parameters: {'n_estimators': 334, 'max_depth': 8, 'min_samples_split': 40, 'min_samples_leaf': 53, 'criterion': 'entropy'}.
Trial 8501 finished with value: 0.7065217391304348 and parameters: {'n_estimators': 326, 'max_depth': 10, 'min_samples_split': 51, 'min_samples_leaf': 56, 'criterion': 'entropy'}.
Trial 8502 finished with value: 0.6847826086956522 and parameters: {'n_estimators': 317, 'max_depth': 13, 'min_samples_split': 34, 'min_samples_leaf': 56, 'criterion': 'entropy'}.
Trial 8503 finished with value: 0.6847826086956522 and parameters: {'n_estimators': 332, 'max_depth': 18, 'min_samples_split': 50, 'min_samples_leaf': 57, 'criterion': 'entropy'}.
Trial 8504 finished with value: 0.6413043478260869 and parameters: {'n_estimators': 303, 'max_depth': 5, 'min_samples_split': 42, 'min_samples_leaf': 53, 'criterion': 'entropy'}.
Trial 8505 finished with value: 0.7282608695652174 and parameters: {'n_estimators': 298, 'max_depth': 8, 'min_samples_split': 53, 'min_samples_leaf': 54, 'criterion': 'entropy'}.
Trial 8506 finished with value: 0.7065217391304348 and parameters: {'n_estimators': 321, 'max_depth': 10, 'min_samples_split': 43, 'min_samples_leaf': 57, 'criterion': 'entropy'}.
Trial 8507 finished with value: 0.6847826086956522 and parameters: {'n_estimators': 306, 'max_depth': 15, 'min_samples_split': 53, 'min_samples_leaf': 56, 'criterion': 'entropy'}.
Trial 8508 finished with value: 0.717391304347826 and parameters: {'n_estimators': 309, 'max_depth': 12, 'min_samples_split': 41, 'min_samples_leaf': 54, 'criterion': 'entropy'}.
Trial 8509 finished with value: 0.6739130434782609 and parameters: {'n_estimators': 301, 'max_depth': 7, 'min_samples_split': 44, 'min_samples_leaf': 51, 'criterion': 'entropy'}.
Trial 8510 finished with value: 0.717391304347826 and parameters: {'n_estimators': 339, 'max_depth': 11, 'min_samples_split': 48, 'min_samples_leaf': 57, 'criterion': 'entropy'}.
Trial 8511 finished with value: 0.7282608695652174 and parameters: {'n_estimators': 302, 'max_depth': 9, 'min_samples_split': 42, 'min_samples_leaf': 57, 'criterion': 'entropy'}.
Trial 8512 finished with value: 0.6847826086956522 and parameters: {'n_estimators': 302, 'max_depth': 13, 'min_samples_split': 41, 'min_samples_leaf': 55, 'criterion': 'entropy'}.
Trial 8513 finished with value: 0.6739130434782609 and parameters: {'n_estimators': 326, 'max_depth': 16, 'min_samples_split': 45, 'min_samples_leaf': 52, 'criterion': 'entropy'}.
Trial 8514 finished with value: 0.7391304347826086 and parameters: {'n_estimators': 297, 'max_depth': 9, 'min_samples_split': 47, 'min_samples_leaf': 57, 'criterion': 'entropy'}.
Trial 8515 finished with value: 0.7282608695652174 and parameters: {'n_estimators': 344, 'max_depth': 11, 'min_samples_split': 41, 'min_samples_leaf': 54, 'criterion': 'entropy'}.
Trial 8516 finished with value: 0.6630434782608695 and parameters: {'n_estimators': 361, 'max_depth': 7, 'min_samples_split': 41, 'min_samples_leaf': 57, 'criterion': 'entropy'}.
Trial 8517 finished with value: 0.6847826086956522 and parameters: {'n_estimators': 318, 'max_depth': 14, 'min_samples_split': 46, 'min_samples_leaf': 55, 'criterion': 'entropy'}.
Trial 8518 finished with value: 0.6413043478260869 and parameters: {'n_estimators': 295, 'max_depth': 5, 'min_samples_split': 54, 'min_samples_leaf': 58, 'criterion': 'entropy'}.
Trial 8519 finished with value: 0.717391304347826 and parameters: {'n_estimators': 768, 'max_depth': 11, 'min_samples_split': 38, 'min_samples_leaf': 57, 'criterion': 'entropy'}.
Trial 8520 finished with value: 0.6739130434782609 and parameters: {'n_estimators': 309, 'max_depth': 96, 'min_samples_split': 41, 'min_samples_leaf': 50, 'criterion': 'entropy'}.
Trial 8521 finished with value: 0.6847826086956522 and parameters: {'n_estimators': 735, 'max_depth': 9, 'min_samples_split': 40, 'min_samples_leaf': 53, 'criterion': 'entropy'}.
Trial 8522 finished with value: 0.717391304347826 and parameters: {'n_estimators': 787, 'max_depth': 13, 'min_samples_split': 45, 'min_samples_leaf': 55, 'criterion': 'entropy'}.
Trial 8523 finished with value: 0.6847826086956522 and parameters: {'n_estimators': 687, 'max_depth': 7, 'min_samples_split': 41, 'min_samples_leaf': 57, 'criterion': 'entropy'}.
Trial 8524 finished with value: 0.7391304347826086 and parameters: {'n_estimators': 331, 'max_depth': 10, 'min_samples_split': 51, 'min_samples_leaf': 58, 'criterion': 'entropy'}.
Trial 8525 finished with value: 0.6847826086956522 and parameters: {'n_estimators': 290, 'max_depth': 14, 'min_samples_split': 39, 'min_samples_leaf': 55, 'criterion': 'entropy'}.
Trial 8526 finished with value: 0.7065217391304348 and parameters: {'n_estimators': 386, 'max_depth': 12, 'min_samples_split': 43, 'min_samples_leaf': 58, 'criterion': 'entropy'}.
Trial 8527 finished with value: 0.6521739130434783 and parameters: {'n_estimators': 297, 'max_depth': 35, 'min_samples_split': 40, 'min_samples_leaf': 52, 'criterion': 'entropy'}.
Trial 8528 finished with value: 0.7282608695652174 and parameters: {'n_estimators': 811, 'max_depth': 8, 'min_samples_split': 49, 'min_samples_leaf': 56, 'criterion': 'entropy'}.
Trial 8529 finished with value: 0.6630434782608695 and parameters: {'n_estimators': 469, 'max_depth': 17, 'min_samples_split': 46, 'min_samples_leaf': 59, 'criterion': 'entropy'}.
Trial 8530 finished with value: 0.717391304347826 and parameters: {'n_estimators': 402, 'max_depth': 10, 'min_samples_split': 39, 'min_samples_leaf': 54, 'criterion': 'entropy'}.
Trial 8531 finished with value: 0.6956521739130435 and parameters: {'n_estimators': 716, 'max_depth': 12, 'min_samples_split': 44, 'min_samples_leaf': 56, 'criterion': 'entropy'}.
Trial 8532 finished with value: 0.6739130434782609 and parameters: {'n_estimators': 317, 'max_depth': 7, 'min_samples_split': 39, 'min_samples_leaf': 58, 'criterion': 'entropy'}.
Trial 8533 finished with value: 0.6956521739130435 and parameters: {'n_estimators': 764, 'max_depth': 15, 'min_samples_split': 39, 'min_samples_leaf': 49, 'criterion': 'entropy'}.
Trial 8534 finished with value: 0.6630434782608695 and parameters: {'n_estimators': 293, 'max_depth': 23, 'min_samples_split': 42, 'min_samples_leaf': 53, 'criterion': 'entropy'}.
