Trial 7675 finished with value: 0.7065217391304348 and parameters: {'n_estimators': 769, 'max_depth': 9, 'min_samples_split': 17, 'min_samples_leaf': 57, 'criterion': 'entropy'}.
Trial 7676 finished with value: 0.6847826086956522 and parameters: {'n_estimators': 800, 'max_depth': 6, 'min_samples_split': 37, 'min_samples_leaf': 69, 'criterion': 'entropy'}.
Trial 7677 finished with value: 0.6847826086956522 and parameters: {'n_estimators': 295, 'max_depth': 13, 'min_samples_split': 50, 'min_samples_leaf': 50, 'criterion': 'gini'}.
Trial 7678 finished with value: 0.6521739130434783 and parameters: {'n_estimators': 210, 'max_depth': 10, 'min_samples_split': 32, 'min_samples_leaf': 77, 'criterion': 'entropy'}.
Trial 7679 finished with value: 0.7065217391304348 and parameters: {'n_estimators': 266, 'max_depth': 12, 'min_samples_split': 21, 'min_samples_leaf': 61, 'criterion': 'gini'}.
Trial 7680 finished with value: 0.7065217391304348 and parameters: {'n_estimators': 717, 'max_depth': 7, 'min_samples_split': 112, 'min_samples_leaf': 58, 'criterion': 'entropy'}.
Trial 7681 finished with value: 0.6956521739130435 and parameters: {'n_estimators': 241, 'max_depth': 24, 'min_samples_split': 119, 'min_samples_leaf': 54, 'criterion': 'gini'}.
Trial 7682 finished with value: 0.6847826086956522 and parameters: {'n_estimators': 309, 'max_depth': 15, 'min_samples_split': 35, 'min_samples_leaf': 72, 'criterion': 'entropy'}.
Trial 7683 finished with value: 0.7065217391304348 and parameters: {'n_estimators': 291, 'max_depth': 9, 'min_samples_split': 28, 'min_samples_leaf': 65, 'criterion': 'gini'}.
Trial 7684 finished with value: 0.6413043478260869 and parameters: {'n_estimators': 268, 'max_depth': 5, 'min_samples_split': 145, 'min_samples_leaf': 59, 'criterion': 'entropy'}.
Trial 7685 finished with value: 0.6739130434782609 and parameters: {'n_estimators': 739, 'max_depth': 74, 'min_samples_split': 24, 'min_samples_leaf': 56, 'criterion': 'gini'}.
Trial 7686 finished with value: 0.6956521739130435 and parameters: {'n_estimators': 325, 'max_depth': 12, 'min_samples_split': 126, 'min_samples_leaf': 63, 'criterion': 'entropy'}.
Trial 7687 finished with value: 0.6630434782608695 and parameters: {'n_estimators': 786, 'max_depth': 17, 'min_samples_split': 42, 'min_samples_leaf': 52, 'criterion': 'entropy'}.
Trial 7688 finished with value: 0.6956521739130435 and parameters: {'n_estimators': 283, 'max_depth': 8, 'min_samples_split': 167, 'min_samples_leaf': 61, 'criterion': 'gini'}.
Trial 7689 finished with value: 0.7282608695652174 and parameters: {'n_estimators': 265, 'max_depth': 10, 'min_samples_split': 135, 'min_samples_leaf': 58, 'criterion': 'entropy'}.
Trial 7690 finished with value: 0.6739130434782609 and parameters: {'n_estimators': 242, 'max_depth': 13, 'min_samples_split': 32, 'min_samples_leaf': 75, 'criterion': 'gini'}.
Trial 7691 finished with value: 0.7065217391304348 and parameters: {'n_estimators': 355, 'max_depth': 11, 'min_samples_split': 140, 'min_samples_leaf': 55, 'criterion': 'entropy'}.
Trial 7692 finished with value: 0.717391304347826 and parameters: {'n_estimators': 308, 'max_depth': 14, 'min_samples_split': 150, 'min_samples_leaf': 60, 'criterion': 'gini'}.
Trial 7693 finished with value: 0.6739130434782609 and parameters: {'n_estimators': 253, 'max_depth': 7, 'min_samples_split': 39, 'min_samples_leaf': 57, 'criterion': 'entropy'}.
Trial 7694 finished with value: 0.6304347826086957 and parameters: {'n_estimators': 280, 'max_depth': 9, 'min_samples_split': 28, 'min_samples_leaf': 28, 'criterion': 'gini'}.
Trial 7695 finished with value: 0.7065217391304348 and parameters: {'n_estimators': 764, 'max_depth': 11, 'min_samples_split': 15, 'min_samples_leaf': 70, 'criterion': 'entropy'}.
Trial 7696 finished with value: 0.6739130434782609 and parameters: {'n_estimators': 226, 'max_depth': 15, 'min_samples_split': 35, 'min_samples_leaf': 59, 'criterion': 'entropy'}.
Trial 7697 finished with value: 0.717391304347826 and parameters: {'n_estimators': 296, 'max_depth': 8, 'min_samples_split': 156, 'min_samples_leaf': 62, 'criterion': 'gini'}.
Trial 7698 finished with value: 0.6630434782608695 and parameters: {'n_estimators': 681, 'max_depth': 5, 'min_samples_split': 132, 'min_samples_leaf': 67, 'criterion': 'entropy'}.
Trial 7699 finished with value: 0.717391304347826 and parameters: {'n_estimators': 334, 'max_depth': 12, 'min_samples_split': 44, 'min_samples_leaf': 53, 'criterion': 'gini'}.
Trial 7700 finished with value: 0.717391304347826 and parameters: {'n_estimators': 313, 'max_depth': 10, 'min_samples_split': 23, 'min_samples_leaf': 56, 'criterion': 'entropy'}.
Trial 7701 finished with value: 0.6304347826086957 and parameters: {'n_estimators': 725, 'max_depth': 7, 'min_samples_split': 30, 'min_samples_leaf': 32, 'criterion': 'gini'}.
Trial 7702 finished with value: 0.6630434782608695 and parameters: {'n_estimators': 256, 'max_depth': 20, 'min_samples_split': 27, 'min_samples_leaf': 64, 'criterion': 'entropy'}.
Trial 7703 finished with value: 0.6847826086956522 and parameters: {'n_estimators': 820, 'max_depth': 16, 'min_samples_split': 101, 'min_samples_leaf': 60, 'criterion': 'gini'}.
Trial 7704 finished with value: 0.6956521739130435 and parameters: {'n_estimators': 748, 'max_depth': 13, 'min_samples_split': 37, 'min_samples_leaf': 74, 'criterion': 'entropy'}.
Trial 7705 finished with value: 0.7065217391304348 and parameters: {'n_estimators': 518, 'max_depth': 9, 'min_samples_split': 20, 'min_samples_leaf': 57, 'criterion': 'entropy'}.
Trial 7706 finished with value: 0.7065217391304348 and parameters: {'n_estimators': 283, 'max_depth': 10, 'min_samples_split': 137, 'min_samples_leaf': 54, 'criterion': 'gini'}.
Trial 7707 finished with value: 0.6956521739130435 and parameters: {'n_estimators': 968, 'max_depth': 12, 'min_samples_split': 146, 'min_samples_leaf': 72, 'criterion': 'entropy'}.
Trial 7708 finished with value: 0.7065217391304348 and parameters: {'n_estimators': 702, 'max_depth': 14, 'min_samples_split': 32, 'min_samples_leaf': 62, 'criterion': 'gini'}.
Trial 7709 finished with value: 0.7065217391304348 and parameters: {'n_estimators': 782, 'max_depth': 7, 'min_samples_split': 141, 'min_samples_leaf': 79, 'criterion': 'entropy'}.
Trial 7710 finished with value: 0.717391304347826 and parameters: {'n_estimators': 922, 'max_depth': 11, 'min_samples_split': 8, 'min_samples_leaf': 59, 'criterion': 'gini'}.
Trial 7711 finished with value: 0.6956521739130435 and parameters: {'n_estimators': 276, 'max_depth': 9, 'min_samples_split': 128, 'min_samples_leaf': 66, 'criterion': 'entropy'}.
Trial 7712 finished with value: 0.6847826086956522 and parameters: {'n_estimators': 100, 'max_depth': 6, 'min_samples_split': 39, 'min_samples_leaf': 56, 'criterion': 'gini'}.
Trial 7713 finished with value: 0.6956521739130435 and parameters: {'n_estimators': 202, 'max_depth': 14, 'min_samples_split': 35, 'min_samples_leaf': 58, 'criterion': 'entropy'}.
Trial 7714 finished with value: 0.7065217391304348 and parameters: {'n_estimators': 235, 'max_depth': 11, 'min_samples_split': 122, 'min_samples_leaf': 69, 'criterion': 'entropy'}.
Trial 7715 finished with value: 0.6847826086956522 and parameters: {'n_estimators': 296, 'max_depth': 17, 'min_samples_split': 25, 'min_samples_leaf': 50, 'criterion': 'gini'}.
Trial 7716 finished with value: 0.6956521739130435 and parameters: {'n_estimators': 259, 'max_depth': 8, 'min_samples_split': 42, 'min_samples_leaf': 61, 'criterion': 'entropy'}.
Trial 7717 finished with value: 0.7065217391304348 and parameters: {'n_estimators': 643, 'max_depth': 12, 'min_samples_split': 30, 'min_samples_leaf': 64, 'criterion': 'gini'}.
Trial 7718 finished with value: 0.6630434782608695 and parameters: {'n_estimators': 325, 'max_depth': 33, 'min_samples_split': 46, 'min_samples_leaf': 55, 'criterion': 'entropy'}.
Trial 7719 finished with value: 0.6847826086956522 and parameters: {'n_estimators': 801, 'max_depth': 10, 'min_samples_split': 34, 'min_samples_leaf': 76, 'criterion': 'gini'}.
Trial 7720 finished with value: 0.6521739130434783 and parameters: {'n_estimators': 273, 'max_depth': 5, 'min_samples_split': 18, 'min_samples_leaf': 52, 'criterion': 'entropy'}.
Trial 7721 finished with value: 0.717391304347826 and parameters: {'n_estimators': 765, 'max_depth': 8, 'min_samples_split': 27, 'min_samples_leaf': 59, 'criterion': 'gini'}.
Trial 7722 finished with value: 0.6739130434782609 and parameters: {'n_estimators': 301, 'max_depth': 14, 'min_samples_split': 153, 'min_samples_leaf': 73, 'criterion': 'entropy'}.
Trial 7723 finished with value: 0.7065217391304348 and parameters: {'n_estimators': 223, 'max_depth': 10, 'min_samples_split': 144, 'min_samples_leaf': 57, 'criterion': 'entropy'}.
Trial 7724 finished with value: 0.7065217391304348 and parameters: {'n_estimators': 315, 'max_depth': 12, 'min_samples_split': 110, 'min_samples_leaf': 62, 'criterion': 'gini'}.
Trial 7725 finished with value: 0.6739130434782609 and parameters: {'n_estimators': 252, 'max_depth': 8, 'min_samples_split': 52, 'min_samples_leaf': 40, 'criterion': 'entropy'}.
Trial 7726 finished with value: 0.6847826086956522 and parameters: {'n_estimators': 742, 'max_depth': 16, 'min_samples_split': 96, 'min_samples_leaf': 60, 'criterion': 'gini'}.
Trial 7727 finished with value: 0.6956521739130435 and parameters: {'n_estimators': 866, 'max_depth': 13, 'min_samples_split': 119, 'min_samples_leaf': 55, 'criterion': 'entropy'}.
Trial 7728 finished with value: 0.7065217391304348 and parameters: {'n_estimators': 284, 'max_depth': 10, 'min_samples_split': 23, 'min_samples_leaf': 58, 'criterion': 'gini'}.
Trial 7729 finished with value: 0.6739130434782609 and parameters: {'n_estimators': 265, 'max_depth': 6, 'min_samples_split': 39, 'min_samples_leaf': 71, 'criterion': 'entropy'}.
Trial 7730 finished with value: 0.6956521739130435 and parameters: {'n_estimators': 347, 'max_depth': 11, 'min_samples_split': 32, 'min_samples_leaf': 53, 'criterion': 'gini'}.
Trial 7731 finished with value: 0.7065217391304348 and parameters: {'n_estimators': 246, 'max_depth': 8, 'min_samples_split': 133, 'min_samples_leaf': 63, 'criterion': 'entropy'}.
Trial 7732 finished with value: 0.6956521739130435 and parameters: {'n_estimators': 293, 'max_depth': 14, 'min_samples_split': 139, 'min_samples_leaf': 68, 'criterion': 'entropy'}.
Trial 7733 finished with value: 0.7065217391304348 and parameters: {'n_estimators': 777, 'max_depth': 9, 'min_samples_split': 70, 'min_samples_leaf': 60, 'criterion': 'gini'}.
Trial 7734 finished with value: 0.717391304347826 and parameters: {'n_estimators': 278, 'max_depth': 12, 'min_samples_split': 11, 'min_samples_leaf': 56, 'criterion': 'entropy'}.
Trial 7735 finished with value: 0.6956521739130435 and parameters: {'n_estimators': 148, 'max_depth': 18, 'min_samples_split': 29, 'min_samples_leaf': 58, 'criterion': 'gini'}.
Trial 7736 finished with value: 0.6847826086956522 and parameters: {'n_estimators': 569, 'max_depth': 9, 'min_samples_split': 36, 'min_samples_leaf': 61, 'criterion': 'entropy'}.
Trial 7737 finished with value: 0.6739130434782609 and parameters: {'n_estimators': 730, 'max_depth': 6, 'min_samples_split': 24, 'min_samples_leaf': 65, 'criterion': 'gini'}.
Trial 7738 finished with value: 0.6739130434782609 and parameters: {'n_estimators': 314, 'max_depth': 15, 'min_samples_split': 117, 'min_samples_leaf': 54, 'criterion': 'entropy'}.
Trial 7739 finished with value: 0.6956521739130435 and parameters: {'n_estimators': 191, 'max_depth': 11, 'min_samples_split': 186, 'min_samples_leaf': 57, 'criterion': 'gini'}.
Trial 7740 finished with value: 0.7065217391304348 and parameters: {'n_estimators': 887, 'max_depth': 7, 'min_samples_split': 34, 'min_samples_leaf': 74, 'criterion': 'entropy'}.
Trial 7741 finished with value: 0.717391304347826 and parameters: {'n_estimators': 259, 'max_depth': 13, 'min_samples_split': 77, 'min_samples_leaf': 59, 'criterion': 'gini'}.
Trial 7742 finished with value: 0.6956521739130435 and parameters: {'n_estimators': 756, 'max_depth': 10, 'min_samples_split': 130, 'min_samples_leaf': 70, 'criterion': 'entropy'}.
Trial 7743 finished with value: 0.6956521739130435 and parameters: {'n_estimators': 297, 'max_depth': 8, 'min_samples_split': 124, 'min_samples_leaf': 62, 'criterion': 'entropy'}.
Trial 7744 finished with value: 0.717391304347826 and parameters: {'n_estimators': 230, 'max_depth': 12, 'min_samples_split': 42, 'min_samples_leaf': 56, 'criterion': 'gini'}.
Trial 7745 finished with value: 0.6739130434782609 and parameters: {'n_estimators': 276, 'max_depth': 36, 'min_samples_split': 29, 'min_samples_leaf': 66, 'criterion': 'entropy'}.
Trial 7746 finished with value: 0.7282608695652174 and parameters: {'n_estimators': 338, 'max_depth': 10, 'min_samples_split': 19, 'min_samples_leaf': 52, 'criterion': 'gini'}.
Trial 7747 finished with value: 0.6847826086956522 and parameters: {'n_estimators': 374, 'max_depth': 16, 'min_samples_split': 39, 'min_samples_leaf': 72, 'criterion': 'entropy'}.
Trial 7748 finished with value: 0.6847826086956522 and parameters: {'n_estimators': 800, 'max_depth': 6, 'min_samples_split': 135, 'min_samples_leaf': 58, 'criterion': 'gini'}.
Trial 7749 finished with value: 0.6847826086956522 and parameters: {'n_estimators': 245, 'max_depth': 13, 'min_samples_split': 148, 'min_samples_leaf': 60, 'criterion': 'entropy'}.
Trial 7750 finished with value: 0.7065217391304348 and parameters: {'n_estimators': 311, 'max_depth': 9, 'min_samples_split': 48, 'min_samples_leaf': 63, 'criterion': 'gini'}.
Trial 7751 finished with value: 0.7282608695652174 and parameters: {'n_estimators': 287, 'max_depth': 11, 'min_samples_split': 25, 'min_samples_leaf': 54, 'criterion': 'entropy'}.
Trial 7752 finished with value: 0.6630434782608695 and parameters: {'n_estimators': 265, 'max_depth': 5, 'min_samples_split': 141, 'min_samples_leaf': 81, 'criterion': 'entropy'}.
Trial 7753 finished with value: 0.6847826086956522 and parameters: {'n_estimators': 709, 'max_depth': 14, 'min_samples_split': 15, 'min_samples_leaf': 56, 'criterion': 'gini'}.
Trial 7754 finished with value: 0.717391304347826 and parameters: {'n_estimators': 753, 'max_depth': 8, 'min_samples_split': 33, 'min_samples_leaf': 78, 'criterion': 'entropy'}.
Trial 7755 finished with value: 0.6956521739130435 and parameters: {'n_estimators': 216, 'max_depth': 11, 'min_samples_split': 37, 'min_samples_leaf': 76, 'criterion': 'gini'}.
Trial 7756 finished with value: 0.6847826086956522 and parameters: {'n_estimators': 293, 'max_depth': 7, 'min_samples_split': 30, 'min_samples_leaf': 61, 'criterion': 'entropy'}.
Trial 7757 finished with value: 0.7065217391304348 and parameters: {'n_estimators': 777, 'max_depth': 9, 'min_samples_split': 20, 'min_samples_leaf': 59, 'criterion': 'gini'}.
Trial 7758 finished with value: 0.6630434782608695 and parameters: {'n_estimators': 246, 'max_depth': 16, 'min_samples_split': 88, 'min_samples_leaf': 50, 'criterion': 'entropy'}.
Trial 7759 finished with value: 0.6956521739130435 and parameters: {'n_estimators': 984, 'max_depth': 12, 'min_samples_split': 137, 'min_samples_leaf': 68, 'criterion': 'gini'}.
Trial 7760 finished with value: 0.7282608695652174 and parameters: {'n_estimators': 269, 'max_depth': 14, 'min_samples_split': 144, 'min_samples_leaf': 64, 'criterion': 'entropy'}.
Trial 7761 finished with value: 0.717391304347826 and parameters: {'n_estimators': 321, 'max_depth': 10, 'min_samples_split': 115, 'min_samples_leaf': 57, 'criterion': 'entropy'}.
Trial 7762 finished with value: 0.6630434782608695 and parameters: {'n_estimators': 730, 'max_depth': 7, 'min_samples_split': 26, 'min_samples_leaf': 55, 'criterion': 'gini'}.
Trial 7763 finished with value: 0.6956521739130435 and parameters: {'n_estimators': 277, 'max_depth': 12, 'min_samples_split': 43, 'min_samples_leaf': 61, 'criterion': 'entropy'}.
Trial 7764 finished with value: 0.6847826086956522 and parameters: {'n_estimators': 821, 'max_depth': 18, 'min_samples_split': 35, 'min_samples_leaf': 58, 'criterion': 'gini'}.
Trial 7765 finished with value: 0.6956521739130435 and parameters: {'n_estimators': 257, 'max_depth': 9, 'min_samples_split': 31, 'min_samples_leaf': 71, 'criterion': 'entropy'}.
Trial 7766 finished with value: 0.6630434782608695 and parameters: {'n_estimators': 302, 'max_depth': 14, 'min_samples_split': 38, 'min_samples_leaf': 53, 'criterion': 'gini'}.
Trial 7767 finished with value: 0.6739130434782609 and parameters: {'n_estimators': 329, 'max_depth': 91, 'min_samples_split': 22, 'min_samples_leaf': 74, 'criterion': 'entropy'}.
Trial 7768 finished with value: 0.7065217391304348 and parameters: {'n_estimators': 233, 'max_depth': 11, 'min_samples_split': 127, 'min_samples_leaf': 59, 'criterion': 'gini'}.
Trial 7769 finished with value: 0.6630434782608695 and parameters: {'n_estimators': 287, 'max_depth': 5, 'min_samples_split': 27, 'min_samples_leaf': 66, 'criterion': 'entropy'}.
Trial 7770 finished with value: 0.6956521739130435 and parameters: {'n_estimators': 765, 'max_depth': 9, 'min_samples_split': 30, 'min_samples_leaf': 63, 'criterion': 'entropy'}.
Trial 7771 finished with value: 0.6956521739130435 and parameters: {'n_estimators': 265, 'max_depth': 7, 'min_samples_split': 150, 'min_samples_leaf': 55, 'criterion': 'gini'}.
Trial 7772 finished with value: 0.7065217391304348 and parameters: {'n_estimators': 296, 'max_depth': 13, 'min_samples_split': 64, 'min_samples_leaf': 57, 'criterion': 'entropy'}.
Trial 7773 finished with value: 0.7282608695652174 and parameters: {'n_estimators': 475, 'max_depth': 10, 'min_samples_split': 107, 'min_samples_leaf': 61, 'criterion': 'gini'}.
Trial 7774 finished with value: 0.6847826086956522 and parameters: {'n_estimators': 437, 'max_depth': 22, 'min_samples_split': 34, 'min_samples_leaf': 70, 'criterion': 'entropy'}.
Trial 7775 finished with value: 0.6630434782608695 and parameters: {'n_estimators': 354, 'max_depth': 16, 'min_samples_split': 2, 'min_samples_leaf': 59, 'criterion': 'gini'}.
Trial 7776 finished with value: 0.6956521739130435 and parameters: {'n_estimators': 784, 'max_depth': 12, 'min_samples_split': 45, 'min_samples_leaf': 56, 'criterion': 'entropy'}.
Trial 7777 finished with value: 0.6956521739130435 and parameters: {'n_estimators': 248, 'max_depth': 8, 'min_samples_split': 141, 'min_samples_leaf': 62, 'criterion': 'gini'}.
Trial 7778 finished with value: 0.717391304347826 and parameters: {'n_estimators': 742, 'max_depth': 11, 'min_samples_split': 130, 'min_samples_leaf': 52, 'criterion': 'entropy'}.
Trial 7779 finished with value: 0.7065217391304348 and parameters: {'n_estimators': 676, 'max_depth': 7, 'min_samples_split': 40, 'min_samples_leaf': 73, 'criterion': 'entropy'}.
Trial 7780 finished with value: 0.6956521739130435 and parameters: {'n_estimators': 279, 'max_depth': 15, 'min_samples_split': 136, 'min_samples_leaf': 60, 'criterion': 'gini'}.
Trial 7781 finished with value: 0.6956521739130435 and parameters: {'n_estimators': 168, 'max_depth': 10, 'min_samples_split': 24, 'min_samples_leaf': 54, 'criterion': 'entropy'}.
Trial 7782 finished with value: 0.6956521739130435 and parameters: {'n_estimators': 305, 'max_depth': 13, 'min_samples_split': 36, 'min_samples_leaf': 68, 'criterion': 'gini'}.
Trial 7783 finished with value: 0.6956521739130435 and parameters: {'n_estimators': 693, 'max_depth': 9, 'min_samples_split': 122, 'min_samples_leaf': 58, 'criterion': 'entropy'}.
Trial 7784 finished with value: 0.717391304347826 and parameters: {'n_estimators': 717, 'max_depth': 7, 'min_samples_split': 16, 'min_samples_leaf': 76, 'criterion': 'gini'}.
Trial 7785 finished with value: 0.6630434782608695 and parameters: {'n_estimators': 315, 'max_depth': 5, 'min_samples_split': 32, 'min_samples_leaf': 64, 'criterion': 'entropy'}.
Trial 7786 finished with value: 0.6739130434782609 and parameters: {'n_estimators': 219, 'max_depth': 11, 'min_samples_split': 145, 'min_samples_leaf': 57, 'criterion': 'gini'}.
Trial 7787 finished with value: 0.6630434782608695 and parameters: {'n_estimators': 946, 'max_depth': 19, 'min_samples_split': 29, 'min_samples_leaf': 60, 'criterion': 'entropy'}.
Trial 7788 finished with value: 0.717391304347826 and parameters: {'n_estimators': 272, 'max_depth': 13, 'min_samples_split': 41, 'min_samples_leaf': 72, 'criterion': 'entropy'}.
Trial 7789 finished with value: 0.7282608695652174 and parameters: {'n_estimators': 257, 'max_depth': 9, 'min_samples_split': 21, 'min_samples_leaf': 55, 'criterion': 'gini'}.
Trial 7790 finished with value: 0.6956521739130435 and parameters: {'n_estimators': 288, 'max_depth': 15, 'min_samples_split': 33, 'min_samples_leaf': 62, 'criterion': 'entropy'}.
Trial 7791 finished with value: 0.7065217391304348 and parameters: {'n_estimators': 338, 'max_depth': 11, 'min_samples_split': 27, 'min_samples_leaf': 58, 'criterion': 'gini'}.
Trial 7792 finished with value: 0.6847826086956522 and parameters: {'n_estimators': 758, 'max_depth': 8, 'min_samples_split': 37, 'min_samples_leaf': 51, 'criterion': 'entropy'}.
Trial 7793 finished with value: 0.7065217391304348 and parameters: {'n_estimators': 902, 'max_depth': 13, 'min_samples_split': 139, 'min_samples_leaf': 65, 'criterion': 'gini'}.
Trial 7794 finished with value: 0.717391304347826 and parameters: {'n_estimators': 801, 'max_depth': 10, 'min_samples_split': 113, 'min_samples_leaf': 56, 'criterion': 'entropy'}.
Trial 7795 finished with value: 0.6956521739130435 and parameters: {'n_estimators': 241, 'max_depth': 7, 'min_samples_split': 26, 'min_samples_leaf': 60, 'criterion': 'gini'}.
Trial 7796 finished with value: 0.7282608695652174 and parameters: {'n_estimators': 303, 'max_depth': 12, 'min_samples_split': 31, 'min_samples_leaf': 54, 'criterion': 'entropy'}.
Trial 7797 finished with value: 0.6739130434782609 and parameters: {'n_estimators': 275, 'max_depth': 39, 'min_samples_split': 48, 'min_samples_leaf': 67, 'criterion': 'gini'}.
