Trial 2022 finished with value: 0.717391304347826 and parameters: {'n_estimators': 761, 'max_depth': 10, 'min_samples_split': 22, 'min_samples_leaf': 57, 'criterion': 'entropy'}.
Trial 2023 finished with value: 0.6739130434782609 and parameters: {'n_estimators': 788, 'max_depth': 16, 'min_samples_split': 66, 'min_samples_leaf': 53, 'criterion': 'entropy'}.
Trial 2024 finished with value: 0.6956521739130435 and parameters: {'n_estimators': 810, 'max_depth': 12, 'min_samples_split': 14, 'min_samples_leaf': 46, 'criterion': 'entropy'}.
Trial 2025 finished with value: 0.6739130434782609 and parameters: {'n_estimators': 824, 'max_depth': 6, 'min_samples_split': 35, 'min_samples_leaf': 49, 'criterion': 'gini'}.
Trial 2026 finished with value: 0.7065217391304348 and parameters: {'n_estimators': 783, 'max_depth': 10, 'min_samples_split': 27, 'min_samples_leaf': 62, 'criterion': 'entropy'}.
Trial 2027 finished with value: 0.7065217391304348 and parameters: {'n_estimators': 741, 'max_depth': 8, 'min_samples_split': 90, 'min_samples_leaf': 55, 'criterion': 'entropy'}.
Trial 2028 finished with value: 0.7065217391304348 and parameters: {'n_estimators': 848, 'max_depth': 12, 'min_samples_split': 34, 'min_samples_leaf': 59, 'criterion': 'entropy'}.
Trial 2029 finished with value: 0.7065217391304348 and parameters: {'n_estimators': 803, 'max_depth': 14, 'min_samples_split': 19, 'min_samples_leaf': 52, 'criterion': 'entropy'}.
Trial 2030 finished with value: 0.6847826086956522 and parameters: {'n_estimators': 554, 'max_depth': 9, 'min_samples_split': 24, 'min_samples_leaf': 51, 'criterion': 'entropy'}.
Trial 2031 finished with value: 0.6956521739130435 and parameters: {'n_estimators': 731, 'max_depth': 11, 'min_samples_split': 31, 'min_samples_leaf': 48, 'criterion': 'entropy'}.
Trial 2032 finished with value: 0.6847826086956522 and parameters: {'n_estimators': 775, 'max_depth': 6, 'min_samples_split': 38, 'min_samples_leaf': 57, 'criterion': 'entropy'}.
Trial 2033 finished with value: 0.6847826086956522 and parameters: {'n_estimators': 829, 'max_depth': 13, 'min_samples_split': 117, 'min_samples_leaf': 54, 'criterion': 'entropy'}.
Trial 2034 finished with value: 0.6739130434782609 and parameters: {'n_estimators': 761, 'max_depth': 17, 'min_samples_split': 42, 'min_samples_leaf': 50, 'criterion': 'entropy'}.
Trial 2035 finished with value: 0.6956521739130435 and parameters: {'n_estimators': 199, 'max_depth': 8, 'min_samples_split': 29, 'min_samples_leaf': 60, 'criterion': 'entropy'}.
Trial 2036 finished with value: 0.717391304347826 and parameters: {'n_estimators': 917, 'max_depth': 10, 'min_samples_split': 24, 'min_samples_leaf': 55, 'criterion': 'entropy'}.
Trial 2037 finished with value: 0.7065217391304348 and parameters: {'n_estimators': 526, 'max_depth': 14, 'min_samples_split': 16, 'min_samples_leaf': 52, 'criterion': 'entropy'}.
Trial 2038 finished with value: 0.7065217391304348 and parameters: {'n_estimators': 806, 'max_depth': 11, 'min_samples_split': 31, 'min_samples_leaf': 47, 'criterion': 'entropy'}.
Trial 2039 finished with value: 0.6847826086956522 and parameters: {'n_estimators': 566, 'max_depth': 7, 'min_samples_split': 20, 'min_samples_leaf': 53, 'criterion': 'entropy'}.
Trial 2040 finished with value: 0.6847826086956522 and parameters: {'n_estimators': 864, 'max_depth': 9, 'min_samples_split': 34, 'min_samples_leaf': 58, 'criterion': 'entropy'}.
Trial 2041 finished with value: 0.6956521739130435 and parameters: {'n_estimators': 792, 'max_depth': 15, 'min_samples_split': 110, 'min_samples_leaf': 44, 'criterion': 'entropy'}.
Trial 2042 finished with value: 0.6304347826086957 and parameters: {'n_estimators': 692, 'max_depth': 5, 'min_samples_split': 26, 'min_samples_leaf': 50, 'criterion': 'entropy'}.
Trial 2043 finished with value: 0.7065217391304348 and parameters: {'n_estimators': 753, 'max_depth': 12, 'min_samples_split': 12, 'min_samples_leaf': 56, 'criterion': 'gini'}.
Trial 2044 finished with value: 0.6956521739130435 and parameters: {'n_estimators': 839, 'max_depth': 19, 'min_samples_split': 39, 'min_samples_leaf': 48, 'criterion': 'entropy'}.
Trial 2045 finished with value: 0.717391304347826 and parameters: {'n_estimators': 659, 'max_depth': 10, 'min_samples_split': 29, 'min_samples_leaf': 63, 'criterion': 'entropy'}.
Trial 2046 finished with value: 0.717391304347826 and parameters: {'n_estimators': 818, 'max_depth': 8, 'min_samples_split': 45, 'min_samples_leaf': 54, 'criterion': 'entropy'}.
Trial 2047 finished with value: 0.717391304347826 and parameters: {'n_estimators': 778, 'max_depth': 13, 'min_samples_split': 22, 'min_samples_leaf': 51, 'criterion': 'entropy'}.
Trial 2048 finished with value: 0.717391304347826 and parameters: {'n_estimators': 599, 'max_depth': 11, 'min_samples_split': 36, 'min_samples_leaf': 57, 'criterion': 'entropy'}.
Trial 2049 finished with value: 0.6956521739130435 and parameters: {'n_estimators': 716, 'max_depth': 7, 'min_samples_split': 164, 'min_samples_leaf': 61, 'criterion': 'entropy'}.
Trial 2050 finished with value: 0.6956521739130435 and parameters: {'n_estimators': 897, 'max_depth': 16, 'min_samples_split': 25, 'min_samples_leaf': 46, 'criterion': 'entropy'}.
Trial 2051 finished with value: 0.6956521739130435 and parameters: {'n_estimators': 426, 'max_depth': 12, 'min_samples_split': 17, 'min_samples_leaf': 49, 'criterion': 'entropy'}.
Trial 2052 finished with value: 0.6847826086956522 and parameters: {'n_estimators': 797, 'max_depth': 9, 'min_samples_split': 32, 'min_samples_leaf': 53, 'criterion': 'entropy'}.
Trial 2053 finished with value: 0.7065217391304348 and parameters: {'n_estimators': 857, 'max_depth': 14, 'min_samples_split': 27, 'min_samples_leaf': 59, 'criterion': 'entropy'}.
Trial 2054 finished with value: 0.717391304347826 and parameters: {'n_estimators': 766, 'max_depth': 10, 'min_samples_split': 33, 'min_samples_leaf': 55, 'criterion': 'entropy'}.
Trial 2055 finished with value: 0.6739130434782609 and parameters: {'n_estimators': 826, 'max_depth': 7, 'min_samples_split': 40, 'min_samples_leaf': 51, 'criterion': 'entropy'}.
Trial 2056 finished with value: 0.717391304347826 and parameters: {'n_estimators': 811, 'max_depth': 12, 'min_samples_split': 188, 'min_samples_leaf': 57, 'criterion': 'entropy'}.
Trial 2057 finished with value: 0.6413043478260869 and parameters: {'n_estimators': 750, 'max_depth': 5, 'min_samples_split': 20, 'min_samples_leaf': 53, 'criterion': 'entropy'}.
Trial 2058 finished with value: 0.7065217391304348 and parameters: {'n_estimators': 737, 'max_depth': 9, 'min_samples_split': 29, 'min_samples_leaf': 47, 'criterion': 'entropy'}.
Trial 2059 finished with value: 0.717391304347826 and parameters: {'n_estimators': 510, 'max_depth': 11, 'min_samples_split': 37, 'min_samples_leaf': 49, 'criterion': 'entropy'}.
Trial 2060 finished with value: 0.6630434782608695 and parameters: {'n_estimators': 544, 'max_depth': 15, 'min_samples_split': 24, 'min_samples_leaf': 55, 'criterion': 'entropy'}.
Trial 2061 finished with value: 0.6847826086956522 and parameters: {'n_estimators': 786, 'max_depth': 58, 'min_samples_split': 33, 'min_samples_leaf': 51, 'criterion': 'entropy'}.
Trial 2062 finished with value: 0.717391304347826 and parameters: {'n_estimators': 841, 'max_depth': 13, 'min_samples_split': 29, 'min_samples_leaf': 59, 'criterion': 'gini'}.
Trial 2063 finished with value: 0.6739130434782609 and parameters: {'n_estimators': 795, 'max_depth': 8, 'min_samples_split': 21, 'min_samples_leaf': 52, 'criterion': 'entropy'}.
Trial 2064 finished with value: 0.7065217391304348 and parameters: {'n_estimators': 941, 'max_depth': 10, 'min_samples_split': 108, 'min_samples_leaf': 40, 'criterion': 'entropy'}.
Trial 2065 finished with value: 0.6956521739130435 and parameters: {'n_estimators': 820, 'max_depth': 17, 'min_samples_split': 35, 'min_samples_leaf': 45, 'criterion': 'entropy'}.
Trial 2066 finished with value: 0.7065217391304348 and parameters: {'n_estimators': 769, 'max_depth': 13, 'min_samples_split': 42, 'min_samples_leaf': 56, 'criterion': 'entropy'}.
Trial 2067 finished with value: 0.6630434782608695 and parameters: {'n_estimators': 726, 'max_depth': 29, 'min_samples_split': 12, 'min_samples_leaf': 61, 'criterion': 'entropy'}.
Trial 2068 finished with value: 0.6847826086956522 and parameters: {'n_estimators': 879, 'max_depth': 7, 'min_samples_split': 25, 'min_samples_leaf': 50, 'criterion': 'entropy'}.
Trial 2069 finished with value: 0.7065217391304348 and parameters: {'n_estimators': 804, 'max_depth': 11, 'min_samples_split': 16, 'min_samples_leaf': 53, 'criterion': 'entropy'}.
Trial 2070 finished with value: 0.6956521739130435 and parameters: {'n_estimators': 779, 'max_depth': 9, 'min_samples_split': 30, 'min_samples_leaf': 65, 'criterion': 'entropy'}.
Trial 2071 finished with value: 0.6956521739130435 and parameters: {'n_estimators': 844, 'max_depth': 15, 'min_samples_split': 38, 'min_samples_leaf': 48, 'criterion': 'entropy'}.
Trial 2072 finished with value: 0.6956521739130435 and parameters: {'n_estimators': 582, 'max_depth': 12, 'min_samples_split': 48, 'min_samples_leaf': 55, 'criterion': 'entropy'}.
Trial 2073 finished with value: 0.6847826086956522 and parameters: {'n_estimators': 754, 'max_depth': 21, 'min_samples_split': 115, 'min_samples_leaf': 58, 'criterion': 'entropy'}.
Trial 2074 finished with value: 0.6304347826086957 and parameters: {'n_estimators': 820, 'max_depth': 5, 'min_samples_split': 26, 'min_samples_leaf': 35, 'criterion': 'entropy'}.
Trial 2075 finished with value: 0.6956521739130435 and parameters: {'n_estimators': 788, 'max_depth': 9, 'min_samples_split': 21, 'min_samples_leaf': 50, 'criterion': 'entropy'}.
Trial 2076 finished with value: 0.7065217391304348 and parameters: {'n_estimators': 857, 'max_depth': 11, 'min_samples_split': 75, 'min_samples_leaf': 53, 'criterion': 'entropy'}.
Trial 2077 finished with value: 0.6739130434782609 and parameters: {'n_estimators': 803, 'max_depth': 7, 'min_samples_split': 34, 'min_samples_leaf': 47, 'criterion': 'entropy'}.
Trial 2078 finished with value: 0.7065217391304348 and parameters: {'n_estimators': 737, 'max_depth': 13, 'min_samples_split': 29, 'min_samples_leaf': 42, 'criterion': 'entropy'}.
Trial 2079 finished with value: 0.7282608695652174 and parameters: {'n_estimators': 987, 'max_depth': 10, 'min_samples_split': 17, 'min_samples_leaf': 57, 'criterion': 'entropy'}.
Trial 2080 finished with value: 0.717391304347826 and parameters: {'n_estimators': 830, 'max_depth': 8, 'min_samples_split': 32, 'min_samples_leaf': 60, 'criterion': 'gini'}.
Trial 2081 finished with value: 0.6956521739130435 and parameters: {'n_estimators': 763, 'max_depth': 15, 'min_samples_split': 23, 'min_samples_leaf': 52, 'criterion': 'entropy'}.
Trial 2082 finished with value: 0.7282608695652174 and parameters: {'n_estimators': 713, 'max_depth': 11, 'min_samples_split': 38, 'min_samples_leaf': 49, 'criterion': 'entropy'}.
Trial 2083 finished with value: 0.7065217391304348 and parameters: {'n_estimators': 622, 'max_depth': 13, 'min_samples_split': 27, 'min_samples_leaf': 55, 'criterion': 'entropy'}.
Trial 2084 finished with value: 0.6847826086956522 and parameters: {'n_estimators': 567, 'max_depth': 9, 'min_samples_split': 5, 'min_samples_leaf': 45, 'criterion': 'entropy'}.
Trial 2085 finished with value: 0.6956521739130435 and parameters: {'n_estimators': 779, 'max_depth': 7, 'min_samples_split': 153, 'min_samples_leaf': 54, 'criterion': 'entropy'}.
Trial 2086 finished with value: 0.7065217391304348 and parameters: {'n_estimators': 815, 'max_depth': 11, 'min_samples_split': 44, 'min_samples_leaf': 63, 'criterion': 'entropy'}.
Trial 2087 finished with value: 0.6630434782608695 and parameters: {'n_estimators': 538, 'max_depth': 18, 'min_samples_split': 34, 'min_samples_leaf': 51, 'criterion': 'entropy'}.
Trial 2088 finished with value: 0.6847826086956522 and parameters: {'n_estimators': 836, 'max_depth': 14, 'min_samples_split': 80, 'min_samples_leaf': 58, 'criterion': 'entropy'}.
Trial 2089 finished with value: 0.717391304347826 and parameters: {'n_estimators': 745, 'max_depth': 9, 'min_samples_split': 25, 'min_samples_leaf': 48, 'criterion': 'entropy'}.
Trial 2090 finished with value: 0.6413043478260869 and parameters: {'n_estimators': 804, 'max_depth': 5, 'min_samples_split': 41, 'min_samples_leaf': 56, 'criterion': 'entropy'}.
Trial 2091 finished with value: 0.6630434782608695 and parameters: {'n_estimators': 765, 'max_depth': 38, 'min_samples_split': 19, 'min_samples_leaf': 52, 'criterion': 'entropy'}.
Trial 2092 finished with value: 0.7065217391304348 and parameters: {'n_estimators': 877, 'max_depth': 12, 'min_samples_split': 30, 'min_samples_leaf': 50, 'criterion': 'entropy'}.
Trial 2093 finished with value: 0.6739130434782609 and parameters: {'n_estimators': 786, 'max_depth': 7, 'min_samples_split': 138, 'min_samples_leaf': 54, 'criterion': 'entropy'}.
Trial 2094 finished with value: 0.717391304347826 and parameters: {'n_estimators': 861, 'max_depth': 10, 'min_samples_split': 36, 'min_samples_leaf': 61, 'criterion': 'entropy'}.
Trial 2095 finished with value: 0.717391304347826 and parameters: {'n_estimators': 827, 'max_depth': 13, 'min_samples_split': 23, 'min_samples_leaf': 46, 'criterion': 'entropy'}.
Trial 2096 finished with value: 0.6739130434782609 and parameters: {'n_estimators': 799, 'max_depth': 16, 'min_samples_split': 31, 'min_samples_leaf': 59, 'criterion': 'entropy'}.
Trial 2097 finished with value: 0.717391304347826 and parameters: {'n_estimators': 493, 'max_depth': 9, 'min_samples_split': 28, 'min_samples_leaf': 49, 'criterion': 'entropy'}.
Trial 2098 finished with value: 0.717391304347826 and parameters: {'n_estimators': 725, 'max_depth': 11, 'min_samples_split': 37, 'min_samples_leaf': 56, 'criterion': 'entropy'}.
Trial 2099 finished with value: 0.717391304347826 and parameters: {'n_estimators': 521, 'max_depth': 14, 'min_samples_split': 120, 'min_samples_leaf': 52, 'criterion': 'gini'}.
Trial 2100 finished with value: 0.6847826086956522 and parameters: {'n_estimators': 844, 'max_depth': 7, 'min_samples_split': 12, 'min_samples_leaf': 54, 'criterion': 'entropy'}.
Trial 2101 finished with value: 0.7065217391304348 and parameters: {'n_estimators': 776, 'max_depth': 12, 'min_samples_split': 33, 'min_samples_leaf': 58, 'criterion': 'entropy'}.
Trial 2102 finished with value: 0.6847826086956522 and parameters: {'n_estimators': 815, 'max_depth': 9, 'min_samples_split': 19, 'min_samples_leaf': 51, 'criterion': 'entropy'}.
Trial 2103 finished with value: 0.6739130434782609 and parameters: {'n_estimators': 698, 'max_depth': 80, 'min_samples_split': 25, 'min_samples_leaf': 44, 'criterion': 'entropy'}.
Trial 2104 finished with value: 0.7065217391304348 and parameters: {'n_estimators': 794, 'max_depth': 11, 'min_samples_split': 41, 'min_samples_leaf': 47, 'criterion': 'entropy'}.
Trial 2105 finished with value: 0.6847826086956522 and parameters: {'n_estimators': 749, 'max_depth': 16, 'min_samples_split': 27, 'min_samples_leaf': 49, 'criterion': 'entropy'}.
Trial 2106 finished with value: 0.7065217391304348 and parameters: {'n_estimators': 764, 'max_depth': 8, 'min_samples_split': 33, 'min_samples_leaf': 53, 'criterion': 'entropy'}.
Trial 2107 finished with value: 0.6739130434782609 and parameters: {'n_estimators': 829, 'max_depth': 14, 'min_samples_split': 17, 'min_samples_leaf': 82, 'criterion': 'entropy'}.
Trial 2108 finished with value: 0.6847826086956522 and parameters: {'n_estimators': 810, 'max_depth': 6, 'min_samples_split': 22, 'min_samples_leaf': 56, 'criterion': 'entropy'}.
Trial 2109 finished with value: 0.717391304347826 and parameters: {'n_estimators': 561, 'max_depth': 10, 'min_samples_split': 30, 'min_samples_leaf': 60, 'criterion': 'entropy'}.
Trial 2110 finished with value: 0.7065217391304348 and parameters: {'n_estimators': 851, 'max_depth': 12, 'min_samples_split': 38, 'min_samples_leaf': 51, 'criterion': 'entropy'}.
Trial 2111 finished with value: 0.7065217391304348 and parameters: {'n_estimators': 782, 'max_depth': 8, 'min_samples_split': 27, 'min_samples_leaf': 54, 'criterion': 'entropy'}.
Trial 2112 finished with value: 0.717391304347826 and parameters: {'n_estimators': 680, 'max_depth': 10, 'min_samples_split': 50, 'min_samples_leaf': 58, 'criterion': 'entropy'}.
Trial 2113 finished with value: 0.7282608695652174 and parameters: {'n_estimators': 903, 'max_depth': 13, 'min_samples_split': 34, 'min_samples_leaf': 48, 'criterion': 'entropy'}.
Trial 2114 finished with value: 0.6847826086956522 and parameters: {'n_estimators': 741, 'max_depth': 17, 'min_samples_split': 22, 'min_samples_leaf': 62, 'criterion': 'entropy'}.
Trial 2115 finished with value: 0.6739130434782609 and parameters: {'n_estimators': 796, 'max_depth': 63, 'min_samples_split': 30, 'min_samples_leaf': 56, 'criterion': 'entropy'}.
Trial 2116 finished with value: 0.6413043478260869 and parameters: {'n_estimators': 823, 'max_depth': 5, 'min_samples_split': 70, 'min_samples_leaf': 50, 'criterion': 'entropy'}.
Trial 2117 finished with value: 0.6956521739130435 and parameters: {'n_estimators': 773, 'max_depth': 11, 'min_samples_split': 43, 'min_samples_leaf': 52, 'criterion': 'entropy'}.
Trial 2118 finished with value: 0.7065217391304348 and parameters: {'n_estimators': 758, 'max_depth': 8, 'min_samples_split': 113, 'min_samples_leaf': 46, 'criterion': 'gini'}.
Trial 2119 finished with value: 0.6739130434782609 and parameters: {'n_estimators': 546, 'max_depth': 15, 'min_samples_split': 36, 'min_samples_leaf': 54, 'criterion': 'entropy'}.
Trial 2120 finished with value: 0.7282608695652174 and parameters: {'n_estimators': 839, 'max_depth': 10, 'min_samples_split': 23, 'min_samples_leaf': 49, 'criterion': 'entropy'}.
Trial 2121 finished with value: 0.6956521739130435 and parameters: {'n_estimators': 808, 'max_depth': 13, 'min_samples_split': 16, 'min_samples_leaf': 57, 'criterion': 'entropy'}.
Trial 2122 finished with value: 0.6847826086956522 and parameters: {'n_estimators': 709, 'max_depth': 8, 'min_samples_split': 26, 'min_samples_leaf': 52, 'criterion': 'entropy'}.
Trial 2123 finished with value: 0.6956521739130435 and parameters: {'n_estimators': 863, 'max_depth': 12, 'min_samples_split': 9, 'min_samples_leaf': 60, 'criterion': 'entropy'}.
Trial 2124 finished with value: 0.6847826086956522 and parameters: {'n_estimators': 730, 'max_depth': 19, 'min_samples_split': 130, 'min_samples_leaf': 55, 'criterion': 'entropy'}.
Trial 2125 finished with value: 0.6739130434782609 and parameters: {'n_estimators': 790, 'max_depth': 6, 'min_samples_split': 31, 'min_samples_leaf': 50, 'criterion': 'entropy'}.
Trial 2126 finished with value: 0.717391304347826 and parameters: {'n_estimators': 605, 'max_depth': 10, 'min_samples_split': 37, 'min_samples_leaf': 64, 'criterion': 'entropy'}.
Trial 2127 finished with value: 0.6956521739130435 and parameters: {'n_estimators': 817, 'max_depth': 15, 'min_samples_split': 19, 'min_samples_leaf': 53, 'criterion': 'entropy'}.
Trial 2128 finished with value: 0.7065217391304348 and parameters: {'n_estimators': 750, 'max_depth': 9, 'min_samples_split': 125, 'min_samples_leaf': 47, 'criterion': 'entropy'}.
Trial 2129 finished with value: 0.7065217391304348 and parameters: {'n_estimators': 233, 'max_depth': 12, 'min_samples_split': 106, 'min_samples_leaf': 58, 'criterion': 'entropy'}.
Trial 2130 finished with value: 0.7065217391304348 and parameters: {'n_estimators': 583, 'max_depth': 14, 'min_samples_split': 28, 'min_samples_leaf': 51, 'criterion': 'entropy'}.
Trial 2131 finished with value: 0.6630434782608695 and parameters: {'n_estimators': 886, 'max_depth': 7, 'min_samples_split': 46, 'min_samples_leaf': 44, 'criterion': 'entropy'}.
Trial 2132 finished with value: 0.717391304347826 and parameters: {'n_estimators': 772, 'max_depth': 11, 'min_samples_split': 33, 'min_samples_leaf': 56, 'criterion': 'entropy'}.
Trial 2133 finished with value: 0.6847826086956522 and parameters: {'n_estimators': 525, 'max_depth': 41, 'min_samples_split': 40, 'min_samples_leaf': 48, 'criterion': 'entropy'}.
Trial 2134 finished with value: 0.717391304347826 and parameters: {'n_estimators': 396, 'max_depth': 9, 'min_samples_split': 25, 'min_samples_leaf': 54, 'criterion': 'entropy'}.
Trial 2135 finished with value: 0.7065217391304348 and parameters: {'n_estimators': 838, 'max_depth': 13, 'min_samples_split': 21, 'min_samples_leaf': 59, 'criterion': 'entropy'}.
Trial 2136 finished with value: 0.6847826086956522 and parameters: {'n_estimators': 798, 'max_depth': 7, 'min_samples_split': 31, 'min_samples_leaf': 50, 'criterion': 'entropy'}.
Trial 2137 finished with value: 0.7065217391304348 and parameters: {'n_estimators': 781, 'max_depth': 10, 'min_samples_split': 34, 'min_samples_leaf': 53, 'criterion': 'entropy'}.
Trial 2138 finished with value: 0.6413043478260869 and parameters: {'n_estimators': 814, 'max_depth': 5, 'min_samples_split': 54, 'min_samples_leaf': 57, 'criterion': 'gini'}.
Trial 2139 finished with value: 0.6739130434782609 and parameters: {'n_estimators': 855, 'max_depth': 17, 'min_samples_split': 27, 'min_samples_leaf': 61, 'criterion': 'entropy'}.
Trial 2140 finished with value: 0.7065217391304348 and parameters: {'n_estimators': 730, 'max_depth': 11, 'min_samples_split': 14, 'min_samples_leaf': 46, 'criterion': 'entropy'}.
Trial 2141 finished with value: 0.7065217391304348 and parameters: {'n_estimators': 968, 'max_depth': 14, 'min_samples_split': 40, 'min_samples_leaf': 52, 'criterion': 'entropy'}.
Trial 2142 finished with value: 0.5978260869565217 and parameters: {'n_estimators': 763, 'max_depth': 8, 'min_samples_split': 23, 'min_samples_leaf': 8, 'criterion': 'entropy'}.
Trial 2143 finished with value: 0.7065217391304348 and parameters: {'n_estimators': 831, 'max_depth': 12, 'min_samples_split': 36, 'min_samples_leaf': 49, 'criterion': 'entropy'}.
