Trial 9885 finished with value: 0.6739130434782609 and parameters: {'n_estimators': 250, 'max_depth': 93, 'min_samples_split': 35, 'min_samples_leaf': 57, 'criterion': 'gini'}.
Trial 9886 finished with value: 0.7065217391304348 and parameters: {'n_estimators': 745, 'max_depth': 9, 'min_samples_split': 144, 'min_samples_leaf': 72, 'criterion': 'entropy'}.
Trial 9887 finished with value: 0.7065217391304348 and parameters: {'n_estimators': 893, 'max_depth': 14, 'min_samples_split': 40, 'min_samples_leaf': 61, 'criterion': 'gini'}.
Trial 9888 finished with value: 0.6630434782608695 and parameters: {'n_estimators': 266, 'max_depth': 7, 'min_samples_split': 17, 'min_samples_leaf': 58, 'criterion': 'entropy'}.
Trial 9889 finished with value: 0.7065217391304348 and parameters: {'n_estimators': 764, 'max_depth': 12, 'min_samples_split': 82, 'min_samples_leaf': 55, 'criterion': 'entropy'}.
Trial 9890 finished with value: 0.7065217391304348 and parameters: {'n_estimators': 346, 'max_depth': 10, 'min_samples_split': 30, 'min_samples_leaf': 59, 'criterion': 'gini'}.
Trial 9891 finished with value: 0.7065217391304348 and parameters: {'n_estimators': 287, 'max_depth': 8, 'min_samples_split': 12, 'min_samples_leaf': 67, 'criterion': 'entropy'}.
Trial 9892 finished with value: 0.6739130434782609 and parameters: {'n_estimators': 314, 'max_depth': 17, 'min_samples_split': 48, 'min_samples_leaf': 56, 'criterion': 'gini'}.
Trial 9893 finished with value: 0.717391304347826 and parameters: {'n_estimators': 229, 'max_depth': 13, 'min_samples_split': 140, 'min_samples_leaf': 61, 'criterion': 'entropy'}.
Trial 9894 finished with value: 0.7282608695652174 and parameters: {'n_estimators': 264, 'max_depth': 11, 'min_samples_split': 36, 'min_samples_leaf': 53, 'criterion': 'entropy'}.
Trial 9895 finished with value: 0.6956521739130435 and parameters: {'n_estimators': 841, 'max_depth': 15, 'min_samples_split': 21, 'min_samples_leaf': 64, 'criterion': 'gini'}.
Trial 9896 finished with value: 0.6956521739130435 and parameters: {'n_estimators': 198, 'max_depth': 9, 'min_samples_split': 147, 'min_samples_leaf': 78, 'criterion': 'entropy'}.
Trial 9897 finished with value: 0.6847826086956522 and parameters: {'n_estimators': 292, 'max_depth': 6, 'min_samples_split': 27, 'min_samples_leaf': 58, 'criterion': 'gini'}.
Trial 9898 finished with value: 0.7065217391304348 and parameters: {'n_estimators': 240, 'max_depth': 13, 'min_samples_split': 33, 'min_samples_leaf': 60, 'criterion': 'entropy'}.
Trial 9899 finished with value: 0.6739130434782609 and parameters: {'n_estimators': 280, 'max_depth': 20, 'min_samples_split': 135, 'min_samples_leaf': 75, 'criterion': 'entropy'}.
Trial 9900 finished with value: 0.717391304347826 and parameters: {'n_estimators': 307, 'max_depth': 10, 'min_samples_split': 128, 'min_samples_leaf': 57, 'criterion': 'gini'}.
Trial 9901 finished with value: 0.6956521739130435 and parameters: {'n_estimators': 331, 'max_depth': 8, 'min_samples_split': 107, 'min_samples_leaf': 63, 'criterion': 'entropy'}.
Trial 9902 finished with value: 0.7065217391304348 and parameters: {'n_estimators': 813, 'max_depth': 11, 'min_samples_split': 42, 'min_samples_leaf': 55, 'criterion': 'gini'}.
Trial 9903 finished with value: 0.6956521739130435 and parameters: {'n_estimators': 786, 'max_depth': 13, 'min_samples_split': 118, 'min_samples_leaf': 70, 'criterion': 'entropy'}.
Trial 9904 finished with value: 0.6413043478260869 and parameters: {'n_estimators': 717, 'max_depth': 5, 'min_samples_split': 38, 'min_samples_leaf': 50, 'criterion': 'gini'}.
Trial 9905 finished with value: 0.6739130434782609 and parameters: {'n_estimators': 258, 'max_depth': 7, 'min_samples_split': 31, 'min_samples_leaf': 59, 'criterion': 'entropy'}.
Trial 9906 finished with value: 0.6847826086956522 and parameters: {'n_estimators': 757, 'max_depth': 15, 'min_samples_split': 24, 'min_samples_leaf': 73, 'criterion': 'entropy'}.
Trial 9907 finished with value: 0.7282608695652174 and parameters: {'n_estimators': 274, 'max_depth': 10, 'min_samples_split': 45, 'min_samples_leaf': 54, 'criterion': 'gini'}.
Trial 9908 finished with value: 0.6956521739130435 and parameters: {'n_estimators': 299, 'max_depth': 12, 'min_samples_split': 96, 'min_samples_leaf': 61, 'criterion': 'entropy'}.
Trial 9909 finished with value: 0.7065217391304348 and parameters: {'n_estimators': 245, 'max_depth': 8, 'min_samples_split': 121, 'min_samples_leaf': 57, 'criterion': 'gini'}.
Trial 9910 finished with value: 0.7282608695652174 and parameters: {'n_estimators': 322, 'max_depth': 10, 'min_samples_split': 34, 'min_samples_leaf': 52, 'criterion': 'entropy'}.
Trial 9911 finished with value: 0.6847826086956522 and parameters: {'n_estimators': 731, 'max_depth': 17, 'min_samples_split': 28, 'min_samples_leaf': 62, 'criterion': 'entropy'}.
Trial 9912 finished with value: 0.6739130434782609 and parameters: {'n_estimators': 857, 'max_depth': 27, 'min_samples_split': 18, 'min_samples_leaf': 65, 'criterion': 'gini'}.
Trial 9913 finished with value: 0.6956521739130435 and parameters: {'n_estimators': 212, 'max_depth': 14, 'min_samples_split': 113, 'min_samples_leaf': 59, 'criterion': 'entropy'}.
Trial 9914 finished with value: 0.7065217391304348 and parameters: {'n_estimators': 982, 'max_depth': 11, 'min_samples_split': 37, 'min_samples_leaf': 56, 'criterion': 'gini'}.
Trial 9915 finished with value: 0.6847826086956522 and parameters: {'n_estimators': 277, 'max_depth': 7, 'min_samples_split': 31, 'min_samples_leaf': 58, 'criterion': 'entropy'}.
Trial 9916 finished with value: 0.7065217391304348 and parameters: {'n_estimators': 775, 'max_depth': 12, 'min_samples_split': 24, 'min_samples_leaf': 67, 'criterion': 'entropy'}.
Trial 9917 finished with value: 0.6956521739130435 and parameters: {'n_estimators': 631, 'max_depth': 9, 'min_samples_split': 125, 'min_samples_leaf': 54, 'criterion': 'gini'}.
Trial 9918 finished with value: 0.6956521739130435 and parameters: {'n_estimators': 699, 'max_depth': 9, 'min_samples_split': 140, 'min_samples_leaf': 61, 'criterion': 'entropy'}.
Trial 9919 finished with value: 0.6956521739130435 and parameters: {'n_estimators': 294, 'max_depth': 15, 'min_samples_split': 41, 'min_samples_leaf': 63, 'criterion': 'gini'}.
Trial 9920 finished with value: 0.6739130434782609 and parameters: {'n_estimators': 265, 'max_depth': 5, 'min_samples_split': 133, 'min_samples_leaf': 72, 'criterion': 'entropy'}.
Trial 9921 finished with value: 0.6847826086956522 and parameters: {'n_estimators': 312, 'max_depth': 13, 'min_samples_split': 27, 'min_samples_leaf': 56, 'criterion': 'gini'}.
Trial 9922 finished with value: 0.7391304347826086 and parameters: {'n_estimators': 250, 'max_depth': 11, 'min_samples_split': 34, 'min_samples_leaf': 60, 'criterion': 'entropy'}.
Trial 9923 finished with value: 0.717391304347826 and parameters: {'n_estimators': 745, 'max_depth': 7, 'min_samples_split': 20, 'min_samples_leaf': 76, 'criterion': 'entropy'}.
Trial 9924 finished with value: 0.717391304347826 and parameters: {'n_estimators': 951, 'max_depth': 9, 'min_samples_split': 39, 'min_samples_leaf': 58, 'criterion': 'gini'}.
Trial 9925 finished with value: 0.7065217391304348 and parameters: {'n_estimators': 341, 'max_depth': 11, 'min_samples_split': 144, 'min_samples_leaf': 54, 'criterion': 'entropy'}.
Trial 9926 finished with value: 0.6956521739130435 and parameters: {'n_estimators': 285, 'max_depth': 13, 'min_samples_split': 54, 'min_samples_leaf': 68, 'criterion': 'gini'}.
Trial 9927 finished with value: 0.6630434782608695 and parameters: {'n_estimators': 264, 'max_depth': 7, 'min_samples_split': 70, 'min_samples_leaf': 57, 'criterion': 'entropy'}.
Trial 9928 finished with value: 0.6847826086956522 and parameters: {'n_estimators': 303, 'max_depth': 17, 'min_samples_split': 30, 'min_samples_leaf': 60, 'criterion': 'entropy'}.
Trial 9929 finished with value: 0.717391304347826 and parameters: {'n_estimators': 243, 'max_depth': 9, 'min_samples_split': 46, 'min_samples_leaf': 62, 'criterion': 'gini'}.
Trial 9930 finished with value: 0.6847826086956522 and parameters: {'n_estimators': 287, 'max_depth': 15, 'min_samples_split': 36, 'min_samples_leaf': 51, 'criterion': 'entropy'}.
Trial 9931 finished with value: 0.7065217391304348 and parameters: {'n_estimators': 227, 'max_depth': 12, 'min_samples_split': 15, 'min_samples_leaf': 74, 'criterion': 'gini'}.
Trial 9932 finished with value: 0.6956521739130435 and parameters: {'n_estimators': 791, 'max_depth': 10, 'min_samples_split': 138, 'min_samples_leaf': 70, 'criterion': 'entropy'}.
Trial 9933 finished with value: 0.7065217391304348 and parameters: {'n_estimators': 766, 'max_depth': 7, 'min_samples_split': 27, 'min_samples_leaf': 59, 'criterion': 'entropy'}.
Trial 9934 finished with value: 0.7065217391304348 and parameters: {'n_estimators': 322, 'max_depth': 14, 'min_samples_split': 32, 'min_samples_leaf': 65, 'criterion': 'gini'}.
Trial 9935 finished with value: 0.7065217391304348 and parameters: {'n_estimators': 276, 'max_depth': 11, 'min_samples_split': 131, 'min_samples_leaf': 55, 'criterion': 'entropy'}.
Trial 9936 finished with value: 0.717391304347826 and parameters: {'n_estimators': 922, 'max_depth': 8, 'min_samples_split': 22, 'min_samples_leaf': 56, 'criterion': 'gini'}.
Trial 9937 finished with value: 0.6521739130434783 and parameters: {'n_estimators': 123, 'max_depth': 5, 'min_samples_split': 175, 'min_samples_leaf': 58, 'criterion': 'entropy'}.
Trial 9938 finished with value: 0.717391304347826 and parameters: {'n_estimators': 550, 'max_depth': 10, 'min_samples_split': 41, 'min_samples_leaf': 52, 'criterion': 'gini'}.
Trial 9939 finished with value: 0.6847826086956522 and parameters: {'n_estimators': 260, 'max_depth': 31, 'min_samples_split': 38, 'min_samples_leaf': 62, 'criterion': 'entropy'}.
Trial 9940 finished with value: 0.6956521739130435 and parameters: {'n_estimators': 823, 'max_depth': 13, 'min_samples_split': 33, 'min_samples_leaf': 60, 'criterion': 'entropy'}.
Trial 9941 finished with value: 0.717391304347826 and parameters: {'n_estimators': 100, 'max_depth': 8, 'min_samples_split': 147, 'min_samples_leaf': 57, 'criterion': 'gini'}.
Trial 9942 finished with value: 0.6739130434782609 and parameters: {'n_estimators': 662, 'max_depth': 19, 'min_samples_split': 24, 'min_samples_leaf': 64, 'criterion': 'entropy'}.
Trial 9943 finished with value: 0.6847826086956522 and parameters: {'n_estimators': 299, 'max_depth': 16, 'min_samples_split': 29, 'min_samples_leaf': 53, 'criterion': 'gini'}.
Trial 9944 finished with value: 0.717391304347826 and parameters: {'n_estimators': 756, 'max_depth': 11, 'min_samples_split': 45, 'min_samples_leaf': 71, 'criterion': 'entropy'}.
Trial 9945 finished with value: 0.7065217391304348 and parameters: {'n_estimators': 729, 'max_depth': 9, 'min_samples_split': 117, 'min_samples_leaf': 55, 'criterion': 'entropy'}.
Trial 9946 finished with value: 0.6956521739130435 and parameters: {'n_estimators': 353, 'max_depth': 13, 'min_samples_split': 37, 'min_samples_leaf': 59, 'criterion': 'gini'}.
Trial 9947 finished with value: 0.6739130434782609 and parameters: {'n_estimators': 278, 'max_depth': 6, 'min_samples_split': 122, 'min_samples_leaf': 61, 'criterion': 'entropy'}.
Trial 9948 finished with value: 0.6847826086956522 and parameters: {'n_estimators': 245, 'max_depth': 11, 'min_samples_split': 142, 'min_samples_leaf': 57, 'criterion': 'gini'}.
Trial 9949 finished with value: 0.7065217391304348 and parameters: {'n_estimators': 317, 'max_depth': 8, 'min_samples_split': 33, 'min_samples_leaf': 63, 'criterion': 'entropy'}.
Trial 9950 finished with value: 0.7065217391304348 and parameters: {'n_estimators': 804, 'max_depth': 14, 'min_samples_split': 27, 'min_samples_leaf': 59, 'criterion': 'entropy'}.
Trial 9951 finished with value: 0.6847826086956522 and parameters: {'n_estimators': 417, 'max_depth': 10, 'min_samples_split': 58, 'min_samples_leaf': 77, 'criterion': 'gini'}.
Trial 9952 finished with value: 0.7065217391304348 and parameters: {'n_estimators': 290, 'max_depth': 12, 'min_samples_split': 50, 'min_samples_leaf': 55, 'criterion': 'entropy'}.
Trial 9953 finished with value: 0.6739130434782609 and parameters: {'n_estimators': 266, 'max_depth': 7, 'min_samples_split': 18, 'min_samples_leaf': 47, 'criterion': 'gini'}.
Trial 9954 finished with value: 0.7065217391304348 and parameters: {'n_estimators': 232, 'max_depth': 9, 'min_samples_split': 153, 'min_samples_leaf': 66, 'criterion': 'entropy'}.
Trial 9955 finished with value: 0.6739130434782609 and parameters: {'n_estimators': 304, 'max_depth': 23, 'min_samples_split': 36, 'min_samples_leaf': 73, 'criterion': 'entropy'}.
Trial 9956 finished with value: 0.6739130434782609 and parameters: {'n_estimators': 745, 'max_depth': 15, 'min_samples_split': 137, 'min_samples_leaf': 80, 'criterion': 'gini'}.
Trial 9957 finished with value: 0.7065217391304348 and parameters: {'n_estimators': 329, 'max_depth': 12, 'min_samples_split': 42, 'min_samples_leaf': 69, 'criterion': 'entropy'}.
Trial 9958 finished with value: 0.6304347826086957 and parameters: {'n_estimators': 254, 'max_depth': 5, 'min_samples_split': 126, 'min_samples_leaf': 57, 'criterion': 'gini'}.
Trial 9959 finished with value: 0.6739130434782609 and parameters: {'n_estimators': 772, 'max_depth': 83, 'min_samples_split': 9, 'min_samples_leaf': 61, 'criterion': 'entropy'}.
Trial 9960 finished with value: 0.7065217391304348 and parameters: {'n_estimators': 709, 'max_depth': 10, 'min_samples_split': 31, 'min_samples_leaf': 59, 'criterion': 'gini'}.
Trial 9961 finished with value: 0.6956521739130435 and parameters: {'n_estimators': 370, 'max_depth': 8, 'min_samples_split': 92, 'min_samples_leaf': 53, 'criterion': 'entropy'}.
Trial 9962 finished with value: 0.6521739130434783 and parameters: {'n_estimators': 159, 'max_depth': 13, 'min_samples_split': 23, 'min_samples_leaf': 56, 'criterion': 'entropy'}.
Trial 9963 finished with value: 0.7065217391304348 and parameters: {'n_estimators': 283, 'max_depth': 10, 'min_samples_split': 29, 'min_samples_leaf': 63, 'criterion': 'gini'}.
Trial 9964 finished with value: 0.7065217391304348 and parameters: {'n_estimators': 221, 'max_depth': 17, 'min_samples_split': 40, 'min_samples_leaf': 58, 'criterion': 'entropy'}.
Trial 9965 finished with value: 0.6630434782608695 and parameters: {'n_estimators': 267, 'max_depth': 7, 'min_samples_split': 35, 'min_samples_leaf': 50, 'criterion': 'gini'}.
Trial 9966 finished with value: 0.6956521739130435 and parameters: {'n_estimators': 310, 'max_depth': 12, 'min_samples_split': 131, 'min_samples_leaf': 54, 'criterion': 'entropy'}.
Trial 9967 finished with value: 0.6739130434782609 and parameters: {'n_estimators': 291, 'max_depth': 15, 'min_samples_split': 26, 'min_samples_leaf': 75, 'criterion': 'entropy'}.
Trial 9968 finished with value: 0.7065217391304348 and parameters: {'n_estimators': 193, 'max_depth': 9, 'min_samples_split': 33, 'min_samples_leaf': 61, 'criterion': 'gini'}.
Trial 9969 finished with value: 0.717391304347826 and parameters: {'n_estimators': 878, 'max_depth': 11, 'min_samples_split': 149, 'min_samples_leaf': 59, 'criterion': 'entropy'}.
Trial 9970 finished with value: 0.6739130434782609 and parameters: {'n_estimators': 597, 'max_depth': 6, 'min_samples_split': 44, 'min_samples_leaf': 56, 'criterion': 'gini'}.
Trial 9971 finished with value: 0.6956521739130435 and parameters: {'n_estimators': 785, 'max_depth': 14, 'min_samples_split': 21, 'min_samples_leaf': 71, 'criterion': 'entropy'}.
Trial 9972 finished with value: 0.7065217391304348 and parameters: {'n_estimators': 338, 'max_depth': 9, 'min_samples_split': 142, 'min_samples_leaf': 65, 'criterion': 'entropy'}.
Trial 9973 finished with value: 0.7065217391304348 and parameters: {'n_estimators': 257, 'max_depth': 12, 'min_samples_split': 103, 'min_samples_leaf': 68, 'criterion': 'gini'}.
Trial 9974 finished with value: 0.6847826086956522 and parameters: {'n_estimators': 275, 'max_depth': 7, 'min_samples_split': 12, 'min_samples_leaf': 60, 'criterion': 'entropy'}.
Trial 9975 finished with value: 0.7065217391304348 and parameters: {'n_estimators': 683, 'max_depth': 10, 'min_samples_split': 37, 'min_samples_leaf': 57, 'criterion': 'gini'}.
Trial 9976 finished with value: 0.6956521739130435 and parameters: {'n_estimators': 749, 'max_depth': 13, 'min_samples_split': 29, 'min_samples_leaf': 63, 'criterion': 'entropy'}.
Trial 9977 finished with value: 0.6739130434782609 and parameters: {'n_estimators': 240, 'max_depth': 16, 'min_samples_split': 109, 'min_samples_leaf': 52, 'criterion': 'gini'}.
Trial 9978 finished with value: 0.7282608695652174 and parameters: {'n_estimators': 299, 'max_depth': 8, 'min_samples_split': 16, 'min_samples_leaf': 55, 'criterion': 'entropy'}.
Trial 9979 finished with value: 0.717391304347826 and parameters: {'n_estimators': 721, 'max_depth': 11, 'min_samples_split': 40, 'min_samples_leaf': 58, 'criterion': 'entropy'}.
Trial 9980 finished with value: 0.6304347826086957 and parameters: {'n_estimators': 284, 'max_depth': 5, 'min_samples_split': 114, 'min_samples_leaf': 38, 'criterion': 'gini'}.
Trial 9981 finished with value: 0.6739130434782609 and parameters: {'n_estimators': 322, 'max_depth': 9, 'min_samples_split': 134, 'min_samples_leaf': 61, 'criterion': 'entropy'}.
Trial 9982 finished with value: 0.6739130434782609 and parameters: {'n_estimators': 211, 'max_depth': 18, 'min_samples_split': 26, 'min_samples_leaf': 54, 'criterion': 'gini'}.
Trial 9983 finished with value: 0.6739130434782609 and parameters: {'n_estimators': 260, 'max_depth': 14, 'min_samples_split': 34, 'min_samples_leaf': 73, 'criterion': 'entropy'}.
Trial 9984 finished with value: 0.717391304347826 and parameters: {'n_estimators': 301, 'max_depth': 11, 'min_samples_split': 31, 'min_samples_leaf': 58, 'criterion': 'entropy'}.
Trial 9985 finished with value: 0.6956521739130435 and parameters: {'n_estimators': 779, 'max_depth': 7, 'min_samples_split': 23, 'min_samples_leaf': 60, 'criterion': 'gini'}.
Trial 9986 finished with value: 0.6956521739130435 and parameters: {'n_estimators': 833, 'max_depth': 13, 'min_samples_split': 157, 'min_samples_leaf': 62, 'criterion': 'entropy'}.
Trial 9987 finished with value: 0.717391304347826 and parameters: {'n_estimators': 276, 'max_depth': 10, 'min_samples_split': 145, 'min_samples_leaf': 56, 'criterion': 'gini'}.
Trial 9988 finished with value: 0.717391304347826 and parameters: {'n_estimators': 249, 'max_depth': 8, 'min_samples_split': 139, 'min_samples_leaf': 64, 'criterion': 'entropy'}.
Trial 9989 finished with value: 0.7065217391304348 and parameters: {'n_estimators': 314, 'max_depth': 12, 'min_samples_split': 38, 'min_samples_leaf': 67, 'criterion': 'entropy'}.
Trial 9990 finished with value: 0.6739130434782609 and parameters: {'n_estimators': 759, 'max_depth': 15, 'min_samples_split': 48, 'min_samples_leaf': 58, 'criterion': 'gini'}.
Trial 9991 finished with value: 0.7065217391304348 and parameters: {'n_estimators': 740, 'max_depth': 9, 'min_samples_split': 128, 'min_samples_leaf': 53, 'criterion': 'entropy'}.
Trial 9992 finished with value: 0.6847826086956522 and parameters: {'n_estimators': 275, 'max_depth': 21, 'min_samples_split': 29, 'min_samples_leaf': 60, 'criterion': 'gini'}.
Trial 9993 finished with value: 0.6521739130434783 and parameters: {'n_estimators': 233, 'max_depth': 6, 'min_samples_split': 122, 'min_samples_leaf': 56, 'criterion': 'entropy'}.
Trial 9994 finished with value: 0.6956521739130435 and parameters: {'n_estimators': 392, 'max_depth': 11, 'min_samples_split': 20, 'min_samples_leaf': 77, 'criterion': 'gini'}.
Trial 9995 finished with value: 0.6956521739130435 and parameters: {'n_estimators': 798, 'max_depth': 12, 'min_samples_split': 34, 'min_samples_leaf': 71, 'criterion': 'entropy'}.
Trial 9996 finished with value: 0.7065217391304348 and parameters: {'n_estimators': 301, 'max_depth': 9, 'min_samples_split': 26, 'min_samples_leaf': 62, 'criterion': 'entropy'}.
Trial 9997 finished with value: 0.6521739130434783 and parameters: {'n_estimators': 290, 'max_depth': 16, 'min_samples_split': 43, 'min_samples_leaf': 59, 'criterion': 'gini'}.
Trial 9998 finished with value: 0.6956521739130435 and parameters: {'n_estimators': 350, 'max_depth': 7, 'min_samples_split': 170, 'min_samples_leaf': 74, 'criterion': 'entropy'}.
Trial 9999 finished with value: 0.6739130434782609 and parameters: {'n_estimators': 262, 'max_depth': 14, 'min_samples_split': 37, 'min_samples_leaf': 50, 'criterion': 'gini'}.
Trial 6089 finished with value: 0.75 and parameters: {'n_estimators': 296, 'max_depth': 9, 'min_samples_split': 35, 'min_samples_leaf': 56, 'criterion': 'entropy'}.
Trial 0 finished with value: 0.5434782608695652 and parameters: {'n_estimators': 483, 'max_depth': 29, 'min_samples_split': 143, 'min_samples_leaf': 72, 'criterion': 'gini'}.
Trial 1 finished with value: 0.532608695652174 and parameters: {'n_estimators': 289, 'max_depth': 44, 'min_samples_split': 112, 'min_samples_leaf': 57, 'criterion': 'entropy'}.
Trial 2 finished with value: 0.5217391304347826 and parameters: {'n_estimators': 801, 'max_depth': 100, 'min_samples_split': 60, 'min_samples_leaf': 18, 'criterion': 'gini'}.
Trial 3 finished with value: 0.5543478260869565 and parameters: {'n_estimators': 464, 'max_depth': 28, 'min_samples_split': 187, 'min_samples_leaf': 44, 'criterion': 'entropy'}.
Trial 4 finished with value: 0.532608695652174 and parameters: {'n_estimators': 673, 'max_depth': 16, 'min_samples_split': 2, 'min_samples_leaf': 82, 'criterion': 'entropy'}.
Trial 5 finished with value: 0.532608695652174 and parameters: {'n_estimators': 729, 'max_depth': 45, 'min_samples_split': 140, 'min_samples_leaf': 84, 'criterion': 'gini'}.
Trial 6 finished with value: 0.5434782608695652 and parameters: {'n_estimators': 869, 'max_depth': 65, 'min_samples_split': 73, 'min_samples_leaf': 98, 'criterion': 'gini'}.
