Trial 6322 finished with value: 0.7065217391304348 and parameters: {'n_estimators': 653, 'max_depth': 12, 'min_samples_split': 34, 'min_samples_leaf': 68, 'criterion': 'entropy'}.
Trial 6323 finished with value: 0.6847826086956522 and parameters: {'n_estimators': 272, 'max_depth': 14, 'min_samples_split': 18, 'min_samples_leaf': 59, 'criterion': 'entropy'}.
Trial 6324 finished with value: 0.6847826086956522 and parameters: {'n_estimators': 236, 'max_depth': 11, 'min_samples_split': 41, 'min_samples_leaf': 74, 'criterion': 'entropy'}.
Trial 6325 finished with value: 0.717391304347826 and parameters: {'n_estimators': 299, 'max_depth': 8, 'min_samples_split': 24, 'min_samples_leaf': 57, 'criterion': 'entropy'}.
Trial 6326 finished with value: 0.7282608695652174 and parameters: {'n_estimators': 327, 'max_depth': 10, 'min_samples_split': 132, 'min_samples_leaf': 62, 'criterion': 'entropy'}.
Trial 6327 finished with value: 0.6956521739130435 and parameters: {'n_estimators': 285, 'max_depth': 16, 'min_samples_split': 30, 'min_samples_leaf': 71, 'criterion': 'entropy'}.
Trial 6328 finished with value: 0.6956521739130435 and parameters: {'n_estimators': 266, 'max_depth': 13, 'min_samples_split': 77, 'min_samples_leaf': 56, 'criterion': 'entropy'}.
Trial 6329 finished with value: 0.6630434782608695 and parameters: {'n_estimators': 622, 'max_depth': 6, 'min_samples_split': 38, 'min_samples_leaf': 59, 'criterion': 'entropy'}.
Trial 6330 finished with value: 0.7282608695652174 and parameters: {'n_estimators': 311, 'max_depth': 9, 'min_samples_split': 44, 'min_samples_leaf': 54, 'criterion': 'gini'}.
Trial 6331 finished with value: 0.717391304347826 and parameters: {'n_estimators': 798, 'max_depth': 11, 'min_samples_split': 33, 'min_samples_leaf': 61, 'criterion': 'entropy'}.
Trial 6332 finished with value: 0.6847826086956522 and parameters: {'n_estimators': 762, 'max_depth': 14, 'min_samples_split': 21, 'min_samples_leaf': 58, 'criterion': 'entropy'}.
Trial 6333 finished with value: 0.6739130434782609 and parameters: {'n_estimators': 252, 'max_depth': 7, 'min_samples_split': 36, 'min_samples_leaf': 65, 'criterion': 'gini'}.
Trial 6334 finished with value: 0.6630434782608695 and parameters: {'n_estimators': 212, 'max_depth': 12, 'min_samples_split': 128, 'min_samples_leaf': 78, 'criterion': 'entropy'}.
Trial 6335 finished with value: 0.6956521739130435 and parameters: {'n_estimators': 679, 'max_depth': 9, 'min_samples_split': 26, 'min_samples_leaf': 63, 'criterion': 'gini'}.
Trial 6336 finished with value: 0.6739130434782609 and parameters: {'n_estimators': 983, 'max_depth': 7, 'min_samples_split': 40, 'min_samples_leaf': 51, 'criterion': 'entropy'}.
Trial 6337 finished with value: 0.7282608695652174 and parameters: {'n_estimators': 285, 'max_depth': 10, 'min_samples_split': 30, 'min_samples_leaf': 68, 'criterion': 'gini'}.
Trial 6338 finished with value: 0.6630434782608695 and parameters: {'n_estimators': 247, 'max_depth': 5, 'min_samples_split': 10, 'min_samples_leaf': 72, 'criterion': 'entropy'}.
Trial 6339 finished with value: 0.6739130434782609 and parameters: {'n_estimators': 114, 'max_depth': 16, 'min_samples_split': 16, 'min_samples_leaf': 56, 'criterion': 'gini'}.
Trial 6340 finished with value: 0.6847826086956522 and parameters: {'n_estimators': 750, 'max_depth': 13, 'min_samples_split': 34, 'min_samples_leaf': 76, 'criterion': 'entropy'}.
Trial 6341 finished with value: 0.717391304347826 and parameters: {'n_estimators': 709, 'max_depth': 11, 'min_samples_split': 29, 'min_samples_leaf': 60, 'criterion': 'gini'}.
Trial 6342 finished with value: 0.717391304347826 and parameters: {'n_estimators': 776, 'max_depth': 8, 'min_samples_split': 23, 'min_samples_leaf': 58, 'criterion': 'entropy'}.
Trial 6343 finished with value: 0.6847826086956522 and parameters: {'n_estimators': 270, 'max_depth': 15, 'min_samples_split': 173, 'min_samples_leaf': 54, 'criterion': 'entropy'}.
Trial 6344 finished with value: 0.7065217391304348 and parameters: {'n_estimators': 302, 'max_depth': 9, 'min_samples_split': 73, 'min_samples_leaf': 63, 'criterion': 'gini'}.
Trial 6345 finished with value: 0.6847826086956522 and parameters: {'n_estimators': 153, 'max_depth': 12, 'min_samples_split': 39, 'min_samples_leaf': 61, 'criterion': 'entropy'}.
Trial 6346 finished with value: 0.6956521739130435 and parameters: {'n_estimators': 327, 'max_depth': 10, 'min_samples_split': 28, 'min_samples_leaf': 66, 'criterion': 'gini'}.
Trial 6347 finished with value: 0.6739130434782609 and parameters: {'n_estimators': 726, 'max_depth': 19, 'min_samples_split': 82, 'min_samples_leaf': 56, 'criterion': 'entropy'}.
Trial 6348 finished with value: 0.6847826086956522 and parameters: {'n_estimators': 284, 'max_depth': 46, 'min_samples_split': 92, 'min_samples_leaf': 59, 'criterion': 'gini'}.
Trial 6349 finished with value: 0.6630434782608695 and parameters: {'n_estimators': 260, 'max_depth': 7, 'min_samples_split': 125, 'min_samples_leaf': 57, 'criterion': 'entropy'}.
Trial 6350 finished with value: 0.6956521739130435 and parameters: {'n_estimators': 225, 'max_depth': 13, 'min_samples_split': 133, 'min_samples_leaf': 74, 'criterion': 'gini'}.
Trial 6351 finished with value: 0.7065217391304348 and parameters: {'n_estimators': 798, 'max_depth': 11, 'min_samples_split': 110, 'min_samples_leaf': 69, 'criterion': 'entropy'}.
Trial 6352 finished with value: 0.717391304347826 and parameters: {'n_estimators': 374, 'max_depth': 9, 'min_samples_split': 116, 'min_samples_leaf': 53, 'criterion': 'entropy'}.
Trial 6353 finished with value: 0.6304347826086957 and parameters: {'n_estimators': 313, 'max_depth': 5, 'min_samples_split': 46, 'min_samples_leaf': 61, 'criterion': 'gini'}.
Trial 6354 finished with value: 0.6739130434782609 and parameters: {'n_estimators': 294, 'max_depth': 14, 'min_samples_split': 34, 'min_samples_leaf': 55, 'criterion': 'entropy'}.
Trial 6355 finished with value: 0.6956521739130435 and parameters: {'n_estimators': 897, 'max_depth': 7, 'min_samples_split': 19, 'min_samples_leaf': 59, 'criterion': 'gini'}.
Trial 6356 finished with value: 0.7065217391304348 and parameters: {'n_estimators': 244, 'max_depth': 11, 'min_samples_split': 122, 'min_samples_leaf': 63, 'criterion': 'entropy'}.
Trial 6357 finished with value: 0.717391304347826 and parameters: {'n_estimators': 273, 'max_depth': 9, 'min_samples_split': 37, 'min_samples_leaf': 72, 'criterion': 'gini'}.
Trial 6358 finished with value: 0.6630434782608695 and parameters: {'n_estimators': 347, 'max_depth': 16, 'min_samples_split': 25, 'min_samples_leaf': 57, 'criterion': 'entropy'}.
Trial 6359 finished with value: 0.6956521739130435 and parameters: {'n_estimators': 761, 'max_depth': 13, 'min_samples_split': 42, 'min_samples_leaf': 60, 'criterion': 'gini'}.
Trial 6360 finished with value: 0.7065217391304348 and parameters: {'n_estimators': 285, 'max_depth': 11, 'min_samples_split': 31, 'min_samples_leaf': 66, 'criterion': 'entropy'}.
Trial 6361 finished with value: 0.6956521739130435 and parameters: {'n_estimators': 194, 'max_depth': 8, 'min_samples_split': 35, 'min_samples_leaf': 52, 'criterion': 'entropy'}.
Trial 6362 finished with value: 0.7065217391304348 and parameters: {'n_estimators': 258, 'max_depth': 12, 'min_samples_split': 28, 'min_samples_leaf': 55, 'criterion': 'gini'}.
Trial 6363 finished with value: 0.7282608695652174 and parameters: {'n_estimators': 305, 'max_depth': 10, 'min_samples_split': 22, 'min_samples_leaf': 58, 'criterion': 'entropy'}.
Trial 6364 finished with value: 0.6739130434782609 and parameters: {'n_estimators': 240, 'max_depth': 7, 'min_samples_split': 133, 'min_samples_leaf': 61, 'criterion': 'gini'}.
Trial 6365 finished with value: 0.6956521739130435 and parameters: {'n_estimators': 744, 'max_depth': 15, 'min_samples_split': 39, 'min_samples_leaf': 70, 'criterion': 'entropy'}.
Trial 6366 finished with value: 0.7065217391304348 and parameters: {'n_estimators': 278, 'max_depth': 9, 'min_samples_split': 33, 'min_samples_leaf': 64, 'criterion': 'gini'}.
Trial 6367 finished with value: 0.7065217391304348 and parameters: {'n_estimators': 328, 'max_depth': 13, 'min_samples_split': 29, 'min_samples_leaf': 57, 'criterion': 'entropy'}.
Trial 6368 finished with value: 0.6739130434782609 and parameters: {'n_estimators': 259, 'max_depth': 6, 'min_samples_split': 43, 'min_samples_leaf': 73, 'criterion': 'gini'}.
Trial 6369 finished with value: 0.6847826086956522 and parameters: {'n_estimators': 784, 'max_depth': 18, 'min_samples_split': 50, 'min_samples_leaf': 62, 'criterion': 'entropy'}.
Trial 6370 finished with value: 0.6739130434782609 and parameters: {'n_estimators': 297, 'max_depth': 11, 'min_samples_split': 118, 'min_samples_leaf': 76, 'criterion': 'entropy'}.
Trial 6371 finished with value: 0.6739130434782609 and parameters: {'n_estimators': 313, 'max_depth': 64, 'min_samples_split': 26, 'min_samples_leaf': 59, 'criterion': 'gini'}.
Trial 6372 finished with value: 0.717391304347826 and parameters: {'n_estimators': 217, 'max_depth': 8, 'min_samples_split': 102, 'min_samples_leaf': 54, 'criterion': 'entropy'}.
Trial 6373 finished with value: 0.6847826086956522 and parameters: {'n_estimators': 411, 'max_depth': 14, 'min_samples_split': 13, 'min_samples_leaf': 56, 'criterion': 'gini'}.
Trial 6374 finished with value: 0.717391304347826 and parameters: {'n_estimators': 269, 'max_depth': 10, 'min_samples_split': 128, 'min_samples_leaf': 60, 'criterion': 'entropy'}.
Trial 6375 finished with value: 0.6739130434782609 and parameters: {'n_estimators': 695, 'max_depth': 5, 'min_samples_split': 34, 'min_samples_leaf': 68, 'criterion': 'gini'}.
Trial 6376 finished with value: 0.6739130434782609 and parameters: {'n_estimators': 100, 'max_depth': 12, 'min_samples_split': 19, 'min_samples_leaf': 58, 'criterion': 'entropy'}.
Trial 6377 finished with value: 0.717391304347826 and parameters: {'n_estimators': 239, 'max_depth': 9, 'min_samples_split': 38, 'min_samples_leaf': 71, 'criterion': 'gini'}.
Trial 6378 finished with value: 0.6956521739130435 and parameters: {'n_estimators': 739, 'max_depth': 16, 'min_samples_split': 31, 'min_samples_leaf': 62, 'criterion': 'entropy'}.
Trial 6379 finished with value: 0.6630434782608695 and parameters: {'n_estimators': 775, 'max_depth': 7, 'min_samples_split': 22, 'min_samples_leaf': 52, 'criterion': 'entropy'}.
Trial 6380 finished with value: 0.7065217391304348 and parameters: {'n_estimators': 287, 'max_depth': 12, 'min_samples_split': 26, 'min_samples_leaf': 56, 'criterion': 'gini'}.
Trial 6381 finished with value: 0.6739130434782609 and parameters: {'n_estimators': 260, 'max_depth': 14, 'min_samples_split': 134, 'min_samples_leaf': 64, 'criterion': 'entropy'}.
Trial 6382 finished with value: 0.7065217391304348 and parameters: {'n_estimators': 296, 'max_depth': 10, 'min_samples_split': 36, 'min_samples_leaf': 59, 'criterion': 'gini'}.
Trial 6383 finished with value: 0.6847826086956522 and parameters: {'n_estimators': 495, 'max_depth': 8, 'min_samples_split': 181, 'min_samples_leaf': 54, 'criterion': 'entropy'}.
Trial 6384 finished with value: 0.6847826086956522 and parameters: {'n_estimators': 727, 'max_depth': 11, 'min_samples_split': 45, 'min_samples_leaf': 74, 'criterion': 'gini'}.
Trial 6385 finished with value: 0.7065217391304348 and parameters: {'n_estimators': 333, 'max_depth': 13, 'min_samples_split': 30, 'min_samples_leaf': 61, 'criterion': 'entropy'}.
Trial 6386 finished with value: 0.7065217391304348 and parameters: {'n_estimators': 267, 'max_depth': 9, 'min_samples_split': 39, 'min_samples_leaf': 66, 'criterion': 'gini'}.
Trial 6387 finished with value: 0.6739130434782609 and parameters: {'n_estimators': 908, 'max_depth': 34, 'min_samples_split': 99, 'min_samples_leaf': 57, 'criterion': 'entropy'}.
Trial 6388 finished with value: 0.6956521739130435 and parameters: {'n_estimators': 762, 'max_depth': 7, 'min_samples_split': 122, 'min_samples_leaf': 59, 'criterion': 'gini'}.
Trial 6389 finished with value: 0.6739130434782609 and parameters: {'n_estimators': 315, 'max_depth': 17, 'min_samples_split': 17, 'min_samples_leaf': 51, 'criterion': 'entropy'}.
Trial 6390 finished with value: 0.6413043478260869 and parameters: {'n_estimators': 281, 'max_depth': 5, 'min_samples_split': 33, 'min_samples_leaf': 56, 'criterion': 'entropy'}.
Trial 6391 finished with value: 0.717391304347826 and parameters: {'n_estimators': 362, 'max_depth': 11, 'min_samples_split': 26, 'min_samples_leaf': 62, 'criterion': 'gini'}.
Trial 6392 finished with value: 0.6956521739130435 and parameters: {'n_estimators': 238, 'max_depth': 15, 'min_samples_split': 42, 'min_samples_leaf': 54, 'criterion': 'entropy'}.
Trial 6393 finished with value: 0.6956521739130435 and parameters: {'n_estimators': 963, 'max_depth': 9, 'min_samples_split': 130, 'min_samples_leaf': 78, 'criterion': 'gini'}.
Trial 6394 finished with value: 0.6847826086956522 and parameters: {'n_estimators': 253, 'max_depth': 13, 'min_samples_split': 31, 'min_samples_leaf': 70, 'criterion': 'entropy'}.
Trial 6395 finished with value: 0.7065217391304348 and parameters: {'n_estimators': 799, 'max_depth': 11, 'min_samples_split': 23, 'min_samples_leaf': 58, 'criterion': 'gini'}.
Trial 6396 finished with value: 0.6847826086956522 and parameters: {'n_estimators': 299, 'max_depth': 7, 'min_samples_split': 108, 'min_samples_leaf': 60, 'criterion': 'entropy'}.
Trial 6397 finished with value: 0.6956521739130435 and parameters: {'n_estimators': 137, 'max_depth': 9, 'min_samples_split': 36, 'min_samples_leaf': 64, 'criterion': 'gini'}.
Trial 6398 finished with value: 0.6956521739130435 and parameters: {'n_estimators': 274, 'max_depth': 12, 'min_samples_split': 28, 'min_samples_leaf': 75, 'criterion': 'entropy'}.
Trial 6399 finished with value: 0.7065217391304348 and parameters: {'n_estimators': 221, 'max_depth': 10, 'min_samples_split': 135, 'min_samples_leaf': 56, 'criterion': 'entropy'}.
Trial 6400 finished with value: 0.6847826086956522 and parameters: {'n_estimators': 608, 'max_depth': 14, 'min_samples_split': 39, 'min_samples_leaf': 61, 'criterion': 'gini'}.
Trial 6401 finished with value: 0.6739130434782609 and parameters: {'n_estimators': 168, 'max_depth': 50, 'min_samples_split': 33, 'min_samples_leaf': 72, 'criterion': 'entropy'}.
Trial 6402 finished with value: 0.7065217391304348 and parameters: {'n_estimators': 313, 'max_depth': 7, 'min_samples_split': 7, 'min_samples_leaf': 58, 'criterion': 'gini'}.
Trial 6403 finished with value: 0.7282608695652174 and parameters: {'n_estimators': 284, 'max_depth': 12, 'min_samples_split': 112, 'min_samples_leaf': 54, 'criterion': 'entropy'}.
Trial 6404 finished with value: 0.7065217391304348 and parameters: {'n_estimators': 257, 'max_depth': 9, 'min_samples_split': 23, 'min_samples_leaf': 67, 'criterion': 'gini'}.
Trial 6405 finished with value: 0.6630434782608695 and parameters: {'n_estimators': 749, 'max_depth': 15, 'min_samples_split': 30, 'min_samples_leaf': 59, 'criterion': 'entropy'}.
Trial 6406 finished with value: 0.6195652173913043 and parameters: {'n_estimators': 712, 'max_depth': 6, 'min_samples_split': 47, 'min_samples_leaf': 17, 'criterion': 'gini'}.
Trial 6407 finished with value: 0.717391304347826 and parameters: {'n_estimators': 343, 'max_depth': 10, 'min_samples_split': 17, 'min_samples_leaf': 63, 'criterion': 'entropy'}.
Trial 6408 finished with value: 0.7065217391304348 and parameters: {'n_estimators': 776, 'max_depth': 13, 'min_samples_split': 193, 'min_samples_leaf': 57, 'criterion': 'entropy'}.
Trial 6409 finished with value: 0.7282608695652174 and parameters: {'n_estimators': 293, 'max_depth': 11, 'min_samples_split': 125, 'min_samples_leaf': 55, 'criterion': 'gini'}.
Trial 6410 finished with value: 0.6956521739130435 and parameters: {'n_estimators': 269, 'max_depth': 8, 'min_samples_split': 35, 'min_samples_leaf': 69, 'criterion': 'entropy'}.
Trial 6411 finished with value: 0.6739130434782609 and parameters: {'n_estimators': 228, 'max_depth': 17, 'min_samples_split': 25, 'min_samples_leaf': 51, 'criterion': 'gini'}.
Trial 6412 finished with value: 0.6304347826086957 and parameters: {'n_estimators': 318, 'max_depth': 5, 'min_samples_split': 41, 'min_samples_leaf': 60, 'criterion': 'entropy'}.
Trial 6413 finished with value: 0.6521739130434783 and parameters: {'n_estimators': 251, 'max_depth': 28, 'min_samples_split': 20, 'min_samples_leaf': 65, 'criterion': 'gini'}.
Trial 6414 finished with value: 0.7065217391304348 and parameters: {'n_estimators': 281, 'max_depth': 55, 'min_samples_split': 37, 'min_samples_leaf': 62, 'criterion': 'entropy'}.
Trial 6415 finished with value: 0.7065217391304348 and parameters: {'n_estimators': 799, 'max_depth': 8, 'min_samples_split': 135, 'min_samples_leaf': 53, 'criterion': 'gini'}.
Trial 6416 finished with value: 0.6847826086956522 and parameters: {'n_estimators': 304, 'max_depth': 12, 'min_samples_split': 30, 'min_samples_leaf': 73, 'criterion': 'entropy'}.
Trial 6417 finished with value: 0.6847826086956522 and parameters: {'n_estimators': 751, 'max_depth': 21, 'min_samples_split': 52, 'min_samples_leaf': 57, 'criterion': 'entropy'}.
Trial 6418 finished with value: 0.6956521739130435 and parameters: {'n_estimators': 236, 'max_depth': 10, 'min_samples_split': 117, 'min_samples_leaf': 60, 'criterion': 'gini'}.
Trial 6419 finished with value: 0.6847826086956522 and parameters: {'n_estimators': 732, 'max_depth': 15, 'min_samples_split': 33, 'min_samples_leaf': 58, 'criterion': 'entropy'}.
Trial 6420 finished with value: 0.6630434782608695 and parameters: {'n_estimators': 271, 'max_depth': 93, 'min_samples_split': 27, 'min_samples_leaf': 77, 'criterion': 'gini'}.
Trial 6421 finished with value: 0.6847826086956522 and parameters: {'n_estimators': 194, 'max_depth': 13, 'min_samples_split': 130, 'min_samples_leaf': 55, 'criterion': 'entropy'}.
Trial 6422 finished with value: 0.7065217391304348 and parameters: {'n_estimators': 298, 'max_depth': 7, 'min_samples_split': 13, 'min_samples_leaf': 70, 'criterion': 'gini'}.
Trial 6423 finished with value: 0.717391304347826 and parameters: {'n_estimators': 322, 'max_depth': 10, 'min_samples_split': 37, 'min_samples_leaf': 62, 'criterion': 'entropy'}.
Trial 6424 finished with value: 0.6739130434782609 and parameters: {'n_estimators': 763, 'max_depth': 9, 'min_samples_split': 44, 'min_samples_leaf': 80, 'criterion': 'gini'}.
Trial 6425 finished with value: 0.7065217391304348 and parameters: {'n_estimators': 281, 'max_depth': 12, 'min_samples_split': 21, 'min_samples_leaf': 67, 'criterion': 'entropy'}.
Trial 6426 finished with value: 0.6847826086956522 and parameters: {'n_estimators': 252, 'max_depth': 14, 'min_samples_split': 65, 'min_samples_leaf': 59, 'criterion': 'entropy'}.
Trial 6427 finished with value: 0.717391304347826 and parameters: {'n_estimators': 294, 'max_depth': 8, 'min_samples_split': 28, 'min_samples_leaf': 57, 'criterion': 'gini'}.
Trial 6428 finished with value: 0.6630434782608695 and parameters: {'n_estimators': 936, 'max_depth': 19, 'min_samples_split': 33, 'min_samples_leaf': 75, 'criterion': 'entropy'}.
Trial 6429 finished with value: 0.6956521739130435 and parameters: {'n_estimators': 339, 'max_depth': 11, 'min_samples_split': 120, 'min_samples_leaf': 64, 'criterion': 'gini'}.
Trial 6430 finished with value: 0.6630434782608695 and parameters: {'n_estimators': 434, 'max_depth': 6, 'min_samples_split': 41, 'min_samples_leaf': 55, 'criterion': 'entropy'}.
Trial 6431 finished with value: 0.6739130434782609 and parameters: {'n_estimators': 263, 'max_depth': 16, 'min_samples_split': 136, 'min_samples_leaf': 61, 'criterion': 'gini'}.
Trial 6432 finished with value: 0.7065217391304348 and parameters: {'n_estimators': 779, 'max_depth': 10, 'min_samples_split': 24, 'min_samples_leaf': 53, 'criterion': 'entropy'}.
Trial 6433 finished with value: 0.6956521739130435 and parameters: {'n_estimators': 215, 'max_depth': 13, 'min_samples_split': 126, 'min_samples_leaf': 58, 'criterion': 'gini'}.
Trial 6434 finished with value: 0.7282608695652174 and parameters: {'n_estimators': 276, 'max_depth': 8, 'min_samples_split': 31, 'min_samples_leaf': 73, 'criterion': 'entropy'}.
Trial 6435 finished with value: 0.6304347826086957 and parameters: {'n_estimators': 308, 'max_depth': 5, 'min_samples_split': 36, 'min_samples_leaf': 60, 'criterion': 'entropy'}.
Trial 6436 finished with value: 0.7065217391304348 and parameters: {'n_estimators': 708, 'max_depth': 11, 'min_samples_split': 40, 'min_samples_leaf': 71, 'criterion': 'gini'}.
Trial 6437 finished with value: 0.7065217391304348 and parameters: {'n_estimators': 238, 'max_depth': 9, 'min_samples_split': 28, 'min_samples_leaf': 56, 'criterion': 'entropy'}.
Trial 6438 finished with value: 0.6739130434782609 and parameters: {'n_estimators': 735, 'max_depth': 14, 'min_samples_split': 32, 'min_samples_leaf': 63, 'criterion': 'gini'}.
Trial 6439 finished with value: 0.7065217391304348 and parameters: {'n_estimators': 575, 'max_depth': 7, 'min_samples_split': 24, 'min_samples_leaf': 59, 'criterion': 'entropy'}.
Trial 6440 finished with value: 0.6956521739130435 and parameters: {'n_estimators': 254, 'max_depth': 12, 'min_samples_split': 17, 'min_samples_leaf': 51, 'criterion': 'gini'}.
Trial 6441 finished with value: 0.7282608695652174 and parameters: {'n_estimators': 290, 'max_depth': 10, 'min_samples_split': 35, 'min_samples_leaf': 56, 'criterion': 'entropy'}.
Trial 6442 finished with value: 0.6739130434782609 and parameters: {'n_estimators': 323, 'max_depth': 17, 'min_samples_split': 48, 'min_samples_leaf': 65, 'criterion': 'gini'}.
Trial 6443 finished with value: 0.717391304347826 and parameters: {'n_estimators': 272, 'max_depth': 8, 'min_samples_split': 43, 'min_samples_leaf': 61, 'criterion': 'entropy'}.
Trial 6444 finished with value: 0.7065217391304348 and parameters: {'n_estimators': 887, 'max_depth': 12, 'min_samples_split': 114, 'min_samples_leaf': 58, 'criterion': 'gini'}.
