Trial 1412 finished with value: 0.6847826086956522 and parameters: {'n_estimators': 840, 'max_depth': 15, 'min_samples_split': 37, 'min_samples_leaf': 36, 'criterion': 'entropy'}.
Trial 1413 finished with value: 0.6847826086956522 and parameters: {'n_estimators': 802, 'max_depth': 9, 'min_samples_split': 104, 'min_samples_leaf': 48, 'criterion': 'entropy'}.
Trial 1414 finished with value: 0.6847826086956522 and parameters: {'n_estimators': 856, 'max_depth': 32, 'min_samples_split': 30, 'min_samples_leaf': 56, 'criterion': 'entropy'}.
Trial 1415 finished with value: 0.6413043478260869 and parameters: {'n_estimators': 819, 'max_depth': 5, 'min_samples_split': 16, 'min_samples_leaf': 53, 'criterion': 'entropy'}.
Trial 1416 finished with value: 0.7065217391304348 and parameters: {'n_estimators': 730, 'max_depth': 12, 'min_samples_split': 22, 'min_samples_leaf': 50, 'criterion': 'entropy'}.
Trial 1417 finished with value: 0.6956521739130435 and parameters: {'n_estimators': 788, 'max_depth': 10, 'min_samples_split': 48, 'min_samples_leaf': 42, 'criterion': 'entropy'}.
Trial 1418 finished with value: 0.6847826086956522 and parameters: {'n_estimators': 765, 'max_depth': 47, 'min_samples_split': 42, 'min_samples_leaf': 46, 'criterion': 'entropy'}.
Trial 1419 finished with value: 0.717391304347826 and parameters: {'n_estimators': 882, 'max_depth': 14, 'min_samples_split': 191, 'min_samples_leaf': 51, 'criterion': 'entropy'}.
Trial 1420 finished with value: 0.6630434782608695 and parameters: {'n_estimators': 833, 'max_depth': 56, 'min_samples_split': 34, 'min_samples_leaf': 58, 'criterion': 'entropy'}.
Trial 1421 finished with value: 0.7065217391304348 and parameters: {'n_estimators': 804, 'max_depth': 8, 'min_samples_split': 25, 'min_samples_leaf': 54, 'criterion': 'gini'}.
Trial 1422 finished with value: 0.6956521739130435 and parameters: {'n_estimators': 685, 'max_depth': 12, 'min_samples_split': 30, 'min_samples_leaf': 48, 'criterion': 'entropy'}.
Trial 1423 finished with value: 0.6739130434782609 and parameters: {'n_estimators': 604, 'max_depth': 6, 'min_samples_split': 39, 'min_samples_leaf': 49, 'criterion': 'entropy'}.
Trial 1424 finished with value: 0.6739130434782609 and parameters: {'n_estimators': 846, 'max_depth': 53, 'min_samples_split': 33, 'min_samples_leaf': 52, 'criterion': 'entropy'}.
Trial 1425 finished with value: 0.6739130434782609 and parameters: {'n_estimators': 780, 'max_depth': 19, 'min_samples_split': 99, 'min_samples_leaf': 44, 'criterion': 'entropy'}.
Trial 1426 finished with value: 0.7065217391304348 and parameters: {'n_estimators': 820, 'max_depth': 10, 'min_samples_split': 20, 'min_samples_leaf': 56, 'criterion': 'entropy'}.
Trial 1427 finished with value: 0.6739130434782609 and parameters: {'n_estimators': 954, 'max_depth': 16, 'min_samples_split': 128, 'min_samples_leaf': 53, 'criterion': 'entropy'}.
Trial 1428 finished with value: 0.6956521739130435 and parameters: {'n_estimators': 555, 'max_depth': 7, 'min_samples_split': 26, 'min_samples_leaf': 50, 'criterion': 'entropy'}.
Trial 1429 finished with value: 0.7065217391304348 and parameters: {'n_estimators': 794, 'max_depth': 12, 'min_samples_split': 36, 'min_samples_leaf': 64, 'criterion': 'entropy'}.
Trial 1430 finished with value: 0.6956521739130435 and parameters: {'n_estimators': 755, 'max_depth': 9, 'min_samples_split': 45, 'min_samples_leaf': 61, 'criterion': 'entropy'}.
Trial 1431 finished with value: 0.717391304347826 and parameters: {'n_estimators': 703, 'max_depth': 14, 'min_samples_split': 11, 'min_samples_leaf': 47, 'criterion': 'entropy'}.
Trial 1432 finished with value: 0.6956521739130435 and parameters: {'n_estimators': 853, 'max_depth': 11, 'min_samples_split': 107, 'min_samples_leaf': 55, 'criterion': 'entropy'}.
Trial 1433 finished with value: 0.7065217391304348 and parameters: {'n_estimators': 910, 'max_depth': 9, 'min_samples_split': 30, 'min_samples_leaf': 59, 'criterion': 'entropy'}.
Trial 1434 finished with value: 0.6739130434782609 and parameters: {'n_estimators': 585, 'max_depth': 7, 'min_samples_split': 27, 'min_samples_leaf': 52, 'criterion': 'entropy'}.
Trial 1435 finished with value: 0.717391304347826 and parameters: {'n_estimators': 652, 'max_depth': 13, 'min_samples_split': 22, 'min_samples_leaf': 49, 'criterion': 'entropy'}.
Trial 1436 finished with value: 0.717391304347826 and parameters: {'n_estimators': 818, 'max_depth': 11, 'min_samples_split': 40, 'min_samples_leaf': 57, 'criterion': 'entropy'}.
Trial 1437 finished with value: 0.6739130434782609 and parameters: {'n_estimators': 535, 'max_depth': 9, 'min_samples_split': 34, 'min_samples_leaf': 46, 'criterion': 'entropy'}.
Trial 1438 finished with value: 0.6630434782608695 and parameters: {'n_estimators': 496, 'max_depth': 16, 'min_samples_split': 18, 'min_samples_leaf': 51, 'criterion': 'entropy'}.
Trial 1439 finished with value: 0.6739130434782609 and parameters: {'n_estimators': 775, 'max_depth': 6, 'min_samples_split': 30, 'min_samples_leaf': 54, 'criterion': 'entropy'}.
Trial 1440 finished with value: 0.6956521739130435 and parameters: {'n_estimators': 805, 'max_depth': 11, 'min_samples_split': 37, 'min_samples_leaf': 48, 'criterion': 'entropy'}.
Trial 1441 finished with value: 0.7065217391304348 and parameters: {'n_estimators': 740, 'max_depth': 13, 'min_samples_split': 24, 'min_samples_leaf': 52, 'criterion': 'gini'}.
Trial 1442 finished with value: 0.717391304347826 and parameters: {'n_estimators': 836, 'max_depth': 9, 'min_samples_split': 115, 'min_samples_leaf': 56, 'criterion': 'entropy'}.
Trial 1443 finished with value: 0.6739130434782609 and parameters: {'n_estimators': 795, 'max_depth': 7, 'min_samples_split': 32, 'min_samples_leaf': 50, 'criterion': 'entropy'}.
Trial 1444 finished with value: 0.717391304347826 and parameters: {'n_estimators': 861, 'max_depth': 10, 'min_samples_split': 122, 'min_samples_leaf': 53, 'criterion': 'entropy'}.
Trial 1445 finished with value: 0.6304347826086957 and parameters: {'n_estimators': 775, 'max_depth': 5, 'min_samples_split': 27, 'min_samples_leaf': 46, 'criterion': 'entropy'}.
Trial 1446 finished with value: 0.717391304347826 and parameters: {'n_estimators': 830, 'max_depth': 14, 'min_samples_split': 41, 'min_samples_leaf': 49, 'criterion': 'entropy'}.
Trial 1447 finished with value: 0.7065217391304348 and parameters: {'n_estimators': 814, 'max_depth': 12, 'min_samples_split': 37, 'min_samples_leaf': 55, 'criterion': 'entropy'}.
Trial 1448 finished with value: 0.7282608695652174 and parameters: {'n_estimators': 801, 'max_depth': 8, 'min_samples_split': 33, 'min_samples_leaf': 58, 'criterion': 'entropy'}.
Trial 1449 finished with value: 0.6630434782608695 and parameters: {'n_estimators': 877, 'max_depth': 17, 'min_samples_split': 24, 'min_samples_leaf': 51, 'criterion': 'entropy'}.
Trial 1450 finished with value: 0.7065217391304348 and parameters: {'n_estimators': 845, 'max_depth': 10, 'min_samples_split': 94, 'min_samples_leaf': 44, 'criterion': 'entropy'}.
Trial 1451 finished with value: 0.7065217391304348 and parameters: {'n_estimators': 756, 'max_depth': 12, 'min_samples_split': 19, 'min_samples_leaf': 48, 'criterion': 'entropy'}.
Trial 1452 finished with value: 0.7065217391304348 and parameters: {'n_estimators': 563, 'max_depth': 8, 'min_samples_split': 14, 'min_samples_leaf': 54, 'criterion': 'entropy'}.
Trial 1453 finished with value: 0.6956521739130435 and parameters: {'n_estimators': 820, 'max_depth': 14, 'min_samples_split': 29, 'min_samples_leaf': 61, 'criterion': 'entropy'}.
Trial 1454 finished with value: 0.7282608695652174 and parameters: {'n_estimators': 788, 'max_depth': 10, 'min_samples_split': 35, 'min_samples_leaf': 50, 'criterion': 'entropy'}.
Trial 1455 finished with value: 0.717391304347826 and parameters: {'n_estimators': 836, 'max_depth': 12, 'min_samples_split': 46, 'min_samples_leaf': 52, 'criterion': 'entropy'}.
Trial 1456 finished with value: 0.6630434782608695 and parameters: {'n_estimators': 865, 'max_depth': 44, 'min_samples_split': 174, 'min_samples_leaf': 59, 'criterion': 'entropy'}.
Trial 1457 finished with value: 0.6739130434782609 and parameters: {'n_estimators': 772, 'max_depth': 7, 'min_samples_split': 30, 'min_samples_leaf': 47, 'criterion': 'entropy'}.
Trial 1458 finished with value: 0.717391304347826 and parameters: {'n_estimators': 802, 'max_depth': 9, 'min_samples_split': 24, 'min_samples_leaf': 56, 'criterion': 'entropy'}.
Trial 1459 finished with value: 0.6739130434782609 and parameters: {'n_estimators': 738, 'max_depth': 15, 'min_samples_split': 42, 'min_samples_leaf': 53, 'criterion': 'gini'}.
Trial 1460 finished with value: 0.6195652173913043 and parameters: {'n_estimators': 520, 'max_depth': 5, 'min_samples_split': 38, 'min_samples_leaf': 45, 'criterion': 'entropy'}.
Trial 1461 finished with value: 0.7282608695652174 and parameters: {'n_estimators': 827, 'max_depth': 11, 'min_samples_split': 27, 'min_samples_leaf': 50, 'criterion': 'entropy'}.
Trial 1462 finished with value: 0.6956521739130435 and parameters: {'n_estimators': 789, 'max_depth': 63, 'min_samples_split': 21, 'min_samples_leaf': 48, 'criterion': 'entropy'}.
Trial 1463 finished with value: 0.717391304347826 and parameters: {'n_estimators': 813, 'max_depth': 8, 'min_samples_split': 32, 'min_samples_leaf': 54, 'criterion': 'entropy'}.
Trial 1464 finished with value: 0.6847826086956522 and parameters: {'n_estimators': 671, 'max_depth': 13, 'min_samples_split': 34, 'min_samples_leaf': 57, 'criterion': 'entropy'}.
Trial 1465 finished with value: 0.717391304347826 and parameters: {'n_estimators': 849, 'max_depth': 10, 'min_samples_split': 101, 'min_samples_leaf': 50, 'criterion': 'entropy'}.
Trial 1466 finished with value: 0.717391304347826 and parameters: {'n_estimators': 721, 'max_depth': 11, 'min_samples_split': 111, 'min_samples_leaf': 51, 'criterion': 'entropy'}.
Trial 1467 finished with value: 0.6630434782608695 and parameters: {'n_estimators': 764, 'max_depth': 7, 'min_samples_split': 16, 'min_samples_leaf': 52, 'criterion': 'entropy'}.
Trial 1468 finished with value: 0.6956521739130435 and parameters: {'n_estimators': 889, 'max_depth': 82, 'min_samples_split': 29, 'min_samples_leaf': 47, 'criterion': 'entropy'}.
Trial 1469 finished with value: 0.6847826086956522 and parameters: {'n_estimators': 815, 'max_depth': 15, 'min_samples_split': 36, 'min_samples_leaf': 55, 'criterion': 'entropy'}.
Trial 1470 finished with value: 0.6956521739130435 and parameters: {'n_estimators': 784, 'max_depth': 13, 'min_samples_split': 24, 'min_samples_leaf': 62, 'criterion': 'entropy'}.
Trial 1471 finished with value: 0.6956521739130435 and parameters: {'n_estimators': 539, 'max_depth': 9, 'min_samples_split': 39, 'min_samples_leaf': 59, 'criterion': 'entropy'}.
Trial 1472 finished with value: 0.7065217391304348 and parameters: {'n_estimators': 620, 'max_depth': 11, 'min_samples_split': 32, 'min_samples_leaf': 53, 'criterion': 'entropy'}.
Trial 1473 finished with value: 0.6739130434782609 and parameters: {'n_estimators': 935, 'max_depth': 7, 'min_samples_split': 106, 'min_samples_leaf': 42, 'criterion': 'entropy'}.
Trial 1474 finished with value: 0.6739130434782609 and parameters: {'n_estimators': 835, 'max_depth': 17, 'min_samples_split': 28, 'min_samples_leaf': 49, 'criterion': 'entropy'}.
Trial 1475 finished with value: 0.6739130434782609 and parameters: {'n_estimators': 795, 'max_depth': 9, 'min_samples_split': 20, 'min_samples_leaf': 68, 'criterion': 'entropy'}.
Trial 1476 finished with value: 0.717391304347826 and parameters: {'n_estimators': 999, 'max_depth': 13, 'min_samples_split': 43, 'min_samples_leaf': 45, 'criterion': 'entropy'}.
Trial 1477 finished with value: 0.6304347826086957 and parameters: {'n_estimators': 575, 'max_depth': 50, 'min_samples_split': 26, 'min_samples_leaf': 25, 'criterion': 'entropy'}.
Trial 1478 finished with value: 0.6413043478260869 and parameters: {'n_estimators': 848, 'max_depth': 5, 'min_samples_split': 35, 'min_samples_leaf': 56, 'criterion': 'gini'}.
Trial 1479 finished with value: 0.7065217391304348 and parameters: {'n_estimators': 749, 'max_depth': 11, 'min_samples_split': 53, 'min_samples_leaf': 51, 'criterion': 'entropy'}.
Trial 1480 finished with value: 0.6956521739130435 and parameters: {'n_estimators': 811, 'max_depth': 8, 'min_samples_split': 31, 'min_samples_leaf': 48, 'criterion': 'entropy'}.
Trial 1481 finished with value: 0.6739130434782609 and parameters: {'n_estimators': 866, 'max_depth': 15, 'min_samples_split': 88, 'min_samples_leaf': 54, 'criterion': 'entropy'}.
Trial 1482 finished with value: 0.7282608695652174 and parameters: {'n_estimators': 778, 'max_depth': 10, 'min_samples_split': 39, 'min_samples_leaf': 52, 'criterion': 'entropy'}.
Trial 1483 finished with value: 0.7065217391304348 and parameters: {'n_estimators': 828, 'max_depth': 12, 'min_samples_split': 23, 'min_samples_leaf': 57, 'criterion': 'entropy'}.
Trial 1484 finished with value: 0.6739130434782609 and parameters: {'n_estimators': 801, 'max_depth': 7, 'min_samples_split': 34, 'min_samples_leaf': 49, 'criterion': 'entropy'}.
Trial 1485 finished with value: 0.7065217391304348 and parameters: {'n_estimators': 768, 'max_depth': 9, 'min_samples_split': 16, 'min_samples_leaf': 46, 'criterion': 'entropy'}.
Trial 1486 finished with value: 0.7065217391304348 and parameters: {'n_estimators': 818, 'max_depth': 13, 'min_samples_split': 48, 'min_samples_leaf': 54, 'criterion': 'entropy'}.
Trial 1487 finished with value: 0.6739130434782609 and parameters: {'n_estimators': 850, 'max_depth': 20, 'min_samples_split': 27, 'min_samples_leaf': 51, 'criterion': 'entropy'}.
Trial 1488 finished with value: 0.717391304347826 and parameters: {'n_estimators': 903, 'max_depth': 11, 'min_samples_split': 31, 'min_samples_leaf': 65, 'criterion': 'entropy'}.
Trial 1489 finished with value: 0.6847826086956522 and parameters: {'n_estimators': 784, 'max_depth': 6, 'min_samples_split': 38, 'min_samples_leaf': 60, 'criterion': 'entropy'}.
Trial 1490 finished with value: 0.717391304347826 and parameters: {'n_estimators': 547, 'max_depth': 14, 'min_samples_split': 156, 'min_samples_leaf': 49, 'criterion': 'entropy'}.
Trial 1491 finished with value: 0.6739130434782609 and parameters: {'n_estimators': 875, 'max_depth': 9, 'min_samples_split': 98, 'min_samples_leaf': 52, 'criterion': 'entropy'}.
Trial 1492 finished with value: 0.6956521739130435 and parameters: {'n_estimators': 831, 'max_depth': 18, 'min_samples_split': 21, 'min_samples_leaf': 57, 'criterion': 'entropy'}.
Trial 1493 finished with value: 0.7065217391304348 and parameters: {'n_estimators': 755, 'max_depth': 11, 'min_samples_split': 43, 'min_samples_leaf': 46, 'criterion': 'entropy'}.
Trial 1494 finished with value: 0.6956521739130435 and parameters: {'n_estimators': 798, 'max_depth': 8, 'min_samples_split': 27, 'min_samples_leaf': 50, 'criterion': 'entropy'}.
Trial 1495 finished with value: 0.7065217391304348 and parameters: {'n_estimators': 811, 'max_depth': 12, 'min_samples_split': 35, 'min_samples_leaf': 55, 'criterion': 'entropy'}.
Trial 1496 finished with value: 0.717391304347826 and parameters: {'n_estimators': 851, 'max_depth': 10, 'min_samples_split': 31, 'min_samples_leaf': 53, 'criterion': 'gini'}.
Trial 1497 finished with value: 0.6739130434782609 and parameters: {'n_estimators': 826, 'max_depth': 15, 'min_samples_split': 11, 'min_samples_leaf': 43, 'criterion': 'entropy'}.
Trial 1498 finished with value: 0.6630434782608695 and parameters: {'n_estimators': 776, 'max_depth': 6, 'min_samples_split': 118, 'min_samples_leaf': 48, 'criterion': 'entropy'}.
Trial 1499 finished with value: 0.7065217391304348 and parameters: {'n_estimators': 796, 'max_depth': 13, 'min_samples_split': 24, 'min_samples_leaf': 59, 'criterion': 'entropy'}.
Trial 1500 finished with value: 0.6956521739130435 and parameters: {'n_estimators': 729, 'max_depth': 8, 'min_samples_split': 132, 'min_samples_leaf': 51, 'criterion': 'entropy'}.
Trial 1501 finished with value: 0.6956521739130435 and parameters: {'n_estimators': 813, 'max_depth': 10, 'min_samples_split': 19, 'min_samples_leaf': 55, 'criterion': 'entropy'}.
Trial 1502 finished with value: 0.6847826086956522 and parameters: {'n_estimators': 509, 'max_depth': 12, 'min_samples_split': 41, 'min_samples_leaf': 48, 'criterion': 'entropy'}.
Trial 1503 finished with value: 0.6304347826086957 and parameters: {'n_estimators': 591, 'max_depth': 5, 'min_samples_split': 36, 'min_samples_leaf': 11, 'criterion': 'entropy'}.
Trial 1504 finished with value: 0.7065217391304348 and parameters: {'n_estimators': 559, 'max_depth': 9, 'min_samples_split': 29, 'min_samples_leaf': 53, 'criterion': 'entropy'}.
Trial 1505 finished with value: 0.6630434782608695 and parameters: {'n_estimators': 842, 'max_depth': 16, 'min_samples_split': 32, 'min_samples_leaf': 50, 'criterion': 'entropy'}.
Trial 1506 finished with value: 0.6956521739130435 and parameters: {'n_estimators': 759, 'max_depth': 7, 'min_samples_split': 104, 'min_samples_leaf': 57, 'criterion': 'entropy'}.
Trial 1507 finished with value: 0.7065217391304348 and parameters: {'n_estimators': 713, 'max_depth': 11, 'min_samples_split': 25, 'min_samples_leaf': 45, 'criterion': 'entropy'}.
Trial 1508 finished with value: 0.7282608695652174 and parameters: {'n_estimators': 785, 'max_depth': 14, 'min_samples_split': 37, 'min_samples_leaf': 47, 'criterion': 'entropy'}.
Trial 1509 finished with value: 0.717391304347826 and parameters: {'n_estimators': 832, 'max_depth': 10, 'min_samples_split': 17, 'min_samples_leaf': 52, 'criterion': 'entropy'}.
Trial 1510 finished with value: 0.6956521739130435 and parameters: {'n_estimators': 805, 'max_depth': 13, 'min_samples_split': 29, 'min_samples_leaf': 55, 'criterion': 'entropy'}.
Trial 1511 finished with value: 0.6847826086956522 and parameters: {'n_estimators': 527, 'max_depth': 8, 'min_samples_split': 21, 'min_samples_leaf': 50, 'criterion': 'entropy'}.
Trial 1512 finished with value: 0.717391304347826 and parameters: {'n_estimators': 874, 'max_depth': 11, 'min_samples_split': 109, 'min_samples_leaf': 59, 'criterion': 'entropy'}.
Trial 1513 finished with value: 0.7065217391304348 and parameters: {'n_estimators': 746, 'max_depth': 7, 'min_samples_split': 45, 'min_samples_leaf': 62, 'criterion': 'entropy'}.
Trial 1514 finished with value: 0.6739130434782609 and parameters: {'n_estimators': 486, 'max_depth': 9, 'min_samples_split': 34, 'min_samples_leaf': 52, 'criterion': 'entropy'}.
Trial 1515 finished with value: 0.7282608695652174 and parameters: {'n_estimators': 854, 'max_depth': 13, 'min_samples_split': 25, 'min_samples_leaf': 49, 'criterion': 'gini'}.
Trial 1516 finished with value: 0.6630434782608695 and parameters: {'n_estimators': 767, 'max_depth': 16, 'min_samples_split': 6, 'min_samples_leaf': 54, 'criterion': 'entropy'}.
Trial 1517 finished with value: 0.7065217391304348 and parameters: {'n_estimators': 823, 'max_depth': 10, 'min_samples_split': 40, 'min_samples_leaf': 57, 'criterion': 'entropy'}.
Trial 1518 finished with value: 0.6413043478260869 and parameters: {'n_estimators': 793, 'max_depth': 5, 'min_samples_split': 32, 'min_samples_leaf': 47, 'criterion': 'entropy'}.
Trial 1519 finished with value: 0.7065217391304348 and parameters: {'n_estimators': 810, 'max_depth': 12, 'min_samples_split': 28, 'min_samples_leaf': 51, 'criterion': 'entropy'}.
Trial 1520 finished with value: 0.7065217391304348 and parameters: {'n_estimators': 864, 'max_depth': 8, 'min_samples_split': 34, 'min_samples_leaf': 53, 'criterion': 'entropy'}.
Trial 1521 finished with value: 0.717391304347826 and parameters: {'n_estimators': 786, 'max_depth': 14, 'min_samples_split': 22, 'min_samples_leaf': 49, 'criterion': 'entropy'}.
Trial 1522 finished with value: 0.717391304347826 and parameters: {'n_estimators': 834, 'max_depth': 10, 'min_samples_split': 39, 'min_samples_leaf': 56, 'criterion': 'entropy'}.
Trial 1523 finished with value: 0.6630434782608695 and parameters: {'n_estimators': 964, 'max_depth': 7, 'min_samples_split': 13, 'min_samples_leaf': 45, 'criterion': 'entropy'}.
Trial 1524 finished with value: 0.6956521739130435 and parameters: {'n_estimators': 440, 'max_depth': 12, 'min_samples_split': 28, 'min_samples_leaf': 47, 'criterion': 'entropy'}.
Trial 1525 finished with value: 0.6847826086956522 and parameters: {'n_estimators': 889, 'max_depth': 9, 'min_samples_split': 36, 'min_samples_leaf': 51, 'criterion': 'entropy'}.
Trial 1526 finished with value: 0.6956521739130435 and parameters: {'n_estimators': 818, 'max_depth': 11, 'min_samples_split': 112, 'min_samples_leaf': 54, 'criterion': 'entropy'}.
Trial 1527 finished with value: 0.6521739130434783 and parameters: {'n_estimators': 392, 'max_depth': 14, 'min_samples_split': 25, 'min_samples_leaf': 39, 'criterion': 'entropy'}.
Trial 1528 finished with value: 0.6956521739130435 and parameters: {'n_estimators': 780, 'max_depth': 7, 'min_samples_split': 32, 'min_samples_leaf': 58, 'criterion': 'entropy'}.
Trial 1529 finished with value: 0.6521739130434783 and parameters: {'n_estimators': 573, 'max_depth': 18, 'min_samples_split': 19, 'min_samples_leaf': 49, 'criterion': 'entropy'}.
Trial 1530 finished with value: 0.6956521739130435 and parameters: {'n_estimators': 802, 'max_depth': 9, 'min_samples_split': 43, 'min_samples_leaf': 61, 'criterion': 'entropy'}.
Trial 1531 finished with value: 0.717391304347826 and parameters: {'n_estimators': 849, 'max_depth': 12, 'min_samples_split': 29, 'min_samples_leaf': 52, 'criterion': 'entropy'}.
Trial 1532 finished with value: 0.6847826086956522 and parameters: {'n_estimators': 738, 'max_depth': 15, 'min_samples_split': 38, 'min_samples_leaf': 55, 'criterion': 'entropy'}.
Trial 1533 finished with value: 0.7065217391304348 and parameters: {'n_estimators': 694, 'max_depth': 10, 'min_samples_split': 24, 'min_samples_leaf': 43, 'criterion': 'entropy'}.
