Trial 6691 finished with value: 0.6630434782608695 and parameters: {'n_estimators': 228, 'max_depth': 7, 'min_samples_split': 34, 'min_samples_leaf': 53, 'criterion': 'gini'}.
Trial 6692 finished with value: 0.717391304347826 and parameters: {'n_estimators': 274, 'max_depth': 14, 'min_samples_split': 29, 'min_samples_leaf': 60, 'criterion': 'entropy'}.
Trial 6693 finished with value: 0.7065217391304348 and parameters: {'n_estimators': 679, 'max_depth': 8, 'min_samples_split': 138, 'min_samples_leaf': 63, 'criterion': 'gini'}.
Trial 6694 finished with value: 0.7065217391304348 and parameters: {'n_estimators': 773, 'max_depth': 11, 'min_samples_split': 39, 'min_samples_leaf': 70, 'criterion': 'entropy'}.
Trial 6695 finished with value: 0.717391304347826 and parameters: {'n_estimators': 287, 'max_depth': 13, 'min_samples_split': 15, 'min_samples_leaf': 59, 'criterion': 'gini'}.
Trial 6696 finished with value: 0.6847826086956522 and parameters: {'n_estimators': 202, 'max_depth': 9, 'min_samples_split': 126, 'min_samples_leaf': 55, 'criterion': 'entropy'}.
Trial 6697 finished with value: 0.6413043478260869 and parameters: {'n_estimators': 258, 'max_depth': 5, 'min_samples_split': 25, 'min_samples_leaf': 57, 'criterion': 'entropy'}.
Trial 6698 finished with value: 0.6304347826086957 and parameters: {'n_estimators': 316, 'max_depth': 16, 'min_samples_split': 32, 'min_samples_leaf': 10, 'criterion': 'gini'}.
Trial 6699 finished with value: 0.717391304347826 and parameters: {'n_estimators': 925, 'max_depth': 11, 'min_samples_split': 120, 'min_samples_leaf': 61, 'criterion': 'entropy'}.
Trial 6700 finished with value: 0.7065217391304348 and parameters: {'n_estimators': 733, 'max_depth': 8, 'min_samples_split': 36, 'min_samples_leaf': 76, 'criterion': 'gini'}.
Trial 6701 finished with value: 0.6956521739130435 and parameters: {'n_estimators': 804, 'max_depth': 13, 'min_samples_split': 31, 'min_samples_leaf': 72, 'criterion': 'entropy'}.
Trial 6702 finished with value: 0.6413043478260869 and parameters: {'n_estimators': 241, 'max_depth': 7, 'min_samples_split': 21, 'min_samples_leaf': 52, 'criterion': 'gini'}.
Trial 6703 finished with value: 0.7391304347826086 and parameters: {'n_estimators': 267, 'max_depth': 10, 'min_samples_split': 42, 'min_samples_leaf': 58, 'criterion': 'entropy'}.
Trial 6704 finished with value: 0.7065217391304348 and parameters: {'n_estimators': 282, 'max_depth': 15, 'min_samples_split': 53, 'min_samples_leaf': 54, 'criterion': 'gini'}.
Trial 6705 finished with value: 0.6956521739130435 and parameters: {'n_estimators': 302, 'max_depth': 12, 'min_samples_split': 28, 'min_samples_leaf': 61, 'criterion': 'entropy'}.
Trial 6706 finished with value: 0.6739130434782609 and parameters: {'n_estimators': 764, 'max_depth': 18, 'min_samples_split': 133, 'min_samples_leaf': 66, 'criterion': 'entropy'}.
Trial 6707 finished with value: 0.7065217391304348 and parameters: {'n_estimators': 701, 'max_depth': 10, 'min_samples_split': 36, 'min_samples_leaf': 56, 'criterion': 'gini'}.
Trial 6708 finished with value: 0.6630434782608695 and parameters: {'n_estimators': 254, 'max_depth': 63, 'min_samples_split': 142, 'min_samples_leaf': 63, 'criterion': 'entropy'}.
Trial 6709 finished with value: 0.7065217391304348 and parameters: {'n_estimators': 219, 'max_depth': 7, 'min_samples_split': 23, 'min_samples_leaf': 74, 'criterion': 'gini'}.
Trial 6710 finished with value: 0.6956521739130435 and parameters: {'n_estimators': 137, 'max_depth': 9, 'min_samples_split': 40, 'min_samples_leaf': 59, 'criterion': 'entropy'}.
Trial 6711 finished with value: 0.6956521739130435 and parameters: {'n_estimators': 787, 'max_depth': 14, 'min_samples_split': 138, 'min_samples_leaf': 69, 'criterion': 'gini'}.
Trial 6712 finished with value: 0.7065217391304348 and parameters: {'n_estimators': 286, 'max_depth': 12, 'min_samples_split': 30, 'min_samples_leaf': 57, 'criterion': 'entropy'}.
Trial 6713 finished with value: 0.6847826086956522 and parameters: {'n_estimators': 318, 'max_depth': 6, 'min_samples_split': 17, 'min_samples_leaf': 60, 'criterion': 'gini'}.
Trial 6714 finished with value: 0.7282608695652174 and parameters: {'n_estimators': 752, 'max_depth': 10, 'min_samples_split': 27, 'min_samples_leaf': 55, 'criterion': 'entropy'}.
Trial 6715 finished with value: 0.6739130434782609 and parameters: {'n_estimators': 266, 'max_depth': 12, 'min_samples_split': 34, 'min_samples_leaf': 64, 'criterion': 'entropy'}.
Trial 6716 finished with value: 0.717391304347826 and parameters: {'n_estimators': 297, 'max_depth': 8, 'min_samples_split': 86, 'min_samples_leaf': 58, 'criterion': 'gini'}.
Trial 6717 finished with value: 0.6847826086956522 and parameters: {'n_estimators': 240, 'max_depth': 15, 'min_samples_split': 32, 'min_samples_leaf': 53, 'criterion': 'entropy'}.
Trial 6718 finished with value: 0.6847826086956522 and parameters: {'n_estimators': 335, 'max_depth': 11, 'min_samples_split': 124, 'min_samples_leaf': 71, 'criterion': 'gini'}.
Trial 6719 finished with value: 0.6413043478260869 and parameters: {'n_estimators': 275, 'max_depth': 5, 'min_samples_split': 46, 'min_samples_leaf': 62, 'criterion': 'entropy'}.
Trial 6720 finished with value: 0.6956521739130435 and parameters: {'n_estimators': 300, 'max_depth': 9, 'min_samples_split': 38, 'min_samples_leaf': 59, 'criterion': 'gini'}.
Trial 6721 finished with value: 0.6956521739130435 and parameters: {'n_estimators': 248, 'max_depth': 13, 'min_samples_split': 25, 'min_samples_leaf': 56, 'criterion': 'entropy'}.
Trial 6722 finished with value: 0.6847826086956522 and parameters: {'n_estimators': 532, 'max_depth': 7, 'min_samples_split': 59, 'min_samples_leaf': 67, 'criterion': 'gini'}.
Trial 6723 finished with value: 0.6956521739130435 and parameters: {'n_estimators': 741, 'max_depth': 10, 'min_samples_split': 113, 'min_samples_leaf': 61, 'criterion': 'entropy'}.
Trial 6724 finished with value: 0.6630434782608695 and parameters: {'n_estimators': 718, 'max_depth': 20, 'min_samples_split': 135, 'min_samples_leaf': 51, 'criterion': 'gini'}.
Trial 6725 finished with value: 0.6739130434782609 and parameters: {'n_estimators': 269, 'max_depth': 17, 'min_samples_split': 34, 'min_samples_leaf': 77, 'criterion': 'entropy'}.
Trial 6726 finished with value: 0.6847826086956522 and parameters: {'n_estimators': 356, 'max_depth': 14, 'min_samples_split': 22, 'min_samples_leaf': 74, 'criterion': 'entropy'}.
Trial 6727 finished with value: 0.717391304347826 and parameters: {'n_estimators': 327, 'max_depth': 11, 'min_samples_split': 8, 'min_samples_leaf': 54, 'criterion': 'gini'}.
Trial 6728 finished with value: 0.7282608695652174 and parameters: {'n_estimators': 286, 'max_depth': 8, 'min_samples_split': 73, 'min_samples_leaf': 58, 'criterion': 'entropy'}.
Trial 6729 finished with value: 0.717391304347826 and parameters: {'n_estimators': 225, 'max_depth': 9, 'min_samples_split': 29, 'min_samples_leaf': 60, 'criterion': 'gini'}.
Trial 6730 finished with value: 0.6956521739130435 and parameters: {'n_estimators': 783, 'max_depth': 12, 'min_samples_split': 129, 'min_samples_leaf': 65, 'criterion': 'entropy'}.
Trial 6731 finished with value: 0.6739130434782609 and parameters: {'n_estimators': 257, 'max_depth': 6, 'min_samples_split': 142, 'min_samples_leaf': 56, 'criterion': 'gini'}.
Trial 6732 finished with value: 0.6956521739130435 and parameters: {'n_estimators': 274, 'max_depth': 14, 'min_samples_split': 40, 'min_samples_leaf': 72, 'criterion': 'entropy'}.
Trial 6733 finished with value: 0.7065217391304348 and parameters: {'n_estimators': 308, 'max_depth': 10, 'min_samples_split': 27, 'min_samples_leaf': 62, 'criterion': 'gini'}.
Trial 6734 finished with value: 0.6521739130434783 and parameters: {'n_estimators': 100, 'max_depth': 39, 'min_samples_split': 20, 'min_samples_leaf': 69, 'criterion': 'entropy'}.
Trial 6735 finished with value: 0.6739130434782609 and parameters: {'n_estimators': 389, 'max_depth': 16, 'min_samples_split': 35, 'min_samples_leaf': 58, 'criterion': 'entropy'}.
Trial 6736 finished with value: 0.6630434782608695 and parameters: {'n_estimators': 167, 'max_depth': 7, 'min_samples_split': 14, 'min_samples_leaf': 54, 'criterion': 'gini'}.
Trial 6737 finished with value: 0.7282608695652174 and parameters: {'n_estimators': 297, 'max_depth': 12, 'min_samples_split': 50, 'min_samples_leaf': 60, 'criterion': 'entropy'}.
Trial 6738 finished with value: 0.7065217391304348 and parameters: {'n_estimators': 880, 'max_depth': 9, 'min_samples_split': 43, 'min_samples_leaf': 57, 'criterion': 'gini'}.
Trial 6739 finished with value: 0.7065217391304348 and parameters: {'n_estimators': 423, 'max_depth': 11, 'min_samples_split': 30, 'min_samples_leaf': 64, 'criterion': 'entropy'}.
Trial 6740 finished with value: 0.6521739130434783 and parameters: {'n_estimators': 459, 'max_depth': 5, 'min_samples_split': 171, 'min_samples_leaf': 62, 'criterion': 'gini'}.
Trial 6741 finished with value: 0.6630434782608695 and parameters: {'n_estimators': 767, 'max_depth': 57, 'min_samples_split': 121, 'min_samples_leaf': 59, 'criterion': 'entropy'}.
Trial 6742 finished with value: 0.6739130434782609 and parameters: {'n_estimators': 242, 'max_depth': 13, 'min_samples_split': 138, 'min_samples_leaf': 75, 'criterion': 'gini'}.
Trial 6743 finished with value: 0.717391304347826 and parameters: {'n_estimators': 723, 'max_depth': 8, 'min_samples_split': 25, 'min_samples_leaf': 56, 'criterion': 'entropy'}.
Trial 6744 finished with value: 0.7282608695652174 and parameters: {'n_estimators': 286, 'max_depth': 10, 'min_samples_split': 37, 'min_samples_leaf': 51, 'criterion': 'entropy'}.
Trial 6745 finished with value: 0.6956521739130435 and parameters: {'n_estimators': 1000, 'max_depth': 15, 'min_samples_split': 107, 'min_samples_leaf': 71, 'criterion': 'gini'}.
Trial 6746 finished with value: 0.7065217391304348 and parameters: {'n_estimators': 593, 'max_depth': 12, 'min_samples_split': 32, 'min_samples_leaf': 54, 'criterion': 'entropy'}.
Trial 6747 finished with value: 0.6956521739130435 and parameters: {'n_estimators': 262, 'max_depth': 7, 'min_samples_split': 142, 'min_samples_leaf': 60, 'criterion': 'gini'}.
Trial 6748 finished with value: 0.6847826086956522 and parameters: {'n_estimators': 210, 'max_depth': 9, 'min_samples_split': 130, 'min_samples_leaf': 67, 'criterion': 'entropy'}.
Trial 6749 finished with value: 0.7065217391304348 and parameters: {'n_estimators': 317, 'max_depth': 11, 'min_samples_split': 65, 'min_samples_leaf': 57, 'criterion': 'gini'}.
Trial 6750 finished with value: 0.6956521739130435 and parameters: {'n_estimators': 751, 'max_depth': 14, 'min_samples_split': 19, 'min_samples_leaf': 63, 'criterion': 'entropy'}.
Trial 6751 finished with value: 0.6956521739130435 and parameters: {'n_estimators': 795, 'max_depth': 8, 'min_samples_split': 40, 'min_samples_leaf': 73, 'criterion': 'gini'}.
Trial 6752 finished with value: 0.7391304347826086 and parameters: {'n_estimators': 280, 'max_depth': 10, 'min_samples_split': 32, 'min_samples_leaf': 58, 'criterion': 'entropy'}.
Trial 6753 finished with value: 0.6847826086956522 and parameters: {'n_estimators': 297, 'max_depth': 17, 'min_samples_split': 117, 'min_samples_leaf': 55, 'criterion': 'entropy'}.
Trial 6754 finished with value: 0.6956521739130435 and parameters: {'n_estimators': 341, 'max_depth': 48, 'min_samples_split': 26, 'min_samples_leaf': 61, 'criterion': 'gini'}.
Trial 6755 finished with value: 0.7065217391304348 and parameters: {'n_estimators': 258, 'max_depth': 13, 'min_samples_split': 134, 'min_samples_leaf': 52, 'criterion': 'entropy'}.
Trial 6756 finished with value: 0.6413043478260869 and parameters: {'n_estimators': 771, 'max_depth': 5, 'min_samples_split': 38, 'min_samples_leaf': 58, 'criterion': 'gini'}.
Trial 6757 finished with value: 0.6521739130434783 and parameters: {'n_estimators': 229, 'max_depth': 90, 'min_samples_split': 43, 'min_samples_leaf': 70, 'criterion': 'entropy'}.
Trial 6758 finished with value: 0.6630434782608695 and parameters: {'n_estimators': 688, 'max_depth': 70, 'min_samples_split': 34, 'min_samples_leaf': 56, 'criterion': 'gini'}.
Trial 6759 finished with value: 0.7065217391304348 and parameters: {'n_estimators': 319, 'max_depth': 9, 'min_samples_split': 28, 'min_samples_leaf': 60, 'criterion': 'entropy'}.
Trial 6760 finished with value: 0.7282608695652174 and parameters: {'n_estimators': 274, 'max_depth': 11, 'min_samples_split': 24, 'min_samples_leaf': 65, 'criterion': 'gini'}.
Trial 6761 finished with value: 0.6630434782608695 and parameters: {'n_estimators': 737, 'max_depth': 36, 'min_samples_split': 126, 'min_samples_leaf': 63, 'criterion': 'entropy'}.
Trial 6762 finished with value: 0.6956521739130435 and parameters: {'n_estimators': 249, 'max_depth': 7, 'min_samples_split': 143, 'min_samples_leaf': 76, 'criterion': 'entropy'}.
Trial 6763 finished with value: 0.7065217391304348 and parameters: {'n_estimators': 294, 'max_depth': 13, 'min_samples_split': 47, 'min_samples_leaf': 59, 'criterion': 'gini'}.
Trial 6764 finished with value: 0.6847826086956522 and parameters: {'n_estimators': 309, 'max_depth': 15, 'min_samples_split': 36, 'min_samples_leaf': 53, 'criterion': 'entropy'}.
Trial 6765 finished with value: 0.717391304347826 and parameters: {'n_estimators': 262, 'max_depth': 11, 'min_samples_split': 30, 'min_samples_leaf': 68, 'criterion': 'gini'}.
Trial 6766 finished with value: 0.7282608695652174 and parameters: {'n_estimators': 278, 'max_depth': 9, 'min_samples_split': 17, 'min_samples_leaf': 56, 'criterion': 'entropy'}.
Trial 6767 finished with value: 0.6847826086956522 and parameters: {'n_estimators': 236, 'max_depth': 6, 'min_samples_split': 136, 'min_samples_leaf': 60, 'criterion': 'gini'}.
Trial 6768 finished with value: 0.6847826086956522 and parameters: {'n_estimators': 295, 'max_depth': 12, 'min_samples_split': 21, 'min_samples_leaf': 73, 'criterion': 'entropy'}.
Trial 6769 finished with value: 0.7065217391304348 and parameters: {'n_estimators': 755, 'max_depth': 8, 'min_samples_split': 32, 'min_samples_leaf': 62, 'criterion': 'gini'}.
Trial 6770 finished with value: 0.717391304347826 and parameters: {'n_estimators': 969, 'max_depth': 10, 'min_samples_split': 40, 'min_samples_leaf': 57, 'criterion': 'entropy'}.
Trial 6771 finished with value: 0.6847826086956522 and parameters: {'n_estimators': 906, 'max_depth': 18, 'min_samples_split': 139, 'min_samples_leaf': 58, 'criterion': 'entropy'}.
Trial 6772 finished with value: 0.6847826086956522 and parameters: {'n_estimators': 183, 'max_depth': 14, 'min_samples_split': 36, 'min_samples_leaf': 54, 'criterion': 'gini'}.
Trial 6773 finished with value: 0.6956521739130435 and parameters: {'n_estimators': 329, 'max_depth': 12, 'min_samples_split': 27, 'min_samples_leaf': 65, 'criterion': 'entropy'}.
Trial 6774 finished with value: 0.7065217391304348 and parameters: {'n_estimators': 804, 'max_depth': 7, 'min_samples_split': 102, 'min_samples_leaf': 78, 'criterion': 'gini'}.
Trial 6775 finished with value: 0.6847826086956522 and parameters: {'n_estimators': 253, 'max_depth': 16, 'min_samples_split': 23, 'min_samples_leaf': 62, 'criterion': 'entropy'}.
Trial 6776 finished with value: 0.6413043478260869 and parameters: {'n_estimators': 559, 'max_depth': 10, 'min_samples_split': 131, 'min_samples_leaf': 22, 'criterion': 'gini'}.
Trial 6777 finished with value: 0.7065217391304348 and parameters: {'n_estimators': 945, 'max_depth': 8, 'min_samples_split': 30, 'min_samples_leaf': 55, 'criterion': 'entropy'}.
Trial 6778 finished with value: 0.6630434782608695 and parameters: {'n_estimators': 283, 'max_depth': 13, 'min_samples_split': 83, 'min_samples_leaf': 80, 'criterion': 'gini'}.
Trial 6779 finished with value: 0.717391304347826 and parameters: {'n_estimators': 728, 'max_depth': 11, 'min_samples_split': 44, 'min_samples_leaf': 60, 'criterion': 'entropy'}.
Trial 6780 finished with value: 0.6630434782608695 and parameters: {'n_estimators': 305, 'max_depth': 5, 'min_samples_split': 35, 'min_samples_leaf': 70, 'criterion': 'gini'}.
Trial 6781 finished with value: 0.7065217391304348 and parameters: {'n_estimators': 264, 'max_depth': 9, 'min_samples_split': 114, 'min_samples_leaf': 58, 'criterion': 'entropy'}.
Trial 6782 finished with value: 0.6630434782608695 and parameters: {'n_estimators': 665, 'max_depth': 7, 'min_samples_split': 121, 'min_samples_leaf': 56, 'criterion': 'entropy'}.
Trial 6783 finished with value: 0.7065217391304348 and parameters: {'n_estimators': 774, 'max_depth': 14, 'min_samples_split': 13, 'min_samples_leaf': 61, 'criterion': 'gini'}.
Trial 6784 finished with value: 0.6847826086956522 and parameters: {'n_estimators': 363, 'max_depth': 11, 'min_samples_split': 38, 'min_samples_leaf': 75, 'criterion': 'entropy'}.
Trial 6785 finished with value: 0.717391304347826 and parameters: {'n_estimators': 222, 'max_depth': 9, 'min_samples_split': 92, 'min_samples_leaf': 72, 'criterion': 'gini'}.
Trial 6786 finished with value: 0.6739130434782609 and parameters: {'n_estimators': 617, 'max_depth': 16, 'min_samples_split': 28, 'min_samples_leaf': 51, 'criterion': 'entropy'}.
Trial 6787 finished with value: 0.7065217391304348 and parameters: {'n_estimators': 277, 'max_depth': 12, 'min_samples_split': 140, 'min_samples_leaf': 67, 'criterion': 'gini'}.
Trial 6788 finished with value: 0.7065217391304348 and parameters: {'n_estimators': 242, 'max_depth': 7, 'min_samples_split': 23, 'min_samples_leaf': 59, 'criterion': 'entropy'}.
Trial 6789 finished with value: 0.7282608695652174 and parameters: {'n_estimators': 320, 'max_depth': 10, 'min_samples_split': 32, 'min_samples_leaf': 53, 'criterion': 'gini'}.
Trial 6790 finished with value: 0.7065217391304348 and parameters: {'n_estimators': 789, 'max_depth': 13, 'min_samples_split': 124, 'min_samples_leaf': 64, 'criterion': 'entropy'}.
Trial 6791 finished with value: 0.7065217391304348 and parameters: {'n_estimators': 711, 'max_depth': 9, 'min_samples_split': 40, 'min_samples_leaf': 57, 'criterion': 'entropy'}.
Trial 6792 finished with value: 0.6956521739130435 and parameters: {'n_estimators': 347, 'max_depth': 15, 'min_samples_split': 18, 'min_samples_leaf': 62, 'criterion': 'gini'}.
Trial 6793 finished with value: 0.717391304347826 and parameters: {'n_estimators': 299, 'max_depth': 11, 'min_samples_split': 144, 'min_samples_leaf': 59, 'criterion': 'entropy'}.
Trial 6794 finished with value: 0.6739130434782609 and parameters: {'n_estimators': 751, 'max_depth': 51, 'min_samples_split': 134, 'min_samples_leaf': 55, 'criterion': 'gini'}.
Trial 6795 finished with value: 0.6739130434782609 and parameters: {'n_estimators': 266, 'max_depth': 5, 'min_samples_split': 33, 'min_samples_leaf': 69, 'criterion': 'entropy'}.
Trial 6796 finished with value: 0.6956521739130435 and parameters: {'n_estimators': 283, 'max_depth': 20, 'min_samples_split': 26, 'min_samples_leaf': 58, 'criterion': 'gini'}.
Trial 6797 finished with value: 0.6847826086956522 and parameters: {'n_estimators': 241, 'max_depth': 7, 'min_samples_split': 110, 'min_samples_leaf': 61, 'criterion': 'entropy'}.
Trial 6798 finished with value: 0.6847826086956522 and parameters: {'n_estimators': 201, 'max_depth': 29, 'min_samples_split': 43, 'min_samples_leaf': 74, 'criterion': 'gini'}.
Trial 6799 finished with value: 0.6739130434782609 and parameters: {'n_estimators': 306, 'max_depth': 13, 'min_samples_split': 36, 'min_samples_leaf': 56, 'criterion': 'entropy'}.
Trial 6800 finished with value: 0.6956521739130435 and parameters: {'n_estimators': 256, 'max_depth': 9, 'min_samples_split': 29, 'min_samples_leaf': 64, 'criterion': 'entropy'}.
Trial 6801 finished with value: 0.717391304347826 and parameters: {'n_estimators': 279, 'max_depth': 12, 'min_samples_split': 21, 'min_samples_leaf': 53, 'criterion': 'gini'}.
Trial 6802 finished with value: 0.7065217391304348 and parameters: {'n_estimators': 804, 'max_depth': 10, 'min_samples_split': 139, 'min_samples_leaf': 59, 'criterion': 'entropy'}.
Trial 6803 finished with value: 0.6847826086956522 and parameters: {'n_estimators': 764, 'max_depth': 7, 'min_samples_split': 128, 'min_samples_leaf': 66, 'criterion': 'gini'}.
Trial 6804 finished with value: 0.6956521739130435 and parameters: {'n_estimators': 738, 'max_depth': 32, 'min_samples_split': 33, 'min_samples_leaf': 72, 'criterion': 'entropy'}.
Trial 6805 finished with value: 0.6956521739130435 and parameters: {'n_estimators': 336, 'max_depth': 14, 'min_samples_split': 39, 'min_samples_leaf': 57, 'criterion': 'gini'}.
Trial 6806 finished with value: 0.7282608695652174 and parameters: {'n_estimators': 299, 'max_depth': 11, 'min_samples_split': 116, 'min_samples_leaf': 62, 'criterion': 'entropy'}.
Trial 6807 finished with value: 0.7065217391304348 and parameters: {'n_estimators': 268, 'max_depth': 8, 'min_samples_split': 48, 'min_samples_leaf': 55, 'criterion': 'gini'}.
Trial 6808 finished with value: 0.6956521739130435 and parameters: {'n_estimators': 288, 'max_depth': 17, 'min_samples_split': 24, 'min_samples_leaf': 60, 'criterion': 'entropy'}.
Trial 6809 finished with value: 0.7065217391304348 and parameters: {'n_estimators': 251, 'max_depth': 10, 'min_samples_split': 30, 'min_samples_leaf': 57, 'criterion': 'entropy'}.
Trial 6810 finished with value: 0.717391304347826 and parameters: {'n_estimators': 321, 'max_depth': 12, 'min_samples_split': 7, 'min_samples_leaf': 54, 'criterion': 'gini'}.
Trial 6811 finished with value: 0.6847826086956522 and parameters: {'n_estimators': 697, 'max_depth': 15, 'min_samples_split': 136, 'min_samples_leaf': 69, 'criterion': 'entropy'}.
Trial 6812 finished with value: 0.6521739130434783 and parameters: {'n_estimators': 220, 'max_depth': 5, 'min_samples_split': 143, 'min_samples_leaf': 60, 'criterion': 'gini'}.
Trial 6813 finished with value: 0.7065217391304348 and parameters: {'n_estimators': 267, 'max_depth': 9, 'min_samples_split': 35, 'min_samples_leaf': 76, 'criterion': 'entropy'}.
