Trial 374 finished with value: 0.5543478260869565 and parameters: {'n_estimators': 663, 'max_depth': 76, 'min_samples_split': 177, 'min_samples_leaf': 95, 'criterion': 'entropy'}.
Trial 375 finished with value: 0.5217391304347826 and parameters: {'n_estimators': 258, 'max_depth': 73, 'min_samples_split': 24, 'min_samples_leaf': 92, 'criterion': 'entropy'}.
Trial 376 finished with value: 0.532608695652174 and parameters: {'n_estimators': 346, 'max_depth': 66, 'min_samples_split': 183, 'min_samples_leaf': 47, 'criterion': 'entropy'}.
Trial 377 finished with value: 0.532608695652174 and parameters: {'n_estimators': 308, 'max_depth': 62, 'min_samples_split': 187, 'min_samples_leaf': 100, 'criterion': 'gini'}.
Trial 378 finished with value: 0.5652173913043478 and parameters: {'n_estimators': 371, 'max_depth': 100, 'min_samples_split': 194, 'min_samples_leaf': 96, 'criterion': 'entropy'}.
Trial 379 finished with value: 0.5217391304347826 and parameters: {'n_estimators': 329, 'max_depth': 71, 'min_samples_split': 170, 'min_samples_leaf': 24, 'criterion': 'entropy'}.
Trial 380 finished with value: 0.5543478260869565 and parameters: {'n_estimators': 601, 'max_depth': 68, 'min_samples_split': 197, 'min_samples_leaf': 98, 'criterion': 'entropy'}.
Trial 381 finished with value: 0.532608695652174 and parameters: {'n_estimators': 285, 'max_depth': 74, 'min_samples_split': 178, 'min_samples_leaf': 40, 'criterion': 'entropy'}.
Trial 382 finished with value: 0.5543478260869565 and parameters: {'n_estimators': 298, 'max_depth': 54, 'min_samples_split': 200, 'min_samples_leaf': 44, 'criterion': 'entropy'}.
Trial 383 finished with value: 0.5652173913043478 and parameters: {'n_estimators': 356, 'max_depth': 46, 'min_samples_split': 190, 'min_samples_leaf': 72, 'criterion': 'entropy'}.
Trial 384 finished with value: 0.5543478260869565 and parameters: {'n_estimators': 319, 'max_depth': 64, 'min_samples_split': 185, 'min_samples_leaf': 49, 'criterion': 'gini'}.
Trial 385 finished with value: 0.5434782608695652 and parameters: {'n_estimators': 339, 'max_depth': 69, 'min_samples_split': 174, 'min_samples_leaf': 93, 'criterion': 'entropy'}.
Trial 386 finished with value: 0.5217391304347826 and parameters: {'n_estimators': 268, 'max_depth': 77, 'min_samples_split': 167, 'min_samples_leaf': 52, 'criterion': 'entropy'}.
Trial 387 finished with value: 0.5434782608695652 and parameters: {'n_estimators': 759, 'max_depth': 67, 'min_samples_split': 161, 'min_samples_leaf': 96, 'criterion': 'entropy'}.
Trial 388 finished with value: 0.5434782608695652 and parameters: {'n_estimators': 380, 'max_depth': 52, 'min_samples_split': 180, 'min_samples_leaf': 98, 'criterion': 'entropy'}.
Trial 389 finished with value: 0.5543478260869565 and parameters: {'n_estimators': 306, 'max_depth': 71, 'min_samples_split': 75, 'min_samples_leaf': 94, 'criterion': 'entropy'}.
Trial 390 finished with value: 0.532608695652174 and parameters: {'n_estimators': 401, 'max_depth': 59, 'min_samples_split': 192, 'min_samples_leaf': 100, 'criterion': 'entropy'}.
Trial 391 finished with value: 0.5652173913043478 and parameters: {'n_estimators': 325, 'max_depth': 74, 'min_samples_split': 173, 'min_samples_leaf': 96, 'criterion': 'entropy'}.
Trial 392 finished with value: 0.5543478260869565 and parameters: {'n_estimators': 285, 'max_depth': 84, 'min_samples_split': 185, 'min_samples_leaf': 98, 'criterion': 'gini'}.
Trial 393 finished with value: 0.532608695652174 and parameters: {'n_estimators': 632, 'max_depth': 66, 'min_samples_split': 169, 'min_samples_leaf': 91, 'criterion': 'entropy'}.
Trial 394 finished with value: 0.5434782608695652 and parameters: {'n_estimators': 354, 'max_depth': 57, 'min_samples_split': 194, 'min_samples_leaf': 88, 'criterion': 'entropy'}.
Trial 395 finished with value: 0.5217391304347826 and parameters: {'n_estimators': 336, 'max_depth': 69, 'min_samples_split': 177, 'min_samples_leaf': 46, 'criterion': 'entropy'}.
Trial 396 finished with value: 0.5543478260869565 and parameters: {'n_estimators': 315, 'max_depth': 72, 'min_samples_split': 182, 'min_samples_leaf': 94, 'criterion': 'entropy'}.
Trial 397 finished with value: 0.532608695652174 and parameters: {'n_estimators': 446, 'max_depth': 78, 'min_samples_split': 188, 'min_samples_leaf': 50, 'criterion': 'entropy'}.
Trial 398 finished with value: 0.5652173913043478 and parameters: {'n_estimators': 300, 'max_depth': 61, 'min_samples_split': 163, 'min_samples_leaf': 96, 'criterion': 'entropy'}.
Trial 399 finished with value: 0.5108695652173914 and parameters: {'n_estimators': 366, 'max_depth': 48, 'min_samples_split': 196, 'min_samples_leaf': 54, 'criterion': 'entropy'}.
Trial 400 finished with value: 0.5543478260869565 and parameters: {'n_estimators': 345, 'max_depth': 75, 'min_samples_split': 151, 'min_samples_leaf': 98, 'criterion': 'entropy'}.
Trial 401 finished with value: 0.532608695652174 and parameters: {'n_estimators': 324, 'max_depth': 64, 'min_samples_split': 170, 'min_samples_leaf': 48, 'criterion': 'gini'}.
Trial 402 finished with value: 0.5543478260869565 and parameters: {'n_estimators': 276, 'max_depth': 70, 'min_samples_split': 174, 'min_samples_leaf': 94, 'criterion': 'entropy'}.
Trial 403 finished with value: 0.5652173913043478 and parameters: {'n_estimators': 296, 'max_depth': 36, 'min_samples_split': 189, 'min_samples_leaf': 96, 'criterion': 'entropy'}.
Trial 404 finished with value: 0.5434782608695652 and parameters: {'n_estimators': 330, 'max_depth': 68, 'min_samples_split': 179, 'min_samples_leaf': 99, 'criterion': 'entropy'}.
Trial 405 finished with value: 0.532608695652174 and parameters: {'n_estimators': 471, 'max_depth': 55, 'min_samples_split': 94, 'min_samples_leaf': 92, 'criterion': 'entropy'}.
Trial 406 finished with value: 0.5217391304347826 and parameters: {'n_estimators': 309, 'max_depth': 26, 'min_samples_split': 193, 'min_samples_leaf': 37, 'criterion': 'entropy'}.
Trial 407 finished with value: 0.5434782608695652 and parameters: {'n_estimators': 257, 'max_depth': 73, 'min_samples_split': 200, 'min_samples_leaf': 43, 'criterion': 'entropy'}.
Trial 408 finished with value: 0.532608695652174 and parameters: {'n_estimators': 419, 'max_depth': 53, 'min_samples_split': 183, 'min_samples_leaf': 100, 'criterion': 'entropy'}.
Trial 409 finished with value: 0.5652173913043478 and parameters: {'n_estimators': 360, 'max_depth': 66, 'min_samples_split': 167, 'min_samples_leaf': 97, 'criterion': 'entropy'}.
Trial 410 finished with value: 0.5434782608695652 and parameters: {'n_estimators': 387, 'max_depth': 71, 'min_samples_split': 156, 'min_samples_leaf': 84, 'criterion': 'gini'}.
Trial 411 finished with value: 0.5652173913043478 and parameters: {'n_estimators': 346, 'max_depth': 30, 'min_samples_split': 173, 'min_samples_leaf': 95, 'criterion': 'entropy'}.
Trial 412 finished with value: 0.5760869565217391 and parameters: {'n_estimators': 316, 'max_depth': 80, 'min_samples_split': 188, 'min_samples_leaf': 52, 'criterion': 'entropy'}.
Trial 413 finished with value: 0.5760869565217391 and parameters: {'n_estimators': 318, 'max_depth': 83, 'min_samples_split': 187, 'min_samples_leaf': 51, 'criterion': 'entropy'}.
Trial 414 finished with value: 0.5108695652173914 and parameters: {'n_estimators': 338, 'max_depth': 81, 'min_samples_split': 187, 'min_samples_leaf': 55, 'criterion': 'entropy'}.
Trial 415 finished with value: 0.5543478260869565 and parameters: {'n_estimators': 321, 'max_depth': 80, 'min_samples_split': 183, 'min_samples_leaf': 51, 'criterion': 'entropy'}.
Trial 416 finished with value: 0.5217391304347826 and parameters: {'n_estimators': 316, 'max_depth': 78, 'min_samples_split': 179, 'min_samples_leaf': 33, 'criterion': 'entropy'}.
Trial 417 finished with value: 0.5760869565217391 and parameters: {'n_estimators': 372, 'max_depth': 86, 'min_samples_split': 187, 'min_samples_leaf': 52, 'criterion': 'entropy'}.
Trial 418 finished with value: 0.5434782608695652 and parameters: {'n_estimators': 390, 'max_depth': 89, 'min_samples_split': 190, 'min_samples_leaf': 53, 'criterion': 'entropy'}.
Trial 419 finished with value: 0.5543478260869565 and parameters: {'n_estimators': 368, 'max_depth': 85, 'min_samples_split': 186, 'min_samples_leaf': 58, 'criterion': 'gini'}.
Trial 420 finished with value: 0.5434782608695652 and parameters: {'n_estimators': 378, 'max_depth': 87, 'min_samples_split': 193, 'min_samples_leaf': 50, 'criterion': 'entropy'}.
Trial 421 finished with value: 0.5434782608695652 and parameters: {'n_estimators': 373, 'max_depth': 80, 'min_samples_split': 188, 'min_samples_leaf': 30, 'criterion': 'entropy'}.
Trial 422 finished with value: 0.5434782608695652 and parameters: {'n_estimators': 357, 'max_depth': 81, 'min_samples_split': 197, 'min_samples_leaf': 52, 'criterion': 'entropy'}.
Trial 423 finished with value: 0.532608695652174 and parameters: {'n_estimators': 723, 'max_depth': 83, 'min_samples_split': 185, 'min_samples_leaf': 59, 'criterion': 'entropy'}.
Trial 424 finished with value: 0.5543478260869565 and parameters: {'n_estimators': 992, 'max_depth': 92, 'min_samples_split': 192, 'min_samples_leaf': 56, 'criterion': 'entropy'}.
Trial 425 finished with value: 0.532608695652174 and parameters: {'n_estimators': 345, 'max_depth': 86, 'min_samples_split': 182, 'min_samples_leaf': 48, 'criterion': 'entropy'}.
Trial 426 finished with value: 0.5108695652173914 and parameters: {'n_estimators': 413, 'max_depth': 81, 'min_samples_split': 190, 'min_samples_leaf': 54, 'criterion': 'gini'}.
Trial 427 finished with value: 0.532608695652174 and parameters: {'n_estimators': 400, 'max_depth': 85, 'min_samples_split': 196, 'min_samples_leaf': 51, 'criterion': 'entropy'}.
Trial 428 finished with value: 0.5434782608695652 and parameters: {'n_estimators': 336, 'max_depth': 90, 'min_samples_split': 186, 'min_samples_leaf': 49, 'criterion': 'entropy'}.
Trial 429 finished with value: 0.5217391304347826 and parameters: {'n_estimators': 312, 'max_depth': 83, 'min_samples_split': 176, 'min_samples_leaf': 47, 'criterion': 'entropy'}.
Trial 430 finished with value: 0.5434782608695652 and parameters: {'n_estimators': 357, 'max_depth': 83, 'min_samples_split': 194, 'min_samples_leaf': 45, 'criterion': 'entropy'}.
Trial 431 finished with value: 0.5543478260869565 and parameters: {'n_estimators': 327, 'max_depth': 88, 'min_samples_split': 181, 'min_samples_leaf': 50, 'criterion': 'entropy'}.
Trial 432 finished with value: 0.5652173913043478 and parameters: {'n_estimators': 809, 'max_depth': 50, 'min_samples_split': 189, 'min_samples_leaf': 74, 'criterion': 'entropy'}.
Trial 433 finished with value: 0.5217391304347826 and parameters: {'n_estimators': 298, 'max_depth': 82, 'min_samples_split': 200, 'min_samples_leaf': 16, 'criterion': 'entropy'}.
Trial 434 finished with value: 0.5434782608695652 and parameters: {'n_estimators': 388, 'max_depth': 84, 'min_samples_split': 177, 'min_samples_leaf': 53, 'criterion': 'entropy'}.
Trial 435 finished with value: 0.5217391304347826 and parameters: {'n_estimators': 346, 'max_depth': 79, 'min_samples_split': 120, 'min_samples_leaf': 48, 'criterion': 'gini'}.
Trial 436 finished with value: 0.5543478260869565 and parameters: {'n_estimators': 317, 'max_depth': 77, 'min_samples_split': 193, 'min_samples_leaf': 52, 'criterion': 'entropy'}.
Trial 437 finished with value: 0.532608695652174 and parameters: {'n_estimators': 373, 'max_depth': 85, 'min_samples_split': 184, 'min_samples_leaf': 63, 'criterion': 'entropy'}.
Trial 438 finished with value: 0.532608695652174 and parameters: {'n_estimators': 333, 'max_depth': 50, 'min_samples_split': 171, 'min_samples_leaf': 42, 'criterion': 'entropy'}.
Trial 439 finished with value: 0.532608695652174 and parameters: {'n_estimators': 306, 'max_depth': 76, 'min_samples_split': 187, 'min_samples_leaf': 56, 'criterion': 'entropy'}.
Trial 440 finished with value: 0.5434782608695652 and parameters: {'n_estimators': 352, 'max_depth': 79, 'min_samples_split': 180, 'min_samples_leaf': 68, 'criterion': 'entropy'}.
Trial 441 finished with value: 0.532608695652174 and parameters: {'n_estimators': 326, 'max_depth': 76, 'min_samples_split': 196, 'min_samples_leaf': 47, 'criterion': 'entropy'}.
Trial 442 finished with value: 0.5434782608695652 and parameters: {'n_estimators': 285, 'max_depth': 45, 'min_samples_split': 190, 'min_samples_leaf': 45, 'criterion': 'entropy'}.
Trial 443 finished with value: 0.5543478260869565 and parameters: {'n_estimators': 362, 'max_depth': 82, 'min_samples_split': 173, 'min_samples_leaf': 51, 'criterion': 'gini'}.
Trial 444 finished with value: 0.5217391304347826 and parameters: {'n_estimators': 297, 'max_depth': 54, 'min_samples_split': 178, 'min_samples_leaf': 39, 'criterion': 'entropy'}.
Trial 445 finished with value: 0.5543478260869565 and parameters: {'n_estimators': 436, 'max_depth': 87, 'min_samples_split': 184, 'min_samples_leaf': 50, 'criterion': 'entropy'}.
Trial 446 finished with value: 0.5217391304347826 and parameters: {'n_estimators': 335, 'max_depth': 92, 'min_samples_split': 191, 'min_samples_leaf': 54, 'criterion': 'entropy'}.
Trial 447 finished with value: 0.5217391304347826 and parameters: {'n_estimators': 320, 'max_depth': 51, 'min_samples_split': 168, 'min_samples_leaf': 46, 'criterion': 'entropy'}.
Trial 448 finished with value: 0.5543478260869565 and parameters: {'n_estimators': 345, 'max_depth': 20, 'min_samples_split': 197, 'min_samples_leaf': 48, 'criterion': 'entropy'}.
Trial 449 finished with value: 0.5434782608695652 and parameters: {'n_estimators': 312, 'max_depth': 79, 'min_samples_split': 175, 'min_samples_leaf': 44, 'criterion': 'entropy'}.
Trial 450 finished with value: 0.5217391304347826 and parameters: {'n_estimators': 405, 'max_depth': 75, 'min_samples_split': 181, 'min_samples_leaf': 4, 'criterion': 'entropy'}.
Trial 451 finished with value: 0.5543478260869565 and parameters: {'n_estimators': 369, 'max_depth': 74, 'min_samples_split': 187, 'min_samples_leaf': 49, 'criterion': 'gini'}.
Trial 452 finished with value: 0.532608695652174 and parameters: {'n_estimators': 304, 'max_depth': 13, 'min_samples_split': 200, 'min_samples_leaf': 47, 'criterion': 'entropy'}.
Trial 453 finished with value: 0.532608695652174 and parameters: {'n_estimators': 330, 'max_depth': 48, 'min_samples_split': 170, 'min_samples_leaf': 54, 'criterion': 'entropy'}.
Trial 454 finished with value: 0.5543478260869565 and parameters: {'n_estimators': 285, 'max_depth': 77, 'min_samples_split': 194, 'min_samples_leaf': 51, 'criterion': 'entropy'}.
Trial 455 finished with value: 0.5108695652173914 and parameters: {'n_estimators': 352, 'max_depth': 52, 'min_samples_split': 165, 'min_samples_leaf': 52, 'criterion': 'entropy'}.
Trial 456 finished with value: 0.532608695652174 and parameters: {'n_estimators': 379, 'max_depth': 67, 'min_samples_split': 176, 'min_samples_leaf': 100, 'criterion': 'entropy'}.
Trial 457 finished with value: 0.5434782608695652 and parameters: {'n_estimators': 314, 'max_depth': 8, 'min_samples_split': 183, 'min_samples_leaf': 41, 'criterion': 'entropy'}.
Trial 458 finished with value: 0.532608695652174 and parameters: {'n_estimators': 339, 'max_depth': 56, 'min_samples_split': 188, 'min_samples_leaf': 90, 'criterion': 'entropy'}.
Trial 459 finished with value: 0.5434782608695652 and parameters: {'n_estimators': 289, 'max_depth': 15, 'min_samples_split': 191, 'min_samples_leaf': 98, 'criterion': 'gini'}.
Trial 460 finished with value: 0.5434782608695652 and parameters: {'n_estimators': 318, 'max_depth': 70, 'min_samples_split': 172, 'min_samples_leaf': 93, 'criterion': 'entropy'}.
Trial 461 finished with value: 0.5543478260869565 and parameters: {'n_estimators': 390, 'max_depth': 73, 'min_samples_split': 179, 'min_samples_leaf': 49, 'criterion': 'entropy'}.
Trial 462 finished with value: 0.5434782608695652 and parameters: {'n_estimators': 520, 'max_depth': 86, 'min_samples_split': 194, 'min_samples_leaf': 44, 'criterion': 'entropy'}.
Trial 463 finished with value: 0.532608695652174 and parameters: {'n_estimators': 563, 'max_depth': 78, 'min_samples_split': 183, 'min_samples_leaf': 81, 'criterion': 'entropy'}.
Trial 464 finished with value: 0.5543478260869565 and parameters: {'n_estimators': 361, 'max_depth': 82, 'min_samples_split': 174, 'min_samples_leaf': 95, 'criterion': 'entropy'}.
Trial 465 finished with value: 0.5 and parameters: {'n_estimators': 304, 'max_depth': 80, 'min_samples_split': 85, 'min_samples_leaf': 46, 'criterion': 'entropy'}.
Trial 466 finished with value: 0.5543478260869565 and parameters: {'n_estimators': 681, 'max_depth': 40, 'min_samples_split': 186, 'min_samples_leaf': 97, 'criterion': 'entropy'}.
Trial 467 finished with value: 0.5434782608695652 and parameters: {'n_estimators': 337, 'max_depth': 68, 'min_samples_split': 197, 'min_samples_leaf': 98, 'criterion': 'gini'}.
Trial 468 finished with value: 0.5543478260869565 and parameters: {'n_estimators': 326, 'max_depth': 24, 'min_samples_split': 169, 'min_samples_leaf': 94, 'criterion': 'entropy'}.
Trial 469 finished with value: 0.532608695652174 and parameters: {'n_estimators': 295, 'max_depth': 65, 'min_samples_split': 57, 'min_samples_leaf': 55, 'criterion': 'entropy'}.
Trial 470 finished with value: 0.5217391304347826 and parameters: {'n_estimators': 356, 'max_depth': 75, 'min_samples_split': 178, 'min_samples_leaf': 86, 'criterion': 'entropy'}.
Trial 471 finished with value: 0.5434782608695652 and parameters: {'n_estimators': 343, 'max_depth': 72, 'min_samples_split': 192, 'min_samples_leaf': 100, 'criterion': 'entropy'}.
Trial 472 finished with value: 0.5217391304347826 and parameters: {'n_estimators': 274, 'max_depth': 54, 'min_samples_split': 165, 'min_samples_leaf': 71, 'criterion': 'entropy'}.
Trial 473 finished with value: 0.5652173913043478 and parameters: {'n_estimators': 312, 'max_depth': 29, 'min_samples_split': 188, 'min_samples_leaf': 96, 'criterion': 'entropy'}.
Trial 474 finished with value: 0.5434782608695652 and parameters: {'n_estimators': 375, 'max_depth': 68, 'min_samples_split': 182, 'min_samples_leaf': 52, 'criterion': 'entropy'}.
Trial 475 finished with value: 0.5217391304347826 and parameters: {'n_estimators': 327, 'max_depth': 71, 'min_samples_split': 173, 'min_samples_leaf': 49, 'criterion': 'gini'}.
Trial 476 finished with value: 0.5434782608695652 and parameters: {'n_estimators': 301, 'max_depth': 84, 'min_samples_split': 197, 'min_samples_leaf': 92, 'criterion': 'entropy'}.
Trial 477 finished with value: 0.5543478260869565 and parameters: {'n_estimators': 349, 'max_depth': 77, 'min_samples_split': 177, 'min_samples_leaf': 98, 'criterion': 'entropy'}.
Trial 478 finished with value: 0.5434782608695652 and parameters: {'n_estimators': 415, 'max_depth': 66, 'min_samples_split': 191, 'min_samples_leaf': 65, 'criterion': 'entropy'}.
Trial 479 finished with value: 0.5217391304347826 and parameters: {'n_estimators': 326, 'max_depth': 5, 'min_samples_split': 200, 'min_samples_leaf': 96, 'criterion': 'entropy'}.
Trial 480 finished with value: 0.5543478260869565 and parameters: {'n_estimators': 875, 'max_depth': 74, 'min_samples_split': 185, 'min_samples_leaf': 94, 'criterion': 'entropy'}.
Trial 481 finished with value: 0.4891304347826087 and parameters: {'n_estimators': 288, 'max_depth': 63, 'min_samples_split': 166, 'min_samples_leaf': 35, 'criterion': 'entropy'}.
Trial 482 finished with value: 0.5543478260869565 and parameters: {'n_estimators': 312, 'max_depth': 49, 'min_samples_split': 181, 'min_samples_leaf': 46, 'criterion': 'entropy'}.
Trial 483 finished with value: 0.5434782608695652 and parameters: {'n_estimators': 395, 'max_depth': 69, 'min_samples_split': 170, 'min_samples_leaf': 50, 'criterion': 'gini'}.
Trial 484 finished with value: 0.5434782608695652 and parameters: {'n_estimators': 362, 'max_depth': 57, 'min_samples_split': 194, 'min_samples_leaf': 98, 'criterion': 'entropy'}.
Trial 485 finished with value: 0.5217391304347826 and parameters: {'n_estimators': 335, 'max_depth': 53, 'min_samples_split': 188, 'min_samples_leaf': 42, 'criterion': 'entropy'}.
Trial 486 finished with value: 0.532608695652174 and parameters: {'n_estimators': 428, 'max_depth': 72, 'min_samples_split': 175, 'min_samples_leaf': 53, 'criterion': 'entropy'}.
Trial 487 finished with value: 0.5434782608695652 and parameters: {'n_estimators': 346, 'max_depth': 80, 'min_samples_split': 180, 'min_samples_leaf': 100, 'criterion': 'entropy'}.
Trial 488 finished with value: 0.5543478260869565 and parameters: {'n_estimators': 315, 'max_depth': 67, 'min_samples_split': 185, 'min_samples_leaf': 95, 'criterion': 'entropy'}.
Trial 489 finished with value: 0.5434782608695652 and parameters: {'n_estimators': 296, 'max_depth': 70, 'min_samples_split': 192, 'min_samples_leaf': 91, 'criterion': 'entropy'}.
Trial 490 finished with value: 0.5434782608695652 and parameters: {'n_estimators': 374, 'max_depth': 64, 'min_samples_split': 172, 'min_samples_leaf': 93, 'criterion': 'entropy'}.
Trial 491 finished with value: 0.5543478260869565 and parameters: {'n_estimators': 329, 'max_depth': 75, 'min_samples_split': 195, 'min_samples_leaf': 48, 'criterion': 'gini'}.
Trial 492 finished with value: 0.5652173913043478 and parameters: {'n_estimators': 308, 'max_depth': 78, 'min_samples_split': 128, 'min_samples_leaf': 97, 'criterion': 'entropy'}.
Trial 493 finished with value: 0.5543478260869565 and parameters: {'n_estimators': 272, 'max_depth': 52, 'min_samples_split': 163, 'min_samples_leaf': 78, 'criterion': 'entropy'}.
Trial 494 finished with value: 0.532608695652174 and parameters: {'n_estimators': 350, 'max_depth': 69, 'min_samples_split': 178, 'min_samples_leaf': 57, 'criterion': 'entropy'}.
Trial 495 finished with value: 0.5217391304347826 and parameters: {'n_estimators': 324, 'max_depth': 72, 'min_samples_split': 189, 'min_samples_leaf': 44, 'criterion': 'entropy'}.
