Trial 9762 finished with value: 0.717391304347826 and parameters: {'n_estimators': 286, 'max_depth': 10, 'min_samples_split': 16, 'min_samples_leaf': 61, 'criterion': 'entropy'}.
Trial 9763 finished with value: 0.6630434782608695 and parameters: {'n_estimators': 306, 'max_depth': 14, 'min_samples_split': 78, 'min_samples_leaf': 51, 'criterion': 'gini'}.
Trial 9764 finished with value: 0.7065217391304348 and parameters: {'n_estimators': 746, 'max_depth': 8, 'min_samples_split': 27, 'min_samples_leaf': 58, 'criterion': 'entropy'}.
Trial 9765 finished with value: 0.6739130434782609 and parameters: {'n_estimators': 807, 'max_depth': 12, 'min_samples_split': 40, 'min_samples_leaf': 98, 'criterion': 'entropy'}.
Trial 9766 finished with value: 0.717391304347826 and parameters: {'n_estimators': 766, 'max_depth': 10, 'min_samples_split': 33, 'min_samples_leaf': 56, 'criterion': 'gini'}.
Trial 9767 finished with value: 0.6739130434782609 and parameters: {'n_estimators': 270, 'max_depth': 5, 'min_samples_split': 114, 'min_samples_leaf': 67, 'criterion': 'entropy'}.
Trial 9768 finished with value: 0.6847826086956522 and parameters: {'n_estimators': 250, 'max_depth': 16, 'min_samples_split': 30, 'min_samples_leaf': 70, 'criterion': 'gini'}.
Trial 9769 finished with value: 0.6739130434782609 and parameters: {'n_estimators': 330, 'max_depth': 7, 'min_samples_split': 131, 'min_samples_leaf': 64, 'criterion': 'entropy'}.
Trial 9770 finished with value: 0.6956521739130435 and parameters: {'n_estimators': 299, 'max_depth': 12, 'min_samples_split': 37, 'min_samples_leaf': 60, 'criterion': 'gini'}.
Trial 9771 finished with value: 0.7065217391304348 and parameters: {'n_estimators': 285, 'max_depth': 9, 'min_samples_split': 23, 'min_samples_leaf': 53, 'criterion': 'entropy'}.
Trial 9772 finished with value: 0.7065217391304348 and parameters: {'n_estimators': 233, 'max_depth': 11, 'min_samples_split': 34, 'min_samples_leaf': 55, 'criterion': 'entropy'}.
Trial 9773 finished with value: 0.7065217391304348 and parameters: {'n_estimators': 721, 'max_depth': 14, 'min_samples_split': 26, 'min_samples_leaf': 58, 'criterion': 'gini'}.
Trial 9774 finished with value: 0.6956521739130435 and parameters: {'n_estimators': 264, 'max_depth': 8, 'min_samples_split': 125, 'min_samples_leaf': 63, 'criterion': 'entropy'}.
Trial 9775 finished with value: 0.6956521739130435 and parameters: {'n_estimators': 313, 'max_depth': 10, 'min_samples_split': 138, 'min_samples_leaf': 57, 'criterion': 'gini'}.
Trial 9776 finished with value: 0.6956521739130435 and parameters: {'n_estimators': 277, 'max_depth': 15, 'min_samples_split': 41, 'min_samples_leaf': 60, 'criterion': 'entropy'}.
Trial 9777 finished with value: 0.6521739130434783 and parameters: {'n_estimators': 215, 'max_depth': 19, 'min_samples_split': 45, 'min_samples_leaf': 54, 'criterion': 'entropy'}.
Trial 9778 finished with value: 0.7065217391304348 and parameters: {'n_estimators': 749, 'max_depth': 12, 'min_samples_split': 30, 'min_samples_leaf': 62, 'criterion': 'gini'}.
Trial 9779 finished with value: 0.6630434782608695 and parameters: {'n_estimators': 251, 'max_depth': 6, 'min_samples_split': 195, 'min_samples_leaf': 72, 'criterion': 'entropy'}.
Trial 9780 finished with value: 0.6956521739130435 and parameters: {'n_estimators': 834, 'max_depth': 9, 'min_samples_split': 151, 'min_samples_leaf': 76, 'criterion': 'gini'}.
Trial 9781 finished with value: 0.7065217391304348 and parameters: {'n_estimators': 692, 'max_depth': 13, 'min_samples_split': 19, 'min_samples_leaf': 56, 'criterion': 'entropy'}.
Trial 9782 finished with value: 0.7282608695652174 and parameters: {'n_estimators': 294, 'max_depth': 11, 'min_samples_split': 38, 'min_samples_leaf': 59, 'criterion': 'entropy'}.
Trial 9783 finished with value: 0.6739130434782609 and parameters: {'n_estimators': 568, 'max_depth': 7, 'min_samples_split': 87, 'min_samples_leaf': 66, 'criterion': 'gini'}.
Trial 9784 finished with value: 0.6956521739130435 and parameters: {'n_estimators': 337, 'max_depth': 10, 'min_samples_split': 135, 'min_samples_leaf': 52, 'criterion': 'entropy'}.
Trial 9785 finished with value: 0.6739130434782609 and parameters: {'n_estimators': 276, 'max_depth': 16, 'min_samples_split': 33, 'min_samples_leaf': 58, 'criterion': 'gini'}.
Trial 9786 finished with value: 0.717391304347826 and parameters: {'n_estimators': 761, 'max_depth': 8, 'min_samples_split': 26, 'min_samples_leaf': 61, 'criterion': 'entropy'}.
Trial 9787 finished with value: 0.6956521739130435 and parameters: {'n_estimators': 370, 'max_depth': 13, 'min_samples_split': 141, 'min_samples_leaf': 69, 'criterion': 'entropy'}.
Trial 9788 finished with value: 0.6413043478260869 and parameters: {'n_estimators': 308, 'max_depth': 5, 'min_samples_split': 49, 'min_samples_leaf': 56, 'criterion': 'gini'}.
Trial 9789 finished with value: 0.6956521739130435 and parameters: {'n_estimators': 941, 'max_depth': 11, 'min_samples_split': 119, 'min_samples_leaf': 49, 'criterion': 'entropy'}.
Trial 9790 finished with value: 0.6956521739130435 and parameters: {'n_estimators': 780, 'max_depth': 9, 'min_samples_split': 23, 'min_samples_leaf': 54, 'criterion': 'gini'}.
Trial 9791 finished with value: 0.7282608695652174 and parameters: {'n_estimators': 258, 'max_depth': 14, 'min_samples_split': 146, 'min_samples_leaf': 64, 'criterion': 'entropy'}.
Trial 9792 finished with value: 0.6956521739130435 and parameters: {'n_estimators': 648, 'max_depth': 7, 'min_samples_split': 30, 'min_samples_leaf': 59, 'criterion': 'gini'}.
Trial 9793 finished with value: 0.6956521739130435 and parameters: {'n_estimators': 189, 'max_depth': 11, 'min_samples_split': 110, 'min_samples_leaf': 74, 'criterion': 'entropy'}.
Trial 9794 finished with value: 0.6956521739130435 and parameters: {'n_estimators': 735, 'max_depth': 9, 'min_samples_split': 35, 'min_samples_leaf': 62, 'criterion': 'entropy'}.
Trial 9795 finished with value: 0.6847826086956522 and parameters: {'n_estimators': 234, 'max_depth': 13, 'min_samples_split': 99, 'min_samples_leaf': 57, 'criterion': 'gini'}.
Trial 9796 finished with value: 0.6847826086956522 and parameters: {'n_estimators': 291, 'max_depth': 7, 'min_samples_split': 39, 'min_samples_leaf': 60, 'criterion': 'entropy'}.
Trial 9797 finished with value: 0.6847826086956522 and parameters: {'n_estimators': 319, 'max_depth': 17, 'min_samples_split': 128, 'min_samples_leaf': 55, 'criterion': 'gini'}.
Trial 9798 finished with value: 0.717391304347826 and parameters: {'n_estimators': 276, 'max_depth': 11, 'min_samples_split': 44, 'min_samples_leaf': 71, 'criterion': 'entropy'}.
Trial 9799 finished with value: 0.6847826086956522 and parameters: {'n_estimators': 347, 'max_depth': 15, 'min_samples_split': 29, 'min_samples_leaf': 57, 'criterion': 'entropy'}.
Trial 9800 finished with value: 0.6956521739130435 and parameters: {'n_estimators': 252, 'max_depth': 9, 'min_samples_split': 35, 'min_samples_leaf': 59, 'criterion': 'gini'}.
Trial 9801 finished with value: 0.6739130434782609 and parameters: {'n_estimators': 792, 'max_depth': 25, 'min_samples_split': 15, 'min_samples_leaf': 77, 'criterion': 'entropy'}.
Trial 9802 finished with value: 0.6956521739130435 and parameters: {'n_estimators': 297, 'max_depth': 13, 'min_samples_split': 23, 'min_samples_leaf': 62, 'criterion': 'gini'}.
Trial 9803 finished with value: 0.6630434782608695 and parameters: {'n_estimators': 274, 'max_depth': 43, 'min_samples_split': 31, 'min_samples_leaf': 53, 'criterion': 'entropy'}.
Trial 9804 finished with value: 0.717391304347826 and parameters: {'n_estimators': 815, 'max_depth': 11, 'min_samples_split': 41, 'min_samples_leaf': 58, 'criterion': 'entropy'}.
Trial 9805 finished with value: 0.6739130434782609 and parameters: {'n_estimators': 242, 'max_depth': 5, 'min_samples_split': 27, 'min_samples_leaf': 82, 'criterion': 'gini'}.
Trial 9806 finished with value: 0.6956521739130435 and parameters: {'n_estimators': 708, 'max_depth': 8, 'min_samples_split': 20, 'min_samples_leaf': 65, 'criterion': 'entropy'}.
Trial 9807 finished with value: 0.6739130434782609 and parameters: {'n_estimators': 769, 'max_depth': 61, 'min_samples_split': 122, 'min_samples_leaf': 68, 'criterion': 'gini'}.
Trial 9808 finished with value: 0.7065217391304348 and parameters: {'n_estimators': 321, 'max_depth': 12, 'min_samples_split': 34, 'min_samples_leaf': 51, 'criterion': 'entropy'}.
Trial 9809 finished with value: 0.7065217391304348 and parameters: {'n_estimators': 299, 'max_depth': 10, 'min_samples_split': 133, 'min_samples_leaf': 61, 'criterion': 'gini'}.
Trial 9810 finished with value: 0.6739130434782609 and parameters: {'n_estimators': 217, 'max_depth': 15, 'min_samples_split': 144, 'min_samples_leaf': 55, 'criterion': 'entropy'}.
Trial 9811 finished with value: 0.6630434782608695 and parameters: {'n_estimators': 263, 'max_depth': 7, 'min_samples_split': 39, 'min_samples_leaf': 57, 'criterion': 'entropy'}.
Trial 9812 finished with value: 0.7065217391304348 and parameters: {'n_estimators': 736, 'max_depth': 9, 'min_samples_split': 32, 'min_samples_leaf': 60, 'criterion': 'gini'}.
Trial 9813 finished with value: 0.7065217391304348 and parameters: {'n_estimators': 485, 'max_depth': 12, 'min_samples_split': 53, 'min_samples_leaf': 63, 'criterion': 'entropy'}.
Trial 9814 finished with value: 0.6956521739130435 and parameters: {'n_estimators': 290, 'max_depth': 10, 'min_samples_split': 37, 'min_samples_leaf': 74, 'criterion': 'gini'}.
Trial 9815 finished with value: 0.6847826086956522 and parameters: {'n_estimators': 586, 'max_depth': 14, 'min_samples_split': 136, 'min_samples_leaf': 56, 'criterion': 'entropy'}.
Trial 9816 finished with value: 0.6956521739130435 and parameters: {'n_estimators': 403, 'max_depth': 7, 'min_samples_split': 26, 'min_samples_leaf': 59, 'criterion': 'entropy'}.
Trial 9817 finished with value: 0.6630434782608695 and parameters: {'n_estimators': 268, 'max_depth': 98, 'min_samples_split': 9, 'min_samples_leaf': 53, 'criterion': 'gini'}.
Trial 9818 finished with value: 0.6847826086956522 and parameters: {'n_estimators': 330, 'max_depth': 18, 'min_samples_split': 148, 'min_samples_leaf': 72, 'criterion': 'entropy'}.
Trial 9819 finished with value: 0.7065217391304348 and parameters: {'n_estimators': 283, 'max_depth': 12, 'min_samples_split': 43, 'min_samples_leaf': 58, 'criterion': 'gini'}.
Trial 9820 finished with value: 0.717391304347826 and parameters: {'n_estimators': 669, 'max_depth': 9, 'min_samples_split': 20, 'min_samples_leaf': 55, 'criterion': 'entropy'}.
Trial 9821 finished with value: 0.6956521739130435 and parameters: {'n_estimators': 872, 'max_depth': 6, 'min_samples_split': 61, 'min_samples_leaf': 67, 'criterion': 'entropy'}.
Trial 9822 finished with value: 0.717391304347826 and parameters: {'n_estimators': 753, 'max_depth': 10, 'min_samples_split': 47, 'min_samples_leaf': 61, 'criterion': 'gini'}.
Trial 9823 finished with value: 0.6956521739130435 and parameters: {'n_estimators': 310, 'max_depth': 14, 'min_samples_split': 30, 'min_samples_leaf': 64, 'criterion': 'entropy'}.
Trial 9824 finished with value: 0.7065217391304348 and parameters: {'n_estimators': 250, 'max_depth': 8, 'min_samples_split': 141, 'min_samples_leaf': 79, 'criterion': 'gini'}.
Trial 9825 finished with value: 0.6630434782608695 and parameters: {'n_estimators': 966, 'max_depth': 20, 'min_samples_split': 36, 'min_samples_leaf': 70, 'criterion': 'entropy'}.
Trial 9826 finished with value: 0.6739130434782609 and parameters: {'n_estimators': 234, 'max_depth': 16, 'min_samples_split': 24, 'min_samples_leaf': 57, 'criterion': 'gini'}.
Trial 9827 finished with value: 0.6847826086956522 and parameters: {'n_estimators': 801, 'max_depth': 12, 'min_samples_split': 116, 'min_samples_leaf': 60, 'criterion': 'entropy'}.
Trial 9828 finished with value: 0.6956521739130435 and parameters: {'n_estimators': 281, 'max_depth': 10, 'min_samples_split': 130, 'min_samples_leaf': 47, 'criterion': 'entropy'}.
Trial 9829 finished with value: 0.6521739130434783 and parameters: {'n_estimators': 260, 'max_depth': 5, 'min_samples_split': 29, 'min_samples_leaf': 53, 'criterion': 'gini'}.
Trial 9830 finished with value: 0.6956521739130435 and parameters: {'n_estimators': 306, 'max_depth': 8, 'min_samples_split': 186, 'min_samples_leaf': 62, 'criterion': 'entropy'}.
Trial 9831 finished with value: 0.7065217391304348 and parameters: {'n_estimators': 354, 'max_depth': 12, 'min_samples_split': 34, 'min_samples_leaf': 58, 'criterion': 'gini'}.
Trial 9832 finished with value: 0.7065217391304348 and parameters: {'n_estimators': 781, 'max_depth': 14, 'min_samples_split': 40, 'min_samples_leaf': 50, 'criterion': 'entropy'}.
Trial 9833 finished with value: 0.6956521739130435 and parameters: {'n_estimators': 160, 'max_depth': 10, 'min_samples_split': 125, 'min_samples_leaf': 55, 'criterion': 'entropy'}.
Trial 9834 finished with value: 0.7065217391304348 and parameters: {'n_estimators': 293, 'max_depth': 8, 'min_samples_split': 27, 'min_samples_leaf': 59, 'criterion': 'gini'}.
Trial 9835 finished with value: 0.717391304347826 and parameters: {'n_estimators': 329, 'max_depth': 11, 'min_samples_split': 34, 'min_samples_leaf': 56, 'criterion': 'entropy'}.
Trial 9836 finished with value: 0.6847826086956522 and parameters: {'n_estimators': 269, 'max_depth': 13, 'min_samples_split': 16, 'min_samples_leaf': 63, 'criterion': 'gini'}.
Trial 9837 finished with value: 0.6630434782608695 and parameters: {'n_estimators': 204, 'max_depth': 6, 'min_samples_split': 38, 'min_samples_leaf': 73, 'criterion': 'entropy'}.
Trial 9838 finished with value: 0.6739130434782609 and parameters: {'n_estimators': 757, 'max_depth': 16, 'min_samples_split': 24, 'min_samples_leaf': 66, 'criterion': 'entropy'}.
Trial 9839 finished with value: 0.7065217391304348 and parameters: {'n_estimators': 726, 'max_depth': 10, 'min_samples_split': 139, 'min_samples_leaf': 60, 'criterion': 'gini'}.
Trial 9840 finished with value: 0.7282608695652174 and parameters: {'n_estimators': 251, 'max_depth': 8, 'min_samples_split': 44, 'min_samples_leaf': 57, 'criterion': 'entropy'}.
Trial 9841 finished with value: 0.717391304347826 and parameters: {'n_estimators': 285, 'max_depth': 12, 'min_samples_split': 29, 'min_samples_leaf': 54, 'criterion': 'gini'}.
Trial 9842 finished with value: 0.6956521739130435 and parameters: {'n_estimators': 310, 'max_depth': 14, 'min_samples_split': 32, 'min_samples_leaf': 75, 'criterion': 'entropy'}.
Trial 9843 finished with value: 0.6956521739130435 and parameters: {'n_estimators': 225, 'max_depth': 10, 'min_samples_split': 110, 'min_samples_leaf': 61, 'criterion': 'entropy'}.
Trial 9844 finished with value: 0.6847826086956522 and parameters: {'n_estimators': 266, 'max_depth': 7, 'min_samples_split': 20, 'min_samples_leaf': 58, 'criterion': 'gini'}.
Trial 9845 finished with value: 0.7065217391304348 and parameters: {'n_estimators': 823, 'max_depth': 12, 'min_samples_split': 41, 'min_samples_leaf': 56, 'criterion': 'entropy'}.
Trial 9846 finished with value: 0.7282608695652174 and parameters: {'n_estimators': 772, 'max_depth': 9, 'min_samples_split': 151, 'min_samples_leaf': 69, 'criterion': 'gini'}.
Trial 9847 finished with value: 0.6413043478260869 and parameters: {'n_estimators': 914, 'max_depth': 5, 'min_samples_split': 36, 'min_samples_leaf': 52, 'criterion': 'entropy'}.
Trial 9848 finished with value: 0.717391304347826 and parameters: {'n_estimators': 115, 'max_depth': 11, 'min_samples_split': 144, 'min_samples_leaf': 64, 'criterion': 'gini'}.
Trial 9849 finished with value: 0.6956521739130435 and parameters: {'n_estimators': 295, 'max_depth': 15, 'min_samples_split': 136, 'min_samples_leaf': 59, 'criterion': 'entropy'}.
Trial 9850 finished with value: 0.6847826086956522 and parameters: {'n_estimators': 741, 'max_depth': 17, 'min_samples_split': 103, 'min_samples_leaf': 62, 'criterion': 'entropy'}.
Trial 9851 finished with value: 0.6739130434782609 and parameters: {'n_estimators': 246, 'max_depth': 7, 'min_samples_split': 13, 'min_samples_leaf': 54, 'criterion': 'gini'}.
Trial 9852 finished with value: 0.7065217391304348 and parameters: {'n_estimators': 278, 'max_depth': 9, 'min_samples_split': 31, 'min_samples_leaf': 71, 'criterion': 'entropy'}.
Trial 9853 finished with value: 0.6847826086956522 and parameters: {'n_estimators': 510, 'max_depth': 13, 'min_samples_split': 26, 'min_samples_leaf': 60, 'criterion': 'gini'}.
Trial 9854 finished with value: 0.7282608695652174 and parameters: {'n_estimators': 320, 'max_depth': 11, 'min_samples_split': 47, 'min_samples_leaf': 57, 'criterion': 'entropy'}.
Trial 9855 finished with value: 0.717391304347826 and parameters: {'n_estimators': 301, 'max_depth': 8, 'min_samples_split': 38, 'min_samples_leaf': 77, 'criterion': 'entropy'}.
Trial 9856 finished with value: 0.6739130434782609 and parameters: {'n_estimators': 267, 'max_depth': 13, 'min_samples_split': 119, 'min_samples_leaf': 55, 'criterion': 'gini'}.
Trial 9857 finished with value: 0.7065217391304348 and parameters: {'n_estimators': 339, 'max_depth': 10, 'min_samples_split': 23, 'min_samples_leaf': 59, 'criterion': 'entropy'}.
Trial 9858 finished with value: 0.6847826086956522 and parameters: {'n_estimators': 281, 'max_depth': 6, 'min_samples_split': 32, 'min_samples_leaf': 61, 'criterion': 'gini'}.
Trial 9859 finished with value: 0.7065217391304348 and parameters: {'n_estimators': 440, 'max_depth': 15, 'min_samples_split': 128, 'min_samples_leaf': 65, 'criterion': 'entropy'}.
Trial 9860 finished with value: 0.7391304347826086 and parameters: {'n_estimators': 243, 'max_depth': 9, 'min_samples_split': 18, 'min_samples_leaf': 57, 'criterion': 'entropy'}.
Trial 9861 finished with value: 0.6630434782608695 and parameters: {'n_estimators': 722, 'max_depth': 12, 'min_samples_split': 162, 'min_samples_leaf': 9, 'criterion': 'gini'}.
Trial 9862 finished with value: 0.7065217391304348 and parameters: {'n_estimators': 760, 'max_depth': 11, 'min_samples_split': 28, 'min_samples_leaf': 51, 'criterion': 'entropy'}.
Trial 9863 finished with value: 0.6956521739130435 and parameters: {'n_estimators': 380, 'max_depth': 7, 'min_samples_split': 114, 'min_samples_leaf': 73, 'criterion': 'gini'}.
Trial 9864 finished with value: 0.6956521739130435 and parameters: {'n_estimators': 688, 'max_depth': 9, 'min_samples_split': 35, 'min_samples_leaf': 62, 'criterion': 'entropy'}.
Trial 9865 finished with value: 0.6847826086956522 and parameters: {'n_estimators': 793, 'max_depth': 14, 'min_samples_split': 123, 'min_samples_leaf': 68, 'criterion': 'gini'}.
Trial 9866 finished with value: 0.6630434782608695 and parameters: {'n_estimators': 311, 'max_depth': 78, 'min_samples_split': 42, 'min_samples_leaf': 54, 'criterion': 'entropy'}.
Trial 9867 finished with value: 0.6413043478260869 and parameters: {'n_estimators': 290, 'max_depth': 5, 'min_samples_split': 132, 'min_samples_leaf': 58, 'criterion': 'entropy'}.
Trial 9868 finished with value: 0.6739130434782609 and parameters: {'n_estimators': 260, 'max_depth': 18, 'min_samples_split': 142, 'min_samples_leaf': 56, 'criterion': 'gini'}.
Trial 9869 finished with value: 0.717391304347826 and parameters: {'n_estimators': 711, 'max_depth': 11, 'min_samples_split': 38, 'min_samples_leaf': 60, 'criterion': 'entropy'}.
Trial 9870 finished with value: 0.6739130434782609 and parameters: {'n_estimators': 234, 'max_depth': 13, 'min_samples_split': 31, 'min_samples_leaf': 64, 'criterion': 'gini'}.
Trial 9871 finished with value: 0.6847826086956522 and parameters: {'n_estimators': 179, 'max_depth': 7, 'min_samples_split': 155, 'min_samples_leaf': 58, 'criterion': 'entropy'}.
Trial 9872 finished with value: 0.6847826086956522 and parameters: {'n_estimators': 739, 'max_depth': 9, 'min_samples_split': 24, 'min_samples_leaf': 53, 'criterion': 'entropy'}.
Trial 9873 finished with value: 0.717391304347826 and parameters: {'n_estimators': 274, 'max_depth': 15, 'min_samples_split': 149, 'min_samples_leaf': 62, 'criterion': 'gini'}.
Trial 9874 finished with value: 0.6847826086956522 and parameters: {'n_estimators': 295, 'max_depth': 10, 'min_samples_split': 35, 'min_samples_leaf': 75, 'criterion': 'entropy'}.
Trial 9875 finished with value: 0.6739130434782609 and parameters: {'n_estimators': 330, 'max_depth': 12, 'min_samples_split': 137, 'min_samples_leaf': 91, 'criterion': 'gini'}.
Trial 9876 finished with value: 0.7282608695652174 and parameters: {'n_estimators': 777, 'max_depth': 8, 'min_samples_split': 66, 'min_samples_leaf': 56, 'criterion': 'entropy'}.
Trial 9877 finished with value: 0.7391304347826086 and parameters: {'n_estimators': 143, 'max_depth': 11, 'min_samples_split': 44, 'min_samples_leaf': 59, 'criterion': 'entropy'}.
Trial 9878 finished with value: 0.6739130434782609 and parameters: {'n_estimators': 257, 'max_depth': 16, 'min_samples_split': 5, 'min_samples_leaf': 70, 'criterion': 'gini'}.
Trial 9879 finished with value: 0.6847826086956522 and parameters: {'n_estimators': 316, 'max_depth': 13, 'min_samples_split': 26, 'min_samples_leaf': 55, 'criterion': 'entropy'}.
Trial 9880 finished with value: 0.6630434782608695 and parameters: {'n_estimators': 278, 'max_depth': 7, 'min_samples_split': 40, 'min_samples_leaf': 66, 'criterion': 'gini'}.
Trial 9881 finished with value: 0.7065217391304348 and parameters: {'n_estimators': 300, 'max_depth': 9, 'min_samples_split': 51, 'min_samples_leaf': 49, 'criterion': 'entropy'}.
Trial 9882 finished with value: 0.7065217391304348 and parameters: {'n_estimators': 220, 'max_depth': 11, 'min_samples_split': 32, 'min_samples_leaf': 60, 'criterion': 'gini'}.
Trial 9883 finished with value: 0.6304347826086957 and parameters: {'n_estimators': 362, 'max_depth': 5, 'min_samples_split': 22, 'min_samples_leaf': 52, 'criterion': 'entropy'}.
Trial 9884 finished with value: 0.6630434782608695 and parameters: {'n_estimators': 799, 'max_depth': 46, 'min_samples_split': 28, 'min_samples_leaf': 63, 'criterion': 'entropy'}.
