Trial 2632 finished with value: 0.6739130434782609 and parameters: {'n_estimators': 841, 'max_depth': 15, 'min_samples_split': 140, 'min_samples_leaf': 18, 'criterion': 'entropy'}.
Trial 2633 finished with value: 0.7065217391304348 and parameters: {'n_estimators': 786, 'max_depth': 10, 'min_samples_split': 27, 'min_samples_leaf': 64, 'criterion': 'entropy'}.
Trial 2634 finished with value: 0.6847826086956522 and parameters: {'n_estimators': 755, 'max_depth': 17, 'min_samples_split': 34, 'min_samples_leaf': 51, 'criterion': 'entropy'}.
Trial 2635 finished with value: 0.6847826086956522 and parameters: {'n_estimators': 807, 'max_depth': 9, 'min_samples_split': 22, 'min_samples_leaf': 58, 'criterion': 'entropy'}.
Trial 2636 finished with value: 0.7065217391304348 and parameters: {'n_estimators': 732, 'max_depth': 12, 'min_samples_split': 43, 'min_samples_leaf': 53, 'criterion': 'entropy'}.
Trial 2637 finished with value: 0.6739130434782609 and parameters: {'n_estimators': 822, 'max_depth': 81, 'min_samples_split': 32, 'min_samples_leaf': 50, 'criterion': 'entropy'}.
Trial 2638 finished with value: 0.6630434782608695 and parameters: {'n_estimators': 431, 'max_depth': 62, 'min_samples_split': 25, 'min_samples_leaf': 42, 'criterion': 'entropy'}.
Trial 2639 finished with value: 0.7065217391304348 and parameters: {'n_estimators': 782, 'max_depth': 14, 'min_samples_split': 29, 'min_samples_leaf': 60, 'criterion': 'entropy'}.
Trial 2640 finished with value: 0.6847826086956522 and parameters: {'n_estimators': 769, 'max_depth': 23, 'min_samples_split': 37, 'min_samples_leaf': 67, 'criterion': 'entropy'}.
Trial 2641 finished with value: 0.6521739130434783 and parameters: {'n_estimators': 838, 'max_depth': 10, 'min_samples_split': 41, 'min_samples_leaf': 25, 'criterion': 'entropy'}.
Trial 2642 finished with value: 0.7065217391304348 and parameters: {'n_estimators': 859, 'max_depth': 12, 'min_samples_split': 34, 'min_samples_leaf': 46, 'criterion': 'entropy'}.
Trial 2643 finished with value: 0.6630434782608695 and parameters: {'n_estimators': 745, 'max_depth': 19, 'min_samples_split': 30, 'min_samples_leaf': 55, 'criterion': 'entropy'}.
Trial 2644 finished with value: 0.6956521739130435 and parameters: {'n_estimators': 805, 'max_depth': 9, 'min_samples_split': 23, 'min_samples_leaf': 57, 'criterion': 'entropy'}.
Trial 2645 finished with value: 0.6739130434782609 and parameters: {'n_estimators': 778, 'max_depth': 75, 'min_samples_split': 27, 'min_samples_leaf': 52, 'criterion': 'gini'}.
Trial 2646 finished with value: 0.717391304347826 and parameters: {'n_estimators': 824, 'max_depth': 14, 'min_samples_split': 69, 'min_samples_leaf': 49, 'criterion': 'entropy'}.
Trial 2647 finished with value: 0.717391304347826 and parameters: {'n_estimators': 717, 'max_depth': 11, 'min_samples_split': 38, 'min_samples_leaf': 54, 'criterion': 'entropy'}.
Trial 2648 finished with value: 0.6739130434782609 and parameters: {'n_estimators': 761, 'max_depth': 16, 'min_samples_split': 32, 'min_samples_leaf': 58, 'criterion': 'entropy'}.
Trial 2649 finished with value: 0.6956521739130435 and parameters: {'n_estimators': 874, 'max_depth': 9, 'min_samples_split': 35, 'min_samples_leaf': 62, 'criterion': 'entropy'}.
Trial 2650 finished with value: 0.6956521739130435 and parameters: {'n_estimators': 793, 'max_depth': 12, 'min_samples_split': 170, 'min_samples_leaf': 48, 'criterion': 'entropy'}.
Trial 2651 finished with value: 0.717391304347826 and parameters: {'n_estimators': 813, 'max_depth': 13, 'min_samples_split': 25, 'min_samples_leaf': 51, 'criterion': 'entropy'}.
Trial 2652 finished with value: 0.7282608695652174 and parameters: {'n_estimators': 679, 'max_depth': 10, 'min_samples_split': 30, 'min_samples_leaf': 56, 'criterion': 'entropy'}.
Trial 2653 finished with value: 0.6956521739130435 and parameters: {'n_estimators': 737, 'max_depth': 14, 'min_samples_split': 21, 'min_samples_leaf': 53, 'criterion': 'entropy'}.
Trial 2654 finished with value: 0.717391304347826 and parameters: {'n_estimators': 843, 'max_depth': 11, 'min_samples_split': 60, 'min_samples_leaf': 60, 'criterion': 'entropy'}.
Trial 2655 finished with value: 0.7065217391304348 and parameters: {'n_estimators': 791, 'max_depth': 9, 'min_samples_split': 41, 'min_samples_leaf': 46, 'criterion': 'entropy'}.
Trial 2656 finished with value: 0.7065217391304348 and parameters: {'n_estimators': 754, 'max_depth': 12, 'min_samples_split': 36, 'min_samples_leaf': 50, 'criterion': 'entropy'}.
Trial 2657 finished with value: 0.6847826086956522 and parameters: {'n_estimators': 814, 'max_depth': 9, 'min_samples_split': 26, 'min_samples_leaf': 39, 'criterion': 'entropy'}.
Trial 2658 finished with value: 0.6630434782608695 and parameters: {'n_estimators': 984, 'max_depth': 68, 'min_samples_split': 31, 'min_samples_leaf': 54, 'criterion': 'entropy'}.
Trial 2659 finished with value: 0.6739130434782609 and parameters: {'n_estimators': 769, 'max_depth': 16, 'min_samples_split': 47, 'min_samples_leaf': 58, 'criterion': 'entropy'}.
Trial 2660 finished with value: 0.7065217391304348 and parameters: {'n_estimators': 834, 'max_depth': 14, 'min_samples_split': 20, 'min_samples_leaf': 52, 'criterion': 'entropy'}.
Trial 2661 finished with value: 0.6956521739130435 and parameters: {'n_estimators': 801, 'max_depth': 11, 'min_samples_split': 39, 'min_samples_leaf': 48, 'criterion': 'entropy'}.
Trial 2662 finished with value: 0.7391304347826086 and parameters: {'n_estimators': 287, 'max_depth': 9, 'min_samples_split': 34, 'min_samples_leaf': 57, 'criterion': 'entropy'}.
Trial 2663 finished with value: 0.7065217391304348 and parameters: {'n_estimators': 215, 'max_depth': 8, 'min_samples_split': 9, 'min_samples_leaf': 59, 'criterion': 'entropy'}.
Trial 2664 finished with value: 0.7282608695652174 and parameters: {'n_estimators': 261, 'max_depth': 8, 'min_samples_split': 28, 'min_samples_leaf': 60, 'criterion': 'entropy'}.
Trial 2665 finished with value: 0.6956521739130435 and parameters: {'n_estimators': 173, 'max_depth': 8, 'min_samples_split': 34, 'min_samples_leaf': 58, 'criterion': 'gini'}.
Trial 2666 finished with value: 0.6956521739130435 and parameters: {'n_estimators': 308, 'max_depth': 8, 'min_samples_split': 23, 'min_samples_leaf': 62, 'criterion': 'entropy'}.
Trial 2667 finished with value: 0.717391304347826 and parameters: {'n_estimators': 147, 'max_depth': 8, 'min_samples_split': 44, 'min_samples_leaf': 57, 'criterion': 'entropy'}.
Trial 2668 finished with value: 0.6739130434782609 and parameters: {'n_estimators': 352, 'max_depth': 35, 'min_samples_split': 32, 'min_samples_leaf': 60, 'criterion': 'entropy'}.
Trial 2669 finished with value: 0.7065217391304348 and parameters: {'n_estimators': 970, 'max_depth': 8, 'min_samples_split': 152, 'min_samples_leaf': 57, 'criterion': 'entropy'}.
Trial 2670 finished with value: 0.7065217391304348 and parameters: {'n_estimators': 661, 'max_depth': 7, 'min_samples_split': 27, 'min_samples_leaf': 59, 'criterion': 'entropy'}.
Trial 2671 finished with value: 0.717391304347826 and parameters: {'n_estimators': 141, 'max_depth': 9, 'min_samples_split': 37, 'min_samples_leaf': 56, 'criterion': 'entropy'}.
Trial 2672 finished with value: 0.7065217391304348 and parameters: {'n_estimators': 363, 'max_depth': 9, 'min_samples_split': 31, 'min_samples_leaf': 58, 'criterion': 'entropy'}.
Trial 2673 finished with value: 0.6847826086956522 and parameters: {'n_estimators': 222, 'max_depth': 7, 'min_samples_split': 18, 'min_samples_leaf': 61, 'criterion': 'entropy'}.
Trial 2674 finished with value: 0.717391304347826 and parameters: {'n_estimators': 124, 'max_depth': 10, 'min_samples_split': 24, 'min_samples_leaf': 63, 'criterion': 'entropy'}.
Trial 2675 finished with value: 0.717391304347826 and parameters: {'n_estimators': 186, 'max_depth': 10, 'min_samples_split': 35, 'min_samples_leaf': 58, 'criterion': 'entropy'}.
Trial 2676 finished with value: 0.6630434782608695 and parameters: {'n_estimators': 267, 'max_depth': 7, 'min_samples_split': 40, 'min_samples_leaf': 56, 'criterion': 'entropy'}.
Trial 2677 finished with value: 0.717391304347826 and parameters: {'n_estimators': 698, 'max_depth': 9, 'min_samples_split': 28, 'min_samples_leaf': 56, 'criterion': 'entropy'}.
Trial 2678 finished with value: 0.717391304347826 and parameters: {'n_estimators': 414, 'max_depth': 10, 'min_samples_split': 126, 'min_samples_leaf': 60, 'criterion': 'entropy'}.
Trial 2679 finished with value: 0.6847826086956522 and parameters: {'n_estimators': 289, 'max_depth': 7, 'min_samples_split': 22, 'min_samples_leaf': 57, 'criterion': 'entropy'}.
Trial 2680 finished with value: 0.717391304347826 and parameters: {'n_estimators': 320, 'max_depth': 9, 'min_samples_split': 15, 'min_samples_leaf': 55, 'criterion': 'entropy'}.
Trial 2681 finished with value: 0.6847826086956522 and parameters: {'n_estimators': 249, 'max_depth': 59, 'min_samples_split': 32, 'min_samples_leaf': 59, 'criterion': 'entropy'}.
Trial 2682 finished with value: 0.6630434782608695 and parameters: {'n_estimators': 238, 'max_depth': 56, 'min_samples_split': 37, 'min_samples_leaf': 64, 'criterion': 'entropy'}.
Trial 2683 finished with value: 0.7391304347826086 and parameters: {'n_estimators': 120, 'max_depth': 11, 'min_samples_split': 27, 'min_samples_leaf': 56, 'criterion': 'entropy'}.
Trial 2684 finished with value: 0.6739130434782609 and parameters: {'n_estimators': 448, 'max_depth': 43, 'min_samples_split': 21, 'min_samples_leaf': 59, 'criterion': 'gini'}.
Trial 2685 finished with value: 0.717391304347826 and parameters: {'n_estimators': 458, 'max_depth': 11, 'min_samples_split': 21, 'min_samples_leaf': 58, 'criterion': 'entropy'}.
Trial 2686 finished with value: 0.7065217391304348 and parameters: {'n_estimators': 231, 'max_depth': 11, 'min_samples_split': 17, 'min_samples_leaf': 62, 'criterion': 'entropy'}.
Trial 2687 finished with value: 0.7282608695652174 and parameters: {'n_estimators': 196, 'max_depth': 11, 'min_samples_split': 24, 'min_samples_leaf': 60, 'criterion': 'entropy'}.
Trial 2688 finished with value: 0.7282608695652174 and parameters: {'n_estimators': 271, 'max_depth': 11, 'min_samples_split': 25, 'min_samples_leaf': 56, 'criterion': 'entropy'}.
Trial 2689 finished with value: 0.717391304347826 and parameters: {'n_estimators': 205, 'max_depth': 12, 'min_samples_split': 20, 'min_samples_leaf': 58, 'criterion': 'entropy'}.
Trial 2690 finished with value: 0.7065217391304348 and parameters: {'n_estimators': 254, 'max_depth': 9, 'min_samples_split': 26, 'min_samples_leaf': 61, 'criterion': 'entropy'}.
Trial 2691 finished with value: 0.717391304347826 and parameters: {'n_estimators': 371, 'max_depth': 12, 'min_samples_split': 13, 'min_samples_leaf': 57, 'criterion': 'entropy'}.
Trial 2692 finished with value: 0.7282608695652174 and parameters: {'n_estimators': 138, 'max_depth': 10, 'min_samples_split': 18, 'min_samples_leaf': 58, 'criterion': 'entropy'}.
Trial 2693 finished with value: 0.6413043478260869 and parameters: {'n_estimators': 119, 'max_depth': 7, 'min_samples_split': 25, 'min_samples_leaf': 56, 'criterion': 'entropy'}.
Trial 2694 finished with value: 0.6630434782608695 and parameters: {'n_estimators': 166, 'max_depth': 13, 'min_samples_split': 22, 'min_samples_leaf': 60, 'criterion': 'entropy'}.
Trial 2695 finished with value: 0.7065217391304348 and parameters: {'n_estimators': 235, 'max_depth': 9, 'min_samples_split': 27, 'min_samples_leaf': 62, 'criterion': 'entropy'}.
Trial 2696 finished with value: 0.6956521739130435 and parameters: {'n_estimators': 104, 'max_depth': 11, 'min_samples_split': 20, 'min_samples_leaf': 57, 'criterion': 'entropy'}.
Trial 2697 finished with value: 0.717391304347826 and parameters: {'n_estimators': 250, 'max_depth': 13, 'min_samples_split': 24, 'min_samples_leaf': 59, 'criterion': 'entropy'}.
Trial 2698 finished with value: 0.7282608695652174 and parameters: {'n_estimators': 288, 'max_depth': 8, 'min_samples_split': 28, 'min_samples_leaf': 56, 'criterion': 'entropy'}.
Trial 2699 finished with value: 0.7065217391304348 and parameters: {'n_estimators': 100, 'max_depth': 10, 'min_samples_split': 23, 'min_samples_leaf': 60, 'criterion': 'entropy'}.
Trial 2700 finished with value: 0.717391304347826 and parameters: {'n_estimators': 340, 'max_depth': 12, 'min_samples_split': 15, 'min_samples_leaf': 56, 'criterion': 'entropy'}.
Trial 2701 finished with value: 0.6739130434782609 and parameters: {'n_estimators': 135, 'max_depth': 100, 'min_samples_split': 27, 'min_samples_leaf': 58, 'criterion': 'entropy'}.
Trial 2702 finished with value: 0.6956521739130435 and parameters: {'n_estimators': 405, 'max_depth': 9, 'min_samples_split': 6, 'min_samples_leaf': 62, 'criterion': 'entropy'}.
Trial 2703 finished with value: 0.6630434782608695 and parameters: {'n_estimators': 193, 'max_depth': 7, 'min_samples_split': 28, 'min_samples_leaf': 55, 'criterion': 'gini'}.
Trial 2704 finished with value: 0.7282608695652174 and parameters: {'n_estimators': 182, 'max_depth': 11, 'min_samples_split': 19, 'min_samples_leaf': 59, 'criterion': 'entropy'}.
Trial 2705 finished with value: 0.6956521739130435 and parameters: {'n_estimators': 154, 'max_depth': 13, 'min_samples_split': 24, 'min_samples_leaf': 57, 'criterion': 'entropy'}.
Trial 2706 finished with value: 0.7065217391304348 and parameters: {'n_estimators': 105, 'max_depth': 10, 'min_samples_split': 28, 'min_samples_leaf': 55, 'criterion': 'entropy'}.
Trial 2707 finished with value: 0.6956521739130435 and parameters: {'n_estimators': 332, 'max_depth': 14, 'min_samples_split': 19, 'min_samples_leaf': 58, 'criterion': 'entropy'}.
Trial 2708 finished with value: 0.7065217391304348 and parameters: {'n_estimators': 142, 'max_depth': 8, 'min_samples_split': 11, 'min_samples_leaf': 60, 'criterion': 'entropy'}.
Trial 2709 finished with value: 0.6847826086956522 and parameters: {'n_estimators': 378, 'max_depth': 12, 'min_samples_split': 29, 'min_samples_leaf': 64, 'criterion': 'entropy'}.
Trial 2710 finished with value: 0.6630434782608695 and parameters: {'n_estimators': 411, 'max_depth': 6, 'min_samples_split': 25, 'min_samples_leaf': 55, 'criterion': 'entropy'}.
Trial 2711 finished with value: 0.6956521739130435 and parameters: {'n_estimators': 324, 'max_depth': 10, 'min_samples_split': 23, 'min_samples_leaf': 57, 'criterion': 'entropy'}.
Trial 2712 finished with value: 0.6739130434782609 and parameters: {'n_estimators': 353, 'max_depth': 15, 'min_samples_split': 30, 'min_samples_leaf': 61, 'criterion': 'entropy'}.
Trial 2713 finished with value: 0.6847826086956522 and parameters: {'n_estimators': 102, 'max_depth': 12, 'min_samples_split': 174, 'min_samples_leaf': 57, 'criterion': 'entropy'}.
Trial 2714 finished with value: 0.6739130434782609 and parameters: {'n_estimators': 158, 'max_depth': 8, 'min_samples_split': 15, 'min_samples_leaf': 66, 'criterion': 'entropy'}.
Trial 2715 finished with value: 0.717391304347826 and parameters: {'n_estimators': 429, 'max_depth': 10, 'min_samples_split': 31, 'min_samples_leaf': 55, 'criterion': 'entropy'}.
Trial 2716 finished with value: 0.6956521739130435 and parameters: {'n_estimators': 328, 'max_depth': 13, 'min_samples_split': 21, 'min_samples_leaf': 55, 'criterion': 'entropy'}.
Trial 2717 finished with value: 0.717391304347826 and parameters: {'n_estimators': 169, 'max_depth': 9, 'min_samples_split': 27, 'min_samples_leaf': 60, 'criterion': 'entropy'}.
Trial 2718 finished with value: 0.6630434782608695 and parameters: {'n_estimators': 694, 'max_depth': 6, 'min_samples_split': 30, 'min_samples_leaf': 58, 'criterion': 'entropy'}.
Trial 2719 finished with value: 0.7065217391304348 and parameters: {'n_estimators': 272, 'max_depth': 11, 'min_samples_split': 24, 'min_samples_leaf': 55, 'criterion': 'entropy'}.
Trial 2720 finished with value: 0.7065217391304348 and parameters: {'n_estimators': 162, 'max_depth': 14, 'min_samples_split': 19, 'min_samples_leaf': 58, 'criterion': 'entropy'}.
Trial 2721 finished with value: 0.6630434782608695 and parameters: {'n_estimators': 126, 'max_depth': 88, 'min_samples_split': 31, 'min_samples_leaf': 63, 'criterion': 'entropy'}.
Trial 2722 finished with value: 0.7065217391304348 and parameters: {'n_estimators': 124, 'max_depth': 8, 'min_samples_split': 84, 'min_samples_leaf': 56, 'criterion': 'gini'}.
Trial 2723 finished with value: 0.6956521739130435 and parameters: {'n_estimators': 913, 'max_depth': 12, 'min_samples_split': 25, 'min_samples_leaf': 54, 'criterion': 'entropy'}.
Trial 2724 finished with value: 0.6739130434782609 and parameters: {'n_estimators': 205, 'max_depth': 15, 'min_samples_split': 28, 'min_samples_leaf': 61, 'criterion': 'entropy'}.
Trial 2725 finished with value: 0.7065217391304348 and parameters: {'n_estimators': 370, 'max_depth': 10, 'min_samples_split': 17, 'min_samples_leaf': 59, 'criterion': 'entropy'}.
Trial 2726 finished with value: 0.6630434782608695 and parameters: {'n_estimators': 320, 'max_depth': 7, 'min_samples_split': 33, 'min_samples_leaf': 54, 'criterion': 'entropy'}.
Trial 2727 finished with value: 0.6956521739130435 and parameters: {'n_estimators': 380, 'max_depth': 13, 'min_samples_split': 21, 'min_samples_leaf': 57, 'criterion': 'entropy'}.
Trial 2728 finished with value: 0.7065217391304348 and parameters: {'n_estimators': 289, 'max_depth': 11, 'min_samples_split': 30, 'min_samples_leaf': 55, 'criterion': 'entropy'}.
Trial 2729 finished with value: 0.717391304347826 and parameters: {'n_estimators': 217, 'max_depth': 9, 'min_samples_split': 23, 'min_samples_leaf': 60, 'criterion': 'entropy'}.
Trial 2730 finished with value: 0.6739130434782609 and parameters: {'n_estimators': 244, 'max_depth': 13, 'min_samples_split': 27, 'min_samples_leaf': 96, 'criterion': 'entropy'}.
Trial 2731 finished with value: 0.6739130434782609 and parameters: {'n_estimators': 397, 'max_depth': 16, 'min_samples_split': 33, 'min_samples_leaf': 57, 'criterion': 'entropy'}.
Trial 2732 finished with value: 0.717391304347826 and parameters: {'n_estimators': 175, 'max_depth': 11, 'min_samples_split': 11, 'min_samples_leaf': 54, 'criterion': 'entropy'}.
Trial 2733 finished with value: 0.6521739130434783 and parameters: {'n_estimators': 388, 'max_depth': 5, 'min_samples_split': 26, 'min_samples_leaf': 62, 'criterion': 'entropy'}.
Trial 2734 finished with value: 0.7065217391304348 and parameters: {'n_estimators': 648, 'max_depth': 8, 'min_samples_split': 31, 'min_samples_leaf': 59, 'criterion': 'entropy'}.
Trial 2735 finished with value: 0.6847826086956522 and parameters: {'n_estimators': 436, 'max_depth': 14, 'min_samples_split': 15, 'min_samples_leaf': 56, 'criterion': 'entropy'}.
Trial 2736 finished with value: 0.7391304347826086 and parameters: {'n_estimators': 317, 'max_depth': 10, 'min_samples_split': 21, 'min_samples_leaf': 58, 'criterion': 'entropy'}.
Trial 2737 finished with value: 0.717391304347826 and parameters: {'n_estimators': 344, 'max_depth': 10, 'min_samples_split': 16, 'min_samples_leaf': 63, 'criterion': 'entropy'}.
Trial 2738 finished with value: 0.6847826086956522 and parameters: {'n_estimators': 223, 'max_depth': 12, 'min_samples_split': 12, 'min_samples_leaf': 65, 'criterion': 'entropy'}.
Trial 2739 finished with value: 0.6847826086956522 and parameters: {'n_estimators': 290, 'max_depth': 7, 'min_samples_split': 20, 'min_samples_leaf': 61, 'criterion': 'entropy'}.
Trial 2740 finished with value: 0.6739130434782609 and parameters: {'n_estimators': 144, 'max_depth': 18, 'min_samples_split': 14, 'min_samples_leaf': 61, 'criterion': 'entropy'}.
Trial 2741 finished with value: 0.7065217391304348 and parameters: {'n_estimators': 223, 'max_depth': 9, 'min_samples_split': 9, 'min_samples_leaf': 59, 'criterion': 'entropy'}.
Trial 2742 finished with value: 0.6847826086956522 and parameters: {'n_estimators': 176, 'max_depth': 11, 'min_samples_split': 16, 'min_samples_leaf': 63, 'criterion': 'gini'}.
Trial 2743 finished with value: 0.717391304347826 and parameters: {'n_estimators': 323, 'max_depth': 14, 'min_samples_split': 5, 'min_samples_leaf': 60, 'criterion': 'entropy'}.
Trial 2744 finished with value: 0.7065217391304348 and parameters: {'n_estimators': 232, 'max_depth': 9, 'min_samples_split': 19, 'min_samples_leaf': 59, 'criterion': 'entropy'}.
Trial 2745 finished with value: 0.6521739130434783 and parameters: {'n_estimators': 210, 'max_depth': 16, 'min_samples_split': 17, 'min_samples_leaf': 59, 'criterion': 'entropy'}.
Trial 2746 finished with value: 0.717391304347826 and parameters: {'n_estimators': 289, 'max_depth': 12, 'min_samples_split': 18, 'min_samples_leaf': 58, 'criterion': 'entropy'}.
Trial 2747 finished with value: 0.6956521739130435 and parameters: {'n_estimators': 254, 'max_depth': 7, 'min_samples_split': 11, 'min_samples_leaf': 63, 'criterion': 'entropy'}.
Trial 2748 finished with value: 0.717391304347826 and parameters: {'n_estimators': 298, 'max_depth': 10, 'min_samples_split': 14, 'min_samples_leaf': 61, 'criterion': 'entropy'}.
Trial 2749 finished with value: 0.7065217391304348 and parameters: {'n_estimators': 163, 'max_depth': 13, 'min_samples_split': 17, 'min_samples_leaf': 58, 'criterion': 'entropy'}.
Trial 2750 finished with value: 0.7065217391304348 and parameters: {'n_estimators': 143, 'max_depth': 15, 'min_samples_split': 20, 'min_samples_leaf': 60, 'criterion': 'entropy'}.
Trial 2751 finished with value: 0.6630434782608695 and parameters: {'n_estimators': 260, 'max_depth': 6, 'min_samples_split': 22, 'min_samples_leaf': 61, 'criterion': 'entropy'}.
Trial 2752 finished with value: 0.6956521739130435 and parameters: {'n_estimators': 200, 'max_depth': 49, 'min_samples_split': 20, 'min_samples_leaf': 58, 'criterion': 'entropy'}.
Trial 2753 finished with value: 0.7282608695652174 and parameters: {'n_estimators': 183, 'max_depth': 12, 'min_samples_split': 21, 'min_samples_leaf': 57, 'criterion': 'entropy'}.
