Trial 8290 finished with value: 0.6739130434782609 and parameters: {'n_estimators': 286, 'max_depth': 5, 'min_samples_split': 111, 'min_samples_leaf': 71, 'criterion': 'gini'}.
Trial 8291 finished with value: 0.6847826086956522 and parameters: {'n_estimators': 260, 'max_depth': 12, 'min_samples_split': 153, 'min_samples_leaf': 59, 'criterion': 'entropy'}.
Trial 8292 finished with value: 0.6956521739130435 and parameters: {'n_estimators': 776, 'max_depth': 15, 'min_samples_split': 39, 'min_samples_leaf': 52, 'criterion': 'entropy'}.
Trial 8293 finished with value: 0.6956521739130435 and parameters: {'n_estimators': 364, 'max_depth': 8, 'min_samples_split': 50, 'min_samples_leaf': 62, 'criterion': 'gini'}.
Trial 8294 finished with value: 0.7282608695652174 and parameters: {'n_estimators': 312, 'max_depth': 10, 'min_samples_split': 131, 'min_samples_leaf': 57, 'criterion': 'entropy'}.
Trial 8295 finished with value: 0.717391304347826 and parameters: {'n_estimators': 848, 'max_depth': 13, 'min_samples_split': 29, 'min_samples_leaf': 54, 'criterion': 'gini'}.
Trial 8296 finished with value: 0.6847826086956522 and parameters: {'n_estimators': 208, 'max_depth': 7, 'min_samples_split': 123, 'min_samples_leaf': 64, 'criterion': 'entropy'}.
Trial 8297 finished with value: 0.7065217391304348 and parameters: {'n_estimators': 587, 'max_depth': 11, 'min_samples_split': 35, 'min_samples_leaf': 55, 'criterion': 'gini'}.
Trial 8298 finished with value: 0.7065217391304348 and parameters: {'n_estimators': 241, 'max_depth': 9, 'min_samples_split': 137, 'min_samples_leaf': 59, 'criterion': 'entropy'}.
Trial 8299 finished with value: 0.6739130434782609 and parameters: {'n_estimators': 336, 'max_depth': 16, 'min_samples_split': 42, 'min_samples_leaf': 61, 'criterion': 'gini'}.
Trial 8300 finished with value: 0.6630434782608695 and parameters: {'n_estimators': 293, 'max_depth': 14, 'min_samples_split': 21, 'min_samples_leaf': 73, 'criterion': 'entropy'}.
Trial 8301 finished with value: 0.6847826086956522 and parameters: {'n_estimators': 161, 'max_depth': 7, 'min_samples_split': 119, 'min_samples_leaf': 67, 'criterion': 'gini'}.
Trial 8302 finished with value: 0.7065217391304348 and parameters: {'n_estimators': 823, 'max_depth': 11, 'min_samples_split': 146, 'min_samples_leaf': 56, 'criterion': 'entropy'}.
Trial 8303 finished with value: 0.717391304347826 and parameters: {'n_estimators': 272, 'max_depth': 9, 'min_samples_split': 26, 'min_samples_leaf': 59, 'criterion': 'entropy'}.
Trial 8304 finished with value: 0.6956521739130435 and parameters: {'n_estimators': 279, 'max_depth': 12, 'min_samples_split': 12, 'min_samples_leaf': 70, 'criterion': 'gini'}.
Trial 8305 finished with value: 0.6956521739130435 and parameters: {'n_estimators': 716, 'max_depth': 9, 'min_samples_split': 159, 'min_samples_leaf': 61, 'criterion': 'entropy'}.
Trial 8306 finished with value: 0.6956521739130435 and parameters: {'n_estimators': 870, 'max_depth': 6, 'min_samples_split': 35, 'min_samples_leaf': 77, 'criterion': 'gini'}.
Trial 8307 finished with value: 0.6739130434782609 and parameters: {'n_estimators': 747, 'max_depth': 21, 'min_samples_split': 46, 'min_samples_leaf': 80, 'criterion': 'entropy'}.
Trial 8308 finished with value: 0.6739130434782609 and parameters: {'n_estimators': 135, 'max_depth': 15, 'min_samples_split': 29, 'min_samples_leaf': 51, 'criterion': 'gini'}.
Trial 8309 finished with value: 0.6521739130434783 and parameters: {'n_estimators': 308, 'max_depth': 17, 'min_samples_split': 40, 'min_samples_leaf': 49, 'criterion': 'entropy'}.
Trial 8310 finished with value: 0.6956521739130435 and parameters: {'n_estimators': 249, 'max_depth': 13, 'min_samples_split': 139, 'min_samples_leaf': 57, 'criterion': 'gini'}.
Trial 8311 finished with value: 0.7065217391304348 and parameters: {'n_estimators': 264, 'max_depth': 11, 'min_samples_split': 32, 'min_samples_leaf': 64, 'criterion': 'entropy'}.
Trial 8312 finished with value: 0.6413043478260869 and parameters: {'n_estimators': 294, 'max_depth': 5, 'min_samples_split': 22, 'min_samples_leaf': 53, 'criterion': 'entropy'}.
Trial 8313 finished with value: 0.717391304347826 and parameters: {'n_estimators': 807, 'max_depth': 8, 'min_samples_split': 63, 'min_samples_leaf': 58, 'criterion': 'gini'}.
Trial 8314 finished with value: 0.7065217391304348 and parameters: {'n_estimators': 236, 'max_depth': 11, 'min_samples_split': 37, 'min_samples_leaf': 55, 'criterion': 'entropy'}.
Trial 8315 finished with value: 0.6956521739130435 and parameters: {'n_estimators': 775, 'max_depth': 9, 'min_samples_split': 143, 'min_samples_leaf': 62, 'criterion': 'gini'}.
Trial 8316 finished with value: 0.7065217391304348 and parameters: {'n_estimators': 324, 'max_depth': 13, 'min_samples_split': 18, 'min_samples_leaf': 68, 'criterion': 'entropy'}.
Trial 8317 finished with value: 0.717391304347826 and parameters: {'n_estimators': 944, 'max_depth': 7, 'min_samples_split': 129, 'min_samples_leaf': 72, 'criterion': 'gini'}.
Trial 8318 finished with value: 0.7065217391304348 and parameters: {'n_estimators': 262, 'max_depth': 10, 'min_samples_split': 100, 'min_samples_leaf': 60, 'criterion': 'entropy'}.
Trial 8319 finished with value: 0.6847826086956522 and parameters: {'n_estimators': 293, 'max_depth': 14, 'min_samples_split': 25, 'min_samples_leaf': 57, 'criterion': 'gini'}.
Trial 8320 finished with value: 0.717391304347826 and parameters: {'n_estimators': 278, 'max_depth': 12, 'min_samples_split': 150, 'min_samples_leaf': 65, 'criterion': 'entropy'}.
Trial 8321 finished with value: 0.717391304347826 and parameters: {'n_estimators': 754, 'max_depth': 9, 'min_samples_split': 31, 'min_samples_leaf': 74, 'criterion': 'entropy'}.
Trial 8322 finished with value: 0.7065217391304348 and parameters: {'n_estimators': 735, 'max_depth': 11, 'min_samples_split': 134, 'min_samples_leaf': 59, 'criterion': 'gini'}.
Trial 8323 finished with value: 0.6956521739130435 and parameters: {'n_estimators': 313, 'max_depth': 7, 'min_samples_split': 36, 'min_samples_leaf': 62, 'criterion': 'entropy'}.
Trial 8324 finished with value: 0.6956521739130435 and parameters: {'n_estimators': 255, 'max_depth': 14, 'min_samples_split': 95, 'min_samples_leaf': 55, 'criterion': 'gini'}.
Trial 8325 finished with value: 0.6413043478260869 and parameters: {'n_estimators': 283, 'max_depth': 5, 'min_samples_split': 43, 'min_samples_leaf': 58, 'criterion': 'entropy'}.
Trial 8326 finished with value: 0.6739130434782609 and parameters: {'n_estimators': 218, 'max_depth': 17, 'min_samples_split': 28, 'min_samples_leaf': 53, 'criterion': 'gini'}.
Trial 8327 finished with value: 0.6956521739130435 and parameters: {'n_estimators': 690, 'max_depth': 10, 'min_samples_split': 32, 'min_samples_leaf': 69, 'criterion': 'entropy'}.
Trial 8328 finished with value: 0.7065217391304348 and parameters: {'n_estimators': 237, 'max_depth': 8, 'min_samples_split': 125, 'min_samples_leaf': 61, 'criterion': 'gini'}.
Trial 8329 finished with value: 0.6847826086956522 and parameters: {'n_estimators': 269, 'max_depth': 44, 'min_samples_split': 40, 'min_samples_leaf': 57, 'criterion': 'entropy'}.
Trial 8330 finished with value: 0.6956521739130435 and parameters: {'n_estimators': 301, 'max_depth': 12, 'min_samples_split': 24, 'min_samples_leaf': 59, 'criterion': 'entropy'}.
Trial 8331 finished with value: 0.7065217391304348 and parameters: {'n_estimators': 346, 'max_depth': 10, 'min_samples_split': 144, 'min_samples_leaf': 55, 'criterion': 'gini'}.
Trial 8332 finished with value: 0.6847826086956522 and parameters: {'n_estimators': 767, 'max_depth': 15, 'min_samples_split': 36, 'min_samples_leaf': 75, 'criterion': 'entropy'}.
Trial 8333 finished with value: 0.6956521739130435 and parameters: {'n_estimators': 794, 'max_depth': 7, 'min_samples_split': 114, 'min_samples_leaf': 63, 'criterion': 'gini'}.
Trial 8334 finished with value: 0.6739130434782609 and parameters: {'n_estimators': 327, 'max_depth': 19, 'min_samples_split': 28, 'min_samples_leaf': 60, 'criterion': 'entropy'}.
Trial 8335 finished with value: 0.7065217391304348 and parameters: {'n_estimators': 710, 'max_depth': 13, 'min_samples_split': 138, 'min_samples_leaf': 56, 'criterion': 'gini'}.
Trial 8336 finished with value: 0.6956521739130435 and parameters: {'n_estimators': 252, 'max_depth': 9, 'min_samples_split': 19, 'min_samples_leaf': 71, 'criterion': 'entropy'}.
Trial 8337 finished with value: 0.6739130434782609 and parameters: {'n_estimators': 388, 'max_depth': 90, 'min_samples_split': 33, 'min_samples_leaf': 52, 'criterion': 'gini'}.
Trial 8338 finished with value: 0.7065217391304348 and parameters: {'n_estimators': 280, 'max_depth': 11, 'min_samples_split': 107, 'min_samples_leaf': 66, 'criterion': 'entropy'}.
Trial 8339 finished with value: 0.6956521739130435 and parameters: {'n_estimators': 201, 'max_depth': 8, 'min_samples_split': 46, 'min_samples_leaf': 58, 'criterion': 'entropy'}.
Trial 8340 finished with value: 0.7065217391304348 and parameters: {'n_estimators': 305, 'max_depth': 12, 'min_samples_split': 119, 'min_samples_leaf': 61, 'criterion': 'gini'}.
Trial 8341 finished with value: 0.6521739130434783 and parameters: {'n_estimators': 731, 'max_depth': 5, 'min_samples_split': 133, 'min_samples_leaf': 64, 'criterion': 'entropy'}.
Trial 8342 finished with value: 0.6739130434782609 and parameters: {'n_estimators': 176, 'max_depth': 15, 'min_samples_split': 13, 'min_samples_leaf': 54, 'criterion': 'gini'}.
Trial 8343 finished with value: 0.6521739130434783 and parameters: {'n_estimators': 265, 'max_depth': 10, 'min_samples_split': 30, 'min_samples_leaf': 77, 'criterion': 'entropy'}.
Trial 8344 finished with value: 0.6847826086956522 and parameters: {'n_estimators': 226, 'max_depth': 13, 'min_samples_split': 40, 'min_samples_leaf': 56, 'criterion': 'gini'}.
Trial 8345 finished with value: 0.717391304347826 and parameters: {'n_estimators': 280, 'max_depth': 8, 'min_samples_split': 24, 'min_samples_leaf': 73, 'criterion': 'entropy'}.
Trial 8346 finished with value: 0.6956521739130435 and parameters: {'n_estimators': 297, 'max_depth': 7, 'min_samples_split': 140, 'min_samples_leaf': 60, 'criterion': 'gini'}.
Trial 8347 finished with value: 0.717391304347826 and parameters: {'n_estimators': 758, 'max_depth': 10, 'min_samples_split': 36, 'min_samples_leaf': 57, 'criterion': 'entropy'}.
Trial 8348 finished with value: 0.6956521739130435 and parameters: {'n_estimators': 249, 'max_depth': 12, 'min_samples_split': 146, 'min_samples_leaf': 62, 'criterion': 'entropy'}.
Trial 8349 finished with value: 0.6630434782608695 and parameters: {'n_estimators': 326, 'max_depth': 16, 'min_samples_split': 33, 'min_samples_leaf': 59, 'criterion': 'gini'}.
Trial 8350 finished with value: 0.6847826086956522 and parameters: {'n_estimators': 290, 'max_depth': 9, 'min_samples_split': 28, 'min_samples_leaf': 67, 'criterion': 'entropy'}.
Trial 8351 finished with value: 0.6956521739130435 and parameters: {'n_estimators': 790, 'max_depth': 14, 'min_samples_split': 19, 'min_samples_leaf': 70, 'criterion': 'gini'}.
Trial 8352 finished with value: 0.6956521739130435 and parameters: {'n_estimators': 265, 'max_depth': 11, 'min_samples_split': 39, 'min_samples_leaf': 51, 'criterion': 'entropy'}.
Trial 8353 finished with value: 0.6630434782608695 and parameters: {'n_estimators': 236, 'max_depth': 6, 'min_samples_split': 129, 'min_samples_leaf': 54, 'criterion': 'gini'}.
Trial 8354 finished with value: 0.7065217391304348 and parameters: {'n_estimators': 304, 'max_depth': 9, 'min_samples_split': 23, 'min_samples_leaf': 59, 'criterion': 'entropy'}.
Trial 8355 finished with value: 0.7065217391304348 and parameters: {'n_estimators': 744, 'max_depth': 13, 'min_samples_split': 136, 'min_samples_leaf': 63, 'criterion': 'gini'}.
Trial 8356 finished with value: 0.7282608695652174 and parameters: {'n_estimators': 273, 'max_depth': 11, 'min_samples_split': 34, 'min_samples_leaf': 56, 'criterion': 'entropy'}.
Trial 8357 finished with value: 0.6739130434782609 and parameters: {'n_estimators': 929, 'max_depth': 7, 'min_samples_split': 27, 'min_samples_leaf': 49, 'criterion': 'gini'}.
Trial 8358 finished with value: 0.6086956521739131 and parameters: {'n_estimators': 986, 'max_depth': 9, 'min_samples_split': 44, 'min_samples_leaf': 12, 'criterion': 'entropy'}.
Trial 8359 finished with value: 0.6847826086956522 and parameters: {'n_estimators': 809, 'max_depth': 18, 'min_samples_split': 31, 'min_samples_leaf': 72, 'criterion': 'entropy'}.
Trial 8360 finished with value: 0.6847826086956522 and parameters: {'n_estimators': 771, 'max_depth': 15, 'min_samples_split': 153, 'min_samples_leaf': 58, 'criterion': 'gini'}.
Trial 8361 finished with value: 0.7065217391304348 and parameters: {'n_estimators': 289, 'max_depth': 12, 'min_samples_split': 142, 'min_samples_leaf': 61, 'criterion': 'entropy'}.
Trial 8362 finished with value: 0.6630434782608695 and parameters: {'n_estimators': 485, 'max_depth': 5, 'min_samples_split': 51, 'min_samples_leaf': 75, 'criterion': 'gini'}.
Trial 8363 finished with value: 0.7065217391304348 and parameters: {'n_estimators': 317, 'max_depth': 8, 'min_samples_split': 124, 'min_samples_leaf': 56, 'criterion': 'entropy'}.
Trial 8364 finished with value: 0.7282608695652174 and parameters: {'n_estimators': 248, 'max_depth': 10, 'min_samples_split': 37, 'min_samples_leaf': 53, 'criterion': 'gini'}.
Trial 8365 finished with value: 0.7065217391304348 and parameters: {'n_estimators': 838, 'max_depth': 13, 'min_samples_split': 17, 'min_samples_leaf': 65, 'criterion': 'entropy'}.
Trial 8366 finished with value: 0.6956521739130435 and parameters: {'n_estimators': 277, 'max_depth': 7, 'min_samples_split': 26, 'min_samples_leaf': 58, 'criterion': 'gini'}.
Trial 8367 finished with value: 0.6956521739130435 and parameters: {'n_estimators': 556, 'max_depth': 11, 'min_samples_split': 91, 'min_samples_leaf': 69, 'criterion': 'entropy'}.
Trial 8368 finished with value: 0.6956521739130435 and parameters: {'n_estimators': 998, 'max_depth': 16, 'min_samples_split': 149, 'min_samples_leaf': 61, 'criterion': 'entropy'}.
Trial 8369 finished with value: 0.7065217391304348 and parameters: {'n_estimators': 339, 'max_depth': 10, 'min_samples_split': 42, 'min_samples_leaf': 59, 'criterion': 'gini'}.
Trial 8370 finished with value: 0.6847826086956522 and parameters: {'n_estimators': 260, 'max_depth': 14, 'min_samples_split': 116, 'min_samples_leaf': 63, 'criterion': 'entropy'}.
Trial 8371 finished with value: 0.6956521739130435 and parameters: {'n_estimators': 306, 'max_depth': 66, 'min_samples_split': 31, 'min_samples_leaf': 55, 'criterion': 'gini'}.
Trial 8372 finished with value: 0.7065217391304348 and parameters: {'n_estimators': 126, 'max_depth': 8, 'min_samples_split': 23, 'min_samples_leaf': 57, 'criterion': 'entropy'}.
Trial 8373 finished with value: 0.717391304347826 and parameters: {'n_estimators': 891, 'max_depth': 12, 'min_samples_split': 35, 'min_samples_leaf': 60, 'criterion': 'gini'}.
Trial 8374 finished with value: 0.6847826086956522 and parameters: {'n_estimators': 217, 'max_depth': 10, 'min_samples_split': 132, 'min_samples_leaf': 72, 'criterion': 'entropy'}.
Trial 8375 finished with value: 0.6847826086956522 and parameters: {'n_estimators': 366, 'max_depth': 7, 'min_samples_split': 28, 'min_samples_leaf': 67, 'criterion': 'gini'}.
Trial 8376 finished with value: 0.7065217391304348 and parameters: {'n_estimators': 715, 'max_depth': 13, 'min_samples_split': 39, 'min_samples_leaf': 54, 'criterion': 'entropy'}.
Trial 8377 finished with value: 0.6521739130434783 and parameters: {'n_estimators': 784, 'max_depth': 5, 'min_samples_split': 34, 'min_samples_leaf': 62, 'criterion': 'entropy'}.
Trial 8378 finished with value: 0.6956521739130435 and parameters: {'n_estimators': 255, 'max_depth': 9, 'min_samples_split': 175, 'min_samples_leaf': 57, 'criterion': 'gini'}.
Trial 8379 finished with value: 0.6847826086956522 and parameters: {'n_estimators': 291, 'max_depth': 12, 'min_samples_split': 59, 'min_samples_leaf': 59, 'criterion': 'entropy'}.
Trial 8380 finished with value: 0.6739130434782609 and parameters: {'n_estimators': 748, 'max_depth': 15, 'min_samples_split': 140, 'min_samples_leaf': 52, 'criterion': 'gini'}.
Trial 8381 finished with value: 0.6739130434782609 and parameters: {'n_estimators': 317, 'max_depth': 55, 'min_samples_split': 21, 'min_samples_leaf': 74, 'criterion': 'entropy'}.
Trial 8382 finished with value: 0.717391304347826 and parameters: {'n_estimators': 273, 'max_depth': 11, 'min_samples_split': 82, 'min_samples_leaf': 65, 'criterion': 'gini'}.
Trial 8383 finished with value: 0.6847826086956522 and parameters: {'n_estimators': 674, 'max_depth': 7, 'min_samples_split': 136, 'min_samples_leaf': 55, 'criterion': 'entropy'}.
Trial 8384 finished with value: 0.6847826086956522 and parameters: {'n_estimators': 245, 'max_depth': 17, 'min_samples_split': 47, 'min_samples_leaf': 61, 'criterion': 'gini'}.
Trial 8385 finished with value: 0.7065217391304348 and parameters: {'n_estimators': 291, 'max_depth': 9, 'min_samples_split': 14, 'min_samples_leaf': 70, 'criterion': 'entropy'}.
Trial 8386 finished with value: 0.717391304347826 and parameters: {'n_estimators': 730, 'max_depth': 11, 'min_samples_split': 144, 'min_samples_leaf': 58, 'criterion': 'entropy'}.
Trial 8387 finished with value: 0.6413043478260869 and parameters: {'n_estimators': 345, 'max_depth': 14, 'min_samples_split': 121, 'min_samples_leaf': 98, 'criterion': 'gini'}.
Trial 8388 finished with value: 0.6956521739130435 and parameters: {'n_estimators': 443, 'max_depth': 9, 'min_samples_split': 30, 'min_samples_leaf': 79, 'criterion': 'entropy'}.
Trial 8389 finished with value: 0.6630434782608695 and parameters: {'n_estimators': 534, 'max_depth': 70, 'min_samples_split': 39, 'min_samples_leaf': 56, 'criterion': 'gini'}.
Trial 8390 finished with value: 0.7065217391304348 and parameters: {'n_estimators': 696, 'max_depth': 7, 'min_samples_split': 128, 'min_samples_leaf': 77, 'criterion': 'entropy'}.
Trial 8391 finished with value: 0.7065217391304348 and parameters: {'n_estimators': 763, 'max_depth': 13, 'min_samples_split': 26, 'min_samples_leaf': 63, 'criterion': 'gini'}.
Trial 8392 finished with value: 0.717391304347826 and parameters: {'n_estimators': 958, 'max_depth': 11, 'min_samples_split': 5, 'min_samples_leaf': 60, 'criterion': 'entropy'}.
Trial 8393 finished with value: 0.717391304347826 and parameters: {'n_estimators': 262, 'max_depth': 9, 'min_samples_split': 112, 'min_samples_leaf': 58, 'criterion': 'gini'}.
Trial 8394 finished with value: 0.6304347826086957 and parameters: {'n_estimators': 314, 'max_depth': 5, 'min_samples_split': 33, 'min_samples_leaf': 53, 'criterion': 'entropy'}.
Trial 8395 finished with value: 0.6847826086956522 and parameters: {'n_estimators': 285, 'max_depth': 15, 'min_samples_split': 36, 'min_samples_leaf': 64, 'criterion': 'entropy'}.
Trial 8396 finished with value: 0.6739130434782609 and parameters: {'n_estimators': 189, 'max_depth': 20, 'min_samples_split': 22, 'min_samples_leaf': 72, 'criterion': 'gini'}.
Trial 8397 finished with value: 0.6956521739130435 and parameters: {'n_estimators': 241, 'max_depth': 12, 'min_samples_split': 27, 'min_samples_leaf': 68, 'criterion': 'entropy'}.
Trial 8398 finished with value: 0.6956521739130435 and parameters: {'n_estimators': 223, 'max_depth': 8, 'min_samples_split': 67, 'min_samples_leaf': 56, 'criterion': 'gini'}.
Trial 8399 finished with value: 0.7065217391304348 and parameters: {'n_estimators': 267, 'max_depth': 10, 'min_samples_split': 147, 'min_samples_leaf': 60, 'criterion': 'entropy'}.
Trial 8400 finished with value: 0.6956521739130435 and parameters: {'n_estimators': 807, 'max_depth': 83, 'min_samples_split': 44, 'min_samples_leaf': 51, 'criterion': 'gini'}.
Trial 8401 finished with value: 0.6847826086956522 and parameters: {'n_estimators': 305, 'max_depth': 7, 'min_samples_split': 30, 'min_samples_leaf': 58, 'criterion': 'entropy'}.
Trial 8402 finished with value: 0.7065217391304348 and parameters: {'n_estimators': 778, 'max_depth': 14, 'min_samples_split': 141, 'min_samples_leaf': 62, 'criterion': 'gini'}.
Trial 8403 finished with value: 0.6739130434782609 and parameters: {'n_estimators': 278, 'max_depth': 17, 'min_samples_split': 41, 'min_samples_leaf': 74, 'criterion': 'entropy'}.
Trial 8404 finished with value: 0.7065217391304348 and parameters: {'n_estimators': 655, 'max_depth': 11, 'min_samples_split': 134, 'min_samples_leaf': 55, 'criterion': 'entropy'}.
Trial 8405 finished with value: 0.7065217391304348 and parameters: {'n_estimators': 257, 'max_depth': 9, 'min_samples_split': 34, 'min_samples_leaf': 88, 'criterion': 'gini'}.
Trial 8406 finished with value: 0.6956521739130435 and parameters: {'n_estimators': 329, 'max_depth': 13, 'min_samples_split': 18, 'min_samples_leaf': 66, 'criterion': 'entropy'}.
Trial 8407 finished with value: 0.6956521739130435 and parameters: {'n_estimators': 298, 'max_depth': 7, 'min_samples_split': 104, 'min_samples_leaf': 60, 'criterion': 'gini'}.
Trial 8408 finished with value: 0.717391304347826 and parameters: {'n_estimators': 746, 'max_depth': 10, 'min_samples_split': 38, 'min_samples_leaf': 57, 'criterion': 'entropy'}.
Trial 8409 finished with value: 0.6956521739130435 and parameters: {'n_estimators': 275, 'max_depth': 12, 'min_samples_split': 30, 'min_samples_leaf': 76, 'criterion': 'gini'}.
Trial 8410 finished with value: 0.6630434782608695 and parameters: {'n_estimators': 234, 'max_depth': 6, 'min_samples_split': 23, 'min_samples_leaf': 54, 'criterion': 'entropy'}.
Trial 8411 finished with value: 0.6847826086956522 and parameters: {'n_estimators': 729, 'max_depth': 9, 'min_samples_split': 26, 'min_samples_leaf': 62, 'criterion': 'gini'}.
Trial 8412 finished with value: 0.6847826086956522 and parameters: {'n_estimators': 293, 'max_depth': 11, 'min_samples_split': 126, 'min_samples_leaf': 70, 'criterion': 'entropy'}.
