Trial 554 finished with value: 0.6956521739130435 and parameters: {'n_estimators': 859, 'max_depth': 73, 'min_samples_split': 9, 'min_samples_leaf': 46, 'criterion': 'entropy'}.
Trial 555 finished with value: 0.717391304347826 and parameters: {'n_estimators': 814, 'max_depth': 11, 'min_samples_split': 45, 'min_samples_leaf': 54, 'criterion': 'entropy'}.
Trial 556 finished with value: 0.6739130434782609 and parameters: {'n_estimators': 788, 'max_depth': 18, 'min_samples_split': 32, 'min_samples_leaf': 59, 'criterion': 'entropy'}.
Trial 557 finished with value: 0.717391304347826 and parameters: {'n_estimators': 842, 'max_depth': 14, 'min_samples_split': 28, 'min_samples_leaf': 48, 'criterion': 'entropy'}.
Trial 558 finished with value: 0.6739130434782609 and parameters: {'n_estimators': 742, 'max_depth': 8, 'min_samples_split': 39, 'min_samples_leaf': 52, 'criterion': 'entropy'}.
Trial 559 finished with value: 0.6304347826086957 and parameters: {'n_estimators': 104, 'max_depth': 5, 'min_samples_split': 20, 'min_samples_leaf': 63, 'criterion': 'entropy'}.
Trial 560 finished with value: 0.7282608695652174 and parameters: {'n_estimators': 601, 'max_depth': 10, 'min_samples_split': 24, 'min_samples_leaf': 50, 'criterion': 'entropy'}.
Trial 561 finished with value: 0.6521739130434783 and parameters: {'n_estimators': 800, 'max_depth': 100, 'min_samples_split': 14, 'min_samples_leaf': 55, 'criterion': 'entropy'}.
Trial 562 finished with value: 0.6956521739130435 and parameters: {'n_estimators': 536, 'max_depth': 12, 'min_samples_split': 91, 'min_samples_leaf': 57, 'criterion': 'entropy'}.
Trial 563 finished with value: 0.6739130434782609 and parameters: {'n_estimators': 826, 'max_depth': 7, 'min_samples_split': 160, 'min_samples_leaf': 47, 'criterion': 'entropy'}.
Trial 564 finished with value: 0.6956521739130435 and parameters: {'n_estimators': 507, 'max_depth': 9, 'min_samples_split': 107, 'min_samples_leaf': 88, 'criterion': 'entropy'}.
Trial 565 finished with value: 0.717391304347826 and parameters: {'n_estimators': 782, 'max_depth': 13, 'min_samples_split': 126, 'min_samples_leaf': 52, 'criterion': 'entropy'}.
Trial 566 finished with value: 0.7282608695652174 and parameters: {'n_estimators': 867, 'max_depth': 11, 'min_samples_split': 51, 'min_samples_leaf': 50, 'criterion': 'entropy'}.
Trial 567 finished with value: 0.717391304347826 and parameters: {'n_estimators': 646, 'max_depth': 9, 'min_samples_split': 31, 'min_samples_leaf': 54, 'criterion': 'entropy'}.
Trial 568 finished with value: 0.6739130434782609 and parameters: {'n_estimators': 844, 'max_depth': 6, 'min_samples_split': 111, 'min_samples_leaf': 48, 'criterion': 'entropy'}.
Trial 569 finished with value: 0.6847826086956522 and parameters: {'n_estimators': 815, 'max_depth': 15, 'min_samples_split': 40, 'min_samples_leaf': 45, 'criterion': 'entropy'}.
Trial 570 finished with value: 0.7065217391304348 and parameters: {'n_estimators': 885, 'max_depth': 11, 'min_samples_split': 36, 'min_samples_leaf': 56, 'criterion': 'entropy'}.
Trial 571 finished with value: 0.6739130434782609 and parameters: {'n_estimators': 767, 'max_depth': 8, 'min_samples_split': 26, 'min_samples_leaf': 52, 'criterion': 'entropy'}.
Trial 572 finished with value: 0.717391304347826 and parameters: {'n_estimators': 828, 'max_depth': 13, 'min_samples_split': 32, 'min_samples_leaf': 59, 'criterion': 'gini'}.
Trial 573 finished with value: 0.7282608695652174 and parameters: {'n_estimators': 801, 'max_depth': 10, 'min_samples_split': 23, 'min_samples_leaf': 50, 'criterion': 'entropy'}.
Trial 574 finished with value: 0.6847826086956522 and parameters: {'n_estimators': 558, 'max_depth': 7, 'min_samples_split': 29, 'min_samples_leaf': 53, 'criterion': 'entropy'}.
Trial 575 finished with value: 0.6847826086956522 and parameters: {'n_estimators': 854, 'max_depth': 12, 'min_samples_split': 43, 'min_samples_leaf': 61, 'criterion': 'entropy'}.
Trial 576 finished with value: 0.6630434782608695 and parameters: {'n_estimators': 482, 'max_depth': 16, 'min_samples_split': 98, 'min_samples_leaf': 49, 'criterion': 'entropy'}.
Trial 577 finished with value: 0.717391304347826 and parameters: {'n_estimators': 582, 'max_depth': 9, 'min_samples_split': 172, 'min_samples_leaf': 55, 'criterion': 'entropy'}.
Trial 578 finished with value: 0.6413043478260869 and parameters: {'n_estimators': 788, 'max_depth': 5, 'min_samples_split': 36, 'min_samples_leaf': 46, 'criterion': 'entropy'}.
Trial 579 finished with value: 0.717391304347826 and parameters: {'n_estimators': 830, 'max_depth': 11, 'min_samples_split': 21, 'min_samples_leaf': 58, 'criterion': 'entropy'}.
Trial 580 finished with value: 0.6630434782608695 and parameters: {'n_estimators': 703, 'max_depth': 14, 'min_samples_split': 27, 'min_samples_leaf': 100, 'criterion': 'entropy'}.
Trial 581 finished with value: 0.6847826086956522 and parameters: {'n_estimators': 754, 'max_depth': 8, 'min_samples_split': 32, 'min_samples_leaf': 51, 'criterion': 'entropy'}.
Trial 582 finished with value: 0.7065217391304348 and parameters: {'n_estimators': 813, 'max_depth': 10, 'min_samples_split': 17, 'min_samples_leaf': 53, 'criterion': 'entropy'}.
Trial 583 finished with value: 0.6739130434782609 and parameters: {'n_estimators': 841, 'max_depth': 7, 'min_samples_split': 39, 'min_samples_leaf': 47, 'criterion': 'entropy'}.
Trial 584 finished with value: 0.6956521739130435 and parameters: {'n_estimators': 733, 'max_depth': 12, 'min_samples_split': 35, 'min_samples_leaf': 56, 'criterion': 'entropy'}.
Trial 585 finished with value: 0.717391304347826 and parameters: {'n_estimators': 798, 'max_depth': 9, 'min_samples_split': 25, 'min_samples_leaf': 49, 'criterion': 'entropy'}.
Trial 586 finished with value: 0.717391304347826 and parameters: {'n_estimators': 861, 'max_depth': 13, 'min_samples_split': 13, 'min_samples_leaf': 51, 'criterion': 'entropy'}.
Trial 587 finished with value: 0.6521739130434783 and parameters: {'n_estimators': 775, 'max_depth': 6, 'min_samples_split': 29, 'min_samples_leaf': 43, 'criterion': 'entropy'}.
Trial 588 finished with value: 0.6739130434782609 and parameters: {'n_estimators': 817, 'max_depth': 17, 'min_samples_split': 19, 'min_samples_leaf': 54, 'criterion': 'entropy'}.
Trial 589 finished with value: 0.6956521739130435 and parameters: {'n_estimators': 828, 'max_depth': 10, 'min_samples_split': 32, 'min_samples_leaf': 48, 'criterion': 'entropy'}.
Trial 590 finished with value: 0.717391304347826 and parameters: {'n_estimators': 134, 'max_depth': 11, 'min_samples_split': 41, 'min_samples_leaf': 58, 'criterion': 'entropy'}.
Trial 591 finished with value: 0.6847826086956522 and parameters: {'n_estimators': 794, 'max_depth': 8, 'min_samples_split': 46, 'min_samples_leaf': 51, 'criterion': 'gini'}.
Trial 592 finished with value: 0.6956521739130435 and parameters: {'n_estimators': 530, 'max_depth': 14, 'min_samples_split': 22, 'min_samples_leaf': 53, 'criterion': 'entropy'}.
Trial 593 finished with value: 0.6956521739130435 and parameters: {'n_estimators': 847, 'max_depth': 10, 'min_samples_split': 153, 'min_samples_leaf': 56, 'criterion': 'entropy'}.
Trial 594 finished with value: 0.6956521739130435 and parameters: {'n_estimators': 776, 'max_depth': 7, 'min_samples_split': 34, 'min_samples_leaf': 92, 'criterion': 'entropy'}.
Trial 595 finished with value: 0.6956521739130435 and parameters: {'n_estimators': 805, 'max_depth': 12, 'min_samples_split': 88, 'min_samples_leaf': 46, 'criterion': 'entropy'}.
Trial 596 finished with value: 0.717391304347826 and parameters: {'n_estimators': 756, 'max_depth': 9, 'min_samples_split': 26, 'min_samples_leaf': 49, 'criterion': 'entropy'}.
Trial 597 finished with value: 0.6413043478260869 and parameters: {'n_estimators': 871, 'max_depth': 5, 'min_samples_split': 104, 'min_samples_leaf': 54, 'criterion': 'entropy'}.
Trial 598 finished with value: 0.6847826086956522 and parameters: {'n_estimators': 898, 'max_depth': 15, 'min_samples_split': 114, 'min_samples_leaf': 61, 'criterion': 'entropy'}.
Trial 599 finished with value: 0.7065217391304348 and parameters: {'n_estimators': 826, 'max_depth': 12, 'min_samples_split': 37, 'min_samples_leaf': 51, 'criterion': 'entropy'}.
Trial 600 finished with value: 0.6956521739130435 and parameters: {'n_estimators': 806, 'max_depth': 8, 'min_samples_split': 29, 'min_samples_leaf': 48, 'criterion': 'entropy'}.
Trial 601 finished with value: 0.717391304347826 and parameters: {'n_estimators': 845, 'max_depth': 10, 'min_samples_split': 32, 'min_samples_leaf': 52, 'criterion': 'entropy'}.
Trial 602 finished with value: 0.7065217391304348 and parameters: {'n_estimators': 788, 'max_depth': 13, 'min_samples_split': 23, 'min_samples_leaf': 44, 'criterion': 'entropy'}.
Trial 603 finished with value: 0.6956521739130435 and parameters: {'n_estimators': 566, 'max_depth': 7, 'min_samples_split': 65, 'min_samples_leaf': 57, 'criterion': 'entropy'}.
Trial 604 finished with value: 0.6956521739130435 and parameters: {'n_estimators': 817, 'max_depth': 11, 'min_samples_split': 17, 'min_samples_leaf': 55, 'criterion': 'entropy'}.
Trial 605 finished with value: 0.6739130434782609 and parameters: {'n_estimators': 514, 'max_depth': 64, 'min_samples_split': 38, 'min_samples_leaf': 50, 'criterion': 'entropy'}.
Trial 606 finished with value: 0.6956521739130435 and parameters: {'n_estimators': 837, 'max_depth': 9, 'min_samples_split': 7, 'min_samples_leaf': 65, 'criterion': 'entropy'}.
Trial 607 finished with value: 0.6739130434782609 and parameters: {'n_estimators': 770, 'max_depth': 6, 'min_samples_split': 28, 'min_samples_leaf': 53, 'criterion': 'entropy'}.
Trial 608 finished with value: 0.7282608695652174 and parameters: {'n_estimators': 860, 'max_depth': 14, 'min_samples_split': 42, 'min_samples_leaf': 47, 'criterion': 'entropy'}.
Trial 609 finished with value: 0.717391304347826 and parameters: {'n_estimators': 713, 'max_depth': 11, 'min_samples_split': 24, 'min_samples_leaf': 60, 'criterion': 'entropy'}.
Trial 610 finished with value: 0.6739130434782609 and parameters: {'n_estimators': 790, 'max_depth': 8, 'min_samples_split': 34, 'min_samples_leaf': 35, 'criterion': 'gini'}.
Trial 611 finished with value: 0.717391304347826 and parameters: {'n_estimators': 745, 'max_depth': 10, 'min_samples_split': 31, 'min_samples_leaf': 32, 'criterion': 'entropy'}.
Trial 612 finished with value: 0.6739130434782609 and parameters: {'n_estimators': 549, 'max_depth': 17, 'min_samples_split': 20, 'min_samples_leaf': 50, 'criterion': 'entropy'}.
Trial 613 finished with value: 0.7065217391304348 and parameters: {'n_estimators': 959, 'max_depth': 12, 'min_samples_split': 12, 'min_samples_leaf': 55, 'criterion': 'entropy'}.
Trial 614 finished with value: 0.6413043478260869 and parameters: {'n_estimators': 619, 'max_depth': 5, 'min_samples_split': 27, 'min_samples_leaf': 52, 'criterion': 'entropy'}.
Trial 615 finished with value: 0.6739130434782609 and parameters: {'n_estimators': 808, 'max_depth': 8, 'min_samples_split': 37, 'min_samples_leaf': 41, 'criterion': 'entropy'}.
Trial 616 finished with value: 0.6956521739130435 and parameters: {'n_estimators': 318, 'max_depth': 14, 'min_samples_split': 48, 'min_samples_leaf': 58, 'criterion': 'entropy'}.
Trial 617 finished with value: 0.717391304347826 and parameters: {'n_estimators': 830, 'max_depth': 10, 'min_samples_split': 100, 'min_samples_leaf': 45, 'criterion': 'entropy'}.
Trial 618 finished with value: 0.7065217391304348 and parameters: {'n_estimators': 874, 'max_depth': 12, 'min_samples_split': 30, 'min_samples_leaf': 49, 'criterion': 'entropy'}.
Trial 619 finished with value: 0.6847826086956522 and parameters: {'n_estimators': 811, 'max_depth': 7, 'min_samples_split': 35, 'min_samples_leaf': 53, 'criterion': 'entropy'}.
Trial 620 finished with value: 0.6630434782608695 and parameters: {'n_estimators': 780, 'max_depth': 20, 'min_samples_split': 17, 'min_samples_leaf': 63, 'criterion': 'entropy'}.
Trial 621 finished with value: 0.7065217391304348 and parameters: {'n_estimators': 848, 'max_depth': 9, 'min_samples_split': 23, 'min_samples_leaf': 47, 'criterion': 'entropy'}.
Trial 622 finished with value: 0.6847826086956522 and parameters: {'n_estimators': 760, 'max_depth': 16, 'min_samples_split': 42, 'min_samples_leaf': 51, 'criterion': 'entropy'}.
Trial 623 finished with value: 0.6847826086956522 and parameters: {'n_estimators': 282, 'max_depth': 13, 'min_samples_split': 27, 'min_samples_leaf': 56, 'criterion': 'entropy'}.
Trial 624 finished with value: 0.7282608695652174 and parameters: {'n_estimators': 828, 'max_depth': 10, 'min_samples_split': 32, 'min_samples_leaf': 49, 'criterion': 'entropy'}.
Trial 625 finished with value: 0.6956521739130435 and parameters: {'n_estimators': 586, 'max_depth': 7, 'min_samples_split': 39, 'min_samples_leaf': 54, 'criterion': 'entropy'}.
Trial 626 finished with value: 0.717391304347826 and parameters: {'n_estimators': 793, 'max_depth': 11, 'min_samples_split': 20, 'min_samples_leaf': 58, 'criterion': 'entropy'}.
Trial 627 finished with value: 0.6847826086956522 and parameters: {'n_estimators': 815, 'max_depth': 83, 'min_samples_split': 25, 'min_samples_leaf': 46, 'criterion': 'entropy'}.
Trial 628 finished with value: 0.6739130434782609 and parameters: {'n_estimators': 857, 'max_depth': 9, 'min_samples_split': 34, 'min_samples_leaf': 51, 'criterion': 'entropy'}.
Trial 629 finished with value: 0.6847826086956522 and parameters: {'n_estimators': 728, 'max_depth': 6, 'min_samples_split': 198, 'min_samples_leaf': 48, 'criterion': 'gini'}.
Trial 630 finished with value: 0.6847826086956522 and parameters: {'n_estimators': 837, 'max_depth': 15, 'min_samples_split': 30, 'min_samples_leaf': 55, 'criterion': 'entropy'}.
Trial 631 finished with value: 0.717391304347826 and parameters: {'n_estimators': 799, 'max_depth': 12, 'min_samples_split': 15, 'min_samples_leaf': 52, 'criterion': 'entropy'}.
Trial 632 finished with value: 0.6739130434782609 and parameters: {'n_estimators': 497, 'max_depth': 91, 'min_samples_split': 45, 'min_samples_leaf': 49, 'criterion': 'entropy'}.
Trial 633 finished with value: 0.717391304347826 and parameters: {'n_estimators': 775, 'max_depth': 8, 'min_samples_split': 38, 'min_samples_leaf': 60, 'criterion': 'entropy'}.
Trial 634 finished with value: 0.6304347826086957 and parameters: {'n_estimators': 541, 'max_depth': 5, 'min_samples_split': 22, 'min_samples_leaf': 57, 'criterion': 'entropy'}.
Trial 635 finished with value: 0.6956521739130435 and parameters: {'n_estimators': 818, 'max_depth': 10, 'min_samples_split': 28, 'min_samples_leaf': 44, 'criterion': 'entropy'}.
Trial 636 finished with value: 0.717391304347826 and parameters: {'n_estimators': 888, 'max_depth': 13, 'min_samples_split': 34, 'min_samples_leaf': 53, 'criterion': 'entropy'}.
Trial 637 finished with value: 0.7065217391304348 and parameters: {'n_estimators': 841, 'max_depth': 8, 'min_samples_split': 24, 'min_samples_leaf': 50, 'criterion': 'entropy'}.
Trial 638 finished with value: 0.717391304347826 and parameters: {'n_estimators': 800, 'max_depth': 11, 'min_samples_split': 107, 'min_samples_leaf': 54, 'criterion': 'entropy'}.
Trial 639 finished with value: 0.7065217391304348 and parameters: {'n_estimators': 759, 'max_depth': 9, 'min_samples_split': 40, 'min_samples_leaf': 46, 'criterion': 'entropy'}.
Trial 640 finished with value: 0.717391304347826 and parameters: {'n_estimators': 825, 'max_depth': 14, 'min_samples_split': 29, 'min_samples_leaf': 51, 'criterion': 'entropy'}.
Trial 641 finished with value: 0.7065217391304348 and parameters: {'n_estimators': 854, 'max_depth': 11, 'min_samples_split': 11, 'min_samples_leaf': 56, 'criterion': 'entropy'}.
Trial 642 finished with value: 0.7065217391304348 and parameters: {'n_estimators': 787, 'max_depth': 7, 'min_samples_split': 96, 'min_samples_leaf': 59, 'criterion': 'entropy'}.
Trial 643 finished with value: 0.7065217391304348 and parameters: {'n_estimators': 876, 'max_depth': 9, 'min_samples_split': 19, 'min_samples_leaf': 48, 'criterion': 'entropy'}.
Trial 644 finished with value: 0.717391304347826 and parameters: {'n_estimators': 814, 'max_depth': 13, 'min_samples_split': 34, 'min_samples_leaf': 53, 'criterion': 'entropy'}.
Trial 645 finished with value: 0.6413043478260869 and parameters: {'n_estimators': 371, 'max_depth': 5, 'min_samples_split': 26, 'min_samples_leaf': 51, 'criterion': 'entropy'}.
Trial 646 finished with value: 0.717391304347826 and parameters: {'n_estimators': 834, 'max_depth': 11, 'min_samples_split': 37, 'min_samples_leaf': 49, 'criterion': 'entropy'}.
Trial 647 finished with value: 0.6847826086956522 and parameters: {'n_estimators': 802, 'max_depth': 7, 'min_samples_split': 103, 'min_samples_leaf': 55, 'criterion': 'entropy'}.
Trial 648 finished with value: 0.6956521739130435 and parameters: {'n_estimators': 213, 'max_depth': 9, 'min_samples_split': 32, 'min_samples_leaf': 52, 'criterion': 'entropy'}.
Trial 649 finished with value: 0.7065217391304348 and parameters: {'n_estimators': 737, 'max_depth': 15, 'min_samples_split': 43, 'min_samples_leaf': 47, 'criterion': 'gini'}.
Trial 650 finished with value: 0.6847826086956522 and parameters: {'n_estimators': 771, 'max_depth': 12, 'min_samples_split': 30, 'min_samples_leaf': 62, 'criterion': 'entropy'}.
Trial 651 finished with value: 0.717391304347826 and parameters: {'n_estimators': 931, 'max_depth': 10, 'min_samples_split': 21, 'min_samples_leaf': 57, 'criterion': 'entropy'}.
Trial 652 finished with value: 0.6739130434782609 and parameters: {'n_estimators': 559, 'max_depth': 18, 'min_samples_split': 16, 'min_samples_leaf': 50, 'criterion': 'entropy'}.
Trial 653 finished with value: 0.7065217391304348 and parameters: {'n_estimators': 857, 'max_depth': 8, 'min_samples_split': 25, 'min_samples_leaf': 53, 'criterion': 'entropy'}.
Trial 654 finished with value: 0.6956521739130435 and parameters: {'n_estimators': 672, 'max_depth': 13, 'min_samples_split': 37, 'min_samples_leaf': 43, 'criterion': 'entropy'}.
Trial 655 finished with value: 0.7065217391304348 and parameters: {'n_estimators': 782, 'max_depth': 7, 'min_samples_split': 33, 'min_samples_leaf': 59, 'criterion': 'entropy'}.
Trial 656 finished with value: 0.6956521739130435 and parameters: {'n_estimators': 823, 'max_depth': 11, 'min_samples_split': 28, 'min_samples_leaf': 48, 'criterion': 'entropy'}.
Trial 657 finished with value: 0.717391304347826 and parameters: {'n_estimators': 530, 'max_depth': 9, 'min_samples_split': 58, 'min_samples_leaf': 55, 'criterion': 'entropy'}.
Trial 658 finished with value: 0.6739130434782609 and parameters: {'n_estimators': 807, 'max_depth': 6, 'min_samples_split': 40, 'min_samples_leaf': 50, 'criterion': 'entropy'}.
Trial 659 finished with value: 0.6847826086956522 and parameters: {'n_estimators': 839, 'max_depth': 15, 'min_samples_split': 117, 'min_samples_leaf': 45, 'criterion': 'entropy'}.
Trial 660 finished with value: 0.717391304347826 and parameters: {'n_estimators': 796, 'max_depth': 12, 'min_samples_split': 25, 'min_samples_leaf': 52, 'criterion': 'entropy'}.
Trial 661 finished with value: 0.717391304347826 and parameters: {'n_estimators': 752, 'max_depth': 10, 'min_samples_split': 20, 'min_samples_leaf': 57, 'criterion': 'entropy'}.
Trial 662 finished with value: 0.717391304347826 and parameters: {'n_estimators': 868, 'max_depth': 8, 'min_samples_split': 49, 'min_samples_leaf': 54, 'criterion': 'entropy'}.
Trial 663 finished with value: 0.7065217391304348 and parameters: {'n_estimators': 825, 'max_depth': 13, 'min_samples_split': 36, 'min_samples_leaf': 47, 'criterion': 'entropy'}.
Trial 664 finished with value: 0.6413043478260869 and parameters: {'n_estimators': 781, 'max_depth': 5, 'min_samples_split': 30, 'min_samples_leaf': 50, 'criterion': 'entropy'}.
Trial 665 finished with value: 0.7065217391304348 and parameters: {'n_estimators': 846, 'max_depth': 10, 'min_samples_split': 33, 'min_samples_leaf': 61, 'criterion': 'entropy'}.
Trial 666 finished with value: 0.6847826086956522 and parameters: {'n_estimators': 575, 'max_depth': 11, 'min_samples_split': 13, 'min_samples_leaf': 52, 'criterion': 'entropy'}.
Trial 667 finished with value: 0.6956521739130435 and parameters: {'n_estimators': 907, 'max_depth': 16, 'min_samples_split': 23, 'min_samples_leaf': 55, 'criterion': 'gini'}.
Trial 668 finished with value: 0.6847826086956522 and parameters: {'n_estimators': 811, 'max_depth': 7, 'min_samples_split': 110, 'min_samples_leaf': 49, 'criterion': 'entropy'}.
Trial 669 finished with value: 0.7065217391304348 and parameters: {'n_estimators': 517, 'max_depth': 9, 'min_samples_split': 42, 'min_samples_leaf': 59, 'criterion': 'entropy'}.
Trial 670 finished with value: 0.7282608695652174 and parameters: {'n_estimators': 793, 'max_depth': 14, 'min_samples_split': 29, 'min_samples_leaf': 47, 'criterion': 'entropy'}.
Trial 671 finished with value: 0.7065217391304348 and parameters: {'n_estimators': 606, 'max_depth': 12, 'min_samples_split': 17, 'min_samples_leaf': 53, 'criterion': 'entropy'}.
Trial 672 finished with value: 0.7282608695652174 and parameters: {'n_estimators': 830, 'max_depth': 8, 'min_samples_split': 36, 'min_samples_leaf': 57, 'criterion': 'entropy'}.
Trial 673 finished with value: 0.717391304347826 and parameters: {'n_estimators': 853, 'max_depth': 10, 'min_samples_split': 4, 'min_samples_leaf': 51, 'criterion': 'entropy'}.
Trial 674 finished with value: 0.6521739130434783 and parameters: {'n_estimators': 693, 'max_depth': 6, 'min_samples_split': 26, 'min_samples_leaf': 45, 'criterion': 'entropy'}.
Trial 675 finished with value: 0.6956521739130435 and parameters: {'n_estimators': 771, 'max_depth': 12, 'min_samples_split': 32, 'min_samples_leaf': 54, 'criterion': 'entropy'}.
Trial 676 finished with value: 0.717391304347826 and parameters: {'n_estimators': 809, 'max_depth': 9, 'min_samples_split': 192, 'min_samples_leaf': 48, 'criterion': 'entropy'}.
