Trial 6814 finished with value: 0.7065217391304348 and parameters: {'n_estimators': 290, 'max_depth': 13, 'min_samples_split': 27, 'min_samples_leaf': 63, 'criterion': 'gini'}.
Trial 6815 finished with value: 0.6086956521739131 and parameters: {'n_estimators': 773, 'max_depth': 7, 'min_samples_split': 41, 'min_samples_leaf': 31, 'criterion': 'entropy'}.
Trial 6816 finished with value: 0.7065217391304348 and parameters: {'n_estimators': 238, 'max_depth': 11, 'min_samples_split': 131, 'min_samples_leaf': 51, 'criterion': 'gini'}.
Trial 6817 finished with value: 0.6847826086956522 and parameters: {'n_estimators': 727, 'max_depth': 9, 'min_samples_split': 17, 'min_samples_leaf': 90, 'criterion': 'entropy'}.
Trial 6818 finished with value: 0.7065217391304348 and parameters: {'n_estimators': 309, 'max_depth': 14, 'min_samples_split': 32, 'min_samples_leaf': 71, 'criterion': 'entropy'}.
Trial 6819 finished with value: 0.7065217391304348 and parameters: {'n_estimators': 752, 'max_depth': 11, 'min_samples_split': 36, 'min_samples_leaf': 58, 'criterion': 'gini'}.
Trial 6820 finished with value: 0.7065217391304348 and parameters: {'n_estimators': 270, 'max_depth': 8, 'min_samples_split': 119, 'min_samples_leaf': 61, 'criterion': 'entropy'}.
Trial 6821 finished with value: 0.6847826086956522 and parameters: {'n_estimators': 790, 'max_depth': 18, 'min_samples_split': 24, 'min_samples_leaf': 55, 'criterion': 'gini'}.
Trial 6822 finished with value: 0.6739130434782609 and parameters: {'n_estimators': 251, 'max_depth': 6, 'min_samples_split': 30, 'min_samples_leaf': 66, 'criterion': 'entropy'}.
Trial 6823 finished with value: 0.6739130434782609 and parameters: {'n_estimators': 154, 'max_depth': 12, 'min_samples_split': 54, 'min_samples_leaf': 59, 'criterion': 'gini'}.
Trial 6824 finished with value: 0.6630434782608695 and parameters: {'n_estimators': 282, 'max_depth': 16, 'min_samples_split': 45, 'min_samples_leaf': 57, 'criterion': 'entropy'}.
Trial 6825 finished with value: 0.7065217391304348 and parameters: {'n_estimators': 332, 'max_depth': 9, 'min_samples_split': 12, 'min_samples_leaf': 74, 'criterion': 'gini'}.
Trial 6826 finished with value: 0.6956521739130435 and parameters: {'n_estimators': 310, 'max_depth': 13, 'min_samples_split': 27, 'min_samples_leaf': 53, 'criterion': 'entropy'}.
Trial 6827 finished with value: 0.717391304347826 and parameters: {'n_estimators': 290, 'max_depth': 10, 'min_samples_split': 37, 'min_samples_leaf': 62, 'criterion': 'entropy'}.
Trial 6828 finished with value: 0.6847826086956522 and parameters: {'n_estimators': 411, 'max_depth': 7, 'min_samples_split': 143, 'min_samples_leaf': 64, 'criterion': 'gini'}.
Trial 6829 finished with value: 0.7282608695652174 and parameters: {'n_estimators': 259, 'max_depth': 11, 'min_samples_split': 137, 'min_samples_leaf': 59, 'criterion': 'entropy'}.
Trial 6830 finished with value: 0.6630434782608695 and parameters: {'n_estimators': 224, 'max_depth': 15, 'min_samples_split': 20, 'min_samples_leaf': 56, 'criterion': 'gini'}.
Trial 6831 finished with value: 0.717391304347826 and parameters: {'n_estimators': 280, 'max_depth': 8, 'min_samples_split': 124, 'min_samples_leaf': 71, 'criterion': 'entropy'}.
Trial 6832 finished with value: 0.6847826086956522 and parameters: {'n_estimators': 762, 'max_depth': 13, 'min_samples_split': 33, 'min_samples_leaf': 61, 'criterion': 'gini'}.
Trial 6833 finished with value: 0.6630434782608695 and parameters: {'n_estimators': 126, 'max_depth': 10, 'min_samples_split': 41, 'min_samples_leaf': 68, 'criterion': 'entropy'}.
Trial 6834 finished with value: 0.6413043478260869 and parameters: {'n_estimators': 305, 'max_depth': 5, 'min_samples_split': 166, 'min_samples_leaf': 58, 'criterion': 'gini'}.
Trial 6835 finished with value: 0.7282608695652174 and parameters: {'n_estimators': 238, 'max_depth': 8, 'min_samples_split': 30, 'min_samples_leaf': 55, 'criterion': 'entropy'}.
Trial 6836 finished with value: 0.6956521739130435 and parameters: {'n_estimators': 510, 'max_depth': 12, 'min_samples_split': 25, 'min_samples_leaf': 51, 'criterion': 'gini'}.
Trial 6837 finished with value: 0.717391304347826 and parameters: {'n_estimators': 376, 'max_depth': 10, 'min_samples_split': 36, 'min_samples_leaf': 60, 'criterion': 'entropy'}.
Trial 6838 finished with value: 0.6739130434782609 and parameters: {'n_estimators': 782, 'max_depth': 60, 'min_samples_split': 134, 'min_samples_leaf': 73, 'criterion': 'entropy'}.
Trial 6839 finished with value: 0.6521739130434783 and parameters: {'n_estimators': 266, 'max_depth': 14, 'min_samples_split': 38, 'min_samples_leaf': 77, 'criterion': 'gini'}.
Trial 6840 finished with value: 0.6847826086956522 and parameters: {'n_estimators': 744, 'max_depth': 7, 'min_samples_split': 141, 'min_samples_leaf': 57, 'criterion': 'entropy'}.
Trial 6841 finished with value: 0.6956521739130435 and parameters: {'n_estimators': 322, 'max_depth': 11, 'min_samples_split': 2, 'min_samples_leaf': 64, 'criterion': 'gini'}.
Trial 6842 finished with value: 0.6847826086956522 and parameters: {'n_estimators': 874, 'max_depth': 9, 'min_samples_split': 32, 'min_samples_leaf': 53, 'criterion': 'entropy'}.
Trial 6843 finished with value: 0.6847826086956522 and parameters: {'n_estimators': 645, 'max_depth': 15, 'min_samples_split': 22, 'min_samples_leaf': 59, 'criterion': 'gini'}.
Trial 6844 finished with value: 0.6956521739130435 and parameters: {'n_estimators': 204, 'max_depth': 12, 'min_samples_split': 48, 'min_samples_leaf': 62, 'criterion': 'entropy'}.
Trial 6845 finished with value: 0.6847826086956522 and parameters: {'n_estimators': 289, 'max_depth': 6, 'min_samples_split': 27, 'min_samples_leaf': 55, 'criterion': 'gini'}.
Trial 6846 finished with value: 0.6847826086956522 and parameters: {'n_estimators': 353, 'max_depth': 9, 'min_samples_split': 111, 'min_samples_leaf': 66, 'criterion': 'entropy'}.
Trial 6847 finished with value: 0.7282608695652174 and parameters: {'n_estimators': 804, 'max_depth': 13, 'min_samples_split': 15, 'min_samples_leaf': 58, 'criterion': 'entropy'}.
Trial 6848 finished with value: 0.6847826086956522 and parameters: {'n_estimators': 715, 'max_depth': 18, 'min_samples_split': 96, 'min_samples_leaf': 70, 'criterion': 'gini'}.
Trial 6849 finished with value: 0.7065217391304348 and parameters: {'n_estimators': 254, 'max_depth': 11, 'min_samples_split': 39, 'min_samples_leaf': 61, 'criterion': 'entropy'}.
Trial 6850 finished with value: 0.7065217391304348 and parameters: {'n_estimators': 271, 'max_depth': 8, 'min_samples_split': 128, 'min_samples_leaf': 56, 'criterion': 'gini'}.
Trial 6851 finished with value: 0.6847826086956522 and parameters: {'n_estimators': 306, 'max_depth': 43, 'min_samples_split': 34, 'min_samples_leaf': 59, 'criterion': 'entropy'}.
Trial 6852 finished with value: 0.6847826086956522 and parameters: {'n_estimators': 482, 'max_depth': 16, 'min_samples_split': 29, 'min_samples_leaf': 63, 'criterion': 'gini'}.
Trial 6853 finished with value: 0.6847826086956522 and parameters: {'n_estimators': 237, 'max_depth': 10, 'min_samples_split': 105, 'min_samples_leaf': 74, 'criterion': 'entropy'}.
Trial 6854 finished with value: 0.6413043478260869 and parameters: {'n_estimators': 297, 'max_depth': 5, 'min_samples_split': 21, 'min_samples_leaf': 53, 'criterion': 'gini'}.
Trial 6855 finished with value: 0.6956521739130435 and parameters: {'n_estimators': 731, 'max_depth': 13, 'min_samples_split': 132, 'min_samples_leaf': 57, 'criterion': 'entropy'}.
Trial 6856 finished with value: 0.6956521739130435 and parameters: {'n_estimators': 275, 'max_depth': 7, 'min_samples_split': 44, 'min_samples_leaf': 79, 'criterion': 'entropy'}.
Trial 6857 finished with value: 0.7282608695652174 and parameters: {'n_estimators': 253, 'max_depth': 9, 'min_samples_split': 78, 'min_samples_leaf': 60, 'criterion': 'gini'}.
Trial 6858 finished with value: 0.7282608695652174 and parameters: {'n_estimators': 319, 'max_depth': 11, 'min_samples_split': 140, 'min_samples_leaf': 72, 'criterion': 'entropy'}.
Trial 6859 finished with value: 0.6956521739130435 and parameters: {'n_estimators': 921, 'max_depth': 14, 'min_samples_split': 144, 'min_samples_leaf': 68, 'criterion': 'gini'}.
Trial 6860 finished with value: 0.6739130434782609 and parameters: {'n_estimators': 768, 'max_depth': 7, 'min_samples_split': 26, 'min_samples_leaf': 55, 'criterion': 'entropy'}.
Trial 6861 finished with value: 0.717391304347826 and parameters: {'n_estimators': 279, 'max_depth': 12, 'min_samples_split': 123, 'min_samples_leaf': 58, 'criterion': 'gini'}.
Trial 6862 finished with value: 0.6739130434782609 and parameters: {'n_estimators': 288, 'max_depth': 21, 'min_samples_split': 35, 'min_samples_leaf': 63, 'criterion': 'entropy'}.
Trial 6863 finished with value: 0.7065217391304348 and parameters: {'n_estimators': 333, 'max_depth': 9, 'min_samples_split': 31, 'min_samples_leaf': 61, 'criterion': 'gini'}.
Trial 6864 finished with value: 0.6630434782608695 and parameters: {'n_estimators': 257, 'max_depth': 16, 'min_samples_split': 118, 'min_samples_leaf': 24, 'criterion': 'entropy'}.
Trial 6865 finished with value: 0.6304347826086957 and parameters: {'n_estimators': 221, 'max_depth': 66, 'min_samples_split': 39, 'min_samples_leaf': 56, 'criterion': 'entropy'}.
Trial 6866 finished with value: 0.7065217391304348 and parameters: {'n_estimators': 741, 'max_depth': 11, 'min_samples_split': 18, 'min_samples_leaf': 65, 'criterion': 'gini'}.
Trial 6867 finished with value: 0.6956521739130435 and parameters: {'n_estimators': 702, 'max_depth': 8, 'min_samples_split': 42, 'min_samples_leaf': 54, 'criterion': 'entropy'}.
Trial 6868 finished with value: 0.7065217391304348 and parameters: {'n_estimators': 295, 'max_depth': 14, 'min_samples_split': 137, 'min_samples_leaf': 51, 'criterion': 'gini'}.
Trial 6869 finished with value: 0.717391304347826 and parameters: {'n_estimators': 269, 'max_depth': 10, 'min_samples_split': 25, 'min_samples_leaf': 59, 'criterion': 'entropy'}.
Trial 6870 finished with value: 0.6413043478260869 and parameters: {'n_estimators': 962, 'max_depth': 5, 'min_samples_split': 31, 'min_samples_leaf': 57, 'criterion': 'gini'}.
Trial 6871 finished with value: 0.6847826086956522 and parameters: {'n_estimators': 238, 'max_depth': 12, 'min_samples_split': 35, 'min_samples_leaf': 76, 'criterion': 'entropy'}.
Trial 6872 finished with value: 0.6956521739130435 and parameters: {'n_estimators': 786, 'max_depth': 7, 'min_samples_split': 28, 'min_samples_leaf': 60, 'criterion': 'gini'}.
Trial 6873 finished with value: 0.6847826086956522 and parameters: {'n_estimators': 184, 'max_depth': 10, 'min_samples_split': 38, 'min_samples_leaf': 71, 'criterion': 'entropy'}.
Trial 6874 finished with value: 0.7065217391304348 and parameters: {'n_estimators': 314, 'max_depth': 13, 'min_samples_split': 23, 'min_samples_leaf': 63, 'criterion': 'entropy'}.
Trial 6875 finished with value: 0.6956521739130435 and parameters: {'n_estimators': 294, 'max_depth': 9, 'min_samples_split': 132, 'min_samples_leaf': 67, 'criterion': 'gini'}.
Trial 6876 finished with value: 0.6847826086956522 and parameters: {'n_estimators': 253, 'max_depth': 15, 'min_samples_split': 33, 'min_samples_leaf': 58, 'criterion': 'entropy'}.
Trial 6877 finished with value: 0.7065217391304348 and parameters: {'n_estimators': 751, 'max_depth': 11, 'min_samples_split': 144, 'min_samples_leaf': 55, 'criterion': 'gini'}.
Trial 6878 finished with value: 0.6847826086956522 and parameters: {'n_estimators': 263, 'max_depth': 7, 'min_samples_split': 43, 'min_samples_leaf': 61, 'criterion': 'entropy'}.
Trial 6879 finished with value: 0.7065217391304348 and parameters: {'n_estimators': 278, 'max_depth': 13, 'min_samples_split': 137, 'min_samples_leaf': 73, 'criterion': 'gini'}.
Trial 6880 finished with value: 0.6847826086956522 and parameters: {'n_estimators': 762, 'max_depth': 9, 'min_samples_split': 19, 'min_samples_leaf': 53, 'criterion': 'entropy'}.
Trial 6881 finished with value: 0.7065217391304348 and parameters: {'n_estimators': 344, 'max_depth': 11, 'min_samples_split': 126, 'min_samples_leaf': 69, 'criterion': 'gini'}.
Trial 6882 finished with value: 0.717391304347826 and parameters: {'n_estimators': 673, 'max_depth': 8, 'min_samples_split': 28, 'min_samples_leaf': 56, 'criterion': 'entropy'}.
Trial 6883 finished with value: 0.6847826086956522 and parameters: {'n_estimators': 299, 'max_depth': 17, 'min_samples_split': 50, 'min_samples_leaf': 59, 'criterion': 'entropy'}.
Trial 6884 finished with value: 0.6304347826086957 and parameters: {'n_estimators': 210, 'max_depth': 5, 'min_samples_split': 11, 'min_samples_leaf': 62, 'criterion': 'gini'}.
Trial 6885 finished with value: 0.7065217391304348 and parameters: {'n_estimators': 895, 'max_depth': 14, 'min_samples_split': 33, 'min_samples_leaf': 65, 'criterion': 'entropy'}.
Trial 6886 finished with value: 0.6956521739130435 and parameters: {'n_estimators': 808, 'max_depth': 12, 'min_samples_split': 37, 'min_samples_leaf': 57, 'criterion': 'gini'}.
Trial 6887 finished with value: 0.6956521739130435 and parameters: {'n_estimators': 779, 'max_depth': 10, 'min_samples_split': 30, 'min_samples_leaf': 60, 'criterion': 'entropy'}.
Trial 6888 finished with value: 0.6413043478260869 and parameters: {'n_estimators': 323, 'max_depth': 7, 'min_samples_split': 23, 'min_samples_leaf': 52, 'criterion': 'gini'}.
Trial 6889 finished with value: 0.7282608695652174 and parameters: {'n_estimators': 236, 'max_depth': 9, 'min_samples_split': 114, 'min_samples_leaf': 57, 'criterion': 'entropy'}.
Trial 6890 finished with value: 0.7065217391304348 and parameters: {'n_estimators': 718, 'max_depth': 12, 'min_samples_split': 140, 'min_samples_leaf': 54, 'criterion': 'gini'}.
Trial 6891 finished with value: 0.6739130434782609 and parameters: {'n_estimators': 274, 'max_depth': 15, 'min_samples_split': 44, 'min_samples_leaf': 75, 'criterion': 'entropy'}.
Trial 6892 finished with value: 0.6847826086956522 and parameters: {'n_estimators': 247, 'max_depth': 19, 'min_samples_split': 122, 'min_samples_leaf': 61, 'criterion': 'gini'}.
Trial 6893 finished with value: 0.717391304347826 and parameters: {'n_estimators': 305, 'max_depth': 10, 'min_samples_split': 15, 'min_samples_leaf': 59, 'criterion': 'entropy'}.
Trial 6894 finished with value: 0.6956521739130435 and parameters: {'n_estimators': 284, 'max_depth': 7, 'min_samples_split': 40, 'min_samples_leaf': 71, 'criterion': 'entropy'}.
Trial 6895 finished with value: 0.7065217391304348 and parameters: {'n_estimators': 263, 'max_depth': 13, 'min_samples_split': 26, 'min_samples_leaf': 63, 'criterion': 'gini'}.
Trial 6896 finished with value: 0.717391304347826 and parameters: {'n_estimators': 134, 'max_depth': 11, 'min_samples_split': 34, 'min_samples_leaf': 55, 'criterion': 'entropy'}.
Trial 6897 finished with value: 0.6847826086956522 and parameters: {'n_estimators': 730, 'max_depth': 8, 'min_samples_split': 130, 'min_samples_leaf': 58, 'criterion': 'gini'}.
Trial 6898 finished with value: 0.6630434782608695 and parameters: {'n_estimators': 317, 'max_depth': 16, 'min_samples_split': 108, 'min_samples_leaf': 73, 'criterion': 'entropy'}.
Trial 6899 finished with value: 0.6739130434782609 and parameters: {'n_estimators': 294, 'max_depth': 6, 'min_samples_split': 144, 'min_samples_leaf': 67, 'criterion': 'gini'}.
Trial 6900 finished with value: 0.717391304347826 and parameters: {'n_estimators': 274, 'max_depth': 9, 'min_samples_split': 30, 'min_samples_leaf': 61, 'criterion': 'entropy'}.
Trial 6901 finished with value: 0.7065217391304348 and parameters: {'n_estimators': 342, 'max_depth': 12, 'min_samples_split': 36, 'min_samples_leaf': 56, 'criterion': 'gini'}.
Trial 6902 finished with value: 0.6630434782608695 and parameters: {'n_estimators': 761, 'max_depth': 68, 'min_samples_split': 135, 'min_samples_leaf': 78, 'criterion': 'entropy'}.
Trial 6903 finished with value: 0.7065217391304348 and parameters: {'n_estimators': 445, 'max_depth': 14, 'min_samples_split': 20, 'min_samples_leaf': 64, 'criterion': 'entropy'}.
Trial 6904 finished with value: 0.717391304347826 and parameters: {'n_estimators': 227, 'max_depth': 10, 'min_samples_split': 26, 'min_samples_leaf': 58, 'criterion': 'gini'}.
Trial 6905 finished with value: 0.6956521739130435 and parameters: {'n_estimators': 248, 'max_depth': 8, 'min_samples_split': 41, 'min_samples_leaf': 70, 'criterion': 'entropy'}.
Trial 6906 finished with value: 0.6413043478260869 and parameters: {'n_estimators': 368, 'max_depth': 5, 'min_samples_split': 33, 'min_samples_leaf': 53, 'criterion': 'gini'}.
Trial 6907 finished with value: 0.7282608695652174 and parameters: {'n_estimators': 292, 'max_depth': 11, 'min_samples_split': 63, 'min_samples_leaf': 60, 'criterion': 'entropy'}.
Trial 6908 finished with value: 0.6847826086956522 and parameters: {'n_estimators': 262, 'max_depth': 34, 'min_samples_split': 30, 'min_samples_leaf': 83, 'criterion': 'gini'}.
Trial 6909 finished with value: 0.7065217391304348 and parameters: {'n_estimators': 781, 'max_depth': 13, 'min_samples_split': 89, 'min_samples_leaf': 56, 'criterion': 'entropy'}.
Trial 6910 finished with value: 0.7065217391304348 and parameters: {'n_estimators': 116, 'max_depth': 9, 'min_samples_split': 120, 'min_samples_leaf': 51, 'criterion': 'gini'}.
Trial 6911 finished with value: 0.7065217391304348 and parameters: {'n_estimators': 743, 'max_depth': 16, 'min_samples_split': 139, 'min_samples_leaf': 62, 'criterion': 'entropy'}.
Trial 6912 finished with value: 0.6847826086956522 and parameters: {'n_estimators': 308, 'max_depth': 46, 'min_samples_split': 47, 'min_samples_leaf': 59, 'criterion': 'entropy'}.
Trial 6913 finished with value: 0.6956521739130435 and parameters: {'n_estimators': 580, 'max_depth': 11, 'min_samples_split': 36, 'min_samples_leaf': 75, 'criterion': 'gini'}.
Trial 6914 finished with value: 0.6630434782608695 and parameters: {'n_estimators': 281, 'max_depth': 7, 'min_samples_split': 26, 'min_samples_leaf': 66, 'criterion': 'entropy'}.
Trial 6915 finished with value: 0.6739130434782609 and parameters: {'n_estimators': 164, 'max_depth': 14, 'min_samples_split': 127, 'min_samples_leaf': 54, 'criterion': 'gini'}.
Trial 6916 finished with value: 0.7282608695652174 and parameters: {'n_estimators': 327, 'max_depth': 9, 'min_samples_split': 23, 'min_samples_leaf': 57, 'criterion': 'entropy'}.
Trial 6917 finished with value: 0.6956521739130435 and parameters: {'n_estimators': 804, 'max_depth': 12, 'min_samples_split': 144, 'min_samples_leaf': 68, 'criterion': 'gini'}.
Trial 6918 finished with value: 0.6739130434782609 and parameters: {'n_estimators': 261, 'max_depth': 7, 'min_samples_split': 39, 'min_samples_leaf': 59, 'criterion': 'entropy'}.
Trial 6919 finished with value: 0.6847826086956522 and parameters: {'n_estimators': 984, 'max_depth': 18, 'min_samples_split': 31, 'min_samples_leaf': 64, 'criterion': 'gini'}.
Trial 6920 finished with value: 0.7282608695652174 and parameters: {'n_estimators': 285, 'max_depth': 11, 'min_samples_split': 19, 'min_samples_leaf': 61, 'criterion': 'entropy'}.
Trial 6921 finished with value: 0.6956521739130435 and parameters: {'n_estimators': 940, 'max_depth': 9, 'min_samples_split': 102, 'min_samples_leaf': 57, 'criterion': 'entropy'}.
Trial 6922 finished with value: 0.6739130434782609 and parameters: {'n_estimators': 241, 'max_depth': 14, 'min_samples_split': 34, 'min_samples_leaf': 72, 'criterion': 'gini'}.
Trial 6923 finished with value: 0.6413043478260869 and parameters: {'n_estimators': 208, 'max_depth': 5, 'min_samples_split': 28, 'min_samples_leaf': 55, 'criterion': 'entropy'}.
Trial 6924 finished with value: 0.7065217391304348 and parameters: {'n_estimators': 687, 'max_depth': 10, 'min_samples_split': 115, 'min_samples_leaf': 62, 'criterion': 'gini'}.
Trial 6925 finished with value: 0.6847826086956522 and parameters: {'n_estimators': 300, 'max_depth': 24, 'min_samples_split': 38, 'min_samples_leaf': 59, 'criterion': 'entropy'}.
Trial 6926 finished with value: 0.7065217391304348 and parameters: {'n_estimators': 270, 'max_depth': 12, 'min_samples_split': 42, 'min_samples_leaf': 69, 'criterion': 'gini'}.
Trial 6927 finished with value: 0.7065217391304348 and parameters: {'n_estimators': 310, 'max_depth': 8, 'min_samples_split': 132, 'min_samples_leaf': 57, 'criterion': 'entropy'}.
Trial 6928 finished with value: 0.6847826086956522 and parameters: {'n_estimators': 755, 'max_depth': 15, 'min_samples_split': 15, 'min_samples_leaf': 53, 'criterion': 'gini'}.
Trial 6929 finished with value: 0.6956521739130435 and parameters: {'n_estimators': 248, 'max_depth': 7, 'min_samples_split': 137, 'min_samples_leaf': 60, 'criterion': 'entropy'}.
Trial 6930 finished with value: 0.6847826086956522 and parameters: {'n_estimators': 229, 'max_depth': 13, 'min_samples_split': 32, 'min_samples_leaf': 74, 'criterion': 'entropy'}.
Trial 6931 finished with value: 0.7282608695652174 and parameters: {'n_estimators': 721, 'max_depth': 10, 'min_samples_split': 21, 'min_samples_leaf': 55, 'criterion': 'gini'}.
Trial 6932 finished with value: 0.717391304347826 and parameters: {'n_estimators': 276, 'max_depth': 11, 'min_samples_split': 145, 'min_samples_leaf': 65, 'criterion': 'entropy'}.
Trial 6933 finished with value: 0.6847826086956522 and parameters: {'n_estimators': 788, 'max_depth': 6, 'min_samples_split': 24, 'min_samples_leaf': 58, 'criterion': 'gini'}.
Trial 6934 finished with value: 0.717391304347826 and parameters: {'n_estimators': 254, 'max_depth': 9, 'min_samples_split': 37, 'min_samples_leaf': 62, 'criterion': 'entropy'}.
Trial 6935 finished with value: 0.6739130434782609 and parameters: {'n_estimators': 323, 'max_depth': 13, 'min_samples_split': 30, 'min_samples_leaf': 76, 'criterion': 'gini'}.
Trial 6936 finished with value: 0.6847826086956522 and parameters: {'n_estimators': 287, 'max_depth': 17, 'min_samples_split': 46, 'min_samples_leaf': 71, 'criterion': 'entropy'}.
