Trial 9639 finished with value: 0.6847826086956522 and parameters: {'n_estimators': 260, 'max_depth': 12, 'min_samples_split': 6, 'min_samples_leaf': 59, 'criterion': 'gini'}.
Trial 9640 finished with value: 0.7065217391304348 and parameters: {'n_estimators': 287, 'max_depth': 9, 'min_samples_split': 18, 'min_samples_leaf': 52, 'criterion': 'entropy'}.
Trial 9641 finished with value: 0.6847826086956522 and parameters: {'n_estimators': 807, 'max_depth': 15, 'min_samples_split': 47, 'min_samples_leaf': 57, 'criterion': 'gini'}.
Trial 9642 finished with value: 0.7065217391304348 and parameters: {'n_estimators': 726, 'max_depth': 10, 'min_samples_split': 35, 'min_samples_leaf': 65, 'criterion': 'entropy'}.
Trial 9643 finished with value: 0.6956521739130435 and parameters: {'n_estimators': 766, 'max_depth': 13, 'min_samples_split': 100, 'min_samples_leaf': 61, 'criterion': 'entropy'}.
Trial 9644 finished with value: 0.6630434782608695 and parameters: {'n_estimators': 308, 'max_depth': 6, 'min_samples_split': 30, 'min_samples_leaf': 54, 'criterion': 'gini'}.
Trial 9645 finished with value: 0.6847826086956522 and parameters: {'n_estimators': 245, 'max_depth': 9, 'min_samples_split': 136, 'min_samples_leaf': 75, 'criterion': 'entropy'}.
Trial 9646 finished with value: 0.6847826086956522 and parameters: {'n_estimators': 277, 'max_depth': 52, 'min_samples_split': 26, 'min_samples_leaf': 63, 'criterion': 'gini'}.
Trial 9647 finished with value: 0.6847826086956522 and parameters: {'n_estimators': 333, 'max_depth': 19, 'min_samples_split': 40, 'min_samples_leaf': 59, 'criterion': 'entropy'}.
Trial 9648 finished with value: 0.717391304347826 and parameters: {'n_estimators': 259, 'max_depth': 11, 'min_samples_split': 32, 'min_samples_leaf': 57, 'criterion': 'entropy'}.
Trial 9649 finished with value: 0.6847826086956522 and parameters: {'n_estimators': 884, 'max_depth': 16, 'min_samples_split': 122, 'min_samples_leaf': 71, 'criterion': 'gini'}.
Trial 9650 finished with value: 0.6956521739130435 and parameters: {'n_estimators': 296, 'max_depth': 7, 'min_samples_split': 145, 'min_samples_leaf': 55, 'criterion': 'entropy'}.
Trial 9651 finished with value: 0.7065217391304348 and parameters: {'n_estimators': 749, 'max_depth': 13, 'min_samples_split': 13, 'min_samples_leaf': 50, 'criterion': 'gini'}.
Trial 9652 finished with value: 0.7065217391304348 and parameters: {'n_estimators': 228, 'max_depth': 10, 'min_samples_split': 23, 'min_samples_leaf': 61, 'criterion': 'entropy'}.
Trial 9653 finished with value: 0.6413043478260869 and parameters: {'n_estimators': 550, 'max_depth': 5, 'min_samples_split': 67, 'min_samples_leaf': 58, 'criterion': 'entropy'}.
Trial 9654 finished with value: 0.6739130434782609 and parameters: {'n_estimators': 315, 'max_depth': 72, 'min_samples_split': 36, 'min_samples_leaf': 53, 'criterion': 'gini'}.
Trial 9655 finished with value: 0.6956521739130435 and parameters: {'n_estimators': 969, 'max_depth': 12, 'min_samples_split': 132, 'min_samples_leaf': 73, 'criterion': 'entropy'}.
Trial 9656 finished with value: 0.717391304347826 and parameters: {'n_estimators': 272, 'max_depth': 8, 'min_samples_split': 31, 'min_samples_leaf': 60, 'criterion': 'gini'}.
Trial 9657 finished with value: 0.6956521739130435 and parameters: {'n_estimators': 790, 'max_depth': 15, 'min_samples_split': 21, 'min_samples_leaf': 56, 'criterion': 'entropy'}.
Trial 9658 finished with value: 0.6956521739130435 and parameters: {'n_estimators': 292, 'max_depth': 10, 'min_samples_split': 167, 'min_samples_leaf': 69, 'criterion': 'gini'}.
Trial 9659 finished with value: 0.6956521739130435 and parameters: {'n_estimators': 734, 'max_depth': 13, 'min_samples_split': 44, 'min_samples_leaf': 63, 'criterion': 'entropy'}.
Trial 9660 finished with value: 0.7282608695652174 and parameters: {'n_estimators': 351, 'max_depth': 8, 'min_samples_split': 116, 'min_samples_leaf': 58, 'criterion': 'entropy'}.
Trial 9661 finished with value: 0.7065217391304348 and parameters: {'n_estimators': 256, 'max_depth': 11, 'min_samples_split': 28, 'min_samples_leaf': 60, 'criterion': 'gini'}.
Trial 9662 finished with value: 0.6304347826086957 and parameters: {'n_estimators': 100, 'max_depth': 81, 'min_samples_split': 90, 'min_samples_leaf': 66, 'criterion': 'entropy'}.
Trial 9663 finished with value: 0.6739130434782609 and parameters: {'n_estimators': 279, 'max_depth': 17, 'min_samples_split': 38, 'min_samples_leaf': 56, 'criterion': 'gini'}.
Trial 9664 finished with value: 0.6847826086956522 and parameters: {'n_estimators': 235, 'max_depth': 7, 'min_samples_split': 34, 'min_samples_leaf': 62, 'criterion': 'entropy'}.
Trial 9665 finished with value: 0.7065217391304348 and parameters: {'n_estimators': 311, 'max_depth': 14, 'min_samples_split': 149, 'min_samples_leaf': 53, 'criterion': 'entropy'}.
Trial 9666 finished with value: 0.7065217391304348 and parameters: {'n_estimators': 700, 'max_depth': 9, 'min_samples_split': 42, 'min_samples_leaf': 58, 'criterion': 'gini'}.
Trial 9667 finished with value: 0.6739130434782609 and parameters: {'n_estimators': 137, 'max_depth': 12, 'min_samples_split': 111, 'min_samples_leaf': 60, 'criterion': 'entropy'}.
Trial 9668 finished with value: 0.6956521739130435 and parameters: {'n_estimators': 760, 'max_depth': 10, 'min_samples_split': 16, 'min_samples_leaf': 74, 'criterion': 'gini'}.
Trial 9669 finished with value: 0.6413043478260869 and parameters: {'n_estimators': 266, 'max_depth': 5, 'min_samples_split': 142, 'min_samples_leaf': 56, 'criterion': 'entropy'}.
Trial 9670 finished with value: 0.6956521739130435 and parameters: {'n_estimators': 293, 'max_depth': 7, 'min_samples_split': 27, 'min_samples_leaf': 64, 'criterion': 'entropy'}.
Trial 9671 finished with value: 0.6739130434782609 and parameters: {'n_estimators': 816, 'max_depth': 14, 'min_samples_split': 125, 'min_samples_leaf': 88, 'criterion': 'gini'}.
Trial 9672 finished with value: 0.6847826086956522 and parameters: {'n_estimators': 851, 'max_depth': 29, 'min_samples_split': 34, 'min_samples_leaf': 51, 'criterion': 'entropy'}.
Trial 9673 finished with value: 0.6956521739130435 and parameters: {'n_estimators': 202, 'max_depth': 11, 'min_samples_split': 155, 'min_samples_leaf': 77, 'criterion': 'gini'}.
Trial 9674 finished with value: 0.6956521739130435 and parameters: {'n_estimators': 776, 'max_depth': 12, 'min_samples_split': 24, 'min_samples_leaf': 59, 'criterion': 'entropy'}.
Trial 9675 finished with value: 0.7065217391304348 and parameters: {'n_estimators': 246, 'max_depth': 9, 'min_samples_split': 51, 'min_samples_leaf': 54, 'criterion': 'entropy'}.
Trial 9676 finished with value: 0.6956521739130435 and parameters: {'n_estimators': 323, 'max_depth': 9, 'min_samples_split': 138, 'min_samples_leaf': 62, 'criterion': 'gini'}.
Trial 9677 finished with value: 0.6847826086956522 and parameters: {'n_estimators': 937, 'max_depth': 15, 'min_samples_split': 39, 'min_samples_leaf': 71, 'criterion': 'entropy'}.
Trial 9678 finished with value: 0.6739130434782609 and parameters: {'n_estimators': 638, 'max_depth': 7, 'min_samples_split': 33, 'min_samples_leaf': 56, 'criterion': 'gini'}.
Trial 9679 finished with value: 0.717391304347826 and parameters: {'n_estimators': 291, 'max_depth': 12, 'min_samples_split': 120, 'min_samples_leaf': 48, 'criterion': 'entropy'}.
Trial 9680 finished with value: 0.6956521739130435 and parameters: {'n_estimators': 713, 'max_depth': 10, 'min_samples_split': 29, 'min_samples_leaf': 67, 'criterion': 'gini'}.
Trial 9681 finished with value: 0.7065217391304348 and parameters: {'n_estimators': 274, 'max_depth': 17, 'min_samples_split': 45, 'min_samples_leaf': 58, 'criterion': 'entropy'}.
Trial 9682 finished with value: 0.7065217391304348 and parameters: {'n_estimators': 308, 'max_depth': 13, 'min_samples_split': 38, 'min_samples_leaf': 61, 'criterion': 'entropy'}.
Trial 9683 finished with value: 0.6847826086956522 and parameters: {'n_estimators': 258, 'max_depth': 6, 'min_samples_split': 21, 'min_samples_leaf': 57, 'criterion': 'gini'}.
Trial 9684 finished with value: 0.6956521739130435 and parameters: {'n_estimators': 341, 'max_depth': 9, 'min_samples_split': 129, 'min_samples_leaf': 54, 'criterion': 'entropy'}.
Trial 9685 finished with value: 0.7065217391304348 and parameters: {'n_estimators': 225, 'max_depth': 11, 'min_samples_split': 31, 'min_samples_leaf': 65, 'criterion': 'gini'}.
Trial 9686 finished with value: 0.6956521739130435 and parameters: {'n_estimators': 753, 'max_depth': 8, 'min_samples_split': 135, 'min_samples_leaf': 59, 'criterion': 'entropy'}.
Trial 9687 finished with value: 0.6847826086956522 and parameters: {'n_estimators': 278, 'max_depth': 14, 'min_samples_split': 25, 'min_samples_leaf': 69, 'criterion': 'entropy'}.
Trial 9688 finished with value: 0.7065217391304348 and parameters: {'n_estimators': 298, 'max_depth': 11, 'min_samples_split': 35, 'min_samples_leaf': 62, 'criterion': 'gini'}.
Trial 9689 finished with value: 0.6413043478260869 and parameters: {'n_estimators': 797, 'max_depth': 5, 'min_samples_split': 42, 'min_samples_leaf': 57, 'criterion': 'entropy'}.
Trial 9690 finished with value: 0.6847826086956522 and parameters: {'n_estimators': 734, 'max_depth': 20, 'min_samples_split': 145, 'min_samples_leaf': 73, 'criterion': 'gini'}.
Trial 9691 finished with value: 0.717391304347826 and parameters: {'n_estimators': 246, 'max_depth': 8, 'min_samples_split': 29, 'min_samples_leaf': 60, 'criterion': 'entropy'}.
Trial 9692 finished with value: 0.6956521739130435 and parameters: {'n_estimators': 327, 'max_depth': 13, 'min_samples_split': 18, 'min_samples_leaf': 55, 'criterion': 'entropy'}.
Trial 9693 finished with value: 0.6739130434782609 and parameters: {'n_estimators': 286, 'max_depth': 16, 'min_samples_split': 39, 'min_samples_leaf': 53, 'criterion': 'gini'}.
Trial 9694 finished with value: 0.717391304347826 and parameters: {'n_estimators': 264, 'max_depth': 10, 'min_samples_split': 34, 'min_samples_leaf': 63, 'criterion': 'entropy'}.
Trial 9695 finished with value: 0.6956521739130435 and parameters: {'n_estimators': 774, 'max_depth': 7, 'min_samples_split': 25, 'min_samples_leaf': 59, 'criterion': 'gini'}.
Trial 9696 finished with value: 0.6956521739130435 and parameters: {'n_estimators': 471, 'max_depth': 12, 'min_samples_split': 48, 'min_samples_leaf': 57, 'criterion': 'entropy'}.
Trial 9697 finished with value: 0.717391304347826 and parameters: {'n_estimators': 301, 'max_depth': 9, 'min_samples_split': 30, 'min_samples_leaf': 61, 'criterion': 'gini'}.
Trial 9698 finished with value: 0.6847826086956522 and parameters: {'n_estimators': 273, 'max_depth': 15, 'min_samples_split': 140, 'min_samples_leaf': 55, 'criterion': 'entropy'}.
Trial 9699 finished with value: 0.6956521739130435 and parameters: {'n_estimators': 250, 'max_depth': 11, 'min_samples_split': 150, 'min_samples_leaf': 51, 'criterion': 'entropy'}.
Trial 9700 finished with value: 0.6956521739130435 and parameters: {'n_estimators': 154, 'max_depth': 9, 'min_samples_split': 37, 'min_samples_leaf': 76, 'criterion': 'gini'}.
Trial 9701 finished with value: 0.6956521739130435 and parameters: {'n_estimators': 312, 'max_depth': 13, 'min_samples_split': 21, 'min_samples_leaf': 58, 'criterion': 'entropy'}.
Trial 9702 finished with value: 0.6739130434782609 and parameters: {'n_estimators': 289, 'max_depth': 33, 'min_samples_split': 104, 'min_samples_leaf': 65, 'criterion': 'gini'}.
Trial 9703 finished with value: 0.6739130434782609 and parameters: {'n_estimators': 364, 'max_depth': 6, 'min_samples_split': 124, 'min_samples_leaf': 70, 'criterion': 'entropy'}.
Trial 9704 finished with value: 0.6630434782608695 and parameters: {'n_estimators': 675, 'max_depth': 69, 'min_samples_split': 43, 'min_samples_leaf': 60, 'criterion': 'entropy'}.
Trial 9705 finished with value: 0.7065217391304348 and parameters: {'n_estimators': 236, 'max_depth': 11, 'min_samples_split': 27, 'min_samples_leaf': 57, 'criterion': 'gini'}.
Trial 9706 finished with value: 0.6956521739130435 and parameters: {'n_estimators': 214, 'max_depth': 8, 'min_samples_split': 9, 'min_samples_leaf': 55, 'criterion': 'entropy'}.
Trial 9707 finished with value: 0.6413043478260869 and parameters: {'n_estimators': 717, 'max_depth': 36, 'min_samples_split': 117, 'min_samples_leaf': 13, 'criterion': 'gini'}.
Trial 9708 finished with value: 0.6630434782608695 and parameters: {'n_estimators': 750, 'max_depth': 14, 'min_samples_split': 133, 'min_samples_leaf': 80, 'criterion': 'entropy'}.
Trial 9709 finished with value: 0.6847826086956522 and parameters: {'n_estimators': 275, 'max_depth': 18, 'min_samples_split': 57, 'min_samples_leaf': 62, 'criterion': 'entropy'}.
Trial 9710 finished with value: 0.7065217391304348 and parameters: {'n_estimators': 322, 'max_depth': 10, 'min_samples_split': 32, 'min_samples_leaf': 72, 'criterion': 'gini'}.
Trial 9711 finished with value: 0.7065217391304348 and parameters: {'n_estimators': 254, 'max_depth': 12, 'min_samples_split': 36, 'min_samples_leaf': 52, 'criterion': 'entropy'}.
Trial 9712 finished with value: 0.6956521739130435 and parameters: {'n_estimators': 790, 'max_depth': 7, 'min_samples_split': 15, 'min_samples_leaf': 59, 'criterion': 'gini'}.
Trial 9713 finished with value: 0.6956521739130435 and parameters: {'n_estimators': 387, 'max_depth': 9, 'min_samples_split': 146, 'min_samples_leaf': 64, 'criterion': 'entropy'}.
Trial 9714 finished with value: 0.6739130434782609 and parameters: {'n_estimators': 911, 'max_depth': 15, 'min_samples_split': 25, 'min_samples_leaf': 56, 'criterion': 'gini'}.
Trial 9715 finished with value: 0.6739130434782609 and parameters: {'n_estimators': 286, 'max_depth': 5, 'min_samples_split': 40, 'min_samples_leaf': 74, 'criterion': 'entropy'}.
Trial 9716 finished with value: 0.717391304347826 and parameters: {'n_estimators': 342, 'max_depth': 11, 'min_samples_split': 73, 'min_samples_leaf': 61, 'criterion': 'entropy'}.
Trial 9717 finished with value: 0.717391304347826 and parameters: {'n_estimators': 820, 'max_depth': 13, 'min_samples_split': 29, 'min_samples_leaf': 58, 'criterion': 'gini'}.
Trial 9718 finished with value: 0.6956521739130435 and parameters: {'n_estimators': 307, 'max_depth': 7, 'min_samples_split': 32, 'min_samples_leaf': 68, 'criterion': 'entropy'}.
Trial 9719 finished with value: 0.7282608695652174 and parameters: {'n_estimators': 177, 'max_depth': 10, 'min_samples_split': 113, 'min_samples_leaf': 55, 'criterion': 'gini'}.
Trial 9720 finished with value: 0.6847826086956522 and parameters: {'n_estimators': 262, 'max_depth': 8, 'min_samples_split': 141, 'min_samples_leaf': 53, 'criterion': 'entropy'}.
Trial 9721 finished with value: 0.6956521739130435 and parameters: {'n_estimators': 766, 'max_depth': 12, 'min_samples_split': 20, 'min_samples_leaf': 60, 'criterion': 'entropy'}.
Trial 9722 finished with value: 0.6847826086956522 and parameters: {'n_estimators': 271, 'max_depth': 15, 'min_samples_split': 37, 'min_samples_leaf': 57, 'criterion': 'gini'}.
Trial 9723 finished with value: 0.6956521739130435 and parameters: {'n_estimators': 743, 'max_depth': 10, 'min_samples_split': 46, 'min_samples_leaf': 67, 'criterion': 'entropy'}.
Trial 9724 finished with value: 0.6956521739130435 and parameters: {'n_estimators': 298, 'max_depth': 13, 'min_samples_split': 34, 'min_samples_leaf': 63, 'criterion': 'gini'}.
Trial 9725 finished with value: 0.6847826086956522 and parameters: {'n_estimators': 864, 'max_depth': 17, 'min_samples_split': 130, 'min_samples_leaf': 59, 'criterion': 'entropy'}.
Trial 9726 finished with value: 0.7282608695652174 and parameters: {'n_estimators': 240, 'max_depth': 8, 'min_samples_split': 25, 'min_samples_leaf': 56, 'criterion': 'entropy'}.
Trial 9727 finished with value: 0.7282608695652174 and parameters: {'n_estimators': 331, 'max_depth': 10, 'min_samples_split': 41, 'min_samples_leaf': 61, 'criterion': 'gini'}.
Trial 9728 finished with value: 0.6630434782608695 and parameters: {'n_estimators': 419, 'max_depth': 6, 'min_samples_split': 137, 'min_samples_leaf': 42, 'criterion': 'entropy'}.
Trial 9729 finished with value: 0.6956521739130435 and parameters: {'n_estimators': 284, 'max_depth': 12, 'min_samples_split': 30, 'min_samples_leaf': 71, 'criterion': 'gini'}.
Trial 9730 finished with value: 0.6956521739130435 and parameters: {'n_estimators': 732, 'max_depth': 14, 'min_samples_split': 122, 'min_samples_leaf': 54, 'criterion': 'entropy'}.
Trial 9731 finished with value: 0.717391304347826 and parameters: {'n_estimators': 258, 'max_depth': 10, 'min_samples_split': 37, 'min_samples_leaf': 50, 'criterion': 'entropy'}.
Trial 9732 finished with value: 0.7065217391304348 and parameters: {'n_estimators': 307, 'max_depth': 8, 'min_samples_split': 27, 'min_samples_leaf': 75, 'criterion': 'gini'}.
Trial 9733 finished with value: 0.6521739130434783 and parameters: {'n_estimators': 222, 'max_depth': 5, 'min_samples_split': 159, 'min_samples_leaf': 58, 'criterion': 'entropy'}.
Trial 9734 finished with value: 0.6847826086956522 and parameters: {'n_estimators': 983, 'max_depth': 11, 'min_samples_split': 22, 'min_samples_leaf': 78, 'criterion': 'gini'}.
Trial 9735 finished with value: 0.6956521739130435 and parameters: {'n_estimators': 781, 'max_depth': 9, 'min_samples_split': 142, 'min_samples_leaf': 63, 'criterion': 'entropy'}.
Trial 9736 finished with value: 0.7065217391304348 and parameters: {'n_estimators': 279, 'max_depth': 7, 'min_samples_split': 94, 'min_samples_leaf': 59, 'criterion': 'gini'}.
Trial 9737 finished with value: 0.6847826086956522 and parameters: {'n_estimators': 127, 'max_depth': 16, 'min_samples_split': 32, 'min_samples_leaf': 57, 'criterion': 'entropy'}.
Trial 9738 finished with value: 0.6847826086956522 and parameters: {'n_estimators': 321, 'max_depth': 13, 'min_samples_split': 43, 'min_samples_leaf': 66, 'criterion': 'entropy'}.
Trial 9739 finished with value: 0.6847826086956522 and parameters: {'n_estimators': 759, 'max_depth': 88, 'min_samples_split': 52, 'min_samples_leaf': 61, 'criterion': 'gini'}.
Trial 9740 finished with value: 0.7282608695652174 and parameters: {'n_estimators': 264, 'max_depth': 11, 'min_samples_split': 35, 'min_samples_leaf': 53, 'criterion': 'entropy'}.
Trial 9741 finished with value: 0.6956521739130435 and parameters: {'n_estimators': 296, 'max_depth': 9, 'min_samples_split': 127, 'min_samples_leaf': 55, 'criterion': 'gini'}.
Trial 9742 finished with value: 0.6847826086956522 and parameters: {'n_estimators': 526, 'max_depth': 14, 'min_samples_split': 18, 'min_samples_leaf': 59, 'criterion': 'entropy'}.
Trial 9743 finished with value: 0.6847826086956522 and parameters: {'n_estimators': 242, 'max_depth': 7, 'min_samples_split': 107, 'min_samples_leaf': 57, 'criterion': 'entropy'}.
Trial 9744 finished with value: 0.6521739130434783 and parameters: {'n_estimators': 453, 'max_depth': 50, 'min_samples_split': 12, 'min_samples_leaf': 64, 'criterion': 'gini'}.
Trial 9745 finished with value: 0.6847826086956522 and parameters: {'n_estimators': 616, 'max_depth': 55, 'min_samples_split': 147, 'min_samples_leaf': 73, 'criterion': 'entropy'}.
Trial 9746 finished with value: 0.7065217391304348 and parameters: {'n_estimators': 701, 'max_depth': 12, 'min_samples_split': 40, 'min_samples_leaf': 62, 'criterion': 'gini'}.
Trial 9747 finished with value: 0.6739130434782609 and parameters: {'n_estimators': 800, 'max_depth': 66, 'min_samples_split': 29, 'min_samples_leaf': 69, 'criterion': 'entropy'}.
Trial 9748 finished with value: 0.6847826086956522 and parameters: {'n_estimators': 201, 'max_depth': 9, 'min_samples_split': 134, 'min_samples_leaf': 60, 'criterion': 'entropy'}.
Trial 9749 finished with value: 0.717391304347826 and parameters: {'n_estimators': 892, 'max_depth': 11, 'min_samples_split': 24, 'min_samples_leaf': 48, 'criterion': 'gini'}.
Trial 9750 finished with value: 0.6739130434782609 and parameters: {'n_estimators': 279, 'max_depth': 16, 'min_samples_split': 47, 'min_samples_leaf': 55, 'criterion': 'entropy'}.
Trial 9751 finished with value: 0.6413043478260869 and parameters: {'n_estimators': 352, 'max_depth': 5, 'min_samples_split': 33, 'min_samples_leaf': 58, 'criterion': 'gini'}.
Trial 9752 finished with value: 0.6956521739130435 and parameters: {'n_estimators': 725, 'max_depth': 13, 'min_samples_split': 37, 'min_samples_leaf': 52, 'criterion': 'entropy'}.
Trial 9753 finished with value: 0.7065217391304348 and parameters: {'n_estimators': 306, 'max_depth': 9, 'min_samples_split': 27, 'min_samples_leaf': 60, 'criterion': 'gini'}.
Trial 9754 finished with value: 0.6521739130434783 and parameters: {'n_estimators': 261, 'max_depth': 7, 'min_samples_split': 119, 'min_samples_leaf': 57, 'criterion': 'entropy'}.
Trial 9755 finished with value: 0.7065217391304348 and parameters: {'n_estimators': 290, 'max_depth': 11, 'min_samples_split': 139, 'min_samples_leaf': 54, 'criterion': 'entropy'}.
Trial 9756 finished with value: 0.6630434782608695 and parameters: {'n_estimators': 229, 'max_depth': 18, 'min_samples_split': 153, 'min_samples_leaf': 72, 'criterion': 'gini'}.
Trial 9757 finished with value: 0.7065217391304348 and parameters: {'n_estimators': 247, 'max_depth': 14, 'min_samples_split': 31, 'min_samples_leaf': 62, 'criterion': 'entropy'}.
Trial 9758 finished with value: 0.6630434782608695 and parameters: {'n_estimators': 268, 'max_depth': 22, 'min_samples_split': 43, 'min_samples_leaf': 56, 'criterion': 'gini'}.
Trial 9759 finished with value: 0.6739130434782609 and parameters: {'n_estimators': 320, 'max_depth': 9, 'min_samples_split': 21, 'min_samples_leaf': 65, 'criterion': 'entropy'}.
Trial 9760 finished with value: 0.6956521739130435 and parameters: {'n_estimators': 779, 'max_depth': 12, 'min_samples_split': 36, 'min_samples_leaf': 75, 'criterion': 'entropy'}.
Trial 9761 finished with value: 0.6956521739130435 and parameters: {'n_estimators': 845, 'max_depth': 7, 'min_samples_split': 144, 'min_samples_leaf': 59, 'criterion': 'gini'}.
