Trial 1656 finished with value: 0.717391304347826 and parameters: {'n_estimators': 805, 'max_depth': 10, 'min_samples_split': 26, 'min_samples_leaf': 57, 'criterion': 'entropy'}.
Trial 1657 finished with value: 0.6521739130434783 and parameters: {'n_estimators': 507, 'max_depth': 17, 'min_samples_split': 120, 'min_samples_leaf': 50, 'criterion': 'entropy'}.
Trial 1658 finished with value: 0.6956521739130435 and parameters: {'n_estimators': 883, 'max_depth': 8, 'min_samples_split': 105, 'min_samples_leaf': 45, 'criterion': 'entropy'}.
Trial 1659 finished with value: 0.7065217391304348 and parameters: {'n_estimators': 823, 'max_depth': 12, 'min_samples_split': 37, 'min_samples_leaf': 59, 'criterion': 'entropy'}.
Trial 1660 finished with value: 0.6847826086956522 and parameters: {'n_estimators': 854, 'max_depth': 14, 'min_samples_split': 30, 'min_samples_leaf': 55, 'criterion': 'entropy'}.
Trial 1661 finished with value: 0.6956521739130435 and parameters: {'n_estimators': 910, 'max_depth': 11, 'min_samples_split': 34, 'min_samples_leaf': 52, 'criterion': 'entropy'}.
Trial 1662 finished with value: 0.7282608695652174 and parameters: {'n_estimators': 685, 'max_depth': 9, 'min_samples_split': 23, 'min_samples_leaf': 49, 'criterion': 'entropy'}.
Trial 1663 finished with value: 0.6086956521739131 and parameters: {'n_estimators': 799, 'max_depth': 7, 'min_samples_split': 44, 'min_samples_leaf': 1, 'criterion': 'entropy'}.
Trial 1664 finished with value: 0.6956521739130435 and parameters: {'n_estimators': 769, 'max_depth': 14, 'min_samples_split': 28, 'min_samples_leaf': 53, 'criterion': 'entropy'}.
Trial 1665 finished with value: 0.7065217391304348 and parameters: {'n_estimators': 538, 'max_depth': 11, 'min_samples_split': 32, 'min_samples_leaf': 51, 'criterion': 'entropy'}.
Trial 1666 finished with value: 0.717391304347826 and parameters: {'n_estimators': 745, 'max_depth': 9, 'min_samples_split': 20, 'min_samples_leaf': 48, 'criterion': 'gini'}.
Trial 1667 finished with value: 0.6956521739130435 and parameters: {'n_estimators': 815, 'max_depth': 6, 'min_samples_split': 38, 'min_samples_leaf': 66, 'criterion': 'entropy'}.
Trial 1668 finished with value: 0.7065217391304348 and parameters: {'n_estimators': 785, 'max_depth': 16, 'min_samples_split': 26, 'min_samples_leaf': 56, 'criterion': 'entropy'}.
Trial 1669 finished with value: 0.6847826086956522 and parameters: {'n_estimators': 832, 'max_depth': 58, 'min_samples_split': 33, 'min_samples_leaf': 47, 'criterion': 'entropy'}.
Trial 1670 finished with value: 0.7065217391304348 and parameters: {'n_estimators': 965, 'max_depth': 12, 'min_samples_split': 39, 'min_samples_leaf': 54, 'criterion': 'entropy'}.
Trial 1671 finished with value: 0.7065217391304348 and parameters: {'n_estimators': 797, 'max_depth': 10, 'min_samples_split': 30, 'min_samples_leaf': 43, 'criterion': 'entropy'}.
Trial 1672 finished with value: 0.717391304347826 and parameters: {'n_estimators': 848, 'max_depth': 8, 'min_samples_split': 23, 'min_samples_leaf': 58, 'criterion': 'entropy'}.
Trial 1673 finished with value: 0.7065217391304348 and parameters: {'n_estimators': 759, 'max_depth': 12, 'min_samples_split': 36, 'min_samples_leaf': 50, 'criterion': 'entropy'}.
Trial 1674 finished with value: 0.6956521739130435 and parameters: {'n_estimators': 816, 'max_depth': 14, 'min_samples_split': 115, 'min_samples_leaf': 52, 'criterion': 'entropy'}.
Trial 1675 finished with value: 0.6956521739130435 and parameters: {'n_estimators': 575, 'max_depth': 7, 'min_samples_split': 17, 'min_samples_leaf': 60, 'criterion': 'entropy'}.
Trial 1676 finished with value: 0.6086956521739131 and parameters: {'n_estimators': 836, 'max_depth': 10, 'min_samples_split': 43, 'min_samples_leaf': 15, 'criterion': 'entropy'}.
Trial 1677 finished with value: 0.6304347826086957 and parameters: {'n_estimators': 863, 'max_depth': 5, 'min_samples_split': 28, 'min_samples_leaf': 46, 'criterion': 'entropy'}.
Trial 1678 finished with value: 0.6956521739130435 and parameters: {'n_estimators': 786, 'max_depth': 13, 'min_samples_split': 111, 'min_samples_leaf': 49, 'criterion': 'entropy'}.
Trial 1679 finished with value: 0.717391304347826 and parameters: {'n_estimators': 808, 'max_depth': 9, 'min_samples_split': 25, 'min_samples_leaf': 56, 'criterion': 'entropy'}.
Trial 1680 finished with value: 0.7065217391304348 and parameters: {'n_estimators': 772, 'max_depth': 11, 'min_samples_split': 33, 'min_samples_leaf': 51, 'criterion': 'entropy'}.
Trial 1681 finished with value: 0.6739130434782609 and parameters: {'n_estimators': 730, 'max_depth': 15, 'min_samples_split': 20, 'min_samples_leaf': 54, 'criterion': 'entropy'}.
Trial 1682 finished with value: 0.6739130434782609 and parameters: {'n_estimators': 824, 'max_depth': 19, 'min_samples_split': 94, 'min_samples_leaf': 49, 'criterion': 'entropy'}.
Trial 1683 finished with value: 0.6847826086956522 and parameters: {'n_estimators': 522, 'max_depth': 8, 'min_samples_split': 13, 'min_samples_leaf': 52, 'criterion': 'entropy'}.
Trial 1684 finished with value: 0.6956521739130435 and parameters: {'n_estimators': 798, 'max_depth': 12, 'min_samples_split': 39, 'min_samples_leaf': 46, 'criterion': 'gini'}.
Trial 1685 finished with value: 0.7065217391304348 and parameters: {'n_estimators': 844, 'max_depth': 10, 'min_samples_split': 170, 'min_samples_leaf': 63, 'criterion': 'entropy'}.
Trial 1686 finished with value: 0.6956521739130435 and parameters: {'n_estimators': 888, 'max_depth': 7, 'min_samples_split': 29, 'min_samples_leaf': 57, 'criterion': 'entropy'}.
Trial 1687 finished with value: 0.717391304347826 and parameters: {'n_estimators': 560, 'max_depth': 9, 'min_samples_split': 36, 'min_samples_leaf': 54, 'criterion': 'entropy'}.
Trial 1688 finished with value: 0.717391304347826 and parameters: {'n_estimators': 756, 'max_depth': 13, 'min_samples_split': 24, 'min_samples_leaf': 50, 'criterion': 'entropy'}.
Trial 1689 finished with value: 0.6847826086956522 and parameters: {'n_estimators': 810, 'max_depth': 16, 'min_samples_split': 32, 'min_samples_leaf': 44, 'criterion': 'entropy'}.
Trial 1690 finished with value: 0.6847826086956522 and parameters: {'n_estimators': 485, 'max_depth': 11, 'min_samples_split': 28, 'min_samples_leaf': 48, 'criterion': 'entropy'}.
Trial 1691 finished with value: 0.6739130434782609 and parameters: {'n_estimators': 786, 'max_depth': 6, 'min_samples_split': 35, 'min_samples_leaf': 52, 'criterion': 'entropy'}.
Trial 1692 finished with value: 0.717391304347826 and parameters: {'n_estimators': 832, 'max_depth': 8, 'min_samples_split': 42, 'min_samples_leaf': 61, 'criterion': 'entropy'}.
Trial 1693 finished with value: 0.6956521739130435 and parameters: {'n_estimators': 863, 'max_depth': 13, 'min_samples_split': 106, 'min_samples_leaf': 55, 'criterion': 'entropy'}.
Trial 1694 finished with value: 0.7065217391304348 and parameters: {'n_estimators': 770, 'max_depth': 10, 'min_samples_split': 18, 'min_samples_leaf': 59, 'criterion': 'entropy'}.
Trial 1695 finished with value: 0.6956521739130435 and parameters: {'n_estimators': 931, 'max_depth': 11, 'min_samples_split': 46, 'min_samples_leaf': 48, 'criterion': 'entropy'}.
Trial 1696 finished with value: 0.6956521739130435 and parameters: {'n_estimators': 798, 'max_depth': 15, 'min_samples_split': 30, 'min_samples_leaf': 51, 'criterion': 'entropy'}.
Trial 1697 finished with value: 0.6521739130434783 and parameters: {'n_estimators': 823, 'max_depth': 5, 'min_samples_split': 23, 'min_samples_leaf': 53, 'criterion': 'entropy'}.
Trial 1698 finished with value: 0.717391304347826 and parameters: {'n_estimators': 715, 'max_depth': 8, 'min_samples_split': 37, 'min_samples_leaf': 56, 'criterion': 'entropy'}.
Trial 1699 finished with value: 0.7065217391304348 and parameters: {'n_estimators': 849, 'max_depth': 12, 'min_samples_split': 27, 'min_samples_leaf': 50, 'criterion': 'entropy'}.
Trial 1700 finished with value: 0.717391304347826 and parameters: {'n_estimators': 811, 'max_depth': 9, 'min_samples_split': 187, 'min_samples_leaf': 46, 'criterion': 'entropy'}.
Trial 1701 finished with value: 0.6630434782608695 and parameters: {'n_estimators': 542, 'max_depth': 18, 'min_samples_split': 33, 'min_samples_leaf': 53, 'criterion': 'entropy'}.
Trial 1702 finished with value: 0.7391304347826086 and parameters: {'n_estimators': 744, 'max_depth': 13, 'min_samples_split': 100, 'min_samples_leaf': 58, 'criterion': 'entropy'}.
Trial 1703 finished with value: 0.6630434782608695 and parameters: {'n_estimators': 726, 'max_depth': 17, 'min_samples_split': 41, 'min_samples_leaf': 63, 'criterion': 'entropy'}.
Trial 1704 finished with value: 0.6847826086956522 and parameters: {'n_estimators': 717, 'max_depth': 15, 'min_samples_split': 51, 'min_samples_leaf': 61, 'criterion': 'gini'}.
Trial 1705 finished with value: 0.6630434782608695 and parameters: {'n_estimators': 715, 'max_depth': 90, 'min_samples_split': 47, 'min_samples_leaf': 60, 'criterion': 'entropy'}.
Trial 1706 finished with value: 0.6956521739130435 and parameters: {'n_estimators': 725, 'max_depth': 14, 'min_samples_split': 19, 'min_samples_leaf': 58, 'criterion': 'entropy'}.
Trial 1707 finished with value: 0.6847826086956522 and parameters: {'n_estimators': 745, 'max_depth': 19, 'min_samples_split': 158, 'min_samples_leaf': 59, 'criterion': 'entropy'}.
Trial 1708 finished with value: 0.6847826086956522 and parameters: {'n_estimators': 705, 'max_depth': 17, 'min_samples_split': 75, 'min_samples_leaf': 61, 'criterion': 'entropy'}.
Trial 1709 finished with value: 0.7065217391304348 and parameters: {'n_estimators': 743, 'max_depth': 16, 'min_samples_split': 80, 'min_samples_leaf': 56, 'criterion': 'entropy'}.
Trial 1710 finished with value: 0.7065217391304348 and parameters: {'n_estimators': 741, 'max_depth': 14, 'min_samples_split': 6, 'min_samples_leaf': 62, 'criterion': 'entropy'}.
Trial 1711 finished with value: 0.7065217391304348 and parameters: {'n_estimators': 752, 'max_depth': 14, 'min_samples_split': 183, 'min_samples_leaf': 59, 'criterion': 'entropy'}.
Trial 1712 finished with value: 0.7391304347826086 and parameters: {'n_estimators': 743, 'max_depth': 13, 'min_samples_split': 25, 'min_samples_leaf': 58, 'criterion': 'entropy'}.
Trial 1713 finished with value: 0.7065217391304348 and parameters: {'n_estimators': 745, 'max_depth': 16, 'min_samples_split': 144, 'min_samples_leaf': 61, 'criterion': 'entropy'}.
Trial 1714 finished with value: 0.6630434782608695 and parameters: {'n_estimators': 700, 'max_depth': 21, 'min_samples_split': 14, 'min_samples_leaf': 63, 'criterion': 'entropy'}.
Trial 1715 finished with value: 0.7065217391304348 and parameters: {'n_estimators': 728, 'max_depth': 13, 'min_samples_split': 21, 'min_samples_leaf': 59, 'criterion': 'entropy'}.
Trial 1716 finished with value: 0.7065217391304348 and parameters: {'n_estimators': 713, 'max_depth': 13, 'min_samples_split': 154, 'min_samples_leaf': 60, 'criterion': 'entropy'}.
Trial 1717 finished with value: 0.6739130434782609 and parameters: {'n_estimators': 721, 'max_depth': 15, 'min_samples_split': 19, 'min_samples_leaf': 58, 'criterion': 'entropy'}.
Trial 1718 finished with value: 0.7065217391304348 and parameters: {'n_estimators': 708, 'max_depth': 12, 'min_samples_split': 23, 'min_samples_leaf': 64, 'criterion': 'entropy'}.
Trial 1719 finished with value: 0.6739130434782609 and parameters: {'n_estimators': 678, 'max_depth': 84, 'min_samples_split': 131, 'min_samples_leaf': 58, 'criterion': 'entropy'}.
Trial 1720 finished with value: 0.717391304347826 and parameters: {'n_estimators': 733, 'max_depth': 11, 'min_samples_split': 65, 'min_samples_leaf': 60, 'criterion': 'entropy'}.
Trial 1721 finished with value: 0.6739130434782609 and parameters: {'n_estimators': 737, 'max_depth': 51, 'min_samples_split': 22, 'min_samples_leaf': 59, 'criterion': 'entropy'}.
Trial 1722 finished with value: 0.6739130434782609 and parameters: {'n_estimators': 734, 'max_depth': 18, 'min_samples_split': 129, 'min_samples_leaf': 58, 'criterion': 'entropy'}.
Trial 1723 finished with value: 0.7065217391304348 and parameters: {'n_estimators': 738, 'max_depth': 12, 'min_samples_split': 16, 'min_samples_leaf': 62, 'criterion': 'gini'}.
Trial 1724 finished with value: 0.6956521739130435 and parameters: {'n_estimators': 750, 'max_depth': 14, 'min_samples_split': 25, 'min_samples_leaf': 57, 'criterion': 'entropy'}.
Trial 1725 finished with value: 0.7065217391304348 and parameters: {'n_estimators': 689, 'max_depth': 10, 'min_samples_split': 9, 'min_samples_leaf': 65, 'criterion': 'entropy'}.
Trial 1726 finished with value: 0.7065217391304348 and parameters: {'n_estimators': 707, 'max_depth': 12, 'min_samples_split': 15, 'min_samples_leaf': 57, 'criterion': 'entropy'}.
Trial 1727 finished with value: 0.7065217391304348 and parameters: {'n_estimators': 734, 'max_depth': 15, 'min_samples_split': 150, 'min_samples_leaf': 60, 'criterion': 'entropy'}.
Trial 1728 finished with value: 0.717391304347826 and parameters: {'n_estimators': 691, 'max_depth': 10, 'min_samples_split': 25, 'min_samples_leaf': 62, 'criterion': 'entropy'}.
Trial 1729 finished with value: 0.7391304347826086 and parameters: {'n_estimators': 750, 'max_depth': 13, 'min_samples_split': 20, 'min_samples_leaf': 58, 'criterion': 'entropy'}.
Trial 1730 finished with value: 0.6739130434782609 and parameters: {'n_estimators': 713, 'max_depth': 17, 'min_samples_split': 12, 'min_samples_leaf': 60, 'criterion': 'entropy'}.
Trial 1731 finished with value: 0.6739130434782609 and parameters: {'n_estimators': 737, 'max_depth': 17, 'min_samples_split': 15, 'min_samples_leaf': 58, 'criterion': 'entropy'}.
Trial 1732 finished with value: 0.6956521739130435 and parameters: {'n_estimators': 750, 'max_depth': 15, 'min_samples_split': 12, 'min_samples_leaf': 64, 'criterion': 'entropy'}.
Trial 1733 finished with value: 0.6739130434782609 and parameters: {'n_estimators': 747, 'max_depth': 15, 'min_samples_split': 18, 'min_samples_leaf': 60, 'criterion': 'entropy'}.
Trial 1734 finished with value: 0.6739130434782609 and parameters: {'n_estimators': 719, 'max_depth': 17, 'min_samples_split': 18, 'min_samples_leaf': 58, 'criterion': 'entropy'}.
Trial 1735 finished with value: 0.6630434782608695 and parameters: {'n_estimators': 731, 'max_depth': 20, 'min_samples_split': 10, 'min_samples_leaf': 58, 'criterion': 'entropy'}.
Trial 1736 finished with value: 0.7065217391304348 and parameters: {'n_estimators': 723, 'max_depth': 14, 'min_samples_split': 16, 'min_samples_leaf': 62, 'criterion': 'entropy'}.
Trial 1737 finished with value: 0.6956521739130435 and parameters: {'n_estimators': 754, 'max_depth': 13, 'min_samples_split': 60, 'min_samples_leaf': 61, 'criterion': 'entropy'}.
Trial 1738 finished with value: 0.6956521739130435 and parameters: {'n_estimators': 758, 'max_depth': 16, 'min_samples_split': 20, 'min_samples_leaf': 57, 'criterion': 'entropy'}.
Trial 1739 finished with value: 0.7065217391304348 and parameters: {'n_estimators': 732, 'max_depth': 13, 'min_samples_split': 21, 'min_samples_leaf': 59, 'criterion': 'entropy'}.
Trial 1740 finished with value: 0.6847826086956522 and parameters: {'n_estimators': 701, 'max_depth': 19, 'min_samples_split': 176, 'min_samples_leaf': 57, 'criterion': 'entropy'}.
Trial 1741 finished with value: 0.6956521739130435 and parameters: {'n_estimators': 756, 'max_depth': 14, 'min_samples_split': 17, 'min_samples_leaf': 61, 'criterion': 'entropy'}.
Trial 1742 finished with value: 0.7065217391304348 and parameters: {'n_estimators': 756, 'max_depth': 12, 'min_samples_split': 20, 'min_samples_leaf': 57, 'criterion': 'entropy'}.
Trial 1743 finished with value: 0.6847826086956522 and parameters: {'n_estimators': 734, 'max_depth': 16, 'min_samples_split': 11, 'min_samples_leaf': 59, 'criterion': 'gini'}.
Trial 1744 finished with value: 0.717391304347826 and parameters: {'n_estimators': 758, 'max_depth': 13, 'min_samples_split': 20, 'min_samples_leaf': 57, 'criterion': 'entropy'}.
Trial 1745 finished with value: 0.717391304347826 and parameters: {'n_estimators': 744, 'max_depth': 11, 'min_samples_split': 24, 'min_samples_leaf': 59, 'criterion': 'entropy'}.
Trial 1746 finished with value: 0.6847826086956522 and parameters: {'n_estimators': 763, 'max_depth': 15, 'min_samples_split': 15, 'min_samples_leaf': 66, 'criterion': 'entropy'}.
Trial 1747 finished with value: 0.6956521739130435 and parameters: {'n_estimators': 723, 'max_depth': 12, 'min_samples_split': 22, 'min_samples_leaf': 56, 'criterion': 'entropy'}.
Trial 1748 finished with value: 0.7065217391304348 and parameters: {'n_estimators': 762, 'max_depth': 11, 'min_samples_split': 21, 'min_samples_leaf': 64, 'criterion': 'entropy'}.
Trial 1749 finished with value: 0.6956521739130435 and parameters: {'n_estimators': 705, 'max_depth': 14, 'min_samples_split': 139, 'min_samples_leaf': 62, 'criterion': 'entropy'}.
Trial 1750 finished with value: 0.6739130434782609 and parameters: {'n_estimators': 737, 'max_depth': 18, 'min_samples_split': 17, 'min_samples_leaf': 56, 'criterion': 'entropy'}.
Trial 1751 finished with value: 0.7065217391304348 and parameters: {'n_estimators': 748, 'max_depth': 10, 'min_samples_split': 24, 'min_samples_leaf': 59, 'criterion': 'entropy'}.
Trial 1752 finished with value: 0.6956521739130435 and parameters: {'n_estimators': 761, 'max_depth': 13, 'min_samples_split': 25, 'min_samples_leaf': 61, 'criterion': 'entropy'}.
Trial 1753 finished with value: 0.717391304347826 and parameters: {'n_estimators': 662, 'max_depth': 9, 'min_samples_split': 13, 'min_samples_leaf': 56, 'criterion': 'entropy'}.
Trial 1754 finished with value: 0.717391304347826 and parameters: {'n_estimators': 701, 'max_depth': 11, 'min_samples_split': 20, 'min_samples_leaf': 58, 'criterion': 'entropy'}.
Trial 1755 finished with value: 0.7065217391304348 and parameters: {'n_estimators': 766, 'max_depth': 13, 'min_samples_split': 121, 'min_samples_leaf': 56, 'criterion': 'entropy'}.
Trial 1756 finished with value: 0.7065217391304348 and parameters: {'n_estimators': 730, 'max_depth': 8, 'min_samples_split': 25, 'min_samples_leaf': 59, 'criterion': 'entropy'}.
Trial 1757 finished with value: 0.6847826086956522 and parameters: {'n_estimators': 697, 'max_depth': 11, 'min_samples_split': 167, 'min_samples_leaf': 56, 'criterion': 'entropy'}.
Trial 1758 finished with value: 0.6739130434782609 and parameters: {'n_estimators': 721, 'max_depth': 15, 'min_samples_split': 22, 'min_samples_leaf': 60, 'criterion': 'entropy'}.
Trial 1759 finished with value: 0.6956521739130435 and parameters: {'n_estimators': 765, 'max_depth': 9, 'min_samples_split': 69, 'min_samples_leaf': 57, 'criterion': 'entropy'}.
Trial 1760 finished with value: 0.6956521739130435 and parameters: {'n_estimators': 737, 'max_depth': 7, 'min_samples_split': 136, 'min_samples_leaf': 61, 'criterion': 'entropy'}.
Trial 1761 finished with value: 0.7065217391304348 and parameters: {'n_estimators': 767, 'max_depth': 12, 'min_samples_split': 17, 'min_samples_leaf': 55, 'criterion': 'entropy'}.
Trial 1762 finished with value: 0.717391304347826 and parameters: {'n_estimators': 742, 'max_depth': 10, 'min_samples_split': 7, 'min_samples_leaf': 58, 'criterion': 'gini'}.
Trial 1763 finished with value: 0.6847826086956522 and parameters: {'n_estimators': 768, 'max_depth': 96, 'min_samples_split': 26, 'min_samples_leaf': 56, 'criterion': 'entropy'}.
Trial 1764 finished with value: 0.6847826086956522 and parameters: {'n_estimators': 776, 'max_depth': 16, 'min_samples_split': 25, 'min_samples_leaf': 55, 'criterion': 'entropy'}.
Trial 1765 finished with value: 0.6956521739130435 and parameters: {'n_estimators': 677, 'max_depth': 13, 'min_samples_split': 21, 'min_samples_leaf': 62, 'criterion': 'entropy'}.
Trial 1766 finished with value: 0.6956521739130435 and parameters: {'n_estimators': 753, 'max_depth': 7, 'min_samples_split': 27, 'min_samples_leaf': 57, 'criterion': 'entropy'}.
Trial 1767 finished with value: 0.717391304347826 and parameters: {'n_estimators': 748, 'max_depth': 11, 'min_samples_split': 124, 'min_samples_leaf': 58, 'criterion': 'entropy'}.
Trial 1768 finished with value: 0.6956521739130435 and parameters: {'n_estimators': 721, 'max_depth': 9, 'min_samples_split': 15, 'min_samples_leaf': 64, 'criterion': 'entropy'}.
Trial 1769 finished with value: 0.6847826086956522 and parameters: {'n_estimators': 775, 'max_depth': 14, 'min_samples_split': 27, 'min_samples_leaf': 55, 'criterion': 'entropy'}.
Trial 1770 finished with value: 0.6739130434782609 and parameters: {'n_estimators': 749, 'max_depth': 6, 'min_samples_split': 19, 'min_samples_leaf': 61, 'criterion': 'entropy'}.
Trial 1771 finished with value: 0.6956521739130435 and parameters: {'n_estimators': 775, 'max_depth': 12, 'min_samples_split': 22, 'min_samples_leaf': 59, 'criterion': 'entropy'}.
Trial 1772 finished with value: 0.717391304347826 and parameters: {'n_estimators': 714, 'max_depth': 9, 'min_samples_split': 28, 'min_samples_leaf': 55, 'criterion': 'entropy'}.
Trial 1773 finished with value: 0.6847826086956522 and parameters: {'n_estimators': 767, 'max_depth': 46, 'min_samples_split': 12, 'min_samples_leaf': 57, 'criterion': 'entropy'}.
Trial 1774 finished with value: 0.717391304347826 and parameters: {'n_estimators': 746, 'max_depth': 11, 'min_samples_split': 23, 'min_samples_leaf': 59, 'criterion': 'entropy'}.
Trial 1775 finished with value: 0.6521739130434783 and parameters: {'n_estimators': 770, 'max_depth': 40, 'min_samples_split': 28, 'min_samples_leaf': 55, 'criterion': 'entropy'}.
Trial 1776 finished with value: 0.6630434782608695 and parameters: {'n_estimators': 777, 'max_depth': 61, 'min_samples_split': 17, 'min_samples_leaf': 60, 'criterion': 'entropy'}.
Trial 1777 finished with value: 0.6739130434782609 and parameters: {'n_estimators': 722, 'max_depth': 17, 'min_samples_split': 25, 'min_samples_leaf': 55, 'criterion': 'entropy'}.
