Trial 252 finished with value: 0.532608695652174 and parameters: {'n_estimators': 362, 'max_depth': 96, 'min_samples_split': 172, 'min_samples_leaf': 93, 'criterion': 'entropy'}.
Trial 253 finished with value: 0.5543478260869565 and parameters: {'n_estimators': 322, 'max_depth': 63, 'min_samples_split': 184, 'min_samples_leaf': 50, 'criterion': 'entropy'}.
Trial 254 finished with value: 0.5543478260869565 and parameters: {'n_estimators': 300, 'max_depth': 74, 'min_samples_split': 168, 'min_samples_leaf': 96, 'criterion': 'gini'}.
Trial 255 finished with value: 0.5543478260869565 and parameters: {'n_estimators': 280, 'max_depth': 72, 'min_samples_split': 200, 'min_samples_leaf': 98, 'criterion': 'entropy'}.
Trial 256 finished with value: 0.532608695652174 and parameters: {'n_estimators': 237, 'max_depth': 76, 'min_samples_split': 155, 'min_samples_leaf': 90, 'criterion': 'entropy'}.
Trial 257 finished with value: 0.5543478260869565 and parameters: {'n_estimators': 348, 'max_depth': 66, 'min_samples_split': 188, 'min_samples_leaf': 94, 'criterion': 'entropy'}.
Trial 258 finished with value: 0.5652173913043478 and parameters: {'n_estimators': 334, 'max_depth': 68, 'min_samples_split': 161, 'min_samples_leaf': 97, 'criterion': 'entropy'}.
Trial 259 finished with value: 0.532608695652174 and parameters: {'n_estimators': 416, 'max_depth': 70, 'min_samples_split': 193, 'min_samples_leaf': 100, 'criterion': 'entropy'}.
Trial 260 finished with value: 0.5760869565217391 and parameters: {'n_estimators': 315, 'max_depth': 65, 'min_samples_split': 179, 'min_samples_leaf': 46, 'criterion': 'entropy'}.
Trial 261 finished with value: 0.5652173913043478 and parameters: {'n_estimators': 395, 'max_depth': 64, 'min_samples_split': 178, 'min_samples_leaf': 48, 'criterion': 'entropy'}.
Trial 262 finished with value: 0.532608695652174 and parameters: {'n_estimators': 323, 'max_depth': 65, 'min_samples_split': 182, 'min_samples_leaf': 44, 'criterion': 'gini'}.
Trial 263 finished with value: 0.5217391304347826 and parameters: {'n_estimators': 365, 'max_depth': 77, 'min_samples_split': 176, 'min_samples_leaf': 47, 'criterion': 'entropy'}.
Trial 264 finished with value: 0.532608695652174 and parameters: {'n_estimators': 436, 'max_depth': 59, 'min_samples_split': 185, 'min_samples_leaf': 54, 'criterion': 'entropy'}.
Trial 265 finished with value: 0.5434782608695652 and parameters: {'n_estimators': 343, 'max_depth': 61, 'min_samples_split': 172, 'min_samples_leaf': 45, 'criterion': 'entropy'}.
Trial 266 finished with value: 0.5543478260869565 and parameters: {'n_estimators': 312, 'max_depth': 50, 'min_samples_split': 180, 'min_samples_leaf': 41, 'criterion': 'entropy'}.
Trial 267 finished with value: 0.5434782608695652 and parameters: {'n_estimators': 290, 'max_depth': 64, 'min_samples_split': 87, 'min_samples_leaf': 92, 'criterion': 'entropy'}.
Trial 268 finished with value: 0.5652173913043478 and parameters: {'n_estimators': 328, 'max_depth': 79, 'min_samples_split': 189, 'min_samples_leaf': 95, 'criterion': 'entropy'}.
Trial 269 finished with value: 0.5869565217391305 and parameters: {'n_estimators': 353, 'max_depth': 55, 'min_samples_split': 176, 'min_samples_leaf': 50, 'criterion': 'entropy'}.
Trial 270 finished with value: 0.5434782608695652 and parameters: {'n_estimators': 380, 'max_depth': 56, 'min_samples_split': 175, 'min_samples_leaf': 51, 'criterion': 'gini'}.
Trial 271 finished with value: 0.5434782608695652 and parameters: {'n_estimators': 358, 'max_depth': 54, 'min_samples_split': 170, 'min_samples_leaf': 53, 'criterion': 'entropy'}.
Trial 272 finished with value: 0.5217391304347826 and parameters: {'n_estimators': 345, 'max_depth': 74, 'min_samples_split': 176, 'min_samples_leaf': 88, 'criterion': 'entropy'}.
Trial 273 finished with value: 0.532608695652174 and parameters: {'n_estimators': 332, 'max_depth': 72, 'min_samples_split': 171, 'min_samples_leaf': 46, 'criterion': 'entropy'}.
Trial 274 finished with value: 0.5869565217391305 and parameters: {'n_estimators': 316, 'max_depth': 58, 'min_samples_split': 195, 'min_samples_leaf': 50, 'criterion': 'entropy'}.
Trial 275 finished with value: 0.5543478260869565 and parameters: {'n_estimators': 370, 'max_depth': 57, 'min_samples_split': 200, 'min_samples_leaf': 50, 'criterion': 'entropy'}.
Trial 276 finished with value: 0.5434782608695652 and parameters: {'n_estimators': 315, 'max_depth': 55, 'min_samples_split': 196, 'min_samples_leaf': 49, 'criterion': 'entropy'}.
Trial 277 finished with value: 0.532608695652174 and parameters: {'n_estimators': 351, 'max_depth': 55, 'min_samples_split': 195, 'min_samples_leaf': 47, 'criterion': 'entropy'}.
Trial 278 finished with value: 0.5543478260869565 and parameters: {'n_estimators': 332, 'max_depth': 58, 'min_samples_split': 181, 'min_samples_leaf': 52, 'criterion': 'gini'}.
Trial 279 finished with value: 0.5760869565217391 and parameters: {'n_estimators': 313, 'max_depth': 52, 'min_samples_split': 192, 'min_samples_leaf': 48, 'criterion': 'entropy'}.
Trial 280 finished with value: 0.532608695652174 and parameters: {'n_estimators': 462, 'max_depth': 52, 'min_samples_split': 193, 'min_samples_leaf': 50, 'criterion': 'entropy'}.
Trial 281 finished with value: 0.5434782608695652 and parameters: {'n_estimators': 391, 'max_depth': 47, 'min_samples_split': 192, 'min_samples_leaf': 47, 'criterion': 'entropy'}.
Trial 282 finished with value: 0.5108695652173914 and parameters: {'n_estimators': 354, 'max_depth': 50, 'min_samples_split': 196, 'min_samples_leaf': 54, 'criterion': 'entropy'}.
Trial 283 finished with value: 0.5543478260869565 and parameters: {'n_estimators': 317, 'max_depth': 52, 'min_samples_split': 189, 'min_samples_leaf': 49, 'criterion': 'entropy'}.
Trial 284 finished with value: 0.5434782608695652 and parameters: {'n_estimators': 696, 'max_depth': 61, 'min_samples_split': 200, 'min_samples_leaf': 45, 'criterion': 'entropy'}.
Trial 285 finished with value: 0.5217391304347826 and parameters: {'n_estimators': 638, 'max_depth': 58, 'min_samples_split': 188, 'min_samples_leaf': 57, 'criterion': 'entropy'}.
Trial 286 finished with value: 0.5108695652173914 and parameters: {'n_estimators': 409, 'max_depth': 45, 'min_samples_split': 192, 'min_samples_leaf': 55, 'criterion': 'entropy'}.
Trial 287 finished with value: 0.5543478260869565 and parameters: {'n_estimators': 336, 'max_depth': 54, 'min_samples_split': 197, 'min_samples_leaf': 48, 'criterion': 'gini'}.
Trial 288 finished with value: 0.5543478260869565 and parameters: {'n_estimators': 305, 'max_depth': 68, 'min_samples_split': 183, 'min_samples_leaf': 43, 'criterion': 'entropy'}.
Trial 289 finished with value: 0.532608695652174 and parameters: {'n_estimators': 515, 'max_depth': 59, 'min_samples_split': 186, 'min_samples_leaf': 39, 'criterion': 'entropy'}.
Trial 290 finished with value: 0.5652173913043478 and parameters: {'n_estimators': 360, 'max_depth': 56, 'min_samples_split': 192, 'min_samples_leaf': 46, 'criterion': 'entropy'}.
Trial 291 finished with value: 0.5434782608695652 and parameters: {'n_estimators': 375, 'max_depth': 15, 'min_samples_split': 180, 'min_samples_leaf': 51, 'criterion': 'entropy'}.
Trial 292 finished with value: 0.5434782608695652 and parameters: {'n_estimators': 331, 'max_depth': 67, 'min_samples_split': 196, 'min_samples_leaf': 51, 'criterion': 'entropy'}.
Trial 293 finished with value: 0.5 and parameters: {'n_estimators': 313, 'max_depth': 49, 'min_samples_split': 166, 'min_samples_leaf': 43, 'criterion': 'entropy'}.
Trial 294 finished with value: 0.5434782608695652 and parameters: {'n_estimators': 301, 'max_depth': 53, 'min_samples_split': 189, 'min_samples_leaf': 93, 'criterion': 'entropy'}.
Trial 295 finished with value: 0.5217391304347826 and parameters: {'n_estimators': 343, 'max_depth': 69, 'min_samples_split': 174, 'min_samples_leaf': 49, 'criterion': 'gini'}.
Trial 296 finished with value: 0.5543478260869565 and parameters: {'n_estimators': 556, 'max_depth': 71, 'min_samples_split': 184, 'min_samples_leaf': 95, 'criterion': 'entropy'}.
Trial 297 finished with value: 0.5434782608695652 and parameters: {'n_estimators': 323, 'max_depth': 62, 'min_samples_split': 179, 'min_samples_leaf': 99, 'criterion': 'entropy'}.
Trial 298 finished with value: 0.5434782608695652 and parameters: {'n_estimators': 425, 'max_depth': 66, 'min_samples_split': 193, 'min_samples_leaf': 47, 'criterion': 'entropy'}.
Trial 299 finished with value: 0.5543478260869565 and parameters: {'n_estimators': 288, 'max_depth': 72, 'min_samples_split': 189, 'min_samples_leaf': 92, 'criterion': 'entropy'}.
Trial 300 finished with value: 0.5652173913043478 and parameters: {'n_estimators': 351, 'max_depth': 68, 'min_samples_split': 142, 'min_samples_leaf': 97, 'criterion': 'entropy'}.
Trial 301 finished with value: 0.532608695652174 and parameters: {'n_estimators': 395, 'max_depth': 51, 'min_samples_split': 164, 'min_samples_leaf': 100, 'criterion': 'entropy'}.
Trial 302 finished with value: 0.5543478260869565 and parameters: {'n_estimators': 324, 'max_depth': 73, 'min_samples_split': 8, 'min_samples_leaf': 94, 'criterion': 'entropy'}.
Trial 303 finished with value: 0.5652173913043478 and parameters: {'n_estimators': 303, 'max_depth': 63, 'min_samples_split': 200, 'min_samples_leaf': 96, 'criterion': 'gini'}.
Trial 304 finished with value: 0.5434782608695652 and parameters: {'n_estimators': 371, 'max_depth': 70, 'min_samples_split': 130, 'min_samples_leaf': 98, 'criterion': 'entropy'}.
Trial 305 finished with value: 0.532608695652174 and parameters: {'n_estimators': 342, 'max_depth': 57, 'min_samples_split': 175, 'min_samples_leaf': 90, 'criterion': 'entropy'}.
Trial 306 finished with value: 0.5434782608695652 and parameters: {'n_estimators': 277, 'max_depth': 67, 'min_samples_split': 185, 'min_samples_leaf': 10, 'criterion': 'entropy'}.
Trial 307 finished with value: 0.5543478260869565 and parameters: {'n_estimators': 320, 'max_depth': 90, 'min_samples_split': 171, 'min_samples_leaf': 94, 'criterion': 'entropy'}.
Trial 308 finished with value: 0.5217391304347826 and parameters: {'n_estimators': 363, 'max_depth': 24, 'min_samples_split': 179, 'min_samples_leaf': 45, 'criterion': 'entropy'}.
Trial 309 finished with value: 0.5760869565217391 and parameters: {'n_estimators': 296, 'max_depth': 75, 'min_samples_split': 196, 'min_samples_leaf': 96, 'criterion': 'entropy'}.
Trial 310 finished with value: 0.5543478260869565 and parameters: {'n_estimators': 290, 'max_depth': 9, 'min_samples_split': 167, 'min_samples_leaf': 41, 'criterion': 'entropy'}.
Trial 311 finished with value: 0.5217391304347826 and parameters: {'n_estimators': 301, 'max_depth': 41, 'min_samples_split': 194, 'min_samples_leaf': 82, 'criterion': 'entropy'}.
Trial 312 finished with value: 0.5434782608695652 and parameters: {'n_estimators': 273, 'max_depth': 70, 'min_samples_split': 182, 'min_samples_leaf': 53, 'criterion': 'gini'}.
Trial 313 finished with value: 0.5543478260869565 and parameters: {'n_estimators': 312, 'max_depth': 32, 'min_samples_split': 173, 'min_samples_leaf': 95, 'criterion': 'entropy'}.
Trial 314 finished with value: 0.5434782608695652 and parameters: {'n_estimators': 334, 'max_depth': 60, 'min_samples_split': 190, 'min_samples_leaf': 69, 'criterion': 'entropy'}.
Trial 315 finished with value: 0.5652173913043478 and parameters: {'n_estimators': 292, 'max_depth': 65, 'min_samples_split': 177, 'min_samples_leaf': 98, 'criterion': 'entropy'}.
Trial 316 finished with value: 0.5434782608695652 and parameters: {'n_estimators': 320, 'max_depth': 55, 'min_samples_split': 197, 'min_samples_leaf': 92, 'criterion': 'entropy'}.
Trial 317 finished with value: 0.5652173913043478 and parameters: {'n_estimators': 349, 'max_depth': 75, 'min_samples_split': 187, 'min_samples_leaf': 96, 'criterion': 'entropy'}.
Trial 318 finished with value: 0.5217391304347826 and parameters: {'n_estimators': 305, 'max_depth': 6, 'min_samples_split': 170, 'min_samples_leaf': 99, 'criterion': 'entropy'}.
Trial 319 finished with value: 0.5434782608695652 and parameters: {'n_estimators': 332, 'max_depth': 69, 'min_samples_split': 183, 'min_samples_leaf': 57, 'criterion': 'entropy'}.
Trial 320 finished with value: 0.5434782608695652 and parameters: {'n_estimators': 272, 'max_depth': 13, 'min_samples_split': 193, 'min_samples_leaf': 50, 'criterion': 'gini'}.
Trial 321 finished with value: 0.532608695652174 and parameters: {'n_estimators': 342, 'max_depth': 72, 'min_samples_split': 165, 'min_samples_leaf': 48, 'criterion': 'entropy'}.
Trial 322 finished with value: 0.5543478260869565 and parameters: {'n_estimators': 310, 'max_depth': 27, 'min_samples_split': 175, 'min_samples_leaf': 94, 'criterion': 'entropy'}.
Trial 323 finished with value: 0.5652173913043478 and parameters: {'n_estimators': 289, 'max_depth': 66, 'min_samples_split': 187, 'min_samples_leaf': 97, 'criterion': 'entropy'}.
Trial 324 finished with value: 0.532608695652174 and parameters: {'n_estimators': 352, 'max_depth': 63, 'min_samples_split': 178, 'min_samples_leaf': 66, 'criterion': 'entropy'}.
Trial 325 finished with value: 0.532608695652174 and parameters: {'n_estimators': 323, 'max_depth': 52, 'min_samples_split': 169, 'min_samples_leaf': 21, 'criterion': 'entropy'}.
Trial 326 finished with value: 0.5434782608695652 and parameters: {'n_estimators': 363, 'max_depth': 59, 'min_samples_split': 43, 'min_samples_leaf': 100, 'criterion': 'entropy'}.
Trial 327 finished with value: 0.5217391304347826 and parameters: {'n_estimators': 257, 'max_depth': 68, 'min_samples_split': 106, 'min_samples_leaf': 86, 'criterion': 'entropy'}.
Trial 328 finished with value: 0.5434782608695652 and parameters: {'n_estimators': 580, 'max_depth': 75, 'min_samples_split': 197, 'min_samples_leaf': 96, 'criterion': 'gini'}.
Trial 329 finished with value: 0.5217391304347826 and parameters: {'n_estimators': 382, 'max_depth': 71, 'min_samples_split': 181, 'min_samples_leaf': 61, 'criterion': 'entropy'}.
Trial 330 finished with value: 0.532608695652174 and parameters: {'n_estimators': 334, 'max_depth': 49, 'min_samples_split': 189, 'min_samples_leaf': 46, 'criterion': 'entropy'}.
Trial 331 finished with value: 0.5217391304347826 and parameters: {'n_estimators': 307, 'max_depth': 38, 'min_samples_split': 173, 'min_samples_leaf': 92, 'criterion': 'entropy'}.
Trial 332 finished with value: 0.5543478260869565 and parameters: {'n_estimators': 293, 'max_depth': 73, 'min_samples_split': 159, 'min_samples_leaf': 98, 'criterion': 'entropy'}.
Trial 333 finished with value: 0.5652173913043478 and parameters: {'n_estimators': 320, 'max_depth': 56, 'min_samples_split': 193, 'min_samples_leaf': 52, 'criterion': 'entropy'}.
Trial 334 finished with value: 0.5543478260869565 and parameters: {'n_estimators': 336, 'max_depth': 61, 'min_samples_split': 200, 'min_samples_leaf': 94, 'criterion': 'entropy'}.
Trial 335 finished with value: 0.532608695652174 and parameters: {'n_estimators': 282, 'max_depth': 69, 'min_samples_split': 184, 'min_samples_leaf': 43, 'criterion': 'entropy'}.
Trial 336 finished with value: 0.5434782608695652 and parameters: {'n_estimators': 368, 'max_depth': 65, 'min_samples_split': 163, 'min_samples_leaf': 96, 'criterion': 'gini'}.
Trial 337 finished with value: 0.5434782608695652 and parameters: {'n_estimators': 308, 'max_depth': 67, 'min_samples_split': 177, 'min_samples_leaf': 99, 'criterion': 'entropy'}.
Trial 338 finished with value: 0.532608695652174 and parameters: {'n_estimators': 349, 'max_depth': 47, 'min_samples_split': 65, 'min_samples_leaf': 89, 'criterion': 'entropy'}.
Trial 339 finished with value: 0.5543478260869565 and parameters: {'n_estimators': 328, 'max_depth': 76, 'min_samples_split': 168, 'min_samples_leaf': 94, 'criterion': 'entropy'}.
Trial 340 finished with value: 0.5652173913043478 and parameters: {'n_estimators': 300, 'max_depth': 54, 'min_samples_split': 191, 'min_samples_leaf': 97, 'criterion': 'entropy'}.
Trial 341 finished with value: 0.5543478260869565 and parameters: {'n_estimators': 266, 'max_depth': 70, 'min_samples_split': 173, 'min_samples_leaf': 91, 'criterion': 'entropy'}.
Trial 342 finished with value: 0.5434782608695652 and parameters: {'n_estimators': 315, 'max_depth': 72, 'min_samples_split': 185, 'min_samples_leaf': 49, 'criterion': 'entropy'}.
Trial 343 finished with value: 0.5434782608695652 and parameters: {'n_estimators': 342, 'max_depth': 19, 'min_samples_split': 180, 'min_samples_leaf': 100, 'criterion': 'entropy'}.
Trial 344 finished with value: 0.5434782608695652 and parameters: {'n_estimators': 286, 'max_depth': 58, 'min_samples_split': 194, 'min_samples_leaf': 95, 'criterion': 'gini'}.
Trial 345 finished with value: 0.532608695652174 and parameters: {'n_estimators': 540, 'max_depth': 81, 'min_samples_split': 188, 'min_samples_leaf': 47, 'criterion': 'entropy'}.
Trial 346 finished with value: 0.5434782608695652 and parameters: {'n_estimators': 382, 'max_depth': 74, 'min_samples_split': 175, 'min_samples_leaf': 98, 'criterion': 'entropy'}.
Trial 347 finished with value: 0.5434782608695652 and parameters: {'n_estimators': 361, 'max_depth': 67, 'min_samples_split': 196, 'min_samples_leaf': 93, 'criterion': 'entropy'}.
Trial 348 finished with value: 0.532608695652174 and parameters: {'n_estimators': 320, 'max_depth': 64, 'min_samples_split': 167, 'min_samples_leaf': 45, 'criterion': 'entropy'}.
Trial 349 finished with value: 0.5652173913043478 and parameters: {'n_estimators': 295, 'max_depth': 70, 'min_samples_split': 172, 'min_samples_leaf': 96, 'criterion': 'entropy'}.
Trial 350 finished with value: 0.5543478260869565 and parameters: {'n_estimators': 331, 'max_depth': 68, 'min_samples_split': 181, 'min_samples_leaf': 51, 'criterion': 'entropy'}.
Trial 351 finished with value: 0.532608695652174 and parameters: {'n_estimators': 350, 'max_depth': 77, 'min_samples_split': 186, 'min_samples_leaf': 76, 'criterion': 'entropy'}.
Trial 352 finished with value: 0.532608695652174 and parameters: {'n_estimators': 310, 'max_depth': 73, 'min_samples_split': 190, 'min_samples_leaf': 100, 'criterion': 'gini'}.
Trial 353 finished with value: 0.5652173913043478 and parameters: {'n_estimators': 275, 'max_depth': 34, 'min_samples_split': 137, 'min_samples_leaf': 97, 'criterion': 'entropy'}.
Trial 354 finished with value: 0.5652173913043478 and parameters: {'n_estimators': 326, 'max_depth': 52, 'min_samples_split': 197, 'min_samples_leaf': 95, 'criterion': 'entropy'}.
Trial 355 finished with value: 0.5108695652173914 and parameters: {'n_estimators': 371, 'max_depth': 61, 'min_samples_split': 179, 'min_samples_leaf': 92, 'criterion': 'entropy'}.
Trial 356 finished with value: 0.5543478260869565 and parameters: {'n_estimators': 906, 'max_depth': 66, 'min_samples_split': 156, 'min_samples_leaf': 79, 'criterion': 'entropy'}.
Trial 357 finished with value: 0.5543478260869565 and parameters: {'n_estimators': 337, 'max_depth': 70, 'min_samples_split': 164, 'min_samples_leaf': 98, 'criterion': 'entropy'}.
Trial 358 finished with value: 0.5434782608695652 and parameters: {'n_estimators': 300, 'max_depth': 75, 'min_samples_split': 171, 'min_samples_leaf': 48, 'criterion': 'entropy'}.
Trial 359 finished with value: 0.5543478260869565 and parameters: {'n_estimators': 494, 'max_depth': 63, 'min_samples_split': 177, 'min_samples_leaf': 95, 'criterion': 'entropy'}.
Trial 360 finished with value: 0.532608695652174 and parameters: {'n_estimators': 400, 'max_depth': 72, 'min_samples_split': 193, 'min_samples_leaf': 98, 'criterion': 'gini'}.
Trial 361 finished with value: 0.5217391304347826 and parameters: {'n_estimators': 355, 'max_depth': 11, 'min_samples_split': 182, 'min_samples_leaf': 53, 'criterion': 'entropy'}.
Trial 362 finished with value: 0.5434782608695652 and parameters: {'n_estimators': 242, 'max_depth': 43, 'min_samples_split': 168, 'min_samples_leaf': 93, 'criterion': 'entropy'}.
Trial 363 finished with value: 0.5434782608695652 and parameters: {'n_estimators': 317, 'max_depth': 55, 'min_samples_split': 186, 'min_samples_leaf': 56, 'criterion': 'entropy'}.
Trial 364 finished with value: 0.5652173913043478 and parameters: {'n_estimators': 279, 'max_depth': 50, 'min_samples_split': 176, 'min_samples_leaf': 96, 'criterion': 'entropy'}.
Trial 365 finished with value: 0.5217391304347826 and parameters: {'n_estimators': 344, 'max_depth': 68, 'min_samples_split': 161, 'min_samples_leaf': 42, 'criterion': 'entropy'}.
Trial 366 finished with value: 0.5434782608695652 and parameters: {'n_estimators': 300, 'max_depth': 59, 'min_samples_split': 200, 'min_samples_leaf': 63, 'criterion': 'entropy'}.
Trial 367 finished with value: 0.532608695652174 and parameters: {'n_estimators': 385, 'max_depth': 71, 'min_samples_split': 191, 'min_samples_leaf': 100, 'criterion': 'entropy'}.
Trial 368 finished with value: 0.5434782608695652 and parameters: {'n_estimators': 320, 'max_depth': 22, 'min_samples_split': 171, 'min_samples_leaf': 50, 'criterion': 'gini'}.
Trial 369 finished with value: 0.5434782608695652 and parameters: {'n_estimators': 338, 'max_depth': 65, 'min_samples_split': 182, 'min_samples_leaf': 45, 'criterion': 'entropy'}.
Trial 370 finished with value: 0.5434782608695652 and parameters: {'n_estimators': 360, 'max_depth': 79, 'min_samples_split': 196, 'min_samples_leaf': 94, 'criterion': 'entropy'}.
Trial 371 finished with value: 0.5217391304347826 and parameters: {'n_estimators': 290, 'max_depth': 17, 'min_samples_split': 174, 'min_samples_leaf': 90, 'criterion': 'entropy'}.
Trial 372 finished with value: 0.5652173913043478 and parameters: {'n_estimators': 309, 'max_depth': 57, 'min_samples_split': 190, 'min_samples_leaf': 97, 'criterion': 'entropy'}.
Trial 373 finished with value: 0.5543478260869565 and parameters: {'n_estimators': 327, 'max_depth': 69, 'min_samples_split': 165, 'min_samples_leaf': 98, 'criterion': 'entropy'}.
