Trial 1900 finished with value: 0.5978260869565217 and parameters: {'n_estimators': 765, 'max_depth': 13, 'min_samples_split': 32, 'min_samples_leaf': 14, 'criterion': 'entropy'}.
Trial 1901 finished with value: 0.6739130434782609 and parameters: {'n_estimators': 822, 'max_depth': 16, 'min_samples_split': 39, 'min_samples_leaf': 58, 'criterion': 'entropy'}.
Trial 1902 finished with value: 0.7282608695652174 and parameters: {'n_estimators': 584, 'max_depth': 10, 'min_samples_split': 24, 'min_samples_leaf': 50, 'criterion': 'entropy'}.
Trial 1903 finished with value: 0.6304347826086957 and parameters: {'n_estimators': 485, 'max_depth': 5, 'min_samples_split': 17, 'min_samples_leaf': 55, 'criterion': 'entropy'}.
Trial 1904 finished with value: 0.6739130434782609 and parameters: {'n_estimators': 614, 'max_depth': 8, 'min_samples_split': 30, 'min_samples_leaf': 52, 'criterion': 'entropy'}.
Trial 1905 finished with value: 0.6739130434782609 and parameters: {'n_estimators': 958, 'max_depth': 53, 'min_samples_split': 36, 'min_samples_leaf': 49, 'criterion': 'entropy'}.
Trial 1906 finished with value: 0.6956521739130435 and parameters: {'n_estimators': 800, 'max_depth': 12, 'min_samples_split': 26, 'min_samples_leaf': 54, 'criterion': 'entropy'}.
Trial 1907 finished with value: 0.6956521739130435 and parameters: {'n_estimators': 784, 'max_depth': 9, 'min_samples_split': 120, 'min_samples_leaf': 61, 'criterion': 'entropy'}.
Trial 1908 finished with value: 0.717391304347826 and parameters: {'n_estimators': 732, 'max_depth': 11, 'min_samples_split': 20, 'min_samples_leaf': 58, 'criterion': 'entropy'}.
Trial 1909 finished with value: 0.6956521739130435 and parameters: {'n_estimators': 828, 'max_depth': 15, 'min_samples_split': 33, 'min_samples_leaf': 48, 'criterion': 'entropy'}.
Trial 1910 finished with value: 0.6630434782608695 and parameters: {'n_estimators': 508, 'max_depth': 7, 'min_samples_split': 50, 'min_samples_leaf': 51, 'criterion': 'entropy'}.
Trial 1911 finished with value: 0.7065217391304348 and parameters: {'n_estimators': 771, 'max_depth': 13, 'min_samples_split': 43, 'min_samples_leaf': 53, 'criterion': 'entropy'}.
Trial 1912 finished with value: 0.6847826086956522 and parameters: {'n_estimators': 812, 'max_depth': 10, 'min_samples_split': 28, 'min_samples_leaf': 74, 'criterion': 'gini'}.
Trial 1913 finished with value: 0.717391304347826 and parameters: {'n_estimators': 547, 'max_depth': 8, 'min_samples_split': 38, 'min_samples_leaf': 57, 'criterion': 'entropy'}.
Trial 1914 finished with value: 0.7065217391304348 and parameters: {'n_estimators': 758, 'max_depth': 12, 'min_samples_split': 23, 'min_samples_leaf': 53, 'criterion': 'entropy'}.
Trial 1915 finished with value: 0.6739130434782609 and parameters: {'n_estimators': 806, 'max_depth': 17, 'min_samples_split': 31, 'min_samples_leaf': 55, 'criterion': 'entropy'}.
Trial 1916 finished with value: 0.6630434782608695 and parameters: {'n_estimators': 832, 'max_depth': 92, 'min_samples_split': 35, 'min_samples_leaf': 60, 'criterion': 'entropy'}.
Trial 1917 finished with value: 0.6847826086956522 and parameters: {'n_estimators': 783, 'max_depth': 6, 'min_samples_split': 15, 'min_samples_leaf': 65, 'criterion': 'entropy'}.
Trial 1918 finished with value: 0.7282608695652174 and parameters: {'n_estimators': 738, 'max_depth': 10, 'min_samples_split': 28, 'min_samples_leaf': 50, 'criterion': 'entropy'}.
Trial 1919 finished with value: 0.7282608695652174 and parameters: {'n_estimators': 805, 'max_depth': 14, 'min_samples_split': 21, 'min_samples_leaf': 48, 'criterion': 'entropy'}.
Trial 1920 finished with value: 0.717391304347826 and parameters: {'n_estimators': 755, 'max_depth': 9, 'min_samples_split': 25, 'min_samples_leaf': 56, 'criterion': 'entropy'}.
Trial 1921 finished with value: 0.7065217391304348 and parameters: {'n_estimators': 787, 'max_depth': 11, 'min_samples_split': 41, 'min_samples_leaf': 51, 'criterion': 'entropy'}.
Trial 1922 finished with value: 0.7065217391304348 and parameters: {'n_estimators': 724, 'max_depth': 13, 'min_samples_split': 33, 'min_samples_leaf': 47, 'criterion': 'entropy'}.
Trial 1923 finished with value: 0.6630434782608695 and parameters: {'n_estimators': 557, 'max_depth': 48, 'min_samples_split': 29, 'min_samples_leaf': 53, 'criterion': 'entropy'}.
Trial 1924 finished with value: 0.7065217391304348 and parameters: {'n_estimators': 826, 'max_depth': 7, 'min_samples_split': 11, 'min_samples_leaf': 59, 'criterion': 'entropy'}.
Trial 1925 finished with value: 0.6847826086956522 and parameters: {'n_estimators': 770, 'max_depth': 15, 'min_samples_split': 87, 'min_samples_leaf': 57, 'criterion': 'entropy'}.
Trial 1926 finished with value: 0.6956521739130435 and parameters: {'n_estimators': 518, 'max_depth': 9, 'min_samples_split': 18, 'min_samples_leaf': 50, 'criterion': 'entropy'}.
Trial 1927 finished with value: 0.6413043478260869 and parameters: {'n_estimators': 812, 'max_depth': 5, 'min_samples_split': 37, 'min_samples_leaf': 55, 'criterion': 'entropy'}.
Trial 1928 finished with value: 0.6847826086956522 and parameters: {'n_estimators': 790, 'max_depth': 11, 'min_samples_split': 46, 'min_samples_leaf': 52, 'criterion': 'entropy'}.
Trial 1929 finished with value: 0.7065217391304348 and parameters: {'n_estimators': 705, 'max_depth': 13, 'min_samples_split': 23, 'min_samples_leaf': 47, 'criterion': 'entropy'}.
Trial 1930 finished with value: 0.6521739130434783 and parameters: {'n_estimators': 300, 'max_depth': 18, 'min_samples_split': 33, 'min_samples_leaf': 49, 'criterion': 'entropy'}.
Trial 1931 finished with value: 0.6956521739130435 and parameters: {'n_estimators': 682, 'max_depth': 8, 'min_samples_split': 28, 'min_samples_leaf': 54, 'criterion': 'gini'}.
Trial 1932 finished with value: 0.717391304347826 and parameters: {'n_estimators': 840, 'max_depth': 11, 'min_samples_split': 40, 'min_samples_leaf': 61, 'criterion': 'entropy'}.
Trial 1933 finished with value: 0.6847826086956522 and parameters: {'n_estimators': 746, 'max_depth': 9, 'min_samples_split': 25, 'min_samples_leaf': 57, 'criterion': 'entropy'}.
Trial 1934 finished with value: 0.717391304347826 and parameters: {'n_estimators': 807, 'max_depth': 12, 'min_samples_split': 31, 'min_samples_leaf': 52, 'criterion': 'entropy'}.
Trial 1935 finished with value: 0.6739130434782609 and parameters: {'n_estimators': 654, 'max_depth': 16, 'min_samples_split': 36, 'min_samples_leaf': 59, 'criterion': 'entropy'}.
Trial 1936 finished with value: 0.6847826086956522 and parameters: {'n_estimators': 773, 'max_depth': 7, 'min_samples_split': 20, 'min_samples_leaf': 50, 'criterion': 'entropy'}.
Trial 1937 finished with value: 0.6739130434782609 and parameters: {'n_estimators': 829, 'max_depth': 14, 'min_samples_split': 26, 'min_samples_leaf': 55, 'criterion': 'entropy'}.
Trial 1938 finished with value: 0.6847826086956522 and parameters: {'n_estimators': 793, 'max_depth': 10, 'min_samples_split': 114, 'min_samples_leaf': 46, 'criterion': 'entropy'}.
Trial 1939 finished with value: 0.6739130434782609 and parameters: {'n_estimators': 533, 'max_depth': 6, 'min_samples_split': 2, 'min_samples_leaf': 53, 'criterion': 'entropy'}.
Trial 1940 finished with value: 0.7065217391304348 and parameters: {'n_estimators': 756, 'max_depth': 12, 'min_samples_split': 199, 'min_samples_leaf': 48, 'criterion': 'entropy'}.
Trial 1941 finished with value: 0.6956521739130435 and parameters: {'n_estimators': 821, 'max_depth': 9, 'min_samples_split': 15, 'min_samples_leaf': 51, 'criterion': 'entropy'}.
Trial 1942 finished with value: 0.7065217391304348 and parameters: {'n_estimators': 923, 'max_depth': 11, 'min_samples_split': 31, 'min_samples_leaf': 63, 'criterion': 'entropy'}.
Trial 1943 finished with value: 0.6847826086956522 and parameters: {'n_estimators': 175, 'max_depth': 14, 'min_samples_split': 172, 'min_samples_leaf': 57, 'criterion': 'entropy'}.
Trial 1944 finished with value: 0.717391304347826 and parameters: {'n_estimators': 589, 'max_depth': 8, 'min_samples_split': 35, 'min_samples_leaf': 55, 'criterion': 'entropy'}.
Trial 1945 finished with value: 0.717391304347826 and parameters: {'n_estimators': 725, 'max_depth': 10, 'min_samples_split': 23, 'min_samples_leaf': 53, 'criterion': 'entropy'}.
Trial 1946 finished with value: 0.717391304347826 and parameters: {'n_estimators': 774, 'max_depth': 13, 'min_samples_split': 41, 'min_samples_leaf': 49, 'criterion': 'entropy'}.
Trial 1947 finished with value: 0.6739130434782609 and parameters: {'n_estimators': 806, 'max_depth': 7, 'min_samples_split': 28, 'min_samples_leaf': 45, 'criterion': 'entropy'}.
Trial 1948 finished with value: 0.6739130434782609 and parameters: {'n_estimators': 791, 'max_depth': 16, 'min_samples_split': 19, 'min_samples_leaf': 59, 'criterion': 'entropy'}.
Trial 1949 finished with value: 0.6847826086956522 and parameters: {'n_estimators': 834, 'max_depth': 33, 'min_samples_split': 33, 'min_samples_leaf': 51, 'criterion': 'gini'}.
Trial 1950 finished with value: 0.6413043478260869 and parameters: {'n_estimators': 743, 'max_depth': 5, 'min_samples_split': 26, 'min_samples_leaf': 57, 'criterion': 'entropy'}.
Trial 1951 finished with value: 0.717391304347826 and parameters: {'n_estimators': 763, 'max_depth': 11, 'min_samples_split': 37, 'min_samples_leaf': 54, 'criterion': 'entropy'}.
Trial 1952 finished with value: 0.717391304347826 and parameters: {'n_estimators': 807, 'max_depth': 9, 'min_samples_split': 31, 'min_samples_leaf': 48, 'criterion': 'entropy'}.
Trial 1953 finished with value: 0.717391304347826 and parameters: {'n_estimators': 556, 'max_depth': 13, 'min_samples_split': 22, 'min_samples_leaf': 51, 'criterion': 'entropy'}.
Trial 1954 finished with value: 0.7065217391304348 and parameters: {'n_estimators': 846, 'max_depth': 10, 'min_samples_split': 44, 'min_samples_leaf': 61, 'criterion': 'entropy'}.
Trial 1955 finished with value: 0.6956521739130435 and parameters: {'n_estimators': 780, 'max_depth': 15, 'min_samples_split': 52, 'min_samples_leaf': 56, 'criterion': 'entropy'}.
Trial 1956 finished with value: 0.6847826086956522 and parameters: {'n_estimators': 814, 'max_depth': 7, 'min_samples_split': 14, 'min_samples_leaf': 53, 'criterion': 'entropy'}.
Trial 1957 finished with value: 0.7065217391304348 and parameters: {'n_estimators': 792, 'max_depth': 12, 'min_samples_split': 28, 'min_samples_leaf': 49, 'criterion': 'entropy'}.
Trial 1958 finished with value: 0.6739130434782609 and parameters: {'n_estimators': 508, 'max_depth': 8, 'min_samples_split': 38, 'min_samples_leaf': 42, 'criterion': 'entropy'}.
Trial 1959 finished with value: 0.717391304347826 and parameters: {'n_estimators': 829, 'max_depth': 11, 'min_samples_split': 33, 'min_samples_leaf': 58, 'criterion': 'entropy'}.
Trial 1960 finished with value: 0.6521739130434783 and parameters: {'n_estimators': 711, 'max_depth': 20, 'min_samples_split': 19, 'min_samples_leaf': 55, 'criterion': 'entropy'}.
Trial 1961 finished with value: 0.6847826086956522 and parameters: {'n_estimators': 742, 'max_depth': 9, 'min_samples_split': 24, 'min_samples_leaf': 51, 'criterion': 'entropy'}.
Trial 1962 finished with value: 0.6847826086956522 and parameters: {'n_estimators': 903, 'max_depth': 24, 'min_samples_split': 29, 'min_samples_leaf': 47, 'criterion': 'entropy'}.
Trial 1963 finished with value: 0.6956521739130435 and parameters: {'n_estimators': 768, 'max_depth': 14, 'min_samples_split': 35, 'min_samples_leaf': 59, 'criterion': 'entropy'}.
Trial 1964 finished with value: 0.6630434782608695 and parameters: {'n_estimators': 844, 'max_depth': 18, 'min_samples_split': 22, 'min_samples_leaf': 52, 'criterion': 'entropy'}.
Trial 1965 finished with value: 0.7065217391304348 and parameters: {'n_estimators': 575, 'max_depth': 12, 'min_samples_split': 39, 'min_samples_leaf': 45, 'criterion': 'entropy'}.
Trial 1966 finished with value: 0.6847826086956522 and parameters: {'n_estimators': 797, 'max_depth': 6, 'min_samples_split': 146, 'min_samples_leaf': 54, 'criterion': 'entropy'}.
Trial 1967 finished with value: 0.7065217391304348 and parameters: {'n_estimators': 946, 'max_depth': 10, 'min_samples_split': 47, 'min_samples_leaf': 49, 'criterion': 'entropy'}.
Trial 1968 finished with value: 0.7065217391304348 and parameters: {'n_estimators': 538, 'max_depth': 13, 'min_samples_split': 118, 'min_samples_leaf': 56, 'criterion': 'gini'}.
Trial 1969 finished with value: 0.6956521739130435 and parameters: {'n_estimators': 819, 'max_depth': 9, 'min_samples_split': 8, 'min_samples_leaf': 61, 'criterion': 'entropy'}.
Trial 1970 finished with value: 0.6630434782608695 and parameters: {'n_estimators': 762, 'max_depth': 16, 'min_samples_split': 30, 'min_samples_leaf': 50, 'criterion': 'entropy'}.
Trial 1971 finished with value: 0.6739130434782609 and parameters: {'n_estimators': 728, 'max_depth': 7, 'min_samples_split': 26, 'min_samples_leaf': 38, 'criterion': 'entropy'}.
Trial 1972 finished with value: 0.7065217391304348 and parameters: {'n_estimators': 783, 'max_depth': 11, 'min_samples_split': 112, 'min_samples_leaf': 53, 'criterion': 'entropy'}.
Trial 1973 finished with value: 0.6847826086956522 and parameters: {'n_estimators': 816, 'max_depth': 14, 'min_samples_split': 17, 'min_samples_leaf': 56, 'criterion': 'entropy'}.
Trial 1974 finished with value: 0.7065217391304348 and parameters: {'n_estimators': 837, 'max_depth': 8, 'min_samples_split': 32, 'min_samples_leaf': 47, 'criterion': 'entropy'}.
Trial 1975 finished with value: 0.6413043478260869 and parameters: {'n_estimators': 606, 'max_depth': 5, 'min_samples_split': 42, 'min_samples_leaf': 51, 'criterion': 'entropy'}.
Trial 1976 finished with value: 0.6956521739130435 and parameters: {'n_estimators': 800, 'max_depth': 12, 'min_samples_split': 134, 'min_samples_leaf': 58, 'criterion': 'entropy'}.
Trial 1977 finished with value: 0.717391304347826 and parameters: {'n_estimators': 753, 'max_depth': 10, 'min_samples_split': 36, 'min_samples_leaf': 53, 'criterion': 'entropy'}.
Trial 1978 finished with value: 0.5978260869565217 and parameters: {'n_estimators': 456, 'max_depth': 8, 'min_samples_split': 27, 'min_samples_leaf': 17, 'criterion': 'entropy'}.
Trial 1979 finished with value: 0.6956521739130435 and parameters: {'n_estimators': 874, 'max_depth': 15, 'min_samples_split': 22, 'min_samples_leaf': 49, 'criterion': 'entropy'}.
Trial 1980 finished with value: 0.717391304347826 and parameters: {'n_estimators': 775, 'max_depth': 11, 'min_samples_split': 33, 'min_samples_leaf': 63, 'criterion': 'entropy'}.
Trial 1981 finished with value: 0.7065217391304348 and parameters: {'n_estimators': 698, 'max_depth': 13, 'min_samples_split': 60, 'min_samples_leaf': 44, 'criterion': 'entropy'}.
Trial 1982 finished with value: 0.6847826086956522 and parameters: {'n_estimators': 853, 'max_depth': 9, 'min_samples_split': 13, 'min_samples_leaf': 60, 'criterion': 'entropy'}.
Trial 1983 finished with value: 0.6956521739130435 and parameters: {'n_estimators': 797, 'max_depth': 11, 'min_samples_split': 25, 'min_samples_leaf': 55, 'criterion': 'entropy'}.
Trial 1984 finished with value: 0.6739130434782609 and parameters: {'n_estimators': 829, 'max_depth': 7, 'min_samples_split': 30, 'min_samples_leaf': 51, 'criterion': 'entropy'}.
Trial 1985 finished with value: 0.6739130434782609 and parameters: {'n_estimators': 560, 'max_depth': 17, 'min_samples_split': 39, 'min_samples_leaf': 47, 'criterion': 'entropy'}.
Trial 1986 finished with value: 0.7282608695652174 and parameters: {'n_estimators': 744, 'max_depth': 10, 'min_samples_split': 18, 'min_samples_leaf': 58, 'criterion': 'entropy'}.
Trial 1987 finished with value: 0.7282608695652174 and parameters: {'n_estimators': 780, 'max_depth': 13, 'min_samples_split': 123, 'min_samples_leaf': 53, 'criterion': 'gini'}.
Trial 1988 finished with value: 0.6847826086956522 and parameters: {'n_estimators': 814, 'max_depth': 44, 'min_samples_split': 35, 'min_samples_leaf': 49, 'criterion': 'entropy'}.
Trial 1989 finished with value: 0.7282608695652174 and parameters: {'n_estimators': 754, 'max_depth': 9, 'min_samples_split': 28, 'min_samples_leaf': 55, 'criterion': 'entropy'}.
Trial 1990 finished with value: 0.6739130434782609 and parameters: {'n_estimators': 525, 'max_depth': 6, 'min_samples_split': 22, 'min_samples_leaf': 52, 'criterion': 'entropy'}.
Trial 1991 finished with value: 0.6739130434782609 and parameters: {'n_estimators': 797, 'max_depth': 15, 'min_samples_split': 31, 'min_samples_leaf': 60, 'criterion': 'entropy'}.
Trial 1992 finished with value: 0.6956521739130435 and parameters: {'n_estimators': 728, 'max_depth': 12, 'min_samples_split': 25, 'min_samples_leaf': 56, 'criterion': 'entropy'}.
Trial 1993 finished with value: 0.6956521739130435 and parameters: {'n_estimators': 629, 'max_depth': 8, 'min_samples_split': 40, 'min_samples_leaf': 50, 'criterion': 'entropy'}.
Trial 1994 finished with value: 0.7065217391304348 and parameters: {'n_estimators': 838, 'max_depth': 11, 'min_samples_split': 34, 'min_samples_leaf': 54, 'criterion': 'entropy'}.
Trial 1995 finished with value: 0.6521739130434783 and parameters: {'n_estimators': 859, 'max_depth': 5, 'min_samples_split': 110, 'min_samples_leaf': 68, 'criterion': 'entropy'}.
Trial 1996 finished with value: 0.7065217391304348 and parameters: {'n_estimators': 769, 'max_depth': 14, 'min_samples_split': 19, 'min_samples_leaf': 65, 'criterion': 'entropy'}.
Trial 1997 finished with value: 0.6847826086956522 and parameters: {'n_estimators': 675, 'max_depth': 71, 'min_samples_split': 29, 'min_samples_leaf': 46, 'criterion': 'entropy'}.
Trial 1998 finished with value: 0.7065217391304348 and parameters: {'n_estimators': 814, 'max_depth': 10, 'min_samples_split': 37, 'min_samples_leaf': 57, 'criterion': 'entropy'}.
Trial 1999 finished with value: 0.6847826086956522 and parameters: {'n_estimators': 792, 'max_depth': 8, 'min_samples_split': 44, 'min_samples_leaf': 51, 'criterion': 'entropy'}.
Trial 2000 finished with value: 0.6956521739130435 and parameters: {'n_estimators': 825, 'max_depth': 12, 'min_samples_split': 128, 'min_samples_leaf': 48, 'criterion': 'entropy'}.
Trial 2001 finished with value: 0.717391304347826 and parameters: {'n_estimators': 720, 'max_depth': 10, 'min_samples_split': 25, 'min_samples_leaf': 53, 'criterion': 'entropy'}.
Trial 2002 finished with value: 0.7065217391304348 and parameters: {'n_estimators': 889, 'max_depth': 13, 'min_samples_split': 15, 'min_samples_leaf': 62, 'criterion': 'entropy'}.
Trial 2003 finished with value: 0.6847826086956522 and parameters: {'n_estimators': 499, 'max_depth': 7, 'min_samples_split': 32, 'min_samples_leaf': 57, 'criterion': 'entropy'}.
Trial 2004 finished with value: 0.6630434782608695 and parameters: {'n_estimators': 779, 'max_depth': 16, 'min_samples_split': 21, 'min_samples_leaf': 50, 'criterion': 'entropy'}.
Trial 2005 finished with value: 0.7065217391304348 and parameters: {'n_estimators': 757, 'max_depth': 9, 'min_samples_split': 28, 'min_samples_leaf': 59, 'criterion': 'gini'}.
Trial 2006 finished with value: 0.717391304347826 and parameters: {'n_estimators': 805, 'max_depth': 11, 'min_samples_split': 36, 'min_samples_leaf': 54, 'criterion': 'entropy'}.
Trial 2007 finished with value: 0.7065217391304348 and parameters: {'n_estimators': 969, 'max_depth': 14, 'min_samples_split': 24, 'min_samples_leaf': 48, 'criterion': 'entropy'}.
Trial 2008 finished with value: 0.6739130434782609 and parameters: {'n_estimators': 850, 'max_depth': 7, 'min_samples_split': 31, 'min_samples_leaf': 52, 'criterion': 'entropy'}.
Trial 2009 finished with value: 0.6739130434782609 and parameters: {'n_estimators': 373, 'max_depth': 12, 'min_samples_split': 9, 'min_samples_leaf': 90, 'criterion': 'entropy'}.
Trial 2010 finished with value: 0.6847826086956522 and parameters: {'n_estimators': 541, 'max_depth': 9, 'min_samples_split': 40, 'min_samples_leaf': 45, 'criterion': 'entropy'}.
Trial 2011 finished with value: 0.6739130434782609 and parameters: {'n_estimators': 827, 'max_depth': 18, 'min_samples_split': 56, 'min_samples_leaf': 55, 'criterion': 'entropy'}.
Trial 2012 finished with value: 0.6413043478260869 and parameters: {'n_estimators': 741, 'max_depth': 5, 'min_samples_split': 18, 'min_samples_leaf': 50, 'criterion': 'entropy'}.
Trial 2013 finished with value: 0.7282608695652174 and parameters: {'n_estimators': 790, 'max_depth': 10, 'min_samples_split': 27, 'min_samples_leaf': 58, 'criterion': 'entropy'}.
Trial 2014 finished with value: 0.6956521739130435 and parameters: {'n_estimators': 335, 'max_depth': 13, 'min_samples_split': 48, 'min_samples_leaf': 52, 'criterion': 'entropy'}.
Trial 2015 finished with value: 0.6956521739130435 and parameters: {'n_estimators': 477, 'max_depth': 8, 'min_samples_split': 35, 'min_samples_leaf': 47, 'criterion': 'entropy'}.
Trial 2016 finished with value: 0.6739130434782609 and parameters: {'n_estimators': 770, 'max_depth': 15, 'min_samples_split': 22, 'min_samples_leaf': 60, 'criterion': 'entropy'}.
Trial 2017 finished with value: 0.7065217391304348 and parameters: {'n_estimators': 580, 'max_depth': 11, 'min_samples_split': 32, 'min_samples_leaf': 56, 'criterion': 'entropy'}.
Trial 2018 finished with value: 0.7065217391304348 and parameters: {'n_estimators': 811, 'max_depth': 12, 'min_samples_split': 27, 'min_samples_leaf': 54, 'criterion': 'entropy'}.
Trial 2019 finished with value: 0.6739130434782609 and parameters: {'n_estimators': 871, 'max_depth': 7, 'min_samples_split': 43, 'min_samples_leaf': 49, 'criterion': 'entropy'}.
Trial 2020 finished with value: 0.6739130434782609 and parameters: {'n_estimators': 839, 'max_depth': 9, 'min_samples_split': 38, 'min_samples_leaf': 51, 'criterion': 'entropy'}.
Trial 2021 finished with value: 0.6739130434782609 and parameters: {'n_estimators': 708, 'max_depth': 14, 'min_samples_split': 30, 'min_samples_leaf': 43, 'criterion': 'entropy'}.
