Trial 4233 finished with value: 0.6739130434782609 and parameters: {'n_estimators': 269, 'max_depth': 15, 'min_samples_split': 138, 'min_samples_leaf': 73, 'criterion': 'gini'}.
Trial 4234 finished with value: 0.6739130434782609 and parameters: {'n_estimators': 237, 'max_depth': 9, 'min_samples_split': 133, 'min_samples_leaf': 57, 'criterion': 'gini'}.
Trial 4235 finished with value: 0.7065217391304348 and parameters: {'n_estimators': 298, 'max_depth': 11, 'min_samples_split': 177, 'min_samples_leaf': 77, 'criterion': 'gini'}.
Trial 4236 finished with value: 0.6739130434782609 and parameters: {'n_estimators': 269, 'max_depth': 6, 'min_samples_split': 143, 'min_samples_leaf': 63, 'criterion': 'gini'}.
Trial 4237 finished with value: 0.7065217391304348 and parameters: {'n_estimators': 699, 'max_depth': 13, 'min_samples_split': 24, 'min_samples_leaf': 67, 'criterion': 'gini'}.
Trial 4238 finished with value: 0.6956521739130435 and parameters: {'n_estimators': 252, 'max_depth': 9, 'min_samples_split': 128, 'min_samples_leaf': 58, 'criterion': 'gini'}.
Trial 4239 finished with value: 0.7065217391304348 and parameters: {'n_estimators': 321, 'max_depth': 11, 'min_samples_split': 34, 'min_samples_leaf': 61, 'criterion': 'gini'}.
Trial 4240 finished with value: 0.6956521739130435 and parameters: {'n_estimators': 291, 'max_depth': 16, 'min_samples_split': 44, 'min_samples_leaf': 56, 'criterion': 'gini'}.
Trial 4241 finished with value: 0.717391304347826 and parameters: {'n_estimators': 284, 'max_depth': 8, 'min_samples_split': 149, 'min_samples_leaf': 71, 'criterion': 'gini'}.
Trial 4242 finished with value: 0.6956521739130435 and parameters: {'n_estimators': 352, 'max_depth': 13, 'min_samples_split': 117, 'min_samples_leaf': 74, 'criterion': 'gini'}.
Trial 4243 finished with value: 0.7065217391304348 and parameters: {'n_estimators': 221, 'max_depth': 10, 'min_samples_split': 85, 'min_samples_leaf': 60, 'criterion': 'gini'}.
Trial 4244 finished with value: 0.6413043478260869 and parameters: {'n_estimators': 308, 'max_depth': 5, 'min_samples_split': 29, 'min_samples_leaf': 64, 'criterion': 'gini'}.
Trial 4245 finished with value: 0.6739130434782609 and parameters: {'n_estimators': 258, 'max_depth': 14, 'min_samples_split': 38, 'min_samples_leaf': 69, 'criterion': 'gini'}.
Trial 4246 finished with value: 0.6847826086956522 and parameters: {'n_estimators': 281, 'max_depth': 38, 'min_samples_split': 25, 'min_samples_leaf': 58, 'criterion': 'gini'}.
Trial 4247 finished with value: 0.6847826086956522 and parameters: {'n_estimators': 241, 'max_depth': 7, 'min_samples_split': 41, 'min_samples_leaf': 56, 'criterion': 'gini'}.
Trial 4248 finished with value: 0.7065217391304348 and parameters: {'n_estimators': 272, 'max_depth': 12, 'min_samples_split': 95, 'min_samples_leaf': 62, 'criterion': 'gini'}.
Trial 4249 finished with value: 0.7065217391304348 and parameters: {'n_estimators': 476, 'max_depth': 9, 'min_samples_split': 31, 'min_samples_leaf': 60, 'criterion': 'gini'}.
Trial 4250 finished with value: 0.6739130434782609 and parameters: {'n_estimators': 304, 'max_depth': 66, 'min_samples_split': 108, 'min_samples_leaf': 66, 'criterion': 'gini'}.
Trial 4251 finished with value: 0.6847826086956522 and parameters: {'n_estimators': 253, 'max_depth': 10, 'min_samples_split': 138, 'min_samples_leaf': 19, 'criterion': 'gini'}.
Trial 4252 finished with value: 0.6847826086956522 and parameters: {'n_estimators': 328, 'max_depth': 7, 'min_samples_split': 35, 'min_samples_leaf': 58, 'criterion': 'gini'}.
Trial 4253 finished with value: 0.6739130434782609 and parameters: {'n_estimators': 287, 'max_depth': 17, 'min_samples_split': 10, 'min_samples_leaf': 75, 'criterion': 'gini'}.
Trial 4254 finished with value: 0.7065217391304348 and parameters: {'n_estimators': 266, 'max_depth': 12, 'min_samples_split': 143, 'min_samples_leaf': 63, 'criterion': 'gini'}.
Trial 4255 finished with value: 0.6630434782608695 and parameters: {'n_estimators': 203, 'max_depth': 15, 'min_samples_split': 23, 'min_samples_leaf': 56, 'criterion': 'gini'}.
Trial 4256 finished with value: 0.717391304347826 and parameters: {'n_estimators': 239, 'max_depth': 9, 'min_samples_split': 122, 'min_samples_leaf': 60, 'criterion': 'gini'}.
Trial 4257 finished with value: 0.6739130434782609 and parameters: {'n_estimators': 148, 'max_depth': 11, 'min_samples_split': 28, 'min_samples_leaf': 71, 'criterion': 'gini'}.
Trial 4258 finished with value: 0.717391304347826 and parameters: {'n_estimators': 175, 'max_depth': 7, 'min_samples_split': 54, 'min_samples_leaf': 58, 'criterion': 'gini'}.
Trial 4259 finished with value: 0.6956521739130435 and parameters: {'n_estimators': 313, 'max_depth': 13, 'min_samples_split': 134, 'min_samples_leaf': 56, 'criterion': 'gini'}.
Trial 4260 finished with value: 0.717391304347826 and parameters: {'n_estimators': 268, 'max_depth': 10, 'min_samples_split': 33, 'min_samples_leaf': 61, 'criterion': 'gini'}.
Trial 4261 finished with value: 0.6630434782608695 and parameters: {'n_estimators': 229, 'max_depth': 5, 'min_samples_split': 148, 'min_samples_leaf': 65, 'criterion': 'gini'}.
Trial 4262 finished with value: 0.6956521739130435 and parameters: {'n_estimators': 295, 'max_depth': 14, 'min_samples_split': 39, 'min_samples_leaf': 68, 'criterion': 'gini'}.
Trial 4263 finished with value: 0.717391304347826 and parameters: {'n_estimators': 340, 'max_depth': 8, 'min_samples_split': 45, 'min_samples_leaf': 59, 'criterion': 'gini'}.
Trial 4264 finished with value: 0.717391304347826 and parameters: {'n_estimators': 282, 'max_depth': 11, 'min_samples_split': 128, 'min_samples_leaf': 63, 'criterion': 'gini'}.
Trial 4265 finished with value: 0.717391304347826 and parameters: {'n_estimators': 375, 'max_depth': 8, 'min_samples_split': 25, 'min_samples_leaf': 57, 'criterion': 'gini'}.
Trial 4266 finished with value: 0.6847826086956522 and parameters: {'n_estimators': 257, 'max_depth': 93, 'min_samples_split': 36, 'min_samples_leaf': 73, 'criterion': 'gini'}.
Trial 4267 finished with value: 0.6847826086956522 and parameters: {'n_estimators': 303, 'max_depth': 12, 'min_samples_split': 21, 'min_samples_leaf': 59, 'criterion': 'gini'}.
Trial 4268 finished with value: 0.6956521739130435 and parameters: {'n_estimators': 274, 'max_depth': 62, 'min_samples_split': 32, 'min_samples_leaf': 61, 'criterion': 'gini'}.
Trial 4269 finished with value: 0.6739130434782609 and parameters: {'n_estimators': 316, 'max_depth': 18, 'min_samples_split': 29, 'min_samples_leaf': 56, 'criterion': 'gini'}.
Trial 4270 finished with value: 0.7065217391304348 and parameters: {'n_estimators': 247, 'max_depth': 9, 'min_samples_split': 140, 'min_samples_leaf': 70, 'criterion': 'gini'}.
Trial 4271 finished with value: 0.6847826086956522 and parameters: {'n_estimators': 284, 'max_depth': 15, 'min_samples_split': 125, 'min_samples_leaf': 62, 'criterion': 'gini'}.
Trial 4272 finished with value: 0.6956521739130435 and parameters: {'n_estimators': 654, 'max_depth': 11, 'min_samples_split': 153, 'min_samples_leaf': 76, 'criterion': 'gini'}.
Trial 4273 finished with value: 0.6739130434782609 and parameters: {'n_estimators': 222, 'max_depth': 6, 'min_samples_split': 146, 'min_samples_leaf': 58, 'criterion': 'gini'}.
Trial 4274 finished with value: 0.6739130434782609 and parameters: {'n_estimators': 259, 'max_depth': 13, 'min_samples_split': 118, 'min_samples_leaf': 82, 'criterion': 'gini'}.
Trial 4275 finished with value: 0.717391304347826 and parameters: {'n_estimators': 298, 'max_depth': 9, 'min_samples_split': 37, 'min_samples_leaf': 65, 'criterion': 'gini'}.
Trial 4276 finished with value: 0.7065217391304348 and parameters: {'n_estimators': 703, 'max_depth': 10, 'min_samples_split': 49, 'min_samples_leaf': 60, 'criterion': 'gini'}.
Trial 4277 finished with value: 0.6847826086956522 and parameters: {'n_estimators': 270, 'max_depth': 27, 'min_samples_split': 6, 'min_samples_leaf': 55, 'criterion': 'gini'}.
Trial 4278 finished with value: 0.6847826086956522 and parameters: {'n_estimators': 327, 'max_depth': 7, 'min_samples_split': 14, 'min_samples_leaf': 58, 'criterion': 'entropy'}.
Trial 4279 finished with value: 0.7065217391304348 and parameters: {'n_estimators': 291, 'max_depth': 12, 'min_samples_split': 42, 'min_samples_leaf': 72, 'criterion': 'entropy'}.
Trial 4280 finished with value: 0.6630434782608695 and parameters: {'n_estimators': 239, 'max_depth': 14, 'min_samples_split': 27, 'min_samples_leaf': 67, 'criterion': 'gini'}.
Trial 4281 finished with value: 0.6847826086956522 and parameters: {'n_estimators': 256, 'max_depth': 84, 'min_samples_split': 131, 'min_samples_leaf': 56, 'criterion': 'entropy'}.
Trial 4282 finished with value: 0.6630434782608695 and parameters: {'n_estimators': 122, 'max_depth': 20, 'min_samples_split': 137, 'min_samples_leaf': 63, 'criterion': 'gini'}.
Trial 4283 finished with value: 0.6630434782608695 and parameters: {'n_estimators': 211, 'max_depth': 53, 'min_samples_split': 143, 'min_samples_leaf': 60, 'criterion': 'entropy'}.
Trial 4284 finished with value: 0.6739130434782609 and parameters: {'n_estimators': 277, 'max_depth': 16, 'min_samples_split': 32, 'min_samples_leaf': 58, 'criterion': 'gini'}.
Trial 4285 finished with value: 0.717391304347826 and parameters: {'n_estimators': 306, 'max_depth': 10, 'min_samples_split': 20, 'min_samples_leaf': 62, 'criterion': 'entropy'}.
Trial 4286 finished with value: 0.6847826086956522 and parameters: {'n_estimators': 243, 'max_depth': 8, 'min_samples_split': 112, 'min_samples_leaf': 74, 'criterion': 'gini'}.
Trial 4287 finished with value: 0.6304347826086957 and parameters: {'n_estimators': 287, 'max_depth': 5, 'min_samples_split': 25, 'min_samples_leaf': 56, 'criterion': 'entropy'}.
Trial 4288 finished with value: 0.6847826086956522 and parameters: {'n_estimators': 353, 'max_depth': 13, 'min_samples_split': 38, 'min_samples_leaf': 70, 'criterion': 'gini'}.
Trial 4289 finished with value: 0.717391304347826 and parameters: {'n_estimators': 427, 'max_depth': 11, 'min_samples_split': 34, 'min_samples_leaf': 60, 'criterion': 'entropy'}.
Trial 4290 finished with value: 0.7065217391304348 and parameters: {'n_estimators': 320, 'max_depth': 8, 'min_samples_split': 161, 'min_samples_leaf': 65, 'criterion': 'gini'}.
Trial 4291 finished with value: 0.717391304347826 and parameters: {'n_estimators': 255, 'max_depth': 10, 'min_samples_split': 29, 'min_samples_leaf': 68, 'criterion': 'entropy'}.
Trial 4292 finished with value: 0.6847826086956522 and parameters: {'n_estimators': 951, 'max_depth': 12, 'min_samples_split': 136, 'min_samples_leaf': 77, 'criterion': 'gini'}.
Trial 4293 finished with value: 0.6847826086956522 and parameters: {'n_estimators': 271, 'max_depth': 14, 'min_samples_split': 18, 'min_samples_leaf': 58, 'criterion': 'entropy'}.
Trial 4294 finished with value: 0.6630434782608695 and parameters: {'n_estimators': 452, 'max_depth': 7, 'min_samples_split': 42, 'min_samples_leaf': 55, 'criterion': 'gini'}.
Trial 4295 finished with value: 0.6956521739130435 and parameters: {'n_estimators': 619, 'max_depth': 10, 'min_samples_split': 141, 'min_samples_leaf': 61, 'criterion': 'entropy'}.
Trial 4296 finished with value: 0.6739130434782609 and parameters: {'n_estimators': 228, 'max_depth': 16, 'min_samples_split': 22, 'min_samples_leaf': 72, 'criterion': 'gini'}.
Trial 4297 finished with value: 0.6956521739130435 and parameters: {'n_estimators': 302, 'max_depth': 9, 'min_samples_split': 30, 'min_samples_leaf': 64, 'criterion': 'entropy'}.
Trial 4298 finished with value: 0.7065217391304348 and parameters: {'n_estimators': 670, 'max_depth': 12, 'min_samples_split': 148, 'min_samples_leaf': 58, 'criterion': 'gini'}.
Trial 4299 finished with value: 0.6847826086956522 and parameters: {'n_estimators': 285, 'max_depth': 6, 'min_samples_split': 34, 'min_samples_leaf': 60, 'criterion': 'entropy'}.
Trial 4300 finished with value: 0.7065217391304348 and parameters: {'n_estimators': 266, 'max_depth': 8, 'min_samples_split': 26, 'min_samples_leaf': 55, 'criterion': 'gini'}.
Trial 4301 finished with value: 0.6956521739130435 and parameters: {'n_estimators': 338, 'max_depth': 14, 'min_samples_split': 132, 'min_samples_leaf': 62, 'criterion': 'entropy'}.
Trial 4302 finished with value: 0.7282608695652174 and parameters: {'n_estimators': 249, 'max_depth': 11, 'min_samples_split': 121, 'min_samples_leaf': 57, 'criterion': 'gini'}.
Trial 4303 finished with value: 0.7391304347826086 and parameters: {'n_estimators': 309, 'max_depth': 9, 'min_samples_split': 40, 'min_samples_leaf': 74, 'criterion': 'entropy'}.
Trial 4304 finished with value: 0.6739130434782609 and parameters: {'n_estimators': 284, 'max_depth': 35, 'min_samples_split': 36, 'min_samples_leaf': 79, 'criterion': 'entropy'}.
Trial 4305 finished with value: 0.6630434782608695 and parameters: {'n_estimators': 186, 'max_depth': 18, 'min_samples_split': 45, 'min_samples_leaf': 56, 'criterion': 'gini'}.
Trial 4306 finished with value: 0.6413043478260869 and parameters: {'n_estimators': 268, 'max_depth': 5, 'min_samples_split': 31, 'min_samples_leaf': 59, 'criterion': 'entropy'}.
Trial 4307 finished with value: 0.7065217391304348 and parameters: {'n_estimators': 230, 'max_depth': 12, 'min_samples_split': 140, 'min_samples_leaf': 69, 'criterion': 'gini'}.
Trial 4308 finished with value: 0.6739130434782609 and parameters: {'n_estimators': 392, 'max_depth': 7, 'min_samples_split': 155, 'min_samples_leaf': 33, 'criterion': 'entropy'}.
Trial 4309 finished with value: 0.6956521739130435 and parameters: {'n_estimators': 303, 'max_depth': 15, 'min_samples_split': 23, 'min_samples_leaf': 62, 'criterion': 'gini'}.
Trial 4310 finished with value: 0.6956521739130435 and parameters: {'n_estimators': 695, 'max_depth': 10, 'min_samples_split': 145, 'min_samples_leaf': 66, 'criterion': 'entropy'}.
Trial 4311 finished with value: 0.6956521739130435 and parameters: {'n_estimators': 324, 'max_depth': 13, 'min_samples_split': 126, 'min_samples_leaf': 60, 'criterion': 'gini'}.
Trial 4312 finished with value: 0.7065217391304348 and parameters: {'n_estimators': 282, 'max_depth': 9, 'min_samples_split': 29, 'min_samples_leaf': 58, 'criterion': 'entropy'}.
Trial 4313 finished with value: 0.6847826086956522 and parameters: {'n_estimators': 253, 'max_depth': 11, 'min_samples_split': 12, 'min_samples_leaf': 64, 'criterion': 'gini'}.
Trial 4314 finished with value: 0.6956521739130435 and parameters: {'n_estimators': 264, 'max_depth': 8, 'min_samples_split': 151, 'min_samples_leaf': 56, 'criterion': 'entropy'}.
Trial 4315 finished with value: 0.6956521739130435 and parameters: {'n_estimators': 294, 'max_depth': 14, 'min_samples_split': 38, 'min_samples_leaf': 60, 'criterion': 'gini'}.
Trial 4316 finished with value: 0.717391304347826 and parameters: {'n_estimators': 240, 'max_depth': 11, 'min_samples_split': 34, 'min_samples_leaf': 72, 'criterion': 'entropy'}.
Trial 4317 finished with value: 0.6847826086956522 and parameters: {'n_estimators': 158, 'max_depth': 7, 'min_samples_split': 18, 'min_samples_leaf': 55, 'criterion': 'gini'}.
Trial 4318 finished with value: 0.6956521739130435 and parameters: {'n_estimators': 274, 'max_depth': 16, 'min_samples_split': 25, 'min_samples_leaf': 76, 'criterion': 'entropy'}.
Trial 4319 finished with value: 0.7282608695652174 and parameters: {'n_estimators': 214, 'max_depth': 13, 'min_samples_split': 135, 'min_samples_leaf': 62, 'criterion': 'gini'}.
Trial 4320 finished with value: 0.7282608695652174 and parameters: {'n_estimators': 318, 'max_depth': 9, 'min_samples_split': 32, 'min_samples_leaf': 57, 'criterion': 'entropy'}.
Trial 4321 finished with value: 0.6847826086956522 and parameters: {'n_estimators': 294, 'max_depth': 6, 'min_samples_split': 117, 'min_samples_leaf': 59, 'criterion': 'gini'}.
Trial 4322 finished with value: 0.6739130434782609 and parameters: {'n_estimators': 258, 'max_depth': 87, 'min_samples_split': 47, 'min_samples_leaf': 68, 'criterion': 'entropy'}.
Trial 4323 finished with value: 0.6521739130434783 and parameters: {'n_estimators': 406, 'max_depth': 23, 'min_samples_split': 38, 'min_samples_leaf': 64, 'criterion': 'gini'}.
Trial 4324 finished with value: 0.7065217391304348 and parameters: {'n_estimators': 359, 'max_depth': 11, 'min_samples_split': 28, 'min_samples_leaf': 71, 'criterion': 'entropy'}.
Trial 4325 finished with value: 0.6956521739130435 and parameters: {'n_estimators': 340, 'max_depth': 9, 'min_samples_split': 145, 'min_samples_leaf': 61, 'criterion': 'gini'}.
Trial 4326 finished with value: 0.6847826086956522 and parameters: {'n_estimators': 711, 'max_depth': 12, 'min_samples_split': 130, 'min_samples_leaf': 58, 'criterion': 'entropy'}.
Trial 4327 finished with value: 0.7065217391304348 and parameters: {'n_estimators': 276, 'max_depth': 7, 'min_samples_split': 141, 'min_samples_leaf': 75, 'criterion': 'gini'}.
Trial 4328 finished with value: 0.6630434782608695 and parameters: {'n_estimators': 979, 'max_depth': 17, 'min_samples_split': 105, 'min_samples_leaf': 55, 'criterion': 'entropy'}.
Trial 4329 finished with value: 0.717391304347826 and parameters: {'n_estimators': 237, 'max_depth': 14, 'min_samples_split': 41, 'min_samples_leaf': 60, 'criterion': 'gini'}.
Trial 4330 finished with value: 0.717391304347826 and parameters: {'n_estimators': 301, 'max_depth': 10, 'min_samples_split': 21, 'min_samples_leaf': 63, 'criterion': 'entropy'}.
Trial 4331 finished with value: 0.6413043478260869 and parameters: {'n_estimators': 289, 'max_depth': 5, 'min_samples_split': 34, 'min_samples_leaf': 58, 'criterion': 'gini'}.
Trial 4332 finished with value: 0.6195652173913043 and parameters: {'n_estimators': 271, 'max_depth': 12, 'min_samples_split': 25, 'min_samples_leaf': 15, 'criterion': 'entropy'}.
Trial 4333 finished with value: 0.7065217391304348 and parameters: {'n_estimators': 252, 'max_depth': 9, 'min_samples_split': 137, 'min_samples_leaf': 73, 'criterion': 'entropy'}.
Trial 4334 finished with value: 0.6739130434782609 and parameters: {'n_estimators': 306, 'max_depth': 15, 'min_samples_split': 61, 'min_samples_leaf': 66, 'criterion': 'gini'}.
Trial 4335 finished with value: 0.6739130434782609 and parameters: {'n_estimators': 260, 'max_depth': 7, 'min_samples_split': 31, 'min_samples_leaf': 55, 'criterion': 'entropy'}.
Trial 4336 finished with value: 0.7065217391304348 and parameters: {'n_estimators': 228, 'max_depth': 11, 'min_samples_split': 125, 'min_samples_leaf': 61, 'criterion': 'gini'}.
Trial 4337 finished with value: 0.6847826086956522 and parameters: {'n_estimators': 290, 'max_depth': 13, 'min_samples_split': 112, 'min_samples_leaf': 93, 'criterion': 'entropy'}.
Trial 4338 finished with value: 0.6956521739130435 and parameters: {'n_estimators': 334, 'max_depth': 9, 'min_samples_split': 148, 'min_samples_leaf': 58, 'criterion': 'gini'}.
Trial 4339 finished with value: 0.6847826086956522 and parameters: {'n_estimators': 321, 'max_depth': 11, 'min_samples_split': 16, 'min_samples_leaf': 70, 'criterion': 'entropy'}.
Trial 4340 finished with value: 0.6847826086956522 and parameters: {'n_estimators': 922, 'max_depth': 7, 'min_samples_split': 37, 'min_samples_leaf': 57, 'criterion': 'gini'}.
Trial 4341 finished with value: 0.6956521739130435 and parameters: {'n_estimators': 207, 'max_depth': 13, 'min_samples_split': 28, 'min_samples_leaf': 63, 'criterion': 'entropy'}.
Trial 4342 finished with value: 0.717391304347826 and parameters: {'n_estimators': 275, 'max_depth': 10, 'min_samples_split': 51, 'min_samples_leaf': 60, 'criterion': 'gini'}.
Trial 4343 finished with value: 0.7282608695652174 and parameters: {'n_estimators': 256, 'max_depth': 8, 'min_samples_split': 42, 'min_samples_leaf': 55, 'criterion': 'entropy'}.
Trial 4344 finished with value: 0.6847826086956522 and parameters: {'n_estimators': 283, 'max_depth': 19, 'min_samples_split': 168, 'min_samples_leaf': 59, 'criterion': 'gini'}.
Trial 4345 finished with value: 0.6630434782608695 and parameters: {'n_estimators': 245, 'max_depth': 5, 'min_samples_split': 134, 'min_samples_leaf': 67, 'criterion': 'entropy'}.
Trial 4346 finished with value: 0.6847826086956522 and parameters: {'n_estimators': 312, 'max_depth': 15, 'min_samples_split': 121, 'min_samples_leaf': 57, 'criterion': 'gini'}.
Trial 4347 finished with value: 0.7065217391304348 and parameters: {'n_estimators': 137, 'max_depth': 12, 'min_samples_split': 66, 'min_samples_leaf': 62, 'criterion': 'entropy'}.
Trial 4348 finished with value: 0.6956521739130435 and parameters: {'n_estimators': 718, 'max_depth': 10, 'min_samples_split': 35, 'min_samples_leaf': 73, 'criterion': 'gini'}.
Trial 4349 finished with value: 0.6956521739130435 and parameters: {'n_estimators': 273, 'max_depth': 8, 'min_samples_split': 143, 'min_samples_leaf': 55, 'criterion': 'entropy'}.
Trial 4350 finished with value: 0.7065217391304348 and parameters: {'n_estimators': 299, 'max_depth': 13, 'min_samples_split': 24, 'min_samples_leaf': 59, 'criterion': 'gini'}.
Trial 4351 finished with value: 0.6739130434782609 and parameters: {'n_estimators': 227, 'max_depth': 16, 'min_samples_split': 30, 'min_samples_leaf': 69, 'criterion': 'entropy'}.
Trial 4352 finished with value: 0.717391304347826 and parameters: {'n_estimators': 260, 'max_depth': 10, 'min_samples_split': 138, 'min_samples_leaf': 61, 'criterion': 'gini'}.
Trial 4353 finished with value: 0.6956521739130435 and parameters: {'n_estimators': 286, 'max_depth': 7, 'min_samples_split': 34, 'min_samples_leaf': 64, 'criterion': 'entropy'}.
Trial 4354 finished with value: 0.7065217391304348 and parameters: {'n_estimators': 317, 'max_depth': 12, 'min_samples_split': 46, 'min_samples_leaf': 57, 'criterion': 'gini'}.
Trial 4355 finished with value: 0.6739130434782609 and parameters: {'n_estimators': 246, 'max_depth': 9, 'min_samples_split': 20, 'min_samples_leaf': 77, 'criterion': 'entropy'}.
