Trial 9516 finished with value: 0.6739130434782609 and parameters: {'n_estimators': 327, 'max_depth': 7, 'min_samples_split': 11, 'min_samples_leaf': 57, 'criterion': 'entropy'}.
Trial 9517 finished with value: 0.6739130434782609 and parameters: {'n_estimators': 175, 'max_depth': 12, 'min_samples_split': 33, 'min_samples_leaf': 51, 'criterion': 'gini'}.
Trial 9518 finished with value: 0.6630434782608695 and parameters: {'n_estimators': 298, 'max_depth': 5, 'min_samples_split': 125, 'min_samples_leaf': 64, 'criterion': 'entropy'}.
Trial 9519 finished with value: 0.6956521739130435 and parameters: {'n_estimators': 887, 'max_depth': 9, 'min_samples_split': 140, 'min_samples_leaf': 59, 'criterion': 'entropy'}.
Trial 9520 finished with value: 0.7065217391304348 and parameters: {'n_estimators': 853, 'max_depth': 11, 'min_samples_split': 41, 'min_samples_leaf': 55, 'criterion': 'gini'}.
Trial 9521 finished with value: 0.6956521739130435 and parameters: {'n_estimators': 364, 'max_depth': 13, 'min_samples_split': 22, 'min_samples_leaf': 53, 'criterion': 'entropy'}.
Trial 9522 finished with value: 0.7065217391304348 and parameters: {'n_estimators': 769, 'max_depth': 8, 'min_samples_split': 35, 'min_samples_leaf': 62, 'criterion': 'gini'}.
Trial 9523 finished with value: 0.6630434782608695 and parameters: {'n_estimators': 277, 'max_depth': 16, 'min_samples_split': 26, 'min_samples_leaf': 57, 'criterion': 'entropy'}.
Trial 9524 finished with value: 0.6956521739130435 and parameters: {'n_estimators': 516, 'max_depth': 10, 'min_samples_split': 159, 'min_samples_leaf': 66, 'criterion': 'entropy'}.
Trial 9525 finished with value: 0.6956521739130435 and parameters: {'n_estimators': 254, 'max_depth': 7, 'min_samples_split': 51, 'min_samples_leaf': 60, 'criterion': 'gini'}.
Trial 9526 finished with value: 0.6847826086956522 and parameters: {'n_estimators': 750, 'max_depth': 13, 'min_samples_split': 30, 'min_samples_leaf': 76, 'criterion': 'entropy'}.
Trial 9527 finished with value: 0.7065217391304348 and parameters: {'n_estimators': 213, 'max_depth': 11, 'min_samples_split': 38, 'min_samples_leaf': 56, 'criterion': 'gini'}.
Trial 9528 finished with value: 0.7065217391304348 and parameters: {'n_estimators': 287, 'max_depth': 9, 'min_samples_split': 43, 'min_samples_leaf': 59, 'criterion': 'entropy'}.
Trial 9529 finished with value: 0.6956521739130435 and parameters: {'n_estimators': 308, 'max_depth': 15, 'min_samples_split': 130, 'min_samples_leaf': 63, 'criterion': 'gini'}.
Trial 9530 finished with value: 0.6847826086956522 and parameters: {'n_estimators': 337, 'max_depth': 18, 'min_samples_split': 16, 'min_samples_leaf': 72, 'criterion': 'entropy'}.
Trial 9531 finished with value: 0.6847826086956522 and parameters: {'n_estimators': 726, 'max_depth': 6, 'min_samples_split': 153, 'min_samples_leaf': 68, 'criterion': 'entropy'}.
Trial 9532 finished with value: 0.717391304347826 and parameters: {'n_estimators': 237, 'max_depth': 12, 'min_samples_split': 134, 'min_samples_leaf': 48, 'criterion': 'gini'}.
Trial 9533 finished with value: 0.717391304347826 and parameters: {'n_estimators': 414, 'max_depth': 9, 'min_samples_split': 33, 'min_samples_leaf': 54, 'criterion': 'entropy'}.
Trial 9534 finished with value: 0.717391304347826 and parameters: {'n_estimators': 265, 'max_depth': 11, 'min_samples_split': 25, 'min_samples_leaf': 58, 'criterion': 'gini'}.
Trial 9535 finished with value: 0.7065217391304348 and parameters: {'n_estimators': 784, 'max_depth': 14, 'min_samples_split': 40, 'min_samples_leaf': 60, 'criterion': 'entropy'}.
Trial 9536 finished with value: 0.6739130434782609 and parameters: {'n_estimators': 290, 'max_depth': 7, 'min_samples_split': 107, 'min_samples_leaf': 56, 'criterion': 'entropy'}.
Trial 9537 finished with value: 0.7282608695652174 and parameters: {'n_estimators': 255, 'max_depth': 9, 'min_samples_split': 143, 'min_samples_leaf': 52, 'criterion': 'gini'}.
Trial 9538 finished with value: 0.6739130434782609 and parameters: {'n_estimators': 318, 'max_depth': 5, 'min_samples_split': 29, 'min_samples_leaf': 74, 'criterion': 'entropy'}.
Trial 9539 finished with value: 0.7065217391304348 and parameters: {'n_estimators': 275, 'max_depth': 11, 'min_samples_split': 36, 'min_samples_leaf': 61, 'criterion': 'gini'}.
Trial 9540 finished with value: 0.6956521739130435 and parameters: {'n_estimators': 308, 'max_depth': 14, 'min_samples_split': 22, 'min_samples_leaf': 58, 'criterion': 'entropy'}.
Trial 9541 finished with value: 0.717391304347826 and parameters: {'n_estimators': 347, 'max_depth': 8, 'min_samples_split': 114, 'min_samples_leaf': 65, 'criterion': 'entropy'}.
Trial 9542 finished with value: 0.6956521739130435 and parameters: {'n_estimators': 710, 'max_depth': 12, 'min_samples_split': 33, 'min_samples_leaf': 55, 'criterion': 'gini'}.
Trial 9543 finished with value: 0.6956521739130435 and parameters: {'n_estimators': 804, 'max_depth': 9, 'min_samples_split': 46, 'min_samples_leaf': 62, 'criterion': 'entropy'}.
Trial 9544 finished with value: 0.7065217391304348 and parameters: {'n_estimators': 756, 'max_depth': 10, 'min_samples_split': 29, 'min_samples_leaf': 70, 'criterion': 'gini'}.
Trial 9545 finished with value: 0.6847826086956522 and parameters: {'n_estimators': 287, 'max_depth': 16, 'min_samples_split': 38, 'min_samples_leaf': 58, 'criterion': 'entropy'}.
Trial 9546 finished with value: 0.6956521739130435 and parameters: {'n_estimators': 199, 'max_depth': 7, 'min_samples_split': 136, 'min_samples_leaf': 81, 'criterion': 'gini'}.
Trial 9547 finished with value: 0.7065217391304348 and parameters: {'n_estimators': 236, 'max_depth': 13, 'min_samples_split': 25, 'min_samples_leaf': 60, 'criterion': 'entropy'}.
Trial 9548 finished with value: 0.6956521739130435 and parameters: {'n_estimators': 461, 'max_depth': 11, 'min_samples_split': 146, 'min_samples_leaf': 56, 'criterion': 'entropy'}.
Trial 9549 finished with value: 0.7065217391304348 and parameters: {'n_estimators': 270, 'max_depth': 8, 'min_samples_split': 18, 'min_samples_leaf': 53, 'criterion': 'gini'}.
Trial 9550 finished with value: 0.6956521739130435 and parameters: {'n_estimators': 255, 'max_depth': 13, 'min_samples_split': 33, 'min_samples_leaf': 67, 'criterion': 'entropy'}.
Trial 9551 finished with value: 0.7065217391304348 and parameters: {'n_estimators': 302, 'max_depth': 10, 'min_samples_split': 95, 'min_samples_leaf': 63, 'criterion': 'gini'}.
Trial 9552 finished with value: 0.6630434782608695 and parameters: {'n_estimators': 327, 'max_depth': 20, 'min_samples_split': 43, 'min_samples_leaf': 77, 'criterion': 'entropy'}.
Trial 9553 finished with value: 0.6413043478260869 and parameters: {'n_estimators': 748, 'max_depth': 5, 'min_samples_split': 120, 'min_samples_leaf': 50, 'criterion': 'entropy'}.
Trial 9554 finished with value: 0.6739130434782609 and parameters: {'n_estimators': 768, 'max_depth': 17, 'min_samples_split': 139, 'min_samples_leaf': 58, 'criterion': 'gini'}.
Trial 9555 finished with value: 0.6956521739130435 and parameters: {'n_estimators': 281, 'max_depth': 15, 'min_samples_split': 128, 'min_samples_leaf': 61, 'criterion': 'entropy'}.
Trial 9556 finished with value: 0.7065217391304348 and parameters: {'n_estimators': 248, 'max_depth': 11, 'min_samples_split': 37, 'min_samples_leaf': 54, 'criterion': 'gini'}.
Trial 9557 finished with value: 0.7065217391304348 and parameters: {'n_estimators': 786, 'max_depth': 7, 'min_samples_split': 103, 'min_samples_leaf': 73, 'criterion': 'entropy'}.
Trial 9558 finished with value: 0.6739130434782609 and parameters: {'n_estimators': 224, 'max_depth': 47, 'min_samples_split': 27, 'min_samples_leaf': 57, 'criterion': 'entropy'}.
Trial 9559 finished with value: 0.7065217391304348 and parameters: {'n_estimators': 870, 'max_depth': 9, 'min_samples_split': 31, 'min_samples_leaf': 59, 'criterion': 'gini'}.
Trial 9560 finished with value: 0.7065217391304348 and parameters: {'n_estimators': 736, 'max_depth': 13, 'min_samples_split': 49, 'min_samples_leaf': 56, 'criterion': 'entropy'}.
Trial 9561 finished with value: 0.7065217391304348 and parameters: {'n_estimators': 300, 'max_depth': 11, 'min_samples_split': 40, 'min_samples_leaf': 64, 'criterion': 'gini'}.
Trial 9562 finished with value: 0.6847826086956522 and parameters: {'n_estimators': 269, 'max_depth': 7, 'min_samples_split': 21, 'min_samples_leaf': 60, 'criterion': 'entropy'}.
Trial 9563 finished with value: 0.6847826086956522 and parameters: {'n_estimators': 692, 'max_depth': 9, 'min_samples_split': 14, 'min_samples_leaf': 71, 'criterion': 'entropy'}.
Trial 9564 finished with value: 0.7065217391304348 and parameters: {'n_estimators': 292, 'max_depth': 14, 'min_samples_split': 150, 'min_samples_leaf': 62, 'criterion': 'gini'}.
Trial 9565 finished with value: 0.7065217391304348 and parameters: {'n_estimators': 318, 'max_depth': 12, 'min_samples_split': 34, 'min_samples_leaf': 54, 'criterion': 'entropy'}.
Trial 9566 finished with value: 0.7065217391304348 and parameters: {'n_estimators': 260, 'max_depth': 10, 'min_samples_split': 27, 'min_samples_leaf': 57, 'criterion': 'gini'}.
Trial 9567 finished with value: 0.6847826086956522 and parameters: {'n_estimators': 829, 'max_depth': 6, 'min_samples_split': 141, 'min_samples_leaf': 59, 'criterion': 'entropy'}.
Trial 9568 finished with value: 0.717391304347826 and parameters: {'n_estimators': 904, 'max_depth': 8, 'min_samples_split': 36, 'min_samples_leaf': 56, 'criterion': 'gini'}.
Trial 9569 finished with value: 0.6847826086956522 and parameters: {'n_estimators': 145, 'max_depth': 12, 'min_samples_split': 29, 'min_samples_leaf': 52, 'criterion': 'entropy'}.
Trial 9570 finished with value: 0.6739130434782609 and parameters: {'n_estimators': 376, 'max_depth': 16, 'min_samples_split': 23, 'min_samples_leaf': 60, 'criterion': 'entropy'}.
Trial 9571 finished with value: 0.6956521739130435 and parameters: {'n_estimators': 279, 'max_depth': 9, 'min_samples_split': 123, 'min_samples_leaf': 66, 'criterion': 'gini'}.
Trial 9572 finished with value: 0.6847826086956522 and parameters: {'n_estimators': 340, 'max_depth': 14, 'min_samples_split': 43, 'min_samples_leaf': 75, 'criterion': 'entropy'}.
Trial 9573 finished with value: 0.6956521739130435 and parameters: {'n_estimators': 242, 'max_depth': 11, 'min_samples_split': 133, 'min_samples_leaf': 62, 'criterion': 'gini'}.
Trial 9574 finished with value: 0.6739130434782609 and parameters: {'n_estimators': 306, 'max_depth': 5, 'min_samples_split': 116, 'min_samples_leaf': 69, 'criterion': 'entropy'}.
Trial 9575 finished with value: 0.6739130434782609 and parameters: {'n_estimators': 436, 'max_depth': 22, 'min_samples_split': 32, 'min_samples_leaf': 58, 'criterion': 'entropy'}.
Trial 9576 finished with value: 0.717391304347826 and parameters: {'n_estimators': 620, 'max_depth': 10, 'min_samples_split': 38, 'min_samples_leaf': 55, 'criterion': 'gini'}.
Trial 9577 finished with value: 0.6956521739130435 and parameters: {'n_estimators': 770, 'max_depth': 7, 'min_samples_split': 144, 'min_samples_leaf': 64, 'criterion': 'entropy'}.
Trial 9578 finished with value: 0.6739130434782609 and parameters: {'n_estimators': 266, 'max_depth': 13, 'min_samples_split': 24, 'min_samples_leaf': 51, 'criterion': 'gini'}.
Trial 9579 finished with value: 0.6956521739130435 and parameters: {'n_estimators': 718, 'max_depth': 41, 'min_samples_split': 31, 'min_samples_leaf': 72, 'criterion': 'entropy'}.
Trial 9580 finished with value: 0.7065217391304348 and parameters: {'n_estimators': 212, 'max_depth': 9, 'min_samples_split': 39, 'min_samples_leaf': 58, 'criterion': 'entropy'}.
Trial 9581 finished with value: 0.6739130434782609 and parameters: {'n_estimators': 288, 'max_depth': 18, 'min_samples_split': 137, 'min_samples_leaf': 61, 'criterion': 'gini'}.
Trial 9582 finished with value: 0.6956521739130435 and parameters: {'n_estimators': 741, 'max_depth': 12, 'min_samples_split': 18, 'min_samples_leaf': 54, 'criterion': 'entropy'}.
Trial 9583 finished with value: 0.6739130434782609 and parameters: {'n_estimators': 792, 'max_depth': 38, 'min_samples_split': 46, 'min_samples_leaf': 56, 'criterion': 'gini'}.
Trial 9584 finished with value: 0.6956521739130435 and parameters: {'n_estimators': 229, 'max_depth': 15, 'min_samples_split': 10, 'min_samples_leaf': 60, 'criterion': 'entropy'}.
Trial 9585 finished with value: 0.6739130434782609 and parameters: {'n_estimators': 260, 'max_depth': 7, 'min_samples_split': 35, 'min_samples_leaf': 58, 'criterion': 'gini'}.
Trial 9586 finished with value: 0.717391304347826 and parameters: {'n_estimators': 308, 'max_depth': 10, 'min_samples_split': 62, 'min_samples_leaf': 63, 'criterion': 'entropy'}.
Trial 9587 finished with value: 0.6956521739130435 and parameters: {'n_estimators': 955, 'max_depth': 8, 'min_samples_split': 27, 'min_samples_leaf': 74, 'criterion': 'entropy'}.
Trial 9588 finished with value: 0.717391304347826 and parameters: {'n_estimators': 273, 'max_depth': 12, 'min_samples_split': 41, 'min_samples_leaf': 53, 'criterion': 'gini'}.
Trial 9589 finished with value: 0.717391304347826 and parameters: {'n_estimators': 329, 'max_depth': 10, 'min_samples_split': 126, 'min_samples_leaf': 67, 'criterion': 'entropy'}.
Trial 9590 finished with value: 0.6630434782608695 and parameters: {'n_estimators': 116, 'max_depth': 14, 'min_samples_split': 31, 'min_samples_leaf': 56, 'criterion': 'gini'}.
Trial 9591 finished with value: 0.6521739130434783 and parameters: {'n_estimators': 814, 'max_depth': 5, 'min_samples_split': 55, 'min_samples_leaf': 60, 'criterion': 'entropy'}.
Trial 9592 finished with value: 0.7282608695652174 and parameters: {'n_estimators': 243, 'max_depth': 8, 'min_samples_split': 21, 'min_samples_leaf': 58, 'criterion': 'entropy'}.
Trial 9593 finished with value: 0.7065217391304348 and parameters: {'n_estimators': 298, 'max_depth': 11, 'min_samples_split': 26, 'min_samples_leaf': 62, 'criterion': 'gini'}.
Trial 9594 finished with value: 0.7065217391304348 and parameters: {'n_estimators': 283, 'max_depth': 13, 'min_samples_split': 35, 'min_samples_leaf': 70, 'criterion': 'entropy'}.
Trial 9595 finished with value: 0.6847826086956522 and parameters: {'n_estimators': 761, 'max_depth': 16, 'min_samples_split': 131, 'min_samples_leaf': 55, 'criterion': 'gini'}.
Trial 9596 finished with value: 0.7065217391304348 and parameters: {'n_estimators': 350, 'max_depth': 9, 'min_samples_split': 142, 'min_samples_leaf': 65, 'criterion': 'entropy'}.
Trial 9597 finished with value: 0.7065217391304348 and parameters: {'n_estimators': 316, 'max_depth': 7, 'min_samples_split': 30, 'min_samples_leaf': 77, 'criterion': 'entropy'}.
Trial 9598 finished with value: 0.7065217391304348 and parameters: {'n_estimators': 1000, 'max_depth': 11, 'min_samples_split': 39, 'min_samples_leaf': 57, 'criterion': 'gini'}.
Trial 9599 finished with value: 0.6739130434782609 and parameters: {'n_estimators': 663, 'max_depth': 12, 'min_samples_split': 35, 'min_samples_leaf': 60, 'criterion': 'entropy'}.
Trial 9600 finished with value: 0.6847826086956522 and parameters: {'n_estimators': 256, 'max_depth': 15, 'min_samples_split': 148, 'min_samples_leaf': 49, 'criterion': 'gini'}.
Trial 9601 finished with value: 0.717391304347826 and parameters: {'n_estimators': 283, 'max_depth': 10, 'min_samples_split': 121, 'min_samples_leaf': 59, 'criterion': 'entropy'}.
Trial 9602 finished with value: 0.6630434782608695 and parameters: {'n_estimators': 395, 'max_depth': 6, 'min_samples_split': 24, 'min_samples_leaf': 54, 'criterion': 'gini'}.
Trial 9603 finished with value: 0.6956521739130435 and parameters: {'n_estimators': 727, 'max_depth': 8, 'min_samples_split': 46, 'min_samples_leaf': 62, 'criterion': 'entropy'}.
Trial 9604 finished with value: 0.6956521739130435 and parameters: {'n_estimators': 295, 'max_depth': 13, 'min_samples_split': 112, 'min_samples_leaf': 57, 'criterion': 'entropy'}.
Trial 9605 finished with value: 0.6739130434782609 and parameters: {'n_estimators': 247, 'max_depth': 76, 'min_samples_split': 14, 'min_samples_leaf': 52, 'criterion': 'gini'}.
Trial 9606 finished with value: 0.7282608695652174 and parameters: {'n_estimators': 269, 'max_depth': 10, 'min_samples_split': 31, 'min_samples_leaf': 68, 'criterion': 'entropy'}.
Trial 9607 finished with value: 0.7391304347826086 and parameters: {'n_estimators': 498, 'max_depth': 8, 'min_samples_split': 43, 'min_samples_leaf': 72, 'criterion': 'gini'}.
Trial 9608 finished with value: 0.6847826086956522 and parameters: {'n_estimators': 748, 'max_depth': 18, 'min_samples_split': 139, 'min_samples_leaf': 59, 'criterion': 'entropy'}.
Trial 9609 finished with value: 0.7065217391304348 and parameters: {'n_estimators': 593, 'max_depth': 12, 'min_samples_split': 35, 'min_samples_leaf': 64, 'criterion': 'entropy'}.
Trial 9610 finished with value: 0.6956521739130435 and parameters: {'n_estimators': 780, 'max_depth': 14, 'min_samples_split': 28, 'min_samples_leaf': 55, 'criterion': 'gini'}.
Trial 9611 finished with value: 0.717391304347826 and parameters: {'n_estimators': 325, 'max_depth': 10, 'min_samples_split': 33, 'min_samples_leaf': 61, 'criterion': 'entropy'}.
Trial 9612 finished with value: 0.6847826086956522 and parameters: {'n_estimators': 286, 'max_depth': 6, 'min_samples_split': 20, 'min_samples_leaf': 56, 'criterion': 'gini'}.
Trial 9613 finished with value: 0.7065217391304348 and parameters: {'n_estimators': 226, 'max_depth': 9, 'min_samples_split': 40, 'min_samples_leaf': 58, 'criterion': 'entropy'}.
Trial 9614 finished with value: 0.717391304347826 and parameters: {'n_estimators': 310, 'max_depth': 12, 'min_samples_split': 117, 'min_samples_leaf': 36, 'criterion': 'entropy'}.
Trial 9615 finished with value: 0.6739130434782609 and parameters: {'n_estimators': 266, 'max_depth': 15, 'min_samples_split': 134, 'min_samples_leaf': 74, 'criterion': 'gini'}.
Trial 9616 finished with value: 0.6956521739130435 and parameters: {'n_estimators': 190, 'max_depth': 8, 'min_samples_split': 146, 'min_samples_leaf': 61, 'criterion': 'entropy'}.
Trial 9617 finished with value: 0.6956521739130435 and parameters: {'n_estimators': 247, 'max_depth': 11, 'min_samples_split': 50, 'min_samples_leaf': 53, 'criterion': 'gini'}.
Trial 9618 finished with value: 0.6304347826086957 and parameters: {'n_estimators': 708, 'max_depth': 5, 'min_samples_split': 26, 'min_samples_leaf': 57, 'criterion': 'entropy'}.
Trial 9619 finished with value: 0.7065217391304348 and parameters: {'n_estimators': 928, 'max_depth': 13, 'min_samples_split': 37, 'min_samples_leaf': 59, 'criterion': 'entropy'}.
Trial 9620 finished with value: 0.6847826086956522 and parameters: {'n_estimators': 796, 'max_depth': 17, 'min_samples_split': 30, 'min_samples_leaf': 63, 'criterion': 'gini'}.
Trial 9621 finished with value: 0.717391304347826 and parameters: {'n_estimators': 295, 'max_depth': 10, 'min_samples_split': 18, 'min_samples_leaf': 70, 'criterion': 'entropy'}.
Trial 9622 finished with value: 0.6739130434782609 and parameters: {'n_estimators': 683, 'max_depth': 7, 'min_samples_split': 43, 'min_samples_leaf': 51, 'criterion': 'gini'}.
Trial 9623 finished with value: 0.7282608695652174 and parameters: {'n_estimators': 276, 'max_depth': 9, 'min_samples_split': 33, 'min_samples_leaf': 55, 'criterion': 'entropy'}.
Trial 9624 finished with value: 0.717391304347826 and parameters: {'n_estimators': 762, 'max_depth': 12, 'min_samples_split': 23, 'min_samples_leaf': 60, 'criterion': 'gini'}.
Trial 9625 finished with value: 0.6847826086956522 and parameters: {'n_estimators': 337, 'max_depth': 14, 'min_samples_split': 108, 'min_samples_leaf': 66, 'criterion': 'entropy'}.
Trial 9626 finished with value: 0.6739130434782609 and parameters: {'n_estimators': 253, 'max_depth': 7, 'min_samples_split': 152, 'min_samples_leaf': 57, 'criterion': 'entropy'}.
Trial 9627 finished with value: 0.7065217391304348 and parameters: {'n_estimators': 169, 'max_depth': 11, 'min_samples_split': 37, 'min_samples_leaf': 76, 'criterion': 'gini'}.
Trial 9628 finished with value: 0.717391304347826 and parameters: {'n_estimators': 306, 'max_depth': 10, 'min_samples_split': 83, 'min_samples_leaf': 62, 'criterion': 'entropy'}.
Trial 9629 finished with value: 0.6739130434782609 and parameters: {'n_estimators': 742, 'max_depth': 16, 'min_samples_split': 28, 'min_samples_leaf': 59, 'criterion': 'gini'}.
Trial 9630 finished with value: 0.6956521739130435 and parameters: {'n_estimators': 280, 'max_depth': 9, 'min_samples_split': 138, 'min_samples_leaf': 79, 'criterion': 'entropy'}.
Trial 9631 finished with value: 0.6956521739130435 and parameters: {'n_estimators': 233, 'max_depth': 13, 'min_samples_split': 38, 'min_samples_leaf': 72, 'criterion': 'entropy'}.
Trial 9632 finished with value: 0.6413043478260869 and parameters: {'n_estimators': 363, 'max_depth': 5, 'min_samples_split': 23, 'min_samples_leaf': 54, 'criterion': 'gini'}.
Trial 9633 finished with value: 0.717391304347826 and parameters: {'n_estimators': 836, 'max_depth': 8, 'min_samples_split': 129, 'min_samples_leaf': 56, 'criterion': 'entropy'}.
Trial 9634 finished with value: 0.7065217391304348 and parameters: {'n_estimators': 269, 'max_depth': 11, 'min_samples_split': 142, 'min_samples_leaf': 64, 'criterion': 'gini'}.
Trial 9635 finished with value: 0.6847826086956522 and parameters: {'n_estimators': 211, 'max_depth': 14, 'min_samples_split': 33, 'min_samples_leaf': 58, 'criterion': 'entropy'}.
Trial 9636 finished with value: 0.6956521739130435 and parameters: {'n_estimators': 778, 'max_depth': 7, 'min_samples_split': 126, 'min_samples_leaf': 61, 'criterion': 'entropy'}.
Trial 9637 finished with value: 0.7282608695652174 and parameters: {'n_estimators': 297, 'max_depth': 11, 'min_samples_split': 28, 'min_samples_leaf': 55, 'criterion': 'gini'}.
Trial 9638 finished with value: 0.6956521739130435 and parameters: {'n_estimators': 321, 'max_depth': 8, 'min_samples_split': 41, 'min_samples_leaf': 68, 'criterion': 'entropy'}.
