Trial 5955 finished with value: 0.6739130434782609 and parameters: {'n_estimators': 311, 'max_depth': 11, 'min_samples_split': 18, 'min_samples_leaf': 88, 'criterion': 'gini'}.
Trial 5956 finished with value: 0.6847826086956522 and parameters: {'n_estimators': 267, 'max_depth': 6, 'min_samples_split': 32, 'min_samples_leaf': 63, 'criterion': 'entropy'}.
Trial 5957 finished with value: 0.6739130434782609 and parameters: {'n_estimators': 288, 'max_depth': 56, 'min_samples_split': 40, 'min_samples_leaf': 60, 'criterion': 'entropy'}.
Trial 5958 finished with value: 0.6739130434782609 and parameters: {'n_estimators': 765, 'max_depth': 18, 'min_samples_split': 141, 'min_samples_leaf': 55, 'criterion': 'gini'}.
Trial 5959 finished with value: 0.717391304347826 and parameters: {'n_estimators': 961, 'max_depth': 10, 'min_samples_split': 30, 'min_samples_leaf': 58, 'criterion': 'entropy'}.
Trial 5960 finished with value: 0.7065217391304348 and parameters: {'n_estimators': 259, 'max_depth': 13, 'min_samples_split': 153, 'min_samples_leaf': 56, 'criterion': 'gini'}.
Trial 5961 finished with value: 0.6739130434782609 and parameters: {'n_estimators': 155, 'max_depth': 15, 'min_samples_split': 26, 'min_samples_leaf': 77, 'criterion': 'entropy'}.
Trial 5962 finished with value: 0.717391304347826 and parameters: {'n_estimators': 437, 'max_depth': 8, 'min_samples_split': 43, 'min_samples_leaf': 73, 'criterion': 'gini'}.
Trial 5963 finished with value: 0.6847826086956522 and parameters: {'n_estimators': 321, 'max_depth': 12, 'min_samples_split': 36, 'min_samples_leaf': 65, 'criterion': 'entropy'}.
Trial 5964 finished with value: 0.7065217391304348 and parameters: {'n_estimators': 185, 'max_depth': 10, 'min_samples_split': 143, 'min_samples_leaf': 62, 'criterion': 'gini'}.
Trial 5965 finished with value: 0.6847826086956522 and parameters: {'n_estimators': 302, 'max_depth': 85, 'min_samples_split': 48, 'min_samples_leaf': 59, 'criterion': 'entropy'}.
Trial 5966 finished with value: 0.6413043478260869 and parameters: {'n_estimators': 275, 'max_depth': 5, 'min_samples_split': 129, 'min_samples_leaf': 52, 'criterion': 'gini'}.
Trial 5967 finished with value: 0.6956521739130435 and parameters: {'n_estimators': 238, 'max_depth': 8, 'min_samples_split': 136, 'min_samples_leaf': 69, 'criterion': 'entropy'}.
Trial 5968 finished with value: 0.717391304347826 and parameters: {'n_estimators': 209, 'max_depth': 14, 'min_samples_split': 114, 'min_samples_leaf': 60, 'criterion': 'gini'}.
Trial 5969 finished with value: 0.717391304347826 and parameters: {'n_estimators': 292, 'max_depth': 11, 'min_samples_split': 20, 'min_samples_leaf': 57, 'criterion': 'entropy'}.
Trial 5970 finished with value: 0.6956521739130435 and parameters: {'n_estimators': 253, 'max_depth': 7, 'min_samples_split': 149, 'min_samples_leaf': 72, 'criterion': 'gini'}.
Trial 5971 finished with value: 0.7282608695652174 and parameters: {'n_estimators': 277, 'max_depth': 9, 'min_samples_split': 86, 'min_samples_leaf': 55, 'criterion': 'entropy'}.
Trial 5972 finished with value: 0.7065217391304348 and parameters: {'n_estimators': 707, 'max_depth': 12, 'min_samples_split': 123, 'min_samples_leaf': 63, 'criterion': 'gini'}.
Trial 5973 finished with value: 0.6739130434782609 and parameters: {'n_estimators': 775, 'max_depth': 16, 'min_samples_split': 32, 'min_samples_leaf': 66, 'criterion': 'entropy'}.
Trial 5974 finished with value: 0.717391304347826 and parameters: {'n_estimators': 738, 'max_depth': 10, 'min_samples_split': 37, 'min_samples_leaf': 61, 'criterion': 'gini'}.
Trial 5975 finished with value: 0.6956521739130435 and parameters: {'n_estimators': 389, 'max_depth': 13, 'min_samples_split': 33, 'min_samples_leaf': 59, 'criterion': 'entropy'}.
Trial 5976 finished with value: 0.6630434782608695 and parameters: {'n_estimators': 334, 'max_depth': 7, 'min_samples_split': 27, 'min_samples_leaf': 57, 'criterion': 'gini'}.
Trial 5977 finished with value: 0.717391304347826 and parameters: {'n_estimators': 227, 'max_depth': 9, 'min_samples_split': 24, 'min_samples_leaf': 54, 'criterion': 'entropy'}.
Trial 5978 finished with value: 0.6956521739130435 and parameters: {'n_estimators': 266, 'max_depth': 11, 'min_samples_split': 108, 'min_samples_leaf': 74, 'criterion': 'gini'}.
Trial 5979 finished with value: 0.6847826086956522 and parameters: {'n_estimators': 791, 'max_depth': 14, 'min_samples_split': 39, 'min_samples_leaf': 58, 'criterion': 'entropy'}.
Trial 5980 finished with value: 0.6956521739130435 and parameters: {'n_estimators': 299, 'max_depth': 76, 'min_samples_split': 74, 'min_samples_leaf': 61, 'criterion': 'gini'}.
Trial 5981 finished with value: 0.6847826086956522 and parameters: {'n_estimators': 907, 'max_depth': 6, 'min_samples_split': 134, 'min_samples_leaf': 91, 'criterion': 'entropy'}.
Trial 5982 finished with value: 0.7065217391304348 and parameters: {'n_estimators': 248, 'max_depth': 9, 'min_samples_split': 28, 'min_samples_leaf': 71, 'criterion': 'gini'}.
Trial 5983 finished with value: 0.7065217391304348 and parameters: {'n_estimators': 984, 'max_depth': 12, 'min_samples_split': 15, 'min_samples_leaf': 56, 'criterion': 'entropy'}.
Trial 5984 finished with value: 0.6847826086956522 and parameters: {'n_estimators': 313, 'max_depth': 18, 'min_samples_split': 139, 'min_samples_leaf': 67, 'criterion': 'entropy'}.
Trial 5985 finished with value: 0.7065217391304348 and parameters: {'n_estimators': 751, 'max_depth': 15, 'min_samples_split': 143, 'min_samples_leaf': 63, 'criterion': 'gini'}.
Trial 5986 finished with value: 0.717391304347826 and parameters: {'n_estimators': 289, 'max_depth': 10, 'min_samples_split': 42, 'min_samples_leaf': 59, 'criterion': 'entropy'}.
Trial 5987 finished with value: 0.717391304347826 and parameters: {'n_estimators': 276, 'max_depth': 8, 'min_samples_split': 119, 'min_samples_leaf': 52, 'criterion': 'gini'}.
Trial 5988 finished with value: 0.7065217391304348 and parameters: {'n_estimators': 140, 'max_depth': 12, 'min_samples_split': 35, 'min_samples_leaf': 54, 'criterion': 'entropy'}.
Trial 5989 finished with value: 0.6304347826086957 and parameters: {'n_estimators': 724, 'max_depth': 5, 'min_samples_split': 21, 'min_samples_leaf': 57, 'criterion': 'gini'}.
Trial 5990 finished with value: 0.7065217391304348 and parameters: {'n_estimators': 259, 'max_depth': 10, 'min_samples_split': 29, 'min_samples_leaf': 65, 'criterion': 'entropy'}.
Trial 5991 finished with value: 0.6956521739130435 and parameters: {'n_estimators': 290, 'max_depth': 7, 'min_samples_split': 157, 'min_samples_leaf': 62, 'criterion': 'gini'}.
Trial 5992 finished with value: 0.6847826086956522 and parameters: {'n_estimators': 313, 'max_depth': 12, 'min_samples_split': 148, 'min_samples_leaf': 76, 'criterion': 'entropy'}.
Trial 5993 finished with value: 0.6956521739130435 and parameters: {'n_estimators': 271, 'max_depth': 15, 'min_samples_split': 33, 'min_samples_leaf': 60, 'criterion': 'gini'}.
Trial 5994 finished with value: 0.717391304347826 and parameters: {'n_estimators': 464, 'max_depth': 9, 'min_samples_split': 127, 'min_samples_leaf': 82, 'criterion': 'entropy'}.
Trial 5995 finished with value: 0.7065217391304348 and parameters: {'n_estimators': 239, 'max_depth': 13, 'min_samples_split': 44, 'min_samples_leaf': 69, 'criterion': 'gini'}.
Trial 5996 finished with value: 0.717391304347826 and parameters: {'n_estimators': 761, 'max_depth': 11, 'min_samples_split': 24, 'min_samples_leaf': 56, 'criterion': 'entropy'}.
Trial 5997 finished with value: 0.6739130434782609 and parameters: {'n_estimators': 218, 'max_depth': 20, 'min_samples_split': 39, 'min_samples_leaf': 59, 'criterion': 'gini'}.
Trial 5998 finished with value: 0.6956521739130435 and parameters: {'n_estimators': 367, 'max_depth': 7, 'min_samples_split': 30, 'min_samples_leaf': 64, 'criterion': 'entropy'}.
Trial 5999 finished with value: 0.6956521739130435 and parameters: {'n_estimators': 296, 'max_depth': 14, 'min_samples_split': 133, 'min_samples_leaf': 72, 'criterion': 'gini'}.
Trial 6000 finished with value: 0.6630434782608695 and parameters: {'n_estimators': 339, 'max_depth': 17, 'min_samples_split': 138, 'min_samples_leaf': 58, 'criterion': 'entropy'}.
Trial 6001 finished with value: 0.7065217391304348 and parameters: {'n_estimators': 776, 'max_depth': 9, 'min_samples_split': 144, 'min_samples_leaf': 61, 'criterion': 'gini'}.
Trial 6002 finished with value: 0.6521739130434783 and parameters: {'n_estimators': 256, 'max_depth': 5, 'min_samples_split': 8, 'min_samples_leaf': 54, 'criterion': 'entropy'}.
Trial 6003 finished with value: 0.7065217391304348 and parameters: {'n_estimators': 793, 'max_depth': 11, 'min_samples_split': 80, 'min_samples_leaf': 56, 'criterion': 'gini'}.
Trial 6004 finished with value: 0.6956521739130435 and parameters: {'n_estimators': 274, 'max_depth': 8, 'min_samples_split': 34, 'min_samples_leaf': 74, 'criterion': 'entropy'}.
Trial 6005 finished with value: 0.717391304347826 and parameters: {'n_estimators': 304, 'max_depth': 13, 'min_samples_split': 18, 'min_samples_leaf': 60, 'criterion': 'gini'}.
Trial 6006 finished with value: 0.7065217391304348 and parameters: {'n_estimators': 320, 'max_depth': 11, 'min_samples_split': 26, 'min_samples_leaf': 58, 'criterion': 'entropy'}.
Trial 6007 finished with value: 0.7065217391304348 and parameters: {'n_estimators': 237, 'max_depth': 7, 'min_samples_split': 37, 'min_samples_leaf': 62, 'criterion': 'gini'}.
Trial 6008 finished with value: 0.6956521739130435 and parameters: {'n_estimators': 740, 'max_depth': 10, 'min_samples_split': 49, 'min_samples_leaf': 68, 'criterion': 'entropy'}.
Trial 6009 finished with value: 0.6739130434782609 and parameters: {'n_estimators': 286, 'max_depth': 16, 'min_samples_split': 31, 'min_samples_leaf': 52, 'criterion': 'gini'}.
Trial 6010 finished with value: 0.7065217391304348 and parameters: {'n_estimators': 264, 'max_depth': 13, 'min_samples_split': 22, 'min_samples_leaf': 64, 'criterion': 'entropy'}.
Trial 6011 finished with value: 0.6956521739130435 and parameters: {'n_estimators': 682, 'max_depth': 9, 'min_samples_split': 111, 'min_samples_leaf': 60, 'criterion': 'gini'}.
Trial 6012 finished with value: 0.6413043478260869 and parameters: {'n_estimators': 122, 'max_depth': 6, 'min_samples_split': 124, 'min_samples_leaf': 55, 'criterion': 'entropy'}.
Trial 6013 finished with value: 0.717391304347826 and parameters: {'n_estimators': 717, 'max_depth': 11, 'min_samples_split': 146, 'min_samples_leaf': 70, 'criterion': 'entropy'}.
Trial 6014 finished with value: 0.717391304347826 and parameters: {'n_estimators': 245, 'max_depth': 14, 'min_samples_split': 152, 'min_samples_leaf': 58, 'criterion': 'gini'}.
Trial 6015 finished with value: 0.6630434782608695 and parameters: {'n_estimators': 284, 'max_depth': 69, 'min_samples_split': 139, 'min_samples_leaf': 57, 'criterion': 'entropy'}.
Trial 6016 finished with value: 0.6847826086956522 and parameters: {'n_estimators': 761, 'max_depth': 10, 'min_samples_split': 27, 'min_samples_leaf': 78, 'criterion': 'gini'}.
Trial 6017 finished with value: 0.7065217391304348 and parameters: {'n_estimators': 261, 'max_depth': 8, 'min_samples_split': 41, 'min_samples_leaf': 62, 'criterion': 'entropy'}.
Trial 6018 finished with value: 0.6956521739130435 and parameters: {'n_estimators': 323, 'max_depth': 12, 'min_samples_split': 30, 'min_samples_leaf': 66, 'criterion': 'gini'}.
Trial 6019 finished with value: 0.6956521739130435 and parameters: {'n_estimators': 200, 'max_depth': 9, 'min_samples_split': 14, 'min_samples_leaf': 72, 'criterion': 'entropy'}.
Trial 6020 finished with value: 0.6956521739130435 and parameters: {'n_estimators': 295, 'max_depth': 15, 'min_samples_split': 131, 'min_samples_leaf': 54, 'criterion': 'gini'}.
Trial 6021 finished with value: 0.6521739130434783 and parameters: {'n_estimators': 223, 'max_depth': 45, 'min_samples_split': 38, 'min_samples_leaf': 60, 'criterion': 'entropy'}.
Trial 6022 finished with value: 0.6413043478260869 and parameters: {'n_estimators': 276, 'max_depth': 5, 'min_samples_split': 24, 'min_samples_leaf': 56, 'criterion': 'gini'}.
Trial 6023 finished with value: 0.7065217391304348 and parameters: {'n_estimators': 304, 'max_depth': 7, 'min_samples_split': 36, 'min_samples_leaf': 59, 'criterion': 'entropy'}.
Trial 6024 finished with value: 0.6956521739130435 and parameters: {'n_estimators': 503, 'max_depth': 12, 'min_samples_split': 119, 'min_samples_leaf': 75, 'criterion': 'gini'}.
Trial 6025 finished with value: 0.7065217391304348 and parameters: {'n_estimators': 249, 'max_depth': 10, 'min_samples_split': 142, 'min_samples_leaf': 63, 'criterion': 'entropy'}.
Trial 6026 finished with value: 0.7065217391304348 and parameters: {'n_estimators': 747, 'max_depth': 8, 'min_samples_split': 136, 'min_samples_leaf': 57, 'criterion': 'gini'}.
Trial 6027 finished with value: 0.7065217391304348 and parameters: {'n_estimators': 793, 'max_depth': 13, 'min_samples_split': 34, 'min_samples_leaf': 52, 'criterion': 'entropy'}.
Trial 6028 finished with value: 0.6847826086956522 and parameters: {'n_estimators': 927, 'max_depth': 17, 'min_samples_split': 29, 'min_samples_leaf': 61, 'criterion': 'gini'}.
Trial 6029 finished with value: 0.717391304347826 and parameters: {'n_estimators': 265, 'max_depth': 10, 'min_samples_split': 17, 'min_samples_leaf': 55, 'criterion': 'entropy'}.
Trial 6030 finished with value: 0.6956521739130435 and parameters: {'n_estimators': 776, 'max_depth': 14, 'min_samples_split': 46, 'min_samples_leaf': 70, 'criterion': 'gini'}.
Trial 6031 finished with value: 0.6956521739130435 and parameters: {'n_estimators': 284, 'max_depth': 11, 'min_samples_split': 21, 'min_samples_leaf': 65, 'criterion': 'entropy'}.
Trial 6032 finished with value: 0.7065217391304348 and parameters: {'n_estimators': 344, 'max_depth': 7, 'min_samples_split': 42, 'min_samples_leaf': 59, 'criterion': 'gini'}.
Trial 6033 finished with value: 0.7391304347826086 and parameters: {'n_estimators': 309, 'max_depth': 9, 'min_samples_split': 32, 'min_samples_leaf': 73, 'criterion': 'entropy'}.
Trial 6034 finished with value: 0.6956521739130435 and parameters: {'n_estimators': 236, 'max_depth': 12, 'min_samples_split': 128, 'min_samples_leaf': 58, 'criterion': 'gini'}.
Trial 6035 finished with value: 0.7065217391304348 and parameters: {'n_estimators': 279, 'max_depth': 15, 'min_samples_split': 146, 'min_samples_leaf': 62, 'criterion': 'entropy'}.
Trial 6036 finished with value: 0.6956521739130435 and parameters: {'n_estimators': 724, 'max_depth': 8, 'min_samples_split': 114, 'min_samples_leaf': 54, 'criterion': 'gini'}.
Trial 6037 finished with value: 0.6521739130434783 and parameters: {'n_estimators': 257, 'max_depth': 5, 'min_samples_split': 150, 'min_samples_leaf': 56, 'criterion': 'entropy'}.
Trial 6038 finished with value: 0.7065217391304348 and parameters: {'n_estimators': 299, 'max_depth': 10, 'min_samples_split': 25, 'min_samples_leaf': 60, 'criterion': 'gini'}.
Trial 6039 finished with value: 0.6956521739130435 and parameters: {'n_estimators': 325, 'max_depth': 13, 'min_samples_split': 38, 'min_samples_leaf': 67, 'criterion': 'entropy'}.
Trial 6040 finished with value: 0.6847826086956522 and parameters: {'n_estimators': 704, 'max_depth': 7, 'min_samples_split': 140, 'min_samples_leaf': 57, 'criterion': 'entropy'}.
Trial 6041 finished with value: 0.6956521739130435 and parameters: {'n_estimators': 272, 'max_depth': 11, 'min_samples_split': 28, 'min_samples_leaf': 63, 'criterion': 'gini'}.
Trial 6042 finished with value: 0.6739130434782609 and parameters: {'n_estimators': 754, 'max_depth': 65, 'min_samples_split': 34, 'min_samples_leaf': 59, 'criterion': 'entropy'}.
Trial 6043 finished with value: 0.6630434782608695 and parameters: {'n_estimators': 178, 'max_depth': 17, 'min_samples_split': 134, 'min_samples_leaf': 76, 'criterion': 'gini'}.
Trial 6044 finished with value: 0.6956521739130435 and parameters: {'n_estimators': 249, 'max_depth': 9, 'min_samples_split': 20, 'min_samples_leaf': 71, 'criterion': 'entropy'}.
Trial 6045 finished with value: 0.6739130434782609 and parameters: {'n_estimators': 1000, 'max_depth': 100, 'min_samples_split': 31, 'min_samples_leaf': 61, 'criterion': 'gini'}.
Trial 6046 finished with value: 0.6739130434782609 and parameters: {'n_estimators': 227, 'max_depth': 14, 'min_samples_split': 44, 'min_samples_leaf': 53, 'criterion': 'entropy'}.
Trial 6047 finished with value: 0.6956521739130435 and parameters: {'n_estimators': 286, 'max_depth': 36, 'min_samples_split': 102, 'min_samples_leaf': 68, 'criterion': 'gini'}.
Trial 6048 finished with value: 0.717391304347826 and parameters: {'n_estimators': 734, 'max_depth': 12, 'min_samples_split': 5, 'min_samples_leaf': 57, 'criterion': 'entropy'}.
Trial 6049 finished with value: 0.6956521739130435 and parameters: {'n_estimators': 775, 'max_depth': 7, 'min_samples_split': 143, 'min_samples_leaf': 64, 'criterion': 'gini'}.
Trial 6050 finished with value: 0.6739130434782609 and parameters: {'n_estimators': 358, 'max_depth': 10, 'min_samples_split': 37, 'min_samples_leaf': 79, 'criterion': 'entropy'}.
Trial 6051 finished with value: 0.7065217391304348 and parameters: {'n_estimators': 309, 'max_depth': 12, 'min_samples_split': 26, 'min_samples_leaf': 74, 'criterion': 'gini'}.
Trial 6052 finished with value: 0.7391304347826086 and parameters: {'n_estimators': 263, 'max_depth': 9, 'min_samples_split': 122, 'min_samples_leaf': 59, 'criterion': 'entropy'}.
Trial 6053 finished with value: 0.6739130434782609 and parameters: {'n_estimators': 288, 'max_depth': 15, 'min_samples_split': 12, 'min_samples_leaf': 56, 'criterion': 'gini'}.
Trial 6054 finished with value: 0.6304347826086957 and parameters: {'n_estimators': 209, 'max_depth': 7, 'min_samples_split': 35, 'min_samples_leaf': 28, 'criterion': 'entropy'}.
Trial 6055 finished with value: 0.7065217391304348 and parameters: {'n_estimators': 326, 'max_depth': 11, 'min_samples_split': 52, 'min_samples_leaf': 61, 'criterion': 'gini'}.
Trial 6056 finished with value: 0.6413043478260869 and parameters: {'n_estimators': 250, 'max_depth': 5, 'min_samples_split': 30, 'min_samples_leaf': 55, 'criterion': 'entropy'}.
Trial 6057 finished with value: 0.6956521739130435 and parameters: {'n_estimators': 619, 'max_depth': 13, 'min_samples_split': 155, 'min_samples_leaf': 58, 'criterion': 'gini'}.
Trial 6058 finished with value: 0.7065217391304348 and parameters: {'n_estimators': 269, 'max_depth': 9, 'min_samples_split': 130, 'min_samples_leaf': 65, 'criterion': 'entropy'}.
Trial 6059 finished with value: 0.6739130434782609 and parameters: {'n_estimators': 406, 'max_depth': 16, 'min_samples_split': 137, 'min_samples_leaf': 62, 'criterion': 'gini'}.
Trial 6060 finished with value: 0.717391304347826 and parameters: {'n_estimators': 290, 'max_depth': 11, 'min_samples_split': 40, 'min_samples_leaf': 52, 'criterion': 'entropy'}.
Trial 6061 finished with value: 0.7065217391304348 and parameters: {'n_estimators': 305, 'max_depth': 8, 'min_samples_split': 24, 'min_samples_leaf': 69, 'criterion': 'gini'}.
Trial 6062 finished with value: 0.6956521739130435 and parameters: {'n_estimators': 793, 'max_depth': 13, 'min_samples_split': 31, 'min_samples_leaf': 60, 'criterion': 'entropy'}.
Trial 6063 finished with value: 0.7065217391304348 and parameters: {'n_estimators': 755, 'max_depth': 10, 'min_samples_split': 145, 'min_samples_leaf': 58, 'criterion': 'gini'}.
Trial 6064 finished with value: 0.6630434782608695 and parameters: {'n_estimators': 241, 'max_depth': 20, 'min_samples_split': 62, 'min_samples_leaf': 72, 'criterion': 'entropy'}.
Trial 6065 finished with value: 0.6630434782608695 and parameters: {'n_estimators': 267, 'max_depth': 6, 'min_samples_split': 20, 'min_samples_leaf': 54, 'criterion': 'gini'}.
Trial 6066 finished with value: 0.7065217391304348 and parameters: {'n_estimators': 277, 'max_depth': 8, 'min_samples_split': 149, 'min_samples_leaf': 63, 'criterion': 'entropy'}.
Trial 6067 finished with value: 0.6739130434782609 and parameters: {'n_estimators': 228, 'max_depth': 15, 'min_samples_split': 36, 'min_samples_leaf': 56, 'criterion': 'gini'}.
Trial 6068 finished with value: 0.6847826086956522 and parameters: {'n_estimators': 318, 'max_depth': 11, 'min_samples_split': 117, 'min_samples_leaf': 77, 'criterion': 'entropy'}.
Trial 6069 finished with value: 0.6956521739130435 and parameters: {'n_estimators': 739, 'max_depth': 9, 'min_samples_split': 28, 'min_samples_leaf': 60, 'criterion': 'entropy'}.
Trial 6070 finished with value: 0.6956521739130435 and parameters: {'n_estimators': 768, 'max_depth': 13, 'min_samples_split': 125, 'min_samples_leaf': 58, 'criterion': 'gini'}.
Trial 6071 finished with value: 0.6956521739130435 and parameters: {'n_estimators': 253, 'max_depth': 18, 'min_samples_split': 141, 'min_samples_leaf': 66, 'criterion': 'entropy'}.
Trial 6072 finished with value: 0.6847826086956522 and parameters: {'n_estimators': 100, 'max_depth': 7, 'min_samples_split': 41, 'min_samples_leaf': 74, 'criterion': 'gini'}.
Trial 6073 finished with value: 0.7065217391304348 and parameters: {'n_estimators': 298, 'max_depth': 11, 'min_samples_split': 33, 'min_samples_leaf': 55, 'criterion': 'entropy'}.
Trial 6074 finished with value: 0.7065217391304348 and parameters: {'n_estimators': 334, 'max_depth': 14, 'min_samples_split': 94, 'min_samples_leaf': 61, 'criterion': 'gini'}.
Trial 6075 finished with value: 0.6739130434782609 and parameters: {'n_estimators': 381, 'max_depth': 9, 'min_samples_split': 133, 'min_samples_leaf': 57, 'criterion': 'entropy'}.
Trial 6076 finished with value: 0.6956521739130435 and parameters: {'n_estimators': 272, 'max_depth': 12, 'min_samples_split': 23, 'min_samples_leaf': 59, 'criterion': 'gini'}.
Trial 6077 finished with value: 0.6739130434782609 and parameters: {'n_estimators': 285, 'max_depth': 6, 'min_samples_split': 47, 'min_samples_leaf': 70, 'criterion': 'entropy'}.
